tid,species,version,language,flavor_text
208007,id-407,34,7,"Las toxinas de la mano derecha son de efecgoinmed:ato, y las de la izquierda, retardado. Noobstante, ambas pueden ser letales."
222488,rec-150-dup-1,,8,Il suo DNA è quasi u9uale a quello di Mew.Ciò nonostante sono agli antipodi perdimensioni e carattere.
217332,rec-846-dup-0,34,6,Seine Bewegungsfreiheit ist stark eingeschränktwenn es vollgefressen ist. So wircl es zu leichterBeute für Urgl das es im Ganzen verschlimgt.
208876,id-473,33,6,"Sie sind schon auf 10 000 Jahre altenWandmalereien abgebildet. Es gab Ze9ten,in denen man sie für ausgestorben hielt."
208877,id-473,,7,Aparece representado en pinturas rupestres dehace 10 000 años. Hubo un tiempo en el que selo consideró extinto.
205603,id-174,34,3,
204364,id-91,,4,一旦牠把殼閉上，無論是擁有什麼樣怪力的人都無法將其打開。
220289,rec-52-dup-1,34,12,为了不弄脏额头上的金币会常常洗脸伽勒尔o的喵喵关系不好
218982,rec-691-dup-1,34,11,頭の　笠を　海面から　出し太陽の　光を　浴びることでドラゴンエネルギーを　作るのだ
220965,rec-520-dup-1,34,11,賢く　物覚えが　いい配達員が　パートナーに選ぶことが　多いらしい
218765,rec-773-dup-0,33,12,
210117,id-572,33,7,Usa la cola para barrer la basurilla. Su extremapulcritud es tanto una avuda en la lirnpieza delhogar como un incordio.
208963,id-478,,3,마이너스 50도의 냉기를 뿜어먹이를 얼린 뒤 거처로가져가서 가지런히 나열한다.
212652,id-746,,1,１ぴきでは　とても　ひよわなためむれることで　てきに　たちむかうのうりょくを　かくとくした。
212489,id-729,34,9,"On nights when the sea is calm, Broonne danc3with one another to the singing of the Primarinathat’s leading them."
205983,id-212,,3,몸은 가늘지만 공격력은무시무시하다. 몸의 근육도금속으로 되어 있다.
208614,id-458,,4,也許是因為海水溫度偏低，伽勒爾地區的小球飛魚動作似乎有點遲緩。
208417,id-445,,7,Habita en montañas de 9rigen volcánico. Vuelatan rápido como un avión a reacción en busca depresas.
213927,id-828,34,7,Un Pokémon ágil y de afiladas garras que sealimenta de huevos y comicla robados. LosBoltund son su enemig0 natural.
214645,id-864,34,5,
209794,id-556,,4,會發出沙鈴般的聲音。鳥寶可夢會因那輕快的節奏而受驚飛走。
224426,id-455,23,6,"Sein süßlich riechender Speichel 2ieht Beute an,die es frisst. Es braucht eiben Tag, sie zu fressen."
223337,id-181,,7,La punta de su cola reluce brillantemente y puede servista desde lejo5. Es usado como faro.
205963,id-211,34,3,전신의 작은 바늘은비늘이 변화한 것이다.찔리면 독 때문에 정신을 잃게 된다.
208964,id-478,,4,會吐出零下５０度的冷氣凍住獵物，並把牠們帶回自己的巢穴，整齊地擺成一排。
212970,id-761,34,11,襲われた　ときに　流す　汗は甘くて　美味しい。　その　香りがさらに　敵を　増やしてしまうのだ。
204700,id-112,33,11,進化して　後ろ足だけで立つようになった。　ツノで　突くと岩石にも　穴を　開けてしまう。
205403,id-147,,3,오랫동안 환상이라고 불렸다.이마에 있는 작은 돌기는성장하고 있는 뿔이다.
207873,id-379,33,3,
221942,rec-101-dup-0,23,7,Explotan a la mínima. Por eso se les tiene muchomiedo. Est0s Pokémon feciben el mote de Bomba Ball.
220148,rec-866-dup-1,33,12,踢踏舞的达人会挥动手中的冰杖向观众演轻快的舞步
222567,rec-252-dup-0,,6,Es klettert blitzschnell Wände empor. Mit seinemSchwanz misst es die Luftfejchtigkeit um dasWetter am nächsten Tag vorherzusagen.
220146,rec-866-dup-1,33,1,
213807,id-822,34,7,"Tras haber librado combates muy duros, hadesarrollado la hsbilidad de determinar conprecisión la fuerza de su adversario."
215527,rec-544-dup-0,34,5,Il se protège avec sa solide carapace et ses épinesempoisonnées tandis quil rassemble lénergienécessaire à son évolution.
219962,rec-310-dup-0,34,5,Ce Pokémon évite de se m0ntrer aux humains.On raconte 4uil fait son nid aux endroitsoù la foudre sest abattue.
218818,rec-534-dup-0,33,3,같은 성분이라도 노보청이배합한 콘크리트가훨씬 견고하고 튼튼하다.
217210,rec-79-dup-0,34,6,Tajcht es seine Rute ins Wasser strömt sie einsüßes Arorna aus. Mit diesem Köder lockt esandere Pokémon an die es dann an Land zieht.
214529,id-858,34,9,"If you’re too loud around it, y0u risk being tornapart by the daws on its tentacle. This Pokémonis also known as the Forest Witch."
203365,id-11,34,5,"Bien que son corps soit entouré d’une carapacesolide, l’intérieur est si mou qu’il je résisteraitpas à un3 attaque violente."
210049,id-568,34,9,This Pokémon was born from a bag stufded withtrash. Galarian Weezing reoish the fumes belchedby Trubbish.
219423,rec-616-dup-0,34,3,전기 에너지에 반응하는 신비한체질을 지녔다. 딱정곤과 함께있으면 무슨 이유인지 진화한다.
222930,id-23,23,8,Con il tempo 5i fa sempre più lungo. La notte qvvolgeil suo corpo attorno a qualche ramo per dormire.
204893,id-122,,3,커다란 손바닥은 팬터마임을하기 위해 발달했다고생각하는 학자도 많다.
218712,rec-445-dup-0,33,9,
216719,rec-815-dup-0,33,5,Il drible avec des oierres pour en fairedes ballons enflammés avant de tirersur ses adversaires pour les brûler.
218604,rec-72-dup-0,34,8,Il suo corpo composto quasi interamentedacqua rende molto djfficile individuarlo9uando è in mare.
222112,rec-641-dup-1,,1,トルネロスの　しっぽから　ふきだしたエネルギーが　おおあらしを　おこすみんかを　ふきとばす　パワー
210098,id-571,33,8,Tiene m0lto ai suoi simili e protegge la tanae il branco crdando miraggi spaventosi.
214666,id-865,34,6,"Der Lauch dient ihm a1s Waffe und zur Abwehr,aber viele essen ihn auch. Mit den harten Blätternpariert es und kit der scharfen Stange kontert es."
218028,rec-95-dup-0,,11,大きく　丈夫な　体をくねらせ　よじらせ　時速８０キロで地面を　勢いよく　掘り進む
216931,rec-361-dup-1,34,5,Il ne peut v'lvre que dans les plus friides contrées.Il saccommode parfaitement de températuresatteignant les - 100 °C.
215891,rec-746-dup-0,33,11,
218748,rec-458-dup-0,34,1,
222283,rec-456-dup-0,12,9,After long exposure to 5unlightthe patterns om its tail fins shinevividly when darkness arrives.
223265,id-162,17,5,La femelle s’enroule autour despetits pour les bercer. Il acculel’ehnemi grâce à sa vitesse.
218870,rec-568-dup-0,33,8,Predilige luoghi insalubri. Sbuca fuori nelle casedove è stata lasciata spazzatura in giro e vi sistabilisce.
216176,rec-240-dup-1,,8,Vive nei pressi dei vulcani. Dopo una faticosagiornata si gode un rilassante bagno nel magma.
208625,id-458,34,5,"Il nage au sein des bancs de Rémoraid.Lorsqu’un prédateur les attaaue, il se batà leurs côtés."
205859,id-197,33,9,"When this Pokémon becomes angry, its poressedrete a poisonous svveat, which it sprays atits opponent’s eyes."
208532,id-451,,1,すなに　からだを　うずめ　じっとえものを　まちつづけている。ヤクデと　そせんが　ちかい。
205993,id-213,,3,껍질 속에 열매가 비축되어 있다.공격받지 않도록 바위 밑에틀어박혀 꼼짝하지 않는다.
213327,id-782,34,7,"Se comunica con sus congéneres mediante lossonid0s que produce al golpdar sus escamas,duras como el acero."
214256,id-845,33,6,
209259,id-526,,9,"This hardy Pokémon can often be found onconstruction sites and in mines, workingalongside people and Copperajah."
209250,id-525,,11,音で　まわりの　様子を　探る。怒らせると　体の　向きを変えないまま　追ってくる。
208920,id-475,,11,武人と　呼ばれる　ポケモン。なにかを　守るためで　なければ肘の　刀は　使わない。
217872,rec-771-dup-0,33,8,Vive vicino alle spiagge in acque calde e pocoprofoncle. Quando si imbatte im un nemico loattacca espellendo gli organi interni dalla bocca.
206983,id-309,,3,정전기를 털에 모은다.공기가 건조한 계절에는전신에서 스파크를 뿌린다.
203992,id-61,33,1,
221777,rec-249-dup-0,23,6,Es schläft in einem Tiefseegraben. Schwingt es5eins Flügel entsteht ein Sturm der 40 Tage dauert.
214516,id-858,33,6,"Die starken Psycho-Kräfte, die es ausstrahlt,ruf4n Kopfschmerzen hrrvor. So hält es andereLebewesen von sich fern."
223609,id-250,23,11,
208179,id-427,,9,"If both of Buneary’s ears are rolled up, somethingis wrong with it5 body or mind. It’s a sure sign thePokémon is in need of care."
214196,id-842,33,6,Nach dem Verzehr eines süßen Apfels hat es sichentwickelt. E5 verströmt einen süßen Duft undlockt damit sein Futter an: Käfer-Pokémon.
224128,id-384,7,9,"RAYQUAZA lived for hundreds of millionsof years in the earth’s ozone layer, never cescending to the ground.This POKéMON appears to feed on waterand particles in the atmosphere."
208669,id-460,,9,This Pokémon is known to bring blizzards.A shake of its ma5sive body is enough tocause whiteout conditions.
213917,id-828,33,7,"Marca a su presa sin ser advertido. Sigue el olory, cuanclo el otro Pokémon baja la guardla,aprovecha para robarle."
224433,id-456,,3,몸의 옆쪽에 있는 줄에태양의 빛을 모아둘 수 있다.밤이 되면 아름답게 빛난다.
216569,rec-81-dup-0,33,8,
205985,id-212,34,5,
217341,rec-846-dup-0,33,5,Sa mâchoire fine et ai9uisée fait sa fierté.À peine voit-il ie moindre mouvementquil fonce dans sa direction.
203696,id-40,33,6,"Je mehr Luft es einatmet, desto größer wjrd es.Ist es verärgert, bläst es seinen Körper rnorm aufund schüchtert so seine Gegner ein."
211257,id-637,33,7,Se dice que sus escamas flamígeras pueden tantocausar incendios como amparar a a1uelios quesufren las inclemencias del frío.
216402,rec-442-dup-1,,12,由１０８个灵魂聚在一起变成了宝可梦似乎有性格恶劣的灵魂混在里面
219023,rec-590-dup-0,34,7,Las esporas que expulsa por 1as extremidadessob altamente tóxicas pero si se secan biensirven como remedio estomacal.
209399,id-533,33,9,"It shows off its muscles to Mach0ke and otherGurdurr. If it fails to mea5ure up to the otherPokémon, it lies low for a little while."
220518,rec-134-dup-0,34,6,Seine Zellstriktur ähnelt der molekulsrenZusammensetzung von Wasser weshalb es sichin Gewässern unsichtbar machen kann.
218255,rec-584-dup-0,,1,いかりが　ちょうてんに　たっするとふぶきを　ふきだして　てきもみかたも　こおりづけに　する
213925,id-828,,5,"Grâce à son corps lestw et ses griffes acérées,il va et vient en dérobant Œufs et nourriture.Son ennemi juré est Fulgudog."
217732,rec-507-dup-0,33,9,Herdier is a very smart and friendly Pokémon.So much so tbat theres s theory that Herdier wasthe first Pokémon to partner with people.
211715,id-685,33,5,Il peut diagnostiquer l’état de santé mentale etpbysiquw de quelqu’un rien qu’à l’odorat. Un teldon pourrait avoir des applications en médecine.
212697,id-748,33,7,"Para resistir las bajas temperaturas de law aguasde Galar, forma una cúpula con las patas vcalienta el interior con el calor de su cuerpo."
217273,rec-547-dup-0,,3,솜을 흩뿌리며 장난을 친다.물을 끼얹으면 무거워져서움직일 수 없게 되어 포기한다.
223941,id-325,17,5,
204935,id-124,,5,"Dans une certaine z0ne de Galar, Lippoutouétait craint et vénéré par la population qui l’avaitsurnommé la « reine des glaces »."
213434,id-792,33,4,被稱為邀引月亮之獸。透過將一切的光轉化為能量來維持生命。
205495,id-169,33,5,Ses pattes sont devenues des ailes.Il fond sur sa pfoir furtivement puisplante ses crocs dans sa nuque.
221535,rec-345-dup-0,34,9,Lileep clings to rocks on the seabed. When preycomes close this Pokémln entangles it witbpetallike tentacles.
207801,id-375,,12,２只铁哑铃因磁力结合起来了。因为有了２个大脑，精神力量也强化到了２倍。
222801,rec-88-dup-1,,5,Vivant dans des tas dordvres il se nourrit desdéchets polluants rejetés par les usines.
208352,id-442,,1,１０８この　たましいが　あつまりポケモンになったが　しょうわるのたましいが　まじってしまったらしい。
222942,id-24,29,4,
212978,id-762,33,8,Gira su se stesso come in una danza spargendonell’aria un dooce profumo. Chi lo annusa provaun sentimento di felicità.
218824,rec-534-dup-0,33,7,El hormigón que preparan los Conkeld7rr esmucho más duro y resistente que el ordinaeioaunque la composición sea la misma.
214108,id-837,34,8,
206021,id-214,33,12,用２只触角来感知气味，以此在整片森林中寻找自己超爱的甘甜树汁。
221182,rec-662-dup-0,33,7,
212964,id-761,,4,受到襲擊時流下的汗水非常甜美可口。那種香氣會吸引更多敵人的注意。
224681,id-511,,7,Comparte las hojas de su cabeza con Pokémonagotados. Posee la facultad de aliviar el cansanfio.
217749,rec-507-dup-0,34,9,The black fu4 that covers thjs Pokémons bodyis dense and springy. Even sharp fangs bounceright off.
207005,id-310,,5,Ce Pokémon évite de se m0ntrer aux humains.On raconte qu’il fait son nid aux endroitsoù la foudre s’est abattue.
222624,rec-152-dup-0,25,6,Im Kampf wedelt Endivie mit seinem Blatt um den Feindfernzuhalten. Von dem Blatt geht auch ein süß|icher Duft ausder die kämpfenden Pokémon beruhigt und eine gemütlichefreundliche Atmosphäre schafft.
221076,rec-372-dup-0,,4,忍耐飢餓不吃任何食物據說當牠用盡了儲的能量後就會開始進化
221239,rec-468-dup-0,33,6,Es zeigt sich nie an Orten wo Streit undZwietracbt herrschen. In letzter Zeit wird e5kaum noch gesehen.
204979,id-126,,9,Magmar dispatches its prey with fire. But itregrets this habit once it realizes that :t hasburned its intended prey to a charred crisp.
224277,id-408,23,7,Fue recreado a partir de un fósil con formz eaférica.Derriba a las presas a cabezazos.
222227,rec-481-dup-0,24,6,Es schläft auf dem Grund eines Sees. Man sagt seinGeist verlasse deri Körper und flieg4 über den See.
211334,id-643,33,4,
211048,id-626,34,8,"Vive in mandrie di circa 20 e5emplari.Per quslche motivo, i Bouffalant che tradisconoil gruppo perdono la chioma."
205006,id-127,34,6,"Pinsir nimmt Beute mit seinen Hörnern in dieZange, um sie anscbließend entzwe'lzureißenoder mit Wucht fortzuschleudern."
222110,rec-641-dup-1,,3,토네로스의 꼬리에서 뿜어져 나온에너지가 큰 폭풍을 일으킨다.민가를 날려버릴 정도의 힘이다.
224683,id-511,,11,元気の　ない　ポケモンに頭の　葉っぱを　分け与える。疲れを　取る　効果が　あるのだ。
215748,rec-539-dup-1,34,8,Grazie al suo intenso allenamento può infliggeremicidialj colpi di ka5ate capaci di dividere in duele acque delloceano.
222161,rec-88-dup-0,,1,ヘドロが　かたまって　うまれたくさくて　さわることが　できないしとおったあとには　くさも　はえない
203856,id-52,33,6,"Es sammelt mit Vorliebe glänzende Gegenstände.Ist es gut gelaunt, lässt es seinem Trainer einenBlick auf seine Sammlunv werfen."
203995,id-61,33,5,Il suffit de fixer la spirale sur son ventre pours’assoupir. On se sert parfois cle lui à la placed’une berceuse p0ur endormir les enfants.
218155,rec-626-dup-0,,4,會組成約２０隻的群體一起生活不知為何背叛了群體的爆炸8頭水牛頭上的毛會脫落
212344,id-722,,4,白天利用光合作用積蓄力量，到了晚上則會悄無聲息地在空中飛翔，尋找獵物。
210724,id-610,34,4,
215351,rec-82-dup-0,,6,Es entsteht durch den Zusammenschlyss dreierMagnetilo und sendet starke Radiowellen ausum seine Umgebung zu untersuchen.
211111,id-629,,12,由于很快就会长大，屁股上的骸骨会接着传给巢里更小的秃鹰丫头用。
215231,id-893,,12,长在身上的藤蔓断掉之后会变成土壤的养分，帮助森林中的植物成长。
203737,id-42,33,7,Le encanta chuparles la sangre a kos seres vivos.En ocasi0nes comparte la preciada colecta conotros congéneres hambrientos.
208014,id-415,,4,３隻一直都在一起，但每一隻對花蜜的喜好卻略有不同。
210481,id-595,33,12,
209968,id-564,,8,Si ritiene sia l’antenato di molti Pokémon condarapace. È stato rigenerato da un fossile.
224799,id-594,,3,넓은 바다를 떠돌아다니며 산다.상처 입은 포켓몬을 발견하면안고서 물가까지 옮긴다.
218761,rec-773-dup-0,33,4,與夥伴間深厚的牽絆讓蘊藏在自己體內的力量覺醒可以隨意改變屬性
224521,id-485,,7,Habita cuevas volcánicas. Cava con sus pies en formade cruz para trepar p0r techos y paredes.
221904,rec-721-dup-0,23,5,Il est capable de générer un nuage cle vapeur pourse cachrr. Il vit dans des montagnes inhabitées.
215808,rec-886-dup-0,34,8,Se non ha un Dreepy sulla testa di cui prendersicura non rjesce a stare tranqu:llo e cercadi sostituirlo con altri Pokémon.
214944,id-879,,4,群居的寶可夢。鼻子的握力十分強勁，甚至能把大石頭弄得粉碎。
206210,id-227,,11,抜け落ちた　羽根から　剣が作られることから　紋章の図案として　人気が　高い。
207058,id-319,33,8,"Se fiuta l’odore di uba preda, la assale allavelocità di 120 km/h, che raggiunge espellendoacqua marina dalla parte posteriore del corpo."
207742,id-372,,1,エサを　たべず　くうふくに　たえる。ためた　エネルギーを　つかいきるとしんかが　はじまるらしい。
208187,id-427,34,7,"Ataca estirando con uri fuerte impulao lasorejas enrolladas. Cuanto más entrena estatécnica, con más potencia la ejecuta."
204063,id-64,,3,염동력의 위력은 절대적이다.진화에 대비하여 이마에 있는 별에사이코 파워를 비축하고 있다.
217544,rec-364-dup-0,,1,りゅうひょうの　うえで　せいかつおよぎながら　えものの　においをかぎわけて　みつけだし　つかまえる
205111,id-132,34,12,
219413,rec-616-dup-0,33,5,
210510,id-596,34,11,
224897,id-653,23,6,"Wenn es Zweige frisst, fasst es neue Kraft uncl stößtüber seine Ohren über 200 °C heiße Luft a7s."
219644,rec-126-dup-0,33,4,
208291,id-437,,12,它身上的纹路让许多学者都认为它原本并不存在于伽勒尔。
215146,id-889,34,6,"Dieses Pokémon fiel in Form einer Steinstatuein solch eineri lamgen Schlaf, dass es inVergessenheit geraten ist."
210374,id-589,33,4,
224294,id-410,,1,たいぼくの　みきに　こすりつけてかたい　かおを　みがく　しゅうせい。うしろからの　こうげきに　よわい。
207996,id-407,33,6,"Mit dem süßlichen Duft seiner Blüten betört esseine Gegner, bevor es sie mit dornigen Rankemheftig auspeitscht."
225310,id-799,27,11,
218813,rec-534-dup-0,,6,Beton der von Meistagrif angerührt wurdeist härter und robuster als jeder andere Betohselbst wenn die Inhaltsstoffe identisch sind.
222968,id-48,23,6,Seine großen Augen bestehen aus vielen kleineriAugen. Nacbts wird es von Licht angezogen.
225263,id-795,27,3,위험한 UB 중 q마리이다. 굉장한속도로 대지를 질주하는모습이 목격되었다.
208001,id-407,33,12,
206711,id-281,34,12,
203606,id-35,34,6,Aufgrund seines reizemden Wesens und se'lnesRufes erfreut sich dieses Pokémon großerBeliebtheit. Leider ist es auch sehr selten.
214554,id-860,33,4,
208836,id-470,33,6,"Die Bevvohner Galars mögen den eifentümlichenGeruch, den seine Blätter verströmen. Als Parfümist er sehr beliebt."
222990,id-56,23,8,"Se è tanto arrabbiato da non riusc'lre più a distinguwregli amici dai nemici, è pericoloso avvicinarsi."
219524,rec-836-dup-1,,8,Trasferisce alle zampe lelettricità che produceper aumentarne la resistenza. Può correre pertre giorni interi seriza mai fermarsi.
215062,id-885,34,1,
208919,id-475,,9,"True to its honorable-warrior image, it usesthe blades on its elbows ohly in defense ofsomething or someone."
217145,rec-626-dup-1,33,9,These Pokémon can crush a car with no moretban a headbutt. Biuffalant with more hair ontheir heads hold higher positions within the herd.
224247,id-399,,11,なにごとにも　動じない図太い　神経の　持ち主。見かけの　割には　機敏に　活動する。
210952,id-622,,1,ねんどから　うみだされた　こだいのポケモン。　なぜか　おおいわをならべつづける　ものも　いる。
209862,id-559,34,1,じょうぶな　かわで　みを　まもる。かわが　のびきるとき　しんかをむかえると　いわれる。
204102,id-66,,1,いつも　パワフル。　たいりょくがありあまっているので　ひまつぶしにいわをもちあげ　さらに　つよくなる。
216968,rec-556-dup-1,33,9,With noises that could be mistaken for the rattlesof maracas it creates an upbeat rhythm startlingnird Pokémon ancl making them fly off in a hurry.
213299,id-781,,9,"After a piece of seaweed merged with debrisfrom a sunken dhip, it was reborn as thisghost Pokémon."
212830,id-754,,11,両腕の　花びらは　薄く切れ味は　鋭い。　光を　集めてビームも　放てるぞ。
220486,rec-550-dup-0,34,6,Früher standen si3 oft auf dem Speiseplan. DasFleisch rotliniger Exemplare war wegen seineshohen Fettanteils bei jungen Leuten sehr beliebt.
210919,id-620,,9,"When Mienshao comes across a truly challengingopponent, 'lt will lighten itself by biting off thefur on its arms."
221778,rec-249-dup-0,,5,Il est supposé être le gardien des sept mers.On rac0nte quil est apparu une nuit de forte tempête.
220292,rec-835-dup-0,34,7,Son muy glotones por lo qu3 ayudan a la gentea cambio de comida. Echan chispas al correr.
223591,id-245,23,7,Recorre el mundo para purificar agua contaminada.Corre veloz con el viento del norte.
223595,id-249,17,5,Il dort dans une faille des granesfonds. Ses battements d’ailesgénèrent une tempête de 40 jours.
218433,rec-723-dup-0,,6,Es bombardiert seine Feinde mit messerwcharfenFedern die man „Flügelklingen nennt und trifftmit jedem Wurf zielsicher ihre Schwachstellen.
217627,rec-714-dup-1,33,6,Bei Sonnenuntergang verlässt es seinw Höhle und9eht mithilfe von Ultraschallwellen auf die Suchenach reifem Obst.
221993,rec-300-dup-0,26,8,
219961,rec-310-dup-0,34,3,좀처럼 사람 앞에 모습을드러내지 않는다. 번개가 떨어진곳에 보금자리가 있다고 한다.
218408,rec-826-dup-0,,1,かしこい　ポケモンとして　ゆうめいおおきな　のうみそは　きょうりょくなサイコパワーを　もつ　あかし
219008,rec-292-dup-0,,3,날개를 움직이지 않고 날아다닌다.몸속이 텅 비어 있고숨을 쉬지 않는 이상한 포켓몬이다.
214869,id-875,34,9,"This Pokémon keeps its heat-sensitive head coolwith ice. It fish4s for its food, dangling its singlehair into the sea to lure in prey."
214866,id-875,,6,"Es kühlt sein Gesicht ständig mit Eis, da diesesHitze nicht gut verträgt. Das Haar auf dem Kopfhängt es ins Meer und angelt sich damit Beute."
214867,id-875,34,7,Se enfría c0nstantemente la cara con hielo porsu escasa resistencia al calor. Utiliza el pelo dela cabeza para pescar en el mar.
214860,id-875,,11,とても　寒い　場所から　流れ流されて　やってきた。　氷で顔を　つねに　冷やして　いるのだ。
220127,rec-142-dup-1,,3,톱 같은 이빨은강철포켓몬의 피부도갈기갈기 베어 가른다.
217735,rec-507-dup-0,33,5,Ce Pokémon est très intelligent et affrctueux.Une théorie avance quil aurait été le premierà fevenir le partenaire dun être humain.
210797,id-614,,7,Congela su aliento y crea colmillos de hielo másduros que el acero. Nada eri mares de aguas fríasen busca de alimento.
212626,id-744,34,6,"Mit seinem steinernen Fellkragen schlägt Wuffelsauf den Boden, um Gegner einzuschüch5ern.Schrecken diese zurück, greift e5 sie sofort an."
204421,id-94,33,12,
203567,id-33,34,7,
211054,id-627,,4,每當遇到看似強勁的寶可夢，都會忍不住去挑起戰鬥。如果輸了就會放聲大哭。
210096,id-571,33,6,
219476,rec-677-dup-0,33,7,Su inexpreslvidad aparente esconde una luchatitánica ppr contener su inmenso poder psíquico.
210339,id-587,33,9,
225200,id-779,27,11,
216910,rec-318-dup-0,34,4,擁有銳利的牙齒和實的下巴船員們絕對不去靠近利牙魚棲息的地方
211643,id-681,,3,강력한 영력으로 사람과포켓몬을 조종해 킬가르도의입맛에 맞는 나라를 만들게 했다.
213153,id-771,,3,따뜻하고 얕은 여울에 산다.상대와 마주치면 체내 기관을입으로 뿜어서 때려눕힌다.
213137,id-770,33,7,Lo apodsn la Pesadilla de las Playas. Hunde asus presas en la arena para luego qbsorberles laenergía vital.
208337,id-440,,7,"Lleva en la bolsa de su panza una roca con formade huevo que cuida con esmero, ikitando aChansey."
222155,rec-88-dup-0,,11,月からの　エックス線を　浴びたヘドロが　ベトベターに　変化した汚いものが　大好物
211035,id-626,33,5,"Il peut détruire une voiture d’un coup de tête.Plus sa crimière est volumineuse, plus son rangau sein du troupeau est élevé."
213949,id-829,34,9,It whirls around in the wind vvhile singing a joyoussong. This delightful display has charmed manyinto raising tgis Pokémon.
218945,rec-246-dup-0,33,4,誕生於地底深處把周的泥土都吃光後就會出現在地變成蛹
208091,id-421,,12,盖起来的花瓣很硬。即使被鸟宝可梦啄到，也完全没问题。
