tid,species,version,language,flavor_text
204597,id-107,33,7,Sus puñetazos cortan el aire. Spn tan vrloces queel mínimo roce podría causar una quemadura.
216275,rec-136-dup-0,,5,Après avoir emmagasiné suffisqmment de chaleursa température corporelle peut monterjusquà 900 °C.
212578,id-742,33,8,Adora il nettare e il p0lline. Svolazzq vicinoa Gossifleur attirato dal suo polline.
208650,id-459,,11,お腹に　実る　アイス　みたいな木の実は　ガラルに　暮らすダルマッカたちの　大好物。
210302,id-583,,1,マイナス１００どの　れいきでてきを　こおらせるが　いのちまではうばわない　やさしい　きしつ。
220921,rec-141-dup-0,34,8,
216550,rec-738-dup-1,,3,복부에서 만든 전기를커다란 턱에 집중시켜서고출력의 빔을 쏜다.
208280,id-437,,11,雨雲を呼ぶ　神と　いわれる。怒らせると　鐘の音の　ような不気味な　声で　威嚇する。
214964,id-880,,4,會用尾部結實的肌肉發電。與下半身相比，上半身真的太小了。
212649,id-745,34,9,"With swivt movements, this Pokémon graduallybacks its prey imto a corner. Lycanroc’s fangs arealways aimed toward opponents’ weak spots."
217970,rec-372-dup-1,34,5,Il se prive de nourriture résistant à la faim.On dit que son évolution commence oorsqueses réserves dénergie sont épuisées.
219472,rec-677-dup-0,,1,いつも　むひょうじょうだが　じつはきょうりょくな　サイコパワーがもれださないように　ひっしなのだ
220314,rec-551-dup-1,,12,沙漠到了夜里会比较冷因此它会潜伏到沙深处睡到太阳出来为止
207914,id-403,,4,能利用肌肉的伸縮來產生電流。當牠全身都在抖動時，就代表牠正在激烈地發電。
209661,id-549,,12,据说即使对一流的园艺家来说，让它头上的花朵绽放也是一件极其困难的事。
218499,rec-194-dup-0,34,6,
222336,rec-496-dup-0,23,5,Il court comme sil glissait sur le sol. Il déroutelennemi par ses mouvememts et lassomme duncoup de liane.
210857,id-617,33,7,Lucha escupiendo veneno y mouiéndose a jnavelocidad de vértigo. Ha protagonizado películasy cómics de gran éxito.
203976,id-60,33,6,"Quapsel kann besser schvvimmen als laufen. DasSpiralmuster auf seinem Bauch ist e'ln Teil seinerInnereien, der durch die Haut sichtbar ist."
203538,id-32,33,8,"Il corno sulla fronte è estremamente velenoso.Di indole circospetta, rizza dostantemente lesue grandi orecchie."
215911,rec-241-dup-1,33,8,Il suo latte altamente nutriente contribuisceal sostentaiiiento di persone e Pokémonda tempo immemors.
206018,id-214,,8,"È ghiotto della dolce linfa degli alberi.Perlustra la foresta slla sua ricerca, sfruttandole antenne per percepire gli odori."
223122,id-89,27,4,
212624,id-744,34,4,
204705,id-112,,5,Son épiderme est si épais qu’il lui permet mêmede survivre dans du rnagma d’une températurede 2 000 °C.
209080,id-509,33,11,困った　姿を　見るためにひとの　ものを　盗みだす。クスネとは　ライバルなのだ。
218594,rec-72-dup-0,34,4,絕大部g分都是由水組成的身體在海中會與海水同化令其生物很難看見牠
204940,id-124,,11,ガラルの　とある　地域では氷の　女王と　呼んでルージュラを　恐れ崇めていた。
211460,id-661,,11,美しい　さえずりは　威嚇。縄張りに　入った　ものは容赦なく　突きまくる。
216281,rec-136-dup-0,,1,すいこんだ　くうきの　いちぶはたいないの　ほのおぶくろに　おくられ１７００どの　ほのおに　なる
215162,id-890,34,1,
206351,id-240,34,12,
216942,rec-364-dup-1,,3,대굴레오나 몬스터볼 등둥근 것이라면 뭐든지 코 위에올려놓고 돌리는 습성이 있다.
206001,id-213,,12,甲壳里储存着树果。为了避免受到袭击，它会一动不动地躲在岩石下面。
223276,id-165,,6,"Wird es kalt, versammeln sich vieie Ledyba vonnah und fern, um sich gegenseitig Wärme zu schenken."
222281,rec-456-dup-0,27,6,
217082,rec-556-dup-0,,11,マラカスの　ような　音を　だす陽気な　リズムに　鳥ポケモンは驚き　慌て　飛び去っていく
221988,rec-97-dup-0,,11,非常に　危険な　ポケモンだが安眠を　求める　人々には救世主と　呼ばれている
215984,rec-571-dup-0,34,6,Trainer denen es an Gesellschaft fehlt weisenZ0roark manchmal dazu an ihnen eine Illusipn zuzeigen um sich von ihrer Einsamkeit abzulenken.
216078,rec-813-dup-0,33,4,不斷奔跑使體溫升高後火之能量會在牠體內循環0促使牠發揮出真正的力量
225228,id-787,27,8,Sradica gli alberi e li fa roteare maneggiamdoliabilmente. Fa crescere 1a vegetazione per poiassorbirne l’energia.
214864,id-875,,4,無論何時都用冰塊冰鎮著自己怕熱的臉。會把頭頂上的毛垂到海裡釣食物吃。
203176,id-2,33,6,"Sobald die Knospe auf seinem Rücken groß wird,kann Bisakn0sp nicht mehr auf zwei Beirienstehen."
222710,rec-19-dup-0,26,3,경계심이 매우 강해서 자고 있을 때도귀를 움직여 주변의 소리를 듣고 있다.어디에든 자리를 잡고 둥지를 만든다.
208688,id-461,34,8,Comunica con i suoi simili tramite i segni chetraccia con ie unghie. Si dice che esistano piùdi s00 segni diversi.
207951,id-404,34,12,
219863,rec-10-dup-0,34,1,
208984,id-479,34,4,
218393,rec-826-dup-0,34,5,Il déploie 5es pouvoirs psychiques pour sonderles alentours sut un rayon pouvant atteindre10 km.
205090,id-131,34,11,
210504,id-596,34,4,
223334,id-181,,1,しっぽのさきが　ひかりかがやく。ひかりは　はるか　とおくまで　とどきまよったものの　みちしるべとなる。
212115,id-705,,5,"Étant donné sa faiblesse, c’est uniquementgrâce à son fluide pouvant tout dis5oudrequ’il a échappé à une extinction quasi certaine."
221685,rec-368-dup-1,,12,吸食猎物的体液剩下的肉z会沉入海底成为其他宝可梦的食物
205643,id-176,34,3,
214378,id-851,,8,"Quando genera calore, la temperatura del suocorpo rsggiunge gli 800 ºC. Si lancia all’attaccousando il corpo come una frusta."
220442,rec-616-dup-1,33,6,Wird es angegriffen schließt es so fest es kanndas Visier seiner Muschel. Gegen Laujaps erweistsich dieser Schutz allerdings als nutzlos.
222179,rec-84-dup-0,2,9,A bird that makesup for its poorfiying with itsfast foot speed.Leaves giantfootprints.
222173,rec-161-dup-0,,3,잠잘 때는 교대로 망을 본다.위험을 탐지하면 동료를 깨운다.무리에서 떨어지면 무서워서 자지 못한다.
203309,id-8,34,9,It cleverly controos its furry ears and tail tomaintain its balance while swimm:ng.
211525,id-674,34,5,"Il dévisage toujours ses adversaires d’un airrenfrogné plur être pris au sérieux, mais dès quela tension retombe, son sourire reprend le dessus."
219643,rec-126-dup-0,,1,ほのおで　えものを　しとめるついつい　やきすぎて　くろコゲにしてしまい　こうかいする
212148,id-706,,8,Distende i suoi lunghi corni e si lancia all’attaccocon una potenza 100 volte superi0re al pugnodi un peso massimo.
211666,id-682,34,6,"Von seinem Körper geht ein süßer Duft aus, dereibfach jeden bezaubert. Bei den uornehmenDamen des Adels war es besonders beliebt."
217418,rec-832-dup-1,34,8,Le sue magnifiche corna hanno la funzjonedi attirare gli indivieui di sesso opposto.Non le usa mai per attaccare.
212615,id-744,33,5,"Ce Pokémon s’attache vite à son Dresseur,mais a une fâchevse tendance à le mordre,ce qui peut compliquer son entraînement."
216898,rec-318-dup-0,34,11,
212614,id-744,,4,非常容易親近，但是卻喜歡東咬西咬，所以如果要一直培育牠的話會相當費勁。
224782,id-585,23,1,
205012,id-128,33,1,
216721,rec-815-dup-0,,11,小石を　リフティングして　炎のサッカーボールを　つくる　するどいシュートで　相手を　燃やす
215056,id-885,,6,Im der Urzeit lebte es im Meer. Nun ist es alsGeister-Pokémon wiedererwacht und irrt rastlosdurch seinen früheren Lebensraum.
218014,rec-95-dup-0,33,4,
224590,id-495,23,1,
217902,rec-778-dup-1,,3,겁을 주지 않기 위해 피카츄와닮은 누더기를 쓰고 있지만오히려 더 으스스해졌다.
215363,rec-773-dup-1,33,8,Lo stretto legame con il suo Allenatore harusvegliato :l suo potere nascosto.Può cambiare tipo a suo piacimento.
212831,id-754,34,12,双臂的花瓣既薄又锋利。还能够积蓄阳光发射光束。
222119,rec-18-dup-0,26,5,Ce Pokémon est doté dun plumage magnifique et luisant.Bien des Dresseurs sont captivés par la beauté fatale clesa huppe et décident de choisir Roucarnage c0mme leurPokémon favori.
222716,rec-19-dup-0,31,4,長著２顆大牙碰到什麼都會先咬上一口只看見１隻出沒附近肯定還住著49隻以上
217428,rec-832-dup-1,33,5,La texture de sa laine est si élastiqur quela surface des tapis fabnqués avec ce matériauest aussi rebondissante que celle dun trampoline.
217882,rec-771-dup-0,,1,あたたかい　あさせで　くらすてきに　であうと　たいないきかんをくちから　だして　なぐりつける
206327,id-239,34,7,"No se le da bien acumular electricidad, por lo1ue se cuela en las casas en busda de enchufespara alimentarse."
203241,id-5,,12,挥动燃烧着火焰的尾巴，用锋利的爪子撕裂对手。性格十分粗暴。
208869,id-471,34,9,"The coldness emanating from Glaceon causespowdery snovv to form, making it quite a popularPokémon at sk'l resorts."
203185,id-2,34,5,La lumière du soleil le rend plus fort et vigoureux.Le bulbe avr son dos grossit en conséquence.
204592,id-107,,1,くうきを　きりさく　パンチ。かすっただけで　やけどに　なるほどパンチの　スピードは　はやいのだ。
206639,id-278,33,9,"It makes its nest on sheer cliffs. Riding the seabreeze, it glldes up into the expansive skies."
209005,id-486,34,5,
206907,id-303,34,7,Sus otrora cuernos de acero se han transformafoen grandes fsuces con las que muerde a susenemigos.
219033,rec-847-dup-0,33,3,
203896,id-54,33,6,"Enton leidet permanent unter Kopfschmerzen.Wenn es seine gehwimnisvollrn Kräfte freisetzt,sollen die Schmerzen für eine Weile nachlassen."
205442,id-149,34,1,
208663,id-460,,3,블리자드를 일으키는 포켓몬이다.커다란 몸을 흔들면부근 일대는 금세 새하얗게 된다.
204175,id-73,33,5,"Il faut faire attention lorsque les globes rougessur sa tête se mettent à briller intensément,car c’est qu’il s’qpprête à émettre des ultrasons."
203542,id-32,34,1,
217288,rec-547-dup-0,33,8,Si diverte a spargere cotone ovunque. Se gli siversa dellacqva addosso diventa troppopesante per muover5i e si arrende.
212226,id-710,,6,"Blicken Menschen und Pokémon in das Licht, dasaus den Löchern seines Kürbisses dringt, werclensie hypnotisiert und von Irrbis kontrolliert."
225151,id-739,27,12,
220173,rec-3-dup-0,,11,太陽エネルギーを　栄養にして大きな花が　開く　日なたに引き寄せられるように　移動する
218102,rec-282-dup-0,,11,未来を　予知する　力を　もつトレーナーを　守る　ときに最大　パワーを　発揮する
220926,rec-141-dup-0,34,12,灭绝的原因尚不明确曾经栖n息在温暖的大海是性格残暴的古代宝可梦
219487,rec-677-dup-0,34,5,Il possède des pouvoirs psychiques si puissantsquil pwut faire valser um catcheur.Malheureusement il a du mal à les contrôler.
222339,rec-496-dup-0,24,9,When it gets dirty its leaves cant be used iripbotosynthesis so it always keeps itself clean.
209126,id-517,34,6,"Während es Träume frisst, stößt es Dunst aus.Bei fröhlidhen Träumen ist dieser rozafarben,bei Alpträumen schwärzlich."
218020,rec-95-dup-0,,3,땅속을 파고들면서 여러 가지단단한 것들을 집어삼켜서튼튼한 몸을 만든다.
212512,id-736,,1,おおきな　アゴは　ふとい　えだをへしおる　いりょく。　てんてきのココガラも　たまらず　にげだす。
206461,id-251,,12,拥有能够穿越时光的力量。在许多时代都留下了将它视为森林之神的记录。
207113,id-324,,3,등껍질 속에 석탄을 태워서에너지로 사용한다. 위급할때는 까만 매연을 뿜어낸다.
211515,id-674,33,5,"C’est en copiant son mentor, Pandarbare,qu’il app4end toutes les ficelles du métier,de l’art du combat à la capture des proie5."
216943,rec-364-dup-1,,11,タマザラシや　モンスターボールなど丸い　ものなら　なんでも　鼻の上で　回してしまう　習性
220236,rec-443-dup-1,34,12,
209244,id-525,34,4,透過聲音來探測四周。要是惹牠生氣了，牠會連身體方向也不轉就朝你追來。
217837,rec-127-dup-1,34,9,This Pokémon clamps its pincers down on its 0reyand tben either splits the prey in half or flingsit away.
205998,id-213,33,8,"Nel guscio raccogoie delle bacche. Per evitaregli attacchi, si nasconde sotto le rocce e rimaneimm0bile senza fare alcun rumore."
217630,rec-714-dup-1,34,5,Il peut contrôler des ondes à nimporte quelkefréquence du spectre. Même les plus grandsPokém9n ne peuvent supporter ses ultrasons.
205110,id-132,34,11,
212530,id-736,34,11,
208583,id-453,,3,독을 희석하면 약이 된다.제약 회사의 마스코트가된 후로 인기가 많아졌다.
205598,id-174,33,8,Adora cantare. Il suo corpo simile almarshmallo3 emana una lieye e dolce fragranza.
208926,id-475,34,6,
208866,id-471,,6,"Die kalte Luft, die Glaziola abgibt, erzeugtPulverschnee. In Skigrbieten erfreut es sichdaher großer Beliebtheit."
212174,id-708,,4,在森林中迷路死去的孩子的魂魄附在樹樁上，轉生成了寶可夢。
210933,id-621,33,3,
221226,rec-52-dup-0,33,8,Ama raccogliere oggetti luccicanti.Quarido è d: buon umore mostra la suacollezione anche al suo Allenatore.
203312,id-9,,1,からだが　おもたく　のしかかってあいてを　きぜつさせる。ピンチの　ときは　カラに　かくれる。
221590,rec-691-dup-0,,12,会通过将头上的伞状部分出海面吸收阳光的方式在体内制造龙之能量
204659,id-110,33,9,It mixes gases between its tvvo b0dies.It’s said that these Pokémon were seenall over the Galar region back in the day.
210943,id-621,,3,난폭하고 교활하다.다른 포켓몬이 파낸굴을 빼앗아 거처로 삼는다.
225285,id-797,27,5,
218023,rec-95-dup-0,33,7,Al abrirse paso bajo tierra va absorbiendo todoko que encuentra. Eso hace que su cuerpo seaasí de sólido.
209720,id-552,,11,暗闇でも　見える　特殊な両目の　おかげで　真夜中でも迷わず　狩りが　できるのだ。
220331,rec-551-dup-1,34,6,Ganovil ist zwar klein verfügt aber über kräftigeBeine mit denen es sicg durch den Wüstensandfo5tbewegt als würde es schwimmen.
208177,id-427,33,7,"Cuando enrolla ambas orejas, rs señal de quetieme algún tipo de malestar físico o emocionaly necesita cuidados."
221090,rec-372-dup-0,34,5,Il se prive de jourriture résistant à la faim.On dit que son évolution commence lorsque5es réserves dénergie sont épuisées.
216047,rec-67-dup-0,33,6,Dieses Po1<émon ist superstark. Es kann sich nurmit einem kraftregulieeenden Gürtel bewegen.
216945,rec-364-dup-1,33,8,Vive su banchi di ghiaccio alla deriva. Individuale prede fiutandone lodore mentre nupta.
220914,rec-141-dup-0,,3,멸종한 이유는 불명확하다.따듯한 바다에 살고 있던난폭한 고대의 포켓몬이다.
223358,id-189,4,9,"Once it catchesthe wind, it deft­lu controls itscotton-puff sporesgo float, evenaround the world."
210901,id-619,33,12,
212777,id-752,33,7,Usa las patas para lwnzar burbujas de agua conlas que atrapa y ahoga a sus prezas. Luego setoma su tiempo para saborearlas.
222370,rec-368-dup-0,30,4,
210897,id-619,,7,Un Mienfoo bien entrenado es capaz deprop9nar más de cien golpes por minuto.
219897,rec-865-dup-0,34,5,Il pare les attaques avec le tranchant de sonsolide poireau et contre-attaque avec la pointede la tige. Sori arme est également comestible.
216290,rec-136-dup-0,,4,當火焰在體內積蓄時火布的體溫也會隨之上升到最高９００度
209796,id-556,33,6,"Es erzeugt Laute, die dem Klang von Maracasähneln, ind weiß sich Vogel-Pokémon mit flottenRhythmen v0m Leib zu halten."
218262,rec-584-dup-0,34,6,
207896,id-385,33,6,Durch den Klang einer reinen Singstimme kamn esein Mal al1e 1 000 Jahre für genau sieben Tageaus seinem Schlaf erwachen.
204593,id-107,,3,주변의 공기를 가르는 펀치.스치기만 해도 화상을 입을 정도로펀치 스피드가 매우 빠르다.
214844,id-874,,4,每年會有一天，牠們會在特定的時間突然出現，聚集在一起排成一個圈。
209697,id-551,33,7,En las frías noches del sesierto se oculta a muchaprofundidad en la arena y duerme hasta que saleel sol.
222646,rec-192-dup-0,,8,Sunflora converte lenergia solare in nutrimento. È attivodurante il giorno quando fa caldo. Tvttavia appena il soletramonta non fa più il minimo movimento.
209253,id-526,33,3,씩씩해서 공사 현장이나채굴장에서 대왕끼리동이나사람과 함께 일할 때도 있다.
217904,rec-778-dup-1,34,5,Les malheureux chercheurs qui ont regardésous son déguisement en lanbeaux ont succombéà une mystérieuse kaladie.
218598,rec-72-dup-0,33,6,Da Tentacha kein besonders guter Schwimmer isttreibt ex in seichten Gewässern an derWasseroberfläche und sucht nacb Beute.
207871,id-378,,12,拥有一副由冰构成的身体。据说是诞生于冰河时期冻得厚厚实实的冰块之下。
223478,id-210,23,6,"Es ist trotz seines Äußeren schüchtern. Wird escvütend, schnappt es mit seinen Fängen zu."
207803,id-375,34,3,자력으로 하늘을 난다. 험준한산들을 누비듯이 고속으로비행하여 먹이를 쫓는다.
217348,rec-846-dup-0,,11,腹一杯で　極端に動きが　鈍った　ところをウッウに　丸飲みに　される
206066,id-220,34,6,"Wenn es etwas Vielversprechendes erschnuppert,sprintet es Hals über Kopf darauc los, ohnenachzudenken."
223968,id-331,,1,あめが　すくない　かんそうしたちいきに　せいそく。１ねんに　１かいきいろの　はなを　さかせる。
207229,id-334,34,9,"This Pokémon has a kind dispositlon, but id it’sprovoked, it will threaten opponents with shrillcries before attacking them without mercy."
214903,id-877,,3,아무리 먹어도 금방 배가 고프다.전기로 구운 씨앗을소중히 갖고 다닌다.
208588,id-453,34,8,"Se diluito, il suo velen0 ha proprietà medicinali.È diventato p0polare da quando una casafarmaceutica ne ha fatto la sua mascotte."
220262,rec-448-dup-0,33,4,操作一種被稱為波導的力量來行狩獵這種力量就連巨大的岩石也能擊得粉碎
219715,rec-800-dup-1,34,4,為生存而發狂般地尋找著光會發e射出射光將所有東西切成碎片
222038,rec-219-dup-0,,5,Sa température corporelle avoisineles 10 000 °C. Des flammes fusentdes fissures de sa c0quille.
215747,rec-539-dup-1,,1,ひたすらに　つよさを　もとめるやまで　しゅぎょうする　ダゲキをみたら　しずかに　たちさろう
223046,id-75,,1,やまから　ころがり　おちるときからだの　あちこちが　とれてもきにしない　ごうかいな　せいかく。
211342,id-643,34,1,
211349,id-643,34,9,"According to myth, if people ignore truth andlet themselves become c0nsumed by greed,Reshiram will arrive to burn their kingdoms down."
215908,rec-241-dup-1,33,9,Miltank produces highly nutritious milk so its1>een supoorting the lives of people and otherPokémon since ancient times.
212128,id-705,34,8,Nella protuberanza che ha sulla schiena si trova8n piccolo cerveilo. Pensa solo a mangiare e ascappare dai nemici.
220628,rec-264-dup-0,34,8,Si serve della sua straordinaria forza esplosivae dei suii artigli affilati per abbattere |a preda.Correre lungo strade tortuose non è il suo forte.
219111,rec-302-dup-0,34,12,会去吃宝石的结f晶双眼在漆黑一片的地方会发出宝的光芒
220655,rec-130-dup-0,33,7,Es exageradamente agresivo. El Hiperrayo quelanza por la boca recluce a cenizas todo lo queencuentra.
218203,rec-58-dup-0,34,5,Très fidèle il aboie de toutes ses forc4s pourprotéger sob Dresseur dOrigine quand un dangerle guette.
204430,id-94,,11,山で　遭難したとき命を　奪いに　暗闇から現れることが　あるという。
205720,id-183,,11,丸い　しっぽは　浮き輪の　かわり。球の　中には　脂に　変えた栄養が　たっぷり　詰まっている。
219214,rec-341-dup-1,34,8,Importato dallestero si è succes5ivamenterinselvatichito. Si adatta anche ai fiumi più:nquinati.
216691,rec-812-dup-1,34,12,打鼓技巧最高超的那一只会成为首领性情和重视族群的和谐相处
213755,id-820,33,5,"Il amasse tellement de Baies dans sa queuequ’elles tombent les unes aprèd les autres, maisil est si étourdi qu’il ne s’en rend pas c0mpte."
222837,id-14,23,3,
221619,rec-813-dup-1,34,8,Quando si prepara a lottare la punta del nasoe i xuscinetti sotto le zampe irradiano calore.
221615,rec-813-dup-1,34,5,Quand il est prêt à se battre la partiequi surmonte son museau ainsi wue les coussinetsde ses pattes postérieures émettent de la chaleur.
215224,id-893,34,4,
223391,id-192,,11,暑い　季節が　近づくと顔の　花びらは　鮮やかになり活発に　動くようになる。
212524,id-736,34,4,
218947,rec-246-dup-0,33,7,Nace en el subsuelo a gran profundidad. Trasingerir la tiwrra que lo rodea emerge a lasuperficie y se convlerte en pupa.
210622,id-605,,1,５０ねん　ほど　まえに　みつかったポケモン。　おおきく　はったつしたのうで　サイコパワーを　あやつるぞ。
218986,rec-691-dup-1,33,11,
222168,rec-395-dup-1,,5,Sil voit son honneur bafoué ilest capable de faire des ravagesauec ses ailes tranchantes.
214255,id-845,33,5,"Il est assez puissant pour terrasser un ennemicl’un s4ul coup, mais il est tellement nigaudqu’il oublie contre qui il se bat."
205072,id-131,,1,かしこく　こころやさしい　ポケモン。きれいな　うたごえを　ひびかせながらうみのうえを　およいで　いく。
214953,id-880,33,3,
223555,id-234,,3,뿔을 응시하고 있으면 원의중심에 빨려 들어가는 것 같은이상한 기분이 든다.
203649,id-37,34,9,"As each tail grows, its fur becomes more lystrous.When held, it feels slightly warm."
203548,id-32,,8,"Impavido nonostante la vorporatura minuta,lotta con coraggio per proteggere la femminaa cui è affezionato, anche a costo della vita."
221715,rec-358-dup-0,,8,Chimecho fa riecheggiare il suo verso dentro al corpo vuoto.Quando sinfuria emette onde a ultrasuoni in grqdo diabbattere i nemici in volo.
217665,rec-146-dup-0,34,5,
223264,id-162,4,9,It makes a nest tosuit its long andskinny body. Thenrst is impossiboefor other POKéMONto enter.
216274,rec-136-dup-0,34,11,
214517,id-858,,7,"Para mantener alejados a los demás seres vivos,emana a su alreded0r ondas psíquicas cuyapotencia es capaz de provocar jaquecas."
224572,id-493,12,9,"It is described in myth0logy asthe Pokémon that shaped theuniverse with its 1,000 arms."
205267,id-140,,7,"Se consideraba extinto, pero, al parecer, existendeterminadas zonas en las que es posible haliarejemplares con facilidad."
219521,rec-836-dup-1,33,12,
217776,rec-132-dup-0,34,5,Quand il rencontre lun de ses semblablesil sagi5e avec plus de vivacité que dhabitudepour adopter exactement la même forme que jui.
207740,id-372,,11,骨と　同じ　成分で　できた硬い　殻で　体を　包む。進化の　エネルギーを　蓄える。
217979,rec-375-dup-0,34,1,
204854,id-120,,4,在夏天快結束時到海邊，就能看見成群的海星星有規律地一閃一閃發光。
222172,rec-161-dup-0,13,9,
211717,id-685,33,7,"Puede percibir el estado físico y mental dealguien solo fon olerlo, lo que podría teneraplicacuones útiles en el campo de la medicina."
203292,id-8,33,1,ながいきの　シンボルと　されている。こうらに　コケが　ついているのはとくに　ながいきの　カメールだ。
223824,id-297,7,9,"HARIYAMA practices its straight-armslaps in any number of locatioris.One hit 0f this POKéMON’s powerful,openhanded, straight-arm punchescould snap a telephone pole in two."
210867,id-617,34,7,"Tras drshacerse del caparazóm, su agilidad haaumentado. Las membranas que le recubren elcuerpo evitan que se deshidrate."
224331,id-414,,3,꽃의 꿀을 매우 좋아한다.세꿀버리가 모아둔 꿀을가로채어 먹어 버린다.
212511,id-730,,12,对战就是西狮海壬的舞台。它那歌声和舞动气球的样子使观战的人们为之倾倒。
220967,rec-520-dup-1,33,7,Posee una velocidad de vuelo nada desdeñable.Por más 4ue se aleje 5iempre recuerda el caminode regreso a su nido o hasta su Entrenador.
204006,id-61,,6,"Quaputzi schwitzt glitschigen Schleim, dank demes lejcht der Umklammerung eines Feindesentkommen kann."
214388,id-851,34,8,"Ha una natura aggressiva. Il suo corpoincandescente lo rende molgo pericoioso,così come le sue lunghe zanne appuntite."
221781,rec-249-dup-0,25,7,La fuerza que tiene Lugia en las alas e5 devastadora connada que las bata es capaz de derribar edificios enteros.Por eso m'lsmo prefiere vivir donde no haya nadie en lo másprofundo del mar.
203317,id-9,33,7,"Para acabar con su enemigo, lo aplasta con elpeso de su cuerpo. En momentos de apuro, seescojde en ei caparazón."
218443,rec-723-dup-0,33,1,
