tid,species,version,language,flavor_text
212633,id-745,,3,냉정하며 신중하다.갈기의 바위는 잘 드는면도날처럼 날카롭다.
207372,id-344,33,1,
203973,id-60,33,3,
208288,id-437,34,8,"Per via dei disegni sul corpo, molti studiosiriten9ono che mon sia un Pokémon originariodi Galar."
210829,id-615,34,9,"When the weather gets hot, these Pokémon turninto water vapor. Cryogonal are almost meverseen during summer."
210822,id-615,,1,あつくなると　すいじょうきにかわる。　なつばに　すがたをみることは　ほとんどない。
210823,id-615,34,3,뜨거워지면 수증기로 변한다.여름철에 모습을볼 일은 거의 없다.
219569,rec-375-dup-1,33,4,由２隻鐵啞鈴以磁力結合而成因為有２個大u腦神力量也強化成２倍了
210525,id-597,34,5,
207811,id-375,,12,依靠磁力飞行。能够在空中以高速穿过险峻的山岳，让追捕的猎物无处可逃。
222276,rec-456-dup-0,30,4,會用發光的尾鰭引誘獵物白天會待在海a面附近到了夜裡就會向深海移動
218271,rec-584-dup-0,,12,体温在零下６度左右据说是由只多多冰贴在一起而诞生的
211492,id-663,33,1,
209127,id-517,34,7,"El humo que despide cambia de color en funcióndel sueño que haya consumido. Si es alegre, serárosa, o negruzco eri el caso de una pesadikla."
205262,id-140,,1,ぜつめつしたとも　いわれるがいちぶの　ちいきでは　けっこうふつうに　みかける　らしい。
218308,rec-271-dup-1,34,4,住在日照充足的水邊白天在水草的床上睡覺陽下山後就會出來活動
204098,id-66,33,8,"Il suo corpo è f0rmato intsramente da muscoli.Non è più alto di un bambino, ma può sollevaree lanciare 100 adulti."
203311,id-8,34,12,会灵巧地摆动自己毛茸茸的耳朵和尾巴，借此在水中保持平衡。
215459,rec-12-dup-0,33,8,Sbatte le ali a fran velocità per libetarele sue polveri tossiche nellaria.
217139,rec-626-dup-1,34,5,Les Frison vivent en troupeau dune vingtainsdindividus. Pour une raison inconnue si lundeux trahit le 9roupe il perd sa crinière.
221893,rec-207-dup-1,,11,顔面　めがけて　飛んでくる張りつかれた　獲物が　驚くあいだに　毒針を　刺しこむ
224660,id-504,17,5,Ils stockent à manger dans leursbajoues et font le guet lndéfiniment. Ilase font des signes en remuant la queue.
221361,rec-328-dup-1,,8,Se si cade in una delle tane a forma di imbutoche scaya nel deserto è impossibile sfuggirne.
219839,rec-5-dup-0,33,12,挥动燃烧着焰的尾巴用锋利的爪子撕对手性格十分粗暴
203441,id-27,,12,喜欢在干燥的沙地上滚来滚去，借此去掉身上的脏东西和水分。
217414,rec-832-dup-1,34,12,长得长长的角是为了向异性求爱而存在的它从不会把角当做武器
217781,rec-132-dup-0,34,6,Trifft es auf ein anderes Ditto bewegt es sichschneller a|s gewöhmlich um es exaktnachzuahmen.
211747,id-686,34,7,"Los destellos de luz iritermitente que emiteaplacan el ánkmo de lucha del enemigo, tras loque aprovecha para esconderse."
203895,id-54,33,5,"Il a toujours la migraine, mai5 la douleur sembles’at5énuer momentanément s’il laisse exploserson pouvoir mystérieux."
210325,id-584,,5,La température de son corps est d’environ- 6 °C. On rwconte que ce Pokémon naîtlorsque deux Sorboul se collent l’un à l’autre.
208657,id-460,33,7,Usa sus enormes brazos como si fueran martillospzra ahuyentar a los grvpos de Darumaka queacechan a los Snover.
203527,id-31,,7,"Para mecer a sus crías, las coloca en los huecosque tiene entre las púas dorsales, momentodurante wl cual no secretan veneno."
210104,id-571,,4,孤獨的訓練家會命令索羅亞克讓他看見幻影，藉此紓解一個人的寂寞。
204202,id-77,,1,ポニータに　みとめられるともえる　たてがみに　さわってもふしぎと　あつくなくなるのだ。
210717,id-610,,7,Viven en madrigueras que construyen bajo tierra.Compiten ent4e ellos para ver quién logra abrircon los colmillos las bayas más duras.
219192,rec-50-dup-1,34,1,
219197,rec-50-dup-1,,7,Este Pokémon avanza horadando la tierra a pocaprofundidad. Resulta fácil localizarlo por losmontículos que deja como rastro.
219196,rec-50-dup-1,34,4,在地下較淺的地方移動被挖掘過的地面會鼓起來所以非常容易發現
210906,id-619,34,6,"Lin-Fu ist klein, hat aber ein wildes Temperament.Gegnern, die sich igm unbedacht nähern, setzt esmit riner eleganten Schlagfolge zu."
205091,id-131,,12,十分耐寒，不畏冰海。皮肤滑滑的，摸上去会有点凉。
223606,id-250,23,6,Sein Körper soll in sieben Farben leuchten. Im Flugzieht es einem Regenbogen hinter sich her.
223270,id-162,23,8,Si addormenta avvolto nell’esile corpo della madre.Mette all’anfo|o i nemici con movimenti rapidi.
225213,id-786,,3,천진난만하고 잔혹한 아칼라의수호신이다. 향기로운꽃향기가 에너지의 근원이다.
203648,id-37,34,8,"Man mano che cresce, le sue sei code diventanosempre più belle. La peiliccia di cui sonoricoperte è calda al tatto."
203647,id-37,34,7,"Su pelaje se va volviendo más suave, lustrosoy bello a medida que le crecen las seis c0las.Al abrazarlo, emana una ligera calidez."
204696,id-112,,6,Nach seiner Entwicklung geht es aufrecht aufseinen Hinterbeinen. Mit seinem Horn kann esLöcher in Felsen bohren.
204692,id-112,33,1,
217833,rec-127-dup-1,34,11,
223962,id-327,23,8,Non ci sono due Spinda cpn lo stes5o motivomaculato. Il suo passo barcollante confonde i nemici.
216935,rec-364-dup-1,33,12,在浮冰上生活能一边游泳一分辨猎物的味道找到对方的位置并将其捕
218972,rec-691-dup-1,,3,금속을 녹슬게 하는 독액으로영역에 들어온 유조선을바다의 부스러기로 만들어 버린다.
217029,rec-54-dup-0,34,3,스트레스가 쌓이면두통이 심해진다. 강력한염동력으로 주위를 압도한다.
204816,id-118,33,6,"Seine Brust-, Rücken- und Schwanzf|ossenbewegen sicn anmutig. Daher nennt man esden „Wassertänzer“."
205498,id-169,33,8,Le due zampe si sono mutate in ali. Vola verso lapreda ad alta velocità senxa fare alcyn rumoree le affonda le zanne nella nuca.
220276,rec-52-dup-1,,4,為了不弄髒額頭上的金幣會常常洗臉g和伽勒爾的喵喵關係不好
218978,rec-691-dup-1,,4,會用能夠腐蝕金屬的毒液將闖入自己地盤s的油輪化為碎屑沉入大海
205955,id-211,,5,"Lorsqu’il est confronté à plus gros que lui,il avale autant d’eau que po5sible pour égalerle gabarit de son adversaire."
217974,rec-375-dup-0,34,7,Levita gracias al magnetismo. Es capaz de sortearescarpadas montaña5 iiiientras vuela a altasvelocidades en pos de su presa.
217536,rec-364-dup-0,34,6,Seejong balanciert gerne Ppkébälle Seemopsund alles was sonst noch rund ist auf seinerNasemspitze.
217014,rec-54-dup-0,,4,頭痛會隨著壓力累積而更加劇烈會用強大的念力壓倒i周圍的一切
215526,rec-544-dup-0,33,4,會高速旋轉去突擊對手牠的q最高時速可以達到大約m１００公里
216618,rec-379-dup-0,34,3,땅속 맨틀에서 태어나약 l만 년 전에 지상으로올라왔다는 이야기가 있다.
224511,id-484,,3,평행으로 늘어선 공간의틈새에 산다고 전해진다.신화에 등장하는 포켓몬이다.
205401,id-147,33,12,
219415,rec-616-dup-0,33,12,一旦被敌人袭击便会关上壳盖保护自己不n过盖盖虫能打得开
223029,id-71,23,7,"Dicen que vive dn grandes colonias en el interior delas junglas, aunque nadje ha podido verificarlo."
212987,id-762,,7,"Si un Corvisquire viene a picotearlo, se defiendegoopeándolo con el cáliz de la cabeza y confuertes patadas."
206453,id-251,,3,시간을 이동하는 힘을 가졌다.숲의 신으로서 여러 시대에기록이 남겨져 있다.
210825,id-615,34,5,
203513,id-31,,3,공격보다는 방어가 특기다.갑옷 같은 비늘로 어떠한공격에도 새끼를 지킨다.
206806,id-293,34,6,"Stößt Flurmei einen Scbrei aus, so erschrickt esvor seiner eigenen Stimme und brüllt noch lauter,bis es erschöpft ist und sich schlafen legen muss."
213947,id-829,34,7,Muchos los crían tras quedar prendadls de loadorables que resultan cuando cantan dandovueltas empujados por lq brisa.
214898,id-877,33,8,Ha costantemente fame. Si nvtre dei semi chetierie nelle sue tasche per produrre elettricità.
220123,rec-142-dup-1,,4,擁有像鋸子般的牙齒就連鋼屬性寶可夢的皮膚都能撕裂成碎片
218905,rec-34-dup-0,33,4,一旦大鬧起來就無人能擋但在長年相伴的尼多后e面前則會露出溫和的表情
224841,id-642,,3,꼬리의 가시에서 전격을날린다. 하나지방의 하늘을날아다니며 번개를 내리친다.
204487,id-99,34,7,
206269,id-236,34,9,"Even though it is 5mall, it can’t be ignored becauseit eill slug any handy target without warning."
208965,id-478,34,5,"Il gèle ses proies avec son souffle à - 50 °C,les amène dans sori antre, puks les y aligneavec soin."
220615,rec-264-dup-0,33,5,Son pelagw est à la fois solide et flexible.Les blairea7x conçus à partir des poils de sa muesont des produits de très grand luxe.
218075,rec-768-dup-0,,11,海底の　穴や　沈没船がすみか　オトスパスと　戦い負けた　ほうが　エサになるのだ
222556,rec-97-dup-1,,8,Ha con sé una sorta di pendolo. Una v9lta per erroresi è portato via un bambino che aveva ipnotizzato.
213304,id-781,34,4,把錨拋到海裡，伏擊獵物。會去捕捉巨大的吼鯨王，吸取牠們的精氣。
212993,id-763,33,3,늘씬하게 뻗은 다리와 잔인한마음씨를 가진 공포의 대상.상대를 사정없이 짓밟는다.
207382,id-344,34,1,
209267,id-526,34,7,Las bolas de energía que lanza solo en díassoleados son tan potentes que pueden hacersaltqr un cajión por los aires.
210947,id-621,,7,Posee una personalidad despiadada y ladiria.Se apropia de los túneles excavados por otrosPokémon y los habita.
204179,id-73,33,9,"When the red orbs on Tentacruel’s head glowbrjghtly, watch oit. The Pokémon is about tofire off a burst of ultrasonic waves."
217616,rec-714-dup-1,34,9,No wavelength of sound is beyond Noibatsabilitv t0 produce. The ultrasonic waves itgenerates can overcome much larger Pokémon.
210150,id-573,34,11,特別な　油の　染みた　毛は攻撃を　受け流す。　油は高値で　取り引き　されている。
208318,id-439,33,8,Imita chi7nque veda. Si esercita com costanzaimitando gli splendidi passi di danza di Mr. Rime.
207805,id-375,34,5,Ce Pokémon vole par magnétisme.Il poursuit ses proies en slalomwntà toute allure emtre les pics escarpés.
212338,id-722,33,8,"In volo attacca lanciando piume affilatecome lame, mentre a distanza ravv:cinatatira poderosi calci con le zampe robuste."
212335,id-722,33,5,"En vol, il attaque en lançant ses plumes aiguiséesfomme des lames. Au corps à corps, il se baten donnant de violents coups de patte."
203553,id-33,,3,다이아몬드보다 단단한 뿔로암석을 부수며 다닌다.달의돌을 찾고 있는 것이다.
211235,id-636,33,5,"Il y a fort longtemps, les gens croyaient queles Pyrlnille étaient tombés du soleil."
204895,id-122,,5,De nombreux savants pensent que ses mainsse sont développées pour faire de la pantomimr.
219837,rec-5-dup-0,,3,불타는 꼬리를 휘두르며날카로운 발톱으로 상대를베어 가르는 몹시 거친 성격이다.
221051,rec-279-dup-1,,1,かいめん　すれすれを　とんでおおきな　くちばしで　かいすいごとエサを　すくいとって　はこぶのだ
206826,id-294,34,6,"Sein Brüllen ist nicht nur ein Angriff aufs Gehöe,sondern erzeugt auch Schockwellen, durch dieGegner weggefegt uncl verletzt werden."
215470,rec-12-dup-0,,8,Raccoglie nettare tutti i giorni e lo spalma sullapeluria che ric0pre le sue zampe per trasportarloal nido.
203909,id-54,34,9,"As Psyduck gets stressed out, its headache getsprogressively vvorse. It uses intense psychiceriergy to overwhelm those around it."
210806,id-614,34,6,"Es schwimmt fröhlich durch kalte Meere. Wennes müde wird, gefriert es mit seinem Eisatem dieWaaseroberfläche und ruhr sich darauf aus."
216677,rec-812-dup-1,,11,特別な　切り株の　パワーをドラミングで　コントロール根っこを　操って　戦う
219408,rec-486-dup-1,33,5,Plusieurs légendes à travers le monderacontent que Regigigas aurait créédes Pokénon à son inage.
204110,id-66,,11,いつも　パワフル。　体力が有り余っているので　暇つぶしに岩を持ち上げ　さらに　強くなる。
211340,id-643,33,11,
221792,rec-794-dup-0,28,5,Lune des mystérieuse5 Ultra-Chimères.On laurait aperçue réduisamt un camion à benneen miettes dun seul coup de poing.
209287,id-527,34,7,Emite ultrasonieos mientras revolotea en buscade los Pokémon insecto cob los que se sustenta.
214185,id-841,34,5,Il vole avec ses ailes faites de pelutes de pommeet crache une substance très acide.Il peut aussi prendre la forme cle ce fruit.
208985,id-479,34,5,
203242,id-5,,1,たたかいで　きもちが　たかぶるとしゃくねつの　ほのおを　ふきながらあたりを　もやしてまわる。
217838,rec-127-dup-1,33,11,
217461,rec-698-dup-0,,11,化石から　復元が　成功敵の　少ない　寒い土地で群れを　つくり　暮らしていた
217465,rec-698-dup-0,34,7,Un Pokémon prehistórico extinto. Se han halladoalgunos ejemplares conservados baj9 el hielo.
219401,rec-486-dup-1,33,1,
223460,id-207,,6,"Es hängt meist an Klippen. Erspäht e5 Beute,spreizt es seine Flügel und greift diese sofort an."
224133,id-384,23,7,Vive en la capa de ozono sobre las nubes y no ouedeser visto desde el suelo.
210020,id-567,,11,飛び立つために　助走する。その　距離は　およそ　４キロ。走る速さは　時速４０キロ。
215972,rec-571-dup-0,34,5,Les Dresseurs en manque de compagnieordomnent à Zor0ark de leur montrerune illusion pour tromper leur solitude.
214996,id-882,33,6,"Dank der enormen Kraft seiner Beine uncl seinesKiefers war es in drr Urzeit unbesiegbar, doch esfing seine Beute restlos weg und starb daher aus."
211455,id-661,33,5,Son chant mélodieux est en fait une tentatiyed’intimidatiin. Il picore sans merci tout individuqui pénètre dans son territoire.
217469,rec-698-dup-0,34,9,Amaura is an ancient Pokémon that has goneextinct. Specimdns or this species can sometimesbe found frozen in ice.
203530,id-31,,11,背中の　棘の　隙間に　子どもを乗せて　あやす。　そのときに　毒が出ることは　けっして　ないのだ。
211244,id-636,,4,全身都相當溫暖。會從角的尖端噴出火來威嚇天敵或獵物。
204228,id-78,34,8,L’esemplare più veloce diventa il capo dwlgruppo e ne decicle velocità e destinazione.
211158,id-632,33,8,"Depone le Uova nei recessi più interni del suonido. Se un Heatmir lo attacca, si difendemordendolo con le grandi mandibole."
211157,id-632,,7,"Deposita sus huevos en la parte más profundadel nido. Si un Heatmor lo ataca, se defiendemordiéndolo con sus enormes mandíbulas."
211155,id-632,,5,"Il dépose ses Œufs tout au fond de son terrier.Lorsqu’un Aflamanoir l’attaque, il se défendà l’aide de ses mandibules."
207901,id-385,,12,每１０００年让它听一次清澈的歌声，就能让它维持７天的清醒。
210493,id-596,33,3,
208682,id-461,,1,ツメで　サインを　えがき　なかまとれんらく。　サインの　しゅるいは５００いじょう　あると　いう。
217546,rec-364-dup-0,,6,Seejong oebt auf Eisschollen. Wittert es beimSchwimmen Beute spürt es sie auf und schnapptsie sich.
210962,id-622,,1,ねんどから　つくられた　ポケモン。なんぜんねんも　まえの　あるじのめいれいを　いまも　まもっている。
212543,id-737,,3,먹은 낙엽을 소화할 때 전기가발생하는 구조로 되어 있다.배의 전기 주머니에 충전된다.
211731,id-685,34,12,
219729,rec-800-dup-1,33,1,
223407,id-198,,11,輝く　物を　拾っては秘密の　場所に　隠しておく。よく　ニャースと　奪い合いになる。
207379,id-344,,9,"This musterious Pokémon started life as an ancientclay figurine made over 20,000 years ago."
215727,rec-127-dup-0,34,4,會用角緊緊夾住獵物就這樣把對方剪成兩半或是把牠扔到天邊去
215143,id-889,34,3,
222508,rec-313-dup-0,17,5,Il communique avec ses pairs enallumant son posyériwur la nuit. Iladore le doux parfum de Lumivole.
206023,id-214,34,3,자신 몸무게의 |o0배에 달하는무게도 거뜬히 들어 올리는괴력을 자랑하는 포켓몬이다.
212779,id-752,33,9,"It launches water bubbles with its legs, drowningprey within the bvbble5. This Pokémon can thentake its time to savor its meal."
223110,id-88,23,8,Grimer è nato da fango esposto ai raggi X proveriienticlalla luna. Ama nutrirsi di sostanze sudicie.
204875,id-121,33,5,"S’il déchaîne son pouvoir psychique puissant,son orgabe appelé « cœvr » se met à brillerde sept couleurs."
217715,rec-744-dup-0,,6,Mit seinem steinernen Fellkragen schlägt Wuffelsauf den Boden um Gegner einzvschüchtern.Schrecken diese zurück greift es sie sofort an.
205444,id-149,,4,人們稱牠為大海的化身。有許多船會在船頭設置快龍的雕像。
218012,rec-95-dup-0,,11,地中を　掘り進みながらいろんな　硬いものを　取り込み頑丈な　体をつくる
205273,id-141,,3,먹이를 베어 갈라 체액을빨아먹는다. 남은 몸은다른 포켓몬의 먹이가 된다.
221544,rec-345-dup-0,,8,Si attacca alle rocce dei fonda|i marini e usai tentacoli simili a petali per catturare le predeche si avvicinano.
222186,rec-84-dup-0,32,12,羽毛较短所以不擅长飞行但是拥有发达的双脚能够以很快的速度奔跑
222623,rec-152-dup-0,6,9,It loves to baskin the suhlight.It uses the leafon itd head toseek out warmplaces.
205290,id-141,,11,絶滅の　理由は　不明。暖かい　海に　暮らしていた凶暴な　古代のポケモン。
219714,rec-800-dup-1,,11,光を　エネルギーに　生きている地下で　眠っていたため　体内に溜まった　不純物で　黒ずむ
208661,id-460,,12,会像挥动锤子一样挥下自己大大的手臂，赶走要袭击雪笠怪的火红不倒翁群体。
221088,rec-372-dup-0,33,6,Es hüllt seinen Körper in eine harte Schaledie Knochenge2ebe gleicht umd sammelt soEnergie für seine Entwicklung.
214895,id-877,,5,Il a toujours un petit creux. Il grignote les grainesqu’il a mises dans ses sortes de pochespour produiee de l’électricité.
213793,id-822,33,3,
225238,id-788,27,8,Avvolge il nemico in una f8tta nebbia chelo induce ad attaccare se stesso. Le correntimarine 5ono la fonte della sua energia.
216119,rec-636-dup-1,33,11,
212535,id-737,,5,"Il est bien protégé par sa robuste carapace,et se défend en générant un courant électriqueau b0ut de ses mandibules."
223319,id-179,,11,ふわふわの　体毛は　静電気がたまると　２倍に　ふくらむ。触ると　感電してしまう。
209270,id-526,34,11,
224111,id-381,,11,高い　知能を　持つ　ポケモン。腕を　折りたたんで　飛べばジェット機を　追い越す　スピードだ。
214854,id-875,33,4,
213801,id-822,,12,头脑聪明，懂得使用工具。会用爪子抓起小石头投向敌人，或是用绳子把敌人捆住。
204691,id-111,,12,脑子里只能记住一件事。一旦开始猛冲，不管理由是什么都会很快感到无所谓而忘掉。
203303,id-8,,3,탐스러운 귀와 꼬리를능숙하게 다뤄서 수중에서의밸런스를 유지한다.
205956,id-211,,6,"Sieht es sich einem größeren Feind gegenüber,schluckt es massenweise Wasser, um seinenKörper aufzublähen vnd größer zu wirken."
208893,id-474,,3,다른 공간에 드나들 수 있는프로그램을 추가한 결과움직임이 불안정해졌다.
208719,id-463,33,9,Lickilicky’s strange tongye can stretch to manytimes the length of its body. No one haa figuredout how Lickilicky’s tongue can stretch so far.
215336,rec-82-dup-0,,9,This Pokémon is three Magnemite that havelinked together. Magneton sends out powerfvlradio waves to study its surroundings.
213871,id-825,,12,正在壳里成长着。用精神力量掌握外界的状况，做好进化的准备。
213800,id-822,33,11,
213806,id-822,,6,"Es hat viele heftige Kämpfe überstanden unddabei gelernt, die Stärke seiner Gegner stetskorrekt einzuschätzen."
205731,id-183,,12,体毛的防水性能很好，就算是从冰冷的海里上岸，身体也会立刻干掉，一点都不冷。
219518,rec-836-dup-1,33,5,Il produit de lélectricité puis la transfèredans ses pattes pour mieux courir. Ain5i il peutfoncer pendant trois jours et trois nuits.
206276,id-237,33,6,"Es dreht sich um sich selbst und verteilt Tritte.Gewinnt es au5reichend an Schwung, bohrt essich dabei in den Boden."
210617,id-605,,7,"Cuando se halla junto a un televisor, la pantallamuestra :mágenes de extraños paisajes. Se creeque corresponden a su lugar de origen."
223052,id-75,,4,最喜歡的食物是長有青苔的岩石。吃的時候會發出咯吱咯吱的聲音，每天會吃１噸以上。
206340,id-240,,11,まだまだ　小さく　臆病。興奮したり　びっくりすると鼻や　口から　火が　もれる。
222576,rec-204-dup-0,30,6,Es macht seinen Körper breiter und größerindem es sich rnit Speichel Bsumrinde anklebt.Ältere Tannza sind deshalb unfassbar groß.
206287,id-237,34,7,"Tras hacer el pino para desconcertar a su rival,domienza a propinar 5us espectaculares patadas."
221308,rec-121-dup-0,,4,會高速旋轉著身體在海裡游泳k並且同時吸食微小的浮游生物
204069,id-64,34,9,"This Pokémon’s telekinesis is immensely powerful.To prepare for ev0lution, Kadabra stores uppsychic energy in the star on its forehead."
224842,id-642,23,6,Es greift mit elektrischer Ladung aus den D9rnenseiner Rute an und bombardiert Einall aus der Luftjit Blitzen.
204064,id-64,,4,念力的威力大得驚人。會把精神力量儲存在額頭的星星裡，以備進化所需。
209315,id-529,,5,Il fonce sur ses proies en joi9nant ses griffeset en tourbillonnant sur lui-même.
212038,id-701,,8,"Sfrutta la sua agilità per indebolire l’avversario,e conclude la lotta dandogli il colpo di graziacon una mossa grandiosa."
212787,id-752,,7,Cuida de pequeños Dewpider acogiéndolos ensu burbuja de agua y dejando que se alimentende los restos de las presas que ha ingerido.
207600,id-361,,11,真夜中　現れる　ユキワラシは大雪を　降らせると　いわれる。雪や　氷を　食べて　暮らす。
212788,id-752,34,8,Tiene un Dewpider nella bolla e se ne prendecura lasciando xhe si nutra dei suoi avanzi.
207607,id-361,34,7,
214495,id-857,33,5,"S’il ressent des émotions trop fortes, il en ferataire la source, quelie qu’elle soit, en utilisantdes méthodes assez ciolentes."
220661,rec-130-dup-0,33,5,Il est dune nature très agressive.Le5 lasers quil tire de sa bouche son6 capablesde désintégrer nimporte quelle cible.
205396,id-147,33,6,"Dratini lebt in der Nähe reißender Gewässer,wje etwa in tiefen Becken unter Wasserfäll3n.Es wächst, indem es sich immer wieder häutet."
214407,id-852,34,7,"Su inteligencia es similar a la de un niño de tresaños. Sus tentáculos se desprenden a menudo,pero ni se irimuta, ya que se regenrran solos."
216545,rec-738-dup-1,34,12,如果它在飞翔时把虫电宝抱o住当作备用电池就能连续发射电力超高的电磁光束
223605,id-250,23,3,몸은 일곱 빛으로 빛나고날아간 자리에는 무지개가 생긴다는신화 속에 남아 있는 포켓몬이다.
221221,rec-52-dup-0,33,9,
221816,rec-166-dup-0,25,7,Dicen que en zonas en las que el aire está limpio en las quese ven las estrellas hay enorme5 p0blaciones de Ledian.La razón es muy sencilla este Pokémon usa la luz de lasestrellas como fuente de energía.
224315,id-412,23,3,
217061,rec-450-dup-0,,11,体の　穴には　たまに　石が詰まる　石を　取ってくれるのでイシズマイを　大切に　守る
203694,id-40,,4,越吸氣就越會膨脹。心情變壞時，會鼓氣撐大身體來威嚇對方。
208676,id-461,,6,Sie jagen ihre Beute in Grupoen. Im Teamerledigen sie selbst große Ziele wie Mamutelmit Leichtigkeit.
222170,rec-161-dup-0,24,8,Ritto sulla coda guarda lontano. Se nota un nemicolaricia forti richiami per zvvertire quelli della sua specie.
205279,id-141,33,9,Kabutops slices its prey apart and sucks ojtthe fluids. The di5carded body parts becomefood for other Pokémon.
217130,rec-436-dup-0,,3,오래된 유적에 나타난다.몸의 무늬는 가라르에 없는낯선 문화의 것이라 수수께끼이다.
215337,rec-82-dup-0,34,5,Il émet constamment une énergie magnétiquepuisaante qui interfère avec la grande majoritédes ordinateurs dont il sapproche.
215334,rec-82-dup-0,,11,３匹の　コイルが　連結した強力な　電波を　放ちまわりの　様子を　観測する
223359,id-189,17,5,
215338,rec-82-dup-0,,4,隨時都釋放著很強的磁力只要三合一磁怪一靠近大多數的電腦都會出現異常
214650,id-864,,11,魂を　被う　霊体の体には　注意。　触れると石のように　動けなく　なるぞ。
205634,id-176,,4,據說牠會為了將幸福帶給心地善良的人而現身。
211729,id-685,34,9,"Slurpuff’s fvr contains a lot of air, making it softto the touch and lighter than it l0oks."
217017,rec-54-dup-0,33,8,È costantemente tormenta6o dal mal di testams se lascia esplodere il suo misterioso poterepare che trovi temporaneamente sollievo.
