tid,species,version,language,flavor_text
213635,id-814,33,5,Son pelage épais lul permet de mieux résiste4au froid et d’augmenter la températurede ses capacités Feu.
212081,id-703,,12,从体内埋藏的宝石中发射出高能量的光线，将所有来袭的敌人都一扫而尽。
218083,rec-768-dup-0,33,7,Hace lo que sea por cojseguir la victoria. Si elrival se descuida aprovecha para asestarle ungolpe letal con svs pequeñas garras frontales.
207757,id-373,33,7,"Un Pokémon poco común que, tras desearcin tosas sus fuerzas poder volar, consiguióun cuerpo alado al evolucionar."
224034,id-354,23,8,"Un peluche divenuto Pokérnon per la rabbia di esserestato buttato via da uri bimbo, di cui è alla ricerca."
212108,id-704,,8,I suoi corni sono degli straordinari organisemsoriali. Riesce a sopravvivere nascondendosinon appena percepisce la presenza del nemico.
208089,id-421,34,9,"Its folded petals are pretty tough. Bird Pokémoncan peck at them all they warit, and Cherrimwori’t be bothered at all."
222846,id-15,,1,りょうてと　おしりにある　３ぼんのどくばりで　あいてを　さして　さしてさしまくって　こうげきする。
203448,id-27,,8,"Scava nel terreno per costruire la sua tana,frantumando anche le rocce più dure coni suoi artiglo affilati."
210965,id-622,34,5,Ce Pokémon fait d’argile continue de respecterles ordres que s0n maître lui a donnés il y aquelques mi|lénaires.
206328,id-239,34,8,"Non è ancora abile nell’immagazzinare elettricità.Si intrufola nelle abitazkoni in cerca di presedi corrente, che sfrutta per nutrirsi."
218016,rec-95-dup-0,33,8,Scava nel terreno assorbend0 gli oggetti più duriper irtobustire il suo corpo.
211280,id-638,,11,テラキオン　ビリジオンと　ともにイッシュ地方の　ポケモンを　守り人と　戦った　伝説がある。
214531,id-858,34,12,
209402,id-533,34,1,
221236,rec-468-dup-0,,12,不会出现在发生争端和纷乱的地方近来几乎见j不到它的身影
211750,id-686,34,11,敵に　発光体の　点滅を浴びせて　戦意を　なくしてしまう。その　隙に　逃げ出すのだ。
204872,id-121,,1,きょうれつな　サイコパワーをはなつとき　コアと　よばれるきかんが　なないろに　きらめく。　
208423,id-445,,3,지상에서도 움직임이 빠르다.설산에서는 체온이 떨어지기 전에먹이를 잡아 거처로 돌아간다.
207246,id-337,34,6,Es wurde erstmal5 vor 40 Jahren bei einemMeteoritenkrater entdeckt. Gegner ver5etzt esallein mit seinem Blick in Schlaf.
217090,rec-556-dup-0,33,7,Emite un sonido parecido a una5 maracas. Semuevw con un ritmo marchoso para sorprendera los Pokémon pájaro que huyen espantados.
222366,rec-368-dup-0,23,6,
213009,id-763,34,9,A kick from the hardened tips 0f this Pokémon’slegs leaves a wound in the opponent’s body andsoul tbat will never heal.
221868,rec-501-dup-0,26,6,Kämpft mit der Muschel auf seinem Bauch. Pariert es einenAngriff schlägt es sofort mit ein3r Schriitt-Attacke zurück.
222644,rec-192-dup-0,23,5,À lapproche des beaux jours les pétales ent0urantsa tête deviennerit plus chatoyants.
214960,id-880,33,11,
213942,id-829,34,1,
217701,rec-271-dup-0,34,3,
217703,rec-271-dup-0,,4,傍晚時開始活動的夜行性寶可夢喜歡吃河底的水苔
217706,rec-271-dup-0,,7,Este Pokémon nocturno entra en acción al caerla tarde. Se alimenta del musgo que crece en ellecho de los ríos.
210124,id-572,34,4,用尾巴互相撫摸來打招呼。尾巴的毛比較蓬鬆的那一方會表現得稍微威風些。
223592,id-245,23,8,Corre per tutto il mondo per purificare l’acquacontaminatz. Si allontana cob i venti del nord.
217583,rec-614-dup-0,34,9,It swims energetically through frigid seas.When it gets tired lt freeze5 the seawaterwith its breath so it can rest on the ice.
203485,id-29,,5,Ce Pokémon se nourrit de Baies en lea ouvrantavec ses incisives. Le bout de sa corne est plusarrondi que celui du mâle.
204362,id-91,34,1,
203544,id-32,,4,體型嬌小，但性情勇猛。為了保護感情好的雌性，會奮不顧身地勇敢戰鬥。
223320,id-179,,4,用咩利羊的毛製成的衣服很容易起靜電，所以會經過特殊加工。
222200,rec-400-dup-0,26,7,Para anidar crea presas 4n los ríos con kaderas y barro.Tiene fama de trabajador.
214173,id-841,,3,새콤한 사과를 먹고 진화했다.화상을 입을 정도로 강한 산성을 띠는액체를 볼주머니에 저장하고 있다.
220621,rec-264-dup-0,,1,つよくて　コシの　ある　たいもうぬけげで　つくられた　シェービングブラシは　ちょうこうきゅうひん
207234,id-337,,4,月亮的盈虧似乎會影響牠力量的增減。每到滿月之夜就會變得活躍。
215522,rec-544-dup-0,34,12,用坚硬的壳和带毒的刺保护自己的身体1积蓄进化所需的能量
215745,rec-539-dup-1,,11,ひたすらに　強さを　求める山で　修行する　ダゲキを見たら　静かに　立ち去ろう
216553,rec-81-dup-0,,1,でんきを　くって　いきているさゆうの　ユニットから　でんじはをほうしゃ　しながら　そらを　とぶ
221786,rec-794-dup-0,,3,다른 세계에서 나타난 UB이다.스스로 몸을 보여주는 행동이자랑인지 위협인지 알 수 없다.
204677,id-111,,7,"Su inteligencia es limitada, aunque posee unafuerza tan considsrable que le permite inclusoderribar rascacielos con solo embestirlos."
209526,id-539,,6,"Der Karateschlag eines perfekt durchteainiertenKaradonis’ hat genug Wucht, um selbst das Meerzu spalten."
214878,id-876,33,8,Le corna sulla testa gli permettono di percepirelo stato d’animo degli altri. Il maschio segue ilsuo Allenatorw ovunque e si prende cura di lui.
224787,id-585,,11,季節が　変わったとき　だけでなく気温や　湿度に　よっても体の色は　少し　変化する。
220441,rec-616-dup-1,33,8,
216548,rec-738-dup-1,34,3,예비 배터리로서 전지충이를안고 날면 높은 전력의전자빔을 연사할 수 있다.
216546,rec-738-dup-1,,1,おなかで　はつでんした　でんきをおおきな　アゴで　しゅうそくさせてだいしゅつりょくの　ビームを　うつ
217935,rec-824-dup-0,34,5,
220302,rec-835-dup-0,34,5,Ce glouton assiste les humains dans leur tragailen échange de friandises. Il cou4t sans arrêtle corps enveloppé délectricité.
207097,id-321,33,7,Puede deiar fuera de combate a sus op0nentescon el impacto de su enorme cuerpo al caer enel agua tras uno de sus saltos.
203514,id-31,33,4,比起攻擊更擅於防守。會用像鎧甲般的堅硬鱗片保護孩子不被任何攻擊傷害。
204172,id-73,33,1,あたまの　あかい　たまの　ひかりがつよくなったら　ようちゅうい。ちょうおんぱを　はなつ　まえぶれだ。
215371,rec-773-dup-1,,12,与所信赖的训练l家之间的牵绊是解放它真正力量的最后一个要素
224847,id-645,17,9,Lands visiter by Landorus grant suchbountiful cropx that it has been hailedas “The Guardian of the Fields.”
217628,rec-714-dup-1,33,12,
217694,rec-271-dup-0,,6,Lombrero wird erst in der Abenddämmdrungaktiv. Es ernährt sich von Moos das am Bodenvon Flüssen gedeiht.
221767,rec-786-dup-0,,3,빛나는 인분을 흩뿌려사람이나 포켓몬의 상처를 치료한다.아칼라에서 모시는 수호신이다.
208030,id-415,,11,夜明けから　日暮れまで　蜜を集めつづける。　すべては群れと　ビークインの　ためだ。
205023,id-128,34,3,
217708,rec-271-dup-0,34,4,住在日h照充足的水邊白天在水草做的床e上睡覺太陽下山後就會出來活動
225167,id-741,,7,Junta las alas y ianza voraces llamas al rival.Su ataque se asemeja a una elaboradacoreografía de fuego.
213860,id-825,,11,ほぼ　動かないが　生きている。飲まず食わずで　殻に　こもるうち超能力に　目覚めたらしい。
210081,id-570,33,12,之所以学会了幻化成其他东西的能力，似乎是因为它的性格比较胆小。
223023,id-70,,12,它在肚子饿的时候会吞掉周围会动的东西，分泌溶解液让其致命。
223385,id-192,17,5,Les rayons du sole'll lui donnent del’énergie. Il e5t connu pour migrervers les régions ensoleillées.
212095,id-704,33,5,"Son corps est principalememt composé d’eau.S’il de déshydrate, il devient tout rabougri.C’est le plus faible des Pokémon Dragon."
210673,id-608,33,3,누군가가 죽기 직전에나타나기 때문에 사신의 사자로여겨져 두려움의 대상이 되었다.
204485,id-99,34,5,"Sa pince gigantesque possède une puissancedestructrice phénoménale, mai5 hors combat,son poids devient un handicap."
204481,id-99,,12,虽然坚硬的钳子有着１万马力的力量，但因为太大而行动迟缓。
211282,id-638,,1,うまれながら　リーダーの　ふうかくをみにつける。　きょうぼうな　あいてもコバルオンの　まえでは　おとなしい。
204488,id-99,34,8,"La sua chela più grande ha una potenzadistruttiva fenomenale, ma fuori dalla lottagli è d’impiccio per via del pesl."
219667,rec-568-dup-1,,11,不衛生な　場所が　好きゴミで　汚したまま　放っておくと部屋にも　現れて　棲みつく
218293,rec-271-dup-1,,11,日当たりの　良い　水辺に　棲む昼間は　水草の　ベッドで　眠り日が　暮れると　動き出す
221660,rec-801-dup-0,28,9,Its mechanized body is merely a vessel. Its trueself is irs So7l-Heart an artificial soul.
211728,id-685,,8,La grande quantità d’aria contenuta jella suapelliccia la rende soffice al tatto. È più leggerodi quanto possa sembrare.
210479,id-595,33,9,
214262,id-845,34,1,
203693,id-40,33,3,숨을 들이쉬면 쉴수록 몸이 부푼다.기분이 나빠지면 몸을 커다랗게부풀려 상대에게 위압을 가한다.
204708,id-112,,8,"La sua pelle, aimile a un’armatura, lo proteggeconsentendogli di vivere nel magma a 2.000 ºC."
223970,id-331,23,6,Es wächst an trockenen Orten mit weni9 Noederschlag.Nur einmal im Jahr bildet es eine gelbe Blüte.
206155,id-225,33,5,Il transporte de la nourriture toute la journée.Ses réserves de vivres auraient sauvé la viede n0mbreuses personnes en péril.
203802,id-45,,1,はなびらが　おおきいほど　たくさんかふんを　だすが　あたまがおもたくて　つかれてしまうという。
218222,rec-443-dup-0,33,6,Es mag enge Löcher in Höhlenwänden die derErdwärme ausgesetzt sind. Selbst wenn draußebein Schneestvrm wütet friert es dort nicht.
206333,id-240,,3,아직은 작고 겁이 많다.흥분하거나 놀라면코나 입에서 불꽃이 새어 나온다.
205863,id-197,34,3,
221943,rec-101-dup-0,32,4,
217484,rec-290-dup-0,,8,Gli capita di restare anche più di dieci anni5ottoterra. Assorbe le sostanze nutritivedalle radici degli alberi.
219830,rec-800-dup-0,34,7,Con sus rayos láser desrruye todo a su paso enbusca de luz pzra sustentarse.
225230,id-787,27,11,大木を　引き抜き　ブンブン振り回す。　草木を　茂らせてそのエネルギーを　吸収する。
224764,id-580,17,5,"Un Pokémon Oiseau doué p0ur la plongée.Il hage sous l’eau à la recherche desphaigne, son plat préféré."
208811,id-467,,12,由于栖息在火山口，因此身体逐渐变得像火山一样，还长着类似岩浆库的器官。
212134,id-706,,4,有時會因為無法理解訓練家的指令而目瞪口呆。那可愛的舉止讓牠深受歡迎。
208966,id-478,34,6,
212139,id-706,,9,"Sometimes it misunderstands instructions andappears dazed or bewildered. Many Trainersdon’t mind, finding this behavior to be adorable."
215158,id-890,33,8,"Si alimenta attraverso il nudleo sul suo petto,con cui assorbe l’energ'la emanata dalla terradella regione di Galar."
207054,id-319,,4,當牠嗅到獵物的氣味，就會從臀部噴射出海水，發動時速１２０公里的襲擊。
206979,id-309,33,9,
212869,id-756,34,9,"If you see a l'lght deep in a forest at nlght,don’t go near. Shiinotic will make you fallfast asleep."
207753,id-373,33,3,하늘을 나는 것을 꿈꿔온 결과날개를 가진 몸으로 진화하는 데성공한 희귀한 포켓몬.
207768,id-373,,8,"È generalmente di buon umore e traboccantedi gioia per essere riuscito a volare, ma se siarrabbia diventa una furia incontrollabile."
221034,rec-279-dup-1,33,7,Transporta a pequeñ0s Pokémon y Huevos en supico hasta lugaees seguros.
203326,id-9,,6,"Die Wassersalven, die es mit den Wasserdüsenin seinem Panzer abfeuert, durchdringen sogard9cke Stahlwände."
209963,id-564,34,3,
215227,id-893,34,7,
221217,rec-52-dup-0,33,1,
221814,rec-166-dup-0,,9,The spot patterns on its back grow larger or smallerdepending on the number of stars in the nlght sky.
204596,id-107,33,6,"Seine Fäuste zerschneiden regelrecht die Luft.Sie sind so schnell, dass selbst die geringsteBerührung Verbrennungen verursacht."
216731,rec-815-dup-0,34,12,拥有熟练的进攻和守技巧只要得到声援就会更有劲但有时会为了出风头而弄巧成拙
217128,rec-436-dup-0,33,6,
211735,id-686,33,5,
218404,rec-826-dup-0,34,9,It emits psychic energy to observe amd studywhats around it—and whsts around it caninclude things over six miles away.
213805,id-822,34,5,"Après avoir surmonté tant de rvdes combats,il a appris à déterminer avec précisionla puissance de ses sdversaires."
220138,rec-866-dup-1,34,7,Se ha granjeado la simpatía de todo el mundopor sus cómicos movimientos. Emite podere5psíquicos por el motivo de s8 barriga.
215720,rec-127-dup-0,34,1,
221300,rec-121-dup-0,,8,Quando scatena i suoi poteri psichici l0rganocentrale detto nucleo brilla di sette coloridiversi.
207802,id-375,34,1,じりょくで　そらを　とぶ。　けわしいさんがくを　ぬうように　こうそくでひこうして　えものを　おいつめる。
225002,id-670,23,9,It flutters around fields of fl0wers and cares forflowers that are starting to wilt. It drawsout the hidden power of flowers to battle.
218033,rec-343-dup-0,33,3,한 다리로 회전하면서이동한다. 거꾸로회전하는 오뚝군도 발견된다.
216549,rec-738-dup-1,34,8,Quando vola portando con sé vn Charjabugcome batteroa di riserva può sparare una rafficadi potentissimi raggi elettromagnetici.
207109,id-321,34,9,Its immense size is the reason for its popularity.Wailord watcbing is a favorite sightseeingactivity in carious parts of the world.
207500,id-350,,11,もっとも　美しい　ポケモンとも呼ばれ　多くの　芸術家にインスピレーションを　与えてきた。
206318,id-239,33,8,Quando si sta per scatenare vna tempe5ta perdeil controllo. Si fa prendere dall’agitazionese sente il rombo dei tuoni.
211336,id-643,33,6,Durch Feuerschübe aus seinem Schweif fliegt esschnell wie ein Düsenjet dvrch die Lüfte. SeimeFlammen sollen die Welt einäschern können.
205973,id-212,,3,커다란 집게의 무게는체중의 4분의 1이다. 내리치면암석도 일격에 산산조각이 난다.
218311,rec-271-dup-1,33,9,It is nocturnal and becomes active at nightfall.It feeds on aquatic mos5es that growin tbe riverbed.
214877,id-876,33,7,Percibe las emociones del objetivo con loscuernos de la fabeza. Los machos están atentosa cualquier co5a que necesite su Entrenador.
217557,rec-447-dup-0,33,5,Il possède assez dendurance pour passetdes nuits entières à courir. Il ext difficile de partiren balade avec lui tant il déborde dénergie.
205853,id-197,,3,화가 나면 전신의 모공으로부터독소가 섞인 땀을 뿜어내어상대의 눈을 노린다.
220378,rec-756-dup-0,33,4,用孢子閃爍著的光吸引獵物讓對m方睡著會從指尖吸收精氣
214179,id-841,33,9,"It ate a sour apple, and that induced itsevolution. In its dheeks, it stores an acidcapable of causlng chemical burns."
208950,id-477,,11,狙った　相手を　腹の口で丸飲み。　魂だけを　食い肉体は　吐き出し　去っていく。
210964,id-622,34,4,用黏土製成的寶可夢。即使現在也一直遵循著數千年前主人的命令。
224132,id-384,,6,Es lebt in der Ozonschicht hoch über den Wolkenund kann voiii Boden aus nicht gesehen werden.
218728,rec-445-dup-0,34,12,身手在陆地上也很矫捷在雪山上会赶在g身体冻僵前干掉猎物并返回住处
205141,id-134,,12,当水伊布开始微微颤动它全身上下的鳍，就表示几个小时之后要下雨了。
214865,id-875,34,5,"Ne supportarit pas la chaleur, il se rafraîch8ttoujours la tête avec de la glace.Il pêche de quoi se nourrir à l’aide de son cheveu."
204873,id-121,,3,강렬한 사이코 파워를 발산할 때코어라고 불리는 기관이일곱 색깔로 빛난다.
208510,id-449,,11,おもに　昼間に　活動する。砂漠の夜は　冷えるので　砂の奥深くに　潜って　眠る。
225271,id-795,,12,危险究极异兽中的一种。被人目击到以骇人的速度在大地狂奔的样子。
225270,id-795,27,11,
210483,id-595,,3,다른 포켓몬에게 달라붙어정전기를 빨아들인다. 멍파치의엉덩이에 자주 달라붙어 있다.
221172,rec-662-dup-0,,4,地盤意識很強且性情好戰火箭雀彼此之間也h會為了爭奪覓食的地方而戰鬥
205260,id-140,33,11,
224152,id-388,12,9,"It lives along water in for4sts. Inthe daytime, it leaves the forestt0 sunbathe its treed shell."
207482,id-349,34,1,
210039,id-568,33,9,"Its favorite places are unsanitary ones. If youleave trash lying around, y0u could even finclone of these Pokémon living in your room."
210687,id-608,34,7,"Se oculta en entornos urbanos haciéndose pasarpor una lámpara corriente. Si se topa con alg7ienm0ribundo, lo sigue en silencio."
213811,id-822,,12,经历无数次艰难的战斗后，它学会了该如何正确地判断敌人的力量。
205255,id-140,33,5,
221994,rec-300-dup-0,25,7,A Sk:tty le encanta mover cosas e ir detrás de ellas. Ea detodos sabido que se dedica a ir detrás de su propia cola yque al final acaba mareándose.
207239,id-337,33,9,The phase of the moon apparently haw someeffect on its power. It’s active on the night ofa full moon.
210387,id-589,,7,Ataca a los enemigos con sus lanzas. Aparecerepresentado eh pleno duelo contra un Sirfetch’den un famoso cuadro.
209871,id-559,34,12,用结实的皮保护身体。据说在皮伸展到极限时，它就会开始进化。
215065,id-885,,5,"Seul, il est si faible qu’il ne saurait rivaliser avecun enfant, mais en coopérant avec ses semblable5,il peut devenir assez fort pour évoluer."
211377,id-646,33,7,"Su poder supera al de Reshiram y Zrlcrom,pero permanece sellado por el frío extremoque genera."
209623,id-547,,3,햇빛을 받을수록 솜이부풀어 오른다. 너무 부풀면찢어져 주위로 흩어진다.
210373,id-589,,3,쪼마리의 껍질을 빼앗아 완전히무장했다. 가라르지방에서는매우 인기가 높다.
222953,id-46,27,12,
207202,id-333,,1,わたぐもに　みえるため　てきからみつかりにくい。　せだいを　かさねるうち　つばさが　しろくなったという。
216039,rec-67-dup-0,34,8,Ha un fisico vigoroso e instancabile. Ajutale persone a trasp0rtare carichi e a svolgerealtri lavori pesanti.
220665,rec-130-dup-0,,1,いちど　あばれだした　ギャラドスはあらしが　ふきすさんでいようともどんなものでも　やきつくしてしまう
225176,id-774,27,6,"Eigentlich lebt es in der Ozonschicht, dochwenn seine Scbale zu schwer wird, stürzt esauf die Erde."
223353,id-188,23,3,
216121,rec-636-dup-1,,1,はるか　むかしの　ひとびとはメラルバは　たいよう　からおっこちてきたと　しんじていた
223480,id-210,23,8,"Malgrado il suo aspetto, è molto timido. Se siarrabbia, tuttavia, cilpisce cori le sue enormi zanne."
203525,id-31,34,5,"Ce Pokémon calme les petit5 de son espèceen les plaçant entre ses épimes dorsales.Dans ce cas, elles ne libèrent pas de poison."
209178,id-520,,8,"È abbastanza veloce nel volo. Per quanto lontanosi spinga, riesce sempre a ritrovare il proprioriido e il proprio Allenatore."
206972,id-309,33,1,
212961,id-761,33,12,从它体内渗透出来的水果香气会强烈地刺激鸟宝可梦的食欲。
211288,id-638,34,8,È un leader nato. Al suo cospetto anchei Ppkémon più feroci assumono uriatteggiamento reverenziale.
221056,rec-704-dup-1,,11,体の　ほとんどが　水分乾燥すると　干からびてしまう最弱の　ドラゴンポケモン
213439,id-792,33,9,"Known as the Beast That Calls the Moon, thisPpkémon lives by taking in any and all light andconverting it into its own energy."
210730,id-610,,11,大きな　キバを　打ちつけ　仲間とじゃれあう。　キバは　折れてもすぐ　生えてくるから　へっちゃらだ。
209515,id-539,,5,Il cherche à tout prix à devenir plus fort.Il est conseiloé de ne pas le déranger quandil s’entraîne en montagne.
220614,rec-264-dup-0,,9,It uses its explosive speed and razor-sharp clawsto bring down prry. Running along windingpaths is not its strong suit.
205865,id-197,34,5,
212178,id-708,33,8,Questo Pokémon è nato quando l’anima cliun bambino smarritosi nel bo5co è entratanel ceppo di un albero.
217723,rec-744-dup-0,33,12,虽然很容易亲近但是因为它喜u欢乱咬所以培育起来也很伤神
207220,id-334,33,11,
222850,id-15,23,8,Possiede tre aculei velenosi sulle xampe anteriori esull’add0me con cui punge i nemici ripetutamente.
216926,rec-361-dup-1,33,6,Erscheint es mitten in der Nacht so sagt mansteht starjer Schneefall bevor. Es eenährt sichvon Eis und Schnee.
221622,rec-813-dup-1,,5,Il court pour augmenter sa température et fairecircvler lénergie incandescente dans son corps.Il peut ainsi déployer toute sa puissance.
212695,id-748,33,5,"Pour endurer les températures peu clémentesde Gslar, il forme un dôme hermétique avecses pzttes pour conserver sa chaleur corporelle."
208006,id-407,,6,"Das Gift aus seiner rechtem Hand wirkt sofort,das aus seiner linken langsam. Beide Giftekönnen tödlich sein."
210187,id-575,34,7,"Sus poderes psíqu:cos alcanzan su apogeo en laanoches estrelladas, aunque su posible vínculo conel espacio está envuelto en misterio."
208025,id-415,34,5,"Du lever du soleil à la tombée de la nuit,il récolte du nwctar pour Apireine et sa colonie."
204601,id-107,33,12,
209279,id-527,33,9,"While inside z cave, if you look up and see lotsof heart-shaped mwrks lining the walls, it’sevidence that Woobat live there."
210372,id-589,33,1,
213590,id-811,,11,激しい　ビートを　刻むことに夢中になる　あまり　戦いで相手が　気絶しても　気づかない。
224210,id-395,,1,ジェットスキーに　まけない　そくどでおよぐ。つばさの　へりは　するどくりゅうひょうを　せつだんする。
204189,id-73,34,9,"Its 80 tentacles cam stretch and shrink freely.Tentacruel ensnares prey in a net of spread-outtentacles, deljvering venomous stings to its catch."
208951,id-477,,12,用腹部的嘴将猎物整个吞下。只会吃掉对方的魂魄，离去时会把肉体吐出来。
205971,id-211,,12,全身上下的小针都是由鳞片变化而来的。如果被刺中的话，就会因中毒而昏迷。
211742,id-686,34,1,てきに　はっこうたいの　てんめつをあびせて　せんいを　なくしてしまう。その　すきに　にげだすのだ。
203271,id-6,,12,能用翅膀飞到距地面１４００米的高度。会吐出高温火焰。
217356,rec-826-dup-1,33,7,Este Pokémon es conocido por su inteli9encia.El gran tamaño de su cerebri es un indicio dela magnitud de sus poderes psíquicos.
222065,rec-86-dup-0,,3,두꺼운 지방 덕분에추운 바다는 문제없지만따뜻한 바다에서 쉽게 지친다.
204196,id-77,33,6,"Nach der Geburt fällt ihm das Laufen schwer.Doe Wettrennen, die es sjch mit seinen Freundenliefert, stärken jedoch seine Beinmuskulatur."
204239,id-79,33,9,"Slow-witted and obliviovs, this Pokémon won’tfeel any pain if its tail gets eaten. It won’t noticewhen its tail grows back, either."
203732,id-42,,1,いきものの　けつえきが　こうぶつ。はらぺこの　なかまに　すった　ちをわけあたえることも　あるという。
218086,rec-768-dup-0,33,5,Il ne recule devant rien pour gagner. Il profite delinattention de son adversaire pour lui administrerun coup clécisif de ses petites griffes ajtérieures.
211320,id-640,33,11,
220734,rec-728-dup-0,34,9,If Popplio want to create big powerful balloonsrhey must be persistent. It takes claily practice forthese Pokémon to develop their skills.
219477,rec-677-dup-0,34,1,
206197,id-227,33,7,Sus afiladas plumas son más cortantes wue el filode una espada. Tiene dlsputas territoriales muyagresivas con Corviknight.
203512,id-31,,1,せめるよりも　まもるほうが　とくい。よろいのような　ウロコで　いかなるこうげきからも　こどもを　まもる。
221658,rec-801-dup-0,,1,きかいじかけの　からだは　ただのうつわ　ソウルハートと　よばれるじんぞうの　たましいが　ほんたい
203641,id-37,,12,虽然还是幼崽，却有着６根美丽的尾巴。长大后，尾巴会变得更多。
210093,id-571,,3,동료애가 깊은 포켓몬이다.무서운 환상을 보게 만들어서거처나 무리를 지킨다.
219900,rec-865-dup-0,33,9,Only Farfetchd that have survived many battlescan attain this evolution. When this Pokém0n5leek withers it will retire from combat.
