tid,id,title,authors,venue,year
71932,journals/tods/HsuSY01,I/O reference behavior of production database workloads and the TPC benchmarks - an analysis at the logical level,"W Hsu, A Smith, H Young",ACM Trans. Database Syst.,2001
71939,journals/tods/LiC01,Answering queries with useful bindings,"C Li, E Chang",ACM Trans. Database Syst.,2001
71945,journals/tods/AndriesCPB01,Applying an update method to a set of receivers,"M Andries, L Cabibbo, J Paredaens, J Bussche",ACM Trans. Database Syst.,2001
71947,journals/tods/Suciu02,Distributed query evaluation on semistructured data,D Suciu,ACM Trans. Database Syst.,2002
71950,journals/tods/SchuldtABS02,Atomicity and isolation for transactional processes,"H Schuldt, G Alonso, C Beeri, H Schek",ACM Trans. Database Syst.,2002
71951,journals/tods/MamoulisP01,Multiway spatial joins,"N Mamoulis, D Papadias",ACM Trans. Database Syst.,2001
71956,journals/tods/EiterGM97,Disjunctive Datalog,"T Eiter, G Gottlob, H Mannila",ACM Trans. Database Syst.,1997
71957,journals/tods/TariSS97,Object Normal Forms and Dependency Constraints for Object-Oriented Schemata,"Z Tari, J Stokes, S Spaccapietra",ACM Trans. Database Syst.,1997
71961,journals/tods/LakshmananLRS97,ProbView: A Flexible Probabilistic Database System,"L Lakshmanan, N Leone, R Ross, V Subrahmanian",ACM Trans. Database Syst.,1997
71965,journals/tods/FormicaGM98,An Efficient Method for Checking Object-Oriented Database Schema Correctness,"A Formica, H Gr—ger, M Missikoff",ACM Trans. Database Syst.,1998
71966,journals/tods/Hellerstein98,Optimization Techniques for Queries with Expensive Methods,J Hellerstein,ACM Trans. Database Syst.,1998
71981,journals/tods/YanG99,The SIFT Information Dissemination System,"T Yan, H Garcia-Molina",ACM Trans. Database Syst.,1999
71985,journals/tods/ChaudhuriS99,Optimization of Queries with User-Defined Predicates,"S Chaudhuri, K Shim",ACM Trans. Database Syst.,1999
71986,journals/tods/CasatiCPP99,Specification and Implementation of Exceptions in Workflow Management Systems,"F Casati, S Ceri, S Paraboschi, G Pozzi",ACM Trans. Database Syst.,1999
71991,journals/vldb/LiangOY00,Optimizing Multiple Dimensional Queries Simultaneously in Multidimensional Databases,"W Liang, M Orlowska, J Yu",VLDB J.,2000
71997,journals/vldb/NgS98,Optimal Clip Ordering for Multi-Clip Queries,"R Ng, P Shum",VLDB J.,1998
72008,journals/vldb/FernandezFLS00,Declarative Specification of Web Sites with Strudel,"M Fernandez, D Florescu, A Levy, D Suciu",VLDB J.,2000
72009,journals/vldb/BerendtS00,Analysis of Navigation Behaviour in Web Sites Integrating Multiple Information Systems,"B Berendt, M Spiliopoulou",VLDB J.,2000
72035,journals/vldb/AbiteboulCM98,A Logical View of Structured Files,"S Abiteboul, S Cluet, T Milo",VLDB J.,1998
72044,journals/vldb/FahlR97,Query Processing Over Object Views of Relational Data,"G Fahl, T Risch",VLDB J.,1997
72047,journals/vldb/HansonCDERTX98,A Flexible and Recoverable Client/Server Database Event Notification System,"E Hanson, I Chen, R Dastur, K Engel, V Ramaswamy, W Tan, C Xu",VLDB J.,1998
72050,journals/vldb/DesslochHMMT98,"Advanced Data Processing in KRISYS: Modeling Concepts, Implementation Techniques, and Client/Server Issues","S DeÔloch, T Hðrder, N Mattos, B Mitschang, J Thomas",VLDB J.,1998
72055,journals/vldb/FengYLH02,A template model for multidimensional inter-transactional association rules,"L Feng, J Yu, H Lu, J Han",VLDB J.,2002
72062,journals/vldb/SaltenisJ02,Indexing of now-relative spatio-bitemporal data,"S Saltenis, C Jensen",VLDB J.,2002
72067,journals/vldb/ChandrasekaranF03,PSoup: a system for streaming queries over streaming data,"S Chandrasekaran, M Franklin",VLDB J.,2003
72069,journals/vldb/ShethTP03,Complex relationships and knowledge discovery support in the InfoQuilt system,"A Sheth, S Thacker, S Patel",VLDB J.,2003
72073,journals/vldb/CuiW03,Lineage tracing for general data warehouse transformations,"Y Cui, J Widom",VLDB J.,2003
72074,journals/vldb/ChienTZ02,Efficient schemes for managing multiversionXML documents,"S Chien, V Tsotras, C Zaniolo",VLDB J.,2002
72083,journals/vldb/LeeSC01,A graph-theoretic model for optimizing queries involving methods,"C Lee, C Shih, Y Chen",VLDB J.,2001
72089,journals/vldb/LiCHH01,Supporting efficient multimedia database exploration,"W Li, K Candan, K Hirata, Y Hara",VLDB J.,2001
72099,journals/vldb/LaurentLSV01,Monotonic complements for independent data warehouses,"D Laurent, J Lechtenb—rger, N Spyratos, G Vossen",VLDB J.,2001
72101,journals/vldb/RahmB01,A survey of approaches to automatic schema matching,"E Rahm, P Bernstein",VLDB J.,2001
72102,journals/vldb/TurkerG01,Semantic integrity support in SQL: 1999 and commercial (object-)relational database management systems,"C T■rker, M Gertz",VLDB J.,2001
72105,journals/vldb/ChangG01,Approximate query mapping: Accounting for translation closeness,"K Chang, H Garcia-Molina",VLDB J.,2001
72109,journals/vldb/PottingerH01,MiniCon: A scalable algorithm for answering queries using views,"R Pottinger, A Halevy",VLDB J.,2001
72112,journals/vldb/EyalM01,Integrating and customizing heterogeneous e-commerce applications,"A Eyal, T Milo",VLDB J.,2001
72123,journals/vldb/BeckerGOSW96,An Asymptotically Optimal Multiversion B-Tree,"B Becker, S Gschwind, T Ohler, B Seeger, P Widmayer",VLDB J.,1996
72127,journals/vldb/HarderR96,Access Path Support for Referential Integrity in SQL2,"T Hðrder, J Reinert",VLDB J.,1996
72133,journals/vldb/WhiteD95,QuickStore: A High Performance Mapped Object Store,"S White, D DeWitt",VLDB J.,1995
72135,journals/vldb/OzsuPSILM95,TIGUKAT: A Uniform Behavioral Objectbase Management System,"M øzsu, R Peters, D Szafron, B Irani, A Lipka, A Muþoz",VLDB J.,1995
72180,journals/sigmod/Snodgrass03a,TODS Reviewers,,,2003
72183,conf/vldb/BerckenS96,Query Processing Techniques for Multiversion Access Methods,"J Bercken, B Seeger",VLDB,1996
72185,conf/vldb/CareyHMW96,PESTO : An Integrated Query/Browser for Object Databases,"M Carey, L Haas, V Maganty, J Williams",VLDB,1996
72189,journals/sigmod/CampbellEM03,XML schema,"C Campbell, A Eisenberg, J Melton",SIGMOD Record,2003
72200,conf/vldb/Gawlick96,Scalablity and Availability in Oracle7 7.3,D Gawlick,VLDB,1996
72226,journals/sigmod/Aberer03a,"Report on the First International Conference on Ontologies, Databases and Applications of Semantics",,,2003
