tid,id,title,authors,venue,year
69611,conf/vldb/RusinkiewiczKTWM95,Towards a Cooperative Transaction Model - The Cooperative Activity Model,"M Rusinkiewicz, W Klas, T Tesch, J Wðsch, P Muth",VLDB,1995
69614,journals/sigmod/Liu02,Editor's Notes,L Liu,SIGMOD Record,2002
69615,journals/sigmod/Hammer02,Report on the ACM Fourth International Workshop on Data Warehousing and OLAP (DOLAP 2001),,,2002
69628,conf/vldb/MehtaD95,Managing Intra-operator Parallelism in Parallel Database Systems,"M Mehta, D DeWitt",VLDB,1995
69632,journals/sigmod/Aberer02,Book Review Column,K Aberer,SIGMOD Record,2002
69640,journals/sigmod/CiliaB02,An Active Functionality Service for E-Business Applications,"M Cilia, A Buchmann",SIGMOD Record,2002
69661,journals/sigmod/OrlandicLS02,The Design of a Retrieval Technique for High-Dimensional Data on Tertiary Storage,"R Orlandic, J Lukaszuk, C Swietlik",SIGMOD Record,2002
69680,conf/vldb/Galindo-LegariaPK94,"Fast, Randomized Join-Order Selection - Why Use Transformations?","C Galindo-Legaria, A Pellenkoft, M Kersten",VLDB,1994
69682,conf/vldb/WienerN94,Bulk Loading into an OODB: A Performance Study,"J Wiener, J Naughton",VLDB,1994
69684,journals/sigmod/Neven02,Automata Theory for XML Researchers,F Neven,SIGMOD Record,2002
69693,conf/vldb/Guting94,GraphDB: Modeling and Querying Graphs in Databases,R G■ting,VLDB,1994
69699,journals/sigmod/Winslett02b,Hector Garcia-Molina Speaks Out,M Winslett,,2002
69701,conf/vldb/BarjaPFWD94,An Effective Deductive Object-Oriented Database Through Language Integration,"M Barja, N Paton, A Fernandes, M Williams, A Dinn",VLDB,1994
69703,journals/sigmod/RossAJS02,Reminiscences on Influential Papers,,,2002
69704,conf/vldb/BaralisW94,An Algebraic Approach to Rule Analysis in Expert Database Systems,"E Baralis, J Widom",VLDB,1994
69705,journals/sigmod/FrankNS02,Report on the Semantic Web Workshop at WWW 2002,,,2002
69708,conf/vldb/HaberIL95,OPOSSUM: Desk-Top Schema Management through Customizable Visualization,"E Haber, Y Ioannidis, M Livny",VLDB,1995
69731,conf/vldb/CatozziR95,OS Support for VLDBs: Unix Enhancements for the Teradata Data Base,"J Catozzi, S Rabinovici",VLDB,1995
69752,journals/sigmod/ChienTZ01,XML Document Versioning,"S Chien, V Tsotras, C Zaniolo",SIGMOD Record,2001
69762,journals/sigmod/Bernstein01,Report on the 2001 SIGMOD and PODS Awards,,,2001
69763,journals/sigmod/BunemanFSW01,Constraints for Semi-structured Data and XML,"P Buneman, W Fan, J SimÕon, S Weinstein",SIGMOD Record,2001
69765,journals/sigmod/Liu01,Editor's Notes,,,2001
69784,conf/vldb/SripadaW94,Cumulative Updates,"S Sripada, B W■thrich",VLDB,1994
69792,journals/sigmod/ShanmugasundaramSKKVNT01,A General Techniques for Querying XML Documents using a Relational Database System,"J Shanmugasundaram, E Shekita, J Kiernan, R Krishnamurthy, S Viglas, J Naughton, I Tatarinov",SIGMOD Record,2001
69798,conf/vldb/AnandBH94,An Empirical Performance Study of the Ingres Search Accelerator for a Large Property Management Database System,"S Anand, D Bell, J Hughes",VLDB,1994
69800,conf/vldb/RosenthalS94,Data Integration in the Large: The Challenge of Reuse,"A Rosenthal, L Seligman",VLDB,1994
69803,conf/vldb/Bernstein94,PC Database Systems - Present and Future,P Bernstein,VLDB,1994
69814,journals/sigmod/Cardelli01,Describing Semistructured Data,L Cardelli,SIGMOD Record,2001
69822,conf/sigmod/ArasuG03,Extracting Structured Data from Web Pages,"A Arasu, H Garcia-Molina",SIGMOD Conference,2003
69825,journals/sigmod/Scholl01,Transactional Information Systems - Book Review,,,2001
69827,conf/sigmod/DeligiannakisR03,Extended Wavelets for Multiple Measures,"A Deligiannakis, N Roussopoulos",SIGMOD Conference,2003
69832,conf/sigmod/BenediktCFFR03,Capturing both Types and Constraints in Data Integration,"M Benedikt, C Chan, W Fan, J Freire, R Rastogi",SIGMOD Conference,2003
69837,journals/sigmod/Dogac02,Guest Editor's Introduction,,,2002
69839,conf/vldb/MatthesS94,Persistent Threads,"F Matthes, J Schmidt",VLDB,1994
69848,journals/sigmod/Bussler02,The Role of B2B Engines in B2B Integration Architectures,C Bussler,SIGMOD Record,2002
69859,journals/sigmod/GobleR02,Report on the 18th British National Conference on Databases (BNCOD),,,2002
69866,journals/sigmod/Snodgrass02,Why I Like Working in Academia,R Snodgrass,SIGMOD Record,2002
69874,journals/sigmod/GatziuJSV99,Design and Management of Data Warehouses: Report on the DMDW'99 Workshop,"S Gatziu, M Jeusfeld, M Staudt, Y Vassiliou",SIGMOD Record,1999
69875,conf/sigmod/WangPFY03,ViST: A Dynamic Index Method for Querying XML Data by Tree Structures,"H Wang, S Park, W Fan, P Yu",SIGMOD Conference,2003
69879,journals/sigmod/RossFLOSSVW00,Reminiscences on Influential Papers,,,2000
69883,conf/sigmod/JohnsonD03,Data Quality and Data Cleaning: An Overview,"T Johnson, T Dasu",SIGMOD Conference,2003
69886,conf/sigmod/GuptaLM03,BIRN-M: A Semantic Mediator for Solving Real-World Neuroscience Problems,"A Gupta, B Ludðscher, M Martone",SIGMOD Conference,2003
69896,conf/sigmod/Mamoulis03,Efficient Processing of Joins on Set-valued Attributes,N Mamoulis,SIGMOD Conference,2003
69904,conf/sigmod/AbiteboulBCMM03,Dynamic XML documents with distribution and replication,"S Abiteboul, A Bonifati, G Cobena, I Manolescu, T Milo",SIGMOD Conference,2003
69905,journals/sigmod/Franklin00,Editor's Notes,M Franklin,SIGMOD Record,2000
69911,conf/sigmod/DeHaanTCO03,A Comprehensive XQuery to SQL Translation using Dynamic Interval Encoding,"D DeHaan, D Toman, M Consens, M øzsu",SIGMOD Conference,2003
69918,conf/sigmod/SunAA03,Hardware Acceleration for Spatial Selections and Joins,"C Sun, D Agrawal, A Abbadi",SIGMOD Conference,2003
69920,journals/sigmod/KantM00,"Workshop on Performance and Architecture of Web Servers (PAWS-2000, held in conjection with SIGMETRICS-2000)",,,2000
69926,journals/sigmod/Naughton00,SIGMOD'2000 Program Chair's Message,,,2000
69930,conf/sigmod/CuiOTS03,Contorting High Dimensional Data for Efficient Main Memory Processing,"B Cui, B Ooi, J Su, K Tan",SIGMOD Conference,2003
69931,journals/sigmod/Snodgrass00a,Chair's Message,,,2000
69946,journals/sigmod/TheodoridisN00,Generating Spatiotemporal Datasets on the WWW,"Y Theodoridis, M Nascimento",SIGMOD Record,2000
69954,conf/sigmod/KimC03,Qcluster: Relevance Feedback Using Adaptive Clustering for Content-Based Image Retrieval,"D Kim, C Chung",SIGMOD Conference,2003
69958,conf/sigmod/Pruscino03,Oracle RAC: Architecture and Performance,A Pruscino,SIGMOD Conference,2003
69961,conf/sigmod/Cabrera03,The Future of Web services - II,F Cabrera,SIGMOD Conference,2003
69965,journals/sigmod/YuenCLL00,Cache Invalidation Scheme for Mobile Computing Systems with Real-time Data,"J Yuen, E Chan, K Lam, H Leung",SIGMOD Record,2000
69969,conf/sigmod/StoltePAG03,Scientific Data Repositories: Designing for a Moving Target,"E Stolte, C Praun, G Alonso, T Gross",SIGMOD Conference,2003
69975,conf/sigmod/ZhangZPTL03,Location-based Spatial Queries,"J Zhang, M Zhu, D Papadias, Y Tao, D Lee",SIGMOD Conference,2003
69982,journals/sigmod/FengJH01,Towards Knowledge-Based Digital Libraries,"L Feng, M Jeusfeld, J Hoppenbrouwers",SIGMOD Record,2001
69985,journals/sigmod/Critchlow01,Report on XEWA-00: The XML Enabled Wide-Area Searches for Bioinformatics Workshop,,,2001
69988,conf/sigmod/MelnikRB03,Rondo: A Programming Platform for Generic Model Management,"S Melnik, E Rahm, P Bernstein",SIGMOD Conference,2003
69998,journals/sigmod/ChristoffelPSL98,Electronic Market: The Roadmap for University Libraries and Members to Survive in the Information Jungle,"M Christoffel, S Pulkowski, B Schmitt, P Lockemann",SIGMOD Record,1998
70003,conf/sigmod/Grust02,Accelerating XPath location steps,T Grust,SIGMOD Conference,2002
70008,conf/sigmod/OlstonW02,Best-effort cache synchronization with source cooperation,"C Olston, J Widom",SIGMOD Conference,2002
70012,journals/sigmod/BollKB98,Design and Implementation of RMP - A Virtual Electronic Market Place,"S Boll, W Klas, B Battaglin",SIGMOD Record,1998
70013,journals/sigmod/ReichB98,A Componentized Architecture for Dynamic Electronic Markets,"B Reich, I Ben-Shaul",SIGMOD Record,1998
70019,journals/sigmod/Dogac98,Guest Editor's Introduction,,,1998
70020,conf/sigmod/GraySSU03,The Lowell Report,"J Gray, H Schek, M Stonebraker, J Ullman",SIGMOD Conference,2003
70023,conf/sigmod/KornMZ03,IPSOFACTO: A Visual Correlation Tool for Aggregate Network Traffic Data,"F Korn, S Muthukrishnan, Y Zhu",SIGMOD Conference,2003
70026,conf/sigmod/SengarH03,PLASTIC: Reducing Query Optimization Overheads through Plan Recycling,"V Sengar, J Haritsa",SIGMOD Conference,2003
70030,conf/sigmod/ZhuSZ03,Query by Humming - in Action with its Technology Revealed,"Y Zhu, D Shasha, X Zhao",SIGMOD Conference,2003
70032,journals/sigmod/NascimentoM99,Report on the 13th Brazilian Symposium on Database Systems (SBBD'98),,,1999
70038,conf/sigmod/ZhouWGGZWXYF03,TREX: DTD-Conforming XML to XML Transformations,"A Zhou, Q Wang, Z Guo, X Gong, S Zheng, H Wu, J Xiao, K Yue, W Fan",SIGMOD Conference,2003
70041,journals/sigmod/EisenbergM99,"SQL: 1999, formerly known as SQL 3","A Eisenberg, J Melton",SIGMOD Record,1999
70044,conf/sigmod/Amer-YahiaFSX03,PIX: Exact and Approximate Phrase Matching in XML,"S Amer-Yahia, M Fernandez, D Srivastava, Y Xu",SIGMOD Conference,2003
70051,conf/sigmod/OoiTZGLLLNSWZ03,PeerDB: Peering into Personal Databases,"B Ooi, K Tan, A Zhou, C Goh, Y Li, C Liau, B Ling, W Ng, Y Shu, X Wang, M Zhang",SIGMOD Conference,2003
70065,conf/sigmod/2002,"Proceedings of the 2002 ACM SIGMOD International Conference on Management of Data, Madison, Wisconsin, June 3-6, 2002",,,2002
70083,conf/sigmod/KarbhariRXD02,ACDN: a content delivery network for applications,"P Karbhari, M Rabinovich, Z Xiao, F Douglis",SIGMOD Conference,2002
70091,conf/sigmod/DogacTPPLKTK02,An ebXML infrastructure implementation through UDDI registries and RosettaNet PIPs,"A Dogac, Y Tambag, P Pembecioglu, S Pektas, G Laleci, G Kurt, S Toprak, Y Kabak",SIGMOD Conference,2002
70094,journals/sigmod/Franklin99a,Editor's Notes,M Franklin,SIGMOD Record,1999
70096,journals/sigmod/ConradHHKRSS99,Engineering Federated Information Systems: Report of EFIS '99 Workshop,"S Conrad, W Hasselbring, U Hohenstein, R Kutsche, M Roantree, G Saake, F Saltor",SIGMOD Record,1999
70098,conf/sigmod/RaoZML02,Automating physical database design in a parallel database,"J Rao, C Zhang, N Megiddo, G Lohman",SIGMOD Conference,2002
70108,conf/sigmod/MoonWH02,General match: a subsequence matching method in time-series databases based on generalized windows,"Y Moon, K Whang, W Han",SIGMOD Conference,2002
70120,journals/sigmod/MusickC99,Practical Lessons in Supporting Large-Scale Computational Science,"R Musick, T Critchlow",SIGMOD Record,1999
70127,conf/sigmod/ChenGMV02,Fractal prefetching BÝTrees: optimizing both cache and disk performance,"S Chen, P Gibbons, T Mowry, G Valentin",SIGMOD Conference,2002
70129,conf/sigmod/ZhouR02,Implementing database operations using SIMD instructions,"J Zhou, K Ross",SIGMOD Conference,2002
70134,conf/sigmod/LiGS02,Skew handling techniques in sort-merge join,"W Li, D Gao, R Snodgrass",SIGMOD Conference,2002
70137,conf/sigmod/PapakonstantinouPV02,QURSED: querying and reporting semistructured data,"Y Papakonstantinou, M Petropoulos, V Vassalos",SIGMOD Conference,2002
70142,conf/sigmod/GillmannWW02,Workflow management with service quality guarantees,"M Gillmann, G Weikum, W Wonner",SIGMOD Conference,2002
70153,journals/sigmod/GuptaHR97,Virtual Database technology,"A Gupta, V Harinarayan, A Rajaraman",SIGMOD Record,1997
70169,journals/sigmod/SilberschatzZ97,Database Systems - Breaking Out of the Box,"A Silberschatz, S Zdonik",SIGMOD Record,1997
70172,journals/sigmod/Fong97,Converting Relational to Object-Oriented Databases,J Fong,SIGMOD Record,1997
70188,journals/sigmod/AtzeniM98,WebDB '98: International Workshop on the Web and Databases,,,1998
70200,conf/sigmod/GarofalakisGR02,Querying and mining data streams: you only get one look a tutorial,,,2002
70205,journals/sigmod/BurtonM98,Applications of the JAVA Programming Language to Database Management,"B Burton, V Marek",SIGMOD Record,1998
70209,conf/sigmod/SlivinskasJS01,Adaptable Query Optimization and Evaluation in Temporal Middleware,"G Slivinskas, C Jensen, R Snodgrass",SIGMOD Conference,2001
70229,conf/sigmod/CandanLLHA01,Enabling Dynamic Content Caching for Database-Driven Web Sites,"K Candan, W Li, Q Luo, W Hsiung, D Agrawal",SIGMOD Conference,2001
70236,conf/sigmod/HanPDW01,Efficient Computation of Iceberg Cubes with Complex Measures,"J Han, J Pei, G Dong, K Wang",SIGMOD Conference,2001
70243,journals/sigmod/KoksalAD98,Workflow History Management,"P Koksal, S Arpinar, A Dogac",SIGMOD Record,1998
70254,conf/sigmod/AfratiLU01,Generating Efficient Plans for Queries Using Views,"F Afrati, C Li, J Ullman",SIGMOD Conference,2001
70258,journals/sigmod/NormanZT96,Much Ado About Shared-Nothing,"M Norman, T Zurek, P Thanisch",SIGMOD Record,1996
70259,journals/sigmod/BestavrosLS96,Report on First International Workshop on Real-Time Database Systems,,,1996
70263,conf/sigmod/StonebrakerH01,Content Integration for E-Business,"M Stonebraker, J Hellerstein",SIGMOD Conference,2001
70265,conf/sigmod/ShahC01,"Fault-tolerant, Load-balancing Queries in Telegraph","M Shah, S Chandrasekaran",SIGMOD Conference,2001
70266,journals/sigmod/BilirisP96,The BeSS Object Storage Manager: Architecture Overview,"A Biliris, E Panagos",SIGMOD Record,1996
70280,journals/sigmod/AndlerHEMBE96,DeeDS Towards a Distributed and Active Real-Time Database System,"S Andler, J Hansson, J Eriksson, J Mellin, M Berndtsson, B Eftring",SIGMOD Record,1996
70282,conf/sigmod/GionisGK01,Efficient and Tunable Similar Set Retrieval,"A Gionis, D Gunopulos, N Koudas",SIGMOD Conference,2001
70293,journals/sigmod/SonDT96,Improving Timeliness in Real-Time Secure Database Systems,"S Son, R David, B Thuraisingham",SIGMOD Record,1996
70312,conf/sigmod/YuMWL01,Efficient and Effective Metasearch for Text Databases Incorporating Linkages among Documents,"C Yu, W Meng, W Wu, K Liu",SIGMOD Conference,2001
70313,journals/sigmod/Qian96,"Shutdown, Budget, and Funding",X Qian,SIGMOD Record,1996
70317,journals/sigmod/TomasicS97,Improving Access to Environmental Data Using Context Information,"A Tomasic, E Simon",SIGMOD Record,1997
70329,journals/sigmod/RiekertMW97,Management of Data and Services in the Environmental Information System (UIS) of Baden-W■rttemberg,"W Riekert, R Mayer-F—ll, G Wiest",SIGMOD Record,1997
70336,conf/sigmod/JoshiA01,Mining Needle in a Haystack: Classifying Rare Classes via Two-phase Rule Induction,"M Joshi, R Agarwal",SIGMOD Conference,2001
70356,journals/sigmod/Keim96,Pixel-oriented Database Visualizations,D Keim,SIGMOD Record,1996
70372,conf/sigmod/CatarciS01,The Prototype of the DARE System,"T Catarci, G Santucci",SIGMOD Conference,2001
70375,conf/sigmod/Rosenthal01,Will Database Researchers Have ANY Role in Data Security? (Panel Abstract),A Rosenthal,SIGMOD Conference,2001
70376,journals/sigmod/Qian96b,New Programs at DARPA and NSF,X Qian,SIGMOD Record,1996
70398,conf/sigmod/CorralMTV00,Closest Pair Queries in Spatial Databases,"A Corral, Y Manolopoulos, Y Theodoridis, M Vassilakopoulos",SIGMOD Conference,2000
70399,conf/sigmod/RoySSB00,Efficient and Extensible Algorithms for Multi Query Optimization,"P Roy, S Seshadri, S Sudarshan, S Bhobe",SIGMOD Conference,2000
70409,journals/sigmod/DogacDKOONEHAKKM95,METU Interoperable Database System,"A Dogac, C Dengi, E Kilic, G øzhan, F Ozcan, S Nural, C Evrendilek, U Halici, I Arpinar, P Koksal, N Kesim, S Mancuhan",SIGMOD Record,1995
70414,conf/sigmod/GillmannWSWW00,A Goal-driven Auto-Configuration Tool for the Distributed Workflow Management System Mentor-lite,"M Gillmann, J WeiÔenfels, G Shegalov, W Wonner, G Weikum",SIGMOD Conference,2000
70417,journals/sigmod/BohmR94,Metadata for Multimedia Documents,"K B—hm, T Rakow",SIGMOD Record,1994
70418,conf/sigmod/OriaOILY00,DISIMA: A Distributed and Interoperable Image Database System,"V Oria, M øzsu, P Iglinski, S Lin, B Yao",SIGMOD Conference,2000
70425,conf/sigmod/ShenoyHSBBS00,Turbo-charging Vertical Mining of Large Databases,"P Shenoy, J Haritsa, S Sudarshan, G Bhalotia, M Bawa, D Shah",SIGMOD Conference,2000
70428,conf/sigmod/HsiaoN00,DLFM: A Transactional Resource Manager,"H Hsiao, I Narang",SIGMOD Conference,2000
70429,journals/sigmod/SchlageterBHMSW95,The Database Group at University of Hagen (FernUniversitaet),"G Schlageter, T Berkel, E Heuel, S Mittrach, A Scherer, W Wilkes",SIGMOD Record,1995
70431,conf/sigmod/Jhingran00,Anatomy of a Real E-Commerce System,A Jhingran,SIGMOD Conference,2000
70434,journals/sigmod/Qian95,Political Winds Change Direction Again,X Qian,SIGMOD Record,1995
70435,conf/sigmod/ChenDLT00,Fact: A Learning Based Web Query Processing System,"S Chen, Y Diao, H Lu, Z Tian",SIGMOD Conference,2000
70438,conf/sigmod/WangSSZZW00,An Approximate Search Engine for Structural Databases,"J Wang, X Wang, D Shasha, B Shapiro, K Zhang, X Zheng, Q Ma, Z Weinberg",SIGMOD Conference,2000
70442,journals/sigmod/DarwenD95,The Third Manifesto,"H Darwen, C Date",SIGMOD Record,1995
70447,journals/sigmod/EnglertGH95,Parallelism and its Price: A Case Study of NonStop SQL/MP,"S Englert, R Glasstone, W Hasan",SIGMOD Record,1995
70449,journals/sigmod/VenkatraoP95,SQL/CLI - A New Binding Style for SQL,"M Venkatrao, M Pizzo",SIGMOD Record,1995
70457,conf/sigmod/SaltenisJLL00,Indexing the Positions of Continuously Moving Objects,"S Saltenis, C Jensen, S Leutenegger, M Lopez",SIGMOD Conference,2000
70469,conf/sigmod/KornM00,Influence Sets Based on Reverse Nearest Neighbor Queries,"F Korn, S Muthukrishnan",SIGMOD Conference,2000
70472,journals/sigmod/Widom95a,Editor's Notes,J Widom,SIGMOD Record,1995
70474,conf/sigmod/GarofalakisGRSS00,XTRACT: A System for Extracting Document Type Descriptors from XML Documents,"M Garofalakis, A Gionis, R Rastogi, S Seshadri, K Shim",SIGMOD Conference,2000
70483,conf/sigmod/BlakeleyD00,Tutorial: Data Access,,,2000
70492,journals/sigmod/Wong95,An Introduction to Remy's Fast Polymorphic Record Projection,L Wong,SIGMOD Record,1995
70496,conf/sigmod/JagadishKS00,On Effective Multi-Dimensional Indexing for Strings,"H Jagadish, N Koudas, D Srivastava",SIGMOD Conference,2000
70497,journals/sigmod/Widom95,Editor's Notes,J Widom,SIGMOD Record,1995
70502,journals/sigmod/Finkelstein95,The New Middleware,R Finkelstein,SIGMOD Record,1995
70506,conf/sigmod/LehnerSPC00,Maintenance of Automatic Summary Tables,"W Lehner, R Sidle, H Pirahesh, R Cochrane",SIGMOD Conference,2000
70509,journals/sigmod/Winslett94,Progress on HPCC and NII,M Winslett,SIGMOD Record,1994
70513,journals/tods/LakshmananLN03,Efficient dynamic mining of constrained frequent sets,"L Lakshmanan, C Leung, R Ng",ACM Trans. Database Syst.,2003
70514,conf/sigmod/AggarwalPWYP99,Fast Algorithms for Projected Clustering,"C Aggarwal, C Procopiuc, J Wolf, P Yu, J Park",SIGMOD Conference,1999
70518,conf/sigmod/Rodriguez-Martinez00,MOCHA: A Database Middleware System Featuring Automatic Deployment of Application-Specific Functionality,"M Rodriguez-Martinez, N Roussopoulos, J McGann, S Kelley, V Katz, Z Song, J JÃJÃ",SIGMOD Conference,2000
70524,journals/sigmod/DreyerDS94,Research Perspectives for Time Series Management Systems,"W Dreyer, A Dittrich, D Schmidt",SIGMOD Record,1994
70551,conf/sigmod/AggarwalWY99,A New Method for Similarity Indexing of Market Basket Data,"C Aggarwal, J Wolf, P Yu",SIGMOD Conference,1999
70565,journals/tods/GunopulosKMSTS03,Discovering all most specific sentences,"D Gunopulos, R Khardon, H Mannila, S Saluja, H Toivonen, R Sharm",ACM Trans. Database Syst.,2003
70569,conf/sigmod/AdaliSS99,A Multimedia Presentation Algebra,"S Adali, M Sapino, V Subrahmanian",SIGMOD Conference,1999
70585,journals/sigmod/Group94,"Response to the March 1994 ODMG-93 Commentary Written by Dr. Won Kim of UniSQL, Inc",O Group,SIGMOD Record,1994
70601,conf/sigmod/Mohan99,A Database Perspective on Lotus Domino/Notes,C Mohan,SIGMOD Conference,1999
70607,conf/sigmod/AcharyaGPR99a,Join Synopses for Approximate Query Answering,"S Acharya, P Gibbons, V Poosala, S Ramaswamy",SIGMOD Conference,1999
70620,conf/sigmod/LakshmananNHP99,Optimization of Constrained Frequent Set Queries with 2-variable Constraints,"L Lakshmanan, R Ng, J Han, A Pang",SIGMOD Conference,1999
70629,journals/sigmod/Qian94,Jumping on the NII Bandwagon,X Qian,SIGMOD Record,1994
70630,conf/sigmod/AnkerstBKS99,OPTICS: Ordering Points To Identify the Clustering Structure,"M Ankerst, M Breunig, H Kriegel, J Sander",SIGMOD Conference,1999
70631,journals/sigmod/Alonso94a,Trade Press News,,,1994
70644,conf/sigmod/DoRD99,The Need for Distributed Asynchronous Transactions,"L Do, P Ram, P Drew",SIGMOD Conference,1999
70647,conf/vldb/MeccaCM01,RoadRunner: Towards Automatic Data Extraction from Large Web Sites,"V Crescenzi, G Mecca, P Merialdo",VLDB,2001
70648,conf/sigmod/AdelbergD99,Nodose Version 2.0,"B Adelberg, M Denny",SIGMOD Conference,1999
70651,conf/sigmod/LiVCAHMWBCHIKSS99,"PowerBookmarks: A System for Personalizable Web Information Organization, Sharing, and Management","W Li, Q Vu, E Chang, D Agrawal, K Hirata, S Mukherjea, Y Wu, C Bufi, K Chang, Y Hara, R Ito, Y Kimura, K Shimazu, Y Saito",SIGMOD Conference,1999
70652,conf/vldb/MargaritisFT01,NetCube: A Scalable Tool for Fast Data Mining and Compression,"D Margaritis, C Faloutsos, S Thrun",VLDB,2001
70661,conf/vldb/ShanmugasundaramKSFF01,Querying XML Views of Relational Data,"J Shanmugasundaram, J Kiernan, E Shekita, C Fan, J Funderburk",VLDB,2001
70662,conf/sigmod/BonnetBCCCHKMMOSS99,The Cornell Jaguar System: Adding Mobility to PREDATOR,"P Bonnet, K Buza, Z Chen, V Cheng, R Chung, T Hickey, R Kennedy, D Mahashin, T Mayr, I Oprencak, P Seshadri, H Siu",SIGMOD Conference,1999
70674,conf/sigmod/LabioYG99,Shrinking the Warehouse Update Window,"W Labio, R Yerneni, H Garcia-Molina",SIGMOD Conference,1999
70675,conf/sigmod/PapakonstantinouV99,Query Rewriting for Semistructured Data,"Y Papakonstantinou, V Vassalos",SIGMOD Conference,1999
70678,conf/sigmod/DeutschFS99,Storing Semistructured Data with STORED,"A Deutsch, M Fernandez, D Suciu",SIGMOD Conference,1999
70679,conf/vldb/ZengBNN01,AgFlow: Agent-based Cross-Enterprise Workflow Management System,"L Zeng, B Benatallah, P Nguyen, A Ngu",VLDB,2001
70682,conf/sigmod/EmbleyJN99,Record-Boundary Discovery in Web Documents,"D Embley, Y Jiang, Y Ng",SIGMOD Conference,1999
70683,conf/vldb/StillgerLMK01,LEO - DB2's LEarning Optimizer,"M Stillger, G Lohman, V Markl, M Kandil",VLDB,2001
70686,conf/sigmod/GarofalakisRRS99,"Of Crawlers, Portals, Mice and Men: Is there more to Mining the Web? (Panel)","M Garofalakis, S Ramaswamy, R Rastogi, K Shim",SIGMOD Conference,1999
70687,conf/sigmod/Suciu99,Managing Web Data,,,1999
70689,conf/sigmod/Chakrabarti99,Hypertext Databases and Data Mining,,,1999
70702,conf/vldb/AboulnagaAN01,Estimating the Selectivity of XML Path Expressions for Internet Scale Applications,"A Aboulnaga, A Alameldeen, J Naughton",VLDB,2001
70703,conf/vldb/YangG01,Comparing Hybrid Peer-to-Peer Systems,"B Yang, H Garcia-Molina",VLDB,2001
70720,conf/vldb/Shmueli01,Architectures for Internal Web Services Deployment,O Shmueli,VLDB,2001
70729,conf/sigmod/Aulakh98,About Quark Digital Media System,K Aulakh,SIGMOD Conference,1998
70739,conf/vldb/WaasCB01,FeedbackBypass: A New Approach to Interactive Similarity Query Processing,"I Bartolini, P Ciaccia, F Waas",VLDB,2001
70744,conf/sigmod/GuhaRS98,CURE: An Efficient Clustering Algorithm for Large Databases,"S Guha, R Rastogi, K Shim",SIGMOD Conference,1998
70747,conf/sigmod/KotidisR98,An Alternative Storage Organization for ROLAP Aggregate Views Based on Cubetrees,"Y Kotidis, N Roussopoulos",SIGMOD Conference,1998
70750,conf/vldb/BerckenS01,An Evaluation of Generic Bulk Loading Techniques,"J Bercken, B Seeger",VLDB,2001
70751,conf/vldb/AnSVKIG01,Analyzing energy behavior of spatial access methods for memory-resident data,"N An, A Sivasubramaniam, N Vijaykrishnan, M Kandemir, M Irwin, S Gurumurthi",VLDB,2001
70760,conf/vldb/ManolopoulosT01,C2P: Clustering based on Closest Pairs,"A Nanopoulos, Y Theodoridis, Y Manolopoulos",VLDB,2001
70762,conf/vldb/TanEO01,Efficient Progressive Skyline Computation,"K Tan, P Eng, B Ooi",VLDB,2001
70763,conf/vldb/AgrawalCN00,Automated Selection of Materialized Views and Indexes in SQL Databases,"S Agrawal, S Chaudhuri, V Narasayya",VLDB,2000
70765,conf/sigmod/PapadopoulosM98,Similarity Query Processing Using Disk Arrays,"A Papadopoulos, Y Manolopoulos",SIGMOD Conference,1998
70769,conf/vldb/PantiSG00,A Case-Based Approach to Information Integration,"M Panti, L Spalazzi, A Giretti",VLDB,2000
70771,conf/sigmod/SeidlK98,Optimal Multi-Step k-Nearest Neighbor Search,"T Seidl, H Kriegel",SIGMOD Conference,1998
70777,conf/vldb/DuttaDMRT00,Demonstration: Enabling Scalable Online Personalization on the Web,"K Dutta, A Datta, D VanderMeer, K Ramamritham, H Thomas",VLDB,2000
70794,conf/vldb/Tsur00,Data Mining in the Bioinformatics Domain,S Tsur,VLDB,2000
70797,conf/vldb/X00a,Author Index,,VLDB,2000
70806,conf/sigmod/Brewer98,Delivering High Availability for Inktomi Search Engines,E Brewer,SIGMOD Conference,1998
70807,conf/sigmod/OlstonWACELSS98,DataSplash,"C Olston, A Woodruff, A Aiken, M Chu, V Ercegovac, M Lin, M Spalding, M Stonebraker",SIGMOD Conference,1998
70809,conf/sigmod/LiuPTBBZBHY98,CQ: A Personalized Update Monitoring Toolkit,"L Liu, C Pu, W Tang, D Buttler, J Biggs, T Zhou, P Benninghoff, W Han, F Yu",SIGMOD Conference,1998
70812,conf/vldb/PardonA00,CheeTah: a Lightweight Transaction Server for Plug-and-Play Internet Data Management,"G Pardon, G Alonso",VLDB,2000
