tid,id,title,authors,venue,year
70816,conf/sigmod/BerchtoldBK98,The Pyramid-Technique: Towards Breaking the Curse of Dimensionality,"S Berchtold, C B—hm, H Kriegel",SIGMOD Conference,1998
70827,conf/vldb/CareyKRLABFLOPQRSSUVWY01,The Propel Distributed Services Platform,"M Carey, S Kirsch, M Roth, B Linden, N Adiba, M Blow, D Florescu, D Li, I Oprencak, R Panwar, R Qi, D Rieber, J Shafer, B Sterling, T Urhan, B Vickery, D Wineman, K Yee",VLDB,2001
70845,conf/vldb/AmbiteKKMST01,The WorlInfo Assistant: Spatio-Temporal Information Integration on the Web,"J Ambite, C Knoblock, M Kolahdouzan, M Muslea, C Shahabi, S Thakkar",VLDB,2001
70846,conf/sigmod/BrinMUT97,Dynamic Itemset Counting and Implication Rules for Market Basket Data,"S Brin, R Motwani, J Ullman, S Tsur",SIGMOD Conference,1997
70850,conf/vldb/KoschBBHHLRT01,SMOOTH - A Distributed Multimedia Database System,"H Kosch, L B—sz—rmÕnyi, A Bachlechner, C Hanin, C Hofbauer, M Lang, C Riedler, R Tusch",VLDB,2001
70853,conf/vldb/YagoubFIV00a,Building and Customizing Data-Intensive Web Sites Using Weave,"K Yagoub, D Florescu, V Issarny, P Valduriez",VLDB,2000
70862,conf/sigmod/Eaton98,Managing Large Systems with DB2 UDB,C Eaton,SIGMOD Conference,1998
70864,conf/sigmod/ReinwaldP98,SQL Open Heterogeneous Data Access,"B Reinwald, H Pirahesh",SIGMOD Conference,1998
70866,conf/sigmod/BlakeleyP98,Microsoft Universal Data Access Platform,"J Blakeley, M Pizzo",SIGMOD Conference,1998
70876,conf/vldb/Duranti01,The Long-Term Preservation of Authentic Electronic Records,L Duranti,VLDB,2001
70879,conf/vldb/MarronL01,On Processing XML in LDAP,"P Marrµn, G Lausen",VLDB,2001
70883,conf/vldb/BonifatiCDS01,Warehousing Workflow Data: Challenges and Opportunities,"A Bonifati, F Casati, U Dayal, M Shan",VLDB,2001
70898,conf/sigmod/GravanoCGP97,STARTS: Stanford Proposal for Internet Meta-Searching (Experience Paper),"L Gravano, K Chang, H Garcia-Molina, A Paepcke",SIGMOD Conference,1997
70901,conf/sigmod/Arpaci-DusseauACHP97,High-Performance Sorting on Networks of Workstations,"A Arpaci-Dusseau, R Arpaci-Dusseau, D Culler, J Hellerstein, D Patterson",SIGMOD Conference,1997
70902,conf/vldb/CasatiS00,Process Automation as the Foundation for E-Business,"F Casati, M Shan",VLDB,2000
70904,conf/sigmod/KoudasS97,Size Separation Spatial Join,"N Koudas, K Sevcik",SIGMOD Conference,1997
70908,conf/vldb/Ladin00,The Zero Latency Enterprise,D Liles,VLDB,2000
70911,conf/vldb/Deshpande00,Linking Business to Deliver Value: A Data Management Challenge,A Deshpande,VLDB,2000
70912,conf/sigmod/MumickQM97,Maintenance of Data Cubes and Summary Tables in a Warehouse,"I Mumick, D Quass, B Mumick",SIGMOD Conference,1997
70919,conf/sigmod/AdelbergGW97,The STRIP Rule System For Efficiently Maintaining Derived Data,"B Adelberg, H Garcia-Molina, J Widom",SIGMOD Conference,1997
70924,conf/sigmod/YangM97,Association Rules over Interval Data,"R Miller, Y Yang",SIGMOD Conference,1997
70932,conf/sigmod/LivnyRBCDLMW97a,DEVise: Integrated Querying and Visual Exploration of Large Datasets (Demo Abstract),"M Livny, R Ramakrishnan, K Beyer, G Chen, D Donjerkovic, S Lawande, J Myllymaki, R Wenger",SIGMOD Conference,1997
70936,conf/vldb/CarusoCGLM00,Telcordia's Database Reconciliation and Data Quality Analysis Tool,"F Caruso, M Cochinwala, U Ganapathy, G Lalk, P Missier",VLDB,2000
70937,conf/sigmod/ChawatheG97,Meaningful Change Detection in Structured Data,"S Chawathe, H Garcia-Molina",SIGMOD Conference,1997
70943,conf/sigmod/LivnyRBCDLMW97,DEVise: Integrated Querying and Visualization of Large Datasets,"M Livny, R Ramakrishnan, K Beyer, G Chen, D Donjerkovic, S Lawande, J Myllymaki, R Wenger",SIGMOD Conference,1997
70962,conf/sigmod/SeshadriP97,PREDATOR: An OR-DBMS with Enhanced Data Types,"P Seshadri, M Paskin",SIGMOD Conference,1997
70970,conf/vldb/ManegoldBK00,What Happens During a Join? Dissecting CPU and Memory Optimization Effects,"S Manegold, P Boncz, M Kersten",VLDB,2000
70974,conf/sigmod/BohrerBBCFHKKMNRRSUUW97a,The InfoSleuth Project,"R Jr., W Bohrer, R Brice, A Cichocki, J Fowler, A Helal, V Kashyap, T Ksiezyk, G Martin, M Nodine, M Rashid, M Rusinkiewicz, R Shea, C Unnikrishnan, A Unruh, D Woelk",SIGMOD Conference,1997
70977,conf/vldb/SrinivasanDFCJYKTDB00,Oracle8i Index-Organized Table and Its Application to New Domains,"J Srinivasan, S Das, C Freiwald, E Chong, M Jagannath, A Yalamanchi, R Krishnan, A Tran, S DeFazio, J Banerjee",VLDB,2000
70982,conf/vldb/RamsakMFZEB00,Integrating the UB-Tree into a Database System Kernel,"F Ramsak, V Markl, R Fenk, M Zirkel, K Elhardt, R Bayer",VLDB,2000
71020,conf/sigmod/GrayHOS96,The Dangers of Replication and a Solution,"J Gray, P Helland, P O'Neil, D Shasha",SIGMOD Conference,1996
71025,conf/sigmod/MogiK96,Hot Mirroring: A Study to Hide Parity Upgrade Penalty and Degradations During Rebuilds for RAID5,"K Mogi, M Kitsuregawa",SIGMOD Conference,1996
71027,conf/sigmod/ZouS96,On-line Reorganization of Sparsely-populated B+trees,"C Zou, B Salzberg",SIGMOD Conference,1996
71028,conf/vldb/GionisIM99,Similarity Search in High Dimensions via Hashing,"A Gionis, P Indyk, R Motwani",VLDB,1999
71038,conf/sigmod/SelfridgeSW96,IDEA: Interactive Data Exploration and Analysis,"P Selfridge, D Srivastava, L Wilson",SIGMOD Conference,1996
71041,conf/vldb/McHughW99,Query Optimization for XML,"J McHugh, J Widom",VLDB,1999
71046,conf/sigmod/HungYK96,CapBasED-AMS: A Capability-based and Event-driven Activity Management System,"P Hung, H Yeung, K Karlapalem",SIGMOD Conference,1996
71051,conf/vldb/BrodieC99,Issues in Network Management in the Next Millennium,"M Brodie, S Chaudhuri",VLDB,1999
71053,conf/vldb/Hamilton99,Networked Data Management Design Points,J Hamilton,VLDB,1999
71061,conf/sigmod/ChawatheRGW96,Change Detection in Hierarchically Structured Information,"S Chawathe, A Rajaraman, H Garcia-Molina, J Widom",SIGMOD Conference,1996
71071,conf/vldb/Mohan99,Repeating History Beyond ARIES,C Mohan,VLDB,1999
71075,conf/vldb/Norvag99,The Persistent Cache: Improving OID Indexing in Temporal Object-Oriented Database Systems,K N½rvÍg,VLDB,1999
71078,conf/sigmod/Agarwal96,A Super Scalar Sort Algorithm for RISC Processors,R Agarwal,SIGMOD Conference,1996
71093,conf/vldb/ZurekS99,Datawarehousing Has More Colours Than Just Black & White,"T Zurek, M Sinnwell",VLDB,1999
71098,conf/vldb/ChanI99,Hierarchical Prefix Cubes for Range-Sum Queries,"C Chan, Y Ioannidis",VLDB,1999
71100,conf/vldb/KonigW99,Combining Histograms and Parametric Curve Fitting for Feedback-Driven Query Result-size Estimation,"A K—nig, G Weikum",VLDB,1999
71101,conf/sigmod/QuassWGHLMNRRAUW96,LORE: A Lightweight Object REpository for Semistructured Data,"D Quass, J Widom, R Goldman, K Haas, Q Luo, J McHugh, S Nestorov, A Rajaraman, H Rivero, S Abiteboul, J Ullman, J Wiener",SIGMOD Conference,1996
71102,conf/vldb/ChaudhuriG99,Evaluating Top-k Selection Queries,"S Chaudhuri, L Gravano",VLDB,1999
71103,conf/sigmod/BohmA96,HyperStorM - Administering Structured Documents Using Object-Oriented Database Technology,"K B—hm, K Aberer",SIGMOD Conference,1996
71110,conf/vldb/RothOH99,Cost Models DO Matter: Providing Cost Information for Diverse Data Sources in a Federated System,"M Roth, F Ozcan, L Haas",VLDB,1999
71122,conf/sigmod/HellersteinN96,Query Execution Techniques for Caching Expensive Methods,"J Hellerstein, J Naughton",SIGMOD Conference,1996
71128,conf/sigmod/Tajima96,Static Detection of Security Flaws in Object-Oriented Databases,K Tajima,SIGMOD Conference,1996
71133,conf/vldb/Chawathe99,Comparing Hierarchical Data in External Memory,S Chawathe,VLDB,1999
71137,conf/vldb/BonczMK99,Database Architecture Optimized for the New Bottleneck: Memory Access,"P Boncz, S Manegold, M Kersten",VLDB,1999
71139,conf/sigmod/LoR96,Spatial Hash-Joins,"M Lo, C Ravishankar",SIGMOD Conference,1996
71148,conf/sigmod/GuptaMR95,Adapting Materialized Views after Redefinitions,"A Gupta, I Mumick, K Ross",SIGMOD Conference,1995
71170,conf/sigmod/LuMSS95,Efficient Maintenance of Materialized Mediated Views,"J Lu, G Moerkotte, J Sch■, V Subrahmanian",SIGMOD Conference,1995
71174,conf/sigmod/Ivinskis95,High Availability of Commercial Applications,K Ivinskis,SIGMOD Conference,1995
71176,conf/vldb/Mihalisin98,A Single Pass Computing Engine for Interactive Analysis of VLDBs,T Mihalisin,VLDB,1998
71191,conf/vldb/BraumandlCK98,Evaluating Functional Joins Along Nested Reference Sets in Object-Relational and Object-Oriented Databases,"R Braumandl, J ClauÔen, A Kemper",VLDB,1998
71194,conf/sigmod/RadekeBBEKKN95,Efendi: Federated Database System of Cadlab,"E Radeke, R B—ttger, B Burkert, Y Engel, G Kachel, S Kolmschlag, D Nolte",SIGMOD Conference,1995
71206,conf/vldb/NipplM98,"TOPAZ: a Cost-Based, Rule-Driven, Multi-Phase Parallelizer","C Nippl, B Mitschang",VLDB,1998
71211,conf/sigmod/BettiniWBJ95,Semantic Assumptions and Query Evaluation in Temporal Databases,"C Bettini, X Wang, E Bertino, S Jajodia",SIGMOD Conference,1995
71215,conf/vldb/ZirintsisKM99,Hyper-Programming in Java,"E Zirintsis, G Kirby, R Morrison",VLDB,1999
71226,conf/sigmod/GriffinL95,Incremental Maintenance of Views with Duplicates,"T Griffin, L Libkin",SIGMOD Conference,1995
71227,conf/sigmod/ChaudhuriDY95,Join Queries with External Text Sources: Execution and Optimization Techniques,"S Chaudhuri, U Dayal, T Yan",SIGMOD Conference,1995
71240,conf/sigmod/Ellison95,Keynote Address,,,1995
71243,conf/vldb/GibsonKR98,Clustering Categorical Data: An Approach Based on Dynamical Systems,"D Gibson, J Kleinberg, P Raghavan",VLDB,1998
71254,conf/sigmod/French95,``One Size Fits All'' Database Architectures Do Not Work for DDS,C French,SIGMOD Conference,1995
71262,conf/vldb/PapadiasMD98,Algorithms for Querying by Spatial Structure,"D Papadias, N Mamoulis, V Delis",VLDB,1998
71269,conf/sigmod/Sheth95,"Workflow Automation: Applications, Technology, and Research (Tutorial)",,,1995
71271,conf/sigmod/Norrie95,Integration Approaches for CIM,,,1995
71276,conf/sigmod/GatziuGD95,The SAMOS Active DBMS Prototype,"S Gatziu, A Geppert, K Dittrich",SIGMOD Conference,1995
71282,conf/sigmod/MassariPSC95,QBI: Query By Icons,"A Massari, S Pavani, L Saladini, P Chrysanthis",SIGMOD Conference,1995
71288,conf/vldb/VassalosP97,Describing and Using Query Capabilities of Heterogeneous Sources,"V Vassalos, Y Papakonstantinou",VLDB,1997
71293,conf/sigmod/GrossmanHQ95,PTool: A Light Weight Persistent Object Manager,"R Grossman, D Hanley, X Qin",SIGMOD Conference,1995
71296,conf/sigmod/WangZS95,"Pattern Matching and Pattern Discovery in Scientific, Program, and Document Databases","J Wang, K Zhang, D Shasha",SIGMOD Conference,1995
71297,conf/vldb/StathatosRB97,Adaptive Data Broadcast in Hybrid Networks,"K Stathatos, N Roussopoulos, J Baras",VLDB,1997
71303,conf/vldb/ZhangL97,Dynamic Memory Adjustment for External Mergesort,"W Zhang, P Larson",VLDB,1997
71306,conf/sigmod/KeimK95,VisDB: A System for Visualizing Large Databases,"D Keim, H Kriegel",SIGMOD Conference,1995
71325,conf/sigmod/FaloutsosRM94,Fast Subsequence Matching in Time-Series Databases,"C Faloutsos, M Ranganathan, Y Manolopoulos",SIGMOD Conference,1994
71326,conf/vldb/KumarKA97,Caprera: An Activity Framework for Transaction Processing on Wide-Area Networks,"S Kumar, E Kwang, D Agrawal",VLDB,1997
71329,conf/vldb/AlonsoHST97,Distributed Processing over Stand-alone Systems and Applications,"G Alonso, C Hagen, H Schek, M Tresch",VLDB,1997
71330,conf/sigmod/ChristophidesACS94,From Structured Documents to Novel Query Facilities,"V Christophides, S Abiteboul, S Cluet, M Scholl",SIGMOD Conference,1994
71356,conf/vldb/KornLKF98,"Ratio Rules: A New Paradigm for Fast, Quantifiable Data Mining","F Korn, A Labrinidis, Y Kotidis, C Faloutsos",VLDB,1998
71366,conf/vldb/Slutz98,Massive Stochastic Testing of SQL,D Slutz,VLDB,1998
71372,conf/sigmod/GraySEBW94,Quickly Generating Billion-Record Synthetic Databases,"J Gray, P Sundaresan, S Englert, K Baclawski, P Weinberger",SIGMOD Conference,1994
71373,conf/vldb/FankhauserGLMT98,Experiences in Federated Databases: From IRO-DB to MIRO-Web,"P Fankhauser, G Gardarin, M Lopez, J Muþoz, A Tomasic",VLDB,1998
71381,conf/sigmod/BrinkhoffKSS94,Multi-Step Processing of Spatial Joins,"T Brinkhoff, H Kriegel, R Schneider, B Seeger",SIGMOD Conference,1994
71384,conf/vldb/FlorescuLS98,Is Web-site Management a Database Problem?,"D Florescu, A Levy, D Suciu",VLDB,1998
71389,conf/vldb/RoussopoulosK98,The Cubetree Storage Organization,"N Roussopoulos, Y Kotidis",VLDB,1998
71391,conf/sigmod/McIverK94,"Self-Adaptive, On-Line Reclustering of Complex Object Data","W Jr., R King",SIGMOD Conference,1994
71408,conf/sigmod/Ubell94,The Montage Extensible DataBlade Achitecture,M Ubell,SIGMOD Conference,1994
71409,conf/sigmod/Pirahesh94,Object-Oriented Features of DB2 Client/Server,H Pirahesh,SIGMOD Conference,1994
71411,conf/vldb/SrivastavaDJL96,Answering Queries with Aggregation Using Views,"D Srivastava, S Dar, H Jagadish, A Levy",VLDB,1996
71418,conf/vldb/ViverosNR96,Applying Data Mining Techniques to a Health Insurance Information System,"M Viveros, J Nearhos, M Rothman",VLDB,1996
71423,conf/sigmod/SagonasSW94,XSB as an Efficient Deductive Database Engine,"K Sagonas, T Swift, D Warren",SIGMOD Conference,1994
71436,journals/sigmod/Liu03c,Editor's Notes,L Liu,SIGMOD Record,2003
71440,conf/sigmod/HwangLYMMGCSS94,The MYRIAD Federated Database Prototype,"S Hwang, E Lim, H Yang, S Musukula, K Mediratta, M Ganesh, D Clements, J Stenoien, J Srivastava",SIGMOD Conference,1994
71449,conf/vldb/Hess96,Very Large Databases in a Commercial Application Environment,K Hess,VLDB,1996
71450,journals/sigmod/Date03,Edgar F. Codd: a tribute and personal memoir,C Date,SIGMOD Record,2003
71453,conf/vldb/Mohan96,DWMS: Data Warehouse Management System,N Mohan,VLDB,1996
71456,conf/sigmod/KuhnTS94,A Language Based Multidatabase System,"e K■hn, T Tschernko, K Schwarz",SIGMOD Conference,1994
71471,journals/sigmod/CalvaneseGLV03,Reasoning on regular path queries,"D Calvanese, G Giacomo, M Lenzerini, M Vardi",SIGMOD Record,2003
71472,conf/vldb/TriantafillouP97,On-Demand Data Elevation in Hierarchical Multimedia Storage Servers,"P Triantafillou, T Papadakis",VLDB,1997
71479,conf/vldb/WangYM97,STING: A Statistical Information Grid Approach to Spatial Data Mining,"W Wang, J Yang, R Muntz",VLDB,1997
71480,journals/sigmod/GalianoM03,"Review of Data on the Web: from relational to semistructured data and XML by Serge Abiteboul, Peter Buneman, and Dan Suciu. Morgan Kaufmann 1999",,,2003
71482,conf/vldb/GravanoG97,Merging Ranks from Heterogeneous Internet Sources,"L Gravano, H Garcia-Molina",VLDB,1997
71484,conf/vldb/SeshadriLR97,The Case for Enhanced Abstract Data Types,"P Seshadri, M Livny, R Ramakrishnan",VLDB,1997
71486,journals/sigmod/PalpanasPKG03,Distributed deviation detection in sensor networks,"T Palpanas, D Papadopoulos, V Kalogeraki, D Gunopulos",SIGMOD Record,2003
71498,journals/sigmod/DemersGRTY03,The Cougar Project: a work-in-progress report,"A Demers, J Gehrke, R Rajaraman, A Trigoni, Y Yao",SIGMOD Record,2003
71501,conf/vldb/LiCHH97,Facilitating Multimedia Database Exploration through Visual Interfaces and Perpetual Query Reformulations,"W Li, K Candan, K Hirata, Y Hara",VLDB,1997
71504,conf/vldb/BridgeJKLLM97,The Oracle Universal Server Buffer,"W Bridge, A Joshi, M Keihl, T Lahiri, J Loaiza, N MacNaughton",VLDB,1997
71512,conf/vldb/DesslochM97,Integrating SQL Databases with Content-Specific Search Engines,"S DeÔloch, N Mattos",VLDB,1997
71514,journals/sigmod/Halevy03,Learning about data integration challenges from day one,A Halevy,SIGMOD Record,2003
71515,conf/vldb/HuangJR97,Spatial Joins Using R-trees: Breadth-First Traversal with Global Optimizations,"Y Huang, N Jing, E Rundensteiner",VLDB,1997
71517,conf/vldb/PellenkoftLK97,The Complexity of Transformation-Based Join Enumeration,"A Pellenkoft, C Galindo-Legaria, M Kersten",VLDB,1997
71526,journals/sigmod/Hainaut03,Research in database engineering at the University of Namur,J Hainaut,SIGMOD Record,2003
71529,journals/sigmod/NascimentoSP03,Analysis of SIGMOD's co-authorship graph,"M Nascimento, J Sander, J Pound",SIGMOD Record,2003
71543,conf/vldb/YanG95,Duplicate Removal in Information System Dissemination,"T Yan, H Garcia-Molina",VLDB,1995
71544,journals/sigmod/Winslett03b,Interview with Rakesh Agrawal,,,2003
71552,journals/sigmod/ArenasKKKMM03,The hyperion project: from data integration to data coordination,"M Arenas, V Kantere, A Kementsietsidis, I Kiringa, R Miller, J Mylopoulos",SIGMOD Record,2003
71555,conf/vldb/Baru96,Performance of Future Database Systems: Bottlenecks and Bonananzas,C Baru,VLDB,1996
71556,journals/sigmod/Hellerstein03,Toward network data independence,J Hellerstein,SIGMOD Record,2003
71580,conf/vldb/HasanM95,Coloring Away Communication in Parallel Query Optimization,"W Hasan, R Motwani",VLDB,1995
71581,conf/vldb/SteinbrunnPMK95,Bypassing Joins in Disjunctive Queries,"M Steinbrunn, K Peithner, G Moerkotte, A Kemper",VLDB,1995
71586,journals/sigmod/GolabO03,Issues in data stream management,"L Golab, M øzsu",SIGMOD Record,2003
71588,conf/vldb/GuptaHQ95,Aggregate-Query Processing in Data Warehousing Environments,"A Gupta, V Harinarayan, D Quass",VLDB,1995
71594,journals/sigmod/MukhopadhyayGS03,An approach to confidence based page ranking for user oriented Web search,"D Mukhopadhyay, D Giri, S Singh",SIGMOD Record,2003
71605,journals/sigmod/David03,ANSI SQL Hierarchical Processing Can Fully Integrate Native XML,M David,SIGMOD Record,2003
71608,journals/sigmod/MarchiLPT03,Analysis of existing databases at the logical level: the DBA companion project,"F Marchi, S Lopes, J Petit, F Toumani",SIGMOD Record,2003
71614,conf/vldb/WangC03,Avoiding Ordering and Grouping In Query Processing,"X Wang, M Cherniack",VLDB,2003
71615,conf/vldb/HulgeriS03,AniPQO: Almost Non-intrusive Parametric Query Optimization for Nonlinear Cost Functions,"A Hulgeri, S Sudarshan",VLDB,2003
71620,conf/vldb/SchindlerAG03,Lachesis: Robust Database Storage Management Based on Device-specific Performance Characteristics,"J Schindler, A Ailamaki, G Ganger",VLDB,2003
71621,conf/vldb/VieiraM03,A Dependability Benchmark for OLTP Application Environments,"M Vieira, H Madeira",VLDB,2003
71638,conf/vldb/PossP03,Data Compression in Oracle,"M P—ss, D Potapov",VLDB,2003
71641,conf/vldb/GalanisWJD03,Locating Data Sources in Large Distributed Systems,"L Galanis, Y Wang, S Jeffery, D DeWitt",VLDB,2003
71644,conf/vldb/WeberSNSS03,WebService Composition with O'GRAPE and OSIRIS,"R Weber, C Schuler, P Neukomm, H Schuldt, H Schek",VLDB,2003
71651,conf/vldb/BergerBSW03,Xcerpt and visXcerpt: From Pattern-Based to Visual Querying of XML and Semistructured Data,"S Berger, F Bry, S Schaffert, C Wieser",VLDB,2003
71657,conf/vldb/Leymann03,Grid and Applications (Industrial Session),F Leymann,VLDB,2003
71660,conf/vldb/DeckerK03,The Semantic Web: Semantics for Data on the Web,,,2003
71666,conf/vldb/LakshmananPZ03,Efficacious Data Cube Exploration by Semantic Summarization and Compression,"L Lakshmanan, J Pei, Y Zhao",VLDB,2003
71670,conf/vldb/LiPHCAAT03,CachePortal II: Acceleration of Very Large Scale Data Center-Hosted Database-driven Web Applications,"W Li, O Po, W Hsiung, K Candan, D Agrawal, Y Akca, K Taniguchi",VLDB,2003
71675,conf/vldb/Mattos03,Integrating Information for On Demand Computing,N Mattos,VLDB,2003
71681,conf/vldb/YangLH03,Efficient Mining of XML Query Patterns for Caching,"L Yang, M Lee, W Hsu",VLDB,2003
71689,conf/vldb/Koch03,Efficient Processing of Expressive Node-Selecting Queries on XML Data in Secondary Storage: A Tree Automata-based Approach,C Koch,VLDB,2003
71700,conf/vldb/LabrinidisR03,Balancing Performance and Data Freshness in Web Database Servers,"A Labrinidis, N Roussopoulos",VLDB,2003
71706,conf/vldb/HankinsP03,"Data Morphing: An Adaptive, Cache-Conscious Storage Technique","R Hankins, J Patel",VLDB,2003
71713,conf/vldb/TianD03,Tuple Routing Strategies for Distributed Eddies,"F Tian, D DeWitt",VLDB,2003
71714,conf/vldb/HuebschHLLSS03,Querying the Internet with PIER,"R Huebsch, J Hellerstein, N Lanham, B Loo, S Shenker, I Stoica",VLDB,2003
71727,conf/vldb/KornMZ03,Checks and Balances: Monitoring Data Quality Problems in Network Traffic Databases,"F Korn, S Muthukrishnan, Y Zhu",VLDB,2003
71733,conf/vldb/KarayannidisTSPMRFEB02,Processing Star Queries on Hierarchically-Clustered Fact Tables,"N Karayannidis, A Tsois, T Sellis, R Pieringer, V Markl, F Ramsak, R Fenk, K Elhardt, R Bayer",VLDB,2002
71737,conf/vldb/RizviH02,Maintaining Data Privacy in Association Rule Mining,"S Rizvi, J Haritsa",VLDB,2002
71738,conf/vldb/SenkulKT02,A Logical Framework for Scheduling Workflows under Resource Allocation Constraints,"P Senkul, M Kifer, I Toroslu",VLDB,2002
71740,conf/vldb/KornMS02,Reverse Nearest Neighbor Aggregates Over Data Streams,"F Korn, S Muthukrishnan, D Srivastava",VLDB,2002
71741,conf/vldb/ChanFFGR02,Tree Pattern Aggregation for Scalable XML Data Dissemination,"C Chan, W Fan, P Felber, M Garofalakis, R Rastogi",VLDB,2002
71744,conf/vldb/LakshmananNWZJ02,The Generalized MDL Approach for Summarization,"L Lakshmanan, R Ng, C Wang, X Zhou, T Johnson",VLDB,2002
71747,conf/vldb/ZellerK02,Experience Report: Exploiting Advanced Database Optimization Features for Large-Scale SAP R/3 Installations,"B Zeller, A Kemper",VLDB,2002
71748,conf/vldb/Vingralek02,"GnatDb: A Small-Footprint, Secure Database System",R Vingralek,VLDB,2002
71753,conf/vldb/SayalCDS02,Business Process Cockpit,"M Sayal, F Casati, U Dayal, M Shan",VLDB,2002
71758,conf/vldb/PanRAMOHAMV02,The Denodo Data Integration Platform,"A Pan, J Raposo, M êlvarez, P Montoto, V Orjales, J Hidalgo, L Ardao, A Molano, ê Viþa",VLDB,2002
71773,conf/vldb/CiliaHB02,Profiling and Internet Connectivity in Automotive Environments,"M Cilia, P Hasselmayer, A Buchmann",VLDB,2002
71775,conf/vldb/LamKR02,RTMonitor: Real-Time Data Monitoring Using Mobile Agent Technologies,"K Lam, A Kwan, K Ramamritham",VLDB,2002
71782,conf/vldb/SarawagiBKM02,ALIAS: An Active Learning led Interactive Deduplication System,"S Sarawagi, A Bhamidipaty, A Kirpal, C Mouli",VLDB,2002
71793,conf/vldb/DayalHL01,"Business Process Coordination: State of the Art, Trends, and Open Issues","U Dayal, M Hsu, R Ladin",VLDB,2001
71795,conf/vldb/KoudasS03,Data Stream Query Processing: A Tutorial,,,2003
71804,conf/vldb/GarofalakisG02,Querying and Mining Data Streams: You Only Get One Look,,,2002
71806,conf/vldb/Sarawagi02,Automation in Information Extraction and Data Integration,,,2002
71807,conf/vldb/Chakrabarti02,Searching and Mining Fine-Grained Semi-Structured Data,,,2002
71809,conf/vldb/ImielinskiB02,"Wireless Graffiti - Data, Data Everywhere Matters","T Imielinski, B Badrinath",VLDB,2002
71812,conf/vldb/CosleyLP02,REFEREE: An Open Framework for Practical Testing of Recommender Systems using ResearchIndex,"D Cosley, S Lawrence, D Pennock",VLDB,2002
71824,conf/vldb/ManegoldBK02,Generic Database Cost Models for Hierarchical Memory Systems,"S Manegold, P Boncz, M Kersten",VLDB,2002
71826,conf/vldb/CarneyCCCLSSTZ02,Monitoring Streams - A New Class of Data Management Applications,"D Carney, U úetintemel, M Cherniack, C Convey, S Lee, G Seidman, M Stonebraker, N Tatbul, S Zdonik",VLDB,2002
71830,conf/vldb/ChienVZTZ02,Efficient Structural Joins on Indexed XML Documents,"S Chien, Z Vagena, D Zhang, V Tsotras, C Zaniolo",VLDB,2002
71832,conf/vldb/ChenHWW02,Multi-Dimensional Regression Analysis of Time-Series Data Streams,"Y Chen, G Dong, J Han, B Wah, J Wang",VLDB,2002
71848,conf/vldb/ShahRS02,Maintaining Coherency of Dynamic Data in Cooperating Repositories,"S Shah, K Ramamritham, P Shenoy",VLDB,2002
71850,conf/vldb/BettiniJWW02,Provisions and Obligations in Policy Management and Security Applications,"C Bettini, S Jajodia, X Wang, D Wijesekera",VLDB,2002
71857,conf/vldb/DoR02,COMA - A System for Flexible Combination of Schema Matching Approaches,"H Do, E Rahm",VLDB,2002
71859,journals/tods/AikenHW95,Static Analysis Techniques for Predicting the Behavior of Active Database Rules,"A Aiken, J Hellerstein, J Widom",ACM Trans. Database Syst.,1995
71865,journals/tods/Chomicki95,Efficient Checking of Temporal Integrity Constraints Using Bounded History Encoding,J Chomicki,ACM Trans. Database Syst.,1995
71868,journals/tods/Chen95a,Query Evaluation in Deductive Databases with Alternating Fixpoint Semantics,W Chen,ACM Trans. Database Syst.,1995
71871,journals/tods/MokNE96,A Normal Form for Precisely Characterizing Redundancy in Nested Relations,"W Mok, Y Ng, D Embley",ACM Trans. Database Syst.,1996
71884,journals/tods/Kuo96,Model and Verification of a Data Manager Based on ARIES,D Kuo,ACM Trans. Database Syst.,1996
71892,journals/vldb/ChanGR03,RE-tree: an efficient index structure for regular expressions,"C Chan, M Garofalakis, R Rastogi",VLDB J.,2003
71899,journals/vldb/FungKL03,Cost-driven vertical class partitioning for methods in object oriented databases,"C Fung, K Karlapalem, Q Li",VLDB J.,2003
71903,journals/vldb/MaedcheMS03,Managing multiple and distributed ontologies on the Semantic Web,"A Maedche, B Motik, L Stojanovic",VLDB J.,2003
71906,journals/vldb/AtluriJY03,Guest editorial,,,2003
71907,journals/tods/Kim94,Charter and Scope,W Kim,ACM Trans. Database Syst.,1994
71915,journals/tods/BrightHP94,Automated Resolution of Semantic Heterogeneity in Multidatabases,"M Bright, A Hurson, S Pakzad",ACM Trans. Database Syst.,1994
71919,journals/tods/PolyzoisG94,Evaluation of Remote Backup Algorithms for Transaction-Processing Systems,"C Polyzois, H Garcia-Molina",ACM Trans. Database Syst.,1994
71927,journals/tods/Lerner00,A model for compound type changes encountered in schema evolution,B Lerner,ACM Trans. Database Syst.,2000
