tid,id,title,authors,venue,year
71986,journals/tods/CasatiCPP99,Specification and Implementation of Exceptions in Workflow Management Systems,"F Casati, S Ceri, S Paraboschi, G Pozzi",ACM Trans. Database Syst.,1999
72004,journals/vldb/GruserRZZ00,Learning Response Time for WebSources Using Query Feedback and Application in Query Optimization,"J Gruser, L Raschid, V Zadorozhny, T Zhan",VLDB J.,2000
72010,journals/vldb/AtzeniM00,Guest Editorial: Databases and the Web,,,2000
72015,journals/vldb/GibsonKR00,Clustering Categorical Data: An Approach Based on Dynamical Systems,"D Gibson, J Kleinberg, P Raghavan",VLDB J.,2000
72021,journals/vldb/Cobb97,The Impact of Technology on Commercial Transaction Processing,E Cobb,VLDB J.,1997
72022,journals/vldb/LometS97,Concurrency and Recovery for Index Trees,"D Lomet, B Salzberg",VLDB J.,1997
72027,journals/vldb/SinghalS97,Analysis of Locking Behavior in Three Real Database Systems,"V Singhal, A Smith",VLDB J.,1997
72035,journals/vldb/AbiteboulCM98,A Logical View of Structured Files,"S Abiteboul, S Cluet, T Milo",VLDB J.,1998
72039,journals/vldb/RoySSSA98,Garbage Collection in Object-Oriented Databases Using Transactional Cyclic Reference Counting,"P Roy, S Seshadri, A Silberschatz, S Sudarshan, S Ashwin",VLDB J.,1998
72041,journals/vldb/SofferS98,Integrating Symbolic Images into a Multimedia Database System Using Classification and Abstraction Approaches,"A Soffer, H Samet",VLDB J.,1998
72045,journals/vldb/Han98,"Optimizing Relational Queries in Connection Hypergraphs: Nested Queries, Views, and Binding Propagations",J Han,VLDB J.,1998
72046,journals/vldb/MehtaGPN98,The OODB Path-Method Generator (PMG) Using Access Weights and Precomputed Access Relevance,"A Mehta, J Geller, Y Perl, E Neuhold",VLDB J.,1998
72051,journals/vldb/AilamakiDH02,Data page layouts for relational databases on deep memory hierarchies,"A Ailamaki, D DeWitt, M Hill",VLDB J.,2002
72052,journals/vldb/HuntAI02,Database indexing for large DNA and protein sequence collections,"E Hunt, M Atkinson, R Irving",VLDB J.,2002
72054,journals/vldb/ApersCS02,Editorial,,,2002
72069,journals/vldb/ShethTP03,Complex relationships and knowledge discovery support in the InfoQuilt system,"A Sheth, S Thacker, S Patel",VLDB J.,2003
72072,journals/vldb/Ozsu03,New partnership with ACM and update on the journal,M Özsu,VLDB J.,2003
72075,journals/vldb/ChanFGR02,Efficient filtering of XML documents with XPath expressions,"C Chan, P Felber, M Garofalakis, R Rastogi",VLDB J.,2002
72076,journals/vldb/IvesHW02,An XML query engine for network-bound data,"Z Ives, A Halevy, D Weld",VLDB J.,2002
72078,journals/vldb/JagadishACLNPPSWWY02,TIMBER: A native XML database,"H Jagadish, S Al-Khalifa, A Chapman, L Lakshmanan, A Nierman, S Paparizos, J Patel, D Srivastava, N Wiwatwattana, Y Wu, C Yu",VLDB J.,2002
72079,journals/vldb/FiebigHKMNSW02,Anatomy of a native XML base management system,"T Fiebig, S Helmer, C Kanne, G Moerkotte, J Neumann, R Schiele, T Westmann",VLDB J.,2002
72082,journals/vldb/ChirkovaHS02,A formal perspective on the view selection problem,"R Chirkova, A Halevy, D Suciu",VLDB J.,2002
72095,journals/vldb/FuCCM00,Dynamic vp-Tree Indexing for n-Nearest Neighbor Search Given Pair-Wise Distances,"A Fu, P Chan, Y Cheung, Y Moon",VLDB J.,2000
72099,journals/vldb/LaurentLSV01,Monotonic complements for independent data warehouses,"D Laurent, J Lechtenbörger, N Spyratos, G Vossen",VLDB J.,2001
72107,journals/vldb/MecellaP01,Designing wrapper components for e-services in integrating heterogeneous systems,"M Mecella, B Pernici",VLDB J.,2001
72116,journals/vldb/PoulovassilisS96,Algebraic Query Optimisation for Database Programming Languages,"A Poulovassilis, C Small",VLDB J.,1996
72124,journals/vldb/MylopoulosCPST96,Building Knowledge Base Management Systems,"J Mylopoulos, V Chaudhri, D Plexousakis, A Shrufi, T Topaloglou",VLDB J.,1996
72128,journals/vldb/DeyBS96,A Complete Temporal Relational Algebra,"D Dey, T Barron, V Storey",VLDB J.,1996
72129,journals/vldb/KashyapS96,Semantic and Schematic Similarities Between Database Objects: A Context-Based Approach,"V Kashyap, A Sheth",VLDB J.,1996
72140,journals/vldb/HarrisR96,Join Algorithm Costs Revisited,"E Harris, K Ramamohanarao",VLDB J.,1996
72143,journals/vldb/C95c,"Title, Foreword, VLDB Journal to be published electronically, Index Vol. 4",,,1995
72149,journals/vldb/Guting94,An Introduction to Spatial Database Systems,R Güting,VLDB J.,1994
72151,journals/vldb/C94c,"Title, Foreword, Preface to the Special Issue on Spatial Database Systems, Index Vol. 3",,,1994
72154,journals/vldb/Baumann94,Management of Multidimensional Discrete Data,P Baumann,VLDB J.,1994
72162,journals/vldb/DanYC95,Characterization of Database Access Pattern for Analytic Prediction of Buffer Hit Probability,"A Dan, P Yu, J Chung",VLDB J.,1995
72166,journals/vldb/GeorgakopoulosRL94,Chronological Scheduling of Transactions with Temporal Dependencies,"D Georgakopoulos, M Rusinkiewicz, W Litwin",VLDB J.,1994
72185,conf/vldb/CareyHMW96,PESTO : An Integrated Query/Browser for Object Databases,"M Carey, L Haas, V Maganty, J Williams",VLDB,1996
72188,conf/vldb/Suciu96,Query Decomposition and View Maintenance for Query Languages for Unstructured Data,D Suciu,VLDB,1996
72192,conf/vldb/LevyRO96,Querying Heterogeneous Information Sources Using Source Descriptions,"A Levy, A Rajaraman, J Ordille",VLDB,1996
72210,conf/vldb/Rengarajan96,How System 11 SQL Server Became Fast,T Rengarajan,VLDB,1996
72215,conf/vldb/AgarwalADGNRS96,On the Computation of Multidimensional Aggregates,"S Agarwal, R Agrawal, P Deshpande, A Gupta, J Naughton, R Ramakrishnan, S Sarawagi",VLDB,1996
72223,journals/sigmod/Aberer03,Call for Book Reviews,,,2003
