tid,id,title,authors,venue,year
69620,conf/vldb/MoserKK95,L/MRP: A Buffer Management Strategy for Interactive Continuous Data Flows in a Multimedia DBMS,"F Moser, A Kraiss, W Klas",VLDB,1995
69627,journals/sigmod/Geller02,Data Mining: Practical Machine Learning Tools and Techniques - Book Review,J Geller,SIGMOD Record,2002
69630,conf/vldb/SrikantA95,Mining Generalized Association Rules,"R Srikant, R Agrawal",VLDB,1995
69636,journals/sigmod/Kim02,Conceptual Modeling and Specification Generation for B2B Business Process based on ebXML,H Kim,SIGMOD Record,2002
69640,journals/sigmod/CiliaB02,An Active Functionality Service for E-Business Applications,"M Cilia, A Buchmann",SIGMOD Record,2002
69647,conf/vldb/DidriksenGD95,Database De-Centralization - A Practical Approach,"T Didriksen, C Galindo-Legaria, E Dahle",VLDB,1995
69657,journals/sigmod/LuoI02,Interviewing During a Tight Job Market,,,2002
69673,conf/vldb/MogiK95,Hot Block Clustering for Disk Arrays with Dynamic Striping,"K Mogi, M Kitsuregawa",VLDB,1995
69692,journals/sigmod/SofferMC02,Report on the Mobile Search Workshop at WWW 2002,,,2002
69693,conf/vldb/Guting94,GraphDB: Modeling and Querying Graphs in Databases,R Güting,VLDB,1994
69696,conf/vldb/GutierrezPST94,Database Graph Views: A Practical Model to Manage Persistent Graphs,"A Gutiérrez, P Pucheral, H Steffen, J Thévenin",VLDB,1994
69716,journals/sigmod/FininJ02,"Agents, Turst, and Information Access on the Semantic Web","T Finin, A Joshi",SIGMOD Record,2002
69717,journals/sigmod/SureSS02,Methodology for Development and Employment of Ontology Based Knowledge Management Applications,"Y Sure, S Staab, R Studer",SIGMOD Record,2002
69722,conf/vldb/SistlaYLL95,Similarity based Retrieval of Pictures Using Indices on Spatial Relationships,"A Sistla, C Yu, C Liu, K Liu",VLDB,1995
69725,journals/sigmod/Liu02b,Editor's Notes,L Liu,SIGMOD Record,2002
69728,journals/sigmod/Aberer02b,Book Review Column,K Aberer,SIGMOD Record,2002
69731,conf/vldb/CatozziR95,OS Support for VLDBs: Unix Enhancements for the Teradata Data Base,"J Catozzi, S Rabinovici",VLDB,1995
69736,conf/vldb/Hallmark95,The Oracle Warehouse,G Hallmark,VLDB,1995
69740,journals/sigmod/HanBP01,Wrapping Web Data into XML,"W Han, D Buttler, C Pu",SIGMOD Record,2001
69742,conf/vldb/ColletCS94,NAOS - Efficient and Modular Reactive Capabilities in an Object-Oriented Database System,"C Collet, T Coupaye, T Svensen",VLDB,1994
69746,conf/vldb/LevyMS94,Query Optimization by Predicate Move-Around,"A Levy, I Mumick, Y Sagiv",VLDB,1994
69747,journals/sigmod/Lomet01,The Evolution of Effective B-tree: Page Organization and Techniques: A Personal Account,D Lomet,SIGMOD Record,2001
69750,conf/vldb/MohaniaS94,Some Issues in Design of Distributed Deductive Databases,"M Mohania, N Sarda",VLDB,1994
69762,journals/sigmod/Bernstein01,Report on the 2001 SIGMOD and PODS Awards,,,2001
69764,conf/vldb/KilgerM94,Indexing Multiple Sets,"C Kilger, G Moerkotte",VLDB,1994
69769,journals/sigmod/BiancheriPP01,EIHA?!?: Deploying Web and WAP services using XML Technology,"C Biancheri, J Pazzaglia, G Paddeu",SIGMOD Record,2001
69773,journals/sigmod/MeltonE01,SQL Multimedia and Application Packages (SQL/MM),"J Melton, A Eisenberg",SIGMOD Record,2001
69777,journals/sigmod/LenzeriniNNS01,Report on the 8th International Workshop on Knowledge Representation Meets Databases (KRDB),,,2001
69813,conf/vldb/YanA94,Integrating a Structured-Text Retrieval System with an Object-Oriented Database System,"T Yan, J Annevelink",VLDB,1994
69818,conf/vldb/ZemankovaI94,Scientific Databases - State of the Art and Future Directions,"M Zemankova, Y Ioannidis",VLDB,1994
69822,conf/sigmod/ArasuG03,Extracting Structured Data from Web Pages,"A Arasu, H Garcia-Molina",SIGMOD Conference,2003
69824,journals/sigmod/VelACM01,Mining Email Content for Author Identification Forensics,"O Vel, A Anderson, M Corney, G Mohay",SIGMOD Record,2001
69827,conf/sigmod/DeligiannakisR03,Extended Wavelets for Multiple Measures,"A Deligiannakis, N Roussopoulos",SIGMOD Conference,2003
69835,conf/vldb/TsatalosSI94,The GMAP: A Versatile Tool for Physical Data Independence,"O Tsatalos, M Solomon, Y Ioannidis",VLDB,1994
69838,conf/vldb/ChaudhuriS94,Including Group-By in Query Optimization,"S Chaudhuri, K Shim",VLDB,1994
69852,conf/vldb/SistlaYH94,Reasoning About Spatial Relationships in Picture Retrieval Systems,"A Sistla, C Yu, R Haddad",VLDB,1994
69859,journals/sigmod/GobleR02,Report on the 18th British National Conference on Databases (BNCOD),,,2002
69868,conf/sigmod/LakshmananPZ03,QC-Trees: An Efficient Summary Structure for Semantic OLAP,"L Lakshmanan, J Pei, Y Zhao",SIGMOD Conference,2003
69876,journals/sigmod/Franklin99b,Editor's Notes,M Franklin,SIGMOD Record,1999
69887,conf/sigmod/AgrawalK03,A System for Watermarking Relational Databases,"R Agrawal, P Haas, J Kiernan",SIGMOD Conference,2003
69888,journals/sigmod/Snodgrass00,Chair's Message,,,2000
69893,journals/sigmod/LiefkeS00,An Extensible Compressor for XML Data,"H Liefke, D Suciu",SIGMOD Record,2000
69897,journals/sigmod/PourabbasR00,Hierarchies and Relative Operators in the OLAP Environment,"E Pourabbas, M Rafanelli",SIGMOD Record,2000
69906,conf/sigmod/BabcockCD03,Dynamic Sample Selection for Approximate Query Processing,"B Babcock, S Chaudhuri, G Das",SIGMOD Conference,2003
69911,conf/sigmod/DeHaanTCO03,A Comprehensive XQuery to SQL Translation using Dynamic Interval Encoding,"D DeHaan, D Toman, M Consens, M Özsu",SIGMOD Conference,2003
69912,journals/sigmod/ClementiniF00,Spatial Operators,"E Clementini, P Felice",SIGMOD Record,2000
69944,journals/sigmod/Bussche00,Constraint databases: A tutorial introduction,J Bussche,SIGMOD Record,2000
69948,conf/sigmod/KriegelBKPS03,Using Sets of Feature Vectors for Similarity Search on Voxelized CAD Objects,"H Kriegel, S Brecheisen, P Kröger, M Pfeifle, M Schubert",SIGMOD Conference,2003
69961,conf/sigmod/Cabrera03,The Future of Web services - II,F Cabrera,SIGMOD Conference,2003
69963,conf/sigmod/GangulyGR03,Processing Set Expressions over Continuous Update Streams,"S Ganguly, M Garofalakis, R Rastogi",SIGMOD Conference,2003
69964,journals/sigmod/Franklin00b,Editor's Notes,M Franklin,SIGMOD Record,2000
69966,conf/sigmod/ChaudhuriGGM03,Robust and Efficient Fuzzy Match for Online Data Cleaning,"S Chaudhuri, K Ganjam, V Ganti, R Motwani",SIGMOD Conference,2003
69971,conf/sigmod/GuptaS03,Stream Processing of XPath Queries with Predicates,"A Gupta, D Suciu",SIGMOD Conference,2003
69986,conf/sigmod/ZhuS03,Warping Indexes with Envelope Transforms for Query by Humming,"Y Zhu, D Shasha",SIGMOD Conference,2003
69989,conf/sigmod/KangN03,On Schema Matching with Opaque Column Names and Data Values,"J Kang, J Naughton",SIGMOD Conference,2003
69990,journals/sigmod/Aggarwal01,Re-designing Distance Functions and Distance-Based Applications for High Dimensional Data,C Aggarwal,SIGMOD Record,2001
69993,conf/sigmod/CohenM03,Spectral Bloom Filters,"S Cohen, Y Matias",SIGMOD Conference,2003
69994,journals/sigmod/PuSW01,Infosphere Project: System Support for Information Flow Applications,"C Pu, K Schwan, J Walpole",SIGMOD Record,2001
69998,journals/sigmod/ChristoffelPSL98,Electronic Market: The Roadmap for University Libraries and Members to Survive in the Information Jungle,"M Christoffel, S Pulkowski, B Schmitt, P Lockemann",SIGMOD Record,1998
70000,journals/sigmod/MeltzerC98,XML and Electronic Commerce: Enabling the Network Economy,"B Meltzer, R Glushko",SIGMOD Record,1998
70004,journals/sigmod/Franklin98a,Editor's Notes,M Franklin,SIGMOD Record,1998
70005,conf/sigmod/ZadorozhnyRVUB02,Efficient evaluation of queries in a mediator for WebSources,"V Zadorozhny, L Raschid, M Vidal, T Urhan, L Bright",SIGMOD Conference,2002
70017,conf/sigmod/Chamberlin03,XQuery: A Query Language for XML,,,2003
70026,conf/sigmod/SengarH03,PLASTIC: Reducing Query Optimization Overheads through Plan Recycling,"V Sengar, J Haritsa",SIGMOD Conference,2003
70029,journals/sigmod/SnodgrassACFLLORRSV99,Reminiscences on Influential Papers,,,1999
70033,conf/sigmod/PaparizosACJLNPSWWY03,TIMBER: A Native System for Querying XML,"S Paparizos, S Al-Khalifa, A Chapman, H Jagadish, L Lakshmanan, A Nierman, J Patel, D Srivastava, N Wiwatwattana, Y Wu, C Yu",SIGMOD Conference,2003
70034,journals/sigmod/RoantreeMH99,The OASIS Multidatabase Prototype,"M Roantree, J Murphy, W Hasselbring",SIGMOD Record,1999
70052,journals/sigmod/BergamaschiCV99,Semantic Integration of Semistructured and Structured Data Sources,"S Bergamaschi, S Castano, M Vincini",SIGMOD Record,1999
70055,journals/sigmod/SmithO99,Unpacking The Semantics of Source and Usage To Perform Semantic Reconciliation In Large-Scale Information Systems,"K Smith, L Obrst",SIGMOD Record,1999
70059,conf/sigmod/ShashaB02,"Database tuning: principles, experiments, and troubleshooting techniques (part II)","D Shasha, P Bonnet",SIGMOD Conference,2002
70067,journals/sigmod/KuanL99,A Study on Data Point Search for HG-Trees,"J Kuan, P Lewis",SIGMOD Record,1999
70073,journals/sigmod/Kim99,"Message from Editor-in-Chief, ACM Transactions on Database Systems",W Kim,,1999
70077,journals/sigmod/DomenigD99,An Overview and Classification of Mediated Query Systems,"R Domenig, K Dittrich",SIGMOD Record,1999
70079,conf/sigmod/AgrawalCD02,DBXplorer: enabling keyword search over relational databases,"S Agrawal, S Chaudhuri, G Das",SIGMOD Conference,2002
70082,conf/sigmod/HanWDPW02,CubeExplorer: online exploration of data cubes,"J Han, J Wang, G Dong, J Pei, K Wang",SIGMOD Conference,2002
70083,conf/sigmod/KarbhariRXD02,ACDN: a content delivery network for applications,"P Karbhari, M Rabinovich, Z Xiao, F Douglis",SIGMOD Conference,2002
70094,journals/sigmod/Franklin99a,Editor's Notes,M Franklin,SIGMOD Record,1999
70098,conf/sigmod/RaoZML02,Automating physical database design in a parallel database,"J Rao, C Zhang, N Megiddo, G Lohman",SIGMOD Conference,2002
70101,journals/sigmod/RosenthalS99,First-Class Views: A Key to User-Centered Computing,"A Rosenthal, E Sciore",SIGMOD Record,1999
70120,journals/sigmod/MusickC99,Practical Lessons in Supporting Large-Scale Computational Science,"R Musick, T Critchlow",SIGMOD Record,1999
70129,conf/sigmod/ZhouR02,Implementing database operations using SIMD instructions,"J Zhou, K Ross",SIGMOD Conference,2002
70131,journals/sigmod/Snodgrass97a,Chair's Message,,,1997
70133,journals/sigmod/NadoH97,Extracting Entity Profiles from Semistructured Information Spaces,"R Nado, S Huffman",SIGMOD Record,1997
70134,conf/sigmod/LiGS02,Skew handling techniques in sort-merge join,"W Li, D Gao, R Snodgrass",SIGMOD Conference,2002
70138,journals/sigmod/Suciu97,Foreword: Management of Semistructured Data,,,1997
70147,conf/sigmod/TaoP02,Time-parameterized queries in spatio-temporal databases,"Y Tao, D Papadias",SIGMOD Conference,2002
70150,journals/sigmod/McClatcheyV97,Workshop on Workflow Management in Scientific and Engineering Applications - Report,,,1997
70157,journals/sigmod/BarbaraS97,Quasi-Cubes: Exploiting Approximations in Multidimensional Databases,"D Barbará, M Sullivan",SIGMOD Record,1997
70160,conf/sigmod/GarofalakisG02,Wavelet synopses with error guarantees,"M Garofalakis, P Gibbons",SIGMOD Conference,2002
70169,journals/sigmod/SilberschatzZ97,Database Systems - Breaking Out of the Box,"A Silberschatz, S Zdonik",SIGMOD Record,1997
70182,conf/sigmod/BarbosaMKL02,ToXgene: a template-based data generator for XML,"D Barbosa, A Mendelzon, J Keenleyside, K Lyons",SIGMOD Conference,2002
70184,journals/sigmod/FrewD97,Data Management for Earth System Science,"J Frew, J Dozier",SIGMOD Record,1997
70186,journals/sigmod/RosenthalHRS97,"\A Consumer Viewpoint on \""\""Mediator Languages - a Proposal for a Standard\""\""\""""","A Rosenthal, E Hughes, S Renner, L Seligman",SIGMOD Record,1997
70192,conf/sigmod/FlorescuGKR02,XL: a platform for web services,"D Florescu, A Grünhagen, D Kossmann, S Rost",SIGMOD Conference,2002
70193,conf/sigmod/CrescenziMM02,RoadRunner: automatic data extraction from data-intensive web sites,"V Crescenzi, G Mecca, P Merialdo",SIGMOD Conference,2002
70199,journals/sigmod/GriffinK98,Algebraic Change Propagation for Semijoin and Outerjoin Queries,"T Griffin, B Kumar",SIGMOD Record,1998
70204,journals/sigmod/TsotrasJS98,An Extensible Notation for Spatiotemporal Index Queries,"V Tsotras, C Jensen, R Snodgrass",SIGMOD Record,1998
70206,conf/sigmod/RinfretOO01,Bit-Sliced Index Arithmetic,"D Rinfret, P O'Neil, E O'Neil",SIGMOD Conference,2001
70208,journals/sigmod/Franklin98,Editor's Notes,M Franklin,SIGMOD Record,1998
70215,conf/sigmod/NazeriBO01,Experiences in Mining Aviation Safety Data,"Z Nazeri, E Bloedorn, P Ostwald",SIGMOD Conference,2001
70223,conf/sigmod/DattaDRTV01,Dynamic Content Acceleration: A Caching Solution to Enable Scalable Dynamic Web Page Generation,"A Datta, K Dutta, K Ramamritham, H Thomas, D VanderMeer",SIGMOD Conference,2001
70231,conf/sigmod/KiesslingHFE01,"COSIMA - Your Smart, Speaking E-Salesperson","W Kießling, S Holland, S 0003, T Ehm",SIGMOD Conference,2001
70237,conf/sigmod/Maguire01,Catalog Management in Websphere Commerce Suite,T Maguire,SIGMOD Conference,2001
70239,journals/sigmod/Rosenthal98,Where Will Object Techonology Drive Data Administration?,A Rosenthal,SIGMOD Record,1998
70240,conf/sigmod/BorkarDS01,Automatic Segmentation of Text into Structured Records,"V Borkar, K Deshmukh, S Sarawagi",SIGMOD Conference,2001
70241,conf/sigmod/SchusterW01,Communication Efficient Distributed Mining of Association Rules,"A Schuster, R Wolff",SIGMOD Conference,2001
70246,conf/sigmod/LahiriG01,Fast-Start: Quick Fault Recovery in Oracle,"T Lahiri, A Ganesh, R Weiss, A Joshi",SIGMOD Conference,2001
70258,journals/sigmod/NormanZT96,Much Ado About Shared-Nothing,"M Norman, T Zurek, P Thanisch",SIGMOD Record,1996
70259,journals/sigmod/BestavrosLS96,Report on First International Workshop on Real-Time Database Systems,,,1996
70264,journals/sigmod/Dogac96,Middle East Technical University Software Research and Development Center,A Dogac,SIGMOD Record,1996
70265,conf/sigmod/ShahC01,"Fault-tolerant, Load-balancing Queries in Telegraph","M Shah, S Chandrasekaran",SIGMOD Conference,2001
70271,journals/sigmod/Widom96,Editor's Notes,J Widom,SIGMOD Record,1996
70272,conf/sigmod/Bussler01,Semantic B2B Integration,,,2001
70273,journals/sigmod/Qian96a,Scientist's Called Upon to Take Actions,X Qian,SIGMOD Record,1996
70283,conf/sigmod/AgichteinGV01,Snowball: A Prototype System for Extracting Relations from Large Text Collections,"E Agichtein, L Gravano, J Pavel, V Sokolova, A Voskoboynik",SIGMOD Conference,2001
70287,journals/sigmod/RamamrithamSSTX96,"Integrating Temporal, Real-Time, and Active Databases","K Ramamritham, R Sivasankaran, J Stankovic, D Towsley, M Xiong",SIGMOD Record,1996
70294,conf/sigmod/LamCKNH01,RETINA: A REal-time TraffIc NAvigation System,"K Lam, E Chan, T Kuo, S Ng, D Hung",SIGMOD Conference,2001
70297,conf/sigmod/DraperHW01,The Nimble Integration Engine,"D Draper, A Halevy, D Weld",SIGMOD Conference,2001
70299,conf/sigmod/Galindo-LegariaJ01,Orthogonal Optimization of Subqueries and Aggregation,"C Galindo-Legaria, M Joshi",SIGMOD Conference,2001
70301,conf/sigmod/DeshpandeGR01,Independence is Good: Dependency-Based Histogram Synopses for High-Dimensional Data,"A Deshpande, M Garofalakis, R Rastogi",SIGMOD Conference,2001
70303,journals/sigmod/FreemanG96,Lifestreams: A Storage Model for Personal Data,"E Freeman, D Gelernter",SIGMOD Record,1996
70311,journals/sigmod/Anonymous96,MQSeries and CICS Link for Lotus Notes,,SIGMOD Record,1996
70326,journals/sigmod/BunemanRU97,Mediator Languages - a Proposal for a Standard,"P Buneman, L Raschid, J Ullman",SIGMOD Record,1997
70332,conf/sigmod/GetoorTK01,Selectivity Estimation using Probabilistic Models,"L Getoor, B Taskar, D Koller",SIGMOD Conference,2001
70341,conf/sigmod/DoanDH01,Reconciling Schemas of Disparate Data Sources: A Machine-Learning Approach,"A Doan, P Domingos, A Halevy",SIGMOD Conference,2001
70344,journals/sigmod/HasanMV96,Applying database Visualization to the World Wide Web,"M Hasan, A Mendelzon, D Vista",SIGMOD Record,1996
70346,conf/sigmod/GunopulosD01,Time Series Similarity Measures and Time Series Indexing,,,2001
70362,journals/sigmod/Ahlberg96,Spotfire: An Information Exploration Environment,C Ahlberg,SIGMOD Record,1996
70369,journals/sigmod/Sidell96,The Mariposa Distributed Database Management System,J Sidell,SIGMOD Record,1996
70378,journals/sigmod/Widom96a,Editor's Notes,J Widom,SIGMOD Record,1996
70386,conf/sigmod/SzalayGKT00,Designing and Mining Multi-Terabyte Astronomy Archives: The Sloan Digital Sky Survey,"A Szalay, P Kunszt, A Thakar, J Gray, D Slutz",SIGMOD Conference,2000
70389,journals/sigmod/Chaudhri95,An Annotated Bibliography of Benchmarks for Object Databases,A Chaudhri,SIGMOD Record,1995
70394,journals/sigmod/BerraNT95,ACM Multimedia '94 Conference Workshop on Multimedia Database Management Systems,"P Berra, K Nwosu, B Thuraisingham",SIGMOD Record,1995
70407,journals/sigmod/GamacheS95,Addressing Techniques Used in Database Object Managers O2 and Orion,"A Gamache, N Sahraoui",SIGMOD Record,1995
70414,conf/sigmod/GillmannWSWW00,A Goal-driven Auto-Configuration Tool for the Distributed Workflow Management System Mentor-lite,"M Gillmann, J Weißenfels, G Shegalov, W Wonner, G Weikum",SIGMOD Conference,2000
70426,journals/sigmod/KiyokiKH94,A Metadatabase System for Semantic Image Search by a Mathematical Model of Meaning,"Y Kiyoki, T Kitagawa, T Hayama",SIGMOD Record,1994
70431,conf/sigmod/Jhingran00,Anatomy of a Real E-Commerce System,A Jhingran,SIGMOD Conference,2000
70435,conf/sigmod/ChenDLT00,Fact: A Learning Based Web Query Processing System,"S Chen, Y Diao, H Lu, Z Tian",SIGMOD Conference,2000
70436,journals/sigmod/Jannink95,Implementing Deletion in B+-Trees,J Jannink,SIGMOD Record,1995
70441,conf/sigmod/Galhardas00,AJAX: An Extensible Data Cleaning Tool,"H Galhardas, D Florescu, D Shasha, E Simon",SIGMOD Conference,2000
70446,conf/sigmod/GoldmanW00,WSQ/DSQ: A Practical Approach for Combined Querying of Databases and the Web,"R Goldman, J Widom",SIGMOD Conference,2000
70447,journals/sigmod/EnglertGH95,Parallelism and its Price: A Case Study of NonStop SQL/MP,"S Englert, R Glasstone, W Hasan",SIGMOD Record,1995
70452,conf/sigmod/LabrinidisR00,WebView Materialization,"A Labrinidis, N Roussopoulos",SIGMOD Conference,2000
70455,journals/sigmod/WolfsonSDNR95,View Maintenance in Mobile Computing,"O Wolfson, A Sistla, S Dao, K Narayanan, R Raj",SIGMOD Record,1995
70456,conf/sigmod/BarclaySG00,TerraServer: A Spatial Data Warehouse,"T Barclay, D Slutz, J Gray",SIGMOD Conference,2000
70462,conf/sigmod/ChristophidesCS00,On Wrapping Query Languages and Efficient XML Integration,"V Christophides, S Cluet, J Siméon",SIGMOD Conference,2000
70466,journals/sigmod/DunhamH95,From the Guest Editors - Special Section on Data Management Issues in Mobile Computing,"M Dunham, A Helal",,1995
70470,journals/sigmod/Ulusoy95,An Annotated Bibliography on Real-Time Database Systems,Ö Ulusoy,SIGMOD Record,1995
70484,journals/sigmod/Richey95,Condition Handling in SQL Persistent Stored Modules,J Richey,SIGMOD Record,1995
70517,journals/tods/Chomicki03,Preference formulas in relational queries,J Chomicki,ACM Trans. Database Syst.,2003
70521,conf/sigmod/LiBCS00,SPIRE: A Progressive Content-Based Spatial Image Retrieval Engine,"C Li, L Bergman, V Castelli, J Smith",SIGMOD Conference,2000
70524,journals/sigmod/DreyerDS94,Research Perspectives for Time Series Management Systems,"W Dreyer, A Dittrich, D Schmidt",SIGMOD Record,1994
70532,journals/sigmod/SnodgrassAABCDEGJKKKLLRSSS94,TSQL2 Language Specification,"R Snodgrass, I Ahn, G Ariav, D Batory, J Clifford, C Dyreson, R Elmasri, F Grandi, C Jensen, W Käfer, N Kline, K Kulkarni, T Leung, N Lorentzos, J Roddick, A Segev, M Soo, S Sripada",SIGMOD Record,1994
70533,journals/sigmod/Loeffen94,Text Databases: A Survey of Text Models and Systems,A Loeffen,SIGMOD Record,1994
70543,conf/sigmod/DavulcuFKR99,A Layered Architecture for Querying Dynamic Web Content,"H Davulcu, J Freire, M Kifer, I Ramakrishnan",SIGMOD Conference,1999
70548,journals/tods/GibbonsMP02,Fast incremental maintenance of approximate histograms,"P Gibbons, Y Matias, V Poosala",ACM Trans. Database Syst.,2002
70553,journals/tods/TaoPZ02,Cost models for overlapping and multiversion structures,"Y Tao, D Papadias, J Zhang",ACM Trans. Database Syst.,2002
70554,conf/sigmod/KotidisR99,DynaMat: A Dynamic View Management System for Data Warehouses,"Y Kotidis, N Roussopoulos",SIGMOD Conference,1999
70570,journals/tods/BeneventanoBS03,Description logics for semantic query optimization in object-oriented database systems,"D Beneventano, S Bergamaschi, C Sartori",ACM Trans. Database Syst.,2003
70572,conf/sigmod/CruzJ99,A User-Centered Interface for Querying Distributed Multimedia Databases,"I Cruz, K James",SIGMOD Conference,1999
70577,journals/sigmod/X94b,Calls for Papers / Announcements,,SIGMOD Record,1994
70582,journals/sigmod/Klein94,How to Modify SQL Queries in Order to Guarantee Sure Answers,H Klein,SIGMOD Record,1994
70598,journals/sigmod/Rosneblatt94,Unix RDBMS: The Next Generation,B Rosneblatt,SIGMOD Record,1994
70601,conf/sigmod/Mohan99,A Database Perspective on Lotus Domino/Notes,C Mohan,SIGMOD Conference,1999
70603,conf/sigmod/FlorescuLMS99,Query Optimization in the Presence of Limited Access Patterns,"D Florescu, A Levy, I Manolescu, D Suciu",SIGMOD Conference,1999
70607,conf/sigmod/AcharyaGPR99a,Join Synopses for Approximate Query Answering,"S Acharya, P Gibbons, V Poosala, S Ramaswamy",SIGMOD Conference,1999
70610,journals/sigmod/Segev94,Editor's Notes,A Segev,SIGMOD Record,1994
70623,journals/sigmod/X94,The TSQL2 Final Language Definition Announcement,,SIGMOD Record,1994
70629,journals/sigmod/Qian94,Jumping on the NII Bandwagon,X Qian,SIGMOD Record,1994
70644,conf/sigmod/DoRD99,The Need for Distributed Asynchronous Transactions,"L Do, P Ram, P Drew",SIGMOD Conference,1999
70653,conf/vldb/DongHLPW01,Mining Multi-Dimensional Constrained Gradients in Data Cubes,"G Dong, J Han, J Lam, J Pei, K Wang",VLDB,2001
70667,conf/sigmod/ChangG99,Mind Your Vocabulary: Query Mapping Across Heterogeneous Information Sources,"K Chang, H Garcia-Molina",SIGMOD Conference,1999
70672,conf/vldb/BlokWZPAKJ01,Flexible and scalable digital library search,"H Blok, M Windhouwer, R Zwol, M Petkovic, P Apers, M Kersten, W Jonker",VLDB,2001
70677,conf/vldb/Adler01,DB2 Spatial Extender - Spatial data within the RDBMS,D Adler,VLDB,2001
70682,conf/sigmod/EmbleyJN99,Record-Boundary Discovery in Web Documents,"D Embley, Y Jiang, Y Ng",SIGMOD Conference,1999
70684,conf/sigmod/Dullmann99,Petabyte Databases,,,1999
70686,conf/sigmod/GarofalakisRRS99,"Of Crawlers, Portals, Mice and Men: Is there more to Mining the Web? (Panel)","M Garofalakis, S Ramaswamy, R Rastogi, K Shim",SIGMOD Conference,1999
70691,conf/sigmod/Brown99,Implementing the Spirit of SQL-99,P Brown,SIGMOD Conference,1999
70696,conf/vldb/Sol01,"Ambient Intelligence with the Ubiquitous Network, the Embedded Computer Devices and the Hidden Databases (abstract)",E Sol,VLDB,2001
70697,conf/sigmod/KanthRSB99,Indexing Medium-dimensionality Data in Oracle,"K Kanth, S Ravada, J Sharma, J Banerjee",SIGMOD Conference,1999
70704,conf/sigmod/ChanI98,Bitmap Index Design and Evaluation,"C Chan, Y Ioannidis",SIGMOD Conference,1998
70705,conf/vldb/AksoyZF01,Data Staging for On-Demand Broadcast,"D Aksoy, M Franklin, S Zdonik",VLDB,2001
70710,conf/sigmod/AdamY98,Electronic Commerce: Tutorial,"N Adam, Y Yesha",SIGMOD Conference,1998
70719,conf/sigmod/BerchtoldK98,"High-Dimensional Index Structures, Database Support for Next Decade's Applications (Tutorial)","S Berchtold, D Keim",SIGMOD Conference,1998
70720,conf/vldb/Shmueli01,Architectures for Internal Web Services Deployment,O Shmueli,VLDB,2001
70732,conf/vldb/ChienTZ01,Efficient Management of Multiversion Documents by Object Referencing,"S Chien, V Tsotras, C Zaniolo",VLDB,2001
70733,conf/vldb/ManolescuFK01,Answering XML Queries on Heterogeneous Data Sources,"I Manolescu, D Florescu, D Kossmann",VLDB,2001
70734,conf/sigmod/BaruGLMPVC99,XML-Based Information Mediation with MIX,"C Baru, A Gupta, B Ludäscher, R Marciano, Y Papakonstantinou, P Velikhov, V Chu",SIGMOD Conference,1999
70744,conf/sigmod/GuhaRS98,CURE: An Efficient Clustering Algorithm for Large Databases,"S Guha, R Rastogi, K Shim",SIGMOD Conference,1998
70747,conf/sigmod/KotidisR98,An Alternative Storage Organization for ROLAP Aggregate Views Based on Cubetrees,"Y Kotidis, N Roussopoulos",SIGMOD Conference,1998
70753,conf/vldb/GalhardasFSSS01,"Declarative Data Cleaning: Language, Model, and Algorithms","H Galhardas, D Florescu, D Shasha, E Simon, C Saita",VLDB,2001
70759,conf/sigmod/NestorovAM98,Extracting Schema from Semistructured Data,"S Nestorov, S Abiteboul, R Motwani",SIGMOD Conference,1998
70769,conf/vldb/PantiSG00,A Case-Based Approach to Information Integration,"M Panti, L Spalazzi, A Giretti",VLDB,2000
70770,conf/sigmod/ZhaoDNS98,Simultaneous Optimization and Evaluation of Multiple Dimensional Queries,"Y Zhao, P Deshpande, J Naughton, A Shukla",SIGMOD Conference,1998
70771,conf/sigmod/SeidlK98,Optimal Multi-Step k-Nearest Neighbor Search,"T Seidl, H Kriegel",SIGMOD Conference,1998
70772,conf/vldb/ChangG00,Approximate Query Translation Across Heterogeneous Information Sources,"K Chang, H Garcia-Molina",VLDB,2000
70775,conf/vldb/ManolescuFKXO00,Agora: Living with XML and Relational,"I Manolescu, D Florescu, D Kossmann, F Xhumari, D Olteanu",VLDB,2000
70779,conf/sigmod/GodfreySE98,Secure and Portable Database Extensibility,"M Godfrey, T Mayr, P Seshadri, T Eicken",SIGMOD Conference,1998
