tid,id,title,authors,venue,year
70789,conf/vldb/CotterB00,Biodiversity Informatics Infrastructure: An Information Commons for the Biodiversity Community,"G Cotter, B Bauldock",VLDB,2000
70796,conf/vldb/ChoenniV00,Design and Implementation of a Genetic-Based Algorithm for Data Mining,S Choenni,VLDB,2000
70798,conf/sigmod/AmbiteABKMMMPT98,ARIADNE: A System for Constructing Mediators for Internet Sources,"J Ambite, N Ashish, G Barish, C Knoblock, S Minton, P Modi, I Muslea, A Philpot, S Tejada",SIGMOD Conference,1998
70806,conf/sigmod/Brewer98,Delivering High Availability for Inktomi Search Engines,E Brewer,SIGMOD Conference,1998
70808,conf/vldb/KemmeA00,"Don't Be Lazy, Be Consistent: Postgres-R, A New Way to Implement Database Replication","B Kemme, G Alonso",VLDB,2000
70820,conf/sigmod/LiYVGPUV98,Capability Based Mediation in TSIMMIS,"C Li, R Yerneni, V Vassalos, H Garcia-Molina, Y Papakonstantinou, J Ullman, M Valiveti",SIGMOD Conference,1998
70825,conf/sigmod/TsurUACMNR98,Query Flocks: A Generalization of Association-Rule Mining,"S Tsur, J Ullman, S Abiteboul, C Clifton, R Motwani, S Nestorov, A Rosenthal",SIGMOD Conference,1998
70827,conf/vldb/CareyKRLABFLOPQRSSUVWY01,The Propel Distributed Services Platform,"M Carey, S Kirsch, M Roth, B Linden, N Adiba, M Blow, D Florescu, D Li, I Oprencak, R Panwar, R Qi, D Rieber, J Shafer, B Sterling, T Urhan, B Vickery, D Wineman, K Yee",VLDB,2001
70828,conf/sigmod/ZaianeHLCC98,MultiMediaMiner: A System Prototype for Multimedia Data Mining,"O Zaïane, J Han, Z Li, S Chee, J Chiang",SIGMOD Conference,1998
70832,conf/sigmod/BaumannDFRW98,The Multidimensional Database System RasDaMan,"P Baumann, A Dehmel, P Furtado, R Ritsch, N Widmann",SIGMOD Conference,1998
70842,conf/vldb/MorishimaKKT01,Enabling End-users to Construct Data-intensive Web-sites from XML Repositories: An Example-based Approach,"A Morishima, S Koizumi, H Kitagawa, S Takano",VLDB,2001
70850,conf/vldb/KoschBBHHLRT01,SMOOTH - A Distributed Multimedia Database System,"H Kosch, L Böszörményi, A Bachlechner, C Hanin, C Hofbauer, M Lang, C Riedler, R Tusch",VLDB,2001
70855,conf/vldb/ZhouLZLZJT01,VXMLR: A Visual XML-Relational Database System,"A Zhou, H Lu, S Zheng, Y Liang, L Zhang, W Ji, Z Tian",VLDB,2001
70857,conf/vldb/StohrR01,WARLOCK: A Data Allocation Tool for Parallel Warehouses,"T Stöhr, E Rahm",VLDB,2001
70879,conf/vldb/MarronL01,On Processing XML in LDAP,"P Marrón, G Lausen",VLDB,2001
70889,conf/vldb/Gentili01,Italian Electronic Identity Card - principle and architecture,M Gentili,VLDB,2001
70899,conf/sigmod/HanKK97,Scalable Parallel Data Mining for Association Rules,"E Han, G Karypis, V Kumar",SIGMOD Conference,1997
70905,conf/sigmod/MaheshwariL97,Partitioned Garbage Collection of Large Object Store,"U Maheshwari, B Liskov",SIGMOD Conference,1997
70907,conf/sigmod/ZaharioudakisC97,Highly Concurrent Cache Consistency for Indices in Client-Server Database Systems,"M Zaharioudakis, M Carey",SIGMOD Conference,1997
70927,conf/vldb/LudasaherGM00,Model-Based Information Integration in a Neuroscience Mediator System,"B Ludäscher, A Gupta, M Martone",VLDB,2000
70933,conf/vldb/BeneventanoBCCGMMV00,Information Integration: The MOMIS Project Demonstration,"D Beneventano, S Bergamaschi, S Castano, A Corni, R Guidetti, G Malvezzi, M Melchiori, M Vincini",VLDB,2000
70945,conf/vldb/GuPS00,OLAP++: Powerful and Easy-to-Use Federations of OLAP and Object Databases,"J Gu, T Pedersen, A Shoshani",VLDB,2000
70946,conf/sigmod/PatelYKTNBHRLEKGDN97,"Building a Scaleable Geo-Spatial DBMS: Technology, Implementation, and Evaluation","J Patel, J Yu, N Kabra, K Tufte, B Nag, J Burger, N Hall, K Ramasamy, R Lueder, C Ellmann, J Kupsch, S Guo, D DeWitt, J Naughton",SIGMOD Conference,1997
70947,conf/sigmod/GebhardtJJ97,A Toolkit for Negotiation Support Interfaces to Multi-Dimensional Data,"M Gebhardt, M Jarke, S Jacobs",SIGMOD Conference,1997
70957,conf/vldb/CowleyP00,Temporal Integrity Constraints with Indeterminacy,"W Cowley, D Plexousakis",VLDB,2000
70960,conf/sigmod/Chakravarthy97,SENTINEL: An Object-Oriented DBMS With Event-Based Rules,S Chakravarthy,SIGMOD Conference,1997
70967,conf/sigmod/OConnellISWABCCLPWW96,A Content-Based Multimedia Server for Massively Parallel Architectures,"W O'Connell, I Ieong, D Schrader, C Watson, G Au, A Biliris, S Choo, P Colin, G Linderman, E Panagos, J Wang, T Walters",SIGMOD Conference,1996
70969,conf/sigmod/SimmenSM96,Fundamental Techniques for Order Optimization,"D Simmen, E Shekita, T Malkemus",SIGMOD Conference,1996
70976,conf/sigmod/GeneserethKD97,Infomaster: An Information Integration System,"M Genesereth, A Keller, O Duschka",SIGMOD Conference,1997
70988,conf/sigmod/Chaudhuri97,Query Optimization at the Crossroads (Panel),S Chaudhuri,SIGMOD Conference,1997
71001,conf/sigmod/BressanGFJHKLMPQSS97,The COntext INterchange Mediator Prototype,"S Bressan, C Goh, K Fynn, M Jakobisiak, K Hussein, H Kon, T Lee, S Madnick, T Pena, J Qu, A Shum, M Siegel",SIGMOD Conference,1997
71002,conf/vldb/ChakrabartiM00,Local Dimensionality Reduction: A New Approach to Indexing High Dimensional Spaces,"K Chakrabarti, S Mehrotra",VLDB,2000
71003,conf/sigmod/QuassW97,On-Line Warehouse View Maintenance,"D Quass, J Widom",SIGMOD Conference,1997
71009,conf/sigmod/ShivakumarG97,Wave-Indices: Indexing Evolving Databases,"N Shivakumar, H Garcia-Molina",SIGMOD Conference,1997
71027,conf/sigmod/ZouS96,On-line Reorganization of Sparsely-populated B+trees,"C Zou, B Salzberg",SIGMOD Conference,1996
71028,conf/vldb/GionisIM99,Similarity Search in High Dimensions via Hashing,"A Gionis, P Indyk, R Motwani",VLDB,1999
71034,conf/vldb/JagadishLS99,What can Hierarchies do for Data Warehouses?,"H Jagadish, L Lakshmanan, D Srivastava",VLDB,1999
71039,conf/sigmod/ChaudhuriG96,Optimizing Queries over Multimedia Repositories,"S Chaudhuri, L Gravano",SIGMOD Conference,1996
71040,conf/vldb/HaasKU99,Loading a Cache with Query Results,"L Haas, D Kossmann, I Ursu",VLDB,1999
71041,conf/vldb/McHughW99,Query Optimization for XML,"J McHugh, J Widom",VLDB,1999
71042,conf/sigmod/GoelI96,SQL Query Optimization: Reordering for a General Class of Queries,"P Goel, B Iyer",SIGMOD Conference,1996
71043,conf/vldb/DonjerkovicR99,Probabilistic Optimization of Top N Queries,"D Donjerkovic, R Ramakrishnan",VLDB,1999
71045,conf/vldb/JagadishKNS99,Multi-Dimensional Substring Selectivity Estimation,"H Jagadish, O Kapitskaia, R Ng, D Srivastava",VLDB,1999
71052,conf/sigmod/Keim96,Databases and Visualization,D Keim,SIGMOD Conference,1996
71057,conf/sigmod/HanFWCZK96,DBMiner: Interactive Mining of Multiple-Level Knowledge in Relational Databases,"J Han, Y Fu, W Wang, J Chiang, O Zaïane, K Koperski",SIGMOD Conference,1996
71077,conf/vldb/KoudasMJ99,Mining Deviants in a Time Series Database,"H Jagadish, N Koudas, S Muthukrishnan",VLDB,1999
71088,conf/sigmod/AdyaGLM95,Efficient Optimistic Concurrency Control Using Loosely Synchronized Clocks,"A Adya, R Gruber, B Liskov, U Maheshwari",SIGMOD Conference,1995
71091,conf/sigmod/RothAHCCFSTW96,The Garlic Project,"M Roth, M Arya, L Haas, M Carey, W Cody, R Fagin, P Schwarz, J II, E Wimmers",SIGMOD Conference,1996
71112,conf/sigmod/FernandezS96,The Ins and Outs (and Everthing in Between) of Data Warehousing,,,1996
71117,conf/vldb/JermaineDO99,A Novel Index Supporting High Volume Data Warehouse Insertion,"C Jermaine, A Datta, E Omiecinski",VLDB,1999
71121,conf/vldb/BamfordAP99,A Scalable and Highly Available Networked Database Architecture,"R Bamford, R Ahad, A Pruscino",VLDB,1999
71122,conf/sigmod/HellersteinN96,Query Execution Techniques for Caching Expensive Methods,"J Hellerstein, J Naughton",SIGMOD Conference,1996
71125,conf/sigmod/McAuliffeCS96,Towards Effective and Efficient Free Space Management,"M McAuliffe, M Carey, M Solomon",SIGMOD Conference,1996
71127,conf/vldb/AilamakiDHW99,DBMSs on a Modern Processor: Where Does Time Go?,"A Ailamaki, D DeWitt, M Hill, D Wood",VLDB,1999
71128,conf/sigmod/Tajima96,Static Detection of Security Flaws in Object-Oriented Databases,K Tajima,SIGMOD Conference,1996
71140,conf/vldb/AbiteboulACEMM99,Active Views for Electronic Commerce,"S Abiteboul, B Amann, S Cluet, A Eyal, L Mignet, T Milo",VLDB,1999
71141,conf/sigmod/PatelD96,Partition Based Spatial-Merge Join,"J Patel, D DeWitt",SIGMOD Conference,1996
71147,conf/vldb/BaulierBGJGKKMMNNRSS98,DataBlitz: A High Performance Main-Memory Storage Manager,"J Baulier, P Bohannon, S Gogate, S Joshi, C Gupta, A Khivesera, H Korth, P McIlroy, J Miller, P Narayan, M Nemeth, R Rastogi, A Silberschatz, S Sudarshan",VLDB,1998
71155,conf/sigmod/DavisonG95,Dynamic Resource Brokering for Multi-User Query Execution,"D Davison, G Graefe",SIGMOD Conference,1995
71170,conf/sigmod/LuMSS95,Efficient Maintenance of Materialized Mediated Views,"J Lu, G Moerkotte, J Schü, V Subrahmanian",SIGMOD Conference,1995
71177,conf/vldb/George98,DMS: A Parallel Data Mining Server,F George,VLDB,1998
71185,conf/sigmod/Olson95,Cover Your Assets,M Olson,SIGMOD Conference,1995
71209,conf/vldb/IshikawaSF98,MindReader: Querying Databases Through Multiple Examples,"Y Ishikawa, R Subramanya, C Faloutsos",VLDB,1998
71212,conf/vldb/DeRose99,"What Do Those Weird XML Types Want, Anyway?",S DeRose,VLDB,1999
71217,conf/vldb/Dayal99,"Industrial Panel on Data Warehousing Technologies: Experiences, Challenges, and Directions",U Dayal,VLDB,1999
71225,conf/vldb/FlorescuLSY99,Optimization of Run-time Management of Data Intensive Web-sites,"D Florescu, A Levy, D Suciu, K Yagoub",VLDB,1999
71235,conf/sigmod/BunemanM95,The Data That You Won't Find in Databases: Tutorial panel on data exchange formats,"P Buneman, D Maier",SIGMOD Conference,1995
71237,conf/vldb/AbiteboulAAACHHMMMMSTV99,XML Repository and Active Views Demonstration,"S Abiteboul, V Aguilera, S Ailleret, B Amann, S Cluet, B Hills, F Hubert, J Mamou, A Marian, L Mignet, T Milo, C Santos, B Tessier, A Vercoustre",VLDB,1999
71250,conf/vldb/KnorrN98,Algorithms for Mining Distance-Based Outliers in Large Datasets,"E Knorr, R Ng",VLDB,1998
71251,conf/sigmod/Bampahl95,Real World Requirements for Decision Support - Implications for RDBMS,S Bansal,SIGMOD Conference,1995
71264,conf/sigmod/Deutsch95,Objects and SQL: Strange Relations? Panel,D Deutsch,SIGMOD Conference,1995
71272,conf/vldb/Garcia-MolinaLY98,Expiring Data in a Warehouse,"H Garcia-Molina, W Labio, J Yang",VLDB,1998
71274,conf/vldb/ZhangL98,Buffering and Read-Ahead Strategies for External Mergesort,"W Zhang, P Larson",VLDB,1998
71279,conf/vldb/TheodoratosS97,Data Warehouse Configuration,"D Theodoratos, T Sellis",VLDB,1997
71282,conf/sigmod/MassariPSC95,QBI: Query By Icons,"A Massari, S Pavani, L Saladini, P Chrysanthis",SIGMOD Conference,1995
71293,conf/sigmod/GrossmanHQ95,PTool: A Light Weight Persistent Object Manager,"R Grossman, D Hanley, X Qin",SIGMOD Conference,1995
71297,conf/vldb/StathatosRB97,Adaptive Data Broadcast in Hybrid Networks,"K Stathatos, N Roussopoulos, J Baras",VLDB,1997
71308,conf/vldb/GibbonsMP97,Fast Incremental Maintenance of Approximate Histograms,"P Gibbons, Y Matias, V Poosala",VLDB,1997
71323,conf/sigmod/CareyFZ94,Fine-Grained Sharing in a Page Server OODBMS,"M Carey, M Franklin, M Zaharioudakis",SIGMOD Conference,1994
71325,conf/sigmod/FaloutsosRM94,Fast Subsequence Matching in Time-Series Databases,"C Faloutsos, M Ranganathan, Y Manolopoulos",SIGMOD Conference,1994
71335,conf/sigmod/ChenR94,Adaptive Selectivity Estimation Using Query Feedback,"C Chen, N Roussopoulos",SIGMOD Conference,1994
71342,conf/vldb/RamaswamyMS98,On the Discovery of Interesting Patterns in Association Rules,"S Ramaswamy, S Mahajan, A Silberschatz",VLDB,1998
71346,conf/vldb/GehrkeRG98,RainForest - A Framework for Fast Decision Tree Construction of Large Datasets,"J Gehrke, R Ramakrishnan, V Ganti",VLDB,1998
71354,conf/vldb/ShuklaDN98,Materialized View Selection for Multidimensional Datasets,"A Shukla, P Deshpande, J Naughton",VLDB,1998
71356,conf/vldb/KornLKF98,"Ratio Rules: A New Paradigm for Fast, Quantifiable Data Mining","F Korn, A Labrinidis, Y Kotidis, C Faloutsos",VLDB,1998
71360,conf/sigmod/ColeG94,Optimization of Dynamic Query Evaluation Plans,"R Cole, G Graefe",SIGMOD Conference,1994
71370,conf/vldb/BonczRK98,The Drill Down Benchmark,"P Boncz, T Rühl, F Kwakkel",VLDB,1998
71387,conf/vldb/Orenstein98,Starting (and Sometimes Ending) a Database Company,J Orenstein,VLDB,1998
71395,conf/sigmod/Hellerstein94,Practical Predicate Placement,J Hellerstein,SIGMOD Conference,1994
71399,conf/vldb/MaratheS97,A Language for Manipulating Arrays,"A Marathe, K Salem",VLDB,1997
71400,conf/sigmod/Galindo-Legaria94,Outerjoins as Disjunctions,C Galindo-Legaria,SIGMOD Conference,1994
71427,conf/sigmod/Cattell94,ODMG-93: A Standard for Object-Oriented DBMSs,R Cattell,SIGMOD Conference,1994
71430,conf/sigmod/Kim94,UniSQL/X Unified Relational and Object-Oriented Database System,W Kim,SIGMOD Conference,1994
71431,conf/vldb/SevcikK96,Filter Trees for Managing Spatial Data over a Range of Size Granularities,"K Sevcik, N Koudas",VLDB,1996
71438,conf/sigmod/Blakeley94,Open Object Database Management Systems,,,1994
71439,conf/vldb/StaudtJ96,Incremental Maintenance of Externally Materialized Views,"M Staudt, M Jarke",VLDB,1996
71453,conf/vldb/Mohan96,DWMS: Data Warehouse Management System,N Mohan,VLDB,1996
71458,conf/vldb/Sheth96,Bellcore's ADAPT/X Harness System for Managing Information on Internet and Intranets,A Sheth,VLDB,1996
71459,conf/vldb/Klots96,Cache Coherency in Oracle Parallel Server,B Klots,VLDB,1996
71471,journals/sigmod/CalvaneseGLV03,Reasoning on regular path queries,"D Calvanese, G Giacomo, M Lenzerini, M Vardi",SIGMOD Record,2003
71477,journals/sigmod/WangD03,Review of Web caching and replication by Michael Rabinovich and Oliver Spatscheck. Addison Wesley 2002,,,2003
71479,conf/vldb/WangYM97,STING: A Statistical Information Grid Approach to Spatial Data Mining,"W Wang, J Yang, R Muntz",VLDB,1997
71481,journals/sigmod/Wiegand03,"Review of Spatial databases with application to GIS by Philippe Rigaux, Michel Scholl, and Agnes Voisard. Morgan Kaufmann 2002",,,2003
71483,journals/sigmod/KannanKIK03,Energy and rate based MAC protocol for wireless sensor networks,"R Kannan, R Kalidindi, S Iyengar, V Kumar",SIGMOD Record,2003
71485,conf/vldb/NgC97,Integrating Reliable Memory in Databases,"W Ng, P Chen",VLDB,1997
71486,journals/sigmod/PalpanasPKG03,Distributed deviation detection in sensor networks,"T Palpanas, D Papadopoulos, V Kalogeraki, D Gunopulos",SIGMOD Record,2003
71488,journals/sigmod/Aberer03d,Book review column,K Aberer,SIGMOD Record,2003
71505,journals/sigmod/Ozsu03a,Chair's Message,,,2003
71517,conf/vldb/PellenkoftLK97,The Complexity of Transformation-Based Join Enumeration,"A Pellenkoft, C Galindo-Legaria, M Kersten",VLDB,1997
71519,conf/vldb/ChakrabartiDAR97,"Using Taxonomy, Discriminants, and Signatures for Navigating in Text Databases","S Chakrabarti, B Dom, R Agrawal, P Raghavan",VLDB,1997
71520,journals/sigmod/KambhampatiK03,Information integration on the Web: a view from AI and databases (report on IIWeb-03),"S Kambhampati, C Knoblock",SIGMOD Record,2003
71529,journals/sigmod/NascimentoSP03,Analysis of SIGMOD's co-authorship graph,"M Nascimento, J Sander, J Pound",SIGMOD Record,2003
71532,journals/sigmod/Liu03a,Editor's Notes,L Liu,SIGMOD Record,2003
71534,journals/sigmod/JukicNV03,Closing the key loophole in MLS databases,"N Jukic, S Nestorov, S Vrbsky",SIGMOD Record,2003
71541,journals/sigmod/Anisimov03,"Review of The data warehouse toolkit: the complete guide to dimensional modeling (2nd edition) by Ralph Kimball, Margy Ross. John Wiley & Sons, Inc. 2002",,,2003
71543,conf/vldb/YanG95,Duplicate Removal in Information System Dissemination,"T Yan, H Garcia-Molina",VLDB,1995
71544,journals/sigmod/Winslett03b,Interview with Rakesh Agrawal,,,2003
71545,journals/sigmod/CherniakV03,Reminiscences on Influential Papers,,,2003
71551,conf/vldb/Celis96,The Query Optimizer in Tandem's new ServerWare SQL Product,P Celis,VLDB,1996
71552,journals/sigmod/ArenasKKKMM03,The hyperion project: from data integration to data coordination,"M Arenas, V Kantere, A Kementsietsidis, I Kiringa, R Miller, J Mylopoulos",SIGMOD Record,2003
71568,conf/vldb/RahmM95,Dynamic Multi-Resource Load Balancing in Parallel Database Systems,"E Rahm, R Marek",VLDB,1995
71572,conf/vldb/CabreraRH95,Applying Database Technology in the ADSM Mass Storage System,"L Cabrera, R Rees, W Hineman",VLDB,1995
71574,conf/vldb/HellersteinNP95,Generalized Search Trees for Database Systems,"J Hellerstein, J Naughton, A Pfeffer",VLDB,1995
71586,journals/sigmod/GolabO03,Issues in data stream management,"L Golab, M Özsu",SIGMOD Record,2003
71592,conf/vldb/GardarinGT95,A Cost Model for Clustered Object-Oriented Databases,"G Gardarin, J Gruser, Z Tang",VLDB,1995
71594,journals/sigmod/MukhopadhyayGS03,An approach to confidence based page ranking for user oriented Web search,"D Mukhopadhyay, D Giri, S Singh",SIGMOD Record,2003
71603,journals/sigmod/BertinoEH03,A Database Approach to Quality of Service Specification in Video Databases,"E Bertino, A Elmagarmid, M Hacid",SIGMOD Record,2003
71609,journals/sigmod/ChakravarthyAEFO03,Database Research at UT Arlington,"S Chakravarthy, Y Aslandogan, R Elmasri, L Fegaras, J Oh",SIGMOD Record,2003
71613,conf/vldb/PottingerB03,Merging Models Based on Given Correspondences,"R Pottinger, P Bernstein",VLDB,2003
71617,conf/vldb/PapadiasTS03,The TPR*-Tree: An Optimized Spatio-Temporal Access Method for Predictive Queries,"Y Tao, D Papadias, J Sun",VLDB,2003
71624,conf/vldb/HelmerNM03,Estimating the Output Cardinality of Partial Preaggregation with a Measure of Clusteredness,"S Helmer, T Neumann, G Moerkotte",VLDB,2003
71629,conf/vldb/MurthyB03,XML Schemas in Oracle XML DB,"R Murthy, S Banerjee",VLDB,2003
71660,conf/vldb/DeckerK03,The Semantic Web: Semantics for Data on the Web,,,2003
71668,conf/vldb/WitkowskiBBFGSS03,Business Modelling Using SQL Spreadsheets,"A Witkowski, S Bellamkonda, T Bozkaya, N Folkert, A Gupta, L Sheng, S Subramanian",VLDB,2003
71669,conf/vldb/SizovGT03,From Focused Crawling to Expert Information: an Application Framework for Web Exploration and Portal Generation,"S Sizov, J Graupmann, M Theobald",VLDB,2003
71671,conf/vldb/NieKH03,BibFinder/StatMiner: Effectively Mining and Using Coverage and Overlap Statistics in Data Integration,"Z Nie, S Kambhampati, T Hernandez",VLDB,2003
71673,conf/vldb/NicklasGS03,"NexusScout: An Advanced Location-Based Application on a Distributed, Open Mediation Platform","D Nicklas, M Großmann, T Schwarz",VLDB,2003
71682,conf/vldb/ShahDR03,An Efficient and Resilient Approach to Filtering and Disseminating Streaming Data,"S Shah, S Dharmarajan, K Ramamritham",VLDB,2003
71692,conf/vldb/TengCY03,A Regression-Based Temporal Pattern Mining Scheme for Data Streams,"W Teng, M Chen, P Yu",VLDB,2003
71693,conf/vldb/KumaranH03,On the Costs of Multilingualism in Database Systems,"A Kumaran, J Haritsa",VLDB,2003
71700,conf/vldb/LabrinidisR03,Balancing Performance and Data Freshness in Web Database Servers,"A Labrinidis, N Roussopoulos",VLDB,2003
71703,conf/vldb/ZhouS03,Data Bubbles for Non-Vector Data: Speeding-up Hierarchical Clustering in Arbitrary Metric Spaces,"J Zhou, J Sander",VLDB,2003
71712,conf/vldb/LernerS03,"AQuery: Query Language for Ordered Data, Optimization Techniques, and Experiments","A Lerner, D Shasha",VLDB,2003
71716,conf/vldb/LuoNEW03,Locking Protocols for Materialized Aggregate Join Views,"G Luo, J Naughton, C Ellmann, M Watzke",VLDB,2003
71735,conf/vldb/NiermanJ02,ProTDB: Probabilistic Data in XML,"A Nierman, H Jagadish",VLDB,2002
71738,conf/vldb/SenkulKT02,A Logical Framework for Scheduling Workflows under Resource Allocation Constraints,"P Senkul, M Kifer, I Toroslu",VLDB,2002
71741,conf/vldb/ChanFFGR02,Tree Pattern Aggregation for Scalable XML Data Dissemination,"C Chan, W Fan, P Felber, M Garofalakis, R Rastogi",VLDB,2002
71752,conf/vldb/SeifertS02,A Multi-version Cache Replacement and Prefetching Policy for Hybrid Data Delivery Environments,"A Seifert, M Scholl",VLDB,2002
71756,conf/vldb/DagevilleZ02,SQL Memory Management in Oracle9i,"B Dageville, M Zaït",VLDB,2002
71760,conf/vldb/AlexandrovABBBCDFHJKKKLLMMMPNPPRRSSW02,OBK - An Online High Energy Physics' Meta-Data Repository,"I Alexandrov, A Amorim, E Badescu, M Barczyk, D Burckhart-Chromek, M Caprini, M Dobson, J Flammer, R Hart, R Jones, A Kazarov, S Kolos, V Kotov, D Liko, L Lucio, L Mapelli, M Mineev, L Moneta, I Papadopoulos, M Nassiakou, N Parrington, L Pedro, A Ribeiro,",VLDB,2002
71762,conf/vldb/Mohan02a,An Efficient Method for Performing Record Deletions and Updates Using Index Scans,C Mohan,VLDB,2002
71764,conf/vldb/ShengBDM02,SELF-SERV: A Platform for Rapid Composition of Web Services in a Peer-to-Peer Environment,"Q Sheng, B Benatallah, M Dumas, E Mak",VLDB,2002
71766,conf/vldb/ShegalovWBL02,EOS: Exactly-Once E-Service Middleware,"G Shegalov, G Weikum, R Barga, D Lomet",VLDB,2002
71775,conf/vldb/LamKR02,RTMonitor: Real-Time Data Monitoring Using Mobile Agent Technologies,"K Lam, A Kwan, K Ramamritham",VLDB,2002
71782,conf/vldb/SarawagiBKM02,ALIAS: An Active Learning led Interactive Deduplication System,"S Sarawagi, A Bhamidipaty, A Kirpal, C Mouli",VLDB,2002
71783,conf/vldb/RantzauCHM02,Champagne: Data Change Propagation for Heterogeneous Information Systems,"R Rantzau, C Constantinescu, U Heinkel, H Meinecke",VLDB,2002
71784,conf/vldb/HerlekarDRGS02,enTrans: A System for Flexible Consistency Maintenance in Directory Applications,"A Herlekar, A Deopujari, K Ramamritham, S Gopale, S Shukla",VLDB,2002
71792,conf/vldb/Wadler01,"Et tu, XML? The downfall of the relational empire (abstract)",P Wadler,VLDB,2001
71793,conf/vldb/DayalHL01,"Business Process Coordination: State of the Art, Trends, and Open Issues","U Dayal, M Hsu, R Ladin",VLDB,2001
71797,conf/vldb/CeriM03,"Constructing and integrating data-centric Web Applications: Methods, Tools, and Techniques",,,2003
71799,conf/vldb/GottlobKP02,Efficient Algorithms for Processing XPath Queries,"G Gottlob, C Koch, R Pichler",VLDB,2002
71804,conf/vldb/GarofalakisG02,Querying and Mining Data Streams: You Only Get One Look,,,2002
71806,conf/vldb/Sarawagi02,Automation in Information Extraction and Data Integration,,,2002
71828,conf/vldb/KossmannRR02,Shooting Stars in the Sky: An Online Algorithm for Skyline Queries,"D Kossmann, F Ramsak, S Rost",VLDB,2002
71832,conf/vldb/ChenHWW02,Multi-Dimensional Regression Analysis of Time-Series Data Streams,"Y Chen, G Dong, J Han, B Wah, J Wang",VLDB,2002
71839,conf/vldb/TaoP02,Adaptive Index Structures,"Y Tao, D Papadias",VLDB,2002
71840,conf/vldb/LimWPVP02,XPathLearner: An On-line Self-Tuning Markov Histogram for XML Path Selectivity Estimation,"L Lim, M Wang, S Padmanabhan, J Vitter, R Parr",VLDB,2002
71853,conf/vldb/CandanALPH02,View Invalidation for Dynamic Content Caching in Multitiered Architectures,"K Candan, D Agrawal, W Li, O Po, W Hsiung",VLDB,2002
71856,conf/vldb/StolteA02,Efficient Exploration of Large Scientific Databases,"E Stolte, G Alonso",VLDB,2002
71868,journals/tods/Chen95a,Query Evaluation in Deductive Databases with Alternating Fixpoint Semantics,W Chen,ACM Trans. Database Syst.,1995
71875,journals/tods/GuoSW96,Solving Satisfiability and Implication Problems in Database Systems,"S Guo, W Sun, M Weiss",ACM Trans. Database Syst.,1996
71876,journals/tods/BellNNS96,Implementing Deductive Databases by Mixed Integer Programming,"C Bell, A Nerode, R Ng, V Subrahmanian",ACM Trans. Database Syst.,1996
71883,journals/tods/RaschidL96,Semantics for Update Rule Programs and Implementations in a Relational Database Management System,"L Raschid, J Lobo",ACM Trans. Database Syst.,1996
71885,journals/tods/CiacciaTZ96,Declustering of Key-Based Partitioned Signature Files,"P Ciaccia, P Tiberio, P Zezula",ACM Trans. Database Syst.,1996
71907,journals/tods/Kim94,Charter and Scope,W Kim,ACM Trans. Database Syst.,1994
71911,journals/tods/OliverS94,A Taxonomy for Secure Object-Oriented Databases,"M Olivier, S Solms",ACM Trans. Database Syst.,1994
71913,journals/tods/YanG94,Index Structures for Selective Dissemination of Information Under the Boolean Model,"T Yan, H Garcia-Molina",ACM Trans. Database Syst.,1994
71936,journals/tods/KemmeA00,A new approach to developing and implementing eager database replication protocols,"B Kemme, G Alonso",ACM Trans. Database Syst.,2000
71937,journals/tods/Meo00,Theory of dependence values,R Meo,ACM Trans. Database Syst.,2000
71938,journals/tods/BaralisW00,An algebraic approach to static analysis of active database rules,"E Baralis, J Widom",ACM Trans. Database Syst.,2000
71939,journals/tods/LiC01,Answering queries with useful bindings,"C Li, E Chang",ACM Trans. Database Syst.,2001
71944,journals/tods/ChomickiTB01,Querying ATSQL databases with temporal logic,"J Chomicki, D Toman, M Böhlen",ACM Trans. Database Syst.,2001
71952,journals/tods/KotidisR01,A case for dynamic view management,"Y Kotidis, N Roussopoulos",ACM Trans. Database Syst.,2001
71955,journals/tods/FranklinCL97,Transactional Client-Server Cache Consistency: Alternatives and Performance,"M Franklin, M Carey, M Livny",ACM Trans. Database Syst.,1997
71963,journals/tods/LiuHD98,Multiview Access Protocols for Large-Scale Replication,"X Liu, A Helal, W Du",ACM Trans. Database Syst.,1998
71976,journals/tods/BertinoBFS98,An Access Control Model Supporting Periodicity Constraints and Temporal Reasoning,"E Bertino, C Bettini, E Ferrari, P Samarati",ACM Trans. Database Syst.,1998
71978,journals/tods/SistlaWYS98,Towards a Theory of Cost Management for Digital Libraries and Electronic Commerce,"A Sistla, O Wolfson, Y Yesha, R Sloan",ACM Trans. Database Syst.,1998
71981,journals/tods/YanG99,The SIFT Information Dissemination System,"T Yan, H Garcia-Molina",ACM Trans. Database Syst.,1999
