tid,id,title,authors,venue,year
70768,conf/vldb/DingGS00,Computing Geographical Scopes of Web Resources,"J Ding, L Gravano, N Shivakumar",VLDB,2000
70770,conf/sigmod/ZhaoDNS98,Simultaneous Optimization and Evaluation of Multiple Dimensional Queries,"Y Zhao, P Deshpande, J Naughton, A Shukla",SIGMOD Conference,1998
70775,conf/vldb/ManolescuFKXO00,Agora: Living with XML and Relational,"I Manolescu, D Florescu, D Kossmann, F Xhumari, D Olteanu",VLDB,2000
70780,conf/vldb/BasuFP00,Building Scalable Internet Applications with Oracle8i Server,"J Basu, J Fern·ndez, O Peschansky",VLDB,2000
70789,conf/vldb/CotterB00,Biodiversity Informatics Infrastructure: An Information Commons for the Biodiversity Community,"G Cotter, B Bauldock",VLDB,2000
70793,conf/sigmod/JaedickeM98,On Parallel Processing of Aggregate and Scalar Functions in Object-Relational DBMS,"M Jaedicke, B Mitschang",SIGMOD Conference,1998
70812,conf/vldb/PardonA00,CheeTah: a Lightweight Transaction Server for Plug-and-Play Internet Data Management,"G Pardon, G Alonso",VLDB,2000
70820,conf/sigmod/LiYVGPUV98,Capability Based Mediation in TSIMMIS,"C Li, R Yerneni, V Vassalos, H Garcia-Molina, Y Papakonstantinou, J Ullman, M Valiveti",SIGMOD Conference,1998
70831,conf/vldb/AbrolLMMMRTWZ01,Navigating large-scale semi-structured data in business portals,"M Abrol, N Latarche, U Mahadevan, J Mao, R Mukherjee, P Raghavan, M Tourn, J Wang, G Zhang",VLDB,2001
70837,conf/vldb/AnciauxBBPV01,PicoDBMS: Validation and Experience,"N Anciaux, C Bobineau, L Bouganim, P Pucheral, P Valduriez",VLDB,2001
70842,conf/vldb/MorishimaKKT01,Enabling End-users to Construct Data-intensive Web-sites from XML Repositories: An Example-based Approach,"A Morishima, S Koizumi, H Kitagawa, S Takano",VLDB,2001
70846,conf/sigmod/BrinMUT97,Dynamic Itemset Counting and Implication Rules for Market Basket Data,"S Brin, R Motwani, J Ullman, S Tsur",SIGMOD Conference,1997
70851,conf/sigmod/KornackerMH97,Concurrency and Recovery in Generalized Search Trees,"M Kornacker, C Mohan, J Hellerstein",SIGMOD Conference,1997
70852,conf/vldb/PereiraFJLS01,WebFilter: A High-throughput XML-based Publish and Subscribe System,"J Pereira, F Fabret, H Jacobsen, F Llirbat, D Shasha",VLDB,2001
70860,conf/sigmod/Spiro98,"Ubiquitous, Self-tuning, Scalable Servers",P Spiro,SIGMOD Conference,1998
70866,conf/sigmod/BlakeleyP98,Microsoft Universal Data Access Platform,"J Blakeley, M Pizzo",SIGMOD Conference,1998
70872,conf/sigmod/Mylopoulos98,Panel on Next Generation Database Systems Won't Work Without Semantics!,J Mylopoulos,SIGMOD Conference,1998
70881,conf/vldb/WiesnerK01,Hyperqueries: Dynamic Distributed Query Processing on the Internet,"A Kemper, C Wiesner",VLDB,2001
70884,conf/sigmod/AndersonAF98,Oracle Rdb's Record Caching Model,"R Anderson, G Arun, R Frank",SIGMOD Conference,1998
70888,conf/vldb/BouguettayaEMO01,Ontology-based Support for Digital Government,"A Bouguettaya, A Elmagarmid, B Medjahed, M Ouzzani",VLDB,2001
70892,conf/sigmod/BohrerBBCFHKKMNRRSUUW97,InfoSleuth: Semantic Integration of Information in Open and Dynamic Environments (Experience Paper),"R Jr., W Bohrer, R Brice, A Cichocki, J Fowler, A Helal, V Kashyap, T Ksiezyk, G Martin, M Nodine, M Rashid, M Rusinkiewicz, R Shea, C Unnikrishnan, A Unruh, D Woelk",SIGMOD Conference,1997
70896,conf/vldb/KemperKW99,Generalised Hash Teams for Join and Group-by,"A Kemper, D Kossmann, C Wiesner",VLDB,1999
70897,conf/vldb/Carey00,"Toto, We're Not in Kansas Anymore: On Transitioning from Research to the Real (Invited Industrial Talk)",M Carey,VLDB,2000
70898,conf/sigmod/GravanoCGP97,STARTS: Stanford Proposal for Internet Meta-Searching (Experience Paper),"L Gravano, K Chang, H Garcia-Molina, A Paepcke",SIGMOD Conference,1997
70905,conf/sigmod/MaheshwariL97,Partitioned Garbage Collection of Large Object Store,"U Maheshwari, B Liskov",SIGMOD Conference,1997
70907,conf/sigmod/ZaharioudakisC97,Highly Concurrent Cache Consistency for Indices in Client-Server Database Systems,"M Zaharioudakis, M Carey",SIGMOD Conference,1997
70909,conf/sigmod/ONeilQ97,Improved Query Performance with Variant Indexes,"P O'Neil, D Quass",SIGMOD Conference,1997
70917,conf/sigmod/TsueiPK97,Database Buffer Size Investigation for OLTP Workloads (Experience Paper),"T Tsuei, A Packer, K Ko",SIGMOD Conference,1997
70935,conf/sigmod/RafieiM97,Similarity-Based Queries for Time Series Data,"D Rafiei, A Mendelzon",SIGMOD Conference,1997
70942,conf/sigmod/KornJF97,Efficiently Supporting Ad Hoc Queries in Large Datasets of Time Sequences,"F Korn, H Jagadish, C Faloutsos",SIGMOD Conference,1997
70951,conf/vldb/HinneburgAK00,What Is the Nearest Neighbor in High Dimensional Spaces?,"A Hinneburg, C Aggarwal, D Keim",VLDB,2000
70955,conf/vldb/JiangSLB00,The BT-tree: A Branched and Temporal Access Method,"L Jiang, B Salzberg, D Lomet, M GarcÌa",VLDB,2000
70962,conf/sigmod/SeshadriP97,PREDATOR: An OR-DBMS with Enhanced Data Types,"P Seshadri, M Paskin",SIGMOD Conference,1997
70973,conf/vldb/DiaoLCT00,Toward Learning Based Web Query Processing,"Y Diao, H Lu, S Chen, Z Tian",VLDB,2000
70983,conf/vldb/CeriCW00,Practical Applications of Triggers and Constraints: Success and Lingering Issues (10-Year Award),"S Ceri, R Cochrane, J Widom",VLDB,2000
70989,conf/vldb/BalminPP00,Hypothetical Queries in an OLAP Environment,"A Balmin, T Papadimitriou, Y Papakonstantinou",VLDB,2000
70992,conf/vldb/WangZ00,Using SQL to Build New Aggregates and Extenders for Object- Relational Systems,"H Wang, C Zaniolo",VLDB,2000
70997,conf/sigmod/HammerGNYBV97,Template-Based Wrappers in the TSIMMIS System,"J Hammer, H Garcia-Molina, S Nestorov, R Yerneni, M Breunig, V Vassalos",SIGMOD Conference,1997
70999,conf/vldb/MillerHH00,Schema Mapping as Query Discovery,"R Miller, L Haas, M Hern·ndez",VLDB,2000
71000,conf/sigmod/LiCHH97,SEMCOG: An Object-based Image Retrieval System and Its Visual Query Interface,"W Li, K Candan, K Hirata, Y Hara",SIGMOD Conference,1997
71005,conf/vldb/WangHH00,Mining Frequent Itemsets Using Support Constraints,"K Wang, Y He, J Han",VLDB,2000
71025,conf/sigmod/MogiK96,Hot Mirroring: A Study to Hide Parity Upgrade Penalty and Degradations During Rebuilds for RAID5,"K Mogi, M Kitsuregawa",SIGMOD Conference,1996
71032,conf/sigmod/AdaliCPS96,Query Caching and Optimization in Distributed Mediator Systems,"S Adali, K Candan, Y Papakonstantinou, V Subrahmanian",SIGMOD Conference,1996
71039,conf/sigmod/ChaudhuriG96,Optimizing Queries over Multimedia Repositories,"S Chaudhuri, L Gravano",SIGMOD Conference,1996
71042,conf/sigmod/GoelI96,SQL Query Optimization: Reordering for a General Class of Queries,"P Goel, B Iyer",SIGMOD Conference,1996
71050,conf/vldb/JosifovskiR99,Integrating Heterogenous Overlapping Databases through Object-Oriented Transformations,"V Josifovski, T Risch",VLDB,1999
71058,conf/vldb/GarofalakisRS99,SPIRIT: Sequential Pattern Mining with Regular Expression Constraints,"M Garofalakis, R Rastogi, K Shim",VLDB,1999
71062,conf/vldb/Campbell99,"The New Locking, Logging, and Recovery Architecture of Microsoft SQL Server 7.0",D Campbell,VLDB,1999
71075,conf/vldb/Norvag99,The Persistent Cache: Improving OID Indexing in Temporal Object-Oriented Database Systems,K N¯rvÂg,VLDB,1999
71078,conf/sigmod/Agarwal96,A Super Scalar Sort Algorithm for RISC Processors,R Agarwal,SIGMOD Conference,1996
71082,conf/sigmod/KrishnanVI96,Estimating Alphanumeric Selectivity in the Presence of Wildcards,"P Krishnan, J Vitter, B Iyer",SIGMOD Conference,1996
71092,conf/vldb/DattaRT99,Curio: A Novel Solution for Efficient Storage and Indexing in Data Warehouses,"A Datta, K Ramamritham, H Thomas",VLDB,1999
71105,conf/sigmod/PiatkoYLS96,Thinksheet: A Tool for Tailoring Complex Documents,"P Piatko, R Yangarber, D Lin, D Shasha",SIGMOD Conference,1996
71108,conf/sigmod/Mohan96,State of the Art in Workflow Management Research and Products,,,1996
71125,conf/sigmod/McAuliffeCS96,Towards Effective and Efficient Free Space Management,"M McAuliffe, M Carey, M Solomon",SIGMOD Conference,1996
71127,conf/vldb/AilamakiDHW99,DBMSs on a Modern Processor: Where Does Time Go?,"A Ailamaki, D DeWitt, M Hill, D Wood",VLDB,1999
71130,conf/sigmod/GarofalakisI96,Multi-dimensional Resource Scheduling for Parallel Queries,"M Garofalakis, Y Ioannidis",SIGMOD Conference,1996
71142,conf/vldb/VorugantiOU99,An Adaptive Hybrid Server Architecture for Client Caching ODBMSs,"K Voruganti, M ÷zsu, R Unrau",VLDB,1999
71149,conf/vldb/RezendeS98,Bridging Heterogeneity: Research and Practice of Database Middleware Technology,"F Rezende, G Sauter",VLDB,1998
71152,conf/sigmod/ParkCY95,An Effective Hash Based Algorithm for Mining Association Rules,"J Park, M Chen, P Yu",SIGMOD Conference,1995
71177,conf/vldb/George98,DMS: A Parallel Data Mining Server,F George,VLDB,1998
71181,conf/sigmod/BaruFGHJPW95,An Overview of DB2 Parallel Edition,"C Baru, G Fecteau, A Goyal, H Hsiao, A Jhingran, S Padmanabhan, W Wilson",SIGMOD Conference,1995
71194,conf/sigmod/RadekeBBEKKN95,Efendi: Federated Database System of Cadlab,"E Radeke, R Bˆttger, B Burkert, Y Engel, G Kachel, S Kolmschlag, D Nolte",SIGMOD Conference,1995
71202,conf/vldb/EsterKSWX98,Incremental Clustering for Mining in a Data Warehousing Environment,"M Ester, H Kriegel, J Sander, M Wimmer, X Xu",VLDB,1998
71208,conf/sigmod/WilschutFA95,Parallel Evaluation of Multi-Join Queries,"A Wilschut, J Flokstra, P Apers",SIGMOD Conference,1995
71209,conf/vldb/IshikawaSF98,MindReader: Querying Databases Through Multiple Examples,"Y Ishikawa, R Subramanya, C Faloutsos",VLDB,1998
71214,conf/sigmod/WhiteD95,Implementing Crash Recovery in QuickStore: A Performance Study,"S White, D DeWitt",SIGMOD Conference,1995
71223,conf/sigmod/FreedmanD95,The SPIFFI Scalable Video-on-Demand System,"C Freedman, D DeWitt",SIGMOD Conference,1995
71224,conf/vldb/ChengGKLLQS99,Implementation of Two Semantic Query Optimization Techniques in DB2 Universal Database,"Q Cheng, J Gryz, F Koo, T Leung, L Liu, X Qian, K Schiefer",VLDB,1999
71228,conf/vldb/MengLYWCR98,Determining Text Databases to Search in the Internet,"W Meng, K Liu, C Yu, X Wang, Y Chang, N Rishe",VLDB,1998
71230,conf/vldb/Tygar98,Atomicity versus Anonymity: Distributed Transactions for Electronic Commerce,J Tygar,VLDB,1998
71232,conf/sigmod/Team95c,Upsizing from File Server to Clent Server Architectures,T Team,SIGMOD Conference,1995
71239,conf/vldb/VriesDBA99,The Mirror MMDBMS Architecture,"A Vries, M Doorn, H Blanken, P Apers",VLDB,1999
71249,conf/sigmod/Edelstein95,Research and Products: Are They Relevant To Each Other? (Panel),H Edelstein,SIGMOD Conference,1995
71250,conf/vldb/KnorrN98,Algorithms for Mining Distance-Based Outliers in Large Datasets,"E Knorr, R Ng",VLDB,1998
71252,conf/vldb/Ganguly98,Design and Analysis of Parametric Query Optimization Algorithms,S Ganguly,VLDB,1998
71254,conf/sigmod/French95,``One Size Fits All'' Database Architectures Do Not Work for DDS,C French,SIGMOD Conference,1995
71262,conf/vldb/PapadiasMD98,Algorithms for Querying by Spatial Structure,"D Papadias, N Mamoulis, V Delis",VLDB,1998
71264,conf/sigmod/Deutsch95,Objects and SQL: Strange Relations? Panel,D Deutsch,SIGMOD Conference,1995
71280,conf/sigmod/ShklarSKT95,InfoHarness: A System for Search and Retrieval of Heterogeneous Information,"L Shklar, A Sheth, V Kashyap, S Thatte",SIGMOD Conference,1995
71288,conf/vldb/VassalosP97,Describing and Using Query Capabilities of Heterogeneous Sources,"V Vassalos, Y Papakonstantinou",VLDB,1997
71297,conf/vldb/StathatosRB97,Adaptive Data Broadcast in Hybrid Networks,"K Stathatos, N Roussopoulos, J Baras",VLDB,1997
71312,conf/sigmod/MohanN94,ARIES/CSA: A Method for Database Recovery in Client-Server Architectures,"C Mohan, I Narang",SIGMOD Conference,1994
71324,conf/vldb/MalonM97,Critical Database Technologies for High Energy Physics,"D Malon, E May",VLDB,1997
71325,conf/sigmod/FaloutsosRM94,Fast Subsequence Matching in Time-Series Databases,"C Faloutsos, M Ranganathan, Y Manolopoulos",SIGMOD Conference,1994
71328,conf/vldb/GinisHKMT97,Data Manager for Evolvable Real-time Command and Control Systems,"E Hughes, R Ginis, B Thuraisingham, P Krupp, J Maurer",VLDB,1997
71333,conf/sigmod/VingralekBW94,Distributed File Organization with Scalable Cost/Performance,"R Vingralek, Y Breitbart, G Weikum",SIGMOD Conference,1994
71335,conf/sigmod/ChenR94,Adaptive Selectivity Estimation Using Query Feedback,"C Chen, N Roussopoulos",SIGMOD Conference,1994
71336,conf/vldb/WildfogelY97,Efficient Testing of High Performance Transaction Processing Systems,"D Wildfogel, R Yerneni",VLDB,1997
71345,conf/sigmod/Mohan94,A Survey and Critique of Advanced Transaction Models,C Mohan,SIGMOD Conference,1994
71349,conf/vldb/GeorgeH98,Secure Buffering in Firm Real-Time Database Systems,"B George, J Haritsa",VLDB,1998
71351,conf/vldb/ZouS98,Safely and Efficiently Updating References During On-line Reorganization,"C Zou, B Salzberg",VLDB,1998
71368,conf/sigmod/BersonGMJ94,Staggered Striping in Multimedia Information Systems,"S Berson, S Ghandeharizadeh, R Muntz, X Ju",SIGMOD Conference,1994
71377,conf/vldb/ArunJ98,KODA - The Architecture And Interface of a Data Model Independent Kernel,"G Arun, A Joshi",VLDB,1998
71389,conf/vldb/RoussopoulosK98,The Cubetree Storage Organization,"N Roussopoulos, Y Kotidis",VLDB,1998
71394,conf/vldb/Mina98,MapInfo SpatialWare: A Spatial Information Server for RDBMS,C Mina,VLDB,1998
71395,conf/sigmod/Hellerstein94,Practical Predicate Placement,J Hellerstein,SIGMOD Conference,1994
71407,conf/vldb/AcharyaFZ96,Disseminating Updates on Broadcast Disks,"S Acharya, M Franklin, S Zdonik",VLDB,1996
71410,conf/vldb/GardarinST96,"Calibrating the Query Optimizer Cost Model of IRO-DB, an Object-Oriented Federated Database System","G Gardarin, F Sha, Z Tang",VLDB,1996
71414,conf/sigmod/BryanMCLG94,The MEDUSA Project: Autonomous Data Management in a Shared-Nothing Parallel Database Machine,"G Bryan, W Moore, B Curry, K Lodge, J Geyer",SIGMOD Conference,1994
71417,conf/sigmod/SinghTW94,Relaxed Transaction Processing,"M Singh, C Tomlinson, D Woelk",SIGMOD Conference,1994
71418,conf/vldb/ViverosNR96,Applying Data Mining Techniques to a Health Insurance Information System,"M Viveros, J Nearhos, M Rothman",VLDB,1996
71419,conf/sigmod/DanielsDDEHJJLSSS94,Oracle's Symmetric Replication Technology and Implications for Application Design,"D Daniels, L Doo, A Downing, C Elsbernd, G Hallmark, S Jain, B Jenkins, P Lim, G Smith, B Souder, J Stamos",SIGMOD Conference,1994
71424,conf/vldb/MeoPC96,A New SQL-like Operator for Mining Association Rules,"R Meo, G Psaila, S Ceri",VLDB,1996
71442,conf/sigmod/HanFHCC94,DBLearn: A System Prototype for Knowledge Discovery in Relational Databases,"J Han, Y Fu, Y Huang, Y Cai, N Cercone",SIGMOD Conference,1994
71455,conf/vldb/Moni96,DISNIC-PLAN: A NICNET Based Distributed Database for Micro-level Planning in India,M Moni,VLDB,1996
71478,conf/vldb/ShaferA97,Parallel Algorithms for High-dimensional Similarity Joins for Data Mining Applications,"J Shafer, R Agrawal",VLDB,1997
71488,journals/sigmod/Aberer03d,Book review column,K Aberer,SIGMOD Record,2003
71493,journals/sigmod/Mani03,Understanding the semantics of sensor data,M Mani,SIGMOD Record,2003
71504,conf/vldb/BridgeJKLLM97,The Oracle Universal Server Buffer,"W Bridge, A Joshi, M Keihl, T Lahiri, J Loaiza, N MacNaughton",VLDB,1997
71512,conf/vldb/DesslochM97,Integrating SQL Databases with Content-Specific Search Engines,"S Deþloch, N Mattos",VLDB,1997
71513,conf/vldb/GarofalakisOS97,Resource Scheduling in Enhanced Pay-Per-View Continuous Media Databases,"M Garofalakis, B ÷zden, A Silberschatz",VLDB,1997
71521,journals/sigmod/MotroA03,Report on FQAS 2002: fifth international conference on flexible query answering systems,,,2003
71525,conf/vldb/KraissW97,Vertical Data Migration in Large Near-Line Document Archives Based on Markov-Chain Predictions,"A Kraiss, G Weikum",VLDB,1997
71528,conf/vldb/GarofalakisI97,Parallel Query Scheduling and Optimization with Time- and Space-Shared Resources,"M Garofalakis, Y Ioannidis",VLDB,1997
71529,journals/sigmod/NascimentoSP03,Analysis of SIGMOD's co-authorship graph,"M Nascimento, J Sander, J Pound",SIGMOD Record,2003
71531,conf/vldb/EicklerGK95,A Performance Evaluation of OID Mapping Techniques,"A Eickler, C Gerlhof, D Kossmann",VLDB,1995
71534,journals/sigmod/JukicNV03,Closing the key loophole in MLS databases,"N Jukic, S Nestorov, S Vrbsky",SIGMOD Record,2003
71543,conf/vldb/YanG95,Duplicate Removal in Information System Dissemination,"T Yan, H Garcia-Molina",VLDB,1995
71545,journals/sigmod/CherniakV03,Reminiscences on Influential Papers,,,2003
71554,journals/sigmod/OoiST03,Relational data sharing in peer-based data management systems,"B Ooi, Y Shu, K Tan",SIGMOD Record,2003
71556,journals/sigmod/Hellerstein03,Toward network data independence,J Hellerstein,SIGMOD Record,2003
71560,conf/vldb/Sacks-Davis96,The Structured Information Manager: A Database System for SGML Documents,R Sacks-Davis,VLDB,1996
71562,journals/sigmod/AbererCDDHPS03,P-Grid: a self-organizing structured P2P system,"K Aberer, P CudrÈ-Mauroux, A Datta, Z Despotovic, M Hauswirth, M Punceva, R Schmidt",SIGMOD Record,2003
71568,conf/vldb/RahmM95,Dynamic Multi-Resource Load Balancing in Parallel Database Systems,"E Rahm, R Marek",VLDB,1995
71569,journals/sigmod/Winslett03a,Interview with Michael Stonebraker,,,2003
71573,journals/sigmod/Nascimento03,Peer-to-peer: harnessing the power of disruptive technologies,M Nascimento,SIGMOD Record,2003
71579,journals/sigmod/FifeG03,Research issues for data communication in mobile ad-hoc network database systems,"L Fife, L Gruenwald",SIGMOD Record,2003
71581,conf/vldb/SteinbrunnPMK95,Bypassing Joins in Disjunctive Queries,"M Steinbrunn, K Peithner, G Moerkotte, A Kemper",VLDB,1995
71589,journals/sigmod/Vianu03,A Web odyssey: from codd to XML,V Vianu,SIGMOD Record,2003
71591,journals/sigmod/Aberer03b,Book review column,K Aberer,SIGMOD Record,2003
71604,conf/vldb/Suciu96a,Implementation and Analysis of a Parallel Collection Query Language,D Suciu,VLDB,1996
71612,conf/vldb/PapadiasZMT03,Query Processing in Spatial Network Databases,"D Papadias, J Zhang, N Mamoulis, Y Tao",VLDB,2003
71618,conf/vldb/KoudasGGSV03,Efficient Approximation Of Optimization Queries Under Parametric Aggregation Constraints,"S Guha, D Gunopulos, N Koudas, D Srivastava, M Vlachos",VLDB,2003
71632,conf/vldb/Galindo-LegariaJWW03,Statistics on Views,"C Galindo-Legaria, M Joshi, F Waas, M Wu",VLDB,2003
71641,conf/vldb/GalanisWJD03,Locating Data Sources in Large Distributed Systems,"L Galanis, Y Wang, S Jeffery, D DeWitt",VLDB,2003
71645,conf/vldb/FernandezSCMS03,Implementing Xquery 1.0: The Galax Experience,"M Fernandez, J SimÈon, B Choi, A Marian, G Sur",VLDB,2003
71648,conf/vldb/ArionBCDMP03,Xquec: Pushing Queries to Compressed XML Data,"A Arion, A Bonifati, G Costa, S D'Aguanno, I Manolescu, A Pugliese",VLDB,2003
71649,conf/vldb/AbiteboulBBCCDMMP03,Managing Distributed Workspaces with Active XML,"S Abiteboul, J Baumgarten, A Bonifati, G Cobena, C Cremarenco, F Dragan, I Manolescu, T Milo, N Preda",VLDB,2003
71662,conf/vldb/Baumann03,"Large-Scale, Standards-Based Earth Observation Imagery and Web Mapping Services",P Baumann,VLDB,2003
71663,conf/vldb/SattlerGS03,QUIET: Continuous Query-driven Index Tuning,"K Sattler, I Geist, E Schallehn",VLDB,2003
71665,conf/vldb/WangSG03,An Interpolated Volume Data Model,"T Wang, S Santini, A Gupta",VLDB,2003
71671,conf/vldb/NieKH03,BibFinder/StatMiner: Effectively Mining and Using Coverage and Overlap Statistics in Data Integration,"Z Nie, S Kambhampati, T Hernandez",VLDB,2003
71676,conf/vldb/EleftheriouBCDHLPPABDDDGJHLRSVW03,A Nanotechnology-based Approach to Data Storage,"E Eleftheriou, P B‰chtold, G Cherubini, A Dholakia, C Hagleitner, T Loeliger, A Pantazi, H Pozidis, T Albrecht, G Binnig, M Despont, U Drechsler, U D¸rig, B Gotsmann, D Jubin, W H‰berle, M Lantz, H Rothuizen, R Stutz, P Vettiger, D Wiesmann",VLDB,2003
71680,conf/vldb/RaghavanG03,Complex Queries over Web Repositories,"S Raghavan, H Garcia-Molina",VLDB,2003
71684,conf/vldb/ChenDZ03,RRXF: Redundancy reducing XML storage in relations,"Y Chen, S Davidson, C Hara, Y Zheng",VLDB,2003
71689,conf/vldb/Koch03,Efficient Processing of Expressive Node-Selecting Queries on XML Data in Secondary Storage: A Tree Automata-based Approach,C Koch,VLDB,2003
71701,conf/vldb/ChenL03,VIPAS: Virtual Link Powered Authority Search in the Web,"C Lin, M Chen",VLDB,2003
71703,conf/vldb/ZhouS03,Data Bubbles for Non-Vector Data: Speeding-up Hierarchical Clustering in Arbitrary Metric Spaces,"J Zhou, J Sander",VLDB,2003
71705,conf/vldb/HinneburgLH03,COMBI-Operator: Database Support for Data Mining Applications,"A Hinneburg, W Lehner, D Habich",VLDB,2003
71709,conf/vldb/ViglasNB03,Maximizing the Output Rate of Multi-Way Join Queries over Streaming Information Sources,"S Viglas, J Naughton, J Burger",VLDB,2003
71712,conf/vldb/LernerS03,"AQuery: Query Language for Ordered Data, Optimization Techniques, and Experiments","A Lerner, D Shasha",VLDB,2003
71718,conf/vldb/MadhavanH03,Composing Mappings Among Data Sources,"J Madhavan, A Halevy",VLDB,2003
71728,conf/vldb/LubbersGJ03,Systematic Development of Data Mining-Based Data Quality Tools,"D L¸bbers, U Grimmer, M Jarke",VLDB,2003
71729,conf/vldb/IwerksSS03,Continuous K-Nearest Neighbor Queries for Continuously Moving Points with Updates,"G Iwerks, H Samet, K Smith",VLDB,2003
71732,conf/vldb/DaynesC02,Lightweight Flexible Isolation for Language-based Extensible Systems,"L DaynËs, G Czajkowski",VLDB,2002
71739,conf/vldb/PalpanasSCP02,Incremental Maintenance for Non-Distributive Aggregate Functions,"T Palpanas, R Sidle, R Cochrane, H Pirahesh",VLDB,2002
71740,conf/vldb/KornMS02,Reverse Nearest Neighbor Aggregates Over Data Streams,"F Korn, S Muthukrishnan, D Srivastava",VLDB,2002
71741,conf/vldb/ChanFFGR02,Tree Pattern Aggregation for Scalable XML Data Dissemination,"C Chan, W Fan, P Felber, M Garofalakis, R Rastogi",VLDB,2002
71743,conf/vldb/RohmBSS02,FAS - A Freshness-Sensitive Coordination Middleware for a Cluster of OLAP Components,"U Rˆhm, K Bˆhm, H Schek, H Schuldt",VLDB,2002
71751,conf/vldb/Fox02,Toward Recovery-Oriented Computing,A Fox,VLDB,2002
71754,conf/vldb/LohmanL02,SMART: Making DB2 (More) Autonomic,"G Lohman, S Lightstone",VLDB,2002
71767,conf/vldb/OhuraTPK02,Experiments on Query Expansion for Internet Yellow Page Services Using Web Log Mining,"Y Ohura, K Takahashi, I Pramudiono, M Kitsuregawa",VLDB,2002
71774,conf/vldb/SantiniG02,GeMBASE: A Geometric Mediator for Brain Analysis with Surface Ensembles,"S Santini, A Gupta",VLDB,2002
71786,conf/vldb/AbiteboulBMMW02,Active XML: Peer-to-Peer Data and Web Services Integration,"S Abiteboul, O Benjelloun, I Manolescu, T Milo, R Weber",VLDB,2002
71802,conf/vldb/ChakrabartiRS02,Fast and Accurate Text Classification via Multiple Linear Discriminant Projections,"S Chakrabarti, S Roy, M Soundalgekar",VLDB,2002
71815,conf/vldb/Moerkotte02,Incorporating XSL Processing into Database Engines,G Moerkotte,VLDB,2002
71821,conf/vldb/GhoshPSH02,Plan Selection Based on Query Clustering,"A Ghosh, J Parikh, V Sengar, J Haritsa",VLDB,2002
71840,conf/vldb/LimWPVP02,XPathLearner: An On-line Self-Tuning Markov Histogram for XML Path Selectivity Estimation,"L Lim, M Wang, S Padmanabhan, J Vitter, R Parr",VLDB,2002
71841,conf/vldb/IpeirotisG02,Distributed Search over the Hidden Web: Hierarchical Database Sampling and Selection,"P Ipeirotis, L Gravano",VLDB,2002
71842,conf/vldb/Keogh02,Exact Indexing of Dynamic Time Warping,E Keogh,VLDB,2002
71846,conf/vldb/GilbertKMS02,How to Summarize the Universe: Dynamic Maintenance of Quantiles,"A Gilbert, Y Kotidis, S Muthukrishnan, M Strauss",VLDB,2002
71849,conf/vldb/ChoN02,Effective Change Detection Using Sampling,"J Cho, A Ntoulas",VLDB,2002
71850,conf/vldb/BettiniJWW02,Provisions and Obligations in Policy Management and Security Applications,"C Bettini, S Jajodia, X Wang, D Wijesekera",VLDB,2002
71853,conf/vldb/CandanALPH02,View Invalidation for Dynamic Content Caching in Multitiered Architectures,"K Candan, D Agrawal, W Li, O Po, W Hsiung",VLDB,2002
71859,journals/tods/AikenHW95,Static Analysis Techniques for Predicting the Behavior of Active Database Rules,"A Aiken, J Hellerstein, J Widom",ACM Trans. Database Syst.,1995
71860,journals/tods/Chen95,Declarative Updates of Relational Databases,W Chen,ACM Trans. Database Syst.,1995
71861,journals/tods/Jagadish95,The INCINERATE Data Model,H Jagadish,ACM Trans. Database Syst.,1995
71868,journals/tods/Chen95a,Query Evaluation in Deductive Databases with Alternating Fixpoint Semantics,W Chen,ACM Trans. Database Syst.,1995
71880,journals/tods/DeyS96,A Probabilistic Relational Model and Algebra,"D Dey, S Sarkar",ACM Trans. Database Syst.,1996
71900,journals/vldb/Li03,Computing complete answers to queries in the presence of limited access patterns,C Li,VLDB J.,2003
71901,journals/vldb/HalkidiNVV03,THESUS: Organizing Web document collections based on link semantics,"M Halkidi, B Nguyen, I Varlamis, M Vazirgiannis",VLDB J.,2003
71916,journals/tods/RosenthalR94,Tools and Transformations - Rigorous and Otherwise - for Practical Database Design,"A Rosenthal, D Reiner",ACM Trans. Database Syst.,1994
71920,journals/tods/CeriFPT94,Automatic Generation of Production Rules for Integrity Maintenance,"S Ceri, P Fraternali, S Paraboschi, L Tanca",ACM Trans. Database Syst.,1994
71930,journals/tods/MuralidharS99,Security of Random Data Perturbation Methods,"K Muralidhar, R Sarathy",ACM Trans. Database Syst.,1999
71938,journals/tods/BaralisW00,An algebraic approach to static analysis of active database rules,"E Baralis, J Widom",ACM Trans. Database Syst.,2000
