tid,id,title,authors,venue,year
71940,journals/tods/EiterLLS01,Probabilistic object bases,"T Eiter, J Lu, T Lukasiewicz, V Subrahmanian",ACM Trans. Database Syst.,2001
71949,journals/tods/LiuDL02,A logical foundation for deductive object-oriented databases,"M Liu, G Dobbie, T Ling",ACM Trans. Database Syst.,2002
71952,journals/tods/KotidisR01,A case for dynamic view management,"Y Kotidis, N Roussopoulos",ACM Trans. Database Syst.,2001
71958,journals/tods/ZaharioudakisCF97,"Adaptive, Fine-Grained Sharing in a Client-Server OODBMS: A Callback-Based Approach","M Zaharioudakis, M Carey, M Franklin",ACM Trans. Database Syst.,1997
71970,journals/tods/Revesz98,Safe Query Languages for Constraint Databases,P Revesz,ACM Trans. Database Syst.,1998
71973,journals/tods/Wijsen99,Temporal FDs on Complex Objects,J Wijsen,ACM Trans. Database Syst.,1999
71979,journals/tods/BozkayaO99,Indexing Large Metric Spaces for Similarity Search Queries,"T Bozkaya, Z ÷zsoyoglu",ACM Trans. Database Syst.,1999
71983,journals/tods/HjaltasonS99,Distance Browsing in Spatial Databases,"G Hjaltason, H Samet",ACM Trans. Database Syst.,1999
71987,journals/vldb/AslanM99,Semantic Heterogeneity Resolution in Federated Databases by Metadata Implantation and Stepwise Evolution,"G Aslan, D McLeod",VLDB J.,1999
71993,journals/vldb/LawLG99,Efficient Support for Interactive Service in Multi-Resolution VOD Systems,"K Law, J Lui, L Golubchik",VLDB J.,1999
71996,journals/vldb/OzsuC98,Introduction (Special Issue on Multimedia Databases),"M ÷zsu, S Christodoulakis",VLDB J.,1998
72001,journals/vldb/BalkirO98,Delivering Presentations from Multimedia Servers,"N Balkir, G ÷zsoyoglu",VLDB J.,1998
72002,journals/vldb/ZezulaSAR98,Approximate Similarity Retrieval with M-Trees,"P Zezula, P Savino, G Amato, F Rabitti",VLDB J.,1998
72005,journals/vldb/BunemanFS00,UnQL: A Query Language and Algebra for Semistructured Data Based on Structural Recursion,"P Buneman, M Fernandez, D Suciu",VLDB J.,2000
72006,journals/vldb/BraumandlCKK00,Functional-Join Processing,"R Braumandl, J Clauþen, A Kemper, D Kossmann",VLDB J.,2000
72012,journals/vldb/MuthOPW00,The LHAM Log-Structured History Data Access Method,"P Muth, P O'Neil, A Pick, G Weikum",VLDB J.,2000
72020,journals/vldb/PanagosB97,Synchronization and Recovery in a Client-Server Storage System,"E Panagos, A Biliris",VLDB J.,1997
72021,journals/vldb/Cobb97,The Impact of Technology on Commercial Transaction Processing,E Cobb,VLDB J.,1997
72023,journals/vldb/SteinbrunnMK97,Heuristic and Randomized Optimization for the Join Ordering Problem,"M Steinbrunn, G Moerkotte, A Kemper",VLDB J.,1997
72028,journals/vldb/Antoshenkov97,Dictionary-Based Order-Preserving String Compression,G Antoshenkov,VLDB J.,1997
72037,journals/vldb/ChakrabartiDAR98,"Scalable Feature Selection, Classification and Signature Generation for Organizing Large Text Databases into Hierarchical Topic Taxonomies","S Chakrabarti, B Dom, R Agrawal, P Raghavan",VLDB J.,1998
72044,journals/vldb/FahlR97,Query Processing Over Object Views of Relational Data,"G Fahl, T Risch",VLDB J.,1997
72055,journals/vldb/FengYLH02,A template model for multidimensional inter-transactional association rules,"L Feng, J Yu, H Lu, J Han",VLDB J.,2002
72059,journals/vldb/FerrariAABC02,An authorization system for digital libraries,"E Ferrari, N Adam, V Atluri, E Bertino, U Capuozzo",VLDB J.,2002
72082,journals/vldb/ChirkovaHS02,A formal perspective on the view selection problem,"R Chirkova, A Halevy, D Suciu",VLDB J.,2002
72089,journals/vldb/LiCHH01,Supporting efficient multimedia database exploration,"W Li, K Candan, K Hirata, Y Hara",VLDB J.,2001
72091,journals/vldb/ManegoldBK00,Optimizing database architecture for the new bottleneck: memory access,"S Manegold, P Boncz, M Kersten",VLDB J.,2000
72102,journals/vldb/TurkerG01,Semantic integrity support in SQL: 1999 and commercial (object-)relational database management systems,"C T¸rker, M Gertz",VLDB J.,2001
72105,journals/vldb/ChangG01,Approximate query mapping: Accounting for translation closeness,"K Chang, H Garcia-Molina",VLDB J.,2001
72107,journals/vldb/MecellaP01,Designing wrapper components for e-services in integrating heterogeneous systems,"M Mecella, B Pernici",VLDB J.,2001
72130,journals/vldb/AntoshenkovZ96,Query Processing and Optimization in Oracle Rdb,"G Antoshenkov, M Ziauddin",VLDB J.,1996
72138,journals/vldb/AtkinsonM95,Orthogonally Persistent Object Systems,"M Atkinson, R Morrison",VLDB J.,1995
72139,journals/vldb/StonebrakerALPSSSY96,Mariposa: A Wide-Area Distributed Database System,"M Stonebraker, P Aoki, W Litwin, A Pfeffer, A Sah, J Sidell, C Staelin, A Yu",VLDB J.,1996
72142,journals/vldb/SivasankaranSTPR96,Priority Assignment in Real-Time Active Databases,"R Sivasankaran, J Stankovic, D Towsley, B Purimetla, K Ramamritham",VLDB J.,1996
72147,journals/vldb/CliftonGB95,HyperFile: A Data and Query Model for Documents,"C Clifton, H Garcia-Molina, D Bloom",VLDB J.,1995
72164,journals/vldb/RamakrishnanSSS94,The CORAL Deductive System,"R Ramakrishnan, D Srivastava, S Sudarshan, P Seshadri",VLDB J.,1994
72165,journals/vldb/VaghaniRKSSLH94,The Aditi Deductive Database System,"J Vaghani, K Ramamohanarao, D Kemp, Z Somogyi, P Stuckey, T Leask, J Harland",VLDB J.,1994
72171,journals/vldb/LinJF94,The TV-Tree: An Index Structure for High-Dimensional Data,"K Lin, H Jagadish, C Faloutsos",VLDB J.,1994
72172,journals/vldb/LeeW94,Efficiently Instantiating View-Objects From Remote Relational Databases,"B Lee, G Wiederhold",VLDB J.,1994
72181,journals/sigmod/Liu03,Editor's Notes,L Liu,SIGMOD Record,2003
72188,conf/vldb/Suciu96,Query Decomposition and View Maintenance for Query Languages for Unstructured Data,D Suciu,VLDB,1996
72192,conf/vldb/LevyRO96,Querying Heterogeneous Information Sources Using Source Descriptions,"A Levy, A Rajaraman, J Ordille",VLDB,1996
72193,journals/sigmod/WinslettMY03,Two-Body Job Searches,"M Winslett, X Ma, T Yu",SIGMOD Record,2003
72194,conf/vldb/ShethKMWDLPLS96,Supporting State-Wide Immunisation Tracking Using Multi-Paradigm Workflow Technology,"A Sheth, K Kochut, J Miller, D Worah, S Das, C Lin, D Palaniswami, J Lynch, I Shevchenko",VLDB,1996
72195,conf/vldb/Kleewein96,Practical Issues with Commercial Use of Federated Databases,J Kleewein,VLDB,1996
72203,journals/sigmod/GroskySF02,Emergent Semantics and the Multimedia Semantic Web,"W Grosky, D Sreenath, F Fotouhi",SIGMOD Record,2002
72221,journals/sigmod/RossGN03,Reminiscences an Influential Papers,,,2003
