tid,id,title,authors,venue,year
69611,conf/vldb/RusinkiewiczKTWM95,Towards a Cooperative Transaction Model - The Cooperative Activity Model,"M Rusinkiewicz, W Klas, T Tesch, J W‰sch, P Muth",VLDB,1995
69613,conf/vldb/AmmannJR95,Using Formal Methods to Reason about Semantics-Based Decompositions of Transactions,"P Ammann, S Jajodia, I Ray",VLDB,1995
69626,conf/vldb/TreschPL95,Type Classification of Semi-Structured Documents,"M Tresch, N Palmer, A Luniewski",VLDB,1995
69634,journals/sigmod/Kemper02,Databases and Transaction Processing: An Application-Oriented Approach - Book Review,A Kemper,SIGMOD Record,2002
69648,journals/sigmod/HalkidiBV02,Cluster Validity Methods: Part I,"M Halkidi, Y Batistakis, M Vazirgiannis",SIGMOD Record,2002
69649,journals/sigmod/PourabbasR02,A Pictorial Query Language for Querying Geographic Databases using Positional and OLAP Operators,"E Pourabbas, M Rafanelli",SIGMOD Record,2002
69650,conf/vldb/HoelS95,Benchmarking Spatial Join Operations with Spatial Output,"E Hoel, H Samet",VLDB,1995
69656,conf/vldb/OrensteinK95,Accessing a Relational Database through an Object-Oriented Database Interface,"J Orenstein, D Kamber",VLDB,1995
69659,journals/sigmod/Wiegand02,Investigating XQuery for Querying Across Database Object Types,N Wiegand,SIGMOD Record,2002
69662,conf/vldb/WienerN95,OODB Bulk Loading Revisited: The Partitioned-List Approach,"J Wiener, J Naughton",VLDB,1995
69663,journals/sigmod/Ozsu02,Chair's Message,,,2002
69667,conf/vldb/GoyalHSS95,Index Concurrency Control in Firm Real-Time Database Systems,"B Goyal, J Haritsa, S Seshadri, V Srinivasan",VLDB,1995
69681,journals/sigmod/Weikum02,Foundations of Statistical Natural Language Processing - Book Review,,,2002
69684,journals/sigmod/Neven02,Automata Theory for XML Researchers,F Neven,SIGMOD Record,2002
69690,conf/vldb/OuzzaniAB94,A Top-Down Approach for Two Level Serializability,"M Ouzzani, M Atroun, N Belkhodja",VLDB,1994
69700,conf/vldb/JohnsonS94,2Q: A Low Overhead High Performance Buffer Management Replacement Algorithm,"T Johnson, D Shasha",VLDB,1994
69708,conf/vldb/HaberIL95,OPOSSUM: Desk-Top Schema Management through Customizable Visualization,"E Haber, Y Ioannidis, M Livny",VLDB,1995
69716,journals/sigmod/FininJ02,"Agents, Turst, and Information Access on the Semantic Web","T Finin, A Joshi",SIGMOD Record,2002
69717,journals/sigmod/SureSS02,Methodology for Development and Employment of Ontology Based Knowledge Management Applications,"Y Sure, S Staab, R Studer",SIGMOD Record,2002
69718,conf/vldb/Brin95,Near Neighbor Search in Large Metric Spaces,S Brin,VLDB,1995
69730,conf/vldb/SimonD95,Promises and Realities of Active Database Systems,"E Simon, A Dittrich",VLDB,1995
69731,conf/vldb/CatozziR95,OS Support for VLDBs: Unix Enhancements for the Teradata Data Base,"J Catozzi, S Rabinovici",VLDB,1995
69745,journals/sigmod/SchmidtWKFCMB01,Why And How To Benchmark XML Databases,"A Schmidt, F Waas, M Kersten, D Florescu, M Carey, I Manolescu, R Busse",SIGMOD Record,2001
69747,journals/sigmod/Lomet01,The Evolution of Effective B-tree: Page Organization and Techniques: A Personal Account,D Lomet,SIGMOD Record,2001
69749,journals/sigmod/TanakaV01,The Ecobase Project: Database and Web Technologies for Environmental Information Systems,"A Tanaka, P Valduriez",SIGMOD Record,2001
69751,conf/vldb/LiC94,Semantic Integration in Heterogeneous Databases Using Neural Networks,"W Li, C Clifton",VLDB,1994
69752,journals/sigmod/ChienTZ01,XML Document Versioning,"S Chien, V Tsotras, C Zaniolo",SIGMOD Record,2001
69754,journals/sigmod/LudascherMM01,"Preservation of Digital Data with Self-Validating, Self-Instantiating Knowledge-Based Archives","B Lud‰scher, R Marciano, R Moore",SIGMOD Record,2001
69766,conf/vldb/SreenathS94,The hcC-tree: An Efficient Index Structure for Object Oriented Databases,"B Sreenath, S Seshadri",VLDB,1994
69786,journals/sigmod/Labrinidis01,Introduction to the Career Forum Column,A Labrinidis,SIGMOD Record,2001
69789,journals/sigmod/Huyn01,Data Analysis and Mining in the Life Sciences,N Huyn,SIGMOD Record,2001
69797,journals/sigmod/Hammer01,Treasurer's Message,,,2001
69800,conf/vldb/RosenthalS94,Data Integration in the Large: The Challenge of Reuse,"A Rosenthal, L Seligman",VLDB,1994
69808,journals/sigmod/BarbaraCJW01,ADAM: A Testbed for Exploring the Use of Data Mining in Intrusion Detection,"D Barbar·, J Couto, S Jajodia, N Wu",SIGMOD Record,2001
69825,journals/sigmod/Scholl01,Transactional Information Systems - Book Review,,,2001
69828,journals/sigmod/Jagadish01,Information Warfare and Security - Book Review,,,2001
69840,journals/sigmod/SommerGB02,The n-Tier Hub Technology,"R Sommer, T Gulledge, D Bailey",SIGMOD Record,2002
69844,conf/vldb/MedianoCD94,V-Trees - A Storage Method for Long Vector Data,"M Mediano, M Casanova, M Dreux",VLDB,1994
69850,conf/vldb/ChawatheCY94,On Index Selection Schemes for Nested Object Hierarchies,"S Chawathe, M Chen, P Yu",VLDB,1994
69864,journals/sigmod/Elderini02,Letter to SIGMOD Record Editor,N Elderini,,2002
69873,conf/sigmod/Al-KhalifaYJ03,Querying Structured Text in an XML Database,"S Al-Khalifa, C Yu, H Jagadish",SIGMOD Conference,2003
69879,journals/sigmod/RossFLOSSVW00,Reminiscences on Influential Papers,,,2000
69883,conf/sigmod/JohnsonD03,Data Quality and Data Cleaning: An Overview,"T Johnson, T Dasu",SIGMOD Conference,2003
69888,journals/sigmod/Snodgrass00,Chair's Message,,,2000
69893,journals/sigmod/LiefkeS00,An Extensible Compressor for XML Data,"H Liefke, D Suciu",SIGMOD Record,2000
69897,journals/sigmod/PourabbasR00,Hierarchies and Relative Operators in the OLAP Environment,"E Pourabbas, M Rafanelli",SIGMOD Record,2000
69903,journals/sigmod/Palpanas00,Knowledge Discovery in Data Warehouses,T Palpanas,SIGMOD Record,2000
69908,journals/sigmod/WestmannKHM00,The Implementation and Performance of Compressed Databases,"T Westmann, D Kossmann, S Helmer, G Moerkotte",SIGMOD Record,2000
69909,conf/sigmod/BornhovdAKMPR03,DBCache: Middle-tier Database Caching for Highly Scalable e-Business Architectures,"C Bornhˆvd, M Altinel, S Krishnamurthy, C Mohan, H Pirahesh, B Reinwald",SIGMOD Conference,2003
69914,conf/sigmod/CranorJSS03,Gigascope: A Stream Database for Network Applications,"C Cranor, T Johnson, O Spatscheck, V Shkapenyuk",SIGMOD Conference,2003
69922,journals/sigmod/LudwigG00,Report in ISDO '00: The CAiSE*00 Workshop on Infrastructures for Dynamic Business-to-Business Service Outsourcinga,,,2000
69925,conf/sigmod/LiBKN03,Composing XSL Transformations with XML Publishing Views,"C Li, P Bohannon, H Korth, P Narayan",SIGMOD Conference,2003
69929,journals/sigmod/Ley00,SIGMOD Anthology Editor's Message,,,2000
69934,conf/sigmod/Raghavan03,Extracting and Exploiting Structure in Text Search,P Raghavan,SIGMOD Conference,2003
69942,journals/sigmod/PoessF00,New TPC Benchmarks for Decision Support and Web Commerce,"M Pˆss, C Floyd",SIGMOD Record,2000
69943,conf/sigmod/GotoK03,Integration of Electronic Tickets and Personal Guide System for Public Transport using Mobile Terminals,"K Goto, Y Kambayashi",SIGMOD Conference,2003
69959,conf/sigmod/Bosworth03,The Future of Web Services - I,A Bosworth,SIGMOD Conference,2003
69966,conf/sigmod/ChaudhuriGGM03,Robust and Efficient Fuzzy Match for Online Data Cleaning,"S Chaudhuri, K Ganjam, V Ganti, R Motwani",SIGMOD Conference,2003
69969,conf/sigmod/StoltePAG03,Scientific Data Repositories: Designing for a Moving Target,"E Stolte, C Praun, G Alonso, T Gross",SIGMOD Conference,2003
69983,conf/sigmod/Dyreson03,"Temporal Coalescing with Now, Granularity, and Incomplete Information",C Dyreson,SIGMOD Conference,2003
69984,journals/sigmod/RossCGLLM01,Reminiscences on Influential Papers,,,2001
69991,conf/sigmod/HeC03,Statistical Schema Matching across Web Query Interfaces,"B He, K Chang",SIGMOD Conference,2003
69992,journals/sigmod/LawderK01,Querying Multi-dimensional Data Indexed Using the Hilbert Space-filling Curve,"J Lawder, P King",SIGMOD Record,2001
69994,journals/sigmod/PuSW01,Infosphere Project: System Support for Information Flow Applications,"C Pu, K Schwan, J Walpole",SIGMOD Record,2001
70000,journals/sigmod/MeltzerC98,XML and Electronic Commerce: Enabling the Network Economy,"B Meltzer, R Glushko",SIGMOD Record,1998
70004,journals/sigmod/Franklin98a,Editor's Notes,M Franklin,SIGMOD Record,1998
70017,conf/sigmod/Chamberlin03,XQuery: A Query Language for XML,,,2003
70019,journals/sigmod/Dogac98,Guest Editor's Introduction,,,1998
70026,conf/sigmod/SengarH03,PLASTIC: Reducing Query Optimization Overheads through Plan Recycling,"V Sengar, J Haritsa",SIGMOD Conference,2003
70031,conf/sigmod/ZhangDWEMPMDR03,Rainbow: Multi-XQuery Optimization Using Materialized XML Views,"X Zhang, K Dimitrova, L Wang, M El-Sayed, B Murphy, B Pielech, M Mulchandani, L Ding, E Rundensteiner",SIGMOD Conference,2003
70044,conf/sigmod/Amer-YahiaFSX03,PIX: Exact and Approximate Phrase Matching in XML,"S Amer-Yahia, M Fernandez, D Srivastava, Y Xu",SIGMOD Conference,2003
70045,conf/sigmod/ArasuBBDIRW03,STREAM: The Stanford Stream Data Manager,"A Arasu, B Babcock, S Babu, M Datar, K Ito, I Nishizawa, J Rosenstein, J Widom",SIGMOD Conference,2003
70051,conf/sigmod/OoiTZGLLLNSWZ03,PeerDB: Peering into Personal Databases,"B Ooi, K Tan, A Zhou, C Goh, Y Li, C Liau, B Ling, W Ng, Y Shu, X Wang, M Zhang",SIGMOD Conference,2003
70064,conf/sigmod/ViglasN02,Rate-based query optimization for streaming information sources,"S Viglas, J Naughton",SIGMOD Conference,2002
70066,journals/sigmod/FowlerPNB99,Agent-Based Semantic Interoperability in InfoSleuth,"J Fowler, B Perry, M Nodine, B Bargmeyer",SIGMOD Record,1999
70071,journals/sigmod/Snodgrass99,Chair's Message,,,1999
70073,journals/sigmod/Kim99,"Message from Editor-in-Chief, ACM Transactions on Database Systems",W Kim,,1999
70084,journals/sigmod/YauLMS99,On Multi-Resolution Document Transmission in Mobile Web,"S Yau, H Leong, D McLeod, A Si",SIGMOD Record,1999
70094,journals/sigmod/Franklin99a,Editor's Notes,M Franklin,SIGMOD Record,1999
70100,conf/sigmod/Aggarwal02,"Hierarchical subspace sampling: a unified framework for high dimensional data reduction, selectivity estimation and nearest neighbor search",C Aggarwal,SIGMOD Conference,2002
70111,journals/sigmod/Libkin99,"Some Remarks on Variable Independence, Closure, and Orthographic Dimension in Constraint Databases",L Libkin,SIGMOD Record,1999
70112,conf/sigmod/ProcopiucJAM02,A Monte Carlo algorithm for fast projective clustering,"C Procopiuc, M Jones, P Agarwal, T Murali",SIGMOD Conference,2002
70114,journals/sigmod/Libkin99a,Database Principles Column - Introduction,L Libkin,SIGMOD Record,1999
70115,conf/sigmod/BrunoC02,Exploiting statistics on query expressions for optimization,"N Bruno, S Chaudhuri",SIGMOD Conference,2002
70118,journals/sigmod/RossCGJBV99,Reminiscences on Influential Papers,,,1999
70121,conf/sigmod/GaoW02,Continually evaluating similarity-based pattern queries on a streaming time series,"L Gao, X Wang",SIGMOD Conference,2002
70126,conf/sigmod/DobraGGR02,Processing complex aggregate queries over data streams,"A Dobra, M Garofalakis, J Gehrke, R Rastogi",SIGMOD Conference,2002
70137,conf/sigmod/PapakonstantinouPV02,QURSED: querying and reporting semistructured data,"Y Papakonstantinou, M Petropoulos, V Vassalos",SIGMOD Conference,2002
70138,journals/sigmod/Suciu97,Foreword: Management of Semistructured Data,,,1997
70144,journals/sigmod/Franklin97a,Editor's Notes,M Franklin,SIGMOD Record,1997
70145,journals/sigmod/DadamK97,The Database and Information System Research Group at the University of Ulm,"P Dadam, W Klas",SIGMOD Record,1997
70146,conf/sigmod/RamanH02,Partial results for online query processing,"V Raman, J Hellerstein",SIGMOD Conference,2002
70148,journals/sigmod/ConradEHRSSSV97,Research Issues in Federated Database Systems: Report of EFDBS '97 Workshop,,,1997
70150,journals/sigmod/McClatcheyV97,Workshop on Workflow Management in Scientific and Engineering Applications - Report,,,1997
70152,journals/sigmod/Seligman97,Industry Perspectives,L Seligman,SIGMOD Record,1997
70157,journals/sigmod/BarbaraS97,Quasi-Cubes: Exploiting Approximations in Multidimensional Databases,"D Barbar·, M Sullivan",SIGMOD Record,1997
70166,conf/sigmod/SzalayGTKMRSv02,The SDSS skyserver: public access to the sloan digital sky server data,"A Szalay, J Gray, A Thakar, P Kunszt, T Malik, J Raddick, C Stoughton, J vandenBerg",SIGMOD Conference,2002
70174,conf/sigmod/LuoKMPWLN02,Middle-tier database caching for e-business,"Q Luo, S Krishnamurthy, C Mohan, H Pirahesh, H Woo, B Lindsay, J Naughton",SIGMOD Conference,2002
70178,journals/sigmod/Franklin97,Editor's Notes,,,1997
70185,conf/sigmod/ChenRW02,XCache: a semantic caching system for XML queries,"L Chen, E Rundensteiner, S Wang",SIGMOD Conference,2002
70203,conf/sigmod/BreunigKKS01,Data Bubbles: Quality Preserving Performance Boosting for Hierarchical Clustering,"M Breunig, H Kriegel, P Krˆger, J Sander",SIGMOD Conference,2001
70217,journals/sigmod/BorgidaCS98,KRDB '98: The 5th International Workshop on Knowledge Representation Meets Databases,,,1998
70241,conf/sigmod/SchusterW01,Communication Efficient Distributed Mining of Association Rules,"A Schuster, R Wolff",SIGMOD Conference,2001
70252,journals/sigmod/ACT-NET96,ACT-NET - The Active Database Management System Manifesto: A Rulebase of ADBMS Features,,SIGMOD Record,1996
70257,conf/sigmod/LangS01,Modeling High-Dimensional Index Structures using Sampling,"C Lang, A Singh",SIGMOD Conference,2001
70283,conf/sigmod/AgichteinGV01,Snowball: A Prototype System for Extracting Relations from Large Text Collections,"E Agichtein, L Gravano, J Pavel, V Sokolova, A Voskoboynik",SIGMOD Conference,2001
70291,journals/sigmod/KuoM96,Real-Time Database - Similarity Semantics and Resource Scheduling,"T Kuo, A Mok",SIGMOD Record,1996
70306,conf/sigmod/BrunoCG01,STHoles: A Multidimensional Workload-Aware Histogram,"N Bruno, S Chaudhuri, L Gravano",SIGMOD Conference,2001
70314,conf/sigmod/ChenGK01,Query Optimization In Compressed Database Systems,"Z Chen, J Gehrke, F Korn",SIGMOD Conference,2001
70318,conf/sigmod/WynblattN01,The Network is the Database: Data Management for Highly Distributed Systems,"J Navas, M Wynblatt",SIGMOD Conference,2001
70322,journals/sigmod/Gunther97,Environment Information Systems - Guest Editor's Foreword,,,1997
70324,conf/sigmod/ZhangNDLL01,On Supporting Containment Queries in Relational Database Management Systems,"C Zhang, J Naughton, D DeWitt, Q Luo, G Lohman",SIGMOD Conference,2001
70328,journals/sigmod/Gardels97,Open GIS and On-Line Environmental Libraries,K Gardels,SIGMOD Record,1997
70332,conf/sigmod/GetoorTK01,Selectivity Estimation using Probabilistic Models,"L Getoor, B Taskar, D Koller",SIGMOD Conference,2001
70336,conf/sigmod/JoshiA01,Mining Needle in a Haystack: Classifying Rare Classes via Two-phase Rule Induction,"M Joshi, R Agarwal",SIGMOD Conference,2001
70338,conf/sigmod/IpeirotisGS01,"Probe, Count, and Classify: Categorizing Hidden Web Databases","P Ipeirotis, L Gravano, M Sahami",SIGMOD Conference,2001
70341,conf/sigmod/DoanDH01,Reconciling Schemas of Disparate Data Sources: A Machine-Learning Approach,"A Doan, P Domingos, A Halevy",SIGMOD Conference,2001
70346,conf/sigmod/GunopulosD01,Time Series Similarity Measures and Time Series Indexing,,,2001
70347,conf/sigmod/BabyCY01,VQBD: Exploring Semistructured Data,"S Chawathe, T Baby, J Yeo",SIGMOD Conference,2001
70355,conf/sigmod/AdiBEY01,Monitoring Business Processes through Event Correlation based on Dependency Model,"A Adi, D Botzer, O Etzion, T Yatzkar-Haham",SIGMOD Conference,2001
70366,conf/sigmod/PalmerF00,Density Biased Sampling: An Improved Method for Data Mining and Clustering,"C Palmer, C Faloutsos",SIGMOD Conference,2000
70367,conf/sigmod/Lomet00,High Speed On-line Backup When Using Logical Log Operations,D Lomet,SIGMOD Conference,2000
70370,conf/sigmod/LabioWGG00,Efficient Resumption of Interrupted Warehouse Loads,"W Labio, J Wiener, H Garcia-Molina, V Gorelik",SIGMOD Conference,2000
70375,conf/sigmod/Rosenthal01,Will Database Researchers Have ANY Role in Data Security? (Panel Abstract),A Rosenthal,SIGMOD Conference,2001
70379,conf/sigmod/ChoSG00,Finding Replicated Web Collections,"J Cho, N Shivakumar, H Garcia-Molina",SIGMOD Conference,2000
70389,journals/sigmod/Chaudhri95,An Annotated Bibliography of Benchmarks for Object Databases,A Chaudhri,SIGMOD Record,1995
70391,conf/sigmod/WaasG00,"Counting, Enumerating, and Sampling of Execution Plans in a Cost-Based Query Optimizer","F Waas, C Galindo-Legaria",SIGMOD Conference,2000
70401,journals/sigmod/Zhang95,Application of OODB and SGML Techniques in Text Database: An Electronic Dictionary System,J Zhang,SIGMOD Record,1995
70402,conf/sigmod/HellersteinA00,Eddies: Continuously Adaptive Query Processing,"R Avnur, J Hellerstein",SIGMOD Conference,2000
70414,conf/sigmod/GillmannWSWW00,A Goal-driven Auto-Configuration Tool for the Distributed Workflow Management System Mentor-lite,"M Gillmann, J Weiþenfels, G Shegalov, W Wonner, G Weikum",SIGMOD Conference,2000
70415,conf/sigmod/2000,"Proceedings of the 2000 ACM SIGMOD International Conference on Management of Data, May 16-18, 2000, Dallas, Texas, USA",,,2000
70421,conf/sigmod/HanPY00,Mining Frequent Patterns without Candidate Generation,"J Han, J Pei, Y Yin",SIGMOD Conference,2000
70425,conf/sigmod/ShenoyHSBBS00,Turbo-charging Vertical Mining of Large Databases,"P Shenoy, J Haritsa, S Sudarshan, G Bhalotia, M Bawa, D Shah",SIGMOD Conference,2000
70428,conf/sigmod/HsiaoN00,DLFM: A Transactional Resource Manager,"H Hsiao, I Narang",SIGMOD Conference,2000
70433,conf/sigmod/Weininger00,Handling Very Large Databases with Informix Extended Parallel Server,A Weininger,SIGMOD Conference,2000
70434,journals/sigmod/Qian95,Political Winds Change Direction Again,X Qian,SIGMOD Record,1995
70436,journals/sigmod/Jannink95,Implementing Deletion in B+-Trees,J Jannink,SIGMOD Record,1995
70437,journals/sigmod/NgH95,Multigranularity Locking in Multiple Job Classes Transaction Processing System,"S Ng, S Hung",SIGMOD Record,1995
70451,journals/sigmod/SegevJS95,Report on The 1995 International Workshop on Temporal Databases,,,1995
70454,conf/sigmod/ChenJDTW00,NiagaraCQ: A Scalable Continuous Query System for Internet Databases,"J Chen, D DeWitt, F Tian, Y Wang",SIGMOD Conference,2000
70456,conf/sigmod/BarclaySG00,TerraServer: A Spatial Data Warehouse,"T Barclay, D Slutz, J Gray",SIGMOD Conference,2000
70462,conf/sigmod/ChristophidesCS00,On Wrapping Query Languages and Efficient XML Integration,"V Christophides, S Cluet, J SimÈon",SIGMOD Conference,2000
70473,journals/sigmod/NobleS95,A Research Status Report on Adaptation for Mobile Data Access,"B Noble, M Satyanarayanan",SIGMOD Record,1995
70477,conf/sigmod/Hellerstein00,Index Research: Forest or Trees? (Panel Abstract),J Hellerstein,SIGMOD Conference,2000
70478,journals/sigmod/ONeilG95,Multi-Table Joins Through Bitmapped Join Indices,"P O'Neil, G Graefe",SIGMOD Record,1995
70479,journals/sigmod/MaelbranckeO95,Optimizing Jan Jannink's Implementation of B+-tree Deletion,"R Maelbrancke, H Olivie",SIGMOD Record,1995
70488,journals/sigmod/RisheSBDOALOSS95,Florida International University High Performance Database Research Center,"N Rishe, W Sun, D Barton, Y Deng, C Orji, M Alexopoulos, L Loureiro, C 0002, M Sanchez, A Shaposhnikov",SIGMOD Record,1995
70490,conf/sigmod/Carey00,On XML and Databases: Where's the Beef? (Panel Abstract),M Carey,SIGMOD Conference,2000
70517,journals/tods/Chomicki03,Preference formulas in relational queries,J Chomicki,ACM Trans. Database Syst.,2003
70525,journals/sigmod/DiazJPa94,Supporting Dynamic Displays Using Active Rules,"O DÌaz, A Jaime, N Paton, G al-Qaimari",SIGMOD Record,1994
70531,conf/sigmod/ShuklaD00,Tutorial: LDAP Directory Services - Just Another Database Application?,,,2000
70533,journals/sigmod/Loeffen94,Text Databases: A Survey of Text Models and Systems,A Loeffen,SIGMOD Record,1994
70535,journals/sigmod/NorrieBSW94,The Database Research Group at ETH Zurich,"M Norrie, S Blott, H Schek, G Weikum",SIGMOD Record,1994
70551,conf/sigmod/AggarwalWY99,A New Method for Similarity Indexing of Market Basket Data,"C Aggarwal, J Wolf, P Yu",SIGMOD Conference,1999
70556,journals/tods/JacoxS03,Iterative spatial join,"E Jacox, H Samet",ACM Trans. Database Syst.,2003
70560,journals/tods/TaoP03,Spatial queries in dynamic environments,"Y Tao, D Papadias",ACM Trans. Database Syst.,2003
70569,conf/sigmod/AdaliSS99,A Multimedia Presentation Algebra,"S Adali, M Sapino, V Subrahmanian",SIGMOD Conference,1999
70581,conf/sigmod/BraumandlKK99,Database Patchwork on the Internet,"R Braumandl, A Kemper, D Kossmann",SIGMOD Conference,1999
70582,journals/sigmod/Klein94,How to Modify SQL Queries in Order to Guarantee Sure Answers,H Klein,SIGMOD Record,1994
70605,conf/sigmod/HaasH99,Ripple Joins for Online Aggregation,"P Haas, J Hellerstein",SIGMOD Conference,1999
70606,journals/sigmod/GeppertD94,Constructing the Next 100 Database Management Systems,"A Geppert, K Dittrich",SIGMOD Record,1994
70609,conf/sigmod/ChaudhuriMN99,On Random Sampling over Joins,"S Chaudhuri, R Motwani, V Narasayya",SIGMOD Conference,1999
70613,journals/sigmod/Stonebraker94,In Memory of Bob Kooi (1951-1993),,,1994
70616,journals/sigmod/MedeirosP94,Databases for GIS,"C Medeiros, F Pires",SIGMOD Record,1994
70621,journals/sigmod/BarbaraBFLS94,The Impact of Database Research on Industrial Products (Panel Summary),"D Barbar·, J Blakeley, D Fishman, D Lomet, M Stonebraker",SIGMOD Record,1994
70631,journals/sigmod/Alonso94a,Trade Press News,,,1994
70636,conf/vldb/AgrawalSX01,Storage and Querying of E-Commerce Data,"R Agrawal, A Somani, Y Xu",VLDB,2001
70637,conf/vldb/CasatiDGS01,"Improving Business Process Quality through Exception Understanding, Prediction, and Prevention","D Grigori, F Casati, U Dayal, M Shan",VLDB,2001
70638,conf/sigmod/Ojjeh99,Microsoft Site Server (Commerce Edition),B Ojjeh,SIGMOD Conference,1999
70640,conf/vldb/AilamakiDHS01,Weaving Relations for Cache Performance,"A Ailamaki, D DeWitt, M Hill, M Skounakis",VLDB,2001
70643,conf/vldb/DillKMRST01,Self-similarity in the Web,"S Dill, R Kumar, K McCurley, S Rajagopalan, D Sivakumar, A Tomkins",VLDB,2001
70652,conf/vldb/MargaritisFT01,NetCube: A Scalable Tool for Fast Data Mining and Compression,"D Margaritis, C Faloutsos, S Thrun",VLDB,2001
70658,conf/sigmod/AcharyaGPR99,The Aqua Approximate Query Answering System,"S Acharya, P Gibbons, V Poosala, S Ramaswamy",SIGMOD Conference,1999
70659,conf/sigmod/BrodskySCE99,The CCUBE Constraint Object-Oriented Database System,"A Brodsky, V Segal, J Chen, P Exarkhopoulo",SIGMOD Conference,1999
70667,conf/sigmod/ChangG99,Mind Your Vocabulary: Query Mapping Across Heterogeneous Information Sources,"K Chang, H Garcia-Molina",SIGMOD Conference,1999
70668,conf/vldb/SundaraHCAS01,Developing an Indexing Scheme for XML Document Collection using the Oracle8i Extensibility Framework,"S Sundara, Y Hu, T Chorma, N Agarwal, J Srinivasan",VLDB,2001
70670,conf/sigmod/MaratheS99,Query Processing Techniques for Arrays,"A Marathe, K Salem",SIGMOD Conference,1999
70685,conf/vldb/Sondag01,The Semantic Web Paving the Way to the Knowledge Society,P Sondag,VLDB,2001
70688,conf/vldb/SeegerBBKSDS01,XXL - A Library Approach to Supporting Efficient Implementations of Advanced Database Queries,"J Bercken, B Blohsfeld, J Dittrich, J Kr‰mer, T Sch‰fer, M Schneider, B Seeger",VLDB,2001
70691,conf/sigmod/Brown99,Implementing the Spirit of SQL-99,P Brown,SIGMOD Conference,1999
70694,conf/vldb/PatonG01,Information Management for Genome Level Bioinformatics,,,2001
70697,conf/sigmod/KanthRSB99,Indexing Medium-dimensionality Data in Oracle,"K Kanth, S Ravada, J Sharma, J Banerjee",SIGMOD Conference,1999
70710,conf/sigmod/AdamY98,Electronic Commerce: Tutorial,"N Adam, Y Yesha",SIGMOD Conference,1998
70711,conf/sigmod/RajagopalanML98,Approximate Medians and other Quantiles in One Pass and with Limited Memory,"G Manku, S Rajagopalan, B Lindsay",SIGMOD Conference,1998
70719,conf/sigmod/BerchtoldK98,"High-Dimensional Index Structures, Database Support for Next Decade's Applications (Tutorial)","S Berchtold, D Keim",SIGMOD Conference,1998
70727,conf/sigmod/LahiriJJC98,"50,000 Users on an Oracle8 Universal Server Database","T Lahiri, A Josji, A Jasuja, S Chatterjee",SIGMOD Conference,1998
70738,conf/sigmod/VossenW99,The WASA2 Object-Oriented Workflow Management System,"G Vossen, M Weske",SIGMOD Conference,1999
70740,conf/sigmod/AgrawalGGR98,Automatic Subspace Clustering of High Dimensional Data for Data Mining Applications,"R Agrawal, J Gehrke, D Gunopulos, P Raghavan",SIGMOD Conference,1998
70743,conf/vldb/ChaHKK01,Cache-Conscious Concurrency Control of Main-Memory Indexes on Shared-Memory Multiprocessor Systems,"S Cha, S Hwang, K Kim, K Kwon",VLDB,2001
70744,conf/sigmod/GuhaRS98,CURE: An Efficient Clustering Algorithm for Large Databases,"S Guha, R Rastogi, K Shim",SIGMOD Conference,1998
70747,conf/sigmod/KotidisR98,An Alternative Storage Organization for ROLAP Aggregate Views Based on Cubetrees,"Y Kotidis, N Roussopoulos",SIGMOD Conference,1998
70753,conf/vldb/GalhardasFSSS01,"Declarative Data Cleaning: Language, Model, and Algorithms","H Galhardas, D Florescu, D Shasha, E Simon, C Saita",VLDB,2001
70755,conf/sigmod/SubramanianV98,Cost-Based Optimization of Decision Support Queries Using Transient Views,"S Subramanian, S Venkataraman",SIGMOD Conference,1998
70758,conf/sigmod/ChakrabartiDI98,Enhanced Hypertext Categorization Using Hyperlinks,"S Chakrabarti, B Dom, P Indyk",SIGMOD Conference,1998
70760,conf/vldb/ManolopoulosT01,C2P: Clustering based on Closest Pairs,"A Nanopoulos, Y Theodoridis, Y Manolopoulos",VLDB,2001
