tid,species,version,language,flavor_text
222339,rec-496-dup-0,24,9,When it gets dirty its leaves cant be used iripbotosynthesis so it always keeps itself clean.
218020,rec-95-dup-0,,3,땅속을 파고들면서 여러 가지단단한 것들을 집어삼켜서튼튼한 몸을 만든다.
211515,id-674,33,5,"C’est en copiant son mentor, Pandarbare,qu’il app4end toutes les ficelles du métier,de l’art du combat à la capture des proie5."
222663,rec-803-dup-0,30,8,UnUltracreatura che vive in un altro mondo.S9h:gnazza felice quando avvelena gli avversaricon il pungiglione che ha sul capo.
217630,rec-714-dup-1,34,5,Il peut contrôler des ondes à nimporte quelkefréquence du spectre. Même les plus grandsPokém9n ne peuvent supporter ses ultrasons.
224073,id-367,,11,光の　届かない　深海に　生息。小魚に　似た　尻尾を　光らせて獲物を　誘い出す。
212174,id-708,,4,在森林中迷路死去的孩子的魂魄附在樹樁上，轉生成了寶可夢。
221226,rec-52-dup-0,33,8,Ama raccogliere oggetti luccicanti.Quarido è d: buon umore mostra la suacollezione anche al suo Allenatore.
203312,id-9,,1,からだが　おもたく　のしかかってあいてを　きぜつさせる。ピンチの　ときは　カラに　かくれる。
216306,rec-356-dup-1,34,7,Busca fuegos fatuos y oos ab5orbe en su cuerpohueco. Lo que pasa dentro luego es un misterio.
218023,rec-95-dup-0,33,7,Al abrirse paso bajo tierra va absorbiendo todoko que encuentra. Eso hace que su cuerpo seaasí de sólido.
219992,rec-303-dup-0,,3,얌전한 얼굴로 상대를 방심하게만들고 큰 턱으로 덥석 문다.한번 물면 절대로 놓지 않는다.
208177,id-427,33,7,"Cuando enrolla ambas orejas, rs señal de quetieme algún tipo de malestar físico o emocionaly necesita cuidados."
213515,id-808,33,5,"Il se nourrit du métal qu’il fait fondre,et produit de l’énergie en daisant circulerdv métal liquide dans son corps."
223099,id-87,23,7,Está recubierto de un lum:noso pelaje blanco. EstePikémon aumenta su actividad cuando bajan lastemperaturas.
221669,rec-669-dup-0,,7,Acumula el polen de lss flores para confeccionarla tiara que lleva en la cabeza que cuenta conpropiedades curativas.
207265,id-338,34,5,"Tirant sa force de l’énergie solaire, il estparticulièrement puiszant pendant la hournée.Il s’illumine quand il tourne."
218262,rec-584-dup-0,34,6,
207298,id-340,33,8,"Nidifica nel letto delle paludi. Incredihilmentevorace, mangia qualunque essere vivente senzadistinzione di sorta."
224190,id-392,23,8,La sua criniera di fuoco è indice del|a sua naturaviolenta. Ne5suno può batterlo in velocità.
209253,id-526,33,3,씩씩해서 공사 현장이나채굴장에서 대왕끼리동이나사람과 함께 일할 때도 있다.
223478,id-210,23,6,"Es ist trotz seines Äußeren schüchtern. Wird escvütend, schnappt es mit seinen Fängen zu."
207583,id-360,34,3,
224075,id-367,,12,游泳能力不太强。会挥动尾巴来吸引猎物，在很接近的时候一口咬住。
222837,id-14,23,3,
223103,id-87,29,12,能以８节的速度在海里游动，并搜寻能当做猎物的宝可梦。特别喜欢吃弱丁鱼。
210599,id-601,33,9,"From its spikes, it launches powerful blasts ogelectricity. Its red core contains an enormousamount of energy."
210596,id-601,33,6,Die Stachelspitzen können starke Elektrizitätabfeuern. Im roten Zentralbestandteil sindUnmengen von Energie gespeichert.
222764,rec-397-dup-0,,11,森や　草原に　生息グループが　出くわすと　なわばりをかけた　争いが　はじまる
218947,rec-246-dup-0,33,7,Nace en el subsuelo a gran profundidad. Trasingerir la tiwrra que lo rodea emerge a lasuperficie y se convlerte en pupa.
206487,id-263,34,7,El Zigzagoon de Galar desarrolló este sspectotras adaptarse a otras regiones. Muestra una granhabilkdad a la hora de encontrar cosas.
204554,id-105,,4,克服了傷痛後進化得更強更壯。會把骨頭當作武器，勇敢地與敵人交鋒。
203548,id-32,,8,"Impavido nonostante la vorporatura minuta,lotta con coraggio per proteggere la femminaa cui è affezionato, anche a costo della vita."
215021,id-883,,12,虽然能通过冻结四周来捕捉猎物，但由于嘴长在头顶上，所以吃起东西来不太方便。
205267,id-140,,7,"Se consideraba extinto, pero, al parecer, existendeterminadas zonas en las que es posible haliarejemplares con facilidad."
211957,id-697,,7,"Este Pokémon vivió hace xien millones de años.A pesar de su ferocidad, posee una firmeza y unapresencia dignas de un rey."
211129,id-630,34,9,
217979,rec-375-dup-0,34,1,
224192,id-393,,9,"Because it is very proud, it hatesaccepting food from people. Itstbick down guards it from cold."
214388,id-851,34,8,"Ha una natura aggressiva. Il suo corpoincandescente lo rende molgo pericoioso,così come le sue lunghe zanne appuntite."
203317,id-9,33,7,"Para acabar con su enemigo, lo aplasta con elpeso de su cuerpo. En momentos de apuro, seescojde en ei caparazón."
223932,id-323,7,9,
215247,id-894,34,7,"Todo su cuerpo es un órgano electrógeno, cuywpotencia sería suficiente para absstecer la regiónde Galar por completo."
207232,id-337,33,1,つきの　みちかけと　パワーのぞうげんが　かんけい　しているらしくまんげつの　よる　かっぱつになる。
223155,id-101,17,5,Il se laisse porter par les ventdlorsque son corps est g0nfléd’électricité à en éclater.
217983,rec-375-dup-0,33,5,Composé de deux Terhal réunis par lattractionmagnétique ce Pokémon a vu sa pui5sancepsycnique doubler grâce aux deux cerveaux.
224557,id-491,17,5,"Menacé, ce Pokémon se protègeen créant des cauchsmars danzl’esprit de ses ennemis."
203246,id-5,,6,"Steigert es sich in einen Kampf hinein, spuckt esFlammen, die all4s in seiner Umgebungniederbrennen."
206500,id-264,,11,強くて　コシの　ある　体毛。抜け毛で　作られた　シェービングブラシは　超高級品。
217104,rec-615-dup-0,34,12,天气一热就会化为水蒸气到了夏天几5乎到处都看不到它的踪影
209260,id-526,33,11,
215317,id-898,33,7,Un Pokémon muy compasivo agraciado con elpoder de la curación. Reinó en Galar en tiempo5remotos.
207257,id-338,,7,"Al girar emite una luz como la del sol, con la queconsigue deslumnrar a sus enemigos."
206475,id-263,33,5,Il frotte son pelage dur sur les arbres pourmarquer son terntoire. Il est plus docileque son cousin de Galar.
206472,id-263,,1,かたい　たいもうを　きに　こすりつけナワバリの　しるしを　つける。ガラルの　ジグザグマより　おんこう。
207303,id-340,,3,큰 늪을 영역으로 한다.적이 가까이 오면 크게 난동부려서큰 지진을 일으킨다.
223005,id-69,17,5,Il préfère les climats chavds ethumides. Ses lianes peuventfapturer une proie en un clin d’œil.
214272,id-846,,1,するどく　とがった　あごが　じまん。すこしでも　うごくものを　みつけるといっちょくせんに　とつげきする。
212082,id-703,34,1,せかいの　どこかには　メレシーがたくさん　ねむる　こうみゃくがありむれの　じょおうも　いるという。
208710,id-462,34,11,
206291,id-237,,12,会通过倒立来扰乱对方的节奏，然后趁隙施展华丽的踢击。
218951,rec-246-dup-0,,3,흙을 먹으며 살고 있다.큰 산 하나를 다 먹으면성장을 위해 잠자기 시작한다.
211959,id-697,33,9,"This Pokémon is from about 100,000,000years ago. It had the presence of a king, viciousbut magnificent."
204306,id-82,34,6,"Es sondert stetig seine starken Magnetkräfte ab,sodass loei den meisten Compvtern Störungenauftreten, wenn es sich in deren Nähe aufhält."
206492,id-264,33,1,つよくて　コシの　ある　たいもう。ぬけげで　つくられた　シェービングブラシは　ちょうこうきゅうひん。
205232,id-139,,1,おおきく　おもい　カラのせいでうごきが　にぶくなり　えものをとれずに　ぜつめつした　という。
219233,rec-142-dup-0,34,8,Le sue zanne simili a lame sono in grado di farea brandeoli persino la pelle de'l Pokémon di tipoAcciaio.
215963,rec-551-dup-0,34,5,Malgré son petit gabarit il a beaucovp de forcedans les pattes arrière. Il parcourt le désertcomme wil nageait dans le sable.
218897,rec-34-dup-0,,11,暴れると　手が　つけられなくなるが長年　連れ添った　ニドクインの前では　穏やかな　顔に　なる
221052,rec-704-dup-1,,11,ツノは　優れた　感覚器官敵の　気配を　感じ取り　すぐに隠れる　ことで　生き残ってきた
220000,rec-303-dup-0,34,6,Sein riesiger Kiefer hat soch aus stählernenHörnern entwickelt. Mit ihm beißt es seineGegner.
223687,id-261,23,7,"Es muy persistente. Si se fija em una presa, no ladejará hasta qur caiga agotada."
211245,id-636,34,5,La température de 5on corps est très élevée.Il projette des flammes du bout de des cornespour intimider ses ennemis et ses proies.
221495,rec-124-dup-1,33,8,
204310,id-82,34,11,
223988,id-335,23,8,
206037,id-215,,7,"Sus patas ocultan garras sumamente afiladas,que extisnde de repente para intimidar alenemigo en caso de amenaza."
217095,rec-615-dup-0,33,8,Maneggia una catema di ghiaccio con culcongela e trascina via chiunque incontri.
206477,id-263,33,7,Frota su pelo hirsuto contra los árboles con el finde marcar su territori0. Tiene un carácter másafable que el Zigzagoon de Galar.
225017,id-672,,3,사람과 살기 시작한최초의 포켓몬이라고 한다.온화한 성격의 포켓몬이다.
203320,id-9,33,11,
219818,rec-800-dup-0,33,12,光芒是它维持生命的能量由于一直沉睡于地下身体ri因积存在体内的杂质而发黑
218415,rec-831-dup-1,33,1,パーマの　かかった　たいもうはたかい　クッションせいが　あるがけから　おちても　へっちゃら
219823,rec-800-dup-0,,8,La luce è la sua fonte denergia. Deve il c0lorenero del corpo alle impurità accumulatesi al suointerno mentre giaceva addormentato sottoterra.
212159,id-707,,9,"This Pokémon is constantly collecting keys.Entrust a Klefki with important keys, and thePokémon will protect them no matter wbat."
218428,rec-831-dup-1,34,11,
211399,id-647,33,9,"Cobalion, Terrakion, and Virizion taught thisPokémon how to fight. It daahes across the world,seeking more opportunities to further its trajning."
218026,rec-95-dup-0,,9,It rapidly bores through the ground at 50 mph bysqvirming and twisting its massive rugged body.
222785,rec-431-dup-1,18,5,
212599,id-743,33,9,It makes pollen puffs from pollen and nectar.The puffs’ effect5 depend on the type 0fingredients and how much of each one is used.
209019,id-506,33,9,This Pokémon is courateous but also cautious.It uses the soft fur covering its face to co|lectinformation about its surroundings.
223339,id-181,23,11,尻尾の先が　光り輝く。光は　はるか　遠くまで　届き迷った者の　道標となる。
214074,id-836,33,4,
207033,id-318,,3,먹이를 발견해도 혼자일 때는공격하지 않는다. 동료가 오는 것을기다린 다음 집단으로 공격한다.
207667,id-364,34,7,"Tiene la cos5umbre de hacer girar en la punta delmorro cualquier objeto redondeado, ya sea unaPoké Ball o un Spheal."
203219,id-4,33,9,"It has a pref3rence for hot things. When it rains,steam is said to sp0ut from the tip of its tail."
218906,rec-34-dup-0,34,8,S: dà vanto della propria forza e lotta convigore sfruttando la coda robusta e il cornoin graclo di frantumare il diamante.
211516,id-674,33,6,"Es imitiert sein großes Vorbild Pandagro, wo esnur kann. So lernt es, wie man kämpf6 und jagt."
224157,id-388,23,7,"Vive en los bosques cerca clel agva. Por el día, sale aque les dé el sol a las plantas de su espalda."
224690,id-512,23,8,
210703,id-609,,3,샹델라를 등불 대용으로사용했던 저택에서는 장례식이끊이지 않았다고 한다.
206479,id-263,,9,It marks its territory ny rubbing its bristly fur ontrees. This variety of Zigzagoon is friendlier andcalmer than the kind native to Galar.
217028,rec-54-dup-0,,3,언제나 두통에 시달린다.신비한 힘을 폭발시키면잠시 통증이 진정되는 듯하다.
213795,id-822,33,5,Il est capable d’utiliser des objets avec ses serrez :il peut par exemple saisir et iancer des pierresou même enrouler une corde autour d’un ennemi.
219240,rec-142-dup-0,34,12,长着锯子般的牙齿甚连钢属性宝可梦的皮都会被它的牙齿撕成碎片
214949,id-879,34,9,"These Pokémon live in herds. Their trunks haveincredible grip strength, stron9 enough to crushgiant rocks into powder."
215133,id-889,,3,인간의 왕과 힘을 합쳐가라르를 구한 포켓몬.금속을 흡수해서 싸운다.
220555,rec-564-dup-0,33,9,This Pokémon inhabited anciemt seas. Althoughit can only frawl it still comes up onto land insearch of prey.
207874,id-379,,4,構成牠身體的神奇物質具有能夠伸縮的柔軟性，但卻比任何金屬都還要堅韌。
217030,rec-54-dup-0,33,12,
222514,rec-397-dup-1,23,5,Il a coutume de se regrouper en larges volées.Les combats entre Étourvol sont très uiolents.
223933,id-323,17,5,"Il porte des volcans sur 5on dos.Quand le magma remonte, ilfrissonne et entre en éruptioj."
206038,id-215,33,8,Intimidisce l’avversario sfoderando all’:mpr0vvisogli affilati artigli nascosti nelle sue zampe.
217978,rec-375-dup-0,,11,２匹の　ダンバルが　磁力でくっついた　２つの　脳みそによりサイコパワーは　２倍に　強化
211400,id-647,,11,コバルオン　テラキオン　ビリジオンに戦いを　学んだ。　世界を駆け巡り　修行を　続ける。
215889,rec-746-dup-0,,8,Presi singolarmente sono eatremamente deboli.Ciò li ha portati ad acquisire labilità di formareun banco quando affrontano il nemico.
205896,id-202,,6,"Es hasst Licht und Schocks. Wird es angehriffen,pumpt es sich auf, um einen Gegenschlagvorzubereiten."
219238,rec-142-dup-0,34,7,Sus colmillos afilados como sierras puedenhaxer trizas incluso oa piel de Pokémon de tipoAcero.
223004,id-69,1,9,A carnivorousPOKéMON that trapsand eat5 bugs.It uses its rpotfeet to soak upneeded moisture.
218845,rec-437-dup-0,33,12,
223482,id-210,,4,發達的下顎和沉重的牙齒是牠的武器。只要不惹牠生氣，就不太會咬人哦。
207588,id-360,34,8,"Hanno l’abitudine di spostarsi in gruppo.Quanclo è ora di dormire, si radunano inuna grotta e riposano stretti l’uno all’altro."
206290,id-237,34,11,
217105,rec-615-dup-0,,1,こおりで　つくった　くさりをあやつって　であった　ものをこおらせ　どこかへ　つれさる
220562,rec-564-dup-0,,3,고대의 바다에 살았다.기어 다니는 것만 가능하지만먹이를 위해서는 육지에 오르기도 한다.
223012,id-69,,4,喜歡高溫多濕的環境。會利用藤蔓捕捉小蟲當成自己的食物。
223335,id-181,,3,꼬리 끝이 빛나며 반짝인다.빛이 아득히 먼 곳까지 닿아서길 잃은 자들의 이정표가 된다.
215855,rec-571-dup-1,33,5,Doté dun grand sens de la camaraderiece Pokémon peut créer des illusions effrayantexp0ur protéger son habitat et ses congénères.
215023,id-883,,3,어떤 공격에도 상처 입지 않는얼굴 가죽을 가졌지만 호흡이자유롭지 않았던 탓에 멸종하였다.
224976,id-668,23,1,
221496,rec-124-dup-1,,3,가라르의 어느 지역에서는얼음의 여왕이라고 부르며루주라를 두려워하며 받들었다.
212596,id-743,33,6,"Es rollt Blütenstaub und Honig zu Kugeln. Je nachZutaten unc Menge, d9e es hineinmischt, weisensie eine andere Wirkung auf."
208799,id-467,33,9,"When Magmortar inhales deeply, the fire bvrningin its belly intensifies, risin9 in temperature toover 3,600 degrees Fahrenheit."
222800,rec-88-dup-1,32,7,Está hecho de loclo endurecido. Pocos se atrevena tocarlo debido a su pestilencia y composiciónjociva. Allá por donde pasa no crece la hierba.
219263,rec-34-dup-1,33,12,
205242,id-139,,1,するどいキバは　いわも　くだくがしょくしゅの　とどく　はんいのえものしか　おそえないのだ。
209622,id-547,,1,ひのひかりを　あびるたび　ワタがふくらんでいく。　ふくらみすぎるとちぎって　あたりに　まきちらす。
221506,rec-124-dup-1,34,3,
206570,id-272,,11,陽気な　リズムに　あわせて体を　動かす　ことでパワーを　増幅させて　いるのだ。
206559,id-272,33,9,"The rhythm of bright, festive music activatesLuricolo’s ceols, making it more powerful."
205248,id-139,34,8,"Le sue zanne affilate pos5ono frantumareanche le pietre, na può attaccare solo le predea portata di tentacolo."
219822,rec-800-dup-0,33,9,It survives by absorbing light. After a long tlmespwnt slumbering underground impuritiesaccumulated within it causing its body to darken.
218186,rec-590-dup-1,34,4,
224676,id-511,,5,Il vit dans les forêts procondes.Manger la feuille qui pousse sursa tête fait disparaître la fatigue.
204307,id-82,34,7,Emite de forma constante una poyente fuerzamagnética q7e causa estragos en prácticamentecualquier ordenador al que se acerque.
209633,id-548,33,3,
223162,id-101,,4,只要受到任何一點衝擊，體內的電能就會迅速膨脹然後爆炸。
206688,id-280,34,8,"Se con le sue corna rosse avverte emozionipositive di pwrsone o Pokémon, il suo corpos'l scalda leggermente."
221753,rec-259-dup-0,,3,걸쭉하게 질퍽거리는 땅을밟으며 생활하면서 단련되어팔다리가 강인해졌다.
214763,id-870,34,3,6마리가 1마리의 포켓몬이다.대열을 바꿔가며팀워크로 싸운다.
221494,rec-124-dup-1,,12,在伽勒尔的某些地方迷唇姐被称作冰之女m王受到人们的畏惧与崇拜
217867,rec-7-dup-0,34,7,
223635,id-255,17,5,Ses câlins réchauffent car il rendermeune f0urnaise. Il envoie des boules defeu à 1 000 °C.
206491,id-263,,12,伽勒尔的蛇纹熊适应了其他地区环境后的样子。十分擅长找东西。
220564,rec-564-dup-0,33,7,Vivía en los mares de hace millone5 de años. Salea tierra para buscar presas aunque solo se puedadesplazar reptando.
220563,rec-564-dup-0,33,8,Nellantichità viveva nei mari. Pur es5endo soloin grado di strisciare sale anche sulla terrafermain cerca di prede.
214932,id-879,,1,みどりのひふは　みずにも　つよい。むかし　ほかのとちから　やってきてひとと　いっしょに　はたらいた。
206439,id-248,33,9,"Its body can’t be harmed by any sort of attacl<,so it is very eager to make chalkengesagainst enemies."
213412,id-791,33,1,
205908,id-202,34,8,
222784,rec-431-dup-1,,1,きにいらないと　ツメを　たてるがたまに　のどを　ならして　あまえるせいかくが　いちぶに　だいにんきだ
209765,id-554,,5,"On a beau le pousser ou le t:rer, quand il dort,rien ne le fait vaciller. Cette qualité lui a valude devenir un emblème pour les porte-bonheurs."
211237,id-636,33,7,
204305,id-82,34,5,Il émet constamment une énergie magnétiquepuissante qui int3rfère avec la 9rande majoritédes ordinateurs dont il s’approche.
203591,id-34,,12,以力量为傲的宝可梦。用自己的粗尾巴和连钻石都能击碎的角，豪爽地战斗。
220495,rec-196-dup-0,33,5,En analysant les courants aériens il peyt prédirela météo ou même les mouvements de son enhemi.
212972,id-762,33,1,
217449,rec-361-dup-0,,12,只能在寒冷的土地上生存即使在零下１００度的环境下也能充满c活力地到处蹦蹦跳跳
204356,id-91,33,6,"Seine Schale ist extrem hart und kann nichteinmal durch eine B0mbe zerschmettert werden.Sie öffnet sich nur, wenn es angreift."
204636,id-109,,6,"Sein Körper ist zum Bersten voll mit Giftgas.Angelockt vom fauligen Geruch verrottenderAbfälle, lungert es auf Müllhalden herum."
204548,id-104,34,8,"Indossa il teschio della madre defunta. A voltefapita che pianga vedendooa in sogno, ma a ognilacrima versata diventa più forte."
223231,id-157,23,11,
206496,id-264,,6,"Sein Fell ist kräftig und fest. Rasierpinsel, die ausseinen ausgefaloenen Haaren hergestellt werden,sind absolute Luxusartikel."
223778,id-285,,6,Es bevorzugt feuchte Orte. Am Tag sitzt esregungslos im Scjatten des Waldes. Von seinemKopf sondert es einen giftigen Puder ab.
212080,id-703,33,11,
209934,id-563,,4,擁有閃亮亮的黃金身軀。據說牠已再也無法記起自己曾經是人類。
205421,id-148,33,12,
220935,rec-29-dup-0,34,8,
212214,id-710,33,4,
213410,id-790,,11,大気の　塵を　すごい　勢いで吸いこみ　進化の　エネルギーをコアで　懸命に　つくっている。
211560,id-677,,11,いつも　無表情だが　じつは強力な　サイコパワーが漏れ出さないように　必死なのだ。
207310,id-340,,11,大きな　沼を　縄張りにする。敵が　近づくと　大暴れして大きな　地震を　起こすのだ。
224184,id-392,12,9,It uses a special kind of martualarts ijvolving all its limbs.Its fire never goes out.
211100,id-629,,11,骸骨を　はき　お尻を　ガード。はき心地の　いい　骸骨をめぐり　仲間同士で　小競り合う。
214375,id-851,33,5,"Quand il génère de la chaleur, sa températureest d’envirpn 800 °C. Il se sert de son corpscimme d’un fouet pour sauter sur ses ennemis."
213033,id-765,33,3,잎사귀와 털로 만든부채를 휘둘러 포켓몬들을마음대로 조종할 수 있다.
210654,id-607,,4,頭上燃燒著的燭光讓牠的身體保持微熱。會拉著迷路孩子的手，將他們帶向靈界。
213894,id-827,33,4,靠搶奪其他寶可夢找到的食物為生。腳上長著軟乎乎的肉球，走路時不會發出絲毫聲響。
212925,id-759,34,5,"Sa façon de remuer les pattes pour se défendrws4mble adorable, mais ce Pokémon est si puissantqu’il pourrait fendre un tronc de la sorte."
210974,id-623,33,4,
206272,id-237,,1,くるくる　まわって　キックをはなつ。こうそくで　まわっているとそのまま　じめんに　もぐっていく。
224319,id-412,,11,冷たい　木枯らしを　防ぐため小枝や　落ち葉を　材料にミノを　作り　体を　覆う。
215849,rec-225-dup-0,33,6,Es trägt immer Lebensmittel bei sich. Man sagtdass viele Menschen in Not nur dank seinerNotration überlebt hätten.
215847,rec-225-dup-0,34,7,Tiene la costumbre de compartir su comida contodo el mundo sea humano o Pokémon por loque está constantemenye en busca de alimento.
215840,rec-225-dup-0,34,5,Ce Pokémon partage facilement son repas avecdautres Pokémon et avec des humains ce quiloblige à constamment courir après la n0urriture.
215843,rec-225-dup-0,34,9,It has a generous habit of sharing its food withpeople and Pokém0n so its always scroungingaround for more food.
215842,rec-225-dup-0,33,9,It carr9es food all day long. There are tales aboutlost people who were saved by the food it had.
219239,rec-142-dup-0,,11,古代の　獰猛な　ポケモン完璧な　復元はいまの　科学でも　不可能らしい
216520,rec-647-dup-0,,1,コバルオン　テラキオン　ビリジオンにたたかいを　まなんだ　せかいをかけめぐり　しゅぎょうを　つづける
212629,id-744,34,9,"This Pokémon intimidates opp0nents by strikingtbe ground with the rocks on its neck. Themoment an opponent flinches, Rockruff attacks."
218844,rec-437-dup-0,33,1,
213354,id-784,33,4,遇到敵人便會敲響尾部的鱗片來威嚇對方。只會與不畏懼自己的強者戰鬥。
205906,id-202,34,6,"Es lebt in der Dunkelheit, um seinen schwarzenSchweif zu verstecken. Es greift nle zuerst an."
218358,rec-544-dup-1,33,12,高速旋转突击对方最高时速可以mv达到１００公里左右
209620,id-547,,11,綿を　まき散らし　イタズラする。水を　かけると　重くなって動けなくなり　観念するぞ。
214449,id-854,,9,The teacup in which this Pokémon makes itshome is a famo7s piece of antique tableware.Many forgeries are in circulation.
216247,rec-67-dup-1,33,6,
214935,id-879,33,5,Sa peau verte résiste bien à l’eau.Il s’est instaolé dans la région il y a lon9tempset a travaillé en coopération avec les Hommes.
211961,id-697,,12,大约１亿年前的宝可梦。虽然凶暴，堂堂正正的举止却略显王者之风。
211094,id-629,,4,穿上骸骨來保護屁股。會和夥伴互相爭搶穿起來舒服的骸骨。
204369,id-91,,9,"Once it slams its shell shut, it is impossible toopen, even by rhose with superior strength."
224094,id-370,,4,變成只有獨自１隻的愛心魚會變得無精打采而破綻處處。於是就被大嘴鷗趁機叼走了。
205228,id-138,34,8,È un antico Pokémon ormai estlnto. Quandonuota usando i suoi dieci tentacoli sembrafluttuare nell’acqua.
215019,id-883,33,9,"Though it’s able to capture prey by freezing itssurroundin9s, it has tr0uble eating the preyafterward because its mouth is on top of its head."
205903,id-202,34,3,
220936,rec-29-dup-0,33,7,Posee un olfato más fino que los Nidoran♂. Usalos b8gotes para percibir la dirección del viento ybuscar comida a sotavento ce sus depredadores.
203322,id-9,,1,こうらの　ロケットほう　からふきだした　ジェットすいりゅうはぶあつい　てっぱんも　つらぬく。
215232,id-894,,1,でんきエネルギーの　かたまり。からだの　リングを　はずすと　ひめたちからが　ときはなたれるらしい。
224522,id-485,,8,Vive nelle cavità dei vulcani. Scava con i suoi piedia froce per scalare pareti e arrampicarsi sui soffitti.
210978,id-623,33,8,
