tid,species,version,language,flavor_text
210986,id-623,34,6,"Man sagt, in seinem Körper befinde sich eineunerschöpfliche Energiequelle, docj bisber istes niemandem gelungen, dies nachzuweisen."
205221,id-138,33,12,
208069,id-420,34,9,"The deeper a Cherubi’s red, the more nutrients ithas sgockpiled in its body. And the sweeter andtastier its small ball!"
208066,id-420,,6,"Je stärker die Rotfärbung seines Körpers ist,desto mehr Nährstoffe stecken in ihm und umsosüßer und besser schmeckt sein Bällchen."
208061,id-420,33,12,它营养丰富的小球是鸟宝可梦的最爱。为了不被啄到而四处逃跑。
208062,id-420,,1,からだが　あかい　チェリンボほどえいようが　おおく　たまの　あじもあまくて　おいしいよ。
208056,id-420,33,6,"Sein nährstoffreiches Bäilchen erfreut sich beiV9gel-Pokémon großer Beliebtheit. Es ist ständigauf der Flucht, damit es nicht gefressen wird."
205257,id-140,33,7,"Un Pokémon casi extinto. Cada tres sías, mjdael caparazón, que se va endureciendo de formaprogresiva."
219254,rec-34-dup-1,33,6,Gerät es in Rage ist es nur schwer aufzuhalten.Doch vor einem Nidoqueen mit dem es schonviele Jahre verbracht hat zeigt es sich frieflich.
217855,rec-7-dup-0,33,3,기다란 목을 등껍질 속에감춘 다음 기세 좋게물대포를 발사한다.
224220,id-396,23,6,"Ihr Schwarm ist stets groß. Obwohl es kleind Pokémonsimd, schwingen sie ihre Flügel mit enormer Kraft."
215571,rec-682-dup-0,34,12,身上飘出的气能让人们神魂倒贵妇们对它钟爱万分
221763,rec-786-dup-0,,1,ヒラヒラ　とびまわり　ふしぎに　ひかるりんぷんを　ふりまく　ふれたものはたちまち　げんきを　とりもどすという
211563,id-677,34,3,
203316,id-9,33,6,"Es begräbt seine Gegner mit seinem enormenKörpergewicht. Wenn ea in einer aussichtdlosenLage steckt, zieht es sich in seinen Panzer zurück."
206681,id-280,33,12,能敏锐地捕捉人和宝可梦的感情。感受到敌意后就会躲进暗处。
210707,id-609,34,7,
220570,rec-564-dup-0,34,8,Si ritiene sia lantenato di molti Pokémon concarapace. È stato rigeberato da un f0ssile.
217620,rec-714-dup-1,33,9,After nightfall they emerge from the caves tbeynest in during the day. Using their ultrasonucwaves they go on the hunt for ripened fruit.
223225,id-157,17,5,Il attaque en projetant des flammes.Il se dussimule derrière les vaguesde chaleur qu’il produit.
217916,rec-770-dup-0,,7,Habita en las playas aunque odia el agua.Cuando caen fuertes lluvias no es capaz depreservar su forma de castillo.
207875,id-379,33,5,"Il est fait d’une matière mystérieuse p|us solideque n’importe quel métal, mais assez souplepour p0uvoir s’étirer ou se rétrécir."
223604,id-250,23,1,からだは　なないろに　かがやきとんだあとに　にじが　できるとしんわに　のこされている　ポケモン。
210989,id-623,,9,"There’s a theory that inside Golurk is a perpetualmotion machine that produce5 limitless energy,but this belief hasn’t been proven."
204623,id-108,34,3,벌레포켓몬이 주된 먹이다.긴 혀로 상대를 핥아마비시킨 후 통째로 삼킨다.
206556,id-272,33,6,Der Rhythmus von fröhlicher Musik aktiviert dieZellen von Kappalore5 und mwcht es so stärker.
221760,rec-786-dup-0,28,8,Svolazza nel cielo spargendo nuvole di scavliedal misterioso luccichio chs fanno tornareimmediatamente il buon umore a chi le tocca.
216344,rec-828-dup-0,34,4,靠著輕盈的身體和銳利的爪子到處偷食物和蛋逐電犬是牠的天敵
209265,id-526,34,5,"Il est capable d’envoyer des boules d’énergieassez puissante5 pour balayer un camion-benne,mais il ne peut tirer que les jours ensoleiloés."
203319,id-9,33,9,"It crushes its foe under its heavy body to causefainting. In a 0inch, it vvill withdraw inside its shell."
224197,id-393,23,7,"No le gusta que |o cuiden. Como no aprecia el apoyode su Entreriador, le cuesta coger confianza con él."
218427,rec-831-dup-1,,3,털이 많이 자라면 움직이지 못한다.우르의 털로 짠 천은놀라울 정도로 튼튼하다.
218836,rec-437-dup-0,34,9,Many scientists suspect that this Pokéiiionoriginated outside the Galar regi0n based onthe patterns on its body.
210364,id-588,34,4,
210360,id-588,,11,電気エネルギーに　反応する不思議な　体質。　チョボマキとともに　いると　進化する。
204571,id-105,,12,进化后，与原本戴在头上的母亲头骨完全融为一体，而且性格也变得十分凶暴。
224785,id-585,,7,"El color de su cuerpo cambia no solo con lasestaciones, sino también con jos cambios de humedady temperatura."
214289,id-846,34,9,"After it’s eaten its fill, its movements 1>ecomeextremely sluggizh. That’s when Cramorantswallows it up."
207261,id-338,33,12,
215962,rec-551-dup-0,,7,Es pequeño pero cuenta con un tren inferiorfuerte. Se desplaza por el desierto a1>riéndosepaso entre la arena como si nadase.
211124,id-630,,4,把撿來的骨頭裝飾在身上。在骨頭形狀這方面似乎也是有流行趨勢的。
208801,id-467,33,12,大口吸气之后腹中的火焰就会烧得更旺，达到摄氏２０００度。
203227,id-4,,7,"Este Pokémon nace con una llama en la punta drla cola. Si se le apagara, fallecería."
212173,id-708,33,3,숲속을 헤매다 목숨을 잃은아이의 영혼이 나무 그루터기에씌어 포켓몬으로 다시 태어났다.
208708,id-462,34,8,"Si pensa che la sua strut6ura molecolare siamutata in seguito all’esposizione a uno specialecampo mwgnetico, che ha innescato l’evoluzione."
219993,rec-303-dup-0,,11,鋼の　ツノが　変形してできた　大きな　アゴで相手に　がぶりと　噛みつくのだ
212160,id-707,33,11,
204360,id-91,,11,殻が　非常に　硬くナパーム弾でも　壊せない。攻撃するときだけ　開く。
220938,rec-29-dup-0,34,5,Ce Pokémon se nourrit de Baies en les ouvrantavec ses incisivez. Le gout de sa corne est plusarrondi que celui du mâle.
211962,id-697,,1,おおあごは　ひとかみするだけでじどうしゃも　こなごなに　する。こだいの　せかいの　おうじゃ。
208185,id-427,,5,"Plus il s’entraîne, plus les coups qu’il assèneen déroulant vigoureusement ses oreillesgagnent en puissance."
216295,rec-356-dup-1,,11,さまよっている　人魂を　見つけ空っぽの　体内に　吸いこむ吸いこまれて　どうなるかは　謎
207292,id-340,33,1,ぬまの　そこに　すみかを　つくる。いきものなら　すききらい　なくなんでも　たべてしまう　おおぐらい。
209646,id-548,,6,"Je kräftiger die Farbe seiner Blättee, destogesünder ist es. Lilminip lässt sich zuweilen in gutgepflegten Blumenbeeten oder Feldern nieder."
207309,id-340,34,9,"It claims a large swwmp to itsejf. If a foe comesnear it, it sets off tremors by thrashing around."
205757,id-185,33,7,"Quien vea agitarse un árbol sin que sople elvierito habrá encontrado un Sudowoodo.En los días lluviosos, sin embargo, se wsconde."
224943,id-664,23,3,
215332,rec-82-dup-0,34,9,This Pokémon is constantly puttirig ovt a powerfulmagnetic force. Most computers go haywire whena Magneton approaches.
223938,id-323,23,8,I vulcani sul suo dorso erittano ogni dieci wnni oquando è veramente arrabbiato.
210695,id-609,,5,"Il s’installe dans les résidences anciennes.Pour hypnotiser son adversaire, il agjteles flammes de ses bras de manière inquiétante."
218370,rec-544-dup-1,33,7,Gira a gran velocidad y carga contra sus riyales.Puede alcanzar lo5 100 km/h.
224784,id-585,23,6,Unabhängig von der Jahreszeit äneert sichseine Farbe a7ch bei wechselnder Temperaturoder Luftfeuchtigkeit leicht.
206495,id-264,33,5,
215239,id-894,33,9,This Pokémon is a cluster of electrical energy.It’s said that removing the rings on Regieleki’sbody will unleash the Pokémon’s latent power.
207038,id-318,,8,"Se è da solo, non assale la preda.Preferisce aspettare i suoi compagmiper attaccare in gruppo."
220939,rec-29-dup-0,33,4,
217021,rec-54-dup-0,,11,ストレスが　溜まると　頭痛がエスカレート　強力な　念力でまわりを　圧倒する
208189,id-427,34,9,
219844,rec-5-dup-0,,7,Este Pokémon de naturaleza agresiva ataca encombate con su cola llameante y hace trizas alrival con sus afiladas garras.
210991,id-623,,12,虽然有人认为它体内有着生成能量的永动机，但至今仍未得到证实。
220008,rec-303-dup-0,,8,Le sue corna dacciaio si sono trasformate inenormi madcelle con cui morde i nemici.
218562,rec-420-dup-0,33,9,It nimbly dashes about to avold getting peckedby bird Pokémon that would love to male offwith its small nutrient-rich storage ball.
223602,id-250,,9,Legends claim thisPOKéMON flies theworld's skies con­tinuously on itsmatnificent seven-colored wings.
220501,rec-196-dup-0,34,5,Le joyau sur le front de Mentali projettedes ondes psychiqies en combat rt sobscurcitquand il est à bout de force.
212602,id-743,,1,あめに　ぬれることが　だいきらい。くもりがちな　ガラルちほうではすがたを　めったに　おがめない。
217110,rec-615-dup-0,33,7,Se vale de sus cadenas de hielo para congelar atodo aquel qve se cruza en su camino y llevárs3loa un lugar desconocido.
217353,rec-826-dup-1,34,5,Il déploie ses pouvoirs psychiques pour sonderles alentours sur um rayoh pouvant atteindre10 km.
205758,id-185,33,8,"Se si nota un albero ondeggiare anche se non c’èvento, probabilmente è un Sudowoodo. Si diceche nel1e giornate piovo5e se ne stia nascosto."
211656,id-682,33,6,
204615,id-108,33,5,"Si sa salive gluante entre en contaft avec la peauet qu’on ne l’essuie pas bien, elle provoque deterribles démangeaisons qui ne s’arrêtent jakais."
219849,rec-5-dup-0,,3,싸움으로 기분이 고조되면작열하는 불꽃을 뿜으며주변을 태워버린다.
211401,id-647,33,12,
223982,id-335,7,9,Memories of battling its arch-rivalSEVIPER are etched into every cell ofZANGOOSE’s body.Thos POKéMON adroitly dodges attackswith incredible agility.
214446,id-854,34,6,"Die Teetasse, die es bewohnt, ist eine berühmteAmtiquität. Es befinden sich al1erdings auch vieleFälschungen im Umlauf."
205430,id-148,34,11,
213799,id-822,33,9,"Smart enough to use tools in battle, theseP0kémon have been seen pickimg up rocks andflinging them or using ropes to wrap up enemies."
213485,id-802,34,5,"Ce Pokémon ayant la capacité de se dissimvlerdans les ombres, il est resté très longtempscaché aux yeux clu monde."
214671,id-865,,12,会用坚硬的葱叶抵挡攻击，接着用锋利的茎反击。它的葱既是武器也是食材。
210663,id-607,,3,흡수하는 생명이 젊으면젊을수록 머리의 불꽃은크고 괴이하게 타오른다.
214943,id-879,,3,무리를 지어 생활한다.코의 악력은 큰 바위도산산이 부술 정도로 강하다.
220160,rec-37-dup-1,,1,こどもだが　６ぽんの　しっぽがうつくしい　せいちょうするとさらに　しっぽが　ふえる
212230,id-710,,11,かぼちゃの　穴から　照らしている光は　見た　人や　ポケモンを催眠状態にして　操る。
206555,id-272,33,5,"Les cellules de Ludicolo s’activent s’il entendune mus'lque entfaînante, le rendant encoreplus puissant."
216529,rec-647-dup-0,33,7,Aprendió a luchar bajo la tvtela de CobalionTerrakion y Virizion. Ahora recorre el mund0perfeccionando su destreza.
221670,rec-669-dup-0,30,12,头上的冠是收集花粉做y成的蕴藏着治愈的效果
212918,id-759,33,8,"Il suo soffice manto è molto piacevole daaccar4zzare, ma se lo si sfiora inavv3rtitamentesi rischia di venire attaccati."
205419,id-148,33,9,"This Pokémon lives in prist'lne oceans and lakes.It can control the weather, and it uses this powerto fly into the skv, riding on the wind."
217031,rec-54-dup-0,34,9,As Psyduck gets stressed out its headache getspr0gressively worse. It uses intense psychic3nergy to overwhelm those around it.
219266,rec-34-dup-1,34,8,Si dà vanto della propria forza e lotta convigore sfruttando la codw robusta e il cornoin grado di frantumare il diamante.
215345,rec-82-dup-0,34,7,Emite de forma constante una potente fuerzamagnética qie causa estragos en prácticamentecualquier ordenador al qu4 se acerque.
208709,id-462,34,9,
224191,id-392,,11,頭で　燃える　炎の　ように激しい　性格の　ポケモン。素早さでは　だれにも　負けない。
217869,rec-7-dup-0,,8,Quando ritrae il lungo collo demtro la corazzasputa un vigoroso getto dacqua.
203236,id-5,33,6,
218840,rec-437-dup-0,34,4,
211520,id-674,,11,親分と　慕う　ゴロンダの真似を　する　ことで　戦い方や獲物の　捕まえ方を　学ぶ。
217103,rec-615-dup-0,,4,天氣一熱就會變c成水蒸氣在夏天見到牠的機會少之又少
224285,id-409,,3,어떤 충격에도 견딜 수 있는두꺼운 두개골에 눌려뇌가 자라지 않았다.
221394,rec-427-dup-1,,1,まるめた　みみを　のばす　いきおいでこうげきする　わざは　トレーニングをするほど　いりょくが　ましていく
213491,id-802,34,12,
211524,id-674,34,4,
223640,id-255,,8,"Nel ventre ha una sacca di fuoco che brucia incontinuazione. Se lo si abbraccia, emana calore."
215033,id-884,,3,윤이 나는 금속과도 같은몸은 가벼우면서도 튼튼하지만녹슬기 쉽다는 것이 흠이다.
214277,id-846,33,7,"Se siente muy orgulloso de su afilada mandíbula.En cuanto detecta el más mínirno movimiento,va direfto al objetivo para cargar contra él."
208702,id-462,34,1,
208726,id-463,34,6,Mit seiner Zunge kann es alles tun und ist damitso geschicky w'le Menschen mit ihren Händen.Diese verwendet Schlurplek nur sehr unbeholfen.
212152,id-707,,1,カギを　あつめつづける　ポケモン。だいじな　カギを　あずけるとなにが　あっても　まもってくれる。
221671,rec-669-dup-0,30,6,Die Krone auf seinem Kopf bat es sich ausPollen von Blumen gebastelt. Sie besirzt eineheilende Wirkung.
205249,id-139,34,9,"Omastar’s sharp fang5 could crush rock, but thePokémon can attack only the prey that comewithin reach of its tentacles."
219500,rec-892-dup-0,,11,遠い　地方の　山岳地帯で暮らす　断崖絶壁を　走り足腰を　鍛え　技を　磨く
219768,rec-239-dup-0,33,6,Nähert sich ein Sturm wird Elekid unrubig.Sobald es Donnergrollen hört ist es nichtmehr zu halten und fängt an zu toben.
219264,rec-34-dup-1,34,5,Très fier de sa force il se bat vigoureusemebtà lalde de sa queue robuste et de sa cornecapable de briser le diamant.
224066,id-367,7,9,
205640,id-176,,11,心優しい　人の　前に幸せを　もたらすため姿を　現すと　言われている。
206446,id-248,34,6,"Seine Schritte erzeugen Erdbeben, eie selbstgroße Berge plätten umd die Form ganzerLandstriche verändern."
215022,id-883,,1,どんな　こうげきにも　きずつかないつらのかわを　もつが　こきゅうがふじゆうだったため　ぜつめつした。
205256,id-140,33,6,"Dieses Pokémon ist so gut wie ausgestorben.Seln Panzer wird immer bärter, indem es sichalle drei Tage häutet."
203218,id-4,33,8,Ama le cose calcle. Si dice che quando piovegli esca vapore dalla pvnta della coda.
212598,id-743,,8,Crea delle sfere di polline e nettare che hannoeffetti diversi a seconda degli ingredientiusati e della loro quantità.
221057,rec-704-dup-1,,5,Son corps est principa1ement composé deau.Sil se déshydrate il devient tout rabougri.Cest le plus faible des Pokémon Dragon.
210367,id-588,34,7,
221393,rec-427-dup-1,34,3,
207270,id-338,34,11,
218950,rec-246-dup-0,,11,土を　食べて　生きている大きな　山ひとつ　食べ終わると成長のため　眠りはじめる
219997,rec-303-dup-0,,1,おとなしい　かおで　あいてを　ゆだんさせてから　おおあごで　がぶりかみつくと　ぜったいに　はなさない
214936,id-879,33,6,Seine grüne Haut ist wasserresistent. Es kamvor lanver Zeit aus einer anderen Region undverrichtete mit den Menscgen Arbeiten.
214447,id-854,34,7,"La taza de té donde se hospeda forma parte deuna antigua y valiosa vaj:lla, de la que circulannumerowas falsificaciones."
207032,id-318,33,1,
216248,rec-67-dup-1,34,4,有著不會疲勞的強韌肉體會去幫y助人類完成例如k搬運沉重行李之類的工作
217854,rec-7-dup-0,,3,위험해지면 등껍질에 손발을감추고 몸을 지키면서입에서 물을 내뿜는다.
207301,id-340,,12,会在沼泽底部筑巢。只要是活物就来者不拒，是什么都吃的大胃王。
223682,id-261,,9,"At first sight, POOCHYENA takes a biteat anything that moves.Th'ls POKéMON chases after prey untilthe victim becomes exhausted.However, it may turn tail if the preystrikes back."
212176,id-708,33,6,"Die Seele eines Kindes, das sich im Wale gerliefund dabei ums Leben kam, nistete sich in einemBaumstumpf ein und wurde zu diesem Pokémon."
204547,id-104,34,7,"Lleva puesto el cráneo de su difunta madre.A veces loora en sueño5, pero cada lágrimavertida le hace más fuerte."
224069,id-367,,3,빛이 닿지 않는 심해에 서식한다.작은 생선처럼 생긴 꼬리를빛내어 먹잇감을 유인한다.
204532,id-104,33,1,しにわかれた　ははおやを　おもいだしなくと　あたまに　かぶった　ホネのなかで　ものがなしく　ひびくのだ。
224126,id-383,23,8,
212081,id-703,,12,从体内埋藏的宝石中发射出高能量的光线，将所有来袭的敌人都一扫而尽。
218016,rec-95-dup-0,33,8,Scava nel terreno assorbend0 gli oggetti più duriper irtobustire il suo corpo.
211878,id-693,33,8,Individva la preda con le antenne dellasua enorme chela e la attacca sparandoproiettili d’acqua.
223872,id-308,23,6,"Es weicht Attzcken elegant tänzerisch aus,um anschließend eine verheerende Attacke ajsderselben Bewegung heraus zu lancieren."
207246,id-337,34,6,Es wurde erstmal5 vor 40 Jahren bei einemMeteoritenkrater entdeckt. Gegner ver5etzt esallein mit seinem Blick in Schlaf.
211890,id-693,,11,右腕は　海水の　砲弾を発射する　大砲。　タンカーを沈めてしまうほどの　威力だ。
213517,id-808,33,7,"Funde metales para ingerirlos. Una vez licuados,los hace circular por el intenor de su cuerpo paragenerar enwrgía."
223592,id-245,23,8,Corre per tutto il mondo per purificare l’acquacontaminatz. Si allontana cob i venti del nord.
204362,id-91,34,1,
203544,id-32,,4,體型嬌小，但性情勇猛。為了保護感情好的雌性，會奮不顧身地勇敢戰鬥。
207234,id-337,,4,月亮的盈虧似乎會影響牠力量的增減。每到滿月之夜就會變得活躍。
224816,id-603,,1,あいてに　まきつき　まるいはんてんから　でんきを　ながしてしびれたところを　まるかじりする。
221786,rec-794-dup-0,,3,다른 세계에서 나타난 UB이다.스스로 몸을 보여주는 행동이자랑인지 위협인지 알 수 없다.
213786,id-821,34,6,Mit seinem kleinen Körper kann es flink fliegenund so mithilfe von rrickreichen Taktiken größereGegner überlisten.
224787,id-585,,11,季節が　変わったとき　だけでなく気温や　湿度に　よっても体の色は　少し　変化する。
206449,id-248,34,9,The quakes caused when it walks make evengreat mountains crumblr and changethe syrrounding terrain.
215552,rec-682-dup-0,,3,사람을 매료하는 황홀한냄새를 몸에서 풍긴다.귀부인들에게 사랑받았다.
217628,rec-714-dup-1,33,12,
221767,rec-786-dup-0,,3,빛나는 인분을 흩뿌려사람이나 포켓몬의 상처를 치료한다.아칼라에서 모시는 수호신이다.
215841,rec-225-dup-0,34,1,じぶんの　エサを　ひとや　ポケモンにわける　しゅうせいが　あるためいつも　エサを　さがしまわっている
213790,id-821,,11,小さい　体で　機敏に　飛んで隙を　突く　戦法で　体の大きな　相手を　手玉に取る。
221660,rec-801-dup-0,28,9,Its mechanized body is merely a vessel. Its trueself is irs So7l-Heart an artificial soul.
205218,id-138,33,8,Quest0 Pokémon si sta rivelando un problemaperché a volte fugge o viene liberato dopoessere stato rigenerato.
219830,rec-800-dup-0,34,7,Con sus rayos láser desrruye todo a su paso enbusca de luz pzra sustentarse.
224764,id-580,17,5,"Un Pokémon Oiseau doué p0ur la plongée.Il hage sous l’eau à la recherche desphaigne, son plat préféré."
208811,id-467,,12,由于栖息在火山口，因此身体逐渐变得像火山一样，还长着类似岩浆库的器官。
204309,id-82,34,9,This Pokémon is constantly putting out a powerfulmagnetic force. Most comouters go haywire whena Magneton approaches.
203326,id-9,,6,"Die Wassersalven, die es mit den Wasserdüsenin seinem Panzer abfeuert, durchdringen sogard9cke Stahlwände."
225048,id-716,23,9,Legends say it can share eternal life.It slept for a thousamd years in the formof a tree before its revival.
211555,id-677,,5,"Sous son masque inexpressif, il est en faitconstamment en train e’essayer de contenirses puissants pouvoirs psychiques."
221217,rec-52-dup-0,33,1,
203573,id-34,,3,날뛰기 시작하면 손쓸 수 없게 되지만긴 세월 함께 지낸 니드퀸앞에서는 온순해진다.
206443,id-248,,3,지축을 울리면서 걸으면큰 산조차 무너지며주변의 지형은 변해버린다.
213805,id-822,34,5,"Après avoir surmonté tant de rvdes combats,il a appris à déterminer avec précisionla puissance de ses sdversaires."
219308,rec-825-dup-1,33,11,
220165,rec-37-dup-1,34,6,
222658,rec-803-dup-0,,1,いせかいに　すむ　ウルトラビーストあたまの　どくばりから　どくえきをあいてに　かけて　ケラケラ　わらう
215869,rec-571-dup-1,34,8,Gli Allenatori tristi e soli chiedono a Zoroarkdi m0strare loro dei miraggi che allsvinola loro solitudine.
203914,id-55,33,4,
214276,id-846,33,6,"Sein spitz zulaufender Kiefer ist sein ganzer Stolz.Erblickt e5 etwas, das 5ich auch nur ein bisschenbewegt, setzt es geradewegs zum Stoßangriff an."
220940,rec-29-dup-0,34,9,It uses its hard incisor teeth to crush and eatberries. The tio of a female Nidorans horn is abit more rounded than the tip of a males horn.
220949,rec-29-dup-0,34,6,Mit ihren harten Vorderzähnen zerteiien sieBeeren bevor sie diese essen. Die Spitze ihresHorns ist etwas abgerundeter als bei Männchen.
210699,id-609,33,9,This Pokémon haunts dilapidated mansions.It sways its arms to hypnotize opponents withthe ominous ranclng of its flames.
205260,id-140,33,11,
224152,id-388,12,9,"It lives along water in for4sts. Inthe daytime, it leaves the forestt0 sunbathe its treed shell."
219511,rec-892-dup-0,33,11,
213811,id-822,,12,经历无数次艰难的战斗后，它学会了该如何正确地判断敌人的力量。
205255,id-140,33,5,
207239,id-337,33,9,The phase of the moon apparently haw someeffect on its power. It’s active on the night ofa full moon.
209623,id-547,,3,햇빛을 받을수록 솜이부풀어 오른다. 너무 부풀면찢어져 주위로 흩어진다.
220002,rec-303-dup-0,34,9,It chomps with its gaping mouth. Its huge jaws areactually steel h0rns that haye been transformed.
215952,rec-551-dup-0,,7,En las frías noches del desierto se oculta a muchaprofundidad en la arena y cluerme hasta que saleel sol.
223480,id-210,23,8,"Malgrado il suo aspetto, è molto timido. Se siarrabbia, tuttavia, cilpisce cori le sue enormi zanne."
207669,id-364,,9,"This Pokémom has a habit of spinning roundthings on its nose, whether those things arePoké Balls or Spheal."
206674,id-280,,4,能敏銳地感知人和寶可夢的感情。一旦感受到敵意就會躲進暗處。
211561,id-677,,12,虽然一直都面无表情，但是那其实是因为它在努力不让自己强力的精神力量漏出。
220494,rec-196-dup-0,33,7,Basándose en las corrientes de aire preclicecosa5 como el tiempo atmosférico o la próximaacción del enemigo.
221056,rec-704-dup-1,,11,体の　ほとんどが　水分乾燥すると　干からびてしまう最弱の　ドラゴンポケモン
223086,id-86,,1,ひょうざんで　くらす　ポケモン。あたまの　とがった　でっぱりでこおりを　わって　うみを　およぐ。
212178,id-708,33,8,Questo Pokémon è nato quando l’anima cliun bambino smarritosi nel bo5co è entratanel ceppo di un albero.
221497,rec-124-dup-1,33,9,In certain parts of Galar Jynx waz once fearecland worshiped as the Queen of Ice.
217356,rec-826-dup-1,33,7,Este Pokémon es conocido por su inteli9encia.El gran tamaño de su cerebri es un indicio dela magnitud de sus poderes psíquicos.
214433,id-854,,3,차게 식은 남은 홍차에외로움을 타는 영혼이 깃들어포켓몬이 되었다고 전해진다.
206488,id-263,34,8,Lo Zigzagoon di Galar ha assunto questo aspettonegli altri territori in cui si è diffuso. Ri5rovaregli oggetti dmarriti è la sua specialità.
204560,id-105,,11,悲しみを　乗りこえて　たくましく進化した。　骨を　武器にして勇敢に　敵と　渡り合う。
204562,id-105,,1,しんかして　かぶっていた　ははおやのホネが　いったいかして　そのうえきょうぼうな　せいかくに　かわった。
221658,rec-801-dup-0,,1,きかいじかけの　からだは　ただのうつわ　ソウルハートと　よばれるじんぞうの　たましいが　ほんたい
223985,id-335,23,3,
213514,id-808,,4,會溶解金屬然後吃掉。透過讓液體金屬在體內循環來製造能量。
