tid,id,title,authors,venue,year
69612,journals/sigmod/EisenbergM02,SQL/XML is Making Good Progress,"A Eisenberg, J Melton",SIGMOD Record,2002
69616,conf/vldb/FerrandinaMZFM95,Schema and Database Evolution in the O2 Object Database System,"F Ferrandina, T Meyer, R Zicari, G Ferran, J Madec",VLDB,1995
69619,journals/sigmod/Ouksel02,Mining the World Wide Web: An Information Search Approach - Book Review,,,2002
69621,journals/sigmod/Konig-RiesMMPPRSVW02,Report on the NSF Workshop on Building an Infrastructure for Mobile and Wireless Systems,,,2002
69626,conf/vldb/TreschPL95,Type Classification of Semi-Structured Documents,"M Tresch, N Palmer, A Luniewski",VLDB,1995
69628,conf/vldb/MehtaD95,Managing Intra-operator Parallelism in Parallel Database Systems,"M Mehta, D DeWitt",VLDB,1995
69629,journals/sigmod/CaplinskasEV02,Advances in Databases and Information Systems (ADBIS),"A Caplinskas, J Eder, O Vasilecas",SIGMOD Record,2002
69632,journals/sigmod/Aberer02,Book Review Column,K Aberer,SIGMOD Record,2002
69633,conf/vldb/FlodinR95,Processing Object-Oriented Queries with Invertible Late Bound Functions,"S Flodin, T Risch",VLDB,1995
69637,conf/vldb/LuSL95,NeuroRule: A Connectionist Approach to Data Mining,"H Lu, R Setiono, H Liu",VLDB,1995
69639,conf/vldb/GallersdorferN95,Improving Performance in Replicated Databases through Relaxed Coherency,"R Gallersdörfer, M Nicola",VLDB,1995
69640,journals/sigmod/CiliaB02,An Active Functionality Service for E-Business Applications,"M Cilia, A Buchmann",SIGMOD Record,2002
69641,journals/sigmod/HummerLW02,Contracting in the Days of eBusiness,"W Hümmer, W Lehner, H Wedekind",SIGMOD Record,2002
69643,conf/vldb/Wang95,DB2 Query Parallelism: Staging and Implementation,Y Wang,VLDB,1995
69644,journals/sigmod/Winslett02a,David DeWitt Speaks Out,M Winslett,ecord,2002
69647,conf/vldb/DidriksenGD95,Database De-Centralization - A Practical Approach,"T Didriksen, C Galindo-Legaria, E Dahle",VLDB,1995
69649,journals/sigmod/PourabbasR02,A Pictorial Query Language for Querying Geographic Databases using Positional and OLAP Operators,"E Pourabbas, M Rafanelli",SIGMOD Record,2002
69651,journals/sigmod/SlivinskasJS02,Bringing Order to Query Optimization,"G Slivinskas, C Jensen, R Snodgrass",SIGMOD Record,2002
69653,journals/sigmod/Liu02a,Editor's Notes,L Liu,SIGMOD Record,2002
69655,journals/sigmod/CruzKLSWY02,Research Activities in Database Management and Information Retrieval at the University of Illinois at Chicago,"I Cruz, A Khokhar, B Liu, A Sistla, O Wolfson, C Yu",SIGMOD Record,2002
69656,conf/vldb/OrensteinK95,Accessing a Relational Database through an Object-Oriented Database Interface,"J Orenstein, D Kamber",VLDB,1995
69657,journals/sigmod/LuoI02,Interviewing During a Tight Job Market,,,2002
69667,conf/vldb/GoyalHSS95,Index Concurrency Control in Firm Real-Time Database Systems,"B Goyal, J Haritsa, S Seshadri, V Srinivasan",VLDB,1995
69669,conf/vldb/BestavrosB95,Value-cognizant Speculative Concurrency Control,"A Bestavros, S Braoudakis",VLDB,1995
69670,journals/sigmod/Goethals02,Data Warehousing and Business Intelligence for E-Commerce - Book Review,F Goethals,SIGMOD Record,2002
69672,conf/vldb/WuYCT95,A Performance Study of Workfile Disk Management for Concurrent Mergesorts in a Multiprocessor Database System,"K Wu, P Yu, J Chung, J Teng",VLDB,1995
69673,conf/vldb/MogiK95,Hot Block Clustering for Disk Arrays with Dynamic Striping,"K Mogi, M Kitsuregawa",VLDB,1995
69677,journals/sigmod/YaoG02,The Cougar Approach to In-Network Query Processing in Sensor Networks,"Y Yao, J Gehrke",SIGMOD Record,2002
69678,conf/vldb/JagadishLRSS94,Dalí: A High Performance Main Memory Storage Manager,"H Jagadish, D Lieuwen, R Rastogi, A Silberschatz, S Sudarshan",VLDB,1994
69680,conf/vldb/Galindo-LegariaPK94,"Fast, Randomized Join-Order Selection - Why Use Transformations?","C Galindo-Legaria, A Pellenkoft, M Kersten",VLDB,1994
69684,journals/sigmod/Neven02,Automata Theory for XML Researchers,F Neven,SIGMOD Record,2002
69685,journals/sigmod/WinslettCDHZZ02,Database Research at the University of Illinois at Urbana-Champaign,"M Winslett, K Chang, A Doan, J Han, C Zhai, Y Zhou",SIGMOD Record,2002
69689,journals/sigmod/Hammer02a,Treasurer's Message,,,2002
69690,conf/vldb/OuzzaniAB94,A Top-Down Approach for Two Level Serializability,"M Ouzzani, M Atroun, N Belkhodja",VLDB,1994
69692,journals/sigmod/SofferMC02,Report on the Mobile Search Workshop at WWW 2002,,,2002
69693,conf/vldb/Guting94,GraphDB: Modeling and Querying Graphs in Databases,R Güting,VLDB,1994
69695,journals/sigmod/CrestaniG02,Report on the 24th European Colloquium on Information Retrieval Research,,,2002
69696,conf/vldb/GutierrezPST94,Database Graph Views: A Practical Model to Manage Persistent Graphs,"A Gutiérrez, P Pucheral, H Steffen, J Thévenin",VLDB,1994
69697,conf/vldb/KemperK94,Dual-Buffering Strategies in Object Bases,"A Kemper, D Kossmann",VLDB,1994
69698,journals/sigmod/MeltonMJKS02,SQL/MED - A Status Report,"J Melton, J Michels, V Josifovski, K Kulkarni, P Schwarz",SIGMOD Record,2002
69700,conf/vldb/JohnsonS94,2Q: A Low Overhead High Performance Buffer Management Replacement Algorithm,"T Johnson, D Shasha",VLDB,1994
69702,journals/sigmod/LightstoneLZ02,Toward Autonomic Computing with DB2 Universal Database,"S Lightstone, G Lohman, D Zilio",SIGMOD Record,2002
69703,journals/sigmod/RossAJS02,Reminiscences on Influential Papers,,,2002
69704,conf/vldb/BaralisW94,An Algebraic Approach to Rule Analysis in Expert Database Systems,"E Baralis, J Widom",VLDB,1994
69705,journals/sigmod/FrankNS02,Report on the Semantic Web Workshop at WWW 2002,,,2002
69707,journals/sigmod/Badia02,Ontologies: A Silver Bullet for Knowledge Management and Electronic Commerce - Book Review,,,2002
69712,conf/vldb/EvangelidisLS95,"The hBP-tree: A Modified hB-tree Supporting Concurrency, Recovery and Node Consolidation","G Evangelidis, D Lomet, B Salzberg",VLDB,1995
69713,journals/sigmod/Wu02,Small Worlds: the Dynamics of Networks between Order and Randomness - Book Review,,,2002
69715,conf/vldb/Sarawagi95,Query Processing in Tertiary Memory Databases,S Sarawagi,VLDB,1995
69717,journals/sigmod/SureSS02,Methodology for Development and Employment of Ontology Based Knowledge Management Applications,"Y Sure, S Staab, R Studer",SIGMOD Record,2002
69721,journals/sigmod/AnyanwuS02,The p Operator: Discovering and Ranking Associations on the Semantic Web,"K Anyanwu, A Sheth",SIGMOD Record,2002
69723,journals/sigmod/HalkidiBV02a,Clustering Validity Checking Methods: Part II,"M Halkidi, Y Batistakis, M Vazirgiannis",SIGMOD Record,2002
69727,conf/vldb/Vaskevitch95,"Very Large Databases: How Large, How Different?",D Vaskevitch,VLDB,1995
69728,journals/sigmod/Aberer02b,Book Review Column,K Aberer,SIGMOD Record,2002
69729,journals/sigmod/HuangKL02,A Study on the Management of Semantic Transaction for Efficient Data Retrieval,"S Huang, I Kwan, C Li",SIGMOD Record,2002
69732,journals/sigmod/RossAA02,Reminiscences on Influential Papers,,,2002
69733,journals/sigmod/Grohe02,Parameterized Complexity for the Database Theorist,M Grohe,SIGMOD Record,2002
69735,journals/sigmod/RoantreeS02,Research in Information Managment at Dublin City University,"M Roantree, A Smeaton",SIGMOD Record,2002
69736,conf/vldb/Hallmark95,The Oracle Warehouse,G Hallmark,VLDB,1995
69738,journals/sigmod/BoucelmaCGJLL02,Report on the EDBT'02 Panel on Scientific Data Integration,,,2002
69741,journals/sigmod/Suciu01,On Database Theory and XML,D Suciu,SIGMOD Record,2001
69748,conf/vldb/HasanM94,Optimization Algorithms for Exploiting the Parallelism-Communication Tradeoff in Pipelined Parallelism,"W Hasan, R Motwani",VLDB,1994
69750,conf/vldb/MohaniaS94,Some Issues in Design of Distributed Deductive Databases,"M Mohania, N Sarda",VLDB,1994
69751,conf/vldb/LiC94,Semantic Integration in Heterogeneous Databases Using Neural Networks,"W Li, C Clifton",VLDB,1994
69754,journals/sigmod/LudascherMM01,"Preservation of Digital Data with Self-Validating, Self-Instantiating Knowledge-Based Archives","B Ludäscher, R Marciano, R Moore",SIGMOD Record,2001
69756,conf/vldb/FerrandinaMZ94,Implementing Lazy Database Updates for an Object Database System,"F Ferrandina, T Meyer, R Zicari",VLDB,1994
69757,conf/vldb/TeisseirePC94,Towards Event-Driven Modelling for Database Design,"M Teisseire, P Poncelet, R Cicchetti",VLDB,1994
69761,conf/vldb/GehaniJR94,OdeFS: A File System Interface to an Object-Oriented Database,"N Gehani, H Jagadish, W Roome",VLDB,1994
69762,journals/sigmod/Bernstein01,Report on the 2001 SIGMOD and PODS Awards,,,2001
69763,journals/sigmod/BunemanFSW01,Constraints for Semi-structured Data and XML,"P Buneman, W Fan, J Siméon, S Weinstein",SIGMOD Record,2001
69764,conf/vldb/KilgerM94,Indexing Multiple Sets,"C Kilger, G Moerkotte",VLDB,1994
69767,conf/vldb/HoelS94,Performance of Data-Parallel Spatial Operations,"E Hoel, H Samet",VLDB,1994
69768,journals/sigmod/EisenbergM01,SQL/XML and the SQLX Informal Group of Companies,"A Eisenberg, J Melton",SIGMOD Record,2001
69770,conf/vldb/BrinkhoffK94,The Impact of Global Clustering on Spatial Database Systems,"T Brinkhoff, H Kriegel",VLDB,1994
69771,journals/sigmod/ShahMFH01,Java Support for Data-Intensive Systems: Experiences Building the Telegraph Dataflow System,"M Shah, S Madden, M Franklin, J Hellerstein",SIGMOD Record,2001
69772,conf/vldb/MuntzR94,A Requirement-Based Approach to Data Modeling and Re-Engineering,"A Muntz, C Ramiller",VLDB,1994
69776,conf/vldb/ChakravarthyKAK94,"Composite Events for Active Databases: Semantics, Contexts and Detection","S Chakravarthy, V Krishnaprasad, E Anwar, S Kim",VLDB,1994
69777,journals/sigmod/LenzeriniNNS01,Report on the 8th International Workshop on Knowledge Representation Meets Databases (KRDB),,,2001
69778,conf/vldb/OzdenBRS94,A Low-Cost Storage Server for Movie on Demand Databases,"B Özden, A Biliris, R Rastogi, A Silberschatz",VLDB,1994
69780,conf/vldb/Chiueh94,Content-Based Image Indexing,T Chiueh,VLDB,1994
69782,journals/sigmod/ShethMKA01,Research in Multi-Organizational Processes and Semantic Information Brokering at the LSDIS Lab,"A Sheth, J Miller, K Kochut, I Arpinar",SIGMOD Record,2001
69783,journals/sigmod/Cetintemel01,On the Academic Interview Circuit: An End-to-End Discussion,U Çetintemel,SIGMOD Record,2001
69784,conf/vldb/SripadaW94,Cumulative Updates,"S Sripada, B Wüthrich",VLDB,1994
69785,conf/vldb/ShatdalKN94,Cache Conscious Algorithms for Relational Query Processing,"A Shatdal, C Kant, J Naughton",VLDB,1994
69786,journals/sigmod/Labrinidis01,Introduction to the Career Forum Column,A Labrinidis,SIGMOD Record,2001
69787,conf/vldb/LevySSZ94,Challenges for Global Information Systems,"A Levy, A Silberschatz, D Srivastava, M Zemankova",VLDB,1994
69788,journals/sigmod/BabuW01,Continuous Queries over Data Streams,"S Babu, J Widom",SIGMOD Record,2001
69790,conf/vldb/GoodmanRS94,Building a Laboratory Information System Around a C++-Based Object-Oriented DBMS,"N Goodman, S Rozen, L Stein",VLDB,1994
69792,journals/sigmod/ShanmugasundaramSKKVNT01,A General Techniques for Querying XML Documents using a Relational Database System,"J Shanmugasundaram, E Shekita, J Kiernan, R Krishnamurthy, S Viglas, J Naughton, I Tatarinov",SIGMOD Record,2001
69793,conf/vldb/BernsteinD94,An Overview of Repository Technology,"P Bernstein, U Dayal",VLDB,1994
69796,journals/sigmod/Snodgrass01a,Accessibility of the Database Literature,R Snodgrass,SIGMOD Record,2001
69797,journals/sigmod/Hammer01,Treasurer's Message,,,2001
69800,conf/vldb/RosenthalS94,Data Integration in the Large: The Challenge of Reuse,"A Rosenthal, L Seligman",VLDB,1994
69802,conf/vldb/Lesk94,Experiments on Access to Digital Libraries: How can Images and Text be Used Together,M Lesk,VLDB,1994
69803,conf/vldb/Bernstein94,PC Database Systems - Present and Future,P Bernstein,VLDB,1994
69804,journals/sigmod/Liu01b,Editor's Notes,L Liu,SIGMOD Record,2001
69805,journals/sigmod/StolfoLCFE01,Data Mining-based Intrusion Detectors: An Overview of the Columbia IDS Project,"S Stolfo, W Lee, P Chan, W Fan, E Eskin",SIGMOD Record,2001
69806,conf/sigmod/BabcockO03,Distributed Top-K Monitoring,"B Babcock, C Olston",SIGMOD Conference,2003
69807,conf/sigmod/DasGR03,Approximate Join Processing Over Data Streams,"A Das, J Gehrke, M Riedewald",SIGMOD Conference,2003
69809,journals/sigmod/CabreraLM01,Detection and Classification of Intrusions and Faults using Sequences of System Calls,"J Cabrera, L Lewis, R Mehra",SIGMOD Record,2001
69810,conf/sigmod/WangJLY03,Containment Join Size Estimation: Models and Methods,"W Wang, H Jiang, H Lu, J Yu",SIGMOD Conference,2003
69812,journals/sigmod/Aberer01a,Book Review Column,K Aberer,SIGMOD Record,2001
69814,journals/sigmod/Cardelli01,Describing Semistructured Data,L Cardelli,SIGMOD Record,2001
69824,journals/sigmod/VelACM01,Mining Email Content for Author Identification Forensics,"O Vel, A Anderson, M Corney, G Mohay",SIGMOD Record,2001
69826,conf/sigmod/IlyasRLGL03,Estimating Compilation Time of a Query Optimizer,"I Ilyas, J Rao, G Lohman, D Gao, E Lin",SIGMOD Conference,2003
69827,conf/sigmod/DeligiannakisR03,Extended Wavelets for Multiple Measures,"A Deligiannakis, N Roussopoulos",SIGMOD Conference,2003
69832,conf/sigmod/BenediktCFFR03,Capturing both Types and Constraints in Data Integration,"M Benedikt, C Chan, W Fan, J Freire, R Rastogi",SIGMOD Conference,2003
69833,journals/sigmod/RossHLW01,Reminiscences on Influential Papers,,,2001
69834,conf/sigmod/MiloAABN03,Exchanging Intensional XML Data,"T Milo, S Abiteboul, B Amann, O Benjelloun, F Ngoc",SIGMOD Conference,2003
69835,conf/vldb/TsatalosSI94,The GMAP: A Versatile Tool for Physical Data Independence,"O Tsatalos, M Solomon, Y Ioannidis",VLDB,1994
69839,conf/vldb/MatthesS94,Persistent Threads,"F Matthes, J Schmidt",VLDB,1994
69840,journals/sigmod/SommerGB02,The n-Tier Hub Technology,"R Sommer, T Gulledge, D Bailey",SIGMOD Record,2002
69841,journals/sigmod/Cingil02,Supporting Global User Profiles Through Trusted Authorities,I Cingil,SIGMOD Record,2002
69842,conf/vldb/DavisonG94,Memory-Contention Responsive Hash Joins,"D Davison, G Graefe",VLDB,1994
69845,conf/vldb/GaasterlandL94,Qualified Answers That Reflect User Needs and Preferences,"T Gaasterland, J Lobo",VLDB,1994
69847,conf/vldb/LitwinNS94,RP*: A Family of Order Preserving Scalable Distributed Data Structures,"W Litwin, M Neimat, D Schneider",VLDB,1994
69848,journals/sigmod/Bussler02,The Role of B2B Engines in B2B Integration Architectures,C Bussler,SIGMOD Record,2002
69849,journals/sigmod/BallMRZ02,Supply Chain Infrastructures: System Integration and Information Sharing,"M Ball, M Ma, L Raschid, Z Zhao",SIGMOD Record,2002
69851,journals/sigmod/Winslett02,Interview with Avi Silberschatz,,,2002
69852,conf/vldb/SistlaYH94,Reasoning About Spatial Relationships in Picture Retrieval Systems,"A Sistla, C Yu, R Haddad",VLDB,1994
69853,journals/sigmod/Grefen02,What Will Be - Book Review,,,2002
69855,conf/vldb/HjelsvoldM94,Modelling and Querying Video Data,"R Hjelsvold, R Midtstraum",VLDB,1994
69856,journals/sigmod/Stonebraker02,Too Much Middleware,M Stonebraker,SIGMOD Record,2002
69862,conf/vldb/PoulovassilisS94,Investigation of Algebraic Query Optimisation Techniques for Database Programming Languages,"A Poulovassilis, C Small",VLDB,1994
69864,journals/sigmod/Elderini02,Letter to SIGMOD Record Editor,N Elderini,,2002
69866,journals/sigmod/Snodgrass02,Why I Like Working in Academia,R Snodgrass,SIGMOD Record,2002
69868,conf/sigmod/LakshmananPZ03,QC-Trees: An Efficient Summary Structure for Semantic OLAP,"L Lakshmanan, J Pei, Y Zhao",SIGMOD Conference,2003
69869,journals/sigmod/JacobS99,FinTime - A Financial Time Series Benchmark,"K Jacob, D Shasha",SIGMOD Record,1999
69872,journals/sigmod/KempsterST99,Diluting ACID,"T Kempster, C Stirling, P Thanisch",SIGMOD Record,1999
69875,conf/sigmod/WangPFY03,ViST: A Dynamic Index Method for Querying XML Data by Tree Structures,"H Wang, S Park, W Fan, P Yu",SIGMOD Conference,2003
69876,journals/sigmod/Franklin99b,Editor's Notes,M Franklin,SIGMOD Record,1999
69877,conf/sigmod/SionAP03,Rights Protection for Relational Data,"R Sion, M Atallah, S Prabhakar",SIGMOD Conference,2003
69878,journals/sigmod/EisenbergM00,SQL Standardization: The Next Steps,"A Eisenberg, J Melton",SIGMOD Record,2000
69879,journals/sigmod/RossFLOSSVW00,Reminiscences on Influential Papers,,,2000
69880,conf/sigmod/AgrawalES03,Information Sharing Across Private Databases,"R Agrawal, A Evfimievski, R Srikant",SIGMOD Conference,2003
69883,conf/sigmod/JohnsonD03,Data Quality and Data Cleaning: An Overview,"T Johnson, T Dasu",SIGMOD Conference,2003
69885,journals/sigmod/CeriKKLOSV00,SIGMOD Sister Societies,"S Ceri, L Kalinichenko, M Kitsuregawa, H Lu, Z Özsoyoglu, R Snodgrass, V Vianu",SIGMOD Record,2000
69887,conf/sigmod/AgrawalK03,A System for Watermarking Relational Databases,"R Agrawal, P Haas, J Kiernan",SIGMOD Conference,2003
69891,conf/sigmod/Ullman03,Improving the Efficiency of Database-System Teaching,J Ullman,SIGMOD Conference,2003
69894,conf/sigmod/2003,"Proceedings of the 2003 ACM SIGMOD International Conference on Management of Data, San Diego, California, USA, June 9-12, 2003",,,2003
69895,journals/sigmod/Vassilakis00,An Optimisation Scheme for Coalesce/Valid Time Selection Operator Sequences,C Vassilakis,SIGMOD Record,2000
69896,conf/sigmod/Mamoulis03,Efficient Processing of Joins on Set-valued Attributes,N Mamoulis,SIGMOD Conference,2003
69898,conf/sigmod/JagatheesanR03,Data Grid Management Systems,"A Jagatheesan, A Rajasekar",SIGMOD Conference,2003
69899,conf/sigmod/ChengKP03,Evaluating Probabilistic Queries over Imprecise Data,"R Cheng, D Kalashnikov, S Prabhakar",SIGMOD Conference,2003
69900,journals/sigmod/RoddickABDEGHLMMMW00,Evolution and Change in Data Management - Issues and Directions,"J Roddick, L Al-Jadir, L Bertossi, M Dumas, F Estrella, H Gregersen, K Hornsby, J Lufter, F Mandreoli, T Männistö, E Mayol, L Wedemeijer",SIGMOD Record,2000
69901,conf/sigmod/OlstonJW03,Adaptive Filters for Continuous Queries over Distributed Data Streams,"C Olston, J Jiang, J Widom",SIGMOD Conference,2003
69903,journals/sigmod/Palpanas00,Knowledge Discovery in Data Warehouses,T Palpanas,SIGMOD Record,2000
69907,conf/sigmod/ShenNSHS03,CMVF: A Novel Dimension Reduction Scheme for Efficient Indexing in A Large Image Database,"J Shen, A Ngu, J Shepherd, D Huynh, Q Sheng",SIGMOD Conference,2003
69908,journals/sigmod/WestmannKHM00,The Implementation and Performance of Compressed Databases,"T Westmann, D Kossmann, S Helmer, G Moerkotte",SIGMOD Record,2000
69910,journals/sigmod/VetterliVS00,Metadata Standards for Data Warehousing: Open Information Model vs. Common Warehouse Metamodel,"T Vetterli, A Vaduva, M Staudt",SIGMOD Record,2000
69914,conf/sigmod/CranorJSS03,Gigascope: A Stream Database for Network Applications,"C Cranor, T Johnson, O Spatscheck, V Shkapenyuk",SIGMOD Conference,2003
69916,journals/sigmod/WuY00,Report on Second International Workshop on Advanced Issues of E-Commerce and Web-based Information Systems,,,2000
69917,journals/sigmod/ArpinarD00,Provision of Market Services for eCo Compliant Electronic Market Places,"S Arpinar, A Dogac",SIGMOD Record,2000
69919,conf/sigmod/ReissK03,A Characterization of the Sensitivity of Query Optimization to Storage Access Cost Parameters,"F Reiss, T Kanungo",SIGMOD Conference,2003
69920,journals/sigmod/KantM00,"Workshop on Performance and Architecture of Web Servers (PAWS-2000, held in conjection with SIGMETRICS-2000)",,,2000
69922,journals/sigmod/LudwigG00,Report in ISDO '00: The CAiSE*00 Workshop on Infrastructures for Dynamic Business-to-Business Service Outsourcinga,,,2000
69923,journals/sigmod/Cruz00,SIGMOD Digital Symposium Collection (DiSC) Editor's Message,,,2000
69924,conf/sigmod/DeshpandeNGS03,Cache-and-Query for Wide Area Sensor Databases,"A Deshpande, S Nath, P Gibbons, S Seshan",SIGMOD Conference,2003
69925,conf/sigmod/LiBKN03,Composing XSL Transformations with XML Publishing Views,"C Li, P Bohannon, H Korth, P Narayan",SIGMOD Conference,2003
69926,journals/sigmod/Naughton00,SIGMOD'2000 Program Chair's Message,,,2000
69930,conf/sigmod/CuiOTS03,Contorting High Dimensional Data for Efficient Main Memory Processing,"B Cui, B Ooi, J Su, K Tan",SIGMOD Conference,2003
69934,conf/sigmod/Raghavan03,Extracting and Exploiting Structure in Text Search,P Raghavan,SIGMOD Conference,2003
69941,conf/sigmod/Colliat03,Data Management Challenges in CRM,G Colliat,SIGMOD Conference,2003
69942,journals/sigmod/PoessF00,New TPC Benchmarks for Decision Support and Web Commerce,"M Pöss, C Floyd",SIGMOD Record,2000
69943,conf/sigmod/GotoK03,Integration of Electronic Tickets and Personal Guide System for Public Transport using Mobile Terminals,"K Goto, Y Kambayashi",SIGMOD Conference,2003
69944,journals/sigmod/Bussche00,Constraint databases: A tutorial introduction,J Bussche,SIGMOD Record,2000
69951,conf/sigmod/ChaudhuriKN03,On Relational Support for XML Publishing: Beyond Sorting and Tagging,"S Chaudhuri, R Kaushik, J Naughton",SIGMOD Conference,2003
69953,journals/sigmod/RossIJP00,Reminiscences on Influential Papers,,,2000
69954,conf/sigmod/KimC03,Qcluster: Relevance Feedback Using Adaptive Clustering for Content-Based Image Retrieval,"D Kim, C Chung",SIGMOD Conference,2003
69956,journals/sigmod/CasatiDS00,VLDB Workshop on Technologies in E-Services (TES),,,2000
69958,conf/sigmod/Pruscino03,Oracle RAC: Architecture and Performance,A Pruscino,SIGMOD Conference,2003
69959,conf/sigmod/Bosworth03,The Future of Web Services - I,A Bosworth,SIGMOD Conference,2003
69960,journals/sigmod/PossasMCR00,Using Quantitative Information for Efficient Association Rule Generation,"B Pôssas, W Jr., M Carvalho, R Resende",SIGMOD Record,2000
69962,journals/sigmod/HasselbringHHKRRS00,"Research and Practice in Federated Information Systems, Report of the EFIS '2000 International Workshop",,,2000
69963,conf/sigmod/GangulyGR03,Processing Set Expressions over Continuous Update Streams,"S Ganguly, M Garofalakis, R Rastogi",SIGMOD Conference,2003
69964,journals/sigmod/Franklin00b,Editor's Notes,M Franklin,SIGMOD Record,2000
69975,conf/sigmod/ZhangZPTL03,Location-based Spatial Queries,"J Zhang, M Zhu, D Papadias, Y Tao, D Lee",SIGMOD Conference,2003
69976,journals/sigmod/MeltonMJKSZ01,SQL and Management of External Data,"J Melton, J Michels, V Josifovski, K Kulkarni, P Schwarz, K Zeidenstein",SIGMOD Record,2001
69978,conf/sigmod/MaddenFHH03,The Design of an Acquisitional Query Processor For Sensor Networks,"S Madden, M Franklin, J Hellerstein, W Hong",SIGMOD Conference,2003
69979,conf/sigmod/MinPC03,XPRESS: A Queriable Compression for XML Data,"J Min, M Park, C Chung",SIGMOD Conference,2003
69981,conf/sigmod/QunLO03,D(k)-Index: An Adaptive Structural Summary for Graph-Structured Data,"C Qun, A Lim, K Ong",SIGMOD Conference,2003
69982,journals/sigmod/FengJH01,Towards Knowledge-Based Digital Libraries,"L Feng, M Jeusfeld, J Hoppenbrouwers",SIGMOD Record,2001
69985,journals/sigmod/Critchlow01,Report on XEWA-00: The XML Enabled Wide-Area Searches for Bioinformatics Workshop,,,2001
69986,conf/sigmod/ZhuS03,Warping Indexes with Envelope Transforms for Query by Humming,"Y Zhu, D Shasha",SIGMOD Conference,2003
69987,journals/sigmod/Snodgrass01,Chair's Message,,,2001
69988,conf/sigmod/MelnikRB03,Rondo: A Programming Platform for Generic Model Management,"S Melnik, E Rahm, P Bernstein",SIGMOD Conference,2003
69989,conf/sigmod/KangN03,On Schema Matching with Opaque Column Names and Data Values,"J Kang, J Naughton",SIGMOD Conference,2003
69991,conf/sigmod/HeC03,Statistical Schema Matching across Web Query Interfaces,"B He, K Chang",SIGMOD Conference,2003
69992,journals/sigmod/LawderK01,Querying Multi-dimensional Data Indexed Using the Hilbert Space-filling Curve,"J Lawder, P King",SIGMOD Record,2001
69993,conf/sigmod/CohenM03,Spectral Bloom Filters,"S Cohen, Y Matias",SIGMOD Conference,2003
69995,journals/sigmod/BernsteinBCDFGGHHJLMNPSU98,The Asilomar Report on Database Research,"P Bernstein, M Brodie, S Ceri, D DeWitt, M Franklin, H Garcia-Molina, J Gray, G Held, J Hellerstein, H Jagadish, M Lesk, D Maier, J Naughton, H Pirahesh, M Stonebraker, J Ullman",SIGMOD Record,1998
69999,conf/sigmod/KaushikBNK02,Covering indexes for branching path queries,"R Kaushik, P Bohannon, J Naughton, H Korth",SIGMOD Conference,2002
70000,journals/sigmod/MeltzerC98,XML and Electronic Commerce: Enabling the Network Economy,"B Meltzer, R Glushko",SIGMOD Record,1998
70002,journals/sigmod/BichlerSZ98,Component-based E-Commerce: Assesment of Current Practices and Future Directions,"M Bichler, A Segev, J Zhao",SIGMOD Record,1998
70003,conf/sigmod/Grust02,Accelerating XPath location steps,T Grust,SIGMOD Conference,2002
70005,conf/sigmod/ZadorozhnyRVUB02,Efficient evaluation of queries in a mediator for WebSources,"V Zadorozhny, L Raschid, M Vidal, T Urhan, L Bright",SIGMOD Conference,2002
70006,journals/sigmod/EisenbergM98a,"SQLJ Part 0, Now Known as SQL/OLB (Object-Language Bindings)","A Eisenberg, J Melton",SIGMOD Record,1998
70007,journals/sigmod/Ritter98,The Middleware Muddle,D Ritter,SIGMOD Record,1998
70009,journals/sigmod/SnodgrassHMOPRRWY98,Reminiscences on Influential Papers,,,1998
70011,conf/sigmod/KalnisNOPT02,An adaptive peer-to-peer network for distributed caching of OLAP results,"P Kalnis, W Ng, B Ooi, D Papadias, K Tan",SIGMOD Conference,2002
70013,journals/sigmod/ReichB98,A Componentized Architecture for Dynamic Electronic Markets,"B Reich, I Ben-Shaul",SIGMOD Record,1998
70014,conf/sigmod/RiedewaldAA02,Efficient integration and aggregation of historical information,"M Riedewald, D Agrawal, A Abbadi",SIGMOD Conference,2002
70015,conf/sigmod/BunemanKTT02,Archiving scientific data,"P Buneman, S Khanna, K Tajima, W Tan",SIGMOD Conference,2002
