tid,id,title,authors,venue,year
70435,conf/sigmod/ChenDLT00,Fact: A Learning Based Web Query Processing System,"S Chen, Y Diao, H Lu, Z Tian",SIGMOD Conference,2000
70438,conf/sigmod/WangSSZZW00,An Approximate Search Engine for Structural Databases,"J Wang, X Wang, D Shasha, B Shapiro, K Zhang, X Zheng, Q Ma, Z Weinberg",SIGMOD Conference,2000
70440,journals/sigmod/Jarke95,Information Systems Research at RWTH Aachen,M Jarke,SIGMOD Record,1995
70441,conf/sigmod/Galhardas00,AJAX: An Extensible Data Cleaning Tool,"H Galhardas, D Florescu, D Shasha, E Simon",SIGMOD Conference,2000
70442,journals/sigmod/DarwenD95,The Third Manifesto,"H Darwen, C Date",SIGMOD Record,1995
70447,journals/sigmod/EnglertGH95,Parallelism and its Price: A Case Study of NonStop SQL/MP,"S Englert, R Glasstone, W Hasan",SIGMOD Record,1995
70450,conf/sigmod/LeeKOTM00,Towards Self-Tuning Data Placement in Parallel Database Systems,"M Lee, M Kitsuregawa, B Ooi, K Tan, A Mondal",SIGMOD Conference,2000
70451,journals/sigmod/SegevJS95,Report on The 1995 International Workshop on Temporal Databases,,,1995
70452,conf/sigmod/LabrinidisR00,WebView Materialization,"A Labrinidis, N Roussopoulos",SIGMOD Conference,2000
70453,journals/sigmod/Bohlen95,Temporal Database System Implementations,M Böhlen,SIGMOD Record,1995
70454,conf/sigmod/ChenJDTW00,NiagaraCQ: A Scalable Continuous Query System for Internet Databases,"J Chen, D DeWitt, F Tian, Y Wang",SIGMOD Conference,2000
70456,conf/sigmod/BarclaySG00,TerraServer: A Spatial Data Warehouse,"T Barclay, D Slutz, J Gray",SIGMOD Conference,2000
70458,journals/sigmod/AlonsoCIM95,Managing Video Data in a Mobile Environment,"R Alonso, Y Chang, L Iftode, V Mani",SIGMOD Record,1995
70459,conf/sigmod/SalemBCL00,How To Roll a Join: Asynchronous Incremental View Maintenance,"K Salem, K Beyer, R Cochrane, B Lindsay",SIGMOD Conference,2000
70460,journals/sigmod/DunhamH95a,Mobile Computing and Databases: Anything New?,"M Dunham, A Helal",SIGMOD Record,1995
70461,journals/sigmod/ElmagarmidJF95,Wireless Client/Server Computing for Personal Information Services and Applications,"A Elmagarmid, J Jing, T Furukawa",SIGMOD Record,1995
70463,journals/sigmod/DrewHKKLLLSW95,Data and Knowledge Base Research at Hong Kong University of Science and Technology,"P Drew, B Hamidzadeh, K Karlapalem, A Kean, D Lee, Q Li, F Lochovsky, C Shum, B Wüthrich",SIGMOD Record,1995
70464,conf/sigmod/BreunigKNS00,LOF: Identifying Density-Based Local Outliers,"M Breunig, H Kriegel, R Ng, J Sander",SIGMOD Conference,2000
70465,conf/sigmod/ChoG00,Synchronizing a Database to Improve Freshness,"J Cho, H Garcia-Molina",SIGMOD Conference,2000
70469,conf/sigmod/KornM00,Influence Sets Based on Reverse Nearest Neighbor Queries,"F Korn, S Muthukrishnan",SIGMOD Conference,2000
70472,journals/sigmod/Widom95a,Editor's Notes,J Widom,SIGMOD Record,1995
70473,journals/sigmod/NobleS95,A Research Status Report on Adaptation for Mobile Data Access,"B Noble, M Satyanarayanan",SIGMOD Record,1995
70474,conf/sigmod/GarofalakisGRSS00,XTRACT: A System for Extracting Document Type Descriptors from XML Documents,"M Garofalakis, A Gionis, R Rastogi, S Seshadri, K Shim",SIGMOD Conference,2000
70481,journals/sigmod/AbiteboulH95,"\Response to \""\""A Close Look at the IFO Data Model\""\""\""""","S Abiteboul, R Hull",SIGMOD Record,1995
70483,conf/sigmod/BlakeleyD00,Tutorial: Data Access,,,2000
70485,journals/sigmod/RosenthalSMBTL95,Data Management Research at The MITRE Corporation,"A Rosenthal, L Seligman, C McCollum, B Blaustein, B Thuraisingham, E Lafferty",SIGMOD Record,1995
70487,conf/sigmod/BratsbergT00,Tutorial: Designing an Ultra Highly Available DBMS,,,2000
70489,journals/sigmod/PitouraB95,A Framework for Providing Consistent and Recoverable Agent-Based Access to Heterogeneous in Mobile Databases,"E Pitoura, B Bhargava",SIGMOD Record,1995
70494,conf/sigmod/AgrawalS00,Privacy-Preserving Data Mining,"R Agrawal, R Srikant",SIGMOD Conference,2000
70496,conf/sigmod/JagadishKS00,On Effective Multi-Dimensional Indexing for Strings,"H Jagadish, N Koudas, D Srivastava",SIGMOD Conference,2000
70497,journals/sigmod/Widom95,Editor's Notes,J Widom,SIGMOD Record,1995
70499,conf/sigmod/ChenCPPSTM00,Internet Traffic Warehouse,"C Chen, M Cochinwala, C Petrone, M Pucci, S Samtani, P Santa, M Mesiti",SIGMOD Conference,2000
70502,journals/sigmod/Finkelstein95,The New Middleware,R Finkelstein,SIGMOD Record,1995
70506,conf/sigmod/LehnerSPC00,Maintenance of Automatic Summary Tables,"W Lehner, R Sidle, H Pirahesh, R Cochrane",SIGMOD Conference,2000
70507,journals/sigmod/Alonso94,Trade Press News,,,1994
70513,journals/tods/LakshmananLN03,Efficient dynamic mining of constrained frequent sets,"L Lakshmanan, C Leung, R Ng",ACM Trans. Database Syst.,2003
70519,conf/sigmod/YangYW00,TIP: A Temporal Extension to Informix,"J Yang, H Ying, J Widom",SIGMOD Conference,2000
70520,journals/tods/DiaoAFZF03,Path sharing and predicate evaluation for high-performance XML filtering,"Y Diao, M Altinel, M Franklin, H Zhang, P Fischer",ACM Trans. Database Syst.,2003
70521,conf/sigmod/LiBCS00,SPIRE: A Progressive Content-Based Spatial Image Retrieval Engine,"C Li, L Bergman, V Castelli, J Smith",SIGMOD Conference,2000
70523,conf/sigmod/MerialdoAMMP00,Homer: a Model-Based CASE Tool for Data-Intensive Web Sites,"P Merialdo, P Atzeni, M Magnante, G Mecca, M Pecorone",SIGMOD Conference,2000
70524,journals/sigmod/DreyerDS94,Research Perspectives for Time Series Management Systems,"W Dreyer, A Dittrich, D Schmidt",SIGMOD Record,1994
70529,conf/sigmod/PeiMHZ00,Towards Data Mining Benchmarking: A Testbed for Performance Study of Frequent Pattern Mining,"J Pei, R Mao, K Hu, H Zhu",SIGMOD Conference,2000
70530,journals/sigmod/PissinouSEMOPSTD94,Towards an Infrastructure for Temporal Databases: Report of an Invitational ARPA/NSF Workshop,,,1994
70531,conf/sigmod/ShuklaD00,Tutorial: LDAP Directory Services - Just Another Database Application?,,,2000
70532,journals/sigmod/SnodgrassAABCDEGJKKKLLRSSS94,TSQL2 Language Specification,"R Snodgrass, I Ahn, G Ariav, D Batory, J Clifford, C Dyreson, R Elmasri, F Grandi, C Jensen, W Käfer, N Kline, K Kulkarni, T Leung, N Lorentzos, J Roddick, A Segev, M Soo, S Sripada",SIGMOD Record,1994
70534,conf/sigmod/IvesLPST00,Self-Organizing Data Sharing Communities with SAGRES,"Z Ives, A Levy, J Madhavan, R Pottinger, S Saroiu, I Tatarinov, S Betzler, Q Chen, E Jaslikowska, J Su, W Yeung",SIGMOD Conference,2000
70535,journals/sigmod/NorrieBSW94,The Database Research Group at ETH Zurich,"M Norrie, S Blott, H Schek, G Weikum",SIGMOD Record,1994
70541,conf/sigmod/Keim99,Efficient Geometry-based Similarity Search of 3D Spatial Databases,D Keim,SIGMOD Conference,1999
70543,conf/sigmod/DavulcuFKR99,A Layered Architecture for Querying Dynamic Web Content,"H Davulcu, J Freire, M Kifer, I Ramakrishnan",SIGMOD Conference,1999
70546,conf/sigmod/CallanCD99,Automatic Discovery of Language Models for Text Databases,"J Callan, M Connell, A Du",SIGMOD Conference,1999
70548,journals/tods/GibbonsMP02,Fast incremental maintenance of approximate histograms,"P Gibbons, Y Matias, V Poosala",ACM Trans. Database Syst.,2002
70551,conf/sigmod/AggarwalWY99,A New Method for Similarity Indexing of Market Basket Data,"C Aggarwal, J Wolf, P Yu",SIGMOD Conference,1999
70555,conf/sigmod/ChanI99,An Efficient Bitmap Encoding Scheme for Selection Queries,"C Chan, Y Ioannidis",SIGMOD Conference,1999
70558,journals/tods/WijesekeraJPH03,Removing permissions in the flexible authorization framework,"D Wijesekera, S Jajodia, F Parisi-Presicce, Ĺ Hagström",ACM Trans. Database Syst.,2003
70559,conf/sigmod/IvesFFLW99,An Adaptive Query Execution System for Data Integration,"Z Ives, D Florescu, M Friedman, A Levy, D Weld",SIGMOD Conference,1999
70562,journals/tods/Jimenez-PerisPAK03,Are quorums an alternative for data replication?,"R Jiménez-Peris, M Patińo-Martínez, G Alonso, B Kemme",ACM Trans. Database Syst.,2003
70563,conf/sigmod/Jamil99,Belief Reasoning in MLS Deductive Databases,H Jamil,SIGMOD Conference,1999
70564,journals/tods/LechtenborgerV03,On the computation of relational view complements,"J Lechtenbörger, G Vossen",ACM Trans. Database Syst.,2003
70566,conf/sigmod/ShanmugasundaramNSR99,Efficient Concurrency Control for Broadcast Environments,"J Shanmugasundaram, A Nithrakashyap, R Sivasankaran, K Ramamritham",SIGMOD Conference,1999
70567,journals/tods/KarpSP03,A simple algorithm for finding frequent elements in streams and bags,"R Karp, S Shenker, C Papadimitriou",ACM Trans. Database Syst.,2003
70568,conf/sigmod/GehrkeGRL99,BOAT-Optimistic Decision Tree Construction,"J Gehrke, V Ganti, R Ramakrishnan, W Loh",SIGMOD Conference,1999
70569,conf/sigmod/AdaliSS99,A Multimedia Presentation Algebra,"S Adali, M Sapino, V Subrahmanian",SIGMOD Conference,1999
70571,journals/sigmod/Segev94a,Editor's Notes,A Segev,SIGMOD Record,1994
70572,conf/sigmod/CruzJ99,A User-Centered Interface for Querying Distributed Multimedia Databases,"I Cruz, K James",SIGMOD Conference,1999
70573,journals/sigmod/SnodgrassAABCDEGJKKKLLRSSS94a,A TSQL2 Tutorial,"nodgrass, I Ahn, G Ariav, D Batory, J Clifford, C Dyreson, R Elmasri, F Grandi, C Jensen, W Käfer, N Kline, K Kulkarni, T Leung, N Lorentzos, J Roddick, A Segev, M Soo, S Sripada",SIGMOD Record,1994
70574,conf/sigmod/MamoulisP99,Integration of Spatial Join Algorithms for Processing Multiple Inputs,"N Mamoulis, D Papadias",SIGMOD Conference,1999
70577,journals/sigmod/X94b,Calls for Papers / Announcements,,SIGMOD Record,1994
70580,conf/sigmod/WolfsonSXZC99,DOMINO: Databases fOr MovINg Objects tracking,"O Wolfson, A Sistla, B Xu, J Zhou, S Chamberlain",SIGMOD Conference,1999
70583,journals/sigmod/Chen94,Database Research at NTHU and ITRI,A Chen,SIGMOD Record,1994
70584,conf/sigmod/LiuHBPT99,An XML-based Wrapper Generator for Web Information Extraction,"L Liu, W Han, D Buttler, C Pu, W Tang",SIGMOD Conference,1999
70585,journals/sigmod/Group94,"Response to the March 1994 ODMG-93 Commentary Written by Dr. Won Kim of UniSQL, Inc",O Group,SIGMOD Record,1994
70588,journals/sigmod/GlavitschSW94,Metadata for Integrating Speech Documents in a Text Retrieval System,"U Glavitsch, P Schäuble, M Wechsler",SIGMOD Record,1994
70589,journals/sigmod/ChenHKPW94,Metadata for Mixed-Media Access,"F Chen, M Hearst, J Kupiec, J Pedersen, L Wilcox",SIGMOD Record,1994
70590,conf/sigmod/TrisoliniLN99,Data Integration and Warehousing in Telecom Italia,"S Trisolini, M Lenzerini, D Nardi",SIGMOD Conference,1999
70591,journals/sigmod/AndersonS94,SEQUOIA 2000 Metadata Schema for Satellite Images,"J Anderson, M Stonebraker",SIGMOD Record,1994
70595,journals/sigmod/Alonso94b,Trade Press News - Announcement and Preface,,,1994
70599,journals/sigmod/BarclayBGS94,Loading Databases Using Dataflow Parallelism,"T Barclay, R Barnes, J Gray, P Sundaresan",SIGMOD Record,1994
70605,conf/sigmod/HaasH99,Ripple Joins for Online Aggregation,"P Haas, J Hellerstein",SIGMOD Conference,1999
70606,journals/sigmod/GeppertD94,Constructing the Next 100 Database Management Systems,"A Geppert, K Dittrich",SIGMOD Record,1994
70609,conf/sigmod/ChaudhuriMN99,On Random Sampling over Joins,"S Chaudhuri, R Motwani, V Narasayya",SIGMOD Conference,1999
70610,journals/sigmod/Segev94,Editor's Notes,A Segev,SIGMOD Record,1994
70615,conf/sigmod/LeeKC99,Multi-dimensional Selectivity Estimation Using Compressed Histogram Information,"J Lee, D Kim, C Chung",SIGMOD Conference,1999
70617,conf/sigmod/AboulnagaC99,Self-tuning Histograms: Building Histograms Without Looking at Data,"A Aboulnaga, S Chaudhuri",SIGMOD Conference,1999
70620,conf/sigmod/LakshmananNHP99,Optimization of Constrained Frequent Set Queries with 2-variable Constraints,"L Lakshmanan, R Ng, J Han, A Pang",SIGMOD Conference,1999
70621,journals/sigmod/BarbaraBFLS94,The Impact of Database Research on Industrial Products (Panel Summary),"D Barbará, J Blakeley, D Fishman, D Lomet, M Stonebraker",SIGMOD Record,1994
70623,journals/sigmod/X94,The TSQL2 Final Language Definition Announcement,,SIGMOD Record,1994
70624,conf/sigmod/JagadishLMSV99,Querying Network Directories,"H Jagadish, L Lakshmanan, T Milo, D Srivastava, D Vista",SIGMOD Conference,1999
70627,conf/sigmod/LometT99,Logical Logging to Extend Recovery to New Domains,"D Lomet, M Tuttle",SIGMOD Conference,1999
70628,journals/sigmod/X94a,Calls for Papers / Announcements,,SIGMOD Record,1994
70630,conf/sigmod/AnkerstBKS99,OPTICS: Ordering Points To Identify the Clustering Structure,"M Ankerst, M Breunig, H Kriegel, J Sander",SIGMOD Conference,1999
70631,journals/sigmod/Alonso94a,Trade Press News,,,1994
70632,conf/sigmod/JagadishLS99,Snakes and Sandwiches: Optimal Clustering Strategies for a Data Warehouse,"H Jagadish, L Lakshmanan, D Srivastava",SIGMOD Conference,1999
70633,conf/sigmod/AcharyaPR99,Selectivity Estimation in Spatial Databases,"S Acharya, V Poosala, S Ramaswamy",SIGMOD Conference,1999
70634,journals/sigmod/RamirezSP94,Medical Information Systems: Characterization and Challenges,"J Ramirez, L Smith, L Peterson",SIGMOD Record,1994
70640,conf/vldb/AilamakiDHS01,Weaving Relations for Cache Performance,"A Ailamaki, D DeWitt, M Hill, M Skounakis",VLDB,2001
70642,conf/vldb/SakuraiYKU01,Similarity Search for Adaptive Ellipsoid Queries Using Spatial Transformation,"Y Sakurai, M Yoshikawa, R Kataoka, S Uemura",VLDB,2001
70644,conf/sigmod/DoRD99,The Need for Distributed Asynchronous Transactions,"L Do, P Ram, P Drew",SIGMOD Conference,1999
70645,conf/vldb/GilbertKMS01,Surfing Wavelets on Streams: One-Pass Summaries for Approximate Aggregate Queries,"A Gilbert, Y Kotidis, S Muthukrishnan, M Strauss",VLDB,2001
70647,conf/vldb/MeccaCM01,RoadRunner: Towards Automatic Data Extraction from Large Web Sites,"V Crescenzi, G Mecca, P Merialdo",VLDB,2001
70648,conf/sigmod/AdelbergD99,Nodose Version 2.0,"B Adelberg, M Denny",SIGMOD Conference,1999
70650,conf/sigmod/BargaL99,Phoenix: Making Applications Robust,"R Barga, D Lomet",SIGMOD Conference,1999
70652,conf/vldb/MargaritisFT01,NetCube: A Scalable Tool for Fast Data Mining and Compression,"D Margaritis, C Faloutsos, S Thrun",VLDB,2001
70654,conf/sigmod/RundensteinerCLCZNJLW99,SERF: ODMG-Based Generic Re-structuring Facility,"E Rundensteiner, K Claypool, M Li, L Chen, X Zhang, C Natarajan, J Jin, S Lima, S Weiner",SIGMOD Conference,1999
70655,conf/sigmod/ZhouLP99,TAM: A System for Dynamic Transactional Activity Management,"T Zhou, L Liu, C Pu",SIGMOD Conference,1999
70657,conf/vldb/RamanH01,Potter's Wheel: An Interactive Data Cleaning System,"V Raman, J Hellerstein",VLDB,2001
70658,conf/sigmod/AcharyaGPR99,The Aqua Approximate Query Answering System,"S Acharya, P Gibbons, V Poosala, S Ramaswamy",SIGMOD Conference,1999
70661,conf/vldb/ShanmugasundaramKSFF01,Querying XML Views of Relational Data,"J Shanmugasundaram, J Kiernan, E Shekita, C Fan, J Funderburk",VLDB,2001
70662,conf/sigmod/BonnetBCCCHKMMOSS99,The Cornell Jaguar System: Adding Mobility to PREDATOR,"P Bonnet, K Buza, Z Chen, V Cheng, R Chung, T Hickey, R Kennedy, D Mahashin, T Mayr, I Oprencak, P Seshadri, H Siu",SIGMOD Conference,1999
70663,conf/vldb/VeltriCV01,Views in a Large Scale XML Repository,"S Cluet, P Veltri, D Vodislav",VLDB,2001
70664,conf/sigmod/RoussopoulosKS99,The Active MultiSync Controller of the Cubetree Storage Organization,"N Roussopoulos, Y Kotidis, Y Sismanis",SIGMOD Conference,1999
70669,conf/vldb/LiCHPALHAY01,Cache Portal: Technology for Accelerating Database-driven e-commerce Web Sites,"W Li, K Candan, W Hsiung, O Po, D Agrawal, Q Luo, W Huang, Y Akca, C Yilmaz",VLDB,2001
70670,conf/sigmod/MaratheS99,Query Processing Techniques for Arrays,"A Marathe, K Salem",SIGMOD Conference,1999
70671,conf/sigmod/NatsevRS99,WALRUS: A Similarity Retrieval Algorithm for Image Databases,"A Natsev, R Rastogi, K Shim",SIGMOD Conference,1999
70674,conf/sigmod/LabioYG99,Shrinking the Warehouse Update Window,"W Labio, R Yerneni, H Garcia-Molina",SIGMOD Conference,1999
70675,conf/sigmod/PapakonstantinouV99,Query Rewriting for Semistructured Data,"Y Papakonstantinou, V Vassalos",SIGMOD Conference,1999
70678,conf/sigmod/DeutschFS99,Storing Semistructured Data with STORED,"A Deutsch, M Fernandez, D Suciu",SIGMOD Conference,1999
70679,conf/vldb/ZengBNN01,AgFlow: Agent-based Cross-Enterprise Workflow Management System,"L Zeng, B Benatallah, P Nguyen, A Ngu",VLDB,2001
70680,conf/sigmod/Seshadri99,"``Honey, I Shrunk the DBMS'': Footprint, Mobility, and Beyond (Panel)",P Seshadri,SIGMOD Conference,1999
70682,conf/sigmod/EmbleyJN99,Record-Boundary Discovery in Web Documents,"D Embley, Y Jiang, Y Ng",SIGMOD Conference,1999
70683,conf/vldb/StillgerLMK01,LEO - DB2's LEarning Optimizer,"M Stillger, G Lohman, V Markl, M Kandil",VLDB,2001
70687,conf/sigmod/Suciu99,Managing Web Data,,,1999
70689,conf/sigmod/Chakrabarti99,Hypertext Databases and Data Mining,,,1999
70690,conf/vldb/AndreiV01,User-Optimizer Communication using Abstract Plans in Sybase ASE,"M Andrei, P Valduriez",VLDB,2001
70692,conf/vldb/ChaudhuriS01,Storage and Retrieval of XML Data Using Relational Databases,,,2001
70693,conf/sigmod/CareyCNVDRSM99,"O-O, What's Happening to DB2?","M Carey, D Chamberlin, S Narayanan, B Vance, D Doole, S Rielau, R Swagerman, N Mattos",SIGMOD Conference,1999
70694,conf/vldb/PatonG01,Information Management for Genome Level Bioinformatics,,,2001
70695,conf/sigmod/Hammond99,Merge Replication in Microsoft's SQL Server 7.0,B Hammond,SIGMOD Conference,1999
70696,conf/vldb/Sol01,"Ambient Intelligence with the Ubiquitous Network, the Embedded Computer Devices and the Hidden Databases (abstract)",E Sol,VLDB,2001
70697,conf/sigmod/KanthRSB99,Indexing Medium-dimensionality Data in Oracle,"K Kanth, S Ravada, J Sharma, J Banerjee",SIGMOD Conference,1999
70699,conf/vldb/MignetMAC01,Change-Centric Management of Versions in an XML Warehouse,"A Marian, S Abiteboul, G Cobena, L Mignet",VLDB,2001
70705,conf/vldb/AksoyZF01,Data Staging for On-Demand Broadcast,"D Aksoy, M Franklin, S Zdonik",VLDB,2001
70708,conf/sigmod/Stonebraker98,Are We Working On the Right Problems? (Panel),M Stonebraker,SIGMOD Conference,1998
70711,conf/sigmod/RajagopalanML98,Approximate Medians and other Quantiles in One Pass and with Limited Memory,"G Manku, S Rajagopalan, B Lindsay",SIGMOD Conference,1998
70713,conf/sigmod/LometW98,Efficient and Transparent Application Recovery in Client-Server Information Systems,"D Lomet, G Weikum",SIGMOD Conference,1998
70715,conf/vldb/BunkerCCMMW01,Aggregate Maintenance for Data Warehousing in Informix Red Brick Vista,"C Bunker, L Colby, R Cole, W McKenna, G Mulagund, D Wilhite",VLDB,2001
70716,conf/sigmod/Doherty98,Database Systems Management and Oracle8,C Doherty,SIGMOD Conference,1998
70724,conf/vldb/Novaretti01,French government activity in the conservation of data and electronic documents,S Novaretti,VLDB,2001
70728,conf/vldb/OConnellWG01,Collaborative Analytical Processing - Dream or Reality? (Panel abstract),"W O'Connell, A Witkowski, G Graefe",VLDB,2001
70730,conf/vldb/TsurAADKW01,Are Web Services the Next Revolution in e-Commerce? (Panel),"S Tsur, S Abiteboul, R Agrawal, U Dayal, J Klein, G Weikum",VLDB,2001
70732,conf/vldb/ChienTZ01,Efficient Management of Multiversion Documents by Object Referencing,"S Chien, V Tsotras, C Zaniolo",VLDB,2001
70734,conf/sigmod/BaruGLMPVC99,XML-Based Information Mediation with MIX,"C Baru, A Gupta, B Ludäscher, R Marciano, Y Papakonstantinou, P Velikhov, V Chu",SIGMOD Conference,1999
70736,conf/vldb/OzsuLON01,An Extendible Hash for Multi-Precision Similarity Querying of Image Databases,"S Lin, M Özsu, V Oria, R Ng",VLDB,2001
70738,conf/sigmod/VossenW99,The WASA2 Object-Oriented Workflow Management System,"G Vossen, M Weske",SIGMOD Conference,1999
70739,conf/vldb/WaasCB01,FeedbackBypass: A New Approach to Interactive Similarity Query Processing,"I Bartolini, P Ciaccia, F Waas",VLDB,2001
70740,conf/sigmod/AgrawalGGR98,Automatic Subspace Clustering of High Dimensional Data for Data Mining Applications,"R Agrawal, J Gehrke, D Gunopulos, P Raghavan",SIGMOD Conference,1998
70742,conf/sigmod/Bayardo98,Efficiently Mining Long Patterns from Databases,R Jr.,SIGMOD Conference,1998
70743,conf/vldb/ChaHKK01,Cache-Conscious Concurrency Control of Main-Memory Indexes on Shared-Memory Multiprocessor Systems,"S Cha, S Hwang, K Kim, K Kwon",VLDB,2001
70746,conf/sigmod/CherniackZ98,Changing the Rules: Transformations for Rule-Based Optimizers,"M Cherniack, S Zdonik",SIGMOD Conference,1998
70747,conf/sigmod/KotidisR98,An Alternative Storage Organization for ROLAP Aggregate Views Based on Cubetrees,"Y Kotidis, N Roussopoulos",SIGMOD Conference,1998
70751,conf/vldb/AnSVKIG01,Analyzing energy behavior of spatial access methods for memory-resident data,"N An, A Sivasubramaniam, N Vijaykrishnan, M Kandemir, M Irwin, S Gurumurthi",VLDB,2001
70752,conf/sigmod/UrhanFA98,Cost Based Query Scrambling for Initial Delays,"T Urhan, M Franklin, L Amsaleg",SIGMOD Conference,1998
70753,conf/vldb/GalhardasFSSS01,"Declarative Data Cleaning: Language, Model, and Algorithms","H Galhardas, D Florescu, D Shasha, E Simon, C Saita",VLDB,2001
70754,conf/sigmod/KabraD98,Efficient Mid-Query Re-Optimization of Sub-Optimal Query Execution Plans,"N Kabra, D DeWitt",SIGMOD Conference,1998
70755,conf/sigmod/SubramanianV98,Cost-Based Optimization of Decision Support Queries Using Transient Views,"S Subramanian, S Venkataraman",SIGMOD Conference,1998
70756,conf/vldb/KahveciS01,Efficient Index Structures for String Databases,"T Kahveci, A Singh",VLDB,2001
70757,conf/vldb/CooperSFHS01,A Fast Index for Semistructured Data,"B Cooper, N Sample, M Franklin, G Hjaltason, M Shadmon",VLDB,2001
70759,conf/sigmod/NestorovAM98,Extracting Schema from Semistructured Data,"S Nestorov, S Abiteboul, R Motwani",SIGMOD Conference,1998
70761,conf/sigmod/DeshpandeRSN98,Caching Multidimensional Queries Using Chunks,"P Deshpande, K Ramasamy, A Shukla, J Naughton",SIGMOD Conference,1998
70762,conf/vldb/TanEO01,Efficient Progressive Skyline Computation,"K Tan, P Eng, B Ooi",VLDB,2001
70763,conf/vldb/AgrawalCN00,Automated Selection of Materialized Views and Indexes in SQL Databases,"S Agrawal, S Chaudhuri, V Narasayya",VLDB,2000
70764,conf/sigmod/GrumbachRS98,The DEDALE System for Complex Spatial Queries,"S Grumbach, P Rigaux, L Segoufin",SIGMOD Conference,1998
70769,conf/vldb/PantiSG00,A Case-Based Approach to Information Integration,"M Panti, L Spalazzi, A Giretti",VLDB,2000
70770,conf/sigmod/ZhaoDNS98,Simultaneous Optimization and Evaluation of Multiple Dimensional Queries,"Y Zhao, P Deshpande, J Naughton, A Shukla",SIGMOD Conference,1998
70772,conf/vldb/ChangG00,Approximate Query Translation Across Heterogeneous Information Sources,"K Chang, H Garcia-Molina",VLDB,2000
70774,conf/vldb/PappasC00,Design and Development of a Stream Service in a Heterogenous Client Environment,"N Pappas, S Christodoulakis",VLDB,2000
70777,conf/vldb/DuttaDMRT00,Demonstration: Enabling Scalable Online Personalization on the Web,"K Dutta, A Datta, D VanderMeer, K Ramamritham, H Thomas",VLDB,2000
70778,conf/sigmod/Cohen98,Integration of Heterogeneous Databases Without Common Domains Using Queries Based on Textual Similarity,W Cohen,SIGMOD Conference,1998
70779,conf/sigmod/GodfreySE98,Secure and Portable Database Extensibility,"M Godfrey, T Mayr, P Seshadri, T Eicken",SIGMOD Conference,1998
70785,conf/vldb/Nori00,Asera: Extranet Architecture for B2B Solutions,A Nori,VLDB,2000
70786,conf/sigmod/LarsonG98,Memory Management During Run Generation in External Sorting,"P Larson, G Graefe",SIGMOD Conference,1998
70793,conf/sigmod/JaedickeM98,On Parallel Processing of Aggregate and Scalar Functions in Object-Relational DBMS,"M Jaedicke, B Mitschang",SIGMOD Conference,1998
70794,conf/vldb/Tsur00,Data Mining in the Bioinformatics Domain,S Tsur,VLDB,2000
70802,conf/sigmod/KornackerSH98,amdb: An Access Method Debugging Tool,"M Kornacker, M Shah, J Hellerstein",SIGMOD Conference,1998
70806,conf/sigmod/Brewer98,Delivering High Availability for Inktomi Search Engines,E Brewer,SIGMOD Conference,1998
70808,conf/vldb/KemmeA00,"Don't Be Lazy, Be Consistent: Postgres-R, A New Way to Implement Database Replication","B Kemme, G Alonso",VLDB,2000
70809,conf/sigmod/LiuPTBBZBHY98,CQ: A Personalized Update Monitoring Toolkit,"L Liu, C Pu, W Tang, D Buttler, J Biggs, T Zhou, P Benninghoff, W Han, F Yu",SIGMOD Conference,1998
70810,conf/vldb/YuV00,Efficient Numerical Error Bounding for Replicated Network Services,"H Yu, A Vahdat",VLDB,2000
70812,conf/vldb/PardonA00,CheeTah: a Lightweight Transaction Server for Plug-and-Play Internet Data Management,"G Pardon, G Alonso",VLDB,2000
70818,conf/vldb/LingLL00,Hierarchical Compact Cube for Range-Max Queries,"S Lee, T Ling, H Li",VLDB,2000
70819,conf/vldb/YiF00,Fast Time Sequence Indexing for Arbitrary Lp Norms,"B Yi, C Faloutsos",VLDB,2000
70821,conf/sigmod/ChenWZ98,A Protein Patent Query System Powered By Kleisli,"J Chen, L Wong, L Zhang",SIGMOD Conference,1998
70822,conf/vldb/LuL00,Decision Tables: Scalable Classification Exploring RDBMS Capabilities,"H Lu, H Liu",VLDB,2000
70823,conf/vldb/PottingerL00,A Scalable Algorithm for Answering Queries Using Views,"R Pottinger, A Levy",VLDB,2000
70824,conf/sigmod/ShintaniK98,Parallel Mining Algorithms for Generalized Association Rules with Classification Hierarchy,"T Shintani, M Kitsuregawa",SIGMOD Conference,1998
70825,conf/sigmod/TsurUACMNR98,Query Flocks: A Generalization of Association-Rule Mining,"S Tsur, J Ullman, S Abiteboul, C Clifton, R Motwani, S Nestorov, A Rosenthal",SIGMOD Conference,1998
70826,conf/vldb/GoldsteinR00,Contrast Plots and P-Sphere Trees: Space vs. Time in Nearest Neighbour Searches,"J Goldstein, R Ramakrishnan",VLDB,2000
