tid,id,title,authors,venue,year
71203,conf/vldb/CherniackZ98,Inferring Function Semantics to Optimize Queries,"M Cherniack, S Zdonik",VLDB,1998
71206,conf/vldb/NipplM98,"TOPAZ: a Cost-Based, Rule-Driven, Multi-Phase Parallelizer","C Nippl, B Mitschang",VLDB,1998
71208,conf/sigmod/WilschutFA95,Parallel Evaluation of Multi-Join Queries,"A Wilschut, J Flokstra, P Apers",SIGMOD Conference,1995
71210,conf/sigmod/HernandezS95,The Merge/Purge Problem for Large Databases,"M Hernández, S Stolfo",SIGMOD Conference,1995
71211,conf/sigmod/BettiniWBJ95,Semantic Assumptions and Query Evaluation in Temporal Databases,"C Bettini, X Wang, E Bertino, S Jajodia",SIGMOD Conference,1995
71215,conf/vldb/ZirintsisKM99,Hyper-Programming in Java,"E Zirintsis, G Kirby, R Morrison",VLDB,1999
71216,conf/sigmod/DuSD95,Reducing Multidatabase Query Response Time by Tree Balancing,"W Du, M Shan, U Dayal",SIGMOD Conference,1995
71218,conf/sigmod/SistlaW95,Temporal Conditions and Integrity Constraints in Active Database Systems,"A Sistla, O Wolfson",SIGMOD Conference,1995
71219,conf/vldb/HoskingC99,"PM3: An Orthogonal Persistent Systems Programming Language - Design, Implementation, Performance","A Hosking, J Chen",VLDB,1999
71220,conf/sigmod/ZhugeGHW95,View Maintenance in a Warehousing Environment,"Y Zhuge, H Garcia-Molina, J Hammer, J Widom",SIGMOD Conference,1995
71221,conf/vldb/FuhDCMTLDRM99,Implementation of SQL3 Structured Types with Inheritance and Value Substitutability,"Y Fuh, S Deßloch, W Chen, N Mattos, B Tran, B Lindsay, L DeMichel, S Rielau, D Mannhaupt",VLDB,1999
71223,conf/sigmod/FreedmanD95,The SPIFFI Scalable Video-on-Demand System,"C Freedman, D DeWitt",SIGMOD Conference,1995
71225,conf/vldb/FlorescuLSY99,Optimization of Run-time Management of Data Intensive Web-sites,"D Florescu, A Levy, D Suciu, K Yagoub",VLDB,1999
71226,conf/sigmod/GriffinL95,Incremental Maintenance of Views with Duplicates,"T Griffin, L Libkin",SIGMOD Conference,1995
71227,conf/sigmod/ChaudhuriDY95,Join Queries with External Text Sources: Execution and Optimization Techniques,"S Chaudhuri, U Dayal, T Yan",SIGMOD Conference,1995
71228,conf/vldb/MengLYWCR98,Determining Text Databases to Search in the Internet,"W Meng, K Liu, C Yu, X Wang, Y Chang, N Rishe",VLDB,1998
71230,conf/vldb/Tygar98,Atomicity versus Anonymity: Distributed Transactions for Electronic Commerce,J Tygar,VLDB,1998
71231,conf/vldb/HelmerWM98,Diag-Join: An Opportunistic Join Algorithm for 1:N Relationships,"S Helmer, T Westmann, G Moerkotte",VLDB,1998
71234,conf/vldb/GraefeBC98,Hash Joins and Hash Teams in Microsoft SQL Server,"G Graefe, R Bunker, S Cooper",VLDB,1998
71241,conf/vldb/BouganimCDDGS99,Miro Web: Integrating Multiple Data Sources through Semistructured Data Types,"L Bouganim, T Chan-Sine-Ying, T Dang-Ngoc, J Darroux, G Gardarin, F Sha",VLDB,1999
71242,conf/sigmod/Gray95,Parallel Database Systems 101,J Gray,SIGMOD Conference,1995
71245,conf/sigmod/Golding95,Things Every Update Replication Customer Should Know,R Golding,SIGMOD Conference,1995
71246,conf/vldb/OoiGT98,Fast High-Dimensional Data Search in Incomplete Databases,"B Ooi, C Goh, K Tan",VLDB,1998
71248,conf/sigmod/Shyy95,VERSANT Replication: Supporting Fault-Tolerant Object Databases,"Y Shyy, H Au-Yeung, C Chou",SIGMOD Conference,1995
71249,conf/sigmod/Edelstein95,Research and Products: Are They Relevant To Each Other? (Panel),H Edelstein,SIGMOD Conference,1995
71250,conf/vldb/KnorrN98,Algorithms for Mining Distance-Based Outliers in Large Datasets,"E Knorr, R Ng",VLDB,1998
71251,conf/sigmod/Bampahl95,Real World Requirements for Decision Support - Implications for RDBMS,S Bansal,SIGMOD Conference,1995
71253,conf/vldb/ShivakumarGC98,Filtering with Approximate Predicates,"N Shivakumar, H Garcia-Molina, C Chekuri",VLDB,1998
71254,conf/sigmod/French95,``One Size Fits All'' Database Architectures Do Not Work for DDS,C French,SIGMOD Conference,1995
71256,conf/sigmod/Perna95,Leveraging The Information Asset,J Perna,SIGMOD Conference,1995
71260,conf/sigmod/Gerber95,Informix Online XPS,R Gerber,SIGMOD Conference,1995
71265,conf/vldb/CarinoJ98,Bank of America Case Study: The Information Currency Advantage,"F Carińo, M Jahnke",VLDB,1998
71266,conf/sigmod/Faloutsos95,Indexing Multimedia Databases (Tutorial),,,1995
71267,conf/vldb/OzsuVU98,An Asynchronous Avoidance-Based Cache Consistency Algorithm for Client Caching DBMSs,"M Özsu, K Voruganti, R Unrau",VLDB,1998
71268,conf/sigmod/MattosM95,An Overview of the Emerging Third-Generation SQL Standard (Tutorial),,,1995
71269,conf/sigmod/Sheth95,"Workflow Automation: Applications, Technology, and Research (Tutorial)",,,1995
71272,conf/vldb/Garcia-MolinaLY98,Expiring Data in a Warehouse,"H Garcia-Molina, W Labio, J Yang",VLDB,1998
71273,conf/sigmod/Gibson95,Storage Technology: RAID and Beyond,,,1995
71274,conf/vldb/ZhangL98,Buffering and Read-Ahead Strategies for External Mergesort,"W Zhang, P Larson",VLDB,1998
71275,conf/vldb/ChaudhuriN97,An Efficient Cost-Driven Index Selection Tool for Microsoft SQL Server,"S Chaudhuri, V Narasayya",VLDB,1997
71276,conf/sigmod/GatziuGD95,The SAMOS Active DBMS Prototype,"S Gatziu, A Geppert, K Dittrich",SIGMOD Conference,1995
71281,conf/vldb/RossS97,Fast Computation of Sparse Datacubes,"K Ross, D Srivastava",VLDB,1997
71284,conf/sigmod/BuchmannDZH95,The REACH Active OODBMS,"A Buchmann, A Deutsch, J Zimmermann, M Higa",SIGMOD Conference,1995
71286,conf/sigmod/AshleyFHLNP95,The Query By Image Content (QBIC) System,"J Ashley, M Flickner, J Hafner, D Lee, W Niblack, D Petkovic",SIGMOD Conference,1995
71287,conf/sigmod/ColletC95,The NAOS System,"C Collet, T Coupaye",SIGMOD Conference,1995
71288,conf/vldb/VassalosP97,Describing and Using Query Capabilities of Heterogeneous Sources,"V Vassalos, Y Papakonstantinou",VLDB,1997
71289,conf/vldb/MorimotoIM97,Efficient Construction of Regression Trees with Range and Region Splitting,"Y Morimoto, H Ishii, S Morishita",VLDB,1997
71290,conf/sigmod/CeriFPP95,The Algres Testbed of CHIMERA: An Active Object-Oriented Database System,"S Ceri, P Fraternali, S Paraboschi, G Psaila",SIGMOD Conference,1995
71291,conf/sigmod/DreyerDS95,Using the CALANDA Time Series Management System,"W Dreyer, A Dittrich, D Schmidt",SIGMOD Conference,1995
71293,conf/sigmod/GrossmanHQ95,PTool: A Light Weight Persistent Object Manager,"R Grossman, D Hanley, X Qin",SIGMOD Conference,1995
71295,conf/vldb/EicklerKK97,Finding Data in the Neighborhood,"A Eickler, A Kemper, D Kossmann",VLDB,1997
71296,conf/sigmod/WangZS95,"Pattern Matching and Pattern Discovery in Scientific, Program, and Document Databases","J Wang, K Zhang, D Shasha",SIGMOD Conference,1995
71297,conf/vldb/StathatosRB97,Adaptive Data Broadcast in Hybrid Networks,"K Stathatos, N Roussopoulos, J Baras",VLDB,1997
71298,conf/sigmod/Team95b,SHORE: Combining the Best Features of OODBMS and File Systems,S Team,SIGMOD Conference,1995
71299,conf/vldb/BerckenSW97,A Generic Approach to Bulk Loading Multidimensional Index Structures,"J Bercken, B Seeger, P Widmayer",VLDB,1997
71301,conf/vldb/HelmerM97,Evaluation of Main Memory Join Algorithms for Joins with Set Comparison Join Predicates,"S Helmer, G Moerkotte",VLDB,1997
71305,conf/vldb/AshwinRSSS97,Garbage Collection in Object Oriented Databases Using Transactional Cyclic Reference Counting,"S Ashwin, P Roy, S Seshadri, A Silberschatz, S Sudarshan",VLDB,1997
71310,conf/sigmod/WangCMSSZ94,Combinatorial Pattern Discovery for Scientific Data: Some Preliminary Results,"J Wang, G Chirn, T Marr, B Shapiro, D Shasha, K Zhang",SIGMOD Conference,1994
71311,conf/vldb/LeeLWS97,A Region Splitting Strategy for Physical Database Design of Multidimensional File Organizations,"J Lee, Y Lee, K Whang, I Song",VLDB,1997
71312,conf/sigmod/MohanN94,ARIES/CSA: A Method for Database Recovery in Client-Server Architectures,"C Mohan, I Narang",SIGMOD Conference,1994
71314,conf/vldb/GoldmanW97,DataGuides: Enabling Query Formulation and Optimization in Semistructured Databases,"R Goldman, J Widom",VLDB,1997
71317,conf/sigmod/BilirisDGJR94,ASSET: A System for Supporting Extended Transactions,"A Biliris, S Dar, N Gehani, H Jagadish, K Ramamritham",SIGMOD Conference,1994
71319,conf/vldb/ChangG97,Effective Memory Use in a Media Server,"E Chang, H Garcia-Molina",VLDB,1997
71320,conf/sigmod/JonkerS95,The ECRC Multi Database System,"W Jonker, H Schütz",SIGMOD Conference,1995
71321,conf/sigmod/HuangSW94,Data Replication for Mobile Computers,"Y Huang, A Sistla, O Wolfson",SIGMOD Conference,1994
71324,conf/vldb/MalonM97,Critical Database Technologies for High Energy Physics,"D Malon, E May",VLDB,1997
71325,conf/sigmod/FaloutsosRM94,Fast Subsequence Matching in Time-Series Databases,"C Faloutsos, M Ranganathan, Y Manolopoulos",SIGMOD Conference,1994
71327,conf/sigmod/KrollW94,Distributing a Search Tree Among a Growing Number of Processors,"B Kröll, P Widmayer",SIGMOD Conference,1994
71329,conf/vldb/AlonsoHST97,Distributed Processing over Stand-alone Systems and Applications,"G Alonso, C Hagen, H Schek, M Tresch",VLDB,1997
71330,conf/sigmod/ChristophidesACS94,From Structured Documents to Novel Query Facilities,"V Christophides, S Abiteboul, S Cluet, M Scholl",SIGMOD Conference,1994
71332,conf/vldb/BernsteinHSSZ97,The Microsoft Repository,"P Bernstein, B Harry, P Sanders, D Shutt, J Zander",VLDB,1997
71333,conf/sigmod/VingralekBW94,Distributed File Organization with Scalable Cost/Performance,"R Vingralek, Y Breitbart, G Weikum",SIGMOD Conference,1994
71336,conf/vldb/WildfogelY97,Efficient Testing of High Performance Transaction Processing Systems,"D Wildfogel, R Yerneni",VLDB,1997
71337,conf/vldb/Jacobs97,Innovation in Database Management: Computer Science vs. Engineering,K Jacobs,VLDB,1997
71343,conf/vldb/SheikholeslamiCZ98,WaveCluster: A Multi-Resolution Clustering Approach for Very Large Spatial Databases,"G Sheikholeslami, S Chatterjee, A Zhang",VLDB,1998
71346,conf/vldb/GehrkeRG98,RainForest - A Framework for Fast Decision Tree Construction of Large Datasets,"J Gehrke, R Ramakrishnan, V Ganti",VLDB,1998
71347,conf/sigmod/Dietterich94,DEC Data Distributor: for Data Replication and Data Warehousing,D Dietterich,SIGMOD Conference,1994
71348,conf/vldb/Moerkotte98,Small Materialized Aggregates: A Light Weight Index Structure for Data Warehousing,G Moerkotte,VLDB,1998
71352,conf/sigmod/Vaskevitch94,Database in Crisis and Transition: A Technical Agenda for the Year 2001,D Vaskevitch,SIGMOD Conference,1994
71353,conf/sigmod/Martin94,COSS: The Common Object Services Specifications,B Martin,SIGMOD Conference,1994
71355,conf/sigmod/GravanoGT94,The Effectiveness of GlOSS for the Text Database Discovery Problem,"L Gravano, H Garcia-Molina, A Tomasic",SIGMOD Conference,1994
71356,conf/vldb/KornLKF98,"Ratio Rules: A New Paradigm for Fast, Quantifiable Data Mining","F Korn, A Labrinidis, Y Kotidis, C Faloutsos",VLDB,1998
71359,conf/vldb/ChakrabartiSD98,Mining Surprising Patterns Using Temporal Description Length,"S Chakrabarti, S Sarawagi, B Dom",VLDB,1998
71360,conf/sigmod/ColeG94,Optimization of Dynamic Query Evaluation Plans,"R Cole, G Graefe",SIGMOD Conference,1994
71363,conf/sigmod/BarbaraI94,Sleepers and Workaholics: Caching Strategies in Mobile Environments,"D Barbará, T Imielinski",SIGMOD Conference,1994
71366,conf/vldb/Slutz98,Massive Stochastic Testing of SQL,D Slutz,VLDB,1998
71367,conf/vldb/DoDJJR98,Issues in Developing Very Large Data Warehouses,"L Do, P Drew, W Jin, V Jumani, D Rossum",VLDB,1998
71377,conf/vldb/ArunJ98,KODA - The Architecture And Interface of a Data Model Independent Kernel,"G Arun, A Joshi",VLDB,1998
71378,conf/sigmod/ConsensM94,Optimizing Queries on Files,"M Consens, T Milo",SIGMOD Conference,1994
71379,conf/sigmod/HsiaoCY94,On Parallel Execution of Multiple Pipelined Hash Joins,"H Hsiao, M Chen, P Yu",SIGMOD Conference,1994
71383,conf/sigmod/LoR94,Spatial Joins Using Seeded Trees,"M Lo, C Ravishankar",SIGMOD Conference,1994
71387,conf/vldb/Orenstein98,Starting (and Sometimes Ending) a Database Company,J Orenstein,VLDB,1998
71389,conf/vldb/RoussopoulosK98,The Cubetree Storage Organization,"N Roussopoulos, Y Kotidis",VLDB,1998
71391,conf/sigmod/McIverK94,"Self-Adaptive, On-Line Reclustering of Complex Object Data","W Jr., R King",SIGMOD Conference,1994
71392,conf/vldb/SchieferKBLF98,IBM's DB2 Universal Database demonstrations at VLDB'98,"K Schiefer, J Kleewein, K Brannon, G Lohman, G Fuh",VLDB,1998
71394,conf/vldb/Mina98,MapInfo SpatialWare: A Spatial Information Server for RDBMS,C Mina,VLDB,1998
71398,conf/vldb/Pogue98,Oracle Industrial Exhibit,A Pogue,VLDB,1998
71403,conf/vldb/GardarinGT96,Cost-based Selection of Path Expression Processing Algorithms in Object-Oriented Databases,"G Gardarin, J Gruser, Z Tang",VLDB,1996
71405,conf/vldb/BouganimFV96,Dynamic Load Balancing in Hierarchical Parallel Database Systems,"L Bouganim, D Florescu, P Valduriez",VLDB,1996
71406,conf/sigmod/Fernandez94,Red Brick Warehouse: A Read-Mostly RDBMS for Open SMP Platforms,P Fernandez,SIGMOD Conference,1994
71407,conf/vldb/AcharyaFZ96,Disseminating Updates on Broadcast Disks,"S Acharya, M Franklin, S Zdonik",VLDB,1996
71409,conf/sigmod/Pirahesh94,Object-Oriented Features of DB2 Client/Server,H Pirahesh,SIGMOD Conference,1994
71410,conf/vldb/GardarinST96,"Calibrating the Query Optimizer Cost Model of IRO-DB, an Object-Oriented Federated Database System","G Gardarin, F Sha, Z Tang",VLDB,1996
71411,conf/vldb/SrivastavaDJL96,Answering Queries with Aggregation Using Views,"D Srivastava, S Dar, H Jagadish, A Levy",VLDB,1996
71412,conf/sigmod/FlokstraKS94,The IMPRESS DDT: A Database Design Toolbox Based on a Formal Specification Language,"J Flokstra, M Keulen, J Skowronek",SIGMOD Conference,1994
71413,conf/vldb/DiwanRSS96,Clustering Techniques for Minimizing External Path Length,"A Diwan, S Rane, S Seshadri, S Sudarshan",VLDB,1996
71414,conf/sigmod/BryanMCLG94,The MEDUSA Project: Autonomous Data Management in a Shared-Nothing Parallel Database Machine,"G Bryan, W Moore, B Curry, K Lodge, J Geyer",SIGMOD Conference,1994
71415,conf/sigmod/Melling94,Enterprise Information Architectures -- They're Finally Changing,W Melling,SIGMOD Conference,1994
71422,conf/vldb/Ogawa96,Effective & Efficient Document Ranking without using a Large Lexicon,Y Ogawa,VLDB,1996
71423,conf/sigmod/SagonasSW94,XSB as an Efficient Deductive Database Engine,"K Sagonas, T Swift, D Warren",SIGMOD Conference,1994
71424,conf/vldb/MeoPC96,A New SQL-like Operator for Mining Association Rules,"R Meo, G Psaila, S Ceri",VLDB,1996
71425,conf/sigmod/Carey94,Parallel Database Systems in the 1990's,M Carey,SIGMOD Conference,1994
71431,conf/vldb/SevcikK96,Filter Trees for Managing Spatial Data over a Range of Size Granularities,"K Sevcik, N Koudas",VLDB,1996
71433,conf/sigmod/Kulkarni94,Object-Oriented Extensions in SQL3: A Status Report,K Kulkarni,SIGMOD Conference,1994
71434,conf/vldb/FaloutsosG96,Analysis of n-Dimensional Quadtrees using the Hausdorff Fractal Dimension,"C Faloutsos, V Gaede",VLDB,1996
71436,journals/sigmod/Liu03c,Editor's Notes,L Liu,SIGMOD Record,2003
71437,conf/vldb/ChaudhuriS96,Optimization of Queries with User-defined Predicates,"S Chaudhuri, K Shim",VLDB,1996
71439,conf/vldb/StaudtJ96,Incremental Maintenance of Externally Materialized Views,"M Staudt, M Jarke",VLDB,1996
71441,conf/vldb/ScheuermannSV96,WATCHMAN : A Data Warehouse Intelligent Cache Manager,"P Scheuermann, J Shim, R Vingralek",VLDB,1996
71442,conf/sigmod/HanFHCC94,DBLearn: A System Prototype for Knowledge Discovery in Relational Databases,"J Han, Y Fu, Y Huang, Y Cai, N Cercone",SIGMOD Conference,1994
71444,journals/sigmod/AilamakiFFSV03,An environmental sensor network to determine drinking water quality and security,"A Ailamaki, C Faloutsos, P Fischbeck, M Small, J VanBriesen",SIGMOD Record,2003
71445,journals/sigmod/BonnetBDL03,Bluetooth-based sensor networks,"P Bonnet, A Beaufour, M Dydensborg, M Leopold",SIGMOD Record,2003
71447,journals/sigmod/Snodgrass03c,Developments at ACM TODS,R Snodgrass,SIGMOD Record,2003
71448,conf/vldb/Gupta96,The Changing Landscape of the Software Industry and its Implications for India,U Gupta,VLDB,1996
71450,journals/sigmod/Date03,Edgar F. Codd: a tribute and personal memoir,C Date,SIGMOD Record,2003
71451,conf/sigmod/TheodoulidisAACKS94,The ORES Temporal Database Management System,"B Theodoulidis, A Ait-Braham, G Andrianopoulos, J Chaudhary, G Karvelis, S Sou",SIGMOD Conference,1994
71454,conf/sigmod/GrossmanQ94,Ptool: A Scalable Persistent Object Manager,"R Grossman, X Qin",SIGMOD Conference,1994
71455,conf/vldb/Moni96,DISNIC-PLAN: A NICNET Based Distributed Database for Micro-level Planning in India,M Moni,VLDB,1996
71456,conf/sigmod/KuhnTS94,A Language Based Multidatabase System,"e Kühn, T Tschernko, K Schwarz",SIGMOD Conference,1994
71457,conf/sigmod/MissikoffT94,MOSAICO - A System for Conceptual Modeling and Rapid Prototyping of Object-Oriented Database Application,"M Missikoff, M Toiati",SIGMOD Conference,1994
71461,conf/vldb/Padmanabhan96,Extracting Large Data Sets using DB2 Parallel Edition,S Padmanabhan,VLDB,1996
71462,conf/sigmod/AgrawalCFGHIIMMSS94,Quest: A Project on Database Mining,"R Agrawal, M Carey, C Faloutsos, S Ghosh, M Houtsma, T Imielinski, B Iyer, A Mahboob, H Miranda, R Srikant, A Swami",SIGMOD Conference,1994
71464,conf/vldb/LeeL96,Further Improvements on Integrity Constraint Checking for Stratifiable Deductive Databases,"S Lee, T Ling",VLDB,1996
71470,conf/vldb/FlorescuKLP97,Using Probabilistic Information in Data Integration,"D Florescu, D Koller, A Levy",VLDB,1997
71471,journals/sigmod/CalvaneseGLV03,Reasoning on regular path queries,"D Calvanese, G Giacomo, M Lenzerini, M Vardi",SIGMOD Record,2003
71474,conf/vldb/ChristodoulakisTZ97,Principles of Optimally Placing Data in Tertiary Storage Libraries,"S Christodoulakis, P Triantafillou, F Zioga",VLDB,1997
71477,journals/sigmod/WangD03,Review of Web caching and replication by Michael Rabinovich and Oliver Spatscheck. Addison Wesley 2002,,,2003
71479,conf/vldb/WangYM97,STING: A Statistical Information Grid Approach to Spatial Data Mining,"W Wang, J Yang, R Muntz",VLDB,1997
71480,journals/sigmod/GalianoM03,"Review of Data on the Web: from relational to semistructured data and XML by Serge Abiteboul, Peter Buneman, and Dan Suciu. Morgan Kaufmann 1999",,,2003
71481,journals/sigmod/Wiegand03,"Review of Spatial databases with application to GIS by Philippe Rigaux, Michel Scholl, and Agnes Voisard. Morgan Kaufmann 2002",,,2003
71482,conf/vldb/GravanoG97,Merging Ranks from Heterogeneous Internet Sources,"L Gravano, H Garcia-Molina",VLDB,1997
71486,journals/sigmod/PalpanasPKG03,Distributed deviation detection in sensor networks,"T Palpanas, D Papadopoulos, V Kalogeraki, D Gunopulos",SIGMOD Record,2003
71487,conf/vldb/BohannonLRSSS97,Logical and Physical Versioning in Main Memory Databases,"R Rastogi, S Seshadri, P Bohannon, D Leinbaugh, A Silberschatz, S Sudarshan",VLDB,1997
71489,journals/sigmod/Kumar03,Sensor: the atomic computing particle,V Kumar,SIGMOD Record,2003
71490,conf/vldb/LlirbatST97,Using Versions in Update Transactions: Application to Integrity Checking,"F Llirbat, E Simon, D Tombroff",VLDB,1997
71493,journals/sigmod/Mani03,Understanding the semantics of sensor data,M Mani,SIGMOD Record,2003
71494,conf/vldb/Huyn97,Multiple-View Self-Maintenance in Data Warehousing Environments,N Huyn,VLDB,1997
71496,journals/sigmod/ChengP03,Managing uncertainty in sensor database,"R Cheng, S Prabhakar",SIGMOD Record,2003
71498,journals/sigmod/DemersGRTY03,The Cougar Project: a work-in-progress report,"A Demers, J Gehrke, R Rajaraman, A Trigoni, Y Yao",SIGMOD Record,2003
71499,journals/sigmod/PitouraAPSV03,DBGlobe: a service-oriented P2P system for global computing,"E Pitoura, S Abiteboul, D Pfoser, G Samaras, M Vazirgiannis",SIGMOD Record,2003
71500,conf/vldb/KietzRS97,Mining Insurance Data at Swiss Life,"J Kietz, U Reimer, M Staudt",VLDB,1997
71501,conf/vldb/LiCHH97,Facilitating Multimedia Database Exploration through Visual Interfaces and Perpetual Query Reformulations,"W Li, K Candan, K Hirata, Y Hara",VLDB,1997
71503,journals/sigmod/Hammer03,Treasurer's Message,,,2003
71507,conf/vldb/PoosalaI97,Selectivity Estimation Without the Attribute Value Independence Assumption,"V Poosala, Y Ioannidis",VLDB,1997
71509,conf/vldb/ChavdaW97,Towards an ODMG-Compliant Visual Object Query Language,"M Chavda, P Wood",VLDB,1997
71510,journals/sigmod/Chamberlin03,2003 SIGMOD Innovations Award Speech,D Chamberlin,SIGMOD Record,2003
71511,journals/sigmod/Aberer03c,Guest editor's introduction,,,2003
71512,conf/vldb/DesslochM97,Integrating SQL Databases with Content-Specific Search Engines,"S Deßloch, N Mattos",VLDB,1997
71516,journals/sigmod/Giorgini03,Agent-Oriented software engineering report on the 4th AOSE workshop (AOSE 2003),,,2003
71517,conf/vldb/PellenkoftLK97,The Complexity of Transformation-Based Join Enumeration,"A Pellenkoft, C Galindo-Legaria, M Kersten",VLDB,1997
71518,journals/sigmod/LenzVJS03,Report on the 5th international workshop on the design and management of data warehouses (DMDW'03),,,2003
71520,journals/sigmod/KambhampatiK03,Information integration on the Web: a view from AI and databases (report on IIWeb-03),"S Kambhampati, C Knoblock",SIGMOD Record,2003
71526,journals/sigmod/Hainaut03,Research in database engineering at the University of Namur,J Hainaut,SIGMOD Record,2003
71531,conf/vldb/EicklerGK95,A Performance Evaluation of OID Mapping Techniques,"A Eickler, C Gerlhof, D Kossmann",VLDB,1995
71532,journals/sigmod/Liu03a,Editor's Notes,L Liu,SIGMOD Record,2003
71533,conf/vldb/AmsalegFG95,Efficient Incremental Garbage Collection for Client-Server Object Database Systems,"L Amsaleg, M Franklin, O Gruber",VLDB,1995
71534,journals/sigmod/JukicNV03,Closing the key loophole in MLS databases,"N Jukic, S Nestorov, S Vrbsky",SIGMOD Record,2003
71535,journals/sigmod/ChrysanthisSZ03,Report on the 4th International Conference on Mobile Data Management,,,2003
71538,conf/vldb/Madnick95,From VLDB to VMLDB (Very MANY Large Data Bases): Dealing with Large-Scale Semantic Heterogenity,S Madnick,VLDB,1995
71540,journals/sigmod/MalaikaEM03,Standards for databases on the grid,"S Malaika, A Eisenberg, J Melton",SIGMOD Record,2003
71544,journals/sigmod/Winslett03b,Interview with Rakesh Agrawal,,,2003
71545,journals/sigmod/CherniakV03,Reminiscences on Influential Papers,,,2003
71547,journals/sigmod/Ouksel03,In-context peer-to-peer information filtering on the Web,A Ouksel,SIGMOD Record,2003
71551,conf/vldb/Celis96,The Query Optimizer in Tandem's new ServerWare SQL Product,P Celis,VLDB,1996
71552,journals/sigmod/ArenasKKKMM03,The hyperion project: from data integration to data coordination,"M Arenas, V Kantere, A Kementsietsidis, I Kiringa, R Miller, J Mylopoulos",SIGMOD Record,2003
71553,conf/vldb/Bhashyam96,"TPC-D: The Challenges, Issues and Results",R Bhashyam,VLDB,1996
71555,conf/vldb/Baru96,Performance of Future Database Systems: Bottlenecks and Bonananzas,C Baru,VLDB,1996
71556,journals/sigmod/Hellerstein03,Toward network data independence,J Hellerstein,SIGMOD Record,2003
71558,journals/sigmod/TatarinovIMHSDDKMM03,The Piazza peer data management project,"I Tatarinov, Z Ives, J Madhavan, A Halevy, D Suciu, N Dalvi, X Dong, Y Kadiyska, G Miklau, P Mork",SIGMOD Record,2003
71559,journals/sigmod/BawaCCDGGKMSSVY03,Peer-to-peer research at Stanford,"M Bawa, B Cooper, A Crespo, N Daswani, P Ganesan, H Garcia-Molina, S Kamvar, S Marti, M Schlosser, Q Sun, P Vinograd, B Yang",SIGMOD Record,2003
71561,conf/vldb/Raghavan96,Loading the Data Warehouse Across Various Parallel Architectures,V Raghavan,VLDB,1996
71564,conf/vldb/SavasereON95,An Efficient Algorithm for Mining Association Rules in Large Databases,"A Savasere, E Omiecinski, S Navathe",VLDB,1995
71567,journals/sigmod/ChongFTSYKDJJ03,A mapping mechanism to support bitmap index and other auxiliary structures on tables stored as primary B+-trees,"E Chong, J Srinivasan, S Das, C Freiwald, A Yalamanchi, M Jagannath, A Tran, R Krishnan, R Jiang",SIGMOD Record,2003
71568,conf/vldb/RahmM95,Dynamic Multi-Resource Load Balancing in Parallel Database Systems,"E Rahm, R Marek",VLDB,1995
71570,conf/vldb/BassiliadesV95,A Non-Uniform Data Fragmentation Strategy for Parallel Main-Menory Database Systems,"N Bassiliades, I Vlahavas",VLDB,1995
71572,conf/vldb/CabreraRH95,Applying Database Technology in the ADSM Mass Storage System,"L Cabrera, R Rees, W Hineman",VLDB,1995
71573,journals/sigmod/Nascimento03,Peer-to-peer: harnessing the power of disruptive technologies,M Nascimento,SIGMOD Record,2003
71576,conf/vldb/MillinerBP95,A Scalable Architecture for Autonomous Heterogeneous Database Interactions,"S Milliner, A Bouguettaya, M Papazoglou",VLDB,1995
71578,journals/sigmod/CaleroPR03,Towards a database body of knowledge: a study from Spain,"C Calero, M Piattini, F Ruiz",SIGMOD Record,2003
71582,journals/sigmod/dOnofrioP03,Modelling temporal thematic map contents,"A d'Onofrio, E Pourabbas",SIGMOD Record,2003
71584,conf/vldb/BargaP95,A Practical and Modular Implementation of Extended Transaction Models,"R Barga, C Pu",VLDB,1995
71588,conf/vldb/GuptaHQ95,Aggregate-Query Processing in Data Warehousing Environments,"A Gupta, V Harinarayan, D Quass",VLDB,1995
71589,journals/sigmod/Vianu03,A Web odyssey: from codd to XML,V Vianu,SIGMOD Record,2003
71591,journals/sigmod/Aberer03b,Book review column,K Aberer,SIGMOD Record,2003
71592,conf/vldb/GardarinGT95,A Cost Model for Clustered Object-Oriented Databases,"G Gardarin, J Gruser, Z Tang",VLDB,1995
71594,journals/sigmod/MukhopadhyayGS03,An approach to confidence based page ranking for user oriented Web search,"D Mukhopadhyay, D Giri, S Singh",SIGMOD Record,2003
71595,journals/sigmod/Snodgrass03,ACM TODS in this Internet Age,R Snodgrass,SIGMOD Record,2003
