tid,id,title,authors,venue,year
70827,conf/vldb/CareyKRLABFLOPQRSSUVWY01,The Propel Distributed Services Platform,"M Carey, S Kirsch, M Roth, B Linden, N Adiba, M Blow, D Florescu, D Li, I Oprencak, R Panwar, R Qi, D Rieber, J Shafer, B Sterling, T Urhan, B Vickery, D Wineman, K Yee",VLDB,2001
70836,conf/sigmod/Cohen98a,Providing Database-like Access to the Web Using Queries Based on Textual Similarity,W Cohen,SIGMOD Conference,1998
70837,conf/vldb/AnciauxBBPV01,PicoDBMS: Validation and Experience,"N Anciaux, C Bobineau, L Bouganim, P Pucheral, P Valduriez",VLDB,2001
70840,conf/sigmod/ChaudhuriN98a,Microsoft Index Tuning Wizard for SQL Server 7.0,"S Chaudhuri, V Narasayya",SIGMOD Conference,1998
70842,conf/vldb/MorishimaKKT01,Enabling End-users to Construct Data-intensive Web-sites from XML Repositories: An Example-based Approach,"A Morishima, S Koizumi, H Kitagawa, S Takano",VLDB,2001
70844,conf/sigmod/GriffinH97,A Framework for Implementing Hypothetical Queries,"T Griffin, R Hull",SIGMOD Conference,1997
70845,conf/vldb/AmbiteKKMST01,The WorlInfo Assistant: Spatio-Temporal Information Integration on the Web,"J Ambite, C Knoblock, M Kolahdouzan, M Muslea, C Shahabi, S Thakkar",VLDB,2001
70847,conf/sigmod/ZhaoDN97,An Array-Based Algorithm for Simultaneous Multidimensional Aggregates,"Y Zhao, P Deshpande, J Naughton",SIGMOD Conference,1997
70848,conf/vldb/SindoniTABFGMPPT01,SIT-IN: a Real-Life Spatio-Temporal Information System,"G Sindoni, L Tininini, A Ambrosetti, C Bedeschi, S Francisci, O Gargano, R Molinaro, M Paolucci, P Patteri, P Ticca",VLDB,2001
70849,conf/sigmod/AcharyaFZ97,Balancing Push and Pull for Data Broadcast,"S Acharya, M Franklin, S Zdonik",SIGMOD Conference,1997
70850,conf/vldb/KoschBBHHLRT01,SMOOTH - A Distributed Multimedia Database System,"H Kosch, L Böszörményi, A Bachlechner, C Hanin, C Hofbauer, M Lang, C Riedler, R Tusch",VLDB,2001
70852,conf/vldb/PereiraFJLS01,WebFilter: A High-throughput XML-based Publish and Subscribe System,"J Pereira, F Fabret, H Jacobsen, F Llirbat, D Shasha",VLDB,2001
70853,conf/vldb/YagoubFIV00a,Building and Customizing Data-Intensive Web Sites Using Weave,"K Yagoub, D Florescu, V Issarny, P Valduriez",VLDB,2000
70855,conf/vldb/ZhouLZLZJT01,VXMLR: A Visual XML-Relational Database System,"A Zhou, H Lu, S Zheng, Y Liang, L Zhang, W Ji, Z Tian",VLDB,2001
70856,conf/sigmod/CeriFP98,The IDEA Web Lab,"S Ceri, P Fraternali, S Paraboschi",SIGMOD Conference,1998
70859,conf/vldb/PapadiasT01,MV3R-Tree: A Spatio-Temporal Access Method for Timestamp and Interval Queries,"Y Tao, D Papadias",VLDB,2001
70861,conf/vldb/OoiYTJ01,Indexing the Distance: An Efficient Method to KNN Processing,"C Yu, B Ooi, K Tan, H Jagadish",VLDB,2001
70868,conf/vldb/SatheS01,Intelligent Rollups in Multidimensional OLAP Data,"G Sathe, S Sarawagi",VLDB,2001
70869,conf/sigmod/KemperKM98,SAP R/3: A Database Application System (Tutorial),,,1998
70876,conf/vldb/Duranti01,The Long-Term Preservation of Authentic Electronic Records,L Duranti,VLDB,2001
70878,conf/sigmod/Kennamer98,Microsoft.com: A High-Scale Data Management and Transaction Processing Solution,S Kennamer,SIGMOD Conference,1998
70879,conf/vldb/MarronL01,On Processing XML in LDAP,"P Marrón, G Lausen",VLDB,2001
70888,conf/vldb/BouguettayaEMO01,Ontology-based Support for Digital Government,"A Bouguettaya, A Elmagarmid, B Medjahed, M Ouzzani",VLDB,2001
70890,conf/sigmod/RamakrishnanD98,The PointCast Network,"S Ramakrishnan, V Dayal",SIGMOD Conference,1998
70893,conf/vldb/NetzCBF00,Integration of Data Mining with Database Technology,"A Netz, S Chaudhuri, J Bernhardt, U Fayyad",VLDB,2000
70896,conf/vldb/KemperKW99,Generalised Hash Teams for Join and Group-by,"A Kemper, D Kossmann, C Wiesner",VLDB,1999
70898,conf/sigmod/GravanoCGP97,STARTS: Stanford Proposal for Internet Meta-Searching (Experience Paper),"L Gravano, K Chang, H Garcia-Molina, A Paepcke",SIGMOD Conference,1997
70900,conf/vldb/Blecken00,Media360 Workflow-Implementing a Workflow Engine Inside a Database,C Blecken,VLDB,2000
70901,conf/sigmod/Arpaci-DusseauACHP97,High-Performance Sorting on Networks of Workstations,"A Arpaci-Dusseau, R Arpaci-Dusseau, D Culler, J Hellerstein, D Patterson",SIGMOD Conference,1997
70905,conf/sigmod/MaheshwariL97,Partitioned Garbage Collection of Large Object Store,"U Maheshwari, B Liskov",SIGMOD Conference,1997
70907,conf/sigmod/ZaharioudakisC97,Highly Concurrent Cache Consistency for Indices in Client-Server Database Systems,"M Zaharioudakis, M Carey",SIGMOD Conference,1997
70909,conf/sigmod/ONeilQ97,Improved Query Performance with Variant Indexes,"P O'Neil, D Quass",SIGMOD Conference,1997
70911,conf/vldb/Deshpande00,Linking Business to Deliver Value: A Data Management Challenge,A Deshpande,VLDB,2000
70912,conf/sigmod/MumickQM97,Maintenance of Data Cubes and Summary Tables in a Warehouse,"I Mumick, D Quass, B Mumick",SIGMOD Conference,1997
70913,conf/sigmod/HoAMS97,Range Queries in OLAP Data Cubes,"C Ho, R Agrawal, N Megiddo, R Srikant",SIGMOD Conference,1997
70915,conf/vldb/RamamrithamABEGP00,"Social, Educational, and Governmental Change Enabled through Information Technology","K Ramamritham, Y Atfi, C Batini, M Eitan, V Gregg, D Phatak",VLDB,2000
70917,conf/sigmod/TsueiPK97,Database Buffer Size Investigation for OLTP Workloads (Experience Paper),"T Tsuei, A Packer, K Ko",SIGMOD Conference,1997
70919,conf/sigmod/AdelbergGW97,The STRIP Rule System For Efficiently Maintaining Derived Data,"B Adelberg, H Garcia-Molina, J Widom",SIGMOD Conference,1997
70920,conf/vldb/Schek00,"Panel: Future Directions of Database Research - The VLDB Broadening Strategy, Part 1",H Schek,VLDB,2000
70924,conf/sigmod/YangM97,Association Rules over Interval Data,"R Miller, Y Yang",SIGMOD Conference,1997
70925,conf/sigmod/JajodiaSSB97,A Unified Framework for Enforcing Multiple Access Control Policies,"S Jajodia, P Samarati, V Subrahmanian, E Bertino",SIGMOD Conference,1997
70928,conf/sigmod/Kramer97,Databases on the Web: Technologies for Federation Architectures and Case Studies (Tutorial),R Kramer,SIGMOD Conference,1997
70929,conf/vldb/AdiBEY00,Push Technology Personalization through Event Correlation,"A Adi, D Botzer, O Etzion, T Yatzkar-Haham",VLDB,2000
70931,conf/vldb/ChakrabartiSST00,Memex: A Browsing Assistant for Collaborative Archiving and Mining of Surf Trails,"S Chakrabarti, S Srivastava, M Subramanyam, M Tiwari",VLDB,2000
70932,conf/sigmod/LivnyRBCDLMW97a,DEVise: Integrated Querying and Visual Exploration of Large Datasets (Demo Abstract),"M Livny, R Ramakrishnan, K Beyer, G Chen, D Donjerkovic, S Lawande, J Myllymaki, R Wenger",SIGMOD Conference,1997
70933,conf/vldb/BeneventanoBCCGMMV00,Information Integration: The MOMIS Project Demonstration,"D Beneventano, S Bergamaschi, S Castano, A Corni, R Guidetti, G Malvezzi, M Melchiori, M Vincini",VLDB,2000
70935,conf/sigmod/RafieiM97,Similarity-Based Queries for Time Series Data,"D Rafiei, A Mendelzon",SIGMOD Conference,1997
70936,conf/vldb/CarusoCGLM00,Telcordia's Database Reconciliation and Data Quality Analysis Tool,"F Caruso, M Cochinwala, U Ganapathy, G Lalk, P Missier",VLDB,2000
70937,conf/sigmod/ChawatheG97,Meaningful Change Detection in Structured Data,"S Chawathe, H Garcia-Molina",SIGMOD Conference,1997
70938,conf/vldb/HelalL00,Rainbow: Distributed Database System for Classroom Education and Experimental Research,"A Helal, H Li",VLDB,2000
70943,conf/sigmod/LivnyRBCDLMW97,DEVise: Integrated Querying and Visualization of Large Datasets,"M Livny, R Ramakrishnan, K Beyer, G Chen, D Donjerkovic, S Lawande, J Myllymaki, R Wenger",SIGMOD Conference,1997
70945,conf/vldb/GuPS00,OLAP++: Powerful and Easy-to-Use Federations of OLAP and Object Databases,"J Gu, T Pedersen, A Shoshani",VLDB,2000
70951,conf/vldb/HinneburgAK00,What Is the Nearest Neighbor in High Dimensional Spaces?,"A Hinneburg, C Aggarwal, D Keim",VLDB,2000
70953,conf/vldb/SakuraiYUK00,The A-tree: An Index Structure for High-Dimensional Spaces Using Relative Approximation,"Y Sakurai, M Yoshikawa, S Uemura, H Kojima",VLDB,2000
70956,conf/sigmod/IoannidisLANT97,ZOO: A Desktop Emperiment Management Environment,"Y Ioannidis, M Livny, A Ailamaki, A Narayanan, A Therber",SIGMOD Conference,1997
70960,conf/sigmod/Chakravarthy97,SENTINEL: An Object-Oriented DBMS With Event-Based Rules,S Chakravarthy,SIGMOD Conference,1997
70961,conf/vldb/KriegelPS00,Managing Intervals Efficiently in Object-Relational Databases,"H Kriegel, M Pötke, T Seidl",VLDB,2000
70962,conf/sigmod/SeshadriP97,PREDATOR: An OR-DBMS with Enhanced Data Types,"P Seshadri, M Paskin",SIGMOD Conference,1997
70965,conf/sigmod/OzdenRSS96,Fault-tolerant Architectures for Continuous Media Servers,"B Özden, R Rastogi, P Shenoy, A Silberschatz",SIGMOD Conference,1996
70966,conf/vldb/KoudasIM00,Identifying Representative Trends in Massive Time Series Data Sets Using Sketches,"P Indyk, N Koudas, S Muthukrishnan",VLDB,2000
70967,conf/sigmod/OConnellISWABCCLPWW96,A Content-Based Multimedia Server for Massively Parallel Architectures,"W O'Connell, I Ieong, D Schrader, C Watson, G Au, A Biliris, S Choo, P Colin, G Linderman, E Panagos, J Wang, T Walters",SIGMOD Conference,1996
70971,conf/sigmod/TomasicABKNR97,The Distributed Information Search Component (Disco) and the World Wide Web,"A Tomasic, R Amouroux, P Bonnet, O Kapitskaia, H Naacke, L Raschid",SIGMOD Conference,1997
70972,conf/vldb/JohnsonA00,Optimizing Queries on Compressed Bitmaps,"S Amer-Yahia, T Johnson",VLDB,2000
70974,conf/sigmod/BohrerBBCFHKKMNRRSUUW97a,The InfoSleuth Project,"R Jr., W Bohrer, R Brice, A Cichocki, J Fowler, A Helal, V Kashyap, T Ksiezyk, G Martin, M Nodine, M Rashid, M Rusinkiewicz, R Shea, C Unnikrishnan, A Unruh, D Woelk",SIGMOD Conference,1997
70976,conf/sigmod/GeneserethKD97,Infomaster: An Information Integration System,"M Genesereth, A Keller, O Duschka",SIGMOD Conference,1997
70977,conf/vldb/SrinivasanDFCJYKTDB00,Oracle8i Index-Organized Table and Its Application to New Domains,"J Srinivasan, S Das, C Freiwald, E Chong, M Jagannath, A Yalamanchi, R Krishnan, A Tran, S DeFazio, J Banerjee",VLDB,2000
70978,conf/sigmod/GingrasLSPS97,Languages for Multi-database Interoperability,"F Gingras, L Lakshmanan, I Subramanian, D Papoulis, N Shiri",SIGMOD Conference,1997
70979,conf/sigmod/BerchtoldK97,S3: Similarity Search in CAD Database Systems,"S Berchtold, H Kriegel",SIGMOD Conference,1997
70980,conf/vldb/StohrMR00,Multi-Dimensional Database Allocation for Parallel Data Warehouses,"T Stöhr, H Märtens, E Rahm",VLDB,2000
70981,conf/sigmod/WangSCRZP97,Structural Matching and Discovery in Document Databases,"J Wang, D Shasha, G Chang, L Relihan, K Zhang, G Patel",SIGMOD Conference,1997
70984,conf/sigmod/LabioZWGGW97,The WHIPS Prototype for Data Warehouse Creation and Maintenance,"W Labio, Y Zhuge, J Wiener, H Gupta, H Garcia-Molina, J Widom",SIGMOD Conference,1997
70985,conf/vldb/MendelzonV00,Temporal Queries in OLAP,"A Mendelzon, A Vaisman",VLDB,2000
70986,conf/sigmod/FernandezFKLS97,STRUDEL: A Web-site Management System,"M Fernandez, D Florescu, J Kang, A Levy, D Suciu",SIGMOD Conference,1997
70987,conf/vldb/ChoG00,The Evolution of the Web and Implications for an Incremental Crawler,"J Cho, H Garcia-Molina",VLDB,2000
70990,conf/sigmod/GoyalHKMSZ97,Picture Programming Project,"N Goyal, C Hoch, R Krishnamurthy, B Meckler, M Suckow, M Zloof",SIGMOD Conference,1997
70992,conf/vldb/WangZ00,Using SQL to Build New Aggregates and Extenders for Object- Relational Systems,"H Wang, C Zaniolo",VLDB,2000
70993,conf/sigmod/ChaudhuriD97,Data Warehousing and OLAP for Decision Support (Tutorial),,,1997
70994,conf/vldb/GantiLR00,ICICLES: Self-Tuning Samples for Approximate Query Answering,"V Ganti, M Lee, R Ramakrishnan",VLDB,2000
70997,conf/sigmod/HammerGNYBV97,Template-Based Wrappers in the TSIMMIS System,"J Hammer, H Garcia-Molina, S Nestorov, R Yerneni, M Breunig, V Vassalos",SIGMOD Conference,1997
70998,conf/vldb/GrumbachRS00,Manipulating Interpolated Data is Easier than You Thought,"S Grumbach, P Rigaux, L Segoufin",VLDB,2000
70999,conf/vldb/MillerHH00,Schema Mapping as Query Discovery,"R Miller, L Haas, M Hernández",VLDB,2000
71005,conf/vldb/WangHH00,Mining Frequent Itemsets Using Support Constraints,"K Wang, Y He, J Han",VLDB,2000
71007,conf/vldb/ChaudhuriW00,Rethinking Database System Architecture: Towards a Self-Tuning RISC-Style Database System,"S Chaudhuri, G Weikum",VLDB,2000
71012,conf/sigmod/GuptaHR97,Revisiting Commit Processing in Distributed Database Systems,"R Gupta, J Haritsa, K Ramamritham",SIGMOD Conference,1997
71018,conf/sigmod/GeorgeH97,Secure Transaction Processing in Firm Real-Time Database Systems,"B George, J Haritsa",SIGMOD Conference,1997
71019,conf/vldb/LakshmananSS99,On Efficiently Implementing SchemaSQL on an SQL Database System,"L Lakshmanan, F Sadri, S Subramanian",VLDB,1999
71025,conf/sigmod/MogiK96,Hot Mirroring: A Study to Hide Parity Upgrade Penalty and Degradations During Rebuilds for RAID5,"K Mogi, M Kitsuregawa",SIGMOD Conference,1996
71026,conf/vldb/LeeL99,Unrolling Cycles to Decide Trigger Termination,"S Lee, T Ling",VLDB,1999
71027,conf/sigmod/ZouS96,On-line Reorganization of Sparsely-populated B+trees,"C Zou, B Salzberg",SIGMOD Conference,1996
71028,conf/vldb/GionisIM99,Similarity Search in High Dimensions via Hashing,"A Gionis, P Indyk, R Motwani",VLDB,1999
71030,conf/sigmod/ZhangRL96,BIRCH: An Efficient Data Clustering Method for Very Large Databases,"T Zhang, R Ramakrishnan, M Livny",SIGMOD Conference,1996
71031,conf/vldb/CareyCNVDRSM99,"O-O, What Have They Done to DB2?","M Carey, D Chamberlin, S Narayanan, B Vance, D Doole, S Rielau, R Swagerman, N Mattos",VLDB,1999
71032,conf/sigmod/AdaliCPS96,Query Caching and Optimization in Distributed Mediator Systems,"S Adali, K Candan, Y Papakonstantinou, V Subrahmanian",SIGMOD Conference,1996
71034,conf/vldb/JagadishLS99,What can Hierarchies do for Data Warehouses?,"H Jagadish, L Lakshmanan, D Srivastava",VLDB,1999
71039,conf/sigmod/ChaudhuriG96,Optimizing Queries over Multimedia Repositories,"S Chaudhuri, L Gravano",SIGMOD Conference,1996
71041,conf/vldb/McHughW99,Query Optimization for XML,"J McHugh, J Widom",VLDB,1999
71042,conf/sigmod/GoelI96,SQL Query Optimization: Reordering for a General Class of Queries,"P Goel, B Iyer",SIGMOD Conference,1996
71043,conf/vldb/DonjerkovicR99,Probabilistic Optimization of Top N Queries,"D Donjerkovic, R Ramakrishnan",VLDB,1999
71044,conf/sigmod/BilirisFOP96,BeSS: Storage Support for Interactive Visualization Systems,"A Biliris, T Funkhouser, W O'Connell, E Panagos",SIGMOD Conference,1996
71045,conf/vldb/JagadishKNS99,Multi-Dimensional Substring Selectivity Estimation,"H Jagadish, O Kapitskaia, R Ng, D Srivastava",VLDB,1999
71046,conf/sigmod/HungYK96,CapBasED-AMS: A Capability-based and Event-driven Activity Management System,"P Hung, H Yeung, K Karlapalem",SIGMOD Conference,1996
71047,conf/vldb/NaumannLF99,Quality-driven Integration of Heterogenous Information Systems,"F Naumann, U Leser, J Freytag",VLDB,1999
71048,conf/sigmod/FukudaMMT96,"Data Mining Using Two-Dimensional Optimized Accociation Rules: Scheme, Algorithms, and Visualization","T Fukuda, Y Morimoto, S Morishita, T Tokuyama",SIGMOD Conference,1996
71050,conf/vldb/JosifovskiR99,Integrating Heterogenous Overlapping Databases through Object-Oriented Transformations,"V Josifovski, T Risch",VLDB,1999
71052,conf/sigmod/Keim96,Databases and Visualization,D Keim,SIGMOD Conference,1996
71053,conf/vldb/Hamilton99,Networked Data Management Design Points,J Hamilton,VLDB,1999
71054,conf/sigmod/Han96,Data Mining Techniques,J Han,SIGMOD Conference,1996
71058,conf/vldb/GarofalakisRS99,SPIRIT: Sequential Pattern Mining with Regular Expression Constraints,"M Garofalakis, R Rastogi, K Shim",VLDB,1999
71059,conf/sigmod/HullZ96,A Framework for Supporting Data Integration Using the Materialized and Virtual Approaches,"R Hull, G Zhou",SIGMOD Conference,1996
71060,conf/vldb/Blum99,Microsoft English Query 7.5: Automatic Extraction of Semantics from Relational Databases and OLAP Cubes,A Blum,VLDB,1999
71061,conf/sigmod/ChawatheRGW96,Change Detection in Hierarchically Structured Information,"S Chawathe, A Rajaraman, H Garcia-Molina, J Widom",SIGMOD Conference,1996
71065,conf/vldb/DarmontS99,VOODB: A Generic Discrete-Event Random Simulation Model To Evaluate the Performances of OODBs,"J Darmont, M Schneider",VLDB,1999
71067,conf/sigmod/BrownCL96,Goal-Oriented Buffer Management Revisited,"K Brown, M Carey, M Livny",SIGMOD Conference,1996
71068,conf/vldb/SahuguetA99,Building Light-Weight Wrappers for Legacy Web Data-Sources Using W4F,"A Sahuguet, F Azavant",VLDB,1999
71073,conf/vldb/TanGO99,Online Feedback for Nested Aggregate Queries with Multi-Threading,"K Tan, C Goh, B Ooi",VLDB,1999
71075,conf/vldb/Norvag99,The Persistent Cache: Improving OID Indexing in Temporal Object-Oriented Database Systems,K Nřrvĺg,VLDB,1999
71078,conf/sigmod/Agarwal96,A Super Scalar Sort Algorithm for RISC Processors,R Agarwal,SIGMOD Conference,1996
71079,conf/vldb/IoannidisP99,Histogram-Based Approximation of Set-Valued Query-Answers,"Y Ioannidis, V Poosala",VLDB,1999
71081,conf/vldb/JagadishMN99,Semantic Compression and Pattern Extraction with Fascicles,"H Jagadish, J Madar, R Ng",VLDB,1999
71084,conf/vldb/PedersenJD99,Extending Practical Pre-Aggregation in On-Line Analytical Processing,"T Pedersen, C Jensen, C Dyreson",VLDB,1999
71085,conf/vldb/LiRS99,Aggregation Algorithms for Very Large Compressed Data Warehouses,"J Li, D Rotem, J Srivastava",VLDB,1999
71086,conf/sigmod/Freeston95,A General Solution of the n-dimensional B-tree Problem,M Freeston,SIGMOD Conference,1995
71087,conf/vldb/KumarRRT99,Extracting Large-Scale Knowledge Bases from the Web,"R Kumar, P Raghavan, S Rajagopalan, A Tomkins",VLDB,1999
71090,conf/sigmod/BerensonBGMOO95,A Critique of ANSI SQL Isolation Levels,"H Berenson, P Bernstein, J Gray, J Melton, E O'Neil, P O'Neil",SIGMOD Conference,1995
71092,conf/vldb/DattaRT99,Curio: A Novel Solution for Efficient Storage and Indexing in Data Warehouses,"A Datta, K Ramamritham, H Thomas",VLDB,1999
71093,conf/vldb/ZurekS99,Datawarehousing Has More Colours Than Just Black & White,"T Zurek, M Sinnwell",VLDB,1999
71097,conf/sigmod/DogacHKOONDMAKE96,METU Interoperable Database System,"A Dogac, U Halici, E Kilic, G Özhan, F Ozcan, S Nural, C Dengi, S Mancuhan, I Arpinar, P Koksal, C Evrendilek",SIGMOD Conference,1996
71099,conf/sigmod/ChooOLCGBPS96,Prospector: A Content-Based Multimedia Server for Massively Parallel Architectures,"S Choo, W O'Connell, G Linderman, H Chen, K Ganapathi, A Biliris, E Panagos, D Schrader",SIGMOD Conference,1996
71100,conf/vldb/KonigW99,Combining Histograms and Parametric Curve Fitting for Feedback-Driven Query Result-size Estimation,"A König, G Weikum",VLDB,1999
71101,conf/sigmod/QuassWGHLMNRRAUW96,LORE: A Lightweight Object REpository for Semistructured Data,"D Quass, J Widom, R Goldman, K Haas, Q Luo, J McHugh, S Nestorov, A Rajaraman, H Rivero, S Abiteboul, J Ullman, J Wiener",SIGMOD Conference,1996
71102,conf/vldb/ChaudhuriG99,Evaluating Top-k Selection Queries,"S Chaudhuri, L Gravano",VLDB,1999
71106,conf/vldb/WangZL99,Building Hierarchical Classifiers Using Class Proximity,"K Wang, S Zhou, S Liew",VLDB,1999
71107,conf/vldb/CarinoOBS99,"Active Storage Hierarchy, Database Systems and Applications - Socratic Exegesis","F Carińo, W O'Connell, J Burgess, J Saltz",VLDB,1999
71111,conf/vldb/NinkHR99,Generating Call-Level Interfaces for Advanced Database Application Programming,"U Nink, T Härder, N Ritter",VLDB,1999
71112,conf/sigmod/FernandezS96,The Ins and Outs (and Everthing in Between) of Data Warehousing,,,1996
71114,conf/sigmod/GoyalHKMS96,Is GUI Programming a Database Research Problem?,"N Goyal, C Hoch, R Krishnamurthy, B Meckler, M Suckow",SIGMOD Conference,1996
71116,conf/vldb/KnorrN99,Finding Intensional Knowledge of Distance-Based Outliers,"E Knorr, R Ng",VLDB,1999
71121,conf/vldb/BamfordAP99,A Scalable and Highly Available Networked Database Architecture,"R Bamford, R Ahad, A Pruscino",VLDB,1999
71122,conf/sigmod/HellersteinN96,Query Execution Techniques for Caching Expensive Methods,"J Hellerstein, J Naughton",SIGMOD Conference,1996
71124,conf/vldb/BernsteinPS99,Context-Based Prefetch for Implementing Objects on Relations,"P Bernstein, S Pal, D Shutt",VLDB,1999
71129,conf/vldb/DyresonBJ99,Capturing and Querying Multiple Aspects of Semistructured Data,"C Dyreson, M Böhlen, C Jensen",VLDB,1999
71133,conf/vldb/Chawathe99,Comparing Hierarchical Data in External Memory,S Chawathe,VLDB,1999
71135,conf/sigmod/PoosalaIHS96,Improved Histograms for Selectivity Estimation of Range Predicates,"V Poosala, Y Ioannidis, P Haas, E Shekita",SIGMOD Conference,1996
71136,conf/vldb/Sarawagi99,Explaining Differences in Multidimensional Aggregates,S Sarawagi,VLDB,1999
71137,conf/vldb/BonczMK99,Database Architecture Optimized for the New Bottleneck: Memory Access,"P Boncz, S Manegold, M Kersten",VLDB,1999
71140,conf/vldb/AbiteboulACEMM99,Active Views for Electronic Commerce,"S Abiteboul, B Amann, S Cluet, A Eyal, L Mignet, T Milo",VLDB,1999
71141,conf/sigmod/PatelD96,Partition Based Spatial-Merge Join,"J Patel, D DeWitt",SIGMOD Conference,1996
71145,conf/vldb/PacittMS99,Fast Algorithms for Maintaining Replica Consistency in Lazy Master Replicated Databases,"E Pacitti, P Minet, E Simon",VLDB,1999
71147,conf/vldb/BaulierBGJGKKMMNNRSS98,DataBlitz: A High Performance Main-Memory Storage Manager,"J Baulier, P Bohannon, S Gogate, S Joshi, C Gupta, A Khivesera, H Korth, P McIlroy, J Miller, P Narayan, M Nemeth, R Rastogi, A Silberschatz, S Sudarshan",VLDB,1998
71148,conf/sigmod/GuptaMR95,Adapting Materialized Views after Redefinitions,"A Gupta, I Mumick, K Ross",SIGMOD Conference,1995
71152,conf/sigmod/ParkCY95,An Effective Hash Based Algorithm for Mining Association Rules,"J Park, M Chen, P Yu",SIGMOD Conference,1995
71153,conf/vldb/BaulierBKS98,A Database System for Real-Time Event Aggregation in Telecommunication,"J Baulier, S Blott, H Korth, A Silberschatz",VLDB,1998
71154,conf/sigmod/FaloutsosL95,"FastMap: A Fast Algorithm for Indexing, Data-Mining and Visualization of Traditional and Multimedia Datasets","C Faloutsos, K Lin",SIGMOD Conference,1995
71156,conf/vldb/BamfordBKM98,Architecture of Oracle Parallel Server,"R Bamford, D Butler, B Klots, N MacNaughton",VLDB,1998
71157,conf/vldb/JoshiBLL98,Checkpointing in Oracle,"A Joshi, W Bridge, J Loaiza, T Lahiri",VLDB,1998
71158,conf/sigmod/AdelbergGK95,Applying Update Streams in a Soft Real-Time Database System,"B Adelberg, H Garcia-Molina, B Kao",SIGMOD Conference,1995
71162,conf/sigmod/HouZ95,Enhancing Database Correctness: a Statistical Approach,"W Hou, Z Zhang",SIGMOD Conference,1995
71163,conf/vldb/GarofalakisIO98,Resource Scheduling for Composite Multimedia Objects,"M Garofalakis, Y Ioannidis, B Özden",VLDB,1998
71164,conf/sigmod/BrinDG95,Copy Detection Mechanisms for Digital Documents,"S Brin, J Davis, H Garcia-Molina",SIGMOD Conference,1995
71167,conf/vldb/AbiteboulMRVW98,Incremental Maintenance for Materialized Views over Semistructured Data,"S Abiteboul, J McHugh, M Rys, V Vassalos, J Wiener",VLDB,1998
71168,conf/sigmod/BersonGM95,Fault Tolerant Design of Multimedia Servers,"S Berson, L Golubchik, R Muntz",SIGMOD Conference,1995
71169,conf/vldb/GoldmanSVG98,Proximity Search in Databases,"R Goldman, N Shivakumar, S Venkatasubramanian, H Garcia-Molina",VLDB,1998
71170,conf/sigmod/LuMSS95,Efficient Maintenance of Materialized Mediated Views,"J Lu, G Moerkotte, J Schü, V Subrahmanian",SIGMOD Conference,1995
71173,conf/vldb/RiedelGF98,Active Storage for Large-Scale Data Mining and Multimedia,"E Riedel, G Gibson, C Faloutsos",VLDB,1998
71174,conf/sigmod/Ivinskis95,High Availability of Commercial Applications,K Ivinskis,SIGMOD Conference,1995
71177,conf/vldb/George98,DMS: A Parallel Data Mining Server,F George,VLDB,1998
71178,conf/sigmod/Gettys95,DIRECTV and Oracle Rdb: The Challenges of VLDB Transaction Processing,W Gettys,SIGMOD Conference,1995
71179,conf/sigmod/Kleissner95,"Enterprise Objects Framework, A Second Generation Object-Relational Enabler",C Kleissner,SIGMOD Conference,1995
71181,conf/sigmod/BaruFGHJPW95,An Overview of DB2 Parallel Edition,"C Baru, G Fecteau, A Goyal, H Hsiao, A Jhingran, S Padmanabhan, W Wilson",SIGMOD Conference,1995
71182,conf/vldb/WeberSB98,A Quantitative Analysis and Performance Study for Similarity-Search Methods in High-Dimensional Spaces,"R Weber, H Schek, S Blott",VLDB,1998
71183,conf/sigmod/Squire95,Data Extraction and Transformation for the Data Warehouse,C Squire,SIGMOD Conference,1995
71184,conf/vldb/CareyK98,Reducing the Braking Distance of an SQL Query Engine,"M Carey, D Kossmann",VLDB,1998
71186,conf/vldb/LinR98,Querying Continuous Time Sequences,"L Lin, T Risch",VLDB,1998
71188,conf/vldb/GingrasL98,nD-SQL: A Multi-Dimensional Language for Interoperability and OLAP,"F Gingras, L Lakshmanan",VLDB,1998
71191,conf/vldb/BraumandlCK98,Evaluating Functional Joins Along Nested Reference Sets in Object-Relational and Object-Oriented Databases,"R Braumandl, J Claußen, A Kemper",VLDB,1998
71195,conf/sigmod/RoussopoulosKV95,Nearest Neighbor Queries,"N Roussopoulos, S Kelley, F Vincent",SIGMOD Conference,1995
71196,conf/vldb/GarciaLL98,On Optimal Node Splitting for R-trees,"Y García, M Lopez, S Leutenegger",VLDB,1998
71198,conf/sigmod/PapadiasTSE95,Topological Relations in the World of Minimum Bounding Rectangles: A Study with R-trees,"D Papadias, Y Theodoridis, T Sellis, M Egenhofer",SIGMOD Conference,1995
71199,conf/sigmod/FegarasM95,Towards an Effective Calculus for Object Query Languages,"L Fegaras, D Maier",SIGMOD Conference,1995
71200,conf/vldb/JagadishKMPSS98,Optimal Histograms with Quality Guarantees,"H Jagadish, N Koudas, S Muthukrishnan, V Poosala, K Sevcik, T Suel",VLDB,1998
