tid,address,authors,booktitle,date,editor,id,institution,journal,month,note,pages,publisher,tech,title,type,volume,year
1020,,"Kibler, D., and Langley, P.",,,,1020,,"Machine Learning,",,,5-8.,,,Machine learning as an experimental science.,,"3(1),",(1988).
1045,,"Pazzani M, Kibler D.",,,,1045,,Machine Learning,,,:57-94.,,,The utility of knowledge in Inductive learning.,,;9,1992
1057,,"Pazzani, M. & Kibler, D.",,,,1057,,"Machine Learning,",,,57-94.,,,The utility of knowledge in inductive learning.,,9,(1992).
1062,,"Pazzani, M. & Kibler, D.",,,,1062,,"Machine Learning,",,,57-94.,,,The utility of knowledge in inductive learning.,,9(1),(1992).
1074,,"Pazzani, M., & Kibler, D.",,,,1074,,"Machine Learning,",,,57-94.,,,The Utility of Knowledge in Inductive Learning.,,"9:1,",(1992).
1077,,"Pazzani, M., and Kibler, D.",,,,1077,,"Machine Learning,",,,57-94.,,,The utility of background knowledge in inductive learning.,,9,(1992).
1088,,M. Pazzani and D. Kibler.,,,,1088,,"Machine Learning,",,,"57-94,",,,The utility of background knowledge in inductive learning.,,9,1992.
1089,,M. Pazzani and D. Kibler.,,,,1089,,"Machine Learning,",,,"57-94,",,,The utility of background knowledge in inductive learning.,,9,1992.
1103,,M. Pazzani and D. Kibler.,,,,1103,,"Machine Learning,",,,"57-94,",,,The utility of background knowledge in inductive learning.,,9,1992.
1119,"San Mateo, CA:","Ruby, D., & Kibler, D.","Proceedings, Ninth National Conference on Artificial Intelligence.",,,1119,,,,,,AAAI Press.,,SteppingStone: An empirical and analytical evaluation.,,,(1991).
1127,"Amherst, MA.","Brodley, C. E. and Utgoff, P. E.",,,,1127,"Department of Computer Science, University of Massachusetts,",,,,,,,"Multivariate versus univariate decision trees,","Technical Report 92-8,",,(1992).
1128,"Amherst, MA.","Brodley, C. E. and Utgoff, P. E.",,,,1128,"Department of Computer Science, University of Massachusetts,",,,,,,,"Multivariate versus univariate decision trees,","Technical Report 92-8,",,(1992).
1132,"Amherst, MA:","Brodley, C. E., & Utgoff, P. E.",,,,1132,"University of Massachusetts, Department of Computer and Information Science.",,,,,,,"Multivariate versus univariate decision trees,","(Coins Technical Report 92-8),",,(1992).
1143,U. Mass.,"Brodley, C. E., and Utgoff, P. E.",,,,1143,"Dept. of Computer Science,",,,,,,,Multivariate Versus Univariate Decision Trees.,"COINS Technical Report 92-8,",,1992.
1154,"Amherst, Massachusetts,",C. E. Brodley and P. E. Utgoff.,,,,1154,"University of Massachussets,",,,To appear in Machine Learning.,,,,Multivariate decision trees.,"COINS Technical Report 92-83,",,1992.
1160,"Amherst,",Carla E. Brodley and Paul Utgoff.,,,,1160,"University of Massachusetts,",,,,,,,Multivariate decision trees.,"Technical Report MASSCS 92-93,",,1992.
1170,,Carla E. Brodley and Paul E. Utgoff.,,,,1170,,"Machine Learning,",,,"45-77,",,,Multivariate decision trees.,,19,1995.
1172,,"Brodley, C. E. & Utgoff, P. E.",,,,1172,,Machine Learning.,,,,Forthcoming.,,", Multivariate decision trees,",,,
1185,,"Brodley, C. E., & Utgoff, P. E.",,,,1185,,"Machine Learning,",,,,,,Multivariate decision trees.,,,(1994).
1199,,Carla E. Brodley and Paul E. Utgoff.,,,,1199,,"Machine Learning,",,,"45-77,",,,Multivariate decision trees.,,19,1995.
1204,,Carla E. Brodley and Paul E. Utgoff.,,,,1204,,"Machine Learning,",,,"45-77,",,,Multivariate decision trees.,,19,1995.
1208,,C. Brodley and P. Utgoff.,,,,1208,,"Machine Learning,",,,,,,Multivariate trees.,,"19,",1995.
1209,,C. E. Brodley and P. E. Utgoff.,,,,1209,,"Machine Learning,",,,"45-77,",,,Multivariate decision trees.,,19(1),1995.
1211,,"Brodley, C.E., and Utgoff, P.E.",,,,1211,,Machine Learning.,,,,,,Multivariate Decision Trees.,,,1994.
1213,,"C.E. Brodley and P.E. Utgoff,",,,,1213,,"Machine Learning,",,,45-77.,,,Multivariate decision trees.,,"19,",
1216,"Northwestern University, Chicago, IL,","Callan, J. and Utgoff, P.","In Proceedings of the Eighth International Workshop on Machine Learning,",,,1216,,,,,"pages 122-126,",Morgan Kauf-mann.,,A Transformational Approach to Constructive Induction.,,,1991.
1222,"Anaheim, CA:","Callan, J. P., & Utgoff, P. E.",Proceedings of the Ninth National Conference on Artificial Intelligence,,,1222,,,,,pp .614-619).,MIT Press.,,Constructive induction on domain knowl edge.,,,(1991).
1224,,J. P. Callan and P.E. Utgoff.,"In Proceedings of the Ninth National Conference on Artificial Intelligence,",,,1224,,,,,"pages 614-619,",,,Constructive induction on domain knowledge.,,,1991.
1225,"Amherst, MA,",C. Cardie.,"Proceedings of the Tenth International Conference on Machine Learning,",,"In P. Utgoff, editor,",1225,"University of Massachusetts,",,,,"pages 25-32,",Morgan Kaufmann.,,Using Decision Trees to Improve Case-Based Learning.,,,1993.
1233,"Amherst, MA,","Cardie, C.","Proceedings of the Tenth International Conference on Machine Learning,",,"In Utgoff, P., editor,",1233,"University of Massachusetts,",,,,"pages 25-32,",Morgan Kaufmann.,,Using Decision Trees to Improve Case-Based Learning.,,,1993.
1235,"San Mateo, CA,",R. Caruana.,"Proceedings of the Tenth International Conference on Machine Learning,",,"In Paul E. Utgoff, editor,",1235,,,,,"pages 41-48,",Morgan Kaufmann.,,Multitask learning: A knowledge-based of source of inductive bias.,,,1993.
1244,"San Mateo, CA,",R. Caruana.,"Proceedings of the Tenth International Conference on Machine Learning,",,"In P. E. Utgoff, editor,",1244,,,,,"pages 41-48,",Morgan Kaufmann.,,Multitask learning: A knowledge-based of source of inductive bias.,,,1993.
1252,"San Mateo, CA,","Caruana, R.","in:Proceedings of the Tenth International Conference on Machine Learning,",,edited by P.  E. Utgoff.,1252,,,,,pp. 41-48.,"Morgan Kaufmann,",,Multitask Learning: A Knowledge-Based of Source of Inductive Bias.,,,"1993,"
1253,"San Mateo, CA,","Caruana, R.","in: Proceedings of the Tenth International Conference on Machine Learning,",,edited by P.  E. Utgoff.,1253,,,,,pp. 41-48.,"Morgan Kaufmann,",,Multitask Learning: A Knowledge-Based of Source of Inductive Bias.,,,"1993,"
1257,"Cambridge, MA","Chapman, D.","Vision, instruction, and action.",,,1257,,,,,,"MIT Press,",,,,,(1991).
1261,,"Clouse, J. A. & Utgoff, P. E.",In Proceedings of the Ninth International Conference on Machine Learning.,,"edited by P. Ed. D. Sleeman, & P. Edwards.",1261,,,,,92-101.,"Morgan Kaufmann,",,A Teaching Method for Reinforcement Learning.,,,(1992).
1262,"San Mateo, CA:","Clouse, J. A., & Utgoff, P. E.",Proceedings of the Ninth International Conference,,,1262,,Machine Learning:,,,(pp. 92-101).,Morgan Kaufmann.,,A teaching method for reinforcement learning.,,,(1992).
1271,,J. A. Clouse and P. E. Utgoff.,In Proceedings of the Ninth Conference on Machine Learning.,,,1271,,,,,,"Morgan Kaufmann,",,A teaching method for reinforcement learning.,,,1992.
1275,"San Mateo, CA,",J.A. Clouse and P.E. Utgoff.,"In Machine Learning: Proceedings of teh Ninth International Conference,",,,1275,,,,,"pages 92-101,",Morgan Kaufmann.,,A teaching method for reinforcement learning.,,,1992.
1290,"San Mateo, CA,",Mark W. Craven and Jude W. Shavlik.,"Proceedings of the Tenth International Conference on Machine Learning,",,"In Paul E. Utgoff, editor,",1290,,,,to appear,,Morgan Kaufmann.,,Learning symbolic rules using artificial neural networks.,,,1993.
1302,,"Draper, B. A., Brodley, C. E., & Utgoff, P. E.",,,,1302,,"IEEE Transactions on Pattern Analysis and Machine Intelligence,",,,888-893.,,,Goal-directed classification using linear machine decision trees.,,"16,",(1994).
1331,,"Usama M. Fayyad, Nicholas Weir, and D. Djorgovski. SKICAT:","In ML-93 ,",,Editor: Paul E. Utgoff.,1331,,,,,pages 112-119.,,,A machine learning system for automated cataloging of large scale sky surveys.,,,
1336,,"Usama M. Fayyad, Nicholas Weir, and D. Djorgovski. SKICAT:","In ML-93 ,",,Editor: Paul E. Utgoff.,1336,,,,,pages 112-119.,,,A machine learning system for automated cataloging of large scale sky surveys.,,,
1339,,"Usama M. Fayyad, Nicholas Weir, and D. Djorgovski. SKICAT:","In ML-93 ,",,Editor: Paul E. Utgoff.,1339,,,,,pages 112-119.,,,A machine learning system for automated cataloging of large scale sky surveys.,,,
1342,,"S. B. Huffman and J. E. Laird,","Proceedings of the Tenth International Conference,",,"P. Utgoff, editor,",1342,,,,,,,,"Learning procedures from interactive natural language instructions, in Machine Learning:",,,1993.
1346,,Scott B. Huffman and John E. Laird.,"Machine Learning: Proceedings of the Tenth International Conference,",,"In P. Utgoff, editor,",1346,,,,,,,,Learning procedures from interactive natural language instructions.,,,1993.
1385,"Palo Alto, CA.","Mitchell, T., Utgoff, T., & Banerji, R.",Machine Learning: An Artificial Intelligence Approach.,,"In Michalski, R., Mitchell, T., & Carbonell, J. (Eds.),",1385,,,,,,"Morgan Kaufmann,",,Learning problem solving heuristics by experimentation.,,,(1983).
1394,,"T. Mitchell, Utgoff, P. and Banerji, R.,","in Machine Learning:  An Artificial Intelligence Approach,",,"R. Michalski,",1394,,,,,,J.,,"Learning by Experimentation: Acquiring and Refining ProblemSolving Heuristics,",,,
1395,,"T. Mitchell, Utgoff, P. and Banerji, R.,","in Machine Learning:  An Artificial Intelligence Approach,",,"R. Michalski,",1395,,,,,,J.,,"Learning by Experimentation: Acquiring and Refining ProblemSolving Heuristics,",,,
1400,,"Mitchell, T.; Utgoff, P.; and Banerji, R.","Machine learning: An artificial intelligence approach,",,"In Michalski, R., and et al., eds.,",1400,,,,,,Morgan Kaufmann.,,Learning by experimentation: Acquiring and refining problem-solving heuristics.,,volume 1.,1983.
1403,"Palo Alto, CA,","T. Mitchell, T. Utgoff, and R. Banerji.",Machine Learning: An Artificial Intelligence Approach.,,"In R. Michalski, T. Mitchell, and J. Carbonell, editors,",1403,,,,,,"Morgan Kaufmann,",,Learning problem solving heuristics by experimentation.,,,1983.
1412,"Palo Alto, CA","Tom M. Mitchell, Paul E. Utgoff, and Ranan Banerji.",". In Machine 58 Learning:  An Artificial Intelligence Approach,",,"Michalski, Ryszard S., Car--bonell, Jamie G., and Mitchell, Tom M. (Eds).",1412,,,,,,"Tioga Publishing Company,",,Learning by Experimentation: Acquiring and Refining Problem-Solving Heuristics,,"Volume I,",(1983).
1413,"Los Altos, California,","T. M. Mitchell, P. E. Utgoff, and R. Banerji.","Machine Learning : An Artificial Intelligence Approach,",,"In R. S. Michalski, J. G. Carbonell, and T. M. Mitchell, editors,",1413,,,,,pages 163-190.,"Morgan Kaufmann,",,Learning by experimentation : Acquiring and refining problem-solving heuristics.,,"Vol. 1.,",1983.
1414,"Los Altos, CA:","Mitchell, T. M.",Proceedings of IJCAI-83.,,,1414,,,,,1139-1151.,Morgan-Kaufmann.,,"Learning and problem solving,",,,(1983)
1417,,Tom M. Mitchaell and Paul E. Utgoff.,In Shavlik and Dietterich,,,1417,,,,,pages 510-522.,,,Learning by experimentation: Acquiring and refining problem-solving heuristics.,,"[17],",
1443,,"R. Musick, Jason Catlett, and S. Russell.","In ML-93 ,",,Editor: Paul E. Utgoff.,1443,,,,,pages 212-219.,,,Decision theoretic subsampling for induction on large databases.,,,
1445,San Mateo:,J. R.,Proc. ML'93,,"(ed P.E. Utgoff),",1445,,,,,,Morgan Kaufmann.,,"Quinlan (1993) Combining instance-based and model-based learning,",,,
1446,"San Francisco, CA.","Quinlan, J. R.",Proc. Int. Conf. on Mach. Learn.,,"In Utgoff, P. E. (Ed.),",1446,,,,,,Morgan Kaufmann.,,Combining instance-based and model-based learning.,,,(1993b).
1454,,John Ross Quinlan.,"In ML-93 ,",,Editor: Paul E. Utgoff.,1454,,,,,pages 236-243.,,,Combining instance-based and model-based learning.,,,
1456,,John Ross Quinlan.,"In ML-93 ,",,Editor: Paul E. Utgoff.,1456,,,,,pages 236-243.,,,Combining instance-based and model-based learning.,,,
1462,,Harish Ragavan and Larry Rendell.,"In ML-93 ,",,Editor: Paul E. Utgoff.,1462,,,,,pages 252-259.,,,Lookahead feature construction for learning hard concepts.,,,
1465,,Harish Ragavan and Larry Rendell.,"In ML-93 ,",,Editor: Paul E. Utgoff,1465,,,,,pages 252-259.,,,Lookahead feature construction for learning hard concepts.,,,
1466,,Harish Ragavan and Larry Rendell.,"In ML-93 ,",,Editor: Paul E. Utgoff.,1466,,,,,pages 252-259.,,,Lookahead feature construction for learning hard concepts.,,,
1480,,"Schwartz, A.","Proceedings of the Tenth International Conference on Machine Learning,",,"in P. Utgoff, ed.,",1480,,,,,,Morgan Kaufmann.,,"A reinforcement learning method for maximizing undiscounted rewards,",,,"(1993),"
1510,,"Utgoff, P. E.",Machine Learning of Inductive Bias.,,,1510,,,,,,"Kluwer Academic Publishers,",,,,32,1986.
1516,,"Utgoff, P. E.",Machine Learning of Inductive Bias.,,,1516,,,,,,"Kluwer Academic Publishers,",,,,35,1986.
1532,,"Utgoff, P.","Machine Learning: An Artificial Intelligence Approach,",,"In Michalski, R. S., Carbonell, J. G., & Mitchell, T. M. (Eds.),",1532,,,,,pp. 107-148.,Morgan Kaufman.,,Shift of bias for inductive concept learning.,,"Vol. II,",(1986).
1536,"Los Altos, CA.","Utgoff, P.","Machine Learning,",,"In Michalski, R., Carbonell, J., and Mitchell, T., editors,",1536,,,,,pages 163-190.,"Morgan Kaufmann,",,Shift of bias for inductive concept learning.,,"volume 2,",(1986).
1545,"San Mateo, CA:","Utgoff, P. E.",Machine learning: An artificial intelligence approach.,,"In Michalski, Carbonell & Mitchell (Eds.),",1545,,,,,,Morgan Kaufmann.,,Shift of bias for inductive concept learning.,,,(1986).
1548,"San Mateo, CA:","Utgoff, P. E.",,,"In Michalski, Carbonell, & Mitchell (Eds.),",1548,,"Machine Learning,",,,pp. 107-148.,Morgan Kaufmann.,,Shift of bias for inductive concept learning.,,"Vol.2, chap. 5,",(1986).
1551,"Los Altos, CA.","Utgoff, P. E.","Machine Learning: An Artificial Intelligence Approach,",,"In Michalski, R., Carbonell, J., & Mitchell, T. (Eds.),",1551,,,,,pp. 107-148.,"Morgan Kaufmann,",,Shift of bias for inductive concept learning.,,"Vol. II,",(1986).
1553,,"Utgoff, P. E.,",In Machine Learning:  An Artificial Intelligence Approach:,,eds R.,1553,,,,,,,,Shift of Bias for Inductive Concept Learning.,,"Volume II,",1986.
1565,,"Utgoff, P. E.","Machine Learning: An Artificial Intelligence Approach,",,"In Michalski, R.S.; Carbonell, J.G.; and T.M., Mitchell,",1565,,,,,107-148.,Morgan Kaufmann Publishers.,,Shift of bias of inductive concept learning.,,Vol II.,"1986,"
1568,"Palo Alto (CA),","P. Utgoff,","Machine Learning: An Artificial Intelligence Approach 2 (Springer-Verlag,",,"in: R.S. Mickalski, J.G. Carbonell and T.M. Mitchell, eds.,",1568,,,,,107-149.,,,"Shift of bias for inductive concept learning,",,,1986)
1573,"Los Altos, CA,",P. Utgoff.,"In Machine Learning,",,,1573,,,,,,"Morgan Kaufmann,",,Shift of bias for inductive concept learning.,,volume 2.,1986.
1575,"Los Altos, CA,",P. Utgoff.,,,"In R. Michalski, J. Carbonell, and T. Mitchell, editors,",1575,,"Machine Learning,",,,pages 163-190.,"Morgan Kaufmann,",,Shift of bias for inductive concept learning.,,"volume 2,",1986.
1576,"Los Altos, CA,",P. Utgoff.,,,"In R. Michalski, J. Carbonell, and T. Mitchell, editors,",1576,,"Machine Learning,",,,pages 163-190.,"Morgan Kaufmann,",,Shift of bias for inductive concept learning.,,"volume 2,",1986.
1579,,P E Utgoff.,Machine Learning: An Artificial Intelligence Approach,,"In R S Michalski, J G Carbonell, and T M Mitchell, editors,",1579,,,,,,"Morgan Kaufmann,",,Shift of bias for inductive concept learning.,,(Volume 2).,1986.
1580,"Los Altos, CA,","Utgoff, Paul E.",Machine Learning. An Artificial Intelligence Approach.,,"In Michalski, Ryszard S., Car-bonell, Jaime G., and Mitchell, Tom M., editors,",1580,,,,,pages 107-148.,"Morgan Kauf-mann,",,Shift of bias for inductive concept learning.,,"Volume II,",
1586,"Los Altos, Ca,",P. Utgoff.,,,"In R. S. Michalshi, J. G. Carbonell, and T. M. Mitchell, editors,",1586,,"Machine Learning,",,,page 107.,"Morgan Kaufman,",,Shift Of Bias For Inductive Concept Learning.,,,1986.
1590,,"Utgoff, P., and Saxena, S.","In Proceedings of the Fourth International Workshop on Machine Learning,",,,1590,,,,,115-121.,,,Learning a preference predicate.,,,1987.
1591,,"P. Utgoff and S. Saxena,","Proceedings of the 4th International Conference on Machine Learning,",,,1591,,,,,"pp. 115-121,",,,"Learning a Preference Predicate,",,,1987.
1594,"Ann Harbour,",Utgoff P.E.,"in Proc. of 5th International Workshop on Machine Learning , J.",,"Laird (ed.),",1594,,,,,,Morgan Kaufmann Inc.,,"ID5: An Incremental ID3,",,,(1988):
1596,"Ann Arbor, Michigan:","Utgoff, P.",Proceedings of the Fifth International Conference on Machine Learning,,,1596,,,,,(pp. 107 - 120).,Morgan Kaufmann.,,ID5R: An incremental ID3.,,27,(1988).
1600,,"Utgoff, P.",In Proceedings of the Fifth International Conference on Machine Learning.,,,1600,,,,,107-120.,,,ID5: An Incremental ID3.,,,1988.
1601,,"Utgoff, P.",In Proceedings of the Fifth International Conference on Machine Learning.,,,1601,,,,,107-120.,,,ID5: An Incremental ID3.,,,1988.
1606,,P. Utgoff. ID5:,"In Proc. 5th Intl. Conf. Mach. Learning,",,,1606,,,,,pages 107-120.,"Morgan Kaufmann,",,An incremental ID3.,,,1988.
1616,"Boston, MA:","Utgoff, P.",Proceedings of the Seventh National Conference on Artificial Intelligence,,,1616,,,,Morgan Kaufmann. Appeared in: Machine Learning: Proceedings of the Eighth International Workshop (ML91).,(pp. 601-606).,,,Perceptron trees: A case study in hybrid concept representations.,,,(1988).
1627,,Paul E. Utgoff.,"In Proceedings of the Seventh National Conference on Artificial Intelligence,",,,1627,,,,,pages 601-606.,"Morgan Kaufmann,",,Perceptron trees: a case study in hybrid concept representation.,,,1988.
1630,,P. Utgoff,,,,1630,,Machine Learning.,,,161-186.,,,. Incremental induction of decision trees.,,"Vol.4,",(1989)
1633,,"Utgoff, P.",,,,1633,,"Machine Learning,",,,161-186.,,,Incremental induction of decision trees.,,"4,",(1989).
1639,,"Utgoff, P. E.",,,,1639,,"Machine Learning,",,,161-186.,,,Incremental induction of decision trees.,,"4 ,",(1989).
1644,,"Utgoff, P. E.",,,,1644,,"Machine Learning,",,,161-186.,,,Incremental induction of decision trees.,,"4,",(1989).
1647,,"Utgoff, P. E.",,,,1647,,"Machine Learning,",,,161-186.,,,Incremental induction of decision trees.,,"4,",(1989).
1670,,"Utgoff, P.",,,,1670,,"Machine Learning,",,,"161-186,",,,Incremental induction of decision trees.,,4,1989.
1672,,P. E. Utgoff.,,,,1672,,"Machine Learning,",,,,,,Incremental induction of decision trees.,,"4,",1989.
1674,,Paul E. Utgoff.,,,,1674,,"Machine Learning,",,,"161-186,",,,Incremental induction of decision trees.,,4,1989.
1686,,P.E. Utgoff.,,,,1686,,"Machine Learning,",,,"161-186,",,,Incremental induction of decision trees.,,4,1989.
1690,,P. E. Utgoff.,"In Sixth International Workshop on Machine Learning,",,,1690,,,,,"pages 362-365,",,,Improved training via incremental learning.,,,1989.
1697,,"Utgoff, Paul E.","Proc. of the 6th Int'l Workshop on Machine Learning,",,,1697,,,,,62-65.,,,"Improved Training via Incremental Learning,",,,(1989).
1738,"Los Altos, CA.","Utgoff, P. E., & Brodley, C. E.","In Proceedings of the Seventh International Conference on Machine Learning,",,,1738,,,,,pp. 58-65.,Morgan Kaufmann.,,An incremental method for finding multivariate splits for decision trees.,,,(1990).
1743,"Austin, TX:","Utgoff, P. E., & Brodley, C. E.",Proceedings of the Seventh International Conference on Machine Learning,,,1743,,,,,(pp. 58-65).,Morgan Kaufmann.,,An incremental method for finding multivariate splits for decision trees.,,,(1990).
1745,"Austin, TX:","Utgoff, P. E., & Brodley, C. E.",Proceedings of the Seventh International Conference on Machine Learning,,,1745,,,,,(pp. 58-65).,Morgan Kaufmann.,,An incremental method for finding multivariate splits for decision trees.,,14,(1990).
1752,"Los Altos, CA,",P. E. Utgoff and C. E. Brodley.,"In Proceedings of the Seventh International Conference on Machine Learning,",1990.,,1752,,,,,"pages 58-65,",Morgan Kaufmann.,,An incremental method for finding multivariate splits for decision trees.,,16,
1756,"Los Altos, CA,",Paul E. Utgoff and Carla E. Brodley.,"In Proceedings of the Seventh International Conference on Machine Learning,",,,1756,,,,,"pages 58-65,",Morgan Kauf-mann.,,An incremental method for finding multivariate splits for decision trees.,,,1990.
1771,"Anaheim, CA:","Utgoff, P. E., & Clouse, J. A.",Proceedings of the Ninth National Conference on Artificial Intelligence,,,1771,,,,,(pp. 596-600).,MIT Press.,,Two kinds of training information for evaluation function learning.,,15,(1991).
1772,"Anaheim, CA.","Utgoff, P., & Clouse, J.","In Proceedings of the Ninth National Conference on Artificial Intelligence,",,,1772,,,,,596-600,,,Two kinds of training information for evaluation function learning.,,,(1991).
1776,,P. E. Utgoff and J. A. Clouse.,"In Proceedings of the Ninth National Conference on Artificial Intelligence,",,,1776,,,,,"pages 596-600,",,,Two kinds of training information for evaluation function learning.,,,1991.
1785,"San Mateo, CA,",P. E. Utgoff and J. A. Clouse.,"In Proceedings of the Ninth Annual Conference on Artificial Intelligence,",1991.,,1785,,,,,"pages 596-600,",Morgan Kaufmann.,,Two kinds of training information for evaluation function learning.,,,
1791,"Amherst, MA: University of Massachusetts,","Utgoff, P. E., & Brodley, C. E.",,,,1791,Department of Computer and Information Science.,,,,,,,"Linear machine decision trees,","(COINS Technical Report 91-10),",,(1991).
1802,"University of Massachusetts, Amherst MA,",Paul E. Utgoff and Carla E. Brodley.,,,,1802,,,,,,,,Linear machine decision trees.,"Technical Report 10,",,1991.
1817,,"Utgoff, P. E.","in Machine Learning: Proceedings of the Eleventh International Conference,",,,1817,,,,,pp. 318-325.,"Morgan Kaufmann,",,"An improved algorithm for incremental induction of decision trees,",,,"(1994),"
1819,,"Utgoff, P. E.","in Machine Learning: Proceedings of the Eleventh International Conference,",,,1819,,,,,pp. 318-325.,"Morgan Kaufmann,",,An improved algorithm for incremental induction of decision trees,,,"(1994),"
1834,,Paul E. Utgoff.,"In ML-94 ,",,Editors: William W. Cohen and Haym Hirsh.,1834,,,,,pages 318-325.,,,An improved algorithm for incremental induction of decision trees.,,,
1842,"University of Massachusetts, Amherst.","Utgoff, P. E.",,,,1842,,,,,,,,"Decision tree induction based on efficient tree restructuring,","Technical Report 05-18,",,"(1995),"
1844,"Amherst, MA:","Utgoff, P. E.",,,,1844,"University of Massachusetts, Department of Computer Science.",,,,,,,Decision tree induction based on efficient tree restructuring,(Technical Report 95-18).,,(1995).
1862,"Amherst, MA: University of Massachusetts,","Utgoff, P. E., & Precup, D.",,,,1862,Department of Computer Science.,,,,,,,"Constructive function approximation,","(Technical Report 97-04),",,(1997).
1877,,"Q. Zheng,",,,,1877,"University of Michigan,",,,PostScript version of the thesis is available via anonymous FTP from ftp.eecs.umich.edu in directory outgoing/zheng. 14,,,,"Real-time Fault-tolerant Communication in Computer Networks,","PhD thesis,",,1993.
