tid,address,authors,booktitle,date,editor,id,institution,journal,month,note,pages,publisher,tech,title,type,volume,year
5,,"M. Ahlskog, J. Paloheimo, H. Stubb, P. Dyreklev, M. Fahlman, O.  Inganas and M.R. Andersson,",,(1994).,,5,,"J Appl. Phys.,",,,"893,",,,,,"76,",
18,"Paderborn, FRG,","D. F. Brown, H. Moura, and D. A. Watt. Actress:","Proceedings of the 4th International Conference on Compiler Construction (CC'92),",October 1992.,"In U. Kastens and P. Pfahler, editors,",18,,,,"volume 641 of Lecture Notes in Computer Science,","pages 95-109,",Springer-Verlag.,,an action semantics directed compiler generator.,,,
25,"Hillsdale, NJ.","Cramer, N. L.","Proceedings of an International Conference on Genetic Algorithms and Their Applications,",(1985).,"In Grefenstette, J., editor,",25,,,,,"pages 183-187,",Lawrence Erlbaum Associates.,,A representation for the adaptive generation of simple sequential programs.,,,
29,,,"Proceedings of the Third International Conference on Genetic Algorithms,",(1989).,"In J. Schaffer (Ed.),",29,,,,,pp. 42-50.,Morgan Kaufmann.,,An investigation of niche and species formation in genetic function optimization.,,,
30,,"Dempster, A., Laird, N., and Rubin, D.",,(1977).,,30,,"Journal of the Royal Statistical Society B,",,,1-38.,,,Maximum likelihood from incomplete data via the EM algorithm.,,39,
38,,"Fahle, M.",,,,38,,"Vis. Res.,",,,2149-2184.,,,"(1991) Parallel perception of vernier offsets, curvature, and chevrons in humans.",,31:,
43,,"Fahle, M., Edelman, S., and Poggio, T.",,(1995).,,43,,"Vision Research,",,,3003-3013.,,,Fast perceptual learning in hyperacuity.,,35,
49,,"Lennart E. Fahlen, Charles Grant Brown, Olov Stahl, and Christer Carlsson.","In Proceedings of Interchi '93,",1993.,,49,,,,,"pages 4348,",,,A space based model for user interaction in shared synthetic environments.,,,
62,,S.E. Fahlman.,,1974.,,62,,"Artificial Intelligence,",,,"1-49,",,,A planning system for robot construction tasks.,,5,
81,"Cambridge, MA,",Scott E. Fahlman.,,1979.,,81,,,,,,"MIT Press,",,NETL: A System for Representing and Using Real-World Knowledge.,,,
83,,S.E. Fahlman.,,,,83,,,,,,MIT Press.,,"NETL: A system for representing real-world knowledge,",,,
94,"Cambridge, Ma,",S. E. Fahlman.,,1977.,,94,,,,,,"MIT Press,",,NETL: A System for Representing and Using Real-World Knowledge.,,,
96,"Cambridge, MA, U.S.A.,",S.E. Fahlman.,,1979.,,96,,,,,,"MIT Press,",,NETL: A system for representing and using real-world knowledge.,,,
113,,"Fahlman, S.E.",Proceedings of the 1988 Connectionist Models Summer School.,(1988).,,113,,,,,pp. 38-51.,Morgan Kaufmann.,,Fast-Learning Variations on BackPropagation: An Empirical Study.,,,
126,"San Mateo, CA,","Fahlman, S. E.","Proceedings of 1988 Connectionist Models Summer School,",,"Touretzky, D., Hinton, G and Sejnowski T. (Eds.)",126,,,,,pp. 38-51.,"Morgan Kaufmann,",,(1988) Faster-Learning Variations on Back-Propagation: An Empiri cal Study.,,,
129,"San Mateo, CA:","Fahlman, S. E.","Proceedings of the 1988 Connectionist Models Summer School,",1988.,"In D. Touretzky, G. E. Hinton, and T. J Sejnowski (Eds),",129,,,,,,"Morgan Kaufmann Publishers , 38-51,",,Faster-learning variations of backpropagation : An empirical study.,,,
132,,"S.E. Fahlman,","in  1988 Connectionist Models Summer School,",1988.,"T.J. Sejnowski, G.E. Hinton, and D.S. Touretzky, Eds.",132,,,,,,"Mor-gan Kaufmann,",,"Faster-learning Variations on Backpropagation : An Empirical Study,",,,
136,,S. Fahlman.,"Proceedings of the 1988 Connectionist Models Summer School,",1988.,"In D. Touretzky, G. Hinton, and T. Sejnowsky, editors,",136,,,,,pages 38-51.,"Morgan-Kauffman,",,Faster-learning variations on backpropagation: an empirical study.,,,
141,"San Mateo, CA,",S. E. Fahlman.,"Connectionist Models Summer School: 1988 Proceedings,",,"In D. S. Touretzky, G. E. Hinton, and Sejnowski, editors,",141,,,,,"pages 38-51,",Morgan Kaufmann.,,Fast-learning variations on back-propagation: An empirical study.,,,
155,"Pittsburgh, PA 15213.","Fahlman, S. E.",,(1988).,,155,"School of Computer Science, Carnegie Mellon University,",,,,,,"Technical Report CMU-CS-88-162,",An empirical study of learning speed in backpropagation networks.,,,
163,"Pittsburgh, PA - USA,",S. E. Fahlman.,,1988.,,163,"Computer Science Department - Carnegie-Mellon,",,,,,,"Technical Report CMU-CS-88-162,",An empirical study of learning speed in back-propagation networks.,,,
165,,"Fahlman, S.E.",In Proceedings of the 1988 Connectionist Models Summer School.,1988.,,165,,,,,,Morgan-Kaufmann.,,An Empirical Study of Learning Speed in Back-Propagation Networks.,,,
170,,S.E. Fahlman.,,1988.,,170,"Carnegie Mellon University,",,,,,,"Technical Report CMU-CS-88-162,",An empirical study of learning speed in back-propagation networks.,,,
176,"Pittsburgh, PA,",Scott E. Fahlman.,,1988.,,176,"School of Computer Science, Carnegie Mellon University,",,,,,,"Technical Report CMU-CS-88-162,",An empirical study of learning speed in back-propagation networks.,,,
177,"Pittsburgh, PA,","Fahlman, S.:",,1988.,,177,"Carnegie Mellon University,",,,,,,"CMU-CS-88-162,","An Empirical Study of Learning Speed in Back-Propagation Networks,",,,
202,"Pittsburgh, PA:","Fahlman, S. E., & Lebiere, C.",,(1989).,,202,"Carnegie Mellon University, Computer Science Department.",,,,,,Technical rep. CMU-CS-90-100).,Cascade-correlation learning architecture,,,
212,,"S. E. Fahlman and C. Lebiere,",,1990,,212,,,,,,,"Technical Report:  CMU-CS-90-100,","The Cascade-Correlation Learning Architecture,",,,
220,,S.E. Fahlman and C. Lebiere.,,1990.,,220,"Carnegie Mellon University,",,,,,,"Technical Report CMU-CS-90-100,",The cascade-correlation learning architecture.,,,
222,,"S. E. Fahlman and C. Lebiere,",,1991.,,222,"Carnegie Mellon University,",,,,,,"Technical Report, CMU-CS-TR-91-100,","The Cascade-Correlation Learning Architecture,",,,
232,"Pittsburgh, PA 15213.","Fahlman, S. and Lebiere, C.",,(1990).,,232,"School of Computer Science, Carnegie-Mellon University,",,,,,,"CMU-CS-90-100,",The Cascade-Correlation Learning Architecture.,,,
236,"Pittsburgh, PA 15213,",S.E. Fahlman and C. Lebiere.,,1991.,,236,"School of Computer Science Carnegie Mellon University,",,,,,,"Technical report,",The cascade-correlation learning architecture.,,,
239,"Pittsburgh, PA,",S. E. Fahlman and C. Lebiere.,,1990.,,239,"School of Computer Science, Carnegie-Mellon University,",,,,,,"Technical Report CMU-CS-90-100,",The cascade-correlation learning architecture.,,,
252,"San Mateo, CA.","Fahlman, S. & Lebiere, C.","Advances in Neural Information Processing Systems (volume 2),",(1989).,"In Touretzky, D., editor,",252,,,,,"(pp. 524-532),",Morgan Kaufmann.,,The cascade-correlation learning architecture.,,,
263,"San Mateo, CA.","Fahlman, S. E. & Lebiere, C.","Advances in Neural Information Processing Systems (volume 2),",(1989).,"In Touretzky, D., editor,",263,,,,,"(pp. 524-532),",Morgan Kaufmann.,,The cascade-correlation learning architecture.,,,
272,,"Fahlman, S. E. and Lebiere, C.",In Neural Information Processing Systems,1990.,"Touretzky, D. S. (ed).",272,,,,,pp 524-532.,"Morgan-Kauffman,",,The Cascade Correlation Learning Architecture.,,2.,
280,,"Fahlman, S. E., & Lebiere, C.","Advances in 43 Neural Information Processing Systems,",(1990).,,280,,,,,524-532.,,,The cascade correlation architecture.,,"2,",
289,"San Mateo, CA:","Fahlman, S. E., and Lebiere, C.",Advances in Neural Information Processing Systems,(1990).,"In Touretzky, D. S., editor,",289,,,,,524-532.,Morgan Kaufmann.,,The cascade-correlation learning architecture.,,"2,",
294,,"Fahlman, S. and Lebiere C.",,(1991).,,294,,,,,,,,The Cascade Correlation Learning Architecture.,,,
306,"Denver, CO.","Fahlman, S., and Lebiere, C.",In Advances in Neural Information Processing Systems,(1989).,,306,,,,,524-532.,,,The cascade-correlation learning architecture.,,"2,",
328,,"S. Fahlman and C. Lebiere,",in Advances in Neural Information Processing Systems,1990.,"(D. Touretzky, ed.),",328,,,,"(San Mateo),","pp. 524-532,","Morgan Kaufmann,",,"The cascade-correlation learning architecture,",,"vol. 2,",
337,"San Mateo, CA)","S. Fahlman and C. Libiere,",Advances in Neural Information Processing Systems,,"in D. Touretzky (ed.),",337,,,,,P.524-532.,"(Morgan Kaufman,",,"The Cascade Correlation Architecture,",,2,
342,San Mateo:,"Fahlman, S.E. and Lebiere C.","In Advances in Neural Information Processing Systems II (Denver 1989),","(1990),","ed. D.S. Touretzky,",342,,,,,524-532.,Morgan Kaufmann.,,The Cascade-Correlation Learning Architecture.,,,
345,"San Mateo, CA,","Fahlman, S. E. and Lebiere, C.","Advances in Neural Information Processing Systems,",1990.,"In Touretzky, D., editor,",345,,,,,pages 524-532.,"Morgan Kaufmann,",,The cascade-correlation learning architecture.,,"volume 2,",
348,"Denver, Colorado,",S. E. Fahlman and C. Lebiere,"in NIPS 2,","(1990),","Editors D. Touretzky, M.",348,,,,,pp. 524-532.,"Kaufmann Publishers, Inc.,",,"The Cascade-Correlation Learning Architecture,",,,
356,"San Mateo, CA:","Fahlman, S.E. and Lebiere, C.","Advances in Neural Information Processing,","1990,","D.S. Touretzky, (Ed.)",356,,,,,pp. 524-532.,"Morgan Kauffman,",,"The cascade-correlation learning architecture,",,"vol. 2,",
363,"San Mateo, CA,",S. E. Fahlman and C. Lebiere.,Advances in Neural Information Processing Structures,1990.,"In D. S. Touretsky, editor,",363,,,,,pages 524532.,"Morgan Kauf mann,",,The cascade-correlation architecture.,,"2,",
367,,Scott E. Fahlman and Christian Lebiere.,"In [22],",1990.,,367,,,,38 REFERENCES,"pages 524-532,",,,The Cascade-Correlation learning architecture.,,,
371,"(San Mateo, CA),","S. Fahlman,",in Advances in Neural Information Processing Systems,1990.,"D. Touretzky, ed.",371,,,,,"pp. 524- ed.532,","Morgan Kaufmann Publishers,",,"The cascade-correlation learning architecture,",,2,
391,San Mateo:,"Fahlman, S.E. and Lebiere C.","In Advances in Neural Information Processing Systems II (Denver 1989),","(1990),","ed. D.S. Touretzky,",391,,,,,524-532.,Morgan Kaufmann.,,The Cascade-Correlation Learning Architecture.,,,
395,"San Mateo CA,",S. E. Fahlman and C. Lebiere.,"Advances in Neural Information Processing Systems (NIPS89),",1990.,,395,,,,,"pp. 524-532,","Morgan Kaufmann,",,The Cascade-Correlation Learning Architecture.,,"vol.2,",
397,"San Mateo, CA:","Fahlman, S. E.",Advances in Neural Information Processing Systems,(1991).,"In Lippmann, R. P., Moody, J. E., and Touretzky, D. S., editors,",397,,,,,190-205.,Morgan Kaufmann.,,The recurrent cascade-correlation architecture.,,"3,",
399,"San Mateo, CA:","Fahlman, S. E.",Advances in Neural Information Processing Systems,(1991).,"In Lippmann, R. P., Moody, J. E., and Touretzky, D. S., editors,",399,,,,,190-205.,Morgan Kaufmann.,,The recurrent cascade-correlation architecture.,,"3,",
402,"San Mateo, CA:","Fahlman, S. E.",Advances in Neural Information Processing Systems,(1991).,"In Lippmann, R. P., Moody, J. E., and Touretzky, D. S., editors,",402,,,,,pages 190-196.,Morgan Kaufmann.,,The recurrent cascade-correlation learning algorithm.,,"3,",
411,"San Mateo, CA,",S. Fahlman.,Advances in Neural Information Processing Systems,1991.,"In R. Lippmann, J. Moody, and D. Touretzky, editors,",411,,,,,pages 190 196.,"Morgan Kaufmann,",,The recurrent cascade-correlation architecture.,,"3,",
415,,Scott E. Fahlman and David B. McDonald.,"Advanced Language Implementation,",1991.,"In Peter Lee, editor,",415,,,,,pages 137-156.,"The MIT Press,",,Design considerations for CMU common lisp.,,"chapter 6,",
421,,Scott E. Fahlman.,"Innovative Applications of Massive Parallelism,",1993.,"In James Geller, editor,",421,Stanford University.,,,"Working Notes, Spring Symposium Series,",pages 85-89.,"AAAI,",,Some thoughts on NETL 15 years later.,,,
441,"New York, NY","Knoop, J. and Steffen, B.,","in Proceedings of the Fourth International Conference on Compiler Construction,",(1992).,U. Kastens and P. ed.,441,,,,"Lecture Notes in Computer Science,",pp. 125-140,"Pfahler,Springer-Verlag,",,"The interprocedural coincidence theorem,",,"Vol. 641,",
443,"New York, NY","Knoop, J. and Steffen, B.,","in Proceedings of the Fourth International Conference on Compiler Construction,",(1992).,U. Kastens and P. ed.,443,,,,"Lecture Notes in Computer Science,",pp.125-140,"Pfahler,Springer-Verlag,",,"The interprocedural coincidence theorem,",,"Vol. 641,",
453,"Paderborn, Germany,",Koen Langendoen and Pieter Hartel. FCG:,"Proceedings of the Conference on Compiler Construction,",Oct 92.,"In P. Pfahler U. Kastens, editor,",453,,,,,"pages 278-296,",Springer-Verlag.,,a code generator for lazy functional languages.,,,
454,"Paderborn, Germany,","K.G. Langendoen and P.H. Hartel, FCG:","Proceedings of the International Workshop on Compiler Construction,",1992.,"Springer Verlag LNCS 641, U. Kastens and P. Pfahler (eds),",454,,,,,"pp 278-296,",,,"a code generator for lazy functional languages, in Compiler construction (CC),",,,
458,,"Poggio, T., Fahle, M., and Edelman, S.",,(1992).,,458,,"Science,",,,1018-1021.,,,Fast perceptual learning in visual hyperacuity.,,256,
463,,"Poggio, T., Fahle, M., and Edelman, S.",,(1992b).,,463,,"Science,",,,1018-1021.,,,Fast perceptual learning in visual hyperacuity.,,256,
468,,"T. Poggio, S. Edelman, and M. Fahle.",,1992.,"Y. Aloimonos (Ed.),",468,,,,,"22-30,",,,"Learning of visual modules from examples: A framework for understanding adaptive visual performance. CVGIP: Image Understanding, Special Issue on Purposive, Qualitative, Active Vision,",,56,
500,"Pittsburgh, PA,","S. Thrun, J. Bala, E. Bloedorn, I. Bratko, B. Cestnik, J. Cheng, K. De Jong, S. Dzeroski, D. Fisher, S. E. Fahlman, R. Hamann, K. Kaufman, S. Keller, I. Kononenko, J. Kreuziger, R. S. Michalski, T.M. Mitchell, P. Pachowicz, Y. Reich, H. Vafaie, W. Van de Welde, W. Wenzel, J. Wnek, and J. Zhang.",,1991.,,500,"Carnegie Mellon University,",,,,,,"Technical Report CMU-CS-91-197,",The MONK's problems a performance comparison of different learning algorithms.,,,
502,"Pittsburgh, PA,","S. Thrun, J. Bala, E. Bloedorn, I. Bratko, B. Cestnik, J. Cheng, K. De Jong, S. Dzeroski, D. Fisher, S. E. Fahlman, R. Hamann, K. Kaufman, S. Keller, I. Kononenko, J. Kreuziger, R. S. Michalski, T.M. Mitchell, P. Pachowicz, Y. Reich, H. Vafaie, W. Van de Welde, W. Wenzel, J. Wnek, and J. Zhang.",,1991.,,502,"Carnegie Mellon University,",,,,,,"Technical Report CMU-CS-91-197,",The MONK's problems a performance comparison of different learning algorithms.,,,
505,,"S.B. Thrun, J. Bala, E. Bloedorn, B. Cheng I. Bratko, S. Dzeroski k. De-Jong, S. Fahlman, D. Fisher, R. Hamann, K. Kaufman, S. Keller, I. Kononenko, J. Kreuziger, R. Michalski, T. Mitchell, P. Pachowicz, Y. Reich, H. Vafaie, K. Van de Welde, W. Wenzel, J. Wnek, and J. Zhang.",,1990.,,505,"Carnegie Mellon University CMU-CS-91-197,",,,,,,"Technical report,",The monk's problem: a performance comparison of different learning algorithms.,,,
508,,"S. B. Thrun, J. Bala, E. Bloedorn, I. Bratko, B. Cestnik, J. Cheng, K. de Jong, S. Dze-roski, S. E. Fahlman, D. Fisher, R. Hamann, K. Kaufaman, S. Keller, I. Kononenko, J. Kreusiger, R. S. Michalski, T. Mitchell, P. Pachowitz, Y. Reich, H. Vafaic, W. Van de Weldel, W. WEnzel, J. Wnek, and J. Zhang.",,1991.,,508,"Carnegie Mellon University,",,,,,,"Technical Report CMU-CS-91-197,",The monk's problems: a performance comparison of different learning algorithms.,,,
516,"Pittsburgh, PA.","S.B. Thrun, J. Bala, E. Bloedorn, I. Bratko, B. Cestnik, J. Cheng, K. De Jong, S. Dzeroski, S.E. Fahlman, D. Fisher, R. Hamann, K. Kaufman, S. Keller, I. Kononenko, J. Kreuziger, R.S. Michalski, T. Mitchell, P. Pachowicz, Y. Reich, H. Vafaie, W. Van de Welde, W. Wenzel, J. Wnek, and J. Zhang,",,,,516,"Department of Computer Science, Carnegie Mellon University,",,,,,,"Technical Report CMU-CD-91-197,",The MONK's problems a performance comparison of different learning algorithms.,,,
531,"Irvine, CA:","Kibler, D., & Aha, D. W.",In Proceedings of the Fourth International Workshop on Machine Learning,,,531,,,,,(pp.24-30.,Morgan Kaufmann.,,Learning representative exemplars of concepts: An initial case study.,,,(1987).
538,"Irvine, CA:","Kibler, D., and Aha, D. W.",In Proceedings of the Fourth International Workshop on Machine Learning.,,,538,,,,,24-30.,"Morgan Kaufmann,",,Learning Representative Exemplars of Concepts: An Initial Case Study.,,,(1987).
541,"Irvine, CA:","Kibler, D., and David W. Aha,",Proceedings of the Fourth International Workshop on Machine Learning.,,,541,,,,,pp. 24-30.,"Morgan Kaufmann,",,Learning representative exemplars of concepts: An initial case study.,,,(1987).
546,"Irvine, CA,",D. Kibler and D. Aha.,"In Proc. of the 4 th International Workshop on Machine Learning,",,,546,,,,,"pages 24-30,",,,Learning representative exemplars of concepts: An initial case study.,,,1987.
547,"CA,",D. Kibler and D. W. Aha.,"Proc. 4th International Workshop on Machine Learning,",,"In P. Langley, editor,",547,,,,,,Kaufmann.,,Learning representative exemplars of concepts: an initial case study.,,,1987.
549,,"Kibler, D., and Aha, D.W.","In Proceedings of the Fourth International Workshop on Machine Learning,",,,549,,,,,24-30.,,,Learning Representative Exemplars of Concepts: An Initial Case Study.,,,"1987,"
572,"Detroit, MI,",D. Aha and D. Kibler.,"In Proceedings of IJCAI-89,",,,572,,,,,"pages 794-799,",Morgan Kaufmann.,,Noise-tolerant instance-based learning algorithms.,,,1989.
577,,"Aha, D. and Kibler, D.",Proceedings of the Eleventh Joint Conference on Artificial Intelligence,,,577,,,,,8,Morgan Kaufmann.,,Noise-tolerant instance-based learning algorithms.,,,(1989).
579,"Dtroit, MI,",D. Aha and D. Kibler.,"In Proceedings of IJCAI-89,",,,579,,,,,"pages 794-799,",Morgan Kaufmann.,,Noise-tolerant instance-based learning algorithms.,,,1989.
580,,"Aha, D. W., Kibler, D. & Albert, M. K.",,,,580,,,,Draft submission to Machine Learning.,,,,Instance-based learning algorithms.,,,(1990).
587,,"D. Aha, D. Kibler, and M. Albert.",,,,587,,"Machine Learning,",,,"37-66,",,,Instance-based learning algorithms.,,6,1991.
589,,"D.W. Aha, D. Kibler, and M.K. Albert:",,,,589,,"Machine Learning,",,,"37-66,",,,"Instance-based learning algorithms,",,"6,",1991.
597,,"Aha, D. W., Kibler, D., & Albert, M.",,,,597,,"Machine Learning,",,,37-66.,,,Instance-based learning algorithms.,,"6 (1),",(1991).
599,,"Aha, D. W., Kibler, D., & Albert, M.",,,,599,,"Machine Learning,",,,,,,Instance-based learning algorithms.,,6 (1).,(1991).
618,,"Aha, D. W., Kibler, D., & Albert, M. K.",,,,618,,"Machine Learning,",,,37-66.,,,Instance-based learning algorithms.,,"6,",(1991).
632,,"Aha, D. W., Kibler, D., and Albert, M. K.",,,,632,,Machine Learning,,,37-66.,,,Instance-Based Learning Algorithms.,,"6,",(1991).
651,,"Aha, D.W., D. Kibler & Albert M.K.",,,,651,,"Machine Learning,",,,pp. 37-66.,,,"Instance-Based Learning Algorithms,",,"6,","(1991),"
660,,"Aha, David W., Dennis Kibler, Marc K. Albert.",,,,660,,Machine Learning.,,,pp. 37-66.,,,Instance-Based Learning Algorithms.,,"6,",1991.
661,,"Aha, David W., Dennis Kibler, and Marc K. Albert,",,,,661,,"Machine Learning,",,,pp. 37-66.,,,Instance-Based Learning Algorithms.,,"Vol6,",(1991).
674,,"Aha, D.W., Kibler, D., and Albert,",,,,674,,"Machine Learning,",,,37-66.,,,M.K. Instance-Based Learning Algorithms.,,"6,","1991,"
677,,"Aha, D.W., Kibler, D., and Albert, M.K.",,,,677,,"Machine Learning,",,,37-66.,,,Instance-Based Learning Algorithms.,,"6,",(1991).
680,,"D. Aha, D. Kibler, and M. Albert,",,,,680,,"Machine Learning,",,,,,,"Instance-based learning algorithms,",,"vol. 6, no. 1,",1991.
697,,"D. Aha, D. Kibler, and M. Albert.",,,,697,,"Machine Learning,",,,,,,Instance-based learning algorithms.,,"6(1),",1991.
703,IN.,"(Aha and Goldstone, 1992) Aha, D. W. and Gold-stone, R. L.","In Proceedings of the Fourteenth Annual Conference of the Cognitive Science Society,",,,703,"Indiana Univeristy, Bloomington,",,,,534-539.,Lawrence Erl-baum Associates.,,Concept learning and flexible weighting.,,,1992.
709,,"J. S. Conery, D. F. Kibler,","Proc. ACM Symp. Functional Programming and Computer Architecture,",,,709,,,,,,,,"Parallel Interpretation of Logic Programs,",,,1981.
713,,"Datta, P. and Kibler, D.",,,,713,,,,,,,,Utilizing prior concepts for learning. In Proceedings of the ML92 Workshop on Biases in Inductive Learning.,,14.,(1992).
719,"Tahoe City, CA:","Datta, P., & Kibler, D.",Proc. Twelfth International Conference on Machine Learning,,,719,,,,,(pp. 158-166).,Morgan Kaufmann.,,Learning prototypical concept descriptions.,,,(1995).
725,,Steven Hampson and Dennis Kibler.,"Workshop Notes: 2nd DIMACS Challenge,",,,725,,,,,,,,Plateaus and plateau search in boolean satisfi-ability problems: When to give up searching and start again.,,,1993.
729,,"Hu, Y. & Kibler, D.","in Proceeding of the 13th National Conference on Artificial Intelligence,",,,729,,,,,"p806--811,",,,"Generation of Attributes for Learning Algorithms,",,14,1996.
734,,D. Kibler and P. Morris.,"In Proceedings of IJCAI-81,",,,734,,,,,,,,Don't Be Stupid.,,,1981.
747,"Glasgow, Scotland.","Kibler, D. & Langley, P.","In Proceedings of the Third European Working Session on Learning,",,,747,,,,,,Pitman.,,Machine learning as an experimental science.,,,(1988).
749,"Glasgow, Scotland.","Kibler, D. & Langley, P.","In Proceedings of the Third European Working Session on Learning,",,,749,,,,,,Pitman.,,Machine learning as an experimental science.,,,(1988).
750,"Edinburgh, UK.","Kibler, D. & Langley, P.","In Proceedings of the Third European Working Session on Learning,",,,750,,,,,"(pp. 1-12),",,,Machine learning as an experimental science.,,,(1988).
751,,"Kibler, D. & Langley P.",,,,751,,Machine Learning 3 (1).,,,,,,Machine Learning as an Experimental Science.,,,(1988).
764,Glasgow:  Pittman.,"Kibler, D., & Langley, P.",Proceedings of the Third European Working Session on Learning,,,764,,,,,(pp. 81-92).,,,Machine learning as an experimental science.,,,(1988).
775,,Pat Langley and Dennis Kibler.,,,,775,,,,"Unpublished paper,",,,,The experimental study of machine learning.,,,1991.
777,"Glasgow, Scotland:","Kibler, D., & Aha, D. W.",In Proceedings of the Third European Working Session on Learning,,,777,,,,,(pp. 63-80).,Pitman.,,Comparing instance-averaging with instance-filtering learning algorithms.,,,(1988).
779,,D. Kibler and D. Aha.,"In Proceedings of the Third European Working Session on Learning,",,,779,,,,,"pages 68-80,",,,Comparing instance-averaging with instance-filtering learn ing algorithms.,,,1988.
781,,"D. Kibler, D.W. Aha, and M.K. Albert:",,,,781,,"Computational Intelligence,",,,"51-57,",,,"Instance-based prediction of real-valued attributes,",,"5,",1989.
791,"San Mateo, CA.","Norvig, P.",,,,791,,,,,,"Morgan Kaufmann,",,Paradigms of Artificial Intelligence Programming: Case Studies in Common Lisp.,,,(1992).
797,"Irvine,CA:","Pazzani, M., & Kibler, D.",,,,797,"University of California, Department of Information & Computer Science.",,,,,,,The utility of knowledge in inductive learning,(Technical Report No.   9018).,,(1990).
816,,"Pazzani, M., & Kibler, D.",,,,816,,"Machine Learning,",,,,,,The utility of knowledge in inductive learning.,,9 (1).,(1992).
830,,"Pazzani, M., & Kibler, D.",,,,830,,"Machine Learning,",,,57-94.,,,The utility of knowledge in inductive learning.,,"9,",(1992).
857,,"Ruby, D., & Kibler, D.",In Proceedings of AAAI-91.,,,857,,,,,,AAAI Press.,,Learning subgoal sequences for planning.,,,(1991).
864,,David Ruby and Dennis Kibler.,"In Machine Learning : proceedings of the Ninth International Workshop (ML92),",,,864,,,,,"pages 379-384,",,,Learning Episodes for Optimization.,,,1992.
866,,"Rudy, D., Kibler, D.","Proceedings of the Ninth International Conference on Machine Learning,",,,866,,,,,,Morgan Kaufmann.,,Learning episodes for optimization.,,,(1992).
880,"U. C. Irvine,  CA,","Aha, D. and Kibler, D.","In Proceedings of the Fourth International Conference on Machine Learning,",,,880,,,,,"pages 24-30,",Morgan Kaufmann.,,Learning Representative Exemplars of Concepts: An Initial Case Study.,,,1987.
907,,"Aha, D. W., Kibler, D., and Albert, M. K.",,,,907,,"Machine Learning,",,,37-66.,,,Instance-based learning algorithms.,,"6,",(1991).
911,,"Aha, D. W.; Kibler, D.; and Albert, M. K.",,,,911,,Machine Learning,,,37-66.,,,Instance-based Learning Algorithms.,,6,1991.
919,,"Aha, D. W.; Kibler, D.; and, Albert, M. K.",,,,919,,Mac hine Learning,,,37-66.,,,Instance-based learning algorithms.,,6:,1991.
938,,"David W. Aha, Dennis Kibler, and M. K. Albert.",,,,938,,"Machine Learning,",,,37-66.,,,Instance-based learning algorithms.,,6,1991.
948,,"D. W. Aha, D. Kibler, and M. K. Albert.",,,,948,,"Machine Learning,",,,"37-66,",,,Instance-based learning algorithms.,,6,1991.
950,,"D. W. Aha, D. Kibler, and M. K. Albert.",,,,950,,"Machine Learning,",,,"37-66,",,,Instance-based learning algorithms.,,6,1991.
964,,"D. W. Aha, D. Kibler, and M. K. Albert.",,,,964,,"Machine Learning,",,,"37-66,",,,Instance-Based Learning Algorithms.,,6(1),1991.
978,,"D. W. Aha, D. Kibler, and J. K. Albert.",,,,978,,"Machine Learning,",,,"37-66,",,,Instance-based learning algorithms.,,6(1),1991.
979,,"D. W. Aha, D. Kibler, and M. K. Albert.",,,,979,,"Machine Learning,",,,"37-66,",,,Instance-based learning algorithms.,,6(1),1991.
988,,"Aha, D., Kibler, D., and Albert, M.",,,,988,,"Machine Learning,",,,"37-66,",,,Instance-Based Learning Algorithms.,,6(1),1991.
990,,"Aha, D., Kibler, D., and Albert, M.",,,,990,,"Machine Learning,",,,"37-66,",,,Instance-Based Learning Algorithms.,,6(1),1991.
1002,,"D.W. Aha, D. Kibler, and M.K. Albert,",,,,1002,,"Machine Learning,",,,"37-66,",,,"Instance-based learning algorithms,",,"6,",1991.
1017,"Irvine, CA,",Dennis Kibler and David W. Aha.,"In Proceedings of the 4 th International Workshop on Machine Learning,",,,1017,,,,,,,,Learning representative exemplars of concepts: An initial case study.,,,1987.
