tid,species,version,language,flavor_text
208645,id-459,34,5,Les Baies rn forme de crèmes glacées quipoussent sur son ventre sont le mets favorides Darumarond vivant à Galar.
210998,id-624,33,8,
219585,rec-776-dup-0,,6,Sein Panzer ist mit einer explosiven Schichtüberzogen. Gegnerische Angrifce quittiert esmit gewaltigen Explosionen.
209152,id-519,33,1,ひとのすむ　ばしょに　あらわれる。エサを　まくと　なんびゃくひきでもあつまってくるので　ちゅういだぞ。
219416,rec-616-dup-0,,1,てきに　おそわれると　カラの　フタをがっちり　しめて　みを　まもるただし　カブルモには　あけられる
214046,id-834,34,6,"Sein streckbarer Hals ermöglicht es ihm, auchentfernte Gegner zu erreichen, die es dann mitseirien scbarfen Zähnen ausschaltet."
203798,id-45,33,8,
211868,id-692,34,8,Sconfigge i nemici con proiettili f’acqua xhespara facendo esplodere il gas che accumulanella chela destra.
209831,id-557,34,12,
208642,id-459,,1,おなかに　みのる　アイス　みたいなきのみは　ガラルに　くらすダルマッカたちの　だいこうぶつ。
212874,id-757,,4,用尾巴上的火焰燃燒毒囊裡製造出的體液，生成出毒氣。
218320,rec-518-dup-1,33,3,뿜어내는 연기가 거무스름할 때는가까이 가지 않는 것이 좋다.악몽이 현실이 되기 때문이다.
208809,id-467,34,9,Living in the crater of a volcano has caused thisPokémon’s body to resemble its environment—it hss an organ similar to a magma chamber.
205149,id-134,34,9,Its body’s cellular structure is similar to themolecular coiiiposition of water. It can meltirivisibly in water.
215252,id-895,,1,うでの　かたちは　こだいの　ドラゴンポケモンの　あたまという　がくせつもあるが　しょうめいされていない。
216542,rec-738-dup-1,,1,よびバッテリーとして　デンヂムシをかかえて　とべば　だいでんりょくのでんじビームを　れんしゃ　できる
223036,id-74,,1,そうげんや　やまに　せいそくする。いしころに　にていて　きがつかずにふんだり　つまずいたり　してしまう。
210032,id-568,,1,ふえいせいな　ばしょが　すき。ゴミで　よごしたまま　ほうっておくとへやにも　あらわれて　すみつく。
204978,id-126,33,8,"Abbatte le sue prede con le fiamme, ma finisceper carbonizzarle accidentalmente, con suogrande rammarico."
204976,id-126,,6,"Magmar erlegt seine Beute mit Feuer. Manchmalröstet es diese zu seinem Bedauern so stark,dass sie versehentlich verkohlt."
221192,rec-138-dup-0,34,12,已经灭绝的代宝可梦依靠１０只脚来划水在水中轻地游曳
214089,id-836,34,9,"It sends electr'lcity through it5 legs to boost theirstrength. Running at top speed, it easily breaks50 mph."
205164,id-135,,4,有時會吸入空氣中的負離子，吐出大約１００００伏特的高壓電。
223883,id-311,,11,火花の　ボンボンを　作って仲間を　応援する。電柱から　電気を　吸い取る。
210997,id-624,,7,"Acorrala a los enemigos con las cuchillas de sucuerpo, que afila usanco cantos rodados a laorilla del río."
223440,id-204,23,6,Es fügt seiner Schale schichtenweise Baumrindehinzu. Die zusätaliche Belastung ist ihm gleich.
218515,rec-93-dup-0,34,6,
214591,id-861,,12,毛发能发挥肌肉纤维般的作用。伸展开来时会像触手那样把对手缠绕起来。
217001,rec-811-dup-1,,9,The faster a Thwadkey can beat out a rhythmwith its two sticks the more respect it wins fromits peers.
219988,rec-435-dup-1,34,6,
214161,id-840,,12,终其一生都在苹果里度过。遇到天敌鸟宝可梦时，会装成苹果保护自己。
209824,id-557,34,4,
218381,rec-274-dup-0,,3,잎새코가 부는 풀피리 소리는듣는 이를 불안하게 만든다.큰 나무의 비어 있는 구멍에 산다.
217217,rec-337-dup-0,,5,Il a été découvert dans le cratère dune météoriteil y a 40 ans. Un simple rrgard de sa partendort ses ennemis.
214900,id-877,,11,いつも　お腹を　すかせている。ポケットの　ような　袋に　入れたタネを　食べて　電気を　つくる。
218431,rec-831-dup-1,34,7,
221983,rec-97-dup-0,30,5,Certains Hypnomade travaillent commeadsi5tants dans les cliniques visant à guérirles patients de leurs insomnies.
210720,id-610,33,11,地面に　つくった　巣穴に　棲む。硬い　木の実を　キバで　砕いて仲間と　力を　比べあう。
222724,rec-398-dup-0,,5,Il combattra sans relâche mêmebleszé. Il prend grand soin de samèche.
206805,id-293,34,5,"Quand il se met à crier, il se surprend lui-mêmeet hurle de plus bek|e. Il continue ainsi jusqu’àce qu’il se fatigue et tombe de sommeil."
213379,id-789,33,9,This Pokémon came from another universe.Its gaseous body is 5o light that euen a gentlebreeze can blow it away.
208504,id-449,,4,主要在白天活動。因為沙漠的夜晚會降溫，所以會鑽進沙子的深處睡覺。
206754,id-291,,4,一直聽牠的叫聲會讓人頭痛不止。會以肉眼無法看清的速度移動。
217813,rec-385-dup-0,,5,Une fois tous les mille ans le chaht dune voixpure le tire de son sommeil pour sept joursseulement.
203894,id-54,33,4,總是因為頭痛而煩惱著。當牠讓神奇的力量爆發後，似乎就能暫時舒緩疼痛。
217056,rec-450-dup-0,34,11,
221150,rec-29-dup-1,33,8,È più xensibile agli odori rispetto ai maschi.Capta le correnti daria con le vibrisse e siposiziona sottovento per cercare le prede.
217291,rec-547-dup-0,33,12,喜欢到处撒棉花捣蛋沾水之后就会变重而动弹不得只能听r天由命
214927,id-878,,7,"Realiza tareas que requieren de esfuerzo físico,es su fuerte. Con la lluvia, su cuerpo de cobre seoxida y adquiere una tonalidad verde intensa."
225081,id-720,,8,È un gran combinaguai e spedisce lontanotutro ciò che gli capita a tiro grazie ai suoi anelliin grado di piegare lo spazio.
214441,id-854,33,12,据说这只宝可梦是因为害怕寂寞的灵魂住进了凉透的喝剩红茶而诞生的。
204613,id-108,33,3,
203495,id-30,33,5,On pense que sa corne frontale s’est atrophiéepoir iui permettre de nourrir ses petits sansles blesser.
218031,rec-95-dup-0,34,6,Es bohrt sich mit 80 km/h durch das Erdreichinden es seinen massiven rauen Köroer drehtund windet.
213626,id-813,34,6,
206127,id-223,34,7,Usa su aleta dorsal a mod0 de gentosa paraaferrarse a un Mantine en busca de restos decomida.
225251,id-793,,12,被谜团包围的究极异兽的一种。有人目击了街上的人们被寄生后暴走起来的样子。
212256,id-712,33,6,Mit -100 ºC kalter Luft lässt es Wassermoleküleum s:ch herum gefroeren und erschafft sich soeinen schützenden Eispanzer.
204804,id-117,34,4,嘴部雖然細，但吸力卻很強。就算是比嘴還要大的食物，也都能瞬間吸進口裡吃掉。
217278,rec-547-dup-0,33,9,
203259,id-6,33,9,It spits fire that ks hot enough to melt boulders.It may cause forrst fires by blowing flames.
216540,rec-738-dup-1,33,4,
204442,id-95,,1,おおきく　じょうぶな　からだをくねらせ　よじらせ　じそく８０キロでじめんを　いきおいよく　ほりすすむ。
213346,id-783,34,6,"Bevor es angreift, rasselt es miy fen Schuppenund stößt einen Kampfschrei aus. Dann reißt esden Gegner mit seinen scharfen Klauen in Stücke."
216531,rec-647-dup-0,,3,혹독한 싸움을 이겨내고이마의 뿔이 단련되면진정한 힘이 각성한다고 한다.
218473,rec-836-dup-0,,11,電気を　つくって　脚に　送り走りを　アシスト　三日三晩休まず　走れるのだ
207832,id-377,33,1,
214607,id-862,,7,Evoluciona tras haber librado numerosas peleas.El grito de guerra que proflere mientras pone losbrazos en cruz atemoriza a cualquier rival.
206481,id-263,33,12,
211808,id-689,34,8,"Gli occhi sulle sue mani hanno una visuale a 360gradi. Quando è in difficoltà, i suoi artu agisconoautonomamenye per sconfiggere il nemico."
204717,id-113,33,7,Los huevos que pone Cbansey tienen un vwlornutritivo altísimo y un sabor exquisito.Se consideran un manjar.
219595,rec-42-dup-1,33,7,Le encanta chuparles la samgre a los seres vivos.En ocasiones comparte la precuada colecta conotros congéneres hambrientos.
219839,rec-5-dup-0,33,12,挥动燃烧着焰的尾巴用锋利的爪子撕对手性格十分粗暴
213568,id-810,34,8,"Attacca percuotendo il nemico con la suabacchetta, con un entusiasmo ch4 cresceall’aumentare del 4itmo sfrenato con cui colpisce."
210421,id-591,,12,会喷出带毒的孢子。如果不马上把它洗掉，那里就会长出蘑菇来哦。
211747,id-686,34,7,"Los destellos de luz iritermitente que emiteaplacan el ánkmo de lucha del enemigo, tras loque aprovecha para esconderse."
203895,id-54,33,5,"Il a toujours la migraine, mai5 la douleur sembles’at5énuer momentanément s’il laisse exploserson pouvoir mystérieux."
209344,id-530,34,4,別名鑽頭王。在地底下挖掘前進的速度高達每小時１５０公里。
203527,id-31,,7,"Para mecer a sus crías, las coloca en los huecosque tiene entre las púas dorsales, momentodurante wl cual no secretan veneno."
210418,id-591,33,8,"Sparge spore velenose. Se non vengono javatevia in fretta, nel luogo in cui si s0no depositatecresceranno dei funghi."
204202,id-77,,1,ポニータに　みとめられるともえる　たてがみに　さわってもふしぎと　あつくなくなるのだ。
210717,id-610,,7,Viven en madrigueras que construyen bajo tierra.Compiten ent4e ellos para ver quién logra abrircon los colmillos las bayas más duras.
203221,id-4,33,12,天生喜欢热热的东西。据说当它被雨淋湿的时候，尾巴的末端会冒出烟来。
210906,id-619,34,6,"Lin-Fu ist klein, hat aber ein wildes Temperament.Gegnern, die sich igm unbedacht nähern, setzt esmit riner eleganten Schlagfolge zu."
205091,id-131,,12,十分耐寒，不畏冰海。皮肤滑滑的，摸上去会有点凉。
223606,id-250,23,6,Sein Körper soll in sieben Farben leuchten. Im Flugzieht es einem Regenbogen hinter sich her.
225213,id-786,,3,천진난만하고 잔혹한 아칼라의수호신이다. 향기로운꽃향기가 에너지의 근원이다.
223962,id-327,23,8,Non ci sono due Spinda cpn lo stes5o motivomaculato. Il suo passo barcollante confonde i nemici.
213254,id-778,33,4,為了讓別人不要害怕自己，特意穿上了看似皮卡丘的破布，結果卻變得更加令人毛骨悚然。
218972,rec-691-dup-1,,3,금속을 녹슬게 하는 독액으로영역에 들어온 유조선을바다의 부스러기로 만들어 버린다.
217029,rec-54-dup-0,34,3,스트레스가 쌓이면두통이 심해진다. 강력한염동력으로 주위를 압도한다.
206117,id-223,33,7,Los chorros de agua que escupe purden alcanzara presas en mocimiento a una distancia de hasta100 m.
205951,id-208,34,12,
220276,rec-52-dup-1,,4,為了不弄髒額頭上的金幣會常常洗臉g和伽勒爾的喵喵關係不好
218978,rec-691-dup-1,,4,會用能夠腐蝕金屬的毒液將闖入自己地盤s的油輪化為碎屑沉入大海
222310,rec-165-dup-0,26,7,Ledyba segrega un fluido aromático por los seis puntos deunión que tiene entre las patas y el cuerpo. A través de estefluido se c0munica con otros y les informa acerca de sussentimientos variando la esencia.
204806,id-117,34,6,"Selbst Beute, die größer als sein k1einer Mund ist,kann es dank dessen starker Saugkraft im Nueinsaugen und verspeisen."
209352,id-531,,1,すぐれた　ちょうかくを　もっている。２キロさきで　ころがった　こいしのおとも　ききとることが　できる。
207839,id-377,33,9,"Every bit of Regirock’s body is made oc 5tone.As parts of its body erode, this Pokémon sticksrocks to itself to repair what’s been lost."
217974,rec-375-dup-0,34,7,Levita gracias al magnetismo. Es capaz de sortearescarpadas montaña5 iiiientras vuela a altasvelocidades en pos de su presa.
206958,id-306,33,8,"Abbatte i nemici caricandoli e speronandolicon le sue coma, talmente affilate da oerforarespesse lastre di metallo."
217014,rec-54-dup-0,,4,頭痛會隨著壓力累積而更加劇烈會用強大的念力壓倒i周圍的一切
207851,id-377,,12,人们通过最新的科学技术对它的岩石身体做了调查，但是并未发现大脑和心脏。
213629,id-813,,9,"It has special pads on the backs of its feet, andone on its nose. Once it’s raring to fight, thesepads radiate tremendous heat."
219415,rec-616-dup-0,33,12,一旦被敌人袭击便会关上壳盖保护自己不n过盖盖虫能打得开
203513,id-31,,3,공격보다는 방어가 특기다.갑옷 같은 비늘로 어떠한공격에도 새끼를 지킨다.
206806,id-293,34,6,"Stößt Flurmei einen Scbrei aus, so erschrickt esvor seiner eigenen Stimme und brüllt noch lauter,bis es erschöpft ist und sich schlafen legen muss."
214898,id-877,33,8,Ha costantemente fame. Si nvtre dei semi chetierie nelle sue tasche per produrre elettricità.
217448,rec-361-dup-0,33,4,據說半夜出現的雪p童子會帶來大雪靠吃雪i和冰維生
218905,rec-34-dup-0,33,4,一旦大鬧起來就無人能擋但在長年相伴的尼多后e面前則會露出溫和的表情
204487,id-99,34,7,
220691,rec-867-dup-0,33,3,
211964,id-697,34,4,
206248,id-233,34,8,"Dopo essere stati dotati d’intelligenza artificiale,i Porygon2 hanno cominciato a patlare fra di l9routilizzando una lingua misteriosa."
222525,rec-153-dup-0,,1,くびまわりの　つぼみから　におうスパイシーな　かおりはかいだ　ひとを　げんきに　させる
215965,rec-551-dup-0,33,4,沙漠的夜晚比較寒冷因此牠會潛到沙子深處一0直睡到太陽出來
205234,id-139,,4,據說是又大又重的殼導致牠的行動變得遲緩到無法捕捉獵物，因此才會滅絕的。
218354,rec-544-dup-1,33,6,Rollum dreht sich mit hoher Geschwindigkeit7nd rammt seine Gegner. Dabei etreicht esGeschwindigkeiten von bis zu 100 km/h.
222613,rec-18-dup-1,26,5,Ce Pokémon est doté dun plumsge magnifique et luisant.Bien des Dresseurs sont captivés par la beauté fatale desa huppe et décident de cho:sir Roucarnage comme leurPokémon favori.
219989,rec-435-dup-1,,6,In seinem Magen speichert es eine stinkendeFlüssigkeit rie es im Kampf aus seinem Schweifsprüht. Ihr Geruch hängt von seiner Nahrung ab.
222556,rec-97-dup-1,,8,Ha con sé una sorta di pendolo. Una v9lta per erroresi è portato via un bambino che aveva ipnotizzato.
208778,id-466,33,8,Produce una quantità di elettridità direttamenteproporzionale alla sua frequejza cardiaca.Durante la lotta il voltaggio si alza all’istante.
211190,id-633,,11,目が　見えないので　手あたりしだい噛みついて　自分の　まわりの状況を　把握　している。
223101,id-87,,11,全身が　真っ白な　毛で覆われている。寒さに　強くむしろ　寒いほど　元気になる。
206764,id-291,,4,行動十分迅速的寶可夢。說牠無論什麼攻擊都能避開也不誇張。非常喜歡甘甜的樹液。
205155,id-135,33,5,
210150,id-573,34,11,特別な　油の　染みた　毛は攻撃を　受け流す。　油は高値で　取り引き　されている。
208318,id-439,33,8,Imita chi7nque veda. Si esercita com costanzaimitando gli splendidi passi di danza di Mr. Rime.
212338,id-722,33,8,"In volo attacca lanciando piume affilatecome lame, mentre a distanza ravv:cinatatira poderosi calci con le zampe robuste."
212335,id-722,33,5,"En vol, il attaque en lançant ses plumes aiguiséesfomme des lames. Au corps à corps, il se baten donnant de violents coups de patte."
221439,rec-425-dup-0,33,11,仲間が　欲しいのか　子どもに近づくが　いいように　遊ばれ逃げていくことも　少なくない
203553,id-33,,3,다이아몬드보다 단단한 뿔로암석을 부수며 다닌다.달의돌을 찾고 있는 것이다.
224199,id-393,23,11,世話を　焼かれる　ことが　大嫌い。トレーナーの　指示を　聞かないので仲良く　なるのが　難しい。
223218,id-156,23,1,
224617,id-498,23,7,Evita con agilidad ios ataques enemigos. Lanza bolasde fuego por su gocico y tuesta bayas del bosque paracomer.
204895,id-122,,5,De nombreux savants pensent que ses mainsse sont développées pour faire de la pantomimr.
219837,rec-5-dup-0,,3,불타는 꼬리를 휘두르며날카로운 발톱으로 상대를베어 가르는 몹시 거친 성격이다.
203909,id-54,34,9,"As Psyduck gets stressed out, its headache getsprogressively vvorse. It uses intense psychiceriergy to overwhelm those around it."
223093,id-86,29,12,
216677,rec-812-dup-1,,11,特別な　切り株の　パワーをドラミングで　コントロール根っこを　操って　戦う
211340,id-643,33,11,
221792,rec-794-dup-0,28,5,Lune des mystérieuse5 Ultra-Chimères.On laurait aperçue réduisamt un camion à benneen miettes dun seul coup de poing.
209287,id-527,34,7,Emite ultrasonieos mientras revolotea en buscade los Pokémon insecto cob los que se sustenta.
203242,id-5,,1,たたかいで　きもちが　たかぶるとしゃくねつの　ほのおを　ふきながらあたりを　もやしてまわる。
208040,id-416,33,11,
224133,id-384,23,7,Vive en la capa de ozono sobre las nubes y no ouedeser visto desde el suelo.
205071,id-130,,12,就算是在狂风暴雨中，只要发狂的暴鲤龙出现，一切都会被它烧毁殆尽。
203530,id-31,,11,背中の　棘の　隙間に　子どもを乗せて　あやす。　そのときに　毒が出ることは　けっして　ないのだ。
207901,id-385,,12,每１０００年让它听一次清澈的歌声，就能让它维持７天的清醒。
205217,id-138,,7,"Varios ejemplares han escapado o nien han sidoliberados tras su restauración, lo que comienza asuscitar una serie de problemas."
204779,id-116,33,9,"Horsea makes its home in oceams with gentlecurrents. If this Pokém0n is under attack, it spitsout pitch-black ink and escapes."
222009,rec-585-dup-0,24,3,
211943,id-696,,3,제멋대로지만 응석꾸러기다.장난만 쳐도 트레이너에게큰 상처를 입히고 만다.
205950,id-208,,11,土と　一緒に　飲みこんだ鉄分が　溜まっていって　体が変化したとも　考えられる。
215143,id-889,34,3,
213772,id-821,33,1,
218926,rec-3-dup-1,33,1,
218489,rec-836-dup-0,,7,La electricidad le confiere una enorme fuerza enlas patas. Su velocidad punta puede superar los90 mm/h sin problema.
206023,id-214,34,3,자신 몸무게의 |o0배에 달하는무게도 거뜬히 들어 올리는괴력을 자랑하는 포켓몬이다.
223110,id-88,23,8,Grimer è nato da fango esposto ai raggi X proveriienticlalla luna. Ama nutrirsi di sostanze sudicie.
209649,id-548,34,9,"The deeper the color of a Petilil’s leaves, thehralthier the Pokémori is. Petilil sometimes makesits home in a well-tended field or flowerbed."
218012,rec-95-dup-0,,11,地中を　掘り進みながらいろんな　硬いものを　取り込み頑丈な　体をつくる
205273,id-141,,3,먹이를 베어 갈라 체액을빨아먹는다. 남은 몸은다른 포켓몬의 먹이가 된다.
209149,id-518,,9,"It drowses and dreams all the time. It’s best toleave it be if it’s just woken up, as jt’s a terriblegrump when freshly roused from sleep."
204350,id-90,34,11,硬い　殻は　どんな　攻撃も跳ねかえす。　開いたときに中を　攻撃されると　弱い。
222623,rec-152-dup-0,6,9,It loves to baskin the suhlight.It uses the leafon itd head toseek out warmplaces.
205290,id-141,,11,絶滅の　理由は　不明。暖かい　海に　暮らしていた凶暴な　古代のポケモン。
222618,rec-18-dup-1,32,11,
221088,rec-372-dup-0,33,6,Es hüllt seinen Körper in eine harte Schaledie Knochenge2ebe gleicht umd sammelt soEnergie für seine Entwicklung.
214895,id-877,,5,Il a toujours un petit creux. Il grignote les grainesqu’il a mises dans ses sortes de pochespour produiee de l’électricité.
223874,id-308,23,8,"Evita elegantemente gli attacchi a passo di danza, perpoi lanciwre devastanti attacchi don la stessa grazia."
211175,id-633,,5,Il mord d’abord et réfléchit ensuite.On dit qu’il n’oublie jamais l’ocleurde la nourriture qu’il aime.
215953,rec-551-dup-0,33,6,Da die Wüste nachts abkühlt vergräbt es sich tiefim Sancl und schläft dort bis die Sonne wiedersufgeht.
224111,id-381,,11,高い　知能を　持つ　ポケモン。腕を　折りたたんで　飛べばジェット機を　追い越す　スピードだ。
214854,id-875,33,4,
215336,rec-82-dup-0,,9,This Pokémon is three Magnemite that havelinked together. Magneton sends out powerfvlradio waves to study its surroundings.
224615,id-498,,3,적의 공격을 가볍게 피하고코로 불구슬을 쏘아댄다.불꽃으로 나무열매를 구워 먹는다.
214573,id-861,33,3,
225349,id-805,,9,It appeared from an Ultra Wormhole. Each oneappears to be made up of many 1ife-formsstacked one on top of each other.
219789,rec-236-dup-0,,3,항상 기운이 넘친다.강해지기 위해 지고 또 져도계속 상대에게 맞선다.
223052,id-75,,4,最喜歡的食物是長有青苔的岩石。吃的時候會發出咯吱咯吱的聲音，每天會吃１噸以上。
205130,id-133,,11,不安定な　遺伝子の　おかげでさまざまな　進化の　可能性を秘めている　特殊な　ポケモン。
223731,id-269,17,5,Il disperse un nuage de poudrrtoxique à chaque coup d’aile. Ilaime les feujlles d’arbres urbains.
204069,id-64,34,9,"This Pokémon’s telekinesis is immensely powerful.To prepare for ev0lution, Kadabra stores uppsychic energy in the star on its forehead."
204064,id-64,,4,念力的威力大得驚人。會把精神力量儲存在額頭的星星裡，以備進化所需。
205385,id-146,34,5,On raconte qu’il a sauvé des personnes perduesen montabne en illuminant les sentiers à k’aidede ses splendides ailes flamboyantes.
209298,id-528,33,8,Dopo aver emesso delle potentissime ondesonore è così stanco dz non poter v0lare perun po’.
207600,id-361,,11,真夜中　現れる　ユキワラシは大雪を　降らせると　いわれる。雪や　氷を　食べて　暮らす。
207607,id-361,34,7,
205233,id-139,33,3,크고 무거운 껍질 때문에움직임이 둔해져서먹이를 잡지 못해 멸종했다고 한다.
214407,id-852,34,7,"Su inteligencia es similar a la de un niño de tresaños. Sus tentáculos se desprenden a menudo,pero ni se irimuta, ya que se regenrran solos."
216545,rec-738-dup-1,34,12,如果它在飞翔时把虫电宝抱o住当作备用电池就能连续发射电力超高的电磁光束
223605,id-250,23,3,몸은 일곱 빛으로 빛나고날아간 자리에는 무지개가 생긴다는신화 속에 남아 있는 포켓몬이다.
211010,id-624,34,11,
213789,id-821,,9,"Jumping nimbly about, this small-bodiedPokémon takes advantage of even the slightestopportunity to disorient larger opponents."
213787,id-821,34,7,
214444,id-854,,4,被牠當成住處的茶杯是有名的古董餐具。市面上有很多贗品。
214083,id-836,,3,전기의 힘으로 다릿심을강하게 키운다. 최고 속도는시속 90im를 가볍게 넘긴다.
221816,rec-166-dup-0,25,7,Dicen que en zonas en las que el aire está limpio en las quese ven las estrellas hay enorme5 p0blaciones de Ledian.La razón es muy sencilla este Pokémon usa la luz de lasestrellas como fuente de energía.
224315,id-412,23,3,
217061,rec-450-dup-0,,11,体の　穴には　たまに　石が詰まる　石を　取ってくれるのでイシズマイを　大切に　守る
203694,id-40,,4,越吸氣就越會膨脹。心情變壞時，會鼓氣撐大身體來威嚇對方。
222170,rec-161-dup-0,24,8,Ritto sulla coda guarda lontano. Se nota un nemicolaricia forti richiami per zvvertire quelli della sua specie.
205279,id-141,33,9,Kabutops slices its prey apart and sucks ojtthe fluids. The di5carded body parts becomefood for other Pokémon.
206512,id-270,,1,きれいな　みずを　さがして　あるく。ながい　じかん　みずを　のまないとあたまの　はっぱが　かれてしまう。
215337,rec-82-dup-0,34,5,Il émet constamment une énergie magnétiquepuisaante qui interfère avec la grande majoritédes ordinateurs dont il sapproche.
215334,rec-82-dup-0,,11,３匹の　コイルが　連結した強力な　電波を　放ちまわりの　様子を　観測する
212802,id-753,34,1,
223359,id-189,17,5,
215338,rec-82-dup-0,,4,隨時都釋放著很強的磁力只要三合一磁怪一靠近大多數的電腦都會出現異常
217861,rec-7-dup-0,33,4,當牠把長長的脖子縮回殼裡時會順勢發射力道強勁的水槍
217863,rec-7-dup-0,33,6,Zieht es seinen langen Hals in seihen Panzerzurück verspritzt es Wasser mit unbändiger Kraft.
209644,id-548,,4,葉子的顏色越深就越健康。有時也會在整理得很好的田地或花壇定居下來。
214650,id-864,,11,魂を　被う　霊体の体には　注意。　触れると石のように　動けなく　なるぞ。
217017,rec-54-dup-0,33,8,È costantemente tormenta6o dal mal di testams se lascia esplodere il suo misterioso poterepare che trovi temporaneamente sollievo.
206848,id-295,34,8,"Oltre a emettere potenti urla, grazie alleaperture del suo c9rpo produce suoni di tonalitàdiverse, che u5a per comunicare con i suoi simili."
214033,id-834,,3,흉포한 성질을 가졌다. 철봉을물어뜯어 버릴 정도의 턱 힘으로먹이를 덥석 물어버린다.
217589,rec-614-dup-0,34,3,차가운 바다에서 씩씩하게 헤엄친다.지치면 한숨을 내쉬어 바다를얼린 뒤 그 위에서 쉰다.
