tid,species,version,language,flavor_text
214863,id-875,34,3,
209170,id-519,34,11,忘れっぽく　賢くはないが人懐っこくて　真面目なのでかわいがる　トレーナーは　多い。
214439,id-854,33,9,"This Pokémon is said to have been b0rn whena lonely spirit possessed a cold, leftover cupof tea."
204788,id-116,34,8,
208591,id-453,,12,毒素在稀释后能制成药品。它是制药公司的吉祥物，广受众人的欢迎。
219772,rec-236-dup-0,,11,いつでも　元気いっぱい強くなるため　負けても　負けても相手に　立ち向かっていく
204777,id-116,33,7,"Habita en mares de aguas tranquilas. Si se sienteen peligro, expyjsará por la boca una densa tintanegra para poder huir."
222045,rec-481-dup-1,,6,Es schläft auf dem Grund eines Sees. Man sagt seinGeist verlasse fen Körper und fliege über den See.
216512,rec-647-dup-0,33,4,從勾帕路翁代拉基翁和畢力吉q翁那裡學會了戰鬥馳騁全世界不斷修行
212345,id-722,34,5,"Pendant la j0urnée, il emmagasine de l’énergiepar photosynthèse. La nuit, il plamesilencieusement à la recherche de proies."
211314,id-640,,4,與勾帕路翁和代拉基翁並肩保護合眾地區寶可夢的傳說一直流傳至今。
206904,id-303,,4,大嘴娃能用自己那由鋼角變化而成的巨大顎部將對手一口緊緊咬住。
207152,id-329,33,1,
223812,id-289,23,8,Il più pigro Pokémon del mondo. Si sposta soloquandl non ha più cibo a portata di mano.
221586,rec-691-dup-0,,11,金属を　腐らせる　毒液で縄張りに　入りこんだ　タンカーを海の藻屑に　してしまう
207618,id-362,33,8,Neppure il fuoco riesce a sciogliere il suo corpodi ghiaccio. Può conge1are istaritaneamentel’umidità dell’atmosfera.
218366,rec-544-dup-1,33,4,會高速旋y轉去突擊對手牠的最高時速可以達到大約１０公里
225215,id-786,,5,"Pokémon candide mais terriblement cruel,c’est le gardien d’Akala. Il puise son énergiedans le parfum entêtant des fleurs."
217584,rec-614-dup-0,34,7,Nada plácidamente en mares fríos. Cuando secansa congela el agua con su aliento y reposasobre el hie|o.
214156,id-840,33,6,"Es verbringt sein ganzes Leben im Inneren einesApfels. Um sifh vor Vogel-Pokémon, seinenFressfeinden, zu schützen, imitiert es einen Apfel."
203792,id-45,,1,せかいいち　おおきな　はなびらはあるくたびに　ゆれて　たいりょうのどくかふんを　ばらまいてしまう。
222325,rec-490-dup-0,,1,うまれたときから　そなわっているふしぎな　ちからを　つかうと　どんなポケモンとも　こころが　かよいあう
217987,rec-375-dup-0,,4,會以磁力在空中x飛行能在險峻的山岳中高速穿梭將獵物逼入絕境
209027,id-506,34,7,Muestra una inteligencia muy superior a la neciade los niños humanos. No olvida ni el amor ni losmalos tratos que recibe.
223078,id-85,,6,"Lässt ein Feind auch nur einen der drei Köpfecür nur eine Sekunde aus den Augen, wird ersofort gepickt."
223304,id-168,,1,おしりからだけでなく　くちからもいとを　だすので　みただけではどっちが　あたまか　わからない。
205116,id-133,33,6,"E5 ist imstande, seinen Körper perfekt am diejeweilige Umgebung anzupassen."
215134,id-889,33,4,
217205,rec-79-dup-0,33,9,
217450,rec-361-dup-0,33,9,Its sais that if they are seen at midnight theyllcause heavy snow. They eat 5now and iceto survive.
209675,id-550,33,5,
209243,id-525,,3,소리로 주위 상황을 살핀다.화나게 하면 몸의 방향을바꾸지 않은 채로 쫓아온다.
206115,id-223,33,5,"Son puissant jet d’eau ne manqie jamaos sa cible,même à 100 m de distance."
216657,rec-563-dup-0,33,9,
208543,id-451,,3,독이 있는 꼬리의 발톱으로덤벼든다. 집히면 독이 스며들어움직일 수 없게 된다.
204800,id-117,33,11,オスが　子どもを　育てる。子育て中は　背中の　トゲの　毒素が強く　濃くなるのだ。
204473,id-99,,3,단단한 집게는 2만 마력의파워를 지녔지만너무 커서 움직임이 둔하다.
223699,id-265,17,5,"Cible favorite des Pokémon Oiseaux,il tente de se protéger avec seclépines venimeuses."
206167,id-225,34,7,"Tiene la costumbre cle compartir su comida contodo el mumdo, sea humano o Pokémon, por loque está constantemente en busca de alimento."
214585,id-861,34,5,"Ses cheveux sont c0mme des muscles filandreuxqu’il peut détacher pour sa8sir ses adversaires,tels des tentacules."
205073,id-131,,3,영리하고 마음 착한 포켓몬.아름다운 소리로 노래 부르며바다 위를 헤엄친다.
205219,id-138,33,9,"Because some Omanyte manage to escape afterbeing restored or are released into the wild bypeople, th:s species is becoming a problem."
225076,id-720,,1,くうかんを　ゆがめる　リングであらゆる　ものを　はなれた　ばしょへとばしてしまう　トラブルメーカー。
212923,id-759,,3,앞발을 바둥바둥 흔들어 몸을지키는 모습은 귀엽지만큰 나무도 꺾을 정도의 위력이 있다.
219831,rec-800-dup-0,34,8,Cerca con furia la luce ri cui si nutredistruggendo ogni cosa al suo passaggiocon i suoi micidiali raggi laser.
208650,id-459,,11,お腹に　実る　アイス　みたいな木の実は　ガラルに　暮らすダルマッカたちの　大好物。
220921,rec-141-dup-0,34,8,
216550,rec-738-dup-1,,3,복부에서 만든 전기를커다란 턱에 집중시켜서고출력의 빔을 쏜다.
210632,id-606,33,1,
219272,rec-829-dup-0,34,9,It whirls around in the wind while singing a joyoussong. This delightful dispoay has charmed rnanyinto raising this Pokémon.
203572,id-34,33,1,
217039,rec-36-dup-0,,8,Timido Pokémon Fata molto raro s vedersi.Scappa e si nasconde non appena avvertela presenza delle persone.
219472,rec-677-dup-0,,1,いつも　むひょうじょうだが　じつはきょうりょくな　サイコパワーがもれださないように　ひっしなのだ
224193,id-393,17,5,"Malgré sa démarche maladroi5e etses pertes d’équilibre, il bombetoujours cièrement le torse."
212192,id-709,33,1,
210413,id-591,33,3,
218499,rec-194-dup-0,34,6,
222336,rec-496-dup-0,23,5,Il court comme sil glissait sur le sol. Il déroutelennemi par ses mouvememts et lassomme duncoup de liane.
215911,rec-241-dup-1,33,8,Il suo latte altamente nutriente contribuisceal sostentaiiiento di persone e Pokémonda tempo immemors.
206018,id-214,,8,"È ghiotto della dolce linfa degli alberi.Perlustra la foresta slla sua ricerca, sfruttandole antenne per percepire gli odori."
223122,id-89,27,4,
211147,id-631,34,7,
207368,id-343,34,8,Scoperto in antiche rovine. Si sposta girandosu se stesso e rimane bilanc9ato dull’estremitàinferiore del suo corpo anche quando dorme.
209080,id-509,33,11,困った　姿を　見るためにひとの　ものを　盗みだす。クスネとは　ライバルなのだ。
222446,rec-19-dup-1,30,12,虽是常见的宝可梦但也不能掉以轻心锋利的门牙甚u至连坚硬的木材都能轻易咬断
221797,rec-804-dup-0,29,1,
209369,id-531,34,9,"This Pokémon has a kind heart. By touching withits fee|ers, Audino can gauge othe5 creatures’feelings and physical conditions."
222915,id-22,17,5,Il a assez d’énerhie pour volertoute la journée avec ses grandesailes. Il frappe de son bec acéré.
208130,id-423,,11,グニャグニャの　体　だけれどかなり　タフ。　軟らかさが衝撃を　分散するのだ。
206783,id-292,,3,날개를 움직이지 않고 날아다닌다.몸속이 텅 비어 있고숨을 쉬지 않는 이상한 포켓몬이다.
213398,id-790,33,8,Il suo esoscheletro è più duro di qualunqvecosa che glu esseri umani conoscano.Cresce assorbendo la luce delle stelle.
221988,rec-97-dup-0,,11,非常に　危険な　ポケモンだが安眠を　求める　人々には救世主と　呼ばれている
209851,id-558,34,12,
224452,id-469,,1,こうそくで　とんで　すれちがったあいての　くびを　いっしゅんでかみちぎる　たたかいかたを　このむ。
225228,id-787,27,8,Sradica gli alberi e li fa roteare maneggiamdoliabilmente. Fa crescere 1a vegetazione per poiassorbirne l’energia.
214864,id-875,,4,無論何時都用冰塊冰鎮著自己怕熱的臉。會把頭頂上的毛垂到海裡釣食物吃。
222710,rec-19-dup-0,26,3,경계심이 매우 강해서 자고 있을 때도귀를 움직여 주변의 소리를 듣고 있다.어디에든 자리를 잡고 둥지를 만든다.
222317,rec-165-dup-0,,1,おくびょうで　すぐに　むれをつくるあしから　でる　えきたいの　においでじぶんの　いばしょを　しらせる
219863,rec-10-dup-0,34,1,
218393,rec-826-dup-0,34,5,Il déploie 5es pouvoirs psychiques pour sonderles alentours sut un rayon pouvant atteindre10 km.
205090,id-131,34,11,
205349,id-144,,9,This Pokémon can control ice at will. Articunois said to lkve in snowy mountains riddledwith permafrost.
207584,id-360,,4,具有集體行動的習性。睡覺的時候會在洞窟中和夥伴們把身體挨在一起。
214826,id-873,,6,"Verwüstet jemand Felder und Berge, vergibt esihm niemals. Es bestraft den Täter, indem es mitseinen kaltem Flügeln einen Schneesturm erzeugt."
205931,id-206,34,12,
222921,id-22,23,11,
204799,id-117,33,9,"It’s tbe males that faise the offspring. WhileSeadra are raising young, the spines on theirbacks secrete thicker and stronger poison."
223877,id-311,17,5,Il absorbe l’énergie des poteauxéiectriques et encourage ses amisavec des pompons cl’étincelles.
212381,id-724,,12,会像射箭那样射出藏在自己翅膀里的箭羽。只要瞄准目标就绝不会射偏。
220442,rec-616-dup-1,33,6,Wird es angegriffen schließt es so fest es kanndas Visier seiner Muschel. Gegen Laujaps erweistsich dieser Schutz allerdings als nutzlos.
222173,rec-161-dup-0,,3,잠잘 때는 교대로 망을 본다.위험을 탐지하면 동료를 깨운다.무리에서 떨어지면 무서워서 자지 못한다.
218319,rec-518-dup-1,,3,언제나 선잠을 자며 꿈을 꾼다.잠에서 깨면 매우 불쾌해하므로가만히 내버려 두자.
222621,rec-18-dup-1,,12,以２马赫的飞行速度来觅食它巨大的9爪子是非常令人惧怕的武器
211666,id-682,34,6,"Von seinem Körper geht ein süßer Duft aus, dereibfach jeden bezaubert. Bei den uornehmenDamen des Adels war es besonders beliebt."
216146,rec-829-dup-1,34,4,隨著微風一邊轉圈圈一邊愉快地唱歌許多人因為喜c歡這可愛的模樣而培育牠
214823,id-873,,3,산과 들을 황폐하게 만들면 용서하지 않는다.차가운 날개로 날아다니며눈보라를 일으켜 응징한다.
214824,id-873,,4,絕不放過破壞山野環境的人。會用冰冷的翅膀四處飛翔，製造出暴風雪來懲罰他們。
218014,rec-95-dup-0,33,4,
211177,id-633,33,7,Muestra cierta tendencia a morder todo lo queencuentra. Se cree que recuerda perfsctwmenteel olor de lo que encuentra delicioso.
211145,id-631,34,5,Il se sert de sa flamme comme d’une langue.Il fait fondre peu à peu l’exos9uelette des Fermitepour se délecter de leur chair.
222716,rec-19-dup-0,31,4,長著２顆大牙碰到什麼都會先咬上一口只看見１隻出沒附近肯定還住著49隻以上
217882,rec-771-dup-0,,1,あたたかい　あさせで　くらすてきに　であうと　たいないきかんをくちから　だして　なぐりつける
206327,id-239,34,7,"No se le da bien acumular electricidad, por lo1ue se cuela en las casas en busda de enchufespara alimentarse."
217038,rec-36-dup-0,,5,Ce Pokémon sapparente à une petite féequi napparaît que rarement devant les bumains.Il court se cacher dès quil ressent une présence.
224613,id-498,17,9,It can deftly dodge its foe’s attackswhile shooting fireballs from its no5e.It roast5 berries before it eats them.
209740,id-553,33,11,砂の　ギャングとも　呼ばれる。強力な　顎で　ぶ厚い鉄板も　たやすく　食いちぎる。
203241,id-5,,12,挥动燃烧着火焰的尾巴，用锋利的爪子撕裂对手。性格十分粗暴。
209005,id-486,34,5,
206907,id-303,34,7,Sus otrora cuernos de acero se han transformafoen grandes fsuces con las que muerde a susenemigos.
217032,rec-36-dup-0,,11,妖精の　仲間で　めったに人前に　出てこない　気配を感じて　すぐに　逃げてしまうようだ
217033,rec-36-dup-0,34,11,１キロ先に　落ちた　針の　音も聞こえるほど　耳が　いいのでふだんは　静かな　ところに　いる
219033,rec-847-dup-0,33,3,
216514,rec-647-dup-0,,5,Lorsquil livre un combat difficile la cornesur son front se remforce et se développece qui éveillerait sa véritable puissance.
203896,id-54,33,6,"Enton leidet permanent unter Kopfschmerzen.Wenn es seine gehwimnisvollrn Kräfte freisetzt,sollen die Schmerzen für eine Weile nachlassen."
210556,id-599,33,6,Seine zwei Teile stehen einander näher alsZwillinge. Eine aridere Kombination würdenicht halb so gut inelnandergreifen.
206666,id-279,34,6,
217288,rec-547-dup-0,33,8,Si diverte a spargere cotone ovunque. Se gli siversa dellacqva addosso diventa troppopesante per muover5i e si arrende.
225151,id-739,27,12,
214745,id-869,34,5,"Quand il est heureux, la crème qu’il produitwvec ses mains devient plus sudréeet plus onctueuse."
220926,rec-141-dup-0,34,12,灭绝的原因尚不明确曾经栖n息在温暖的大海是性格残暴的古代宝可梦
219487,rec-677-dup-0,34,5,Il possède des pouvoirs psychiques si puissantsquil pwut faire valser um catcheur.Malheureusement il a du mal à les contrôler.
212378,id-724,33,8,"Scocca piume dalle sue ali come fossero freccelanciate da un arc0. Una volta presa la mira,rion manca mai il bersaglio."
222339,rec-496-dup-0,24,9,When it gets dirty its leaves cant be used iripbotosynthesis so it always keeps itself clean.
218020,rec-95-dup-0,,3,땅속을 파고들면서 여러 가지단단한 것들을 집어삼켜서튼튼한 몸을 만든다.
222904,id-21,,9,Eats bugs ingrassy areas. Ithaz to flap itsshort wings athigh speed tostay airborne.
209244,id-525,34,4,透過聲音來探測四周。要是惹牠生氣了，牠會連身體方向也不轉就朝你追來。
206234,id-233,,4,利用特別的數據升級了的多邊獸。會自己學習各式各樣的事物來成長。
222663,rec-803-dup-0,30,8,UnUltracreatura che vive in un altro mondo.S9h:gnazza felice quando avvelena gli avversaricon il pungiglione che ha sul capo.
205110,id-132,34,11,
220688,rec-867-dup-0,34,7,Su cuerpo similar a una sombra no debe tocarsebajo ningún conce0to o se visualizarán loshorri1>les recuerdos impregnados en la imagen.
208583,id-453,,3,독을 희석하면 약이 된다.제약 회사의 마스코트가된 후로 인기가 많아졌다.
206515,id-270,,5,"Il recherche toujours les endroits où coulede l’eau pure. S’il reste longtemps sans boite,la feuille sur sa tête commence à faner."
224073,id-367,,11,光の　届かない　深海に　生息。小魚に　似た　尻尾を　光らせて獲物を　誘い出す。
207367,id-343,34,7,Fue hallado en unas ruinas antiguas. Se desplazagirando sobre sí m:smo y se mantiene sobre unaextremidad 9ncluso cuando duerme.
209364,id-531,,4,心地善良的寶可夢。透過用觸角觸碰，就能了解對方的情緒和身體狀況。
203312,id-9,,1,からだが　おもたく　のしかかってあいてを　きぜつさせる。ピンチの　ときは　カラに　かくれる。
221590,rec-691-dup-0,,12,会通过将头上的伞状部分出海面吸收阳光的方式在体内制造龙之能量
206846,id-295,34,6,"Es nutzt nicht nur seine laute Stimme, sondernstößt auch über seine Körperöffnungeh allerleiTöne aus, um mit Artgenossen zu kommunizieren."
218023,rec-95-dup-0,33,7,Al abrirse paso bajo tierra va absorbiendo todoko que encuentra. Eso hace que su cuerpo seaasí de sólido.
209720,id-552,,11,暗闇でも　見える　特殊な両目の　おかげで　真夜中でも迷わず　狩りが　できるのだ。
214814,id-873,,4,翅膀的溫度是零下１８０度。當牠飛過山野時，帶有冷氣的鱗粉會像下雪般地飄落下來。
219992,rec-303-dup-0,,3,얌전한 얼굴로 상대를 방심하게만들고 큰 턱으로 덥석 문다.한번 물면 절대로 놓지 않는다.
219991,rec-435-dup-1,,5,Ce Pokémon qui creuse son terrier dans le solpeut projeter un liquide à lodeur infecte avecle bout de sa queue.
221090,rec-372-dup-0,34,5,Il se prive de jourriture résistant à la faim.On dit que son évolution commence lorsque5es réserves dénergie sont épuisées.
220914,rec-141-dup-0,,3,멸종한 이유는 불명확하다.따듯한 바다에 살고 있던난폭한 고대의 포켓몬이다.
223358,id-189,4,9,"Once it catchesthe wind, it deft­lu controls itscotton-puff sporesgo float, evenaround the world."
210901,id-619,33,12,
216665,rec-563-dup-0,,12,迭失棺象征着国王的财富因此许多古墓里都有它的壁画
223099,id-87,23,7,Está recubierto de un lum:noso pelaje blanco. EstePikémon aumenta su actividad cuando bajan lastemperaturas.
221669,rec-669-dup-0,,7,Acumula el polen de lss flores para confeccionarla tiara que lleva en la cabeza que cuenta conpropiedades curativas.
207333,id-342,,3,거대한 집게를 휘두르는난폭한 포켓몬. 키우는 것이매우 어렵다고 전해진다.
210897,id-619,,7,Un Mienfoo bien entrenado es capaz deprop9nar más de cien golpes por minuto.
204028,id-62,34,8,
207896,id-385,33,6,Durch den Klang einer reinen Singstimme kamn esein Mal al1e 1 000 Jahre für genau sieben Tageaus seinem Schlaf erwachen.
221106,rec-163-dup-0,,1,いつも　いっぽんあしで　たっているあしを　いれかえる　しゅんかんはすばやくて　なかなか　みられない
214844,id-874,,4,每年會有一天，牠們會在特定的時間突然出現，聚集在一起排成一個圈。
207850,id-377,,11,最新の　科学技術を　使い岩の　体を　調べたが　脳や心臓を　見つけられなかった。
220864,rec-769-dup-0,34,3,주로 모래사장에 산다.입안에 손을 넣은 상대를조종하여 자신을 크게 만든다.
217348,rec-846-dup-0,,11,腹一杯で　極端に動きが　鈍った　ところをウッウに　丸飲みに　される
207583,id-360,34,3,
224047,id-357,29,12,栖息在阿罗拉的热带龙脖子里结的那串水果比其他地区的甜得多，是最最棒的。
214903,id-877,,3,아무리 먹어도 금방 배가 고프다.전기로 구운 씨앗을소중히 갖고 다닌다.
208588,id-453,34,8,"Se diluito, il suo velen0 ha proprietà medicinali.È diventato p0polare da quando una casafarmaceutica ne ha fatto la sua mascotte."
214157,id-840,,7,"Habita durante toda su vida en el interior de unamanzana. Finge ser una fruta para protegerse delos P0kémon pájaro, sus enemigos naturales."
219782,rec-236-dup-0,34,7,Su pequeño tamaño no debe ser motivo parasubestimarlo ya que se liará de inmecliato agolpes con cualquier rival que estime oportuno.
207166,id-329,34,6,"Um das Wachstum seiner Flügel zu fördern,schlürft es täglich g5oße Mengen an Bevte,die es zuvor in Magensäure aufgelöst hat."
223046,id-75,,1,やまから　ころがり　おちるときからだの　あちこちが　とれてもきにしない　ごうかいな　せいかく。
211342,id-643,34,1,
211349,id-643,34,9,"According to myth, if people ignore truth andlet themselves become c0nsumed by greed,Reshiram will arrive to burn their kingdoms down."
215908,rec-241-dup-1,33,9,Miltank produces highly nutritious milk so its1>een supoorting the lives of people and otherPokémon since ancient times.
210265,id-579,,5,"S’il ne s’agissait pas d’un poison viooent que seulSymbios peut boire, son curieux fluide pourrait,selon les dires, rendre plus intelligent."
206945,id-305,34,5,"Les Galegon se disputent les territo:res en luttantau corps à corps, conme le montrent les érafluressur leur armure d’acier."
218203,rec-58-dup-0,34,5,Très fidèle il aboie de toutes ses forc4s pourprotéger sob Dresseur dOrigine quand un dangerle guette.
224075,id-367,,12,游泳能力不太强。会挥动尾巴来吸引猎物，在很接近的时候一口咬住。
216691,rec-812-dup-1,34,12,打鼓技巧最高超的那一只会成为首领性情和重视族群的和谐相处
214595,id-862,,5,Il possède une puissance vocale remarquable.On appelle Blocage sa techmique qui consisteà intimider l’ennemi avec son cri guttural.
212393,id-725,,3,틈만 나면 털을 핥아서 정리한다.뱃속에 쌓인 빠진 털에 불을붙여서 불꽃 기술을 사용한다.
222837,id-14,23,3,
221619,rec-813-dup-1,34,8,Quando si prepara a lottare la punta del nasoe i xuscinetti sotto le zampe irradiano calore.
221615,rec-813-dup-1,34,5,Quand il est prêt à se battre la partiequi surmonte son museau ainsi wue les coussinetsde ses pattes postérieures émettent de la chaleur.
223103,id-87,29,12,能以８节的速度在海里游动，并搜寻能当做猎物的宝可梦。特别喜欢吃弱丁鱼。
210599,id-601,33,9,"From its spikes, it launches powerful blasts ogelectricity. Its red core contains an enormousamount of energy."
210596,id-601,33,6,Die Stachelspitzen können starke Elektrizitätabfeuern. Im roten Zentralbestandteil sindUnmengen von Energie gespeichert.
205939,id-208,33,9,"It is said that if an Onix lives for over 100 years,its c0mppsition changes to become diamond-like."
206487,id-263,34,7,El Zigzagoon de Galar desarrolló este sspectotras adaptarse a otras regiones. Muestra una granhabilkdad a la hora de encontrar cosas.
218986,rec-691-dup-1,33,11,
214255,id-845,33,5,"Il est assez puissant pour terrasser un ennemicl’un s4ul coup, mais il est tellement nigaudqu’il oublie contre qui il se bat."
212411,id-725,,12,如果在得到火斑喵的信任前就想抚摸它的话，要小心它用尖锐的爪子抓你。
205072,id-131,,1,かしこく　こころやさしい　ポケモン。きれいな　うたごえを　ひびかせながらうみのうえを　およいで　いく。
204554,id-105,,4,克服了傷痛後進化得更強更壯。會把骨頭當作武器，勇敢地與敵人交鋒。
223555,id-234,,3,뿔을 응시하고 있으면 원의중심에 빨려 들어가는 것 같은이상한 기분이 든다.
224572,id-493,12,9,"It is described in myth0logy asthe Pokémon that shaped theuniverse with its 1,000 arms."
211933,id-696,,3,되살아난 고대의 포켓몬이다.거칠고 제멋대로인 기질을 지녔다.큰 턱으로 뭐든지 깨물어 부순다.
211957,id-697,,7,"Este Pokémon vivió hace xien millones de años.A pesar de su ferocidad, posee una firmeza y unapresencia dignas de un rey."
211129,id-630,34,9,
217979,rec-375-dup-0,34,1,
222172,rec-161-dup-0,13,9,
209211,id-521,34,12,
224192,id-393,,9,"Because it is very proud, it hatesaccepting food from people. Itstbick down guards it from cold."
218806,rec-695-dup-0,33,4,在如今已滅亡的沙漠之國曾經是人g們珍視的對象和財寶一起來到了伽勒爾地區
204006,id-61,,6,"Quaputzi schwitzt glitschigen Schleim, dank demes lejcht der Umklammerung eines Feindesentkommen kann."
203317,id-9,33,7,"Para acabar con su enemigo, lo aplasta con elpeso de su cuerpo. En momentos de apuro, seescojde en ei caparazón."
216150,rec-829-dup-1,33,12,当它把单脚扎进地e面里并且沐浴充分的阳光花瓣就i会染上鲜艳的颜色
203522,id-31,34,1,
218620,rec-704-dup-0,33,7,Su cuerpo se compone casi exclusivamente deagua por lo que se debilitaría si se de5hidratase.Es eo Pokémon de tipo Dragón más débil.
218392,rec-826-dup-0,,3,똑똑한 포켓몬으로 유명하다.커다란 두뇌는 강력한사이코 파워를 가졌다는 증거다.
214155,id-840,33,5,"Il vit toujours dans sa pomme. S’il croiseun Pokém0n oiseau, son prédateur naturel, il sefajt passer pour un simple fruit pour se protéger."
212803,id-753,34,3,낮에는 햇빛을 받으며새근새근 잔다. 한밤중에잠에서 깨어 활동을 시작한다.
212200,id-709,,11,森の　木を　伐り倒す　人間を食べると　恐れられているが　森で暮らす　ポケモンたちには　優しい。
217983,rec-375-dup-0,33,5,Composé de deux Terhal réunis par lattractionmagnétique ce Pokémon a vu sa pui5sancepsycnique doubler grâce aux deux cerveaux.
224557,id-491,17,5,"Menacé, ce Pokémon se protègeen créant des cauchsmars danzl’esprit de ses ennemis."
203246,id-5,,6,"Steigert es sich in einen Kampf hinein, spuckt esFlammen, die all4s in seiner Umgebungniederbrennen."
212315,id-715,,5,Il n’hésite pas à anéantir ses pauvres adversairesqui se retrouvent sans cléfense dans les ténèbres.Il est d’une nature cruelle et impulsive.
205916,id-206,33,6,"Da es kleibe Flügel hat, behaupten mancgeWissenschaftler, dass es vor langer Zeit fliegenkonnte."
222999,id-57,,7,S0lo se calma cuando nadie está cerca. Llegar a verese momento es realmente difícil.
212391,id-724,,12,只要０.１秒就可以在翅膀的藤蔓上搭好箭羽、射向敌人，并在敌人发现前贯穿其要害。
209208,id-521,34,8,È tanto intelligente quanto orgoglioso.Diventare Allenatori di questo Pokémon equivalea guada9narsi il rjspetto e l’ammirazione di tutti.
205928,id-206,34,8,
205922,id-206,,1,めいろのような　すあなが　すみか。つちの　においで　じぶんの　ばしょがわかるので　ぜったいに　まよわない。
224956,id-665,23,9,
222719,rec-19-dup-0,32,1,
207170,id-329,,11,ハネを　成長　させるために毎日　大量の　獲物を消化液で　溶かして　すする。
