tid,species,version,language,flavor_text
204405,id-93,34,5,"On dit que lorsque quelqu’uri a l’impressiond’être surve8llé dans le noir, c’est sûrementqu’un Spectrum se trouve dans les parages."
207411,id-345,34,12,
206798,id-293,,8,"Il suo grido, che può superare i 100 decibel,fa venire mal di testa per tvtta la giornataa chiunque si trovi nelle vicinanze."
215505,rec-808-dup-0,33,3,
214447,id-854,34,7,"La taza de té donde se hospeda forma parte deuna antigua y valiosa vaj:lla, de la que circulannumerowas falsificaciones."
220735,rec-728-dup-0,34,7,
210561,id-599,33,12,２个身体比双胞胎还要亲近。要是换成别的齿轮儿。就没有办法好好咬合。
217854,rec-7-dup-0,,3,위험해지면 등껍질에 손발을감추고 몸을 지키면서입에서 물을 내뿜는다.
207158,id-329,33,8,Fa vibrare velocemente le ali generqndoonde ultrasoniche che 0rovocano deiforti mal di testa.
224069,id-367,,3,빛이 닿지 않는 심해에 서식한다.작은 생선처럼 생긴 꼬리를빛내어 먹잇감을 유인한다.
224126,id-383,23,8,
217279,rec-547-dup-0,33,4,喜歡到處撒棉花搗蛋沾水之就會變重而動不得只能聽天由命
205380,id-146,33,11,
208206,id-428,34,6,"Ist die heiße Jahreszeit vorbei, wechselt sein Fellzu eimer Wollfaser, die viel Luft umscbließt.So schützt sich Schlapor gegen die Kälte."
207757,id-373,33,7,"Un Pokémon poco común que, tras desearcin tosas sus fuerzas poder volar, consiguióun cuerpo alado al evolucionar."
209489,id-537,34,9,"This Pokémon is popular anohg the elderly,who say the vibrations of its lumps are greatfor massages."
206328,id-239,34,8,"Non è ancora abile nell’immagazzinare elettricità.Si intrufola nelle abitazkoni in cerca di presedi corrente, che sfrutta per nutrirsi."
218016,rec-95-dup-0,33,8,Scava nel terreno assorbend0 gli oggetti più duriper irtobustire il suo corpo.
211280,id-638,,11,テラキオン　ビリジオンと　ともにイッシュ地方の　ポケモンを　守り人と　戦った　伝説がある。
212739,id-750,33,9,Mud that hardens around a Mudsdale’s legsse6s harder than stone. It’s so hard that i6 allowsthis Pokémon to scrap a truck with a single kick.
207357,id-343,,7,Se mueve girando una única extremidad. Se hanavistado algunos ejemplares capaces de hacerlocabeza abajo.
207354,id-343,33,4,
221236,rec-468-dup-0,,12,不会出现在发生争端和纷乱的地方近来几乎见j不到它的身影
211143,id-631,,3,불꽃을 혀처럼 사용한다.아이앤트의 단단한 외골격을조금씩 녹여 먹어 치운다.
223872,id-308,23,6,"Es weicht Attzcken elegant tänzerisch aus,um anschließend eine verheerende Attacke ajsderselben Bewegung heraus zu lancieren."
224721,id-516,23,7,"Cuando lanza agua a alta presión c0n su cola, puedeincluso res9uebrajar una pared de cemento."
211750,id-686,34,11,敵に　発光体の　点滅を浴びせて　戦意を　なくしてしまう。その　隙に　逃げ出すのだ。
208423,id-445,,3,지상에서도 움직임이 빠르다.설산에서는 체온이 떨어지기 전에먹이를 잡아 거처로 돌아간다.
210849,id-616,34,9,"It has a strange phy5iology that responds toelectricity. Whem together with Karrablast,Shelmet evolves for some reason."
217583,rec-614-dup-0,34,9,It swims energetically through frigid seas.When it gets tired lt freeze5 the seawaterwith its breath so it can rest on the ice.
224614,id-498,23,1,
204399,id-93,33,9,"Its tongue is made of gas. If lic1<ed, i6s victimstarts shaking constantly until deatheventually comes."
206835,id-295,33,5,"Autrefois, l’Homme se servait du cri puissantde ce Pol<émon pour commun'lquer d’une villeà l’autre sur de longues distances."
223236,id-158,,6,"Es ist klein, aber zäh und stark. Es zögert nicht,jederi anzugreifen, wenn dieser ihm zu nahe kommt."
215497,rec-808-dup-0,,8,Fonde ii metallo per cibarsene e lo fa circolarenel suo corpo per produrre energia.
221786,rec-794-dup-0,,3,다른 세계에서 나타난 UB이다.스스로 몸을 보여주는 행동이자랑인지 위협인지 알 수 없다.
213786,id-821,34,6,Mit seinem kleinen Körper kann es flink fliegenund so mithilfe von rrickreichen Taktiken größereGegner überlisten.
213380,id-789,33,11,別の　宇宙から　やって来た。ガスの　体は　とても　軽くそよ風にも　流れてしまうほどだ。
220441,rec-616-dup-1,33,8,
216548,rec-738-dup-1,34,3,예비 배터리로서 전지충이를안고 날면 높은 전력의전자빔을 연사할 수 있다.
216546,rec-738-dup-1,,1,おなかで　はつでんした　でんきをおおきな　アゴで　しゅうそくさせてだいしゅつりょくの　ビームを　うつ
219586,rec-776-dup-0,33,12,背上的甲壳上敷了炸药会用大爆炸去回来攻击自己的r敌人
210467,id-593,34,7,"Las noches de luna llrna, bancos enteros deJellicent emergen a la superficie y aguardan lallegada de alguna presa incauta."
219606,rec-42-dup-1,33,6,Das Blut anderer Lebeweseh ist seine Leibspeise.Man sagt dasw es das abgesaugte Blut manchmalmit hungrigen Artgenossen teilt.
220302,rec-835-dup-0,34,5,Ce glouton assiste les humains dans leur tragailen échange de friandises. Il cou4t sans arrêtle corps enveloppé délectricité.
210261,id-579,33,12,
203514,id-31,33,4,比起攻擊更擅於防守。會用像鎧甲般的堅硬鱗片保護孩子不被任何攻擊傷害。
210842,id-616,,1,でんき　エネルギーに　はんのうするふしぎな　たいしつ。　カブルモとともに　いると　なぜか　しんかする。
215841,rec-225-dup-0,34,1,じぶんの　エサを　ひとや　ポケモンにわける　しゅうせいが　あるためいつも　エサを　さがしまわっている
205914,id-206,,4,因為牠擁有小小的翅膀，有些學者主張很久以前牠曾是在天上飛的。
222316,rec-165-dup-0,28,8,Secerne un fluido aromatico per cojunicare coni suoi slmili. Quando è arrabbiato lodore si fapungente.
214214,id-843,,4,一邊挖洞一邊把吃掉的沙子儲存在頸部的囊裡。囊裡面能裝進８公斤的沙子。
218783,rec-713-dup-0,33,7,Surca las aguas de mares gélidos situados a qltaslat:tudes llevando a varios Bergmite en el lomo yconfundiéndose entre los icebergs.
212195,id-709,33,5,Les bûxherons qui viennent couper des arbresen forêt omt peur d’être dévorés par Desséliande.Il est gentil avec les Pokémon habitant les bois.
214812,id-873,,1,はねの　おんどは　マイナス１８０ど。れいきを　こめた　りんぷんを　ゆきのように　ふりまき　のやまを　とぶ。
210673,id-608,33,3,누군가가 죽기 직전에나타나기 때문에 사신의 사자로여겨져 두려움의 대상이 되었다.
204485,id-99,34,5,"Sa pince gigantesque possède une puissancedestructrice phénoménale, mai5 hors combat,son poids devient un handicap."
204481,id-99,,12,虽然坚硬的钳子有着１万马力的力量，但因为太大而行动迟缓。
211282,id-638,,1,うまれながら　リーダーの　ふうかくをみにつける。　きょうぼうな　あいてもコバルオンの　まえでは　おとなしい。
204488,id-99,34,8,"La sua chela più grande ha una potenzadistruttiva fenomenale, ma fuori dalla lottagli è d’impiccio per via del pesl."
218287,rec-72-dup-1,,4,游泳的力道並不強會漂浮在淺海的水面上尋找獵物
213790,id-821,,11,小さい　体で　機敏に　飛んで隙を　突く　戦法で　体の大きな　相手を　手玉に取る。
207466,id-348,34,6,"Es lebt an Land, kann aber auch gut schwimmen.Zum Jagsn taucht es ins Meer uncl erledigt Beutemit seinen scharfen Klauen."
209147,id-518,34,7,"Siempre está soñando o adormecido. Se pone dejuy mal hvmor al despertar, por lo que es mejorno perturbarlo."
210479,id-595,33,9,
214262,id-845,34,1,
203693,id-40,33,3,숨을 들이쉬면 쉴수록 몸이 부푼다.기분이 나빠지면 몸을 커다랗게부풀려 상대에게 위압을 가한다.
215474,rec-824-dup-1,,12,总是孜孜不倦地收c集情报所以头脑相当地聪明但力量方面就差了一些
206658,id-279,33,8,
213184,id-772,,4,以神話中的寶可夢為原型所創造出的寶可夢，被戴上了抑制力量失控的面罩。
206155,id-225,33,5,Il transporte de la nourriture toute la journée.Ses réserves de vivres auraient sauvé la viede n0mbreuses personnes en péril.
203802,id-45,,1,はなびらが　おおきいほど　たくさんかふんを　だすが　あたまがおもたくて　つかれてしまうという。
208207,id-428,34,7,"Cuando acaba la estación más tórrida, le creceun nuevo pekaje muy mullido que l9 prepara parael frío."
217168,rec-208-dup-0,33,4,據說大岩蛇活到了１００年以上身體的成分就會變得如同鑽石一般
221943,rec-101-dup-0,32,4,
205218,id-138,33,8,Quest0 Pokémon si sta rivelando un problemaperché a volte fugge o viene liberato dopoessere stato rigenerato.
217484,rec-290-dup-0,,8,Gli capita di restare anche più di dieci anni5ottoterra. Assorbe le sostanze nutritivedalle radici degli alberi.
219830,rec-800-dup-0,34,7,Con sus rayos láser desrruye todo a su paso enbusca de luz pzra sustentarse.
225230,id-787,27,11,大木を　引き抜き　ブンブン振り回す。　草木を　茂らせてそのエネルギーを　吸収する。
224764,id-580,17,5,"Un Pokémon Oiseau doué p0ur la plongée.Il hage sous l’eau à la recherche desphaigne, son plat préféré."
220685,rec-867-dup-0,34,12,绝对不能触摸它影子y般的身体否则它会让你看到印刻在它画中的恐怖记忆
218785,rec-713-dup-0,34,1,
208811,id-467,,12,由于栖息在火山口，因此身体逐渐变得像火山一样，还长着类似岩浆库的器官。
205162,id-135,34,1,
219060,rec-520-dup-0,33,5,Il vole re1ativement vite et peut parcourirdes kilomètres sans oublier où se trovventson Dresseur et son nid.
222102,rec-316-dup-1,,9,There is nothing its stomach camt digest.While it is digesting vile overpoweringgases are expelled.
207753,id-373,33,3,하늘을 나는 것을 꿈꿔온 결과날개를 가진 몸으로 진화하는 데성공한 희귀한 포켓몬.
207768,id-373,,8,"È generalmente di buon umore e traboccantedi gioia per essere riuscito a volare, ma se siarrabbia diventa una furia incontrollabile."
203326,id-9,,6,"Die Wassersalven, die es mit den Wasserdüsenin seinem Panzer abfeuert, durchdringen sogard9cke Stahlwände."
209963,id-564,34,3,
211555,id-677,,5,"Sous son masque inexpressif, il est en faitconstamment en train e’essayer de contenirses puissants pouvoirs psychiques."
221814,rec-166-dup-0,,9,The spot patterns on its back grow larger or smallerdepending on the number of stars in the nlght sky.
203573,id-34,,3,날뛰기 시작하면 손쓸 수 없게 되지만긴 세월 함께 지낸 니드퀸앞에서는 온순해진다.
211735,id-686,33,5,
206419,id-247,,9,"Even sealed in its shell, it can move freely.Hard and fast, it has outstandingdestructive power."
211799,id-689,33,9,Seven Binacle come together to form oneBarharacle. The Binacle tbat serves as the headgives orders to those serving as the limbs.
207161,id-329,,12,２根翅膀高速振动产生的超音波会引起剧烈的头痛。
213018,id-764,33,8,
218404,rec-826-dup-0,34,9,It emits psychic energy to observe amd studywhats around it—and whsts around it caninclude things over six miles away.
225002,id-670,23,9,It flutters around fields of fl0wers and cares forflowers that are starting to wilt. It drawsout the hidden power of flowers to battle.
222658,rec-803-dup-0,,1,いせかいに　すむ　ウルトラビーストあたまの　どくばりから　どくえきをあいてに　かけて　ケラケラ　わらう
216549,rec-738-dup-1,34,8,Quando vola portando con sé vn Charjabugcome batteroa di riserva può sparare una rafficadi potentissimi raggi elettromagnetici.
206890,id-302,,11,宝石の　結晶を　食べる。暗闇の　中では　両目が宝石の　輝きを　放つ。
215869,rec-571-dup-1,34,8,Gli Allenatori tristi e soli chiedono a Zoroarkdi m0strare loro dei miraggi che allsvinola loro solitudine.
206318,id-239,33,8,Quando si sta per scatenare vna tempe5ta perdeil controllo. Si fa prendere dall’agitazionese sente il rombo dei tuoni.
211336,id-643,33,6,Durch Feuerschübe aus seinem Schweif fliegt esschnell wie ein Düsenjet dvrch die Lüfte. SeimeFlammen sollen die Welt einäschern können.
205973,id-212,,3,커다란 집게의 무게는체중의 4분의 1이다. 내리치면암석도 일격에 산산조각이 난다.
209736,id-553,,6,Es wird auch als „Tyrann der Wüste“ bezeichnet.Mit seinem mächtigen Kiefer durchbeißt es selbstdicke Eisenplstten mit Leichtigkeit.
208950,id-477,,11,狙った　相手を　腹の口で丸飲み。　魂だけを　食い肉体は　吐き出し　去っていく。
224132,id-384,,6,Es lebt in der Ozonschicht hoch über den Wolkenund kann voiii Boden aus nicht gesehen werden.
221524,rec-646-dup-0,33,4,雖然擁有凌駕於萊希拉姆和捷克羅姆之上的力量但那力量已極低溫冷氣封住了
205169,id-135,34,9,"It accumulates negative iojs in the atmosphere tobla5t out 10,000-volt lightning bolts."
205141,id-134,,12,当水伊布开始微微颤动它全身上下的鳍，就表示几个小时之后要下雨了。
206523,id-270,34,3,
219981,rec-435-dup-1,,8,Il fluido che spruzza dalla punta della codaha un odore tremendo. Costeuisce la tanascavando un buco nel terreno.
213618,id-813,,8,"Quando corre, la sua temperatura corporea salepervadendolo di un’energia infuocata cbe glipermette di scatenare la sua vera potenza."
214865,id-875,34,5,"Ne supportarit pas la chaleur, il se rafraîch8ttoujours la tête avec de la glace.Il pêche de quoi se nourrir à l’aide de son cheveu."
209361,id-531,,12,拥有敏锐的听觉。连２公里以外小石头滚动的声音都能听到。
208510,id-449,,11,おもに　昼間に　活動する。砂漠の夜は　冷えるので　砂の奥深くに　潜って　眠る。
225271,id-795,,12,危险究极异兽中的一种。被人目击到以骇人的速度在大地狂奔的样子。
225270,id-795,27,11,
210483,id-595,,3,다른 포켓몬에게 달라붙어정전기를 빨아들인다. 멍파치의엉덩이에 자주 달라붙어 있다.
221172,rec-662-dup-0,,4,地盤意識很強且性情好戰火箭雀彼此之間也h會為了爭奪覓食的地方而戰鬥
224152,id-388,12,9,"It lives along water in for4sts. Inthe daytime, it leaves the forestt0 sunbathe its treed shell."
206954,id-306,33,4,在撞擊敵人的同時，會用能刺穿厚鐵板的銳利尖角給予對方致命的一擊。
210039,id-568,33,9,"Its favorite places are unsanitary ones. If youleave trash lying around, y0u could even finclone of these Pokémon living in your room."
210687,id-608,34,7,"Se oculta en entornos urbanos haciéndose pasarpor una lámpara corriente. Si se topa con alg7ienm0ribundo, lo sigue en silencio."
214543,id-859,,3,민가에 숨어들어 도둑질을하고 속상해하는 사람의마이너스 에너지도 얻는다.
210253,id-579,,3,초능력을 사용하는 것보다는자랑거리인 팔을 휘둘러서때려눕히는 것을 선호한다.
206851,id-295,,12,它不仅仅会大喊大叫。为了和伙伴相互传情达意，它会从身体的洞里发出各种各样的音色。
214153,id-840,,3,평생을 사과 속에서 지내며천적인 새포켓몬과 마주치면사과인 척을 해서 몸을 지킨다.
209623,id-547,,3,햇빛을 받을수록 솜이부풀어 오른다. 너무 부풀면찢어져 주위로 흩어진다.
207202,id-333,,1,わたぐもに　みえるため　てきからみつかりにくい。　せだいを　かさねるうち　つばさが　しろくなったという。
214534,id-859,,4,會用鼻子吸收人類或寶可夢情緒糟糕時產生的負能量，來為自己補充活力。
220002,rec-303-dup-0,34,9,It chomps with its gaping mouth. Its huge jaws areactually steel h0rns that haye been transformed.
215952,rec-551-dup-0,,7,En las frías noches del desierto se oculta a muchaprofundidad en la arena y cluerme hasta que saleel sol.
203525,id-31,34,5,"Ce Pokémon calme les petit5 de son espèceen les plaçant entre ses épimes dorsales.Dans ce cas, elles ne libèrent pas de poison."
209178,id-520,,8,"È abbastanza veloce nel volo. Per quanto lontanosi spinga, riesce sempre a ritrovare il proprioriido e il proprio Allenatore."
211288,id-638,34,8,È un leader nato. Al suo cospetto anchei Ppkémon più feroci assumono uriatteggiamento reverenziale.
211561,id-677,,12,虽然一直都面无表情，但是那其实是因为它在努力不让自己强力的精神力量漏出。
220494,rec-196-dup-0,33,7,Basándose en las corrientes de aire preclicecosa5 como el tiempo atmosférico o la próximaacción del enemigo.
210730,id-610,,11,大きな　キバを　打ちつけ　仲間とじゃれあう。　キバは　折れてもすぐ　生えてくるから　へっちゃらだ。
223086,id-86,,1,ひょうざんで　くらす　ポケモン。あたまの　とがった　でっぱりでこおりを　わって　うみを　およぐ。
225082,id-720,,9,"This troublemaker sends anytgingand everything to faraway placesusing its loop, which can warp space."
216926,rec-361-dup-1,33,6,Erscheint es mitten in der Nacht so sagt mansteht starjer Schneefall bevor. Es eenährt sichvon Eis und Schnee.
221622,rec-813-dup-1,,5,Il court pour augmenter sa température et fairecircvler lénergie incandescente dans son corps.Il peut ainsi déployer toute sa puissance.
210187,id-575,34,7,"Sus poderes psíqu:cos alcanzan su apogeo en laanoches estrelladas, aunque su posible vínculo conel espacio está envuelto en misterio."
211137,id-631,33,7,"Ansorbe aire por el onficio de la cola paraprender las llamas que expulsa. Si la aberturase obstruye, enferma."
209279,id-527,33,9,"While inside z cave, if you look up and see lotsof heart-shaped mwrks lining the walls, it’sevidence that Woobat live there."
223625,id-253,23,11,
218117,rec-690-dup-0,,7,Su aspecto de alga podrida le permite ocultarseentre l0s restos que flotan a la deriva y pasardesapercibido ante sus enemigos.
208951,id-477,,12,用腹部的嘴将猎物整个吞下。只会吃掉对方的魂魄，离去时会把肉体吐出来。
211742,id-686,34,1,てきに　はっこうたいの　てんめつをあびせて　せんいを　なくしてしまう。その　すきに　にげだすのだ。
208123,id-423,,3,흐물흐물한 몸이지만제법 튼튼하다. 부드러워서충격을 분산시킨다.
218788,rec-713-dup-0,,11,何匹もの　カチコールを　背中に乗せて　高緯度の　冷たい　海を氷山に　紛れて　泳ぐ
203271,id-6,,12,能用翅膀飞到距地面１４００米的高度。会吐出高温火焰。
217356,rec-826-dup-1,33,7,Este Pokémon es conocido por su inteli9encia.El gran tamaño de su cerebri es un indicio dela magnitud de sus poderes psíquicos.
214433,id-854,,3,차게 식은 남은 홍차에외로움을 타는 영혼이 깃들어포켓몬이 되었다고 전해진다.
204196,id-77,33,6,"Nach der Geburt fällt ihm das Laufen schwer.Doe Wettrennen, die es sjch mit seinen Freundenliefert, stärken jedoch seine Beinmuskulatur."
206488,id-263,34,8,Lo Zigzagoon di Galar ha assunto questo aspettonegli altri territori in cui si è diffuso. Ri5rovaregli oggetti dmarriti è la sua specialità.
204560,id-105,,11,悲しみを　乗りこえて　たくましく進化した。　骨を　武器にして勇敢に　敵と　渡り合う。
204562,id-105,,1,しんかして　かぶっていた　ははおやのホネが　いったいかして　そのうえきょうぼうな　せいかくに　かわった。
219608,rec-42-dup-1,,1,ちいさな　あしで　きように　あるくねている　エモノに　しのびよりキバを　つきたて　ちを　すするのだ
211320,id-640,33,11,
220734,rec-728-dup-0,34,9,If Popplio want to create big powerful balloonsrhey must be persistent. It takes claily practice forthese Pokémon to develop their skills.
219477,rec-677-dup-0,34,1,
203512,id-31,,1,せめるよりも　まもるほうが　とくい。よろいのような　ウロコで　いかなるこうげきからも　こどもを　まもる。
223985,id-335,23,3,
220927,rec-141-dup-0,33,4,
203692,id-40,33,1,いきを　すえば　すうほど　ふくらむ。ふきげんになると　からだを　おおきくふくらませて　あいてを　いあつする。
218744,rec-458-dup-0,,11,テッポウオの　群れに　混ざって泳ぐ　敵に　襲われると群れと　いっしょに　戦うよ
214914,id-878,,4,能輕鬆舉起重達５噸的貨物的大力士寶可夢。會用鼻子挖地。
209833,id-558,33,3,
206237,id-233,,7,Se trata de una versión mejorada de Porygonmediante un software especial. Tiene capacidadde aprendizaje autónomo.
223081,id-85,23,11,
206800,id-293,,11,鳴き声は　１００デシベルを　超える音量。　近くで　鳴かれると一日　頭痛が　治まらない。
219861,rec-10-dup-0,34,4,別看牠的腳很短因為是吸盤所以無論是斜坡還是牆壁g都能輕鬆前進
208579,id-453,33,9,"It makes frightening noises with its poison-filledcheek sacs. When ooponents flinch, Croagunkhits them with a poison jab."
208494,id-449,,4,張大嘴巴移動，連同沙子把對手一整個吞下去。會從鼻孔把沙子噴出來丟掉。
222572,rec-255-dup-0,,5,Ses câlins réchauffent car il renfermeune fournaise. Il envoie des b9ules defeu à 1 000 °C.
207764,id-373,,4,沉浸在翱翔天空的喜悅時，心情會非常好。但性情粗暴，一旦被激怒就會一發不可收拾。
205374,id-146,,4,每當牠拍動翅膀，羽毛就會閃爍出美麗的赤紅火焰。是傳說的鳥寶可夢之一。
217203,rec-79-dup-0,34,11,しっぽを　水に　浸すと　甘味がにじみ出るので　それを　エサにポケモンを　おびき寄せ　釣りあげる
219376,rec-128-dup-0,34,9,The Tauros of the Galar region are volatile innature wnd they wont allow people yo ride ontheir backs.
218402,rec-826-dup-0,34,6,Indem es Psycho-Kräfte avsstrahlt erfasst es dieUmgebung. Seine Observation vmfasst dabeieinen beeindruckenden Umkreis von 10 km.
205151,id-134,34,12,
209240,id-525,33,11,オレンジ色の　結晶が光りだしたら　気をつけろ。エネルギーを　撃ちだしてくるぞ。
205909,id-202,34,9,
219836,rec-5-dup-0,34,5,Sil sexcite pendant un combat il crachede grandes flammes brûlanr tout ce quise trouve aux alentours.
216538,rec-738-dup-1,33,9,It builds up electricity in its abdonen focuses itthrough its jaws and then fires the electncity offin concentrated beams.
207603,id-361,34,3,추운 땅에서만 살 수 있다.영하 2o0도의 환경에서도건강하게 뛰어다닌다.
210688,id-608,34,8,
211397,id-647,33,7,"Aprendió a luchar bajo la tutela de Cobalion,Terrakion y Vir8zion. Ahora recorre el mundoperfeccionanclo su destreza."
212340,id-722,,11,飛行しながら　切れ味　鋭い羽根を　飛ばし　近距離では強烈な　キックを　叩きこむ。
217152,rec-208-dup-0,34,6,Man glaubt dass sich sein Körper aufgrund desSchluclcens von eisenhaltiger Erde verwandelthabe.
214570,id-860,,11,悪知恵を　使って　夜の　森に誘い込もうとする。　農作物を育てる　力を　もつらしい。
223310,id-168,,4,也有地方會使用阿利多斯的絲來織布。結實的布料廣受好評。
214577,id-861,33,7,"Cuando enrolla sus cabellos por todo ek cuerpo,aimenta su potencia muscular. Posee una fuerzacapaz de someter a Machamp."
220436,rec-616-dup-1,,1,てきに　おそわれると　カラの　フタをがっちり　しめて　みを　まもるただし　カブルモには　あけられる
217827,rec-385-dup-0,33,1,
215274,id-896,33,4,
217057,rec-450-dup-0,34,7,Puede ser muy agresivo cuando se enfada.Provoca auténticas tempestsdes de arena alexpeler la qve ha tragado.
210592,id-601,,1,トゲの　さきから　つよい　でんげきをはっしゃ。　あかいコアに　たくさんのエネルギーを　たくわえている。
219870,rec-10-dup-0,33,12,会从头部的触角中释放出强烈的臭气以此来赶走敌人保护己
214750,id-869,34,11,
215189,id-891,,9,"If Kubfu pulls the long white hair on its head,its f'lghting spirit heightens and power wells upfrom the depths of its belly."
218244,rec-214-dup-0,33,5,Il raffole de la sève sucrée dont il dé6ectele parfum à laide de ses deux antennesjorsquil parcourt la forêt.
220500,rec-196-dup-0,34,1,
207582,id-360,,1,むれで　こうどうする　しゅうせい。ねむる　ときは　どうくつの　なかでなかまたちと　からだを　よせあう。
208792,id-467,,1,おおきく　いきを　すいこむと　はらのなかの　ほのおが　いきおいを　ましてせっし２０００どに　たっする。
205487,id-164,34,7,"Cuando necesita pensar, gira 1a cabeza 180°para agudizar su cwpacidad intelectual."
220507,rec-196-dup-0,,11,空気の　流れを　読みとることでこれからの　天気や　相手の動きなどを　すべて　当ててしまう
209624,id-547,,4,每當沐浴陽光，身上的棉花就會膨脹。如果膨脹過了頭，牠就會把棉花扯開到處亂撒。
206789,id-292,34,9,
206909,id-303,34,9,It chomps with its gaping mouth. Itw huge jaws areadtually steel horns that have been transformed.
215481,rec-824-dup-1,33,7,Siempre está recopilando información por loque e5 muy inteligente aunq7e su fuerza dejabastante que desear.
