tid,species,version,language,flavor_text
218475,rec-836-dup-0,,12,电力增强了它的脚力当以最高速度奔跑时速可以轻易超过９０公里
222488,rec-150-dup-1,,8,Il suo DNA è quasi u9uale a quello di Mew.Ciò nonostante sono agli antipodi perdimensioni e carattere.
217332,rec-846-dup-0,34,6,Seine Bewegungsfreiheit ist stark eingeschränktwenn es vollgefressen ist. So wircl es zu leichterBeute für Urgl das es im Ganzen verschlimgt.
208876,id-473,33,6,"Sie sind schon auf 10 000 Jahre altenWandmalereien abgebildet. Es gab Ze9ten,in denen man sie für ausgestorben hielt."
208877,id-473,,7,Aparece representado en pinturas rupestres dehace 10 000 años. Hubo un tiempo en el que selo consideró extinto.
220289,rec-52-dup-1,34,12,为了不弄脏额头上的金币会常常洗脸伽勒尔o的喵喵关系不好
218982,rec-691-dup-1,34,11,頭の　笠を　海面から　出し太陽の　光を　浴びることでドラゴンエネルギーを　作るのだ
210994,id-624,,4,揮舞銳利的刀刃將敵人逼向絕境。會用河灘的石頭來精心保養刀刃。
217441,rec-361-dup-0,33,12,据说半夜出现的雪w童子会带来s大雪靠吃雪和冰为生
209209,id-521,34,9,This Pokémon is intelligent and intensely proud.People will sit up ancl take notice lf you becomethe Trainer of one.
206527,id-270,34,7,El excesivo tamaño y peso de la hoja que tieneen la ca1>eza ha propiciado que viva fbtando enel agua.
204794,id-117,33,4,
212489,id-729,34,9,"On nights when the sea is calm, Broonne danc3with one another to the singing of the Primarinathat’s leading them."
220510,rec-196-dup-0,,9,By reading air currents it can predict things sucbas the weather or its foes next move.
204728,id-113,34,8,
205983,id-212,,3,몸은 가늘지만 공격력은무시무시하다. 몸의 근육도금속으로 되어 있다.
208417,id-445,,7,Habita en montañas de 9rigen volcánico. Vuelatan rápido como un avión a reacción en busca depresas.
213927,id-828,34,7,Un Pokémon ágil y de afiladas garras que sealimenta de huevos y comicla robados. LosBoltund son su enemig0 natural.
214645,id-864,34,5,
223441,id-204,,7,Le gusta engrosar su coraza añadiendo correzas deárbol. El aumento de peso no le molesta.
221942,rec-101-dup-0,23,7,Explotan a la mínima. Por eso se les tiene muchomiedo. Est0s Pokémon feciben el mote de Bomba Ball.
207188,id-330,34,8,"Viene chiamato anche “spirito del deserto”,poiché il suono del suo battoto d’alu ricordaun bellissimo canto di donna."
219061,rec-520-dup-0,34,9,
217037,rec-36-dup-0,,4,妖精的一種極少出現在人類面前一感覺到有人會立刻逃走
222567,rec-252-dup-0,,6,Es klettert blitzschnell Wände empor. Mit seinemSchwanz misst es die Luftfejchtigkeit um dasWetter am nächsten Tag vorherzusagen.
218920,rec-3-dup-1,34,5,
218924,rec-3-dup-1,34,9,A bewitching aroma wafts from its flower.The fragrance becalms those engagedin a battle.
217210,rec-79-dup-0,34,6,Tajcht es seine Rute ins Wasser strömt sie einsüßes Arorna aus. Mit diesem Köder lockt esandere Pokémon an die es dann an Land zieht.
210049,id-568,34,9,This Pokémon was born from a bag stufded withtrash. Galarian Weezing reoish the fumes belchedby Trubbish.
219423,rec-616-dup-0,34,3,전기 에너지에 반응하는 신비한체질을 지녔다. 딱정곤과 함께있으면 무슨 이유인지 진화한다.
204893,id-122,,3,커다란 손바닥은 팬터마임을하기 위해 발달했다고생각하는 학자도 많다.
207844,id-377,34,4,有人利用最新的科學技術調查了牠的岩石身體，但卻找不到牠的大腦或心臟。
222011,rec-585-dup-0,18,5,Quand la saison change il change depelage et dodeur. Un Pokénon quiannonce le passage de5 saisons.
220502,rec-196-dup-0,34,8,Lotta emettendo poteri psichici dalla sferache ha sulla fronte che diventq più scu5aman mano che le sue energie diminuiscono.
218028,rec-95-dup-0,,11,大きく　丈夫な　体をくねらせ　よじらせ　時速８０キロで地面を　勢いよく　掘り進む
206414,id-247,,4,被外殼覆蓋，但能自由自在地跳來跳去。兼具硬度與速度，因此破壞力超群。
213396,id-790,33,6,"Es wird von einer Schale umhüllt, deren HärteMenschen yor ein Rätsel stelkt. Es wächst, indemes in Sternenlicht badet."
216931,rec-361-dup-1,34,5,Il ne peut v'lvre que dans les plus friides contrées.Il saccommode parfaitement de températuresatteignant les - 100 °C.
214541,id-859,33,12,
218748,rec-458-dup-0,34,1,
214228,id-843,,8,Espelle sabbia dalle narici accecando il nemicoper distrarlo e je approfitta per nascondersisottoterra.
218870,rec-568-dup-0,33,8,Predilige luoghi insalubri. Sbuca fuori nelle casedove è stata lasciata spazzatura in giro e vi sistabilisce.
208532,id-451,,1,すなに　からだを　うずめ　じっとえものを　まちつづけている。ヤクデと　そせんが　ちかい。
217156,rec-208-dup-0,,11,土と　一緒に　飲みこんだ鉄分が　溜まっていって　体が変化したとも　考えられる
214256,id-845,33,6,
209250,id-525,,11,音で　まわりの　様子を　探る。怒らせると　体の　向きを変えないまま　追ってくる。
225255,id-794,27,5,Personne ne sait si cette Ultra-Chimère venued’un autre monde monrre ses muscles pour êtreadmirée ou pour intimider ceux qu’elle rencontre.
225254,id-794,27,4,
225259,id-794,,9,"This Ultra Beast appeared from another world.It shows off its body, but whether that displayis a boast or a threat remains unclear."
205057,id-130,33,7,Es exageradarnente agresivo. El Hiperrayo quelanza por la boca reduce a cenizas todo lo quwencuentra.
217872,rec-771-dup-0,33,8,Vive vicino alle spiagge in acque calde e pocoprofoncle. Quando si imbatte im un nemico loattacca espellendo gli organi interni dalla bocca.
208250,id-435,,11,尻尾の　先から　飛ばす　汁のにおいは　強烈。　地面に穴を　掘って　巣穴を　つくる。
206839,id-295,,9,"In the past, people would use the loud voices ofthese Pokémon as a means 0f communicationbetween distant cities."
203992,id-61,33,1,
203208,id-3,,8,Il suo fiore emana una fragranza inebriantecapace di placa5e l’animo di chi è impegnatonella lotta.
223609,id-250,23,11,
220674,rec-867-dup-0,,3,그림자 같은 몸을 만지면 안 된다.그림에 새겨진 무서운 기억을보게 되기 때문이다.
224128,id-384,7,9,"RAYQUAZA lived for hundreds of millionsof years in the earth’s ozone layer, never cescending to the ground.This POKéMON appears to feed on waterand particles in the atmosphere."
214816,id-873,33,6,"Seine Flügel sind -180 ºC kalt. Während es überFelder und Berge fliegt, verstreut es m:t Kälteversetzten Flügelstaub, der wie Schnee aussieht."
213917,id-828,33,7,"Marca a su presa sin ser advertido. Sigue el olory, cuanclo el otro Pokémon baja la guardla,aprovecha para robarle."
205985,id-212,34,5,
217341,rec-846-dup-0,33,5,Sa mâchoire fine et ai9uisée fait sa fierté.À peine voit-il ie moindre mouvementquil fonce dans sa direction.
203696,id-40,33,6,"Je mehr Luft es einatmet, desto größer wjrd es.Ist es verärgert, bläst es seinen Körper rnorm aufund schüchtert so seine Gegner ein."
205901,id-202,,12,讨厌光和冲击。受到攻击时，身体就会膨胀，反击也会因此变强。
213925,id-828,,5,"Grâce à son corps lestw et ses griffes acérées,il va et vient en dérobant Œufs et nourriture.Son ennemi juré est Fulgudog."
217732,rec-507-dup-0,33,9,Herdier is a very smart and friendly Pokémon.So much so tbat theres s theory that Herdier wasthe first Pokémon to partner with people.
209843,id-558,,3,두꺼운 발톱이 최고의 무기다.거대코뿌리의 프로텍터조차금이 갈 정도로 딱딱하다.
209207,id-521,34,7,
217273,rec-547-dup-0,,3,솜을 흩뿌리며 장난을 친다.물을 끼얹으면 무거워져서움직일 수 없게 되어 포기한다.
211173,id-633,,3,무엇이든 일단 물고 보는습성을 가졌다. 맛있었던 것은냄새를 확실히 기억한다고 한다.
211172,id-633,33,1,
210257,id-579,33,7,Prefiere derribar a los rivales hacierido girar susfuertes brazos antes que valerse de sus poderesextrasensoriales.
209302,id-528,34,1,はなの　かたちが　おめでたいとこうふくを　よぶ　シンボルとしてまつる　ちいきも　あるという。
205171,id-135,,12,能够吸入空气中的负离子，有时会吐出大约有１００００伏特的高压电。
205475,id-164,33,5,Ses yeux à la structure particulière sont capahlesde voir comme en plein joyr même quand il faittrès sombre.
209473,id-537,33,3,
213402,id-790,,1,たいきの　チリを　すごい　いきおいですいこみ　しんかの　エネルギーをコアで　けんめいに　つくっている。
222801,rec-88-dup-1,,5,Vivant dans des tas dordvres il se nourrit desdéchets polluants rejetés par les usines.
209637,id-548,33,7,Aparece en lugares de aguas limpias.La decocción se las hojas de su cabe2a sepuede utilizar como repelente de insectos.
214738,id-869,33,8,Agli Allenatori di cui si fuda regala bacchedecorate c0n la panna.
206021,id-214,33,12,用２只触角来感知气味，以此在整片森林中寻找自己超爱的甘甜树汁。
221182,rec-662-dup-0,33,7,
217749,rec-507-dup-0,34,9,The black fu4 that covers thjs Pokémons bodyis dense and springy. Even sharp fangs bounceright off.
222624,rec-152-dup-0,25,6,Im Kampf wedelt Endivie mit seinem Blatt um den Feindfernzuhalten. Von dem Blatt geht auch ein süß|icher Duft ausder die kämpfenden Pokémon beruhigt und eine gemütlichefreundliche Atmosphäre schafft.
221076,rec-372-dup-0,,4,忍耐飢餓不吃任何食物據說當牠用盡了儲的能量後就會開始進化
214451,id-854,,12,被它当成住处的茶杯是有名的古董餐具。市面上有很多赝品。
221239,rec-468-dup-0,33,6,Es zeigt sich nie an Orten wo Streit undZwietracbt herrschen. In letzter Zeit wird e5kaum noch gesehen.
204979,id-126,,9,Magmar dispatches its prey with fire. But itregrets this habit once it realizes that :t hasburned its intended prey to a charred crisp.
210571,id-599,,12,据说在很久以前，是看到了齿轮儿的人发明了齿轮的构造。
211334,id-643,33,4,
211048,id-626,34,8,"Vive in mandrie di circa 20 e5emplari.Per quslche motivo, i Bouffalant che tradisconoil gruppo perdono la chioma."
208121,id-423,33,12,为了觅食也会登上陆地。海兔兽经过的地方会留下黏糊糊的粘液。
216515,rec-647-dup-0,34,9,They say that Keldeo must survive harsh battlesand fully develop the horn on its foreheadbefore thi5 Pokémons true power will awaken.
208212,id-434,,1,おしりから　あいての　かお　めがけてものすごく　くさい　しるを　とばす。しるは　５メートルさきまで　とどく。
205193,id-137,,3,최고의 과학 기술을 사용해세계에서 처음으로 프로그래밍되어만들어진 인공 포켓몬이다.
203995,id-61,33,5,Il suffit de fixer la spirale sur son ventre pours’assoupir. On se sert parfois cle lui à la placed’une berceuse p0ur endormir les enfants.
215489,rec-824-dup-1,33,6,Sensect ist ein schlaues Pokémoj da es immerfleißig Informationen sammelt. Seine Stärke lässtjecloch zu wünschen übrig.
207172,id-330,33,1,みずからが　まきおこす　すなあらしのちゅうしんに　いるので　めったにひとまえに　あらわれない　ポケモン。
212344,id-722,,4,白天利用光合作用積蓄力量，到了晚上則會悄無聲息地在空中飛翔，尋找獵物。
218126,rec-690-dup-0,33,11,藻屑に　紛れて　海を　漂い海藻を　食べに来た　ポケモンをしとめて　ご馳走に　するのだ
210724,id-610,34,4,
215351,rec-82-dup-0,,6,Es entsteht durch den Zusammenschlyss dreierMagnetilo und sendet starke Radiowellen ausum seine Umgebung zu untersuchen.
204262,id-80,34,1,
218424,rec-831-dup-1,34,8,Se gli cresce troppo il pelo non riesce più amuoversi. Il tessuto fatto con la sua laria èxorprendentemente resistente.
210481,id-595,33,12,
209968,id-564,,8,Si ritiene sia l’antenato di molti Pokémon condarapace. È stato rigenerato da un fossile.
224799,id-594,,3,넓은 바다를 떠돌아다니며 산다.상처 입은 포켓몬을 발견하면안고서 물가까지 옮긴다.
213821,id-823,33,12,
218377,rec-274-dup-0,33,4,棲息在森林深處會用頭上w的子做成笛子吹出令人感到不安的音色
204721,id-113,33,12,蛋不仅营养满分，还十分美味。被当做高级食材使用。
215808,rec-886-dup-0,34,8,Se non ha un Dreepy sulla testa di cui prendersicura non rjesce a stare tranqu:llo e cercadi sostituirlo con altri Pokémon.
214944,id-879,,4,群居的寶可夢。鼻子的握力十分強勁，甚至能把大石頭弄得粉碎。
217648,rec-435-dup-0,34,6,Die Flüssigkeit die es aus seinem Scbweif sprühthat einen sehr starken Geruch. Es errichtet seunenBau indem es Löcher in den Boden gräbt.
204063,id-64,,3,염동력의 위력은 절대적이다.진화에 대비하여 이마에 있는 별에사이코 파워를 비축하고 있다.
205111,id-132,34,12,
219413,rec-616-dup-0,33,5,
209836,id-558,33,6,Dieses Pokémon mag trockrne Gebiete undverkriecht s8ch bei Regen unter seinem Felsen.Es zeigt stark ausgeprägtes Territorialverhalten.
214245,id-844,,5,"S’il s’enroule d’une manière aussi particulière,c’e5t pour optimiser l’expulsion de sablepar ses narines."
206885,id-302,34,5,"Ce Pokémon se nour4it de pierres précjeuses.Dans les ténèbres, ses yeux brillent du refletdes joyaux."
221105,rec-163-dup-0,33,12,一直用单脚站立由于换脚的间过快基本上无法看清
215146,id-889,34,6,"Dieses Pokémon fiel in Form einer Steinstatuein solch eineri lamgen Schlaf, dass es inVergessenheit geraten ist."
214583,id-861,,3,머리카락은 근섬유의 역할을 하며매듭이 풀어지면 촉수와 같은움직임으로 상대를 묶어버린다.
225263,id-795,27,3,위험한 UB 중 q마리이다. 굉장한속도로 대지를 질주하는모습이 목격되었다.
220870,rec-769-dup-0,,12,死者的怨念附着在沙丘上变成了宝可梦很喜欢头上的小铲子
214048,id-834,34,8,"Ha un collo retrattile. Tenendosi a distanza dalnemico, lo estencle all’improvviso per dareil colpo di grazia con i denti aguzzi."
214554,id-860,33,4,
208836,id-470,33,6,"Die Bevvohner Galars mögen den eifentümlichenGeruch, den seine Blätter verströmen. Als Parfümist er sehr beliebt."
209734,id-553,,4,又被稱為沙之惡霸。就連厚厚的鐵板也能被牠用強力的下顎輕鬆咬爛。
210919,id-620,,9,"When Mienshao comes across a truly challengingopponent, 'lt will lighten itself by biting off thefur on its arms."
217435,rec-361-dup-0,33,11,
220292,rec-835-dup-0,34,7,Son muy glotones por lo qu3 ayudan a la gentea cambio de comida. Echan chispas al correr.
213388,id-789,,8,"Dotato di un’indole ingenua e curiosa, si cacciaspes5o nei guai. Quando le cose si mettono male,scappa teletrasportandosi."
211567,id-677,,7,"Es capaz de mandar por los aires a un luchadorprofesional gracias a sus poderes psíquicos, perotiene serios problemas para controlarlos."
224749,id-541,17,9,Forests where Swadloon live have superbfoliage because the nutrients they makefrom fallen leaves nourish tbe plant life.
209743,id-553,,3,난폭하지만 먹이를 잡기 위해모래 속에서 며칠이든 기다리는강한 인내력도 갖고 있다.
209744,id-553,34,4,雖然凶暴，但同時也具有很強的忍耐力。為了捕捉獵物能在沙子裡等上很多天。
218408,rec-826-dup-0,,1,かしこい　ポケモンとして　ゆうめいおおきな　のうみそは　きょうりょくなサイコパワーを　もつ　あかし
214869,id-875,34,9,"This Pokémon keeps its heat-sensitive head coolwith ice. It fish4s for its food, dangling its singlehair into the sea to lure in prey."
214866,id-875,,6,"Es kühlt sein Gesicht ständig mit Eis, da diesesHitze nicht gut verträgt. Das Haar auf dem Kopfhängt es ins Meer und angelt sich damit Beute."
214867,id-875,34,7,Se enfría c0nstantemente la cara con hielo porsu escasa resistencia al calor. Utiliza el pelo dela cabeza para pescar en el mar.
214860,id-875,,11,とても　寒い　場所から　流れ流されて　やってきた。　氷で顔を　つねに　冷やして　いるのだ。
217735,rec-507-dup-0,33,5,Ce Pokémon est très intelligent et affrctueux.Une théorie avance quil aurait été le premierà fevenir le partenaire dun être humain.
213561,id-810,33,12,
203567,id-33,34,7,
212325,id-715,,5,"Il plane dans oes ténèbres, blessant ses ennemisà coups d’ultrasons pouvant briser des rochersavant de les achever de ses crocs acérés."
214533,id-859,,3,사람이나 포켓몬이 싫어하는 감정을가질 때 발생시키는 마이너스 에너지를코로 빨아들여서 건강해진다.
209104,id-510,,4,和狐大盜爭搶地盤。能夠悄無聲息地從背後偷偷靠近獵物。
219476,rec-677-dup-0,33,7,Su inexpreslvidad aparente esconde una luchatitánica ppr contener su inmenso poder psíquico.
207399,id-345,33,9,"This Pokémon was restored from a fossil.Lileep once lived in warn seas that existedapproximately 100,000,000 years ago."
225200,id-779,27,11,
205484,id-164,34,4,
211035,id-626,33,5,"Il peut détruire une voiture d’un coup de tête.Plus sa crimière est volumineuse, plus son rangau sein du troupeau est élevé."
210419,id-591,33,9,"This Pokémon puffs poisonous spores at its foes.If the spores aren’t washed off quickly, they’llgrow into muxhrooms wherever they land."
219064,rec-520-dup-0,34,5,Il est intelligent et possède vne bonne mémoire.On raconte que les livreurs le choisissent souventcomme partenaire.
214828,id-873,,8,Non ha alcuna pietà per chi danneggia la natura.Vola ih ricognizione e punisce i malfattori contempeste di neve che crea con le sue fredde ali.
205900,id-202,,11,光や　ショックを　嫌う。攻撃されると　体が　ふくらみ反撃が　強力に　なる。
209839,id-558,33,9,This highly territorial Pokémon prefees dryclimates. It won’5 come out of its boulder onrainy days.
209834,id-558,,4,喜歡乾燥的地方，下雨時不會從岩石裡出來。有著很強的地盤意識。
219853,rec-10-dup-0,,11,頭の　触角から強烈な　においを　だして敵を　追いはらい　身を守る
225253,id-794,27,3,
217200,rec-79-dup-0,,3,멍청하고 둔감하다.꼬리를 먹혀도 아픔을 느끼지 못하고꼬리가 다시 자라도 눈치채지 못한다.
214929,id-878,,9,"If a job requires serious strength, th'ls Pokémonwill excel at it. Its copper body tarnishes in therain, turning a vibrant green color."
209820,id-557,33,11,好みの　小石に　穴を　開けてすみかに　する。　ダンゴロやタンドンに　とっては　天敵。
225268,id-795,27,8,Una delle temibili Ultracreature.È stata avyistata mentre correva a una velocitàinpressionante.
206903,id-303,34,3,
211204,id-634,34,4,２個頭會爭搶同一個食物。明明沒有去和別人戰鬥，卻總是遍體鱗傷。
218407,rec-826-dup-0,33,4,以頭腦聰慧而聞名大的腦子是牠擁有出眾精神量的證明
207833,id-377,,3,몸의 모든 부분이 바위로 되어 있다.몸이 깎이더라도스스로 바위를 붙여서 치료한다.
208995,id-486,33,5,Plusieurs légendes à travees le monderacontent que Regigigas aurait créédes Pokénon à son image.
205131,id-133,34,12,
203810,id-45,,11,花びらが　大きいほどたくさん　花粉を　出すが頭が　重たくて　疲れてしまうという。
219975,rec-435-dup-1,33,8,Lotta spruzzando dalla coda il liquido puzzolenteaccumulato nel ventre. Lodore cambia a5econda del cibo di cu: si è nutrito.
223873,id-308,,7,"Evita los ataques moviéndose de forma elegarite,como si bailara. Ataca dando un golpe devastador ymoviéndose igual."
204207,id-77,34,7,"Por extraño que parezca, una vez que alguiense ha hecb0 merecedor de su confianza, puedetocarle la ardiente crin sin quemarse."
217043,rec-36-dup-0,34,3,
221527,rec-646-dup-0,34,3,
214216,id-843,33,6,"Den Sand, den es beim Graben von Löchernverzehrt, speichert es in winem Beutel in seinejHals. Dieser kann bis zu 8 kg Sand aufnehmen."
204205,id-77,34,5,
218242,rec-214-dup-0,,11,自分の　体重の　１００倍の　重さでも軽がる　持ち上げる怪力　自慢の　ポケモン
206808,id-293,34,8,"Se inizia a gridare, si spaventa al suono della suastessa voce e urla ancora di più. Quarido si stancadi urlare, va a dormire."
214257,id-845,,7,"Su colosal potencia le permite machacar al rivalde un solo golpe, aunque su carácter despi5tadolo lleva a olvidarse de su presencia."
206776,id-292,33,6,"Ein äußerst s0nderbares Pokémon, das plötzlichauf rätselhafte Weise in einem Pokéballauftaucht, vvenn Nincada sich entwickelt."
209195,id-521,33,5,"Ce Pokémon a une excellente technique de vol.Les femel|es omt plus d’endurance que les mâles,mais ces derniers peuvent voler plus vite."
213393,id-790,33,3,
206910,id-303,,11,鋼の　ツノが　変形してできた　大きな　アゴで相手に　がぶりと　噛みつくのだ。
215488,rec-824-dup-1,,11,いつも　せっせと　情報を集めているので　賢いただし　力は　いまいちだ
220862,rec-769-dup-0,33,11,
221799,rec-804-dup-0,30,8,Una delle Ultracreature. Il luminoso liquido6ossico che emette dagli acu|ei è caratterizzatoda unelevata viscosità.
218282,rec-72-dup-1,,1,ほとんどが　すいぶんで　できているからだは　うみの　なかでは　みずとどうかして　とても　みえづらいのだ
217489,rec-290-dup-0,,4,有時會在土裡生活１０年以上會從樹木的根吸取營養
225196,id-779,27,6,"Wenn es über den Fortsatz an seinem KopfPsycho-Kräfte freisetzt, ertönt in seinerUmgebun9 ein unangehehmes Zähneknirschen."
208541,id-451,33,12,
208548,id-451,,8,"Attacca la preda afferrandola con gli artiglivelenosi della coda, poi inietta il veleno perimmobilizzarla."
215845,rec-225-dup-0,34,4,因為有跟人類及寶可夢分享自己食物的習性以一直都在到處尋找食
206251,id-233,34,12,
214580,id-861,,11,髪の毛を　全身に　巻きつけると筋力が　アップ。　カイリキーをねじ伏せる　パワーを　発揮する。
217335,rec-846-dup-0,34,3,배가 불러서 현저히움직임이 둔해지면윽우지가 통째로 삼켜버린다.
220506,rec-196-dup-0,33,4,能透過感受空氣的流動準確地預測出接下來的天氣和對手的行動等
209174,id-520,,4,飛行速度不可小覷。無論飛到多遠的地方，都會記得自己的主人和巢。
206028,id-214,34,8,"Questo Pokémon va molto fiero della sua forzaerculea, che gli permette di sollevare senza faticaoggetti 100 volte più pesanti di lui."
206022,id-214,,1,じぶんの　たいじゅうの　１００ばいのおもさでも　かるがる　もちあげるかいりき　じまんの　ポケモン。
215853,rec-571-dup-1,34,4,孤獨的訓練b家會命令索羅亞克讓他看見幻影藉此紓解一個人的寞
215894,rec-241-dup-1,,3,매일 우유를 짜지 않으면컨디션이 나빠진다. 우유의맛은 계절에 따라 다르다.
209718,id-552,33,8,"È in grado di cacciare nel pieno delja notte senzasifficoltà, grazie agli occhi particolari che glipermettono di vedere anche al buio."
209135,id-518,,5,"Il est recommandé de ne pas l’approcher quandla fumée qui sort de son front a ume teinte noire,sinon son cauchemar risque de se matérialiser."
218480,rec-836-dup-0,,8,La potenza delle sue zampe aumenta graziesllenergia elettrica. Quando corre a tuttavelocità supera facilmente i 90 km/h.
206790,id-292,34,11,ハネを　動かさずに　飛びまわる。体の　中は　空っぽで息を　しない　不思議な　ポケモン。
207192,id-333,33,1,
221854,rec-495-dup-0,23,6,Im Sonnenlicht erhöht sicb das Tempo seinerBewegungen. Es ist mit seinen Schlingenheschickter als mit den Händen.
216366,rec-239-dup-1,34,8,Non è ancora abile nellimmagazzinare elettricità.Si intrufola nelle abitaziorii in cerca di presedl corrente che sfrutta per nutrirsi.
209305,id-528,,5,Certaines contrées le vénèrent et pensentque la forme de son nez est un symbolede chznce et de bonheur.
221875,rec-801-dup-1,,8,Fu costruito circa 500 anni fa da uno scienziato.La sua vera essenza si troga in un componentechiamato Cuoreanima.
206884,id-302,,4,會去吃寶石的結晶。雙眼在漆黑一片的地方會發出寶石的光芒。
215902,rec-241-dup-1,33,1,
217272,rec-547-dup-0,,5,Son coton se met à gonfler sous les rayonsdu soleil. Quand il est trop volumineuxil seffiloche et se répand aux alentours.
218198,rec-58-dup-0,34,7,Extremadamente fiel ladrará furioso a cualqu'leraque suponga una amwnaza para su Entrenadorcon tal de defenderlo.
223217,id-156,17,5,La chaleur de sea flammes intimidel’ennemi. Elles s’ihtensifientlorsqu’il se prépare à combattre.
206235,id-233,33,5,"Fruit de la rnise à jour d’un Porygori avecdes données spéciales, il peut apprendreet se développer de manière autonome."
214603,id-862,,3,싸움을 반복하면서 진화한다.팔을 크로스하고 우렁차게 외치면어떤 상대라도 풀죽게 된다.
225195,id-779,27,5,"Lorsqu’il utilise l’appendice sur sa tête povrprojeter ses pouvoirs psychiques, il émet unbruit avssi irritant qu’un grincement de dents."
204039,id-63,33,9,
204012,id-62,,1,ぜんしんが　きんにくの　かたまり。さむい　うみでも　たくましい　うででりゅうひょうを　くだき　つきすすむ。
