tid,id,title,authors,venue,year
70831,conf/vldb/AbrolLMMMRTWZ01,Navigating large-scale semi-structured data in business portals,"M Abrol, N Latarche, U Mahadevan, J Mao, R Mukherjee, P Raghavan, M Tourn, J Wang, G Zhang",VLDB,2001
70832,conf/sigmod/BaumannDFRW98,The Multidimensional Database System RasDaMan,"P Baumann, A Dehmel, P Furtado, R Ritsch, N Widmann",SIGMOD Conference,1998
70840,conf/sigmod/ChaudhuriN98a,Microsoft Index Tuning Wizard for SQL Server 7.0,"S Chaudhuri, V Narasayya",SIGMOD Conference,1998
70844,conf/sigmod/GriffinH97,A Framework for Implementing Hypothetical Queries,"T Griffin, R Hull",SIGMOD Conference,1997
70846,conf/sigmod/BrinMUT97,Dynamic Itemset Counting and Implication Rules for Market Basket Data,"S Brin, R Motwani, J Ullman, S Tsur",SIGMOD Conference,1997
70848,conf/vldb/SindoniTABFGMPPT01,SIT-IN: a Real-Life Spatio-Temporal Information System,"G Sindoni, L Tininini, A Ambrosetti, C Bedeschi, S Francisci, O Gargano, R Molinaro, M Paolucci, P Patteri, P Ticca",VLDB,2001
70850,conf/vldb/KoschBBHHLRT01,SMOOTH - A Distributed Multimedia Database System,"H Kosch, L Böszörményi, A Bachlechner, C Hanin, C Hofbauer, M Lang, C Riedler, R Tusch",VLDB,2001
70852,conf/vldb/PereiraFJLS01,WebFilter: A High-throughput XML-based Publish and Subscribe System,"J Pereira, F Fabret, H Jacobsen, F Llirbat, D Shasha",VLDB,2001
70853,conf/vldb/YagoubFIV00a,Building and Customizing Data-Intensive Web Sites Using Weave,"K Yagoub, D Florescu, V Issarny, P Valduriez",VLDB,2000
70854,conf/sigmod/RoussopoulosKR97,Cubetree: Organization of and Bulk Updates on the Data Cube,"N Roussopoulos, Y Kotidis, M Roussopoulos",SIGMOD Conference,1997
70856,conf/sigmod/CeriFP98,The IDEA Web Lab,"S Ceri, P Fraternali, S Paraboschi",SIGMOD Conference,1998
70857,conf/vldb/StohrR01,WARLOCK: A Data Allocation Tool for Parallel Warehouses,"T Stöhr, E Rahm",VLDB,2001
70859,conf/vldb/PapadiasT01,MV3R-Tree: A Spatio-Temporal Access Method for Timestamp and Interval Queries,"Y Tao, D Papadias",VLDB,2001
70861,conf/vldb/OoiYTJ01,Indexing the Distance: An Efficient Method to KNN Processing,"C Yu, B Ooi, K Tan, H Jagadish",VLDB,2001
70863,conf/vldb/TanSHCR01,Walking Through a Very Large Virtual Environment in Real-time,"L Shou, J Chionh, Z Huang, Y Ruan, K Tan",VLDB,2001
70864,conf/sigmod/ReinwaldP98,SQL Open Heterogeneous Data Access,"B Reinwald, H Pirahesh",SIGMOD Conference,1998
70865,conf/vldb/LabrinidisR01,Update Propagation Strategies for Improving the Quality of Data on the Web,"A Labrinidis, N Roussopoulos",VLDB,2001
70866,conf/sigmod/BlakeleyP98,Microsoft Universal Data Access Platform,"J Blakeley, M Pizzo",SIGMOD Conference,1998
70868,conf/vldb/SatheS01,Intelligent Rollups in Multidimensional OLAP Data,"G Sathe, S Sarawagi",VLDB,2001
70869,conf/sigmod/KemperKM98,SAP R/3: A Database Application System (Tutorial),,,1998
70870,conf/vldb/CuiW01,Lineage Tracing for General Data Warehouse Transformations,"Y Cui, J Widom",VLDB,2001
70871,conf/vldb/BratsbergH01,Online Scaling in a Highly Available Database,"S Bratsberg, R Humborstad",VLDB,2001
70878,conf/sigmod/Kennamer98,Microsoft.com: A High-Scale Data Management and Transaction Processing Solution,S Kennamer,SIGMOD Conference,1998
70879,conf/vldb/MarronL01,On Processing XML in LDAP,"P Marrón, G Lausen",VLDB,2001
70880,conf/sigmod/Lassettre98,Olympic Records for Data at the 1998 Nagano Games,E Lassettre,SIGMOD Conference,1998
70881,conf/vldb/WiesnerK01,Hyperqueries: Dynamic Distributed Query Processing on the Internet,"A Kemper, C Wiesner",VLDB,2001
70883,conf/vldb/BonifatiCDS01,Warehousing Workflow Data: Challenges and Opportunities,"A Bonifati, F Casati, U Dayal, M Shan",VLDB,2001
70884,conf/sigmod/AndersonAF98,Oracle Rdb's Record Caching Model,"R Anderson, G Arun, R Frank",SIGMOD Conference,1998
70886,conf/vldb/Huyn01,Scientific OLAP for the Biotech Domain,N Huyn,VLDB,2001
70889,conf/vldb/Gentili01,Italian Electronic Identity Card - principle and architecture,M Gentili,VLDB,2001
70897,conf/vldb/Carey00,"Toto, We're Not in Kansas Anymore: On Transitioning from Research to the Real (Invited Industrial Talk)",M Carey,VLDB,2000
70905,conf/sigmod/MaheshwariL97,Partitioned Garbage Collection of Large Object Store,"U Maheshwari, B Liskov",SIGMOD Conference,1997
70906,conf/vldb/Bowker00,Work and Information Practices in the Sciences of Biodiversity,G Bowker,VLDB,2000
70907,conf/sigmod/ZaharioudakisC97,Highly Concurrent Cache Consistency for Indices in Client-Server Database Systems,"M Zaharioudakis, M Carey",SIGMOD Conference,1997
70912,conf/sigmod/MumickQM97,Maintenance of Data Cubes and Summary Tables in a Warehouse,"I Mumick, D Quass, B Mumick",SIGMOD Conference,1997
70913,conf/sigmod/HoAMS97,Range Queries in OLAP Data Cubes,"C Ho, R Agrawal, N Megiddo, R Srikant",SIGMOD Conference,1997
70914,conf/vldb/Team00,"High-Performance and Scalability through Application Tier,In-Memory Data Management",,VLDB,2000
70915,conf/vldb/RamamrithamABEGP00,"Social, Educational, and Governmental Change Enabled through Information Technology","K Ramamritham, Y Atfi, C Batini, M Eitan, V Gregg, D Phatak",VLDB,2000
70917,conf/sigmod/TsueiPK97,Database Buffer Size Investigation for OLTP Workloads (Experience Paper),"T Tsuei, A Packer, K Ko",SIGMOD Conference,1997
70921,conf/vldb/BernsteinHJRW00,Panel: Is Generic Metadata Management Feasible?,"P Bernstein, L Haas, M Jarke, E Rahm, G Wiederhold",VLDB,2000
70922,conf/sigmod/CareyDNAGS97,The BUCKY Object-Relational Benchmark (Experience Paper),"M Carey, D DeWitt, J Naughton, M Asgarian, P Brown, J Gehrke, D Shah",SIGMOD Conference,1997
70924,conf/sigmod/YangM97,Association Rules over Interval Data,"R Miller, Y Yang",SIGMOD Conference,1997
70927,conf/vldb/LudasaherGM00,Model-Based Information Integration in a Neuroscience Mediator System,"B Ludäscher, A Gupta, M Martone",VLDB,2000
70928,conf/sigmod/Kramer97,Databases on the Web: Technologies for Federation Architectures and Case Studies (Tutorial),R Kramer,SIGMOD Conference,1997
70933,conf/vldb/BeneventanoBCCGMMV00,Information Integration: The MOMIS Project Demonstration,"D Beneventano, S Bergamaschi, S Castano, A Corni, R Guidetti, G Malvezzi, M Melchiori, M Vincini",VLDB,2000
70934,conf/sigmod/HanKS97,GeoMiner: A System Prototype for Spatial Data Mining,"J Han, K Koperski, N Stefanovic",SIGMOD Conference,1997
70937,conf/sigmod/ChawatheG97,Meaningful Change Detection in Structured Data,"S Chawathe, H Garcia-Molina",SIGMOD Conference,1997
70938,conf/vldb/HelalL00,Rainbow: Distributed Database System for Classroom Education and Experimental Research,"A Helal, H Li",VLDB,2000
70941,conf/vldb/RisheYACLMVSV00,Semantic Access: Semantic Interface for Querying Databases,"N Rishe, J Yuan, R Athauda, S Chen, X Lu, X Ma, A Vaschillo, A Shaposhnikov, D Vasilevsky",VLDB,2000
70942,conf/sigmod/KornJF97,Efficiently Supporting Ad Hoc Queries in Large Datasets of Time Sequences,"F Korn, H Jagadish, C Faloutsos",SIGMOD Conference,1997
70943,conf/sigmod/LivnyRBCDLMW97,DEVise: Integrated Querying and Visualization of Large Datasets,"M Livny, R Ramakrishnan, K Beyer, G Chen, D Donjerkovic, S Lawande, J Myllymaki, R Wenger",SIGMOD Conference,1997
70944,conf/vldb/PedersenJD00,The TreeScape System: Reuse of Pre-Computed Aggregates over Irregular OLAP Hierarchies,"T Pedersen, C Jensen, C Dyreson",VLDB,2000
70946,conf/sigmod/PatelYKTNBHRLEKGDN97,"Building a Scaleable Geo-Spatial DBMS: Technology, Implementation, and Evaluation","J Patel, J Yu, N Kabra, K Tufte, B Nag, J Burger, N Hall, K Ramasamy, R Lueder, C Ellmann, J Kupsch, S Guo, D DeWitt, J Naughton",SIGMOD Conference,1997
70947,conf/sigmod/GebhardtJJ97,A Toolkit for Negotiation Support Interfaces to Multi-Dimensional Data,"M Gebhardt, M Jarke, S Jacobs",SIGMOD Conference,1997
70948,conf/vldb/LabioYCGW00,Performance Issues in Incremental Warehouse Maintenance,"W Labio, J Yang, Y Cui, H Garcia-Molina, J Widom",VLDB,2000
70949,conf/vldb/JarkeKL00,The Challenge of Process Data Warehousing,"M Jarke, T List, J Köller",VLDB,2000
70950,conf/sigmod/BozkayaO97,Distance-Based Indexing for High-Dimensional Metric Spaces,"T Bozkaya, Z Özsoyoglu",SIGMOD Conference,1997
70951,conf/vldb/HinneburgAK00,What Is the Nearest Neighbor in High Dimensional Spaces?,"A Hinneburg, C Aggarwal, D Keim",VLDB,2000
70952,conf/sigmod/AgrawalASY97,Efficient View Maintenance at Data Warehouses,"D Agrawal, A Abbadi, A Singh, T Yurek",SIGMOD Conference,1997
70954,conf/sigmod/LlirbatFS97,Eliminating Costly Redundant Computations from SQL Trigger Executions,"F Llirbat, F Fabret, E Simon",SIGMOD Conference,1997
70955,conf/vldb/JiangSLB00,The BT-tree: A Branched and Temporal Access Method,"L Jiang, B Salzberg, D Lomet, M García",VLDB,2000
70957,conf/vldb/CowleyP00,Temporal Integrity Constraints with Indeterminacy,"W Cowley, D Plexousakis",VLDB,2000
70958,conf/sigmod/WodtkeWWDM97,The MENTOR Workbench for Enterprise-wide Workflow Management,"D Wodtke, J Weißenfels, G Weikum, A Dittrich, P Muth",SIGMOD Conference,1997
70959,conf/vldb/GuntzerBK00,Optimizing Multi-Feature Queries for Image Databases,"U Güntzer, W Balke, W Kießling",VLDB,2000
70960,conf/sigmod/Chakravarthy97,SENTINEL: An Object-Oriented DBMS With Event-Based Rules,S Chakravarthy,SIGMOD Conference,1997
70961,conf/vldb/KriegelPS00,Managing Intervals Efficiently in Object-Relational Databases,"H Kriegel, M Pötke, T Seidl",VLDB,2000
70962,conf/sigmod/SeshadriP97,PREDATOR: An OR-DBMS with Enhanced Data Types,"P Seshadri, M Paskin",SIGMOD Conference,1997
70963,conf/sigmod/Blakeley96,Data Access for the Masses through OLE DB,J Blakeley,SIGMOD Conference,1996
70964,conf/vldb/PfoserJT00,Novel Approaches in Query Processing for Moving Object Trajectories,"D Pfoser, C Jensen, Y Theodoridis",VLDB,2000
70965,conf/sigmod/OzdenRSS96,Fault-tolerant Architectures for Continuous Media Servers,"B Özden, R Rastogi, P Shenoy, A Silberschatz",SIGMOD Conference,1996
70967,conf/sigmod/OConnellISWABCCLPWW96,A Content-Based Multimedia Server for Massively Parallel Architectures,"W O'Connell, I Ieong, D Schrader, C Watson, G Au, A Biliris, S Choo, P Colin, G Linderman, E Panagos, J Wang, T Walters",SIGMOD Conference,1996
70968,conf/vldb/RamasamyPNK00,"Set Containment Joins: The Good, The Bad and The Ugly","K Ramasamy, J Patel, J Naughton, R Kaushik",VLDB,2000
70969,conf/sigmod/SimmenSM96,Fundamental Techniques for Order Optimization,"D Simmen, E Shekita, T Malkemus",SIGMOD Conference,1996
70972,conf/vldb/JohnsonA00,Optimizing Queries on Compressed Bitmaps,"S Amer-Yahia, T Johnson",VLDB,2000
70973,conf/vldb/DiaoLCT00,Toward Learning Based Web Query Processing,"Y Diao, H Lu, S Chen, Z Tian",VLDB,2000
70974,conf/sigmod/BohrerBBCFHKKMNRRSUUW97a,The InfoSleuth Project,"R Jr., W Bohrer, R Brice, A Cichocki, J Fowler, A Helal, V Kashyap, T Ksiezyk, G Martin, M Nodine, M Rashid, M Rusinkiewicz, R Shea, C Unnikrishnan, A Unruh, D Woelk",SIGMOD Conference,1997
70977,conf/vldb/SrinivasanDFCJYKTDB00,Oracle8i Index-Organized Table and Its Application to New Domains,"J Srinivasan, S Das, C Freiwald, E Chong, M Jagannath, A Yalamanchi, R Krishnan, A Tran, S DeFazio, J Banerjee",VLDB,2000
70981,conf/sigmod/WangSCRZP97,Structural Matching and Discovery in Document Databases,"J Wang, D Shasha, G Chang, L Relihan, K Zhang, G Patel",SIGMOD Conference,1997
70982,conf/vldb/RamsakMFZEB00,Integrating the UB-Tree into a Database System Kernel,"F Ramsak, V Markl, R Fenk, M Zirkel, K Elhardt, R Bayer",VLDB,2000
70984,conf/sigmod/LabioZWGGW97,The WHIPS Prototype for Data Warehouse Creation and Maintenance,"W Labio, Y Zhuge, J Wiener, H Gupta, H Garcia-Molina, J Widom",SIGMOD Conference,1997
70988,conf/sigmod/Chaudhuri97,Query Optimization at the Crossroads (Panel),S Chaudhuri,SIGMOD Conference,1997
70989,conf/vldb/BalminPP00,Hypothetical Queries in an OLAP Environment,"A Balmin, T Papadimitriou, Y Papakonstantinou",VLDB,2000
70990,conf/sigmod/GoyalHKMSZ97,Picture Programming Project,"N Goyal, C Hoch, R Krishnamurthy, B Meckler, M Suckow, M Zloof",SIGMOD Conference,1997
70992,conf/vldb/WangZ00,Using SQL to Build New Aggregates and Extenders for Object- Relational Systems,"H Wang, C Zaniolo",VLDB,2000
70993,conf/sigmod/ChaudhuriD97,Data Warehousing and OLAP for Decision Support (Tutorial),,,1997
70995,conf/vldb/OlstonW00,Offering a Precision-Performance Tradeoff for Aggregation Queries over Replicated Data,"C Olston, J Widom",VLDB,2000
70996,conf/sigmod/AtzeniT97,MDM: a Multiple-Data-Model Tool for the Management of Heterogeneous Database Schemes,"P Atzeni, R Torlone",SIGMOD Conference,1997
71004,conf/vldb/LakshmananJN00,The 3W Model and Algebra for Unified Data Mining,"T Johnson, L Lakshmanan, R Ng",VLDB,2000
71006,conf/sigmod/ColbyKLMR97,Supporting Multiple View Maintenance Policies,"L Colby, A Kawaguchi, D Lieuwen, I Mumick, K Ross",SIGMOD Conference,1997
71009,conf/sigmod/ShivakumarG97,Wave-Indices: Indexing Evolving Databases,"N Shivakumar, H Garcia-Molina",SIGMOD Conference,1997
71010,conf/vldb/ChristopheBPV00,PicoDMBS: Scaling Down Database Techniques for the Smartcard,"C Bobineau, L Bouganim, P Pucheral, P Valduriez",VLDB,2000
71011,conf/vldb/Taylor00,Concurrency in the Data Warehouse,R Taylor,VLDB,2000
71014,conf/sigmod/Shasha97,"Lessons from Wall Street: Case Studies in Configuration, Tuning, and Distribution (Tutorial)",,,1997
71018,conf/sigmod/GeorgeH97,Secure Transaction Processing in Firm Real-Time Database Systems,"B George, J Haritsa",SIGMOD Conference,1997
71020,conf/sigmod/GrayHOS96,The Dangers of Replication and a Solution,"J Gray, P Helland, P O'Neil, D Shasha",SIGMOD Conference,1996
71023,conf/vldb/JaedickeM99,User-Defined Table Operators: Enhancing Extensibility for ORDBMS,"M Jaedicke, B Mitschang",VLDB,1999
71025,conf/sigmod/MogiK96,Hot Mirroring: A Study to Hide Parity Upgrade Penalty and Degradations During Rebuilds for RAID5,"K Mogi, M Kitsuregawa",SIGMOD Conference,1996
71026,conf/vldb/LeeL99,Unrolling Cycles to Decide Trigger Termination,"S Lee, T Ling",VLDB,1999
71027,conf/sigmod/ZouS96,On-line Reorganization of Sparsely-populated B+trees,"C Zou, B Salzberg",SIGMOD Conference,1996
71028,conf/vldb/GionisIM99,Similarity Search in High Dimensions via Hashing,"A Gionis, P Indyk, R Motwani",VLDB,1999
71029,conf/vldb/KeimH99,Optimal Grid-Clustering: Towards Breaking the Curse of Dimensionality in High-Dimensional Clustering,"A Hinneburg, D Keim",VLDB,1999
71030,conf/sigmod/ZhangRL96,BIRCH: An Efficient Data Clustering Method for Very Large Databases,"T Zhang, R Ramakrishnan, M Livny",SIGMOD Conference,1996
71031,conf/vldb/CareyCNVDRSM99,"O-O, What Have They Done to DB2?","M Carey, D Chamberlin, S Narayanan, B Vance, D Doole, S Rielau, R Swagerman, N Mattos",VLDB,1999
71033,conf/sigmod/AchyutuniON96,Two Techniques for On-Line Index Modification in Shared Nothing Parallel Databases,"K Achyutuni, E Omiecinski, S Navathe",SIGMOD Conference,1996
71036,conf/sigmod/VanceM96,Rapid Bushy Join-order Optimization with Cartesian Products,"B Vance, D Maier",SIGMOD Conference,1996
71037,conf/vldb/Johnson99,Performance Measurements of Compressed Bitmap Indices,T Johnson,VLDB,1999
71039,conf/sigmod/ChaudhuriG96,Optimizing Queries over Multimedia Repositories,"S Chaudhuri, L Gravano",SIGMOD Conference,1996
71042,conf/sigmod/GoelI96,SQL Query Optimization: Reordering for a General Class of Queries,"P Goel, B Iyer",SIGMOD Conference,1996
71043,conf/vldb/DonjerkovicR99,Probabilistic Optimization of Top N Queries,"D Donjerkovic, R Ramakrishnan",VLDB,1999
71046,conf/sigmod/HungYK96,CapBasED-AMS: A Capability-based and Event-driven Activity Management System,"P Hung, H Yeung, K Karlapalem",SIGMOD Conference,1996
71051,conf/vldb/BrodieC99,Issues in Network Management in the Next Millennium,"M Brodie, S Chaudhuri",VLDB,1999
71052,conf/sigmod/Keim96,Databases and Visualization,D Keim,SIGMOD Conference,1996
71054,conf/sigmod/Han96,Data Mining Techniques,J Han,SIGMOD Conference,1996
71056,conf/vldb/Pound99,In Cyber Space No One can Hear You Scream,C Pound,VLDB,1999
71057,conf/sigmod/HanFWCZK96,DBMiner: Interactive Mining of Multiple-Level Knowledge in Relational Databases,"J Han, Y Fu, W Wang, J Chiang, O Zaďane, K Koperski",SIGMOD Conference,1996
71058,conf/vldb/GarofalakisRS99,SPIRIT: Sequential Pattern Mining with Regular Expression Constraints,"M Garofalakis, R Rastogi, K Shim",VLDB,1999
71065,conf/vldb/DarmontS99,VOODB: A Generic Discrete-Event Random Simulation Model To Evaluate the Performances of OODBs,"J Darmont, M Schneider",VLDB,1999
71066,conf/sigmod/NguyenS96,Accessing Relational Databases from the World Wide Web,"T Nguyen, V Srinivasan",SIGMOD Conference,1996
71067,conf/sigmod/BrownCL96,Goal-Oriented Buffer Management Revisited,"K Brown, M Carey, M Livny",SIGMOD Conference,1996
71069,conf/vldb/AcharyaGP99,Aqua: A Fast Decision Support Systems Using Approximate Query Answers,"S Acharya, P Gibbons, V Poosala",VLDB,1999
71070,conf/sigmod/ChristophidesCM96,Evaluating Queries with Generalized Path Expressions,"V Christophides, S Cluet, G Moerkotte",SIGMOD Conference,1996
71071,conf/vldb/Mohan99,Repeating History Beyond ARIES,C Mohan,VLDB,1999
71075,conf/vldb/Norvag99,The Persistent Cache: Improving OID Indexing in Temporal Object-Oriented Database Systems,K Nřrvĺg,VLDB,1999
71076,conf/sigmod/LibkinMW96,"A Query Language for Multidimensional Arrays: Design, Implementation, and Optimization Techniques","L Libkin, R Machlin, L Wong",SIGMOD Conference,1996
71079,conf/vldb/IoannidisP99,Histogram-Based Approximation of Set-Valued Query-Answers,"Y Ioannidis, V Poosala",VLDB,1999
71081,conf/vldb/JagadishMN99,Semantic Compression and Pattern Extraction with Fascicles,"H Jagadish, J Madar, R Ng",VLDB,1999
71082,conf/sigmod/KrishnanVI96,Estimating Alphanumeric Selectivity in the Presence of Wildcards,"P Krishnan, J Vitter, B Iyer",SIGMOD Conference,1996
71087,conf/vldb/KumarRRT99,Extracting Large-Scale Knowledge Bases from the Web,"R Kumar, P Raghavan, S Rajagopalan, A Tomkins",VLDB,1999
71088,conf/sigmod/AdyaGLM95,Efficient Optimistic Concurrency Control Using Loosely Synchronized Clocks,"A Adya, R Gruber, B Liskov, U Maheshwari",SIGMOD Conference,1995
71092,conf/vldb/DattaRT99,Curio: A Novel Solution for Efficient Storage and Indexing in Data Warehouses,"A Datta, K Ramamritham, H Thomas",VLDB,1999
71093,conf/vldb/ZurekS99,Datawarehousing Has More Colours Than Just Black & White,"T Zurek, M Sinnwell",VLDB,1999
71094,conf/sigmod/RundensteinerKRCJM96,The MultiView Project: Object-Oriented View Technology and Applications,"E Rundensteiner, H Kuno, Y Ra, V Crestana-Taube, M Jones, P Marrón",SIGMOD Conference,1996
71099,conf/sigmod/ChooOLCGBPS96,Prospector: A Content-Based Multimedia Server for Massively Parallel Architectures,"S Choo, W O'Connell, G Linderman, H Chen, K Ganapathi, A Biliris, E Panagos, D Schrader",SIGMOD Conference,1996
71100,conf/vldb/KonigW99,Combining Histograms and Parametric Curve Fitting for Feedback-Driven Query Result-size Estimation,"A König, G Weikum",VLDB,1999
71101,conf/sigmod/QuassWGHLMNRRAUW96,LORE: A Lightweight Object REpository for Semistructured Data,"D Quass, J Widom, R Goldman, K Haas, Q Luo, J McHugh, S Nestorov, A Rajaraman, H Rivero, S Abiteboul, J Ullman, J Wiener",SIGMOD Conference,1996
71108,conf/sigmod/Mohan96,State of the Art in Workflow Management Research and Products,,,1996
71110,conf/vldb/RothOH99,Cost Models DO Matter: Providing Cost Information for Diverse Data Sources in a Federated System,"M Roth, F Ozcan, L Haas",VLDB,1999
71114,conf/sigmod/GoyalHKMS96,Is GUI Programming a Database Research Problem?,"N Goyal, C Hoch, R Krishnamurthy, B Meckler, M Suckow",SIGMOD Conference,1996
71117,conf/vldb/JermaineDO99,A Novel Index Supporting High Volume Data Warehouse Insertion,"C Jermaine, A Datta, E Omiecinski",VLDB,1999
71118,conf/sigmod/MorpainCFP96,Maintaining Database Consistency in Presence of Value Dependencies in Multidatabase Systems,"C Morpain, M Cart, J Ferrié, J Pons",SIGMOD Conference,1996
71122,conf/sigmod/HellersteinN96,Query Execution Techniques for Caching Expensive Methods,"J Hellerstein, J Naughton",SIGMOD Conference,1996
71123,conf/sigmod/CookKWZ96,"Semi-automatic, Self-adaptive Control of Garbage Collection Rates in Object Databases","J Cook, A Klauser, A Wolf, B Zorn",SIGMOD Conference,1996
71126,conf/vldb/GohOST99,GHOST: Fine Granularity Buffering of Indexes,"C Goh, B Ooi, D Sim, K Tan",VLDB,1999
71128,conf/sigmod/Tajima96,Static Detection of Security Flaws in Object-Oriented Databases,K Tajima,SIGMOD Conference,1996
71131,conf/sigmod/LiskovACDGGMMS96,Safe and Efficient Sharing of Persistent Objects in Thor,"B Liskov, A Adya, M Castro, M Day, S Ghemawat, R Gruber, U Maheshwari, A Myers, L Shrira",SIGMOD Conference,1996
71132,conf/vldb/RaoR99,Cache Conscious Indexing for Decision-Support in Main Memory,"J Rao, K Ross",VLDB,1999
71133,conf/vldb/Chawathe99,Comparing Hierarchical Data in External Memory,S Chawathe,VLDB,1999
71135,conf/sigmod/PoosalaIHS96,Improved Histograms for Selectivity Estimation of Range Predicates,"V Poosala, Y Ioannidis, P Haas, E Shekita",SIGMOD Conference,1996
71136,conf/vldb/Sarawagi99,Explaining Differences in Multidimensional Aggregates,S Sarawagi,VLDB,1999
71138,conf/sigmod/DohertyHR96,Structures for Manipulating Proposed Updates in Object-Oriented Databases,"M Doherty, R Hull, M Rupawalla",SIGMOD Conference,1996
71139,conf/sigmod/LoR96,Spatial Hash-Joins,"M Lo, C Ravishankar",SIGMOD Conference,1996
71142,conf/vldb/VorugantiOU99,An Adaptive Hybrid Server Architecture for Client Caching ODBMSs,"K Voruganti, M Özsu, R Unrau",VLDB,1999
71146,conf/sigmod/RaoBG96,Providing Better Support for a Class of Decision Support Queries,"S Rao, A Badia, D Gucht",SIGMOD Conference,1996
71147,conf/vldb/BaulierBGJGKKMMNNRSS98,DataBlitz: A High Performance Main-Memory Storage Manager,"J Baulier, P Bohannon, S Gogate, S Joshi, C Gupta, A Khivesera, H Korth, P McIlroy, J Miller, P Narayan, M Nemeth, R Rastogi, A Silberschatz, S Sudarshan",VLDB,1998
71149,conf/vldb/RezendeS98,Bridging Heterogeneity: Research and Practice of Database Middleware Technology,"F Rezende, G Sauter",VLDB,1998
71151,conf/vldb/VenkataramanZ98,Heterogeneous Database Query Optimization in DB2 Universal DataJoiner,"S Venkataraman, T Zhang",VLDB,1998
71155,conf/sigmod/DavisonG95,Dynamic Resource Brokering for Multi-User Query Execution,"D Davison, G Graefe",SIGMOD Conference,1995
71156,conf/vldb/BamfordBKM98,Architecture of Oracle Parallel Server,"R Bamford, D Butler, B Klots, N MacNaughton",VLDB,1998
71158,conf/sigmod/AdelbergGK95,Applying Update Streams in a Soft Real-Time Database System,"B Adelberg, H Garcia-Molina, B Kao",SIGMOD Conference,1995
71160,conf/vldb/Vieille98,From Data Independence to Knowledge Independence: An on-going Story,L Vieille,VLDB,1998
71161,conf/vldb/DarEGP98,DTL's DataSpot: Database Exploration Using Plain Language,"S Dar, G Entin, S Geva, E Palmon",VLDB,1998
71163,conf/vldb/GarofalakisIO98,Resource Scheduling for Composite Multimedia Objects,"M Garofalakis, Y Ioannidis, B Özden",VLDB,1998
71166,conf/sigmod/AbiteboulCM95,A Database Interface for File Updates,"S Abiteboul, S Cluet, T Milo",SIGMOD Conference,1995
71167,conf/vldb/AbiteboulMRVW98,Incremental Maintenance for Materialized Views over Semistructured Data,"S Abiteboul, J McHugh, M Rys, V Vassalos, J Wiener",VLDB,1998
71168,conf/sigmod/BersonGM95,Fault Tolerant Design of Multimedia Servers,"S Berson, L Golubchik, R Muntz",SIGMOD Conference,1995
71169,conf/vldb/GoldmanSVG98,Proximity Search in Databases,"R Goldman, N Shivakumar, S Venkatasubramanian, H Garcia-Molina",VLDB,1998
71170,conf/sigmod/LuMSS95,Efficient Maintenance of Materialized Mediated Views,"J Lu, G Moerkotte, J Schü, V Subrahmanian",SIGMOD Conference,1995
71171,conf/sigmod/WoelkBJOTU95,Carnot and InfoSleuth: Database Technology and the World Wide Web,"D Woelk, W Bohrer, N Jacobs, K Ong, C Tomlinson, C Unnikrishnan",SIGMOD Conference,1995
71173,conf/vldb/RiedelGF98,Active Storage for Large-Scale Data Mining and Multimedia,"E Riedel, G Gibson, C Faloutsos",VLDB,1998
71174,conf/sigmod/Ivinskis95,High Availability of Commercial Applications,K Ivinskis,SIGMOD Conference,1995
71177,conf/vldb/George98,DMS: A Parallel Data Mining Server,F George,VLDB,1998
71178,conf/sigmod/Gettys95,DIRECTV and Oracle Rdb: The Challenges of VLDB Transaction Processing,W Gettys,SIGMOD Conference,1995
71181,conf/sigmod/BaruFGHJPW95,An Overview of DB2 Parallel Edition,"C Baru, G Fecteau, A Goyal, H Hsiao, A Jhingran, S Padmanabhan, W Wilson",SIGMOD Conference,1995
71187,conf/sigmod/MoleskyR95,Recovery Protocols for Shared Memory Database Systems,"L Molesky, K Ramamritham",SIGMOD Conference,1995
71189,conf/sigmod/BrodskyK95,The LyriC Language: Querying Constraint Objects,"A Brodsky, Y Kornatzky",SIGMOD Conference,1995
71190,conf/vldb/RezendeH98,The Heterogeneity Problem and Middleware Technology: Experiences with and Performance of Database Gateways,"F Rezende, K Hergula",VLDB,1998
71194,conf/sigmod/RadekeBBEKKN95,Efendi: Federated Database System of Cadlab,"E Radeke, R Böttger, B Burkert, Y Engel, G Kachel, S Kolmschlag, D Nolte",SIGMOD Conference,1995
71197,conf/vldb/BliujuteJSS98,R-Tree Based Indexing of Now-Relative Bitemporal Data,"R Bliujute, C Jensen, S Saltenis, G Slivinskas",VLDB,1998
71204,conf/sigmod/RamaswamyK95,OODB Indexing by Class-Division,"S Ramaswamy, P Kanellakis",SIGMOD Conference,1995
71206,conf/vldb/NipplM98,"TOPAZ: a Cost-Based, Rule-Driven, Multi-Phase Parallelizer","C Nippl, B Mitschang",VLDB,1998
71209,conf/vldb/IshikawaSF98,MindReader: Querying Databases Through Multiple Examples,"Y Ishikawa, R Subramanya, C Faloutsos",VLDB,1998
71211,conf/sigmod/BettiniWBJ95,Semantic Assumptions and Query Evaluation in Temporal Databases,"C Bettini, X Wang, E Bertino, S Jajodia",SIGMOD Conference,1995
