tid,id,title,authors,venue,year
69611,conf/vldb/RusinkiewiczKTWM95,Towards a Cooperative Transaction Model - The Cooperative Activity Model,"M Rusinkiewicz, W Klas, T Tesch, J Wäsch, P Muth",VLDB,1995
69612,journals/sigmod/EisenbergM02,SQL/XML is Making Good Progress,"A Eisenberg, J Melton",SIGMOD Record,2002
69613,conf/vldb/AmmannJR95,Using Formal Methods to Reason about Semantics-Based Decompositions of Transactions,"P Ammann, S Jajodia, I Ray",VLDB,1995
69616,conf/vldb/FerrandinaMZFM95,Schema and Database Evolution in the O2 Object Database System,"F Ferrandina, T Meyer, R Zicari, G Ferran, J Madec",VLDB,1995
69617,conf/vldb/SubietaKL95,Procedures in Object-Oriented Query Languages,"K Subieta, Y Kambayashi, J Leszczylowski",VLDB,1995
69618,journals/sigmod/BargaL02,Phoenix Project: Fault-Tolerant Applications,"R Barga, D Lomet",SIGMOD Record,2002
69620,conf/vldb/MoserKK95,L/MRP: A Buffer Management Strategy for Interactive Continuous Data Flows in a Multimedia DBMS,"F Moser, A Kraiss, W Klas",VLDB,1995
69622,conf/vldb/ChaudhuriGS95,Retrieval of Composite Multimedia Objects,"S Chaudhuri, S Ghandeharizadeh, C Shahabi",VLDB,1995
69623,journals/sigmod/Kosch02,MPEG-7 and Multimedia Database Systems,H Kosch,SIGMOD Record,2002
69626,conf/vldb/TreschPL95,Type Classification of Semi-Structured Documents,"M Tresch, N Palmer, A Luniewski",VLDB,1995
69629,journals/sigmod/CaplinskasEV02,Advances in Databases and Information Systems (ADBIS),"A Caplinskas, J Eder, O Vasilecas",SIGMOD Record,2002
69630,conf/vldb/SrikantA95,Mining Generalized Association Rules,"R Srikant, R Agrawal",VLDB,1995
69631,conf/vldb/HaasNSS95,Sampling-Based Estimation of the Number of Distinct Values of an Attribute,"P Haas, J Naughton, S Seshadri, L Stokes",VLDB,1995
69632,journals/sigmod/Aberer02,Book Review Column,K Aberer,SIGMOD Record,2002
69633,conf/vldb/FlodinR95,Processing Object-Oriented Queries with Invertible Late Bound Functions,"S Flodin, T Risch",VLDB,1995
69634,journals/sigmod/Kemper02,Databases and Transaction Processing: An Application-Oriented Approach - Book Review,A Kemper,SIGMOD Record,2002
69635,conf/vldb/HvasshovdTBH95,"The ClustRa Telecom Database: High Availability, High Throughput, and Real-Time Response","S Hvasshovd, Ř Torbjřrnsen, S Bratsberg, P Holager",VLDB,1995
69636,journals/sigmod/Kim02,Conceptual Modeling and Specification Generation for B2B Business Process based on ebXML,H Kim,SIGMOD Record,2002
69637,conf/vldb/LuSL95,NeuroRule: A Connectionist Approach to Data Mining,"H Lu, R Setiono, H Liu",VLDB,1995
69640,journals/sigmod/CiliaB02,An Active Functionality Service for E-Business Applications,"M Cilia, A Buchmann",SIGMOD Record,2002
69642,conf/vldb/LometT95,Redo Recovery after System Crashes,"D Lomet, M Tuttle",VLDB,1995
69645,conf/vldb/SumiyaYTSI95,A Product Specification Database for Visual Prototyping,"K Sumiya, K Yasutake, H Tanaka, N Sanada, Y Imai",VLDB,1995
69647,conf/vldb/DidriksenGD95,Database De-Centralization - A Practical Approach,"T Didriksen, C Galindo-Legaria, E Dahle",VLDB,1995
69648,journals/sigmod/HalkidiBV02,Cluster Validity Methods: Part I,"M Halkidi, Y Batistakis, M Vazirgiannis",SIGMOD Record,2002
69649,journals/sigmod/PourabbasR02,A Pictorial Query Language for Querying Geographic Databases using Positional and OLAP Operators,"E Pourabbas, M Rafanelli",SIGMOD Record,2002
69650,conf/vldb/HoelS95,Benchmarking Spatial Join Operations with Spatial Output,"E Hoel, H Samet",VLDB,1995
69654,conf/vldb/LeslieJBY95,Efficient Search of Multi-Dimensional B-Trees,"H Leslie, R Jain, D Birdsall, H Yaghmai",VLDB,1995
69655,journals/sigmod/CruzKLSWY02,Research Activities in Database Management and Information Retrieval at the University of Illinois at Chicago,"I Cruz, A Khokhar, B Liu, A Sistla, O Wolfson, C Yu",SIGMOD Record,2002
69657,journals/sigmod/LuoI02,Interviewing During a Tight Job Market,,,2002
69659,journals/sigmod/Wiegand02,Investigating XQuery for Querying Across Database Object Types,N Wiegand,SIGMOD Record,2002
69663,journals/sigmod/Ozsu02,Chair's Message,,,2002
69664,conf/vldb/Korth95,The Double Life of the Transaction Abstraction: Fundamental Principle and Evolving System Concept,H Korth,VLDB,1995
69665,journals/sigmod/Fagin02,Combining Fuzzy Information: an Overview,R Fagin,SIGMOD Record,2002
69667,conf/vldb/GoyalHSS95,Index Concurrency Control in Firm Real-Time Database Systems,"B Goyal, J Haritsa, S Seshadri, V Srinivasan",VLDB,1995
69670,journals/sigmod/Goethals02,Data Warehousing and Business Intelligence for E-Commerce - Book Review,F Goethals,SIGMOD Record,2002
69671,journals/sigmod/BerzalM02,Data Mining: Concepts and Techniques - Book Review,"F Galiano, N Marín",SIGMOD Record,2002
69672,conf/vldb/WuYCT95,A Performance Study of Workfile Disk Management for Concurrent Mergesorts in a Multiprocessor Database System,"K Wu, P Yu, J Chung, J Teng",VLDB,1995
69676,conf/vldb/JonscherD94,An Approach for Building Secure Database Federations,"D Jonscher, K Dittrich",VLDB,1994
69678,conf/vldb/JagadishLRSS94,Dalí: A High Performance Main Memory Storage Manager,"H Jagadish, D Lieuwen, R Rastogi, A Silberschatz, S Sudarshan",VLDB,1994
69681,journals/sigmod/Weikum02,Foundations of Statistical Natural Language Processing - Book Review,,,2002
69682,conf/vldb/WienerN94,Bulk Loading into an OODB: A Performance Study,"J Wiener, J Naughton",VLDB,1994
69684,journals/sigmod/Neven02,Automata Theory for XML Researchers,F Neven,SIGMOD Record,2002
69685,journals/sigmod/WinslettCDHZZ02,Database Research at the University of Illinois at Urbana-Champaign,"M Winslett, K Chang, A Doan, J Han, C Zhai, Y Zhou",SIGMOD Record,2002
69686,conf/vldb/BrownCC94,Fast Incremental Indexing for Full-Text Information Retrieval,"E Brown, J Callan, W Croft",VLDB,1994
69687,journals/sigmod/Ozsu02a,Chair's Message,,,2002
69689,journals/sigmod/Hammer02a,Treasurer's Message,,,2002
69690,conf/vldb/OuzzaniAB94,A Top-Down Approach for Two Level Serializability,"M Ouzzani, M Atroun, N Belkhodja",VLDB,1994
69692,journals/sigmod/SofferMC02,Report on the Mobile Search Workshop at WWW 2002,,,2002
69693,conf/vldb/Guting94,GraphDB: Modeling and Querying Graphs in Databases,R Güting,VLDB,1994
69695,journals/sigmod/CrestaniG02,Report on the 24th European Colloquium on Information Retrieval Research,,,2002
69697,conf/vldb/KemperK94,Dual-Buffering Strategies in Object Bases,"A Kemper, D Kossmann",VLDB,1994
69699,journals/sigmod/Winslett02b,Hector Garcia-Molina Speaks Out,M Winslett,,2002
69702,journals/sigmod/LightstoneLZ02,Toward Autonomic Computing with DB2 Universal Database,"S Lightstone, G Lohman, D Zilio",SIGMOD Record,2002
69703,journals/sigmod/RossAJS02,Reminiscences on Influential Papers,,,2002
69705,journals/sigmod/FrankNS02,Report on the Semantic Web Workshop at WWW 2002,,,2002
69706,conf/vldb/AgrawalS94,Fast Algorithms for Mining Association Rules in Large Databases,"R Agrawal, R Srikant",VLDB,1994
69708,conf/vldb/HaberIL95,OPOSSUM: Desk-Top Schema Management through Customizable Visualization,"E Haber, Y Ioannidis, M Livny",VLDB,1995
69710,conf/vldb/AgrawalPWZ95,Querying Shapes of Histories,"R Agrawal, G Psaila, E Wimmers, M Zaďt",VLDB,1995
69713,journals/sigmod/Wu02,Small Worlds: the Dynamics of Networks between Order and Randomness - Book Review,,,2002
69715,conf/vldb/Sarawagi95,Query Processing in Tertiary Memory Databases,S Sarawagi,VLDB,1995
69716,journals/sigmod/FininJ02,"Agents, Turst, and Information Access on the Semantic Web","T Finin, A Joshi",SIGMOD Record,2002
69717,journals/sigmod/SureSS02,Methodology for Development and Employment of Ontology Based Knowledge Management Applications,"Y Sure, S Staab, R Studer",SIGMOD Record,2002
69718,conf/vldb/Brin95,Near Neighbor Search in Large Metric Spaces,S Brin,VLDB,1995
69721,journals/sigmod/AnyanwuS02,The p Operator: Discovering and Ranking Associations on the Semantic Web,"K Anyanwu, A Sheth",SIGMOD Record,2002
69724,conf/vldb/Meier95,Providing Database Migration Tools - A Practicioner's Approach,A Meier,VLDB,1995
69725,journals/sigmod/Liu02b,Editor's Notes,L Liu,SIGMOD Record,2002
69729,journals/sigmod/HuangKL02,A Study on the Management of Semantic Transaction for Efficient Data Retrieval,"S Huang, I Kwan, C Li",SIGMOD Record,2002
69730,conf/vldb/SimonD95,Promises and Realities of Active Database Systems,"E Simon, A Dittrich",VLDB,1995
69732,journals/sigmod/RossAA02,Reminiscences on Influential Papers,,,2002
69740,journals/sigmod/HanBP01,Wrapping Web Data into XML,"W Han, D Buttler, C Pu",SIGMOD Record,2001
69741,journals/sigmod/Suciu01,On Database Theory and XML,D Suciu,SIGMOD Record,2001
69742,conf/vldb/ColletCS94,NAOS - Efficient and Modular Reactive Capabilities in an Object-Oriented Database System,"C Collet, T Coupaye, T Svensen",VLDB,1994
69743,journals/sigmod/Fankhauser01,XQuery Formal Semantics: State and Challenges,P Fankhauser,SIGMOD Record,2001
69745,journals/sigmod/SchmidtWKFCMB01,Why And How To Benchmark XML Databases,"A Schmidt, F Waas, M Kersten, D Florescu, M Carey, I Manolescu, R Busse",SIGMOD Record,2001
69746,conf/vldb/LevyMS94,Query Optimization by Predicate Move-Around,"A Levy, I Mumick, Y Sagiv",VLDB,1994
69748,conf/vldb/HasanM94,Optimization Algorithms for Exploiting the Parallelism-Communication Tradeoff in Pipelined Parallelism,"W Hasan, R Motwani",VLDB,1994
69749,journals/sigmod/TanakaV01,The Ecobase Project: Database and Web Technologies for Environmental Information Systems,"A Tanaka, P Valduriez",SIGMOD Record,2001
69751,conf/vldb/LiC94,Semantic Integration in Heterogeneous Databases Using Neural Networks,"W Li, C Clifton",VLDB,1994
69754,journals/sigmod/LudascherMM01,"Preservation of Digital Data with Self-Validating, Self-Instantiating Knowledge-Based Archives","B Ludäscher, R Marciano, R Moore",SIGMOD Record,2001
69756,conf/vldb/FerrandinaMZ94,Implementing Lazy Database Updates for an Object Database System,"F Ferrandina, T Meyer, R Zicari",VLDB,1994
69757,conf/vldb/TeisseirePC94,Towards Event-Driven Modelling for Database Design,"M Teisseire, P Poncelet, R Cicchetti",VLDB,1994
69759,journals/sigmod/Winslett01,"Jeffrey D. Ullman Speaks Out on the Future of Higher Education, Startups, Database Theory, and More",,,2001
69762,journals/sigmod/Bernstein01,Report on the 2001 SIGMOD and PODS Awards,,,2001
69763,journals/sigmod/BunemanFSW01,Constraints for Semi-structured Data and XML,"P Buneman, W Fan, J Siméon, S Weinstein",SIGMOD Record,2001
69764,conf/vldb/KilgerM94,Indexing Multiple Sets,"C Kilger, G Moerkotte",VLDB,1994
69765,journals/sigmod/Liu01,Editor's Notes,,,2001
69766,conf/vldb/SreenathS94,The hcC-tree: An Efficient Index Structure for Object Oriented Databases,"B Sreenath, S Seshadri",VLDB,1994
69772,conf/vldb/MuntzR94,A Requirement-Based Approach to Data Modeling and Re-Engineering,"A Muntz, C Ramiller",VLDB,1994
69774,conf/vldb/SteenhagenABB94,From Nested-Loop to Join Queries in OODB,"H Steenhagen, P Apers, H Blanken, R By",VLDB,1994
69779,journals/sigmod/Liu01a,Editor's Notes,L Liu,SIGMOD Record,2001
69781,conf/vldb/DeWittKLPY94,Client-Server Paradise,"D DeWitt, N Kabra, J Luo, J Patel, J Yu",VLDB,1994
69783,journals/sigmod/Cetintemel01,On the Academic Interview Circuit: An End-to-End Discussion,U Çetintemel,SIGMOD Record,2001
69784,conf/vldb/SripadaW94,Cumulative Updates,"S Sripada, B Wüthrich",VLDB,1994
69786,journals/sigmod/Labrinidis01,Introduction to the Career Forum Column,A Labrinidis,SIGMOD Record,2001
69790,conf/vldb/GoodmanRS94,Building a Laboratory Information System Around a C++-Based Object-Oriented DBMS,"N Goodman, S Rozen, L Stein",VLDB,1994
69791,conf/vldb/CochinwalaB94,A Multidatabase System for Tracking and Retrieval of Financial Data,"M Cochinwala, J Bradley",VLDB,1994
69794,journals/sigmod/Aberer01,Advanced XML Data Processing - Guest Editor's Introduction,K Aberer,SIGMOD Record,2001
69795,conf/vldb/IyerW94,Data Compression Support in Databases,"B Iyer, D Wilhite",VLDB,1994
69797,journals/sigmod/Hammer01,Treasurer's Message,,,2001
69800,conf/vldb/RosenthalS94,Data Integration in the Large: The Challenge of Reuse,"A Rosenthal, L Seligman",VLDB,1994
69806,conf/sigmod/BabcockO03,Distributed Top-K Monitoring,"B Babcock, C Olston",SIGMOD Conference,2003
69811,conf/vldb/MartinC94,Relating Distributed Objects,"B Martin, R Cattell",VLDB,1994
69813,conf/vldb/YanA94,Integrating a Structured-Text Retrieval System with an Object-Oriented Database System,"T Yan, J Annevelink",VLDB,1994
69815,journals/sigmod/Ozsu01a,Chair's Message,,,2001
69818,conf/vldb/ZemankovaI94,Scientific Databases - State of the Art and Future Directions,"M Zemankova, Y Ioannidis",VLDB,1994
69819,journals/sigmod/LeeF01,Mining System Audit Data: Opportunities and Challenges,"W Lee, W Fan",SIGMOD Record,2001
69820,conf/sigmod/FaginKS03,Efficient similarity search and classification via rank aggregation,"R Fagin, R Kumar, D Sivakumar",SIGMOD Conference,2003
69822,conf/sigmod/ArasuG03,Extracting Structured Data from Web Pages,"A Arasu, H Garcia-Molina",SIGMOD Conference,2003
69823,conf/sigmod/ChaudhuriGS03,Factorizing Complex Predicates in Queries to Exploit Indexes,"S Chaudhuri, P Ganesan, S Sarawagi",SIGMOD Conference,2003
69825,journals/sigmod/Scholl01,Transactional Information Systems - Book Review,,,2001
69826,conf/sigmod/IlyasRLGL03,Estimating Compilation Time of a Query Optimizer,"I Ilyas, J Rao, G Lohman, D Gao, E Lin",SIGMOD Conference,2003
69827,conf/sigmod/DeligiannakisR03,Extended Wavelets for Multiple Measures,"A Deligiannakis, N Roussopoulos",SIGMOD Conference,2003
69829,journals/sigmod/Winslett01a,"Gio Wiederhold Speaks Out on Moving into Academia in Mid-Career, How to Be an Effective Consultant, Why You Should Be a Program Manager as a Funding Agency, the Need for Ontology Algebra and Simulations, and More",,,2001
69830,conf/sigmod/BabcockBDM03,Chain : Operator Scheduling for Memory Minimization in Data Stream Systems,"B Babcock, S Babu, M Datar, R Motwani",SIGMOD Conference,2003
69833,journals/sigmod/RossHLW01,Reminiscences on Influential Papers,,,2001
69835,conf/vldb/TsatalosSI94,The GMAP: A Versatile Tool for Physical Data Independence,"O Tsatalos, M Solomon, Y Ioannidis",VLDB,1994
69836,journals/sigmod/TianDCZ02,The Design and Performance Evaluation of Alternative XML Storage Strategies,"F Tian, D DeWitt, J Chen, C Zhang",SIGMOD Record,2002
69838,conf/vldb/ChaudhuriS94,Including Group-By in Query Optimization,"S Chaudhuri, K Shim",VLDB,1994
69840,journals/sigmod/SommerGB02,The n-Tier Hub Technology,"R Sommer, T Gulledge, D Bailey",SIGMOD Record,2002
69841,journals/sigmod/Cingil02,Supporting Global User Profiles Through Trusted Authorities,I Cingil,SIGMOD Record,2002
69842,conf/vldb/DavisonG94,Memory-Contention Responsive Hash Joins,"D Davison, G Graefe",VLDB,1994
69843,journals/sigmod/QuixSJ02,Business Data Management for B2B Electronic Commerce,"C Quix, M Schoop, M Jeusfeld",SIGMOD Record,2002
69846,journals/sigmod/CuiJO02,Semantic B2B Integration: Issues in Ontology-based Applications,"Z Cui, D Jones, P O'Brien",SIGMOD Record,2002
69847,conf/vldb/LitwinNS94,RP*: A Family of Order Preserving Scalable Distributed Data Structures,"W Litwin, M Neimat, D Schneider",VLDB,1994
69848,journals/sigmod/Bussler02,The Role of B2B Engines in B2B Integration Architectures,C Bussler,SIGMOD Record,2002
69850,conf/vldb/ChawatheCY94,On Index Selection Schemes for Nested Object Hierarchies,"S Chawathe, M Chen, P Yu",VLDB,1994
69852,conf/vldb/SistlaYH94,Reasoning About Spatial Relationships in Picture Retrieval Systems,"A Sistla, C Yu, R Haddad",VLDB,1994
69853,journals/sigmod/Grefen02,What Will Be - Book Review,,,2002
69855,conf/vldb/HjelsvoldM94,Modelling and Querying Video Data,"R Hjelsvold, R Midtstraum",VLDB,1994
69857,conf/vldb/PirotteZMY94,Materialization: A Powerful and Ubiquitous Abstraction Pattern,"A Pirotte, E Zimányi, D Massart, T Yakusheva",VLDB,1994
69860,conf/vldb/NgY94,Maximizing Buffer and Disk Utilizations for News On-Demand,"R Ng, J Yang",VLDB,1994
69862,conf/vldb/PoulovassilisS94,Investigation of Algebraic Query Optimisation Techniques for Database Programming Languages,"A Poulovassilis, C Small",VLDB,1994
69864,journals/sigmod/Elderini02,Letter to SIGMOD Record Editor,N Elderini,,2002
69867,journals/sigmod/VassiliadisS99,A Survey of Logical Models for OLAP Databases,"P Vassiliadis, T Sellis",SIGMOD Record,1999
69868,conf/sigmod/LakshmananPZ03,QC-Trees: An Efficient Summary Structure for Semantic OLAP,"L Lakshmanan, J Pei, Y Zhao",SIGMOD Conference,2003
69872,journals/sigmod/KempsterST99,Diluting ACID,"T Kempster, C Stirling, P Thanisch",SIGMOD Record,1999
69874,journals/sigmod/GatziuJSV99,Design and Management of Data Warehouses: Report on the DMDW'99 Workshop,"S Gatziu, M Jeusfeld, M Staudt, Y Vassiliou",SIGMOD Record,1999
69876,journals/sigmod/Franklin99b,Editor's Notes,M Franklin,SIGMOD Record,1999
69880,conf/sigmod/AgrawalES03,Information Sharing Across Private Databases,"R Agrawal, A Evfimievski, R Srikant",SIGMOD Conference,2003
69881,journals/sigmod/DongS00,Incremental Maintenance of Recursive Views Using Relational Calculus/SQL,"G Dong, J Su",SIGMOD Record,2000
69886,conf/sigmod/GuptaLM03,BIRN-M: A Semantic Mediator for Solving Real-World Neuroscience Problems,"A Gupta, B Ludäscher, M Martone",SIGMOD Conference,2003
69888,journals/sigmod/Snodgrass00,Chair's Message,,,2000
69889,journals/sigmod/PaepckeGRC00,Beyond Document Similarity: Understanding Value-Based Search and Browsing Technologies,"A Paepcke, H Garcia-Molina, G Rodríguez-Mulŕ, J Cho",SIGMOD Record,2000
69890,conf/sigmod/AbadiCCCCEGHMRSSTXYZ03,Aurora: A Data Stream Management System,"D Abadi, D Carney, U Çetintemel, M Cherniack, C Convey, C Erwin, E Galvez, M Hatoun, A Maskey, A Rasin, A Singer, M Stonebraker, N Tatbul, Y Xing, R Yan, S Zdonik",SIGMOD Conference,2003
69893,journals/sigmod/LiefkeS00,An Extensible Compressor for XML Data,"H Liefke, D Suciu",SIGMOD Record,2000
69894,conf/sigmod/2003,"Proceedings of the 2003 ACM SIGMOD International Conference on Management of Data, San Diego, California, USA, June 9-12, 2003",,,2003
69895,journals/sigmod/Vassilakis00,An Optimisation Scheme for Coalesce/Valid Time Selection Operator Sequences,C Vassilakis,SIGMOD Record,2000
69896,conf/sigmod/Mamoulis03,Efficient Processing of Joins on Set-valued Attributes,N Mamoulis,SIGMOD Conference,2003
69897,journals/sigmod/PourabbasR00,Hierarchies and Relative Operators in the OLAP Environment,"E Pourabbas, M Rafanelli",SIGMOD Record,2000
69901,conf/sigmod/OlstonJW03,Adaptive Filters for Continuous Queries over Distributed Data Streams,"C Olston, J Jiang, J Widom",SIGMOD Conference,2003
69904,conf/sigmod/AbiteboulBCMM03,Dynamic XML documents with distribution and replication,"S Abiteboul, A Bonifati, G Cobena, I Manolescu, T Milo",SIGMOD Conference,2003
69905,journals/sigmod/Franklin00,Editor's Notes,M Franklin,SIGMOD Record,2000
69906,conf/sigmod/BabcockCD03,Dynamic Sample Selection for Approximate Query Processing,"B Babcock, S Chaudhuri, G Das",SIGMOD Conference,2003
69908,journals/sigmod/WestmannKHM00,The Implementation and Performance of Compressed Databases,"T Westmann, D Kossmann, S Helmer, G Moerkotte",SIGMOD Record,2000
69910,journals/sigmod/VetterliVS00,Metadata Standards for Data Warehousing: Open Information Model vs. Common Warehouse Metamodel,"T Vetterli, A Vaduva, M Staudt",SIGMOD Record,2000
69914,conf/sigmod/CranorJSS03,Gigascope: A Stream Database for Network Applications,"C Cranor, T Johnson, O Spatscheck, V Shkapenyuk",SIGMOD Conference,2003
69915,conf/sigmod/Bierman03,Formal semantics and analysis of object queries,G Bierman,SIGMOD Conference,2003
69916,journals/sigmod/WuY00,Report on Second International Workshop on Advanced Issues of E-Commerce and Web-based Information Systems,,,2000
69919,conf/sigmod/ReissK03,A Characterization of the Sensitivity of Query Optimization to Storage Access Cost Parameters,"F Reiss, T Kanungo",SIGMOD Conference,2003
69920,journals/sigmod/KantM00,"Workshop on Performance and Architecture of Web Servers (PAWS-2000, held in conjection with SIGMETRICS-2000)",,,2000
69921,conf/sigmod/LometT03,A Theory of Redo Recovery,"D Lomet, M Tuttle",SIGMOD Conference,2003
69923,journals/sigmod/Cruz00,SIGMOD Digital Symposium Collection (DiSC) Editor's Message,,,2000
69924,conf/sigmod/DeshpandeNGS03,Cache-and-Query for Wide Area Sensor Databases,"A Deshpande, S Nath, P Gibbons, S Seshan",SIGMOD Conference,2003
69925,conf/sigmod/LiBKN03,Composing XSL Transformations with XML Publishing Views,"C Li, P Bohannon, H Korth, P Narayan",SIGMOD Conference,2003
69926,journals/sigmod/Naughton00,SIGMOD'2000 Program Chair's Message,,,2000
69928,journals/sigmod/Mendelzon00,Information Director's Message,,,2000
69929,journals/sigmod/Ley00,SIGMOD Anthology Editor's Message,,,2000
69932,conf/sigmod/Stonebraker03,Visionary: A Next Generation Visualization System for Databases,M Stonebraker,SIGMOD Conference,2003
69934,conf/sigmod/Raghavan03,Extracting and Exploiting Structure in Text Search,P Raghavan,SIGMOD Conference,2003
69943,conf/sigmod/GotoK03,Integration of Electronic Tickets and Personal Guide System for Public Transport using Mobile Terminals,"K Goto, Y Kambayashi",SIGMOD Conference,2003
69946,journals/sigmod/TheodoridisN00,Generating Spatiotemporal Datasets on the WWW,"Y Theodoridis, M Nascimento",SIGMOD Record,2000
69947,journals/sigmod/Halevy00,Theory of Answering Queries Using Views,A Halevy,SIGMOD Record,2000
69948,conf/sigmod/KriegelBKPS03,Using Sets of Feature Vectors for Similarity Search on Voxelized CAD Objects,"H Kriegel, S Brecheisen, P Kröger, M Pfeifle, M Schubert",SIGMOD Conference,2003
69949,journals/sigmod/RashidS00,Object Database Evolution Using Separation of Concerns,"A Rashid, P Sawyer",SIGMOD Record,2000
69952,journals/sigmod/Jhingran00,Moving up the food chain: Supporting E-Commerce Applications on Databases,A Jhingran,SIGMOD Record,2000
69953,journals/sigmod/RossIJP00,Reminiscences on Influential Papers,,,2000
69959,conf/sigmod/Bosworth03,The Future of Web Services - I,A Bosworth,SIGMOD Conference,2003
69963,conf/sigmod/GangulyGR03,Processing Set Expressions over Continuous Update Streams,"S Ganguly, M Garofalakis, R Rastogi",SIGMOD Conference,2003
69965,journals/sigmod/YuenCLL00,Cache Invalidation Scheme for Mobile Computing Systems with Real-time Data,"J Yuen, E Chan, K Lam, H Leung",SIGMOD Record,2000
69966,conf/sigmod/ChaudhuriGGM03,Robust and Efficient Fuzzy Match for Online Data Cleaning,"S Chaudhuri, K Ganjam, V Ganti, R Motwani",SIGMOD Conference,2003
69968,journals/sigmod/BernsteinHP00,A Vision of Management of Complex Models,"P Bernstein, A Halevy, R Pottinger",SIGMOD Record,2000
69969,conf/sigmod/StoltePAG03,Scientific Data Repositories: Designing for a Moving Target,"E Stolte, C Praun, G Alonso, T Gross",SIGMOD Conference,2003
69971,conf/sigmod/GuptaS03,Stream Processing of XPath Queries with Predicates,"A Gupta, D Suciu",SIGMOD Conference,2003
69973,journals/sigmod/BoscMP01,Report on The fourth International Conference on Flexible Query Answering systems,,,2001
69974,conf/sigmod/PengC03,XPath Queries on Streaming Data,"F Peng, S Chawathe",SIGMOD Conference,2003
69981,conf/sigmod/QunLO03,D(k)-Index: An Adaptive Structural Summary for Graph-Structured Data,"C Qun, A Lim, K Ong",SIGMOD Conference,2003
69986,conf/sigmod/ZhuS03,Warping Indexes with Envelope Transforms for Query by Humming,"Y Zhu, D Shasha",SIGMOD Conference,2003
69988,conf/sigmod/MelnikRB03,Rondo: A Programming Platform for Generic Model Management,"S Melnik, E Rahm, P Bernstein",SIGMOD Conference,2003
69990,journals/sigmod/Aggarwal01,Re-designing Distance Functions and Distance-Based Applications for High Dimensional Data,C Aggarwal,SIGMOD Record,2001
69993,conf/sigmod/CohenM03,Spectral Bloom Filters,"S Cohen, Y Matias",SIGMOD Conference,2003
69994,journals/sigmod/PuSW01,Infosphere Project: System Support for Information Flow Applications,"C Pu, K Schwan, J Walpole",SIGMOD Record,2001
69998,journals/sigmod/ChristoffelPSL98,Electronic Market: The Roadmap for University Libraries and Members to Survive in the Information Jungle,"M Christoffel, S Pulkowski, B Schmitt, P Lockemann",SIGMOD Record,1998
69999,conf/sigmod/KaushikBNK02,Covering indexes for branching path queries,"R Kaushik, P Bohannon, J Naughton, H Korth",SIGMOD Conference,2002
70003,conf/sigmod/Grust02,Accelerating XPath location steps,T Grust,SIGMOD Conference,2002
70004,journals/sigmod/Franklin98a,Editor's Notes,M Franklin,SIGMOD Record,1998
70005,conf/sigmod/ZadorozhnyRVUB02,Efficient evaluation of queries in a mediator for WebSources,"V Zadorozhny, L Raschid, M Vidal, T Urhan, L Bright",SIGMOD Conference,2002
70009,journals/sigmod/SnodgrassHMOPRRWY98,Reminiscences on Influential Papers,,,1998
70013,journals/sigmod/ReichB98,A Componentized Architecture for Dynamic Electronic Markets,"B Reich, I Ben-Shaul",SIGMOD Record,1998
70016,journals/sigmod/JenningsNF98,ADEPT: An Agent-Based Approach to Business Process Management,"N Jennings, T Norman, P Faratin",SIGMOD Record,1998
70017,conf/sigmod/Chamberlin03,XQuery: A Query Language for XML,,,2003
70019,journals/sigmod/Dogac98,Guest Editor's Introduction,,,1998
70020,conf/sigmod/GraySSU03,The Lowell Report,"J Gray, H Schek, M Stonebraker, J Ullman",SIGMOD Conference,2003
70022,conf/sigmod/KoudasS03,Panel: Querying Networked Databases,"N Koudas, D Srivastava",SIGMOD Conference,2003
70024,journals/sigmod/Domingo-FerrerH98,An Anonymous Electronic Commerce Scheme with an Off-Line Authority and Untrusted Agents,"J Domingo-Ferrer, J Herrera-Joancomartí",SIGMOD Record,1998
70025,journals/sigmod/BuchnerM98,Discovering Internet Marketing Intelligence through Online Analytical Web Usage Mining,"A Büchner, M Mulvenna",SIGMOD Record,1998
