tid,id,title,authors,venue,year
71213,conf/vldb/RamanRH99,Online Dynamic Reordering for Interactive Data Processing,"V Raman, B Raman, J Hellerstein",VLDB,1999
71216,conf/sigmod/DuSD95,Reducing Multidatabase Query Response Time by Tree Balancing,"W Du, M Shan, U Dayal",SIGMOD Conference,1995
71218,conf/sigmod/SistlaW95,Temporal Conditions and Integrity Constraints in Active Database Systems,"A Sistla, O Wolfson",SIGMOD Conference,1995
71221,conf/vldb/FuhDCMTLDRM99,Implementation of SQL3 Structured Types with Inheritance and Value Substitutability,"Y Fuh, S Deßloch, W Chen, N Mattos, B Tran, B Lindsay, L DeMichel, S Rielau, D Mannhaupt",VLDB,1999
71225,conf/vldb/FlorescuLSY99,Optimization of Run-time Management of Data Intensive Web-sites,"D Florescu, A Levy, D Suciu, K Yagoub",VLDB,1999
71229,conf/sigmod/DanS95,An Online Video Placement Policy based on Bandwith to Space Ratio (BSR),"A Dan, D Sitaram",SIGMOD Conference,1995
71232,conf/sigmod/Team95c,Upsizing from File Server to Clent Server Architectures,T Team,SIGMOD Conference,1995
71233,conf/sigmod/Team95,"Object-Oriented, Rapid Application Development in a PC Database Environment",F Team,SIGMOD Conference,1995
71234,conf/vldb/GraefeBC98,Hash Joins and Hash Teams in Microsoft SQL Server,"G Graefe, R Bunker, S Cooper",VLDB,1998
71235,conf/sigmod/BunemanM95,The Data That You Won't Find in Databases: Tutorial panel on data exchange formats,"P Buneman, D Maier",SIGMOD Conference,1995
71237,conf/vldb/AbiteboulAAACHHMMMMSTV99,XML Repository and Active Views Demonstration,"S Abiteboul, V Aguilera, S Ailleret, B Amann, S Cluet, B Hills, F Hubert, J Mamou, A Marian, L Mignet, T Milo, C Santos, B Tessier, A Vercoustre",VLDB,1999
71240,conf/sigmod/Ellison95,Keynote Address,,,1995
71241,conf/vldb/BouganimCDDGS99,Miro Web: Integrating Multiple Data Sources through Semistructured Data Types,"L Bouganim, T Chan-Sine-Ying, T Dang-Ngoc, J Darroux, G Gardarin, F Sha",VLDB,1999
71245,conf/sigmod/Golding95,Things Every Update Replication Customer Should Know,R Golding,SIGMOD Conference,1995
71250,conf/vldb/KnorrN98,Algorithms for Mining Distance-Based Outliers in Large Datasets,"E Knorr, R Ng",VLDB,1998
71251,conf/sigmod/Bampahl95,Real World Requirements for Decision Support - Implications for RDBMS,S Bansal,SIGMOD Conference,1995
71252,conf/vldb/Ganguly98,Design and Analysis of Parametric Query Optimization Algorithms,S Ganguly,VLDB,1998
71254,conf/sigmod/French95,``One Size Fits All'' Database Architectures Do Not Work for DDS,C French,SIGMOD Conference,1995
71260,conf/sigmod/Gerber95,Informix Online XPS,R Gerber,SIGMOD Conference,1995
71261,conf/sigmod/Levine95,Order-of-Magnitude Advantage of TPC-C Though Massive Parallelism,C Levine,SIGMOD Conference,1995
71262,conf/vldb/PapadiasMD98,Algorithms for Querying by Spatial Structure,"D Papadias, N Mamoulis, V Delis",VLDB,1998
71263,conf/vldb/ZimbraoS98,A Raster Approximation For Processing of Spatial Joins,"G Zimbrao, J Souza",VLDB,1998
71264,conf/sigmod/Deutsch95,Objects and SQL: Strange Relations? Panel,D Deutsch,SIGMOD Conference,1995
71270,conf/vldb/MuthOPW98,"Design, Implementation, and Performance of the LHAM Log-Structured History Data Access Method","P Muth, P O'Neil, A Pick, G Weikum",VLDB,1998
71271,conf/sigmod/Norrie95,Integration Approaches for CIM,,,1995
71273,conf/sigmod/Gibson95,Storage Technology: RAID and Beyond,,,1995
71274,conf/vldb/ZhangL98,Buffering and Read-Ahead Strategies for External Mergesort,"W Zhang, P Larson",VLDB,1998
71277,conf/sigmod/ThomasDM95,Design and Implementation of Advanced Knowledge Processing in the KDMS KRISYS (Demonstration Description),"J Thomas, S Deßloch, N Mattos",SIGMOD Conference,1995
71279,conf/vldb/TheodoratosS97,Data Warehouse Configuration,"D Theodoratos, T Sellis",VLDB,1997
71282,conf/sigmod/MassariPSC95,QBI: Query By Icons,"A Massari, S Pavani, L Saladini, P Chrysanthis",SIGMOD Conference,1995
71283,conf/vldb/HumborstadSHT97,1-Safe Algorithms for Symmetric Site Configurations,"R Humborstad, M Sabaratnam, S Hvasshovd, Ř Torbjřrnsen",VLDB,1997
71284,conf/sigmod/BuchmannDZH95,The REACH Active OODBMS,"A Buchmann, A Deutsch, J Zimmermann, M Higa",SIGMOD Conference,1995
71287,conf/sigmod/ColletC95,The NAOS System,"C Collet, T Coupaye",SIGMOD Conference,1995
71288,conf/vldb/VassalosP97,Describing and Using Query Capabilities of Heterogeneous Sources,"V Vassalos, Y Papakonstantinou",VLDB,1997
71293,conf/sigmod/GrossmanHQ95,PTool: A Light Weight Persistent Object Manager,"R Grossman, D Hanley, X Qin",SIGMOD Conference,1995
71294,conf/vldb/AlsabtiRS97,A One-Pass Algorithm for Accurately Estimating Quantiles for Disk-Resident Data,"K Alsabti, S Ranka, V Singh",VLDB,1997
71295,conf/vldb/EicklerKK97,Finding Data in the Neighborhood,"A Eickler, A Kemper, D Kossmann",VLDB,1997
71297,conf/vldb/StathatosRB97,Adaptive Data Broadcast in Hybrid Networks,"K Stathatos, N Roussopoulos, J Baras",VLDB,1997
71300,conf/sigmod/Team95a,Paradise: A Database System for GIS Applications,P Team,SIGMOD Conference,1995
71301,conf/vldb/HelmerM97,Evaluation of Main Memory Join Algorithms for Joins with Set Comparison Join Predicates,"S Helmer, G Moerkotte",VLDB,1997
71302,conf/sigmod/LiC95,Semint: A System Prototype for Semantic Integration in Heterogeneous Databases,"W Li, C Clifton",SIGMOD Conference,1995
71304,conf/sigmod/HammerGIPUW95,"Information Translation, Mediation, and Mosaic-Based Browsing in the TSIMMIS System","J Hammer, H Garcia-Molina, K Ireland, Y Papakonstantinou, J Ullman, J Widom",SIGMOD Conference,1995
71308,conf/vldb/GibbonsMP97,Fast Incremental Maintenance of Approximate Histograms,"P Gibbons, Y Matias, V Poosala",VLDB,1997
71309,conf/vldb/ChatziantoniouR97,Groupwise Processing of Relational Queries,"D Chatziantoniou, K Ross",VLDB,1997
71312,conf/sigmod/MohanN94,ARIES/CSA: A Method for Database Recovery in Client-Server Architectures,"C Mohan, I Narang",SIGMOD Conference,1994
71317,conf/sigmod/BilirisDGJR94,ASSET: A System for Supporting Extended Transactions,"A Biliris, S Dar, N Gehani, H Jagadish, K Ramamritham",SIGMOD Conference,1994
71319,conf/vldb/ChangG97,Effective Memory Use in a Media Server,"E Chang, H Garcia-Molina",VLDB,1997
71320,conf/sigmod/JonkerS95,The ECRC Multi Database System,"W Jonker, H Schütz",SIGMOD Conference,1995
71321,conf/sigmod/HuangSW94,Data Replication for Mobile Computers,"Y Huang, A Sistla, O Wolfson",SIGMOD Conference,1994
71323,conf/sigmod/CareyFZ94,Fine-Grained Sharing in a Page Server OODBMS,"M Carey, M Franklin, M Zaharioudakis",SIGMOD Conference,1994
71325,conf/sigmod/FaloutsosRM94,Fast Subsequence Matching in Time-Series Databases,"C Faloutsos, M Ranganathan, Y Manolopoulos",SIGMOD Conference,1994
71326,conf/vldb/KumarKA97,Caprera: An Activity Framework for Transaction Processing on Wide-Area Networks,"S Kumar, E Kwang, D Agrawal",VLDB,1997
71327,conf/sigmod/KrollW94,Distributing a Search Tree Among a Growing Number of Processors,"B Kröll, P Widmayer",SIGMOD Conference,1994
71328,conf/vldb/GinisHKMT97,Data Manager for Evolvable Real-time Command and Control Systems,"E Hughes, R Ginis, B Thuraisingham, P Krupp, J Maurer",VLDB,1997
71332,conf/vldb/BernsteinHSSZ97,The Microsoft Repository,"P Bernstein, B Harry, P Sanders, D Shutt, J Zander",VLDB,1997
71333,conf/sigmod/VingralekBW94,Distributed File Organization with Scalable Cost/Performance,"R Vingralek, Y Breitbart, G Weikum",SIGMOD Conference,1994
71335,conf/sigmod/ChenR94,Adaptive Selectivity Estimation Using Query Feedback,"C Chen, N Roussopoulos",SIGMOD Conference,1994
71336,conf/vldb/WildfogelY97,Efficient Testing of High Performance Transaction Processing Systems,"D Wildfogel, R Yerneni",VLDB,1997
71338,conf/sigmod/SwamiS94,Estimating Page Fetches for Index Scans with Finite LRU Buffers,"A Swami, K Schiefer",SIGMOD Conference,1994
71339,conf/vldb/RastogiS98,PUBLIC: A Decision Tree Classifier that Integrates Building and Pruning,"R Rastogi, K Shim",VLDB,1998
71341,conf/sigmod/BilirisP94,EOS: An Extensible Object Store,"A Biliris, E Panagos",SIGMOD Conference,1994
71342,conf/vldb/RamaswamyMS98,On the Discovery of Interesting Patterns in Association Rules,"S Ramaswamy, S Mahajan, A Silberschatz",VLDB,1998
71346,conf/vldb/GehrkeRG98,RainForest - A Framework for Fast Decision Tree Construction of Large Datasets,"J Gehrke, R Ramakrishnan, V Ganti",VLDB,1998
71352,conf/sigmod/Vaskevitch94,Database in Crisis and Transition: A Technical Agenda for the Year 2001,D Vaskevitch,SIGMOD Conference,1994
71355,conf/sigmod/GravanoGT94,The Effectiveness of GlOSS for the Text Database Discovery Problem,"L Gravano, H Garcia-Molina, A Tomasic",SIGMOD Conference,1994
71363,conf/sigmod/BarbaraI94,Sleepers and Workaholics: Caching Strategies in Mobile Environments,"D Barbará, T Imielinski",SIGMOD Conference,1994
71364,conf/vldb/LakshmiZ98,Selectivity Estimation in Extensible Databases - A Neural Network Approach,"M Lakshmi, S Zhou",VLDB,1998
71365,conf/sigmod/Ballinger94,Evolving Teradata Decision Support for Massively Parallel Processing with UNIX,C Ballinger,SIGMOD Conference,1994
71366,conf/vldb/Slutz98,Massive Stochastic Testing of SQL,D Slutz,VLDB,1998
71367,conf/vldb/DoDJJR98,Issues in Developing Very Large Data Warehouses,"L Do, P Drew, W Jin, V Jumani, D Rossum",VLDB,1998
71368,conf/sigmod/BersonGMJ94,Staggered Striping in Multimedia Information Systems,"S Berson, S Ghandeharizadeh, R Muntz, X Ju",SIGMOD Conference,1994
71370,conf/vldb/BonczRK98,The Drill Down Benchmark,"P Boncz, T Rühl, F Kwakkel",VLDB,1998
71371,conf/vldb/Sterling98,The National Medical Knowledge Bank,W Sterling,VLDB,1998
71375,conf/vldb/BelloDDFNSWZ98,Materialized Views in Oracle,"R Bello, K Dias, A Downing, J Jr., J Finnerty, W Norcott, H Sun, A Witkowski, M Ziauddin",VLDB,1998
71378,conf/sigmod/ConsensM94,Optimizing Queries on Files,"M Consens, T Milo",SIGMOD Conference,1994
71380,conf/vldb/Schoning98,The ADABAS Buffer Pool Manager,H Schöning,VLDB,1998
71381,conf/sigmod/BrinkhoffKSS94,Multi-Step Processing of Spatial Joins,"T Brinkhoff, H Kriegel, R Schneider, B Seeger",SIGMOD Conference,1994
71385,conf/sigmod/PangCL94,Managing Memory for Real-Time Queries,"H Pang, M Carey, M Livny",SIGMOD Conference,1994
71387,conf/vldb/Orenstein98,Starting (and Sometimes Ending) a Database Company,J Orenstein,VLDB,1998
71388,conf/sigmod/CareyDFHMNSSTTWZ94,Shoring Up Persistent Applications,"M Carey, D DeWitt, M Franklin, N Hall, M McAuliffe, J Naughton, D Schuh, M Solomon, C Tan, O Tsatalos, S White, M Zwilling",SIGMOD Conference,1994
71391,conf/sigmod/McIverK94,"Self-Adaptive, On-Line Reclustering of Complex Object Data","W Jr., R King",SIGMOD Conference,1994
71394,conf/vldb/Mina98,MapInfo SpatialWare: A Spatial Information Server for RDBMS,C Mina,VLDB,1998
71395,conf/sigmod/Hellerstein94,Practical Predicate Placement,J Hellerstein,SIGMOD Conference,1994
71399,conf/vldb/MaratheS97,A Language for Manipulating Arrays,"A Marathe, K Salem",VLDB,1997
71406,conf/sigmod/Fernandez94,Red Brick Warehouse: A Read-Mostly RDBMS for Open SMP Platforms,P Fernandez,SIGMOD Conference,1994
71408,conf/sigmod/Ubell94,The Montage Extensible DataBlade Achitecture,M Ubell,SIGMOD Conference,1994
71409,conf/sigmod/Pirahesh94,Object-Oriented Features of DB2 Client/Server,H Pirahesh,SIGMOD Conference,1994
71410,conf/vldb/GardarinST96,"Calibrating the Query Optimizer Cost Model of IRO-DB, an Object-Oriented Federated Database System","G Gardarin, F Sha, Z Tang",VLDB,1996
71415,conf/sigmod/Melling94,Enterprise Information Architectures -- They're Finally Changing,W Melling,SIGMOD Conference,1994
71416,conf/vldb/KornSFSP96,Fast Nearest Neighbor Search in Medical Image Databases,"F Korn, N Sidiropoulos, C Faloutsos, E Siegel, Z Protopapas",VLDB,1996
71417,conf/sigmod/SinghTW94,Relaxed Transaction Processing,"M Singh, C Tomlinson, D Woelk",SIGMOD Conference,1994
71421,conf/sigmod/GorelikWD94,Sybase Replication Server,"A Gorelik, Y Wang, M Deppe",SIGMOD Conference,1994
71427,conf/sigmod/Cattell94,ODMG-93: A Standard for Object-Oriented DBMSs,R Cattell,SIGMOD Conference,1994
71428,conf/vldb/LabioG96,Efficient Snapshot Differential Algorithms for Data Warehousing,"W Labio, H Garcia-Molina",VLDB,1996
71430,conf/sigmod/Kim94,UniSQL/X Unified Relational and Object-Oriented Database System,W Kim,SIGMOD Conference,1994
71431,conf/vldb/SevcikK96,Filter Trees for Managing Spatial Data over a Range of Size Granularities,"K Sevcik, N Koudas",VLDB,1996
71432,conf/sigmod/LaursenOP94,Oracle Media Server: Providing Consumer Based Interactive Access to Multimedia Data,"A Laursen, J Olkin, M Porter",SIGMOD Conference,1994
71436,journals/sigmod/Liu03c,Editor's Notes,L Liu,SIGMOD Record,2003
71437,conf/vldb/ChaudhuriS96,Optimization of Queries with User-defined Predicates,"S Chaudhuri, K Shim",VLDB,1996
71441,conf/vldb/ScheuermannSV96,WATCHMAN : A Data Warehouse Intelligent Cache Manager,"P Scheuermann, J Shim, R Vingralek",VLDB,1996
71442,conf/sigmod/HanFHCC94,DBLearn: A System Prototype for Knowledge Discovery in Relational Databases,"J Han, Y Fu, Y Huang, Y Cai, N Cercone",SIGMOD Conference,1994
71443,conf/vldb/BerchtoldKK96,The X-tree : An Index Structure for High-Dimensional Data,"S Berchtold, D Keim, H Kriegel",VLDB,1996
71444,journals/sigmod/AilamakiFFSV03,An environmental sensor network to determine drinking water quality and security,"A Ailamaki, C Faloutsos, P Fischbeck, M Small, J VanBriesen",SIGMOD Record,2003
71445,journals/sigmod/BonnetBDL03,Bluetooth-based sensor networks,"P Bonnet, A Beaufour, M Dydensborg, M Leopold",SIGMOD Record,2003
71450,journals/sigmod/Date03,Edgar F. Codd: a tribute and personal memoir,C Date,SIGMOD Record,2003
71451,conf/sigmod/TheodoulidisAACKS94,The ORES Temporal Database Management System,"B Theodoulidis, A Ait-Braham, G Andrianopoulos, J Chaudhary, G Karvelis, S Sou",SIGMOD Conference,1994
71453,conf/vldb/Mohan96,DWMS: Data Warehouse Management System,N Mohan,VLDB,1996
71458,conf/vldb/Sheth96,Bellcore's ADAPT/X Harness System for Managing Information on Internet and Intranets,A Sheth,VLDB,1996
71459,conf/vldb/Klots96,Cache Coherency in Oracle Parallel Server,B Klots,VLDB,1996
71461,conf/vldb/Padmanabhan96,Extracting Large Data Sets using DB2 Parallel Edition,S Padmanabhan,VLDB,1996
71467,journals/sigmod/TanK03,Power efficient data gathering and aggregation in wireless sensor networks,"H Tan, I Korpeoglu",SIGMOD Record,2003
71471,journals/sigmod/CalvaneseGLV03,Reasoning on regular path queries,"D Calvanese, G Giacomo, M Lenzerini, M Vardi",SIGMOD Record,2003
71476,conf/vldb/BaralisPT97,Materialized Views Selection in a Multidimensional Database,"E Baralis, S Paraboschi, E Teniente",VLDB,1997
71477,journals/sigmod/WangD03,Review of Web caching and replication by Michael Rabinovich and Oliver Spatscheck. Addison Wesley 2002,,,2003
71479,conf/vldb/WangYM97,STING: A Statistical Information Grid Approach to Spatial Data Mining,"W Wang, J Yang, R Muntz",VLDB,1997
71480,journals/sigmod/GalianoM03,"Review of Data on the Web: from relational to semistructured data and XML by Serge Abiteboul, Peter Buneman, and Dan Suciu. Morgan Kaufmann 1999",,,2003
71481,journals/sigmod/Wiegand03,"Review of Spatial databases with application to GIS by Philippe Rigaux, Michel Scholl, and Agnes Voisard. Morgan Kaufmann 2002",,,2003
71483,journals/sigmod/KannanKIK03,Energy and rate based MAC protocol for wireless sensor networks,"R Kannan, R Kalidindi, S Iyengar, V Kumar",SIGMOD Record,2003
71485,conf/vldb/NgC97,Integrating Reliable Memory in Databases,"W Ng, P Chen",VLDB,1997
71486,journals/sigmod/PalpanasPKG03,Distributed deviation detection in sensor networks,"T Palpanas, D Papadopoulos, V Kalogeraki, D Gunopulos",SIGMOD Record,2003
71488,journals/sigmod/Aberer03d,Book review column,K Aberer,SIGMOD Record,2003
71490,conf/vldb/LlirbatST97,Using Versions in Update Transactions: Application to Integrity Checking,"F Llirbat, E Simon, D Tombroff",VLDB,1997
71496,journals/sigmod/ChengP03,Managing uncertainty in sensor database,"R Cheng, S Prabhakar",SIGMOD Record,2003
71497,conf/vldb/Jamil97,Implementing Abstract Objects with Inheritance in Datalogneg,H Jamil,VLDB,1997
71498,journals/sigmod/DemersGRTY03,The Cougar Project: a work-in-progress report,"A Demers, J Gehrke, R Rajaraman, A Trigoni, Y Yao",SIGMOD Record,2003
71502,journals/sigmod/NejdlSS03,Design issues and challenges for RDF- and schema-based peer-to-peer systems,"W Nejdl, W Siberski, M Sintek",SIGMOD Record,2003
71503,journals/sigmod/Hammer03,Treasurer's Message,,,2003
71504,conf/vldb/BridgeJKLLM97,The Oracle Universal Server Buffer,"W Bridge, A Joshi, M Keihl, T Lahiri, J Loaiza, N MacNaughton",VLDB,1997
71505,journals/sigmod/Ozsu03a,Chair's Message,,,2003
71506,conf/vldb/LockemannKKKN97,"The Network as a Global Database: Challenges of Interoperability, Proactivity, Interactiveness, Legacy","P Lockemann, U Kölsch, A Koschel, R Kramer, R Nikolai, M Wallrath, H Walter",VLDB,1997
71508,journals/sigmod/Snodgrass03b,Journal relevance,R Snodgrass,SIGMOD Record,2003
71509,conf/vldb/ChavdaW97,Towards an ODMG-Compliant Visual Object Query Language,"M Chavda, P Wood",VLDB,1997
71510,journals/sigmod/Chamberlin03,2003 SIGMOD Innovations Award Speech,D Chamberlin,SIGMOD Record,2003
71511,journals/sigmod/Aberer03c,Guest editor's introduction,,,2003
71513,conf/vldb/GarofalakisOS97,Resource Scheduling in Enhanced Pay-Per-View Continuous Media Databases,"M Garofalakis, B Özden, A Silberschatz",VLDB,1997
71519,conf/vldb/ChakrabartiDAR97,"Using Taxonomy, Discriminants, and Signatures for Navigating in Text Databases","S Chakrabarti, B Dom, R Agrawal, P Raghavan",VLDB,1997
71521,journals/sigmod/MotroA03,Report on FQAS 2002: fifth international conference on flexible query answering systems,,,2003
71523,conf/vldb/HaasKWY97,Optimizing Queries Across Diverse Data Sources,"L Haas, D Kossmann, E Wimmers, J Yang",VLDB,1997
71524,journals/sigmod/Liu03b,Editor's Notes,L Liu,SIGMOD Record,2003
71525,conf/vldb/KraissW97,Vertical Data Migration in Large Near-Line Document Archives Based on Markov-Chain Predictions,"A Kraiss, G Weikum",VLDB,1997
71528,conf/vldb/GarofalakisI97,Parallel Query Scheduling and Optimization with Time- and Space-Shared Resources,"M Garofalakis, Y Ioannidis",VLDB,1997
71530,conf/vldb/ClaussenKMP97,Optimizing Queries with Universal Quantification in Object-Oriented and Object-Relational Databases,"J Claußen, A Kemper, G Moerkotte, K Peithner",VLDB,1997
71532,journals/sigmod/Liu03a,Editor's Notes,L Liu,SIGMOD Record,2003
71533,conf/vldb/AmsalegFG95,Efficient Incremental Garbage Collection for Client-Server Object Database Systems,"L Amsaleg, M Franklin, O Gruber",VLDB,1995
71534,journals/sigmod/JukicNV03,Closing the key loophole in MLS databases,"N Jukic, S Nestorov, S Vrbsky",SIGMOD Record,2003
71541,journals/sigmod/Anisimov03,"Review of The data warehouse toolkit: the complete guide to dimensional modeling (2nd edition) by Ralph Kimball, Margy Ross. John Wiley & Sons, Inc. 2002",,,2003
71544,journals/sigmod/Winslett03b,Interview with Rakesh Agrawal,,,2003
71547,journals/sigmod/Ouksel03,In-context peer-to-peer information filtering on the Web,A Ouksel,SIGMOD Record,2003
71548,conf/vldb/Sullivan96,Tribeca: A Stream Database Manager for Network Traffic Analysis,M Sullivan,VLDB,1996
71551,conf/vldb/Celis96,The Query Optimizer in Tandem's new ServerWare SQL Product,P Celis,VLDB,1996
71552,journals/sigmod/ArenasKKKMM03,The hyperion project: from data integration to data coordination,"M Arenas, V Kantere, A Kementsietsidis, I Kiringa, R Miller, J Mylopoulos",SIGMOD Record,2003
71556,journals/sigmod/Hellerstein03,Toward network data independence,J Hellerstein,SIGMOD Record,2003
71560,conf/vldb/Sacks-Davis96,The Structured Information Manager: A Database System for SGML Documents,R Sacks-Davis,VLDB,1996
71561,conf/vldb/Raghavan96,Loading the Data Warehouse Across Various Parallel Architectures,V Raghavan,VLDB,1996
71562,journals/sigmod/AbererCDDHPS03,P-Grid: a self-organizing structured P2P system,"K Aberer, P Cudré-Mauroux, A Datta, Z Despotovic, M Hauswirth, M Punceva, R Schmidt",SIGMOD Record,2003
71563,journals/sigmod/WeikumSR03,"Report on the 10th Conference on Database Systems for Business, Technology, and the Web (BTW 2003)",,,2003
71566,journals/sigmod/RossNO03,Reminiscences on Influential Papers,,,2003
71567,journals/sigmod/ChongFTSYKDJJ03,A mapping mechanism to support bitmap index and other auxiliary structures on tables stored as primary B+-trees,"E Chong, J Srinivasan, S Das, C Freiwald, A Yalamanchi, M Jagannath, A Tran, R Krishnan, R Jiang",SIGMOD Record,2003
71568,conf/vldb/RahmM95,Dynamic Multi-Resource Load Balancing in Parallel Database Systems,"E Rahm, R Marek",VLDB,1995
71570,conf/vldb/BassiliadesV95,A Non-Uniform Data Fragmentation Strategy for Parallel Main-Menory Database Systems,"N Bassiliades, I Vlahavas",VLDB,1995
71572,conf/vldb/CabreraRH95,Applying Database Technology in the ADSM Mass Storage System,"L Cabrera, R Rees, W Hineman",VLDB,1995
71573,journals/sigmod/Nascimento03,Peer-to-peer: harnessing the power of disruptive technologies,M Nascimento,SIGMOD Record,2003
71575,journals/sigmod/Hoffner03,Fundamentals of data warehouses: 2nd revised and extended edition,V Hoffner,SIGMOD Record,2003
71576,conf/vldb/MillinerBP95,A Scalable Architecture for Autonomous Heterogeneous Database Interactions,"S Milliner, A Bouguettaya, M Papazoglou",VLDB,1995
71577,conf/vldb/AgrawalLSS95,"Fast Similarity Search in the Presence of Noise, Scaling, and Translation in Time-Series Databases","R Agrawal, K Lin, H Sawhney, K Shim",VLDB,1995
71579,journals/sigmod/FifeG03,Research issues for data communication in mobile ad-hoc network database systems,"L Fife, L Gruenwald",SIGMOD Record,2003
71582,journals/sigmod/dOnofrioP03,Modelling temporal thematic map contents,"A d'Onofrio, E Pourabbas",SIGMOD Record,2003
71586,journals/sigmod/GolabO03,Issues in data stream management,"L Golab, M Özsu",SIGMOD Record,2003
71588,conf/vldb/GuptaHQ95,Aggregate-Query Processing in Data Warehousing Environments,"A Gupta, V Harinarayan, D Quass",VLDB,1995
71590,conf/vldb/YanL95,Eager Aggregation and Lazy Aggregation,"W Yan, P Larson",VLDB,1995
71591,journals/sigmod/Aberer03b,Book review column,K Aberer,SIGMOD Record,2003
71592,conf/vldb/GardarinGT95,A Cost Model for Clustered Object-Oriented Databases,"G Gardarin, J Gruser, Z Tang",VLDB,1995
71593,conf/vldb/BelussiF95,Estimating the Selectivity of Spatial Queries Using the `Correlation' Fractal Dimension,"A Belussi, C Faloutsos",VLDB,1995
71594,journals/sigmod/MukhopadhyayGS03,An approach to confidence based page ranking for user oriented Web search,"D Mukhopadhyay, D Giri, S Singh",SIGMOD Record,2003
71595,journals/sigmod/Snodgrass03,ACM TODS in this Internet Age,R Snodgrass,SIGMOD Record,2003
71597,conf/vldb/ChatziantoniouR96,Querying Multiple Features of Groups in Relational Databases,"D Chatziantoniou, K Ross",VLDB,1996
71599,conf/vldb/FaloutsosMS96,Modeling Skewed Distribution Using Multifractals and the `80-20' Law,"C Faloutsos, Y Matias, A Silberschatz",VLDB,1996
71600,journals/sigmod/GottlobKP03,XPath Processing in a Nutshell,"G Gottlob, C Koch, R Pichler",SIGMOD Record,2003
71603,journals/sigmod/BertinoEH03,A Database Approach to Quality of Service Specification in Video Databases,"E Bertino, A Elmagarmid, M Hacid",SIGMOD Record,2003
71607,conf/vldb/PapakonstantinouAG96,Object Fusion in Mediator Systems,"Y Papakonstantinou, S Abiteboul, H Garcia-Molina",VLDB,1996
71609,journals/sigmod/ChakravarthyAEFO03,Database Research at UT Arlington,"S Chakravarthy, Y Aslandogan, R Elmasri, L Fegaras, J Oh",SIGMOD Record,2003
71610,conf/vldb/VermeerA96,The Role of Integrity Constraints in Database Interoperation,"M Vermeer, P Apers",VLDB,1996
71614,conf/vldb/WangC03,Avoiding Ordering and Grouping In Query Processing,"X Wang, M Cherniack",VLDB,2003
71616,conf/vldb/IlyasAE03,Supporting Top-k Join Queries in Relational Databases,"I Ilyas, W Aref, A Elmagarmid",VLDB,2003
71617,conf/vldb/PapadiasTS03,The TPR*-Tree: An Optimized Spatio-Temporal Access Method for Predictive Queries,"Y Tao, D Papadias, J Sun",VLDB,2003
71618,conf/vldb/KoudasGGSV03,Efficient Approximation Of Optimization Queries Under Parametric Aggregation Constraints,"S Guha, D Gunopulos, N Koudas, D Srivastava, M Vlachos",VLDB,2003
71621,conf/vldb/VieiraM03,A Dependability Benchmark for OLTP Application Environments,"M Vieira, H Madeira",VLDB,2003
71622,conf/vldb/ChaudhuriGN03,Primitives for Workload Summarization and Implications for SQL,"S Chaudhuri, P Ganesan, V Narasayya",VLDB,2003
71624,conf/vldb/HelmerNM03,Estimating the Output Cardinality of Partial Preaggregation with a Measure of Clusteredness,"S Helmer, T Neumann, G Moerkotte",VLDB,2003
71626,conf/vldb/YuAA03,Tabular Placement of Relational Data on MEMS-based Storage Devices,"H Yu, D Agrawal, A Abbadi",VLDB,2003
71627,conf/vldb/LiuLBHTS03,Capturing Global Transactions from Multiple Recovery Log Files in a Partitioned Database System,"C Liu, B Lindsay, S Bourbonnais, E Hamel, T Truong, J Stankiewitz",VLDB,2003
71628,conf/vldb/FlorescuHKLRWCSA03,The BEA/XQRL Streaming XQuery Processor,"D Florescu, C Hillery, D Kossmann, P Lucas, F Riccardi, T Westmann, M Carey, A Sundararajan, G Agrawal",VLDB,2003
71631,conf/vldb/AnKR03,Improving Performance with Bulk-Inserts in Oracle R-Trees,"N An, K Kanth, S Ravada",VLDB,2003
71632,conf/vldb/Galindo-LegariaJWW03,Statistics on Views,"C Galindo-Legaria, M Joshi, F Waas, M Wu",VLDB,2003
71633,conf/vldb/BhattacharjeePMLCH03,Efficient Query Processing for Multi-Dimensionally Clustered Tables in DB2,"B Bhattacharjee, S Padmanabhan, T Malkemus, T Lai, L Cranston, M Huras",VLDB,2003
71637,conf/vldb/BawaBA03,Privacy-Preserving Indexing of Documents on the Network,"M Bawa, R Jr., R Agrawal",VLDB,2003
