tid,id,title,authors,venue,year
70425,conf/sigmod/ShenoyHSBBS00,Turbo-charging Vertical Mining of Large Databases,"P Shenoy, J Haritsa, S Sudarshan, G Bhalotia, M Bawa, D Shah",SIGMOD Conference,2000
70428,conf/sigmod/HsiaoN00,DLFM: A Transactional Resource Manager,"H Hsiao, I Narang",SIGMOD Conference,2000
70429,journals/sigmod/SchlageterBHMSW95,The Database Group at University of Hagen (FernUniversitaet),"G Schlageter, T Berkel, E Heuel, S Mittrach, A Scherer, W Wilkes",SIGMOD Record,1995
70430,conf/sigmod/Ross00,Expressing Business Rules,R Ross,SIGMOD Conference,2000
70431,conf/sigmod/Jhingran00,Anatomy of a Real E-Commerce System,A Jhingran,SIGMOD Conference,2000
70436,journals/sigmod/Jannink95,Implementing Deletion in B+-Trees,J Jannink,SIGMOD Record,1995
70438,conf/sigmod/WangSSZZW00,An Approximate Search Engine for Structural Databases,"J Wang, X Wang, D Shasha, B Shapiro, K Zhang, X Zheng, Q Ma, Z Weinberg",SIGMOD Conference,2000
70441,conf/sigmod/Galhardas00,AJAX: An Extensible Data Cleaning Tool,"H Galhardas, D Florescu, D Shasha, E Simon",SIGMOD Conference,2000
70442,journals/sigmod/DarwenD95,The Third Manifesto,"H Darwen, C Date",SIGMOD Record,1995
70443,conf/sigmod/LitwinS00,LH*RS: A High-Availability Scalable Distributed Data Structure using Reed Solomon Codes,"W Litwin, T Schwarz",SIGMOD Conference,2000
70445,journals/sigmod/Qian95b,"Opportunities at ARPA, NSF, and Elsewhere",X Qian,SIGMOD Record,1995
70446,conf/sigmod/GoldmanW00,WSQ/DSQ: A Practical Approach for Combined Querying of Databases and the Web,"R Goldman, J Widom",SIGMOD Conference,2000
70447,journals/sigmod/EnglertGH95,Parallelism and its Price: A Case Study of NonStop SQL/MP,"S Englert, R Glasstone, W Hasan",SIGMOD Record,1995
70450,conf/sigmod/LeeKOTM00,Towards Self-Tuning Data Placement in Parallel Database Systems,"M Lee, M Kitsuregawa, B Ooi, K Tan, A Mondal",SIGMOD Conference,2000
70453,journals/sigmod/Bohlen95,Temporal Database System Implementations,M Böhlen,SIGMOD Record,1995
70454,conf/sigmod/ChenJDTW00,NiagaraCQ: A Scalable Continuous Query System for Internet Databases,"J Chen, D DeWitt, F Tian, Y Wang",SIGMOD Conference,2000
70455,journals/sigmod/WolfsonSDNR95,View Maintenance in Mobile Computing,"O Wolfson, A Sistla, S Dao, K Narayanan, R Raj",SIGMOD Record,1995
70456,conf/sigmod/BarclaySG00,TerraServer: A Spatial Data Warehouse,"T Barclay, D Slutz, J Gray",SIGMOD Conference,2000
70457,conf/sigmod/SaltenisJLL00,Indexing the Positions of Continuously Moving Objects,"S Saltenis, C Jensen, S Leutenegger, M Lopez",SIGMOD Conference,2000
70458,journals/sigmod/AlonsoCIM95,Managing Video Data in a Mobile Environment,"R Alonso, Y Chang, L Iftode, V Mani",SIGMOD Record,1995
70459,conf/sigmod/SalemBCL00,How To Roll a Join: Asynchronous Incremental View Maintenance,"K Salem, K Beyer, R Cochrane, B Lindsay",SIGMOD Conference,2000
70462,conf/sigmod/ChristophidesCS00,On Wrapping Query Languages and Efficient XML Integration,"V Christophides, S Cluet, J Siméon",SIGMOD Conference,2000
70464,conf/sigmod/BreunigKNS00,LOF: Identifying Density-Based Local Outliers,"M Breunig, H Kriegel, R Ng, J Sander",SIGMOD Conference,2000
70466,journals/sigmod/DunhamH95,From the Guest Editors - Special Section on Data Management Issues in Mobile Computing,"M Dunham, A Helal",,1995
70467,journals/sigmod/BhargavaAP95,Digital Library Services in Mobile Computing,"B Bhargava, M Annamalai, E Pitoura",SIGMOD Record,1995
70468,conf/sigmod/FaloutsosSTT00,Spatial Join Selectivity Using Power Laws,"C Faloutsos, B Seeger, A Traina, C Jr.",SIGMOD Conference,2000
70469,conf/sigmod/KornM00,Influence Sets Based on Reverse Nearest Neighbor Queries,"F Korn, S Muthukrishnan",SIGMOD Conference,2000
70473,journals/sigmod/NobleS95,A Research Status Report on Adaptation for Mobile Data Access,"B Noble, M Satyanarayanan",SIGMOD Record,1995
70475,journals/sigmod/Fong95,Mapping Extended Entity Relationship Model to Object Modeling Technique,J Fong,SIGMOD Record,1995
70476,conf/sigmod/Nori00,Application Architecture: 2Tier or 3Tier? What is DBMS's Role? (Panel Abstract),A Nori,SIGMOD Conference,2000
70479,journals/sigmod/MaelbranckeO95,Optimizing Jan Jannink's Implementation of B+-tree Deletion,"R Maelbrancke, H Olivie",SIGMOD Record,1995
70483,conf/sigmod/BlakeleyD00,Tutorial: Data Access,,,2000
70484,journals/sigmod/Richey95,Condition Handling in SQL Persistent Stored Modules,J Richey,SIGMOD Record,1995
70485,journals/sigmod/RosenthalSMBTL95,Data Management Research at The MITRE Corporation,"A Rosenthal, L Seligman, C McCollum, B Blaustein, B Thuraisingham, E Lafferty",SIGMOD Record,1995
70492,journals/sigmod/Wong95,An Introduction to Remy's Fast Polymorphic Record Projection,L Wong,SIGMOD Record,1995
70494,conf/sigmod/AgrawalS00,Privacy-Preserving Data Mining,"R Agrawal, R Srikant",SIGMOD Conference,2000
70499,conf/sigmod/ChenCPPSTM00,Internet Traffic Warehouse,"C Chen, M Cochinwala, C Petrone, M Pucci, S Samtani, P Santa, M Mesiti",SIGMOD Conference,2000
70502,journals/sigmod/Finkelstein95,The New Middleware,R Finkelstein,SIGMOD Record,1995
70504,conf/sigmod/PonnekantiK00,Online Index Rebuild,"N Ponnekanti, H Kodavalla",SIGMOD Conference,2000
70505,journals/sigmod/Alonso95a,Trade Press News,,,1995
70508,conf/sigmod/BressanGOT00,Integrating Replacement Policies in StorM: An Extensible Approach,"C Goh, B Ooi, S Bressan, K Tan",SIGMOD Conference,2000
70514,conf/sigmod/AggarwalPWYP99,Fast Algorithms for Projected Clustering,"C Aggarwal, C Procopiuc, J Wolf, P Yu, J Park",SIGMOD Conference,1999
70515,conf/sigmod/HsuLG00,Image Mining in IRIS: Integrated Retinal Information System,"W Hsu, M Lee, K Goh",SIGMOD Conference,2000
70517,journals/tods/Chomicki03,Preference formulas in relational queries,J Chomicki,ACM Trans. Database Syst.,2003
70521,conf/sigmod/LiBCS00,SPIRE: A Progressive Content-Based Spatial Image Retrieval Engine,"C Li, L Bergman, V Castelli, J Smith",SIGMOD Conference,2000
70524,journals/sigmod/DreyerDS94,Research Perspectives for Time Series Management Systems,"W Dreyer, A Dittrich, D Schmidt",SIGMOD Record,1994
70525,journals/sigmod/DiazJPa94,Supporting Dynamic Displays Using Active Rules,"O Díaz, A Jaime, N Paton, G al-Qaimari",SIGMOD Record,1994
70527,journals/sigmod/Snodgrass94,Overview of the Special Section on Temporal Database Infrastructure,R Snodgrass,SIGMOD Record,1994
70529,conf/sigmod/PeiMHZ00,Towards Data Mining Benchmarking: A Testbed for Performance Study of Frequent Pattern Mining,"J Pei, R Mao, K Hu, H Zhu",SIGMOD Conference,2000
70533,journals/sigmod/Loeffen94,Text Databases: A Survey of Text Models and Systems,A Loeffen,SIGMOD Record,1994
70535,journals/sigmod/NorrieBSW94,The Database Research Group at ETH Zurich,"M Norrie, S Blott, H Schek, G Weikum",SIGMOD Record,1994
70539,conf/sigmod/YerneniLGU99,Computing Capabilities of Mediators,"R Yerneni, C Li, H Garcia-Molina, J Ullman",SIGMOD Conference,1999
70541,conf/sigmod/Keim99,Efficient Geometry-based Similarity Search of 3D Spatial Databases,D Keim,SIGMOD Conference,1999
70543,conf/sigmod/DavulcuFKR99,A Layered Architecture for Querying Dynamic Web Content,"H Davulcu, J Freire, M Kifer, I Ramakrishnan",SIGMOD Conference,1999
70544,journals/tods/FernandezKSMT02,SilkRoute: A framework for publishing relational data in XML,"M Fernandez, Y Kadiyska, D Suciu, A Morishima, W Tan",ACM Trans. Database Syst.,2002
70545,journals/tods/CiacciaP02,Searching in metric spaces with user-defined and approximate distances,"P Ciaccia, M Patella",ACM Trans. Database Syst.,2002
70546,conf/sigmod/CallanCD99,Automatic Discovery of Language Models for Text Databases,"J Callan, M Connell, A Du",SIGMOD Conference,1999
70547,conf/sigmod/BeyerR99,Bottom-Up Computation of Sparse and Iceberg CUBEs,"K Beyer, R Ramakrishnan",SIGMOD Conference,1999
70548,journals/tods/GibbonsMP02,Fast incremental maintenance of approximate histograms,"P Gibbons, Y Matias, V Poosala",ACM Trans. Database Syst.,2002
70551,conf/sigmod/AggarwalWY99,A New Method for Similarity Indexing of Market Basket Data,"C Aggarwal, J Wolf, P Yu",SIGMOD Conference,1999
70552,journals/tods/ChakrabartiKMP02,Locally adaptive dimensionality reduction for indexing large time series databases,"K Chakrabarti, E Keogh, S Mehrotra, M Pazzani",ACM Trans. Database Syst.,2002
70553,journals/tods/TaoPZ02,Cost models for overlapping and multiversion structures,"Y Tao, D Papadias, J Zhang",ACM Trans. Database Syst.,2002
70555,conf/sigmod/ChanI99,An Efficient Bitmap Encoding Scheme for Selection Queries,"C Chan, Y Ioannidis",SIGMOD Conference,1999
70556,journals/tods/JacoxS03,Iterative spatial join,"E Jacox, H Samet",ACM Trans. Database Syst.,2003
70557,conf/sigmod/VitterW99,Approximate Computation of Multidimensional Aggregates of Sparse Data Using Wavelets,"J Vitter, M Wang",SIGMOD Conference,1999
70559,conf/sigmod/IvesFFLW99,An Adaptive Query Execution System for Data Integration,"Z Ives, D Florescu, M Friedman, A Levy, D Weld",SIGMOD Conference,1999
70560,journals/tods/TaoP03,Spatial queries in dynamic environments,"Y Tao, D Papadias",ACM Trans. Database Syst.,2003
70561,conf/sigmod/BlohsfeldKS99,A Comparison of Selectivity Estimators for Range Queries on Metric Attributes,"B Blohsfeld, D Korus, B Seeger",SIGMOD Conference,1999
70563,conf/sigmod/Jamil99,Belief Reasoning in MLS Deductive Databases,H Jamil,SIGMOD Conference,1999
70567,journals/tods/KarpSP03,A simple algorithm for finding frequent elements in streams and bags,"R Karp, S Shenker, C Papadimitriou",ACM Trans. Database Syst.,2003
70569,conf/sigmod/AdaliSS99,A Multimedia Presentation Algebra,"S Adali, M Sapino, V Subrahmanian",SIGMOD Conference,1999
70570,journals/tods/BeneventanoBS03,Description logics for semantic query optimization in object-oriented database systems,"D Beneventano, S Bergamaschi, C Sartori",ACM Trans. Database Syst.,2003
70571,journals/sigmod/Segev94a,Editor's Notes,A Segev,SIGMOD Record,1994
70573,journals/sigmod/SnodgrassAABCDEGJKKKLLRSSS94a,A TSQL2 Tutorial,"nodgrass, I Ahn, G Ariav, D Batory, J Clifford, C Dyreson, R Elmasri, F Grandi, C Jensen, W Käfer, N Kline, K Kulkarni, T Leung, N Lorentzos, J Roddick, A Segev, M Soo, S Sripada",SIGMOD Record,1994
70576,journals/sigmod/Qian94a,"Announcements from NSF, NASA, and Elsewhere",X Qian,SIGMOD Record,1994
70577,journals/sigmod/X94b,Calls for Papers / Announcements,,SIGMOD Record,1994
70579,journals/sigmod/Datta94,Research Issues in Databases for ARCS: Active Rapidly Changing Data Systems,A Datta,SIGMOD Record,1994
70581,conf/sigmod/BraumandlKK99,Database Patchwork on the Internet,"R Braumandl, A Kemper, D Kossmann",SIGMOD Conference,1999
70582,journals/sigmod/Klein94,How to Modify SQL Queries in Order to Guarantee Sure Answers,H Klein,SIGMOD Record,1994
70585,journals/sigmod/Group94,"Response to the March 1994 ODMG-93 Commentary Written by Dr. Won Kim of UniSQL, Inc",O Group,SIGMOD Record,1994
70586,conf/sigmod/AltinelABFSZ99,DBIS-Toolkit: Adaptable Middleware for Large Scale Data Delivery,"M Altinel, D Aksoy, T Baby, M Franklin, W Shapiro, S Zdonik",SIGMOD Conference,1999
70589,journals/sigmod/ChenHKPW94,Metadata for Mixed-Media Access,"F Chen, M Hearst, J Kupiec, J Pedersen, L Wilcox",SIGMOD Record,1994
70590,conf/sigmod/TrisoliniLN99,Data Integration and Warehousing in Telecom Italia,"S Trisolini, M Lenzerini, D Nardi",SIGMOD Conference,1999
70593,journals/sigmod/GroskyFS94,Using Metadata for the Intelligent Browsing of Structured Media Objects,"W Grosky, F Fotouhi, I Sethi",SIGMOD Record,1994
70594,conf/sigmod/Kohler99,EMC Information Sharing: Direct Access to MVS Data from Unix and NT,W Kohler,SIGMOD Conference,1999
70596,conf/sigmod/HinneburgK99,Clustering Methods for Large Databases: From the Past to the Future,"A Hinneburg, D Keim",SIGMOD Conference,1999
70603,conf/sigmod/FlorescuLMS99,Query Optimization in the Presence of Limited Access Patterns,"D Florescu, A Levy, I Manolescu, D Suciu",SIGMOD Conference,1999
70605,conf/sigmod/HaasH99,Ripple Joins for Online Aggregation,"P Haas, J Hellerstein",SIGMOD Conference,1999
70608,journals/sigmod/Yang94,A Hypertext Query Language for Images,L Yang,SIGMOD Record,1994
70609,conf/sigmod/ChaudhuriMN99,On Random Sampling over Joins,"S Chaudhuri, R Motwani, V Narasayya",SIGMOD Conference,1999
70610,journals/sigmod/Segev94,Editor's Notes,A Segev,SIGMOD Record,1994
70612,journals/sigmod/Kim94,Observations on the ODMG-93 Proposal,W Kim,SIGMOD Record,1994
70614,conf/sigmod/Wu99,Query Optimization for Selections Using Bitmaps,M Wu,SIGMOD Conference,1999
70616,journals/sigmod/MedeirosP94,Databases for GIS,"C Medeiros, F Pires",SIGMOD Record,1994
70619,journals/sigmod/Widom94,Research Issues in Active Database Systems: Report from the Closing Panel at RIDE-ADS '94,J Widom,SIGMOD Record,1994
70620,conf/sigmod/LakshmananNHP99,Optimization of Constrained Frequent Set Queries with 2-variable Constraints,"L Lakshmanan, R Ng, J Han, A Pang",SIGMOD Conference,1999
70625,journals/sigmod/YeungHL94,Performance Evaluation of a New Distributed Deadlock Detection Algorithm,"C Yeung, S Hung, K Lam",SIGMOD Record,1994
70634,journals/sigmod/RamirezSP94,Medical Information Systems: Characterization and Challenges,"J Ramirez, L Smith, L Peterson",SIGMOD Record,1994
70638,conf/sigmod/Ojjeh99,Microsoft Site Server (Commerce Edition),B Ojjeh,SIGMOD Conference,1999
70641,conf/sigmod/BergstraesserBPS99,Versions and Workspaces in Microsoft Repository,"T Bergstraesser, P Bernstein, S Pal, D Shutt",SIGMOD Conference,1999
70643,conf/vldb/DillKMRST01,Self-similarity in the Web,"S Dill, R Kumar, K McCurley, S Rajagopalan, D Sivakumar, A Tomkins",VLDB,2001
70646,conf/sigmod/JarkeQBLMS99,Improving OLTP Data Quality Using Data Warehouse Mechanisms,"M Jarke, C Quix, G Blees, D Lehmann, G Michalk, S Striel",SIGMOD Conference,1999
70651,conf/sigmod/LiVCAHMWBCHIKSS99,"PowerBookmarks: A System for Personalizable Web Information Organization, Sharing, and Management","W Li, Q Vu, E Chang, D Agrawal, K Hirata, S Mukherjea, Y Wu, C Bufi, K Chang, Y Hara, R Ito, Y Kimura, K Shimazu, Y Saito",SIGMOD Conference,1999
70653,conf/vldb/DongHLPW01,Mining Multi-Dimensional Constrained Gradients in Data Cubes,"G Dong, J Han, J Lam, J Pei, K Wang",VLDB,2001
70654,conf/sigmod/RundensteinerCLCZNJLW99,SERF: ODMG-Based Generic Re-structuring Facility,"E Rundensteiner, K Claypool, M Li, L Chen, X Zhang, C Natarajan, J Jin, S Lima, S Weiner",SIGMOD Conference,1999
70655,conf/sigmod/ZhouLP99,TAM: A System for Dynamic Transactional Activity Management,"T Zhou, L Liu, C Pu",SIGMOD Conference,1999
70658,conf/sigmod/AcharyaGPR99,The Aqua Approximate Query Answering System,"S Acharya, P Gibbons, V Poosala, S Ramaswamy",SIGMOD Conference,1999
70661,conf/vldb/ShanmugasundaramKSFF01,Querying XML Views of Relational Data,"J Shanmugasundaram, J Kiernan, E Shekita, C Fan, J Funderburk",VLDB,2001
70663,conf/vldb/VeltriCV01,Views in a Large Scale XML Repository,"S Cluet, P Veltri, D Vodislav",VLDB,2001
70667,conf/sigmod/ChangG99,Mind Your Vocabulary: Query Mapping Across Heterogeneous Information Sources,"K Chang, H Garcia-Molina",SIGMOD Conference,1999
70669,conf/vldb/LiCHPALHAY01,Cache Portal: Technology for Accelerating Database-driven e-commerce Web Sites,"W Li, K Candan, W Hsiung, O Po, D Agrawal, Q Luo, W Huang, Y Akca, C Yilmaz",VLDB,2001
70672,conf/vldb/BlokWZPAKJ01,Flexible and scalable digital library search,"H Blok, M Windhouwer, R Zwol, M Petkovic, P Apers, M Kersten, W Jonker",VLDB,2001
70676,conf/vldb/BrownG01,A Prototype Content-Based Retrieval System that Uses Virtual Images to Save Space,"L Brown, L Gruenwald",VLDB,2001
70679,conf/vldb/ZengBNN01,AgFlow: Agent-based Cross-Enterprise Workflow Management System,"L Zeng, B Benatallah, P Nguyen, A Ngu",VLDB,2001
70680,conf/sigmod/Seshadri99,"``Honey, I Shrunk the DBMS'': Footprint, Mobility, and Beyond (Panel)",P Seshadri,SIGMOD Conference,1999
70681,conf/vldb/MaedaT01,ACTIVIEW: Adaptive data presentation using SuperSQL,"Y Maeda, M Toyama",VLDB,2001
70683,conf/vldb/StillgerLMK01,LEO - DB2's LEarning Optimizer,"M Stillger, G Lohman, V Markl, M Kandil",VLDB,2001
70684,conf/sigmod/Dullmann99,Petabyte Databases,,,1999
70686,conf/sigmod/GarofalakisRRS99,"Of Crawlers, Portals, Mice and Men: Is there more to Mining the Web? (Panel)","M Garofalakis, S Ramaswamy, R Rastogi, K Shim",SIGMOD Conference,1999
70688,conf/vldb/SeegerBBKSDS01,XXL - A Library Approach to Supporting Efficient Implementations of Advanced Database Queries,"J Bercken, B Blohsfeld, J Dittrich, J Krämer, T Schäfer, M Schneider, B Seeger",VLDB,2001
70690,conf/vldb/AndreiV01,User-Optimizer Communication using Abstract Plans in Sybase ASE,"M Andrei, P Valduriez",VLDB,2001
70691,conf/sigmod/Brown99,Implementing the Spirit of SQL-99,P Brown,SIGMOD Conference,1999
70692,conf/vldb/ChaudhuriS01,Storage and Retrieval of XML Data Using Relational Databases,,,2001
70694,conf/vldb/PatonG01,Information Management for Genome Level Bioinformatics,,,2001
70697,conf/sigmod/KanthRSB99,Indexing Medium-dimensionality Data in Oracle,"K Kanth, S Ravada, J Sharma, J Banerjee",SIGMOD Conference,1999
70699,conf/vldb/MignetMAC01,Change-Centric Management of Versions in an XML Warehouse,"A Marian, S Abiteboul, G Cobena, L Mignet",VLDB,2001
70701,conf/sigmod/FernandezFKLS98,Catching the Boat with Strudel: Experiences with a Web-Site Management System,"M Fernandez, D Florescu, J Kang, A Levy, D Suciu",SIGMOD Conference,1998
70702,conf/vldb/AboulnagaAN01,Estimating the Selectivity of XML Path Expressions for Internet Scale Applications,"A Aboulnaga, A Alameldeen, J Naughton",VLDB,2001
70704,conf/sigmod/ChanI98,Bitmap Index Design and Evaluation,"C Chan, Y Ioannidis",SIGMOD Conference,1998
70705,conf/vldb/AksoyZF01,Data Staging for On-Demand Broadcast,"D Aksoy, M Franklin, S Zdonik",VLDB,2001
70708,conf/sigmod/Stonebraker98,Are We Working On the Right Problems? (Panel),M Stonebraker,SIGMOD Conference,1998
70709,conf/vldb/Gibbons01,Distinct Sampling for Highly-Accurate Answers to Distinct Values Queries and Event Reports,P Gibbons,VLDB,2001
70710,conf/sigmod/AdamY98,Electronic Commerce: Tutorial,"N Adam, Y Yesha",SIGMOD Conference,1998
70711,conf/sigmod/RajagopalanML98,Approximate Medians and other Quantiles in One Pass and with Limited Memory,"G Manku, S Rajagopalan, B Lindsay",SIGMOD Conference,1998
70712,conf/vldb/GravanoIJKMS01,Approximate String Joins in a Database (Almost) for Free,"L Gravano, P Ipeirotis, H Jagadish, N Koudas, S Muthukrishnan, D Srivastava",VLDB,2001
70713,conf/sigmod/LometW98,Efficient and Transparent Application Recovery in Client-Server Information Systems,"D Lomet, G Weikum",SIGMOD Conference,1998
70720,conf/vldb/Shmueli01,Architectures for Internal Web Services Deployment,O Shmueli,VLDB,2001
70723,conf/sigmod/Whelan98,FileNet Integrated Document Management Database Usage and Issues,D Whelan,SIGMOD Conference,1998
70726,conf/sigmod/NaumanS98,"Developing a High Traffic, Read-Only Web Site","J Nauman, R Suorsa",SIGMOD Conference,1998
70727,conf/sigmod/LahiriJJC98,"50,000 Users on an Oracle8 Universal Server Database","T Lahiri, A Josji, A Jasuja, S Chatterjee",SIGMOD Conference,1998
70728,conf/vldb/OConnellWG01,Collaborative Analytical Processing - Dream or Reality? (Panel abstract),"W O'Connell, A Witkowski, G Graefe",VLDB,2001
70732,conf/vldb/ChienTZ01,Efficient Management of Multiversion Documents by Object Referencing,"S Chien, V Tsotras, C Zaniolo",VLDB,2001
70734,conf/sigmod/BaruGLMPVC99,XML-Based Information Mediation with MIX,"C Baru, A Gupta, B Ludäscher, R Marciano, Y Papakonstantinou, P Velikhov, V Chu",SIGMOD Conference,1999
70738,conf/sigmod/VossenW99,The WASA2 Object-Oriented Workflow Management System,"G Vossen, M Weske",SIGMOD Conference,1999
70745,conf/vldb/HuntAI01,A Database Index to Large Biological Sequences,"E Hunt, M Atkinson, R Irving",VLDB,2001
70747,conf/sigmod/KotidisR98,An Alternative Storage Organization for ROLAP Aggregate Views Based on Cubetrees,"Y Kotidis, N Roussopoulos",SIGMOD Conference,1998
70748,conf/vldb/Kotidis01,A Data Warehousing Architecture for Enabling Service Provisioning Process,Y Kotidis,VLDB,2001
70750,conf/vldb/BerckenS01,An Evaluation of Generic Bulk Loading Techniques,"J Bercken, B Seeger",VLDB,2001
70756,conf/vldb/KahveciS01,Efficient Index Structures for String Databases,"T Kahveci, A Singh",VLDB,2001
70757,conf/vldb/CooperSFHS01,A Fast Index for Semistructured Data,"B Cooper, N Sample, M Franklin, G Hjaltason, M Shadmon",VLDB,2001
70758,conf/sigmod/ChakrabartiDI98,Enhanced Hypertext Categorization Using Hyperlinks,"S Chakrabarti, B Dom, P Indyk",SIGMOD Conference,1998
70759,conf/sigmod/NestorovAM98,Extracting Schema from Semistructured Data,"S Nestorov, S Abiteboul, R Motwani",SIGMOD Conference,1998
70760,conf/vldb/ManolopoulosT01,C2P: Clustering based on Closest Pairs,"A Nanopoulos, Y Theodoridis, Y Manolopoulos",VLDB,2001
70762,conf/vldb/TanEO01,Efficient Progressive Skyline Computation,"K Tan, P Eng, B Ooi",VLDB,2001
70763,conf/vldb/AgrawalCN00,Automated Selection of Materialized Views and Indexes in SQL Databases,"S Agrawal, S Chaudhuri, V Narasayya",VLDB,2000
70767,conf/sigmod/HjaltasonS98,Incremental Distance Join Algorithms for Spatial Databases,"G Hjaltason, H Samet",SIGMOD Conference,1998
70768,conf/vldb/DingGS00,Computing Geographical Scopes of Web Resources,"J Ding, L Gravano, N Shivakumar",VLDB,2000
70769,conf/vldb/PantiSG00,A Case-Based Approach to Information Integration,"M Panti, L Spalazzi, A Giretti",VLDB,2000
70771,conf/sigmod/SeidlK98,Optimal Multi-Step k-Nearest Neighbor Search,"T Seidl, H Kriegel",SIGMOD Conference,1998
70772,conf/vldb/ChangG00,Approximate Query Translation Across Heterogeneous Information Sources,"K Chang, H Garcia-Molina",VLDB,2000
70775,conf/vldb/ManolescuFKXO00,Agora: Living with XML and Relational,"I Manolescu, D Florescu, D Kossmann, F Xhumari, D Olteanu",VLDB,2000
70776,conf/sigmod/Miller98,Using Schematically Heterogeneous Structures,R Miller,SIGMOD Conference,1998
70778,conf/sigmod/Cohen98,Integration of Heterogeneous Databases Without Common Domains Using Queries Based on Textual Similarity,W Cohen,SIGMOD Conference,1998
70782,conf/sigmod/ChaudhuriMN98,Random Sampling for Histogram Construction: How much is enough?,"S Chaudhuri, R Motwani, V Narasayya",SIGMOD Conference,1998
70784,conf/vldb/HvasshovdBT00,An Ultra Highly Available DBMS,"S Hvasshovd, S Bratsberg, Ř Torbjřrnsen",VLDB,2000
70785,conf/vldb/Nori00,Asera: Extranet Architecture for B2B Solutions,A Nori,VLDB,2000
70787,conf/sigmod/Adelberg98,NoDoSE - A Tool for Semi-Automatically Extracting Semi-Structured Data from Text Documents,B Adelberg,SIGMOD Conference,1998
70791,conf/sigmod/SarawagiTA98,Integrating Mining with Relational Database Systems: Alternatives and Implications,"S Sarawagi, S Thomas, R Agrawal",SIGMOD Conference,1998
70793,conf/sigmod/JaedickeM98,On Parallel Processing of Aggregate and Scalar Functions in Object-Relational DBMS,"M Jaedicke, B Mitschang",SIGMOD Conference,1998
70796,conf/vldb/ChoenniV00,Design and Implementation of a Genetic-Based Algorithm for Data Mining,S Choenni,VLDB,2000
70798,conf/sigmod/AmbiteABKMMMPT98,ARIADNE: A System for Constructing Mediators for Internet Sources,"J Ambite, N Ashish, G Barish, C Knoblock, S Minton, P Modi, I Muslea, A Philpot, S Tejada",SIGMOD Conference,1998
70799,conf/vldb/ShanmugasundaramSBCLPR00,Efficiently Publishing Relational Data as XML Documents,"J Shanmugasundaram, E Shekita, R Barr, M Carey, B Lindsay, H Pirahesh, B Reinwald",VLDB,2000
70801,conf/vldb/AltinelF00,Efficient Filtering of XML Documents for Selective Dissemination of Information,"M Altinel, M Franklin",VLDB,2000
70802,conf/sigmod/KornackerSH98,amdb: An Access Method Debugging Tool,"M Kornacker, M Shah, J Hellerstein",SIGMOD Conference,1998
70805,conf/vldb/MatiasVW00,Dynamic Maintenance of Wavelet-Based Histograms,"Y Matias, J Vitter, M Wang",VLDB,2000
70806,conf/sigmod/Brewer98,Delivering High Availability for Inktomi Search Engines,E Brewer,SIGMOD Conference,1998
70811,conf/sigmod/Fegaras98,Query Unnesting in Object-Oriented Databases,L Fegaras,SIGMOD Conference,1998
70813,conf/sigmod/RaoR98,Reusing Invariants: A New Strategy for Correlated Queries,"J Rao, K Ross",SIGMOD Conference,1998
70814,conf/vldb/YagoubFIV00,Caching Strategies for Data-Intensive Web Sites,"K Yagoub, D Florescu, V Issarny, P Valduriez",VLDB,2000
70816,conf/sigmod/BerchtoldBK98,The Pyramid-Technique: Towards Breaking the Curse of Dimensionality,"S Berchtold, C Böhm, H Kriegel",SIGMOD Conference,1998
70820,conf/sigmod/LiYVGPUV98,Capability Based Mediation in TSIMMIS,"C Li, R Yerneni, V Vassalos, H Garcia-Molina, Y Papakonstantinou, J Ullman, M Valiveti",SIGMOD Conference,1998
70821,conf/sigmod/ChenWZ98,A Protein Patent Query System Powered By Kleisli,"J Chen, L Wong, L Zhang",SIGMOD Conference,1998
70822,conf/vldb/LuL00,Decision Tables: Scalable Classification Exploring RDBMS Capabilities,"H Lu, H Liu",VLDB,2000
70824,conf/sigmod/ShintaniK98,Parallel Mining Algorithms for Generalized Association Rules with Classification Hierarchy,"T Shintani, M Kitsuregawa",SIGMOD Conference,1998
70826,conf/vldb/GoldsteinR00,Contrast Plots and P-Sphere Trees: Space vs. Time in Nearest Neighbour Searches,"J Goldstein, R Ramakrishnan",VLDB,2000
70827,conf/vldb/CareyKRLABFLOPQRSSUVWY01,The Propel Distributed Services Platform,"M Carey, S Kirsch, M Roth, B Linden, N Adiba, M Blow, D Florescu, D Li, I Oprencak, R Panwar, R Qi, D Rieber, J Shafer, B Sterling, T Urhan, B Vickery, D Wineman, K Yee",VLDB,2001
70828,conf/sigmod/ZaianeHLCC98,MultiMediaMiner: A System Prototype for Multimedia Data Mining,"O Zaďane, J Han, Z Li, S Chee, J Chiang",SIGMOD Conference,1998
