tid,id,title,authors,venue,year
71915,journals/tods/BrightHP94,Automated Resolution of Semantic Heterogeneity in Multidatabases,"M Bright, A Hurson, S Pakzad",ACM Trans. Database Syst.,1994
71938,journals/tods/BaralisW00,An algebraic approach to static analysis of active database rules,"E Baralis, J Widom",ACM Trans. Database Syst.,2000
71940,journals/tods/EiterLLS01,Probabilistic object bases,"T Eiter, J Lu, T Lukasiewicz, V Subrahmanian",ACM Trans. Database Syst.,2001
71951,journals/tods/MamoulisP01,Multiway spatial joins,"N Mamoulis, D Papadias",ACM Trans. Database Syst.,2001
71954,journals/tods/LakshmananSS01,SchemaSQL: An extension to SQL for multidatabase interoperability,"L Lakshmanan, F Sadri, S Subramanian",ACM Trans. Database Syst.,2001
71958,journals/tods/ZaharioudakisCF97,"Adaptive, Fine-Grained Sharing in a Client-Server OODBMS: A Callback-Based Approach","M Zaharioudakis, M Carey, M Franklin",ACM Trans. Database Syst.,1997
71960,journals/tods/WolfsonJH97,An Adaptive Data Replication Algorithm,"O Wolfson, S Jajodia, Y Huang",ACM Trans. Database Syst.,1997
71970,journals/tods/Revesz98,Safe Query Languages for Constraint Databases,P Revesz,ACM Trans. Database Syst.,1998
71973,journals/tods/Wijsen99,Temporal FDs on Complex Objects,J Wijsen,ACM Trans. Database Syst.,1999
71983,journals/tods/HjaltasonS99,Distance Browsing in Spatial Databases,"G Hjaltason, H Samet",ACM Trans. Database Syst.,1999
71986,journals/tods/CasatiCPP99,Specification and Implementation of Exceptions in Workflow Management Systems,"F Casati, S Ceri, S Paraboschi, G Pozzi",ACM Trans. Database Syst.,1999
71993,journals/vldb/LawLG99,Efficient Support for Interactive Service in Multi-Resolution VOD Systems,"K Law, J Lui, L Golubchik",VLDB J.,1999
71995,journals/vldb/GarofalakisOS98,On Periodic Resource scheduling for Continuous-Media Databases,"M Garofalakis, B Özden, A Silberschatz",VLDB J.,1998
72005,journals/vldb/BunemanFS00,UnQL: A Query Language and Algebra for Semistructured Data Based on Structural Recursion,"P Buneman, M Fernandez, D Suciu",VLDB J.,2000
72011,journals/vldb/GeorgeH00,Secure Bufering in Firm Real-Time Database Systems,"B George, J Haritsa",VLDB J.,2000
72014,journals/vldb/SheikholeslamiCZ00,WaveCluster: A Wavelet Based Clustering Approach for Spatial Data in Very Large Databases,"G Sheikholeslami, S Chatterjee, A Zhang",VLDB J.,2000
72018,journals/vldb/WidomS00,Foreword by the VLDB '98 PC Chairmen: Best Papers of VLDB '98,,,2000
72023,journals/vldb/SteinbrunnMK97,Heuristic and Randomized Optimization for the Join Ordering Problem,"M Steinbrunn, G Moerkotte, A Kemper",VLDB J.,1997
72024,journals/vldb/BerchtoldKK97,Using Extended Feature Objects for Partial Similarity Retrieval,"S Berchtold, D Keim, H Kriegel",VLDB J.,1997
72025,journals/vldb/MuckP97,A Configrable Type Hierarchy Index for OODB,"T Mück, M Polaschek",VLDB J.,1997
72032,journals/vldb/CatarciSC97,Graphical Interaction with Heterogeneous Databases,"T Catarci, G Santucci, J Cardiff",VLDB J.,1997
72039,journals/vldb/RoySSSA98,Garbage Collection in Object-Oriented Databases Using Transactional Cyclic Reference Counting,"P Roy, S Seshadri, A Silberschatz, S Sudarshan, S Ashwin",VLDB J.,1998
72051,journals/vldb/AilamakiDH02,Data page layouts for relational databases on deep memory hierarchies,"A Ailamaki, D DeWitt, M Hill",VLDB J.,2002
72059,journals/vldb/FerrariAABC02,An authorization system for digital libraries,"E Ferrari, N Adam, V Atluri, E Bertino, U Capuozzo",VLDB J.,2002
72064,journals/vldb/MihailaRT02,Locating and accessing data repositories with WebSemantics,"G Mihaila, L Raschid, A Tomasic",VLDB J.,2002
72076,journals/vldb/IvesHW02,An XML query engine for network-bound data,"Z Ives, A Halevy, D Weld",VLDB J.,2002
72078,journals/vldb/JagadishACLNPPSWWY02,TIMBER: A native XML database,"H Jagadish, S Al-Khalifa, A Chapman, L Lakshmanan, A Nierman, S Paparizos, J Patel, D Srivastava, N Wiwatwattana, Y Wu, C Yu",VLDB J.,2002
72079,journals/vldb/FiebigHKMNSW02,Anatomy of a native XML base management system,"T Fiebig, S Helmer, C Kanne, G Moerkotte, J Neumann, R Schiele, T Westmann",VLDB J.,2002
72084,journals/vldb/NguSHL01,Combining multi-visual features for efficient indexing in a large image database,"A Ngu, Q Sheng, D Huynh, R Lei",VLDB J.,2001
72086,journals/vldb/BraumandlKKKKSS01,ObjectGlobe: Ubiquitous query processing on the Internet,"R Braumandl, M Keidl, A Kemper, D Kossmann, A Kreutz, S Seltzsam, K Stocker",VLDB J.,2001
72088,journals/vldb/WangW01,Indexing very high-dimensional sparse and quasi-sparse vectors for similarity searches,"C Wang, X Wang",VLDB J.,2001
72091,journals/vldb/ManegoldBK00,Optimizing database architecture for the new bottleneck: memory access,"S Manegold, P Boncz, M Kersten",VLDB J.,2000
72094,journals/vldb/Atkinson00,Guest editorial,,,2000
72101,journals/vldb/RahmB01,A survey of approaches to automatic schema matching,"E Rahm, P Bernstein",VLDB J.,2001
72108,journals/vldb/BonifatiCP01,Active rules for XML: A new paradigm for E-services,"A Bonifati, S Ceri, S Paraboschi",VLDB J.,2001
72113,journals/vldb/SuHHHLWLPLL01,An Internet-based negotiation server for e-commerce,"S Su, C Huang, J Hammer, Y Huang, H Li, L Wang, Y Liu, C Pluempitiwiriyawej, M Lee, H Lam",VLDB J.,2001
72123,journals/vldb/BeckerGOSW96,An Asymptotically Optimal Multiversion B-Tree,"B Becker, S Gschwind, T Ohler, B Seeger, P Widmayer",VLDB J.,1996
72126,journals/vldb/MehtaD97,Data Placement in Shared-Nothing Parallel Database Systems,"M Mehta, D DeWitt",VLDB J.,1997
72130,journals/vldb/AntoshenkovZ96,Query Processing and Optimization in Oracle Rdb,"G Antoshenkov, M Ziauddin",VLDB J.,1996
72141,journals/vldb/DeWittNSV96,Parallelising OODBMS Traversals: A Performance Evaluation,"D DeWitt, J Naughton, J Shafer, S Venkataraman",VLDB J.,1996
72145,journals/vldb/NybergBCGL95,AlphaSort: A Cache-Sensitive Parallel External Sort,"C Nyberg, T Barclay, Z Cvetanovic, J Gray, D Lomet",VLDB J.,1995
72164,journals/vldb/RamakrishnanSSS94,The CORAL Deductive System,"R Ramakrishnan, D Srivastava, S Sudarshan, P Seshadri",VLDB J.,1994
72171,journals/vldb/LinJF94,The TV-Tree: An Index Structure for High-Dimensional Data,"K Lin, H Jagadish, C Faloutsos",VLDB J.,1994
72193,journals/sigmod/WinslettMY03,Two-Body Job Searches,"M Winslett, X Ma, T Yu",SIGMOD Record,2003
72199,journals/sigmod/MeersmanS02,Guest Editor's Introduction,,,2002
72212,journals/sigmod/SpynsMJ02,Data Modelling versus Ontology Engineering,"P Spyns, R Meersman, M Jarrar",SIGMOD Record,2002
72215,conf/vldb/AgarwalADGNRS96,On the Computation of Multidimensional Aggregates,"S Agarwal, R Agrawal, P Deshpande, A Gupta, J Naughton, R Ramakrishnan, S Sarawagi",VLDB,1996
