tid,id,title,authors,venue,year
69615,journals/sigmod/Hammer02,Report on the ACM Fourth International Workshop on Data Warehousing and OLAP (DOLAP 2001),,,2002
69616,conf/vldb/FerrandinaMZFM95,Schema and Database Evolution in the O2 Object Database System,"F Ferrandina, T Meyer, R Zicari, G Ferran, J Madec",VLDB,1995
69617,conf/vldb/SubietaKL95,Procedures in Object-Oriented Query Languages,"K Subieta, Y Kambayashi, J Leszczylowski",VLDB,1995
69619,journals/sigmod/Ouksel02,Mining the World Wide Web: An Information Search Approach - Book Review,,,2002
69630,conf/vldb/SrikantA95,Mining Generalized Association Rules,"R Srikant, R Agrawal",VLDB,1995
69633,conf/vldb/FlodinR95,Processing Object-Oriented Queries with Invertible Late Bound Functions,"S Flodin, T Risch",VLDB,1995
69635,conf/vldb/HvasshovdTBH95,"The ClustRa Telecom Database: High Availability, High Throughput, and Real-Time Response","S Hvasshovd, Ř Torbjřrnsen, S Bratsberg, P Holager",VLDB,1995
69639,conf/vldb/GallersdorferN95,Improving Performance in Replicated Databases through Relaxed Coherency,"R Gallersdörfer, M Nicola",VLDB,1995
69656,conf/vldb/OrensteinK95,Accessing a Relational Database through an Object-Oriented Database Interface,"J Orenstein, D Kamber",VLDB,1995
69662,conf/vldb/WienerN95,OODB Bulk Loading Revisited: The Partitioned-List Approach,"J Wiener, J Naughton",VLDB,1995
69665,journals/sigmod/Fagin02,Combining Fuzzy Information: an Overview,R Fagin,SIGMOD Record,2002
69669,conf/vldb/BestavrosB95,Value-cognizant Speculative Concurrency Control,"A Bestavros, S Braoudakis",VLDB,1995
69671,journals/sigmod/BerzalM02,Data Mining: Concepts and Techniques - Book Review,"F Galiano, N Marín",SIGMOD Record,2002
69672,conf/vldb/WuYCT95,A Performance Study of Workfile Disk Management for Concurrent Mergesorts in a Multiprocessor Database System,"K Wu, P Yu, J Chung, J Teng",VLDB,1995
69676,conf/vldb/JonscherD94,An Approach for Building Secure Database Federations,"D Jonscher, K Dittrich",VLDB,1994
69680,conf/vldb/Galindo-LegariaPK94,"Fast, Randomized Join-Order Selection - Why Use Transformations?","C Galindo-Legaria, A Pellenkoft, M Kersten",VLDB,1994
69683,conf/vldb/NgH94,Efficient and Effective Clustering Methods for Spatial Data Mining,"R Ng, J Han",VLDB,1994
69684,journals/sigmod/Neven02,Automata Theory for XML Researchers,F Neven,SIGMOD Record,2002
69686,conf/vldb/BrownCC94,Fast Incremental Indexing for Full-Text Information Retrieval,"E Brown, J Callan, W Croft",VLDB,1994
69691,conf/vldb/FrohnLU94,Access to Objects by Path Expressions and Rules,"J Frohn, G Lausen, H Uphoff",VLDB,1994
69699,journals/sigmod/Winslett02b,Hector Garcia-Molina Speaks Out,M Winslett,,2002
69702,journals/sigmod/LightstoneLZ02,Toward Autonomic Computing with DB2 Universal Database,"S Lightstone, G Lohman, D Zilio",SIGMOD Record,2002
69705,journals/sigmod/FrankNS02,Report on the Semantic Web Workshop at WWW 2002,,,2002
69710,conf/vldb/AgrawalPWZ95,Querying Shapes of Histories,"R Agrawal, G Psaila, E Wimmers, M Zaďt",VLDB,1995
69711,journals/sigmod/Winslett02c,Interview with David Maier,,,2002
69712,conf/vldb/EvangelidisLS95,"The hBP-tree: A Modified hB-tree Supporting Concurrency, Recovery and Node Consolidation","G Evangelidis, D Lomet, B Salzberg",VLDB,1995
69713,journals/sigmod/Wu02,Small Worlds: the Dynamics of Networks between Order and Randomness - Book Review,,,2002
69716,journals/sigmod/FininJ02,"Agents, Turst, and Information Access on the Semantic Web","T Finin, A Joshi",SIGMOD Record,2002
69721,journals/sigmod/AnyanwuS02,The p Operator: Discovering and Ranking Associations on the Semantic Web,"K Anyanwu, A Sheth",SIGMOD Record,2002
69728,journals/sigmod/Aberer02b,Book Review Column,K Aberer,SIGMOD Record,2002
69735,journals/sigmod/RoantreeS02,Research in Information Managment at Dublin City University,"M Roantree, A Smeaton",SIGMOD Record,2002
69742,conf/vldb/ColletCS94,NAOS - Efficient and Modular Reactive Capabilities in an Object-Oriented Database System,"C Collet, T Coupaye, T Svensen",VLDB,1994
69745,journals/sigmod/SchmidtWKFCMB01,Why And How To Benchmark XML Databases,"A Schmidt, F Waas, M Kersten, D Florescu, M Carey, I Manolescu, R Busse",SIGMOD Record,2001
69748,conf/vldb/HasanM94,Optimization Algorithms for Exploiting the Parallelism-Communication Tradeoff in Pipelined Parallelism,"W Hasan, R Motwani",VLDB,1994
69749,journals/sigmod/TanakaV01,The Ecobase Project: Database and Web Technologies for Environmental Information Systems,"A Tanaka, P Valduriez",SIGMOD Record,2001
69755,journals/sigmod/ConstantopoulosCP01,"Semantic Web Workshop: Models, Architectures and Management",,,2001
69757,conf/vldb/TeisseirePC94,Towards Event-Driven Modelling for Database Design,"M Teisseire, P Poncelet, R Cicchetti",VLDB,1994
69769,journals/sigmod/BiancheriPP01,EIHA?!?: Deploying Web and WAP services using XML Technology,"C Biancheri, J Pazzaglia, G Paddeu",SIGMOD Record,2001
69773,journals/sigmod/MeltonE01,SQL Multimedia and Application Packages (SQL/MM),"J Melton, A Eisenberg",SIGMOD Record,2001
69777,journals/sigmod/LenzeriniNNS01,Report on the 8th International Workshop on Knowledge Representation Meets Databases (KRDB),,,2001
69789,journals/sigmod/Huyn01,Data Analysis and Mining in the Life Sciences,N Huyn,SIGMOD Record,2001
69790,conf/vldb/GoodmanRS94,Building a Laboratory Information System Around a C++-Based Object-Oriented DBMS,"N Goodman, S Rozen, L Stein",VLDB,1994
69800,conf/vldb/RosenthalS94,Data Integration in the Large: The Challenge of Reuse,"A Rosenthal, L Seligman",VLDB,1994
69801,journals/sigmod/LabrinidisM01,Career-Enhancing Services at SIGMOD Online,"A Labrinidis, A Mendelzon",SIGMOD Record,2001
69809,journals/sigmod/CabreraLM01,Detection and Classification of Intrusions and Faults using Sequences of System Calls,"J Cabrera, L Lewis, R Mehra",SIGMOD Record,2001
69820,conf/sigmod/FaginKS03,Efficient similarity search and classification via rank aggregation,"R Fagin, R Kumar, D Sivakumar",SIGMOD Conference,2003
69821,journals/sigmod/SayginVC01,Using Unknowns to Prevent Discovery of Association Rules,"Y Saygin, V Verykios, C Clifton",SIGMOD Record,2001
69823,conf/sigmod/ChaudhuriGS03,Factorizing Complex Predicates in Queries to Exploit Indexes,"S Chaudhuri, P Ganesan, S Sarawagi",SIGMOD Conference,2003
69826,conf/sigmod/IlyasRLGL03,Estimating Compilation Time of a Query Optimizer,"I Ilyas, J Rao, G Lohman, D Gao, E Lin",SIGMOD Conference,2003
69827,conf/sigmod/DeligiannakisR03,Extended Wavelets for Multiple Measures,"A Deligiannakis, N Roussopoulos",SIGMOD Conference,2003
69842,conf/vldb/DavisonG94,Memory-Contention Responsive Hash Joins,"D Davison, G Graefe",VLDB,1994
69853,journals/sigmod/Grefen02,What Will Be - Book Review,,,2002
69866,journals/sigmod/Snodgrass02,Why I Like Working in Academia,R Snodgrass,SIGMOD Record,2002
69868,conf/sigmod/LakshmananPZ03,QC-Trees: An Efficient Summary Structure for Semantic OLAP,"L Lakshmanan, J Pei, Y Zhao",SIGMOD Conference,2003
69871,conf/sigmod/GuoSBS03,XRANK: Ranked Keyword Search over XML Documents,"L Guo, F Shao, C Botev, J Shanmugasundaram",SIGMOD Conference,2003
69877,conf/sigmod/SionAP03,Rights Protection for Relational Data,"R Sion, M Atallah, S Prabhakar",SIGMOD Conference,2003
69886,conf/sigmod/GuptaLM03,BIRN-M: A Semantic Mediator for Solving Real-World Neuroscience Problems,"A Gupta, B Ludäscher, M Martone",SIGMOD Conference,2003
69889,journals/sigmod/PaepckeGRC00,Beyond Document Similarity: Understanding Value-Based Search and Browsing Technologies,"A Paepcke, H Garcia-Molina, G Rodríguez-Mulŕ, J Cho",SIGMOD Record,2000
69893,journals/sigmod/LiefkeS00,An Extensible Compressor for XML Data,"H Liefke, D Suciu",SIGMOD Record,2000
69901,conf/sigmod/OlstonJW03,Adaptive Filters for Continuous Queries over Distributed Data Streams,"C Olston, J Jiang, J Widom",SIGMOD Conference,2003
69906,conf/sigmod/BabcockCD03,Dynamic Sample Selection for Approximate Query Processing,"B Babcock, S Chaudhuri, G Das",SIGMOD Conference,2003
69907,conf/sigmod/ShenNSHS03,CMVF: A Novel Dimension Reduction Scheme for Efficient Indexing in A Large Image Database,"J Shen, A Ngu, J Shepherd, D Huynh, Q Sheng",SIGMOD Conference,2003
69912,journals/sigmod/ClementiniF00,Spatial Operators,"E Clementini, P Felice",SIGMOD Record,2000
69915,conf/sigmod/Bierman03,Formal semantics and analysis of object queries,G Bierman,SIGMOD Conference,2003
69919,conf/sigmod/ReissK03,A Characterization of the Sensitivity of Query Optimization to Storage Access Cost Parameters,"F Reiss, T Kanungo",SIGMOD Conference,2003
69925,conf/sigmod/LiBKN03,Composing XSL Transformations with XML Publishing Views,"C Li, P Bohannon, H Korth, P Narayan",SIGMOD Conference,2003
69935,journals/sigmod/Hammer00,Treasurer's Message,,,2000
69964,journals/sigmod/Franklin00b,Editor's Notes,M Franklin,SIGMOD Record,2000
69965,journals/sigmod/YuenCLL00,Cache Invalidation Scheme for Mobile Computing Systems with Real-time Data,"J Yuen, E Chan, K Lam, H Leung",SIGMOD Record,2000
69967,conf/sigmod/KementsietsidisAM03,Mapping Data in Peer-to-Peer Systems: Semantics and Algorithmic Issues,"A Kementsietsidis, M Arenas, R Miller",SIGMOD Conference,2003
69969,conf/sigmod/StoltePAG03,Scientific Data Repositories: Designing for a Moving Target,"E Stolte, C Praun, G Alonso, T Gross",SIGMOD Conference,2003
69978,conf/sigmod/MaddenFHH03,The Design of an Acquisitional Query Processor For Sensor Networks,"S Madden, M Franklin, J Hellerstein, W Hong",SIGMOD Conference,2003
69988,conf/sigmod/MelnikRB03,Rondo: A Programming Platform for Generic Model Management,"S Melnik, E Rahm, P Bernstein",SIGMOD Conference,2003
69989,conf/sigmod/KangN03,On Schema Matching with Opaque Column Names and Data Values,"J Kang, J Naughton",SIGMOD Conference,2003
69996,conf/sigmod/LuoEHN02,A scalable hash ripple join algorithm,"G Luo, C Ellmann, P Haas, J Naughton",SIGMOD Conference,2002
69999,conf/sigmod/KaushikBNK02,Covering indexes for branching path queries,"R Kaushik, P Bohannon, J Naughton, H Korth",SIGMOD Conference,2002
70004,journals/sigmod/Franklin98a,Editor's Notes,M Franklin,SIGMOD Record,1998
70025,journals/sigmod/BuchnerM98,Discovering Internet Marketing Intelligence through Online Analytical Web Usage Mining,"A Büchner, M Mulvenna",SIGMOD Record,1998
70026,conf/sigmod/SengarH03,PLASTIC: Reducing Query Optimization Overheads through Plan Recycling,"V Sengar, J Haritsa",SIGMOD Conference,2003
70052,journals/sigmod/BergamaschiCV99,Semantic Integration of Semistructured and Structured Data Sources,"S Bergamaschi, S Castano, M Vincini",SIGMOD Record,1999
70056,conf/sigmod/ZuzartePMCLW03,WinMagic : Subquery Elimination Using Window Aggregation,"C Zuzarte, H Pirahesh, W Ma, Q Cheng, L Liu, K Wong",SIGMOD Conference,2003
70059,conf/sigmod/ShashaB02,"Database tuning: principles, experiments, and troubleshooting techniques (part II)","D Shasha, P Bonnet",SIGMOD Conference,2002
70064,conf/sigmod/ViglasN02,Rate-based query optimization for streaming information sources,"S Viglas, J Naughton",SIGMOD Conference,2002
70072,conf/sigmod/Bonnet02,Going public: open-source databases and database research,P Bonnet,SIGMOD Conference,2002
70074,conf/sigmod/HellersteinW02,Data streams: fresh current or stagnant backwater? (panel),"J Hellerstein, J Widom",SIGMOD Conference,2002
70076,conf/sigmod/CranorGJSS02,Gigascope: high performance network monitoring with an SQL interface,"C Cranor, Y Gao, T Johnson, V Shkapenyuk, O Spatscheck",SIGMOD Conference,2002
70077,journals/sigmod/DomenigD99,An Overview and Classification of Mediated Query Systems,"R Domenig, K Dittrich",SIGMOD Record,1999
70079,conf/sigmod/AgrawalCD02,DBXplorer: enabling keyword search over relational databases,"S Agrawal, S Chaudhuri, G Das",SIGMOD Conference,2002
70080,journals/sigmod/Snodgrass99a,Chair's Message,,,1999
70084,journals/sigmod/YauLMS99,On Multi-Resolution Document Transmission in Mobile Web,"S Yau, H Leong, D McLeod, A Si",SIGMOD Record,1999
70091,conf/sigmod/DogacTPPLKTK02,An ebXML infrastructure implementation through UDDI registries and RosettaNet PIPs,"A Dogac, Y Tambag, P Pembecioglu, S Pektas, G Laleci, G Kurt, S Toprak, Y Kabak",SIGMOD Conference,2002
70108,conf/sigmod/MoonWH02,General match: a subsequence matching method in time-series databases based on generalized windows,"Y Moon, K Whang, W Han",SIGMOD Conference,2002
70109,conf/sigmod/WangWYY02,Clustering by pattern similarity in large data sets,"H Wang, W Wang, J Yang, P Yu",SIGMOD Conference,2002
70113,conf/sigmod/ThaperGIK02,Dynamic multidimensional histograms,"N Thaper, S Guha, P Indyk, N Koudas",SIGMOD Conference,2002
70123,conf/sigmod/DattaDTVSR02,Proxy-based acceleration of dynamically generated content on the world wide web: an approach and implementation,"A Datta, K Dutta, H Thomas, D VanderMeer, S Suresha, K Ramamritham",SIGMOD Conference,2002
70124,journals/sigmod/McHughW97,Integrating Dynamically-Fetched External Information into a DBMS for Semistructured Data,"J McHugh, J Widom",SIGMOD Record,1997
70138,journals/sigmod/Suciu97,Foreword: Management of Semistructured Data,,,1997
70148,journals/sigmod/ConradEHRSSSV97,Research Issues in Federated Database Systems: Report of EFDBS '97 Workshop,,,1997
70156,conf/sigmod/YangWYH02,Mining long sequential patterns in a noisy environment,"J Yang, W Wang, P Yu, J Han",SIGMOD Conference,2002
70157,journals/sigmod/BarbaraS97,Quasi-Cubes: Exploiting Approximations in Multidimensional Databases,"D Barbará, M Sullivan",SIGMOD Record,1997
70158,conf/sigmod/ChoiC02,Selectivity estimation for spatio-temporal queries to moving objects,"Y Choi, C Chung",SIGMOD Conference,2002
70159,journals/sigmod/ClementLGMK97,OGDI: Toward Interoperability among Geospatial Databases,"G Clement, C Larouche, D Gouin, P Morin, H Kucera",SIGMOD Record,1997
70164,journals/sigmod/FernandezFLS97,A Query Language for a Web-Site Management System,"M Fernandez, D Florescu, A Levy, D Suciu",SIGMOD Record,1997
70169,journals/sigmod/SilberschatzZ97,Database Systems - Breaking Out of the Box,"A Silberschatz, S Zdonik",SIGMOD Record,1997
70174,conf/sigmod/LuoKMPWLN02,Middle-tier database caching for e-business,"Q Luo, S Krishnamurthy, C Mohan, H Pirahesh, H Woo, B Lindsay, J Naughton",SIGMOD Conference,2002
70175,conf/sigmod/MarklL02,Learning table access cardinalities with LEO,"V Markl, G Lohman",SIGMOD Conference,2002
70197,conf/sigmod/Mohan02,Tutorial: application servers and associated technologies,,,2002
70198,journals/sigmod/Lomet98,B-tree Page Size When Caching is Considered,D Lomet,SIGMOD Record,1998
70201,journals/sigmod/CheungF98,Enhanced Nearest Neighbour Search on the R-tree,"K Cheung, A Fu",SIGMOD Record,1998
70203,conf/sigmod/BreunigKKS01,Data Bubbles: Quality Preserving Performance Boosting for Hierarchical Clustering,"M Breunig, H Kriegel, P Kröger, J Sander",SIGMOD Conference,2001
70215,conf/sigmod/NazeriBO01,Experiences in Mining Aviation Safety Data,"Z Nazeri, E Bloedorn, P Ostwald",SIGMOD Conference,2001
70226,conf/sigmod/HernandezMHYHT01,Clio: A Semi-Automatic Tool For Schema Mapping,"M Hernández, R Miller, L Haas",SIGMOD Conference,2001
70233,journals/sigmod/Mendelzon98,Information Director's Message,,,1998
70234,conf/sigmod/YanMHF01,Data-Driven Understanding and Refinement of Schema Mappings,"L Yan, R Miller, L Haas, R Fagin",SIGMOD Conference,2001
70246,conf/sigmod/LahiriG01,Fast-Start: Quick Fault Recovery in Oracle,"T Lahiri, A Ganesh, R Weiss, A Joshi",SIGMOD Conference,2001
70252,journals/sigmod/ACT-NET96,ACT-NET - The Active Database Management System Manifesto: A Rulebase of ADBMS Features,,SIGMOD Record,1996
70258,journals/sigmod/NormanZT96,Much Ado About Shared-Nothing,"M Norman, T Zurek, P Thanisch",SIGMOD Record,1996
70264,journals/sigmod/Dogac96,Middle East Technical University Software Research and Development Center,A Dogac,SIGMOD Record,1996
70268,conf/sigmod/HaasH01,Online Query Processing,,,2001
70270,conf/sigmod/Larson01,XML Data Management Go Native or Spruce up Relational Systems? (Panel Abstract),P Larson,SIGMOD Conference,2001
70280,journals/sigmod/AndlerHEMBE96,DeeDS Towards a Distributed and Active Real-Time Database System,"S Andler, J Hansson, J Eriksson, J Mellin, M Berndtsson, B Eftring",SIGMOD Record,1996
70281,journals/sigmod/LinP96,Enhancing External Consistency in Real-Time Transactions,"K Lin, S Peng",SIGMOD Record,1996
70283,conf/sigmod/AgichteinGV01,Snowball: A Prototype System for Extracting Relations from Large Text Collections,"E Agichtein, L Gravano, J Pavel, V Sokolova, A Voskoboynik",SIGMOD Conference,2001
70286,journals/sigmod/PhatakSSS96,"Database Research at the Indian Institute of Technology, Bombay","D Phatak, N Sarda, S Seshadri, S Sudarshan",SIGMOD Record,1996
70291,journals/sigmod/KuoM96,Real-Time Database - Similarity Semantics and Resource Scheduling,"T Kuo, A Mok",SIGMOD Record,1996
70292,conf/sigmod/BabuGR01,SPARTAN: A Model-Based Semantic Compression System for Massive Data Tables,"S Babu, M Garofalakis, R Rastogi",SIGMOD Conference,2001
70296,conf/sigmod/GreenwaldK01,Space-Efficient Online Computation of Quantile Summaries,"M Greenwald, S Khanna",SIGMOD Conference,2001
70300,journals/sigmod/BerndtssonH96,Workshop Report: The First International Workshop on Active and Real-Time Database Systems (ARTDB-95),,,1996
70304,conf/sigmod/LazaridisM01,Progressive Approximate Aggregate Queries with a Multi-Resolution Tree Structure,"I Lazaridis, S Mehrotra",SIGMOD Conference,2001
70314,conf/sigmod/ChenGK01,Query Optimization In Compressed Database Systems,"Z Chen, J Gehrke, F Korn",SIGMOD Conference,2001
70322,journals/sigmod/Gunther97,Environment Information Systems - Guest Editor's Foreword,,,1997
70334,conf/sigmod/HristidisKP01,PREFER: A System for the Efficient Execution of Multi-parametric Ranked Queries,"V Hristidis, N Koudas, Y Papakonstantinou",SIGMOD Conference,2001
70336,conf/sigmod/JoshiA01,Mining Needle in a Haystack: Classifying Rare Classes via Two-phase Rule Induction,"M Joshi, R Agarwal",SIGMOD Conference,2001
70346,conf/sigmod/GunopulosD01,Time Series Similarity Measures and Time Series Indexing,,,2001
70352,journals/sigmod/Widom96b,Editor's Notes,Jennifer Widom,SIGMOD Record,1996
70358,journals/sigmod/SantucciT96,To Table or Not to Table: a Hypertabular Answer,"G Santucci, L Tarantino",SIGMOD Record,1996
70359,conf/sigmod/WuAA01,Using the Golden Rule of Sampling for Query Estimation,"Y Wu, D Agrawal, A Abbadi",SIGMOD Conference,2001
70360,journals/sigmod/TaninBS96,Incremental data Structures and Algorithms for Dynamic Query Interfaces,"E Tanin, R Beigel, B Shneiderman",SIGMOD Record,1996
70365,journals/sigmod/Bhashyam96,"TCP-D - The Challenges, Issues and Results",R Bhashyam,SIGMOD Record,1996
70377,conf/sigmod/NguyenACP01,Monitoring XML Data on the Web,"B Nguyen, S Abiteboul, G Cobena, M Preda",SIGMOD Conference,2001
70400,journals/sigmod/KimballS95,Why Decision Support Fails and How To Fix It,"R Kimball, K Strehlo",SIGMOD Record,1995
70411,conf/sigmod/LiuPBHPT00,AQR-Toolkit: An Adaptive Query Routing Middleware for Distributed Data Intensive Systems,"L Liu, C Pu, D Buttler, W Han, H Paques, W Tang",SIGMOD Conference,2000
70412,journals/sigmod/KlasS94,Metadata for Digital Media: Introduction to the Special Issue,"W Klas, A Sheth",SIGMOD Record,1994
70440,journals/sigmod/Jarke95,Information Systems Research at RWTH Aachen,M Jarke,SIGMOD Record,1995
70448,conf/sigmod/RodriguezR00,MOCHA: A Self-Extensible Database Middleware System for Distributed Data Sources,"M Rodriguez-Martinez, N Roussopoulos",SIGMOD Conference,2000
70452,conf/sigmod/LabrinidisR00,WebView Materialization,"A Labrinidis, N Roussopoulos",SIGMOD Conference,2000
70468,conf/sigmod/FaloutsosSTT00,Spatial Join Selectivity Using Power Laws,"C Faloutsos, B Seeger, A Traina, C Jr.",SIGMOD Conference,2000
70471,conf/sigmod/LiefkeS00,XMILL: An Efficient Compressor for XML Data,"H Liefke, D Suciu",SIGMOD Conference,2000
70477,conf/sigmod/Hellerstein00,Index Research: Forest or Trees? (Panel Abstract),J Hellerstein,SIGMOD Conference,2000
70486,conf/sigmod/Gal00,"Data Management in eCommerce: The Good, the Bad, and the Ugly",,,2000
70490,conf/sigmod/Carey00,On XML and Databases: Where's the Beef? (Panel Abstract),M Carey,SIGMOD Conference,2000
70506,conf/sigmod/LehnerSPC00,Maintenance of Automatic Summary Tables,"W Lehner, R Sidle, H Pirahesh, R Cochrane",SIGMOD Conference,2000
70522,journals/tods/HjaltasonS03,Index-driven similarity search in metric spaces,"G Hjaltason, H Samet",ACM Trans. Database Syst.,2003
70527,journals/sigmod/Snodgrass94,Overview of the Special Section on Temporal Database Infrastructure,R Snodgrass,SIGMOD Record,1994
70529,conf/sigmod/PeiMHZ00,Towards Data Mining Benchmarking: A Testbed for Performance Study of Frequent Pattern Mining,"J Pei, R Mao, K Hu, H Zhu",SIGMOD Conference,2000
70549,conf/sigmod/MayrS99,Client-Site Query Extensions,"T Mayr, P Seshadri",SIGMOD Conference,1999
70554,conf/sigmod/KotidisR99,DynaMat: A Dynamic View Management System for Data Warehouses,"Y Kotidis, N Roussopoulos",SIGMOD Conference,1999
70555,conf/sigmod/ChanI99,An Efficient Bitmap Encoding Scheme for Selection Queries,"C Chan, Y Ioannidis",SIGMOD Conference,1999
70560,journals/tods/TaoP03,Spatial queries in dynamic environments,"Y Tao, D Papadias",ACM Trans. Database Syst.,2003
70566,conf/sigmod/ShanmugasundaramNSR99,Efficient Concurrency Control for Broadcast Environments,"J Shanmugasundaram, A Nithrakashyap, R Sivasankaran, K Ramamritham",SIGMOD Conference,1999
70568,conf/sigmod/GehrkeGRL99,BOAT-Optimistic Decision Tree Construction,"J Gehrke, V Ganti, R Ramakrishnan, W Loh",SIGMOD Conference,1999
70579,journals/sigmod/Datta94,Research Issues in Databases for ARCS: Active Rapidly Changing Data Systems,A Datta,SIGMOD Record,1994
70580,conf/sigmod/WolfsonSXZC99,DOMINO: Databases fOr MovINg Objects tracking,"O Wolfson, A Sistla, B Xu, J Zhou, S Chamberlain",SIGMOD Conference,1999
70585,journals/sigmod/Group94,"Response to the March 1994 ODMG-93 Commentary Written by Dr. Won Kim of UniSQL, Inc",O Group,SIGMOD Record,1994
70593,journals/sigmod/GroskyFS94,Using Metadata for the Intelligent Browsing of Structured Media Objects,"W Grosky, F Fotouhi, I Sethi",SIGMOD Record,1994
70597,conf/sigmod/KrishnamurthyBN99,Bringing Object-Relational Technology to Mainstream,"V Krishnamurthy, S Banerjee, A Nori",SIGMOD Conference,1999
70602,journals/sigmod/MattosD94,Recent Design Trade-offs in SQL3,"N Mattos, L DeMichiel",SIGMOD Record,1994
70606,journals/sigmod/GeppertD94,Constructing the Next 100 Database Management Systems,"A Geppert, K Dittrich",SIGMOD Record,1994
70607,conf/sigmod/AcharyaGPR99a,Join Synopses for Approximate Query Answering,"S Acharya, P Gibbons, V Poosala, S Ramaswamy",SIGMOD Conference,1999
70623,journals/sigmod/X94,The TSQL2 Final Language Definition Announcement,,SIGMOD Record,1994
70624,conf/sigmod/JagadishLMSV99,Querying Network Directories,"H Jagadish, L Lakshmanan, T Milo, D Srivastava, D Vista",SIGMOD Conference,1999
70626,conf/sigmod/BreitbartKRSS99,Update Propagation Protocols For Replicated Databases,"Y Breitbart, R Komondoor, R Rastogi, S Seshadri, A Silberschatz",SIGMOD Conference,1999
70627,conf/sigmod/LometT99,Logical Logging to Extend Recovery to New Domains,"D Lomet, M Tuttle",SIGMOD Conference,1999
70631,journals/sigmod/Alonso94a,Trade Press News,,,1994
70635,conf/sigmod/Team99,In-Memory Data Management for Consumer Transactions The Times-Ten Approach,T Team,SIGMOD Conference,1999
70650,conf/sigmod/BargaL99,Phoenix: Making Applications Robust,"R Barga, D Lomet",SIGMOD Conference,1999
70655,conf/sigmod/ZhouLP99,TAM: A System for Dynamic Transactional Activity Management,"T Zhou, L Liu, C Pu",SIGMOD Conference,1999
70660,conf/vldb/FegarasE01,Query Engines for Web-Accessible XML Data,"L Fegaras, R Elmasri",VLDB,2001
70662,conf/sigmod/BonnetBCCCHKMMOSS99,The Cornell Jaguar System: Adding Mobility to PREDATOR,"P Bonnet, K Buza, Z Chen, V Cheng, R Chung, T Hickey, R Kennedy, D Mahashin, T Mayr, I Oprencak, P Seshadri, H Siu",SIGMOD Conference,1999
70667,conf/sigmod/ChangG99,Mind Your Vocabulary: Query Mapping Across Heterogeneous Information Sources,"K Chang, H Garcia-Molina",SIGMOD Conference,1999
70675,conf/sigmod/PapakonstantinouV99,Query Rewriting for Semistructured Data,"Y Papakonstantinou, V Vassalos",SIGMOD Conference,1999
70677,conf/vldb/Adler01,DB2 Spatial Extender - Spatial data within the RDBMS,D Adler,VLDB,2001
70678,conf/sigmod/DeutschFS99,Storing Semistructured Data with STORED,"A Deutsch, M Fernandez, D Suciu",SIGMOD Conference,1999
70685,conf/vldb/Sondag01,The Semantic Web Paving the Way to the Knowledge Society,P Sondag,VLDB,2001
70690,conf/vldb/AndreiV01,User-Optimizer Communication using Abstract Plans in Sybase ASE,"M Andrei, P Valduriez",VLDB,2001
70691,conf/sigmod/Brown99,Implementing the Spirit of SQL-99,P Brown,SIGMOD Conference,1999
70695,conf/sigmod/Hammond99,Merge Replication in Microsoft's SQL Server 7.0,B Hammond,SIGMOD Conference,1999
70698,conf/vldb/Leymann01,Managing Business Processes via Workflow Technology,,,2001
70709,conf/vldb/Gibbons01,Distinct Sampling for Highly-Accurate Answers to Distinct Values Queries and Event Reports,P Gibbons,VLDB,2001
70712,conf/vldb/GravanoIJKMS01,Approximate String Joins in a Database (Almost) for Free,"L Gravano, P Ipeirotis, H Jagadish, N Koudas, S Muthukrishnan, D Srivastava",VLDB,2001
70719,conf/sigmod/BerchtoldK98,"High-Dimensional Index Structures, Database Support for Next Decade's Applications (Tutorial)","S Berchtold, D Keim",SIGMOD Conference,1998
70721,conf/vldb/SadriZZA01,A Sequential Pattern Query Language for Supporting Instant Data Mining for e-Services,"R Sadri, C Zaniolo, A Zarkesh, J Adibi",VLDB,2001
