tid,id,title,authors,venue,year
70728,conf/vldb/OConnellWG01,Collaborative Analytical Processing - Dream or Reality? (Panel abstract),"W O'Connell, A Witkowski, G Graefe",VLDB,2001
70734,conf/sigmod/BaruGLMPVC99,XML-Based Information Mediation with MIX,"C Baru, A Gupta, B Ludäscher, R Marciano, Y Papakonstantinou, P Velikhov, V Chu",SIGMOD Conference,1999
70740,conf/sigmod/AgrawalGGR98,Automatic Subspace Clustering of High Dimensional Data for Data Mining Applications,"R Agrawal, J Gehrke, D Gunopulos, P Raghavan",SIGMOD Conference,1998
70747,conf/sigmod/KotidisR98,An Alternative Storage Organization for ROLAP Aggregate Views Based on Cubetrees,"Y Kotidis, N Roussopoulos",SIGMOD Conference,1998
70749,conf/sigmod/KanthAS98,Dimensionality Reduction for Similarity Searching in Dynamic Databases,"K Kanth, D Agrawal, A Singh",SIGMOD Conference,1998
70752,conf/sigmod/UrhanFA98,Cost Based Query Scrambling for Initial Delays,"T Urhan, M Franklin, L Amsaleg",SIGMOD Conference,1998
70755,conf/sigmod/SubramanianV98,Cost-Based Optimization of Decision Support Queries Using Transient Views,"S Subramanian, S Venkataraman",SIGMOD Conference,1998
70757,conf/vldb/CooperSFHS01,A Fast Index for Semistructured Data,"B Cooper, N Sample, M Franklin, G Hjaltason, M Shadmon",VLDB,2001
70790,conf/sigmod/GibbonsM98,New Sampling-Based Summary Statistics for Improving Approximate Query Answers,"P Gibbons, Y Matias",SIGMOD Conference,1998
70792,conf/vldb/Banerjee00,A Database Platform for Bioinformatics,S Banerjee,VLDB,2000
70794,conf/vldb/Tsur00,Data Mining in the Bioinformatics Domain,S Tsur,VLDB,2000
70795,conf/sigmod/AvnurHLORRRW98,CONTROL: Continuous Output and Navigation Technology with Refinement On-Line,"R Avnur, J Hellerstein, B Lo, C Olston, B Raman, V Raman, T Roth, K Wylie",SIGMOD Conference,1998
70800,conf/sigmod/DarEGP98,DTL's DataSpot: Database Exploration as Easy as Browsing the Web,"S Dar, G Entin, S Geva, E Palmon",SIGMOD Conference,1998
70802,conf/sigmod/KornackerSH98,amdb: An Access Method Debugging Tool,"M Kornacker, M Shah, J Hellerstein",SIGMOD Conference,1998
70811,conf/sigmod/Fegaras98,Query Unnesting in Object-Oriented Databases,L Fegaras,SIGMOD Conference,1998
70815,conf/vldb/WuFSP00,FALCON: Feedback Adaptive Loop for Content-Based Retrieval,"L Wu, C Faloutsos, K Sycara, T Payne",VLDB,2000
70817,conf/sigmod/JonssonFS98,Interaction of Query Evaluation and Buffer Management for Information Retrieval,"B Jónsson, M Franklin, D Srivastava",SIGMOD Conference,1998
70819,conf/vldb/YiF00,Fast Time Sequence Indexing for Arbitrary Lp Norms,"B Yi, C Faloutsos",VLDB,2000
70832,conf/sigmod/BaumannDFRW98,The Multidimensional Database System RasDaMan,"P Baumann, A Dehmel, P Furtado, R Ritsch, N Widmann",SIGMOD Conference,1998
70840,conf/sigmod/ChaudhuriN98a,Microsoft Index Tuning Wizard for SQL Server 7.0,"S Chaudhuri, V Narasayya",SIGMOD Conference,1998
70841,conf/sigmod/KiepuszewskiMO98,FlowBack: Providing Backward Recovery for Workflow Systems,"B Kiepuszewski, R Mühlberger, M Orlowska",SIGMOD Conference,1998
70846,conf/sigmod/BrinMUT97,Dynamic Itemset Counting and Implication Rules for Market Basket Data,"S Brin, R Motwani, J Ullman, S Tsur",SIGMOD Conference,1997
70847,conf/sigmod/ZhaoDN97,An Array-Based Algorithm for Simultaneous Multidimensional Aggregates,"Y Zhao, P Deshpande, J Naughton",SIGMOD Conference,1997
70856,conf/sigmod/CeriFP98,The IDEA Web Lab,"S Ceri, P Fraternali, S Paraboschi",SIGMOD Conference,1998
70866,conf/sigmod/BlakeleyP98,Microsoft Universal Data Access Platform,"J Blakeley, M Pizzo",SIGMOD Conference,1998
70874,conf/vldb/JensenL01,Transaction Timestamping in (Temporal) Databases,"C Jensen, D Lomet",VLDB,2001
70875,conf/sigmod/MeccaAMMS98,The Araneus Web-Base Management System,"G Mecca, P Atzeni, A Masci, P Merialdo, G Sindoni",SIGMOD Conference,1998
70877,conf/vldb/OzdenGHNSDGGW01,Storage Service Providers: a Solution for Storage Management? (Panel),"B Özden, E Gabber, B Hillyer, W Ng, E Shriver, D DeWitt, B Gordon, J Gray, J Wilkes",VLDB,2001
70883,conf/vldb/BonifatiCDS01,Warehousing Workflow Data: Challenges and Opportunities,"A Bonifati, F Casati, U Dayal, M Shan",VLDB,2001
70900,conf/vldb/Blecken00,Media360 Workflow-Implementing a Workflow Engine Inside a Database,C Blecken,VLDB,2000
70905,conf/sigmod/MaheshwariL97,Partitioned Garbage Collection of Large Object Store,"U Maheshwari, B Liskov",SIGMOD Conference,1997
70911,conf/vldb/Deshpande00,Linking Business to Deliver Value: A Data Management Challenge,A Deshpande,VLDB,2000
70929,conf/vldb/AdiBEY00,Push Technology Personalization through Event Correlation,"A Adi, D Botzer, O Etzion, T Yatzkar-Haham",VLDB,2000
70933,conf/vldb/BeneventanoBCCGMMV00,Information Integration: The MOMIS Project Demonstration,"D Beneventano, S Bergamaschi, S Castano, A Corni, R Guidetti, G Malvezzi, M Melchiori, M Vincini",VLDB,2000
70940,conf/sigmod/BrinMS97,Beyond Market Baskets: Generalizing Association Rules to Correlations,"S Brin, R Motwani, C Silverstein",SIGMOD Conference,1997
70943,conf/sigmod/LivnyRBCDLMW97,DEVise: Integrated Querying and Visualization of Large Datasets,"M Livny, R Ramakrishnan, K Beyer, G Chen, D Donjerkovic, S Lawande, J Myllymaki, R Wenger",SIGMOD Conference,1997
70944,conf/vldb/PedersenJD00,The TreeScape System: Reuse of Pre-Computed Aggregates over Irregular OLAP Hierarchies,"T Pedersen, C Jensen, C Dyreson",VLDB,2000
70952,conf/sigmod/AgrawalASY97,Efficient View Maintenance at Data Warehouses,"D Agrawal, A Abbadi, A Singh, T Yurek",SIGMOD Conference,1997
70953,conf/vldb/SakuraiYUK00,The A-tree: An Index Structure for High-Dimensional Spaces Using Relative Approximation,"Y Sakurai, M Yoshikawa, S Uemura, H Kojima",VLDB,2000
70956,conf/sigmod/IoannidisLANT97,ZOO: A Desktop Emperiment Management Environment,"Y Ioannidis, M Livny, A Ailamaki, A Narayanan, A Therber",SIGMOD Conference,1997
70962,conf/sigmod/SeshadriP97,PREDATOR: An OR-DBMS with Enhanced Data Types,"P Seshadri, M Paskin",SIGMOD Conference,1997
70977,conf/vldb/SrinivasanDFCJYKTDB00,Oracle8i Index-Organized Table and Its Application to New Domains,"J Srinivasan, S Das, C Freiwald, E Chong, M Jagannath, A Yalamanchi, R Krishnan, A Tran, S DeFazio, J Banerjee",VLDB,2000
70998,conf/vldb/GrumbachRS00,Manipulating Interpolated Data is Easier than You Thought,"S Grumbach, P Rigaux, L Segoufin",VLDB,2000
71004,conf/vldb/LakshmananJN00,The 3W Model and Algebra for Unified Data Mining,"T Johnson, L Lakshmanan, R Ng",VLDB,2000
71014,conf/sigmod/Shasha97,"Lessons from Wall Street: Case Studies in Configuration, Tuning, and Distribution (Tutorial)",,,1997
71015,conf/sigmod/MotakisZ97,Temporal Aggregation in Active Database Rules,"I Motakis, C Zaniolo",SIGMOD Conference,1997
71022,conf/vldb/DeutschPT99,"Physical Data Independence, Constraints, and Optimization with Universal Plans","A Deutsch, L Popa, V Tannen",VLDB,1999
71023,conf/vldb/JaedickeM99,User-Defined Table Operators: Enhancing Extensibility for ORDBMS,"M Jaedicke, B Mitschang",VLDB,1999
71036,conf/sigmod/VanceM96,Rapid Bushy Join-order Optimization with Cartesian Products,"B Vance, D Maier",SIGMOD Conference,1996
71038,conf/sigmod/SelfridgeSW96,IDEA: Interactive Data Exploration and Analysis,"P Selfridge, D Srivastava, L Wilson",SIGMOD Conference,1996
71040,conf/vldb/HaasKU99,Loading a Cache with Query Results,"L Haas, D Kossmann, I Ursu",VLDB,1999
71044,conf/sigmod/BilirisFOP96,BeSS: Storage Support for Interactive Visualization Systems,"A Biliris, T Funkhouser, W O'Connell, E Panagos",SIGMOD Conference,1996
71046,conf/sigmod/HungYK96,CapBasED-AMS: A Capability-based and Event-driven Activity Management System,"P Hung, H Yeung, K Karlapalem",SIGMOD Conference,1996
71052,conf/sigmod/Keim96,Databases and Visualization,D Keim,SIGMOD Conference,1996
71057,conf/sigmod/HanFWCZK96,DBMiner: Interactive Mining of Multiple-Level Knowledge in Relational Databases,"J Han, Y Fu, W Wang, J Chiang, O Zaďane, K Koperski",SIGMOD Conference,1996
71066,conf/sigmod/NguyenS96,Accessing Relational Databases from the World Wide Web,"T Nguyen, V Srinivasan",SIGMOD Conference,1996
71072,conf/sigmod/SeshadriHPLRSSS96,Cost-Based Optimization for Magic: Algebra and Implementation,"P Seshadri, J Hellerstein, H Pirahesh, T Leung, R Ramakrishnan, D Srivastava, P Stuckey, S Sudarshan",SIGMOD Conference,1996
71075,conf/vldb/Norvag99,The Persistent Cache: Improving OID Indexing in Temporal Object-Oriented Database Systems,K Nřrvĺg,VLDB,1999
71083,conf/sigmod/ShatdalN95,Adaptive Parallel Aggregation Algorithms,"A Shatdal, J Naughton",SIGMOD Conference,1995
71091,conf/sigmod/RothAHCCFSTW96,The Garlic Project,"M Roth, M Arya, L Haas, M Carey, W Cody, R Fagin, P Schwarz, J II, E Wimmers",SIGMOD Conference,1996
71097,conf/sigmod/DogacHKOONDMAKE96,METU Interoperable Database System,"A Dogac, U Halici, E Kilic, G Özhan, F Ozcan, S Nural, C Dengi, S Mancuhan, I Arpinar, P Koksal, C Evrendilek",SIGMOD Conference,1996
71099,conf/sigmod/ChooOLCGBPS96,Prospector: A Content-Based Multimedia Server for Massively Parallel Architectures,"S Choo, W O'Connell, G Linderman, H Chen, K Ganapathi, A Biliris, E Panagos, D Schrader",SIGMOD Conference,1996
71110,conf/vldb/RothOH99,Cost Models DO Matter: Providing Cost Information for Diverse Data Sources in a Federated System,"M Roth, F Ozcan, L Haas",VLDB,1999
71112,conf/sigmod/FernandezS96,The Ins and Outs (and Everthing in Between) of Data Warehousing,,,1996
71119,conf/sigmod/CherniackZ96,Rule Languages and Internal Algebras for Rule-Based Optimizers,"M Cherniack, S Zdonik",SIGMOD Conference,1996
71123,conf/sigmod/CookKWZ96,"Semi-automatic, Self-adaptive Control of Garbage Collection Rates in Object Databases","J Cook, A Klauser, A Wolf, B Zorn",SIGMOD Conference,1996
71124,conf/vldb/BernsteinPS99,Context-Based Prefetch for Implementing Objects on Relations,"P Bernstein, S Pal, D Shutt",VLDB,1999
71126,conf/vldb/GohOST99,GHOST: Fine Granularity Buffering of Indexes,"C Goh, B Ooi, D Sim, K Tan",VLDB,1999
71132,conf/vldb/RaoR99,Cache Conscious Indexing for Decision-Support in Main Memory,"J Rao, K Ross",VLDB,1999
71135,conf/sigmod/PoosalaIHS96,Improved Histograms for Selectivity Estimation of Range Predicates,"V Poosala, Y Ioannidis, P Haas, E Shekita",SIGMOD Conference,1996
71143,conf/sigmod/HarinarayanRU96,Implementing Data Cubes Efficiently,"V Harinarayan, A Rajaraman, J Ullman",SIGMOD Conference,1996
71144,conf/vldb/PitouraC99,Exploiting Versions for Handling Updates in Broadcast Disks,"E Pitoura, P Chrysanthis",VLDB,1999
71150,conf/sigmod/AcharyaAFZ95,Broadcast Disks: Data Management for Asymmetric Communications Environments,"S Acharya, R Alonso, M Franklin, S Zdonik",SIGMOD Conference,1995
71151,conf/vldb/VenkataramanZ98,Heterogeneous Database Query Optimization in DB2 Universal DataJoiner,"S Venkataraman, T Zhang",VLDB,1998
71160,conf/vldb/Vieille98,From Data Independence to Knowledge Independence: An on-going Story,L Vieille,VLDB,1998
71161,conf/vldb/DarEGP98,DTL's DataSpot: Database Exploration Using Plain Language,"S Dar, G Entin, S Geva, E Palmon",VLDB,1998
71166,conf/sigmod/AbiteboulCM95,A Database Interface for File Updates,"S Abiteboul, S Cluet, T Milo",SIGMOD Conference,1995
71175,conf/sigmod/Hope95,Enterprise Transaction Processing on Windows NT,G Hope,SIGMOD Conference,1995
71183,conf/sigmod/Squire95,Data Extraction and Transformation for the Data Warehouse,C Squire,SIGMOD Conference,1995
71189,conf/sigmod/BrodskyK95,The LyriC Language: Querying Constraint Objects,"A Brodsky, Y Kornatzky",SIGMOD Conference,1995
71193,conf/vldb/MiloZ98,Using Schema Matching to Simplify Heterogeneous Data Translation,"T Milo, S Zohar",VLDB,1998
71194,conf/sigmod/RadekeBBEKKN95,Efendi: Federated Database System of Cadlab,"E Radeke, R Böttger, B Burkert, Y Engel, G Kachel, S Kolmschlag, D Nolte",SIGMOD Conference,1995
71197,conf/vldb/BliujuteJSS98,R-Tree Based Indexing of Now-Relative Bitemporal Data,"R Bliujute, C Jensen, S Saltenis, G Slivinskas",VLDB,1998
71201,conf/sigmod/GardarinMP95,OFL: A Functional Execution Model for Object Query Languages,"G Gardarin, F Machuca, P Pucheral",SIGMOD Conference,1995
71213,conf/vldb/RamanRH99,Online Dynamic Reordering for Interactive Data Processing,"V Raman, B Raman, J Hellerstein",VLDB,1999
71214,conf/sigmod/WhiteD95,Implementing Crash Recovery in QuickStore: A Performance Study,"S White, D DeWitt",SIGMOD Conference,1995
71223,conf/sigmod/FreedmanD95,The SPIFFI Scalable Video-on-Demand System,"C Freedman, D DeWitt",SIGMOD Conference,1995
71226,conf/sigmod/GriffinL95,Incremental Maintenance of Views with Duplicates,"T Griffin, L Libkin",SIGMOD Conference,1995
71255,conf/vldb/Greco98,Binding Propagation in Disjunctive Databases,S Greco,VLDB,1998
71256,conf/sigmod/Perna95,Leveraging The Information Asset,J Perna,SIGMOD Conference,1995
71260,conf/sigmod/Gerber95,Informix Online XPS,R Gerber,SIGMOD Conference,1995
71264,conf/sigmod/Deutsch95,Objects and SQL: Strange Relations? Panel,D Deutsch,SIGMOD Conference,1995
71267,conf/vldb/OzsuVU98,An Asynchronous Avoidance-Based Cache Consistency Algorithm for Client Caching DBMSs,"M Özsu, K Voruganti, R Unrau",VLDB,1998
71273,conf/sigmod/Gibson95,Storage Technology: RAID and Beyond,,,1995
71283,conf/vldb/HumborstadSHT97,1-Safe Algorithms for Symmetric Site Configurations,"R Humborstad, M Sabaratnam, S Hvasshovd, Ř Torbjřrnsen",VLDB,1997
71285,conf/vldb/RothS97,"Don't Scrap It, Wrap It! A Wrapper Architecture for Legacy Data Sources","M Roth, P Schwarz",VLDB,1997
71289,conf/vldb/MorimotoIM97,Efficient Construction of Regression Trees with Range and Region Splitting,"Y Morimoto, H Ishii, S Morishita",VLDB,1997
71292,conf/vldb/SkubiszewskiV97,Concurrent Garbage Collection in O2,"M Skubiszewski, P Valduriez",VLDB,1997
71294,conf/vldb/AlsabtiRS97,A One-Pass Algorithm for Accurately Estimating Quantiles for Disk-Resident Data,"K Alsabti, S Ranka, V Singh",VLDB,1997
71321,conf/sigmod/HuangSW94,Data Replication for Mobile Computers,"Y Huang, A Sistla, O Wolfson",SIGMOD Conference,1994
71324,conf/vldb/MalonM97,Critical Database Technologies for High Energy Physics,"D Malon, E May",VLDB,1997
71326,conf/vldb/KumarKA97,Caprera: An Activity Framework for Transaction Processing on Wide-Area Networks,"S Kumar, E Kwang, D Agrawal",VLDB,1997
71327,conf/sigmod/KrollW94,Distributing a Search Tree Among a Growing Number of Processors,"B Kröll, P Widmayer",SIGMOD Conference,1994
71338,conf/sigmod/SwamiS94,Estimating Page Fetches for Index Scans with Finite LRU Buffers,"A Swami, K Schiefer",SIGMOD Conference,1994
71339,conf/vldb/RastogiS98,PUBLIC: A Decision Tree Classifier that Integrates Building and Pruning,"R Rastogi, K Shim",VLDB,1998
71342,conf/vldb/RamaswamyMS98,On the Discovery of Interesting Patterns in Association Rules,"S Ramaswamy, S Mahajan, A Silberschatz",VLDB,1998
71345,conf/sigmod/Mohan94,A Survey and Critique of Advanced Transaction Models,C Mohan,SIGMOD Conference,1994
71350,conf/sigmod/DarR94,A Performance Study of Transitive Closure Algorithms,"S Dar, R Ramakrishnan",SIGMOD Conference,1994
71359,conf/vldb/ChakrabartiSD98,Mining Surprising Patterns Using Temporal Description Length,"S Chakrabarti, S Sarawagi, B Dom",VLDB,1998
71360,conf/sigmod/ColeG94,Optimization of Dynamic Query Evaluation Plans,"R Cole, G Graefe",SIGMOD Conference,1994
71364,conf/vldb/LakshmiZ98,Selectivity Estimation in Extensible Databases - A Neural Network Approach,"M Lakshmi, S Zhou",VLDB,1998
71372,conf/sigmod/GraySEBW94,Quickly Generating Billion-Record Synthetic Databases,"J Gray, P Sundaresan, S Englert, K Baclawski, P Weinberger",SIGMOD Conference,1994
71379,conf/sigmod/HsiaoCY94,On Parallel Execution of Multiple Pipelined Hash Joins,"H Hsiao, M Chen, P Yu",SIGMOD Conference,1994
71385,conf/sigmod/PangCL94,Managing Memory for Real-Time Queries,"H Pang, M Carey, M Livny",SIGMOD Conference,1994
71393,conf/sigmod/SeshadriLR94,Sequence Query Processing,"P Seshadri, M Livny, R Ramakrishnan",SIGMOD Conference,1994
71398,conf/vldb/Pogue98,Oracle Industrial Exhibit,A Pogue,VLDB,1998
71405,conf/vldb/BouganimFV96,Dynamic Load Balancing in Hierarchical Parallel Database Systems,"L Bouganim, D Florescu, P Valduriez",VLDB,1996
71408,conf/sigmod/Ubell94,The Montage Extensible DataBlade Achitecture,M Ubell,SIGMOD Conference,1994
71410,conf/vldb/GardarinST96,"Calibrating the Query Optimizer Cost Model of IRO-DB, an Object-Oriented Federated Database System","G Gardarin, F Sha, Z Tang",VLDB,1996
71431,conf/vldb/SevcikK96,Filter Trees for Managing Spatial Data over a Range of Size Granularities,"K Sevcik, N Koudas",VLDB,1996
71436,journals/sigmod/Liu03c,Editor's Notes,L Liu,SIGMOD Record,2003
71445,journals/sigmod/BonnetBDL03,Bluetooth-based sensor networks,"P Bonnet, A Beaufour, M Dydensborg, M Leopold",SIGMOD Record,2003
71446,conf/vldb/CareyD96,Of Objects and Databases: A Decade of Turmoil,"M Carey, D DeWitt",VLDB,1996
71451,conf/sigmod/TheodoulidisAACKS94,The ORES Temporal Database Management System,"B Theodoulidis, A Ait-Braham, G Andrianopoulos, J Chaudhary, G Karvelis, S Sou",SIGMOD Conference,1994
71453,conf/vldb/Mohan96,DWMS: Data Warehouse Management System,N Mohan,VLDB,1996
71459,conf/vldb/Klots96,Cache Coherency in Oracle Parallel Server,B Klots,VLDB,1996
71461,conf/vldb/Padmanabhan96,Extracting Large Data Sets using DB2 Parallel Edition,S Padmanabhan,VLDB,1996
71490,conf/vldb/LlirbatST97,Using Versions in Update Transactions: Application to Integrity Checking,"F Llirbat, E Simon, D Tombroff",VLDB,1997
71491,conf/vldb/JagadishNSSK97,Incremental Organization for Data Recording and Warehousing,"H Jagadish, P Narayan, S Seshadri, S Sudarshan, R Kanneganti",VLDB,1997
71494,conf/vldb/Huyn97,Multiple-View Self-Maintenance in Data Warehousing Environments,N Huyn,VLDB,1997
71498,journals/sigmod/DemersGRTY03,The Cougar Project: a work-in-progress report,"A Demers, J Gehrke, R Rajaraman, A Trigoni, Y Yao",SIGMOD Record,2003
71503,journals/sigmod/Hammer03,Treasurer's Message,,,2003
71514,journals/sigmod/Halevy03,Learning about data integration challenges from day one,A Halevy,SIGMOD Record,2003
71515,conf/vldb/HuangJR97,Spatial Joins Using R-trees: Breadth-First Traversal with Global Optimizations,"Y Huang, N Jing, E Rundensteiner",VLDB,1997
71517,conf/vldb/PellenkoftLK97,The Complexity of Transformation-Based Join Enumeration,"A Pellenkoft, C Galindo-Legaria, M Kersten",VLDB,1997
71522,conf/vldb/CiacciaPZ97,M-tree: An Efficient Access Method for Similarity Search in Metric Spaces,"P Ciaccia, M Patella, P Zezula",VLDB,1997
71524,journals/sigmod/Liu03b,Editor's Notes,L Liu,SIGMOD Record,2003
71535,journals/sigmod/ChrysanthisSZ03,Report on the 4th International Conference on Mobile Data Management,,,2003
71539,conf/vldb/ChenRS95,Declustering Databases on Heterogeneous Disk Systems,"L Chen, D Rotem, S Seshadri",VLDB,1995
71542,conf/vldb/KornackerB95,High-Concurrency Locking in R-Trees,"M Kornacker, D Banks",VLDB,1995
71553,conf/vldb/Bhashyam96,"TPC-D: The Challenges, Issues and Results",R Bhashyam,VLDB,1996
71564,conf/vldb/SavasereON95,An Efficient Algorithm for Mining Association Rules in Large Databases,"A Savasere, E Omiecinski, S Navathe",VLDB,1995
71566,journals/sigmod/RossNO03,Reminiscences on Influential Papers,,,2003
71568,conf/vldb/RahmM95,Dynamic Multi-Resource Load Balancing in Parallel Database Systems,"E Rahm, R Marek",VLDB,1995
71569,journals/sigmod/Winslett03a,Interview with Michael Stonebraker,,,2003
71576,conf/vldb/MillinerBP95,A Scalable Architecture for Autonomous Heterogeneous Database Interactions,"S Milliner, A Bouguettaya, M Papazoglou",VLDB,1995
71584,conf/vldb/BargaP95,A Practical and Modular Implementation of Extended Transaction Models,"R Barga, C Pu",VLDB,1995
71585,conf/vldb/BunemanDHOW95,A Data Transformation System for Biological Data Sources,"P Buneman, S Davidson, K Hart, G Overton, L Wong",VLDB,1995
71586,journals/sigmod/GolabO03,Issues in data stream management,"L Golab, M Özsu",SIGMOD Record,2003
71594,journals/sigmod/MukhopadhyayGS03,An approach to confidence based page ranking for user oriented Web search,"D Mukhopadhyay, D Giri, S Singh",SIGMOD Record,2003
71605,journals/sigmod/David03,ANSI SQL Hierarchical Processing Can Fully Integrate Native XML,M David,SIGMOD Record,2003
71606,conf/vldb/Levy96,Obtaining Complete Answers from Incomplete Databases,A Levy,VLDB,1996
71608,journals/sigmod/MarchiLPT03,Analysis of existing databases at the logical level: the DBA companion project,"F Marchi, S Lopes, J Petit, F Toumani",SIGMOD Record,2003
71625,conf/vldb/AnciauxBP03,Memory Requirements for Query Execution in Highly Constrained Devices,"N Anciaux, L Bouganim, P Pucheral",VLDB,2003
71628,conf/vldb/FlorescuHKLRWCSA03,The BEA/XQRL Streaming XQuery Processor,"D Florescu, C Hillery, D Kossmann, P Lucas, F Riccardi, T Westmann, M Carey, A Sundararajan, G Agrawal",VLDB,2003
71632,conf/vldb/Galindo-LegariaJWW03,Statistics on Views,"C Galindo-Legaria, M Joshi, F Waas, M Wu",VLDB,2003
71640,conf/vldb/HristidisGP03,Efficient IR-Style Keyword Search over Relational Databases,"V Hristidis, L Gravano, Y Papakonstantinou",VLDB,2003
71644,conf/vldb/WeberSNSS03,WebService Composition with O'GRAPE and OSIRIS,"R Weber, C Schuler, P Neukomm, H Schuldt, H Schek",VLDB,2003
71652,conf/vldb/Brodie03,Illuminating the Dark Side of Web Services,M Brodie,VLDB,2003
71653,conf/vldb/Cluet03,Who needs XML Databases?,S Cluet,VLDB,2003
71678,conf/vldb/Shenker03,The Data-Centric Revolution in Networking,S Shenker,VLDB,2003
71688,conf/vldb/ChenJLP03,From Tree Patterns to Generalized Tree Patterns: On Efficient Evaluation of XQuery,"Z Chen, H Jagadish, L Lakshmanan, S Paparizos",VLDB,2003
71694,conf/vldb/YuPM03,Distributed Top-N Query Processing with Possibly Uncooperative Local Systems,"C Yu, G Philip, W Meng",VLDB,2003
71695,conf/vldb/LongS03,Optimized Query Execution in Large Search Engines with Global Page Ordering,"X Long, T Suel",VLDB,2003
71706,conf/vldb/HankinsP03,"Data Morphing: An Adaptive, Cache-Conscious Storage Technique","R Hankins, J Patel",VLDB,2003
71709,conf/vldb/ViglasNB03,Maximizing the Output Rate of Multi-Way Join Queries over Streaming Information Sources,"S Viglas, J Naughton, J Burger",VLDB,2003
71718,conf/vldb/MadhavanH03,Composing Mappings Among Data Sources,"J Madhavan, A Halevy",VLDB,2003
71727,conf/vldb/KornMZ03,Checks and Balances: Monitoring Data Quality Problems in Network Traffic Databases,"F Korn, S Muthukrishnan, Y Zhu",VLDB,2003
71742,conf/vldb/BenediktCFRZZ02,DTD-Directed Publishing with Attribute Translation Grammars,"M Benedikt, C Chan, W Fan, R Rastogi, S Zheng, A Zhou",VLDB,2002
71746,conf/vldb/LeeWMS02,A One-Pass Aggregation Algorithm with the Optimal Buffer Size in Multidimensional OLAP,"Y Lee, K Whang, Y Moon, I Song",VLDB,2002
71774,conf/vldb/SantiniG02,GeMBASE: A Geometric Mediator for Brain Analysis with Surface Ensembles,"S Santini, A Gupta",VLDB,2002
71776,conf/vldb/HeymannTKWRMF02,Viator - A Tool Family for Graphical Networking and Data View Creation,"S Heymann, K Tham, A Kilian, G Wegner, P Rieger, D Merkel, J Freytag",VLDB,2002
71793,conf/vldb/DayalHL01,"Business Process Coordination: State of the Art, Trends, and Open Issues","U Dayal, M Hsu, R Ladin",VLDB,2001
71799,conf/vldb/GottlobKP02,Efficient Algorithms for Processing XPath Queries,"G Gottlob, C Koch, R Pichler",VLDB,2002
71801,conf/vldb/RamamurthyDS02,A Case for Fractured Mirrors,"R Ramamurthy, D DeWitt, Q Su",VLDB,2002
71808,conf/vldb/Faloutsos02,Sensor Data Mining: Similarity Search and Pattern Analysis,,,2002
71828,conf/vldb/KossmannRR02,Shooting Stars in the Sky: An Online Algorithm for Skyline Queries,"D Kossmann, F Ramsak, S Rost",VLDB,2002
71839,conf/vldb/TaoP02,Adaptive Index Structures,"Y Tao, D Papadias",VLDB,2002
71846,conf/vldb/GilbertKMS02,How to Summarize the Universe: Dynamic Maintenance of Quantiles,"A Gilbert, Y Kotidis, S Muthukrishnan, M Strauss",VLDB,2002
71853,conf/vldb/CandanALPH02,View Invalidation for Dynamic Content Caching in Multitiered Architectures,"K Candan, D Agrawal, W Li, O Po, W Hsiung",VLDB,2002
71861,journals/tods/Jagadish95,The INCINERATE Data Model,H Jagadish,ACM Trans. Database Syst.,1995
71867,journals/tods/SrivastavaSRN95,Space Optimization in Deductive Databases,"D Srivastava, S Sudarshan, R Ramakrishnan, J Naughton",ACM Trans. Database Syst.,1995
71874,journals/tods/FraternaliT95,A Structured Approach for the Definition of the Semantics of Active Databases,"P Fraternali, L Tanca",ACM Trans. Database Syst.,1995
71875,journals/tods/GuoSW96,Solving Satisfiability and Implication Problems in Database Systems,"S Guo, W Sun, M Weiss",ACM Trans. Database Syst.,1996
71877,journals/tods/BunemanO96,Polymorphism and Type Inference in Database Programming,"P Buneman, A Ohori",ACM Trans. Database Syst.,1996
71879,journals/tods/GhandeharizadehHJ96,Heraclitus: Elevating Deltas to be First-Class Citizens in a Database Programming Language,"S Ghandeharizadeh, R Hull, D Jacobs",ACM Trans. Database Syst.,1996
71880,journals/tods/DeyS96,A Probabilistic Relational Model and Algebra,"D Dey, S Sarkar",ACM Trans. Database Syst.,1996
71883,journals/tods/RaschidL96,Semantics for Update Rule Programs and Implementations in a Relational Database Management System,"L Raschid, J Lobo",ACM Trans. Database Syst.,1996
71886,journals/tods/LitwinN96,"LH* - A Scalable, Distributed Data Structure","W Litwin, M Neimat, D Schneider",ACM Trans. Database Syst.,1996
71892,journals/vldb/ChanGR03,RE-tree: an efficient index structure for regular expressions,"C Chan, M Garofalakis, R Rastogi",VLDB J.,2003
71899,journals/vldb/FungKL03,Cost-driven vertical class partitioning for methods in object oriented databases,"C Fung, K Karlapalem, Q Li",VLDB J.,2003
