tid,id,title,authors,venue,year
72050,journals/vldb/DesslochHMMT98,"Advanced Data Processing in KRISYS: Modeling Concepts, Implementation Techniques, and Client/Server Issues","S Deßloch, T Härder, N Mattos, B Mitschang, J Thomas",VLDB J.,1998
72055,journals/vldb/FengYLH02,A template model for multidimensional inter-transactional association rules,"L Feng, J Yu, H Lu, J Han",VLDB J.,2002
72066,journals/vldb/Halevy01,Answering queries using views: A survey,A Halevy,VLDB J.,2001
72069,journals/vldb/ShethTP03,Complex relationships and knowledge discovery support in the InfoQuilt system,"A Sheth, S Thacker, S Patel",VLDB J.,2003
72075,journals/vldb/ChanFGR02,Efficient filtering of XML documents with XPath expressions,"C Chan, P Felber, M Garofalakis, R Rastogi",VLDB J.,2002
72077,journals/vldb/Halevy02,Guest Editorial,,,2002
72078,journals/vldb/JagadishACLNPPSWWY02,TIMBER: A native XML database,"H Jagadish, S Al-Khalifa, A Chapman, L Lakshmanan, A Nierman, S Paparizos, J Patel, D Srivastava, N Wiwatwattana, Y Wu, C Yu",VLDB J.,2002
72084,journals/vldb/NguSHL01,Combining multi-visual features for efficient indexing in a large image database,"A Ngu, Q Sheng, D Huynh, R Lei",VLDB J.,2001
72086,journals/vldb/BraumandlKKKKSS01,ObjectGlobe: Ubiquitous query processing on the Internet,"R Braumandl, M Keidl, A Kemper, D Kossmann, A Kreutz, S Seltzsam, K Stocker",VLDB J.,2001
72111,journals/vldb/CasatiSG01,E-Services - Guest editorial,,,2001
72114,journals/vldb/DattaDVRN01,An architecture to support scalable online personalization on the Web,"A Datta, K Dutta, D VanderMeer, K Ramamritham, S Navathe",VLDB J.,2001
72119,journals/vldb/RamamrithamC96,A Taxonomy of Correctness Criteria in Database Applications,"K Ramamritham, P Chrysanthis",VLDB J.,1996
72121,journals/vldb/FangGM96,An Experimental System for Object-Based Sharing in Federated Databases,"D Fang, S Ghandeharizadeh",VLDB J.,1996
72129,journals/vldb/KashyapS96,Semantic and Schematic Similarities Between Database Objects: A Context-Based Approach,"V Kashyap, A Sheth",VLDB J.,1996
72135,journals/vldb/OzsuPSILM95,TIGUKAT: A Uniform Behavioral Objectbase Management System,"M Özsu, R Peters, D Szafron, B Irani, A Lipka, A Muńoz",VLDB J.,1995
72137,journals/vldb/C95b,"Title, Preface to the Special Issue on Persistent Object Systems",,,1995
72139,journals/vldb/StonebrakerALPSSSY96,Mariposa: A Wide-Area Distributed Database System,"M Stonebraker, P Aoki, W Litwin, A Pfeffer, A Sah, J Sidell, C Staelin, A Yu",VLDB J.,1996
72148,journals/vldb/ConstantopoulosJMV95,The Software Information Base: A Server for Reuse,"P Constantopoulos, M Jarke, J Mylopoulos, Y Vassiliou",VLDB J.,1995
72150,journals/vldb/AgrawalAJL95,Ordered Shared Locks for Real-Time Databases,"D Agrawal, A Abbadi, R Jeffers, L Lin",VLDB J.,1995
72161,journals/vldb/C95,"Title, Announcement",,,1995
72163,journals/vldb/DerrMP94,"The Glue-Nail Deductive Database System: Design, Implementation, and Evaluation","M Derr, S Morishita, G Phipps",VLDB J.,1994
72167,journals/vldb/WhangKW94,Dynamic Maintenance of Data Distribution for Selectivity Estimation,"K Whang, S Kim, G Wiederhold",VLDB J.,1994
72170,journals/vldb/Sciore94,Versioning and Configuration Management in an Object-Oriented Data Model,E Sciore,VLDB J.,1994
72173,journals/vldb/C94b,"Title, Foreword",,,1994
72178,journals/vldb/C94a,"Title, Foreword, Special Issue Editorial",,,1994
72183,conf/vldb/BerckenS96,Query Processing Techniques for Multiversion Access Methods,"J Bercken, B Seeger",VLDB,1996
72185,conf/vldb/CareyHMW96,PESTO : An Integrated Query/Browser for Object Databases,"M Carey, L Haas, V Maganty, J Williams",VLDB,1996
72189,journals/sigmod/CampbellEM03,XML schema,"C Campbell, A Eisenberg, J Melton",SIGMOD Record,2003
72191,journals/sigmod/AilamakiG03,Time management for new faculty,"A Ailamaki, J Gehrke",SIGMOD Record,2003
72196,journals/sigmod/Ozsu02b,Chair's Message,,,2002
72199,journals/sigmod/MeersmanS02,Guest Editor's Introduction,,,2002
72211,conf/vldb/BertinoBFS96,Supporting Periodic Authorizations and Temporal Reasoning in Database Access Control,"E Bertino, C Bettini, E Ferrari, P Samarati",VLDB,1996
72216,journals/sigmod/MaximilienS02,Conceptual Model of Web Service Reputation,"E Maximilien, M Singh",SIGMOD Record,2002
72220,conf/vldb/Dyreson96,Information Retrieval from an Incomplete Data Cube,C Dyreson,VLDB,1996
72222,conf/vldb/ShuklaDNR96,Storage Estimation for Multidimensional Aggregates in the Presence of Hierarchies,"A Shukla, P Deshpande, J Naughton, K Ramasamy",VLDB,1996
72223,journals/sigmod/Aberer03,Call for Book Reviews,,,2003
