tid,id,title,authors,venue,year
69623,journals/sigmod/Kosch02,MPEG-7 and Multimedia Database Systems,H Kosch,SIGMOD Record,2002
69629,journals/sigmod/CaplinskasEV02,Advances in Databases and Information Systems (ADBIS),"A Caplinskas, J Eder, O Vasilecas",SIGMOD Record,2002
69630,conf/vldb/SrikantA95,Mining Generalized Association Rules,"R Srikant, R Agrawal",VLDB,1995
69634,journals/sigmod/Kemper02,Databases and Transaction Processing: An Application-Oriented Approach - Book Review,A Kemper,SIGMOD Record,2002
69635,conf/vldb/HvasshovdTBH95,"The ClustRa Telecom Database: High Availability, High Throughput, and Real-Time Response","S Hvasshovd, Ř Torbjřrnsen, S Bratsberg, P Holager",VLDB,1995
69648,journals/sigmod/HalkidiBV02,Cluster Validity Methods: Part I,"M Halkidi, Y Batistakis, M Vazirgiannis",SIGMOD Record,2002
69657,journals/sigmod/LuoI02,Interviewing During a Tight Job Market,,,2002
69658,conf/vldb/Lindsay95,"DB2 Common Server: Technology, Progress, & Directions",B Lindsay,VLDB,1995
69667,conf/vldb/GoyalHSS95,Index Concurrency Control in Firm Real-Time Database Systems,"B Goyal, J Haritsa, S Seshadri, V Srinivasan",VLDB,1995
69671,journals/sigmod/BerzalM02,Data Mining: Concepts and Techniques - Book Review,"F Galiano, N Marín",SIGMOD Record,2002
69686,conf/vldb/BrownCC94,Fast Incremental Indexing for Full-Text Information Retrieval,"E Brown, J Callan, W Croft",VLDB,1994
69691,conf/vldb/FrohnLU94,Access to Objects by Path Expressions and Rules,"J Frohn, G Lausen, H Uphoff",VLDB,1994
69695,journals/sigmod/CrestaniG02,Report on the 24th European Colloquium on Information Retrieval Research,,,2002
69699,journals/sigmod/Winslett02b,Hector Garcia-Molina Speaks Out,M Winslett,,2002
69704,conf/vldb/BaralisW94,An Algebraic Approach to Rule Analysis in Expert Database Systems,"E Baralis, J Widom",VLDB,1994
69707,journals/sigmod/Badia02,Ontologies: A Silver Bullet for Knowledge Management and Electronic Commerce - Book Review,,,2002
69711,journals/sigmod/Winslett02c,Interview with David Maier,,,2002
69715,conf/vldb/Sarawagi95,Query Processing in Tertiary Memory Databases,S Sarawagi,VLDB,1995
69722,conf/vldb/SistlaYLL95,Similarity based Retrieval of Pictures Using Indices on Spatial Relationships,"A Sistla, C Yu, C Liu, K Liu",VLDB,1995
69740,journals/sigmod/HanBP01,Wrapping Web Data into XML,"W Han, D Buttler, C Pu",SIGMOD Record,2001
69777,journals/sigmod/LenzeriniNNS01,Report on the 8th International Workshop on Knowledge Representation Meets Databases (KRDB),,,2001
69781,conf/vldb/DeWittKLPY94,Client-Server Paradise,"D DeWitt, N Kabra, J Luo, J Patel, J Yu",VLDB,1994
69791,conf/vldb/CochinwalaB94,A Multidatabase System for Tracking and Retrieval of Financial Data,"M Cochinwala, J Bradley",VLDB,1994
69796,journals/sigmod/Snodgrass01a,Accessibility of the Database Literature,R Snodgrass,SIGMOD Record,2001
69803,conf/vldb/Bernstein94,PC Database Systems - Present and Future,P Bernstein,VLDB,1994
69805,journals/sigmod/StolfoLCFE01,Data Mining-based Intrusion Detectors: An Overview of the Columbia IDS Project,"S Stolfo, W Lee, P Chan, W Fan, E Eskin",SIGMOD Record,2001
69808,journals/sigmod/BarbaraCJW01,ADAM: A Testbed for Exploring the Use of Data Mining in Intrusion Detection,"D Barbará, J Couto, S Jajodia, N Wu",SIGMOD Record,2001
69813,conf/vldb/YanA94,Integrating a Structured-Text Retrieval System with an Object-Oriented Database System,"T Yan, J Annevelink",VLDB,1994
69820,conf/sigmod/FaginKS03,Efficient similarity search and classification via rank aggregation,"R Fagin, R Kumar, D Sivakumar",SIGMOD Conference,2003
69821,journals/sigmod/SayginVC01,Using Unknowns to Prevent Discovery of Association Rules,"Y Saygin, V Verykios, C Clifton",SIGMOD Record,2001
69834,conf/sigmod/MiloAABN03,Exchanging Intensional XML Data,"T Milo, S Abiteboul, B Amann, O Benjelloun, F Ngoc",SIGMOD Conference,2003
69835,conf/vldb/TsatalosSI94,The GMAP: A Versatile Tool for Physical Data Independence,"O Tsatalos, M Solomon, Y Ioannidis",VLDB,1994
69840,journals/sigmod/SommerGB02,The n-Tier Hub Technology,"R Sommer, T Gulledge, D Bailey",SIGMOD Record,2002
69848,journals/sigmod/Bussler02,The Role of B2B Engines in B2B Integration Architectures,C Bussler,SIGMOD Record,2002
69857,conf/vldb/PirotteZMY94,Materialization: A Powerful and Ubiquitous Abstraction Pattern,"A Pirotte, E Zimányi, D Massart, T Yakusheva",VLDB,1994
69865,conf/vldb/KamelF94,Hilbert R-tree: An Improved R-tree using Fractals,"I Kamel, C Faloutsos",VLDB,1994
69872,journals/sigmod/KempsterST99,Diluting ACID,"T Kempster, C Stirling, P Thanisch",SIGMOD Record,1999
69873,conf/sigmod/Al-KhalifaYJ03,Querying Structured Text in an XML Database,"S Al-Khalifa, C Yu, H Jagadish",SIGMOD Conference,2003
69887,conf/sigmod/AgrawalK03,A System for Watermarking Relational Databases,"R Agrawal, P Haas, J Kiernan",SIGMOD Conference,2003
69908,journals/sigmod/WestmannKHM00,The Implementation and Performance of Compressed Databases,"T Westmann, D Kossmann, S Helmer, G Moerkotte",SIGMOD Record,2000
69914,conf/sigmod/CranorJSS03,Gigascope: A Stream Database for Network Applications,"C Cranor, T Johnson, O Spatscheck, V Shkapenyuk",SIGMOD Conference,2003
69919,conf/sigmod/ReissK03,A Characterization of the Sensitivity of Query Optimization to Storage Access Cost Parameters,"F Reiss, T Kanungo",SIGMOD Conference,2003
69925,conf/sigmod/LiBKN03,Composing XSL Transformations with XML Publishing Views,"C Li, P Bohannon, H Korth, P Narayan",SIGMOD Conference,2003
69928,journals/sigmod/Mendelzon00,Information Director's Message,,,2000
69930,conf/sigmod/CuiOTS03,Contorting High Dimensional Data for Efficient Main Memory Processing,"B Cui, B Ooi, J Su, K Tan",SIGMOD Conference,2003
69945,conf/sigmod/PadmanabhanBMCH03,Multi-Dimensional Clustering: A New Data Layout Scheme in DB2,"S Padmanabhan, B Bhattacharjee, T Malkemus, L Cranston, M Huras",SIGMOD Conference,2003
69955,conf/sigmod/Krishnamurthy03,Oracle XML DB Repository,V Krishnamurthy,SIGMOD Conference,2003
69966,conf/sigmod/ChaudhuriGGM03,Robust and Efficient Fuzzy Match for Online Data Cleaning,"S Chaudhuri, K Ganjam, V Ganti, R Motwani",SIGMOD Conference,2003
69968,journals/sigmod/BernsteinHP00,A Vision of Management of Complex Models,"P Bernstein, A Halevy, R Pottinger",SIGMOD Record,2000
69973,journals/sigmod/BoscMP01,Report on The fourth International Conference on Flexible Query Answering systems,,,2001
69983,conf/sigmod/Dyreson03,"Temporal Coalescing with Now, Granularity, and Incomplete Information",C Dyreson,SIGMOD Conference,2003
69984,journals/sigmod/RossCGLLM01,Reminiscences on Influential Papers,,,2001
69985,journals/sigmod/Critchlow01,Report on XEWA-00: The XML Enabled Wide-Area Searches for Bioinformatics Workshop,,,2001
69989,conf/sigmod/KangN03,On Schema Matching with Opaque Column Names and Data Values,"J Kang, J Naughton",SIGMOD Conference,2003
69992,journals/sigmod/LawderK01,Querying Multi-dimensional Data Indexed Using the Hilbert Space-filling Curve,"J Lawder, P King",SIGMOD Record,2001
69996,conf/sigmod/LuoEHN02,A scalable hash ripple join algorithm,"G Luo, C Ellmann, P Haas, J Naughton",SIGMOD Conference,2002
69999,conf/sigmod/KaushikBNK02,Covering indexes for branching path queries,"R Kaushik, P Bohannon, J Naughton, H Korth",SIGMOD Conference,2002
70003,conf/sigmod/Grust02,Accelerating XPath location steps,T Grust,SIGMOD Conference,2002
70023,conf/sigmod/KornMZ03,IPSOFACTO: A Visual Correlation Tool for Aggregate Network Traffic Data,"F Korn, S Muthukrishnan, Y Zhu",SIGMOD Conference,2003
70030,conf/sigmod/ZhuSZ03,Query by Humming - in Action with its Technology Revealed,"Y Zhu, D Shasha, X Zhao",SIGMOD Conference,2003
70051,conf/sigmod/OoiTZGLLLNSWZ03,PeerDB: Peering into Personal Databases,"B Ooi, K Tan, A Zhou, C Goh, Y Li, C Liau, B Ling, W Ng, Y Shu, X Wang, M Zhang",SIGMOD Conference,2003
70053,conf/sigmod/LiuFP03,GridDB: A Database Interface to the Grid,"D Liu, M Franklin, D Parekh",SIGMOD Conference,2003
70057,conf/sigmod/LakshmananPZ03a,SOCQET: Semantic OLAP with Compressed Cube and Summarization,"L Lakshmanan, J Pei, Y Zhao",SIGMOD Conference,2003
70059,conf/sigmod/ShashaB02,"Database tuning: principles, experiments, and troubleshooting techniques (part II)","D Shasha, P Bonnet",SIGMOD Conference,2002
70060,journals/sigmod/SycaraKWL99,Dynamic Service Matchmaking Among Agents in Open Information Environments,"K Sycara, M Klusch, S Widoff, J Lu",SIGMOD Record,1999
70062,journals/sigmod/PapazoglouH99,Contextualizing the Information Space in Federated Digital Libraries,"M Papazoglou, J Hoppenbrouwers",SIGMOD Record,1999
70075,journals/sigmod/GruenwaldBDGSSV99,Database Research at the University of Oklahoma,"L Gruenwald, L Brown, R Dirckze, S Guinepain, C Sánchez, B Summers, S Vanichayobon",SIGMOD Record,1999
70083,conf/sigmod/KarbhariRXD02,ACDN: a content delivery network for applications,"P Karbhari, M Rabinovich, Z Xiao, F Douglis",SIGMOD Conference,2002
70092,journals/sigmod/CfP99,"The Active Database Central, ER2000, VLDB 2000, WISE 2000, Books, ACM DL",,SIGMOD Record,1999
70095,conf/sigmod/Weininger02,Efficient execution of joins in a star schema,A Weininger,SIGMOD Conference,2002
70103,journals/sigmod/RamDD99,Distributed Transactions in Practice,"P Ram, L Do, P Drew",SIGMOD Record,1999
70106,conf/sigmod/BhattacharyaMBNHS02,Coordinating backup/recovery and data consistency between database and file systems,"S Bhattacharya, C Mohan, K Brannon, I Narang, H Hsiao, M Subramanian",SIGMOD Conference,2002
70117,conf/sigmod/Ramanan02,Efficient algorithms for minimizing tree pattern queries,P Ramanan,SIGMOD Conference,2002
70119,conf/sigmod/VriesMNK02,Efficient k-NN search on vertically decomposed data,"A Vries, N Mamoulis, N Nes, M Kersten",SIGMOD Conference,2002
70129,conf/sigmod/ZhouR02,Implementing database operations using SIMD instructions,"J Zhou, K Ross",SIGMOD Conference,2002
70132,conf/sigmod/FreireHRRS02,StatiX: making XML count,"J Freire, J Haritsa, M Ramanath, P Roy, J Siméon",SIGMOD Conference,2002
70152,journals/sigmod/Seligman97,Industry Perspectives,L Seligman,SIGMOD Record,1997
70156,conf/sigmod/YangWYH02,Mining long sequential patterns in a noisy environment,"J Yang, W Wang, P Yu, J Han",SIGMOD Conference,2002
70161,conf/sigmod/JosifovskiSHL02,Garlic: a new flavor of federated query processing for DB2,"V Josifovski, P Schwarz, L Haas, E Lin",SIGMOD Conference,2002
70163,conf/sigmod/KanthRA02,Quadtree and R-tree indexes in oracle spatial: a comparison using GIS data,"K Kanth, S Ravada, D Abugov",SIGMOD Conference,2002
70166,conf/sigmod/SzalayGTKMRSv02,The SDSS skyserver: public access to the sloan digital sky server data,"A Szalay, J Gray, A Thakar, P Kunszt, T Malik, J Raddick, C Stoughton, J vandenBerg",SIGMOD Conference,2002
70172,journals/sigmod/Fong97,Converting Relational to Object-Oriented Databases,J Fong,SIGMOD Record,1997
70174,conf/sigmod/LuoKMPWLN02,Middle-tier database caching for e-business,"Q Luo, S Krishnamurthy, C Mohan, H Pirahesh, H Woo, B Lindsay, J Naughton",SIGMOD Conference,2002
70181,journals/sigmod/Konig-RiesL97,"Research in Databases and Data-Intensive Applications - Computer Science Department and FZI, University of Karlsruhe","B König-Ries, P Lockemann",SIGMOD Record,1997
70187,conf/sigmod/RundensteinerWYD02,XmdvTool: visual interactive data exploration and trend discovery of high-dimensional data sets,"E Rundensteiner, M Ward, J Yang, P Doshi",SIGMOD Conference,2002
70190,journals/sigmod/Snodgrass98b,Chair's Message,,,1998
70202,conf/sigmod/Cotton02,Implementing XQuery,P Cotton,SIGMOD Conference,2002
70207,conf/sigmod/ChaudhuriDN01,"A Robust, Optimization-Based Approach for Approximate Answering of Aggregate Queries","S Chaudhuri, G Das, V Narasayya",SIGMOD Conference,2001
70209,conf/sigmod/SlivinskasJS01,Adaptable Query Optimization and Evaluation in Temporal Middleware,"G Slivinskas, C Jensen, R Snodgrass",SIGMOD Conference,2001
70224,journals/sigmod/Seshadri98,Predator: A Resource for Database Research,P Seshadri,SIGMOD Record,1998
70225,journals/sigmod/Roussopoulos98,Materialized Views and Data Warehouses,N Roussopoulos,SIGMOD Record,1998
70232,journals/sigmod/Snodgrass98,Chair's Message,,,1998
70254,conf/sigmod/AfratiLU01,Generating Efficient Plans for Queries Using Views,"F Afrati, C Li, J Ullman",SIGMOD Conference,2001
70264,journals/sigmod/Dogac96,Middle East Technical University Software Research and Development Center,A Dogac,SIGMOD Record,1996
70265,conf/sigmod/ShahC01,"Fault-tolerant, Load-balancing Queries in Telegraph","M Shah, S Chandrasekaran",SIGMOD Conference,2001
70274,conf/sigmod/GoldsteinL01,"Optimizing Queries Using Materialized Views: A practical, scalable solution","J Goldstein, P Larson",SIGMOD Conference,2001
70276,conf/sigmod/ShouCTRH01,REVIEW: A Real Time Virtual Walkthrough System,"L Shou, J Chionh, K Tan, Y Ruan, Z Huang",SIGMOD Conference,2001
70279,conf/sigmod/MistryRSR01,Materialized View Selection and Maintenance Using Multi-Query Optimization,"H Mistry, P Roy, S Sudarshan, K Ramamritham",SIGMOD Conference,2001
70289,conf/sigmod/BertinoCF01,Securing XML Documents: the Author-X Project Demonstration,"E Bertino, S Castano, E Ferrari",SIGMOD Conference,2001
70298,journals/sigmod/TsotrasK96,Temporal Database Bibliography Update,"V Tsotras, A Kumar",SIGMOD Record,1996
70299,conf/sigmod/Galindo-LegariaJ01,Orthogonal Optimization of Subqueries and Aggregation,"C Galindo-Legaria, M Joshi",SIGMOD Conference,2001
70305,journals/sigmod/Wade96,Object Query Standards,A Wade,SIGMOD Record,1996
70309,journals/sigmod/Gaffney96,Illustra's Web DataBlade Module,J Gaffney,SIGMOD Record,1996
70317,journals/sigmod/TomasicS97,Improving Access to Environmental Data Using Context Information,"A Tomasic, E Simon",SIGMOD Record,1997
70325,conf/sigmod/ChenGM01,Improving Index Performance through Prefetching,"S Chen, P Gibbons, T Mowry",SIGMOD Conference,2001
70330,conf/sigmod/Sahuguet01,"\Kweelt: More than just \""\""yet another framework to query XML!\""\""\""""",A Sahuguet,SIGMOD Conference,2001
70364,conf/sigmod/AggarwalY00,Finding Generalized Projected Clusters In High Dimensional Spaces,"C Aggarwal, P Yu",SIGMOD Conference,2000
70367,conf/sigmod/Lomet00,High Speed On-line Backup When Using Logical Log Operations,D Lomet,SIGMOD Conference,2000
70368,journals/sigmod/ShethGJRSWW96,Report from the NSF Workshop on Workflow and Process Automation in Information Systems,,,1996
70381,conf/sigmod/OhHP00,Efficient and Cost-effective Techniques for Browsing and Indexing Large Video Databases,"J Oh, K Hua",SIGMOD Conference,2000
70386,conf/sigmod/SzalayGKT00,Designing and Mining Multi-Terabyte Astronomy Archives: The Sloan Digital Sky Survey,"A Szalay, P Kunszt, A Thakar, J Gray, D Slutz",SIGMOD Conference,2000
70389,journals/sigmod/Chaudhri95,An Annotated Bibliography of Benchmarks for Object Databases,A Chaudhri,SIGMOD Record,1995
70392,journals/sigmod/JaegerF95,An Annotated Bibliography on Active Databases,"U Jaeger, J Freytag",SIGMOD Record,1995
70400,journals/sigmod/KimballS95,Why Decision Support Fails and How To Fix It,"R Kimball, K Strehlo",SIGMOD Record,1995
70401,journals/sigmod/Zhang95,Application of OODB and SGML Techniques in Text Database: An Electronic Dictionary System,J Zhang,SIGMOD Record,1995
70407,journals/sigmod/GamacheS95,Addressing Techniques Used in Database Object Managers O2 and Orion,"A Gamache, N Sahraoui",SIGMOD Record,1995
70422,journals/sigmod/Bertram94,Data Modelling in the Large,M Bertram,SIGMOD Record,1994
70433,conf/sigmod/Weininger00,Handling Very Large Databases with Informix Extended Parallel Server,A Weininger,SIGMOD Conference,2000
70435,conf/sigmod/ChenDLT00,Fact: A Learning Based Web Query Processing System,"S Chen, Y Diao, H Lu, Z Tian",SIGMOD Conference,2000
70439,conf/sigmod/JarkeQCLFLVV00,Concept Based Design of Data Warehouses: The DWQ Demonstrators,"M Jarke, C Quix, D Calvanese, M Lenzerini, E Franconi, S Ligoudistianos, P Vassiliadis, Y Vassiliou",SIGMOD Conference,2000
70442,journals/sigmod/DarwenD95,The Third Manifesto,"H Darwen, C Date",SIGMOD Record,1995
70446,conf/sigmod/GoldmanW00,WSQ/DSQ: A Practical Approach for Combined Querying of Databases and the Web,"R Goldman, J Widom",SIGMOD Conference,2000
70447,journals/sigmod/EnglertGH95,Parallelism and its Price: A Case Study of NonStop SQL/MP,"S Englert, R Glasstone, W Hasan",SIGMOD Record,1995
70449,journals/sigmod/VenkatraoP95,SQL/CLI - A New Binding Style for SQL,"M Venkatrao, M Pizzo",SIGMOD Record,1995
70453,journals/sigmod/Bohlen95,Temporal Database System Implementations,M Böhlen,SIGMOD Record,1995
70455,journals/sigmod/WolfsonSDNR95,View Maintenance in Mobile Computing,"O Wolfson, A Sistla, S Dao, K Narayanan, R Raj",SIGMOD Record,1995
70457,conf/sigmod/SaltenisJLL00,Indexing the Positions of Continuously Moving Objects,"S Saltenis, C Jensen, S Leutenegger, M Lopez",SIGMOD Conference,2000
70463,journals/sigmod/DrewHKKLLLSW95,Data and Knowledge Base Research at Hong Kong University of Science and Technology,"P Drew, B Hamidzadeh, K Karlapalem, A Kean, D Lee, Q Li, F Lochovsky, C Shum, B Wüthrich",SIGMOD Record,1995
70464,conf/sigmod/BreunigKNS00,LOF: Identifying Density-Based Local Outliers,"M Breunig, H Kriegel, R Ng, J Sander",SIGMOD Conference,2000
70486,conf/sigmod/Gal00,"Data Management in eCommerce: The Good, the Bad, and the Ugly",,,2000
70488,journals/sigmod/RisheSBDOALOSS95,Florida International University High Performance Database Research Center,"N Rishe, W Sun, D Barton, Y Deng, C Orji, M Alexopoulos, L Loureiro, C 0002, M Sanchez, A Shaposhnikov",SIGMOD Record,1995
70496,conf/sigmod/JagadishKS00,On Effective Multi-Dimensional Indexing for Strings,"H Jagadish, N Koudas, D Srivastava",SIGMOD Conference,2000
70497,journals/sigmod/Widom95,Editor's Notes,J Widom,SIGMOD Record,1995
70499,conf/sigmod/ChenCPPSTM00,Internet Traffic Warehouse,"C Chen, M Cochinwala, C Petrone, M Pucci, S Samtani, P Santa, M Mesiti",SIGMOD Conference,2000
70507,journals/sigmod/Alonso94,Trade Press News,,,1994
70510,conf/sigmod/ReveszCKLLW00,The MLPQ/GIS Constraint Database System,"P Revesz, R Chen, P Kanjamala, Y Li, Y Liu, Y Wang",SIGMOD Conference,2000
70515,conf/sigmod/HsuLG00,Image Mining in IRIS: Integrated Retinal Information System,"W Hsu, M Lee, K Goh",SIGMOD Conference,2000
70524,journals/sigmod/DreyerDS94,Research Perspectives for Time Series Management Systems,"W Dreyer, A Dittrich, D Schmidt",SIGMOD Record,1994
70525,journals/sigmod/DiazJPa94,Supporting Dynamic Displays Using Active Rules,"O Díaz, A Jaime, N Paton, G al-Qaimari",SIGMOD Record,1994
70532,journals/sigmod/SnodgrassAABCDEGJKKKLLRSSS94,TSQL2 Language Specification,"R Snodgrass, I Ahn, G Ariav, D Batory, J Clifford, C Dyreson, R Elmasri, F Grandi, C Jensen, W Käfer, N Kline, K Kulkarni, T Leung, N Lorentzos, J Roddick, A Segev, M Soo, S Sripada",SIGMOD Record,1994
70554,conf/sigmod/KotidisR99,DynaMat: A Dynamic View Management System for Data Warehouses,"Y Kotidis, N Roussopoulos",SIGMOD Conference,1999
70557,conf/sigmod/VitterW99,Approximate Computation of Multidimensional Aggregates of Sparse Data Using Wavelets,"J Vitter, M Wang",SIGMOD Conference,1999
70562,journals/tods/Jimenez-PerisPAK03,Are quorums an alternative for data replication?,"R Jiménez-Peris, M Patińo-Martínez, G Alonso, B Kemme",ACM Trans. Database Syst.,2003
70571,journals/sigmod/Segev94a,Editor's Notes,A Segev,SIGMOD Record,1994
70576,journals/sigmod/Qian94a,"Announcements from NSF, NASA, and Elsewhere",X Qian,SIGMOD Record,1994
70577,journals/sigmod/X94b,Calls for Papers / Announcements,,SIGMOD Record,1994
70580,conf/sigmod/WolfsonSXZC99,DOMINO: Databases fOr MovINg Objects tracking,"O Wolfson, A Sistla, B Xu, J Zhou, S Chamberlain",SIGMOD Conference,1999
70584,conf/sigmod/LiuHBPT99,An XML-based Wrapper Generator for Web Information Extraction,"L Liu, W Han, D Buttler, C Pu, W Tang",SIGMOD Conference,1999
70592,conf/sigmod/BaulierBGGHJKKMMNNRSSSWW99,DataBlitz Storage Manager: Main Memory Database Performance for Critical Applications,"J Baulier, P Bohannon, S Gogate, C Gupta, S Haldar, S Joshi, A Khivesera, H Korth, P McIlroy, J Miller, P Narayan, M Nemeth, R Rastogi, S Seshadri, A Silberschatz, S Sudarshan, M Wilder, C Wei",SIGMOD Conference,1999
70609,conf/sigmod/ChaudhuriMN99,On Random Sampling over Joins,"S Chaudhuri, R Motwani, V Narasayya",SIGMOD Conference,1999
70611,conf/sigmod/MankuRL99,Random Sampling Techniques for Space Efficient Online Computation of Order Statistics of Large Datasets,"G Manku, S Rajagopalan, B Lindsay",SIGMOD Conference,1999
70615,conf/sigmod/LeeKC99,Multi-dimensional Selectivity Estimation Using Compressed Histogram Information,"J Lee, D Kim, C Chung",SIGMOD Conference,1999
70618,journals/sigmod/BunemanLSTW94,Comprehension Syntax,"P Buneman, L Libkin, D Suciu, V Tannen, L Wong",SIGMOD Record,1994
70624,conf/sigmod/JagadishLMSV99,Querying Network Directories,"H Jagadish, L Lakshmanan, T Milo, D Srivastava, D Vista",SIGMOD Conference,1999
70635,conf/sigmod/Team99,In-Memory Data Management for Consumer Transactions The Times-Ten Approach,T Team,SIGMOD Conference,1999
70637,conf/vldb/CasatiDGS01,"Improving Business Process Quality through Exception Understanding, Prediction, and Prevention","D Grigori, F Casati, U Dayal, M Shan",VLDB,2001
70645,conf/vldb/GilbertKMS01,Surfing Wavelets on Streams: One-Pass Summaries for Approximate Aggregate Queries,"A Gilbert, Y Kotidis, S Muthukrishnan, M Strauss",VLDB,2001
70654,conf/sigmod/RundensteinerCLCZNJLW99,SERF: ODMG-Based Generic Re-structuring Facility,"E Rundensteiner, K Claypool, M Li, L Chen, X Zhang, C Natarajan, J Jin, S Lima, S Weiner",SIGMOD Conference,1999
70656,conf/vldb/LiM01,Indexing and Querying XML Data for Regular Path Expressions,"Q Li, B Moon",VLDB,2001
70665,conf/vldb/NatsevCSLV01,Supporting Incremental Join Queries on Ranked Inputs,"A Natsev, Y Chang, J Smith, C Li, J Vitter",VLDB,2001
70673,conf/vldb/NishioSTTL01,Functional Properties of Information Filtering,"R Sawai, M Tsukamoto, Y Loh, T Terada, S Nishio",VLDB,2001
70677,conf/vldb/Adler01,DB2 Spatial Extender - Spatial data within the RDBMS,D Adler,VLDB,2001
70679,conf/vldb/ZengBNN01,AgFlow: Agent-based Cross-Enterprise Workflow Management System,"L Zeng, B Benatallah, P Nguyen, A Ngu",VLDB,2001
70686,conf/sigmod/GarofalakisRRS99,"Of Crawlers, Portals, Mice and Men: Is there more to Mining the Web? (Panel)","M Garofalakis, S Ramaswamy, R Rastogi, K Shim",SIGMOD Conference,1999
70694,conf/vldb/PatonG01,Information Management for Genome Level Bioinformatics,,,2001
70697,conf/sigmod/KanthRSB99,Indexing Medium-dimensionality Data in Oracle,"K Kanth, S Ravada, J Sharma, J Banerjee",SIGMOD Conference,1999
70699,conf/vldb/MignetMAC01,Change-Centric Management of Versions in an XML Warehouse,"A Marian, S Abiteboul, G Cobena, L Mignet",VLDB,2001
70703,conf/vldb/YangG01,Comparing Hybrid Peer-to-Peer Systems,"B Yang, H Garcia-Molina",VLDB,2001
70711,conf/sigmod/RajagopalanML98,Approximate Medians and other Quantiles in One Pass and with Limited Memory,"G Manku, S Rajagopalan, B Lindsay",SIGMOD Conference,1998
70714,conf/vldb/UrhanF01,Dynamic Pipeline Scheduling for Improving Interactive Query Performance,"T Urhan, M Franklin",VLDB,2001
70718,conf/vldb/LahiriSCMC01,Cache Fusion: Extending Shared-Disk Clusters with Shared Caches,"T Lahiri, V Srihari, W Chan, N MacNaughton, S Chandrasekaran",VLDB,2001
70730,conf/vldb/TsurAADKW01,Are Web Services the Next Revolution in e-Commerce? (Panel),"S Tsur, S Abiteboul, R Agrawal, U Dayal, J Klein, G Weikum",VLDB,2001
70743,conf/vldb/ChaHKK01,Cache-Conscious Concurrency Control of Main-Memory Indexes on Shared-Memory Multiprocessor Systems,"S Cha, S Hwang, K Kim, K Kwon",VLDB,2001
70744,conf/sigmod/GuhaRS98,CURE: An Efficient Clustering Algorithm for Large Databases,"S Guha, R Rastogi, K Shim",SIGMOD Conference,1998
70745,conf/vldb/HuntAI01,A Database Index to Large Biological Sequences,"E Hunt, M Atkinson, R Irving",VLDB,2001
70753,conf/vldb/GalhardasFSSS01,"Declarative Data Cleaning: Language, Model, and Algorithms","H Galhardas, D Florescu, D Shasha, E Simon, C Saita",VLDB,2001
70764,conf/sigmod/GrumbachRS98,The DEDALE System for Complex Spatial Queries,"S Grumbach, P Rigaux, L Segoufin",SIGMOD Conference,1998
70773,conf/sigmod/CluetDSS98,Your Mediators Need Data Conversion!,"S Cluet, C Delobel, J Siméon, K Smaga",SIGMOD Conference,1998
70777,conf/vldb/DuttaDMRT00,Demonstration: Enabling Scalable Online Personalization on the Web,"K Dutta, A Datta, D VanderMeer, K Ramamritham, H Thomas",VLDB,2000
70788,conf/vldb/MohanBWSZ00,Evolution of Groupware for Business Applications: A Database Perspective on Lotus Domino/Notes,"C Mohan, R Barber, S Watts, A Somani, M Zaharioudakis",VLDB,2000
70799,conf/vldb/ShanmugasundaramSBCLPR00,Efficiently Publishing Relational Data as XML Documents,"J Shanmugasundaram, E Shekita, R Barr, M Carey, B Lindsay, H Pirahesh, B Reinwald",VLDB,2000
70804,conf/sigmod/LiS98,Free Parallel Data Mining,"B Li, D Shasha",SIGMOD Conference,1998
70806,conf/sigmod/Brewer98,Delivering High Availability for Inktomi Search Engines,E Brewer,SIGMOD Conference,1998
70809,conf/sigmod/LiuPTBBZBHY98,CQ: A Personalized Update Monitoring Toolkit,"L Liu, C Pu, W Tang, D Buttler, J Biggs, T Zhou, P Benninghoff, W Han, F Yu",SIGMOD Conference,1998
70815,conf/vldb/WuFSP00,FALCON: Feedback Adaptive Loop for Content-Based Retrieval,"L Wu, C Faloutsos, K Sycara, T Payne",VLDB,2000
70818,conf/vldb/LingLL00,Hierarchical Compact Cube for Range-Max Queries,"S Lee, T Ling, H Li",VLDB,2000
70819,conf/vldb/YiF00,Fast Time Sequence Indexing for Arbitrary Lp Norms,"B Yi, C Faloutsos",VLDB,2000
70836,conf/sigmod/Cohen98a,Providing Database-like Access to the Web Using Queries Based on Textual Similarity,W Cohen,SIGMOD Conference,1998
