tid,id,title,authors,venue,year
70858,conf/sigmod/BerchtoldBBKK97,Fast Parallel Similarity Search in Multimedia Databases,"S Berchtold, C Böhm, B Braunmüller, D Keim, H Kriegel",SIGMOD Conference,1997
70869,conf/sigmod/KemperKM98,SAP R/3: A Database Application System (Tutorial),,,1998
70873,conf/sigmod/AndersonBKW98,"Replication, Consistency, and Practicality: Are These Mutually Exclusive?","T Anderson, Y Breitbart, H Korth, A Wool",SIGMOD Conference,1998
70876,conf/vldb/Duranti01,The Long-Term Preservation of Authentic Electronic Records,L Duranti,VLDB,2001
70877,conf/vldb/OzdenGHNSDGGW01,Storage Service Providers: a Solution for Storage Management? (Panel),"B Özden, E Gabber, B Hillyer, W Ng, E Shriver, D DeWitt, B Gordon, J Gray, J Wilkes",VLDB,2001
70878,conf/sigmod/Kennamer98,Microsoft.com: A High-Scale Data Management and Transaction Processing Solution,S Kennamer,SIGMOD Conference,1998
70884,conf/sigmod/AndersonAF98,Oracle Rdb's Record Caching Model,"R Anderson, G Arun, R Frank",SIGMOD Conference,1998
70887,conf/sigmod/Chan98,Transactional Publish / Subscribe: The Proactive Multicast of Database Changes,A Chan,SIGMOD Conference,1998
70890,conf/sigmod/RamakrishnanD98,The PointCast Network,"S Ramakrishnan, V Dayal",SIGMOD Conference,1998
70894,conf/sigmod/HellersteinHW97,Online Aggregation,"J Hellerstein, P Haas, H Wang",SIGMOD Conference,1997
70897,conf/vldb/Carey00,"Toto, We're Not in Kansas Anymore: On Transitioning from Research to the Real (Invited Industrial Talk)",M Carey,VLDB,2000
70899,conf/sigmod/HanKK97,Scalable Parallel Data Mining for Association Rules,"E Han, G Karypis, V Kumar",SIGMOD Conference,1997
70923,conf/vldb/PereiraFLS00,Publish/Subscribe on the Web at Extreme Speed,"J Pereira, F Fabret, F Llirbat, R Preotiuc-Pietro, K Ross, D Shasha",VLDB,2000
70925,conf/sigmod/JajodiaSSB97,A Unified Framework for Enforcing Multiple Access Control Policies,"S Jajodia, P Samarati, V Subrahmanian, E Bertino",SIGMOD Conference,1997
70926,conf/vldb/ShahabiFKF00,INSITE: A Tool for Interpreting Users? Interaction with a Web Space,"C Shahabi, A Faisal, F Kashani, J Faruque",VLDB,2000
70927,conf/vldb/LudasaherGM00,Model-Based Information Integration in a Neuroscience Mediator System,"B Ludäscher, A Gupta, M Martone",VLDB,2000
70932,conf/sigmod/LivnyRBCDLMW97a,DEVise: Integrated Querying and Visual Exploration of Large Datasets (Demo Abstract),"M Livny, R Ramakrishnan, K Beyer, G Chen, D Donjerkovic, S Lawande, J Myllymaki, R Wenger",SIGMOD Conference,1997
70937,conf/sigmod/ChawatheG97,Meaningful Change Detection in Structured Data,"S Chawathe, H Garcia-Molina",SIGMOD Conference,1997
70955,conf/vldb/JiangSLB00,The BT-tree: A Branched and Temporal Access Method,"L Jiang, B Salzberg, D Lomet, M García",VLDB,2000
70959,conf/vldb/GuntzerBK00,Optimizing Multi-Feature Queries for Image Databases,"U Güntzer, W Balke, W Kießling",VLDB,2000
70961,conf/vldb/KriegelPS00,Managing Intervals Efficiently in Object-Relational Databases,"H Kriegel, M Pötke, T Seidl",VLDB,2000
70965,conf/sigmod/OzdenRSS96,Fault-tolerant Architectures for Continuous Media Servers,"B Özden, R Rastogi, P Shenoy, A Silberschatz",SIGMOD Conference,1996
70974,conf/sigmod/BohrerBBCFHKKMNRRSUUW97a,The InfoSleuth Project,"R Jr., W Bohrer, R Brice, A Cichocki, J Fowler, A Helal, V Kashyap, T Ksiezyk, G Martin, M Nodine, M Rashid, M Rusinkiewicz, R Shea, C Unnikrishnan, A Unruh, D Woelk",SIGMOD Conference,1997
70976,conf/sigmod/GeneserethKD97,Infomaster: An Information Integration System,"M Genesereth, A Keller, O Duschka",SIGMOD Conference,1997
70984,conf/sigmod/LabioZWGGW97,The WHIPS Prototype for Data Warehouse Creation and Maintenance,"W Labio, Y Zhuge, J Wiener, H Gupta, H Garcia-Molina, J Widom",SIGMOD Conference,1997
70985,conf/vldb/MendelzonV00,Temporal Queries in OLAP,"A Mendelzon, A Vaisman",VLDB,2000
70999,conf/vldb/MillerHH00,Schema Mapping as Query Discovery,"R Miller, L Haas, M Hernández",VLDB,2000
71004,conf/vldb/LakshmananJN00,The 3W Model and Algebra for Unified Data Mining,"T Johnson, L Lakshmanan, R Ng",VLDB,2000
71009,conf/sigmod/ShivakumarG97,Wave-Indices: Indexing Evolving Databases,"N Shivakumar, H Garcia-Molina",SIGMOD Conference,1997
71010,conf/vldb/ChristopheBPV00,PicoDMBS: Scaling Down Database Techniques for the Smartcard,"C Bobineau, L Bouganim, P Pucheral, P Valduriez",VLDB,2000
71020,conf/sigmod/GrayHOS96,The Dangers of Replication and a Solution,"J Gray, P Helland, P O'Neil, D Shasha",SIGMOD Conference,1996
71022,conf/vldb/DeutschPT99,"Physical Data Independence, Constraints, and Optimization with Universal Plans","A Deutsch, L Popa, V Tannen",VLDB,1999
71023,conf/vldb/JaedickeM99,User-Defined Table Operators: Enhancing Extensibility for ORDBMS,"M Jaedicke, B Mitschang",VLDB,1999
71024,conf/sigmod/HillyerS96,Random I/O Scheduling in Online Tertiary Storage Systems,"B Hillyer, A Silberschatz",SIGMOD Conference,1996
71029,conf/vldb/KeimH99,Optimal Grid-Clustering: Towards Breaking the Curse of Dimensionality in High-Dimensional Clustering,"A Hinneburg, D Keim",VLDB,1999
71038,conf/sigmod/SelfridgeSW96,IDEA: Interactive Data Exploration and Analysis,"P Selfridge, D Srivastava, L Wilson",SIGMOD Conference,1996
71046,conf/sigmod/HungYK96,CapBasED-AMS: A Capability-based and Event-driven Activity Management System,"P Hung, H Yeung, K Karlapalem",SIGMOD Conference,1996
71048,conf/sigmod/FukudaMMT96,"Data Mining Using Two-Dimensional Optimized Accociation Rules: Scheme, Algorithms, and Visualization","T Fukuda, Y Morimoto, S Morishita, T Tokuyama",SIGMOD Conference,1996
71056,conf/vldb/Pound99,In Cyber Space No One can Hear You Scream,C Pound,VLDB,1999
71073,conf/vldb/TanGO99,Online Feedback for Nested Aggregate Queries with Multi-Threading,"K Tan, C Goh, B Ooi",VLDB,1999
71076,conf/sigmod/LibkinMW96,"A Query Language for Multidimensional Arrays: Design, Implementation, and Optimization Techniques","L Libkin, R Machlin, L Wong",SIGMOD Conference,1996
71082,conf/sigmod/KrishnanVI96,Estimating Alphanumeric Selectivity in the Presence of Wildcards,"P Krishnan, J Vitter, B Iyer",SIGMOD Conference,1996
71083,conf/sigmod/ShatdalN95,Adaptive Parallel Aggregation Algorithms,"A Shatdal, J Naughton",SIGMOD Conference,1995
71088,conf/sigmod/AdyaGLM95,Efficient Optimistic Concurrency Control Using Loosely Synchronized Clocks,"A Adya, R Gruber, B Liskov, U Maheshwari",SIGMOD Conference,1995
71089,conf/vldb/CeriFP99,"Data-Driven, One-To-One Web Site Generation for Data-Intensive Applications","S Ceri, P Fraternali, S Paraboschi",VLDB,1999
71090,conf/sigmod/BerensonBGMOO95,A Critique of ANSI SQL Isolation Levels,"H Berenson, P Bernstein, J Gray, J Melton, E O'Neil, P O'Neil",SIGMOD Conference,1995
71102,conf/vldb/ChaudhuriG99,Evaluating Top-k Selection Queries,"S Chaudhuri, L Gravano",VLDB,1999
71106,conf/vldb/WangZL99,Building Hierarchical Classifiers Using Class Proximity,"K Wang, S Zhou, S Liew",VLDB,1999
71109,conf/sigmod/Bernstein96,Repository System Engineering,,,1996
71115,conf/sigmod/RossSS96,Materialized View Maintenance and Integrity Constraint Checking: Trading Space for Time,"K Ross, D Srivastava, S Sudarshan",SIGMOD Conference,1996
71120,conf/vldb/TamuraK99,Dynamic Load Balancing for Parallel Association Rule Mining on Heterogenous PC Cluster Systems,"M Tamura, M Kitsuregawa",VLDB,1999
71125,conf/sigmod/McAuliffeCS96,Towards Effective and Efficient Free Space Management,"M McAuliffe, M Carey, M Solomon",SIGMOD Conference,1996
71131,conf/sigmod/LiskovACDGGMMS96,Safe and Efficient Sharing of Persistent Objects in Thor,"B Liskov, A Adya, M Castro, M Day, S Ghemawat, R Gruber, U Maheshwari, A Myers, L Shrira",SIGMOD Conference,1996
71139,conf/sigmod/LoR96,Spatial Hash-Joins,"M Lo, C Ravishankar",SIGMOD Conference,1996
71149,conf/vldb/RezendeS98,Bridging Heterogeneity: Research and Practice of Database Middleware Technology,"F Rezende, G Sauter",VLDB,1998
71152,conf/sigmod/ParkCY95,An Effective Hash Based Algorithm for Mining Association Rules,"J Park, M Chen, P Yu",SIGMOD Conference,1995
71154,conf/sigmod/FaloutsosL95,"FastMap: A Fast Algorithm for Indexing, Data-Mining and Visualization of Traditional and Multimedia Datasets","C Faloutsos, K Lin",SIGMOD Conference,1995
71165,conf/vldb/JohnsonM98,Performance Measurements of Tertiary Storage Devices,"T Johnson, E Miller",VLDB,1998
71166,conf/sigmod/AbiteboulCM95,A Database Interface for File Updates,"S Abiteboul, S Cluet, T Milo",SIGMOD Conference,1995
71172,conf/vldb/Shaw98,Technology and the Future of Commerce and Finance (Abstract),D Shaw,VLDB,1998
71181,conf/sigmod/BaruFGHJPW95,An Overview of DB2 Parallel Edition,"C Baru, G Fecteau, A Goyal, H Hsiao, A Jhingran, S Padmanabhan, W Wilson",SIGMOD Conference,1995
71182,conf/vldb/WeberSB98,A Quantitative Analysis and Performance Study for Similarity-Search Methods in High-Dimensional Spaces,"R Weber, H Schek, S Blott",VLDB,1998
71187,conf/sigmod/MoleskyR95,Recovery Protocols for Shared Memory Database Systems,"L Molesky, K Ramamritham",SIGMOD Conference,1995
71188,conf/vldb/GingrasL98,nD-SQL: A Multi-Dimensional Language for Interoperability and OLAP,"F Gingras, L Lakshmanan",VLDB,1998
71189,conf/sigmod/BrodskyK95,The LyriC Language: Querying Constraint Objects,"A Brodsky, Y Kornatzky",SIGMOD Conference,1995
71193,conf/vldb/MiloZ98,Using Schema Matching to Simplify Heterogeneous Data Translation,"T Milo, S Zohar",VLDB,1998
71195,conf/sigmod/RoussopoulosKV95,Nearest Neighbor Queries,"N Roussopoulos, S Kelley, F Vincent",SIGMOD Conference,1995
71202,conf/vldb/EsterKSWX98,Incremental Clustering for Mining in a Data Warehousing Environment,"M Ester, H Kriegel, J Sander, M Wimmer, X Xu",VLDB,1998
71207,conf/vldb/AnkerstBKS98,Improving Adaptable Similarity Query Processing by Using Approximations,"M Ankerst, B Braunmüller, H Kriegel, T Seidl",VLDB,1998
71214,conf/sigmod/WhiteD95,Implementing Crash Recovery in QuickStore: A Performance Study,"S White, D DeWitt",SIGMOD Conference,1995
71219,conf/vldb/HoskingC99,"PM3: An Orthogonal Persistent Systems Programming Language - Design, Implementation, Performance","A Hosking, J Chen",VLDB,1999
71222,conf/sigmod/BhargavaGI95,Hypergraph Based Reorderings of Outer Join Queries with Complex Predicates,"G Bhargava, P Goel, B Iyer",SIGMOD Conference,1995
71224,conf/vldb/ChengGKLLQS99,Implementation of Two Semantic Query Optimization Techniques in DB2 Universal Database,"Q Cheng, J Gryz, F Koo, T Leung, L Liu, X Qian, K Schiefer",VLDB,1999
71227,conf/sigmod/ChaudhuriDY95,Join Queries with External Text Sources: Execution and Optimization Techniques,"S Chaudhuri, U Dayal, T Yan",SIGMOD Conference,1995
71233,conf/sigmod/Team95,"Object-Oriented, Rapid Application Development in a PC Database Environment",F Team,SIGMOD Conference,1995
71241,conf/vldb/BouganimCDDGS99,Miro Web: Integrating Multiple Data Sources through Semistructured Data Types,"L Bouganim, T Chan-Sine-Ying, T Dang-Ngoc, J Darroux, G Gardarin, F Sha",VLDB,1999
71256,conf/sigmod/Perna95,Leveraging The Information Asset,J Perna,SIGMOD Conference,1995
71271,conf/sigmod/Norrie95,Integration Approaches for CIM,,,1995
71281,conf/vldb/RossS97,Fast Computation of Sparse Datacubes,"K Ross, D Srivastava",VLDB,1997
71288,conf/vldb/VassalosP97,Describing and Using Query Capabilities of Heterogeneous Sources,"V Vassalos, Y Papakonstantinou",VLDB,1997
71305,conf/vldb/AshwinRSSS97,Garbage Collection in Object Oriented Databases Using Transactional Cyclic Reference Counting,"S Ashwin, P Roy, S Seshadri, A Silberschatz, S Sudarshan",VLDB,1997
71314,conf/vldb/GoldmanW97,DataGuides: Enabling Query Formulation and Optimization in Semistructured Databases,"R Goldman, J Widom",VLDB,1997
71318,conf/vldb/WhiteheadSM97,GTE SuperPages: Using IR Techniques for Searching Complex Objects,"S Whitehead, H Sinha, M Murphy",VLDB,1997
71348,conf/vldb/Moerkotte98,Small Materialized Aggregates: A Light Weight Index Structure for Data Warehousing,G Moerkotte,VLDB,1998
71353,conf/sigmod/Martin94,COSS: The Common Object Services Specifications,B Martin,SIGMOD Conference,1994
71357,conf/sigmod/MumickP94,Implementation of Magic-sets in a Relational Database System,"I Mumick, H Pirahesh",SIGMOD Conference,1994
71366,conf/vldb/Slutz98,Massive Stochastic Testing of SQL,D Slutz,VLDB,1998
71367,conf/vldb/DoDJJR98,Issues in Developing Very Large Data Warehouses,"L Do, P Drew, W Jin, V Jumani, D Rossum",VLDB,1998
71369,conf/sigmod/Ahn94,Database Issues in Telecommunications Network Management,I Ahn,SIGMOD Conference,1994
71371,conf/vldb/Sterling98,The National Medical Knowledge Bank,W Sterling,VLDB,1998
71376,conf/sigmod/TomasicGS94,Incremental Updates of Inverted Lists for Text Document Retrieval,"A Tomasic, H Garcia-Molina, K Shoens",SIGMOD Conference,1994
71377,conf/vldb/ArunJ98,KODA - The Architecture And Interface of a Data Model Independent Kernel,"G Arun, A Joshi",VLDB,1998
71390,conf/sigmod/WhiteD94,QuickStore: A High Performance Mapped Object Store,"S White, D DeWitt",SIGMOD Conference,1994
71397,conf/sigmod/KemperMPS94,Optimizing Disjunctive Queries with Expensive Predicates,"A Kemper, G Moerkotte, K Peithner, M Steinbrunn",SIGMOD Conference,1994
71406,conf/sigmod/Fernandez94,Red Brick Warehouse: A Read-Mostly RDBMS for Open SMP Platforms,P Fernandez,SIGMOD Conference,1994
71410,conf/vldb/GardarinST96,"Calibrating the Query Optimizer Cost Model of IRO-DB, an Object-Oriented Federated Database System","G Gardarin, F Sha, Z Tang",VLDB,1996
71418,conf/vldb/ViverosNR96,Applying Data Mining Techniques to a Health Insurance Information System,"M Viveros, J Nearhos, M Rothman",VLDB,1996
71431,conf/vldb/SevcikK96,Filter Trees for Managing Spatial Data over a Range of Size Granularities,"K Sevcik, N Koudas",VLDB,1996
71447,journals/sigmod/Snodgrass03c,Developments at ACM TODS,R Snodgrass,SIGMOD Record,2003
71448,conf/vldb/Gupta96,The Changing Landscape of the Software Industry and its Implications for India,U Gupta,VLDB,1996
71449,conf/vldb/Hess96,Very Large Databases in a Commercial Application Environment,K Hess,VLDB,1996
71451,conf/sigmod/TheodoulidisAACKS94,The ORES Temporal Database Management System,"B Theodoulidis, A Ait-Braham, G Andrianopoulos, J Chaudhary, G Karvelis, S Sou",SIGMOD Conference,1994
71455,conf/vldb/Moni96,DISNIC-PLAN: A NICNET Based Distributed Database for Micro-level Planning in India,M Moni,VLDB,1996
71461,conf/vldb/Padmanabhan96,Extracting Large Data Sets using DB2 Parallel Edition,S Padmanabhan,VLDB,1996
71471,journals/sigmod/CalvaneseGLV03,Reasoning on regular path queries,"D Calvanese, G Giacomo, M Lenzerini, M Vardi",SIGMOD Record,2003
71482,conf/vldb/GravanoG97,Merging Ranks from Heterogeneous Internet Sources,"L Gravano, H Garcia-Molina",VLDB,1997
71483,journals/sigmod/KannanKIK03,Energy and rate based MAC protocol for wireless sensor networks,"R Kannan, R Kalidindi, S Iyengar, V Kumar",SIGMOD Record,2003
71487,conf/vldb/BohannonLRSSS97,Logical and Physical Versioning in Main Memory Databases,"R Rastogi, S Seshadri, P Bohannon, D Leinbaugh, A Silberschatz, S Sudarshan",VLDB,1997
71499,journals/sigmod/PitouraAPSV03,DBGlobe: a service-oriented P2P system for global computing,"E Pitoura, S Abiteboul, D Pfoser, G Samaras, M Vazirgiannis",SIGMOD Record,2003
71501,conf/vldb/LiCHH97,Facilitating Multimedia Database Exploration through Visual Interfaces and Perpetual Query Reformulations,"W Li, K Candan, K Hirata, Y Hara",VLDB,1997
71504,conf/vldb/BridgeJKLLM97,The Oracle Universal Server Buffer,"W Bridge, A Joshi, M Keihl, T Lahiri, J Loaiza, N MacNaughton",VLDB,1997
71521,journals/sigmod/MotroA03,Report on FQAS 2002: fifth international conference on flexible query answering systems,,,2003
71522,conf/vldb/CiacciaPZ97,M-tree: An Efficient Access Method for Similarity Search in Metric Spaces,"P Ciaccia, M Patella, P Zezula",VLDB,1997
71523,conf/vldb/HaasKWY97,Optimizing Queries Across Diverse Data Sources,"L Haas, D Kossmann, E Wimmers, J Yang",VLDB,1997
71532,journals/sigmod/Liu03a,Editor's Notes,L Liu,SIGMOD Record,2003
71542,conf/vldb/KornackerB95,High-Concurrency Locking in R-Trees,"M Kornacker, D Banks",VLDB,1995
71543,conf/vldb/YanG95,Duplicate Removal in Information System Dissemination,"T Yan, H Garcia-Molina",VLDB,1995
71547,journals/sigmod/Ouksel03,In-context peer-to-peer information filtering on the Web,A Ouksel,SIGMOD Record,2003
71556,journals/sigmod/Hellerstein03,Toward network data independence,J Hellerstein,SIGMOD Record,2003
71581,conf/vldb/SteinbrunnPMK95,Bypassing Joins in Disjunctive Queries,"M Steinbrunn, K Peithner, G Moerkotte, A Kemper",VLDB,1995
71583,journals/sigmod/GottlobKP03a,XPath processing in a nutshell,,,2003
71588,conf/vldb/GuptaHQ95,Aggregate-Query Processing in Data Warehousing Environments,"A Gupta, V Harinarayan, D Quass",VLDB,1995
71593,conf/vldb/BelussiF95,Estimating the Selectivity of Spatial Queries Using the `Correlation' Fractal Dimension,"A Belussi, C Faloutsos",VLDB,1995
71622,conf/vldb/ChaudhuriGN03,Primitives for Workload Summarization and Implications for SQL,"S Chaudhuri, P Ganesan, V Narasayya",VLDB,2003
71624,conf/vldb/HelmerNM03,Estimating the Output Cardinality of Partial Preaggregation with a Measure of Clusteredness,"S Helmer, T Neumann, G Moerkotte",VLDB,2003
71643,conf/vldb/TorloneA03,Chameleon: an Extensible and Customizable Tool for Web Data Translation,"R Torlone, P Atzeni",VLDB,2003
71644,conf/vldb/WeberSNSS03,WebService Composition with O'GRAPE and OSIRIS,"R Weber, C Schuler, P Neukomm, H Schuldt, H Schek",VLDB,2003
71657,conf/vldb/Leymann03,Grid and Applications (Industrial Session),F Leymann,VLDB,2003
71689,conf/vldb/Koch03,Efficient Processing of Expressive Node-Selecting Queries on XML Data in Secondary Storage: A Tree Automata-based Approach,C Koch,VLDB,2003
71698,conf/vldb/Ramanan03,Covering Indexes for XML Queries: Bisimulation - Simulation = Negation,P Ramanan,VLDB,2003
71724,conf/vldb/GolabO03,Processing Sliding Window Multi-Joins in Continuous Queries over Data Streams,"L Golab, M Özsu",VLDB,2003
71726,conf/vldb/XinHLW03,Star-Cubing: Computing Iceberg Cubes by Top-Down and Bottom-Up Integration,"D Xin, J Han, X Li, B Wah",VLDB,2003
71730,conf/vldb/GrustKT03,Staircase Join: Teach a Relational DBMS to Watch its (Axis) Steps,"T Grust, M Keulen, J Teubner",VLDB,2003
71734,conf/vldb/KangC02,Exploiting Versions for On-line Data Warehouse Maintenance in MOLAP Servers,"H Kang, C Chung",VLDB,2002
71741,conf/vldb/ChanFFGR02,Tree Pattern Aggregation for Scalable XML Data Dissemination,"C Chan, W Fan, P Felber, M Garofalakis, R Rastogi",VLDB,2002
71747,conf/vldb/ZellerK02,Experience Report: Exploiting Advanced Database Optimization Features for Large-Scale SAP R/3 Installations,"B Zeller, A Kemper",VLDB,2002
71748,conf/vldb/Vingralek02,"GnatDb: A Small-Footprint, Secure Database System",R Vingralek,VLDB,2002
71751,conf/vldb/Fox02,Toward Recovery-Oriented Computing,A Fox,VLDB,2002
71756,conf/vldb/DagevilleZ02,SQL Memory Management in Oracle9i,"B Dageville, M Zaďt",VLDB,2002
71768,conf/vldb/LiHKSPAC02,Issues and Evaluations of Caching Solutions for Web Application Acceleration,"W Li, W Hsiung, D Kalashnikov, R Sion, O Po, D Agrawal, K Candan",VLDB,2002
71771,conf/vldb/MahnkeMS02,Extending an ORDBMS: The StateMachine Module,"W Mahnke, C Mathis, H Steiert",VLDB,2002
71772,conf/vldb/AdityaBCHNS02,BANKS: Browsing and Keyword Searching in Relational Databases,"B Aditya, G Bhalotia, S Chakrabarti, A Hulgeri, C Nakhe, P Parag, S Sudarshan",VLDB,2002
71775,conf/vldb/LamKR02,RTMonitor: Real-Time Data Monitoring Using Mobile Agent Technologies,"K Lam, A Kwan, K Ramamritham",VLDB,2002
71780,conf/vldb/GarofalakisG01,Approximate Query Processing: Taming the TeraBytes,"M Garofalakis, P Gibbons",VLDB,2001
71783,conf/vldb/RantzauCHM02,Champagne: Data Change Propagation for Heterogeneous Information Systems,"R Rantzau, C Constantinescu, U Heinkel, H Meinecke",VLDB,2002
71796,conf/vldb/JagatheesanMPW03,Grid Data Management Systems & Services,,,2003
71802,conf/vldb/ChakrabartiRS02,Fast and Accurate Text Classification via Multiple Linear Discriminant Projections,"S Chakrabarti, S Roy, M Soundalgekar",VLDB,2002
71805,conf/vldb/Mohan02,Application Servers and Associated Technologies,,,2002
71814,conf/vldb/OzsoyogluAAOUO02,Sideway Value Algebra for Object-Relational Databases,"G Özsoyoglu, A Al-Hamdani, I Altingövde, S Özel, Ö Ulusoy, Z Özsoyoglu",VLDB,2002
71818,conf/vldb/BohannonGKNS02,Optimizing View Queries in ROLEX to Support Navigable Result Trees,"P Bohannon, S Ganguly, H Korth, P Narayan, P Shenoy",VLDB,2002
71830,conf/vldb/ChienVZTZ02,Efficient Structural Joins on Indexed XML Documents,"S Chien, Z Vagena, D Zhang, V Tsotras, C Zaniolo",VLDB,2002
71847,conf/vldb/Uhl02,A Bandwidth Model for Internet Search,A Uhl,VLDB,2002
71849,conf/vldb/ChoN02,Effective Change Detection Using Sampling,"J Cho, A Ntoulas",VLDB,2002
71853,conf/vldb/CandanALPH02,View Invalidation for Dynamic Content Caching in Multitiered Architectures,"K Candan, D Agrawal, W Li, O Po, W Hsiung",VLDB,2002
71862,journals/tods/GoldmanL94,Quorum Consensus in Nested Transaction Systems,"K Goldman, N Lynch",ACM Trans. Database Syst.,1994
71869,journals/tods/IoannidisR95,Containment of Conjunctive Queries: Beyond Relations as Sets,"Y Ioannidis, R Ramakrishnan",ACM Trans. Database Syst.,1995
71878,journals/tods/BaralisCP96,Modularization Techniques for Active Rules Design,"E Baralis, S Ceri, S Paraboschi",ACM Trans. Database Syst.,1996
71886,journals/tods/LitwinN96,"LH* - A Scalable, Distributed Data Structure","W Litwin, M Neimat, D Schneider",ACM Trans. Database Syst.,1996
71892,journals/vldb/ChanGR03,RE-tree: an efficient index structure for regular expressions,"C Chan, M Garofalakis, R Rastogi",VLDB J.,2003
71895,journals/vldb/YangW03,Incremental computation and maintenance of temporal aggregates,"J Yang, J Widom",VLDB J.,2003
71900,journals/vldb/Li03,Computing complete answers to queries in the presence of limited access patterns,C Li,VLDB J.,2003
71907,journals/tods/Kim94,Charter and Scope,W Kim,ACM Trans. Database Syst.,1994
71912,journals/tods/ScioreSR94,Using Semantic Values to Falilitate Interoperability Among Heterogeneous Information Systems,"E Sciore, M Siegel, A Rosenthal",ACM Trans. Database Syst.,1994
71913,journals/tods/YanG94,Index Structures for Selective Dissemination of Information Under the Boolean Model,"T Yan, H Garcia-Molina",ACM Trans. Database Syst.,1994
71914,journals/tods/Subrahmanian94,Amalgamating Knowledge Bases,V Subrahmanian,ACM Trans. Database Syst.,1994
71916,journals/tods/RosenthalR94,Tools and Transformations - Rigorous and Otherwise - for Practical Database Design,"A Rosenthal, D Reiner",ACM Trans. Database Syst.,1994
71920,journals/tods/CeriFPT94,Automatic Generation of Production Rules for Integrity Maintenance,"S Ceri, P Fraternali, S Paraboschi, L Tanca",ACM Trans. Database Syst.,1994
71926,journals/tods/KossmannS00,Iterative dynamic programming: a new class of query optimization algorithms,"D Kossmann, K Stocker",ACM Trans. Database Syst.,2000
71929,journals/tods/DeySB99,Improving Database Design Through the Analysis of Relationships,"D Dey, V Storey, T Barron",ACM Trans. Database Syst.,1999
71940,journals/tods/EiterLLS01,Probabilistic object bases,"T Eiter, J Lu, T Lukasiewicz, V Subrahmanian",ACM Trans. Database Syst.,2001
71941,journals/tods/Snodgrass01,Editorial,,,2001
71943,journals/tods/FukudaMMT01,Data Mining with optimized two-dimensional association rules,"T Fukuda, Y Morimoto, S Morishita, T Tokuyama",ACM Trans. Database Syst.,2001
71950,journals/tods/SchuldtABS02,Atomicity and isolation for transactional processes,"H Schuldt, G Alonso, C Beeri, H Schek",ACM Trans. Database Syst.,2002
71952,journals/tods/KotidisR01,A case for dynamic view management,"Y Kotidis, N Roussopoulos",ACM Trans. Database Syst.,2001
71963,journals/tods/LiuHD98,Multiview Access Protocols for Large-Scale Replication,"X Liu, A Helal, W Du",ACM Trans. Database Syst.,1998
71969,journals/tods/DyresonS98,Supporting Valid-Time Indeterminacy,"C Dyreson, R Snodgrass",ACM Trans. Database Syst.,1998
71971,journals/tods/KonopnickiS98,Information Gathering in the World-Wide Web: The W3QL Query Language and the W3QS System,"D Konopnicki, O Shmueli",ACM Trans. Database Syst.,1998
71975,journals/tods/CastanoAFP98,Conceptual Schema Analysis: Techniques and Applications,"S Castano, V Antonellis, M Fugini, B Pernici",ACM Trans. Database Syst.,1998
71984,journals/tods/GravanoGT99,GlOSS: Text-Source Discovery over the Internet,"L Gravano, H Garcia-Molina, A Tomasic",ACM Trans. Database Syst.,1999
71985,journals/tods/ChaudhuriS99,Optimization of Queries with User-Defined Predicates,"S Chaudhuri, K Shim",ACM Trans. Database Syst.,1999
71987,journals/vldb/AslanM99,Semantic Heterogeneity Resolution in Federated Databases by Metadata Implantation and Stepwise Evolution,"G Aslan, D McLeod",VLDB J.,1999
72011,journals/vldb/GeorgeH00,Secure Bufering in Firm Real-Time Database Systems,"B George, J Haritsa",VLDB J.,2000
72020,journals/vldb/PanagosB97,Synchronization and Recovery in a Client-Server Storage System,"E Panagos, A Biliris",VLDB J.,1997
72022,journals/vldb/LometS97,Concurrency and Recovery for Index Trees,"D Lomet, B Salzberg",VLDB J.,1997
72029,journals/vldb/IoannidisNSS97,Parametric Query Optimization,"Y Ioannidis, R Ng, K Shim, T Sellis",VLDB J.,1997
72031,journals/vldb/MehrotraKS97,Concurrency Control in Hierarchical Multidatabase Systems,"S Mehrotra, H Korth, A Silberschatz",VLDB J.,1997
72044,journals/vldb/FahlR97,Query Processing Over Object Views of Relational Data,"G Fahl, T Risch",VLDB J.,1997
72048,journals/vldb/ScheuermannWZ98,Data Partitioning and Load Balancing in Parallel Disk Systems,"P Scheuermann, G Weikum, P Zabback",VLDB J.,1998
