tid,id,title,authors,venue,year
69613,conf/vldb/AmmannJR95,Using Formal Methods to Reason about Semantics-Based Decompositions of Transactions,"P Ammann, S Jajodia, I Ray",VLDB,1995
69614,journals/sigmod/Liu02,Editor's Notes,L Liu,SIGMOD Record,2002
69617,conf/vldb/SubietaKL95,Procedures in Object-Oriented Query Languages,"K Subieta, Y Kambayashi, J Leszczylowski",VLDB,1995
69619,journals/sigmod/Ouksel02,Mining the World Wide Web: An Information Search Approach - Book Review,,,2002
69620,conf/vldb/MoserKK95,L/MRP: A Buffer Management Strategy for Interactive Continuous Data Flows in a Multimedia DBMS,"F Moser, A Kraiss, W Klas",VLDB,1995
69622,conf/vldb/ChaudhuriGS95,Retrieval of Composite Multimedia Objects,"S Chaudhuri, S Ghandeharizadeh, C Shahabi",VLDB,1995
69623,journals/sigmod/Kosch02,MPEG-7 and Multimedia Database Systems,H Kosch,SIGMOD Record,2002
69624,conf/vldb/LuTD95,The Fittest Survives: An Adaptive Approach to Query Optimization,"H Lu, K Tan, S Dao",VLDB,1995
69626,conf/vldb/TreschPL95,Type Classification of Semi-Structured Documents,"M Tresch, N Palmer, A Luniewski",VLDB,1995
69627,journals/sigmod/Geller02,Data Mining: Practical Machine Learning Tools and Techniques - Book Review,J Geller,SIGMOD Record,2002
69629,journals/sigmod/CaplinskasEV02,Advances in Databases and Information Systems (ADBIS),"A Caplinskas, J Eder, O Vasilecas",SIGMOD Record,2002
69630,conf/vldb/SrikantA95,Mining Generalized Association Rules,"R Srikant, R Agrawal",VLDB,1995
69633,conf/vldb/FlodinR95,Processing Object-Oriented Queries with Invertible Late Bound Functions,"S Flodin, T Risch",VLDB,1995
69635,conf/vldb/HvasshovdTBH95,"The ClustRa Telecom Database: High Availability, High Throughput, and Real-Time Response","S Hvasshovd, Ř Torbjřrnsen, S Bratsberg, P Holager",VLDB,1995
69637,conf/vldb/LuSL95,NeuroRule: A Connectionist Approach to Data Mining,"H Lu, R Setiono, H Liu",VLDB,1995
69638,journals/sigmod/ErdurD02,A Multi-Agent System Infrastructure for Software Component Market-Place: An Ontological Perspective,"R Erdur, O Dikenelli",SIGMOD Record,2002
69639,conf/vldb/GallersdorferN95,Improving Performance in Replicated Databases through Relaxed Coherency,"R Gallersdörfer, M Nicola",VLDB,1995
69640,journals/sigmod/CiliaB02,An Active Functionality Service for E-Business Applications,"M Cilia, A Buchmann",SIGMOD Record,2002
69641,journals/sigmod/HummerLW02,Contracting in the Days of eBusiness,"W Hümmer, W Lehner, H Wedekind",SIGMOD Record,2002
69643,conf/vldb/Wang95,DB2 Query Parallelism: Staging and Implementation,Y Wang,VLDB,1995
69647,conf/vldb/DidriksenGD95,Database De-Centralization - A Practical Approach,"T Didriksen, C Galindo-Legaria, E Dahle",VLDB,1995
69648,journals/sigmod/HalkidiBV02,Cluster Validity Methods: Part I,"M Halkidi, Y Batistakis, M Vazirgiannis",SIGMOD Record,2002
69651,journals/sigmod/SlivinskasJS02,Bringing Order to Query Optimization,"G Slivinskas, C Jensen, R Snodgrass",SIGMOD Record,2002
69652,conf/vldb/BrownS95,BigSur: A System For the Management of Earth Science Data,"P Brown, M Stonebraker",VLDB,1995
69653,journals/sigmod/Liu02a,Editor's Notes,L Liu,SIGMOD Record,2002
69657,journals/sigmod/LuoI02,Interviewing During a Tight Job Market,,,2002
69659,journals/sigmod/Wiegand02,Investigating XQuery for Querying Across Database Object Types,N Wiegand,SIGMOD Record,2002
69660,conf/vldb/KonopnickiS95,W3QS: A Query System for the World-Wide Web,"D Konopnicki, O Shmueli",VLDB,1995
69661,journals/sigmod/OrlandicLS02,The Design of a Retrieval Technique for High-Dimensional Data on Tertiary Storage,"R Orlandic, J Lukaszuk, C Swietlik",SIGMOD Record,2002
69662,conf/vldb/WienerN95,OODB Bulk Loading Revisited: The Partitioned-List Approach,"J Wiener, J Naughton",VLDB,1995
69663,journals/sigmod/Ozsu02,Chair's Message,,,2002
69665,journals/sigmod/Fagin02,Combining Fuzzy Information: an Overview,R Fagin,SIGMOD Record,2002
69666,conf/vldb/ReuterCGSW95,Databases and Workflow Management: What is it All About? (Panel),"A Reuter, S Ceri, J Gray, B Salzberg, G Weikum",VLDB,1995
69669,conf/vldb/BestavrosB95,Value-cognizant Speculative Concurrency Control,"A Bestavros, S Braoudakis",VLDB,1995
69671,journals/sigmod/BerzalM02,Data Mining: Concepts and Techniques - Book Review,"F Galiano, N Marín",SIGMOD Record,2002
69672,conf/vldb/WuYCT95,A Performance Study of Workfile Disk Management for Concurrent Mergesorts in a Multiprocessor Database System,"K Wu, P Yu, J Chung, J Teng",VLDB,1995
69673,conf/vldb/MogiK95,Hot Block Clustering for Disk Arrays with Dynamic Striping,"K Mogi, M Kitsuregawa",VLDB,1995
69675,journals/sigmod/Snodgrass02a,TODS Perceptions and Misconceptions,R Snodgrass,SIGMOD Record,2002
69677,journals/sigmod/YaoG02,The Cougar Approach to In-Network Query Processing in Sensor Networks,"Y Yao, J Gehrke",SIGMOD Record,2002
69681,journals/sigmod/Weikum02,Foundations of Statistical Natural Language Processing - Book Review,,,2002
69683,conf/vldb/NgH94,Efficient and Effective Clustering Methods for Spatial Data Mining,"R Ng, J Han",VLDB,1994
69684,journals/sigmod/Neven02,Automata Theory for XML Researchers,F Neven,SIGMOD Record,2002
69685,journals/sigmod/WinslettCDHZZ02,Database Research at the University of Illinois at Urbana-Champaign,"M Winslett, K Chang, A Doan, J Han, C Zhai, Y Zhou",SIGMOD Record,2002
69686,conf/vldb/BrownCC94,Fast Incremental Indexing for Full-Text Information Retrieval,"E Brown, J Callan, W Croft",VLDB,1994
69689,journals/sigmod/Hammer02a,Treasurer's Message,,,2002
69690,conf/vldb/OuzzaniAB94,A Top-Down Approach for Two Level Serializability,"M Ouzzani, M Atroun, N Belkhodja",VLDB,1994
69693,conf/vldb/Guting94,GraphDB: Modeling and Querying Graphs in Databases,R Güting,VLDB,1994
69694,journals/sigmod/LeveneP02,Report on the Web Dynamics Workshop at WWW 2002,,,2002
69695,journals/sigmod/CrestaniG02,Report on the 24th European Colloquium on Information Retrieval Research,,,2002
69696,conf/vldb/GutierrezPST94,Database Graph Views: A Practical Model to Manage Persistent Graphs,"A Gutiérrez, P Pucheral, H Steffen, J Thévenin",VLDB,1994
69697,conf/vldb/KemperK94,Dual-Buffering Strategies in Object Bases,"A Kemper, D Kossmann",VLDB,1994
69699,journals/sigmod/Winslett02b,Hector Garcia-Molina Speaks Out,M Winslett,,2002
69701,conf/vldb/BarjaPFWD94,An Effective Deductive Object-Oriented Database Through Language Integration,"M Barja, N Paton, A Fernandes, M Williams, A Dinn",VLDB,1994
69702,journals/sigmod/LightstoneLZ02,Toward Autonomic Computing with DB2 Universal Database,"S Lightstone, G Lohman, D Zilio",SIGMOD Record,2002
69706,conf/vldb/AgrawalS94,Fast Algorithms for Mining Association Rules in Large Databases,"R Agrawal, R Srikant",VLDB,1994
69707,journals/sigmod/Badia02,Ontologies: A Silver Bullet for Knowledge Management and Electronic Commerce - Book Review,,,2002
69708,conf/vldb/HaberIL95,OPOSSUM: Desk-Top Schema Management through Customizable Visualization,"E Haber, Y Ioannidis, M Livny",VLDB,1995
69709,journals/sigmod/GobleR02a,The Grid: An Application of the Semantic Web,"C Goble, D Roure",SIGMOD Record,2002
69713,journals/sigmod/Wu02,Small Worlds: the Dynamics of Networks between Order and Randomness - Book Review,,,2002
69715,conf/vldb/Sarawagi95,Query Processing in Tertiary Memory Databases,S Sarawagi,VLDB,1995
69719,conf/vldb/RamakrishnanGRSWZ95,Scientific Journals: Extinction or Explosion? (Panel),"R Ramakrishnan, H Garcia-Molina, G Rossbach, A Silberschatz, G Wiederhold, J Zijlstra",VLDB,1995
69720,journals/sigmod/ButtlerCCFHLPRX02,Querying Multiple Bioinformatics Data Sources: Can Semantic Web Research Help?,"D Buttler, M Coleman, T Critchlow, R Fileto, W Han, L Liu, C Pu, D Rocco, L Xiong",SIGMOD Record,2002
69722,conf/vldb/SistlaYLL95,Similarity based Retrieval of Pictures Using Indices on Spatial Relationships,"A Sistla, C Yu, C Liu, K Liu",VLDB,1995
69729,journals/sigmod/HuangKL02,A Study on the Management of Semantic Transaction for Efficient Data Retrieval,"S Huang, I Kwan, C Li",SIGMOD Record,2002
69732,journals/sigmod/RossAA02,Reminiscences on Influential Papers,,,2002
69734,conf/vldb/Fecteau95,Managing a DB2 Parallel Edition Database,G Fecteau,VLDB,1995
69738,journals/sigmod/BoucelmaCGJLL02,Report on the EDBT'02 Panel on Scientific Data Integration,,,2002
69739,conf/vldb/AmielBDS94,Supporting Exceptions to Schema Consistency to Ease Schema Evolution in OODBMS,"E Amiel, M Bellosta, E Dujardin, E Simon",VLDB,1994
69740,journals/sigmod/HanBP01,Wrapping Web Data into XML,"W Han, D Buttler, C Pu",SIGMOD Record,2001
69741,journals/sigmod/Suciu01,On Database Theory and XML,D Suciu,SIGMOD Record,2001
69743,journals/sigmod/Fankhauser01,XQuery Formal Semantics: State and Challenges,P Fankhauser,SIGMOD Record,2001
69744,conf/vldb/BrownMCL94,Towards Automated Performance Tuning for Complex Workloads,"K Brown, M Mehta, M Carey, M Livny",VLDB,1994
69745,journals/sigmod/SchmidtWKFCMB01,Why And How To Benchmark XML Databases,"A Schmidt, F Waas, M Kersten, D Florescu, M Carey, I Manolescu, R Busse",SIGMOD Record,2001
69746,conf/vldb/LevyMS94,Query Optimization by Predicate Move-Around,"A Levy, I Mumick, Y Sagiv",VLDB,1994
69747,journals/sigmod/Lomet01,The Evolution of Effective B-tree: Page Organization and Techniques: A Personal Account,D Lomet,SIGMOD Record,2001
69751,conf/vldb/LiC94,Semantic Integration in Heterogeneous Databases Using Neural Networks,"W Li, C Clifton",VLDB,1994
69752,journals/sigmod/ChienTZ01,XML Document Versioning,"S Chien, V Tsotras, C Zaniolo",SIGMOD Record,2001
69753,conf/vldb/IdrisGC94,Providing Dynamic Security Control in a Federated Database,"N Idris, W Gray, R Churchhouse",VLDB,1994
69754,journals/sigmod/LudascherMM01,"Preservation of Digital Data with Self-Validating, Self-Instantiating Knowledge-Based Archives","B Ludäscher, R Marciano, R Moore",SIGMOD Record,2001
69755,journals/sigmod/ConstantopoulosCP01,"Semantic Web Workshop: Models, Architectures and Management",,,2001
69759,journals/sigmod/Winslett01,"Jeffrey D. Ullman Speaks Out on the Future of Higher Education, Startups, Database Theory, and More",,,2001
69760,conf/vldb/SetzerZ94,New Concurrency Control Algorithms for Accessing and Compacting B-Trees,"V Setzer, A Zisman",VLDB,1994
69761,conf/vldb/GehaniJR94,OdeFS: A File System Interface to an Object-Oriented Database,"N Gehani, H Jagadish, W Roome",VLDB,1994
69762,journals/sigmod/Bernstein01,Report on the 2001 SIGMOD and PODS Awards,,,2001
69763,journals/sigmod/BunemanFSW01,Constraints for Semi-structured Data and XML,"P Buneman, W Fan, J Siméon, S Weinstein",SIGMOD Record,2001
69764,conf/vldb/KilgerM94,Indexing Multiple Sets,"C Kilger, G Moerkotte",VLDB,1994
69768,journals/sigmod/EisenbergM01,SQL/XML and the SQLX Informal Group of Companies,"A Eisenberg, J Melton",SIGMOD Record,2001
69769,journals/sigmod/BiancheriPP01,EIHA?!?: Deploying Web and WAP services using XML Technology,"C Biancheri, J Pazzaglia, G Paddeu",SIGMOD Record,2001
69770,conf/vldb/BrinkhoffK94,The Impact of Global Clustering on Spatial Database Systems,"T Brinkhoff, H Kriegel",VLDB,1994
69773,journals/sigmod/MeltonE01,SQL Multimedia and Application Packages (SQL/MM),"J Melton, A Eisenberg",SIGMOD Record,2001
69776,conf/vldb/ChakravarthyKAK94,"Composite Events for Active Databases: Semantics, Contexts and Detection","S Chakravarthy, V Krishnaprasad, E Anwar, S Kim",VLDB,1994
69777,journals/sigmod/LenzeriniNNS01,Report on the 8th International Workshop on Knowledge Representation Meets Databases (KRDB),,,2001
69780,conf/vldb/Chiueh94,Content-Based Image Indexing,T Chiueh,VLDB,1994
69781,conf/vldb/DeWittKLPY94,Client-Server Paradise,"D DeWitt, N Kabra, J Luo, J Patel, J Yu",VLDB,1994
69784,conf/vldb/SripadaW94,Cumulative Updates,"S Sripada, B Wüthrich",VLDB,1994
69785,conf/vldb/ShatdalKN94,Cache Conscious Algorithms for Relational Query Processing,"A Shatdal, C Kant, J Naughton",VLDB,1994
69786,journals/sigmod/Labrinidis01,Introduction to the Career Forum Column,A Labrinidis,SIGMOD Record,2001
69788,journals/sigmod/BabuW01,Continuous Queries over Data Streams,"S Babu, J Widom",SIGMOD Record,2001
69789,journals/sigmod/Huyn01,Data Analysis and Mining in the Life Sciences,N Huyn,SIGMOD Record,2001
69790,conf/vldb/GoodmanRS94,Building a Laboratory Information System Around a C++-Based Object-Oriented DBMS,"N Goodman, S Rozen, L Stein",VLDB,1994
69793,conf/vldb/BernsteinD94,An Overview of Repository Technology,"P Bernstein, U Dayal",VLDB,1994
69795,conf/vldb/IyerW94,Data Compression Support in Databases,"B Iyer, D Wilhite",VLDB,1994
69796,journals/sigmod/Snodgrass01a,Accessibility of the Database Literature,R Snodgrass,SIGMOD Record,2001
69797,journals/sigmod/Hammer01,Treasurer's Message,,,2001
69803,conf/vldb/Bernstein94,PC Database Systems - Present and Future,P Bernstein,VLDB,1994
69807,conf/sigmod/DasGR03,Approximate Join Processing Over Data Streams,"A Das, J Gehrke, M Riedewald",SIGMOD Conference,2003
69808,journals/sigmod/BarbaraCJW01,ADAM: A Testbed for Exploring the Use of Data Mining in Intrusion Detection,"D Barbará, J Couto, S Jajodia, N Wu",SIGMOD Record,2001
69809,journals/sigmod/CabreraLM01,Detection and Classification of Intrusions and Faults using Sequences of System Calls,"J Cabrera, L Lewis, R Mehra",SIGMOD Record,2001
69810,conf/sigmod/WangJLY03,Containment Join Size Estimation: Models and Methods,"W Wang, H Jiang, H Lu, J Yu",SIGMOD Conference,2003
69811,conf/vldb/MartinC94,Relating Distributed Objects,"B Martin, R Cattell",VLDB,1994
69813,conf/vldb/YanA94,Integrating a Structured-Text Retrieval System with an Object-Oriented Database System,"T Yan, J Annevelink",VLDB,1994
69817,journals/sigmod/Barbara01,Special Issue on Data Mining for Intrusion Detection and Threat Analysis - Guest Editor's Introduction,,,2001
69820,conf/sigmod/FaginKS03,Efficient similarity search and classification via rank aggregation,"R Fagin, R Kumar, D Sivakumar",SIGMOD Conference,2003
69824,journals/sigmod/VelACM01,Mining Email Content for Author Identification Forensics,"O Vel, A Anderson, M Corney, G Mohay",SIGMOD Record,2001
69825,journals/sigmod/Scholl01,Transactional Information Systems - Book Review,,,2001
69826,conf/sigmod/IlyasRLGL03,Estimating Compilation Time of a Query Optimizer,"I Ilyas, J Rao, G Lohman, D Gao, E Lin",SIGMOD Conference,2003
69832,conf/sigmod/BenediktCFFR03,Capturing both Types and Constraints in Data Integration,"M Benedikt, C Chan, W Fan, J Freire, R Rastogi",SIGMOD Conference,2003
69834,conf/sigmod/MiloAABN03,Exchanging Intensional XML Data,"T Milo, S Abiteboul, B Amann, O Benjelloun, F Ngoc",SIGMOD Conference,2003
69837,journals/sigmod/Dogac02,Guest Editor's Introduction,,,2002
69840,journals/sigmod/SommerGB02,The n-Tier Hub Technology,"R Sommer, T Gulledge, D Bailey",SIGMOD Record,2002
69842,conf/vldb/DavisonG94,Memory-Contention Responsive Hash Joins,"D Davison, G Graefe",VLDB,1994
69844,conf/vldb/MedianoCD94,V-Trees - A Storage Method for Long Vector Data,"M Mediano, M Casanova, M Dreux",VLDB,1994
69847,conf/vldb/LitwinNS94,RP*: A Family of Order Preserving Scalable Distributed Data Structures,"W Litwin, M Neimat, D Schneider",VLDB,1994
69850,conf/vldb/ChawatheCY94,On Index Selection Schemes for Nested Object Hierarchies,"S Chawathe, M Chen, P Yu",VLDB,1994
69854,conf/vldb/LuOT94,On Spatially Partitioned Temporal Join,"H Lu, B Ooi, K Tan",VLDB,1994
69855,conf/vldb/HjelsvoldM94,Modelling and Querying Video Data,"R Hjelsvold, R Midtstraum",VLDB,1994
69857,conf/vldb/PirotteZMY94,Materialization: A Powerful and Ubiquitous Abstraction Pattern,"A Pirotte, E Zimányi, D Massart, T Yakusheva",VLDB,1994
69859,journals/sigmod/GobleR02,Report on the 18th British National Conference on Databases (BNCOD),,,2002
69860,conf/vldb/NgY94,Maximizing Buffer and Disk Utilizations for News On-Demand,"R Ng, J Yang",VLDB,1994
69861,journals/sigmod/RossKMV02,Reminiscences on Influential Papers,,,2002
69864,journals/sigmod/Elderini02,Letter to SIGMOD Record Editor,N Elderini,,2002
69865,conf/vldb/KamelF94,Hilbert R-tree: An Improved R-tree using Fractals,"I Kamel, C Faloutsos",VLDB,1994
69866,journals/sigmod/Snodgrass02,Why I Like Working in Academia,R Snodgrass,SIGMOD Record,2002
69869,journals/sigmod/JacobS99,FinTime - A Financial Time Series Benchmark,"K Jacob, D Shasha",SIGMOD Record,1999
69871,conf/sigmod/GuoSBS03,XRANK: Ranked Keyword Search over XML Documents,"L Guo, F Shao, C Botev, J Shanmugasundaram",SIGMOD Conference,2003
69872,journals/sigmod/KempsterST99,Diluting ACID,"T Kempster, C Stirling, P Thanisch",SIGMOD Record,1999
69873,conf/sigmod/Al-KhalifaYJ03,Querying Structured Text in an XML Database,"S Al-Khalifa, C Yu, H Jagadish",SIGMOD Conference,2003
69874,journals/sigmod/GatziuJSV99,Design and Management of Data Warehouses: Report on the DMDW'99 Workshop,"S Gatziu, M Jeusfeld, M Staudt, Y Vassiliou",SIGMOD Record,1999
69875,conf/sigmod/WangPFY03,ViST: A Dynamic Index Method for Querying XML Data by Tree Structures,"H Wang, S Park, W Fan, P Yu",SIGMOD Conference,2003
69889,journals/sigmod/PaepckeGRC00,Beyond Document Similarity: Understanding Value-Based Search and Browsing Technologies,"A Paepcke, H Garcia-Molina, G Rodríguez-Mulŕ, J Cho",SIGMOD Record,2000
69890,conf/sigmod/AbadiCCCCEGHMRSSTXYZ03,Aurora: A Data Stream Management System,"D Abadi, D Carney, U Çetintemel, M Cherniack, C Convey, C Erwin, E Galvez, M Hatoun, A Maskey, A Rasin, A Singer, M Stonebraker, N Tatbul, Y Xing, R Yan, S Zdonik",SIGMOD Conference,2003
69892,journals/sigmod/BonifatiC00,Comparative Analysis of Five XML Query Languages,"A Bonifati, S Ceri",SIGMOD Record,2000
69893,journals/sigmod/LiefkeS00,An Extensible Compressor for XML Data,"H Liefke, D Suciu",SIGMOD Record,2000
69896,conf/sigmod/Mamoulis03,Efficient Processing of Joins on Set-valued Attributes,N Mamoulis,SIGMOD Conference,2003
69899,conf/sigmod/ChengKP03,Evaluating Probabilistic Queries over Imprecise Data,"R Cheng, D Kalashnikov, S Prabhakar",SIGMOD Conference,2003
69900,journals/sigmod/RoddickABDEGHLMMMW00,Evolution and Change in Data Management - Issues and Directions,"J Roddick, L Al-Jadir, L Bertossi, M Dumas, F Estrella, H Gregersen, K Hornsby, J Lufter, F Mandreoli, T Männistö, E Mayol, L Wedemeijer",SIGMOD Record,2000
69901,conf/sigmod/OlstonJW03,Adaptive Filters for Continuous Queries over Distributed Data Streams,"C Olston, J Jiang, J Widom",SIGMOD Conference,2003
69903,journals/sigmod/Palpanas00,Knowledge Discovery in Data Warehouses,T Palpanas,SIGMOD Record,2000
69904,conf/sigmod/AbiteboulBCMM03,Dynamic XML documents with distribution and replication,"S Abiteboul, A Bonifati, G Cobena, I Manolescu, T Milo",SIGMOD Conference,2003
69905,journals/sigmod/Franklin00,Editor's Notes,M Franklin,SIGMOD Record,2000
69906,conf/sigmod/BabcockCD03,Dynamic Sample Selection for Approximate Query Processing,"B Babcock, S Chaudhuri, G Das",SIGMOD Conference,2003
69908,journals/sigmod/WestmannKHM00,The Implementation and Performance of Compressed Databases,"T Westmann, D Kossmann, S Helmer, G Moerkotte",SIGMOD Record,2000
69909,conf/sigmod/BornhovdAKMPR03,DBCache: Middle-tier Database Caching for Highly Scalable e-Business Architectures,"C Bornhövd, M Altinel, S Krishnamurthy, C Mohan, H Pirahesh, B Reinwald",SIGMOD Conference,2003
69913,journals/sigmod/RossAKSSY00,Reminiscences on Influential Papers,,,2000
69914,conf/sigmod/CranorJSS03,Gigascope: A Stream Database for Network Applications,"C Cranor, T Johnson, O Spatscheck, V Shkapenyuk",SIGMOD Conference,2003
69922,journals/sigmod/LudwigG00,Report in ISDO '00: The CAiSE*00 Workshop on Infrastructures for Dynamic Business-to-Business Service Outsourcinga,,,2000
69924,conf/sigmod/DeshpandeNGS03,Cache-and-Query for Wide Area Sensor Databases,"A Deshpande, S Nath, P Gibbons, S Seshan",SIGMOD Conference,2003
69925,conf/sigmod/LiBKN03,Composing XSL Transformations with XML Publishing Views,"C Li, P Bohannon, H Korth, P Narayan",SIGMOD Conference,2003
69928,journals/sigmod/Mendelzon00,Information Director's Message,,,2000
69930,conf/sigmod/CuiOTS03,Contorting High Dimensional Data for Efficient Main Memory Processing,"B Cui, B Ooi, J Su, K Tan",SIGMOD Conference,2003
69934,conf/sigmod/Raghavan03,Extracting and Exploiting Structure in Text Search,P Raghavan,SIGMOD Conference,2003
69935,journals/sigmod/Hammer00,Treasurer's Message,,,2000
69938,conf/sigmod/Shivakumar03,Google in a Box - Building the Google Search Appliance,N Shivakumar,SIGMOD Conference,2003
69947,journals/sigmod/Halevy00,Theory of Answering Queries Using Views,A Halevy,SIGMOD Record,2000
69949,journals/sigmod/RashidS00,Object Database Evolution Using Separation of Concerns,"A Rashid, P Sawyer",SIGMOD Record,2000
69950,conf/sigmod/Aggarwal03,A Framework for Change Diagnosis of Data Streams,C Aggarwal,SIGMOD Conference,2003
69951,conf/sigmod/ChaudhuriKN03,On Relational Support for XML Publishing: Beyond Sorting and Tagging,"S Chaudhuri, R Kaushik, J Naughton",SIGMOD Conference,2003
69954,conf/sigmod/KimC03,Qcluster: Relevance Feedback Using Adaptive Clustering for Content-Based Image Retrieval,"D Kim, C Chung",SIGMOD Conference,2003
69956,journals/sigmod/CasatiDS00,VLDB Workshop on Technologies in E-Services (TES),,,2000
69957,journals/sigmod/Snodgrass00c,SIGMOD Program Review,,,2000
69958,conf/sigmod/Pruscino03,Oracle RAC: Architecture and Performance,A Pruscino,SIGMOD Conference,2003
69959,conf/sigmod/Bosworth03,The Future of Web Services - I,A Bosworth,SIGMOD Conference,2003
69960,journals/sigmod/PossasMCR00,Using Quantitative Information for Efficient Association Rule Generation,"B Pôssas, W Jr., M Carvalho, R Resende",SIGMOD Record,2000
69961,conf/sigmod/Cabrera03,The Future of Web services - II,F Cabrera,SIGMOD Conference,2003
69962,journals/sigmod/HasselbringHHKRRS00,"Research and Practice in Federated Information Systems, Report of the EFIS '2000 International Workshop",,,2000
69963,conf/sigmod/GangulyGR03,Processing Set Expressions over Continuous Update Streams,"S Ganguly, M Garofalakis, R Rastogi",SIGMOD Conference,2003
69965,journals/sigmod/YuenCLL00,Cache Invalidation Scheme for Mobile Computing Systems with Real-time Data,"J Yuen, E Chan, K Lam, H Leung",SIGMOD Record,2000
69966,conf/sigmod/ChaudhuriGGM03,Robust and Efficient Fuzzy Match for Online Data Cleaning,"S Chaudhuri, K Ganjam, V Ganti, R Motwani",SIGMOD Conference,2003
69967,conf/sigmod/KementsietsidisAM03,Mapping Data in Peer-to-Peer Systems: Semantics and Algorithmic Issues,"A Kementsietsidis, M Arenas, R Miller",SIGMOD Conference,2003
69968,journals/sigmod/BernsteinHP00,A Vision of Management of Complex Models,"P Bernstein, A Halevy, R Pottinger",SIGMOD Record,2000
69969,conf/sigmod/StoltePAG03,Scientific Data Repositories: Designing for a Moving Target,"E Stolte, C Praun, G Alonso, T Gross",SIGMOD Conference,2003
69970,journals/sigmod/Snodgrass00b,Chair's Message,,,2000
69971,conf/sigmod/GuptaS03,Stream Processing of XPath Queries with Predicates,"A Gupta, D Suciu",SIGMOD Conference,2003
69973,journals/sigmod/BoscMP01,Report on The fourth International Conference on Flexible Query Answering systems,,,2001
69978,conf/sigmod/MaddenFHH03,The Design of an Acquisitional Query Processor For Sensor Networks,"S Madden, M Franklin, J Hellerstein, W Hong",SIGMOD Conference,2003
69980,journals/sigmod/BertinoEH01,Quality of Service in Multimedia Digital Libraries,"E Bertino, A Elmagarmid, M Hacid",SIGMOD Record,2001
69982,journals/sigmod/FengJH01,Towards Knowledge-Based Digital Libraries,"L Feng, M Jeusfeld, J Hoppenbrouwers",SIGMOD Record,2001
69983,conf/sigmod/Dyreson03,"Temporal Coalescing with Now, Granularity, and Incomplete Information",C Dyreson,SIGMOD Conference,2003
69984,journals/sigmod/RossCGLLM01,Reminiscences on Influential Papers,,,2001
69986,conf/sigmod/ZhuS03,Warping Indexes with Envelope Transforms for Query by Humming,"Y Zhu, D Shasha",SIGMOD Conference,2003
69988,conf/sigmod/MelnikRB03,Rondo: A Programming Platform for Generic Model Management,"S Melnik, E Rahm, P Bernstein",SIGMOD Conference,2003
69989,conf/sigmod/KangN03,On Schema Matching with Opaque Column Names and Data Values,"J Kang, J Naughton",SIGMOD Conference,2003
69990,journals/sigmod/Aggarwal01,Re-designing Distance Functions and Distance-Based Applications for High Dimensional Data,C Aggarwal,SIGMOD Record,2001
69991,conf/sigmod/HeC03,Statistical Schema Matching across Web Query Interfaces,"B He, K Chang",SIGMOD Conference,2003
69992,journals/sigmod/LawderK01,Querying Multi-dimensional Data Indexed Using the Hilbert Space-filling Curve,"J Lawder, P King",SIGMOD Record,2001
69993,conf/sigmod/CohenM03,Spectral Bloom Filters,"S Cohen, Y Matias",SIGMOD Conference,2003
69995,journals/sigmod/BernsteinBCDFGGHHJLMNPSU98,The Asilomar Report on Database Research,"P Bernstein, M Brodie, S Ceri, D DeWitt, M Franklin, H Garcia-Molina, J Gray, G Held, J Hellerstein, H Jagadish, M Lesk, D Maier, J Naughton, H Pirahesh, M Stonebraker, J Ullman",SIGMOD Record,1998
69998,journals/sigmod/ChristoffelPSL98,Electronic Market: The Roadmap for University Libraries and Members to Survive in the Information Jungle,"M Christoffel, S Pulkowski, B Schmitt, P Lockemann",SIGMOD Record,1998
69999,conf/sigmod/KaushikBNK02,Covering indexes for branching path queries,"R Kaushik, P Bohannon, J Naughton, H Korth",SIGMOD Conference,2002
70000,journals/sigmod/MeltzerC98,XML and Electronic Commerce: Enabling the Network Economy,"B Meltzer, R Glushko",SIGMOD Record,1998
70003,conf/sigmod/Grust02,Accelerating XPath location steps,T Grust,SIGMOD Conference,2002
70004,journals/sigmod/Franklin98a,Editor's Notes,M Franklin,SIGMOD Record,1998
70005,conf/sigmod/ZadorozhnyRVUB02,Efficient evaluation of queries in a mediator for WebSources,"V Zadorozhny, L Raschid, M Vidal, T Urhan, L Bright",SIGMOD Conference,2002
