tid,id,title,authors,venue,year
70416,journals/sigmod/JainH94,Metadata in Video Databases,"R Jain, A Hampapur",SIGMOD Record,1994
70421,conf/sigmod/HanPY00,Mining Frequent Patterns without Candidate Generation,"J Han, J Pei, Y Yin",SIGMOD Conference,2000
70423,journals/sigmod/Segev94b,Editor's Notes and Erratum,,,1994
70426,journals/sigmod/KiyokiKH94,A Metadatabase System for Semantic Image Search by a Mathematical Model of Meaning,"Y Kiyoki, T Kitagawa, T Hayama",SIGMOD Record,1994
70427,journals/sigmod/Alonso95,Trade Press News,,,1995
70435,conf/sigmod/ChenDLT00,Fact: A Learning Based Web Query Processing System,"S Chen, Y Diao, H Lu, Z Tian",SIGMOD Conference,2000
70436,journals/sigmod/Jannink95,Implementing Deletion in B+-Trees,J Jannink,SIGMOD Record,1995
70438,conf/sigmod/WangSSZZW00,An Approximate Search Engine for Structural Databases,"J Wang, X Wang, D Shasha, B Shapiro, K Zhang, X Zheng, Q Ma, Z Weinberg",SIGMOD Conference,2000
70441,conf/sigmod/Galhardas00,AJAX: An Extensible Data Cleaning Tool,"H Galhardas, D Florescu, D Shasha, E Simon",SIGMOD Conference,2000
70443,conf/sigmod/LitwinS00,LH*RS: A High-Availability Scalable Distributed Data Structure using Reed Solomon Codes,"W Litwin, T Schwarz",SIGMOD Conference,2000
70444,journals/sigmod/SellisV95,The Database Group at National Technical University of Athens (NTUA),"T Sellis, Y Vassiliou",SIGMOD Record,1995
70448,conf/sigmod/RodriguezR00,MOCHA: A Self-Extensible Database Middleware System for Distributed Data Sources,"M Rodriguez-Martinez, N Roussopoulos",SIGMOD Conference,2000
70450,conf/sigmod/LeeKOTM00,Towards Self-Tuning Data Placement in Parallel Database Systems,"M Lee, M Kitsuregawa, B Ooi, K Tan, A Mondal",SIGMOD Conference,2000
70452,conf/sigmod/LabrinidisR00,WebView Materialization,"A Labrinidis, N Roussopoulos",SIGMOD Conference,2000
70454,conf/sigmod/ChenJDTW00,NiagaraCQ: A Scalable Continuous Query System for Internet Databases,"J Chen, D DeWitt, F Tian, Y Wang",SIGMOD Conference,2000
70457,conf/sigmod/SaltenisJLL00,Indexing the Positions of Continuously Moving Objects,"S Saltenis, C Jensen, S Leutenegger, M Lopez",SIGMOD Conference,2000
70463,journals/sigmod/DrewHKKLLLSW95,Data and Knowledge Base Research at Hong Kong University of Science and Technology,"P Drew, B Hamidzadeh, K Karlapalem, A Kean, D Lee, Q Li, F Lochovsky, C Shum, B Wüthrich",SIGMOD Record,1995
70464,conf/sigmod/BreunigKNS00,LOF: Identifying Density-Based Local Outliers,"M Breunig, H Kriegel, R Ng, J Sander",SIGMOD Conference,2000
70465,conf/sigmod/ChoG00,Synchronizing a Database to Improve Freshness,"J Cho, H Garcia-Molina",SIGMOD Conference,2000
70467,journals/sigmod/BhargavaAP95,Digital Library Services in Mobile Computing,"B Bhargava, M Annamalai, E Pitoura",SIGMOD Record,1995
70471,conf/sigmod/LiefkeS00,XMILL: An Efficient Compressor for XML Data,"H Liefke, D Suciu",SIGMOD Conference,2000
70476,conf/sigmod/Nori00,Application Architecture: 2Tier or 3Tier? What is DBMS's Role? (Panel Abstract),A Nori,SIGMOD Conference,2000
70479,journals/sigmod/MaelbranckeO95,Optimizing Jan Jannink's Implementation of B+-tree Deletion,"R Maelbrancke, H Olivie",SIGMOD Record,1995
70483,conf/sigmod/BlakeleyD00,Tutorial: Data Access,,,2000
70485,journals/sigmod/RosenthalSMBTL95,Data Management Research at The MITRE Corporation,"A Rosenthal, L Seligman, C McCollum, B Blaustein, B Thuraisingham, E Lafferty",SIGMOD Record,1995
70486,conf/sigmod/Gal00,"Data Management in eCommerce: The Good, the Bad, and the Ugly",,,2000
70488,journals/sigmod/RisheSBDOALOSS95,Florida International University High Performance Database Research Center,"N Rishe, W Sun, D Barton, Y Deng, C Orji, M Alexopoulos, L Loureiro, C 0002, M Sanchez, A Shaposhnikov",SIGMOD Record,1995
70489,journals/sigmod/PitouraB95,A Framework for Providing Consistent and Recoverable Agent-Based Access to Heterogeneous in Mobile Databases,"E Pitoura, B Bhargava",SIGMOD Record,1995
70490,conf/sigmod/Carey00,On XML and Databases: Where's the Beef? (Panel Abstract),M Carey,SIGMOD Conference,2000
70491,conf/sigmod/RaoR00,Making B+-Trees Cache Conscious in Main Memory,"J Rao, K Ross",SIGMOD Conference,2000
70492,journals/sigmod/Wong95,An Introduction to Remy's Fast Polymorphic Record Projection,L Wong,SIGMOD Record,1995
70493,journals/sigmod/LeeCL95,An Aspect of Query Optimization in Multidatabase Systems (Extended Abstract),"C Lee, C Chen, H Lu",SIGMOD Record,1995
70496,conf/sigmod/JagadishKS00,On Effective Multi-Dimensional Indexing for Strings,"H Jagadish, N Koudas, D Srivastava",SIGMOD Conference,2000
70499,conf/sigmod/ChenCPPSTM00,Internet Traffic Warehouse,"C Chen, M Cochinwala, C Petrone, M Pucci, S Samtani, P Santa, M Mesiti",SIGMOD Conference,2000
70503,journals/sigmod/Stacey95,"Replication: DB2, Oracle, or Sybase?",D Stacey,SIGMOD Record,1995
70504,conf/sigmod/PonnekantiK00,Online Index Rebuild,"N Ponnekanti, H Kodavalla",SIGMOD Conference,2000
70506,conf/sigmod/LehnerSPC00,Maintenance of Automatic Summary Tables,"W Lehner, R Sidle, H Pirahesh, R Cochrane",SIGMOD Conference,2000
70507,journals/sigmod/Alonso94,Trade Press News,,,1994
70508,conf/sigmod/BressanGOT00,Integrating Replacement Policies in StorM: An Extensible Approach,"C Goh, B Ooi, S Bressan, K Tan",SIGMOD Conference,2000
70509,journals/sigmod/Winslett94,Progress on HPCC and NII,M Winslett,SIGMOD Record,1994
70514,conf/sigmod/AggarwalPWYP99,Fast Algorithms for Projected Clustering,"C Aggarwal, C Procopiuc, J Wolf, P Yu, J Park",SIGMOD Conference,1999
70519,conf/sigmod/YangYW00,TIP: A Temporal Extension to Informix,"J Yang, H Ying, J Widom",SIGMOD Conference,2000
70522,journals/tods/HjaltasonS03,Index-driven similarity search in metric spaces,"G Hjaltason, H Samet",ACM Trans. Database Syst.,2003
70523,conf/sigmod/MerialdoAMMP00,Homer: a Model-Based CASE Tool for Data-Intensive Web Sites,"P Merialdo, P Atzeni, M Magnante, G Mecca, M Pecorone",SIGMOD Conference,2000
70524,journals/sigmod/DreyerDS94,Research Perspectives for Time Series Management Systems,"W Dreyer, A Dittrich, D Schmidt",SIGMOD Record,1994
70525,journals/sigmod/DiazJPa94,Supporting Dynamic Displays Using Active Rules,"O Díaz, A Jaime, N Paton, G al-Qaimari",SIGMOD Record,1994
70527,journals/sigmod/Snodgrass94,Overview of the Special Section on Temporal Database Infrastructure,R Snodgrass,SIGMOD Record,1994
70528,conf/sigmod/Sarawagi00,"i3: Intelligent, Interactive Investigaton of OLAP data cubes","S Sarawagi, G Sathe",SIGMOD Conference,2000
70530,journals/sigmod/PissinouSEMOPSTD94,Towards an Infrastructure for Temporal Databases: Report of an Invitational ARPA/NSF Workshop,,,1994
70536,conf/sigmod/FegarasSRM00,lambda-DB: An ODMG-Based Object-Oriented DBMS,"L Fegaras, C Srinivasan, A Rajendran, D Maier",SIGMOD Conference,2000
70538,conf/sigmod/RundensteinerCCSO00,SERFing the Web: Web Site Management Made Easy,"E Rundensteiner, K Claypool, L Chen, H Su, K Oenoki",SIGMOD Conference,2000
70542,journals/tods/MelnikG03,Adaptive algorithms for set containment joins,"S Melnik, H Garcia-Molina",ACM Trans. Database Syst.,2003
70545,journals/tods/CiacciaP02,Searching in metric spaces with user-defined and approximate distances,"P Ciaccia, M Patella",ACM Trans. Database Syst.,2002
70548,journals/tods/GibbonsMP02,Fast incremental maintenance of approximate histograms,"P Gibbons, Y Matias, V Poosala",ACM Trans. Database Syst.,2002
70551,conf/sigmod/AggarwalWY99,A New Method for Similarity Indexing of Market Basket Data,"C Aggarwal, J Wolf, P Yu",SIGMOD Conference,1999
70552,journals/tods/ChakrabartiKMP02,Locally adaptive dimensionality reduction for indexing large time series databases,"K Chakrabarti, E Keogh, S Mehrotra, M Pazzani",ACM Trans. Database Syst.,2002
70554,conf/sigmod/KotidisR99,DynaMat: A Dynamic View Management System for Data Warehouses,"Y Kotidis, N Roussopoulos",SIGMOD Conference,1999
70557,conf/sigmod/VitterW99,Approximate Computation of Multidimensional Aggregates of Sparse Data Using Wavelets,"J Vitter, M Wang",SIGMOD Conference,1999
70559,conf/sigmod/IvesFFLW99,An Adaptive Query Execution System for Data Integration,"Z Ives, D Florescu, M Friedman, A Levy, D Weld",SIGMOD Conference,1999
70560,journals/tods/TaoP03,Spatial queries in dynamic environments,"Y Tao, D Papadias",ACM Trans. Database Syst.,2003
70568,conf/sigmod/GehrkeGRL99,BOAT-Optimistic Decision Tree Construction,"J Gehrke, V Ganti, R Ramakrishnan, W Loh",SIGMOD Conference,1999
70571,journals/sigmod/Segev94a,Editor's Notes,A Segev,SIGMOD Record,1994
70575,conf/sigmod/RundensteinerKZWLLN99,Evolvable View Environment (EVE): Non-Equivalent View Maintenance under Schema Changes,"E Rundensteiner, A Koeller, X Zhang, A Wyk, Y Li, A Lee, A Nica",SIGMOD Conference,1999
70576,journals/sigmod/Qian94a,"Announcements from NSF, NASA, and Elsewhere",X Qian,SIGMOD Record,1994
70579,journals/sigmod/Datta94,Research Issues in Databases for ARCS: Active Rapidly Changing Data Systems,A Datta,SIGMOD Record,1994
70580,conf/sigmod/WolfsonSXZC99,DOMINO: Databases fOr MovINg Objects tracking,"O Wolfson, A Sistla, B Xu, J Zhou, S Chamberlain",SIGMOD Conference,1999
70582,journals/sigmod/Klein94,How to Modify SQL Queries in Order to Guarantee Sure Answers,H Klein,SIGMOD Record,1994
70583,journals/sigmod/Chen94,Database Research at NTHU and ITRI,A Chen,SIGMOD Record,1994
70585,journals/sigmod/Group94,"Response to the March 1994 ODMG-93 Commentary Written by Dr. Won Kim of UniSQL, Inc",O Group,SIGMOD Record,1994
70587,conf/sigmod/Greer99,Daytona And The Fourth-Generation Language Cymbal,R Greer,SIGMOD Conference,1999
70590,conf/sigmod/TrisoliniLN99,Data Integration and Warehousing in Telecom Italia,"S Trisolini, M Lenzerini, D Nardi",SIGMOD Conference,1999
70591,journals/sigmod/AndersonS94,SEQUOIA 2000 Metadata Schema for Satellite Images,"J Anderson, M Stonebraker",SIGMOD Record,1994
70592,conf/sigmod/BaulierBGGHJKKMMNNRSSSWW99,DataBlitz Storage Manager: Main Memory Database Performance for Critical Applications,"J Baulier, P Bohannon, S Gogate, C Gupta, S Haldar, S Joshi, A Khivesera, H Korth, P McIlroy, J Miller, P Narayan, M Nemeth, R Rastogi, S Seshadri, A Silberschatz, S Sudarshan, M Wilder, C Wei",SIGMOD Conference,1999
70593,journals/sigmod/GroskyFS94,Using Metadata for the Intelligent Browsing of Structured Media Objects,"W Grosky, F Fotouhi, I Sethi",SIGMOD Record,1994
70595,journals/sigmod/Alonso94b,Trade Press News - Announcement and Preface,,,1994
70598,journals/sigmod/Rosneblatt94,Unix RDBMS: The Next Generation,B Rosneblatt,SIGMOD Record,1994
70599,journals/sigmod/BarclayBGS94,Loading Databases Using Dataflow Parallelism,"T Barclay, R Barnes, J Gray, P Sundaresan",SIGMOD Record,1994
70600,conf/sigmod/Ozsu99,Data Management Issues in Electronic Commerce (Panel),M Özsu,SIGMOD Conference,1999
70603,conf/sigmod/FlorescuLMS99,Query Optimization in the Presence of Limited Access Patterns,"D Florescu, A Levy, I Manolescu, D Suciu",SIGMOD Conference,1999
70605,conf/sigmod/HaasH99,Ripple Joins for Online Aggregation,"P Haas, J Hellerstein",SIGMOD Conference,1999
70606,journals/sigmod/GeppertD94,Constructing the Next 100 Database Management Systems,"A Geppert, K Dittrich",SIGMOD Record,1994
70611,conf/sigmod/MankuRL99,Random Sampling Techniques for Space Efficient Online Computation of Order Statistics of Large Datasets,"G Manku, S Rajagopalan, B Lindsay",SIGMOD Conference,1999
70613,journals/sigmod/Stonebraker94,In Memory of Bob Kooi (1951-1993),,,1994
70614,conf/sigmod/Wu99,Query Optimization for Selections Using Bitmaps,M Wu,SIGMOD Conference,1999
70615,conf/sigmod/LeeKC99,Multi-dimensional Selectivity Estimation Using Compressed Histogram Information,"J Lee, D Kim, C Chung",SIGMOD Conference,1999
70616,journals/sigmod/MedeirosP94,Databases for GIS,"C Medeiros, F Pires",SIGMOD Record,1994
70618,journals/sigmod/BunemanLSTW94,Comprehension Syntax,"P Buneman, L Libkin, D Suciu, V Tannen, L Wong",SIGMOD Record,1994
70624,conf/sigmod/JagadishLMSV99,Querying Network Directories,"H Jagadish, L Lakshmanan, T Milo, D Srivastava, D Vista",SIGMOD Conference,1999
70625,journals/sigmod/YeungHL94,Performance Evaluation of a New Distributed Deadlock Detection Algorithm,"C Yeung, S Hung, K Lam",SIGMOD Record,1994
70627,conf/sigmod/LometT99,Logical Logging to Extend Recovery to New Domains,"D Lomet, M Tuttle",SIGMOD Conference,1999
70628,journals/sigmod/X94a,Calls for Papers / Announcements,,SIGMOD Record,1994
70629,journals/sigmod/Qian94,Jumping on the NII Bandwagon,X Qian,SIGMOD Record,1994
70632,conf/sigmod/JagadishLS99,Snakes and Sandwiches: Optimal Clustering Strategies for a Data Warehouse,"H Jagadish, L Lakshmanan, D Srivastava",SIGMOD Conference,1999
70633,conf/sigmod/AcharyaPR99,Selectivity Estimation in Spatial Databases,"S Acharya, V Poosala, S Ramaswamy",SIGMOD Conference,1999
70634,journals/sigmod/RamirezSP94,Medical Information Systems: Characterization and Challenges,"J Ramirez, L Smith, L Peterson",SIGMOD Record,1994
70635,conf/sigmod/Team99,In-Memory Data Management for Consumer Transactions The Times-Ten Approach,T Team,SIGMOD Conference,1999
70636,conf/vldb/AgrawalSX01,Storage and Querying of E-Commerce Data,"R Agrawal, A Somani, Y Xu",VLDB,2001
70638,conf/sigmod/Ojjeh99,Microsoft Site Server (Commerce Edition),B Ojjeh,SIGMOD Conference,1999
70639,conf/sigmod/Rajaraman99,E-Commerce Database Issues and Experience,A Rajaraman,SIGMOD Conference,1999
70642,conf/vldb/SakuraiYKU01,Similarity Search for Adaptive Ellipsoid Queries Using Spatial Transformation,"Y Sakurai, M Yoshikawa, R Kataoka, S Uemura",VLDB,2001
70646,conf/sigmod/JarkeQBLMS99,Improving OLTP Data Quality Using Data Warehouse Mechanisms,"M Jarke, C Quix, G Blees, D Lehmann, G Michalk, S Striel",SIGMOD Conference,1999
70647,conf/vldb/MeccaCM01,RoadRunner: Towards Automatic Data Extraction from Large Web Sites,"V Crescenzi, G Mecca, P Merialdo",VLDB,2001
70648,conf/sigmod/AdelbergD99,Nodose Version 2.0,"B Adelberg, M Denny",SIGMOD Conference,1999
70651,conf/sigmod/LiVCAHMWBCHIKSS99,"PowerBookmarks: A System for Personalizable Web Information Organization, Sharing, and Management","W Li, Q Vu, E Chang, D Agrawal, K Hirata, S Mukherjea, Y Wu, C Bufi, K Chang, Y Hara, R Ito, Y Kimura, K Shimazu, Y Saito",SIGMOD Conference,1999
70654,conf/sigmod/RundensteinerCLCZNJLW99,SERF: ODMG-Based Generic Re-structuring Facility,"E Rundensteiner, K Claypool, M Li, L Chen, X Zhang, C Natarajan, J Jin, S Lima, S Weiner",SIGMOD Conference,1999
70658,conf/sigmod/AcharyaGPR99,The Aqua Approximate Query Answering System,"S Acharya, P Gibbons, V Poosala, S Ramaswamy",SIGMOD Conference,1999
70662,conf/sigmod/BonnetBCCCHKMMOSS99,The Cornell Jaguar System: Adding Mobility to PREDATOR,"P Bonnet, K Buza, Z Chen, V Cheng, R Chung, T Hickey, R Kennedy, D Mahashin, T Mayr, I Oprencak, P Seshadri, H Siu",SIGMOD Conference,1999
70665,conf/vldb/NatsevCSLV01,Supporting Incremental Join Queries on Ranked Inputs,"A Natsev, Y Chang, J Smith, C Li, J Vitter",VLDB,2001
70666,conf/sigmod/BohlenBD99,The Jungle Database Search Engine,"M Böhlen, L Bukauskas, C Dyreson",SIGMOD Conference,1999
70668,conf/vldb/SundaraHCAS01,Developing an Indexing Scheme for XML Document Collection using the Oracle8i Extensibility Framework,"S Sundara, Y Hu, T Chorma, N Agarwal, J Srinivasan",VLDB,2001
70671,conf/sigmod/NatsevRS99,WALRUS: A Similarity Retrieval Algorithm for Image Databases,"A Natsev, R Rastogi, K Shim",SIGMOD Conference,1999
70678,conf/sigmod/DeutschFS99,Storing Semistructured Data with STORED,"A Deutsch, M Fernandez, D Suciu",SIGMOD Conference,1999
70679,conf/vldb/ZengBNN01,AgFlow: Agent-based Cross-Enterprise Workflow Management System,"L Zeng, B Benatallah, P Nguyen, A Ngu",VLDB,2001
70682,conf/sigmod/EmbleyJN99,Record-Boundary Discovery in Web Documents,"D Embley, Y Jiang, Y Ng",SIGMOD Conference,1999
70683,conf/vldb/StillgerLMK01,LEO - DB2's LEarning Optimizer,"M Stillger, G Lohman, V Markl, M Kandil",VLDB,2001
70690,conf/vldb/AndreiV01,User-Optimizer Communication using Abstract Plans in Sybase ASE,"M Andrei, P Valduriez",VLDB,2001
70694,conf/vldb/PatonG01,Information Management for Genome Level Bioinformatics,,,2001
70696,conf/vldb/Sol01,"Ambient Intelligence with the Ubiquitous Network, the Embedded Computer Devices and the Hidden Databases (abstract)",E Sol,VLDB,2001
70699,conf/vldb/MignetMAC01,Change-Centric Management of Versions in an XML Warehouse,"A Marian, S Abiteboul, G Cobena, L Mignet",VLDB,2001
70700,conf/sigmod/AdaliBSS98,A Multi-Similarity Algebra,"S Adali, P Bonatti, M Sapino, V Subrahmanian",SIGMOD Conference,1998
70701,conf/sigmod/FernandezFKLS98,Catching the Boat with Strudel: Experiences with a Web-Site Management System,"M Fernandez, D Florescu, J Kang, A Levy, D Suciu",SIGMOD Conference,1998
70702,conf/vldb/AboulnagaAN01,Estimating the Selectivity of XML Path Expressions for Internet Scale Applications,"A Aboulnaga, A Alameldeen, J Naughton",VLDB,2001
70703,conf/vldb/YangG01,Comparing Hybrid Peer-to-Peer Systems,"B Yang, H Garcia-Molina",VLDB,2001
70706,conf/sigmod/ChaudhuriN98,AutoAdmin 'What-if' Index Analysis Utility,"S Chaudhuri, V Narasayya",SIGMOD Conference,1998
70707,conf/vldb/ChungCLL01,Dynamic Update Cube for Range-sum Queries,"S Chun, C Chung, J Lee, S Lee",VLDB,2001
70708,conf/sigmod/Stonebraker98,Are We Working On the Right Problems? (Panel),M Stonebraker,SIGMOD Conference,1998
70709,conf/vldb/Gibbons01,Distinct Sampling for Highly-Accurate Answers to Distinct Values Queries and Event Reports,P Gibbons,VLDB,2001
70710,conf/sigmod/AdamY98,Electronic Commerce: Tutorial,"N Adam, Y Yesha",SIGMOD Conference,1998
70711,conf/sigmod/RajagopalanML98,Approximate Medians and other Quantiles in One Pass and with Limited Memory,"G Manku, S Rajagopalan, B Lindsay",SIGMOD Conference,1998
70713,conf/sigmod/LometW98,Efficient and Transparent Application Recovery in Client-Server Information Systems,"D Lomet, G Weikum",SIGMOD Conference,1998
70714,conf/vldb/UrhanF01,Dynamic Pipeline Scheduling for Improving Interactive Query Performance,"T Urhan, M Franklin",VLDB,2001
70717,conf/sigmod/FranklinZ98,Data In Your Face: Push Technology in Perspective,"M Franklin, S Zdonik",SIGMOD Conference,1998
70718,conf/vldb/LahiriSCMC01,Cache Fusion: Extending Shared-Disk Clusters with Shared Caches,"T Lahiri, V Srihari, W Chan, N MacNaughton, S Chandrasekaran",VLDB,2001
70719,conf/sigmod/BerchtoldK98,"High-Dimensional Index Structures, Database Support for Next Decade's Applications (Tutorial)","S Berchtold, D Keim",SIGMOD Conference,1998
70721,conf/vldb/SadriZZA01,A Sequential Pattern Query Language for Supporting Instant Data Mining for e-Services,"R Sadri, C Zaniolo, A Zarkesh, J Adibi",VLDB,2001
70723,conf/sigmod/Whelan98,FileNet Integrated Document Management Database Usage and Issues,D Whelan,SIGMOD Conference,1998
70724,conf/vldb/Novaretti01,French government activity in the conservation of data and electronic documents,S Novaretti,VLDB,2001
70725,conf/vldb/Draluk01,Discovering Web Services: An Overview,V Draluk,VLDB,2001
70727,conf/sigmod/LahiriJJC98,"50,000 Users on an Oracle8 Universal Server Database","T Lahiri, A Josji, A Jasuja, S Chatterjee",SIGMOD Conference,1998
70729,conf/sigmod/Aulakh98,About Quark Digital Media System,K Aulakh,SIGMOD Conference,1998
70732,conf/vldb/ChienTZ01,Efficient Management of Multiversion Documents by Object Referencing,"S Chien, V Tsotras, C Zaniolo",VLDB,2001
70735,conf/sigmod/BouguettayaBH99,"World Wide Database - Integrating the Web, CORBA, and Databases","A Bouguettaya, B Benatallah, L Hendra, J Beard, K Smith, M Ouzzani",SIGMOD Conference,1999
70736,conf/vldb/OzsuLON01,An Extendible Hash for Multi-Precision Similarity Querying of Image Databases,"S Lin, M Özsu, V Oria, R Ng",VLDB,2001
70737,conf/vldb/BohmMSW01,Fast Evaluation Techniques for Complex Similarity Queries,"K Böhm, M Mlivoncic, H Schek, R Weber",VLDB,2001
70747,conf/sigmod/KotidisR98,An Alternative Storage Organization for ROLAP Aggregate Views Based on Cubetrees,"Y Kotidis, N Roussopoulos",SIGMOD Conference,1998
70748,conf/vldb/Kotidis01,A Data Warehousing Architecture for Enabling Service Provisioning Process,Y Kotidis,VLDB,2001
70749,conf/sigmod/KanthAS98,Dimensionality Reduction for Similarity Searching in Dynamic Databases,"K Kanth, D Agrawal, A Singh",SIGMOD Conference,1998
70755,conf/sigmod/SubramanianV98,Cost-Based Optimization of Decision Support Queries Using Transient Views,"S Subramanian, S Venkataraman",SIGMOD Conference,1998
70756,conf/vldb/KahveciS01,Efficient Index Structures for String Databases,"T Kahveci, A Singh",VLDB,2001
70760,conf/vldb/ManolopoulosT01,C2P: Clustering based on Closest Pairs,"A Nanopoulos, Y Theodoridis, Y Manolopoulos",VLDB,2001
70764,conf/sigmod/GrumbachRS98,The DEDALE System for Complex Spatial Queries,"S Grumbach, P Rigaux, L Segoufin",SIGMOD Conference,1998
70767,conf/sigmod/HjaltasonS98,Incremental Distance Join Algorithms for Spatial Databases,"G Hjaltason, H Samet",SIGMOD Conference,1998
70774,conf/vldb/PappasC00,Design and Development of a Stream Service in a Heterogenous Client Environment,"N Pappas, S Christodoulakis",VLDB,2000
70776,conf/sigmod/Miller98,Using Schematically Heterogeneous Structures,R Miller,SIGMOD Conference,1998
70777,conf/vldb/DuttaDMRT00,Demonstration: Enabling Scalable Online Personalization on the Web,"K Dutta, A Datta, D VanderMeer, K Ramamritham, H Thomas",VLDB,2000
70778,conf/sigmod/Cohen98,Integration of Heterogeneous Databases Without Common Domains Using Queries Based on Textual Similarity,W Cohen,SIGMOD Conference,1998
70779,conf/sigmod/GodfreySE98,Secure and Portable Database Extensibility,"M Godfrey, T Mayr, P Seshadri, T Eicken",SIGMOD Conference,1998
70783,conf/sigmod/MatiasVW98,Wavelet-Based Histograms for Selectivity Estimation,"Y Matias, J Vitter, M Wang",SIGMOD Conference,1998
70784,conf/vldb/HvasshovdBT00,An Ultra Highly Available DBMS,"S Hvasshovd, S Bratsberg, Ř Torbjřrnsen",VLDB,2000
70785,conf/vldb/Nori00,Asera: Extranet Architecture for B2B Solutions,A Nori,VLDB,2000
70787,conf/sigmod/Adelberg98,NoDoSE - A Tool for Semi-Automatically Extracting Semi-Structured Data from Text Documents,B Adelberg,SIGMOD Conference,1998
70788,conf/vldb/MohanBWSZ00,Evolution of Groupware for Business Applications: A Database Perspective on Lotus Domino/Notes,"C Mohan, R Barber, S Watts, A Somani, M Zaharioudakis",VLDB,2000
70793,conf/sigmod/JaedickeM98,On Parallel Processing of Aggregate and Scalar Functions in Object-Relational DBMS,"M Jaedicke, B Mitschang",SIGMOD Conference,1998
70794,conf/vldb/Tsur00,Data Mining in the Bioinformatics Domain,S Tsur,VLDB,2000
70795,conf/sigmod/AvnurHLORRRW98,CONTROL: Continuous Output and Navigation Technology with Refinement On-Line,"R Avnur, J Hellerstein, B Lo, C Olston, B Raman, V Raman, T Roth, K Wylie",SIGMOD Conference,1998
70798,conf/sigmod/AmbiteABKMMMPT98,ARIADNE: A System for Constructing Mediators for Internet Sources,"J Ambite, N Ashish, G Barish, C Knoblock, S Minton, P Modi, I Muslea, A Philpot, S Tejada",SIGMOD Conference,1998
70799,conf/vldb/ShanmugasundaramSBCLPR00,Efficiently Publishing Relational Data as XML Documents,"J Shanmugasundaram, E Shekita, R Barr, M Carey, B Lindsay, H Pirahesh, B Reinwald",VLDB,2000
70802,conf/sigmod/KornackerSH98,amdb: An Access Method Debugging Tool,"M Kornacker, M Shah, J Hellerstein",SIGMOD Conference,1998
70803,conf/vldb/ChakrabartiGRS00,Approximate Query Processing Using Wavelets,"K Chakrabarti, M Garofalakis, R Rastogi, K Shim",VLDB,2000
70804,conf/sigmod/LiS98,Free Parallel Data Mining,"B Li, D Shasha",SIGMOD Conference,1998
70805,conf/vldb/MatiasVW00,Dynamic Maintenance of Wavelet-Based Histograms,"Y Matias, J Vitter, M Wang",VLDB,2000
70806,conf/sigmod/Brewer98,Delivering High Availability for Inktomi Search Engines,E Brewer,SIGMOD Conference,1998
70812,conf/vldb/PardonA00,CheeTah: a Lightweight Transaction Server for Plug-and-Play Internet Data Management,"G Pardon, G Alonso",VLDB,2000
70817,conf/sigmod/JonssonFS98,Interaction of Query Evaluation and Buffer Management for Information Retrieval,"B Jónsson, M Franklin, D Srivastava",SIGMOD Conference,1998
70818,conf/vldb/LingLL00,Hierarchical Compact Cube for Range-Max Queries,"S Lee, T Ling, H Li",VLDB,2000
70819,conf/vldb/YiF00,Fast Time Sequence Indexing for Arbitrary Lp Norms,"B Yi, C Faloutsos",VLDB,2000
70820,conf/sigmod/LiYVGPUV98,Capability Based Mediation in TSIMMIS,"C Li, R Yerneni, V Vassalos, H Garcia-Molina, Y Papakonstantinou, J Ullman, M Valiveti",SIGMOD Conference,1998
70822,conf/vldb/LuL00,Decision Tables: Scalable Classification Exploring RDBMS Capabilities,"H Lu, H Liu",VLDB,2000
70825,conf/sigmod/TsurUACMNR98,Query Flocks: A Generalization of Association-Rule Mining,"S Tsur, J Ullman, S Abiteboul, C Clifton, R Motwani, S Nestorov, A Rosenthal",SIGMOD Conference,1998
70826,conf/vldb/GoldsteinR00,Contrast Plots and P-Sphere Trees: Space vs. Time in Nearest Neighbour Searches,"J Goldstein, R Ramakrishnan",VLDB,2000
70827,conf/vldb/CareyKRLABFLOPQRSSUVWY01,The Propel Distributed Services Platform,"M Carey, S Kirsch, M Roth, B Linden, N Adiba, M Blow, D Florescu, D Li, I Oprencak, R Panwar, R Qi, D Rieber, J Shafer, B Sterling, T Urhan, B Vickery, D Wineman, K Yee",VLDB,2001
70829,conf/sigmod/Toyama98,SuperSQL: An Extended SQL for Database Publishing and Presentation,M Toyama,SIGMOD Conference,1998
70830,conf/vldb/NarayananS01,Tavant System Architecture for Sell-side Channel Management,"S Narayanan, S Subramanian",VLDB,2001
70831,conf/vldb/AbrolLMMMRTWZ01,Navigating large-scale semi-structured data in business portals,"M Abrol, N Latarche, U Mahadevan, J Mao, R Mukherjee, P Raghavan, M Tourn, J Wang, G Zhang",VLDB,2001
70832,conf/sigmod/BaumannDFRW98,The Multidimensional Database System RasDaMan,"P Baumann, A Dehmel, P Furtado, R Ritsch, N Widmann",SIGMOD Conference,1998
