tid,id,title,authors,venue,year
71213,conf/vldb/RamanRH99,Online Dynamic Reordering for Interactive Data Processing,"V Raman, B Raman, J Hellerstein",VLDB,1999
71214,conf/sigmod/WhiteD95,Implementing Crash Recovery in QuickStore: A Performance Study,"S White, D DeWitt",SIGMOD Conference,1995
71215,conf/vldb/ZirintsisKM99,Hyper-Programming in Java,"E Zirintsis, G Kirby, R Morrison",VLDB,1999
71216,conf/sigmod/DuSD95,Reducing Multidatabase Query Response Time by Tree Balancing,"W Du, M Shan, U Dayal",SIGMOD Conference,1995
71217,conf/vldb/Dayal99,"Industrial Panel on Data Warehousing Technologies: Experiences, Challenges, and Directions",U Dayal,VLDB,1999
71218,conf/sigmod/SistlaW95,Temporal Conditions and Integrity Constraints in Active Database Systems,"A Sistla, O Wolfson",SIGMOD Conference,1995
71219,conf/vldb/HoskingC99,"PM3: An Orthogonal Persistent Systems Programming Language - Design, Implementation, Performance","A Hosking, J Chen",VLDB,1999
71220,conf/sigmod/ZhugeGHW95,View Maintenance in a Warehousing Environment,"Y Zhuge, H Garcia-Molina, J Hammer, J Widom",SIGMOD Conference,1995
71222,conf/sigmod/BhargavaGI95,Hypergraph Based Reorderings of Outer Join Queries with Complex Predicates,"G Bhargava, P Goel, B Iyer",SIGMOD Conference,1995
71225,conf/vldb/FlorescuLSY99,Optimization of Run-time Management of Data Intensive Web-sites,"D Florescu, A Levy, D Suciu, K Yagoub",VLDB,1999
71226,conf/sigmod/GriffinL95,Incremental Maintenance of Views with Duplicates,"T Griffin, L Libkin",SIGMOD Conference,1995
71227,conf/sigmod/ChaudhuriDY95,Join Queries with External Text Sources: Execution and Optimization Techniques,"S Chaudhuri, U Dayal, T Yan",SIGMOD Conference,1995
71228,conf/vldb/MengLYWCR98,Determining Text Databases to Search in the Internet,"W Meng, K Liu, C Yu, X Wang, Y Chang, N Rishe",VLDB,1998
71230,conf/vldb/Tygar98,Atomicity versus Anonymity: Distributed Transactions for Electronic Commerce,J Tygar,VLDB,1998
71235,conf/sigmod/BunemanM95,The Data That You Won't Find in Databases: Tutorial panel on data exchange formats,"P Buneman, D Maier",SIGMOD Conference,1995
71239,conf/vldb/VriesDBA99,The Mirror MMDBMS Architecture,"A Vries, M Doorn, H Blanken, P Apers",VLDB,1999
71241,conf/vldb/BouganimCDDGS99,Miro Web: Integrating Multiple Data Sources through Semistructured Data Types,"L Bouganim, T Chan-Sine-Ying, T Dang-Ngoc, J Darroux, G Gardarin, F Sha",VLDB,1999
71242,conf/sigmod/Gray95,Parallel Database Systems 101,J Gray,SIGMOD Conference,1995
71243,conf/vldb/GibsonKR98,Clustering Categorical Data: An Approach Based on Dynamical Systems,"D Gibson, J Kleinberg, P Raghavan",VLDB,1998
71245,conf/sigmod/Golding95,Things Every Update Replication Customer Should Know,R Golding,SIGMOD Conference,1995
71246,conf/vldb/OoiGT98,Fast High-Dimensional Data Search in Incomplete Databases,"B Ooi, C Goh, K Tan",VLDB,1998
71249,conf/sigmod/Edelstein95,Research and Products: Are They Relevant To Each Other? (Panel),H Edelstein,SIGMOD Conference,1995
71251,conf/sigmod/Bampahl95,Real World Requirements for Decision Support - Implications for RDBMS,S Bansal,SIGMOD Conference,1995
71252,conf/vldb/Ganguly98,Design and Analysis of Parametric Query Optimization Algorithms,S Ganguly,VLDB,1998
71254,conf/sigmod/French95,``One Size Fits All'' Database Architectures Do Not Work for DDS,C French,SIGMOD Conference,1995
71256,conf/sigmod/Perna95,Leveraging The Information Asset,J Perna,SIGMOD Conference,1995
71257,conf/sigmod/Atkinson95,Use of a Component Architecture in Integrating Relational and Non-relational Storage Systems,R Atkinson,SIGMOD Conference,1995
71258,conf/vldb/FangSGMU98,Computing Iceberg Queries Efficiently,"M Fang, N Shivakumar, H Garcia-Molina, R Motwani, J Ullman",VLDB,1998
71259,conf/vldb/Amer-YahiaCD98,Bulk-Loading Techniques for Object Databases and an Application to Relational Data,"S Amer-Yahia, S Cluet, C Delobel",VLDB,1998
71260,conf/sigmod/Gerber95,Informix Online XPS,R Gerber,SIGMOD Conference,1995
71262,conf/vldb/PapadiasMD98,Algorithms for Querying by Spatial Structure,"D Papadias, N Mamoulis, V Delis",VLDB,1998
71264,conf/sigmod/Deutsch95,Objects and SQL: Strange Relations? Panel,D Deutsch,SIGMOD Conference,1995
71265,conf/vldb/CarinoJ98,Bank of America Case Study: The Information Currency Advantage,"F Carińo, M Jahnke",VLDB,1998
71266,conf/sigmod/Faloutsos95,Indexing Multimedia Databases (Tutorial),,,1995
71269,conf/sigmod/Sheth95,"Workflow Automation: Applications, Technology, and Research (Tutorial)",,,1995
71271,conf/sigmod/Norrie95,Integration Approaches for CIM,,,1995
71273,conf/sigmod/Gibson95,Storage Technology: RAID and Beyond,,,1995
71277,conf/sigmod/ThomasDM95,Design and Implementation of Advanced Knowledge Processing in the KDMS KRISYS (Demonstration Description),"J Thomas, S Deßloch, N Mattos",SIGMOD Conference,1995
71281,conf/vldb/RossS97,Fast Computation of Sparse Datacubes,"K Ross, D Srivastava",VLDB,1997
71285,conf/vldb/RothS97,"Don't Scrap It, Wrap It! A Wrapper Architecture for Legacy Data Sources","M Roth, P Schwarz",VLDB,1997
71286,conf/sigmod/AshleyFHLNP95,The Query By Image Content (QBIC) System,"J Ashley, M Flickner, J Hafner, D Lee, W Niblack, D Petkovic",SIGMOD Conference,1995
71288,conf/vldb/VassalosP97,Describing and Using Query Capabilities of Heterogeneous Sources,"V Vassalos, Y Papakonstantinou",VLDB,1997
71290,conf/sigmod/CeriFPP95,The Algres Testbed of CHIMERA: An Active Object-Oriented Database System,"S Ceri, P Fraternali, S Paraboschi, G Psaila",SIGMOD Conference,1995
71291,conf/sigmod/DreyerDS95,Using the CALANDA Time Series Management System,"W Dreyer, A Dittrich, D Schmidt",SIGMOD Conference,1995
71292,conf/vldb/SkubiszewskiV97,Concurrent Garbage Collection in O2,"M Skubiszewski, P Valduriez",VLDB,1997
71293,conf/sigmod/GrossmanHQ95,PTool: A Light Weight Persistent Object Manager,"R Grossman, D Hanley, X Qin",SIGMOD Conference,1995
71294,conf/vldb/AlsabtiRS97,A One-Pass Algorithm for Accurately Estimating Quantiles for Disk-Resident Data,"K Alsabti, S Ranka, V Singh",VLDB,1997
71295,conf/vldb/EicklerKK97,Finding Data in the Neighborhood,"A Eickler, A Kemper, D Kossmann",VLDB,1997
71297,conf/vldb/StathatosRB97,Adaptive Data Broadcast in Hybrid Networks,"K Stathatos, N Roussopoulos, J Baras",VLDB,1997
71301,conf/vldb/HelmerM97,Evaluation of Main Memory Join Algorithms for Joins with Set Comparison Join Predicates,"S Helmer, G Moerkotte",VLDB,1997
71302,conf/sigmod/LiC95,Semint: A System Prototype for Semantic Integration in Heterogeneous Databases,"W Li, C Clifton",SIGMOD Conference,1995
71305,conf/vldb/AshwinRSSS97,Garbage Collection in Object Oriented Databases Using Transactional Cyclic Reference Counting,"S Ashwin, P Roy, S Seshadri, A Silberschatz, S Sudarshan",VLDB,1997
71308,conf/vldb/GibbonsMP97,Fast Incremental Maintenance of Approximate Histograms,"P Gibbons, Y Matias, V Poosala",VLDB,1997
71311,conf/vldb/LeeLWS97,A Region Splitting Strategy for Physical Database Design of Multidimensional File Organizations,"J Lee, Y Lee, K Whang, I Song",VLDB,1997
71312,conf/sigmod/MohanN94,ARIES/CSA: A Method for Database Recovery in Client-Server Architectures,"C Mohan, I Narang",SIGMOD Conference,1994
71313,conf/sigmod/ZhangNBB94,Ensuring Relaxed Atomicity for Flexible Transactions in Multidatabase Systems,"A Zhang, M Nodine, B Bhargava, O Bukhres",SIGMOD Conference,1994
71315,conf/sigmod/ImielinskiVB94,Energy Efficient Indexing on Air,"T Imielinski, S Viswanathan, B Badrinath",SIGMOD Conference,1994
71316,conf/vldb/BaumannFRW97,Geo/Environmental and Medical Data Management in the RasDaMan System,"P Baumann, P Furtado, R Ritsch, N Widmann",VLDB,1997
71317,conf/sigmod/BilirisDGJR94,ASSET: A System for Supporting Extended Transactions,"A Biliris, S Dar, N Gehani, H Jagadish, K Ramamritham",SIGMOD Conference,1994
71318,conf/vldb/WhiteheadSM97,GTE SuperPages: Using IR Techniques for Searching Complex Objects,"S Whitehead, H Sinha, M Murphy",VLDB,1997
71321,conf/sigmod/HuangSW94,Data Replication for Mobile Computers,"Y Huang, A Sistla, O Wolfson",SIGMOD Conference,1994
71322,conf/vldb/SeidlK97,Efficient User-Adaptable Similarity Search in Large Multimedia Databases,"T Seidl, H Kriegel",VLDB,1997
71326,conf/vldb/KumarKA97,Caprera: An Activity Framework for Transaction Processing on Wide-Area Networks,"S Kumar, E Kwang, D Agrawal",VLDB,1997
71327,conf/sigmod/KrollW94,Distributing a Search Tree Among a Growing Number of Processors,"B Kröll, P Widmayer",SIGMOD Conference,1994
71328,conf/vldb/GinisHKMT97,Data Manager for Evolvable Real-time Command and Control Systems,"E Hughes, R Ginis, B Thuraisingham, P Krupp, J Maurer",VLDB,1997
71330,conf/sigmod/ChristophidesACS94,From Structured Documents to Novel Query Facilities,"V Christophides, S Abiteboul, S Cluet, M Scholl",SIGMOD Conference,1994
71331,conf/sigmod/NybergBCGL94,AlphaSort: A RISC Machine Sort,"C Nyberg, T Barclay, Z Cvetanovic, J Gray, D Lomet",SIGMOD Conference,1994
71332,conf/vldb/BernsteinHSSZ97,The Microsoft Repository,"P Bernstein, B Harry, P Sanders, D Shutt, J Zander",VLDB,1997
71338,conf/sigmod/SwamiS94,Estimating Page Fetches for Index Scans with Finite LRU Buffers,"A Swami, K Schiefer",SIGMOD Conference,1994
71339,conf/vldb/RastogiS98,PUBLIC: A Decision Tree Classifier that Integrates Building and Pruning,"R Rastogi, K Shim",VLDB,1998
71341,conf/sigmod/BilirisP94,EOS: An Extensible Object Store,"A Biliris, E Panagos",SIGMOD Conference,1994
71342,conf/vldb/RamaswamyMS98,On the Discovery of Interesting Patterns in Association Rules,"S Ramaswamy, S Mahajan, A Silberschatz",VLDB,1998
71343,conf/vldb/SheikholeslamiCZ98,WaveCluster: A Multi-Resolution Clustering Approach for Very Large Spatial Databases,"G Sheikholeslami, S Chatterjee, A Zhang",VLDB,1998
71345,conf/sigmod/Mohan94,A Survey and Critique of Advanced Transaction Models,C Mohan,SIGMOD Conference,1994
71346,conf/vldb/GehrkeRG98,RainForest - A Framework for Fast Decision Tree Construction of Large Datasets,"J Gehrke, R Ramakrishnan, V Ganti",VLDB,1998
71347,conf/sigmod/Dietterich94,DEC Data Distributor: for Data Replication and Data Warehousing,D Dietterich,SIGMOD Conference,1994
71348,conf/vldb/Moerkotte98,Small Materialized Aggregates: A Light Weight Index Structure for Data Warehousing,G Moerkotte,VLDB,1998
71349,conf/vldb/GeorgeH98,Secure Buffering in Firm Real-Time Database Systems,"B George, J Haritsa",VLDB,1998
71351,conf/vldb/ZouS98,Safely and Efficiently Updating References During On-line Reorganization,"C Zou, B Salzberg",VLDB,1998
71352,conf/sigmod/Vaskevitch94,Database in Crisis and Transition: A Technical Agenda for the Year 2001,D Vaskevitch,SIGMOD Conference,1994
71353,conf/sigmod/Martin94,COSS: The Common Object Services Specifications,B Martin,SIGMOD Conference,1994
71355,conf/sigmod/GravanoGT94,The Effectiveness of GlOSS for the Text Database Discovery Problem,"L Gravano, H Garcia-Molina, A Tomasic",SIGMOD Conference,1994
71356,conf/vldb/KornLKF98,"Ratio Rules: A New Paradigm for Fast, Quantifiable Data Mining","F Korn, A Labrinidis, Y Kotidis, C Faloutsos",VLDB,1998
71357,conf/sigmod/MumickP94,Implementation of Magic-sets in a Relational Database System,"I Mumick, H Pirahesh",SIGMOD Conference,1994
71358,conf/vldb/ArgePRSV98,Scalable Sweeping-Based Spatial Join,"L Arge, O Procopiuc, S Ramaswamy, T Suel, J Vitter",VLDB,1998
71359,conf/vldb/ChakrabartiSD98,Mining Surprising Patterns Using Temporal Description Length,"S Chakrabarti, S Sarawagi, B Dom",VLDB,1998
71360,conf/sigmod/ColeG94,Optimization of Dynamic Query Evaluation Plans,"R Cole, G Graefe",SIGMOD Conference,1994
71361,conf/sigmod/IoannidisL94,Incomplete Path Expressions and their Disambiguation,"Y Ioannidis, Y Lashkari",SIGMOD Conference,1994
71363,conf/sigmod/BarbaraI94,Sleepers and Workaholics: Caching Strategies in Mobile Environments,"D Barbará, T Imielinski",SIGMOD Conference,1994
71365,conf/sigmod/Ballinger94,Evolving Teradata Decision Support for Massively Parallel Processing with UNIX,C Ballinger,SIGMOD Conference,1994
71367,conf/vldb/DoDJJR98,Issues in Developing Very Large Data Warehouses,"L Do, P Drew, W Jin, V Jumani, D Rossum",VLDB,1998
71369,conf/sigmod/Ahn94,Database Issues in Telecommunications Network Management,I Ahn,SIGMOD Conference,1994
71372,conf/sigmod/GraySEBW94,Quickly Generating Billion-Record Synthetic Databases,"J Gray, P Sundaresan, S Englert, K Baclawski, P Weinberger",SIGMOD Conference,1994
71373,conf/vldb/FankhauserGLMT98,Experiences in Federated Databases: From IRO-DB to MIRO-Web,"P Fankhauser, G Gardarin, M Lopez, J Muńoz, A Tomasic",VLDB,1998
71377,conf/vldb/ArunJ98,KODA - The Architecture And Interface of a Data Model Independent Kernel,"G Arun, A Joshi",VLDB,1998
71378,conf/sigmod/ConsensM94,Optimizing Queries on Files,"M Consens, T Milo",SIGMOD Conference,1994
71380,conf/vldb/Schoning98,The ADABAS Buffer Pool Manager,H Schöning,VLDB,1998
71385,conf/sigmod/PangCL94,Managing Memory for Real-Time Queries,"H Pang, M Carey, M Livny",SIGMOD Conference,1994
71387,conf/vldb/Orenstein98,Starting (and Sometimes Ending) a Database Company,J Orenstein,VLDB,1998
71389,conf/vldb/RoussopoulosK98,The Cubetree Storage Organization,"N Roussopoulos, Y Kotidis",VLDB,1998
71391,conf/sigmod/McIverK94,"Self-Adaptive, On-Line Reclustering of Complex Object Data","W Jr., R King",SIGMOD Conference,1994
71395,conf/sigmod/Hellerstein94,Practical Predicate Placement,J Hellerstein,SIGMOD Conference,1994
71396,conf/vldb/Objectivity98,Objectivity Industrial Exhibit,O Objectivity,VLDB,1998
71397,conf/sigmod/KemperMPS94,Optimizing Disjunctive Queries with Expensive Predicates,"A Kemper, G Moerkotte, K Peithner, M Steinbrunn",SIGMOD Conference,1994
71400,conf/sigmod/Galindo-Legaria94,Outerjoins as Disjunctions,C Galindo-Legaria,SIGMOD Conference,1994
71402,conf/sigmod/CookWZ94,Partition Selection Policies in Object Database Garbage Collection,"J Cook, A Wolf, B Zorn",SIGMOD Conference,1994
71403,conf/vldb/GardarinGT96,Cost-based Selection of Path Expression Processing Algorithms in Object-Oriented Databases,"G Gardarin, J Gruser, Z Tang",VLDB,1996
71406,conf/sigmod/Fernandez94,Red Brick Warehouse: A Read-Mostly RDBMS for Open SMP Platforms,P Fernandez,SIGMOD Conference,1994
71407,conf/vldb/AcharyaFZ96,Disseminating Updates on Broadcast Disks,"S Acharya, M Franklin, S Zdonik",VLDB,1996
71408,conf/sigmod/Ubell94,The Montage Extensible DataBlade Achitecture,M Ubell,SIGMOD Conference,1994
71410,conf/vldb/GardarinST96,"Calibrating the Query Optimizer Cost Model of IRO-DB, an Object-Oriented Federated Database System","G Gardarin, F Sha, Z Tang",VLDB,1996
71415,conf/sigmod/Melling94,Enterprise Information Architectures -- They're Finally Changing,W Melling,SIGMOD Conference,1994
71418,conf/vldb/ViverosNR96,Applying Data Mining Techniques to a Health Insurance Information System,"M Viveros, J Nearhos, M Rothman",VLDB,1996
71419,conf/sigmod/DanielsDDEHJJLSSS94,Oracle's Symmetric Replication Technology and Implications for Application Design,"D Daniels, L Doo, A Downing, C Elsbernd, G Hallmark, S Jain, B Jenkins, P Lim, G Smith, B Souder, J Stamos",SIGMOD Conference,1994
71420,conf/vldb/BohlenSS96,Coalescing in Temporal Databases,"M Böhlen, R Snodgrass, M Soo",VLDB,1996
71425,conf/sigmod/Carey94,Parallel Database Systems in the 1990's,M Carey,SIGMOD Conference,1994
71428,conf/vldb/LabioG96,Efficient Snapshot Differential Algorithms for Data Warehousing,"W Labio, H Garcia-Molina",VLDB,1996
71429,conf/vldb/McKennaBHT96,EROC: A Toolkit for Building NEATO Query Optimizers,"W McKenna, L Burger, C Hoang, M Truong",VLDB,1996
71430,conf/sigmod/Kim94,UniSQL/X Unified Relational and Object-Oriented Database System,W Kim,SIGMOD Conference,1994
71434,conf/vldb/FaloutsosG96,Analysis of n-Dimensional Quadtrees using the Hausdorff Fractal Dimension,"C Faloutsos, V Gaede",VLDB,1996
71435,conf/vldb/SeshadriLR96,The Design and Implementation of a Sequence Database System,"P Seshadri, M Livny, R Ramakrishnan",VLDB,1996
71436,journals/sigmod/Liu03c,Editor's Notes,L Liu,SIGMOD Record,2003
71440,conf/sigmod/HwangLYMMGCSS94,The MYRIAD Federated Database Prototype,"S Hwang, E Lim, H Yang, S Musukula, K Mediratta, M Ganesh, D Clements, J Stenoien, J Srivastava",SIGMOD Conference,1994
71441,conf/vldb/ScheuermannSV96,WATCHMAN : A Data Warehouse Intelligent Cache Manager,"P Scheuermann, J Shim, R Vingralek",VLDB,1996
71445,journals/sigmod/BonnetBDL03,Bluetooth-based sensor networks,"P Bonnet, A Beaufour, M Dydensborg, M Leopold",SIGMOD Record,2003
71449,conf/vldb/Hess96,Very Large Databases in a Commercial Application Environment,K Hess,VLDB,1996
71450,journals/sigmod/Date03,Edgar F. Codd: a tribute and personal memoir,C Date,SIGMOD Record,2003
71451,conf/sigmod/TheodoulidisAACKS94,The ORES Temporal Database Management System,"B Theodoulidis, A Ait-Braham, G Andrianopoulos, J Chaudhary, G Karvelis, S Sou",SIGMOD Conference,1994
71452,conf/vldb/Malaika96,Database Management Systems and the Internet,S Malaika,VLDB,1996
71453,conf/vldb/Mohan96,DWMS: Data Warehouse Management System,N Mohan,VLDB,1996
71454,conf/sigmod/GrossmanQ94,Ptool: A Scalable Persistent Object Manager,"R Grossman, X Qin",SIGMOD Conference,1994
71458,conf/vldb/Sheth96,Bellcore's ADAPT/X Harness System for Managing Information on Internet and Intranets,A Sheth,VLDB,1996
71459,conf/vldb/Klots96,Cache Coherency in Oracle Parallel Server,B Klots,VLDB,1996
71460,conf/sigmod/CatarciS94,Query by Diagram: A Graphical Environment for Querying Databases,"T Catarci, G Santucci",SIGMOD Conference,1994
71462,conf/sigmod/AgrawalCFGHIIMMSS94,Quest: A Project on Database Mining,"R Agrawal, M Carey, C Faloutsos, S Ghosh, M Houtsma, T Imielinski, B Iyer, A Mahboob, H Miranda, R Srikant, A Swami",SIGMOD Conference,1994
71465,conf/vldb/PoosalaI96,Estimation of Query-Result Distribution and its Application in Parallel-Join Load Balancing,"V Poosala, Y Ioannidis",VLDB,1996
71466,conf/sigmod/SagonasSW94a,XSB as a Deductive Database,"K Sagonas, T Swift, D Warren",SIGMOD Conference,1994
71469,journals/sigmod/GerlaX03,Multimedia streaming in large-scale sensor networks with mobile swarms,"M Gerla, K Xu",SIGMOD Record,2003
71471,journals/sigmod/CalvaneseGLV03,Reasoning on regular path queries,"D Calvanese, G Giacomo, M Lenzerini, M Vardi",SIGMOD Record,2003
71473,journals/sigmod/Winslett03c,Interview with Pat Selinger,,,2003
71474,conf/vldb/ChristodoulakisTZ97,Principles of Optimally Placing Data in Tertiary Storage Libraries,"S Christodoulakis, P Triantafillou, F Zioga",VLDB,1997
71477,journals/sigmod/WangD03,Review of Web caching and replication by Michael Rabinovich and Oliver Spatscheck. Addison Wesley 2002,,,2003
71481,journals/sigmod/Wiegand03,"Review of Spatial databases with application to GIS by Philippe Rigaux, Michel Scholl, and Agnes Voisard. Morgan Kaufmann 2002",,,2003
71482,conf/vldb/GravanoG97,Merging Ranks from Heterogeneous Internet Sources,"L Gravano, H Garcia-Molina",VLDB,1997
71484,conf/vldb/SeshadriLR97,The Case for Enhanced Abstract Data Types,"P Seshadri, M Livny, R Ramakrishnan",VLDB,1997
71485,conf/vldb/NgC97,Integrating Reliable Memory in Databases,"W Ng, P Chen",VLDB,1997
71486,journals/sigmod/PalpanasPKG03,Distributed deviation detection in sensor networks,"T Palpanas, D Papadopoulos, V Kalogeraki, D Gunopulos",SIGMOD Record,2003
71488,journals/sigmod/Aberer03d,Book review column,K Aberer,SIGMOD Record,2003
71489,journals/sigmod/Kumar03,Sensor: the atomic computing particle,V Kumar,SIGMOD Record,2003
71491,conf/vldb/JagadishNSSK97,Incremental Organization for Data Recording and Warehousing,"H Jagadish, P Narayan, S Seshadri, S Sudarshan, R Kanneganti",VLDB,1997
71494,conf/vldb/Huyn97,Multiple-View Self-Maintenance in Data Warehousing Environments,N Huyn,VLDB,1997
71497,conf/vldb/Jamil97,Implementing Abstract Objects with Inheritance in Datalogneg,H Jamil,VLDB,1997
71498,journals/sigmod/DemersGRTY03,The Cougar Project: a work-in-progress report,"A Demers, J Gehrke, R Rajaraman, A Trigoni, Y Yao",SIGMOD Record,2003
71501,conf/vldb/LiCHH97,Facilitating Multimedia Database Exploration through Visual Interfaces and Perpetual Query Reformulations,"W Li, K Candan, K Hirata, Y Hara",VLDB,1997
71503,journals/sigmod/Hammer03,Treasurer's Message,,,2003
71504,conf/vldb/BridgeJKLLM97,The Oracle Universal Server Buffer,"W Bridge, A Joshi, M Keihl, T Lahiri, J Loaiza, N MacNaughton",VLDB,1997
71505,journals/sigmod/Ozsu03a,Chair's Message,,,2003
71509,conf/vldb/ChavdaW97,Towards an ODMG-Compliant Visual Object Query Language,"M Chavda, P Wood",VLDB,1997
71510,journals/sigmod/Chamberlin03,2003 SIGMOD Innovations Award Speech,D Chamberlin,SIGMOD Record,2003
71511,journals/sigmod/Aberer03c,Guest editor's introduction,,,2003
71512,conf/vldb/DesslochM97,Integrating SQL Databases with Content-Specific Search Engines,"S Deßloch, N Mattos",VLDB,1997
71513,conf/vldb/GarofalakisOS97,Resource Scheduling in Enhanced Pay-Per-View Continuous Media Databases,"M Garofalakis, B Özden, A Silberschatz",VLDB,1997
71514,journals/sigmod/Halevy03,Learning about data integration challenges from day one,A Halevy,SIGMOD Record,2003
71519,conf/vldb/ChakrabartiDAR97,"Using Taxonomy, Discriminants, and Signatures for Navigating in Text Databases","S Chakrabarti, B Dom, R Agrawal, P Raghavan",VLDB,1997
71520,journals/sigmod/KambhampatiK03,Information integration on the Web: a view from AI and databases (report on IIWeb-03),"S Kambhampati, C Knoblock",SIGMOD Record,2003
71522,conf/vldb/CiacciaPZ97,M-tree: An Efficient Access Method for Similarity Search in Metric Spaces,"P Ciaccia, M Patella, P Zezula",VLDB,1997
71526,journals/sigmod/Hainaut03,Research in database engineering at the University of Namur,J Hainaut,SIGMOD Record,2003
71528,conf/vldb/GarofalakisI97,Parallel Query Scheduling and Optimization with Time- and Space-Shared Resources,"M Garofalakis, Y Ioannidis",VLDB,1997
71532,journals/sigmod/Liu03a,Editor's Notes,L Liu,SIGMOD Record,2003
71534,journals/sigmod/JukicNV03,Closing the key loophole in MLS databases,"N Jukic, S Nestorov, S Vrbsky",SIGMOD Record,2003
71536,conf/vldb/Bayer95,Document Management as a Database Problem,R Bayer,VLDB,1995
71537,journals/sigmod/Jonsson03,In Memory of Gísli R. Hjaltason,,,2003
71542,conf/vldb/KornackerB95,High-Concurrency Locking in R-Trees,"M Kornacker, D Banks",VLDB,1995
71543,conf/vldb/YanG95,Duplicate Removal in Information System Dissemination,"T Yan, H Garcia-Molina",VLDB,1995
71544,journals/sigmod/Winslett03b,Interview with Rakesh Agrawal,,,2003
71546,conf/vldb/GravanoG95,Generalizing GlOSS to Vector-Space Databases and Broker Hierarchies,"L Gravano, H Garcia-Molina",VLDB,1995
71547,journals/sigmod/Ouksel03,In-context peer-to-peer information filtering on the Web,A Ouksel,SIGMOD Record,2003
71548,conf/vldb/Sullivan96,Tribeca: A Stream Database Manager for Network Traffic Analysis,M Sullivan,VLDB,1996
71550,conf/vldb/MiningGroup96,MineSet(tm): A System for High-End Data Mining and Visualization,,VLDB,1996
71553,conf/vldb/Bhashyam96,"TPC-D: The Challenges, Issues and Results",R Bhashyam,VLDB,1996
71556,journals/sigmod/Hellerstein03,Toward network data independence,J Hellerstein,SIGMOD Record,2003
71557,conf/vldb/GuptaM96,What is the Data Warehousing Problem? (Are Materialized Views the Answer?),"A Gupta, I Mumick",VLDB,1996
71560,conf/vldb/Sacks-Davis96,The Structured Information Manager: A Database System for SGML Documents,R Sacks-Davis,VLDB,1996
71561,conf/vldb/Raghavan96,Loading the Data Warehouse Across Various Parallel Architectures,V Raghavan,VLDB,1996
71564,conf/vldb/SavasereON95,An Efficient Algorithm for Mining Association Rules in Large Databases,"A Savasere, E Omiecinski, S Navathe",VLDB,1995
71565,conf/vldb/HanF95,Discovery of Multiple-Level Association Rules from Large Databases,"J Han, Y Fu",VLDB,1995
71566,journals/sigmod/RossNO03,Reminiscences on Influential Papers,,,2003
71568,conf/vldb/RahmM95,Dynamic Multi-Resource Load Balancing in Parallel Database Systems,"E Rahm, R Marek",VLDB,1995
71570,conf/vldb/BassiliadesV95,A Non-Uniform Data Fragmentation Strategy for Parallel Main-Menory Database Systems,"N Bassiliades, I Vlahavas",VLDB,1995
71571,journals/sigmod/Stirling03,Information rules,D Stirling,SIGMOD Record,2003
71574,conf/vldb/HellersteinNP95,Generalized Search Trees for Database Systems,"J Hellerstein, J Naughton, A Pfeffer",VLDB,1995
71576,conf/vldb/MillinerBP95,A Scalable Architecture for Autonomous Heterogeneous Database Interactions,"S Milliner, A Bouguettaya, M Papazoglou",VLDB,1995
71580,conf/vldb/HasanM95,Coloring Away Communication in Parallel Query Optimization,"W Hasan, R Motwani",VLDB,1995
71583,journals/sigmod/GottlobKP03a,XPath processing in a nutshell,,,2003
71586,journals/sigmod/GolabO03,Issues in data stream management,"L Golab, M Özsu",SIGMOD Record,2003
71589,journals/sigmod/Vianu03,A Web odyssey: from codd to XML,V Vianu,SIGMOD Record,2003
71592,conf/vldb/GardarinGT95,A Cost Model for Clustered Object-Oriented Databases,"G Gardarin, J Gruser, Z Tang",VLDB,1995
71593,conf/vldb/BelussiF95,Estimating the Selectivity of Spatial Queries Using the `Correlation' Fractal Dimension,"A Belussi, C Faloutsos",VLDB,1995
71594,journals/sigmod/MukhopadhyayGS03,An approach to confidence based page ranking for user oriented Web search,"D Mukhopadhyay, D Giri, S Singh",SIGMOD Record,2003
71596,conf/vldb/IoannidisLGP96,ZOO : A Desktop Experiment Management Environment,"Y Ioannidis, M Livny, S Gupta, N Ponnekanti",VLDB,1996
71599,conf/vldb/FaloutsosMS96,Modeling Skewed Distribution Using Multifractals and the `80-20' Law,"C Faloutsos, Y Matias, A Silberschatz",VLDB,1996
71601,conf/vldb/DarFJST96,Semantic Data Caching and Replacement,"S Dar, M Franklin, B Jónsson, D Srivastava, M Tan",VLDB,1996
71602,journals/sigmod/Winslett03,Interview with Jim Gray,,,2003
