tid,id,title,authors,venue,year
69613,conf/vldb/AmmannJR95,Using Formal Methods to Reason about Semantics-Based Decompositions of Transactions,"P Ammann, S Jajodia, I Ray",VLDB,1995
69619,journals/sigmod/Ouksel02,Mining the World Wide Web: An Information Search Approach - Book Review,,,2002
69620,conf/vldb/MoserKK95,L/MRP: A Buffer Management Strategy for Interactive Continuous Data Flows in a Multimedia DBMS,"F Moser, A Kraiss, W Klas",VLDB,1995
69647,conf/vldb/DidriksenGD95,Database De-Centralization - A Practical Approach,"T Didriksen, C Galindo-Legaria, E Dahle",VLDB,1995
69653,journals/sigmod/Liu02a,Editor's Notes,L Liu,SIGMOD Record,2002
69659,journals/sigmod/Wiegand02,Investigating XQuery for Querying Across Database Object Types,N Wiegand,SIGMOD Record,2002
69662,conf/vldb/WienerN95,OODB Bulk Loading Revisited: The Partitioned-List Approach,"J Wiener, J Naughton",VLDB,1995
69677,journals/sigmod/YaoG02,The Cougar Approach to In-Network Query Processing in Sensor Networks,"Y Yao, J Gehrke",SIGMOD Record,2002
69697,conf/vldb/KemperK94,Dual-Buffering Strategies in Object Bases,"A Kemper, D Kossmann",VLDB,1994
69699,journals/sigmod/Winslett02b,Hector Garcia-Molina Speaks Out,M Winslett,,2002
69700,conf/vldb/JohnsonS94,2Q: A Low Overhead High Performance Buffer Management Replacement Algorithm,"T Johnson, D Shasha",VLDB,1994
69704,conf/vldb/BaralisW94,An Algebraic Approach to Rule Analysis in Expert Database Systems,"E Baralis, J Widom",VLDB,1994
69707,journals/sigmod/Badia02,Ontologies: A Silver Bullet for Knowledge Management and Electronic Commerce - Book Review,,,2002
69708,conf/vldb/HaberIL95,OPOSSUM: Desk-Top Schema Management through Customizable Visualization,"E Haber, Y Ioannidis, M Livny",VLDB,1995
69712,conf/vldb/EvangelidisLS95,"The hBP-tree: A Modified hB-tree Supporting Concurrency, Recovery and Node Consolidation","G Evangelidis, D Lomet, B Salzberg",VLDB,1995
69720,journals/sigmod/ButtlerCCFHLPRX02,Querying Multiple Bioinformatics Data Sources: Can Semantic Web Research Help?,"D Buttler, M Coleman, T Critchlow, R Fileto, W Han, L Liu, C Pu, D Rocco, L Xiong",SIGMOD Record,2002
69733,journals/sigmod/Grohe02,Parameterized Complexity for the Database Theorist,M Grohe,SIGMOD Record,2002
69738,journals/sigmod/BoucelmaCGJLL02,Report on the EDBT'02 Panel on Scientific Data Integration,,,2002
69742,conf/vldb/ColletCS94,NAOS - Efficient and Modular Reactive Capabilities in an Object-Oriented Database System,"C Collet, T Coupaye, T Svensen",VLDB,1994
69752,journals/sigmod/ChienTZ01,XML Document Versioning,"S Chien, V Tsotras, C Zaniolo",SIGMOD Record,2001
69755,journals/sigmod/ConstantopoulosCP01,"Semantic Web Workshop: Models, Architectures and Management",,,2001
69761,conf/vldb/GehaniJR94,OdeFS: A File System Interface to an Object-Oriented Database,"N Gehani, H Jagadish, W Roome",VLDB,1994
69769,journals/sigmod/BiancheriPP01,EIHA?!?: Deploying Web and WAP services using XML Technology,"C Biancheri, J Pazzaglia, G Paddeu",SIGMOD Record,2001
69772,conf/vldb/MuntzR94,A Requirement-Based Approach to Data Modeling and Re-Engineering,"A Muntz, C Ramiller",VLDB,1994
69796,journals/sigmod/Snodgrass01a,Accessibility of the Database Literature,R Snodgrass,SIGMOD Record,2001
69809,journals/sigmod/CabreraLM01,Detection and Classification of Intrusions and Faults using Sequences of System Calls,"J Cabrera, L Lewis, R Mehra",SIGMOD Record,2001
69815,journals/sigmod/Ozsu01a,Chair's Message,,,2001
69819,journals/sigmod/LeeF01,Mining System Audit Data: Opportunities and Challenges,"W Lee, W Fan",SIGMOD Record,2001
69821,journals/sigmod/SayginVC01,Using Unknowns to Prevent Discovery of Association Rules,"Y Saygin, V Verykios, C Clifton",SIGMOD Record,2001
69829,journals/sigmod/Winslett01a,"Gio Wiederhold Speaks Out on Moving into Academia in Mid-Career, How to Be an Effective Consultant, Why You Should Be a Program Manager as a Funding Agency, the Need for Ontology Algebra and Simulations, and More",,,2001
69833,journals/sigmod/RossHLW01,Reminiscences on Influential Papers,,,2001
69834,conf/sigmod/MiloAABN03,Exchanging Intensional XML Data,"T Milo, S Abiteboul, B Amann, O Benjelloun, F Ngoc",SIGMOD Conference,2003
69840,journals/sigmod/SommerGB02,The n-Tier Hub Technology,"R Sommer, T Gulledge, D Bailey",SIGMOD Record,2002
69842,conf/vldb/DavisonG94,Memory-Contention Responsive Hash Joins,"D Davison, G Graefe",VLDB,1994
69849,journals/sigmod/BallMRZ02,Supply Chain Infrastructures: System Integration and Information Sharing,"M Ball, M Ma, L Raschid, Z Zhao",SIGMOD Record,2002
69854,conf/vldb/LuOT94,On Spatially Partitioned Temporal Join,"H Lu, B Ooi, K Tan",VLDB,1994
69869,journals/sigmod/JacobS99,FinTime - A Financial Time Series Benchmark,"K Jacob, D Shasha",SIGMOD Record,1999
69870,conf/sigmod/WitkowskiBBDFGSS03,Spreadsheets in RDBMS for OLAP,"A Witkowski, S Bellamkonda, T Bozkaya, G Dorman, N Folkert, A Gupta, L Sheng, S Subramanian",SIGMOD Conference,2003
69876,journals/sigmod/Franklin99b,Editor's Notes,M Franklin,SIGMOD Record,1999
69888,journals/sigmod/Snodgrass00,Chair's Message,,,2000
69901,conf/sigmod/OlstonJW03,Adaptive Filters for Continuous Queries over Distributed Data Streams,"C Olston, J Jiang, J Widom",SIGMOD Conference,2003
69909,conf/sigmod/BornhovdAKMPR03,DBCache: Middle-tier Database Caching for Highly Scalable e-Business Architectures,"C Bornh÷vd, M Altinel, S Krishnamurthy, C Mohan, H Pirahesh, B Reinwald",SIGMOD Conference,2003
69912,journals/sigmod/ClementiniF00,Spatial Operators,"E Clementini, P Felice",SIGMOD Record,2000
69920,journals/sigmod/KantM00,"Workshop on Performance and Architecture of Web Servers (PAWS-2000, held in conjection with SIGMETRICS-2000)",,,2000
69928,journals/sigmod/Mendelzon00,Information Director's Message,,,2000
69930,conf/sigmod/CuiOTS03,Contorting High Dimensional Data for Efficient Main Memory Processing,"B Cui, B Ooi, J Su, K Tan",SIGMOD Conference,2003
69931,journals/sigmod/Snodgrass00a,Chair's Message,,,2000
69934,conf/sigmod/Raghavan03,Extracting and Exploiting Structure in Text Search,P Raghavan,SIGMOD Conference,2003
69941,conf/sigmod/Colliat03,Data Management Challenges in CRM,G Colliat,SIGMOD Conference,2003
69947,journals/sigmod/Halevy00,Theory of Answering Queries Using Views,A Halevy,SIGMOD Record,2000
69950,conf/sigmod/Aggarwal03,A Framework for Change Diagnosis of Data Streams,C Aggarwal,SIGMOD Conference,2003
69954,conf/sigmod/KimC03,Qcluster: Relevance Feedback Using Adaptive Clustering for Content-Based Image Retrieval,"D Kim, C Chung",SIGMOD Conference,2003
69957,journals/sigmod/Snodgrass00c,SIGMOD Program Review,,,2000
69961,conf/sigmod/Cabrera03,The Future of Web services - II,F Cabrera,SIGMOD Conference,2003
69970,journals/sigmod/Snodgrass00b,Chair's Message,,,2000
69981,conf/sigmod/QunLO03,D(k)-Index: An Adaptive Structural Summary for Graph-Structured Data,"C Qun, A Lim, K Ong",SIGMOD Conference,2003
69983,conf/sigmod/Dyreson03,"Temporal Coalescing with Now, Granularity, and Incomplete Information",C Dyreson,SIGMOD Conference,2003
69988,conf/sigmod/MelnikRB03,Rondo: A Programming Platform for Generic Model Management,"S Melnik, E Rahm, P Bernstein",SIGMOD Conference,2003
69993,conf/sigmod/CohenM03,Spectral Bloom Filters,"S Cohen, Y Matias",SIGMOD Conference,2003
70010,conf/sigmod/MaddenSHR02,Continuously adaptive continuous queries over streams,"S Madden, M Shah, J Hellerstein, V Raman",SIGMOD Conference,2002
70030,conf/sigmod/ZhuSZ03,Query by Humming - in Action with its Technology Revealed,"Y Zhu, D Shasha, X Zhao",SIGMOD Conference,2003
70033,conf/sigmod/PaparizosACJLNPSWWY03,TIMBER: A Native System for Querying XML,"S Paparizos, S Al-Khalifa, A Chapman, H Jagadish, L Lakshmanan, A Nierman, J Patel, D Srivastava, N Wiwatwattana, Y Wu, C Yu",SIGMOD Conference,2003
70043,journals/sigmod/Mackay99,Semantic Integration of Environmental Models for Application to Global Information Systems and Decision-Making,D Mackay,SIGMOD Record,1999
70048,conf/sigmod/LarsonG03,Transparent Mid-Tier Database Caching in SQL Server,"P Larson, J Goldstein, J Zhou",SIGMOD Conference,2003
70051,conf/sigmod/OoiTZGLLLNSWZ03,PeerDB: Peering into Personal Databases,"B Ooi, K Tan, A Zhou, C Goh, Y Li, C Liau, B Ling, W Ng, Y Shu, X Wang, M Zhang",SIGMOD Conference,2003
70057,conf/sigmod/LakshmananPZ03a,SOCQET: Semantic OLAP with Compressed Cube and Summarization,"L Lakshmanan, J Pei, Y Zhao",SIGMOD Conference,2003
70058,journals/sigmod/Hampapur99,Semantic Video Indexing: Approach and Issue,A Hampapur,SIGMOD Record,1999
70062,journals/sigmod/PapazoglouH99,Contextualizing the Information Space in Federated Digital Libraries,"M Papazoglou, J Hoppenbrouwers",SIGMOD Record,1999
70063,journals/sigmod/SouzaS99,Efficient Materialization and Use of Views in Data Warehouses,"M Souza, M Sampaio",SIGMOD Record,1999
70064,conf/sigmod/ViglasN02,Rate-based query optimization for streaming information sources,"S Viglas, J Naughton",SIGMOD Conference,2002
70069,journals/sigmod/CeriFP99,Design Principles for Data-Intensive Web Sites,"S Ceri, P Fraternali, S Paraboschi",SIGMOD Record,1999
70073,journals/sigmod/Kim99,"Message from Editor-in-Chief, ACM Transactions on Database Systems",W Kim,,1999
70086,journals/sigmod/BernsteinDK99,"Towards Adaptive Workflow Systems, CSCW-98 Workshop Report",,,1999
70097,journals/sigmod/FrankGGJKLMNPSSSTW99,Chorochronos: A Research Network for Spatiotemporal Database Systems,"A Frank, S Grumbach, R G³ting, C Jensen, M Koubarakis, N Lorentzos, Y Manolopoulos, E Nardelli, B Pernici, H Schek, M Scholl, T Sellis, B Theodoulidis, P Widmayer",SIGMOD Record,1999
70106,conf/sigmod/BhattacharyaMBNHS02,Coordinating backup/recovery and data consistency between database and file systems,"S Bhattacharya, C Mohan, K Brannon, I Narang, H Hsiao, M Subramanian",SIGMOD Conference,2002
70122,journals/sigmod/EisenbergM99a,SQLJ-Part 1: SQL Routines Using the Java Programming Language,"A Eisenberg, J Melton",SIGMOD Record,1999
70123,conf/sigmod/DattaDTVSR02,Proxy-based acceleration of dynamically generated content on the world wide web: an approach and implementation,"A Datta, K Dutta, H Thomas, D VanderMeer, S Suresha, K Ramamritham",SIGMOD Conference,2002
70128,journals/sigmod/BaaderJN97,Intelligent Access to Heterogeneous Information Sources: Report on the 4th Workshop on Knowledge Representation Meets Databases,,,1997
70135,journals/sigmod/AshishK97,Wrapper Generation for Semi-structured Internet Sources,"N Ashish, C Knoblock",SIGMOD Record,1997
70149,conf/sigmod/BrunoKS02,Holistic twig joins: optimal XML pattern matching,"N Bruno, N Koudas, D Srivastava",SIGMOD Conference,2002
70150,journals/sigmod/McClatcheyV97,Workshop on Workflow Management in Scientific and Engineering Applications - Report,,,1997
70153,journals/sigmod/GuptaHR97,Virtual Database technology,"A Gupta, V Harinarayan, A Rajaraman",SIGMOD Record,1997
70169,journals/sigmod/SilberschatzZ97,Database Systems - Breaking Out of the Box,"A Silberschatz, S Zdonik",SIGMOD Record,1997
70177,conf/sigmod/ZhangMCMR02,Rainbow: mapping-driven XQuery processing system,"X Zhang, M Mulchandani, S Christ, B Murphy, E Rundensteiner",SIGMOD Conference,2002
70179,conf/sigmod/TheobaldW02,The XXL search engine: ranked retrieval of XML data using indexes and ontologies,"A Theobald, G Weikum",SIGMOD Conference,2002
70184,journals/sigmod/FrewD97,Data Management for Earth System Science,"J Frew, J Dozier",SIGMOD Record,1997
70202,conf/sigmod/Cotton02,Implementing XQuery,P Cotton,SIGMOD Conference,2002
70207,conf/sigmod/ChaudhuriDN01,"A Robust, Optimization-Based Approach for Approximate Answering of Aggregate Queries","S Chaudhuri, G Das, V Narasayya",SIGMOD Conference,2001
70209,conf/sigmod/SlivinskasJS01,Adaptable Query Optimization and Evaluation in Temporal Middleware,"G Slivinskas, C Jensen, R Snodgrass",SIGMOD Conference,2001
70223,conf/sigmod/DattaDRTV01,Dynamic Content Acceleration: A Caching Solution to Enable Scalable Dynamic Web Page Generation,"A Datta, K Dutta, K Ramamritham, H Thomas, D VanderMeer",SIGMOD Conference,2001
70228,conf/sigmod/FernandezMS01,Efficient Evaluation of XML Middle-ware Queries,"M Fernandez, A Morishima, D Suciu",SIGMOD Conference,2001
70230,journals/sigmod/MusickM98,Report on the Second IEEE Metadata Conference (Metadata '97),,,1998
70234,conf/sigmod/YanMHF01,Data-Driven Understanding and Refinement of Schema Mappings,"L Yan, R Miller, L Haas, R Fagin",SIGMOD Conference,2001
70240,conf/sigmod/BorkarDS01,Automatic Segmentation of Text into Structured Records,"V Borkar, K Deshmukh, S Sarawagi",SIGMOD Conference,2001
70244,conf/sigmod/OlstonWL01,Adaptive Precision Setting for Cached Approximate Values,"C Olston, B Loo, J Widom",SIGMOD Conference,2001
70246,conf/sigmod/LahiriG01,Fast-Start: Quick Fault Recovery in Oracle,"T Lahiri, A Ganesh, R Weiss, A Joshi",SIGMOD Conference,2001
70262,journals/sigmod/HasanFV96,Open Issues in Parallel Query Optimization,"W Hasan, D Florescu, P Valduriez",SIGMOD Record,1996
70266,journals/sigmod/BilirisP96,The BeSS Object Storage Manager: Architecture Overview,"A Biliris, E Panagos",SIGMOD Record,1996
70269,journals/sigmod/Colliat96,"OLAP, Relational, and Multidimensional Database Systems",G Colliat,SIGMOD Record,1996
70271,journals/sigmod/Widom96,Editor's Notes,J Widom,SIGMOD Record,1996
70274,conf/sigmod/GoldsteinL01,"Optimizing Queries Using Materialized Views: A practical, scalable solution","J Goldstein, P Larson",SIGMOD Conference,2001
70276,conf/sigmod/ShouCTRH01,REVIEW: A Real Time Virtual Walkthrough System,"L Shou, J Chionh, K Tan, Y Ruan, Z Huang",SIGMOD Conference,2001
70279,conf/sigmod/MistryRSR01,Materialized View Selection and Maintenance Using Multi-Query Optimization,"H Mistry, P Roy, S Sudarshan, K Ramamritham",SIGMOD Conference,2001
70281,journals/sigmod/LinP96,Enhancing External Consistency in Real-Time Transactions,"K Lin, S Peng",SIGMOD Record,1996
70283,conf/sigmod/AgichteinGV01,Snowball: A Prototype System for Extracting Relations from Large Text Collections,"E Agichtein, L Gravano, J Pavel, V Sokolova, A Voskoboynik",SIGMOD Conference,2001
70289,conf/sigmod/BertinoCF01,Securing XML Documents: the Author-X Project Demonstration,"E Bertino, S Castano, E Ferrari",SIGMOD Conference,2001
70297,conf/sigmod/DraperHW01,The Nimble Integration Engine,"D Draper, A Halevy, D Weld",SIGMOD Conference,2001
70298,journals/sigmod/TsotrasK96,Temporal Database Bibliography Update,"V Tsotras, A Kumar",SIGMOD Record,1996
70322,journals/sigmod/Gunther97,Environment Information Systems - Guest Editor's Foreword,,,1997
70323,journals/sigmod/KaradimitriouT97,Min-Max Compression Methods for Medical Image Databases,"K Karadimitriou, J Tyler",SIGMOD Record,1997
70325,conf/sigmod/ChenGM01,Improving Index Performance through Prefetching,"S Chen, P Gibbons, T Mowry",SIGMOD Conference,2001
70341,conf/sigmod/DoanDH01,Reconciling Schemas of Disparate Data Sources: A Machine-Learning Approach,"A Doan, P Domingos, A Halevy",SIGMOD Conference,2001
70350,journals/sigmod/CatarciC96,"Information Visualization, Guest Editors' Foreword",,,1996
70365,journals/sigmod/Bhashyam96,"TCP-D - The Challenges, Issues and Results",R Bhashyam,SIGMOD Record,1996
70370,conf/sigmod/LabioWGG00,Efficient Resumption of Interrupted Warehouse Loads,"W Labio, J Wiener, H Garcia-Molina, V Gorelik",SIGMOD Conference,2000
70371,journals/sigmod/Camps96,"Domains, Relations and Religious Wars",R Camps,SIGMOD Record,1996
70372,conf/sigmod/CatarciS01,The Prototype of the DARE System,"T Catarci, G Santucci",SIGMOD Conference,2001
70375,conf/sigmod/Rosenthal01,Will Database Researchers Have ANY Role in Data Security? (Panel Abstract),A Rosenthal,SIGMOD Conference,2001
70383,conf/sigmod/RamaswamyRS00,Efficient Algorithms for Mining Outliers from Large Data Sets,"S Ramaswamy, R Rastogi, K Shim",SIGMOD Conference,2000
70394,journals/sigmod/BerraNT95,ACM Multimedia '94 Conference Workshop on Multimedia Database Management Systems,"P Berra, K Nwosu, B Thuraisingham",SIGMOD Record,1995
70395,conf/sigmod/ZaharioudakisCLPU00,Answering Complex SQL Queries Using Automatic Summary Tables,"M Zaharioudakis, R Cochrane, G Lapis, H Pirahesh, M Urata",SIGMOD Conference,2000
70402,conf/sigmod/HellersteinA00,Eddies: Continuously Adaptive Query Processing,"R Avnur, J Hellerstein",SIGMOD Conference,2000
70409,journals/sigmod/DogacDKOONEHAKKM95,METU Interoperable Database System,"A Dogac, C Dengi, E Kilic, G Ízhan, F Ozcan, S Nural, C Evrendilek, U Halici, I Arpinar, P Koksal, N Kesim, S Mancuhan",SIGMOD Record,1995
70411,conf/sigmod/LiuPBHPT00,AQR-Toolkit: An Adaptive Query Routing Middleware for Distributed Data Intensive Systems,"L Liu, C Pu, D Buttler, W Han, H Paques, W Tang",SIGMOD Conference,2000
70414,conf/sigmod/GillmannWSWW00,A Goal-driven Auto-Configuration Tool for the Distributed Workflow Management System Mentor-lite,"M Gillmann, J Wei▀enfels, G Shegalov, W Wonner, G Weikum",SIGMOD Conference,2000
70417,journals/sigmod/BohmR94,Metadata for Multimedia Documents,"K B÷hm, T Rakow",SIGMOD Record,1994
70423,journals/sigmod/Segev94b,Editor's Notes and Erratum,,,1994
70430,conf/sigmod/Ross00,Expressing Business Rules,R Ross,SIGMOD Conference,2000
70431,conf/sigmod/Jhingran00,Anatomy of a Real E-Commerce System,A Jhingran,SIGMOD Conference,2000
70435,conf/sigmod/ChenDLT00,Fact: A Learning Based Web Query Processing System,"S Chen, Y Diao, H Lu, Z Tian",SIGMOD Conference,2000
70440,journals/sigmod/Jarke95,Information Systems Research at RWTH Aachen,M Jarke,SIGMOD Record,1995
70443,conf/sigmod/LitwinS00,LH*RS: A High-Availability Scalable Distributed Data Structure using Reed Solomon Codes,"W Litwin, T Schwarz",SIGMOD Conference,2000
70457,conf/sigmod/SaltenisJLL00,Indexing the Positions of Continuously Moving Objects,"S Saltenis, C Jensen, S Leutenegger, M Lopez",SIGMOD Conference,2000
70460,journals/sigmod/DunhamH95a,Mobile Computing and Databases: Anything New?,"M Dunham, A Helal",SIGMOD Record,1995
70461,journals/sigmod/ElmagarmidJF95,Wireless Client/Server Computing for Personal Information Services and Applications,"A Elmagarmid, J Jing, T Furukawa",SIGMOD Record,1995
70480,conf/sigmod/Ramakrishnan00,From Browsing to Interacting: DBMS Support for Responive Websites (Abstract),R Ramakrishnan,SIGMOD Conference,2000
70482,conf/sigmod/OrdonezC00,SQLEM: Fast Clustering in SQL using the EM Algorithm,"C Ordonez, P Cereghini",SIGMOD Conference,2000
70492,journals/sigmod/Wong95,An Introduction to Remy's Fast Polymorphic Record Projection,L Wong,SIGMOD Record,1995
70507,journals/sigmod/Alonso94,Trade Press News,,,1994
70509,journals/sigmod/Winslett94,Progress on HPCC and NII,M Winslett,SIGMOD Record,1994
70531,conf/sigmod/ShuklaD00,Tutorial: LDAP Directory Services - Just Another Database Application?,,,2000
70534,conf/sigmod/IvesLPST00,Self-Organizing Data Sharing Communities with SAGRES,"Z Ives, A Levy, J Madhavan, R Pottinger, S Saroiu, I Tatarinov, S Betzler, Q Chen, E Jaslikowska, J Su, W Yeung",SIGMOD Conference,2000
70539,conf/sigmod/YerneniLGU99,Computing Capabilities of Mediators,"R Yerneni, C Li, H Garcia-Molina, J Ullman",SIGMOD Conference,1999
70540,journals/tods/MayL02,Understanding the global semantics of referential actions using logic rules,"W May, B Ludõscher",ACM Trans. Database Syst.,2002
70545,journals/tods/CiacciaP02,Searching in metric spaces with user-defined and approximate distances,"P Ciaccia, M Patella",ACM Trans. Database Syst.,2002
70548,journals/tods/GibbonsMP02,Fast incremental maintenance of approximate histograms,"P Gibbons, Y Matias, V Poosala",ACM Trans. Database Syst.,2002
70565,journals/tods/GunopulosKMSTS03,Discovering all most specific sentences,"D Gunopulos, R Khardon, H Mannila, S Saluja, H Toivonen, R Sharm",ACM Trans. Database Syst.,2003
70571,journals/sigmod/Segev94a,Editor's Notes,A Segev,SIGMOD Record,1994
70580,conf/sigmod/WolfsonSXZC99,DOMINO: Databases fOr MovINg Objects tracking,"O Wolfson, A Sistla, B Xu, J Zhou, S Chamberlain",SIGMOD Conference,1999
70586,conf/sigmod/AltinelABFSZ99,DBIS-Toolkit: Adaptable Middleware for Large Scale Data Delivery,"M Altinel, D Aksoy, T Baby, M Franklin, W Shapiro, S Zdonik",SIGMOD Conference,1999
70591,journals/sigmod/AndersonS94,SEQUOIA 2000 Metadata Schema for Satellite Images,"J Anderson, M Stonebraker",SIGMOD Record,1994
70598,journals/sigmod/Rosneblatt94,Unix RDBMS: The Next Generation,B Rosneblatt,SIGMOD Record,1994
70607,conf/sigmod/AcharyaGPR99a,Join Synopses for Approximate Query Answering,"S Acharya, P Gibbons, V Poosala, S Ramaswamy",SIGMOD Conference,1999
70632,conf/sigmod/JagadishLS99,Snakes and Sandwiches: Optimal Clustering Strategies for a Data Warehouse,"H Jagadish, L Lakshmanan, D Srivastava",SIGMOD Conference,1999
70638,conf/sigmod/Ojjeh99,Microsoft Site Server (Commerce Edition),B Ojjeh,SIGMOD Conference,1999
70646,conf/sigmod/JarkeQBLMS99,Improving OLTP Data Quality Using Data Warehouse Mechanisms,"M Jarke, C Quix, G Blees, D Lehmann, G Michalk, S Striel",SIGMOD Conference,1999
70647,conf/vldb/MeccaCM01,RoadRunner: Towards Automatic Data Extraction from Large Web Sites,"V Crescenzi, G Mecca, P Merialdo",VLDB,2001
70650,conf/sigmod/BargaL99,Phoenix: Making Applications Robust,"R Barga, D Lomet",SIGMOD Conference,1999
70655,conf/sigmod/ZhouLP99,TAM: A System for Dynamic Transactional Activity Management,"T Zhou, L Liu, C Pu",SIGMOD Conference,1999
70665,conf/vldb/NatsevCSLV01,Supporting Incremental Join Queries on Ranked Inputs,"A Natsev, Y Chang, J Smith, C Li, J Vitter",VLDB,2001
70672,conf/vldb/BlokWZPAKJ01,Flexible and scalable digital library search,"H Blok, M Windhouwer, R Zwol, M Petkovic, P Apers, M Kersten, W Jonker",VLDB,2001
70681,conf/vldb/MaedaT01,ACTIVIEW: Adaptive data presentation using SuperSQL,"Y Maeda, M Toyama",VLDB,2001
70682,conf/sigmod/EmbleyJN99,Record-Boundary Discovery in Web Documents,"D Embley, Y Jiang, Y Ng",SIGMOD Conference,1999
70683,conf/vldb/StillgerLMK01,LEO - DB2's LEarning Optimizer,"M Stillger, G Lohman, V Markl, M Kandil",VLDB,2001
70689,conf/sigmod/Chakrabarti99,Hypertext Databases and Data Mining,,,1999
70696,conf/vldb/Sol01,"Ambient Intelligence with the Ubiquitous Network, the Embedded Computer Devices and the Hidden Databases (abstract)",E Sol,VLDB,2001
70697,conf/sigmod/KanthRSB99,Indexing Medium-dimensionality Data in Oracle,"K Kanth, S Ravada, J Sharma, J Banerjee",SIGMOD Conference,1999
70703,conf/vldb/YangG01,Comparing Hybrid Peer-to-Peer Systems,"B Yang, H Garcia-Molina",VLDB,2001
70710,conf/sigmod/AdamY98,Electronic Commerce: Tutorial,"N Adam, Y Yesha",SIGMOD Conference,1998
70711,conf/sigmod/RajagopalanML98,Approximate Medians and other Quantiles in One Pass and with Limited Memory,"G Manku, S Rajagopalan, B Lindsay",SIGMOD Conference,1998
70717,conf/sigmod/FranklinZ98,Data In Your Face: Push Technology in Perspective,"M Franklin, S Zdonik",SIGMOD Conference,1998
70719,conf/sigmod/BerchtoldK98,"High-Dimensional Index Structures, Database Support for Next Decade's Applications (Tutorial)","S Berchtold, D Keim",SIGMOD Conference,1998
70723,conf/sigmod/Whelan98,FileNet Integrated Document Management Database Usage and Issues,D Whelan,SIGMOD Conference,1998
70729,conf/sigmod/Aulakh98,About Quark Digital Media System,K Aulakh,SIGMOD Conference,1998
70735,conf/sigmod/BouguettayaBH99,"World Wide Database - Integrating the Web, CORBA, and Databases","A Bouguettaya, B Benatallah, L Hendra, J Beard, K Smith, M Ouzzani",SIGMOD Conference,1999
70740,conf/sigmod/AgrawalGGR98,Automatic Subspace Clustering of High Dimensional Data for Data Mining Applications,"R Agrawal, J Gehrke, D Gunopulos, P Raghavan",SIGMOD Conference,1998
70756,conf/vldb/KahveciS01,Efficient Index Structures for String Databases,"T Kahveci, A Singh",VLDB,2001
70772,conf/vldb/ChangG00,Approximate Query Translation Across Heterogeneous Information Sources,"K Chang, H Garcia-Molina",VLDB,2000
70785,conf/vldb/Nori00,Asera: Extranet Architecture for B2B Solutions,A Nori,VLDB,2000
70788,conf/vldb/MohanBWSZ00,Evolution of Groupware for Business Applications: A Database Perspective on Lotus Domino/Notes,"C Mohan, R Barber, S Watts, A Somani, M Zaharioudakis",VLDB,2000
70790,conf/sigmod/GibbonsM98,New Sampling-Based Summary Statistics for Improving Approximate Query Answers,"P Gibbons, Y Matias",SIGMOD Conference,1998
70797,conf/vldb/X00a,Author Index,,VLDB,2000
70800,conf/sigmod/DarEGP98,DTL's DataSpot: Database Exploration as Easy as Browsing the Web,"S Dar, G Entin, S Geva, E Palmon",SIGMOD Conference,1998
70801,conf/vldb/AltinelF00,Efficient Filtering of XML Documents for Selective Dissemination of Information,"M Altinel, M Franklin",VLDB,2000
70803,conf/vldb/ChakrabartiGRS00,Approximate Query Processing Using Wavelets,"K Chakrabarti, M Garofalakis, R Rastogi, K Shim",VLDB,2000
70805,conf/vldb/MatiasVW00,Dynamic Maintenance of Wavelet-Based Histograms,"Y Matias, J Vitter, M Wang",VLDB,2000
70808,conf/vldb/KemmeA00,"Don't Be Lazy, Be Consistent: Postgres-R, A New Way to Implement Database Replication","B Kemme, G Alonso",VLDB,2000
70813,conf/sigmod/RaoR98,Reusing Invariants: A New Strategy for Correlated Queries,"J Rao, K Ross",SIGMOD Conference,1998
70817,conf/sigmod/JonssonFS98,Interaction of Query Evaluation and Buffer Management for Information Retrieval,"B J¾nsson, M Franklin, D Srivastava",SIGMOD Conference,1998
70822,conf/vldb/LuL00,Decision Tables: Scalable Classification Exploring RDBMS Capabilities,"H Lu, H Liu",VLDB,2000
70829,conf/sigmod/Toyama98,SuperSQL: An Extended SQL for Database Publishing and Presentation,M Toyama,SIGMOD Conference,1998
70831,conf/vldb/AbrolLMMMRTWZ01,Navigating large-scale semi-structured data in business portals,"M Abrol, N Latarche, U Mahadevan, J Mao, R Mukherjee, P Raghavan, M Tourn, J Wang, G Zhang",VLDB,2001
