tid,id,title,authors,venue,year
72051,journals/vldb/AilamakiDH02,Data page layouts for relational databases on deep memory hierarchies,"A Ailamaki, D DeWitt, M Hill",VLDB J.,2002
72056,journals/vldb/NanopoulosM02,Efficient similarity search for market basket data,"A Nanopoulos, Y Manolopoulos",VLDB J.,2002
72060,journals/vldb/RafieiM02,Efficient retrieval of similar shapes,"D Rafiei, A Mendelzon",VLDB J.,2002
72065,journals/vldb/GrefenVA01,Global transaction support for workflow management systems: from formal specification to practical implementation,"P Grefen, J Vonk, P Apers",VLDB J.,2001
72075,journals/vldb/ChanFGR02,Efficient filtering of XML documents with XPath expressions,"C Chan, P Felber, M Garofalakis, R Rastogi",VLDB J.,2002
72076,journals/vldb/IvesHW02,An XML query engine for network-bound data,"Z Ives, A Halevy, D Weld",VLDB J.,2002
72093,journals/vldb/ClaussenKKW00,Exploiting early sorting and early partitioning for decisionsupport query processing,"J Clau▀en, A Kemper, D Kossmann, C Wiesner",VLDB J.,2000
72097,journals/vldb/TanGO00,Progressive evaluation of nested aggregate queries,"K Tan, C Goh, B Ooi",VLDB J.,2000
72098,journals/vldb/RamanRH00,Online dynamic reordering,"V Raman, B Raman, J Hellerstein",VLDB J.,2000
72106,journals/vldb/ChakrabartiGRS01,Approximate query processing using wavelets,"K Chakrabarti, M Garofalakis, R Rastogi, K Shim",VLDB J.,2001
72122,journals/vldb/AmielBDS96,Type-safe Relaxing of Schema Consistency Rules for Flexible Modeling in OODBMS,"E Amiel, M Bellosta, E Dujardin, E Simon",VLDB J.,1996
72125,journals/vldb/EvangelidisS97,"The hB-Pi-Tree: A Multi-Attribute Index Supporting Concurrency, Recovery and Node Consolidation","G Evangelidis, D Lomet, B Salzberg",VLDB J.,1997
72135,journals/vldb/OzsuPSILM95,TIGUKAT: A Uniform Behavioral Objectbase Management System,"M Ízsu, R Peters, D Szafron, B Irani, A Lipka, A Mu±oz",VLDB J.,1995
72138,journals/vldb/AtkinsonM95,Orthogonally Persistent Object Systems,"M Atkinson, R Morrison",VLDB J.,1995
72150,journals/vldb/AgrawalAJL95,Ordered Shared Locks for Real-Time Databases,"D Agrawal, A Abbadi, R Jeffers, L Lin",VLDB J.,1995
72152,journals/vldb/ChuIT94,A Semantic Modeling Approach for Image Retrieval by Content,"W Chu, I Ieong, R Taira",VLDB J.,1994
72153,journals/vldb/PapadiasS94,Qualitative Representation of Spatial Knowledge in Two-Dimensional Space,"D Papadias, T Sellis",VLDB J.,1994
72157,journals/vldb/TenienteO95,Updating Knowledge Bases While Maintaining Their Consistency,"E Teniente, A OlivÚ",VLDB J.,1995
72159,journals/vldb/TempletonHMB95,InterViso: Dealing With the Complexity of Federated Database Access,"M Templeton, H Henley, E Maros, D Buer",VLDB J.,1995
72168,journals/vldb/KamelWS94,A Pattern-Based Object Calculus,"N Kamel, P Wu, S Su",VLDB J.,1994
72169,journals/vldb/C94,"Title, Foreword",,,1994
72170,journals/vldb/Sciore94,Versioning and Configuration Management in an Object-Oriented Data Model,E Sciore,VLDB J.,1994
72174,journals/vldb/Barbara-MillaG94,The Demarcation Protocol: A Technique for Maintaining Constraints in Distributed Database Systems,"D Barbarß, H Garcia-Molina",VLDB J.,1994
72185,conf/vldb/CareyHMW96,PESTO : An Integrated Query/Browser for Object Databases,"M Carey, L Haas, V Maganty, J Williams",VLDB,1996
72186,journals/sigmod/WenLMZ03,A Multi-paradigm Querying Approach for a Generic Multimedia Database Management System,"J Wen, Q Li, W Ma, H Zhang",SIGMOD Record,2003
72206,conf/vldb/Dasgupta96,Large Databases for Remote Sensing and GIS,A Dasgupta,VLDB,1996
72207,conf/vldb/Hammond96,Using Referential Integrity To Easily Define Consistent Subset Replicas,B Hammond,VLDB,1996
72208,journals/sigmod/ShethM02,Amicalola Report: Database and Information System Research Challenges and Opportunities in Semantic Web and Enterprises,"A Sheth, R Meersman",SIGMOD Record,2002
72211,conf/vldb/BertinoBFS96,Supporting Periodic Authorizations and Temporal Reasoning in Database Access Control,"E Bertino, C Bettini, E Ferrari, P Samarati",VLDB,1996
72215,conf/vldb/AgarwalADGNRS96,On the Computation of Multidimensional Aggregates,"S Agarwal, R Agrawal, P Deshpande, A Gupta, J Naughton, R Ramakrishnan, S Sarawagi",VLDB,1996
72220,conf/vldb/Dyreson96,Information Retrieval from an Incomplete Data Cube,C Dyreson,VLDB,1996
72221,journals/sigmod/RossGN03,Reminiscences an Influential Papers,,,2003
72222,conf/vldb/ShuklaDNR96,Storage Estimation for Multidimensional Aggregates in the Presence of Hierarchies,"A Shukla, P Deshpande, J Naughton, K Ramasamy",VLDB,1996
72223,journals/sigmod/Aberer03,Call for Book Reviews,,,2003
