tid,id,title,authors,venue,year
70842,conf/vldb/MorishimaKKT01,Enabling End-users to Construct Data-intensive Web-sites from XML Repositories: An Example-based Approach,"A Morishima, S Koizumi, H Kitagawa, S Takano",VLDB,2001
70843,conf/vldb/BaumgartnerFG01a,Supervised Wrapper Generation with Lixto,"R Baumgartner, S Flesca, G Gottlob",VLDB,2001
70844,conf/sigmod/GriffinH97,A Framework for Implementing Hypothetical Queries,"T Griffin, R Hull",SIGMOD Conference,1997
70846,conf/sigmod/BrinMUT97,Dynamic Itemset Counting and Implication Rules for Market Basket Data,"S Brin, R Motwani, J Ullman, S Tsur",SIGMOD Conference,1997
70854,conf/sigmod/RoussopoulosKR97,Cubetree: Organization of and Bulk Updates on the Data Cube,"N Roussopoulos, Y Kotidis, M Roussopoulos",SIGMOD Conference,1997
70856,conf/sigmod/CeriFP98,The IDEA Web Lab,"S Ceri, P Fraternali, S Paraboschi",SIGMOD Conference,1998
70860,conf/sigmod/Spiro98,"Ubiquitous, Self-tuning, Scalable Servers",P Spiro,SIGMOD Conference,1998
70861,conf/vldb/OoiYTJ01,Indexing the Distance: An Efficient Method to KNN Processing,"C Yu, B Ooi, K Tan, H Jagadish",VLDB,2001
70870,conf/vldb/CuiW01,Lineage Tracing for General Data Warehouse Transformations,"Y Cui, J Widom",VLDB,2001
70872,conf/sigmod/Mylopoulos98,Panel on Next Generation Database Systems Won't Work Without Semantics!,J Mylopoulos,SIGMOD Conference,1998
70873,conf/sigmod/AndersonBKW98,"Replication, Consistency, and Practicality: Are These Mutually Exclusive?","T Anderson, Y Breitbart, H Korth, A Wool",SIGMOD Conference,1998
70877,conf/vldb/OzdenGHNSDGGW01,Storage Service Providers: a Solution for Storage Management? (Panel),"B Ízden, E Gabber, B Hillyer, W Ng, E Shriver, D DeWitt, B Gordon, J Gray, J Wilkes",VLDB,2001
70893,conf/vldb/NetzCBF00,Integration of Data Mining with Database Technology,"A Netz, S Chaudhuri, J Bernhardt, U Fayyad",VLDB,2000
70906,conf/vldb/Bowker00,Work and Information Practices in the Sciences of Biodiversity,G Bowker,VLDB,2000
70921,conf/vldb/BernsteinHJRW00,Panel: Is Generic Metadata Management Feasible?,"P Bernstein, L Haas, M Jarke, E Rahm, G Wiederhold",VLDB,2000
70924,conf/sigmod/YangM97,Association Rules over Interval Data,"R Miller, Y Yang",SIGMOD Conference,1997
70933,conf/vldb/BeneventanoBCCGMMV00,Information Integration: The MOMIS Project Demonstration,"D Beneventano, S Bergamaschi, S Castano, A Corni, R Guidetti, G Malvezzi, M Melchiori, M Vincini",VLDB,2000
70935,conf/sigmod/RafieiM97,Similarity-Based Queries for Time Series Data,"D Rafiei, A Mendelzon",SIGMOD Conference,1997
70937,conf/sigmod/ChawatheG97,Meaningful Change Detection in Structured Data,"S Chawathe, H Garcia-Molina",SIGMOD Conference,1997
70945,conf/vldb/GuPS00,OLAP++: Powerful and Easy-to-Use Federations of OLAP and Object Databases,"J Gu, T Pedersen, A Shoshani",VLDB,2000
70951,conf/vldb/HinneburgAK00,What Is the Nearest Neighbor in High Dimensional Spaces?,"A Hinneburg, C Aggarwal, D Keim",VLDB,2000
70960,conf/sigmod/Chakravarthy97,SENTINEL: An Object-Oriented DBMS With Event-Based Rules,S Chakravarthy,SIGMOD Conference,1997
70961,conf/vldb/KriegelPS00,Managing Intervals Efficiently in Object-Relational Databases,"H Kriegel, M P÷tke, T Seidl",VLDB,2000
70975,conf/vldb/Sarawagi00,User-Adaptive Exploration of Multidimensional Data,S Sarawagi,VLDB,2000
70980,conf/vldb/StohrMR00,Multi-Dimensional Database Allocation for Parallel Data Warehouses,"T St÷hr, H Mõrtens, E Rahm",VLDB,2000
70984,conf/sigmod/LabioZWGGW97,The WHIPS Prototype for Data Warehouse Creation and Maintenance,"W Labio, Y Zhuge, J Wiener, H Gupta, H Garcia-Molina, J Widom",SIGMOD Conference,1997
71010,conf/vldb/ChristopheBPV00,PicoDMBS: Scaling Down Database Techniques for the Smartcard,"C Bobineau, L Bouganim, P Pucheral, P Valduriez",VLDB,2000
71013,conf/vldb/X00,"Ordering Information, Conference Organizers, Program Committees, Additional Reviewers, Additional Demonstrations Reviewers, Sponsors, VLDB Endowment, Preface, Foreword",,,2000
71015,conf/sigmod/MotakisZ97,Temporal Aggregation in Active Database Rules,"I Motakis, C Zaniolo",SIGMOD Conference,1997
71019,conf/vldb/LakshmananSS99,On Efficiently Implementing SchemaSQL on an SQL Database System,"L Lakshmanan, F Sadri, S Subramanian",VLDB,1999
71022,conf/vldb/DeutschPT99,"Physical Data Independence, Constraints, and Optimization with Universal Plans","A Deutsch, L Popa, V Tannen",VLDB,1999
71023,conf/vldb/JaedickeM99,User-Defined Table Operators: Enhancing Extensibility for ORDBMS,"M Jaedicke, B Mitschang",VLDB,1999
71027,conf/sigmod/ZouS96,On-line Reorganization of Sparsely-populated B+trees,"C Zou, B Salzberg",SIGMOD Conference,1996
71032,conf/sigmod/AdaliCPS96,Query Caching and Optimization in Distributed Mediator Systems,"S Adali, K Candan, Y Papakonstantinou, V Subrahmanian",SIGMOD Conference,1996
71033,conf/sigmod/AchyutuniON96,Two Techniques for On-Line Index Modification in Shared Nothing Parallel Databases,"K Achyutuni, E Omiecinski, S Navathe",SIGMOD Conference,1996
71070,conf/sigmod/ChristophidesCM96,Evaluating Queries with Generalized Path Expressions,"V Christophides, S Cluet, G Moerkotte",SIGMOD Conference,1996
71073,conf/vldb/TanGO99,Online Feedback for Nested Aggregate Queries with Multi-Threading,"K Tan, C Goh, B Ooi",VLDB,1999
71076,conf/sigmod/LibkinMW96,"A Query Language for Multidimensional Arrays: Design, Implementation, and Optimization Techniques","L Libkin, R Machlin, L Wong",SIGMOD Conference,1996
71077,conf/vldb/KoudasMJ99,Mining Deviants in a Time Series Database,"H Jagadish, N Koudas, S Muthukrishnan",VLDB,1999
71086,conf/sigmod/Freeston95,A General Solution of the n-dimensional B-tree Problem,M Freeston,SIGMOD Conference,1995
71087,conf/vldb/KumarRRT99,Extracting Large-Scale Knowledge Bases from the Web,"R Kumar, P Raghavan, S Rajagopalan, A Tomkins",VLDB,1999
71089,conf/vldb/CeriFP99,"Data-Driven, One-To-One Web Site Generation for Data-Intensive Applications","S Ceri, P Fraternali, S Paraboschi",VLDB,1999
71092,conf/vldb/DattaRT99,Curio: A Novel Solution for Efficient Storage and Indexing in Data Warehouses,"A Datta, K Ramamritham, H Thomas",VLDB,1999
71101,conf/sigmod/QuassWGHLMNRRAUW96,LORE: A Lightweight Object REpository for Semistructured Data,"D Quass, J Widom, R Goldman, K Haas, Q Luo, J McHugh, S Nestorov, A Rajaraman, H Rivero, S Abiteboul, J Ullman, J Wiener",SIGMOD Conference,1996
71107,conf/vldb/CarinoOBS99,"Active Storage Hierarchy, Database Systems and Applications - Socratic Exegesis","F Cari±o, W O'Connell, J Burgess, J Saltz",VLDB,1999
71115,conf/sigmod/RossSS96,Materialized View Maintenance and Integrity Constraint Checking: Trading Space for Time,"K Ross, D Srivastava, S Sudarshan",SIGMOD Conference,1996
71116,conf/vldb/KnorrN99,Finding Intensional Knowledge of Distance-Based Outliers,"E Knorr, R Ng",VLDB,1999
71126,conf/vldb/GohOST99,GHOST: Fine Granularity Buffering of Indexes,"C Goh, B Ooi, D Sim, K Tan",VLDB,1999
71128,conf/sigmod/Tajima96,Static Detection of Security Flaws in Object-Oriented Databases,K Tajima,SIGMOD Conference,1996
71131,conf/sigmod/LiskovACDGGMMS96,Safe and Efficient Sharing of Persistent Objects in Thor,"B Liskov, A Adya, M Castro, M Day, S Ghemawat, R Gruber, U Maheshwari, A Myers, L Shrira",SIGMOD Conference,1996
71136,conf/vldb/Sarawagi99,Explaining Differences in Multidimensional Aggregates,S Sarawagi,VLDB,1999
71150,conf/sigmod/AcharyaAFZ95,Broadcast Disks: Data Management for Asymmetric Communications Environments,"S Acharya, R Alonso, M Franklin, S Zdonik",SIGMOD Conference,1995
71156,conf/vldb/BamfordBKM98,Architecture of Oracle Parallel Server,"R Bamford, D Butler, B Klots, N MacNaughton",VLDB,1998
71159,conf/sigmod/IoannidisP95,Balancing Histogram Optimality and Practicality for Query Result Size Estimation,"Y Ioannidis, V Poosala",SIGMOD Conference,1995
71160,conf/vldb/Vieille98,From Data Independence to Knowledge Independence: An on-going Story,L Vieille,VLDB,1998
71162,conf/sigmod/HouZ95,Enhancing Database Correctness: a Statistical Approach,"W Hou, Z Zhang",SIGMOD Conference,1995
71174,conf/sigmod/Ivinskis95,High Availability of Commercial Applications,K Ivinskis,SIGMOD Conference,1995
71180,conf/vldb/GrovlenHT98,Low-Cost Compensation-Based Query Processing,"Ï Gr°vlen, S Hvasshovd, Ï Torbj°rnsen",VLDB,1998
71181,conf/sigmod/BaruFGHJPW95,An Overview of DB2 Parallel Edition,"C Baru, G Fecteau, A Goyal, H Hsiao, A Jhingran, S Padmanabhan, W Wilson",SIGMOD Conference,1995
71188,conf/vldb/GingrasL98,nD-SQL: A Multi-Dimensional Language for Interoperability and OLAP,"F Gingras, L Lakshmanan",VLDB,1998
71194,conf/sigmod/RadekeBBEKKN95,Efendi: Federated Database System of Cadlab,"E Radeke, R B÷ttger, B Burkert, Y Engel, G Kachel, S Kolmschlag, D Nolte",SIGMOD Conference,1995
71213,conf/vldb/RamanRH99,Online Dynamic Reordering for Interactive Data Processing,"V Raman, B Raman, J Hellerstein",VLDB,1999
71216,conf/sigmod/DuSD95,Reducing Multidatabase Query Response Time by Tree Balancing,"W Du, M Shan, U Dayal",SIGMOD Conference,1995
71221,conf/vldb/FuhDCMTLDRM99,Implementation of SQL3 Structured Types with Inheritance and Value Substitutability,"Y Fuh, S De▀loch, W Chen, N Mattos, B Tran, B Lindsay, L DeMichel, S Rielau, D Mannhaupt",VLDB,1999
71222,conf/sigmod/BhargavaGI95,Hypergraph Based Reorderings of Outer Join Queries with Complex Predicates,"G Bhargava, P Goel, B Iyer",SIGMOD Conference,1995
71225,conf/vldb/FlorescuLSY99,Optimization of Run-time Management of Data Intensive Web-sites,"D Florescu, A Levy, D Suciu, K Yagoub",VLDB,1999
71226,conf/sigmod/GriffinL95,Incremental Maintenance of Views with Duplicates,"T Griffin, L Libkin",SIGMOD Conference,1995
71240,conf/sigmod/Ellison95,Keynote Address,,,1995
71249,conf/sigmod/Edelstein95,Research and Products: Are They Relevant To Each Other? (Panel),H Edelstein,SIGMOD Conference,1995
71251,conf/sigmod/Bampahl95,Real World Requirements for Decision Support - Implications for RDBMS,S Bansal,SIGMOD Conference,1995
71257,conf/sigmod/Atkinson95,Use of a Component Architecture in Integrating Relational and Non-relational Storage Systems,R Atkinson,SIGMOD Conference,1995
71258,conf/vldb/FangSGMU98,Computing Iceberg Queries Efficiently,"M Fang, N Shivakumar, H Garcia-Molina, R Motwani, J Ullman",VLDB,1998
71263,conf/vldb/ZimbraoS98,A Raster Approximation For Processing of Spatial Joins,"G Zimbrao, J Souza",VLDB,1998
71273,conf/sigmod/Gibson95,Storage Technology: RAID and Beyond,,,1995
71276,conf/sigmod/GatziuGD95,The SAMOS Active DBMS Prototype,"S Gatziu, A Geppert, K Dittrich",SIGMOD Conference,1995
71294,conf/vldb/AlsabtiRS97,A One-Pass Algorithm for Accurately Estimating Quantiles for Disk-Resident Data,"K Alsabti, S Ranka, V Singh",VLDB,1997
71300,conf/sigmod/Team95a,Paradise: A Database System for GIS Applications,P Team,SIGMOD Conference,1995
71305,conf/vldb/AshwinRSSS97,Garbage Collection in Object Oriented Databases Using Transactional Cyclic Reference Counting,"S Ashwin, P Roy, S Seshadri, A Silberschatz, S Sudarshan",VLDB,1997
71310,conf/sigmod/WangCMSSZ94,Combinatorial Pattern Discovery for Scientific Data: Some Preliminary Results,"J Wang, G Chirn, T Marr, B Shapiro, D Shasha, K Zhang",SIGMOD Conference,1994
71325,conf/sigmod/FaloutsosRM94,Fast Subsequence Matching in Time-Series Databases,"C Faloutsos, M Ranganathan, Y Manolopoulos",SIGMOD Conference,1994
71328,conf/vldb/GinisHKMT97,Data Manager for Evolvable Real-time Command and Control Systems,"E Hughes, R Ginis, B Thuraisingham, P Krupp, J Maurer",VLDB,1997
71334,conf/vldb/SellisRF97,Multidimensional Access Methods: Trees Have Grown Everywhere,"T Sellis, N Roussopoulos, C Faloutsos",VLDB,1997
71337,conf/vldb/Jacobs97,Innovation in Database Management: Computer Science vs. Engineering,K Jacobs,VLDB,1997
71342,conf/vldb/RamaswamyMS98,On the Discovery of Interesting Patterns in Association Rules,"S Ramaswamy, S Mahajan, A Silberschatz",VLDB,1998
71345,conf/sigmod/Mohan94,A Survey and Critique of Advanced Transaction Models,C Mohan,SIGMOD Conference,1994
71351,conf/vldb/ZouS98,Safely and Efficiently Updating References During On-line Reorganization,"C Zou, B Salzberg",VLDB,1998
71355,conf/sigmod/GravanoGT94,The Effectiveness of GlOSS for the Text Database Discovery Problem,"L Gravano, H Garcia-Molina, A Tomasic",SIGMOD Conference,1994
71360,conf/sigmod/ColeG94,Optimization of Dynamic Query Evaluation Plans,"R Cole, G Graefe",SIGMOD Conference,1994
71367,conf/vldb/DoDJJR98,Issues in Developing Very Large Data Warehouses,"L Do, P Drew, W Jin, V Jumani, D Rossum",VLDB,1998
71370,conf/vldb/BonczRK98,The Drill Down Benchmark,"P Boncz, T R³hl, F Kwakkel",VLDB,1998
71377,conf/vldb/ArunJ98,KODA - The Architecture And Interface of a Data Model Independent Kernel,"G Arun, A Joshi",VLDB,1998
71388,conf/sigmod/CareyDFHMNSSTTWZ94,Shoring Up Persistent Applications,"M Carey, D DeWitt, M Franklin, N Hall, M McAuliffe, J Naughton, D Schuh, M Solomon, C Tan, O Tsatalos, S White, M Zwilling",SIGMOD Conference,1994
71390,conf/sigmod/WhiteD94,QuickStore: A High Performance Mapped Object Store,"S White, D DeWitt",SIGMOD Conference,1994
71392,conf/vldb/SchieferKBLF98,IBM's DB2 Universal Database demonstrations at VLDB'98,"K Schiefer, J Kleewein, K Brannon, G Lohman, G Fuh",VLDB,1998
71394,conf/vldb/Mina98,MapInfo SpatialWare: A Spatial Information Server for RDBMS,C Mina,VLDB,1998
71395,conf/sigmod/Hellerstein94,Practical Predicate Placement,J Hellerstein,SIGMOD Conference,1994
71396,conf/vldb/Objectivity98,Objectivity Industrial Exhibit,O Objectivity,VLDB,1998
71400,conf/sigmod/Galindo-Legaria94,Outerjoins as Disjunctions,C Galindo-Legaria,SIGMOD Conference,1994
71403,conf/vldb/GardarinGT96,Cost-based Selection of Path Expression Processing Algorithms in Object-Oriented Databases,"G Gardarin, J Gruser, Z Tang",VLDB,1996
71407,conf/vldb/AcharyaFZ96,Disseminating Updates on Broadcast Disks,"S Acharya, M Franklin, S Zdonik",VLDB,1996
71416,conf/vldb/KornSFSP96,Fast Nearest Neighbor Search in Medical Image Databases,"F Korn, N Sidiropoulos, C Faloutsos, E Siegel, Z Protopapas",VLDB,1996
71418,conf/vldb/ViverosNR96,Applying Data Mining Techniques to a Health Insurance Information System,"M Viveros, J Nearhos, M Rothman",VLDB,1996
71424,conf/vldb/MeoPC96,A New SQL-like Operator for Mining Association Rules,"R Meo, G Psaila, S Ceri",VLDB,1996
71427,conf/sigmod/Cattell94,ODMG-93: A Standard for Object-Oriented DBMSs,R Cattell,SIGMOD Conference,1994
71428,conf/vldb/LabioG96,Efficient Snapshot Differential Algorithms for Data Warehousing,"W Labio, H Garcia-Molina",VLDB,1996
71435,conf/vldb/SeshadriLR96,The Design and Implementation of a Sequence Database System,"P Seshadri, M Livny, R Ramakrishnan",VLDB,1996
71436,journals/sigmod/Liu03c,Editor's Notes,L Liu,SIGMOD Record,2003
71437,conf/vldb/ChaudhuriS96,Optimization of Queries with User-defined Predicates,"S Chaudhuri, K Shim",VLDB,1996
71444,journals/sigmod/AilamakiFFSV03,An environmental sensor network to determine drinking water quality and security,"A Ailamaki, C Faloutsos, P Fischbeck, M Small, J VanBriesen",SIGMOD Record,2003
71453,conf/vldb/Mohan96,DWMS: Data Warehouse Management System,N Mohan,VLDB,1996
71454,conf/sigmod/GrossmanQ94,Ptool: A Scalable Persistent Object Manager,"R Grossman, X Qin",SIGMOD Conference,1994
71455,conf/vldb/Moni96,DISNIC-PLAN: A NICNET Based Distributed Database for Micro-level Planning in India,M Moni,VLDB,1996
71458,conf/vldb/Sheth96,Bellcore's ADAPT/X Harness System for Managing Information on Internet and Intranets,A Sheth,VLDB,1996
71459,conf/vldb/Klots96,Cache Coherency in Oracle Parallel Server,B Klots,VLDB,1996
71497,conf/vldb/Jamil97,Implementing Abstract Objects with Inheritance in Datalogneg,H Jamil,VLDB,1997
71534,journals/sigmod/JukicNV03,Closing the key loophole in MLS databases,"N Jukic, S Nestorov, S Vrbsky",SIGMOD Record,2003
71536,conf/vldb/Bayer95,Document Management as a Database Problem,R Bayer,VLDB,1995
71544,journals/sigmod/Winslett03b,Interview with Rakesh Agrawal,,,2003
71548,conf/vldb/Sullivan96,Tribeca: A Stream Database Manager for Network Traffic Analysis,M Sullivan,VLDB,1996
71554,journals/sigmod/OoiST03,Relational data sharing in peer-based data management systems,"B Ooi, Y Shu, K Tan",SIGMOD Record,2003
71556,journals/sigmod/Hellerstein03,Toward network data independence,J Hellerstein,SIGMOD Record,2003
71576,conf/vldb/MillinerBP95,A Scalable Architecture for Autonomous Heterogeneous Database Interactions,"S Milliner, A Bouguettaya, M Papazoglou",VLDB,1995
71578,journals/sigmod/CaleroPR03,Towards a database body of knowledge: a study from Spain,"C Calero, M Piattini, F Ruiz",SIGMOD Record,2003
71583,journals/sigmod/GottlobKP03a,XPath processing in a nutshell,,,2003
71600,journals/sigmod/GottlobKP03,XPath Processing in a Nutshell,"G Gottlob, C Koch, R Pichler",SIGMOD Record,2003
71610,conf/vldb/VermeerA96,The Role of Integrity Constraints in Database Interoperation,"M Vermeer, P Apers",VLDB,1996
71620,conf/vldb/SchindlerAG03,Lachesis: Robust Database Storage Management Based on Device-specific Performance Characteristics,"J Schindler, A Ailamaki, G Ganger",VLDB,2003
71622,conf/vldb/ChaudhuriGN03,Primitives for Workload Summarization and Implications for SQL,"S Chaudhuri, P Ganesan, V Narasayya",VLDB,2003
71626,conf/vldb/YuAA03,Tabular Placement of Relational Data on MEMS-based Storage Devices,"H Yu, D Agrawal, A Abbadi",VLDB,2003
71635,conf/vldb/MiklauS03,Controlling Access to Published Data Using Cryptography,"G Miklau, D Suciu",VLDB,2003
71644,conf/vldb/WeberSNSS03,WebService Composition with O'GRAPE and OSIRIS,"R Weber, C Schuler, P Neukomm, H Schuldt, H Schek",VLDB,2003
71648,conf/vldb/ArionBCDMP03,Xquec: Pushing Queries to Compressed XML Data,"A Arion, A Bonifati, G Costa, S D'Aguanno, I Manolescu, A Pugliese",VLDB,2003
71650,conf/vldb/MengLLA03,OrientStore: A Schema Based Native XML Storage System,"X Meng, D Luo, M Lee, J An",VLDB,2003
71651,conf/vldb/BergerBSW03,Xcerpt and visXcerpt: From Pattern-Based to Visual Querying of XML and Semistructured Data,"S Berger, F Bry, S Schaffert, C Wieser",VLDB,2003
71659,conf/vldb/CliftonFHKLS03,Privacy-Enhanced Data Management for Next-Generation e-Commerce,,,2003
71665,conf/vldb/WangSG03,An Interpolated Volume Data Model,"T Wang, S Santini, A Gupta",VLDB,2003
71667,conf/vldb/WangZL03,ATLAS: A Small but Complete SQL Extension for Data Mining and Data Streams,"H Wang, C Zaniolo, C Luo",VLDB,2003
71672,conf/vldb/PetrovicBJ03,S-ToPSS: Semantic Toronto Publish/Subscribe System,"M Petrovic, I Burcea, H Jacobsen",VLDB,2003
71682,conf/vldb/ShahDR03,An Efficient and Resilient Approach to Filtering and Disseminating Streaming Data,"S Shah, S Dharmarajan, K Ramamritham",VLDB,2003
71683,conf/vldb/Amer-YahiaFSX03,Phrase Matching in XML,"S Amer-Yahia, M Fernandez, D Srivastava, Y Xu",VLDB,2003
71697,conf/vldb/FlescaFM03,On the minimization of Xpath queries,"S Flesca, F Furfaro, E Masciari",VLDB,2003
71702,conf/vldb/LimWV03,SASH: A Self-Adaptive Histogram Set for Dynamically Changing Workloads,"L Lim, M Wang, J Vitter",VLDB,2003
71703,conf/vldb/ZhouS03,Data Bubbles for Non-Vector Data: Speeding-up Hierarchical Clustering in Arbitrary Metric Spaces,"J Zhou, J Sander",VLDB,2003
71707,conf/vldb/TatbulCZCS03,Load Shedding in a Data Stream Manager,"N Tatbul, U Ãetintemel, S Zdonik, M Cherniack, M Stonebraker",VLDB,2003
71719,conf/vldb/GaoS03,Temporal Slicing in the Evaluation of XML Queries,"D Gao, R Snodgrass",VLDB,2003
71722,conf/vldb/QianZXP03,The ND-Tree: A Dynamic Indexing Technique for Multidimensional Non-ordered Discrete Data Spaces,"G Qian, Q Zhu, Q Xue, S Pramanik",VLDB,2003
71730,conf/vldb/GrustKT03,Staircase Join: Teach a Relational DBMS to Watch its (Axis) Steps,"T Grust, M Keulen, J Teubner",VLDB,2003
71735,conf/vldb/NiermanJ02,ProTDB: Probabilistic Data in XML,"A Nierman, H Jagadish",VLDB,2002
71746,conf/vldb/LeeWMS02,A One-Pass Aggregation Algorithm with the Optimal Buffer Size in Multidimensional OLAP,"Y Lee, K Whang, Y Moon, I Song",VLDB,2002
71747,conf/vldb/ZellerK02,Experience Report: Exploiting Advanced Database Optimization Features for Large-Scale SAP R/3 Installations,"B Zeller, A Kemper",VLDB,2002
71754,conf/vldb/LohmanL02,SMART: Making DB2 (More) Autonomic,"G Lohman, S Lightstone",VLDB,2002
71758,conf/vldb/PanRAMOHAMV02,The Denodo Data Integration Platform,"A Pan, J Raposo, M ┴lvarez, P Montoto, V Orjales, J Hidalgo, L Ardao, A Molano, ┴ Vi±a",VLDB,2002
71763,conf/vldb/KeidlSSK02,ServiceGlobe: Distributing E-Services Across the Internet,"M Keidl, S Seltzsam, K Stocker, A Kemper",VLDB,2002
71771,conf/vldb/MahnkeMS02,Extending an ORDBMS: The StateMachine Module,"W Mahnke, C Mathis, H Steiert",VLDB,2002
71778,conf/vldb/HsuLOMTX02,Advanced Database Technologies in a Diabetic Healthcare System,"W Hsu, M Lee, B Ooi, P Mohanty, K Teo, C Xia",VLDB,2002
71793,conf/vldb/DayalHL01,"Business Process Coordination: State of the Art, Trends, and Open Issues","U Dayal, M Hsu, R Ladin",VLDB,2001
71803,conf/vldb/Nori02,eBusiness Standards and Architectures,,,2002
71820,conf/vldb/AgrawalKSX02,Hippocratic Databases,"R Agrawal, J Kiernan, R Srikant, Y Xu",VLDB,2002
71821,conf/vldb/GhoshPSH02,Plan Selection Based on Query Clustering,"A Ghosh, J Parikh, V Sengar, J Haritsa",VLDB,2002
71836,conf/vldb/LifantsevC02,I/O-Conscious Data Preparation for Large-Scale Web Search Engines,"M Lifantsev, T Chiueh",VLDB,2002
71843,conf/vldb/ChoALS02,Optimizing the Secure Evaluation of Twig Queries,"S Cho, S Amer-Yahia, L Lakshmanan, D Srivastava",VLDB,2002
71846,conf/vldb/GilbertKMS02,How to Summarize the Universe: Dynamic Maintenance of Quantiles,"A Gilbert, Y Kotidis, S Muthukrishnan, M Strauss",VLDB,2002
71860,journals/tods/Chen95,Declarative Updates of Relational Databases,W Chen,ACM Trans. Database Syst.,1995
71864,journals/tods/BaekgaardM95,Incremental Computation of Nested Relational Query Expressions,"L Bµkgaard, L Mark",ACM Trans. Database Syst.,1995
71884,journals/tods/Kuo96,Model and Verification of a Data Manager Based on ARIES,D Kuo,ACM Trans. Database Syst.,1996
71908,journals/tods/SalemGS94,Altruistic Locking,"K Salem, H Garcia-Molina, J Shands",ACM Trans. Database Syst.,1994
71909,journals/tods/CliffordC94,On Completeness of Historical Relational Query Languages,"J Clifford, A Croker, A Tuzhilin",ACM Trans. Database Syst.,1994
71911,journals/tods/OliverS94,A Taxonomy for Secure Object-Oriented Databases,"M Olivier, S Solms",ACM Trans. Database Syst.,1994
71917,journals/tods/KorthS94,Formal Aspects of Concurrency Control in Long-Duration Transaction Systems Using the NT/PV Model,"H Korth, G Speegle",ACM Trans. Database Syst.,1994
71918,journals/tods/ChrysanthisR94,Synthesis of Extended Transaction Models Using ACTA,"P Chrysanthis, K Ramamritham",ACM Trans. Database Syst.,1994
71919,journals/tods/PolyzoisG94,Evaluation of Remote Backup Algorithms for Transaction-Processing Systems,"C Polyzois, H Garcia-Molina",ACM Trans. Database Syst.,1994
71938,journals/tods/BaralisW00,An algebraic approach to static analysis of active database rules,"E Baralis, J Widom",ACM Trans. Database Syst.,2000
71939,journals/tods/LiC01,Answering queries with useful bindings,"C Li, E Chang",ACM Trans. Database Syst.,2001
71940,journals/tods/EiterLLS01,Probabilistic object bases,"T Eiter, J Lu, T Lukasiewicz, V Subrahmanian",ACM Trans. Database Syst.,2001
71941,journals/tods/Snodgrass01,Editorial,,,2001
71956,journals/tods/EiterGM97,Disjunctive Datalog,"T Eiter, G Gottlob, H Mannila",ACM Trans. Database Syst.,1997
71960,journals/tods/WolfsonJH97,An Adaptive Data Replication Algorithm,"O Wolfson, S Jajodia, Y Huang",ACM Trans. Database Syst.,1997
71963,journals/tods/LiuHD98,Multiview Access Protocols for Large-Scale Replication,"X Liu, A Helal, W Du",ACM Trans. Database Syst.,1998
71968,journals/tods/StoreyCDGS97,Database Design with Common Sense Business Reasoning and Learning,"V Storey, R Chiang, D Dey, R Goldstein, S Sundaresan",ACM Trans. Database Syst.,1997
71975,journals/tods/CastanoAFP98,Conceptual Schema Analysis: Techniques and Applications,"S Castano, V Antonellis, M Fugini, B Pernici",ACM Trans. Database Syst.,1998
71978,journals/tods/SistlaWYS98,Towards a Theory of Cost Management for Digital Libraries and Electronic Commerce,"A Sistla, O Wolfson, Y Yesha, R Sloan",ACM Trans. Database Syst.,1998
71980,journals/tods/Alagic99,Type-Checking OQL Queries In the ODMG Type Systems,S Alagic,ACM Trans. Database Syst.,1999
71984,journals/tods/GravanoGT99,GlOSS: Text-Source Discovery over the Internet,"L Gravano, H Garcia-Molina, A Tomasic",ACM Trans. Database Syst.,1999
71986,journals/tods/CasatiCPP99,Specification and Implementation of Exceptions in Workflow Management Systems,"F Casati, S Ceri, S Paraboschi, G Pozzi",ACM Trans. Database Syst.,1999
71996,journals/vldb/OzsuC98,Introduction (Special Issue on Multimedia Databases),"M Ízsu, S Christodoulakis",VLDB J.,1998
72018,journals/vldb/WidomS00,Foreword by the VLDB '98 PC Chairmen: Best Papers of VLDB '98,,,2000
72024,journals/vldb/BerchtoldKK97,Using Extended Feature Objects for Partial Similarity Retrieval,"S Berchtold, D Keim, H Kriegel",VLDB J.,1997
72028,journals/vldb/Antoshenkov97,Dictionary-Based Order-Preserving String Compression,G Antoshenkov,VLDB J.,1997
72035,journals/vldb/AbiteboulCM98,A Logical View of Structured Files,"S Abiteboul, S Cluet, T Milo",VLDB J.,1998
72047,journals/vldb/HansonCDERTX98,A Flexible and Recoverable Client/Server Database Event Notification System,"E Hanson, I Chen, R Dastur, K Engel, V Ramaswamy, W Tan, C Xu",VLDB J.,1998
72050,journals/vldb/DesslochHMMT98,"Advanced Data Processing in KRISYS: Modeling Concepts, Implementation Techniques, and Client/Server Issues","S De▀loch, T Hõrder, N Mattos, B Mitschang, J Thomas",VLDB J.,1998
