tid,address,authors,booktitle,date,editor,id,institution,journal,month,note,pages,publisher,tech,title,type,volume,year
6,,"M. Ahlskog, J. Paloheimo, H. Stubb, P. Dyreklev, M. Fahlman, O. Inganas and M.R. Andersson,",,(1994).,,6,,"J Appl. Phys.,",,,"893,",,,,,"76,",
8,,"M. Ahlskog, J. Paloheimo, H. Stubb, P. Dyreklev, M. Fahlman, O. Inganas and M.R. Andersson,",,(1994).,,8,,"Journal of Applied Physics,",,,"893,",,,,,"76,",
56,,Scott Elliott Fahlman.,,1974.,,56,,"Artificial Intelligence,",,,"1-49,",,,A planning system for robot construction tasks.,,5(1),
58,,"Fahlman, S. E.",,(1974).,,58,,"Artificial Intelligence,",,,1-49.,,,A Planning System for Robot Construction Tasks.,,"5 (1),",
59,,"Fahlman, S.E.",,1974.,,59,,"Artificial Intelligence,",,,1-49.,,,A Planning System for Robot Construction Tasks.,,5(1),
70,Cambridge MA.,"Fahlman, S. E.",,(1979).,,70,,,,,,"MIT Press,",,NETL: A System for Representing and Using Real World Knowledge.,,,
91,,Scott E Fahlman.,,1979.,,91,,,,,,"The MIT Press,",,"NETL, A System For Representing And Using Real-World Knowledge.",,,
94,"Cambridge, Ma,",S. E. Fahlman.,,1977.,,94,,,,,,"MIT Press,",,NETL: A System for Representing and Using Real-World Knowledge.,,,
96,"Cambridge, MA, U.S.A.,",S.E. Fahlman.,,1979.,,96,,,,,,"MIT Press,",,NETL: A system for representing and using real-world knowledge.,,,
101,"Hillsdale, NJ:","Fahlman, S.",Parallel Models of Associative Memory.,(1981).,"In G. Hinton and J. Anderson (Eds.),",101,,,,,,Lawrence Erlbaum Associates.,,Representing Implicit Knowledge.,,,
102,Menlo Park:,"Fahlman S, Touretzky D and van Roggen W,","In Proc IJCAI-81,",,,102,,,,International Joint Conferences on AI.,"257-263,",,,"Cancellation in a Parallel Semantic Network,",,,
104,,"Fahlman, S. & Hinton, G.",,(1987).,,104,,"Computer,",,,100-109.,,,Connectionist architectures for artificial intelligence.,,"20,",
116,"Pittsburgh, PA,","Fahlman, S.E.","Proceedings of the 1988 Connectionist Models Summer School,",1989.,"In D. Touretzky, G. Hinton & T. Sejnowski, eds.",116,,,,,38-51,"(Morgan Kaufman, San Mateo).",,Fast-learning variations on back-propagation: an empirical study.,,,
147,"Pittsburgh, PA,",Scott E. Fahlman.,,1988.,,147,"School of Computer Science, Carnegie Mellon University,",,,,,,"Technical Report CMU-CS-88-162,",An empirical study of learning speed in back-propagation networks.,,,
159,,"Fahlman, Scott.",,1988.,,159,"Department of Computer Science, Carnegie Mellon University.",,,,,,"Technical Report CMU-CS-88-162,",An empirical study of learning speed in back-propagation networks.,,,
162,,"Fahlman, Scott.",,1988.,,162,"Department of Computer Science, Carnegie Mellon University.",,,,,,"Technical Report CMU-CS-88-162,",An empirical study of learning speed in back-propagation networks.,,,
163,"Pittsburgh, PA - USA,",S. E. Fahlman.,,1988.,,163,"Computer Science Department - Carnegie-Mellon,",,,,,,"Technical Report CMU-CS-88-162,",An empirical study of learning speed in back-propagation networks.,,,
166,,Scott E. Fahlman.,,1988.,,166,"CMU Department of Computer Science,",,,,,,"Technical Report CMU-CS-88-162,",An empirical strudy of learning speed in back-propagation networks.,,,
167,,S. Fahlman.,,1988.,,167,"Carnegie Mellon University,",,,,,,"Technical report,",An empirical study of learning speed in back-propagation networks.,,,
170,,S.E. Fahlman.,,1988.,,170,"Carnegie Mellon University,",,,,,,"Technical Report CMU-CS-88-162,",An empirical study of learning speed in back-propagation networks.,,,
172,"Pittsburgh, PA,",Scott E. Fahlman.,,1988.,,172,"School of Computer Science, Carnegie Mellon University,",,,,,,"Technical Report CMU-CS-88-162,",An empirical study of learning speed in back-propagation networks.,,,
191,,"Scott Fahlman,",,1988.,,191,"Department of Computer Science, Carnegie Mellon University,",,,,,,"Technical Report CMU-CS-88-162,","An Empirical Study of Learning Speed in BackPropagation Networks,",,,
192,"Pittsburgh, PA:","Fahlman, S.E. and Lebiere, C.,",,1991.,,192,"Carnegie-Mellon University,",,,,,,"(technical report), CMU-CS-90-100,","The Cascade-Correlation Learning Architecture,",,,
202,"Pittsburgh, PA:","Fahlman, S. E., & Lebiere, C.",,(1989).,,202,"Carnegie Mellon University, Computer Science Department.",,,,,,Technical rep. CMU-CS-90-100).,Cascade-correlation learning architecture,,,
208,,"Fahlman S. E., Lebiere C.,",,1990.,,208,"Carnegie Mellon University,",,,,,,"Technical Report CMU-CS-90-100,","The cascade-correlation learning architecture,",,,
212,,"S. E. Fahlman and C. Lebiere,",,1990,,212,,,,,,,"Technical Report:  CMU-CS-90-100,","The Cascade-Correlation Learning Architecture,",,,
214,,Scott E. Fahlman and Christian Lebiere.,,1990.,,214,"Carnegie Mellon University, School of Computer Science,",,,,,,"Technical Report CMU-CS-90-100,",The Cascade-Correlation learning architecture.,,,
219,"Pittsburgh, PA,","Fahlman, S. E., and Lebiere, C.",,1990.,,219,"School of Computer Science, Carnegie Mellon University,",,,,,,"Tech. Rep.  CMU-CS-90-100,",The Cascade-Correlation learning architecture.,,,
222,,"S. E. Fahlman and C. Lebiere,",,1991.,,222,"Carnegie Mellon University,",,,,,,"Technical Report, CMU-CS-TR-91-100,","The Cascade-Correlation Learning Architecture,",,,
230,"Pittsburgh, PA 15213,",S. E. Fahlman and Christian Lebiere.,,1990.,,230,"School of Computer Science, Carnegie Mellon University,",,,,,,"Technical Report CMU-CS-90-100,",The cascade-correlation learning architecture.,,,
234,"Pittsburgh, PA 15213.","Fahlman, S. and Lebiere, C.",,(1990).,,234,"School of Computer Science, Carnegie-Mellon University,",,,,,,"CMU-CS-90-100,",The Cascade-Correlation Learning Architecture.,,,
235,"Pittsburgh, PA,","S. Fahlman and C. Lebiere,",,1990.,,235,"School of Computer Science, Carnegie-Mellon University,",,,,,,"Tech. Rep.  CMU-CS-90-100,","The cascade-correlation learning architecture,",,,
236,"Pittsburgh, PA 15213,",S.E. Fahlman and C. Lebiere.,,1991.,,236,"School of Computer Science Carnegie Mellon University,",,,,,,"Technical report,",The cascade-correlation learning architecture.,,,
251,"San Mateo, CA.","Fahlman, S. & Lebiere, C.","Advances in Neural Information Processing Systems (volume 2),",(1989).,"In Touretzky, D., editor,",251,,,,,"(pp. 524-532),",Morgan Kaufmann.,,The cascade-correlation learning architecture.,,,
252,"San Mateo, CA.","Fahlman, S. & Lebiere, C.","Advances in Neural Information Processing Systems (volume 2),",(1989).,"In Touretzky, D., editor,",252,,,,,"(pp. 524-532),",Morgan Kaufmann.,,The cascade-correlation learning architecture.,,,
260,"Palo Alto, CA.","Fahlman, S. & Lebiere, C.",Advances in Neural Information Processing Systems (volume 2).,(1990).,"In Touretzky, D., editor,",260,,,,,,"Morgan Kaufmann,",,The cascade-correlation learning architecture.,,,
268,,"Fahlman, S. E. & Lebiere, C.","In Advances in Neural Information Processing Systems,",(1990).,,268,,,,,(pp.  524532).,,,The cascade correlation architecture.,,Volume 2,
272,,"Fahlman, S. E. and Lebiere, C.",In Neural Information Processing Systems,1990.,"Touretzky, D. S. (ed).",272,,,,,pp 524-532.,"Morgan-Kauffman,",,The Cascade Correlation Learning Architecture.,,2.,
276,,"Fahlman, S. E. and Lebiere, C.",Advances in Neural Information Processing Systems,(1990).,"In Touretzky (Ed.),",276,,,,,,Morgan Kauffman.,,The cascade-correlation learning architecture.,,2.,
283,"San Mateo, CA:","Fahlman, S. E., & Lebiere, C.",In Advances in Neural Information Processing Systems,(1990).,D. S. Touretzky (Ed.),283,,,,,,Morgan Kaufmann.,,The cascade-correlation learning architecture.,,Vol. 2).,
288,"San Mateo, CA:","Fahlman, S. E., and Lebiere, C.",Advances in Neural Information Processing Systems,(1990).,"In Touretzky, D. S., editor,",288,,,,,524-532.,Morgan Kaufmann.,,The cascade-correlation learning architecture.,,"2,",
293,"San Mateo, CA:","Fahlman, S. E., and Lebiere, C.",Advances in Neural Information Processing Systems,(1990).,"In Touretzky, D. S., editor,",293,,,,,524-532.,Morgan Kaufmann.,,The cascade-correlation learning architecture.,,"2,",
313,,S. E. Fahlman and C. Lebiere.,Advances in Neural Information Processing Systems,(1990),"In D. S. Touretzky, (ed.),",313,,,,,pages 524-532.,Morgan Kaufmann.,,The cascade-correlation learning architecture.,,"volume2,",
327,,"S. Fahlman and C. Lebiere,",in Advances in Neural Information Processing Systems,1990.,"(D. Touretzky, ed.),",327,,,,"(San Mateo),","pp. 524-532,","Morgan Kaufmann,",,"The cascade-correlation learning architecture,",,"vol.2,",
332,,S.E. Fahlman and C. Lebiere.,Advances in Neural Information Processing Systems,1990.,ed. D.S. Touretsky.,332,,,,,"524-532,",,,The cascade-correlation learning architecture.,,"2,",
346,"Los Altos, CA.","Fahlmann, Scott, C. Lebiere.",in Advances in Neural Information Processing,,,346,,,,,pp. 524-532.,Morgan Kaufmann Publishers:,,The Cascade-Correlation Learning Architechture.,,2.,
356,"San Mateo, CA:","Fahlman, S.E. and Lebiere, C.","Advances in Neural Information Processing,","1990,","D.S. Touretzky, (Ed.)",356,,,,,pp. 524-532.,"Morgan Kauffman,",,"The cascade-correlation learning architecture,",,"vol. 2,",
366,"Los Altos, CA.","S. Fahlmann, C. Lebiere,",Advances in Neural Information Processing,,,366,,,,,"pp 524-532,",Morgan Kaufmann Publishers:,,"The Cascade-Correlation Learning Architecture,",,"2,",
371,"(San Mateo, CA),","S. Fahlman,",in Advances in Neural Information Processing Systems,1990.,"D. Touretzky, ed.",371,,,,,"pp. 524- ed.532,","Morgan Kaufmann Publishers,",,"The cascade-correlation learning architecture,",,2,
379,"San Mateo, CA,",S. E. Fahlman and C. Lebiere.,Neural Information Processing Systems,1990.,"In D.S. Touretzky, editor,",379,,,,,pages 524-532.,"Morgan-Kauffman,",,The cascade correlation learning algorithm.,,"2,",
380,"San Mateo, CA,",S. Fahlman and C. Lebiere.,"Advances in Neural Information Processing Systems,",1990.,"In D. Touretzky, editor,",380,,,,,"pages 524-532,","IEEE, Morgan Kaufmann,",,The cascade-correlation learning architecture.,,,
396,"San Mateo, CA:","Fahlman, S. E.",Advances in Neural Information Processing Systems,(1991).,"In Lippmann, R. P., Moody, J. E., and Touretzky, D. S., editors,",396,,,,,190-205.,Morgan Kaufmann.,,The recurrent cascade-correlation architecture.,,"3,",
411,"San Mateo, CA,",S. Fahlman.,Advances in Neural Information Processing Systems,1991.,"In R. Lippmann, J. Moody, and D. Touretzky, editors,",411,,,,,pages 190 196.,"Morgan Kaufmann,",,The recurrent cascade-correlation architecture.,,"3,",
425,,"S. E. Fahlman, L. D. Baker and J. A. Boyan,",,1996.,,425,"CMU-CS-TR-96-184, Carnegie Mellon University,",,,,,,"Technical Report,","The Cascade 2 Learning Architecture,",,,
436,"New York, NY","Knoop, J. and Steffen, B.,","in Proceedings of the Fourth International Conference on Compiler Construction,",(1992).,"U. Kastens and P. Pfahler, ed.",436,,,,"Lecture Notes in Computer Science,",pp.125-140,"Springer-Verlag,",,"The interprocedural coincidence theorem,",,"Vol. 641,",
451,,"Kriegel, H.P., Heep S., Fahldiek A., Mysliwitz N.","Proc. 4th Int. Conf. DEXA 1993,",,,451,,,,,pp. 349-360.,,,Query Processing of Geometric Objects with Free Form Boundaries in Spatial Databases.,,,
454,"Paderborn, Germany,","K.G. Langendoen and P.H. Hartel, FCG:","Proceedings of the International Workshop on Compiler Construction,",1992.,"Springer Verlag LNCS 641, U. Kastens and P. Pfahler (eds),",454,,,,,"pp 278-296,",,,"a code generator for lazy functional languages, in Compiler construction (CC),",,,
471,"Burlington, Massachusetts,","Guy L. Steele Jr., Scott E. Fahlman, Richard P. Gabriel, David A. Moon, and Daniel L. Weinreb.",,1984.,,471,,,,,,"Digital Press,",,Common Lisp: The Language.,,,
478,"Bedford, Massachusetts,","Common Lisp: The Language (Second Edition). By Guy L. Steele Jr., Scott E. Fahlman, Richard P. Gabriel, David A. Moon, Daniel L. Weinreb, Daniel G. Bobrow, Linda G. DeMichiel, Sonya E. Keene, Gregor Kiczales, Crispin Perdue, Kent M. Pitman, Richard C. Waters, and Jon L White.",,1990.,,478,,,,"ISBN 1-55558-041-6. Steele and Gabriel, Evolution of Lisp 72",,"Digital Press,",,,,,
479,"Berlin, Germany,","S udholt, M. and Steigner, C.","Proceedings of the Fourth International Conference on Compiler Construction,",1992.,"In Kastens,  U. and Pfahler, P., Eds.,",479,,,,"volume 641 of Lecture Notes in Computer Science, (Paderborn,  Germany, Oct.).",pp. 156-162.,"Springer-Verlag,",,On interprocedural data flow analysis for object oriented languages.,,,
481,,"S.B. Thrun, J. Bala, E. Bloedorn, I. Bratko, B. Cestnik, J. Cheng, K. De Jong, S. Dzeroski andS.E. Fahlman, D. Fisher, R. Hamann, K. Kaufman, S. Keller, I. Kononenko, J. Kreuziger, R.S. Michalski, T. Mitchell, P. Pachowicz, Y. Reich, H. Vafaie, W. Van de Weldel, W. Wenzel, J. Wnek, and J. Zhang.",,1991.,,481,"Carnegie Mellon University,",,,,,,"Technical Report CMU-CS-91-197,",The monk's problems: A performance comparison of different learning algorithms.,,,
483,"Pittsburgh, PA,","Thrun, S.B., Bala, J., Bloedorn, E., Bratko, I., Cestnik, B., Cheng, J., De Jong, K., Dzerowski, S., Fahlman, S.E., Hamann, R., Kaufman, K., Keller, S., Kononenko, I., Kreuziger, J., Michalski, R.S., Mitchell, T., Pachowicz, P., Vafaie, H., Van de Velde, W., Wenzel, W., Wnek, J., and Zhang, J.,",,1991.,,483,"Carnegie Mellon University,",,,,,,"CMU-CS-91-197,","The MONKS Problems: A Performance Comparison of Different Learning Algorithms,",,,
485,,"Fahlman, D. Fisher, R. Hamann, K. Kaufman, S. Keller, I. Kononenko, J. Kreuziger, R.S. Michal-ski, T. Mitchell, P. Pachowicz, Y. Reich, H. Vafaie, W. Van de Welde, W. Wenzel, J. Wnek, and J. Zhang.",,1991.,,485,"Carnegie Mellon University,",,,,,,"Technical Report CS-CMU-91-197,",The MONK's problems A performance comparison of different learning algorithms.,,,
526,,"Weiss, Y., Edelman, S., and Fahle, M.",,(1993).,,526,,"Neural Computation,",,,695-718.,,,Models of perceptual learning in vernier hyperacuity.,,5,
535,,"Kibler, D., and Aha, D.","In Proceedings of the 4th International Workshop on Machine Learning,",,,535,,,,,24-30.,,,Learning Representative Exemplars of Concepts: An Initial Case Study.,,,1987.
543,"Ca,",D. Kibler and D. W. Aha.,"Proc. 4th International Workshop on Machine Learning,",,"In P. Langley, editor,",543,,,,,,"Kaufmann,",,Learning representative exemplars of concepts: an initial case study.,,,1987.
545,"Irvine, CA,",D. Kibler and D. Aha.,"In Proc. of the 4 th International Workshop on Machine Learning,",,,545,,,,,"pages 24-30,",,,Learning representative exemplars of concepts: An initial case study.,,,1987.
547,"CA,",D. Kibler and D. W. Aha.,"Proc. 4th International Workshop on Machine Learning,",,"In P. Langley, editor,",547,,,,,,Kaufmann.,,Learning representative exemplars of concepts: an initial case study.,,,1987.
558,,"Aha, D. & Kibler, D.",Proc. IJCAI-89,,,558,,,,,pp.794-799).,,,Noise-tolerant instance-based learning algorithms.,,,(1989).
580,,"Aha, D. W., Kibler, D. & Albert, M. K.",,,,580,,,,Draft submission to Machine Learning.,,,,Instance-based learning algorithms.,,,(1990).
582,,"AHA, D.W., KIBLER, D. and ALBERT, M.K.",,,,582,,"Machine Learning,",,,pp. 37-66.,,,"Instance-based learning algorithms,",,"Vol. 6,","1991,"
589,,"D.W. Aha, D. Kibler, and M.K. Albert:",,,,589,,"Machine Learning,",,,"37-66,",,,"Instance-based learning algorithms,",,"6,",1991.
595,,"Aha, D. W., Kibler, D. & Albert, M. K.",,,,595,,"Machine Learning 6(1),",,,pp. 37-66.,,,"Instance-based learning algorithms,",,,"(1991),"
598,,"Aha, D. W., Kibler, D., & Albert, M.",,,,598,,"Machine Learning,",,,37-66.,,,Instance-based learning algorithms.,,"6 (1),",(1991).
610,,"Aha, D. W., Kibler, D., & Albert, M. K.",,,,610,,"Machine Learning,",,,37-66.,,,Instance-based learning algorithms.,,"6,",(1991).
621,,"Aha, D. W., Kibler, D., & Albert, M. K.",,,,621,,"Machine Learning,",,,37-66.,,,Instance-based learning algorithms.,,"6,",(1991).
622,,"Aha, D. W., Kibler, D., & Albert, M. K.",,,,622,,"Machine Learning,",,,37-66.,,,Instance-based learning algorithms.,,"6,",(1991).
642,,"Aha, D., Kibler, D., & Albert, M.",,,,642,,Machine Learning,,,pp. 37-66.,,,Instance-Based Learning Algorithms.,,6 (1):,(1991).
650,,"Aha, D.W., D. Kibler & Albert M.K.",,,,650,,"Machine Learning,",,,pp. 37-66.,,,"Instance-Based Learning Algorithms,",,"6,","(1991),"
657,,"Aha, David W., Dennis Kibler, Marc K. Albert,",,,,657,,"Machine Learning,",,,pp. 37-66.,,,"Instance-Based Learning Algorithms,",,vol. 6,(1991).
659,,"Aha, David W., Dennis Kibler, Marc K. Albert,",,,,659,,"Machine Learning,",,,pp. 37-66.,,,"Instance-Based Learning Algorithms,",,"vol.6,",(1991).
677,,"Aha, D.W., Kibler, D., and Albert, M.K.",,,,677,,"Machine Learning,",,,37-66.,,,Instance-Based Learning Algorithms.,,"6,",(1991).
681,,"D. Aha, D. Kibler, and M. Albert,",,,,681,,"Machine Learning,",,,,,,"Instance-based learning algorithms,",,"vol. 6, no. 1,",1991.
684,,"D.W. Aha, D. Kibler, and M.K. Albert,",,,,684,,"Machine Learning,",,,"37-66,",,,"`Instance-Based Learning Algorithms',",,"6,",(1991).
690,,"D. Aha, D. Kibler, and M. Albert.",,,,690,,"Machine Learning,",,,"37-66,",,,Instance-based learning algorithms.,,6,1991.
694,,"D. Aha, D. Kibler, and M. Albert.",,,,694,,"Machine Learning,",,,,,,Instance-based learning algorithms.,,"6(1),",1991.
698,,"David W. Aha, Dennis Kibler, and Marc K. Albert.",,,,698,,"Machine Learning,",,,,,,Instance-based learning algorithms.,,"6(1),",1991.
707,,"J.S. Conery, D.F. Kibler,","in Proceedings ACM Symposium on Functional Programming and Computer Architecture,",,,707,,,,,,,,"Parallel interpretation of logic programs,",,,1981.
708,,"J. S. Conery, D. F. Kibler,","Proc. ACM Symp. Functional Programming and Computer Architecture,",,,708,,,f14g,,,,,"Parallel Interpretation of Logic Programs,",,,1981.
713,,"Datta, P. and Kibler, D.",,,,713,,,,,,,,Utilizing prior concepts for learning. In Proceedings of the ML92 Workshop on Biases in Inductive Learning.,,14.,(1992).
717,"Tahoe City, CA.","Datta, P. and Kibler, D.",In Proceedings of the Twelfth International Conference on Machine Learning.,,,717,,,,,,Morgan Kaufmann.,,Learning Prototypical Concept Descriptions.,,,(1995).
720,"Tahoe City, CA:","Datta, P., and Kibler, D.","In Proceedings of the Twelfth International Conference on Machine Learning,",,,720,,,,,158-166.,Morgan Kaufmann.,,Learning prototypical concept descriptions.,,,1995.
745,"Glasgow, Scotland:","Kibler, D. & Langley, P.",Proceedings of the Third European Working Session on Learning.,,,745,,,,,,Pitman.,,Machine Learning as an Experimental Science.,,,(1988).
747,"Glasgow, Scotland.","Kibler, D. & Langley, P.","In Proceedings of the Third European Working Session on Learning,",,,747,,,,,,Pitman.,,Machine learning as an experimental science.,,,(1988).
749,"Glasgow, Scotland.","Kibler, D. & Langley, P.","In Proceedings of the Third European Working Session on Learning,",,,749,,,,,,Pitman.,,Machine learning as an experimental science.,,,(1988).
750,"Edinburgh, UK.","Kibler, D. & Langley, P.","In Proceedings of the Third European Working Session on Learning,",,,750,,,,,"(pp. 1-12),",,,Machine learning as an experimental science.,,,(1988).
758,Glasgow:,"Kibler, D., & Langley, P.",Proceedings of the Third Eu-ropean Working Session on Learning,,,758,,,,,(pp. 81-92).,Pittman.,,Machine learning as an experimental science.,,,(1988).
801,,Pazzani M. and Kibler D.,,,,801,,"Machine Learning,",,,57-94.,,,The utility of knowledge in inductive learning.,,"9, 1,",(1991).
809,,"Pazzani, M., & Kibler, D.",,,,809,,"Machine Learning,",,,57-94.,,,The utility of background knowledge in inductive learning.,,"9,",(1992).
823,,"Pazzani, M., & Kibler, D.",,,,823,,"Machine Learning,",,,57-94.,,,The utility of knowledge in inductive learning.,,"9,",(1992).
827,,"Pazzani, M., & Kibler, D.",,,,827,,"Machine Learning,",,,57-94.,,,The utility of knowledge in inductive learning.,,"9,",(1992).
830,,"Pazzani, M., & Kibler, D.",,,,830,,"Machine Learning,",,,57-94.,,,The utility of knowledge in inductive learning.,,"9,",(1992).
844,,Michael Pazzani and Dennis Kibler.,,,,844,,"Machine Learning,",,,":57-94,",,,The utility of knowledge in inductive learning.,,(9),1992.
856,"Detroit, MI:","Ruby, D., & Kibler, D.",Proceedings of the Eleventh International Joint Conference on Artificial Intelligence .,,,856,,,,,(pp609-614).,Morgan Kauf-mann.,,Learning subgoal sequences for planning.,,,(1989).
864,,David Ruby and Dennis Kibler.,"In Machine Learning : proceedings of the Ninth International Workshop (ML92),",,,864,,,,,"pages 379-384,",,,Learning Episodes for Optimization.,,,1992.
868,,"T. A. Standish, D. C. Harriman, D. F. Kibler, and J. M. Neighbors,",,,,868,"Department of Information and Computer Science, University of California, Irvine,",,January,,,,,"The Irvine Program Transformation Catalogue,",,,1976.
875,"Seattle, WA:","Townsend-Weber, T., & Kibler, D.",Working Notes of the AAAI94 Workshop on Case-Based Reasoning,,,875,,,,,pp. 30-35,AAAI Press.,,Instance-based prediction of continuous values.,,,(1994).
880,"U. C. Irvine,  CA,","Aha, D. and Kibler, D.","In Proceedings of the Fourth International Conference on Machine Learning,",,,880,,,,,"pages 24-30,",Morgan Kaufmann.,,Learning Representative Exemplars of Concepts: An Initial Case Study.,,,1987.
891,,"D. Aha, D. Kibler, and M. Albert.",,,,891,,"Machine Learning,",,,"37-66,",,,Instance-Based Learning Algorithms.,,6(1),1991.
897,,"Aha, D. W., D. Kibler, and M. Albert.",,,,897,,"Machine Learning,",,,37-66.,,,Instance-based learning algorithms.,,7,1991.
912,,"Aha, D. W.; Kibler, D.; and Albert, M. K.",,,,912,,Machine Learning,,,37-66.,,,Instance-based learning algorithms.,,6,1991.
918,,"Aha, D. W.; Kibler, D.; and Albert, M. K.",,,,918,,Machine Learning,,,37-66.,,,Instance-based learning algorithms.,,6(1),1991.
921,,"Aha, D., Kibler, D. and Albert, M.",,,,921,,Machine Learning,,,37-66.,,,Instance-Based Learning Algorithms.,,6,1991.
925,,"Aha, D., Kibler, D., & Albert, M.",,,,925,,"Machine Learning,",,,37-66.,,,Instance-based learning algorithms.,,6,(1991).
934,,"Aha, D.W., Kibler, D., & Albert, M.K.",,,,934,,"Machine Learning,",,,37-66.,,,"Instance-based learning algorithms,",,6,(1991)
940,,"Aha, D. W.; Kibler, D.; and Albert, M. K.",,,,940,,Machine Learning,,,37-66.,,,Instance-based Learning Algorithms.,,6,1991.
948,,"D. W. Aha, D. Kibler, and M. K. Albert.",,,,948,,"Machine Learning,",,,"37-66,",,,Instance-based learning algorithms.,,6,1991.
958,,"D.W. Aha, D. Kibler, and M.K. Albert.",,,,958,,"Machine Learning,",January,,"37-66,",,,Instance-based learning algorithms.,,6,1991.
973,,"D. W. Aha, D. Kibler, and M. K. Albert.",,,,973,,"Machine Learning,",,,"37-66,",,,Instance-based learning algorithms.,,6(1),1991.
978,,"D. W. Aha, D. Kibler, and J. K. Albert.",,,,978,,"Machine Learning,",,,"37-66,",,,Instance-based learning algorithms.,,6(1),1991.
986,,"David W. Aha, Dennis Kibler, and Marc K. Albert.",,,,986,,"Machine Learning,",,,"37-66,",,,Instance-based learning algorithms.,,6(1),1991.
993,,"D. W. Aha, D. Kibler, and M. K. Al-bert.",,,,993,,"Machine Learning,",,,"37-66,",,,Instance-based learning algorithms.,,6,1991.
1004,,"Aha, D., Kibler, D., & Albert, M.",,,,1004,,"Machine Learning,",,,37-66.,,,Instance-based learning algorithms.,,"6,",(1991).
1010,,J.S. Conery and D.F. Kibler.,,,,1010,,"New Generation Computing,",,,"43-70,",,,And parallelism and nondeterminism in logic programs.,,3,1985.
1023,,"Kibler, D. and Aha, D. W.",,,,1023,,"Computational Intelligence,",,,51-57.,,,Instance-based prediction of real-valued attributes.,,5(2),(1989).
1026,,"Kibler, D., Aha, D.W., & Albert, M.K.",,,,1026,,"Computational Intelligence,",,,51-57.,,,"Instance-based prediction of real-valued attributes,",,5,(1989)
1027,,"Kibler, D., Aha, D.W., & Albert, M.K.",,,,1027,,"Computational Intelligence,",,,51-57.,,,"Instance-based prediction of real-valued attributes,",,5,(1989)
1037,,Micheal Pazzani and Dennis Kibler.,,,,1037,,"Machine Learning,",,,"57-94,",,,The utility of knowledge in inductive learning.,,9,1992.
1057,,"Pazzani, M. & Kibler, D.",,,,1057,,"Machine Learning,",,,57-94.,,,The utility of knowledge in inductive learning.,,9,(1992).
1074,,"Pazzani, M., & Kibler, D.",,,,1074,,"Machine Learning,",,,57-94.,,,The Utility of Knowledge in Inductive Learning.,,"9:1,",(1992).
1077,,"Pazzani, M., and Kibler, D.",,,,1077,,"Machine Learning,",,,57-94.,,,The utility of background knowledge in inductive learning.,,9,(1992).
1088,,M. Pazzani and D. Kibler.,,,,1088,,"Machine Learning,",,,"57-94,",,,The utility of background knowledge in inductive learning.,,9,1992.
1116,,Bruce Porter and Dennus Kibler.,,,,1116,,"Machine Learning,",,,"249-286,",,,Experimental goal regression: A method for learning problem-solving heuristics.,,1,1986.
1119,"San Mateo, CA:","Ruby, D., & Kibler, D.","Proceedings, Ninth National Conference on Artificial Intelligence.",,,1119,,,,,,AAAI Press.,,SteppingStone: An empirical and analytical evaluation.,,,(1991).
1141,"Amherst, Massachusetts, USA,","C.E. Brodley and P.E. Ut-goff,",,,,1141,"Department of Computer Science, University of Massachusetts,",,,,,,,Multivariate versus univariate decision trees.,"COINS Technical Report 92-8,",,1992.
1147,"Amherst, MA,",Carla E. Brodley and Paul E. Utgoff.,,,,1147,"Dept. of Computer Science, University of Massachusetts,",,January,,,,,Multivariate versus univariate decision trees.,"Technical Report COINS-CR-92-8,",,1992.
1151,"Amherst, MA,",Carla E. Brodley and Paul E. Utgoff.,,,,1151,"Dept. of Computer Science, University of Massachusetts,",,January,,,,,Multivariate versus univariate decision trees.,"Technical Report COINS-CR-92-8,",,1992.
1165,,C. E. Brodley and P. E. Utgoff.,,,,1165,,"Machine Learning,",,,,,,Goal-directed Classification Using Linear Machine Decision Trees.,,,1994.
1170,,Carla E. Brodley and Paul E. Utgoff.,,,,1170,,"Machine Learning,",,,"45-77,",,,Multivariate decision trees.,,19,1995.
