tid,address,authors,booktitle,date,editor,id,institution,journal,month,note,pages,publisher,tech,title,type,volume,year
1173,,"Brodley, C. E. and Utgoff P. E.",,,,1173,,"Machine Learning,",,,45-77.,,,Multivariate decision trees.,,"19,",(1995).
1178,,"Brodley, C. E., & Utgoff, P. E.",,,,1178,,Machine Learning.,,,,,,(in press). Multivariate decision trees.,,,
1181,,"Brodley, C. E., & Utgoff, P. E.",,,,1181,,"Machine Learning,",,,,,,Multivariate decision trees.,,,(1994).
1184,,"Brodley, C. E., & Utgoff, P. E.",,,,1184,,"Machine Learning,",,,,,,Multivariate decision trees.,,,(1994).
1208,,C. Brodley and P. Utgoff.,,,,1208,,"Machine Learning,",,,,,,Multivariate trees.,,"19,",1995.
1209,,C. E. Brodley and P. E. Utgoff.,,,,1209,,"Machine Learning,",,,"45-77,",,,Multivariate decision trees.,,19(1),1995.
1232,"Amherst, MA,","Cardie, C.","Proceedings of the Tenth International Conference on Machine Learning,",,"In Utgoff, P., editor,",1232,"University of Massachusetts,",,,,"pages 25-32,",Morgan Kaufmann.,,Using Decision Trees to Improve Case-Based Learning.,,,1993.
1235,"San Mateo, CA,",R. Caruana.,"Proceedings of the Tenth International Conference on Machine Learning,",,"In Paul E. Utgoff, editor,",1235,,,,,"pages 41-48,",Morgan Kaufmann.,,Multitask learning: A knowledge-based of source of inductive bias.,,,1993.
1238,"San Mateo, CA,",Richard Caruana.,"Proceedings of the Tenth International Conference on Machine Learning,",,"In Paul E. Utgoff, editor,",1238,,,,,"pages 41-48,",Morgan Kaufmann.,,Multitask learning: A knowledge-based of source of inductive bias.,,,1993.
1245,"San Mateo, CA,",R. Caruana.,"Proceedings of the Tenth International Conference on Machine Learning,",,"In P. E. Utgoff, editor,",1245,,,,,"pages 41-48,",Morgan Kaufmann.,,Multitask learning: A knowledge-based of source of inductive bias.,,,1993.
1248,"San Mateo, CA,",R. Caruana.,"Proceedings of the Tenth International Conference on Machine Learning,",,"In P. E. Utgoff, editor,",1248,,,,,"pages 41-48,",Morgan Kaufmann.,,Multitask learning: A knowledge-based of source of inductive bias.,,,1993.
1262,"San Mateo, CA:","Clouse, J. A., & Utgoff, P. E.",Proceedings of the Ninth International Conference,,,1262,,Machine Learning:,,,(pp. 92-101).,Morgan Kaufmann.,,A teaching method for reinforcement learning.,,,(1992).
1265,,"Clouse, J., & Utgoff, P.","Proc. 9th Intl. ML Conf.,",,,1265,,,,,92-101.,,,A teaching method for reinforcement learning.,,,1992.
1285,"Seattle,",M. Connell and P. Utgoff.,"in Proceedings AAAI-87,",,,1285,,,,,456-460.,"American Association for Arti-ficial Intelligence,",,"Learning to control a dynamic physical system,",,"Vol. 2,",1987.
1286,"Seattle,",M. Connell and P. Utgoff.,"in Proceedings AAAI-87,",,,1286,,,,,456-460.,"American Association for Artificial Intelligence,",,"Learning to control a dynamic physical system,",,"Vol. 2,",1987.
1302,,"Draper, B. A., Brodley, C. E., & Utgoff, P. E.",,,,1302,,"IEEE Transactions on Pattern Analysis and Machine Intelligence,",,,888-893.,,,Goal-directed classification using linear machine decision trees.,,"16,",(1994).
1307,,"B. A. Draper, Carla E. Brodley, and Paul E. Utgoff.",,,,1307,,"IEEE Transactions on Pattern Analysis and Machine Intelligence,",,,":888,",,,Goal-directed classification using linear machine decision trees.,,16(9),1994.
1368,"San Mateo, CA.","Mitchell, T. M., Utgoff, P. E. & Banerji, R. B.",Machine Learning: An Artificial Intelligence Approach,,"In R.S.  Michalski, J.G. Carbonell, & T.M. Mitchell (Eds.),",1368,,,,,,"Morgan Kaufmann,",,Learning by experimentation: Acquiring and refining problem-solving heuristics.,,"(Vol. I),",(1983).
1369,"San Mateo, CA.","Mitchell, T. M., Utgoff, P. E. & Banerji, R. B.",Machine Learning: An Artificial Intelligence Approach,,"In R.S.  Michalski, J.G. Carbonell, & T.M. Mitchell (Eds.),",1369,,,,,,"Morgan Kaufmann,",,Learning by experimentation: Acquiring and refining problem-solving heuristics.,,"(Vol. I),",(1983).
1375,"Los Altos, CA,","Mitchell, T., Utgoff, P. E., and Banerji, R.",Machine Learning: An artificial intelligence approach.,,"In R. S. Michalski, J. G. Carbonell and T. M. Mitchell (eds.)",1375,,,,,pp. 163-189.,"Morgan Kaufmann, Inc.,",,Learning by Experimentation: Acquiring and refining problem-solving heuristics.,,,(1983).
1391,,"Mitchell, T.M.; Utgoff, P.E.; and Banerji, R.B.",In Machine Learning.,,,1391,,,,,,Morgan Kaufmann.,,Learning by experimentation: Acquiring and refining problem-solving heuristics.,,,1983.
1397,"Palo Alto, CA,","Tom M. Mitchell, Paul E. Utgoff, and Ranan Banerji.","In Machine Learning:  An Artificial Intelligence Approach,",,,1397,,,,,pages 163-190.,"Morgan Kaufmann,",,Learning problem solving heuristics by experimentation.,,,1983.
1420,"San Mateo, CA,",Tom M. Mitchell and Sebastian Thrun.,"Proceedings of the Tenth International Conference on Machine Learning,",,"In Paul E. Utgoff, editor,",1420,,,,,"pages 197-204,",Morgan Kaufmann.,,Explanation based learning: A comparison of symbolic and neural network approaches.,,,1993.
1423,"San Mateo, CA,",Tom M. Mitchell and Sebastian Thrun.,"Proceedings of the Tenth International Conference on Machine Learning,",,"In Paul E. Utgoff, editor,",1423,,,,,"pages 197-204,",Morgan Kaufmann.,,Explanation based learning: A comparison of symbolic and neural network approaches.,,,1993.
1433,"San Mateo, CA.","Mladenic, D.","In Machine Learning Proceedings of the Tenth International Conference,",,"(P.E.Utgoff, ed.),",1433,,,,,pp. 205-211.,"Morgan Kaufmann Pubishers,",,Combinatorial optimization in inductive concept learning.,,,(1993)
1434,,"Moss, E., Cavazos, J., Stefanovic, D., Utgoff, P., Precup, D., Scheeff, D., & Brodley, C.",,,,1434,,,,Submitted for publication.,,,,Learning Policies for Local Instruction Scheduling.,,,(1997).
1438,,"R. Musick, Jason Catlett, and S. Russell.","In ML-93 ,",,Editor: Paul E. Utgoff.,1438,,,,,pages 212-219.,,,Decision theoretic subsampling for induction on large databases.,,,
1439,,"R. Musick, Jason Catlett, and S. Russell.","In ML-93 ,",,Editor: Paul E. Utgoff.,1439,,,,,pages 212-219.,,,Decision theoretic subsampling for induction on large databases.,,,
1441,,"R. Musick, Jason Catlett, and S. Russell.","In ML-93 ,",,Editor: Paul E. Utgoff.,1441,,,,,pages 212-219.,,,Decision theoretic subsampling for induction on large databases.,,,
1451,,John Ross Quinlan.,"In ML-93 ,",,Editor: Paul E. Utgoff.,1451,,,,,pages 236-243.,,,Combining instance-based and model-based learning.,,,
1457,San Mateo.,"Quinlan, J. R.","Proceedings of the 10th International Conference on Machine Learning,",,"In Utgoff, P. E., editor,",1457,,,,,,Morgan Kaufmann.,,Combining instance-based and model-based learn-ing.,,,(1993b).
1467,,Harish Ragavan and Larry Rendell.,"In ML-93 ,",,Editor: Paul E. Utgoff,1467,,,,,pages 252-259.,,,Lookahead feature construction for learning hard concepts.,,,
1477,,Ron Rymon.,"In ML-93 ,",,Editor: Paul E. Utgoff.,1477,,,,,pages 268-275.,,,An SE-tree based characterization of the induction problem.,,,
1494,,P. E. Utgoff.,,,,1494,"Rutgers, Laboratory for Computer Science Research,",,Oct.,,,,,Shift of Bias for Inductive Concept Learning.,"PhD thesis,",,1984.
1528,,"Utgoff, P.","Machine Learning II,",,"In Michalski, R., Carbonell, J., and Mitchell, T., editors,",1528,,,,,pages 107-148.,Morgan Kaufman.,,Shift of bias for inductive concept learning.,,,(1986).
1531,"Los Altos, CA:","Utgoff, P.","Machine Learning: An AI Approach,",,"Eds) in Michalski R., Carbonell J. & Mitchell T.(",1531,,,,,pp.107-148.,"Morgan Kaufmann),",,"Shift of Bias For Inductive Concept Learning,",,Vol. II.,(1985).
1548,"San Mateo, CA:","Utgoff, P. E.",,,"In Michalski, Carbonell, & Mitchell (Eds.),",1548,,"Machine Learning,",,,pp. 107-148.,Morgan Kaufmann.,,Shift of bias for inductive concept learning.,,"Vol.2, chap. 5,",(1986).
1551,"Los Altos, CA.","Utgoff, P. E.","Machine Learning: An Artificial Intelligence Approach,",,"In Michalski, R., Carbonell, J., & Mitchell, T. (Eds.),",1551,,,,,pp. 107-148.,"Morgan Kaufmann,",,Shift of bias for inductive concept learning.,,"Vol. II,",(1986).
1559,,P.E. Utgoff.,"Machine Learning: An Artificial Intelligence Approach,",,"In R.S. Michalski, J.G. Carbonell, and T.M. Mitchell, editors,",1559,,,,,,"Morgan Kaufmann,",,Shift of bias for inductive concept learning.,,Volume II.,1986.
1564,,"Utgoff, P. E.","Machine Learning: An Artificial Intelligence Approach,",,"In Michalski, R.S.; Carbonell, J.G.; and T.M., Mitchell,",1564,,,,,107-148.,Morgan Kaufmann Publishers.,,Shift of bias of inductive concept learning.,,Vol II.,"1986,"
1566,,"Utgoff, P. E.","Machine Learning: An Artificial Intelligence Approach,",,"In Michalski, R.S.; Carbonell, J.G.; and T.M., Mitchell,",1566,,,,,107-148.,Morgan Kaufmann Publishers.,,Shift of bias of inductive concept learning.,,Vol II.,"1986,"
1572,"Los Altos, CA,",P. E. Utgoff.,"Machine Learning: An Artificial Intelligence Approach,",,"In R. S. Michalski, J. G. Carbonell, and T. M. Mitchell, editors,",1572,,,,,"pages 107-148,",Morgan Kaufmann.,,Shift of bias for inductive concept learning.,,10,1986.
1575,"Los Altos, CA,",P. Utgoff.,,,"In R. Michalski, J. Carbonell, and T. Mitchell, editors,",1575,,"Machine Learning,",,,pages 163-190.,"Morgan Kaufmann,",,Shift of bias for inductive concept learning.,,"volume 2,",1986.
1580,"Los Altos, CA,","Utgoff, Paul E.",Machine Learning. An Artificial Intelligence Approach.,,"In Michalski, Ryszard S., Car-bonell, Jaime G., and Mitchell, Tom M., editors,",1580,,,,,pages 107-148.,"Morgan Kauf-mann,",,Shift of bias for inductive concept learning.,,"Volume II,",
1586,"Los Altos, Ca,",P. Utgoff.,,,"In R. S. Michalshi, J. G. Carbonell, and T. M. Mitchell, editors,",1586,,"Machine Learning,",,,page 107.,"Morgan Kaufman,",,Shift Of Bias For Inductive Concept Learning.,,,1986.
1592,,"Utgoff, P. and Saxena, S.","In Proceedings of the Fourth International Workshop on Machine Learning,",,,1592,,,,,pages 115-121.,,,Learning a preference predicate.,,,(1987).
1596,"Ann Arbor, Michigan:","Utgoff, P.",Proceedings of the Fifth International Conference on Machine Learning,,,1596,,,,,(pp. 107 - 120).,Morgan Kaufmann.,,ID5R: An incremental ID3.,,27,(1988).
1605,,P. Utgoff. ID5:,"In Proceedings of the Fifth International Conference on Machine Learning,",,,1605,,,,,"pages 107-120,",,,An Incremental ID3.,,,1988.
1616,"Boston, MA:","Utgoff, P.",Proceedings of the Seventh National Conference on Artificial Intelligence,,,1616,,,,Morgan Kaufmann. Appeared in: Machine Learning: Proceedings of the Eighth International Workshop (ML91).,(pp. 601-606).,,,Perceptron trees: A case study in hybrid concept representations.,,,(1988).
1617,"St. Paul, MN:","Utgoff, P. E.",Proceedings of the Seventh National Conference on Artificial Intelligence,,,1617,,,,,(pp. 601-606).,Morgan Kaufmann.,,Perceptron trees: A case study in hybrid concept representations.,,,(1988).
1631,,Utgoff P. E.,,,,1631,,"Machine Learning,",,,161-186.,,,"Incremental Induction of Decision Trees,",,4,(1989).
1657,,"Utgoff, P. E.",Machine Learning,,,1657,,,,,161-186.,,,Incremental induction of decision trees.,,4(2),1989.
1666,,P. Utgoff.,,,,1666,,"Machine Learning,",,,"161-186,",,,Incremental induction of decision trees.,,4(2),1989.
1668,,P.E. Utgoff.,,,,1668,,"Machine Learning,",,,"161-186,",,,Incremental induction of decision trees.,,4(2),1989.
1674,,Paul E. Utgoff.,,,,1674,,"Machine Learning,",,,"161-186,",,,Incremental induction of decision trees.,,4,1989.
1686,,P.E. Utgoff.,,,,1686,,"Machine Learning,",,,"161-186,",,,Incremental induction of decision trees.,,4,1989.
1711,,"Utgoff, P. E.",,,,1711,,"Connection Science,",,,377-391.,,,Perceptron trees: A case study in hybrid concept representations.,,"1,",(1989b).
1716,,Paul E. Utgoff.,,,,1716,,"Connection Science,",,,"377-391,",,,Perceptron trees: A case study in hybrid concept representations.,,1(4),1989.
1732,"Los Altos, CA.","Utgoff, P. E., & Brodley, C. E.","In Proceedings of the Seventh International Conference on Machine Learning,",,,1732,,,,,,,,An incremental method for finding mul-tivariate splits for decision trees.,,,(1990).
1741,"Los Altos, CA.","Utgoff, P. E., & Brodley, C. E.","In Proceedings of the Seventh International Conference on Machine Learning,",,,1741,,,,,pp. 58-65.,Morgan Kaufmann.,,An incremental method for finding multivariate splits for decision trees.,,,(1990).
1750,"Los Altos, CA.",P. Utgoff and C. Brodley.,"In Proceedings of the Seventh International Conference on Machine Learning,",,,1750,,,,,"pages 56-65,",Morgan Kaufmann.,,An incremental method for find multivariate splits for decision trees.,,,
1752,"Los Altos, CA,",P. E. Utgoff and C. E. Brodley.,"In Proceedings of the Seventh International Conference on Machine Learning,",1990.,,1752,,,,,"pages 58-65,",Morgan Kaufmann.,,An incremental method for finding multivariate splits for decision trees.,,16,
1756,"Los Altos, CA,",Paul E. Utgoff and Carla E. Brodley.,"In Proceedings of the Seventh International Conference on Machine Learning,",,,1756,,,,,"pages 58-65,",Morgan Kauf-mann.,,An incremental method for finding multivariate splits for decision trees.,,,1990.
1783,"San Mateo, CA,",P. E. Utgoff and J. A. Clouse.,"In Proceedings of the Ninth Annual Conference on Artificial Intelligence,",1991.,,1783,,,,,"pages 596-600,",Morgan Kaufmann.,,Two kinds of training information for evaluation function learning.,,,
1808,"University of Massachusetts, Amherst MA,",Paul E. Utgoff and Carla E. Brodley.,,,,1808,,,,,,,,Linear machine decision trees.,"Technical Report 10,",,1991.
1819,,"Utgoff, P. E.","in Machine Learning: Proceedings of the Eleventh International Conference,",,,1819,,,,,pp. 318-325.,"Morgan Kaufmann,",,An improved algorithm for incremental induction of decision trees,,,"(1994),"
1820,"New Brunswick, NJ:","Utgoff, P. E.",In Proceedings of the Eleventh International Conference on Machine Learning,,,1820,,,,,(pp. 318-325).,Morgan Kaufmann.,,An improved algorithm for incremental induction of decision trees.,,,(1994).
1821,"New Brunswick, NJ:","Utgoff, P. E.",In Proceedings of the Eleventh International Conference on Machine Learning,,,1821,,,,,(pp. 318-325).,Morgan Kaufmann.,,An improved algorithm for incremental induction of decision trees.,,,(1994).
1825,"Rutgers University, New Brunswick, NJ,","Utgoff, P.","Proceedings of the Eleventh International Conference on Machine Learning,",,"In Cohen, W. and Hirsh, H., editors,",1825,,,,,"pages 318-325,",Morgan Kaufmann.,,An Improved Algorithm for Incremental Induction of Decision Trees.,,,1994.
1828,,Paul E. Utgoff.,"In ML-94 ,",,Editors: William W. Cohen and Haym Hirsh.,1828,,,,,pages 318-325.,,,An improved algorithm for incremental induction of decision trees.,,,
1836,,Paul E. Utgoff.,"In ML-94 ,",,Editors: William W. Cohen and Haym Hirsh.,1836,,,,,pages 318-325.,,,An improved algorithm for incremental induction of decision trees.,,,
1837,"San Francisco, CA:","P.E. Utgoff,","Proceedings of the Eleventh International Conference on Machine Learning,",,,1837,,,,,318-325.,"Morgan Kaufmann,",,An improved algorithm for incremental induction of decision trees.,,,
1840,"University of Massachusetts, Amherst.","Utgoff, P. E.",,,,1840,,,,,,,,"Decision tree induction based on efficient tree restructuring,","Technical Report 05-18,",,"(1995),"
1847,"University of Massachusetts,",Paul E. Utgoff.,,,,1847,,,March,,,,,Decision tree induction based on efficient tree restructuring.,"Technical Report 95-18,",,1995.
1854,"Amherst, MA.",Paul E. Utgoff.,,1996.,,1854,"University of Massachusetts,",,,,,,,Feature function learning for value approximation.,Technical Report 96 09.,,
1864,"Amherst, MA: University of Massachusetts,","Utgoff, P. E., & Precup, D.",,,,1864,Department of Computer Science.,,,,,,,"Constructive function approximation,","(Technical Report 97-04),",,(1997).
1865,"Amherst, MA: University of Massachusetts,","Utgoff, P. E., & Precup, D.",,,,1865,Department of Computer Science.,,,,,,,"Constructive function approximation,","(Technical Report 97-04),",,(1997).
1870,"Palo Alto, CA:","Yee, R. C., Saxena, S., Utgoff, P. E., & Barto, A. G.",Proceedings of the Eighth National Conference on Artificial Intelligence,,Yoshio.,1870,,,,,(pp. 882-888).,AAAI Press.,,Explaining Temporal Differences to Create Useful Concepts for Evaluating States.,,,(1990).
