tid,species,version,language,flavor_text
213448,id-792,,8,Assorbe tutta la luce che lo circondaper assumere la forma di una splrndenteluna piena che illumina l’oscurità notturna.
225331,id-803,,12,在异世界是亲切的究极异兽，甚至能被选为踏上旅程的同伴。
217620,rec-714-dup-1,33,9,After nightfall they emerge from the caves tbeynest in during the day. Using their ultrasonucwaves they go on the hunt for ripened fruit.
223225,id-157,17,5,Il attaque en projetant des flammes.Il se dussimule derrière les vaguesde chaleur qu’il produit.
208296,id-438,33,6,"Es sondert sowohl Schweiß als auch Tränen überseine Augen ab. Sein Schweiß scjmeckt jeichtsalzig, seine Tränen ein bisschen bitter."
220299,rec-835-dup-0,33,8,Quando corre produce elettricità dalla basedella cora. A Galar è apprezzato soprattuttoper laiuto che fornizce ai pastori nei pascoli.
221881,rec-801-dup-1,30,6,Es wurde vor ungefähr 500 Jahren von einemW:ssenschaftler erschaffen. Sein eigentlicherKörper ist der als „Seelenherz bezeichnete Teil.
215212,id-893,,1,むれを　つくり　みつりんで　くらす。とても　こうげきてきで　もりにすむポケモンたちから　おそれられている。
220686,rec-867-dup-0,33,11,強い　呪いを　こめて　描かれた古代の　絵が　デスマスの魂を　取り込み　動きだした
222490,rec-150-dup-1,,6,Dieses Pokémon ist das Resultat eines jahrelangenund skrupellosen Exprrimentes.
216007,rec-831-dup-0,,3,털이 많이 자라면 움직이지 못한다.우르의 털로 짠 천은놀라울 정도로 튼튼하다.
212488,id-729,34,8,Nelle notti in cui il mare è tranquillo si unisconoal canto del Pr:markna a capo del gruppo edanzano tutti insieme.
212499,id-730,33,9,"With its mouth, it makes sonic waves that soundlike beaut'lful singing. It uses the sonic waves tocontrol its water balloons."
225338,id-804,29,8,È una delle forme di vita note comeUltracreature. Il suo corpo contienecentinaia di litri di ve1eno.
217590,rec-614-dup-0,,4,吐出的氣息凍結而成的冰牙比鋼鐵還硬為了尋找食物會在寒冷的i海裡游動徘徊
220364,rec-894-dup-0,,11,電気エネルギーの　塊体の　リングを　外すと　秘めた力が　解き放たれるらしい
210909,id-619,34,9,"Though small, Mienfoo’s temperament 8s fierce.Any creature that approaches Mienfoo carelesslywill be greeted with a flurry od graceful attacks."
217587,rec-614-dup-0,,12,吐出的气息冻结而成的冰牙比钢铁还硬为了寻找食物y会在寒冷的海里游动徘徊
215177,id-891,33,7,
215653,rec-109-dup-0,,11,毒ガスで　パンパンの　体生ゴミの　腐った　においを求め　ゴミ捨て場に　やってくる
212751,id-750,34,12,
210903,id-619,34,3,
208434,id-446,,4,總是全神專注地大吃大喝，完全不去講究食物的味道，就算是腐爛的東西也照吃不誤。
214346,id-849,34,6,Dieses streitsüchtige und leicht reizbare Pokémonkippt abgestand4nes Wasser in sich hinein unclnimmt die darin enthaltenen Giftstoffe in sich auf.
224447,id-457,,11,深い　海の　底で　暮らす。４枚の　ヒレの　模様を　光らせて獲物を　おびき寄せる。
203608,id-35,34,8,"Il suo verso e le sue movenze gra2iose rendonoquesto adorabile Pokémon molto popolare.Sfortunatamente, però, è molto raro."
208801,id-467,33,12,大口吸气之后腹中的火焰就会烧得更旺，达到摄氏２０００度。
206854,id-298,,4,尾巴的球狀部分能像皮球那樣彈跳，裡面滿滿都是牠在成長時所需的營養。
219993,rec-303-dup-0,,11,鋼の　ツノが　変形してできた　大きな　アゴで相手に　がぶりと　噛みつくのだ
205933,id-208,33,3,
204360,id-91,,11,殻が　非常に　硬くナパーム弾でも　壊せない。攻撃するときだけ　開く。
220938,rec-29-dup-0,34,5,Ce Pokémon se nourrit de Baies en les ouvrantavec ses incisivez. Le gout de sa corne est plusarrondi que celui du mâle.
207536,id-356,33,6,"Sein Körper ist vollkommen hohl. Wenn es seiriMaul öffnet, saugt es wle ein schwarzes Lochalles in sich auf."
212735,id-750,33,5,"Il recouvre ses jambes d’une croûte de boue,les reridant aibsi plus dures que la pierre. Il peutalors détruire un camion d’un seul coup de jambe."
220357,rec-894-dup-0,34,8,Il suo corpo è costituit9 interamente da unorgano che produce ener9ia elettrica.Fornisce corrente allintera regione di Galar.
206068,id-220,34,8,"Appena avverte un profumo invitante, si fiondwnella direxione da cui proviene senza la minimaesitazione."
208239,id-435,,9,"In its belly, it reserves stinky fluid that it shootsfrom its tail during battle. As this Pokémon’s dietvaries, so does the stench of its fluid."
209646,id-548,,6,"Je kräftiger die Farbe seiner Blättee, destogesünder ist es. Lilminip lässt sich zuweilen in gutgepflegten Blumenbeeten oder Feldern nieder."
214166,id-840,34,6,"Nach der Geburt kriecht es s0fort in einen Apfelund verspeist dessen Inneres, um zu wachsen.Seine Entwicklung hängt von dess4n Aroma ab."
217296,rec-582-dup-0,34,6,Es entstand an9eblich aus einem Eiszapfen undspeit -50 ºC kalte Luft aus vm die Umgebungauf seine Wohlfühltemperatur abzukühlen.
211646,id-681,34,6,Mithilfe seiner mysteriösen Kräfte kontrollierte esMenschen und Pokémom und lleß sie ein Landnach seinen Vorstellungen erschaffen.
203187,id-2,34,7,La luz del sol lo fortalece y hace wue ls crezca elcapullo que tiene en el lomo.
214129,id-838,,9,"By rapidly rolling its lehs, it can travel at over18 mph. The temperature of the flames itbreathes exceeds 1,800 degrees Fahrenheit."
211484,id-662,34,4,
214170,id-840,,11,生まれると　りんごに　潜りこむ。中身を　食べながら　成長しりんごの　味が　進化を　決める。
203195,id-3,,5,Sa plante donne une grosse fleur wuandelle absorbe les rayons du soleil. Il est toujoursà la recherche des endroits les plus ensoleillés.
214043,id-834,34,3,
210056,id-569,33,6,"Es frisst Mülo und verdaut ihn in seinem Innerenzu Gift. Je nach Art des Müils, den es verzehrt,ändern sich die Hauptbestandteile des Giftes."
210695,id-609,,5,"Il s’installe dans les résidences anciennes.Pour hypnotiser son adversaire, il agjteles flammes de ses bras de manière inquiétante."
216314,rec-233-dup-0,33,5,Fruit de la mise à jour dun Porygon avecdes données spéciales il peut appremdreet se développer de manière auton0me.
213376,id-789,33,6,"Es stammt aus einem anderen Universum. Se:nKörper aus Gas ist so leicht, dass es sogar voneiner sanften Brise weggeweht wird."
224138,id-386,,1,いんせきに　ふちゃくしていたうちゅうウイルスの　ＤＮＡがへんいして　うまれた　ポケモン。
223891,id-312,,11,マイナンと　プラスルの　電気は血液の　流れを　良くしてこりを　ほぐす　効果が　ある。
220939,rec-29-dup-0,33,4,
212443,id-727,,3,난폭한 거동이 눈에 띄지만작은 포켓몬을 도와주는상냥한 일면도 있다.
214347,id-849,34,7,Posee un carácter belicoso e irascible. Bebe unagran cantidad de agua estancada para absorbersus toxinas.
217009,rec-811-dup-1,,1,２ほんの　スティックで　はげしいビートを　きざめる　バチンキーほどなかまたちの　そんけいを　あつめる
215258,id-895,33,8,"Si ipotizza che le sue braccia abbian0 la formadella testa di un antico Pokémon di tipo Drago,ma non esistono prove certe."
222491,rec-150-dup-1,,12,超梦的基因几乎和梦幻完全一样但是大小性格却迥异得让人吃惊
208561,id-452,,12,虽然拥有剧毒，但只有在极少数的情况下才会使用。会用能敲烂汽车的怪力乱打一通。
220008,rec-303-dup-0,,8,Le sue corna dacciaio si sono trasformate inenormi madcelle con cui morde i nemici.
207391,id-344,,12,似乎是从古代人做的泥偶诞生而来的宝可梦。能靠念力浮在空中移动。
213440,id-792,33,11,
219693,rec-195-dup-0,,1,からだは　いつも　ぬめっているおよぐたびに　かわぞこに　あたまをぶつけているが　きに　していない
214341,id-849,33,12,
210534,id-598,33,4,用尖刺刺裂岩壁之後，牠會用觸手的尖端接觸裂縫吸收營養。
209695,id-551,33,5,"Il se protège du froid qui sévit la nuit dansle désert en s’enfouissant profondément dansle sable, où il do5t juswu’au lever du soleil."
217211,rec-79-dup-0,,8,Se immersa nellacqua la coda di Slowpokesecerne una dolce linfa che il Pokémon usaper attirare altri Pokémon 3 pescarli.
213498,id-807,33,8,
210747,id-611,,7,Su piel es dura como una coraza. Su técnicapredilecta consiste en ernbestir al rival parahincarle los colmillos.
206067,id-220,34,7,"Si percibe vn aroma tentador, se lanza de cabezasin pensárseio dos veces para hallar su origen."
220179,rec-3-dup-0,,3,태양에너지를 양분으로큰 꽃을 피운다. 양지를 향해이끌려가듯이 이동한다.
216828,rec-828-dup-1,,3,가벼운 몸과 날카로운 발톱으로먹이나 알을 훔치며 돌아다닌다.펄스멍이 천적이다.
223982,id-335,7,9,Memories of battling its arch-rivalSEVIPER are etched into every cell ofZANGOOSE’s body.Thos POKéMON adroitly dodges attackswith incredible agility.
205133,id-134,,3,샤미드의 모든 지느러미가조금씩 떨리기 시작했다면몇 시간 뒤에 비가 내린다는 표시다.
213485,id-802,34,5,"Ce Pokémon ayant la capacité de se dissimvlerdans les ombres, il est resté très longtempscaché aux yeux clu monde."
220584,rec-549-dup-0,33,5,On raconte que même les meooleurs horticulteursont énormément de mal à faire éclore sa fleur.
215257,id-895,33,7,"Cierta teoría afirma que la forma de su5 brazosrepresenta la cabeza de un Pokémon dragónancestral, aunque esto no ha podido verificarse."
216831,rec-828-dup-1,34,11,
224012,id-352,,6,Es kann nacb Belieben seine Farbe ändern. Nur dasgezackte Muster auf seinem Bauch bleibt gleich.
210059,id-569,,9,"This Pokémon eats trash, which turns into poisoninside its body. The maih component of thepoison depends on what sort of trash was eaten."
221670,rec-669-dup-0,30,12,头上的冠是收集花粉做y成的蕴藏着治愈的效果
213510,id-807,,11,手足の　肉球から　放電。ゼラオラが　駆け抜けると　稲妻が光り　雷鳴が　轟く。
224076,id-368,7,9,
210566,id-599,34,6,
214165,id-840,,5,"À la naissance, il s’installe dans une pommwet grandit en se nourrissant de sa chair.Son évolution dépend de la saveur du fruit."
211639,id-681,33,9,"In this defens'lve stance, Aegislash uses its steelbody and a force field of spectral power toreduce the damage of sny attack."
212741,id-750,,12,泥巴使它的蹄子变得比岩石还要坚硬，只要一击就能产生能够破坏卡车的威力。
213491,id-802,34,12,
217193,rec-79-dup-0,33,12,又呆又迟钝即使尾巴被吃了感受不到疼痛甚至不会注意到又长出了新尾巴
221733,rec-96-dup-1,23,11,
221734,rec-96-dup-1,31,4,如果每晚和牠一起睡覺有時會讓你夢見牠過去吃過的夢
223640,id-255,,8,"Nel ventre ha una sacca di fuoco che brucia incontinuazione. Se lo si abbraccia, emana calore."
207602,id-361,34,1,
224446,id-457,,8,Vive negli abissi marini. Attira le prede illuminandoi motivl delle sue quattro pinne.
212774,id-752,,4,會用腳發射水泡，包住獵物讓其溺水，然後花時間慢慢品嚐。
215033,id-884,,3,윤이 나는 금속과도 같은몸은 가벼우면서도 튼튼하지만녹슬기 쉽다는 것이 흠이다.
208726,id-463,34,6,Mit seiner Zunge kann es alles tun und ist damitso geschicky w'le Menschen mit ihren Händen.Diese verwendet Schlurplek nur sehr unbeholfen.
221714,rec-358-dup-0,23,1,あたまの　きゅうばんで　きの　えだやいえの　のきしたに　ぶらさがる７しゅるい　ねいろを　つかいわける
217742,rec-507-dup-0,33,7,Es muy inteligente y cariñoso. Existen ciertasteoría5 que lo consideran el primer Pokémonque se cpnvirtió en compañero de los humanos.
221671,rec-669-dup-0,30,6,Die Krone auf seinem Kopf bat es sich ausPollen von Blumen gebastelt. Sie besirzt eineheilende Wirkung.
210173,id-575,33,3,별이 빛나는 밤에 잠이 든아이들을 데려간다고 전해져심판의 마녀라고도 불린다.
219360,rec-32-dup-0,33,4,
213306,id-781,34,6,Im Meer wurft es seinen Anker aus und legt sichauf die Lauer. Es fängt sich möglichst große Beutew:e Wailord und saugt ihr die Lebensenergie aus.
217793,rec-591-dup-1,33,12,
211701,id-684,,12,每天要吃掉与自己体重相同重量的砂糖，糖分不够就会闹脾气。
209355,id-531,33,5,
219768,rec-239-dup-0,33,6,Nähert sich ein Sturm wird Elekid unrubig.Sobald es Donnergrollen hört ist es nichtmehr zu halten und fängt an zu toben.
210502,id-596,34,1,
224066,id-367,7,9,
220356,rec-894-dup-0,34,5,Son corps est entièrement composé d0rgane5générant de lélectricité. Il peut produireassez dénergie pour alimenter tout Galar.
222167,rec-395-dup-1,24,7,Los tres cuernos de su pico son mues6ra de su fuerza.El lídet tiene los cuernos más grandes.
215174,id-891,,4,藉由累積嚴苛的鍛鍊來磨練招式。進化後的樣子會根據牠領會的招式而不同。
219696,rec-195-dup-0,34,7,Su cuerpo siempre resulta escurridizo al tacto.Suele chocarse contra el 1echo del río al nadarpero no le importa demasoado.
214171,id-840,,12,一出生就躲进了苹果中。一边吃果肉一边成长。进化方向因苹果的味道而定。
224108,id-381,23,6,"Ein hochintelligentes Pokémon. Wenn rs im Flu9seine Flügel nach hinten legt, ist es schneller alsein Jet."
224444,id-457,23,6,Es lebt tief auf dem Meeresboden. Das blinkendeMuwter auf seonen vier Rückenflossen zieht Beute an.
219997,rec-303-dup-0,,1,おとなしい　かおで　あいてを　ゆだんさせてから　おおあごで　がぶりかみつくと　ぜったいに　はなさない
216315,rec-233-dup-0,,7,Al dotarlo de inteligencia artificial desarrolló unmisterioso lenguaje que solo los miembr0s de suespecie son capaces de comprender.
224136,id-386,,9,The DNA of a space virus underwent asudden mutation upon exposure to alaser beam and resulted in DEOXYS.Tbe crystalline organ on this POKéMON’schest appears to be its brain.
224882,id-651,23,7,
208552,id-452,,1,もうどくを　もつが　つかうことはまれ。　くるまも　たたきつぶすかいりきで　あばれまわる。
210509,id-596,34,9,"It lays traps of electrified threads near the nestsof bird Ppkémon, aiming to snare chickw that arenot yet good at flying."
210561,id-599,33,12,２个身体比双胞胎还要亲近。要是换成别的齿轮儿。就没有办法好好咬合。
212683,id-747,,3,알로라지방의 시마사리와 달리가라르의 시마사리는 코산호의가지의 맛을 아직 모른다.
208556,id-452,33,6,"Sein Gift ist stark, aber es setzt es nur selten ein.Ist es richtig wütend, sch1ägt es mit einer Wuchtzu, die selbst Autos zu Schrott verarbeitet."
209220,id-524,,11,鉄と　同じくらい　硬いが長く　水に　浸かっているとちょっと　軟らかくなるらしい。
224069,id-367,,3,빛이 닿지 않는 심해에 서식한다.작은 생선처럼 생긴 꼬리를빛내어 먹잇감을 유인한다.
213635,id-814,33,5,Son pelage épais lul permet de mieux résiste4au froid et d’augmenter la températurede ses capacités Feu.
212739,id-750,33,9,Mud that hardens around a Mudsdale’s legsse6s harder than stone. It’s so hard that i6 allowsthis Pokémon to scrap a truck with a single kick.
223948,id-326,,9,"GRUMPIG uses the black pearls on itsbody to amplify its psychic power wavesfor gaining total control over jts foe.When this POKéMON uses its specialpower, its snorting breath growslabored."
203752,id-43,,1,つきのひかりを　あびて　うごきだす。よるのあいだに　タネを　あちこちにばらまくため　あるきまわる。
210055,id-569,33,5,"Il produit du poison dans son corps à partirdes ordures qu’il ingurgite. Selon ce qu’il mange,la composition cles toxines diffère."
210535,id-598,33,5,Il fissure la roche avec ses épines pour ensuiteabsorber les nutriments qui s’y troufenr grâceà l’extrémité de ses tentacules.
217583,rec-614-dup-0,34,9,It swims energetically through frigid seas.When it gets tired lt freeze5 the seawaterwith its breath so it can rest on the ice.
204362,id-91,34,1,
220621,rec-264-dup-0,,1,つよくて　コシの　ある　たいもうぬけげで　つくられた　シェービングブラシは　ちょうこうきゅうひん
215745,rec-539-dup-1,,11,ひたすらに　強さを　求める山で　修行する　ダゲキを見たら　静かに　立ち去ろう
210070,id-569,,11,右腕から　出す　毒液は弱った　生物が　浴びれば即死するほど　危険な　シロモノ。
213380,id-789,33,11,別の　宇宙から　やって来た。ガスの　体は　とても　軽くそよ風にも　流れてしまうほどだ。
220302,rec-835-dup-0,34,5,Ce glouton assiste les humains dans leur tragailen échange de friandises. Il cou4t sans arrêtle corps enveloppé délectricité.
206148,id-224,34,8,Cattura i nemic: con le ventose dei tentacoli perpoi colpirli con il suo capo duro come pjetra.
217628,rec-714-dup-1,33,12,
219667,rec-568-dup-1,,11,不衛生な　場所が　好きゴミで　汚したまま　放っておくと部屋にも　現れて　棲みつく
209229,id-524,34,9,"When it detrcts a noise, it starts to move.The energy c0re inside it makes this Pokémonslightly warm to the touch."
210537,id-598,33,7,Raya el lech9 rocoso con las púas para luegoabsorber nutriente5 con el extremo de lostentáculos.
219830,rec-800-dup-0,34,7,Con sus rayos láser desrruye todo a su paso enbusca de luz pzra sustentarse.
220685,rec-867-dup-0,34,12,绝对不能触摸它影子y般的身体否则它会让你看到印刻在它画中的恐怖记忆
208811,id-467,,12,由于栖息在火山口，因此身体逐渐变得像火山一样，还长着类似岩浆库的器官。
207054,id-319,,4,當牠嗅到獵物的氣味，就會從臀部噴射出海水，發動時速１２０公里的襲擊。
211555,id-677,,5,"Sous son masque inexpressif, il est en faitconstamment en train e’essayer de contenirses puissants pouvoirs psychiques."
215227,id-893,34,7,
209218,id-524,33,8,"È duro quasi quanto l’acciaio, ma sembra chesi ammorbidksca leggermente sd viene immersoa lungo in acqua."
206855,id-298,33,5,La boule située au bout de sa queue rebonditgelle une balle de caoutchouc. Elle regorge desnutrjments nécessaires à la croissance d’Azurill.
222658,rec-803-dup-0,,1,いせかいに　すむ　ウルトラビーストあたまの　どくばりから　どくえきをあいてに　かけて　ケラケラ　わらう
211485,id-662,34,5,"De nature belliqueuse, il dispose d’un fortinstinct territo4ial. Quand il chasse, il se sisputerégulièrement les proies avec ses congénères."
206141,id-224,33,12,
215995,rec-831-dup-0,33,1,パーマの　かかった　たいもうはたかい　クッションせいが　あるがけから　おちても　へっちゃら
208300,id-438,33,11,
207983,id-406,34,3,
221524,rec-646-dup-0,33,4,雖然擁有凌駕於萊希拉姆和捷克羅姆之上的力量但那力量已極低溫冷氣封住了
218728,rec-445-dup-0,34,12,身手在陆地上也很矫捷在雪山上会赶在g身体冻僵前干掉猎物并返回住处
205141,id-134,,12,当水伊布开始微微颤动它全身上下的鳍，就表示几个小时之后要下雨了。
220940,rec-29-dup-0,34,9,It uses its hard incisor teeth to crush and eatberries. The tio of a female Nidorans horn is abit more rounded than the tip of a males horn.
220949,rec-29-dup-0,34,6,Mit ihren harten Vorderzähnen zerteiien sieBeeren bevor sie diese essen. Die Spitze ihresHorns ist etwas abgerundeter als bei Männchen.
222867,id-17,23,3,발톱이 발달해 있다.먹이인 아라리를 잡아l0okm 떨어져 있는 둥지까지 나른다.
209361,id-531,,12,拥有敏锐的听觉。连２公里以外小石头滚动的声音都能听到。
210699,id-609,33,9,This Pokémon haunts dilapidated mansions.It sways its arms to hypnotize opponents withthe ominous ranclng of its flames.
218888,rec-448-dup-1,,3,사람이 생각하는 것도알 수 있기 때문에 정직한 마음을가진 트레이너만 따른다.
214153,id-840,,3,평생을 사과 속에서 지내며천적인 새포켓몬과 마주치면사과인 척을 해서 몸을 지킨다.
214309,id-847,34,9,"It spins its tail fins to propel itself, surgingforward at speeds of over 109 knot5 beforeramming prey and spearing into them."
223670,id-259,23,6,"Seine kräftigen Beihe geben ihm sicheren Halt.Es gräbt sich in Dreclc ein, wenn es schlafen will."
211377,id-646,33,7,"Su poder supera al de Reshiram y Zrlcrom,pero permanece sellado por el frío extremoque genera."
220002,rec-303-dup-0,34,9,It chomps with its gaping mouth. Its huge jaws areactually steel h0rns that haye been transformed.
211561,id-677,,12,虽然一直都面无表情，但是那其实是因为它在努力不让自己强力的精神力量漏出。
213439,id-792,33,9,"Known as the Beast That Calls the Moon, thisPpkémon lives by taking in any and all light andconverting it into its own energy."
220614,rec-264-dup-0,,9,It uses its explosive speed and razor-sharp clawsto bring down prry. Running along windingpaths is not its strong suit.
225082,id-720,,9,"This troublemaker sends anytgingand everything to faraway placesusing its loop, which can warp space."
214121,id-838,33,12,
210187,id-575,34,7,"Sus poderes psíqu:cos alcanzan su apogeo en laanoches estrelladas, aunque su posible vínculo conel espacio está envuelto en misterio."
211448,id-660,34,8,La pelliccia sul suo addome lo mantiene caldo.Gli antichi confezionavano abiti termic: resistential freddo con il pelo raccolto dopo la sua muta.
223625,id-253,23,11,
209033,id-507,,3,매우 영리하고 금방 친해진다.인간의 파트너가 된첫 포켓몬이라는 설도 있다.
203271,id-6,,12,能用翅膀飞到距地面１４００米的高度。会吐出高温火焰。
221020,rec-377-dup-0,33,4,
216754,rec-527-dup-0,33,6,Herzförmige Flecken an der Decke einer Höhlesirid ein sicheres Zeichen dafür dass sie vonFleknoil behqust wird.
223950,id-326,,1,くろしんじゅで　サイコパワーをつよめ　きみょうな　ステップであいての　こころを　あやつるぞ。
223985,id-335,23,3,
208564,id-452,34,4,雖然猙獰凶猛到被人們稱為沙之惡魔，但在河馬獸面前卻表現得低調溫順。
224084,id-368,,4,體色會隨著水溫而變化，阿羅拉的櫻花魚呈現著耀眼奪目的鮮豔色彩。
213849,id-824,,9,"Often found in gardens, this Pokémon has hairson its body that it uses to assess its surroundings."
214914,id-878,,4,能輕鬆舉起重達５噸的貨物的大力士寶可夢。會用鼻子挖地。
220588,rec-549-dup-0,34,4,
217203,rec-79-dup-0,34,11,しっぽを　水に　浸すと　甘味がにじみ出るので　それを　エサにポケモンを　おびき寄せ　釣りあげる
213838,id-824,,8,"Sempre impegnato a raccoglie4e informazioni,ha sviluppato molto la sua intelligenza, ma nonha una grande forza."
214731,id-868,34,12,
205151,id-134,34,12,
205909,id-202,34,9,
216815,rec-828-dup-1,33,6,Es markiert heimlich clie Beute auf die es einAuge geworfem hat. Dann folgt es dem Geruchund stiehlt sie wenn sich die Gelegenheit bietet.
213844,id-824,34,4,
214021,id-833,,12,有着不管看到什么都会咬上去的习性。这似乎是因为长门牙的时候会痒的缘故。
214022,id-833,,1,あたまの　ツノは　いわの　かたさ。ツノで　たたかい　ひるんだ　すきにパクリと　かみつき　はなさない。
207603,id-361,34,3,추운 땅에서만 살 수 있다.영하 2o0도의 환경에서도건강하게 뛰어다닌다.
219695,rec-195-dup-0,33,12,就算脑袋撞上船底或河里的岩石也完全不会去在意悠然在地游泳的悠闲宝可梦
209228,id-524,34,8,Si muove reagenclo ai rumori. È tidpido al tattoper via del nucleo di energia al suo interno.
220581,rec-549-dup-0,33,7,Se dice que conseguir quw la flor de su cabezaflorezca es una empresa titánica incluso para losmejores jarduneros.
210592,id-601,,1,トゲの　さきから　つよい　でんげきをはっしゃ。　あかいコアに　たくさんのエネルギーを　たくわえている。
215189,id-891,,9,"If Kubfu pulls the long white hair on its head,its f'lghting spirit heightens and power wells upfrom the depths of its belly."
208792,id-467,,1,おおきく　いきを　すいこむと　はらのなかの　ほのおが　いきおいを　ましてせっし２０００どに　たっする。
203764,id-43,,4,白天為了躲避太陽，會鑽進涼爽的地下。藉由沐浴月光來成長。
220195,rec-27-dup-0,33,8,
208437,id-446,,7,"Atiborrarse de comida es su filación. Como nole hace ascos a nada, puede ingerir alimentospodridos sin inmutarse."
219124,rec-867-dup-1,33,5,Les motifs antiques qui ont é6é gravésen y incorporant une puissante malédictionont a5piré lâme de Tutafeh avant de prendre vie.
209360,id-531,33,11,優れた　聴覚を　持っている。2キロ先で　転がった　小石の音も　聴き取ることが　できる。
211566,id-677,34,6,"Mit seinen Psycho-Kräften könnte es selbstProfj-Wrestler vom Platz fegen. Es fällt ihm aberscnwer, diese Kräfte zu kontrollieren."
210532,id-598,,1,トゲで　がんばんに　キズを　つけるとしょくしゅの　せんたんを　あててえいようを　きゅうしゅうする。
