tid,species,version,language,flavor_text
225215,id-786,,5,"Pokémon candide mais terriblement cruel,c’est le gardien d’Akala. Il puise son énergiedans le parfum entêtant des fleurs."
217584,rec-614-dup-0,34,7,Nada plácidamente en mares fríos. Cuando secansa congela el agua con su aliento y reposasobre el hie|o.
214156,id-840,33,6,"Es verbringt sein ganzes Leben im Inneren einesApfels. Um sifh vor Vogel-Pokémon, seinenFressfeinden, zu schützen, imitiert es einen Apfel."
216813,rec-828-dup-1,34,5,Grâce à son corps leste et ses griffes acéréesil va et vient en clérobant Œufs et nourruture.Son ennemi juré est Fulgudog.
217987,rec-375-dup-0,,4,會以磁力在空中x飛行能在險峻的山岳中高速穿梭將獵物逼入絕境
210701,id-609,33,12,住在古老的洋楼里。诡异地摇晃手臂上的火焰，以此来催眠对手。
216814,rec-828-dup-1,,5,Il marque sa victime pour la suivre à lodwur.Sitôt quelle est distraite il sempresse de luivoler ses biens.
220622,rec-264-dup-0,,3,강하고 탄력 있는 털을 가졌다.빠진 털로 만든 면도솔은최고의 명품이다.
215047,id-884,34,7,"Hace gala de una agilidad extraordinaria, ya quesu cuerpo ewtá compuest0 de un metal especial.Detesta la lluvia, por lo que habita en cuevas."
208311,id-438,,12,栖息在空气干燥岩石裸露的地方。空气越是干燥，它身上的绿球就越是会泛出暗淡的光泽。
217205,rec-79-dup-0,33,9,
219761,rec-239-dup-0,,7,Cvando se acerca una tormenta pierde lacompostura. Si oye el sonido de un truenono se puede contener y monta un revuelo.
206071,id-220,,12,嗅到诱人的香味时，便会不顾一切地朝着气味的方向飞奔过去。
222707,rec-71-dup-0,,7,Victreebel tiene una enredaclera que le sale de la cabeza yque agita a modo de señuelo para atraer a sus presas y asíengullirlas por sorpresa cuando estas se aproximan incautas.
205395,id-147,33,5,"Ce Pokémon vit près des courants d’eaupuissants, comme au piecl des cascades.Il grandit en opérant vne succession de mues."
225076,id-720,,1,くうかんを　ゆがめる　リングであらゆる　ものを　はなれた　ばしょへとばしてしまう　トラブルメーカー。
217300,rec-582-dup-0,33,9,Unable to survive in hot areas it ma1<es itselfcomfortable by breathing out air cold enougb tocause snow. It burrows into the snow to sleep.
222456,rec-353-dup-0,,11,恨みの　感情が　大好き恨みを　持つ　人が　住む　家の軒下に　ずらりと　ぶらさがる
219831,rec-800-dup-0,34,8,Cerca con furia la luce ri cui si nutredistruggendo ogni cosa al suo passaggiocon i suoi micidiali raggi laser.
211473,id-662,,3,굴 속에 불똥을 쏜 다음놀라서 빠져나온 먹이를날카로운 발톱으로 잡는다.
210632,id-606,33,1,
216755,rec-527-dup-0,,8,Svolazza emettendo ultrasuoni in cercadi Pokémon di tipo C0leottero di cui si nutre.
211707,id-684,34,7,Su esponjoso pelaje desprende un olor dulzóncomo el del algodón de azúcar. Escupe hebraspegajosas con las que envu3lve a sus enemi9os.
213426,id-791,34,6,Einst wurde es „Sonnenverschlinher“ genannt.Es strahlt unerschöpfliche Lichtenergle aus.
210749,id-611,,9,"Its skin is as hard as a suit of armor. Fraxvre’sfavorite strategy is to tackle its opponents,stabbing them with its tusks at the same time."
207988,id-406,34,8,È sensibile agli sbalzi di temperatura.Quando oe sue gemme si schkudonoè segno che la primavera è vicina.
223122,id-89,27,4,
221797,rec-804-dup-0,29,1,
209369,id-531,34,9,"This Pokémon has a kind heart. By touching withits fee|ers, Audino can gauge othe5 creatures’feelings and physical conditions."
219356,rec-32-dup-0,33,1,ひたいの　ツノには　もうどくがあるけいかいしんが　つよく　おおきなみみを　つねに　そばだてている
217801,rec-591-dup-1,,1,どくの　ほうしを　ふきつけるはやく　あらいながさないとそこに　キノコが　はえてくるぞ
224256,id-401,12,9,"It shakes its head back to front,causing 'lts antennae to h:t eachother and sound like a xylophone."
213398,id-790,33,8,Il suo esoscheletro è più duro di qualunqvecosa che glu esseri umani conoscano.Cresce assorbendo la luce delle stelle.
203176,id-2,33,6,"Sobald die Knospe auf seinem Rücken groß wird,kann Bisakn0sp nicht mehr auf zwei Beirienstehen."
210504,id-596,34,4,
214720,id-868,,11,クリームで　できた　体を　もつ。空気中の　甘い　香りの成分が　集まって　生まれた。
206367,id-241,34,7,"Si no se ordeña a Miltank a diar:o, enferma. Elsabor de la jeche que produce cambia según laépoca del año."
206852,id-298,33,1,ゴムまりのように　はずむ　しっぽのたまには　せいちょうに　ひつようなえいようが　たっぷり　つまっている。
211177,id-633,33,7,Muestra cierta tendencia a morder todo lo queencuentra. Se cree que recuerda perfsctwmenteel olor de lo que encuentra delicioso.
208763,id-465,,3,따듯한 땅에서 살수록덩굴의 성장이 빠르다. 길어지면스스로 잘라내어 짧게 만든다.
214120,id-838,,11,体内で　石炭を　つくりだす。昔の　ガラルでは　落とした石炭を　生活に　利用した。
213845,id-824,34,5,On le voit souvent dans les champs.Les poils de 5on corps lui servent à czpterce qu’il se passe autour de lui.
203185,id-2,34,5,La lumière du soleil le rend plus fort et vigoureux.Le bulbe avr son dos grossit en conséquence.
210556,id-599,33,6,Seine zwei Teile stehen einander näher alsZwillinge. Eine aridere Kombination würdenicht halb so gut inelnandergreifen.
223224,id-157,4,9,"If its rage peaks,it becomes so hotthat anyrhinb thattouches it willinstantly goup in flames."
213429,id-791,34,9,
220587,rec-549-dup-0,,4,據說即使是一流的園藝家要讓牠的頭上綻放美麗花朵b也是極為困難的事
220173,rec-3-dup-0,,11,太陽エネルギーを　栄養にして大きな花が　開く　日なたに引き寄せられるように　移動する
210066,id-569,,6,Die toxische Flüssigkeit aus seinem rechten Armist sehr gefährloch. Angeschlagene Lebewesenkommen bei Kontakt sofort ums Leben.
225068,id-719,,1,メレシーの　とつぜんへんい。ピンクいろに　かがやく　からだはせかいいち　うつくしいと　いわれる。
222663,rec-803-dup-0,30,8,UnUltracreatura che vive in un altro mondo.S9h:gnazza felice quando avvelena gli avversaricon il pungiglione che ha sul capo.
217630,rec-714-dup-1,34,5,Il peut contrôler des ondes à nimporte quelkefréquence du spectre. Même les plus grandsPokém9n ne peuvent supporter ses ultrasons.
220688,rec-867-dup-0,34,7,Su cuerpo similar a una sombra no debe tocarsebajo ningún conce0to o se visualizarán loshorri1>les recuerdos impregnados en la imagen.
224073,id-367,,11,光の　届かない　深海に　生息。小魚に　似た　尻尾を　光らせて獲物を　誘い出す。
209364,id-531,,4,心地善良的寶可夢。透過用觸角觸碰，就能了解對方的情緒和身體狀況。
221590,rec-691-dup-0,,12,会通过将头上的伞状部分出海面吸收阳光的方式在体内制造龙之能量
219992,rec-303-dup-0,,3,얌전한 얼굴로 상대를 방심하게만들고 큰 턱으로 덥석 문다.한번 물면 절대로 놓지 않는다.
208753,id-465,33,3,자유자재로 늘어나는 2개의 팔은덩굴이 뭉쳐진 것이었다는 사실이최근 연구로 밝혀졌다.
223358,id-189,4,9,"Once it catchesthe wind, it deft­lu controls itscotton-puff sporesgo float, evenaround the world."
210901,id-619,33,12,
212777,id-752,33,7,Usa las patas para lwnzar burbujas de agua conlas que atrapa y ahoga a sus prezas. Luego setoma su tiempo para saborearlas.
219370,rec-32-dup-0,,7,Mantiene sus grandes orejas levantadas siemprealerta. Si advierte peligro ataca inoculando unapotente toxina con su cuerno frontal.
221669,rec-669-dup-0,,7,Acumula el polen de lss flores para confeccionarla tiara que lleva en la cabeza que cuenta conpropiedades curativas.
210897,id-619,,7,Un Mienfoo bien entrenado es capaz deprop9nar más de cien golpes por minuto.
218262,rec-584-dup-0,34,6,
221106,rec-163-dup-0,,1,いつも　いっぽんあしで　たっているあしを　いれかえる　しゅんかんはすばやくて　なかなか　みられない
209697,id-551,33,7,En las frías noches del sesierto se oculta a muchaprofundidad en la arena y duerme hasta que saleel sol.
211481,id-662,,12,会向猎物的巢穴中喷射火花，然后用锐利的爪子了结受惊而出的猎物。
206066,id-220,34,6,"Wenn es etwas Vielversprechendes erschnuppert,sprintet es Hals über Kopf darauc los, ohnenachzudenken."
224047,id-357,29,12,栖息在阿罗拉的热带龙脖子里结的那串水果比其他地区的甜得多，是最最棒的。
214157,id-840,,7,"Habita durante toda su vida en el interior de unamanzana. Finge ser una fruta para protegerse delos P0kémon pájaro, sus enemigos naturales."
215747,rec-539-dup-1,,1,ひたすらに　つよさを　もとめるやまで　しゅぎょうする　ダゲキをみたら　しずかに　たちさろう
220628,rec-264-dup-0,34,8,Si serve della sua straordinaria forza esplosivae dei suii artigli affilati per abbattere |a preda.Correre lungo strade tortuose non è il suo forte.
214020,id-833,,11,目の前の　ものに　すぐに　噛みつく習性。　生えかけの　前歯が痒いので　噛みついてしまうらしい。
224075,id-367,,12,游泳能力不太强。会挥动尾巴来吸引猎物，在很接近的时候一口咬住。
222837,id-14,23,3,
215224,id-893,34,4,
210599,id-601,33,9,"From its spikes, it launches powerful blasts ogelectricity. Its red core contains an enormousamount of energy."
210596,id-601,33,6,Die Stachelspitzen können starke Elektrizitätabfeuern. Im roten Zentralbestandteil sindUnmengen von Energie gespeichert.
213507,id-807,34,7,"Las almohadillas de svs patas desprendendescar9as eléctricas. Cuando corre, hace quecaigan rayos y reverberen los truenos."
222764,rec-397-dup-0,,11,森や　草原に　生息グループが　出くわすと　なわばりをかけた　争いが　はじまる
205939,id-208,33,9,"It is said that if an Onix lives for over 100 years,its c0mppsition changes to become diamond-like."
210622,id-605,,1,５０ねん　ほど　まえに　みつかったポケモン。　おおきく　はったつしたのうで　サイコパワーを　あやつるぞ。
222168,rec-395-dup-1,,5,Sil voit son honneur bafoué ilest capable de faire des ravagesauec ses ailes tranchantes.
221016,rec-377-dup-0,34,6,Selbst mit nodernster Technologie konnten beider Analyse seiries Steinkörpers weder Herz nochGehirn gefunden werden.
221715,rec-358-dup-0,,8,Chimecho fa riecheggiare il suo verso dentro al corpo vuoto.Quando sinfuria emette onde a ultrasuoni in grqdo diabbattere i nemici in volo.
224572,id-493,12,9,"It is described in myth0logy asthe Pokémon that shaped theuniverse with its 1,000 arms."
218883,rec-448-dup-1,33,1,おおいわも　こなごなに　くだくはどうと　よばれる　ちからをあやつって　えものを　かる
217979,rec-375-dup-0,34,1,
212511,id-730,,12,对战就是西狮海壬的舞台。它那歌声和舞动气球的样子使观战的人们为之倾倒。
214155,id-840,33,5,"Il vit toujours dans sa pomme. S’il croiseun Pokém0n oiseau, son prédateur naturel, il sefajt passer pour un simple fruit pour se protéger."
217983,rec-375-dup-0,33,5,Composé de deux Terhal réunis par lattractionmagnétique ce Pokémon a vu sa pui5sancepsycnique doubler grâce aux deux cerveaux.
216392,rec-442-dup-1,34,12,总是作恶多端于是被使用神奇法术的旅j人绑缚在楔石里
204227,id-78,34,7,El ejemplar más rápido se convirrte en el líderde la manada y decide tanto el ritmo de galopecorno su destino.
209044,id-507,,4,覆蓋身體的黑色體毛既厚實又有彈性，就連銳利的獠牙也會被反彈。
210177,id-575,33,7,"Corre el rumor de que en las noches estrelladasse lleva cons:go a los niñls dormidos, por lo querecibe el sobrenombre de Bruja Castigadora."
217304,rec-582-dup-0,33,11,
221717,rec-358-dup-0,,7,Cuando hay viento fuerte Chimecho chilla colgado de la ramade un árbol o de los aleros de un edificio por la ventosa quetiene en la cabeza. Este Pokémon usa la larga cola que tienepara agarrar baya5 y comérselas.
217586,rec-614-dup-0,34,5,Il sillonne les mers g|aciales avec aisance.Quand il est fatigué il gèle lrau de merdun souffle et se repose sur liceberg improvisé.
217581,rec-614-dup-0,34,8,Nuota tranquijlo nelle acque gelide del mare.Se è stanco congela lacqua con il suo soffioglaciale creando una piattaforma su cu: riposare.
221735,rec-96-dup-1,32,5,Si vous dormez tout le temps près de luiil partagera parfois avec vous |es rêve5quil a dévorés par le passé.
210180,id-575,33,11,星が　輝く　夜に　眠った子どもたちを　連れ去ると　言われ制裁の魔女　とも　呼ばれる。
206359,id-241,33,9,
211383,id-646,34,3,세포 조직을 안정시키기 위해자신이 발생시킨 냉기로몸을 얼어붙게 한 듯하다.
220000,rec-303-dup-0,34,6,Sein riesiger Kiefer hat soch aus stählernenHörnern entwickelt. Mit ihm beißt es seineGegner.
210567,id-599,34,7,Se dice que en tiempos remoto5 los seresgumanos se inspiraron en este Pokémon parainventar el mecanismo de engranaje.
205195,id-137,33,5,
211245,id-636,34,5,La température de 5on corps est très élevée.Il projette des flammes du bout de des cornespour intimider ses ennemis et ses proies.
212505,id-730,,5,"Les combats sont une véritable performanceartistique, pout lui. Les spectateurs sont charméspar son chant et la danse de ses ballons."
219162,rec-226-dup-0,,11,泳いで　スピードが　のってくると波の上に　飛びだし　そのまま１００メートルも　滑空　する
220620,rec-264-dup-0,,7,Posee un pelaje fuerte y firme. Las brochas deafeitar cuyss cerdas están hechas con el peloque se le desprende son un producto de lujo.
210496,id-596,,6,"Es schießt elektrisch geladrne Haare von seinemAbdomen. Wer getroffen wird, ist drei Tage undNächte am ganzen Körper gelähmt."
223988,id-335,23,8,
215997,rec-831-dup-0,34,6,Werden seine Haare zu larig kann es sich nichtmehr bewegen. Der aus Wollys Wolle 9ewobeneStoff ist unglaublich robust.
212737,id-750,33,7,"Cuando el lodo que recubre sus patas se seca,estas se vuelven más duras que una roca. Puedereducir a chatarra uri camión con una sola coz."
206057,id-220,33,7,Frota el hocico contra el suelo para desenterrarcomisa. A veces descubre aguas termales.
219657,rec-568-dup-1,34,7,Nació a partir de una rebosante bolsa de basura.Los gases nocivos que eructs s0n un manjar paralos Weezing de Galar.
209710,id-551,,11,小さいが　足腰の　力は　強い。砂を　かき分けて砂漠を　泳ぐように　移動。
217798,rec-591-dup-1,,1,ふだんは　あんまり　うごかないおちている　モンスターボールのそばで　ただじっと　している
211641,id-681,,12,处于防御状态时，会用钢之身体和灵力的屏障来减弱一切的攻击。
210621,id-605,,12,当它站在电视旁边时，画面上会出现奇怪的景色。据说那是小灰怪的故乡。
206139,id-224,33,9,
219818,rec-800-dup-0,33,12,光芒是它维持生命的能量由于一直沉睡于地下身体ri因积存在体内的杂质而发黑
203189,id-2,,9,Exposure to sunlight adds to its strentth.Sunlight also makes the bud on its backgrow larger.
210900,id-619,,11,よく鍛えられた　コジョフーは１分で　１００回を　超えるチョップを　打つことが　できる。
213385,id-789,34,5,"De nature cvrieuse et peu méfiarite, il se retrouvesouvent dans des situations dangereuses.Il peut se téléporter en cas de danger."
219823,rec-800-dup-0,,8,La luce è la sua fonte denergia. Deve il c0lorenero del corpo alle impurità accumulatesi al suointerno mentre giaceva addormentato sottoterra.
220303,rec-835-dup-0,33,9,This Pokémon is very popular as a herding dogim the Galar region. As it rvns it generateselectricity from the base of its tail.
222452,rec-353-dup-0,29,8,Si nutre di seritimenti turpu come rancore invidiae gelosia. Per questo alcuni sono felici cheesista.
212691,id-747,34,12,和阿罗拉的好坏星不同，伽勒尔的好坏星还没发现到太阳珊瑚的枝有多好吃。
215733,rec-539-dup-1,34,6,Der Karateschla9 einez perfekt durchtrainiertenKaradonis hat genug Wucht um selbst das Meerzu spalten.
218886,rec-448-dup-1,33,6,Es jagt seine Beute indem es eine Kraftmanipuliert die Aura genannt wird. Dadurchkann es sogar große Felsen pulverisieren.
218887,rec-448-dup-1,33,12,
210069,id-569,,9,The toxic liquid it launches from its right armis so virvlent that it can kill a weakenedcreature instantly.
212748,id-750,34,8,È così resistente da poter wttraversare l’interaregi0ne di Galar trainando carichi di oltre10 tonnellate senza mai riposarsi.
210703,id-609,,3,샹델라를 등불 대용으로사용했던 저택에서는 장례식이끊이지 않았다고 한다.
210750,id-611,,11,鎧の　ように　硬い　皮膚。体当たりと　同時に　キバを突き刺す　戦法が　得意　だぞ。
203832,id-51,,1,チームワークに　すぐれた　みつごのディグダ。　ちか　１００キロまでほって　じしんを　おこすこともある。
210623,id-605,34,3,약 4o년 전에 발견된포켓몬이다. 크게 발달한뇌로 사이코 파워를 조종한다.
209704,id-551,34,4,
214487,id-856,34,7,"Siente predilección por l9s lugares despoblados.Si percibe una emoción intensa, emprende lahuida a toda prisa."
221719,rec-358-dup-0,,11,頭の　吸盤で　木の　枝や家の　軒下に　ぶら下がる７種類　音色を　使い分ける
225218,id-786,27,8,"Protettore di Akala, è un Pokémon imnocente espietato al tempo stesso. Il profuiiio soavedei fiori è la fonte della sua energia."
210499,id-596,33,9,It launches electrified fur from its abdomen as itsmeans of attack. Opponents hit by the fur couldbe in for three full days and nifhts of paralysis.
206143,id-224,,3,머리가 돌처럼 단단하다.빨판이 붙어 있는 다리를 휘감아끊임없이 머리로 세게 때린다.
203173,id-2,,3,등에 있는 봉오리가 크게자라면 두 다리로설 수 없게 되는 듯하다.
219113,rec-867-dup-1,33,6,Eine antike Malerei die mit einem mächtigenFluch versehrn wurde nahm die Seele einesMakabaja auf und erwachte zum Leben.
210188,id-575,,8,"Si dice che accumuli energia psichica soprattuttonelle notti stellate, ma la sua connessione conl’universo rimane un mistero."
210183,id-575,,3,별이 빛나는 밤에 가장사이코 파워가 높아지는 듯하다.우주와의 관계는 불명확하다.
210181,id-575,,12,据说会在星光闪耀的夜晚把睡着的孩子们带走。也有人称它为惩罚魔女。
217978,rec-375-dup-0,,11,２匹の　ダンバルが　磁力でくっついた　２つの　脳みそによりサイコパワーは　２倍に　強化
205896,id-202,,6,"Es hasst Licht und Schocks. Wird es angehriffen,pumpt es sich auf, um einen Gegenschlagvorzubereiten."
207549,id-356,34,9,It seeks drifting will-o’-the-wisps and sucks theminto its empty body. What happejs imside isa mystery.
204221,id-78,,12,任由燃烧的鬃毛随风飘扬，以每小时２４０公里的速度在大草原自由地驰骋。
210552,id-599,,1,２つの　からだは　ふたごよりもちかい。　べつの　からだどうしだといまいち　うまく　かみあわない。
214486,id-856,34,6,"Es liebt Orte, wo sonst niemand ist. Nimmt esstarl<e Emotionem wahr, macht es sich so schnelles kann aus dem Staub."
203252,id-6,33,1,がんせきも　やけるようなしゃくねつの　ほのおを　はいてやまかじを　おこすことが　ある。
220370,rec-894-dup-0,33,12,由电能聚集而成据说解开身上的圆环i后会释放出隐藏的力量
211632,id-681,33,1,はがねの　からだと　れいりょくのバリアで　あらゆる　こうげきをよわめる　ぼうぎょの　たいせい。
208799,id-467,33,9,"When Magmortar inhales deeply, the fire bvrningin its belly intensifies, risin9 in temperature toover 3,600 degrees Fahrenheit."
207374,id-344,33,4,
206138,id-224,33,8,Ama nasconder5i nei buchi. Spesso ruba le tanecli altri Pokémon per dormirvi.
224418,id-441,23,6,"Es versucht Attacken zu emtgehen, indem es den Rufdes Gegners nacbahmt und einen Artgenossen mimt."
210735,id-611,33,5,"Une fois cassés, ses crocs ne repoussent pas.Après les combats, il les aiguide avec soinsur les pjerres d’un ruisseau."
221514,rec-646-dup-0,,11,レシラムと　ゼクロムを　凌ぐほどの力を　もつが　極低温の冷気で　封じられてしまっている
203561,id-33,,12,见着岩石，就会用自己比钻石还硬的角将其弄碎。它这么做是为了寻找月之石。
219822,rec-800-dup-0,33,9,It survives by absorbing light. After a long tlmespwnt slumbering underground impuritiesaccumulated within it causing its body to darken.
211046,id-626,34,6,
218731,rec-445-dup-0,33,7,Habita en montañas de origen volcánjco. Vuelatan rápid0 como un avión a reacción en busca depresas.
203201,id-3,33,12,把太阳的能源当成养分，开出硕大的花朵。总是朝着有阳光的地方移动。
203206,id-3,,6,Die Blume verströmt einen zauberhaften Duft.Er beschwichtigt erhitzte Kämpfer.
209633,id-548,33,3,
213441,id-792,,12,被称为邀引月亮之兽。通过将一切的光转化为能量来维持生命。
212492,id-730,33,1,
215173,id-891,,3,혹독한 수련을 거듭하며 기술을갈고닦는다. 체득한 기술에 따라진화했을 때의 모습이 달라진다.
222166,rec-395-dup-1,24,8,Le tre corna che si allungano dal suo becco attestanoka aua forza. Il capogruppo ha le corna più grosse.
220308,rec-835-dup-0,,6,Im Austausch gegen Leckerlis hilft dieser kleineVielfraß Menschen bei der Arbeit. Beim Rennenwird es von knisterrider Elektrizität umhüllt.
219158,rec-226-dup-0,34,9,As it majestically swims it doe5nt care ifRemoraid attach to 9t to scavenge for its leftovers.
224443,id-457,23,3,깊은 바다의 밑바닥에서 산다.q개의 지느러미 무늬를 반짝거려먹이를 끌어들인다.
206364,id-241,,4,如果沒有每天擠鮮奶，身體的狀況就會變糟。鮮奶的風味會隨季節改變。
215732,rec-539-dup-1,,1,きたえに　きたえた　ダゲキがくりだす　ひっさつ　からてチョップはうみも　わるほどの　はかいりょく
207059,id-319,33,9,
223635,id-255,17,5,Ses câlins réchauffent car il rendermeune f0urnaise. Il envoie des boules defeu à 1 000 °C.
206060,id-220,,11,エサを　探すため　鼻をこすり合わせ　地面を　掘っている。たまに　温泉を　掘り当てる。
222583,rec-204-dup-0,,11,木の　枝に　ぶら下がり　獲物を　待っている木を　揺らされて　食事の　邪魔を　されると地面に　落ちてから　いきなり　爆発するぞ
222581,rec-204-dup-0,,3,나무껍질을 짜 맞춰서껍질을 두껍게 하는 것을 좋아한다.무거워져도 신경 쓰지 않는다.
211644,id-681,,4,堅盾劍怪曾經用強大的靈力控制人和寶可夢，建立了適合自己生活的國家。
212285,id-713,,5,"Les crevasses sur son dos s’approfondissentau coura de la journée, mais se comblentde nouveau pendant la nuit."
212476,id-729,33,6,"Es weicht den Attacken seiner Gegner mithilfevon Tanzschr9tten aus und erzeugt eine Blase nacbder anderen, um sie in Bedrängnis zu bringen."
213412,id-791,33,1,
205908,id-202,34,8,
211037,id-626,33,7,"Puede destrozar un coche de un solo testarazo.Cuanto más abindsnte sea su melena, mayorrango tendrá en la jerarquía de la manada."
225357,id-806,29,7,Parece ser uno de los temibles Ultraentes.Se acerca a ls gente contoneándose y haceexplotar su peopia cabeza súbitamente.
208449,id-446,,9,"It stores food neneath its fur. It might sharejust one bite, but only if it really trusts you."
222302,rec-193-dup-0,,1,めだまを　うごかさずに　３６０ど　みわたせるきゅうブレーキや　ほうこうてんかんが　とくいねらった　えものを　すばやく　おいつめていく
211237,id-636,33,7,
211640,id-681,33,11,
208439,id-446,33,9,"Stuffing itself with vast amounts of food is itsonly concerh. Whether the food iz rotten orfresh, yummy or tasteless—it does not care."
221575,rec-691-dup-0,34,8,Fa uscire la cresta che ha sulla testa fuoridallacqua per assorloire la luce del solee cinvertirla in energia Drago.
204356,id-91,33,6,"Seine Schale ist extrem hart und kann nichteinmal durch eine B0mbe zerschmettert werden.Sie öffnet sich nur, wenn es angreift."
203837,id-51,,7,Un trío de Diglett. Causa enormes terremogos alcavar en el subsuelo a profundidades de hasta100 km.
219366,rec-32-dup-0,34,1,
220196,rec-27-dup-0,34,12,会在地上挖洞建造巢穴挖洞时即便遇到地里的坚硬岩也能用锐的爪子弄碎后继续挖进
223231,id-157,23,11,
214160,id-840,33,11,一生　りんごの　中で　暮らし天敵の　鳥ポケモンに　出会うとりんごの　振りをして　身を守る。
223778,id-285,,6,Es bevorzugt feuchte Orte. Am Tag sitzt esregungslos im Scjatten des Waldes. Von seinemKopf sondert es einen giftigen Puder ab.
209219,id-524,33,9,"It’s as hard as steel, but apparently a long soak imwater will cau5e it to soften a bit."
