tid,id,title,authors,venue,year
71374,conf/sigmod/DewanSHH94,Predictive Dynamic Load Balancing of Parallel and Distributed Rule and Query Processing,"H Dewan, S Stolfo, M Hernßndez, J Hwang",SIGMOD Conference,1994
71376,conf/sigmod/TomasicGS94,Incremental Updates of Inverted Lists for Text Document Retrieval,"A Tomasic, H Garcia-Molina, K Shoens",SIGMOD Conference,1994
71377,conf/vldb/ArunJ98,KODA - The Architecture And Interface of a Data Model Independent Kernel,"G Arun, A Joshi",VLDB,1998
71379,conf/sigmod/HsiaoCY94,On Parallel Execution of Multiple Pipelined Hash Joins,"H Hsiao, M Chen, P Yu",SIGMOD Conference,1994
71380,conf/vldb/Schoning98,The ADABAS Buffer Pool Manager,H Sch÷ning,VLDB,1998
71385,conf/sigmod/PangCL94,Managing Memory for Real-Time Queries,"H Pang, M Carey, M Livny",SIGMOD Conference,1994
71387,conf/vldb/Orenstein98,Starting (and Sometimes Ending) a Database Company,J Orenstein,VLDB,1998
71388,conf/sigmod/CareyDFHMNSSTTWZ94,Shoring Up Persistent Applications,"M Carey, D DeWitt, M Franklin, N Hall, M McAuliffe, J Naughton, D Schuh, M Solomon, C Tan, O Tsatalos, S White, M Zwilling",SIGMOD Conference,1994
71389,conf/vldb/RoussopoulosK98,The Cubetree Storage Organization,"N Roussopoulos, Y Kotidis",VLDB,1998
71393,conf/sigmod/SeshadriLR94,Sequence Query Processing,"P Seshadri, M Livny, R Ramakrishnan",SIGMOD Conference,1994
71394,conf/vldb/Mina98,MapInfo SpatialWare: A Spatial Information Server for RDBMS,C Mina,VLDB,1998
71395,conf/sigmod/Hellerstein94,Practical Predicate Placement,J Hellerstein,SIGMOD Conference,1994
71396,conf/vldb/Objectivity98,Objectivity Industrial Exhibit,O Objectivity,VLDB,1998
71398,conf/vldb/Pogue98,Oracle Industrial Exhibit,A Pogue,VLDB,1998
71399,conf/vldb/MaratheS97,A Language for Manipulating Arrays,"A Marathe, K Salem",VLDB,1997
71400,conf/sigmod/Galindo-Legaria94,Outerjoins as Disjunctions,C Galindo-Legaria,SIGMOD Conference,1994
71402,conf/sigmod/CookWZ94,Partition Selection Policies in Object Database Garbage Collection,"J Cook, A Wolf, B Zorn",SIGMOD Conference,1994
71404,conf/sigmod/Englert94,NonStop SQL: Scalability and Availability for Decision Support,S Englert,SIGMOD Conference,1994
71405,conf/vldb/BouganimFV96,Dynamic Load Balancing in Hierarchical Parallel Database Systems,"L Bouganim, D Florescu, P Valduriez",VLDB,1996
71406,conf/sigmod/Fernandez94,Red Brick Warehouse: A Read-Mostly RDBMS for Open SMP Platforms,P Fernandez,SIGMOD Conference,1994
71407,conf/vldb/AcharyaFZ96,Disseminating Updates on Broadcast Disks,"S Acharya, M Franklin, S Zdonik",VLDB,1996
71408,conf/sigmod/Ubell94,The Montage Extensible DataBlade Achitecture,M Ubell,SIGMOD Conference,1994
71410,conf/vldb/GardarinST96,"Calibrating the Query Optimizer Cost Model of IRO-DB, an Object-Oriented Federated Database System","G Gardarin, F Sha, Z Tang",VLDB,1996
71411,conf/vldb/SrivastavaDJL96,Answering Queries with Aggregation Using Views,"D Srivastava, S Dar, H Jagadish, A Levy",VLDB,1996
71414,conf/sigmod/BryanMCLG94,The MEDUSA Project: Autonomous Data Management in a Shared-Nothing Parallel Database Machine,"G Bryan, W Moore, B Curry, K Lodge, J Geyer",SIGMOD Conference,1994
71416,conf/vldb/KornSFSP96,Fast Nearest Neighbor Search in Medical Image Databases,"F Korn, N Sidiropoulos, C Faloutsos, E Siegel, Z Protopapas",VLDB,1996
71417,conf/sigmod/SinghTW94,Relaxed Transaction Processing,"M Singh, C Tomlinson, D Woelk",SIGMOD Conference,1994
71418,conf/vldb/ViverosNR96,Applying Data Mining Techniques to a Health Insurance Information System,"M Viveros, J Nearhos, M Rothman",VLDB,1996
71419,conf/sigmod/DanielsDDEHJJLSSS94,Oracle's Symmetric Replication Technology and Implications for Application Design,"D Daniels, L Doo, A Downing, C Elsbernd, G Hallmark, S Jain, B Jenkins, P Lim, G Smith, B Souder, J Stamos",SIGMOD Conference,1994
71420,conf/vldb/BohlenSS96,Coalescing in Temporal Databases,"M B÷hlen, R Snodgrass, M Soo",VLDB,1996
71421,conf/sigmod/GorelikWD94,Sybase Replication Server,"A Gorelik, Y Wang, M Deppe",SIGMOD Conference,1994
71422,conf/vldb/Ogawa96,Effective & Efficient Document Ranking without using a Large Lexicon,Y Ogawa,VLDB,1996
71423,conf/sigmod/SagonasSW94,XSB as an Efficient Deductive Database Engine,"K Sagonas, T Swift, D Warren",SIGMOD Conference,1994
71424,conf/vldb/MeoPC96,A New SQL-like Operator for Mining Association Rules,"R Meo, G Psaila, S Ceri",VLDB,1996
71425,conf/sigmod/Carey94,Parallel Database Systems in the 1990's,M Carey,SIGMOD Conference,1994
71427,conf/sigmod/Cattell94,ODMG-93: A Standard for Object-Oriented DBMSs,R Cattell,SIGMOD Conference,1994
71428,conf/vldb/LabioG96,Efficient Snapshot Differential Algorithms for Data Warehousing,"W Labio, H Garcia-Molina",VLDB,1996
71431,conf/vldb/SevcikK96,Filter Trees for Managing Spatial Data over a Range of Size Granularities,"K Sevcik, N Koudas",VLDB,1996
71434,conf/vldb/FaloutsosG96,Analysis of n-Dimensional Quadtrees using the Hausdorff Fractal Dimension,"C Faloutsos, V Gaede",VLDB,1996
71435,conf/vldb/SeshadriLR96,The Design and Implementation of a Sequence Database System,"P Seshadri, M Livny, R Ramakrishnan",VLDB,1996
71436,journals/sigmod/Liu03c,Editor's Notes,L Liu,SIGMOD Record,2003
71437,conf/vldb/ChaudhuriS96,Optimization of Queries with User-defined Predicates,"S Chaudhuri, K Shim",VLDB,1996
71438,conf/sigmod/Blakeley94,Open Object Database Management Systems,,,1994
71439,conf/vldb/StaudtJ96,Incremental Maintenance of Externally Materialized Views,"M Staudt, M Jarke",VLDB,1996
71442,conf/sigmod/HanFHCC94,DBLearn: A System Prototype for Knowledge Discovery in Relational Databases,"J Han, Y Fu, Y Huang, Y Cai, N Cercone",SIGMOD Conference,1994
71444,journals/sigmod/AilamakiFFSV03,An environmental sensor network to determine drinking water quality and security,"A Ailamaki, C Faloutsos, P Fischbeck, M Small, J VanBriesen",SIGMOD Record,2003
71445,journals/sigmod/BonnetBDL03,Bluetooth-based sensor networks,"P Bonnet, A Beaufour, M Dydensborg, M Leopold",SIGMOD Record,2003
71447,journals/sigmod/Snodgrass03c,Developments at ACM TODS,R Snodgrass,SIGMOD Record,2003
71450,journals/sigmod/Date03,Edgar F. Codd: a tribute and personal memoir,C Date,SIGMOD Record,2003
71451,conf/sigmod/TheodoulidisAACKS94,The ORES Temporal Database Management System,"B Theodoulidis, A Ait-Braham, G Andrianopoulos, J Chaudhary, G Karvelis, S Sou",SIGMOD Conference,1994
71453,conf/vldb/Mohan96,DWMS: Data Warehouse Management System,N Mohan,VLDB,1996
71454,conf/sigmod/GrossmanQ94,Ptool: A Scalable Persistent Object Manager,"R Grossman, X Qin",SIGMOD Conference,1994
71455,conf/vldb/Moni96,DISNIC-PLAN: A NICNET Based Distributed Database for Micro-level Planning in India,M Moni,VLDB,1996
71458,conf/vldb/Sheth96,Bellcore's ADAPT/X Harness System for Managing Information on Internet and Intranets,A Sheth,VLDB,1996
71459,conf/vldb/Klots96,Cache Coherency in Oracle Parallel Server,B Klots,VLDB,1996
71460,conf/sigmod/CatarciS94,Query by Diagram: A Graphical Environment for Querying Databases,"T Catarci, G Santucci",SIGMOD Conference,1994
71461,conf/vldb/Padmanabhan96,Extracting Large Data Sets using DB2 Parallel Edition,S Padmanabhan,VLDB,1996
71462,conf/sigmod/AgrawalCFGHIIMMSS94,Quest: A Project on Database Mining,"R Agrawal, M Carey, C Faloutsos, S Ghosh, M Houtsma, T Imielinski, B Iyer, A Mahboob, H Miranda, R Srikant, A Swami",SIGMOD Conference,1994
71466,conf/sigmod/SagonasSW94a,XSB as a Deductive Database,"K Sagonas, T Swift, D Warren",SIGMOD Conference,1994
71467,journals/sigmod/TanK03,Power efficient data gathering and aggregation in wireless sensor networks,"H Tan, I Korpeoglu",SIGMOD Record,2003
71470,conf/vldb/FlorescuKLP97,Using Probabilistic Information in Data Integration,"D Florescu, D Koller, A Levy",VLDB,1997
71471,journals/sigmod/CalvaneseGLV03,Reasoning on regular path queries,"D Calvanese, G Giacomo, M Lenzerini, M Vardi",SIGMOD Record,2003
71473,journals/sigmod/Winslett03c,Interview with Pat Selinger,,,2003
71475,journals/sigmod/RossGR03,Reminiscences on Influential Papers,,,2003
71476,conf/vldb/BaralisPT97,Materialized Views Selection in a Multidimensional Database,"E Baralis, S Paraboschi, E Teniente",VLDB,1997
71477,journals/sigmod/WangD03,Review of Web caching and replication by Michael Rabinovich and Oliver Spatscheck. Addison Wesley 2002,,,2003
71479,conf/vldb/WangYM97,STING: A Statistical Information Grid Approach to Spatial Data Mining,"W Wang, J Yang, R Muntz",VLDB,1997
71483,journals/sigmod/KannanKIK03,Energy and rate based MAC protocol for wireless sensor networks,"R Kannan, R Kalidindi, S Iyengar, V Kumar",SIGMOD Record,2003
71485,conf/vldb/NgC97,Integrating Reliable Memory in Databases,"W Ng, P Chen",VLDB,1997
71486,journals/sigmod/PalpanasPKG03,Distributed deviation detection in sensor networks,"T Palpanas, D Papadopoulos, V Kalogeraki, D Gunopulos",SIGMOD Record,2003
71488,journals/sigmod/Aberer03d,Book review column,K Aberer,SIGMOD Record,2003
71493,journals/sigmod/Mani03,Understanding the semantics of sensor data,M Mani,SIGMOD Record,2003
71494,conf/vldb/Huyn97,Multiple-View Self-Maintenance in Data Warehousing Environments,N Huyn,VLDB,1997
71496,journals/sigmod/ChengP03,Managing uncertainty in sensor database,"R Cheng, S Prabhakar",SIGMOD Record,2003
71499,journals/sigmod/PitouraAPSV03,DBGlobe: a service-oriented P2P system for global computing,"E Pitoura, S Abiteboul, D Pfoser, G Samaras, M Vazirgiannis",SIGMOD Record,2003
71502,journals/sigmod/NejdlSS03,Design issues and challenges for RDF- and schema-based peer-to-peer systems,"W Nejdl, W Siberski, M Sintek",SIGMOD Record,2003
71503,journals/sigmod/Hammer03,Treasurer's Message,,,2003
71504,conf/vldb/BridgeJKLLM97,The Oracle Universal Server Buffer,"W Bridge, A Joshi, M Keihl, T Lahiri, J Loaiza, N MacNaughton",VLDB,1997
71505,journals/sigmod/Ozsu03a,Chair's Message,,,2003
71509,conf/vldb/ChavdaW97,Towards an ODMG-Compliant Visual Object Query Language,"M Chavda, P Wood",VLDB,1997
71510,journals/sigmod/Chamberlin03,2003 SIGMOD Innovations Award Speech,D Chamberlin,SIGMOD Record,2003
71511,journals/sigmod/Aberer03c,Guest editor's introduction,,,2003
71513,conf/vldb/GarofalakisOS97,Resource Scheduling in Enhanced Pay-Per-View Continuous Media Databases,"M Garofalakis, B ųzden, A Silberschatz",VLDB,1997
71516,journals/sigmod/Giorgini03,Agent-Oriented software engineering report on the 4th AOSE workshop (AOSE 2003),,,2003
71518,journals/sigmod/LenzVJS03,Report on the 5th international workshop on the design and management of data warehouses (DMDW'03),,,2003
71519,conf/vldb/ChakrabartiDAR97,"Using Taxonomy, Discriminants, and Signatures for Navigating in Text Databases","S Chakrabarti, B Dom, R Agrawal, P Raghavan",VLDB,1997
71520,journals/sigmod/KambhampatiK03,Information integration on the Web: a view from AI and databases (report on IIWeb-03),"S Kambhampati, C Knoblock",SIGMOD Record,2003
71521,journals/sigmod/MotroA03,Report on FQAS 2002: fifth international conference on flexible query answering systems,,,2003
71522,conf/vldb/CiacciaPZ97,M-tree: An Efficient Access Method for Similarity Search in Metric Spaces,"P Ciaccia, M Patella, P Zezula",VLDB,1997
71523,conf/vldb/HaasKWY97,Optimizing Queries Across Diverse Data Sources,"L Haas, D Kossmann, E Wimmers, J Yang",VLDB,1997
71524,journals/sigmod/Liu03b,Editor's Notes,L Liu,SIGMOD Record,2003
71525,conf/vldb/KraissW97,Vertical Data Migration in Large Near-Line Document Archives Based on Markov-Chain Predictions,"A Kraiss, G Weikum",VLDB,1997
71526,journals/sigmod/Hainaut03,Research in database engineering at the University of Namur,J Hainaut,SIGMOD Record,2003
71527,journals/sigmod/AilamakiH03,Exposing undergraduate students to database system internals,"A Ailamaki, J Hellerstein",SIGMOD Record,2003
71528,conf/vldb/GarofalakisI97,Parallel Query Scheduling and Optimization with Time- and Space-Shared Resources,"M Garofalakis, Y Ioannidis",VLDB,1997
71529,journals/sigmod/NascimentoSP03,Analysis of SIGMOD's co-authorship graph,"M Nascimento, J Sander, J Pound",SIGMOD Record,2003
71530,conf/vldb/ClaussenKMP97,Optimizing Queries with Universal Quantification in Object-Oriented and Object-Relational Databases,"J Clau▀en, A Kemper, G Moerkotte, K Peithner",VLDB,1997
71531,conf/vldb/EicklerGK95,A Performance Evaluation of OID Mapping Techniques,"A Eickler, C Gerlhof, D Kossmann",VLDB,1995
71532,journals/sigmod/Liu03a,Editor's Notes,L Liu,SIGMOD Record,2003
71533,conf/vldb/AmsalegFG95,Efficient Incremental Garbage Collection for Client-Server Object Database Systems,"L Amsaleg, M Franklin, O Gruber",VLDB,1995
71534,journals/sigmod/JukicNV03,Closing the key loophole in MLS databases,"N Jukic, S Nestorov, S Vrbsky",SIGMOD Record,2003
71536,conf/vldb/Bayer95,Document Management as a Database Problem,R Bayer,VLDB,1995
71539,conf/vldb/ChenRS95,Declustering Databases on Heterogeneous Disk Systems,"L Chen, D Rotem, S Seshadri",VLDB,1995
71543,conf/vldb/YanG95,Duplicate Removal in Information System Dissemination,"T Yan, H Garcia-Molina",VLDB,1995
71544,journals/sigmod/Winslett03b,Interview with Rakesh Agrawal,,,2003
71545,journals/sigmod/CherniakV03,Reminiscences on Influential Papers,,,2003
71547,journals/sigmod/Ouksel03,In-context peer-to-peer information filtering on the Web,A Ouksel,SIGMOD Record,2003
71548,conf/vldb/Sullivan96,Tribeca: A Stream Database Manager for Network Traffic Analysis,M Sullivan,VLDB,1996
71551,conf/vldb/Celis96,The Query Optimizer in Tandem's new ServerWare SQL Product,P Celis,VLDB,1996
71552,journals/sigmod/ArenasKKKMM03,The hyperion project: from data integration to data coordination,"M Arenas, V Kantere, A Kementsietsidis, I Kiringa, R Miller, J Mylopoulos",SIGMOD Record,2003
71554,journals/sigmod/OoiST03,Relational data sharing in peer-based data management systems,"B Ooi, Y Shu, K Tan",SIGMOD Record,2003
71555,conf/vldb/Baru96,Performance of Future Database Systems: Bottlenecks and Bonananzas,C Baru,VLDB,1996
71557,conf/vldb/GuptaM96,What is the Data Warehousing Problem? (Are Materialized Views the Answer?),"A Gupta, I Mumick",VLDB,1996
71558,journals/sigmod/TatarinovIMHSDDKMM03,The Piazza peer data management project,"I Tatarinov, Z Ives, J Madhavan, A Halevy, D Suciu, N Dalvi, X Dong, Y Kadiyska, G Miklau, P Mork",SIGMOD Record,2003
71559,journals/sigmod/BawaCCDGGKMSSVY03,Peer-to-peer research at Stanford,"M Bawa, B Cooper, A Crespo, N Daswani, P Ganesan, H Garcia-Molina, S Kamvar, S Marti, M Schlosser, Q Sun, P Vinograd, B Yang",SIGMOD Record,2003
71560,conf/vldb/Sacks-Davis96,The Structured Information Manager: A Database System for SGML Documents,R Sacks-Davis,VLDB,1996
71562,journals/sigmod/AbererCDDHPS03,P-Grid: a self-organizing structured P2P system,"K Aberer, P Cudrķ-Mauroux, A Datta, Z Despotovic, M Hauswirth, M Punceva, R Schmidt",SIGMOD Record,2003
71563,journals/sigmod/WeikumSR03,"Report on the 10th Conference on Database Systems for Business, Technology, and the Web (BTW 2003)",,,2003
71564,conf/vldb/SavasereON95,An Efficient Algorithm for Mining Association Rules in Large Databases,"A Savasere, E Omiecinski, S Navathe",VLDB,1995
71566,journals/sigmod/RossNO03,Reminiscences on Influential Papers,,,2003
71568,conf/vldb/RahmM95,Dynamic Multi-Resource Load Balancing in Parallel Database Systems,"E Rahm, R Marek",VLDB,1995
71570,conf/vldb/BassiliadesV95,A Non-Uniform Data Fragmentation Strategy for Parallel Main-Menory Database Systems,"N Bassiliades, I Vlahavas",VLDB,1995
71572,conf/vldb/CabreraRH95,Applying Database Technology in the ADSM Mass Storage System,"L Cabrera, R Rees, W Hineman",VLDB,1995
71573,journals/sigmod/Nascimento03,Peer-to-peer: harnessing the power of disruptive technologies,M Nascimento,SIGMOD Record,2003
71574,conf/vldb/HellersteinNP95,Generalized Search Trees for Database Systems,"J Hellerstein, J Naughton, A Pfeffer",VLDB,1995
71575,journals/sigmod/Hoffner03,Fundamentals of data warehouses: 2nd revised and extended edition,V Hoffner,SIGMOD Record,2003
71579,journals/sigmod/FifeG03,Research issues for data communication in mobile ad-hoc network database systems,"L Fife, L Gruenwald",SIGMOD Record,2003
71581,conf/vldb/SteinbrunnPMK95,Bypassing Joins in Disjunctive Queries,"M Steinbrunn, K Peithner, G Moerkotte, A Kemper",VLDB,1995
71582,journals/sigmod/dOnofrioP03,Modelling temporal thematic map contents,"A d'Onofrio, E Pourabbas",SIGMOD Record,2003
71585,conf/vldb/BunemanDHOW95,A Data Transformation System for Biological Data Sources,"P Buneman, S Davidson, K Hart, G Overton, L Wong",VLDB,1995
71586,journals/sigmod/GolabO03,Issues in data stream management,"L Golab, M ųzsu",SIGMOD Record,2003
71588,conf/vldb/GuptaHQ95,Aggregate-Query Processing in Data Warehousing Environments,"A Gupta, V Harinarayan, D Quass",VLDB,1995
71591,journals/sigmod/Aberer03b,Book review column,K Aberer,SIGMOD Record,2003
71592,conf/vldb/GardarinGT95,A Cost Model for Clustered Object-Oriented Databases,"G Gardarin, J Gruser, Z Tang",VLDB,1995
71593,conf/vldb/BelussiF95,Estimating the Selectivity of Spatial Queries Using the `Correlation' Fractal Dimension,"A Belussi, C Faloutsos",VLDB,1995
71594,journals/sigmod/MukhopadhyayGS03,An approach to confidence based page ranking for user oriented Web search,"D Mukhopadhyay, D Giri, S Singh",SIGMOD Record,2003
71595,journals/sigmod/Snodgrass03,ACM TODS in this Internet Age,R Snodgrass,SIGMOD Record,2003
71597,conf/vldb/ChatziantoniouR96,Querying Multiple Features of Groups in Relational Databases,"D Chatziantoniou, K Ross",VLDB,1996
71599,conf/vldb/FaloutsosMS96,Modeling Skewed Distribution Using Multifractals and the `80-20' Law,"C Faloutsos, Y Matias, A Silberschatz",VLDB,1996
71600,journals/sigmod/GottlobKP03,XPath Processing in a Nutshell,"G Gottlob, C Koch, R Pichler",SIGMOD Record,2003
71603,journals/sigmod/BertinoEH03,A Database Approach to Quality of Service Specification in Video Databases,"E Bertino, A Elmagarmid, M Hacid",SIGMOD Record,2003
71604,conf/vldb/Suciu96a,Implementation and Analysis of a Parallel Collection Query Language,D Suciu,VLDB,1996
71605,journals/sigmod/David03,ANSI SQL Hierarchical Processing Can Fully Integrate Native XML,M David,SIGMOD Record,2003
71607,conf/vldb/PapakonstantinouAG96,Object Fusion in Mediator Systems,"Y Papakonstantinou, S Abiteboul, H Garcia-Molina",VLDB,1996
71609,journals/sigmod/ChakravarthyAEFO03,Database Research at UT Arlington,"S Chakravarthy, Y Aslandogan, R Elmasri, L Fegaras, J Oh",SIGMOD Record,2003
71610,conf/vldb/VermeerA96,The Role of Integrity Constraints in Database Interoperation,"M Vermeer, P Apers",VLDB,1996
71611,conf/vldb/LinLYZ03,Multiscale Histograms: Summarizing Topological Relations in Large Spatial Datasets,"X Lin, Q Liu, Y Yuan, X Zhou",VLDB,2003
71613,conf/vldb/PottingerB03,Merging Models Based on Given Correspondences,"R Pottinger, P Bernstein",VLDB,2003
71615,conf/vldb/HulgeriS03,AniPQO: Almost Non-intrusive Parametric Query Optimization for Nonlinear Cost Functions,"A Hulgeri, S Sudarshan",VLDB,2003
71616,conf/vldb/IlyasAE03,Supporting Top-k Join Queries in Relational Databases,"I Ilyas, W Aref, A Elmagarmid",VLDB,2003
71617,conf/vldb/PapadiasTS03,The TPR*-Tree: An Optimized Spatio-Temporal Access Method for Predictive Queries,"Y Tao, D Papadias, J Sun",VLDB,2003
71618,conf/vldb/KoudasGGSV03,Efficient Approximation Of Optimization Queries Under Parametric Aggregation Constraints,"S Guha, D Gunopulos, N Koudas, D Srivastava, M Vlachos",VLDB,2003
71620,conf/vldb/SchindlerAG03,Lachesis: Robust Database Storage Management Based on Device-specific Performance Characteristics,"J Schindler, A Ailamaki, G Ganger",VLDB,2003
71621,conf/vldb/VieiraM03,A Dependability Benchmark for OLTP Application Environments,"M Vieira, H Madeira",VLDB,2003
71623,conf/vldb/HaasB03,BHUNT: Automatic Discovery of Fuzzy Algebraic Constraints in Relational Data,"P Brown, P Haas",VLDB,2003
71624,conf/vldb/HelmerNM03,Estimating the Output Cardinality of Partial Preaggregation with a Measure of Clusteredness,"S Helmer, T Neumann, G Moerkotte",VLDB,2003
71626,conf/vldb/YuAA03,Tabular Placement of Relational Data on MEMS-based Storage Devices,"H Yu, D Agrawal, A Abbadi",VLDB,2003
71627,conf/vldb/LiuLBHTS03,Capturing Global Transactions from Multiple Recovery Log Files in a Partitioned Database System,"C Liu, B Lindsay, S Bourbonnais, E Hamel, T Truong, J Stankiewitz",VLDB,2003
71628,conf/vldb/FlorescuHKLRWCSA03,The BEA/XQRL Streaming XQuery Processor,"D Florescu, C Hillery, D Kossmann, P Lucas, F Riccardi, T Westmann, M Carey, A Sundararajan, G Agrawal",VLDB,2003
71629,conf/vldb/MurthyB03,XML Schemas in Oracle XML DB,"R Murthy, S Banerjee",VLDB,2003
71630,conf/vldb/HageJPST03,Integrated Data Management for Mobile Services in the Real World,"C Hage, C Jensen, T Pedersen, L Speicys, I Timko",VLDB,2003
71632,conf/vldb/Galindo-LegariaJWW03,Statistics on Views,"C Galindo-Legaria, M Joshi, F Waas, M Wu",VLDB,2003
71633,conf/vldb/BhattacharjeePMLCH03,Efficient Query Processing for Multi-Dimensionally Clustered Tables in DB2,"B Bhattacharjee, S Padmanabhan, T Malkemus, T Lai, L Cranston, M Huras",VLDB,2003
71634,conf/vldb/SrinivasaK03,A Platform Based on the Multi-dimensional Data Model for Analysis of Bio-Molecular Structures,"S Srinivasa, S Kumar",VLDB,2003
71635,conf/vldb/MiklauS03,Controlling Access to Published Data Using Cryptography,"G Miklau, D Suciu",VLDB,2003
71636,conf/vldb/MeekPK03,OASIS: An Online and Accurate Technique for Local-alignment Searches on Biological Sequences,"C Meek, J Patel, S Kasetty",VLDB,2003
71637,conf/vldb/BawaBA03,Privacy-Preserving Indexing of Documents on the Network,"M Bawa, R Jr., R Agrawal",VLDB,2003
71638,conf/vldb/PossP03,Data Compression in Oracle,"M P÷ss, D Potapov",VLDB,2003
71639,conf/vldb/CarneyCZRCS03,Operator Scheduling in a Data Stream Manager,"D Carney, U Ūetintemel, A Rasin, S Zdonik, M Cherniack, M Stonebraker",VLDB,2003
71641,conf/vldb/GalanisWJD03,Locating Data Sources in Large Distributed Systems,"L Galanis, Y Wang, S Jeffery, D DeWitt",VLDB,2003
71645,conf/vldb/FernandezSCMS03,Implementing Xquery 1.0: The Galax Experience,"M Fernandez, J Simķon, B Choi, A Marian, G Sur",VLDB,2003
71646,conf/vldb/HardingLM03,XISS/R: XML Indexing and Storage System using RDBMS,"P Harding, Q Li, B Moon",VLDB,2003
71647,conf/vldb/BalminHKPSW03,A System for Keyword Proximity Search on XML Databases,"A Balmin, V Hristidis, N Koudas, Y Papakonstantinou, D Srivastava, T Wang",VLDB,2003
71648,conf/vldb/ArionBCDMP03,Xquec: Pushing Queries to Compressed XML Data,"A Arion, A Bonifati, G Costa, S D'Aguanno, I Manolescu, A Pugliese",VLDB,2003
71650,conf/vldb/MengLLA03,OrientStore: A Schema Based Native XML Storage System,"X Meng, D Luo, M Lee, J An",VLDB,2003
71651,conf/vldb/BergerBSW03,Xcerpt and visXcerpt: From Pattern-Based to Visual Querying of XML and Semistructured Data,"S Berger, F Bry, S Schaffert, C Wieser",VLDB,2003
71652,conf/vldb/Brodie03,Illuminating the Dark Side of Web Services,M Brodie,VLDB,2003
71654,conf/vldb/KerstenWFKBC03,A Database Striptease or How to Manage Your Personal Databases,"M Kersten, G Weikum, M Franklin, D Keim, A Buchmann, S Chaudhuri",VLDB,2003
71660,conf/vldb/DeckerK03,The Semantic Web: Semantics for Data on the Web,,,2003
71661,conf/vldb/NathDKGKS03,IrisNet: An Architecture for Internet-scale Sensing Services,"S Nath, A Deshpande, Y Ke, P Gibbons, B Karp, S Seshan",VLDB,2003
71663,conf/vldb/SattlerGS03,QUIET: Continuous Query-driven Index Tuning,"K Sattler, I Geist, E Schallehn",VLDB,2003
71664,conf/vldb/BouganimNPW03,Chip-Secured Data Access: Reconciling Access Rights with Data Encryption,"L Bouganim, F Ngoc, P Pucheral, L Wu",VLDB,2003
71665,conf/vldb/WangSG03,An Interpolated Volume Data Model,"T Wang, S Santini, A Gupta",VLDB,2003
71666,conf/vldb/LakshmananPZ03,Efficacious Data Cube Exploration by Semantic Summarization and Compression,"L Lakshmanan, J Pei, Y Zhao",VLDB,2003
71668,conf/vldb/WitkowskiBBFGSS03,Business Modelling Using SQL Spreadsheets,"A Witkowski, S Bellamkonda, T Bozkaya, N Folkert, A Gupta, L Sheng, S Subramanian",VLDB,2003
71669,conf/vldb/SizovGT03,From Focused Crawling to Expert Information: an Application Framework for Web Exploration and Portal Generation,"S Sizov, J Graupmann, M Theobald",VLDB,2003
71672,conf/vldb/PetrovicBJ03,S-ToPSS: Semantic Toronto Publish/Subscribe System,"M Petrovic, I Burcea, H Jacobsen",VLDB,2003
71673,conf/vldb/NicklasGS03,"NexusScout: An Advanced Location-Based Application on a Distributed, Open Mediation Platform","D Nicklas, M Gro▀mann, T Schwarz",VLDB,2003
71676,conf/vldb/EleftheriouBCDHLPPABDDDGJHLRSVW03,A Nanotechnology-based Approach to Data Storage,"E Eleftheriou, P Bõchtold, G Cherubini, A Dholakia, C Hagleitner, T Loeliger, A Pantazi, H Pozidis, T Albrecht, G Binnig, M Despont, U Drechsler, U D³rig, B Gotsmann, D Jubin, W Hõberle, M Lantz, H Rothuizen, R Stutz, P Vettiger, D Wiesmann",VLDB,2003
71677,conf/vldb/Ioannidis03,The History of Histograms (abridged),Y Ioannidis,VLDB,2003
71678,conf/vldb/Shenker03,The Data-Centric Revolution in Networking,S Shenker,VLDB,2003
71679,conf/vldb/CohenMKS03,XSEarch: A Semantic Search Engine for XML,"S Cohen, J Mamou, Y Kanza, Y Sagiv",VLDB,2003
71681,conf/vldb/YangLH03,Efficient Mining of XML Query Patterns for Caching,"L Yang, M Lee, W Hsu",VLDB,2003
71682,conf/vldb/ShahDR03,An Efficient and Resilient Approach to Filtering and Disseminating Streaming Data,"S Shah, S Dharmarajan, K Ramamritham",VLDB,2003
71683,conf/vldb/Amer-YahiaFSX03,Phrase Matching in XML,"S Amer-Yahia, M Fernandez, D Srivastava, Y Xu",VLDB,2003
71684,conf/vldb/ChenDZ03,RRXF: Redundancy reducing XML storage in relations,"Y Chen, S Davidson, C Hara, Y Zheng",VLDB,2003
71685,conf/vldb/DeutschT03,MARS: A System for Publishing XML from Mixed and Redundant Storage,"A Deutsch, V Tannen",VLDB,2003
