tid,id,title,authors,venue,year
70231,conf/sigmod/KiesslingHFE01,"COSIMA - Your Smart, Speaking E-Salesperson","W Kie▀ling, S Holland, S 0003, T Ehm",SIGMOD Conference,2001
70232,journals/sigmod/Snodgrass98,Chair's Message,,,1998
70234,conf/sigmod/YanMHF01,Data-Driven Understanding and Refinement of Schema Mappings,"L Yan, R Miller, L Haas, R Fagin",SIGMOD Conference,2001
70237,conf/sigmod/Maguire01,Catalog Management in Websphere Commerce Suite,T Maguire,SIGMOD Conference,2001
70238,journals/sigmod/Franklin97b,Editor's Notes,M Franklin,SIGMOD Record,1997
70239,journals/sigmod/Rosenthal98,Where Will Object Techonology Drive Data Administration?,A Rosenthal,SIGMOD Record,1998
70240,conf/sigmod/BorkarDS01,Automatic Segmentation of Text into Structured Records,"V Borkar, K Deshmukh, S Sarawagi",SIGMOD Conference,2001
70241,conf/sigmod/SchusterW01,Communication Efficient Distributed Mining of Association Rules,"A Schuster, R Wolff",SIGMOD Conference,2001
70242,journals/sigmod/Bernstein98,Repositories and Object Oriented Databases,P Bernstein,SIGMOD Record,1998
70245,journals/sigmod/Manola98,Towards a Richer Web Object Model,F Manola,SIGMOD Record,1998
70246,conf/sigmod/LahiriG01,Fast-Start: Quick Fault Recovery in Oracle,"T Lahiri, A Ganesh, R Weiss, A Joshi",SIGMOD Conference,2001
70248,conf/sigmod/GodfreyGXZ01,Exploiting Constraint-Like Data Characterizations in Query Optimization,"P Godfrey, J Gryz, C Zuzarte",SIGMOD Conference,2001
70249,conf/sigmod/FabretJLPRS01,Filtering Algorithms and Implementation for Very Fast Publish/Subscribe,"F Fabret, H Jacobsen, F Llirbat, J Pereira, K Ross, D Shasha",SIGMOD Conference,2001
70251,conf/sigmod/ButtlerLPP01,OminiSearch: A Method for Searching Dynamic Content on the Web,"D Buttler, L Liu, C Pu, H Paques",SIGMOD Conference,2001
70253,journals/sigmod/BrunieK96,Control Strategies for Complex Relational Query Processing in Shared Nothing Systems,"L Brunie, H Kosch",SIGMOD Record,1996
70254,conf/sigmod/AfratiLU01,Generating Efficient Plans for Queries Using Views,"F Afrati, C Li, J Ullman",SIGMOD Conference,2001
70255,conf/sigmod/Smith01,MPEG-7 Standard for Multimedia Databases,,,2001
70257,conf/sigmod/LangS01,Modeling High-Dimensional Index Structures using Sampling,"C Lang, A Singh",SIGMOD Conference,2001
70258,journals/sigmod/NormanZT96,Much Ado About Shared-Nothing,"M Norman, T Zurek, P Thanisch",SIGMOD Record,1996
70259,journals/sigmod/BestavrosLS96,Report on First International Workshop on Real-Time Database Systems,,,1996
70260,conf/sigmod/Meseck01,"Data Management: Lasting Impact of the Wild, Wild, Web",R Meseck,SIGMOD Conference,2001
70265,conf/sigmod/ShahC01,"Fault-tolerant, Load-balancing Queries in Telegraph","M Shah, S Chandrasekaran",SIGMOD Conference,2001
70266,journals/sigmod/BilirisP96,The BeSS Object Storage Manager: Architecture Overview,"A Biliris, E Panagos",SIGMOD Record,1996
70270,conf/sigmod/Larson01,XML Data Management Go Native or Spruce up Relational Systems? (Panel Abstract),P Larson,SIGMOD Conference,2001
70271,journals/sigmod/Widom96,Editor's Notes,J Widom,SIGMOD Record,1996
70272,conf/sigmod/Bussler01,Semantic B2B Integration,,,2001
70273,journals/sigmod/Qian96a,Scientist's Called Upon to Take Actions,X Qian,SIGMOD Record,1996
70274,conf/sigmod/GoldsteinL01,"Optimizing Queries Using Materialized Views: A practical, scalable solution","J Goldstein, P Larson",SIGMOD Conference,2001
70277,journals/sigmod/Bestavros96,Advances in Real-Time Database Systems Research,A Bestavros,SIGMOD Record,1996
70279,conf/sigmod/MistryRSR01,Materialized View Selection and Maintenance Using Multi-Query Optimization,"H Mistry, P Roy, S Sudarshan, K Ramamritham",SIGMOD Conference,2001
70282,conf/sigmod/GionisGK01,Efficient and Tunable Similar Set Retrieval,"A Gionis, D Gunopulos, N Koudas",SIGMOD Conference,2001
70283,conf/sigmod/AgichteinGV01,Snowball: A Prototype System for Extracting Relations from Large Text Collections,"E Agichtein, L Gravano, J Pavel, V Sokolova, A Voskoboynik",SIGMOD Conference,2001
70285,conf/sigmod/KimCK01,Optimizing Multidimensional Index Trees for Main Memory Access,"K Kim, S Cha, K Kwon",SIGMOD Conference,2001
70286,journals/sigmod/PhatakSSS96,"Database Research at the Indian Institute of Technology, Bombay","D Phatak, N Sarda, S Seshadri, S Sudarshan",SIGMOD Record,1996
70290,journals/sigmod/HaritsaS96,Real-Time Index Concurrency Control,"J Haritsa, S Seshadri",SIGMOD Record,1996
70291,journals/sigmod/KuoM96,Real-Time Database - Similarity Semantics and Resource Scheduling,"T Kuo, A Mok",SIGMOD Record,1996
70292,conf/sigmod/BabuGR01,SPARTAN: A Model-Based Semantic Compression System for Massive Data Tables,"S Babu, M Garofalakis, R Rastogi",SIGMOD Conference,2001
70293,journals/sigmod/SonDT96,Improving Timeliness in Real-Time Secure Database Systems,"S Son, R David, B Thuraisingham",SIGMOD Record,1996
70294,conf/sigmod/LamCKNH01,RETINA: A REal-time TraffIc NAvigation System,"K Lam, E Chan, T Kuo, S Ng, D Hung",SIGMOD Conference,2001
70295,journals/sigmod/AdelbergKG96,Overview of the STanford Real-time Information Processor (STRIP),"B Adelberg, B Kao, H Garcia-Molina",SIGMOD Record,1996
70296,conf/sigmod/GreenwaldK01,Space-Efficient Online Computation of Quantile Summaries,"M Greenwald, S Khanna",SIGMOD Conference,2001
70297,conf/sigmod/DraperHW01,The Nimble Integration Engine,"D Draper, A Halevy, D Weld",SIGMOD Conference,2001
70298,journals/sigmod/TsotrasK96,Temporal Database Bibliography Update,"V Tsotras, A Kumar",SIGMOD Record,1996
70299,conf/sigmod/Galindo-LegariaJ01,Orthogonal Optimization of Subqueries and Aggregation,"C Galindo-Legaria, M Joshi",SIGMOD Conference,2001
70300,journals/sigmod/BerndtssonH96,Workshop Report: The First International Workshop on Active and Real-Time Database Systems (ARTDB-95),,,1996
70301,conf/sigmod/DeshpandeGR01,Independence is Good: Dependency-Based Histogram Synopses for High-Dimensional Data,"A Deshpande, M Garofalakis, R Rastogi",SIGMOD Conference,2001
70302,journals/sigmod/Baeza-YatesN96,Integrating Contents and Structure in Text Retrieval,"R Baeza-Yates, G Navarro",SIGMOD Record,1996
70303,journals/sigmod/FreemanG96,Lifestreams: A Storage Model for Personal Data,"E Freeman, D Gelernter",SIGMOD Record,1996
70306,conf/sigmod/BrunoCG01,STHoles: A Multidimensional Workload-Aware Histogram,"N Bruno, S Chaudhuri, L Gravano",SIGMOD Conference,2001
70307,journals/sigmod/UrbanDG96,Database Research at Arizona State University,"S Urban, S Dietrich, F Golshani",SIGMOD Record,1996
70309,journals/sigmod/Gaffney96,Illustra's Web DataBlade Module,J Gaffney,SIGMOD Record,1996
70310,conf/sigmod/KalnisP01,Proxy-Server Architectures for OLAP,"P Kalnis, D Papadias",SIGMOD Conference,2001
70313,journals/sigmod/Qian96,"Shutdown, Budget, and Funding",X Qian,SIGMOD Record,1996
70314,conf/sigmod/ChenGK01,Query Optimization In Compressed Database Systems,"Z Chen, J Gehrke, F Korn",SIGMOD Conference,2001
70315,journals/sigmod/KramerNKRLKLZ97,WWW-UDK: A Web-based Environmental Meta-Information System,"R Kramer, R Nikolai, A Koschel, C Rolker, P Lockemann, A Keitel, R Legat, K Zirm",SIGMOD Record,1997
70316,conf/sigmod/BohannonMR01,Main-Memory Index Structures with Fixed-Size Partial Keys,"P Bohannon, P McIlroy, R Rastogi",SIGMOD Conference,2001
70317,journals/sigmod/TomasicS97,Improving Access to Environmental Data Using Context Information,"A Tomasic, E Simon",SIGMOD Record,1997
70320,conf/sigmod/AggarwalY01,Outlier Detection for High Dimensional Data,"C Aggarwal, P Yu",SIGMOD Conference,2001
70322,journals/sigmod/Gunther97,Environment Information Systems - Guest Editor's Foreword,,,1997
70323,journals/sigmod/KaradimitriouT97,Min-Max Compression Methods for Medical Image Databases,"K Karadimitriou, J Tyler",SIGMOD Record,1997
70324,conf/sigmod/ZhangNDLL01,On Supporting Containment Queries in Relational Database Management Systems,"C Zhang, J Naughton, D DeWitt, Q Luo, G Lohman",SIGMOD Conference,2001
70325,conf/sigmod/ChenGM01,Improving Index Performance through Prefetching,"S Chen, P Gibbons, T Mowry",SIGMOD Conference,2001
70327,conf/sigmod/AgrawalCN01,Materialized View and Index Selection Tool for Microsoft SQL Server 2000,"S Agrawal, S Chaudhuri, V Narasayya",SIGMOD Conference,2001
70328,journals/sigmod/Gardels97,Open GIS and On-Line Environmental Libraries,K Gardels,SIGMOD Record,1997
70329,journals/sigmod/RiekertMW97,Management of Data and Services in the Environmental Information System (UIS) of Baden-W³rttemberg,"W Riekert, R Mayer-F÷ll, G Wiest",SIGMOD Record,1997
70330,conf/sigmod/Sahuguet01,"\Kweelt: More than just \""\""yet another framework to query XML!\""\""\""""",A Sahuguet,SIGMOD Conference,2001
70331,journals/sigmod/Ioannidis96,Dynamic Information Visualization,Y Ioannidis,SIGMOD Record,1996
70332,conf/sigmod/GetoorTK01,Selectivity Estimation using Probabilistic Models,"L Getoor, B Taskar, D Koller",SIGMOD Conference,2001
70334,conf/sigmod/HristidisKP01,PREFER: A System for the Efficient Execution of Multi-parametric Ranked Queries,"V Hristidis, N Koudas, Y Papakonstantinou",SIGMOD Conference,2001
70336,conf/sigmod/JoshiA01,Mining Needle in a Haystack: Classifying Rare Classes via Two-phase Rule Induction,"M Joshi, R Agarwal",SIGMOD Conference,2001
70338,conf/sigmod/IpeirotisGS01,"Probe, Count, and Classify: Categorizing Hidden Web Databases","P Ipeirotis, L Gravano, M Sahami",SIGMOD Conference,2001
70339,conf/sigmod/NgWY01,Iceberg-cube computation with PC clusters,"R Ng, A Wagner, Y Yin",SIGMOD Conference,2001
70340,journals/sigmod/AtkinsonDJPS96,An Orthogonally Persistent Java,"M Atkinson, L DaynĶs, M Jordan, T Printezis, S Spence",SIGMOD Record,1996
70341,conf/sigmod/DoanDH01,Reconciling Schemas of Disparate Data Sources: A Machine-Learning Approach,"A Doan, P Domingos, A Halevy",SIGMOD Conference,2001
70344,journals/sigmod/HasanMV96,Applying database Visualization to the World Wide Web,"M Hasan, A Mendelzon, D Vista",SIGMOD Record,1996
70345,journals/sigmod/KennedyMB96,A Framework for Information Visualisation,"J Kennedy, K Mitchell, P Barclay",SIGMOD Record,1996
70346,conf/sigmod/GunopulosD01,Time Series Similarity Measures and Time Series Indexing,,,2001
70347,conf/sigmod/BabyCY01,VQBD: Exploring Semistructured Data,"S Chawathe, T Baby, J Yeo",SIGMOD Conference,2001
70350,journals/sigmod/CatarciC96,"Information Visualization, Guest Editors' Foreword",,,1996
70352,journals/sigmod/Widom96b,Editor's Notes,Jennifer Widom,SIGMOD Record,1996
70354,conf/sigmod/KriegelMPS01,Spatial Data Management for Computer Aided Design,"H Kriegel, A M³ller, M P÷tke, T Seidl",SIGMOD Conference,2001
70355,conf/sigmod/AdiBEY01,Monitoring Business Processes through Event Correlation based on Dependency Model,"A Adi, D Botzer, O Etzion, T Yatzkar-Haham",SIGMOD Conference,2001
70356,journals/sigmod/Keim96,Pixel-oriented Database Visualizations,D Keim,SIGMOD Record,1996
70358,journals/sigmod/SantucciT96,To Table or Not to Table: a Hypertabular Answer,"G Santucci, L Tarantino",SIGMOD Record,1996
70361,conf/sigmod/GehrkeKS01,On Computing Correlated Aggregates Over Continual Data Streams,"J Gehrke, F Korn, D Srivastava",SIGMOD Conference,2001
70362,journals/sigmod/Ahlberg96,Spotfire: An Information Exploration Environment,C Ahlberg,SIGMOD Record,1996
70363,journals/sigmod/Eisenberg96,New Standard for Stored Procedures in SQL,A Eisenberg,SIGMOD Record,1996
70367,conf/sigmod/Lomet00,High Speed On-line Backup When Using Logical Log Operations,D Lomet,SIGMOD Conference,2000
70369,journals/sigmod/Sidell96,The Mariposa Distributed Database Management System,J Sidell,SIGMOD Record,1996
70370,conf/sigmod/LabioWGG00,Efficient Resumption of Interrupted Warehouse Loads,"W Labio, J Wiener, H Garcia-Molina, V Gorelik",SIGMOD Conference,2000
70371,journals/sigmod/Camps96,"Domains, Relations and Religious Wars",R Camps,SIGMOD Record,1996
70373,journals/sigmod/ZobelMR96,Guidelines for Presentation and Comparison of Indexing Techniques,"J Zobel, A Moffat, K Ramamohanarao",SIGMOD Record,1996
70374,conf/sigmod/ChangC01,PBIR - Perception-Based Image Retrieval,"E Chang, T Cheng, L Chang",SIGMOD Conference,2001
70375,conf/sigmod/Rosenthal01,Will Database Researchers Have ANY Role in Data Security? (Panel Abstract),A Rosenthal,SIGMOD Conference,2001
70376,journals/sigmod/Qian96b,New Programs at DARPA and NSF,X Qian,SIGMOD Record,1996
70378,journals/sigmod/Widom96a,Editor's Notes,J Widom,SIGMOD Record,1996
70379,conf/sigmod/ChoSG00,Finding Replicated Web Collections,"J Cho, N Shivakumar, H Garcia-Molina",SIGMOD Conference,2000
70380,journals/sigmod/MedskerCS95,A Comparison of Three User Interfaces to Relational Microcomputer Data Bases,"C Medsker, M Christensen, I Song",SIGMOD Record,1995
70381,conf/sigmod/OhHP00,Efficient and Cost-effective Techniques for Browsing and Indexing Large Video Databases,"J Oh, K Hua",SIGMOD Conference,2000
70382,journals/sigmod/Segev95,Editor's (Farewell) Notes,,,1995
70383,conf/sigmod/RamaswamyRS00,Efficient Algorithms for Mining Outliers from Large Data Sets,"S Ramaswamy, R Rastogi, K Shim",SIGMOD Conference,2000
70384,journals/sigmod/DogacAOD95,Implementation Aspects of an Object-Oriented DBMS,"A Dogac, M Altinel, C Ozkan, I Durusoy",SIGMOD Record,1995
70385,journals/sigmod/KarlapalemLS95,HODFA: An Architectural Framework for Homogenizing Heterogeneous Legacy Database,"K Karlapalem, Q Li, C Shum",SIGMOD Record,1995
70386,conf/sigmod/SzalayGKT00,Designing and Mining Multi-Terabyte Astronomy Archives: The Sloan Digital Sky Survey,"A Szalay, P Kunszt, A Thakar, J Gray, D Slutz",SIGMOD Conference,2000
70387,conf/sigmod/GunopulosKTD00,Approximating Multi-Dimensional Aggregate Range Queries over Real Attributes,"D Gunopulos, G Kollios, V Tsotras, C Domeniconi",SIGMOD Conference,2000
70389,journals/sigmod/Chaudhri95,An Annotated Bibliography of Benchmarks for Object Databases,A Chaudhri,SIGMOD Record,1995
70390,conf/sigmod/AcharyaGP00,Congressional Samples for Approximate Answering of Group-By Queries,"S Acharya, P Gibbons, V Poosala",SIGMOD Conference,2000
70391,conf/sigmod/WaasG00,"Counting, Enumerating, and Sampling of Execution Plans in a Cost-Based Query Optimizer","F Waas, C Galindo-Legaria",SIGMOD Conference,2000
70394,journals/sigmod/BerraNT95,ACM Multimedia '94 Conference Workshop on Multimedia Database Management Systems,"P Berra, K Nwosu, B Thuraisingham",SIGMOD Record,1995
70395,conf/sigmod/ZaharioudakisCLPU00,Answering Complex SQL Queries Using Automatic Summary Tables,"M Zaharioudakis, R Cochrane, G Lapis, H Pirahesh, M Urata",SIGMOD Conference,2000
70396,journals/sigmod/YanG95,Information Finding in a Digital Library: The Stanford Perspective,"T Yan, H Garcia-Molina",SIGMOD Record,1995
70398,conf/sigmod/CorralMTV00,Closest Pair Queries in Spatial Databases,"A Corral, Y Manolopoulos, Y Theodoridis, M Vassilakopoulos",SIGMOD Conference,2000
70399,conf/sigmod/RoySSB00,Efficient and Extensible Algorithms for Multi Query Optimization,"P Roy, S Seshadri, S Sudarshan, S Bhobe",SIGMOD Conference,2000
70400,journals/sigmod/KimballS95,Why Decision Support Fails and How To Fix It,"R Kimball, K Strehlo",SIGMOD Record,1995
70401,journals/sigmod/Zhang95,Application of OODB and SGML Techniques in Text Database: An Electronic Dictionary System,J Zhang,SIGMOD Record,1995
70402,conf/sigmod/HellersteinA00,Eddies: Continuously Adaptive Query Processing,"R Avnur, J Hellerstein",SIGMOD Conference,2000
70403,journals/sigmod/Lee95,Normalization in OODB Design,B Lee,SIGMOD Record,1995
70404,conf/sigmod/PopaDST00,A Chase Too Far?,"L Popa, A Deutsch, A Sahuguet, V Tannen",SIGMOD Conference,2000
70405,journals/sigmod/KokkotosIPS95,On the Issue of Valid Time(s) in Temporal Databases,"S Kokkotos, E Ioannidis, T Panayiotopoulos, C Spyropoulos",SIGMOD Record,1995
70408,conf/sigmod/ForlizziGNS00,A Data Model and Data Structures for Moving Objects Databases,"L Forlizzi, R G³ting, E Nardelli, M Schneider",SIGMOD Conference,2000
70410,conf/sigmod/MoonSL00,Adaptive Multi-Stage Distance Join Processing,"H Shin, B Moon, S Lee",SIGMOD Conference,2000
70411,conf/sigmod/LiuPBHPT00,AQR-Toolkit: An Adaptive Query Routing Middleware for Distributed Data Intensive Systems,"L Liu, C Pu, D Buttler, W Han, H Paques, W Tang",SIGMOD Conference,2000
70412,journals/sigmod/KlasS94,Metadata for Digital Media: Introduction to the Special Issue,"W Klas, A Sheth",SIGMOD Record,1994
70413,journals/sigmod/Wedekind94,"\Are the Terms \""\""Version\""\"" and \""\""Variant\""\"" Orthogonal to One Another? A Critical Assessment of the STEP Standardization\""""",H Wedekind,SIGMOD Record,1994
70414,conf/sigmod/GillmannWSWW00,A Goal-driven Auto-Configuration Tool for the Distributed Workflow Management System Mentor-lite,"M Gillmann, J Wei▀enfels, G Shegalov, W Wonner, G Weikum",SIGMOD Conference,2000
70416,journals/sigmod/JainH94,Metadata in Video Databases,"R Jain, A Hampapur",SIGMOD Record,1994
70417,journals/sigmod/BohmR94,Metadata for Multimedia Documents,"K B÷hm, T Rakow",SIGMOD Record,1994
70418,conf/sigmod/OriaOILY00,DISIMA: A Distributed and Interoperable Image Database System,"V Oria, M ųzsu, P Iglinski, S Lin, B Yao",SIGMOD Conference,2000
70419,conf/sigmod/RiedelFGN00,Data Mining on an OLTP System (Nearly) for Free,"E Riedel, C Faloutsos, G Ganger, D Nagle",SIGMOD Conference,2000
70420,journals/sigmod/ShinM94,A New Join Algorithm,"D Shin, A Meltzer",SIGMOD Record,1994
70421,conf/sigmod/HanPY00,Mining Frequent Patterns without Candidate Generation,"J Han, J Pei, Y Yin",SIGMOD Conference,2000
70422,journals/sigmod/Bertram94,Data Modelling in the Large,M Bertram,SIGMOD Record,1994
70425,conf/sigmod/ShenoyHSBBS00,Turbo-charging Vertical Mining of Large Databases,"P Shenoy, J Haritsa, S Sudarshan, G Bhalotia, M Bawa, D Shah",SIGMOD Conference,2000
70426,journals/sigmod/KiyokiKH94,A Metadatabase System for Semantic Image Search by a Mathematical Model of Meaning,"Y Kiyoki, T Kitagawa, T Hayama",SIGMOD Record,1994
70428,conf/sigmod/HsiaoN00,DLFM: A Transactional Resource Manager,"H Hsiao, I Narang",SIGMOD Conference,2000
70429,journals/sigmod/SchlageterBHMSW95,The Database Group at University of Hagen (FernUniversitaet),"G Schlageter, T Berkel, E Heuel, S Mittrach, A Scherer, W Wilkes",SIGMOD Record,1995
70430,conf/sigmod/Ross00,Expressing Business Rules,R Ross,SIGMOD Conference,2000
70431,conf/sigmod/Jhingran00,Anatomy of a Real E-Commerce System,A Jhingran,SIGMOD Conference,2000
70432,journals/sigmod/X95,Calls for Papers and Announcements,,SIGMOD Record,1995
70433,conf/sigmod/Weininger00,Handling Very Large Databases with Informix Extended Parallel Server,A Weininger,SIGMOD Conference,2000
70434,journals/sigmod/Qian95,Political Winds Change Direction Again,X Qian,SIGMOD Record,1995
70435,conf/sigmod/ChenDLT00,Fact: A Learning Based Web Query Processing System,"S Chen, Y Diao, H Lu, Z Tian",SIGMOD Conference,2000
70436,journals/sigmod/Jannink95,Implementing Deletion in B+-Trees,J Jannink,SIGMOD Record,1995
70438,conf/sigmod/WangSSZZW00,An Approximate Search Engine for Structural Databases,"J Wang, X Wang, D Shasha, B Shapiro, K Zhang, X Zheng, Q Ma, Z Weinberg",SIGMOD Conference,2000
70442,journals/sigmod/DarwenD95,The Third Manifesto,"H Darwen, C Date",SIGMOD Record,1995
70443,conf/sigmod/LitwinS00,LH*RS: A High-Availability Scalable Distributed Data Structure using Reed Solomon Codes,"W Litwin, T Schwarz",SIGMOD Conference,2000
70445,journals/sigmod/Qian95b,"Opportunities at ARPA, NSF, and Elsewhere",X Qian,SIGMOD Record,1995
70446,conf/sigmod/GoldmanW00,WSQ/DSQ: A Practical Approach for Combined Querying of Databases and the Web,"R Goldman, J Widom",SIGMOD Conference,2000
70447,journals/sigmod/EnglertGH95,Parallelism and its Price: A Case Study of NonStop SQL/MP,"S Englert, R Glasstone, W Hasan",SIGMOD Record,1995
70448,conf/sigmod/RodriguezR00,MOCHA: A Self-Extensible Database Middleware System for Distributed Data Sources,"M Rodriguez-Martinez, N Roussopoulos",SIGMOD Conference,2000
70450,conf/sigmod/LeeKOTM00,Towards Self-Tuning Data Placement in Parallel Database Systems,"M Lee, M Kitsuregawa, B Ooi, K Tan, A Mondal",SIGMOD Conference,2000
70451,journals/sigmod/SegevJS95,Report on The 1995 International Workshop on Temporal Databases,,,1995
70452,conf/sigmod/LabrinidisR00,WebView Materialization,"A Labrinidis, N Roussopoulos",SIGMOD Conference,2000
70453,journals/sigmod/Bohlen95,Temporal Database System Implementations,M B÷hlen,SIGMOD Record,1995
70454,conf/sigmod/ChenJDTW00,NiagaraCQ: A Scalable Continuous Query System for Internet Databases,"J Chen, D DeWitt, F Tian, Y Wang",SIGMOD Conference,2000
70455,journals/sigmod/WolfsonSDNR95,View Maintenance in Mobile Computing,"O Wolfson, A Sistla, S Dao, K Narayanan, R Raj",SIGMOD Record,1995
70456,conf/sigmod/BarclaySG00,TerraServer: A Spatial Data Warehouse,"T Barclay, D Slutz, J Gray",SIGMOD Conference,2000
70457,conf/sigmod/SaltenisJLL00,Indexing the Positions of Continuously Moving Objects,"S Saltenis, C Jensen, S Leutenegger, M Lopez",SIGMOD Conference,2000
70458,journals/sigmod/AlonsoCIM95,Managing Video Data in a Mobile Environment,"R Alonso, Y Chang, L Iftode, V Mani",SIGMOD Record,1995
70459,conf/sigmod/SalemBCL00,How To Roll a Join: Asynchronous Incremental View Maintenance,"K Salem, K Beyer, R Cochrane, B Lindsay",SIGMOD Conference,2000
70461,journals/sigmod/ElmagarmidJF95,Wireless Client/Server Computing for Personal Information Services and Applications,"A Elmagarmid, J Jing, T Furukawa",SIGMOD Record,1995
70463,journals/sigmod/DrewHKKLLLSW95,Data and Knowledge Base Research at Hong Kong University of Science and Technology,"P Drew, B Hamidzadeh, K Karlapalem, A Kean, D Lee, Q Li, F Lochovsky, C Shum, B W³thrich",SIGMOD Record,1995
70464,conf/sigmod/BreunigKNS00,LOF: Identifying Density-Based Local Outliers,"M Breunig, H Kriegel, R Ng, J Sander",SIGMOD Conference,2000
70466,journals/sigmod/DunhamH95,From the Guest Editors - Special Section on Data Management Issues in Mobile Computing,"M Dunham, A Helal",,1995
70467,journals/sigmod/BhargavaAP95,Digital Library Services in Mobile Computing,"B Bhargava, M Annamalai, E Pitoura",SIGMOD Record,1995
70470,journals/sigmod/Ulusoy95,An Annotated Bibliography on Real-Time Database Systems,ų Ulusoy,SIGMOD Record,1995
70473,journals/sigmod/NobleS95,A Research Status Report on Adaptation for Mobile Data Access,"B Noble, M Satyanarayanan",SIGMOD Record,1995
70475,journals/sigmod/Fong95,Mapping Extended Entity Relationship Model to Object Modeling Technique,J Fong,SIGMOD Record,1995
70476,conf/sigmod/Nori00,Application Architecture: 2Tier or 3Tier? What is DBMS's Role? (Panel Abstract),A Nori,SIGMOD Conference,2000
70477,conf/sigmod/Hellerstein00,Index Research: Forest or Trees? (Panel Abstract),J Hellerstein,SIGMOD Conference,2000
70478,journals/sigmod/ONeilG95,Multi-Table Joins Through Bitmapped Join Indices,"P O'Neil, G Graefe",SIGMOD Record,1995
70479,journals/sigmod/MaelbranckeO95,Optimizing Jan Jannink's Implementation of B+-tree Deletion,"R Maelbrancke, H Olivie",SIGMOD Record,1995
70485,journals/sigmod/RosenthalSMBTL95,Data Management Research at The MITRE Corporation,"A Rosenthal, L Seligman, C McCollum, B Blaustein, B Thuraisingham, E Lafferty",SIGMOD Record,1995
70486,conf/sigmod/Gal00,"Data Management in eCommerce: The Good, the Bad, and the Ugly",,,2000
70490,conf/sigmod/Carey00,On XML and Databases: Where's the Beef? (Panel Abstract),M Carey,SIGMOD Conference,2000
70494,conf/sigmod/AgrawalS00,Privacy-Preserving Data Mining,"R Agrawal, R Srikant",SIGMOD Conference,2000
70495,journals/sigmod/DoanPK95,Design and User Testing of a Multi-Paradigm Query Interface to an Object-Oriented Database,"D Doan, N Paton, A Kilgour",SIGMOD Record,1995
70498,conf/sigmod/ChangBCLLS00,The Onion Technique: Indexing for Linear Optimization Queries,"Y Chang, L Bergman, V Castelli, C Li, M Lo, J Smith",SIGMOD Conference,2000
70499,conf/sigmod/ChenCPPSTM00,Internet Traffic Warehouse,"C Chen, M Cochinwala, C Petrone, M Pucci, S Samtani, P Santa, M Mesiti",SIGMOD Conference,2000
70500,journals/sigmod/X95a,Calls for Papers and Announcements,,SIGMOD Record,1995
70501,conf/sigmod/AnnamalaiCD00,Indexing Images in Oracle8i,"M Annamalai, R Chopra, S DeFazio",SIGMOD Conference,2000
70502,journals/sigmod/Finkelstein95,The New Middleware,R Finkelstein,SIGMOD Record,1995
70503,journals/sigmod/Stacey95,"Replication: DB2, Oracle, or Sybase?",D Stacey,SIGMOD Record,1995
70504,conf/sigmod/PonnekantiK00,Online Index Rebuild,"N Ponnekanti, H Kodavalla",SIGMOD Conference,2000
70505,journals/sigmod/Alonso95a,Trade Press News,,,1995
70506,conf/sigmod/LehnerSPC00,Maintenance of Automatic Summary Tables,"W Lehner, R Sidle, H Pirahesh, R Cochrane",SIGMOD Conference,2000
70508,conf/sigmod/BressanGOT00,Integrating Replacement Policies in StorM: An Extensible Approach,"C Goh, B Ooi, S Bressan, K Tan",SIGMOD Conference,2000
70511,conf/sigmod/ChakrabartiM99,Efficient Concurrency Control in Multidimensional Access Methods,"K Chakrabarti, S Mehrotra",SIGMOD Conference,1999
70515,conf/sigmod/HsuLG00,Image Mining in IRIS: Integrated Retinal Information System,"W Hsu, M Lee, K Goh",SIGMOD Conference,2000
70517,journals/tods/Chomicki03,Preference formulas in relational queries,J Chomicki,ACM Trans. Database Syst.,2003
70520,journals/tods/DiaoAFZF03,Path sharing and predicate evaluation for high-performance XML filtering,"Y Diao, M Altinel, M Franklin, H Zhang, P Fischer",ACM Trans. Database Syst.,2003
70521,conf/sigmod/LiBCS00,SPIRE: A Progressive Content-Based Spatial Image Retrieval Engine,"C Li, L Bergman, V Castelli, J Smith",SIGMOD Conference,2000
70522,journals/tods/HjaltasonS03,Index-driven similarity search in metric spaces,"G Hjaltason, H Samet",ACM Trans. Database Syst.,2003
