tid,id,title,authors,venue,year
70811,conf/sigmod/Fegaras98,Query Unnesting in Object-Oriented Databases,L Fegaras,SIGMOD Conference,1998
70813,conf/sigmod/RaoR98,Reusing Invariants: A New Strategy for Correlated Queries,"J Rao, K Ross",SIGMOD Conference,1998
70814,conf/vldb/YagoubFIV00,Caching Strategies for Data-Intensive Web Sites,"K Yagoub, D Florescu, V Issarny, P Valduriez",VLDB,2000
70815,conf/vldb/WuFSP00,FALCON: Feedback Adaptive Loop for Content-Based Retrieval,"L Wu, C Faloutsos, K Sycara, T Payne",VLDB,2000
70816,conf/sigmod/BerchtoldBK98,The Pyramid-Technique: Towards Breaking the Curse of Dimensionality,"S Berchtold, C B÷hm, H Kriegel",SIGMOD Conference,1998
70817,conf/sigmod/JonssonFS98,Interaction of Query Evaluation and Buffer Management for Information Retrieval,"B J¾nsson, M Franklin, D Srivastava",SIGMOD Conference,1998
70820,conf/sigmod/LiYVGPUV98,Capability Based Mediation in TSIMMIS,"C Li, R Yerneni, V Vassalos, H Garcia-Molina, Y Papakonstantinou, J Ullman, M Valiveti",SIGMOD Conference,1998
70821,conf/sigmod/ChenWZ98,A Protein Patent Query System Powered By Kleisli,"J Chen, L Wong, L Zhang",SIGMOD Conference,1998
70822,conf/vldb/LuL00,Decision Tables: Scalable Classification Exploring RDBMS Capabilities,"H Lu, H Liu",VLDB,2000
70824,conf/sigmod/ShintaniK98,Parallel Mining Algorithms for Generalized Association Rules with Classification Hierarchy,"T Shintani, M Kitsuregawa",SIGMOD Conference,1998
70826,conf/vldb/GoldsteinR00,Contrast Plots and P-Sphere Trees: Space vs. Time in Nearest Neighbour Searches,"J Goldstein, R Ramakrishnan",VLDB,2000
70827,conf/vldb/CareyKRLABFLOPQRSSUVWY01,The Propel Distributed Services Platform,"M Carey, S Kirsch, M Roth, B Linden, N Adiba, M Blow, D Florescu, D Li, I Oprencak, R Panwar, R Qi, D Rieber, J Shafer, B Sterling, T Urhan, B Vickery, D Wineman, K Yee",VLDB,2001
70829,conf/sigmod/Toyama98,SuperSQL: An Extended SQL for Database Publishing and Presentation,M Toyama,SIGMOD Conference,1998
70831,conf/vldb/AbrolLMMMRTWZ01,Navigating large-scale semi-structured data in business portals,"M Abrol, N Latarche, U Mahadevan, J Mao, R Mukherjee, P Raghavan, M Tourn, J Wang, G Zhang",VLDB,2001
70832,conf/sigmod/BaumannDFRW98,The Multidimensional Database System RasDaMan,"P Baumann, A Dehmel, P Furtado, R Ritsch, N Widmann",SIGMOD Conference,1998
70835,conf/vldb/May01,LoPiX: A System for XML Data Integration and Manipulation,W May,VLDB,2001
70836,conf/sigmod/Cohen98a,Providing Database-like Access to the Web Using Queries Based on Textual Similarity,W Cohen,SIGMOD Conference,1998
70837,conf/vldb/AnciauxBBPV01,PicoDBMS: Validation and Experience,"N Anciaux, C Bobineau, L Bouganim, P Pucheral, P Valduriez",VLDB,2001
70838,conf/sigmod/LacroixSC98,User-oriented smart-cache for the Web: What You Seek is What You Get!,"Z Lacroix, A Sahuguet, R Chandrasekar",SIGMOD Conference,1998
70839,conf/vldb/CatozziR01,Operating System Extensions for the Teradata Parallel VLDB,"J Catozzi, S Rabinovici",VLDB,2001
70840,conf/sigmod/ChaudhuriN98a,Microsoft Index Tuning Wizard for SQL Server 7.0,"S Chaudhuri, V Narasayya",SIGMOD Conference,1998
70842,conf/vldb/MorishimaKKT01,Enabling End-users to Construct Data-intensive Web-sites from XML Repositories: An Example-based Approach,"A Morishima, S Koizumi, H Kitagawa, S Takano",VLDB,2001
70846,conf/sigmod/BrinMUT97,Dynamic Itemset Counting and Implication Rules for Market Basket Data,"S Brin, R Motwani, J Ullman, S Tsur",SIGMOD Conference,1997
70847,conf/sigmod/ZhaoDN97,An Array-Based Algorithm for Simultaneous Multidimensional Aggregates,"Y Zhao, P Deshpande, J Naughton",SIGMOD Conference,1997
70848,conf/vldb/SindoniTABFGMPPT01,SIT-IN: a Real-Life Spatio-Temporal Information System,"G Sindoni, L Tininini, A Ambrosetti, C Bedeschi, S Francisci, O Gargano, R Molinaro, M Paolucci, P Patteri, P Ticca",VLDB,2001
70849,conf/sigmod/AcharyaFZ97,Balancing Push and Pull for Data Broadcast,"S Acharya, M Franklin, S Zdonik",SIGMOD Conference,1997
70850,conf/vldb/KoschBBHHLRT01,SMOOTH - A Distributed Multimedia Database System,"H Kosch, L B÷sz÷rmķnyi, A Bachlechner, C Hanin, C Hofbauer, M Lang, C Riedler, R Tusch",VLDB,2001
70851,conf/sigmod/KornackerMH97,Concurrency and Recovery in Generalized Search Trees,"M Kornacker, C Mohan, J Hellerstein",SIGMOD Conference,1997
70852,conf/vldb/PereiraFJLS01,WebFilter: A High-throughput XML-based Publish and Subscribe System,"J Pereira, F Fabret, H Jacobsen, F Llirbat, D Shasha",VLDB,2001
70853,conf/vldb/YagoubFIV00a,Building and Customizing Data-Intensive Web Sites Using Weave,"K Yagoub, D Florescu, V Issarny, P Valduriez",VLDB,2000
70854,conf/sigmod/RoussopoulosKR97,Cubetree: Organization of and Bulk Updates on the Data Cube,"N Roussopoulos, Y Kotidis, M Roussopoulos",SIGMOD Conference,1997
70855,conf/vldb/ZhouLZLZJT01,VXMLR: A Visual XML-Relational Database System,"A Zhou, H Lu, S Zheng, Y Liang, L Zhang, W Ji, Z Tian",VLDB,2001
70856,conf/sigmod/CeriFP98,The IDEA Web Lab,"S Ceri, P Fraternali, S Paraboschi",SIGMOD Conference,1998
70858,conf/sigmod/BerchtoldBBKK97,Fast Parallel Similarity Search in Multimedia Databases,"S Berchtold, C B÷hm, B Braunm³ller, D Keim, H Kriegel",SIGMOD Conference,1997
70859,conf/vldb/PapadiasT01,MV3R-Tree: A Spatio-Temporal Access Method for Timestamp and Interval Queries,"Y Tao, D Papadias",VLDB,2001
70860,conf/sigmod/Spiro98,"Ubiquitous, Self-tuning, Scalable Servers",P Spiro,SIGMOD Conference,1998
70861,conf/vldb/OoiYTJ01,Indexing the Distance: An Efficient Method to KNN Processing,"C Yu, B Ooi, K Tan, H Jagadish",VLDB,2001
70863,conf/vldb/TanSHCR01,Walking Through a Very Large Virtual Environment in Real-time,"L Shou, J Chionh, Z Huang, Y Ruan, K Tan",VLDB,2001
70864,conf/sigmod/ReinwaldP98,SQL Open Heterogeneous Data Access,"B Reinwald, H Pirahesh",SIGMOD Conference,1998
70866,conf/sigmod/BlakeleyP98,Microsoft Universal Data Access Platform,"J Blakeley, M Pizzo",SIGMOD Conference,1998
70867,conf/sigmod/ClossmanSHKPB98,Java and Relational Databases: SQLJ (Tutorial),,,1998
70868,conf/vldb/SatheS01,Intelligent Rollups in Multidimensional OLAP Data,"G Sathe, S Sarawagi",VLDB,2001
70869,conf/sigmod/KemperKM98,SAP R/3: A Database Application System (Tutorial),,,1998
70870,conf/vldb/CuiW01,Lineage Tracing for General Data Warehouse Transformations,"Y Cui, J Widom",VLDB,2001
70872,conf/sigmod/Mylopoulos98,Panel on Next Generation Database Systems Won't Work Without Semantics!,J Mylopoulos,SIGMOD Conference,1998
70873,conf/sigmod/AndersonBKW98,"Replication, Consistency, and Practicality: Are These Mutually Exclusive?","T Anderson, Y Breitbart, H Korth, A Wool",SIGMOD Conference,1998
70874,conf/vldb/JensenL01,Transaction Timestamping in (Temporal) Databases,"C Jensen, D Lomet",VLDB,2001
70875,conf/sigmod/MeccaAMMS98,The Araneus Web-Base Management System,"G Mecca, P Atzeni, A Masci, P Merialdo, G Sindoni",SIGMOD Conference,1998
70876,conf/vldb/Duranti01,The Long-Term Preservation of Authentic Electronic Records,L Duranti,VLDB,2001
70878,conf/sigmod/Kennamer98,Microsoft.com: A High-Scale Data Management and Transaction Processing Solution,S Kennamer,SIGMOD Conference,1998
70879,conf/vldb/MarronL01,On Processing XML in LDAP,"P Marr¾n, G Lausen",VLDB,2001
70880,conf/sigmod/Lassettre98,Olympic Records for Data at the 1998 Nagano Games,E Lassettre,SIGMOD Conference,1998
70883,conf/vldb/BonifatiCDS01,Warehousing Workflow Data: Challenges and Opportunities,"A Bonifati, F Casati, U Dayal, M Shan",VLDB,2001
70884,conf/sigmod/AndersonAF98,Oracle Rdb's Record Caching Model,"R Anderson, G Arun, R Frank",SIGMOD Conference,1998
70886,conf/vldb/Huyn01,Scientific OLAP for the Biotech Domain,N Huyn,VLDB,2001
70887,conf/sigmod/Chan98,Transactional Publish / Subscribe: The Proactive Multicast of Database Changes,A Chan,SIGMOD Conference,1998
70889,conf/vldb/Gentili01,Italian Electronic Identity Card - principle and architecture,M Gentili,VLDB,2001
70890,conf/sigmod/RamakrishnanD98,The PointCast Network,"S Ramakrishnan, V Dayal",SIGMOD Conference,1998
70892,conf/sigmod/BohrerBBCFHKKMNRRSUUW97,InfoSleuth: Semantic Integration of Information in Open and Dynamic Environments (Experience Paper),"R Jr., W Bohrer, R Brice, A Cichocki, J Fowler, A Helal, V Kashyap, T Ksiezyk, G Martin, M Nodine, M Rashid, M Rusinkiewicz, R Shea, C Unnikrishnan, A Unruh, D Woelk",SIGMOD Conference,1997
70893,conf/vldb/NetzCBF00,Integration of Data Mining with Database Technology,"A Netz, S Chaudhuri, J Bernhardt, U Fayyad",VLDB,2000
70895,conf/sigmod/CareyK97,"\On Saying \""\""Enough Already!\""\"" in SQL\""""","M Carey, D Kossmann",SIGMOD Conference,1997
70896,conf/vldb/KemperKW99,Generalised Hash Teams for Join and Group-by,"A Kemper, D Kossmann, C Wiesner",VLDB,1999
70897,conf/vldb/Carey00,"Toto, We're Not in Kansas Anymore: On Transitioning from Research to the Real (Invited Industrial Talk)",M Carey,VLDB,2000
70898,conf/sigmod/GravanoCGP97,STARTS: Stanford Proposal for Internet Meta-Searching (Experience Paper),"L Gravano, K Chang, H Garcia-Molina, A Paepcke",SIGMOD Conference,1997
70899,conf/sigmod/HanKK97,Scalable Parallel Data Mining for Association Rules,"E Han, G Karypis, V Kumar",SIGMOD Conference,1997
70900,conf/vldb/Blecken00,Media360 Workflow-Implementing a Workflow Engine Inside a Database,C Blecken,VLDB,2000
70902,conf/vldb/CasatiS00,Process Automation as the Foundation for E-Business,"F Casati, M Shan",VLDB,2000
70905,conf/sigmod/MaheshwariL97,Partitioned Garbage Collection of Large Object Store,"U Maheshwari, B Liskov",SIGMOD Conference,1997
70906,conf/vldb/Bowker00,Work and Information Practices in the Sciences of Biodiversity,G Bowker,VLDB,2000
70907,conf/sigmod/ZaharioudakisC97,Highly Concurrent Cache Consistency for Indices in Client-Server Database Systems,"M Zaharioudakis, M Carey",SIGMOD Conference,1997
70909,conf/sigmod/ONeilQ97,Improved Query Performance with Variant Indexes,"P O'Neil, D Quass",SIGMOD Conference,1997
70911,conf/vldb/Deshpande00,Linking Business to Deliver Value: A Data Management Challenge,A Deshpande,VLDB,2000
70912,conf/sigmod/MumickQM97,Maintenance of Data Cubes and Summary Tables in a Warehouse,"I Mumick, D Quass, B Mumick",SIGMOD Conference,1997
70913,conf/sigmod/HoAMS97,Range Queries in OLAP Data Cubes,"C Ho, R Agrawal, N Megiddo, R Srikant",SIGMOD Conference,1997
70914,conf/vldb/Team00,"High-Performance and Scalability through Application Tier,In-Memory Data Management",,VLDB,2000
70917,conf/sigmod/TsueiPK97,Database Buffer Size Investigation for OLTP Workloads (Experience Paper),"T Tsuei, A Packer, K Ko",SIGMOD Conference,1997
70920,conf/vldb/Schek00,"Panel: Future Directions of Database Research - The VLDB Broadening Strategy, Part 1",H Schek,VLDB,2000
70923,conf/vldb/PereiraFLS00,Publish/Subscribe on the Web at Extreme Speed,"J Pereira, F Fabret, F Llirbat, R Preotiuc-Pietro, K Ross, D Shasha",VLDB,2000
70924,conf/sigmod/YangM97,Association Rules over Interval Data,"R Miller, Y Yang",SIGMOD Conference,1997
70927,conf/vldb/LudasaherGM00,Model-Based Information Integration in a Neuroscience Mediator System,"B Ludõscher, A Gupta, M Martone",VLDB,2000
70928,conf/sigmod/Kramer97,Databases on the Web: Technologies for Federation Architectures and Case Studies (Tutorial),R Kramer,SIGMOD Conference,1997
70933,conf/vldb/BeneventanoBCCGMMV00,Information Integration: The MOMIS Project Demonstration,"D Beneventano, S Bergamaschi, S Castano, A Corni, R Guidetti, G Malvezzi, M Melchiori, M Vincini",VLDB,2000
70934,conf/sigmod/HanKS97,GeoMiner: A System Prototype for Spatial Data Mining,"J Han, K Koperski, N Stefanovic",SIGMOD Conference,1997
70935,conf/sigmod/RafieiM97,Similarity-Based Queries for Time Series Data,"D Rafiei, A Mendelzon",SIGMOD Conference,1997
70937,conf/sigmod/ChawatheG97,Meaningful Change Detection in Structured Data,"S Chawathe, H Garcia-Molina",SIGMOD Conference,1997
70938,conf/vldb/HelalL00,Rainbow: Distributed Database System for Classroom Education and Experimental Research,"A Helal, H Li",VLDB,2000
70941,conf/vldb/RisheYACLMVSV00,Semantic Access: Semantic Interface for Querying Databases,"N Rishe, J Yuan, R Athauda, S Chen, X Lu, X Ma, A Vaschillo, A Shaposhnikov, D Vasilevsky",VLDB,2000
70943,conf/sigmod/LivnyRBCDLMW97,DEVise: Integrated Querying and Visualization of Large Datasets,"M Livny, R Ramakrishnan, K Beyer, G Chen, D Donjerkovic, S Lawande, J Myllymaki, R Wenger",SIGMOD Conference,1997
70944,conf/vldb/PedersenJD00,The TreeScape System: Reuse of Pre-Computed Aggregates over Irregular OLAP Hierarchies,"T Pedersen, C Jensen, C Dyreson",VLDB,2000
70945,conf/vldb/GuPS00,OLAP++: Powerful and Easy-to-Use Federations of OLAP and Object Databases,"J Gu, T Pedersen, A Shoshani",VLDB,2000
70946,conf/sigmod/PatelYKTNBHRLEKGDN97,"Building a Scaleable Geo-Spatial DBMS: Technology, Implementation, and Evaluation","J Patel, J Yu, N Kabra, K Tufte, B Nag, J Burger, N Hall, K Ramasamy, R Lueder, C Ellmann, J Kupsch, S Guo, D DeWitt, J Naughton",SIGMOD Conference,1997
70947,conf/sigmod/GebhardtJJ97,A Toolkit for Negotiation Support Interfaces to Multi-Dimensional Data,"M Gebhardt, M Jarke, S Jacobs",SIGMOD Conference,1997
70948,conf/vldb/LabioYCGW00,Performance Issues in Incremental Warehouse Maintenance,"W Labio, J Yang, Y Cui, H Garcia-Molina, J Widom",VLDB,2000
70949,conf/vldb/JarkeKL00,The Challenge of Process Data Warehousing,"M Jarke, T List, J K÷ller",VLDB,2000
70950,conf/sigmod/BozkayaO97,Distance-Based Indexing for High-Dimensional Metric Spaces,"T Bozkaya, Z ųzsoyoglu",SIGMOD Conference,1997
70951,conf/vldb/HinneburgAK00,What Is the Nearest Neighbor in High Dimensional Spaces?,"A Hinneburg, C Aggarwal, D Keim",VLDB,2000
70952,conf/sigmod/AgrawalASY97,Efficient View Maintenance at Data Warehouses,"D Agrawal, A Abbadi, A Singh, T Yurek",SIGMOD Conference,1997
70954,conf/sigmod/LlirbatFS97,Eliminating Costly Redundant Computations from SQL Trigger Executions,"F Llirbat, F Fabret, E Simon",SIGMOD Conference,1997
70955,conf/vldb/JiangSLB00,The BT-tree: A Branched and Temporal Access Method,"L Jiang, B Salzberg, D Lomet, M GarcĒa",VLDB,2000
70958,conf/sigmod/WodtkeWWDM97,The MENTOR Workbench for Enterprise-wide Workflow Management,"D Wodtke, J Wei▀enfels, G Weikum, A Dittrich, P Muth",SIGMOD Conference,1997
70959,conf/vldb/GuntzerBK00,Optimizing Multi-Feature Queries for Image Databases,"U G³ntzer, W Balke, W Kie▀ling",VLDB,2000
70960,conf/sigmod/Chakravarthy97,SENTINEL: An Object-Oriented DBMS With Event-Based Rules,S Chakravarthy,SIGMOD Conference,1997
70961,conf/vldb/KriegelPS00,Managing Intervals Efficiently in Object-Relational Databases,"H Kriegel, M P÷tke, T Seidl",VLDB,2000
70962,conf/sigmod/SeshadriP97,PREDATOR: An OR-DBMS with Enhanced Data Types,"P Seshadri, M Paskin",SIGMOD Conference,1997
70963,conf/sigmod/Blakeley96,Data Access for the Masses through OLE DB,J Blakeley,SIGMOD Conference,1996
70964,conf/vldb/PfoserJT00,Novel Approaches in Query Processing for Moving Object Trajectories,"D Pfoser, C Jensen, Y Theodoridis",VLDB,2000
70967,conf/sigmod/OConnellISWABCCLPWW96,A Content-Based Multimedia Server for Massively Parallel Architectures,"W O'Connell, I Ieong, D Schrader, C Watson, G Au, A Biliris, S Choo, P Colin, G Linderman, E Panagos, J Wang, T Walters",SIGMOD Conference,1996
70969,conf/sigmod/SimmenSM96,Fundamental Techniques for Order Optimization,"D Simmen, E Shekita, T Malkemus",SIGMOD Conference,1996
70972,conf/vldb/JohnsonA00,Optimizing Queries on Compressed Bitmaps,"S Amer-Yahia, T Johnson",VLDB,2000
70973,conf/vldb/DiaoLCT00,Toward Learning Based Web Query Processing,"Y Diao, H Lu, S Chen, Z Tian",VLDB,2000
70976,conf/sigmod/GeneserethKD97,Infomaster: An Information Integration System,"M Genesereth, A Keller, O Duschka",SIGMOD Conference,1997
70979,conf/sigmod/BerchtoldK97,S3: Similarity Search in CAD Database Systems,"S Berchtold, H Kriegel",SIGMOD Conference,1997
70980,conf/vldb/StohrMR00,Multi-Dimensional Database Allocation for Parallel Data Warehouses,"T St÷hr, H Mõrtens, E Rahm",VLDB,2000
70982,conf/vldb/RamsakMFZEB00,Integrating the UB-Tree into a Database System Kernel,"F Ramsak, V Markl, R Fenk, M Zirkel, K Elhardt, R Bayer",VLDB,2000
70983,conf/vldb/CeriCW00,Practical Applications of Triggers and Constraints: Success and Lingering Issues (10-Year Award),"S Ceri, R Cochrane, J Widom",VLDB,2000
70984,conf/sigmod/LabioZWGGW97,The WHIPS Prototype for Data Warehouse Creation and Maintenance,"W Labio, Y Zhuge, J Wiener, H Gupta, H Garcia-Molina, J Widom",SIGMOD Conference,1997
70988,conf/sigmod/Chaudhuri97,Query Optimization at the Crossroads (Panel),S Chaudhuri,SIGMOD Conference,1997
70989,conf/vldb/BalminPP00,Hypothetical Queries in an OLAP Environment,"A Balmin, T Papadimitriou, Y Papakonstantinou",VLDB,2000
70990,conf/sigmod/GoyalHKMSZ97,Picture Programming Project,"N Goyal, C Hoch, R Krishnamurthy, B Meckler, M Suckow, M Zloof",SIGMOD Conference,1997
70991,conf/sigmod/CareyMN97,"Object-Relational Database Systems: Principles, Products, and Challenges (Tutorial)",,,1997
70992,conf/vldb/WangZ00,Using SQL to Build New Aggregates and Extenders for Object- Relational Systems,"H Wang, C Zaniolo",VLDB,2000
70993,conf/sigmod/ChaudhuriD97,Data Warehousing and OLAP for Decision Support (Tutorial),,,1997
70995,conf/vldb/OlstonW00,Offering a Precision-Performance Tradeoff for Aggregation Queries over Replicated Data,"C Olston, J Widom",VLDB,2000
70996,conf/sigmod/AtzeniT97,MDM: a Multiple-Data-Model Tool for the Management of Heterogeneous Database Schemes,"P Atzeni, R Torlone",SIGMOD Conference,1997
70997,conf/sigmod/HammerGNYBV97,Template-Based Wrappers in the TSIMMIS System,"J Hammer, H Garcia-Molina, S Nestorov, R Yerneni, M Breunig, V Vassalos",SIGMOD Conference,1997
70999,conf/vldb/MillerHH00,Schema Mapping as Query Discovery,"R Miller, L Haas, M Hernßndez",VLDB,2000
71000,conf/sigmod/LiCHH97,SEMCOG: An Object-based Image Retrieval System and Its Visual Query Interface,"W Li, K Candan, K Hirata, Y Hara",SIGMOD Conference,1997
71001,conf/sigmod/BressanGFJHKLMPQSS97,The COntext INterchange Mediator Prototype,"S Bressan, C Goh, K Fynn, M Jakobisiak, K Hussein, H Kon, T Lee, S Madnick, T Pena, J Qu, A Shum, M Siegel",SIGMOD Conference,1997
71003,conf/sigmod/QuassW97,On-Line Warehouse View Maintenance,"D Quass, J Widom",SIGMOD Conference,1997
71004,conf/vldb/LakshmananJN00,The 3W Model and Algebra for Unified Data Mining,"T Johnson, L Lakshmanan, R Ng",VLDB,2000
71005,conf/vldb/WangHH00,Mining Frequent Itemsets Using Support Constraints,"K Wang, Y He, J Han",VLDB,2000
71008,conf/sigmod/KatayamaS97,The SR-tree: An Index Structure for High-Dimensional Nearest Neighbor Queries,"N Katayama, S Satoh",SIGMOD Conference,1997
71009,conf/sigmod/ShivakumarG97,Wave-Indices: Indexing Evolving Databases,"N Shivakumar, H Garcia-Molina",SIGMOD Conference,1997
71011,conf/vldb/Taylor00,Concurrency in the Data Warehouse,R Taylor,VLDB,2000
71014,conf/sigmod/Shasha97,"Lessons from Wall Street: Case Studies in Configuration, Tuning, and Distribution (Tutorial)",,,1997
71016,conf/vldb/SchaeferBBJ00,Controlling Data Warehouses with Knowledge Networks,"E Schaefer, J Becker, A Boehmer, M Jarke",VLDB,2000
71018,conf/sigmod/GeorgeH97,Secure Transaction Processing in Firm Real-Time Database Systems,"B George, J Haritsa",SIGMOD Conference,1997
71020,conf/sigmod/GrayHOS96,The Dangers of Replication and a Solution,"J Gray, P Helland, P O'Neil, D Shasha",SIGMOD Conference,1996
71023,conf/vldb/JaedickeM99,User-Defined Table Operators: Enhancing Extensibility for ORDBMS,"M Jaedicke, B Mitschang",VLDB,1999
71024,conf/sigmod/HillyerS96,Random I/O Scheduling in Online Tertiary Storage Systems,"B Hillyer, A Silberschatz",SIGMOD Conference,1996
71025,conf/sigmod/MogiK96,Hot Mirroring: A Study to Hide Parity Upgrade Penalty and Degradations During Rebuilds for RAID5,"K Mogi, M Kitsuregawa",SIGMOD Conference,1996
71027,conf/sigmod/ZouS96,On-line Reorganization of Sparsely-populated B+trees,"C Zou, B Salzberg",SIGMOD Conference,1996
71028,conf/vldb/GionisIM99,Similarity Search in High Dimensions via Hashing,"A Gionis, P Indyk, R Motwani",VLDB,1999
71029,conf/vldb/KeimH99,Optimal Grid-Clustering: Towards Breaking the Curse of Dimensionality in High-Dimensional Clustering,"A Hinneburg, D Keim",VLDB,1999
71030,conf/sigmod/ZhangRL96,BIRCH: An Efficient Data Clustering Method for Very Large Databases,"T Zhang, R Ramakrishnan, M Livny",SIGMOD Conference,1996
71031,conf/vldb/CareyCNVDRSM99,"O-O, What Have They Done to DB2?","M Carey, D Chamberlin, S Narayanan, B Vance, D Doole, S Rielau, R Swagerman, N Mattos",VLDB,1999
71032,conf/sigmod/AdaliCPS96,Query Caching and Optimization in Distributed Mediator Systems,"S Adali, K Candan, Y Papakonstantinou, V Subrahmanian",SIGMOD Conference,1996
71033,conf/sigmod/AchyutuniON96,Two Techniques for On-Line Index Modification in Shared Nothing Parallel Databases,"K Achyutuni, E Omiecinski, S Navathe",SIGMOD Conference,1996
71034,conf/vldb/JagadishLS99,What can Hierarchies do for Data Warehouses?,"H Jagadish, L Lakshmanan, D Srivastava",VLDB,1999
71035,conf/vldb/ShanmugasundaramGTZDN99,Relational Databases for Querying XML Documents: Limitations and Opportunities,"J Shanmugasundaram, K Tufte, C Zhang, G He, D DeWitt, J Naughton",VLDB,1999
71036,conf/sigmod/VanceM96,Rapid Bushy Join-order Optimization with Cartesian Products,"B Vance, D Maier",SIGMOD Conference,1996
71037,conf/vldb/Johnson99,Performance Measurements of Compressed Bitmap Indices,T Johnson,VLDB,1999
71039,conf/sigmod/ChaudhuriG96,Optimizing Queries over Multimedia Repositories,"S Chaudhuri, L Gravano",SIGMOD Conference,1996
71040,conf/vldb/HaasKU99,Loading a Cache with Query Results,"L Haas, D Kossmann, I Ursu",VLDB,1999
71041,conf/vldb/McHughW99,Query Optimization for XML,"J McHugh, J Widom",VLDB,1999
71042,conf/sigmod/GoelI96,SQL Query Optimization: Reordering for a General Class of Queries,"P Goel, B Iyer",SIGMOD Conference,1996
71043,conf/vldb/DonjerkovicR99,Probabilistic Optimization of Top N Queries,"D Donjerkovic, R Ramakrishnan",VLDB,1999
71044,conf/sigmod/BilirisFOP96,BeSS: Storage Support for Interactive Visualization Systems,"A Biliris, T Funkhouser, W O'Connell, E Panagos",SIGMOD Conference,1996
71047,conf/vldb/NaumannLF99,Quality-driven Integration of Heterogenous Information Systems,"F Naumann, U Leser, J Freytag",VLDB,1999
71049,conf/sigmod/SrikantA96,Mining Quantitative Association Rules in Large Relational Tables,"R Srikant, R Agrawal",SIGMOD Conference,1996
71050,conf/vldb/JosifovskiR99,Integrating Heterogenous Overlapping Databases through Object-Oriented Transformations,"V Josifovski, T Risch",VLDB,1999
71051,conf/vldb/BrodieC99,Issues in Network Management in the Next Millennium,"M Brodie, S Chaudhuri",VLDB,1999
71052,conf/sigmod/Keim96,Databases and Visualization,D Keim,SIGMOD Conference,1996
71053,conf/vldb/Hamilton99,Networked Data Management Design Points,J Hamilton,VLDB,1999
71054,conf/sigmod/Han96,Data Mining Techniques,J Han,SIGMOD Conference,1996
71056,conf/vldb/Pound99,In Cyber Space No One can Hear You Scream,C Pound,VLDB,1999
71057,conf/sigmod/HanFWCZK96,DBMiner: Interactive Mining of Multiple-Level Knowledge in Relational Databases,"J Han, Y Fu, W Wang, J Chiang, O Za’ane, K Koperski",SIGMOD Conference,1996
71061,conf/sigmod/ChawatheRGW96,Change Detection in Hierarchically Structured Information,"S Chawathe, A Rajaraman, H Garcia-Molina, J Widom",SIGMOD Conference,1996
71066,conf/sigmod/NguyenS96,Accessing Relational Databases from the World Wide Web,"T Nguyen, V Srinivasan",SIGMOD Conference,1996
71067,conf/sigmod/BrownCL96,Goal-Oriented Buffer Management Revisited,"K Brown, M Carey, M Livny",SIGMOD Conference,1996
71068,conf/vldb/SahuguetA99,Building Light-Weight Wrappers for Legacy Web Data-Sources Using W4F,"A Sahuguet, F Azavant",VLDB,1999
71069,conf/vldb/AcharyaGP99,Aqua: A Fast Decision Support Systems Using Approximate Query Answers,"S Acharya, P Gibbons, V Poosala",VLDB,1999
71070,conf/sigmod/ChristophidesCM96,Evaluating Queries with Generalized Path Expressions,"V Christophides, S Cluet, G Moerkotte",SIGMOD Conference,1996
71071,conf/vldb/Mohan99,Repeating History Beyond ARIES,C Mohan,VLDB,1999
71072,conf/sigmod/SeshadriHPLRSSS96,Cost-Based Optimization for Magic: Algebra and Implementation,"P Seshadri, J Hellerstein, H Pirahesh, T Leung, R Ramakrishnan, D Srivastava, P Stuckey, S Sudarshan",SIGMOD Conference,1996
71074,conf/sigmod/ColbyGLMT96,Algorithms for Deferred View Maintenance,"L Colby, T Griffin, L Libkin, I Mumick, H Trickey",SIGMOD Conference,1996
71075,conf/vldb/Norvag99,The Persistent Cache: Improving OID Indexing in Temporal Object-Oriented Database Systems,K N°rvÕg,VLDB,1999
71076,conf/sigmod/LibkinMW96,"A Query Language for Multidimensional Arrays: Design, Implementation, and Optimization Techniques","L Libkin, R Machlin, L Wong",SIGMOD Conference,1996
71079,conf/vldb/IoannidisP99,Histogram-Based Approximation of Set-Valued Query-Answers,"Y Ioannidis, V Poosala",VLDB,1999
71081,conf/vldb/JagadishMN99,Semantic Compression and Pattern Extraction with Fascicles,"H Jagadish, J Madar, R Ng",VLDB,1999
71082,conf/sigmod/KrishnanVI96,Estimating Alphanumeric Selectivity in the Presence of Wildcards,"P Krishnan, J Vitter, B Iyer",SIGMOD Conference,1996
71083,conf/sigmod/ShatdalN95,Adaptive Parallel Aggregation Algorithms,"A Shatdal, J Naughton",SIGMOD Conference,1995
71084,conf/vldb/PedersenJD99,Extending Practical Pre-Aggregation in On-Line Analytical Processing,"T Pedersen, C Jensen, C Dyreson",VLDB,1999
71085,conf/vldb/LiRS99,Aggregation Algorithms for Very Large Compressed Data Warehouses,"J Li, D Rotem, J Srivastava",VLDB,1999
71087,conf/vldb/KumarRRT99,Extracting Large-Scale Knowledge Bases from the Web,"R Kumar, P Raghavan, S Rajagopalan, A Tomkins",VLDB,1999
