tid,id,title,authors,venue,year
69613,conf/vldb/AmmannJR95,Using Formal Methods to Reason about Semantics-Based Decompositions of Transactions,"P Ammann, S Jajodia, I Ray",VLDB,1995
69616,conf/vldb/FerrandinaMZFM95,Schema and Database Evolution in the O2 Object Database System,"F Ferrandina, T Meyer, R Zicari, G Ferran, J Madec",VLDB,1995
69623,journals/sigmod/Kosch02,MPEG-7 and Multimedia Database Systems,H Kosch,SIGMOD Record,2002
69624,conf/vldb/LuTD95,The Fittest Survives: An Adaptive Approach to Query Optimization,"H Lu, K Tan, S Dao",VLDB,1995
69628,conf/vldb/MehtaD95,Managing Intra-operator Parallelism in Parallel Database Systems,"M Mehta, D DeWitt",VLDB,1995
69630,conf/vldb/SrikantA95,Mining Generalized Association Rules,"R Srikant, R Agrawal",VLDB,1995
69634,journals/sigmod/Kemper02,Databases and Transaction Processing: An Application-Oriented Approach - Book Review,A Kemper,SIGMOD Record,2002
69647,conf/vldb/DidriksenGD95,Database De-Centralization - A Practical Approach,"T Didriksen, C Galindo-Legaria, E Dahle",VLDB,1995
69648,journals/sigmod/HalkidiBV02,Cluster Validity Methods: Part I,"M Halkidi, Y Batistakis, M Vazirgiannis",SIGMOD Record,2002
69652,conf/vldb/BrownS95,BigSur: A System For the Management of Earth Science Data,"P Brown, M Stonebraker",VLDB,1995
69672,conf/vldb/WuYCT95,A Performance Study of Workfile Disk Management for Concurrent Mergesorts in a Multiprocessor Database System,"K Wu, P Yu, J Chung, J Teng",VLDB,1995
69682,conf/vldb/WienerN94,Bulk Loading into an OODB: A Performance Study,"J Wiener, J Naughton",VLDB,1994
69688,conf/vldb/FuC94,A Transaction Replication Scheme for a Replicated Database with Node Autonomy,"A Fu, D Cheung",VLDB,1994
69691,conf/vldb/FrohnLU94,Access to Objects by Path Expressions and Rules,"J Frohn, G Lausen, H Uphoff",VLDB,1994
69698,journals/sigmod/MeltonMJKS02,SQL/MED - A Status Report,"J Melton, J Michels, V Josifovski, K Kulkarni, P Schwarz",SIGMOD Record,2002
69700,conf/vldb/JohnsonS94,2Q: A Low Overhead High Performance Buffer Management Replacement Algorithm,"T Johnson, D Shasha",VLDB,1994
69701,conf/vldb/BarjaPFWD94,An Effective Deductive Object-Oriented Database Through Language Integration,"M Barja, N Paton, A Fernandes, M Williams, A Dinn",VLDB,1994
69703,journals/sigmod/RossAJS02,Reminiscences on Influential Papers,,,2002
69718,conf/vldb/Brin95,Near Neighbor Search in Large Metric Spaces,S Brin,VLDB,1995
69723,journals/sigmod/HalkidiBV02a,Clustering Validity Checking Methods: Part II,"M Halkidi, Y Batistakis, M Vazirgiannis",SIGMOD Record,2002
69731,conf/vldb/CatozziR95,OS Support for VLDBs: Unix Enhancements for the Teradata Data Base,"J Catozzi, S Rabinovici",VLDB,1995
69738,journals/sigmod/BoucelmaCGJLL02,Report on the EDBT'02 Panel on Scientific Data Integration,,,2002
69747,journals/sigmod/Lomet01,The Evolution of Effective B-tree: Page Organization and Techniques: A Personal Account,D Lomet,SIGMOD Record,2001
69750,conf/vldb/MohaniaS94,Some Issues in Design of Distributed Deductive Databases,"M Mohania, N Sarda",VLDB,1994
69754,journals/sigmod/LudascherMM01,"Preservation of Digital Data with Self-Validating, Self-Instantiating Knowledge-Based Archives","B Ludäscher, R Marciano, R Moore",SIGMOD Record,2001
69757,conf/vldb/TeisseirePC94,Towards Event-Driven Modelling for Database Design,"M Teisseire, P Poncelet, R Cicchetti",VLDB,1994
69787,conf/vldb/LevySSZ94,Challenges for Global Information Systems,"A Levy, A Silberschatz, D Srivastava, M Zemankova",VLDB,1994
69801,journals/sigmod/LabrinidisM01,Career-Enhancing Services at SIGMOD Online,"A Labrinidis, A Mendelzon",SIGMOD Record,2001
69802,conf/vldb/Lesk94,Experiments on Access to Digital Libraries: How can Images and Text be Used Together,M Lesk,VLDB,1994
69805,journals/sigmod/StolfoLCFE01,Data Mining-based Intrusion Detectors: An Overview of the Columbia IDS Project,"S Stolfo, W Lee, P Chan, W Fan, E Eskin",SIGMOD Record,2001
69808,journals/sigmod/BarbaraCJW01,ADAM: A Testbed for Exploring the Use of Data Mining in Intrusion Detection,"D Barbará, J Couto, S Jajodia, N Wu",SIGMOD Record,2001
69809,journals/sigmod/CabreraLM01,Detection and Classification of Intrusions and Faults using Sequences of System Calls,"J Cabrera, L Lewis, R Mehra",SIGMOD Record,2001
69811,conf/vldb/MartinC94,Relating Distributed Objects,"B Martin, R Cattell",VLDB,1994
69836,journals/sigmod/TianDCZ02,The Design and Performance Evaluation of Alternative XML Storage Strategies,"F Tian, D DeWitt, J Chen, C Zhang",SIGMOD Record,2002
69844,conf/vldb/MedianoCD94,V-Trees - A Storage Method for Long Vector Data,"M Mediano, M Casanova, M Dreux",VLDB,1994
69859,journals/sigmod/GobleR02,Report on the 18th British National Conference on Databases (BNCOD),,,2002
69871,conf/sigmod/GuoSBS03,XRANK: Ranked Keyword Search over XML Documents,"L Guo, F Shao, C Botev, J Shanmugasundaram",SIGMOD Conference,2003
69876,journals/sigmod/Franklin99b,Editor's Notes,M Franklin,SIGMOD Record,1999
69901,conf/sigmod/OlstonJW03,Adaptive Filters for Continuous Queries over Distributed Data Streams,"C Olston, J Jiang, J Widom",SIGMOD Conference,2003
69907,conf/sigmod/ShenNSHS03,CMVF: A Novel Dimension Reduction Scheme for Efficient Indexing in A Large Image Database,"J Shen, A Ngu, J Shepherd, D Huynh, Q Sheng",SIGMOD Conference,2003
69910,journals/sigmod/VetterliVS00,Metadata Standards for Data Warehousing: Open Information Model vs. Common Warehouse Metamodel,"T Vetterli, A Vaduva, M Staudt",SIGMOD Record,2000
69911,conf/sigmod/DeHaanTCO03,A Comprehensive XQuery to SQL Translation using Dynamic Interval Encoding,"D DeHaan, D Toman, M Consens, M Özsu",SIGMOD Conference,2003
69918,conf/sigmod/SunAA03,Hardware Acceleration for Spatial Selections and Joins,"C Sun, D Agrawal, A Abbadi",SIGMOD Conference,2003
69920,journals/sigmod/KantM00,"Workshop on Performance and Architecture of Web Servers (PAWS-2000, held in conjection with SIGMETRICS-2000)",,,2000
69924,conf/sigmod/DeshpandeNGS03,Cache-and-Query for Wide Area Sensor Databases,"A Deshpande, S Nath, P Gibbons, S Seshan",SIGMOD Conference,2003
69927,conf/sigmod/PapadiasTFS03,An Optimal and Progressive Algorithm for Skyline Queries,"D Papadias, Y Tao, G Fu, B Seeger",SIGMOD Conference,2003
69932,conf/sigmod/Stonebraker03,Visionary: A Next Generation Visualization System for Databases,M Stonebraker,SIGMOD Conference,2003
69941,conf/sigmod/Colliat03,Data Management Challenges in CRM,G Colliat,SIGMOD Conference,2003
69942,journals/sigmod/PoessF00,New TPC Benchmarks for Decision Support and Web Commerce,"M Pöss, C Floyd",SIGMOD Record,2000
69943,conf/sigmod/GotoK03,Integration of Electronic Tickets and Personal Guide System for Public Transport using Mobile Terminals,"K Goto, Y Kambayashi",SIGMOD Conference,2003
69959,conf/sigmod/Bosworth03,The Future of Web Services - I,A Bosworth,SIGMOD Conference,2003
69964,journals/sigmod/Franklin00b,Editor's Notes,M Franklin,SIGMOD Record,2000
69976,journals/sigmod/MeltonMJKSZ01,SQL and Management of External Data,"J Melton, J Michels, V Josifovski, K Kulkarni, P Schwarz, K Zeidenstein",SIGMOD Record,2001
69981,conf/sigmod/QunLO03,D(k)-Index: An Adaptive Structural Summary for Graph-Structured Data,"C Qun, A Lim, K Ong",SIGMOD Conference,2003
69985,journals/sigmod/Critchlow01,Report on XEWA-00: The XML Enabled Wide-Area Searches for Bioinformatics Workshop,,,2001
69990,journals/sigmod/Aggarwal01,Re-designing Distance Functions and Distance-Based Applications for High Dimensional Data,C Aggarwal,SIGMOD Record,2001
69991,conf/sigmod/HeC03,Statistical Schema Matching across Web Query Interfaces,"B He, K Chang",SIGMOD Conference,2003
70018,journals/sigmod/DogacDATKCD98,A Workflow-based Electronic Marketplace on the Web,"A Dogac, I Durusoy, S Arpinar, N Tatbul, P Koksal, I Cingil, N Dimililer",SIGMOD Record,1998
70044,conf/sigmod/Amer-YahiaFSX03,PIX: Exact and Approximate Phrase Matching in XML,"S Amer-Yahia, M Fernandez, D Srivastava, Y Xu",SIGMOD Conference,2003
70048,conf/sigmod/LarsonG03,Transparent Mid-Tier Database Caching in SQL Server,"P Larson, J Goldstein, J Zhou",SIGMOD Conference,2003
70052,journals/sigmod/BergamaschiCV99,Semantic Integration of Semistructured and Structured Data Sources,"S Bergamaschi, S Castano, M Vincini",SIGMOD Record,1999
70053,conf/sigmod/LiuFP03,GridDB: A Database Interface to the Grid,"D Liu, M Franklin, D Parekh",SIGMOD Conference,2003
70059,conf/sigmod/ShashaB02,"Database tuning: principles, experiments, and troubleshooting techniques (part II)","D Shasha, P Bonnet",SIGMOD Conference,2002
70068,conf/sigmod/HinneburgKW02,HD-Eye: visual clustering of high dimensional data,"A Hinneburg, D Keim, M Wawryniuk",SIGMOD Conference,2002
70072,conf/sigmod/Bonnet02,Going public: open-source databases and database research,P Bonnet,SIGMOD Conference,2002
70078,conf/sigmod/MaddenH02,Distributing queries over low-power wireless sensor networks,"S Madden, J Hellerstein",SIGMOD Conference,2002
70081,journals/sigmod/Ozsoyoglu99,Vice Chair's Message,,,1999
70082,conf/sigmod/HanWDPW02,CubeExplorer: online exploration of data cubes,"J Han, J Wang, G Dong, J Pei, K Wang",SIGMOD Conference,2002
70085,conf/sigmod/AltinelLKMPLWB02,DBCache: database caching for web application servers,"M Altinel, Q Luo, S Krishnamurthy, C Mohan, H Pirahesh, B Lindsay, H Woo, L Brown",SIGMOD Conference,2002
70098,conf/sigmod/RaoZML02,Automating physical database design in a parallel database,"J Rao, C Zhang, N Megiddo, G Lohman",SIGMOD Conference,2002
70102,conf/sigmod/SismanisDRK02,Dwarf: shrinking the PetaCube,"Y Sismanis, A Deligiannakis, N Roussopoulos, Y Kotidis",SIGMOD Conference,2002
70104,conf/sigmod/ChaudhuriGN02,Compressing SQL workloads,"S Chaudhuri, A Gupta, V Narasayya",SIGMOD Conference,2002
70107,journals/sigmod/Etzion99,Report on NGITS'99: The 4th International Workshop on Next Generation Information Technologies and Systems,,,1999
70108,conf/sigmod/MoonWH02,General match: a subsequence matching method in time-series databases based on generalized windows,"Y Moon, K Whang, W Han",SIGMOD Conference,2002
70111,journals/sigmod/Libkin99,"Some Remarks on Variable Independence, Closure, and Orthographic Dimension in Constraint Databases",L Libkin,SIGMOD Record,1999
70119,conf/sigmod/VriesMNK02,Efficient k-NN search on vertically decomposed data,"A Vries, N Mamoulis, N Nes, M Kersten",SIGMOD Conference,2002
70120,journals/sigmod/MusickC99,Practical Lessons in Supporting Large-Scale Computational Science,"R Musick, T Critchlow",SIGMOD Record,1999
70122,journals/sigmod/EisenbergM99a,SQLJ-Part 1: SQL Routines Using the Java Programming Language,"A Eisenberg, J Melton",SIGMOD Record,1999
70123,conf/sigmod/DattaDTVSR02,Proxy-based acceleration of dynamically generated content on the world wide web: an approach and implementation,"A Datta, K Dutta, H Thomas, D VanderMeer, S Suresha, K Ramamritham",SIGMOD Conference,2002
70134,conf/sigmod/LiGS02,Skew handling techniques in sort-merge join,"W Li, D Gao, R Snodgrass",SIGMOD Conference,2002
70136,conf/sigmod/TatarinovVBSSZ02,Storing and querying ordered XML using a relational database system,"I Tatarinov, S Viglas, K Beyer, J Shanmugasundaram, E Shekita, C Zhang",SIGMOD Conference,2002
70149,conf/sigmod/BrunoKS02,Holistic twig joins: optimal XML pattern matching,"N Bruno, N Koudas, D Srivastava",SIGMOD Conference,2002
70150,journals/sigmod/McClatcheyV97,Workshop on Workflow Management in Scientific and Engineering Applications - Report,,,1997
70156,conf/sigmod/YangWYH02,Mining long sequential patterns in a noisy environment,"J Yang, W Wang, P Yu, J Han",SIGMOD Conference,2002
70159,journals/sigmod/ClementLGMK97,OGDI: Toward Interoperability among Geospatial Databases,"G Clement, C Larouche, D Gouin, P Morin, H Kucera",SIGMOD Record,1997
70168,journals/sigmod/JukicV97,Asserting Beliefs in MLS Relational Models,"N Jukic, S Vrbsky",SIGMOD Record,1997
70172,journals/sigmod/Fong97,Converting Relational to Object-Oriented Databases,J Fong,SIGMOD Record,1997
70179,conf/sigmod/TheobaldW02,The XXL search engine: ranked retrieval of XML data using indexes and ontologies,"A Theobald, G Weikum",SIGMOD Conference,2002
70182,conf/sigmod/BarbosaMKL02,ToXgene: a template-based data generator for XML,"D Barbosa, A Mendelzon, J Keenleyside, K Lyons",SIGMOD Conference,2002
70189,conf/sigmod/LuWYBLY02,XBase: making your gigabyte disk queriable,"H Lu, G Wang, G Yu, Y Bao, J Lv, Y Yu",SIGMOD Conference,2002
70190,journals/sigmod/Snodgrass98b,Chair's Message,,,1998
70206,conf/sigmod/RinfretOO01,Bit-Sliced Index Arithmetic,"D Rinfret, P O'Neil, E O'Neil",SIGMOD Conference,2001
70211,journals/sigmod/EisenbergM98,Standards in Practice,"A Eisenberg, J Melton",SIGMOD Record,1998
70228,conf/sigmod/FernandezMS01,Efficient Evaluation of XML Middle-ware Queries,"M Fernandez, A Morishima, D Suciu",SIGMOD Conference,2001
70229,conf/sigmod/CandanLLHA01,Enabling Dynamic Content Caching for Database-Driven Web Sites,"K Candan, W Li, Q Luo, W Hsiung, D Agrawal",SIGMOD Conference,2001
70233,journals/sigmod/Mendelzon98,Information Director's Message,,,1998
70240,conf/sigmod/BorkarDS01,Automatic Segmentation of Text into Structured Records,"V Borkar, K Deshmukh, S Sarawagi",SIGMOD Conference,2001
70243,journals/sigmod/KoksalAD98,Workflow History Management,"P Koksal, S Arpinar, A Dogac",SIGMOD Record,1998
70245,journals/sigmod/Manola98,Towards a Richer Web Object Model,F Manola,SIGMOD Record,1998
70246,conf/sigmod/LahiriG01,Fast-Start: Quick Fault Recovery in Oracle,"T Lahiri, A Ganesh, R Weiss, A Joshi",SIGMOD Conference,2001
70252,journals/sigmod/ACT-NET96,ACT-NET - The Active Database Management System Manifesto: A Rulebase of ADBMS Features,,SIGMOD Record,1996
70253,journals/sigmod/BrunieK96,Control Strategies for Complex Relational Query Processing in Shared Nothing Systems,"L Brunie, H Kosch",SIGMOD Record,1996
70259,journals/sigmod/BestavrosLS96,Report on First International Workshop on Real-Time Database Systems,,,1996
70262,journals/sigmod/HasanFV96,Open Issues in Parallel Query Optimization,"W Hasan, D Florescu, P Valduriez",SIGMOD Record,1996
70279,conf/sigmod/MistryRSR01,Materialized View Selection and Maintenance Using Multi-Query Optimization,"H Mistry, P Roy, S Sudarshan, K Ramamritham",SIGMOD Conference,2001
70282,conf/sigmod/GionisGK01,Efficient and Tunable Similar Set Retrieval,"A Gionis, D Gunopulos, N Koudas",SIGMOD Conference,2001
70283,conf/sigmod/AgichteinGV01,Snowball: A Prototype System for Extracting Relations from Large Text Collections,"E Agichtein, L Gravano, J Pavel, V Sokolova, A Voskoboynik",SIGMOD Conference,2001
70284,journals/sigmod/SilberschatzSU96,Database Research: Achievements and Opportunities Into the 21st Century,"A Silberschatz, M Stonebraker, J Ullman",SIGMOD Record,1996
70287,journals/sigmod/RamamrithamSSTX96,"Integrating Temporal, Real-Time, and Active Databases","K Ramamritham, R Sivasankaran, J Stankovic, D Towsley, M Xiong",SIGMOD Record,1996
70294,conf/sigmod/LamCKNH01,RETINA: A REal-time TraffIc NAvigation System,"K Lam, E Chan, T Kuo, S Ng, D Hung",SIGMOD Conference,2001
70303,journals/sigmod/FreemanG96,Lifestreams: A Storage Model for Personal Data,"E Freeman, D Gelernter",SIGMOD Record,1996
70306,conf/sigmod/BrunoCG01,STHoles: A Multidimensional Workload-Aware Histogram,"N Bruno, S Chaudhuri, L Gravano",SIGMOD Conference,2001
70307,journals/sigmod/UrbanDG96,Database Research at Arizona State University,"S Urban, S Dietrich, F Golshani",SIGMOD Record,1996
70309,journals/sigmod/Gaffney96,Illustra's Web DataBlade Module,J Gaffney,SIGMOD Record,1996
70311,journals/sigmod/Anonymous96,MQSeries and CICS Link for Lotus Notes,,SIGMOD Record,1996
70332,conf/sigmod/GetoorTK01,Selectivity Estimation using Probabilistic Models,"L Getoor, B Taskar, D Koller",SIGMOD Conference,2001
70333,journals/sigmod/Date96,"A Response to R. Camps' Article ``Domains, Relations and Religious Wars''",C Date,SIGMOD Record,1996
70335,journals/sigmod/Qian97,Opportunities in Information Management and Assurance,X Qian,SIGMOD Record,1997
70344,journals/sigmod/HasanMV96,Applying database Visualization to the World Wide Web,"M Hasan, A Mendelzon, D Vista",SIGMOD Record,1996
70349,conf/sigmod/CasatiS01,Models and Languages for Describing and Discovering E-Services,,,2001
70354,conf/sigmod/KriegelMPS01,Spatial Data Management for Computer Aided Design,"H Kriegel, A Müller, M Pötke, T Seidl",SIGMOD Conference,2001
70355,conf/sigmod/AdiBEY01,Monitoring Business Processes through Event Correlation based on Dependency Model,"A Adi, D Botzer, O Etzion, T Yatzkar-Haham",SIGMOD Conference,2001
70371,journals/sigmod/Camps96,"Domains, Relations and Religious Wars",R Camps,SIGMOD Record,1996
70373,journals/sigmod/ZobelMR96,Guidelines for Presentation and Comparison of Indexing Techniques,"J Zobel, A Moffat, K Ramamohanarao",SIGMOD Record,1996
70375,conf/sigmod/Rosenthal01,Will Database Researchers Have ANY Role in Data Security? (Panel Abstract),A Rosenthal,SIGMOD Conference,2001
70387,conf/sigmod/GunopulosKTD00,Approximating Multi-Dimensional Aggregate Range Queries over Real Attributes,"D Gunopulos, G Kollios, V Tsotras, C Domeniconi",SIGMOD Conference,2000
70389,journals/sigmod/Chaudhri95,An Annotated Bibliography of Benchmarks for Object Databases,A Chaudhri,SIGMOD Record,1995
70402,conf/sigmod/HellersteinA00,Eddies: Continuously Adaptive Query Processing,"R Avnur, J Hellerstein",SIGMOD Conference,2000
70405,journals/sigmod/KokkotosIPS95,On the Issue of Valid Time(s) in Temporal Databases,"S Kokkotos, E Ioannidis, T Panayiotopoulos, C Spyropoulos",SIGMOD Record,1995
70409,journals/sigmod/DogacDKOONEHAKKM95,METU Interoperable Database System,"A Dogac, C Dengi, E Kilic, G Özhan, F Ozcan, S Nural, C Evrendilek, U Halici, I Arpinar, P Koksal, N Kesim, S Mancuhan",SIGMOD Record,1995
70411,conf/sigmod/LiuPBHPT00,AQR-Toolkit: An Adaptive Query Routing Middleware for Distributed Data Intensive Systems,"L Liu, C Pu, D Buttler, W Han, H Paques, W Tang",SIGMOD Conference,2000
70416,journals/sigmod/JainH94,Metadata in Video Databases,"R Jain, A Hampapur",SIGMOD Record,1994
70419,conf/sigmod/RiedelFGN00,Data Mining on an OLTP System (Nearly) for Free,"E Riedel, C Faloutsos, G Ganger, D Nagle",SIGMOD Conference,2000
70439,conf/sigmod/JarkeQCLFLVV00,Concept Based Design of Data Warehouses: The DWQ Demonstrators,"M Jarke, C Quix, D Calvanese, M Lenzerini, E Franconi, S Ligoudistianos, P Vassiliadis, Y Vassiliou",SIGMOD Conference,2000
70464,conf/sigmod/BreunigKNS00,LOF: Identifying Density-Based Local Outliers,"M Breunig, H Kriegel, R Ng, J Sander",SIGMOD Conference,2000
70468,conf/sigmod/FaloutsosSTT00,Spatial Join Selectivity Using Power Laws,"C Faloutsos, B Seeger, A Traina, C Jr.",SIGMOD Conference,2000
70486,conf/sigmod/Gal00,"Data Management in eCommerce: The Good, the Bad, and the Ugly",,,2000
70492,journals/sigmod/Wong95,An Introduction to Remy's Fast Polymorphic Record Projection,L Wong,SIGMOD Record,1995
70495,journals/sigmod/DoanPK95,Design and User Testing of a Multi-Paradigm Query Interface to an Object-Oriented Database,"D Doan, N Paton, A Kilgour",SIGMOD Record,1995
70496,conf/sigmod/JagadishKS00,On Effective Multi-Dimensional Indexing for Strings,"H Jagadish, N Koudas, D Srivastava",SIGMOD Conference,2000
70502,journals/sigmod/Finkelstein95,The New Middleware,R Finkelstein,SIGMOD Record,1995
70504,conf/sigmod/PonnekantiK00,Online Index Rebuild,"N Ponnekanti, H Kodavalla",SIGMOD Conference,2000
70514,conf/sigmod/AggarwalPWYP99,Fast Algorithms for Projected Clustering,"C Aggarwal, C Procopiuc, J Wolf, P Yu, J Park",SIGMOD Conference,1999
70515,conf/sigmod/HsuLG00,Image Mining in IRIS: Integrated Retinal Information System,"W Hsu, M Lee, K Goh",SIGMOD Conference,2000
70523,conf/sigmod/MerialdoAMMP00,Homer: a Model-Based CASE Tool for Data-Intensive Web Sites,"P Merialdo, P Atzeni, M Magnante, G Mecca, M Pecorone",SIGMOD Conference,2000
70530,journals/sigmod/PissinouSEMOPSTD94,Towards an Infrastructure for Temporal Databases: Report of an Invitational ARPA/NSF Workshop,,,1994
70537,journals/sigmod/Gallagher94,Influencing Database Language Standards,L Gallagher,SIGMOD Record,1994
70538,conf/sigmod/RundensteinerCCSO00,SERFing the Web: Web Site Management Made Easy,"E Rundensteiner, K Claypool, L Chen, H Su, K Oenoki",SIGMOD Conference,2000
70541,conf/sigmod/Keim99,Efficient Geometry-based Similarity Search of 3D Spatial Databases,D Keim,SIGMOD Conference,1999
70548,journals/tods/GibbonsMP02,Fast incremental maintenance of approximate histograms,"P Gibbons, Y Matias, V Poosala",ACM Trans. Database Syst.,2002
70549,conf/sigmod/MayrS99,Client-Site Query Extensions,"T Mayr, P Seshadri",SIGMOD Conference,1999
70554,conf/sigmod/KotidisR99,DynaMat: A Dynamic View Management System for Data Warehouses,"Y Kotidis, N Roussopoulos",SIGMOD Conference,1999
70555,conf/sigmod/ChanI99,An Efficient Bitmap Encoding Scheme for Selection Queries,"C Chan, Y Ioannidis",SIGMOD Conference,1999
70575,conf/sigmod/RundensteinerKZWLLN99,Evolvable View Environment (EVE): Non-Equivalent View Maintenance under Schema Changes,"E Rundensteiner, A Koeller, X Zhang, A Wyk, Y Li, A Lee, A Nica",SIGMOD Conference,1999
70579,journals/sigmod/Datta94,Research Issues in Databases for ARCS: Active Rapidly Changing Data Systems,A Datta,SIGMOD Record,1994
70584,conf/sigmod/LiuHBPT99,An XML-based Wrapper Generator for Web Information Extraction,"L Liu, W Han, D Buttler, C Pu, W Tang",SIGMOD Conference,1999
70588,journals/sigmod/GlavitschSW94,Metadata for Integrating Speech Documents in a Text Retrieval System,"U Glavitsch, P Schäuble, M Wechsler",SIGMOD Record,1994
70590,conf/sigmod/TrisoliniLN99,Data Integration and Warehousing in Telecom Italia,"S Trisolini, M Lenzerini, D Nardi",SIGMOD Conference,1999
70591,journals/sigmod/AndersonS94,SEQUOIA 2000 Metadata Schema for Satellite Images,"J Anderson, M Stonebraker",SIGMOD Record,1994
70592,conf/sigmod/BaulierBGGHJKKMMNNRSSSWW99,DataBlitz Storage Manager: Main Memory Database Performance for Critical Applications,"J Baulier, P Bohannon, S Gogate, C Gupta, S Haldar, S Joshi, A Khivesera, H Korth, P McIlroy, J Miller, P Narayan, M Nemeth, R Rastogi, S Seshadri, A Silberschatz, S Sudarshan, M Wilder, C Wei",SIGMOD Conference,1999
70601,conf/sigmod/Mohan99,A Database Perspective on Lotus Domino/Notes,C Mohan,SIGMOD Conference,1999
70612,journals/sigmod/Kim94,Observations on the ODMG-93 Proposal,W Kim,SIGMOD Record,1994
70613,journals/sigmod/Stonebraker94,In Memory of Bob Kooi (1951-1993),,,1994
70616,journals/sigmod/MedeirosP94,Databases for GIS,"C Medeiros, F Pires",SIGMOD Record,1994
70624,conf/sigmod/JagadishLMSV99,Querying Network Directories,"H Jagadish, L Lakshmanan, T Milo, D Srivastava, D Vista",SIGMOD Conference,1999
70625,journals/sigmod/YeungHL94,Performance Evaluation of a New Distributed Deadlock Detection Algorithm,"C Yeung, S Hung, K Lam",SIGMOD Record,1994
70626,conf/sigmod/BreitbartKRSS99,Update Propagation Protocols For Replicated Databases,"Y Breitbart, R Komondoor, R Rastogi, S Seshadri, A Silberschatz",SIGMOD Conference,1999
70633,conf/sigmod/AcharyaPR99,Selectivity Estimation in Spatial Databases,"S Acharya, V Poosala, S Ramaswamy",SIGMOD Conference,1999
70654,conf/sigmod/RundensteinerCLCZNJLW99,SERF: ODMG-Based Generic Re-structuring Facility,"E Rundensteiner, K Claypool, M Li, L Chen, X Zhang, C Natarajan, J Jin, S Lima, S Weiner",SIGMOD Conference,1999
70655,conf/sigmod/ZhouLP99,TAM: A System for Dynamic Transactional Activity Management,"T Zhou, L Liu, C Pu",SIGMOD Conference,1999
70656,conf/vldb/LiM01,Indexing and Querying XML Data for Regular Path Expressions,"Q Li, B Moon",VLDB,2001
70667,conf/sigmod/ChangG99,Mind Your Vocabulary: Query Mapping Across Heterogeneous Information Sources,"K Chang, H Garcia-Molina",SIGMOD Conference,1999
70676,conf/vldb/BrownG01,A Prototype Content-Based Retrieval System that Uses Virtual Images to Save Space,"L Brown, L Gruenwald",VLDB,2001
70679,conf/vldb/ZengBNN01,AgFlow: Agent-based Cross-Enterprise Workflow Management System,"L Zeng, B Benatallah, P Nguyen, A Ngu",VLDB,2001
70699,conf/vldb/MignetMAC01,Change-Centric Management of Versions in an XML Warehouse,"A Marian, S Abiteboul, G Cobena, L Mignet",VLDB,2001
70705,conf/vldb/AksoyZF01,Data Staging for On-Demand Broadcast,"D Aksoy, M Franklin, S Zdonik",VLDB,2001
70706,conf/sigmod/ChaudhuriN98,AutoAdmin 'What-if' Index Analysis Utility,"S Chaudhuri, V Narasayya",SIGMOD Conference,1998
70711,conf/sigmod/RajagopalanML98,Approximate Medians and other Quantiles in One Pass and with Limited Memory,"G Manku, S Rajagopalan, B Lindsay",SIGMOD Conference,1998
70715,conf/vldb/BunkerCCMMW01,Aggregate Maintenance for Data Warehousing in Informix Red Brick Vista,"C Bunker, L Colby, R Cole, W McKenna, G Mulagund, D Wilhite",VLDB,2001
70722,conf/sigmod/WhiteCF98,Enterprise Java Platform Data Access,"S White, R Cattell, S Finkelstein",SIGMOD Conference,1998
70730,conf/vldb/TsurAADKW01,Are Web Services the Next Revolution in e-Commerce? (Panel),"S Tsur, S Abiteboul, R Agrawal, U Dayal, J Klein, G Weikum",VLDB,2001
70743,conf/vldb/ChaHKK01,Cache-Conscious Concurrency Control of Main-Memory Indexes on Shared-Memory Multiprocessor Systems,"S Cha, S Hwang, K Kim, K Kwon",VLDB,2001
70746,conf/sigmod/CherniackZ98,Changing the Rules: Transformations for Rule-Based Optimizers,"M Cherniack, S Zdonik",SIGMOD Conference,1998
70751,conf/vldb/AnSVKIG01,Analyzing energy behavior of spatial access methods for memory-resident data,"N An, A Sivasubramaniam, N Vijaykrishnan, M Kandemir, M Irwin, S Gurumurthi",VLDB,2001
70768,conf/vldb/DingGS00,Computing Geographical Scopes of Web Resources,"J Ding, L Gravano, N Shivakumar",VLDB,2000
