tid,id,title,authors,venue,year
71940,journals/tods/EiterLLS01,Probabilistic object bases,"T Eiter, J Lu, T Lukasiewicz, V Subrahmanian",ACM Trans. Database Syst.,2001
71941,journals/tods/Snodgrass01,Editorial,,,2001
71945,journals/tods/AndriesCPB01,Applying an update method to a set of receivers,"M Andries, L Cabibbo, J Paredaens, J Bussche",ACM Trans. Database Syst.,2001
71958,journals/tods/ZaharioudakisCF97,"Adaptive, Fine-Grained Sharing in a Client-Server OODBMS: A Callback-Based Approach","M Zaharioudakis, M Carey, M Franklin",ACM Trans. Database Syst.,1997
71962,journals/tods/WangBBJ97,Logical Design for Temporal Databases with Multiple Granularities,"X Wang, C Bettini, A Brodsky, S Jajodia",ACM Trans. Database Syst.,1997
71963,journals/tods/LiuHD98,Multiview Access Protocols for Large-Scale Replication,"X Liu, A Helal, W Du",ACM Trans. Database Syst.,1998
71971,journals/tods/KonopnickiS98,Information Gathering in the World-Wide Web: The W3QL Query Language and the W3QS System,"D Konopnicki, O Shmueli",ACM Trans. Database Syst.,1998
71973,journals/tods/Wijsen99,Temporal FDs on Complex Objects,J Wijsen,ACM Trans. Database Syst.,1999
71975,journals/tods/CastanoAFP98,Conceptual Schema Analysis: Techniques and Applications,"S Castano, V Antonellis, M Fugini, B Pernici",ACM Trans. Database Syst.,1998
71981,journals/tods/YanG99,The SIFT Information Dissemination System,"T Yan, H Garcia-Molina",ACM Trans. Database Syst.,1999
71983,journals/tods/HjaltasonS99,Distance Browsing in Spatial Databases,"G Hjaltason, H Samet",ACM Trans. Database Syst.,1999
71987,journals/vldb/AslanM99,Semantic Heterogeneity Resolution in Federated Databases by Metadata Implantation and Stepwise Evolution,"G Aslan, D McLeod",VLDB J.,1999
71991,journals/vldb/LiangOY00,Optimizing Multiple Dimensional Queries Simultaneously in Multidimensional Databases,"W Liang, M Orlowska, J Yu",VLDB J.,2000
72004,journals/vldb/GruserRZZ00,Learning Response Time for WebSources Using Query Feedback and Application in Query Optimization,"J Gruser, L Raschid, V Zadorozhny, T Zhan",VLDB J.,2000
72005,journals/vldb/BunemanFS00,UnQL: A Query Language and Algebra for Semistructured Data Based on Structural Recursion,"P Buneman, M Fernandez, D Suciu",VLDB J.,2000
72015,journals/vldb/GibsonKR00,Clustering Categorical Data: An Approach Based on Dynamical Systems,"D Gibson, J Kleinberg, P Raghavan",VLDB J.,2000
72016,journals/vldb/KnorrNT00,Distance-Based Outliers: Algorithms and Applications,"E Knorr, R Ng, V Tucakov",VLDB J.,2000
72039,journals/vldb/RoySSSA98,Garbage Collection in Object-Oriented Databases Using Transactional Cyclic Reference Counting,"P Roy, S Seshadri, A Silberschatz, S Sudarshan, S Ashwin",VLDB J.,1998
72043,journals/vldb/DiazJ97,EXACT: An Extensible Approach to Active Object-Oriented Databases,"O Díaz, A Jaime",VLDB J.,1997
72049,journals/vldb/IshakbeyogluO98,Maintenance of Implication Integrity Constraints Under Updates to Constraints,"N Ishakbeyoglu, Z Özsoyoglu",VLDB J.,1998
72050,journals/vldb/DesslochHMMT98,"Advanced Data Processing in KRISYS: Modeling Concepts, Implementation Techniques, and Client/Server Issues","S Deßloch, T Härder, N Mattos, B Mitschang, J Thomas",VLDB J.,1998
72051,journals/vldb/AilamakiDH02,Data page layouts for relational databases on deep memory hierarchies,"A Ailamaki, D DeWitt, M Hill",VLDB J.,2002
72056,journals/vldb/NanopoulosM02,Efficient similarity search for market basket data,"A Nanopoulos, Y Manolopoulos",VLDB J.,2002
72057,journals/vldb/HjaltasonS02,Speeding up construction of PMR quadtree-based spatial indexes,"G Hjaltason, H Samet",VLDB J.,2002
72065,journals/vldb/GrefenVA01,Global transaction support for workflow management systems: from formal specification to practical implementation,"P Grefen, J Vonk, P Apers",VLDB J.,2001
72075,journals/vldb/ChanFGR02,Efficient filtering of XML documents with XPath expressions,"C Chan, P Felber, M Garofalakis, R Rastogi",VLDB J.,2002
72088,journals/vldb/WangW01,Indexing very high-dimensional sparse and quasi-sparse vectors for similarity searches,"C Wang, X Wang",VLDB J.,2001
72091,journals/vldb/ManegoldBK00,Optimizing database architecture for the new bottleneck: memory access,"S Manegold, P Boncz, M Kersten",VLDB J.,2000
72094,journals/vldb/Atkinson00,Guest editorial,,,2000
72102,journals/vldb/TurkerG01,Semantic integrity support in SQL: 1999 and commercial (object-)relational database management systems,"C Türker, M Gertz",VLDB J.,2001
72110,journals/vldb/Sarawagi01,User-cognizant multidimensional analysis,S Sarawagi,VLDB J.,2001
72121,journals/vldb/FangGM96,An Experimental System for Object-Based Sharing in Federated Databases,"D Fang, S Ghandeharizadeh",VLDB J.,1996
72125,journals/vldb/EvangelidisS97,"The hB-Pi-Tree: A Multi-Attribute Index Supporting Concurrency, Recovery and Node Consolidation","G Evangelidis, D Lomet, B Salzberg",VLDB J.,1997
72126,journals/vldb/MehtaD97,Data Placement in Shared-Nothing Parallel Database Systems,"M Mehta, D DeWitt",VLDB J.,1997
72133,journals/vldb/WhiteD95,QuickStore: A High Performance Mapped Object Store,"S White, D DeWitt",VLDB J.,1995
72135,journals/vldb/OzsuPSILM95,TIGUKAT: A Uniform Behavioral Objectbase Management System,"M Özsu, R Peters, D Szafron, B Irani, A Lipka, A Muńoz",VLDB J.,1995
72136,journals/vldb/BenzakenD95,Thémis: A Database Programming Language Handling Integrity Constraints,"V Benzaken, A Doucet",VLDB J.,1995
72138,journals/vldb/AtkinsonM95,Orthogonally Persistent Object Systems,"M Atkinson, R Morrison",VLDB J.,1995
72141,journals/vldb/DeWittNSV96,Parallelising OODBMS Traversals: A Performance Evaluation,"D DeWitt, J Naughton, J Shafer, S Venkataraman",VLDB J.,1996
72145,journals/vldb/NybergBCGL95,AlphaSort: A Cache-Sensitive Parallel External Sort,"C Nyberg, T Barclay, Z Cvetanovic, J Gray, D Lomet",VLDB J.,1995
72149,journals/vldb/Guting94,An Introduction to Spatial Database Systems,R Güting,VLDB J.,1994
72155,journals/vldb/C95a,Title,,,1995
72157,journals/vldb/TenienteO95,Updating Knowledge Bases While Maintaining Their Consistency,"E Teniente, A Olivé",VLDB J.,1995
72165,journals/vldb/VaghaniRKSSLH94,The Aditi Deductive Database System,"J Vaghani, K Ramamohanarao, D Kemp, Z Somogyi, P Stuckey, T Leask, J Harland",VLDB J.,1994
72170,journals/vldb/Sciore94,Versioning and Configuration Management in an Object-Oriented Data Model,E Sciore,VLDB J.,1994
72185,conf/vldb/CareyHMW96,PESTO : An Integrated Query/Browser for Object Databases,"M Carey, L Haas, V Maganty, J Williams",VLDB,1996
72186,journals/sigmod/WenLMZ03,A Multi-paradigm Querying Approach for a Generic Multimedia Database Management System,"J Wen, Q Li, W Ma, H Zhang",SIGMOD Record,2003
72187,journals/sigmod/SalgadoE03,Report on the 17th Brazilian Symposium on Database Systems (SBBD 2002),,,2003
72190,conf/vldb/LakshmananSS96,SchemaSQL - A Language for Interoperability in Relational Multi-Database Systems,"L Lakshmanan, F Sadri, I Subramanian",VLDB,1996
72201,journals/sigmod/Snodgrass02b,"Rights of TODS Readers, Authors and Reviewers",R Snodgrass,SIGMOD Record,2002
72210,conf/vldb/Rengarajan96,How System 11 SQL Server Became Fast,T Rengarajan,VLDB,1996
72211,conf/vldb/BertinoBFS96,Supporting Periodic Authorizations and Temporal Reasoning in Database Access Control,"E Bertino, C Bettini, E Ferrari, P Samarati",VLDB,1996
72215,conf/vldb/AgarwalADGNRS96,On the Computation of Multidimensional Aggregates,"S Agarwal, R Agrawal, P Deshpande, A Gupta, J Naughton, R Ramakrishnan, S Sarawagi",VLDB,1996
72220,conf/vldb/Dyreson96,Information Retrieval from an Incomplete Data Cube,C Dyreson,VLDB,1996
72226,journals/sigmod/Aberer03a,"Report on the First International Conference on Ontologies, Databases and Applications of Semantics",,,2003
