tid,id,title,authors,venue,year
70770,conf/sigmod/ZhaoDNS98,Simultaneous Optimization and Evaluation of Multiple Dimensional Queries,"Y Zhao, P Deshpande, J Naughton, A Shukla",SIGMOD Conference,1998
70787,conf/sigmod/Adelberg98,NoDoSE - A Tool for Semi-Automatically Extracting Semi-Structured Data from Text Documents,B Adelberg,SIGMOD Conference,1998
70789,conf/vldb/CotterB00,Biodiversity Informatics Infrastructure: An Information Commons for the Biodiversity Community,"G Cotter, B Bauldock",VLDB,2000
70797,conf/vldb/X00a,Author Index,,VLDB,2000
70800,conf/sigmod/DarEGP98,DTL's DataSpot: Database Exploration as Easy as Browsing the Web,"S Dar, G Entin, S Geva, E Palmon",SIGMOD Conference,1998
70809,conf/sigmod/LiuPTBBZBHY98,CQ: A Personalized Update Monitoring Toolkit,"L Liu, C Pu, W Tang, D Buttler, J Biggs, T Zhou, P Benninghoff, W Han, F Yu",SIGMOD Conference,1998
70819,conf/vldb/YiF00,Fast Time Sequence Indexing for Arbitrary Lp Norms,"B Yi, C Faloutsos",VLDB,2000
70820,conf/sigmod/LiYVGPUV98,Capability Based Mediation in TSIMMIS,"C Li, R Yerneni, V Vassalos, H Garcia-Molina, Y Papakonstantinou, J Ullman, M Valiveti",SIGMOD Conference,1998
70825,conf/sigmod/TsurUACMNR98,Query Flocks: A Generalization of Association-Rule Mining,"S Tsur, J Ullman, S Abiteboul, C Clifton, R Motwani, S Nestorov, A Rosenthal",SIGMOD Conference,1998
70827,conf/vldb/CareyKRLABFLOPQRSSUVWY01,The Propel Distributed Services Platform,"M Carey, S Kirsch, M Roth, B Linden, N Adiba, M Blow, D Florescu, D Li, I Oprencak, R Panwar, R Qi, D Rieber, J Shafer, B Sterling, T Urhan, B Vickery, D Wineman, K Yee",VLDB,2001
70830,conf/vldb/NarayananS01,Tavant System Architecture for Sell-side Channel Management,"S Narayanan, S Subramanian",VLDB,2001
70831,conf/vldb/AbrolLMMMRTWZ01,Navigating large-scale semi-structured data in business portals,"M Abrol, N Latarche, U Mahadevan, J Mao, R Mukherjee, P Raghavan, M Tourn, J Wang, G Zhang",VLDB,2001
70833,conf/vldb/DattaDTVRF01,A Comparative Study of Alternative Middle Tier Caching Solutions to Support Dynamic Web Content Acceleration,"A Datta, K Dutta, H Thomas, D VanderMeer, K Ramamritham, D Fishman",VLDB,2001
70841,conf/sigmod/KiepuszewskiMO98,FlowBack: Providing Backward Recovery for Workflow Systems,"B Kiepuszewski, R Mühlberger, M Orlowska",SIGMOD Conference,1998
70857,conf/vldb/StohrR01,WARLOCK: A Data Allocation Tool for Parallel Warehouses,"T Stöhr, E Rahm",VLDB,2001
70863,conf/vldb/TanSHCR01,Walking Through a Very Large Virtual Environment in Real-time,"L Shou, J Chionh, Z Huang, Y Ruan, K Tan",VLDB,2001
70885,conf/sigmod/NgLK98,A Data Mining Application: Customes Retention at the Port of Singapore Authority (PSA),"K Ng, H Liu, H Kwah",SIGMOD Conference,1998
70886,conf/vldb/Huyn01,Scientific OLAP for the Biotech Domain,N Huyn,VLDB,2001
70888,conf/vldb/BouguettayaEMO01,Ontology-based Support for Digital Government,"A Bouguettaya, A Elmagarmid, B Medjahed, M Ouzzani",VLDB,2001
70891,conf/vldb/LaneEN00,"Biodiversity Informatics: The Challenge of Rapid Development, Large Databases, and Complex Data (Keynote)",,,2000
70895,conf/sigmod/CareyK97,"\On Saying \""\""Enough Already!\""\"" in SQL\""""","M Carey, D Kossmann",SIGMOD Conference,1997
70897,conf/vldb/Carey00,"Toto, We're Not in Kansas Anymore: On Transitioning from Research to the Real (Invited Industrial Talk)",M Carey,VLDB,2000
70904,conf/sigmod/KoudasS97,Size Separation Spatial Join,"N Koudas, K Sevcik",SIGMOD Conference,1997
70917,conf/sigmod/TsueiPK97,Database Buffer Size Investigation for OLTP Workloads (Experience Paper),"T Tsuei, A Packer, K Ko",SIGMOD Conference,1997
70934,conf/sigmod/HanKS97,GeoMiner: A System Prototype for Spatial Data Mining,"J Han, K Koperski, N Stefanovic",SIGMOD Conference,1997
70935,conf/sigmod/RafieiM97,Similarity-Based Queries for Time Series Data,"D Rafiei, A Mendelzon",SIGMOD Conference,1997
70937,conf/sigmod/ChawatheG97,Meaningful Change Detection in Structured Data,"S Chawathe, H Garcia-Molina",SIGMOD Conference,1997
70943,conf/sigmod/LivnyRBCDLMW97,DEVise: Integrated Querying and Visualization of Large Datasets,"M Livny, R Ramakrishnan, K Beyer, G Chen, D Donjerkovic, S Lawande, J Myllymaki, R Wenger",SIGMOD Conference,1997
70944,conf/vldb/PedersenJD00,The TreeScape System: Reuse of Pre-Computed Aggregates over Irregular OLAP Hierarchies,"T Pedersen, C Jensen, C Dyreson",VLDB,2000
70962,conf/sigmod/SeshadriP97,PREDATOR: An OR-DBMS with Enhanced Data Types,"P Seshadri, M Paskin",SIGMOD Conference,1997
70964,conf/vldb/PfoserJT00,Novel Approaches in Query Processing for Moving Object Trajectories,"D Pfoser, C Jensen, Y Theodoridis",VLDB,2000
70967,conf/sigmod/OConnellISWABCCLPWW96,A Content-Based Multimedia Server for Massively Parallel Architectures,"W O'Connell, I Ieong, D Schrader, C Watson, G Au, A Biliris, S Choo, P Colin, G Linderman, E Panagos, J Wang, T Walters",SIGMOD Conference,1996
70971,conf/sigmod/TomasicABKNR97,The Distributed Information Search Component (Disco) and the World Wide Web,"A Tomasic, R Amouroux, P Bonnet, O Kapitskaia, H Naacke, L Raschid",SIGMOD Conference,1997
70975,conf/vldb/Sarawagi00,User-Adaptive Exploration of Multidimensional Data,S Sarawagi,VLDB,2000
70976,conf/sigmod/GeneserethKD97,Infomaster: An Information Integration System,"M Genesereth, A Keller, O Duschka",SIGMOD Conference,1997
70980,conf/vldb/StohrMR00,Multi-Dimensional Database Allocation for Parallel Data Warehouses,"T Stöhr, H Märtens, E Rahm",VLDB,2000
70984,conf/sigmod/LabioZWGGW97,The WHIPS Prototype for Data Warehouse Creation and Maintenance,"W Labio, Y Zhuge, J Wiener, H Gupta, H Garcia-Molina, J Widom",SIGMOD Conference,1997
70994,conf/vldb/GantiLR00,ICICLES: Self-Tuning Samples for Approximate Query Answering,"V Ganti, M Lee, R Ramakrishnan",VLDB,2000
70997,conf/sigmod/HammerGNYBV97,Template-Based Wrappers in the TSIMMIS System,"J Hammer, H Garcia-Molina, S Nestorov, R Yerneni, M Breunig, V Vassalos",SIGMOD Conference,1997
71005,conf/vldb/WangHH00,Mining Frequent Itemsets Using Support Constraints,"K Wang, Y He, J Han",VLDB,2000
71015,conf/sigmod/MotakisZ97,Temporal Aggregation in Active Database Rules,"I Motakis, C Zaniolo",SIGMOD Conference,1997
71025,conf/sigmod/MogiK96,Hot Mirroring: A Study to Hide Parity Upgrade Penalty and Degradations During Rebuilds for RAID5,"K Mogi, M Kitsuregawa",SIGMOD Conference,1996
71042,conf/sigmod/GoelI96,SQL Query Optimization: Reordering for a General Class of Queries,"P Goel, B Iyer",SIGMOD Conference,1996
71047,conf/vldb/NaumannLF99,Quality-driven Integration of Heterogenous Information Systems,"F Naumann, U Leser, J Freytag",VLDB,1999
71053,conf/vldb/Hamilton99,Networked Data Management Design Points,J Hamilton,VLDB,1999
71056,conf/vldb/Pound99,In Cyber Space No One can Hear You Scream,C Pound,VLDB,1999
71066,conf/sigmod/NguyenS96,Accessing Relational Databases from the World Wide Web,"T Nguyen, V Srinivasan",SIGMOD Conference,1996
71075,conf/vldb/Norvag99,The Persistent Cache: Improving OID Indexing in Temporal Object-Oriented Database Systems,K Nřrvĺg,VLDB,1999
71084,conf/vldb/PedersenJD99,Extending Practical Pre-Aggregation in On-Line Analytical Processing,"T Pedersen, C Jensen, C Dyreson",VLDB,1999
71085,conf/vldb/LiRS99,Aggregation Algorithms for Very Large Compressed Data Warehouses,"J Li, D Rotem, J Srivastava",VLDB,1999
71086,conf/sigmod/Freeston95,A General Solution of the n-dimensional B-tree Problem,M Freeston,SIGMOD Conference,1995
71092,conf/vldb/DattaRT99,Curio: A Novel Solution for Efficient Storage and Indexing in Data Warehouses,"A Datta, K Ramamritham, H Thomas",VLDB,1999
71094,conf/sigmod/RundensteinerKRCJM96,The MultiView Project: Object-Oriented View Technology and Applications,"E Rundensteiner, H Kuno, Y Ra, V Crestana-Taube, M Jones, P Marrón",SIGMOD Conference,1996
71100,conf/vldb/KonigW99,Combining Histograms and Parametric Curve Fitting for Feedback-Driven Query Result-size Estimation,"A König, G Weikum",VLDB,1999
71109,conf/sigmod/Bernstein96,Repository System Engineering,,,1996
71115,conf/sigmod/RossSS96,Materialized View Maintenance and Integrity Constraint Checking: Trading Space for Time,"K Ross, D Srivastava, S Sudarshan",SIGMOD Conference,1996
71118,conf/sigmod/MorpainCFP96,Maintaining Database Consistency in Presence of Value Dependencies in Multidatabase Systems,"C Morpain, M Cart, J Ferrié, J Pons",SIGMOD Conference,1996
71129,conf/vldb/DyresonBJ99,Capturing and Querying Multiple Aspects of Semistructured Data,"C Dyreson, M Böhlen, C Jensen",VLDB,1999
71135,conf/sigmod/PoosalaIHS96,Improved Histograms for Selectivity Estimation of Range Predicates,"V Poosala, Y Ioannidis, P Haas, E Shekita",SIGMOD Conference,1996
71139,conf/sigmod/LoR96,Spatial Hash-Joins,"M Lo, C Ravishankar",SIGMOD Conference,1996
71140,conf/vldb/AbiteboulACEMM99,Active Views for Electronic Commerce,"S Abiteboul, B Amann, S Cluet, A Eyal, L Mignet, T Milo",VLDB,1999
71148,conf/sigmod/GuptaMR95,Adapting Materialized Views after Redefinitions,"A Gupta, I Mumick, K Ross",SIGMOD Conference,1995
71155,conf/sigmod/DavisonG95,Dynamic Resource Brokering for Multi-User Query Execution,"D Davison, G Graefe",SIGMOD Conference,1995
71156,conf/vldb/BamfordBKM98,Architecture of Oracle Parallel Server,"R Bamford, D Butler, B Klots, N MacNaughton",VLDB,1998
71159,conf/sigmod/IoannidisP95,Balancing Histogram Optimality and Practicality for Query Result Size Estimation,"Y Ioannidis, V Poosala",SIGMOD Conference,1995
71161,conf/vldb/DarEGP98,DTL's DataSpot: Database Exploration Using Plain Language,"S Dar, G Entin, S Geva, E Palmon",VLDB,1998
71164,conf/sigmod/BrinDG95,Copy Detection Mechanisms for Digital Documents,"S Brin, J Davis, H Garcia-Molina",SIGMOD Conference,1995
71173,conf/vldb/RiedelGF98,Active Storage for Large-Scale Data Mining and Multimedia,"E Riedel, G Gibson, C Faloutsos",VLDB,1998
71177,conf/vldb/George98,DMS: A Parallel Data Mining Server,F George,VLDB,1998
71186,conf/vldb/LinR98,Querying Continuous Time Sequences,"L Lin, T Risch",VLDB,1998
71187,conf/sigmod/MoleskyR95,Recovery Protocols for Shared Memory Database Systems,"L Molesky, K Ramamritham",SIGMOD Conference,1995
71193,conf/vldb/MiloZ98,Using Schema Matching to Simplify Heterogeneous Data Translation,"T Milo, S Zohar",VLDB,1998
71200,conf/vldb/JagadishKMPSS98,Optimal Histograms with Quality Guarantees,"H Jagadish, N Koudas, S Muthukrishnan, V Poosala, K Sevcik, T Suel",VLDB,1998
71201,conf/sigmod/GardarinMP95,OFL: A Functional Execution Model for Object Query Languages,"G Gardarin, F Machuca, P Pucheral",SIGMOD Conference,1995
71223,conf/sigmod/FreedmanD95,The SPIFFI Scalable Video-on-Demand System,"C Freedman, D DeWitt",SIGMOD Conference,1995
71240,conf/sigmod/Ellison95,Keynote Address,,,1995
71245,conf/sigmod/Golding95,Things Every Update Replication Customer Should Know,R Golding,SIGMOD Conference,1995
71249,conf/sigmod/Edelstein95,Research and Products: Are They Relevant To Each Other? (Panel),H Edelstein,SIGMOD Conference,1995
71256,conf/sigmod/Perna95,Leveraging The Information Asset,J Perna,SIGMOD Conference,1995
71259,conf/vldb/Amer-YahiaCD98,Bulk-Loading Techniques for Object Databases and an Application to Relational Data,"S Amer-Yahia, S Cluet, C Delobel",VLDB,1998
71260,conf/sigmod/Gerber95,Informix Online XPS,R Gerber,SIGMOD Conference,1995
71266,conf/sigmod/Faloutsos95,Indexing Multimedia Databases (Tutorial),,,1995
71276,conf/sigmod/GatziuGD95,The SAMOS Active DBMS Prototype,"S Gatziu, A Geppert, K Dittrich",SIGMOD Conference,1995
71308,conf/vldb/GibbonsMP97,Fast Incremental Maintenance of Approximate Histograms,"P Gibbons, Y Matias, V Poosala",VLDB,1997
71310,conf/sigmod/WangCMSSZ94,Combinatorial Pattern Discovery for Scientific Data: Some Preliminary Results,"J Wang, G Chirn, T Marr, B Shapiro, D Shasha, K Zhang",SIGMOD Conference,1994
71315,conf/sigmod/ImielinskiVB94,Energy Efficient Indexing on Air,"T Imielinski, S Viswanathan, B Badrinath",SIGMOD Conference,1994
71317,conf/sigmod/BilirisDGJR94,ASSET: A System for Supporting Extended Transactions,"A Biliris, S Dar, N Gehani, H Jagadish, K Ramamritham",SIGMOD Conference,1994
71325,conf/sigmod/FaloutsosRM94,Fast Subsequence Matching in Time-Series Databases,"C Faloutsos, M Ranganathan, Y Manolopoulos",SIGMOD Conference,1994
71329,conf/vldb/AlonsoHST97,Distributed Processing over Stand-alone Systems and Applications,"G Alonso, C Hagen, H Schek, M Tresch",VLDB,1997
71335,conf/sigmod/ChenR94,Adaptive Selectivity Estimation Using Query Feedback,"C Chen, N Roussopoulos",SIGMOD Conference,1994
71339,conf/vldb/RastogiS98,PUBLIC: A Decision Tree Classifier that Integrates Building and Pruning,"R Rastogi, K Shim",VLDB,1998
71344,conf/sigmod/Jagadish94,Databases for Networks,H Jagadish,SIGMOD Conference,1994
71350,conf/sigmod/DarR94,A Performance Study of Transitive Closure Algorithms,"S Dar, R Ramakrishnan",SIGMOD Conference,1994
71351,conf/vldb/ZouS98,Safely and Efficiently Updating References During On-line Reorganization,"C Zou, B Salzberg",VLDB,1998
71361,conf/sigmod/IoannidisL94,Incomplete Path Expressions and their Disambiguation,"Y Ioannidis, Y Lashkari",SIGMOD Conference,1994
71371,conf/vldb/Sterling98,The National Medical Knowledge Bank,W Sterling,VLDB,1998
71381,conf/sigmod/BrinkhoffKSS94,Multi-Step Processing of Spatial Joins,"T Brinkhoff, H Kriegel, R Schneider, B Seeger",SIGMOD Conference,1994
71386,conf/vldb/BlottKS98,"Information, Communication, and Money: For What Can We Charge and How Can We Meter It?","S Blott, H Korth, A Silberschatz",VLDB,1998
71390,conf/sigmod/WhiteD94,QuickStore: A High Performance Mapped Object Store,"S White, D DeWitt",SIGMOD Conference,1994
71393,conf/sigmod/SeshadriLR94,Sequence Query Processing,"P Seshadri, M Livny, R Ramakrishnan",SIGMOD Conference,1994
71399,conf/vldb/MaratheS97,A Language for Manipulating Arrays,"A Marathe, K Salem",VLDB,1997
71411,conf/vldb/SrivastavaDJL96,Answering Queries with Aggregation Using Views,"D Srivastava, S Dar, H Jagadish, A Levy",VLDB,1996
71416,conf/vldb/KornSFSP96,Fast Nearest Neighbor Search in Medical Image Databases,"F Korn, N Sidiropoulos, C Faloutsos, E Siegel, Z Protopapas",VLDB,1996
71420,conf/vldb/BohlenSS96,Coalescing in Temporal Databases,"M Böhlen, R Snodgrass, M Soo",VLDB,1996
71436,journals/sigmod/Liu03c,Editor's Notes,L Liu,SIGMOD Record,2003
71437,conf/vldb/ChaudhuriS96,Optimization of Queries with User-defined Predicates,"S Chaudhuri, K Shim",VLDB,1996
71444,journals/sigmod/AilamakiFFSV03,An environmental sensor network to determine drinking water quality and security,"A Ailamaki, C Faloutsos, P Fischbeck, M Small, J VanBriesen",SIGMOD Record,2003
71445,journals/sigmod/BonnetBDL03,Bluetooth-based sensor networks,"P Bonnet, A Beaufour, M Dydensborg, M Leopold",SIGMOD Record,2003
71446,conf/vldb/CareyD96,Of Objects and Databases: A Decade of Turmoil,"M Carey, D DeWitt",VLDB,1996
71450,journals/sigmod/Date03,Edgar F. Codd: a tribute and personal memoir,C Date,SIGMOD Record,2003
71453,conf/vldb/Mohan96,DWMS: Data Warehouse Management System,N Mohan,VLDB,1996
71459,conf/vldb/Klots96,Cache Coherency in Oracle Parallel Server,B Klots,VLDB,1996
71461,conf/vldb/Padmanabhan96,Extracting Large Data Sets using DB2 Parallel Edition,S Padmanabhan,VLDB,1996
71468,conf/vldb/AtzeniMM97,To Weave the Web,"P Atzeni, G Mecca, P Merialdo",VLDB,1997
71471,journals/sigmod/CalvaneseGLV03,Reasoning on regular path queries,"D Calvanese, G Giacomo, M Lenzerini, M Vardi",SIGMOD Record,2003
71476,conf/vldb/BaralisPT97,Materialized Views Selection in a Multidimensional Database,"E Baralis, S Paraboschi, E Teniente",VLDB,1997
71478,conf/vldb/ShaferA97,Parallel Algorithms for High-dimensional Similarity Joins for Data Mining Applications,"J Shafer, R Agrawal",VLDB,1997
71492,journals/sigmod/HellersteinHM03,"The sensor spectrum: technology, trends, and requirements","J Hellerstein, W Hong, S Madden",SIGMOD Record,2003
71503,journals/sigmod/Hammer03,Treasurer's Message,,,2003
71512,conf/vldb/DesslochM97,Integrating SQL Databases with Content-Specific Search Engines,"S Deßloch, N Mattos",VLDB,1997
71514,journals/sigmod/Halevy03,Learning about data integration challenges from day one,A Halevy,SIGMOD Record,2003
71515,conf/vldb/HuangJR97,Spatial Joins Using R-trees: Breadth-First Traversal with Global Optimizations,"Y Huang, N Jing, E Rundensteiner",VLDB,1997
71517,conf/vldb/PellenkoftLK97,The Complexity of Transformation-Based Join Enumeration,"A Pellenkoft, C Galindo-Legaria, M Kersten",VLDB,1997
71530,conf/vldb/ClaussenKMP97,Optimizing Queries with Universal Quantification in Object-Oriented and Object-Relational Databases,"J Claußen, A Kemper, G Moerkotte, K Peithner",VLDB,1997
71537,journals/sigmod/Jonsson03,In Memory of Gísli R. Hjaltason,,,2003
71543,conf/vldb/YanG95,Duplicate Removal in Information System Dissemination,"T Yan, H Garcia-Molina",VLDB,1995
71549,journals/sigmod/KoubarakisTID03,Selective information dissemination in P2P networks: problems and solutions,"M Koubarakis, C Tryfonopoulos, S Idreos, Y Drougas",SIGMOD Record,2003
71560,conf/vldb/Sacks-Davis96,The Structured Information Manager: A Database System for SGML Documents,R Sacks-Davis,VLDB,1996
71564,conf/vldb/SavasereON95,An Efficient Algorithm for Mining Association Rules in Large Databases,"A Savasere, E Omiecinski, S Navathe",VLDB,1995
71574,conf/vldb/HellersteinNP95,Generalized Search Trees for Database Systems,"J Hellerstein, J Naughton, A Pfeffer",VLDB,1995
71583,journals/sigmod/GottlobKP03a,XPath processing in a nutshell,,,2003
71585,conf/vldb/BunemanDHOW95,A Data Transformation System for Biological Data Sources,"P Buneman, S Davidson, K Hart, G Overton, L Wong",VLDB,1995
71621,conf/vldb/VieiraM03,A Dependability Benchmark for OLTP Application Environments,"M Vieira, H Madeira",VLDB,2003
71630,conf/vldb/HageJPST03,Integrated Data Management for Mobile Services in the Real World,"C Hage, C Jensen, T Pedersen, L Speicys, I Timko",VLDB,2003
71633,conf/vldb/BhattacharjeePMLCH03,Efficient Query Processing for Multi-Dimensionally Clustered Tables in DB2,"B Bhattacharjee, S Padmanabhan, T Malkemus, T Lai, L Cranston, M Huras",VLDB,2003
71649,conf/vldb/AbiteboulBBCCDMMP03,Managing Distributed Workspaces with Active XML,"S Abiteboul, J Baumgarten, A Bonifati, G Cobena, C Cremarenco, F Dragan, I Manolescu, T Milo, N Preda",VLDB,2003
71666,conf/vldb/LakshmananPZ03,Efficacious Data Cube Exploration by Semantic Summarization and Compression,"L Lakshmanan, J Pei, Y Zhao",VLDB,2003
71669,conf/vldb/SizovGT03,From Focused Crawling to Expert Information: an Application Framework for Web Exploration and Portal Generation,"S Sizov, J Graupmann, M Theobald",VLDB,2003
71676,conf/vldb/EleftheriouBCDHLPPABDDDGJHLRSVW03,A Nanotechnology-based Approach to Data Storage,"E Eleftheriou, P Bächtold, G Cherubini, A Dholakia, C Hagleitner, T Loeliger, A Pantazi, H Pozidis, T Albrecht, G Binnig, M Despont, U Drechsler, U Dürig, B Gotsmann, D Jubin, W Häberle, M Lantz, H Rothuizen, R Stutz, P Vettiger, D Wiesmann",VLDB,2003
71677,conf/vldb/Ioannidis03,The History of Histograms (abridged),Y Ioannidis,VLDB,2003
71681,conf/vldb/YangLH03,Efficient Mining of XML Query Patterns for Caching,"L Yang, M Lee, W Hsu",VLDB,2003
71692,conf/vldb/TengCY03,A Regression-Based Temporal Pattern Mining Scheme for Data Streams,"W Teng, M Chen, P Yu",VLDB,2003
71703,conf/vldb/ZhouS03,Data Bubbles for Non-Vector Data: Speeding-up Hierarchical Clustering in Arbitrary Metric Spaces,"J Zhou, J Sander",VLDB,2003
71704,conf/vldb/ShiSZ03,A Shrinking-Based Approach for Multi-Dimensional Data Analysis,"Y Shi, Y Song, A Zhang",VLDB,2003
71707,conf/vldb/TatbulCZCS03,Load Shedding in a Data Stream Manager,"N Tatbul, U Çetintemel, S Zdonik, M Cherniack, M Stonebraker",VLDB,2003
71711,conf/vldb/HeMYW03,WISE-Integrator: An Automatic Integrator of Web Search Interfaces for E-Commerce,"H He, W Meng, C Yu, Z Wu",VLDB,2003
71713,conf/vldb/TianD03,Tuple Routing Strategies for Distributed Eddies,"F Tian, D DeWitt",VLDB,2003
71718,conf/vldb/MadhavanH03,Composing Mappings Among Data Sources,"J Madhavan, A Halevy",VLDB,2003
71719,conf/vldb/GaoS03,Temporal Slicing in the Evaluation of XML Queries,"D Gao, R Snodgrass",VLDB,2003
71726,conf/vldb/XinHLW03,Star-Cubing: Computing Iceberg Cubes by Top-Down and Bottom-Up Integration,"D Xin, J Han, X Li, B Wah",VLDB,2003
71729,conf/vldb/IwerksSS03,Continuous K-Nearest Neighbor Queries for Continuously Moving Points with Updates,"G Iwerks, H Samet, K Smith",VLDB,2003
71735,conf/vldb/NiermanJ02,ProTDB: Probabilistic Data in XML,"A Nierman, H Jagadish",VLDB,2002
71745,conf/vldb/LakshmananPH02,Quotient Cube: How to Summarize the Semantics of a Data Cube,"L Lakshmanan, J Pei, J Han",VLDB,2002
71753,conf/vldb/SayalCDS02,Business Process Cockpit,"M Sayal, F Casati, U Dayal, M Shan",VLDB,2002
71754,conf/vldb/LohmanL02,SMART: Making DB2 (More) Autonomic,"G Lohman, S Lightstone",VLDB,2002
71755,conf/vldb/SchmidtWKCMB02,XMark: A Benchmark for XML Data Management,"A Schmidt, F Waas, M Kersten, M Carey, I Manolescu, R Busse",VLDB,2002
71757,conf/vldb/KiesslingK02,"Preference SQL - Design, Implementation, Experiences","W Kießling, G Köstler",VLDB,2002
71761,conf/vldb/IlyasAE02,Joining Ranked Inputs in Practice,"I Ilyas, W Aref, A Elmagarmid",VLDB,2002
71763,conf/vldb/KeidlSSK02,ServiceGlobe: Distributing E-Services Across the Internet,"M Keidl, S Seltzsam, K Stocker, A Kemper",VLDB,2002
71779,conf/vldb/Mohan01,Caching Technologies for Web Applications,C Mohan,VLDB,2001
71800,conf/vldb/CormodeDIM02,Comparing Data Streams Using Hamming Norms (How to Zero In),"G Cormode, M Datar, P Indyk, S Muthukrishnan",VLDB,2002
71805,conf/vldb/Mohan02,Application Servers and Associated Technologies,,,2002
71814,conf/vldb/OzsoyogluAAOUO02,Sideway Value Algebra for Object-Relational Databases,"G Özsoyoglu, A Al-Hamdani, I Altingövde, S Özel, Ö Ulusoy, Z Özsoyoglu",VLDB,2002
71821,conf/vldb/GhoshPSH02,Plan Selection Based on Query Clustering,"A Ghosh, J Parikh, V Sengar, J Haritsa",VLDB,2002
71822,conf/vldb/HulgeriS02,Parametric Query Optimization for Linear and Piecewise Linear Cost Functions,"A Hulgeri, S Sudarshan",VLDB,2002
71836,conf/vldb/LifantsevC02,I/O-Conscious Data Preparation for Large-Scale Web Search Engines,"M Lifantsev, T Chiueh",VLDB,2002
71840,conf/vldb/LimWPVP02,XPathLearner: An On-line Self-Tuning Markov Histogram for XML Path Selectivity Estimation,"L Lim, M Wang, S Padmanabhan, J Vitter, R Parr",VLDB,2002
71846,conf/vldb/GilbertKMS02,How to Summarize the Universe: Dynamic Maintenance of Quantiles,"A Gilbert, Y Kotidis, S Muthukrishnan, M Strauss",VLDB,2002
71848,conf/vldb/ShahRS02,Maintaining Coherency of Dynamic Data in Cooperating Repositories,"S Shah, K Ramamritham, P Shenoy",VLDB,2002
71850,conf/vldb/BettiniJWW02,Provisions and Obligations in Policy Management and Security Applications,"C Bettini, S Jajodia, X Wang, D Wijesekera",VLDB,2002
71856,conf/vldb/StolteA02,Efficient Exploration of Large Scientific Databases,"E Stolte, G Alonso",VLDB,2002
71858,conf/vldb/PopaVMHF02,Translating Web Data,"L Popa, Y Velegrakis, R Miller, M Hernández, R Fagin",VLDB,2002
71859,journals/tods/AikenHW95,Static Analysis Techniques for Predicting the Behavior of Active Database Rules,"A Aiken, J Hellerstein, J Widom",ACM Trans. Database Syst.,1995
71860,journals/tods/Chen95,Declarative Updates of Relational Databases,W Chen,ACM Trans. Database Syst.,1995
71871,journals/tods/MokNE96,A Normal Form for Precisely Characterizing Redundancy in Nested Relations,"W Mok, Y Ng, D Embley",ACM Trans. Database Syst.,1996
71873,journals/tods/ChenHM95,An Execution Model for Limited Ambiguity Rules and Its Application to Derived Data Update,"I Chen, R Hull, D McLeod",ACM Trans. Database Syst.,1995
71874,journals/tods/FraternaliT95,A Structured Approach for the Definition of the Semantics of Active Databases,"P Fraternali, L Tanca",ACM Trans. Database Syst.,1995
71887,journals/tods/Galindo-LegariaR97,Outerjoin Simplification and Reordering for Query Optimization,"C Galindo-Legaria, A Rosenthal",ACM Trans. Database Syst.,1997
71889,journals/tods/Keen97,Extended Ehemeral Logging: Log Storage Management for Applications with Long Lived Transactions,"J Keen, W Dally",ACM Trans. Database Syst.,1997
71893,journals/vldb/AbadiCCCCLSTZ03,Aurora: a new model and architecture for data stream management,"D Abadi, D Carney, U Çetintemel, M Cherniack, C Convey, S Lee, M Stonebraker, N Tatbul, S Zdonik",VLDB J.,2003
71895,journals/vldb/YangW03,Incremental computation and maintenance of temporal aggregates,"J Yang, J Widom",VLDB J.,2003
71898,journals/vldb/ChuaCL03,Instance-based attribute identification in database integration,"C Cecil, R Chiang, E Lim",VLDB J.,2003
71901,journals/vldb/HalkidiNVV03,THESUS: Organizing Web document collections based on link semantics,"M Halkidi, B Nguyen, I Varlamis, M Vazirgiannis",VLDB J.,2003
71909,journals/tods/CliffordC94,On Completeness of Historical Relational Query Languages,"J Clifford, A Croker, A Tuzhilin",ACM Trans. Database Syst.,1994
71920,journals/tods/CeriFPT94,Automatic Generation of Production Rules for Integrity Maintenance,"S Ceri, P Fraternali, S Paraboschi, L Tanca",ACM Trans. Database Syst.,1994
71924,journals/tods/ParsonsW00,Emancipating instances from the tyranny of classes in information modeling,"J Parsons, Y Wand",ACM Trans. Database Syst.,2000
71927,journals/tods/Lerner00,A model for compound type changes encountered in schema evolution,B Lerner,ACM Trans. Database Syst.,2000
71928,journals/tods/GutingBEJLSV00,A foundation for representing and quering moving objects,"R Güting, M Böhlen, M Erwig, C Jensen, N Lorentzos, M Schneider, M Vazirgiannis",ACM Trans. Database Syst.,2000
