tid,id,title,authors,venue,year
69615,journals/sigmod/Hammer02,Report on the ACM Fourth International Workshop on Data Warehousing and OLAP (DOLAP 2001),,,2002
69617,conf/vldb/SubietaKL95,Procedures in Object-Oriented Query Languages,"K Subieta, Y Kambayashi, J Leszczylowski",VLDB,1995
69619,journals/sigmod/Ouksel02,Mining the World Wide Web: An Information Search Approach - Book Review,,,2002
69620,conf/vldb/MoserKK95,L/MRP: A Buffer Management Strategy for Interactive Continuous Data Flows in a Multimedia DBMS,"F Moser, A Kraiss, W Klas",VLDB,1995
69627,journals/sigmod/Geller02,Data Mining: Practical Machine Learning Tools and Techniques - Book Review,J Geller,SIGMOD Record,2002
69635,conf/vldb/HvasshovdTBH95,"The ClustRa Telecom Database: High Availability, High Throughput, and Real-Time Response","S Hvasshovd, Ř Torbjřrnsen, S Bratsberg, P Holager",VLDB,1995
69645,conf/vldb/SumiyaYTSI95,A Product Specification Database for Visual Prototyping,"K Sumiya, K Yasutake, H Tanaka, N Sanada, Y Imai",VLDB,1995
69651,journals/sigmod/SlivinskasJS02,Bringing Order to Query Optimization,"G Slivinskas, C Jensen, R Snodgrass",SIGMOD Record,2002
69661,journals/sigmod/OrlandicLS02,The Design of a Retrieval Technique for High-Dimensional Data on Tertiary Storage,"R Orlandic, J Lukaszuk, C Swietlik",SIGMOD Record,2002
69663,journals/sigmod/Ozsu02,Chair's Message,,,2002
69669,conf/vldb/BestavrosB95,Value-cognizant Speculative Concurrency Control,"A Bestavros, S Braoudakis",VLDB,1995
69676,conf/vldb/JonscherD94,An Approach for Building Secure Database Federations,"D Jonscher, K Dittrich",VLDB,1994
69678,conf/vldb/JagadishLRSS94,Dalí: A High Performance Main Memory Storage Manager,"H Jagadish, D Lieuwen, R Rastogi, A Silberschatz, S Sudarshan",VLDB,1994
69686,conf/vldb/BrownCC94,Fast Incremental Indexing for Full-Text Information Retrieval,"E Brown, J Callan, W Croft",VLDB,1994
69691,conf/vldb/FrohnLU94,Access to Objects by Path Expressions and Rules,"J Frohn, G Lausen, H Uphoff",VLDB,1994
69697,conf/vldb/KemperK94,Dual-Buffering Strategies in Object Bases,"A Kemper, D Kossmann",VLDB,1994
69702,journals/sigmod/LightstoneLZ02,Toward Autonomic Computing with DB2 Universal Database,"S Lightstone, G Lohman, D Zilio",SIGMOD Record,2002
69704,conf/vldb/BaralisW94,An Algebraic Approach to Rule Analysis in Expert Database Systems,"E Baralis, J Widom",VLDB,1994
69705,journals/sigmod/FrankNS02,Report on the Semantic Web Workshop at WWW 2002,,,2002
69706,conf/vldb/AgrawalS94,Fast Algorithms for Mining Association Rules in Large Databases,"R Agrawal, R Srikant",VLDB,1994
69715,conf/vldb/Sarawagi95,Query Processing in Tertiary Memory Databases,S Sarawagi,VLDB,1995
69725,journals/sigmod/Liu02b,Editor's Notes,L Liu,SIGMOD Record,2002
69732,journals/sigmod/RossAA02,Reminiscences on Influential Papers,,,2002
69741,journals/sigmod/Suciu01,On Database Theory and XML,D Suciu,SIGMOD Record,2001
69753,conf/vldb/IdrisGC94,Providing Dynamic Security Control in a Federated Database,"N Idris, W Gray, R Churchhouse",VLDB,1994
69766,conf/vldb/SreenathS94,The hcC-tree: An Efficient Index Structure for Object Oriented Databases,"B Sreenath, S Seshadri",VLDB,1994
69771,journals/sigmod/ShahMFH01,Java Support for Data-Intensive Systems: Experiences Building the Telegraph Dataflow System,"M Shah, S Madden, M Franklin, J Hellerstein",SIGMOD Record,2001
69772,conf/vldb/MuntzR94,A Requirement-Based Approach to Data Modeling and Re-Engineering,"A Muntz, C Ramiller",VLDB,1994
69774,conf/vldb/SteenhagenABB94,From Nested-Loop to Join Queries in OODB,"H Steenhagen, P Apers, H Blanken, R By",VLDB,1994
69775,journals/sigmod/GunopulosK01,DIMACS Summer School Tutorial on New Frontiers in Data Mining,"D Gunopulos, N Koudas",SIGMOD Record,2001
69790,conf/vldb/GoodmanRS94,Building a Laboratory Information System Around a C++-Based Object-Oriented DBMS,"N Goodman, S Rozen, L Stein",VLDB,1994
69791,conf/vldb/CochinwalaB94,A Multidatabase System for Tracking and Retrieval of Financial Data,"M Cochinwala, J Bradley",VLDB,1994
69802,conf/vldb/Lesk94,Experiments on Access to Digital Libraries: How can Images and Text be Used Together,M Lesk,VLDB,1994
69805,journals/sigmod/StolfoLCFE01,Data Mining-based Intrusion Detectors: An Overview of the Columbia IDS Project,"S Stolfo, W Lee, P Chan, W Fan, E Eskin",SIGMOD Record,2001
69806,conf/sigmod/BabcockO03,Distributed Top-K Monitoring,"B Babcock, C Olston",SIGMOD Conference,2003
69815,journals/sigmod/Ozsu01a,Chair's Message,,,2001
69821,journals/sigmod/SayginVC01,Using Unknowns to Prevent Discovery of Association Rules,"Y Saygin, V Verykios, C Clifton",SIGMOD Record,2001
69840,journals/sigmod/SommerGB02,The n-Tier Hub Technology,"R Sommer, T Gulledge, D Bailey",SIGMOD Record,2002
69850,conf/vldb/ChawatheCY94,On Index Selection Schemes for Nested Object Hierarchies,"S Chawathe, M Chen, P Yu",VLDB,1994
69853,journals/sigmod/Grefen02,What Will Be - Book Review,,,2002
69855,conf/vldb/HjelsvoldM94,Modelling and Querying Video Data,"R Hjelsvold, R Midtstraum",VLDB,1994
69865,conf/vldb/KamelF94,Hilbert R-tree: An Improved R-tree using Fractals,"I Kamel, C Faloutsos",VLDB,1994
69873,conf/sigmod/Al-KhalifaYJ03,Querying Structured Text in an XML Database,"S Al-Khalifa, C Yu, H Jagadish",SIGMOD Conference,2003
69875,conf/sigmod/WangPFY03,ViST: A Dynamic Index Method for Querying XML Data by Tree Structures,"H Wang, S Park, W Fan, P Yu",SIGMOD Conference,2003
69890,conf/sigmod/AbadiCCCCEGHMRSSTXYZ03,Aurora: A Data Stream Management System,"D Abadi, D Carney, U Çetintemel, M Cherniack, C Convey, C Erwin, E Galvez, M Hatoun, A Maskey, A Rasin, A Singer, M Stonebraker, N Tatbul, Y Xing, R Yan, S Zdonik",SIGMOD Conference,2003
69891,conf/sigmod/Ullman03,Improving the Efficiency of Database-System Teaching,J Ullman,SIGMOD Conference,2003
69893,journals/sigmod/LiefkeS00,An Extensible Compressor for XML Data,"H Liefke, D Suciu",SIGMOD Record,2000
69906,conf/sigmod/BabcockCD03,Dynamic Sample Selection for Approximate Query Processing,"B Babcock, S Chaudhuri, G Das",SIGMOD Conference,2003
69908,journals/sigmod/WestmannKHM00,The Implementation and Performance of Compressed Databases,"T Westmann, D Kossmann, S Helmer, G Moerkotte",SIGMOD Record,2000
69913,journals/sigmod/RossAKSSY00,Reminiscences on Influential Papers,,,2000
69926,journals/sigmod/Naughton00,SIGMOD'2000 Program Chair's Message,,,2000
69930,conf/sigmod/CuiOTS03,Contorting High Dimensional Data for Efficient Main Memory Processing,"B Cui, B Ooi, J Su, K Tan",SIGMOD Conference,2003
69933,journals/sigmod/LeeC00,Comparative Analysis of Six XML Schema Languages,"D Lee, W Chu",SIGMOD Record,2000
69936,conf/sigmod/Seshadri03,Building Notification Services with Microsoft SQLServer,P Seshadri,SIGMOD Conference,2003
69939,conf/sigmod/Zeller03,NonStop SQL/MX Publish/Subscribe: Continuous Data Streams in Transaction Processing,H Zeller,SIGMOD Conference,2003
69957,journals/sigmod/Snodgrass00c,SIGMOD Program Review,,,2000
69960,journals/sigmod/PossasMCR00,Using Quantitative Information for Efficient Association Rule Generation,"B Pôssas, W Jr., M Carvalho, R Resende",SIGMOD Record,2000
69972,journals/sigmod/CarmelMS01,XML and Information Retrieval: a SIGIR 2000 Workshop,,,2001
69983,conf/sigmod/Dyreson03,"Temporal Coalescing with Now, Granularity, and Incomplete Information",C Dyreson,SIGMOD Conference,2003
69992,journals/sigmod/LawderK01,Querying Multi-dimensional Data Indexed Using the Hilbert Space-filling Curve,"J Lawder, P King",SIGMOD Record,2001
70000,journals/sigmod/MeltzerC98,XML and Electronic Commerce: Enabling the Network Economy,"B Meltzer, R Glushko",SIGMOD Record,1998
70002,journals/sigmod/BichlerSZ98,Component-based E-Commerce: Assesment of Current Practices and Future Directions,"M Bichler, A Segev, J Zhao",SIGMOD Record,1998
70004,journals/sigmod/Franklin98a,Editor's Notes,M Franklin,SIGMOD Record,1998
70011,conf/sigmod/KalnisNOPT02,An adaptive peer-to-peer network for distributed caching of OLAP results,"P Kalnis, W Ng, B Ooi, D Papadias, K Tan",SIGMOD Conference,2002
70015,conf/sigmod/BunemanKTT02,Archiving scientific data,"P Buneman, S Khanna, K Tajima, W Tan",SIGMOD Conference,2002
70021,journals/sigmod/Snodgrass98c,Chair's Message,,,1998
70022,conf/sigmod/KoudasS03,Panel: Querying Networked Databases,"N Koudas, D Srivastava",SIGMOD Conference,2003
70024,journals/sigmod/Domingo-FerrerH98,An Anonymous Electronic Commerce Scheme with an Off-Line Authority and Untrusted Agents,"J Domingo-Ferrer, J Herrera-Joancomartí",SIGMOD Record,1998
70035,conf/sigmod/ChoALS03,LockX: A System for Efficiently Querying Secure XML,"S Cho, S Amer-Yahia, L Lakshmanan, D Srivastava",SIGMOD Conference,2003
70036,journals/sigmod/Franklin98b,Editor's Notes,M Franklin,SIGMOD Record,1998
70069,journals/sigmod/CeriFP99,Design Principles for Data-Intensive Web Sites,"S Ceri, P Fraternali, S Paraboschi",SIGMOD Record,1999
70074,conf/sigmod/HellersteinW02,Data streams: fresh current or stagnant backwater? (panel),"J Hellerstein, J Widom",SIGMOD Conference,2002
70075,journals/sigmod/GruenwaldBDGSSV99,Database Research at the University of Oklahoma,"L Gruenwald, L Brown, R Dirckze, S Guinepain, C Sánchez, B Summers, S Vanichayobon",SIGMOD Record,1999
70088,journals/sigmod/Franklin99,Editor's Notes,M Franklin,SIGMOD Record,1999
70096,journals/sigmod/ConradHHKRSS99,Engineering Federated Information Systems: Report of EFIS '99 Workshop,"S Conrad, W Hasselbring, U Hohenstein, R Kutsche, M Roantree, G Saake, F Saltor",SIGMOD Record,1999
70100,conf/sigmod/Aggarwal02,"Hierarchical subspace sampling: a unified framework for high dimensional data reduction, selectivity estimation and nearest neighbor search",C Aggarwal,SIGMOD Conference,2002
70105,journals/sigmod/PapianiWDN99,"A Distributed Scientific Data Archive Using the Web, XML and SQL/MED","M Papiani, J Wason, A Dunlop, D Nicole",SIGMOD Record,1999
70116,journals/sigmod/Abiteboul99,On Views and XML,S Abiteboul,SIGMOD Record,1999
70120,journals/sigmod/MusickC99,Practical Lessons in Supporting Large-Scale Computational Science,"R Musick, T Critchlow",SIGMOD Record,1999
70127,conf/sigmod/ChenGMV02,Fractal prefetching B±Trees: optimizing both cache and disk performance,"S Chen, P Gibbons, T Mowry, G Valentin",SIGMOD Conference,2002
70153,journals/sigmod/GuptaHR97,Virtual Database technology,"A Gupta, V Harinarayan, A Rajaraman",SIGMOD Record,1997
70158,conf/sigmod/ChoiC02,Selectivity estimation for spatio-temporal queries to moving objects,"Y Choi, C Chung",SIGMOD Conference,2002
70162,journals/sigmod/RamamrithamS97,Report on DART '96: Databases: Active and Real-Time (Concepts meet Practice),,,1997
70163,conf/sigmod/KanthRA02,Quadtree and R-tree indexes in oracle spatial: a comparison using GIS data,"K Kanth, S Ravada, D Abugov",SIGMOD Conference,2002
70167,conf/sigmod/PossSKL02,"TPC-DS, taking decision support benchmarking to the next level","M Pöss, B Smith, L Kollár, P Larson",SIGMOD Conference,2002
70176,journals/sigmod/ChaudhuriD97,An Overview of Data Warehousing and OLAP Technology,"S Chaudhuri, U Dayal",SIGMOD Record,1997
70179,conf/sigmod/TheobaldW02,The XXL search engine: ranked retrieval of XML data using indexes and ontologies,"A Theobald, G Weikum",SIGMOD Conference,2002
70182,conf/sigmod/BarbosaMKL02,ToXgene: a template-based data generator for XML,"D Barbosa, A Mendelzon, J Keenleyside, K Lyons",SIGMOD Conference,2002
70186,journals/sigmod/RosenthalHRS97,"\A Consumer Viewpoint on \""\""Mediator Languages - a Proposal for a Standard\""\""\""""","A Rosenthal, E Hughes, S Renner, L Seligman",SIGMOD Record,1997
70188,journals/sigmod/AtzeniM98,WebDB '98: International Workshop on the Web and Databases,,,1998
70189,conf/sigmod/LuWYBLY02,XBase: making your gigabyte disk queriable,"H Lu, G Wang, G Yu, Y Bao, J Lv, Y Yu",SIGMOD Conference,2002
70191,journals/sigmod/ChangGKRS98,Database Research at Columbia University,"S Chang, L Gravano, G Kaiser, K Ross, S Stolfo",SIGMOD Record,1998
70202,conf/sigmod/Cotton02,Implementing XQuery,P Cotton,SIGMOD Conference,2002
70204,journals/sigmod/TsotrasJS98,An Extensible Notation for Spatiotemporal Index Queries,"V Tsotras, C Jensen, R Snodgrass",SIGMOD Record,1998
70207,conf/sigmod/ChaudhuriDN01,"A Robust, Optimization-Based Approach for Approximate Answering of Aggregate Queries","S Chaudhuri, G Das, V Narasayya",SIGMOD Conference,2001
70212,conf/sigmod/BohmBKK01,Epsilon Grid Order: An Algorithm for the Similarity Join on Massive High-Dimensional Data,"C Böhm, B Braunmüller, F Krebs, H Kriegel",SIGMOD Conference,2001
70216,journals/sigmod/SnodgrassGIMSU98,Reminiscences on Influential Papers,,,1998
70225,journals/sigmod/Roussopoulos98,Materialized Views and Data Warehouses,N Roussopoulos,SIGMOD Record,1998
70228,conf/sigmod/FernandezMS01,Efficient Evaluation of XML Middle-ware Queries,"M Fernandez, A Morishima, D Suciu",SIGMOD Conference,2001
70236,conf/sigmod/HanPDW01,Efficient Computation of Iceberg Cubes with Complex Measures,"J Han, J Pei, G Dong, K Wang",SIGMOD Conference,2001
70237,conf/sigmod/Maguire01,Catalog Management in Websphere Commerce Suite,T Maguire,SIGMOD Conference,2001
70240,conf/sigmod/BorkarDS01,Automatic Segmentation of Text into Structured Records,"V Borkar, K Deshmukh, S Sarawagi",SIGMOD Conference,2001
70250,journals/sigmod/ChangASS98,T2: A Customizable Parallel Database for Multi-Dimensional Data,"C Chang, A Acharya, A Sussman, J Saltz",SIGMOD Record,1998
70252,journals/sigmod/ACT-NET96,ACT-NET - The Active Database Management System Manifesto: A Rulebase of ADBMS Features,,SIGMOD Record,1996
70272,conf/sigmod/Bussler01,Semantic B2B Integration,,,2001
70274,conf/sigmod/GoldsteinL01,"Optimizing Queries Using Materialized Views: A practical, scalable solution","J Goldstein, P Larson",SIGMOD Conference,2001
70278,conf/sigmod/TatarinovIHW01,Updating XML,"I Tatarinov, Z Ives, A Halevy, D Weld",SIGMOD Conference,2001
70280,journals/sigmod/AndlerHEMBE96,DeeDS Towards a Distributed and Active Real-Time Database System,"S Andler, J Hansson, J Eriksson, J Mellin, M Berndtsson, B Eftring",SIGMOD Record,1996
70284,journals/sigmod/SilberschatzSU96,Database Research: Achievements and Opportunities Into the 21st Century,"A Silberschatz, M Stonebraker, J Ullman",SIGMOD Record,1996
70285,conf/sigmod/KimCK01,Optimizing Multidimensional Index Trees for Main Memory Access,"K Kim, S Cha, K Kwon",SIGMOD Conference,2001
70287,journals/sigmod/RamamrithamSSTX96,"Integrating Temporal, Real-Time, and Active Databases","K Ramamritham, R Sivasankaran, J Stankovic, D Towsley, M Xiong",SIGMOD Record,1996
70295,journals/sigmod/AdelbergKG96,Overview of the STanford Real-time Information Processor (STRIP),"B Adelberg, B Kao, H Garcia-Molina",SIGMOD Record,1996
70304,conf/sigmod/LazaridisM01,Progressive Approximate Aggregate Queries with a Multi-Resolution Tree Structure,"I Lazaridis, S Mehrotra",SIGMOD Conference,2001
70314,conf/sigmod/ChenGK01,Query Optimization In Compressed Database Systems,"Z Chen, J Gehrke, F Korn",SIGMOD Conference,2001
70315,journals/sigmod/KramerNKRLKLZ97,WWW-UDK: A Web-based Environmental Meta-Information System,"R Kramer, R Nikolai, A Koschel, C Rolker, P Lockemann, A Keitel, R Legat, K Zirm",SIGMOD Record,1997
70324,conf/sigmod/ZhangNDLL01,On Supporting Containment Queries in Relational Database Management Systems,"C Zhang, J Naughton, D DeWitt, Q Luo, G Lohman",SIGMOD Conference,2001
70326,journals/sigmod/BunemanRU97,Mediator Languages - a Proposal for a Standard,"P Buneman, L Raschid, J Ullman",SIGMOD Record,1997
70333,journals/sigmod/Date96,"A Response to R. Camps' Article ``Domains, Relations and Religious Wars''",C Date,SIGMOD Record,1996
70337,journals/sigmod/DoanPSB97,Query Previews for Networked Information Systems: A Case Study with NASA Environmental Data,"K Doan, C Plaisant, B Shneiderman, T Bruns",SIGMOD Record,1997
70344,journals/sigmod/HasanMV96,Applying database Visualization to the World Wide Web,"M Hasan, A Mendelzon, D Vista",SIGMOD Record,1996
70346,conf/sigmod/GunopulosD01,Time Series Similarity Measures and Time Series Indexing,,,2001
70352,journals/sigmod/Widom96b,Editor's Notes,Jennifer Widom,SIGMOD Record,1996
70358,journals/sigmod/SantucciT96,To Table or Not to Table: a Hypertabular Answer,"G Santucci, L Tarantino",SIGMOD Record,1996
70364,conf/sigmod/AggarwalY00,Finding Generalized Projected Clusters In High Dimensional Spaces,"C Aggarwal, P Yu",SIGMOD Conference,2000
70365,journals/sigmod/Bhashyam96,"TCP-D - The Challenges, Issues and Results",R Bhashyam,SIGMOD Record,1996
70374,conf/sigmod/ChangC01,PBIR - Perception-Based Image Retrieval,"E Chang, T Cheng, L Chang",SIGMOD Conference,2001
70377,conf/sigmod/NguyenACP01,Monitoring XML Data on the Web,"B Nguyen, S Abiteboul, G Cobena, M Preda",SIGMOD Conference,2001
70385,journals/sigmod/KarlapalemLS95,HODFA: An Architectural Framework for Homogenizing Heterogeneous Legacy Database,"K Karlapalem, Q Li, C Shum",SIGMOD Record,1995
70402,conf/sigmod/HellersteinA00,Eddies: Continuously Adaptive Query Processing,"R Avnur, J Hellerstein",SIGMOD Conference,2000
70412,journals/sigmod/KlasS94,Metadata for Digital Media: Introduction to the Special Issue,"W Klas, A Sheth",SIGMOD Record,1994
70423,journals/sigmod/Segev94b,Editor's Notes and Erratum,,,1994
70432,journals/sigmod/X95,Calls for Papers and Announcements,,SIGMOD Record,1995
70437,journals/sigmod/NgH95,Multigranularity Locking in Multiple Job Classes Transaction Processing System,"S Ng, S Hung",SIGMOD Record,1995
70448,conf/sigmod/RodriguezR00,MOCHA: A Self-Extensible Database Middleware System for Distributed Data Sources,"M Rodriguez-Martinez, N Roussopoulos",SIGMOD Conference,2000
70459,conf/sigmod/SalemBCL00,How To Roll a Join: Asynchronous Incremental View Maintenance,"K Salem, K Beyer, R Cochrane, B Lindsay",SIGMOD Conference,2000
70460,journals/sigmod/DunhamH95a,Mobile Computing and Databases: Anything New?,"M Dunham, A Helal",SIGMOD Record,1995
70468,conf/sigmod/FaloutsosSTT00,Spatial Join Selectivity Using Power Laws,"C Faloutsos, B Seeger, A Traina, C Jr.",SIGMOD Conference,2000
70478,journals/sigmod/ONeilG95,Multi-Table Joins Through Bitmapped Join Indices,"P O'Neil, G Graefe",SIGMOD Record,1995
70484,journals/sigmod/Richey95,Condition Handling in SQL Persistent Stored Modules,J Richey,SIGMOD Record,1995
70486,conf/sigmod/Gal00,"Data Management in eCommerce: The Good, the Bad, and the Ugly",,,2000
70493,journals/sigmod/LeeCL95,An Aspect of Query Optimization in Multidatabase Systems (Extended Abstract),"C Lee, C Chen, H Lu",SIGMOD Record,1995
70494,conf/sigmod/AgrawalS00,Privacy-Preserving Data Mining,"R Agrawal, R Srikant",SIGMOD Conference,2000
70495,journals/sigmod/DoanPK95,Design and User Testing of a Multi-Paradigm Query Interface to an Object-Oriented Database,"D Doan, N Paton, A Kilgour",SIGMOD Record,1995
70496,conf/sigmod/JagadishKS00,On Effective Multi-Dimensional Indexing for Strings,"H Jagadish, N Koudas, D Srivastava",SIGMOD Conference,2000
70517,journals/tods/Chomicki03,Preference formulas in relational queries,J Chomicki,ACM Trans. Database Syst.,2003
70521,conf/sigmod/LiBCS00,SPIRE: A Progressive Content-Based Spatial Image Retrieval Engine,"C Li, L Bergman, V Castelli, J Smith",SIGMOD Conference,2000
70523,conf/sigmod/MerialdoAMMP00,Homer: a Model-Based CASE Tool for Data-Intensive Web Sites,"P Merialdo, P Atzeni, M Magnante, G Mecca, M Pecorone",SIGMOD Conference,2000
70527,journals/sigmod/Snodgrass94,Overview of the Special Section on Temporal Database Infrastructure,R Snodgrass,SIGMOD Record,1994
70532,journals/sigmod/SnodgrassAABCDEGJKKKLLRSSS94,TSQL2 Language Specification,"R Snodgrass, I Ahn, G Ariav, D Batory, J Clifford, C Dyreson, R Elmasri, F Grandi, C Jensen, W Käfer, N Kline, K Kulkarni, T Leung, N Lorentzos, J Roddick, A Segev, M Soo, S Sripada",SIGMOD Record,1994
70535,journals/sigmod/NorrieBSW94,The Database Research Group at ETH Zurich,"M Norrie, S Blott, H Schek, G Weikum",SIGMOD Record,1994
70540,journals/tods/MayL02,Understanding the global semantics of referential actions using logic rules,"W May, B Ludäscher",ACM Trans. Database Syst.,2002
70543,conf/sigmod/DavulcuFKR99,A Layered Architecture for Querying Dynamic Web Content,"H Davulcu, J Freire, M Kifer, I Ramakrishnan",SIGMOD Conference,1999
70549,conf/sigmod/MayrS99,Client-Site Query Extensions,"T Mayr, P Seshadri",SIGMOD Conference,1999
70550,journals/tods/CaldersNW02,Searching for dependencies at multiple abstraction levels,"T Calders, R Ng, J Wijsen",ACM Trans. Database Syst.,2002
70551,conf/sigmod/AggarwalWY99,A New Method for Similarity Indexing of Market Basket Data,"C Aggarwal, J Wolf, P Yu",SIGMOD Conference,1999
70587,conf/sigmod/Greer99,Daytona And The Fourth-Generation Language Cymbal,R Greer,SIGMOD Conference,1999
70618,journals/sigmod/BunemanLSTW94,Comprehension Syntax,"P Buneman, L Libkin, D Suciu, V Tannen, L Wong",SIGMOD Record,1994
70622,conf/sigmod/Hidber99,Online Association Rule Mining,C Hidber,SIGMOD Conference,1999
70644,conf/sigmod/DoRD99,The Need for Distributed Asynchronous Transactions,"L Do, P Ram, P Drew",SIGMOD Conference,1999
70651,conf/sigmod/LiVCAHMWBCHIKSS99,"PowerBookmarks: A System for Personalizable Web Information Organization, Sharing, and Management","W Li, Q Vu, E Chang, D Agrawal, K Hirata, S Mukherjea, Y Wu, C Bufi, K Chang, Y Hara, R Ito, Y Kimura, K Shimazu, Y Saito",SIGMOD Conference,1999
70652,conf/vldb/MargaritisFT01,NetCube: A Scalable Tool for Fast Data Mining and Compression,"D Margaritis, C Faloutsos, S Thrun",VLDB,2001
70653,conf/vldb/DongHLPW01,Mining Multi-Dimensional Constrained Gradients in Data Cubes,"G Dong, J Han, J Lam, J Pei, K Wang",VLDB,2001
70667,conf/sigmod/ChangG99,Mind Your Vocabulary: Query Mapping Across Heterogeneous Information Sources,"K Chang, H Garcia-Molina",SIGMOD Conference,1999
70669,conf/vldb/LiCHPALHAY01,Cache Portal: Technology for Accelerating Database-driven e-commerce Web Sites,"W Li, K Candan, W Hsiung, O Po, D Agrawal, Q Luo, W Huang, Y Akca, C Yilmaz",VLDB,2001
70676,conf/vldb/BrownG01,A Prototype Content-Based Retrieval System that Uses Virtual Images to Save Space,"L Brown, L Gruenwald",VLDB,2001
70680,conf/sigmod/Seshadri99,"``Honey, I Shrunk the DBMS'': Footprint, Mobility, and Beyond (Panel)",P Seshadri,SIGMOD Conference,1999
70681,conf/vldb/MaedaT01,ACTIVIEW: Adaptive data presentation using SuperSQL,"Y Maeda, M Toyama",VLDB,2001
70682,conf/sigmod/EmbleyJN99,Record-Boundary Discovery in Web Documents,"D Embley, Y Jiang, Y Ng",SIGMOD Conference,1999
70683,conf/vldb/StillgerLMK01,LEO - DB2's LEarning Optimizer,"M Stillger, G Lohman, V Markl, M Kandil",VLDB,2001
70687,conf/sigmod/Suciu99,Managing Web Data,,,1999
70689,conf/sigmod/Chakrabarti99,Hypertext Databases and Data Mining,,,1999
70711,conf/sigmod/RajagopalanML98,Approximate Medians and other Quantiles in One Pass and with Limited Memory,"G Manku, S Rajagopalan, B Lindsay",SIGMOD Conference,1998
70721,conf/vldb/SadriZZA01,A Sequential Pattern Query Language for Supporting Instant Data Mining for e-Services,"R Sadri, C Zaniolo, A Zarkesh, J Adibi",VLDB,2001
70723,conf/sigmod/Whelan98,FileNet Integrated Document Management Database Usage and Issues,D Whelan,SIGMOD Conference,1998
70727,conf/sigmod/LahiriJJC98,"50,000 Users on an Oracle8 Universal Server Database","T Lahiri, A Josji, A Jasuja, S Chatterjee",SIGMOD Conference,1998
70728,conf/vldb/OConnellWG01,Collaborative Analytical Processing - Dream or Reality? (Panel abstract),"W O'Connell, A Witkowski, G Graefe",VLDB,2001
70729,conf/sigmod/Aulakh98,About Quark Digital Media System,K Aulakh,SIGMOD Conference,1998
70733,conf/vldb/ManolescuFK01,Answering XML Queries on Heterogeneous Data Sources,"I Manolescu, D Florescu, D Kossmann",VLDB,2001
70738,conf/sigmod/VossenW99,The WASA2 Object-Oriented Workflow Management System,"G Vossen, M Weske",SIGMOD Conference,1999
70741,conf/vldb/LuoN01,Form-Based Proxy Caching for Database-Backed Web Sites,"Q Luo, J Naughton",VLDB,2001
70752,conf/sigmod/UrhanFA98,Cost Based Query Scrambling for Initial Delays,"T Urhan, M Franklin, L Amsaleg",SIGMOD Conference,1998
70757,conf/vldb/CooperSFHS01,A Fast Index for Semistructured Data,"B Cooper, N Sample, M Franklin, G Hjaltason, M Shadmon",VLDB,2001
70761,conf/sigmod/DeshpandeRSN98,Caching Multidimensional Queries Using Chunks,"P Deshpande, K Ramasamy, A Shukla, J Naughton",SIGMOD Conference,1998
70763,conf/vldb/AgrawalCN00,Automated Selection of Materialized Views and Indexes in SQL Databases,"S Agrawal, S Chaudhuri, V Narasayya",VLDB,2000
70770,conf/sigmod/ZhaoDNS98,Simultaneous Optimization and Evaluation of Multiple Dimensional Queries,"Y Zhao, P Deshpande, J Naughton, A Shukla",SIGMOD Conference,1998
70772,conf/vldb/ChangG00,Approximate Query Translation Across Heterogeneous Information Sources,"K Chang, H Garcia-Molina",VLDB,2000
70779,conf/sigmod/GodfreySE98,Secure and Portable Database Extensibility,"M Godfrey, T Mayr, P Seshadri, T Eicken",SIGMOD Conference,1998
70790,conf/sigmod/GibbonsM98,New Sampling-Based Summary Statistics for Improving Approximate Query Answers,"P Gibbons, Y Matias",SIGMOD Conference,1998
70791,conf/sigmod/SarawagiTA98,Integrating Mining with Relational Database Systems: Alternatives and Implications,"S Sarawagi, S Thomas, R Agrawal",SIGMOD Conference,1998
70795,conf/sigmod/AvnurHLORRRW98,CONTROL: Continuous Output and Navigation Technology with Refinement On-Line,"R Avnur, J Hellerstein, B Lo, C Olston, B Raman, V Raman, T Roth, K Wylie",SIGMOD Conference,1998
70796,conf/vldb/ChoenniV00,Design and Implementation of a Genetic-Based Algorithm for Data Mining,S Choenni,VLDB,2000
70807,conf/sigmod/OlstonWACELSS98,DataSplash,"C Olston, A Woodruff, A Aiken, M Chu, V Ercegovac, M Lin, M Spalding, M Stonebraker",SIGMOD Conference,1998
