tid,id,title,authors,venue,year
71986,journals/tods/CasatiCPP99,Specification and Implementation of Exceptions in Workflow Management Systems,"F Casati, S Ceri, S Paraboschi, G Pozzi",ACM Trans. Database Syst.,1999
71996,journals/vldb/OzsuC98,Introduction (Special Issue on Multimedia Databases),"M Özsu, S Christodoulakis",VLDB J.,1998
71998,journals/vldb/JiangE98,Spatial and Temporal Content-Based Access to Hypervideo Databases,"H Jiang, A Elmagarmid",VLDB J.,1998
72009,journals/vldb/BerendtS00,Analysis of Navigation Behaviour in Web Sites Integrating Multiple Information Systems,"B Berendt, M Spiliopoulou",VLDB J.,2000
72013,journals/vldb/KornLKF00,Quantifiable Data Mining Using Ratio Rules,"F Korn, A Labrinidis, Y Kotidis, C Faloutsos",VLDB J.,2000
72014,journals/vldb/SheikholeslamiCZ00,WaveCluster: A Wavelet Based Clustering Approach for Spatial Data in Very Large Databases,"G Sheikholeslami, S Chatterjee, A Zhang",VLDB J.,2000
72015,journals/vldb/GibsonKR00,Clustering Categorical Data: An Approach Based on Dynamical Systems,"D Gibson, J Kleinberg, P Raghavan",VLDB J.,2000
72016,journals/vldb/KnorrNT00,Distance-Based Outliers: Algorithms and Applications,"E Knorr, R Ng, V Tucakov",VLDB J.,2000
72017,journals/vldb/TorpJS00,Effective Timestamping in Databases,"K Torp, C Jensen, R Snodgrass",VLDB J.,2000
72031,journals/vldb/MehrotraKS97,Concurrency Control in Hierarchical Multidatabase Systems,"S Mehrotra, H Korth, A Silberschatz",VLDB J.,1997
72045,journals/vldb/Han98,"Optimizing Relational Queries in Connection Hypergraphs: Nested Queries, Views, and Binding Propagations",J Han,VLDB J.,1998
72055,journals/vldb/FengYLH02,A template model for multidimensional inter-transactional association rules,"L Feng, J Yu, H Lu, J Han",VLDB J.,2002
72058,journals/vldb/SakuraiYUK02,Spatial indexing of high-dimensional data based on relative approximation,"Y Sakurai, M Yoshikawa, S Uemura, H Kojima",VLDB J.,2002
72062,journals/vldb/SaltenisJ02,Indexing of now-relative spatio-bitemporal data,"S Saltenis, C Jensen",VLDB J.,2002
72064,journals/vldb/MihailaRT02,Locating and accessing data repositories with WebSemantics,"G Mihaila, L Raschid, A Tomasic",VLDB J.,2002
72073,journals/vldb/CuiW03,Lineage tracing for general data warehouse transformations,"Y Cui, J Widom",VLDB J.,2003
72083,journals/vldb/LeeSC01,A graph-theoretic model for optimizing queries involving methods,"C Lee, C Shih, Y Chen",VLDB J.,2001
72098,journals/vldb/RamanRH00,Online dynamic reordering,"V Raman, B Raman, J Hellerstein",VLDB J.,2000
72120,journals/vldb/KellerB96,A Predicate-based Caching Scheme for Client-Server Database Architectures,"A Keller, J Basu",VLDB J.,1996
72127,journals/vldb/HarderR96,Access Path Support for Referential Integrity in SQL2,"T Härder, J Reinert",VLDB J.,1996
72129,journals/vldb/KashyapS96,Semantic and Schematic Similarities Between Database Objects: A Context-Based Approach,"V Kashyap, A Sheth",VLDB J.,1996
72150,journals/vldb/AgrawalAJL95,Ordered Shared Locks for Real-Time Databases,"D Agrawal, A Abbadi, R Jeffers, L Lin",VLDB J.,1995
72151,journals/vldb/C94c,"Title, Foreword, Preface to the Special Issue on Spatial Database Systems, Index Vol. 3",,,1994
72163,journals/vldb/DerrMP94,"The Glue-Nail Deductive Database System: Design, Implementation, and Evaluation","M Derr, S Morishita, G Phipps",VLDB J.,1994
72167,journals/vldb/WhangKW94,Dynamic Maintenance of Data Distribution for Selectivity Estimation,"K Whang, S Kim, G Wiederhold",VLDB J.,1994
72181,journals/sigmod/Liu03,Editor's Notes,L Liu,SIGMOD Record,2003
72199,journals/sigmod/MeersmanS02,Guest Editor's Introduction,,,2002
72203,journals/sigmod/GroskySF02,Emergent Semantics and the Multimedia Semantic Web,"W Grosky, D Sreenath, F Fotouhi",SIGMOD Record,2002
72218,journals/sigmod/BusslerFM02,A Conceptual Architecture for Semantic Web Enabled Web Services,"C Bussler, D Fensel, A Maedche",SIGMOD Record,2002
