tid,id,title,authors,venue,year
70809,conf/sigmod/LiuPTBBZBHY98,CQ: A Personalized Update Monitoring Toolkit,"L Liu, C Pu, W Tang, D Buttler, J Biggs, T Zhou, P Benninghoff, W Han, F Yu",SIGMOD Conference,1998
70812,conf/vldb/PardonA00,CheeTah: a Lightweight Transaction Server for Plug-and-Play Internet Data Management,"G Pardon, G Alonso",VLDB,2000
70823,conf/vldb/PottingerL00,A Scalable Algorithm for Answering Queries Using Views,"R Pottinger, A Levy",VLDB,2000
70826,conf/vldb/GoldsteinR00,Contrast Plots and P-Sphere Trees: Space vs. Time in Nearest Neighbour Searches,"J Goldstein, R Ramakrishnan",VLDB,2000
70827,conf/vldb/CareyKRLABFLOPQRSSUVWY01,The Propel Distributed Services Platform,"M Carey, S Kirsch, M Roth, B Linden, N Adiba, M Blow, D Florescu, D Li, I Oprencak, R Panwar, R Qi, D Rieber, J Shafer, B Sterling, T Urhan, B Vickery, D Wineman, K Yee",VLDB,2001
70828,conf/sigmod/ZaianeHLCC98,MultiMediaMiner: A System Prototype for Multimedia Data Mining,"O Zaďane, J Han, Z Li, S Chee, J Chiang",SIGMOD Conference,1998
70834,conf/sigmod/ParkKKLPC98,Xmas: An Extensible Main-Memory Storage System for High-Performance Applications,"J Park, Y Kwon, K Kim, S Lee, B Park, S Cha",SIGMOD Conference,1998
70839,conf/vldb/CatozziR01,Operating System Extensions for the Teradata Parallel VLDB,"J Catozzi, S Rabinovici",VLDB,2001
70842,conf/vldb/MorishimaKKT01,Enabling End-users to Construct Data-intensive Web-sites from XML Repositories: An Example-based Approach,"A Morishima, S Koizumi, H Kitagawa, S Takano",VLDB,2001
70844,conf/sigmod/GriffinH97,A Framework for Implementing Hypothetical Queries,"T Griffin, R Hull",SIGMOD Conference,1997
70845,conf/vldb/AmbiteKKMST01,The WorlInfo Assistant: Spatio-Temporal Information Integration on the Web,"J Ambite, C Knoblock, M Kolahdouzan, M Muslea, C Shahabi, S Thakkar",VLDB,2001
70851,conf/sigmod/KornackerMH97,Concurrency and Recovery in Generalized Search Trees,"M Kornacker, C Mohan, J Hellerstein",SIGMOD Conference,1997
70855,conf/vldb/ZhouLZLZJT01,VXMLR: A Visual XML-Relational Database System,"A Zhou, H Lu, S Zheng, Y Liang, L Zhang, W Ji, Z Tian",VLDB,2001
70859,conf/vldb/PapadiasT01,MV3R-Tree: A Spatio-Temporal Access Method for Timestamp and Interval Queries,"Y Tao, D Papadias",VLDB,2001
70863,conf/vldb/TanSHCR01,Walking Through a Very Large Virtual Environment in Real-time,"L Shou, J Chionh, Z Huang, Y Ruan, K Tan",VLDB,2001
70868,conf/vldb/SatheS01,Intelligent Rollups in Multidimensional OLAP Data,"G Sathe, S Sarawagi",VLDB,2001
70879,conf/vldb/MarronL01,On Processing XML in LDAP,"P Marrón, G Lausen",VLDB,2001
70880,conf/sigmod/Lassettre98,Olympic Records for Data at the 1998 Nagano Games,E Lassettre,SIGMOD Conference,1998
70881,conf/vldb/WiesnerK01,Hyperqueries: Dynamic Distributed Query Processing on the Internet,"A Kemper, C Wiesner",VLDB,2001
70886,conf/vldb/Huyn01,Scientific OLAP for the Biotech Domain,N Huyn,VLDB,2001
70892,conf/sigmod/BohrerBBCFHKKMNRRSUUW97,InfoSleuth: Semantic Integration of Information in Open and Dynamic Environments (Experience Paper),"R Jr., W Bohrer, R Brice, A Cichocki, J Fowler, A Helal, V Kashyap, T Ksiezyk, G Martin, M Nodine, M Rashid, M Rusinkiewicz, R Shea, C Unnikrishnan, A Unruh, D Woelk",SIGMOD Conference,1997
70910,conf/vldb/Brodie00,"Panel: Future Directions of Database Research - The VLDB Broadening Strategy, Part 2",M Brodie,VLDB,2000
70911,conf/vldb/Deshpande00,Linking Business to Deliver Value: A Data Management Challenge,A Deshpande,VLDB,2000
70932,conf/sigmod/LivnyRBCDLMW97a,DEVise: Integrated Querying and Visual Exploration of Large Datasets (Demo Abstract),"M Livny, R Ramakrishnan, K Beyer, G Chen, D Donjerkovic, S Lawande, J Myllymaki, R Wenger",SIGMOD Conference,1997
70934,conf/sigmod/HanKS97,GeoMiner: A System Prototype for Spatial Data Mining,"J Han, K Koperski, N Stefanovic",SIGMOD Conference,1997
70948,conf/vldb/LabioYCGW00,Performance Issues in Incremental Warehouse Maintenance,"W Labio, J Yang, Y Cui, H Garcia-Molina, J Widom",VLDB,2000
70962,conf/sigmod/SeshadriP97,PREDATOR: An OR-DBMS with Enhanced Data Types,"P Seshadri, M Paskin",SIGMOD Conference,1997
70966,conf/vldb/KoudasIM00,Identifying Representative Trends in Massive Time Series Data Sets Using Sketches,"P Indyk, N Koudas, S Muthukrishnan",VLDB,2000
70986,conf/sigmod/FernandezFKLS97,STRUDEL: A Web-site Management System,"M Fernandez, D Florescu, J Kang, A Levy, D Suciu",SIGMOD Conference,1997
70988,conf/sigmod/Chaudhuri97,Query Optimization at the Crossroads (Panel),S Chaudhuri,SIGMOD Conference,1997
70990,conf/sigmod/GoyalHKMSZ97,Picture Programming Project,"N Goyal, C Hoch, R Krishnamurthy, B Meckler, M Suckow, M Zloof",SIGMOD Conference,1997
71009,conf/sigmod/ShivakumarG97,Wave-Indices: Indexing Evolving Databases,"N Shivakumar, H Garcia-Molina",SIGMOD Conference,1997
71020,conf/sigmod/GrayHOS96,The Dangers of Replication and a Solution,"J Gray, P Helland, P O'Neil, D Shasha",SIGMOD Conference,1996
71026,conf/vldb/LeeL99,Unrolling Cycles to Decide Trigger Termination,"S Lee, T Ling",VLDB,1999
71041,conf/vldb/McHughW99,Query Optimization for XML,"J McHugh, J Widom",VLDB,1999
71047,conf/vldb/NaumannLF99,Quality-driven Integration of Heterogenous Information Systems,"F Naumann, U Leser, J Freytag",VLDB,1999
71060,conf/vldb/Blum99,Microsoft English Query 7.5: Automatic Extraction of Semantics from Relational Databases and OLAP Cubes,A Blum,VLDB,1999
71068,conf/vldb/SahuguetA99,Building Light-Weight Wrappers for Legacy Web Data-Sources Using W4F,"A Sahuguet, F Azavant",VLDB,1999
71069,conf/vldb/AcharyaGP99,Aqua: A Fast Decision Support Systems Using Approximate Query Answers,"S Acharya, P Gibbons, V Poosala",VLDB,1999
71072,conf/sigmod/SeshadriHPLRSSS96,Cost-Based Optimization for Magic: Algebra and Implementation,"P Seshadri, J Hellerstein, H Pirahesh, T Leung, R Ramakrishnan, D Srivastava, P Stuckey, S Sudarshan",SIGMOD Conference,1996
71086,conf/sigmod/Freeston95,A General Solution of the n-dimensional B-tree Problem,M Freeston,SIGMOD Conference,1995
71099,conf/sigmod/ChooOLCGBPS96,Prospector: A Content-Based Multimedia Server for Massively Parallel Architectures,"S Choo, W O'Connell, G Linderman, H Chen, K Ganapathi, A Biliris, E Panagos, D Schrader",SIGMOD Conference,1996
71102,conf/vldb/ChaudhuriG99,Evaluating Top-k Selection Queries,"S Chaudhuri, L Gravano",VLDB,1999
71109,conf/sigmod/Bernstein96,Repository System Engineering,,,1996
71117,conf/vldb/JermaineDO99,A Novel Index Supporting High Volume Data Warehouse Insertion,"C Jermaine, A Datta, E Omiecinski",VLDB,1999
71119,conf/sigmod/CherniackZ96,Rule Languages and Internal Algebras for Rule-Based Optimizers,"M Cherniack, S Zdonik",SIGMOD Conference,1996
71138,conf/sigmod/DohertyHR96,Structures for Manipulating Proposed Updates in Object-Oriented Databases,"M Doherty, R Hull, M Rupawalla",SIGMOD Conference,1996
71139,conf/sigmod/LoR96,Spatial Hash-Joins,"M Lo, C Ravishankar",SIGMOD Conference,1996
71147,conf/vldb/BaulierBGJGKKMMNNRSS98,DataBlitz: A High Performance Main-Memory Storage Manager,"J Baulier, P Bohannon, S Gogate, S Joshi, C Gupta, A Khivesera, H Korth, P McIlroy, J Miller, P Narayan, M Nemeth, R Rastogi, A Silberschatz, S Sudarshan",VLDB,1998
71154,conf/sigmod/FaloutsosL95,"FastMap: A Fast Algorithm for Indexing, Data-Mining and Visualization of Traditional and Multimedia Datasets","C Faloutsos, K Lin",SIGMOD Conference,1995
71155,conf/sigmod/DavisonG95,Dynamic Resource Brokering for Multi-User Query Execution,"D Davison, G Graefe",SIGMOD Conference,1995
71158,conf/sigmod/AdelbergGK95,Applying Update Streams in a Soft Real-Time Database System,"B Adelberg, H Garcia-Molina, B Kao",SIGMOD Conference,1995
71167,conf/vldb/AbiteboulMRVW98,Incremental Maintenance for Materialized Views over Semistructured Data,"S Abiteboul, J McHugh, M Rys, V Vassalos, J Wiener",VLDB,1998
71169,conf/vldb/GoldmanSVG98,Proximity Search in Databases,"R Goldman, N Shivakumar, S Venkatasubramanian, H Garcia-Molina",VLDB,1998
71174,conf/sigmod/Ivinskis95,High Availability of Commercial Applications,K Ivinskis,SIGMOD Conference,1995
71178,conf/sigmod/Gettys95,DIRECTV and Oracle Rdb: The Challenges of VLDB Transaction Processing,W Gettys,SIGMOD Conference,1995
71185,conf/sigmod/Olson95,Cover Your Assets,M Olson,SIGMOD Conference,1995
71193,conf/vldb/MiloZ98,Using Schema Matching to Simplify Heterogeneous Data Translation,"T Milo, S Zohar",VLDB,1998
71199,conf/sigmod/FegarasM95,Towards an Effective Calculus for Object Query Languages,"L Fegaras, D Maier",SIGMOD Conference,1995
71211,conf/sigmod/BettiniWBJ95,Semantic Assumptions and Query Evaluation in Temporal Databases,"C Bettini, X Wang, E Bertino, S Jajodia",SIGMOD Conference,1995
71218,conf/sigmod/SistlaW95,Temporal Conditions and Integrity Constraints in Active Database Systems,"A Sistla, O Wolfson",SIGMOD Conference,1995
71236,conf/vldb/BaumannDFRW99,Spatio-Temporal Retrieval with RasDaMan,"P Baumann, A Dehmel, P Furtado, R Ritsch, N Widmann",VLDB,1999
71244,conf/sigmod/Epstein95,Keynote Address,,,1995
71251,conf/sigmod/Bampahl95,Real World Requirements for Decision Support - Implications for RDBMS,S Bansal,SIGMOD Conference,1995
71253,conf/vldb/ShivakumarGC98,Filtering with Approximate Predicates,"N Shivakumar, H Garcia-Molina, C Chekuri",VLDB,1998
71261,conf/sigmod/Levine95,Order-of-Magnitude Advantage of TPC-C Though Massive Parallelism,C Levine,SIGMOD Conference,1995
71264,conf/sigmod/Deutsch95,Objects and SQL: Strange Relations? Panel,D Deutsch,SIGMOD Conference,1995
71266,conf/sigmod/Faloutsos95,Indexing Multimedia Databases (Tutorial),,,1995
71281,conf/vldb/RossS97,Fast Computation of Sparse Datacubes,"K Ross, D Srivastava",VLDB,1997
71282,conf/sigmod/MassariPSC95,QBI: Query By Icons,"A Massari, S Pavani, L Saladini, P Chrysanthis",SIGMOD Conference,1995
71300,conf/sigmod/Team95a,Paradise: A Database System for GIS Applications,P Team,SIGMOD Conference,1995
71303,conf/vldb/ZhangL97,Dynamic Memory Adjustment for External Mergesort,"W Zhang, P Larson",VLDB,1997
71306,conf/sigmod/KeimK95,VisDB: A System for Visualizing Large Databases,"D Keim, H Kriegel",SIGMOD Conference,1995
71309,conf/vldb/ChatziantoniouR97,Groupwise Processing of Relational Queries,"D Chatziantoniou, K Ross",VLDB,1997
71313,conf/sigmod/ZhangNBB94,Ensuring Relaxed Atomicity for Flexible Transactions in Multidatabase Systems,"A Zhang, M Nodine, B Bhargava, O Bukhres",SIGMOD Conference,1994
71314,conf/vldb/GoldmanW97,DataGuides: Enabling Query Formulation and Optimization in Semistructured Databases,"R Goldman, J Widom",VLDB,1997
71315,conf/sigmod/ImielinskiVB94,Energy Efficient Indexing on Air,"T Imielinski, S Viswanathan, B Badrinath",SIGMOD Conference,1994
71318,conf/vldb/WhiteheadSM97,GTE SuperPages: Using IR Techniques for Searching Complex Objects,"S Whitehead, H Sinha, M Murphy",VLDB,1997
71322,conf/vldb/SeidlK97,Efficient User-Adaptable Similarity Search in Large Multimedia Databases,"T Seidl, H Kriegel",VLDB,1997
71331,conf/sigmod/NybergBCGL94,AlphaSort: A RISC Machine Sort,"C Nyberg, T Barclay, Z Cvetanovic, J Gray, D Lomet",SIGMOD Conference,1994
71339,conf/vldb/RastogiS98,PUBLIC: A Decision Tree Classifier that Integrates Building and Pruning,"R Rastogi, K Shim",VLDB,1998
71346,conf/vldb/GehrkeRG98,RainForest - A Framework for Fast Decision Tree Construction of Large Datasets,"J Gehrke, R Ramakrishnan, V Ganti",VLDB,1998
71362,conf/vldb/SilversteinBMU98,Scalable Techniques for Mining Causal Structures,"C Silverstein, S Brin, R Motwani, J Ullman",VLDB,1998
71377,conf/vldb/ArunJ98,KODA - The Architecture And Interface of a Data Model Independent Kernel,"G Arun, A Joshi",VLDB,1998
71378,conf/sigmod/ConsensM94,Optimizing Queries on Files,"M Consens, T Milo",SIGMOD Conference,1994
71382,conf/vldb/CarinoO98,Plan-Per-Tuple Optimization Solution - Parallel Execution of Expensive User-Defined Functions,"F Carińo, W O'Connell",VLDB,1998
71384,conf/vldb/FlorescuLS98,Is Web-site Management a Database Problem?,"D Florescu, A Levy, D Suciu",VLDB,1998
71395,conf/sigmod/Hellerstein94,Practical Predicate Placement,J Hellerstein,SIGMOD Conference,1994
71399,conf/vldb/MaratheS97,A Language for Manipulating Arrays,"A Marathe, K Salem",VLDB,1997
71405,conf/vldb/BouganimFV96,Dynamic Load Balancing in Hierarchical Parallel Database Systems,"L Bouganim, D Florescu, P Valduriez",VLDB,1996
71414,conf/sigmod/BryanMCLG94,The MEDUSA Project: Autonomous Data Management in a Shared-Nothing Parallel Database Machine,"G Bryan, W Moore, B Curry, K Lodge, J Geyer",SIGMOD Conference,1994
71430,conf/sigmod/Kim94,UniSQL/X Unified Relational and Object-Oriented Database System,W Kim,SIGMOD Conference,1994
71433,conf/sigmod/Kulkarni94,Object-Oriented Extensions in SQL3: A Status Report,K Kulkarni,SIGMOD Conference,1994
71442,conf/sigmod/HanFHCC94,DBLearn: A System Prototype for Knowledge Discovery in Relational Databases,"J Han, Y Fu, Y Huang, Y Cai, N Cercone",SIGMOD Conference,1994
71459,conf/vldb/Klots96,Cache Coherency in Oracle Parallel Server,B Klots,VLDB,1996
71464,conf/vldb/LeeL96,Further Improvements on Integrity Constraint Checking for Stratifiable Deductive Databases,"S Lee, T Ling",VLDB,1996
71476,conf/vldb/BaralisPT97,Materialized Views Selection in a Multidimensional Database,"E Baralis, S Paraboschi, E Teniente",VLDB,1997
71490,conf/vldb/LlirbatST97,Using Versions in Update Transactions: Application to Integrity Checking,"F Llirbat, E Simon, D Tombroff",VLDB,1997
71502,journals/sigmod/NejdlSS03,Design issues and challenges for RDF- and schema-based peer-to-peer systems,"W Nejdl, W Siberski, M Sintek",SIGMOD Record,2003
71509,conf/vldb/ChavdaW97,Towards an ODMG-Compliant Visual Object Query Language,"M Chavda, P Wood",VLDB,1997
71512,conf/vldb/DesslochM97,Integrating SQL Databases with Content-Specific Search Engines,"S Deßloch, N Mattos",VLDB,1997
71514,journals/sigmod/Halevy03,Learning about data integration challenges from day one,A Halevy,SIGMOD Record,2003
71523,conf/vldb/HaasKWY97,Optimizing Queries Across Diverse Data Sources,"L Haas, D Kossmann, E Wimmers, J Yang",VLDB,1997
71531,conf/vldb/EicklerGK95,A Performance Evaluation of OID Mapping Techniques,"A Eickler, C Gerlhof, D Kossmann",VLDB,1995
71535,journals/sigmod/ChrysanthisSZ03,Report on the 4th International Conference on Mobile Data Management,,,2003
71540,journals/sigmod/MalaikaEM03,Standards for databases on the grid,"S Malaika, A Eisenberg, J Melton",SIGMOD Record,2003
71548,conf/vldb/Sullivan96,Tribeca: A Stream Database Manager for Network Traffic Analysis,M Sullivan,VLDB,1996
71555,conf/vldb/Baru96,Performance of Future Database Systems: Bottlenecks and Bonananzas,C Baru,VLDB,1996
71557,conf/vldb/GuptaM96,What is the Data Warehousing Problem? (Are Materialized Views the Answer?),"A Gupta, I Mumick",VLDB,1996
71567,journals/sigmod/ChongFTSYKDJJ03,A mapping mechanism to support bitmap index and other auxiliary structures on tables stored as primary B+-trees,"E Chong, J Srinivasan, S Das, C Freiwald, A Yalamanchi, M Jagannath, A Tran, R Krishnan, R Jiang",SIGMOD Record,2003
71568,conf/vldb/RahmM95,Dynamic Multi-Resource Load Balancing in Parallel Database Systems,"E Rahm, R Marek",VLDB,1995
71570,conf/vldb/BassiliadesV95,A Non-Uniform Data Fragmentation Strategy for Parallel Main-Menory Database Systems,"N Bassiliades, I Vlahavas",VLDB,1995
71578,journals/sigmod/CaleroPR03,Towards a database body of knowledge: a study from Spain,"C Calero, M Piattini, F Ruiz",SIGMOD Record,2003
71585,conf/vldb/BunemanDHOW95,A Data Transformation System for Biological Data Sources,"P Buneman, S Davidson, K Hart, G Overton, L Wong",VLDB,1995
71590,conf/vldb/YanL95,Eager Aggregation and Lazy Aggregation,"W Yan, P Larson",VLDB,1995
71595,journals/sigmod/Snodgrass03,ACM TODS in this Internet Age,R Snodgrass,SIGMOD Record,2003
71598,journals/sigmod/OConnellW03,Performing Jobs without Decompression in a Compressed Database System,"S O'Connell, N Winterbottom",SIGMOD Record,2003
71600,journals/sigmod/GottlobKP03,XPath Processing in a Nutshell,"G Gottlob, C Koch, R Pichler",SIGMOD Record,2003
71608,journals/sigmod/MarchiLPT03,Analysis of existing databases at the logical level: the DBA companion project,"F Marchi, S Lopes, J Petit, F Toumani",SIGMOD Record,2003
71616,conf/vldb/IlyasAE03,Supporting Top-k Join Queries in Relational Databases,"I Ilyas, W Aref, A Elmagarmid",VLDB,2003
71627,conf/vldb/LiuLBHTS03,Capturing Global Transactions from Multiple Recovery Log Files in a Partitioned Database System,"C Liu, B Lindsay, S Bourbonnais, E Hamel, T Truong, J Stankiewitz",VLDB,2003
71632,conf/vldb/Galindo-LegariaJWW03,Statistics on Views,"C Galindo-Legaria, M Joshi, F Waas, M Wu",VLDB,2003
71648,conf/vldb/ArionBCDMP03,Xquec: Pushing Queries to Compressed XML Data,"A Arion, A Bonifati, G Costa, S D'Aguanno, I Manolescu, A Pugliese",VLDB,2003
71667,conf/vldb/WangZL03,ATLAS: A Small but Complete SQL Extension for Data Mining and Data Streams,"H Wang, C Zaniolo, C Luo",VLDB,2003
71669,conf/vldb/SizovGT03,From Focused Crawling to Expert Information: an Application Framework for Web Exploration and Portal Generation,"S Sizov, J Graupmann, M Theobald",VLDB,2003
71671,conf/vldb/NieKH03,BibFinder/StatMiner: Effectively Mining and Using Coverage and Overlap Statistics in Data Integration,"Z Nie, S Kambhampati, T Hernandez",VLDB,2003
71673,conf/vldb/NicklasGS03,"NexusScout: An Advanced Location-Based Application on a Distributed, Open Mediation Platform","D Nicklas, M Großmann, T Schwarz",VLDB,2003
71674,conf/vldb/AbiteboulABBNM03,Schema-driven Customization of Web Services,"S Abiteboul, B Amann, J Baumgarten, O Benjelloun, F Ngoc, T Milo",VLDB,2003
71677,conf/vldb/Ioannidis03,The History of Histograms (abridged),Y Ioannidis,VLDB,2003
71690,conf/vldb/DiaoF03,Query Processing for High-Volume XML Message Brokering,"Y Diao, M Franklin",VLDB,2003
71691,conf/vldb/AggarwalHWY03,A Framework for Clustering Evolving Data Streams,"C Aggarwal, J Han, J Wang, P Yu",VLDB,2003
71692,conf/vldb/TengCY03,A Regression-Based Temporal Pattern Mining Scheme for Data Streams,"W Teng, M Chen, P Yu",VLDB,2003
71697,conf/vldb/FlescaFM03,On the minimization of Xpath queries,"S Flesca, F Furfaro, E Masciari",VLDB,2003
71699,conf/vldb/ZhouR03,Buffering Accesses to Memory-Resident Index Structures,"J Zhou, K Ross",VLDB,2003
71700,conf/vldb/LabrinidisR03,Balancing Performance and Data Freshness in Web Database Servers,"A Labrinidis, N Roussopoulos",VLDB,2003
71701,conf/vldb/ChenL03,VIPAS: Virtual Link Powered Authority Search in the Web,"C Lin, M Chen",VLDB,2003
71708,conf/vldb/HammadFAE03,Scheduling for shared window joins over data streams,"M Hammad, M Franklin, W Aref, A Elmagarmid",VLDB,2003
71711,conf/vldb/HeMYW03,WISE-Integrator: An Automatic Integrator of Web Search Interfaces for E-Commerce,"H He, W Meng, C Yu, Z Wu",VLDB,2003
71712,conf/vldb/LernerS03,"AQuery: Query Language for Ordered Data, Optimization Techniques, and Experiments","A Lerner, D Shasha",VLDB,2003
71714,conf/vldb/HuebschHLLSS03,Querying the Internet with PIER,"R Huebsch, J Hellerstein, N Lanham, B Loo, S Shenker, I Stoica",VLDB,2003
71721,conf/vldb/LeeHJT03,Supporting Frequent Updates in R-Trees: A Bottom-Up Approach,"M Lee, W Hsu, C Jensen, B Cui, K Teo",VLDB,2003
71723,conf/vldb/KraftSRM03,Coarse-Grained Optimization: Techniques for Rewriting SQL Statement Sequences,"T Kraft, H Schwarz, R Rantzau, B Mitschang",VLDB,2003
71724,conf/vldb/GolabO03,Processing Sliding Window Multi-Joins in Continuous Queries over Data Streams,"L Golab, M Özsu",VLDB,2003
71735,conf/vldb/NiermanJ02,ProTDB: Probabilistic Data in XML,"A Nierman, H Jagadish",VLDB,2002
71739,conf/vldb/PalpanasSCP02,Incremental Maintenance for Non-Distributive Aggregate Functions,"T Palpanas, R Sidle, R Cochrane, H Pirahesh",VLDB,2002
71742,conf/vldb/BenediktCFRZZ02,DTD-Directed Publishing with Attribute Translation Grammars,"M Benedikt, C Chan, W Fan, R Rastogi, S Zheng, A Zhou",VLDB,2002
71751,conf/vldb/Fox02,Toward Recovery-Oriented Computing,A Fox,VLDB,2002
71764,conf/vldb/ShengBDM02,SELF-SERV: A Platform for Rapid Composition of Web Services in a Peer-to-Peer Environment,"Q Sheng, B Benatallah, M Dumas, E Mak",VLDB,2002
71766,conf/vldb/ShegalovWBL02,EOS: Exactly-Once E-Service Middleware,"G Shegalov, G Weikum, R Barga, D Lomet",VLDB,2002
71768,conf/vldb/LiHKSPAC02,Issues and Evaluations of Caching Solutions for Web Application Acceleration,"W Li, W Hsiung, D Kalashnikov, R Sion, O Po, D Agrawal, K Candan",VLDB,2002
71772,conf/vldb/AdityaBCHNS02,BANKS: Browsing and Keyword Searching in Relational Databases,"B Aditya, G Bhalotia, S Chakrabarti, A Hulgeri, C Nakhe, P Parag, S Sudarshan",VLDB,2002
71774,conf/vldb/SantiniG02,GeMBASE: A Geometric Mediator for Brain Analysis with Surface Ensembles,"S Santini, A Gupta",VLDB,2002
71778,conf/vldb/HsuLOMTX02,Advanced Database Technologies in a Diabetic Healthcare System,"W Hsu, M Lee, B Ooi, P Mohanty, K Teo, C Xia",VLDB,2002
71792,conf/vldb/Wadler01,"Et tu, XML? The downfall of the relational empire (abstract)",P Wadler,VLDB,2001
71810,conf/vldb/WeikumMHZ02,Self-tuning Database Technology and Information Services: from Wishful Thinking to Viable Engineering,"G Weikum, A Mönkeberg, C Hasse, P Zabback",VLDB,2002
71813,conf/vldb/ConradGJM02,Database Selection Using Actual Physical and Acquired Logical Collection Resources in a Massive Domain-specific Operational Environment,"J Conrad, X Guo, P Jackson, M Meziou",VLDB,2002
71819,conf/vldb/AgrawalK02,Watermarking Relational Databases,"R Agrawal, J Kiernan",VLDB,2002
71824,conf/vldb/ManegoldBK02,Generic Database Cost Models for Hierarchical Memory Systems,"S Manegold, P Boncz, M Kersten",VLDB,2002
71829,conf/vldb/KaushikBNS02,Updates for Structure Indexes,"R Kaushik, P Bohannon, J Naughton, P Shenoy",VLDB,2002
71830,conf/vldb/ChienVZTZ02,Efficient Structural Joins on Indexed XML Documents,"S Chien, Z Vagena, D Zhang, V Tsotras, C Zaniolo",VLDB,2002
71851,conf/vldb/AnanthakrishnaCG02,Eliminating Fuzzy Duplicates in Data Warehouses,"R Ananthakrishna, S Chaudhuri, V Ganti",VLDB,2002
71862,journals/tods/GoldmanL94,Quorum Consensus in Nested Transaction Systems,"K Goldman, N Lynch",ACM Trans. Database Syst.,1994
71870,journals/tods/ShashaLSV95,Transaction Chopping: Algorithms and Performance Studies,"D Shasha, F Llirbat, E Simon, P Valduriez",ACM Trans. Database Syst.,1995
71875,journals/tods/GuoSW96,Solving Satisfiability and Implication Problems in Database Systems,"S Guo, W Sun, M Weiss",ACM Trans. Database Syst.,1996
71883,journals/tods/RaschidL96,Semantics for Update Rule Programs and Implementations in a Relational Database Management System,"L Raschid, J Lobo",ACM Trans. Database Syst.,1996
71884,journals/tods/Kuo96,Model and Verification of a Data Manager Based on ARIES,D Kuo,ACM Trans. Database Syst.,1996
71885,journals/tods/CiacciaTZ96,Declustering of Key-Based Partitioned Signature Files,"P Ciaccia, P Tiberio, P Zezula",ACM Trans. Database Syst.,1996
71912,journals/tods/ScioreSR94,Using Semantic Values to Falilitate Interoperability Among Heterogeneous Information Systems,"E Sciore, M Siegel, A Rosenthal",ACM Trans. Database Syst.,1994
71916,journals/tods/RosenthalR94,Tools and Transformations - Rigorous and Otherwise - for Practical Database Design,"A Rosenthal, D Reiner",ACM Trans. Database Syst.,1994
71921,journals/tods/WinslettSQ94,Formal Query Languages for Secure Relational Databases,"M Winslett, K Smith, X Qian",ACM Trans. Database Syst.,1994
71926,journals/tods/KossmannS00,Iterative dynamic programming: a new class of query optimization algorithms,"D Kossmann, K Stocker",ACM Trans. Database Syst.,2000
71935,journals/tods/KossmannFDA00,Cache investment: integrating query optimization and distributed data placement,"D Kossmann, M Franklin, G Drasch",ACM Trans. Database Syst.,2000
71938,journals/tods/BaralisW00,An algebraic approach to static analysis of active database rules,"E Baralis, J Widom",ACM Trans. Database Syst.,2000
71940,journals/tods/EiterLLS01,Probabilistic object bases,"T Eiter, J Lu, T Lukasiewicz, V Subrahmanian",ACM Trans. Database Syst.,2001
71947,journals/tods/Suciu02,Distributed query evaluation on semistructured data,D Suciu,ACM Trans. Database Syst.,2002
71952,journals/tods/KotidisR01,A case for dynamic view management,"Y Kotidis, N Roussopoulos",ACM Trans. Database Syst.,2001
71955,journals/tods/FranklinCL97,Transactional Client-Server Cache Consistency: Alternatives and Performance,"M Franklin, M Carey, M Livny",ACM Trans. Database Syst.,1997
71956,journals/tods/EiterGM97,Disjunctive Datalog,"T Eiter, G Gottlob, H Mannila",ACM Trans. Database Syst.,1997
71959,journals/tods/AmmannJR97,Applying Formal Methods to Semantic-Based Decomposition of Transactions,"P Ammann, S Jajodia, I Ray",ACM Trans. Database Syst.,1997
71963,journals/tods/LiuHD98,Multiview Access Protocols for Large-Scale Replication,"X Liu, A Helal, W Du",ACM Trans. Database Syst.,1998
71975,journals/tods/CastanoAFP98,Conceptual Schema Analysis: Techniques and Applications,"S Castano, V Antonellis, M Fugini, B Pernici",ACM Trans. Database Syst.,1998
71976,journals/tods/BertinoBFS98,An Access Control Model Supporting Periodicity Constraints and Temporal Reasoning,"E Bertino, C Bettini, E Ferrari, P Samarati",ACM Trans. Database Syst.,1998
71979,journals/tods/BozkayaO99,Indexing Large Metric Spaces for Similarity Search Queries,"T Bozkaya, Z Özsoyoglu",ACM Trans. Database Syst.,1999
71980,journals/tods/Alagic99,Type-Checking OQL Queries In the ODMG Type Systems,S Alagic,ACM Trans. Database Syst.,1999
71981,journals/tods/YanG99,The SIFT Information Dissemination System,"T Yan, H Garcia-Molina",ACM Trans. Database Syst.,1999
