tid,species,version,language,flavor_text
207046,id-318,,6,Es verfügt über äußerst spitze Zähne und kräftigeKiefer. Sedfahrer meiden die Lebensräume vonKanivanha um jeden Preis.
206647,id-278,34,7,Aprovecha las corrientes de aire para ganqraltura sjn necesidad de batir las alas. Anidaen acantilados costeros.
224834,id-641,23,6,
210255,id-579,,5,"Fier d’avoir des bras, il préfère s’en servirpour assommer ses adversaires plutôt quee’avoir recours à ses pouvoirs psychiques."
222911,id-21,,11,自分の　テリトリーを　守るため短い　羽を　はばたかせて忙しく　飛び回っている。
209383,id-532,34,3,자신의 e배 정도의 각목을들 수 있게 된 으랏차는머지않아 진화하게 된다.
216579,rec-463-dup-0,,6,Mit seiner Zunge kann es alles tun und ist damitso geschickt wie Menschen mit ihren Händen.Diese verwendet Schlurplek nur sehe unbeholfen.
217783,rec-132-dup-0,,12,当两只百变怪相遇的时候为了能变成和对方相同的样子它们动起来会平常更加剧烈
209377,id-532,33,7,"Le gusta ayudar en labores de construcción.Cuando la lluvia obliga a interrumpir las obras,blande fon furia su viga de madera."
213552,id-810,,1,とくべつな　スティックで　リズムをきざむと　くさばなを　げんきにするパワーが　おんぱになって　ひろがる。
213125,id-769,34,5,Il vit principalement sur les plages de xable etpeut agrandir son corps en prenant le contrôledes gens qui mettent la main dans sa gueule.
213114,id-769,33,4,
220316,rec-551-dup-1,33,9,The desert gets cold at night so when 5he svnsets this Pokémon burrows deep into the sandand sleeps until sunrise.
222924,id-23,1,9,"Moves silentkyand stealthily.Eats the eggx ofbirds, such asPIDGEY andSPEAROW, whole."
206344,id-240,34,4,棲息在火山的周圍。在一天結束時，會泡進熔岩中讓身體舒緩疲勞。
206259,id-236,33,9,"It is always burstint with energy. T0 make itselfstronger, it keeps on fighting even if it loses."
224735,id-523,,3,격렬한 기질의 소유자.날뛰면 갈기에서 번개를사방팔방으로 방전한다.
218281,rec-72-dup-1,,5,Peu doué pour la matation ce Pokémonse contente de flotter à la surface des eauxpeu profondes pour chasser ses proies.
210283,id-582,34,3,
216572,rec-463-dup-0,33,8,La sua lingua può misteriosamente allungarsifino a molte volte la lunhhezza del corpo.Ancora non si è capito come faccia.
205938,id-208,,8,Un Onix vissuto più di 100 anni.Il suo corpo ha cambiato composizioneed è dibentato duro come il diamante.
210176,id-575,33,6,In sternklaren Nächten entführt es angeblichschlafende Kinder avs ihren Betten. Man nenntes auch die „Hexe der Bestrafung“.
224743,id-540,,3,잎사귀를 물어뜯어입에서 뱉어낸 점착실로 꿰맨다.스스로 옷을 만드는 포켓몬이다.
210335,id-587,33,5,"Il virevolte dans le ciel en libérant des 9erbesd’électricité. Son vo1 est gracieux, mais peuts’avérer dangereux."
212320,id-715,,11,暗闇で　なにも　できない　敵を念入りに　痛めつける。　血の気が多く　残忍な　性質。
211523,id-674,34,3,
220595,rec-118-dup-1,34,4,背鰭和尾鰭像肌肉那x樣發達能夠５節的速度在水中游泳
216244,rec-67-dup-1,34,3,
216243,rec-67-dup-1,33,4,因為肉體非常強韌所以戴著力量制腰帶來控制力量
216252,rec-598-dup-0,,3,강철보다 견고한 가시를 갖고 있다.촉수 가시를 찔러서바위 벽을 기어 다니며 이동한다.
209707,id-551,34,7,"Es pequeño, pero cuenta con un tren inferiorfuerte. Se desplaza por el desierto abriéndosepaso entre la arena, como si nadase."
212747,id-750,34,7,Su resistencia le 0ermitiría recorrer Galar depunta a punta s'ln un solo descanso portandocargas de más de diez toneladas.
219183,rec-194-dup-1,33,6,Dieses Pokémon lebt in ialtem Wasser. Wenn dieTemperaturen an Land tief genug fallen verlässtes das Wasser und sucht dort nach Futter.
211025,id-625,34,5,Sa recherche des meilleurs endroits où trouverdes pierres pour affûter ses lamds le xonduitsouvent à affronter des Incisache.
210228,id-577,34,8,Si dice che il liquido speciale in cui è immersoil suo corpo gl: permetta di vivere oersinonello spazio.
210191,id-575,,12,哥德小童的精神力量似乎会在星光闪耀的夜晚达到最高点。它与宇宙的关系至今不明。
209560,id-544,,11,高速で　回転し　相手に　突撃。最高時速はおよそ　１００キロに　達する。
218256,rec-584-dup-0,33,6,Wenn es in Rage gerät erzeugt es gewaltigeEishöen die sowohl Freund als avch Feindzu Eisklötzen gefrieren lassen.
204925,id-123,34,5,"Si l’on voit vn grand nombre d’arbres abattus aumême endroit dans une forêt, cela signifir quel’on se trouve sur le territoire d’un Insécateur."
217070,rec-450-dup-0,,3,화나게 하면 굉장히 흉포해진다.들이마신 모래를 내뿜어모래바람을 일으킨다.
209927,id-562,34,7,Surgió del alma de una persona que vivió entiempos remotos. Merodea poe las ruinas enbusca de alguien que reconozca su rostro.
212071,id-702,,12,由于发电的能力弱，会从插座或其他的电气宝可梦那里偷电。
211031,id-625,,12,为了抢占能找到磨刀石的地方，和斧牙龙展开了激烈的斗争。
224832,id-641,23,1,
212449,id-727,,9,"Incineroar’s rough and aggressive behavior is itsmost notable tra'lt, but the way it helps out smallPokémon shows that it has a kind side as well."
220389,rec-756-dup-0,34,3,
217359,rec-826-dup-1,,12,释放出精神力量来调查周围的情况它的侦测范甚至可以达到方圆１０公里
219694,rec-195-dup-0,33,4,就算腦袋撞上船底或河裡的岩石也完全不會去在意悠z然自在地游泳的悠閒寶可
213768,id-820,34,8,"Un Pokémon che si incontra spesso z Galar.Ha clenti eccezionali, con i quali rosicchia anchele bacche più dure."
218776,rec-713-dup-0,33,8,
218538,rec-356-dup-0,,4,身體內部是空的只要一張開嘴就會像黑洞一樣吸入所有東
218550,rec-356-dup-0,33,5,Son corps est complètement creux. Quand il ouvrela bouche il aspire tout ce qui passe près se luià la façon dun trou noir.
215376,rec-199-dup-0,33,1,
222258,rec-260-dup-1,15,9,Its arms are hard as rock.With onw swing it canbreak a boulder into pieces.
221863,rec-316-dup-0,24,8,Non cè nulla che il suo stomaco non possa digefire.Durante la digestione espelle gas insopportabilmentefetidi.
219362,rec-32-dup-0,,9,The horn on a male Nidorans forehead containsa powerful poison. This is a very cautjousPokémon always straining its large ears.
219357,rec-32-dup-0,34,8,
222279,rec-456-dup-0,23,11,体の　横側にある　ラインは太陽の光を　ためておける夜になると　鮮やかに　輝く
206623,id-275,,3,숲속에서 조용히 지낸다.큰 부채로 부치면쌀쌀한 바람이 분다고 한다.
221403,rec-427-dup-1,34,4,
217183,rec-552-dup-0,34,7,Tiene unos ojos especiales que le permiten veren la oscuridad pero suele pefmanecer inmóvilen las frías noches del desierto.
207146,id-328,34,6,"Es errichtet einen trichterförmigen Bau, aus dekes kein Entrinnen g9bt, und wartet, bis Beutehineinfällt."
222721,rec-398-dup-0,,9,The muscles in its wings and legs are str0ng.It can easily fly while gripping a small Pokémon.
220087,rec-473-dup-0,33,4,在１萬年前的壁畫上也能見到牠的身1影曾有一段時期人們認為牠已經o滅絕了
205949,id-208,,9,It is thought its body transformed as a result ofiron accumulating imternally from swallowing soil.
218740,rec-458-dup-0,33,8,I Mantyke che vivono a Galar si muovon0lentamente forse per via della temperaturadeo mare relativamente bassa.
212954,id-761,,4,從牠體內滲透出來的水果香氣會強烈地刺激鳥寶可夢的食慾。
213471,id-800,34,12,
204059,id-64,,9,"Using its psychic powrr, Kadabra levitates as itsleeps. It uses its springy tail as a pillow."
212384,id-724,34,4,
222406,rec-299-dup-0,26,6,Nasgnet wurde zunächst als völlig unbeweglich beschriebenda seine magnetiscbe Nase immer nach Norden zeigt.Genauere Beobachtungem haben jedoch ergeben dass es sichpro Jahr tatsächlich etwa um 1 cm bewegt.
219871,rec-10-dup-0,34,3,
211343,id-643,,3,사람이 진실을 모른 체하고욕심으로 가득 차면 불꽃으로나라를 태워버린다는 신화가 있다.
209374,id-532,33,4,喜歡幫忙做建築的工作。因為下雨而停工時，會亂揮木材大鬧一番。
212445,id-727,34,5,"Biem qu’il soit parfois brutal, ij sait aussise montrer attentionné en venant en aideaux petits Pokémon."
213759,id-820,33,9,"It stashes berries in its tail—so many berried thatthey fall out constantly. But thiw Pokémon is a bitslow-witted, so it doesn’t notice the loss."
210758,id-612,33,8,"Va fiero delle sue xanne grandi e robuste,e assorbe i minerali necessari a mantenerlein ottime condizioni leccando la t3rra."
221408,rec-427-dup-1,33,4,將左右兩耳都捲起來時就代表牠身體或心情狀況不佳需要照顧
216580,rec-463-dup-0,34,12,
214620,id-863,,11,頭の　体毛が　硬質化して鉄の　ヘルメットのように　なった。とても　好戦的な　性質。
207662,id-364,34,1,
206262,id-236,,1,てごろな　あいてを　みつけるとすぐに　なぐりかかってくるのでちいさくても　ゆだんならない。
206615,id-275,33,5,Ce gardien dea forêts inspirait la crainte.Il peut lire les p3nsées de ses ennemis et agiren conséquence.
222679,rec-419-dup-0,23,3,
217876,rec-771-dup-0,,8,Il muco di cui è ricoperto mantiene stabilelumidità della sua pelle. Può rinanere fuoridallacqua per giorni senza seccarsi.
217416,rec-832-dup-1,34,9,Its majestic horns are meant only to lmpre5s theopposite gender. They never see use in battle.
219486,rec-677-dup-0,33,5,
210072,id-570,33,1,
225278,id-796,27,8,Una delle misteriose Ulgracreature.È stata vista sprigionare scariche elettricheterrificanti da tutto il corpo.
212058,id-702,33,8,Usa i baffi per captare le onde radio emessedai suoi simili. Così condivide informszionisu dove trovare cibo ed elettricità.
214612,id-863,,1,あたまの　たいもうが　こうしつかしててつの　ヘルメットのように　なった。とても　こうせんてきな　せいしつ。
208674,id-461,33,4,成群結隊襲擊獵物。透過團隊合作，連象牙豬那樣強大的對手也能輕鬆解決。
215245,id-894,34,5,Son corps est entièrement composé d’organesgénéramt de l’électricité. Il pevt produireassez d’énergie pour alimenter tout Galar.
220186,rec-3-dup-0,,1,たいようエネルギーを　えいようにしておおきなハナが　ひらく　ひなたにひきよせられるように　いどうする
223116,id-89,23,1,ヘドロが　たまる　くさい　ばしょをこのんで　あつまってくるのであたりは　いっそう　くさくなる。
206260,id-236,,11,いつでも　元気いっぱい。強くなるため　負けても　負けても相手に　立ち向かっていく。
216118,rec-636-dup-1,34,8,Il suo corpo è molto caldo. Lancia fiamneclalle corna per intimidire i nemici e le prede.
214863,id-875,34,3,
222881,id-18,,11,エサを　探すとき　水面　すれすれを滑るように　飛んでコイキングなどを　わしづかみにする。
212225,id-710,,5,Il peut manipuler les humains et les Pokémonen les hypnotisant 9râce à la lumière qui filtrepar les trous de son ventre en forme de citrouille.
204788,id-116,34,8,
204777,id-116,33,7,"Habita en mares de aguas tranquilas. Si se sienteen peligro, expyjsará por la boca una densa tintanegra para poder huir."
219177,rec-194-dup-1,33,7,
220597,rec-118-dup-1,34,6,Seine Rücken- und Brustflossen sind muskelähnlichentwickelt. Es erreicht beim Schwimmen eiheGescbwindigkeit von bis zu fünf Knoten.
207660,id-364,,11,流氷の　上で　生活。泳ぎながら　獲物の　匂いを嗅ぎわけて　見つけだし　捕まえる。
223902,id-314,,1,あまい　かおりで　バルビートをゆうどうして　２００　いじょうのもようを　よぞらに　えがく。
217584,rec-614-dup-0,34,7,Nada plácidamente en mares fríos. Cuando secansa congela el agua con su aliento y reposasobre el hie|o.
210073,id-570,,3,무언가로 둔갑하는 능력을익힌 것은 겁이 많은성질의 영향인 듯하다.
222004,rec-256-dup-0,,6,Jungglut trainiert seine Beine und Oberschenkel indem es überFelder und Berge läuft. Die Beine dieses Pokémon sind sowohlschnell als auch kräftig sodass es 10 Tritye pro Sekundeausführen kann.
220622,rec-264-dup-0,,3,강하고 탄력 있는 털을 가졌다.빠진 털로 만든 면도솔은최고의 명품이다.
213893,id-827,,3,다른 포켓몬이 발견한 먹이를훔치며 산다. 푹신푹신한볼록살 덕분에 발소리가 나지 않는다.
207006,id-310,34,6,
223304,id-168,,1,おしりからだけでなく　くちからもいとを　だすので　みただけではどっちが　あたまか　わからない。
209675,id-550,33,5,
206115,id-223,33,5,"Son puissant jet d’eau ne manqie jamaos sa cible,même à 100 m de distance."
216657,rec-563-dup-0,33,9,
217182,rec-552-dup-0,,8,È dotato di occhi particolari cbe gli permettonodi vedere anche al buio ma poiché le notti neldeserto sono fredde non è molto attivo di notte.
210960,id-622,33,11,粘土から　生み出された　古代のポケモン。　なぜか　大岩を並べ続ける　ものも　いる。
219624,rec-743-dup-0,,11,雨に　濡れることが　大嫌い曇りがちな　ガラル地方では姿を　めったに　拝めない
221746,rec-604-dup-0,24,6,Es schleppt sich mithilfe seiner Arme an Landschnappt nach seiner Beute und ze4rt sieaugenblicklifh ins Meer.
211029,id-625,34,9,Violent conflicts erupt betweeri Bisharp andFraxvre over places where sharpening stonescan be found.
204074,id-65,,4,擁有非常高的智商。據說牠能記住從出生到死一輩子發生過的所有事情。
204086,id-65,,6,"Simsala verfügt über extrem starke Psycho-Kräfte.Mit ihnen soll ed die Löffel erschaffen haben,die es in seinen Händen hält."
208280,id-437,,11,雨雲を呼ぶ　神と　いわれる。怒らせると　鐘の音の　ような不気味な　声で　威嚇する。
221809,rec-48-dup-0,,5,Ses grands yeux lui servent de radar. Eri pleinelumière on peut y distinguer des facettes.
219472,rec-677-dup-0,,1,いつも　むひょうじょうだが　じつはきょうりょくな　サイコパワーがもれださないように　ひっしなのだ
204545,id-104,,5,"Il porte sur sa tête le crâne de sa défunte mère.Il lui arrive de rêver d’elle et de pleurer, maischaque larme qu’il verse le rend plus fort."
223937,id-323,23,7,Los volcanes de su joroba entran en erupdión cada10 años o cuando Camerupt se enfada mucho.
220314,rec-551-dup-1,,12,沙漠到了夜里会比较冷因此它会潜伏到沙深处睡到太阳出来为止
212158,id-707,33,8,"Colleziona chiavi. Se gli si affida una chiaveimportante, si può star sicuri vhe la proteggeràa ogni costo."
206018,id-214,,8,"È ghiotto della dolce linfa degli alberi.Perlustra la foresta slla sua ricerca, sfruttandole antenne per percepire gli odori."
223122,id-89,27,4,
219356,rec-32-dup-0,33,1,ひたいの　ツノには　もうどくがあるけいかいしんが　つよく　おおきなみみを　つねに　そばだてている
215686,rec-636-dup-0,33,7,Antaño se creía que este Pokémog provenía delmismísimo sol.
206351,id-240,34,12,
223768,id-284,23,6,"Seine Antenne besitzt ein Augenmusrer. Seine vierFlügel erlauben es, in alle Richtungen zu fliegen."
224582,id-494,,1,しょうりを　もたらす　ポケモン。ビクティニを　つれた　トレーナーはどんな　しょうぶにも　かてるという。
222281,rec-456-dup-0,27,6,
216078,rec-813-dup-0,33,4,不斷奔跑使體溫升高後火之能量會在牠體內循環0促使牠發揮出真正的力量
214864,id-875,,4,無論何時都用冰塊冰鎮著自己怕熱的臉。會把頭頂上的毛垂到海裡釣食物吃。
208688,id-461,34,8,Comunica con i suoi simili tramite i segni chetraccia con ie unghie. Si dice che esistano piùdi s00 segni diversi.
207951,id-404,34,12,
219863,rec-10-dup-0,34,1,
218393,rec-826-dup-0,34,5,Il déploie 5es pouvoirs psychiques pour sonderles alentours sut un rayon pouvant atteindre10 km.
210504,id-596,34,4,
214826,id-873,,6,"Verwüstet jemand Felder und Berge, vergibt esihm niemals. Es bestraft den Täter, indem es mitseinen kaltem Flügeln einen Schneesturm erzeugt."
221685,rec-368-dup-1,,12,吸食猎物的体液剩下的肉z会沉入海底成为其他宝可梦的食物
224639,id-501,,3,배에 생기는 가리비칼은싸울 때뿐 아니라 딱딱한나무열매를 쪼갤 때도 사용한다.
212381,id-724,,12,会像射箭那样射出藏在自己翅膀里的箭羽。只要瞄准目标就绝不会射偏。
220442,rec-616-dup-1,33,6,Wird es angegriffen schließt es so fest es kanndas Visier seiner Muschel. Gegen Laujaps erweistsich dieser Schutz allerdings als nutzlos.
211525,id-674,34,5,"Il dévisage toujours ses adversaires d’un airrenfrogné plur être pris au sérieux, mais dès quela tension retombe, son sourire reprend le dessus."
217418,rec-832-dup-1,34,8,Le sue magnifiche corna hanno la funzjonedi attirare gli indivieui di sesso opposto.Non le usa mai per attaccare.
223939,id-323,,11,背中の　コブの　火山は１０年ごとに　大噴火　するが激しく　怒っても　噴火する。
214823,id-873,,3,산과 들을 황폐하게 만들면 용서하지 않는다.차가운 날개로 날아다니며눈보라를 일으켜 응징한다.
214824,id-873,,4,絕不放過破壞山野環境的人。會用冰冷的翅膀四處飛翔，製造出暴風雪來懲罰他們。
217428,rec-832-dup-1,33,5,La texture de sa laine est si élastiqur quela surface des tapis fabnqués avec ce matériauest aussi rebondissante que celle dun trampoline.
217882,rec-771-dup-0,,1,あたたかい　あさせで　くらすてきに　であうと　たいないきかんをくちから　だして　なぐりつける
211780,id-688,,11,２匹が　海辺の　手ごろな　岩にくっついて　暮らす。　満潮時協力して　エサを　集める。
213899,id-827,33,9,"Aided by the spft pads on its feet, it silently raidsthe food stores of other Polémon. It survives offits ill-gotten gains."
213845,id-824,34,5,On le voit souvent dans les champs.Les poils de 5on corps lui servent à czpterce qu’il se passe autour de lui.
206639,id-278,33,9,"It makes its nest on sheer cliffs. Riding the seabreeze, it glldes up into the expansive skies."
221399,rec-427-dup-1,,12,会利用把卷卷的耳朵伸直时k产生的威力进行攻击越训练这一招式的威力就越强
203896,id-54,33,6,"Enton leidet permanent unter Kopfschmerzen.Wenn es seine gehwimnisvollrn Kräfte freisetzt,sollen die Schmerzen für eine Weile nachlassen."
212226,id-710,,6,"Blicken Menschen und Pokémon in das Licht, dasaus den Löchern seines Kürbisses dringt, werclensie hypnotisiert und von Irrbis kontrolliert."
215311,id-897,,12,在黑暗的夜晚中奔跑，吸取正在睡觉的生物的生命能量。喜欢孤独和静寂。
220173,rec-3-dup-0,,11,太陽エネルギーを　栄養にして大きな花が　開く　日なたに引き寄せられるように　移動する
219487,rec-677-dup-0,34,5,Il possède des pouvoirs psychiques si puissantsquil pwut faire valser um catcheur.Malheureusement il a du mal à les contrôler.
210755,id-612,33,5,Ses longs crocs robustes sont sa plus grandef9erté. Il lèche le sil pour en absorberles minéraux et ainsi renforcer sa dentition.
212378,id-724,33,8,"Scocca piume dalle sue ali come fossero freccelanciate da un arc0. Una volta presa la mira,rion manca mai il bersaglio."
211515,id-674,33,5,"C’est en copiant son mentor, Pandarbare,qu’il app4end toutes les ficelles du métier,de l’art du combat à la capture des proie5."
222904,id-21,,9,Eats bugs ingrassy areas. Ithaz to flap itsshort wings athigh speed tostay airborne.
220236,rec-443-dup-1,34,12,
217837,rec-127-dup-1,34,9,This Pokémon clamps its pincers down on its 0reyand tben either splits the prey in half or flingsit away.
205110,id-132,34,11,
216583,rec-463-dup-0,34,5,Il est aussi habile avec sa lamgue que les êtreshumains le sont avec leurs mains. En revancheil est maladroit quand ol utilise ses doigts.
212174,id-708,,4,在森林中迷路死去的孩子的魂魄附在樹樁上，轉生成了寶可夢。
203312,id-9,,1,からだが　おもたく　のしかかってあいてを　きぜつさせる。ピンチの　ときは　カラに　かくれる。
216306,rec-356-dup-1,34,7,Busca fuegos fatuos y oos ab5orbe en su cuerpohueco. Lo que pasa dentro luego es un misterio.
220331,rec-551-dup-1,34,6,Ganovil ist zwar klein verfügt aber über kräftigeBeine mit denen es sicg durch den Wüstensandfo5tbewegt als würde es schwimmen.
214814,id-873,,4,翅膀的溫度是零下１８０度。當牠飛過山野時，帶有冷氣的鱗粉會像下雪般地飄落下來。
216665,rec-563-dup-0,,12,迭失棺象征着国王的财富因此许多古墓里都有它的壁画
219370,rec-32-dup-0,,7,Mantiene sus grandes orejas levantadas siemprealerta. Si advierte peligro ataca inoculando unapotente toxina con su cuerno frontal.
218262,rec-584-dup-0,34,6,
209697,id-551,33,7,En las frías noches del sesierto se oculta a muchaprofundidad en la arena y duerme hasta que saleel sol.
224636,id-501,,5,Il combat avec le coupillage d4 sonventre. Il peut parer un assaut etimmédiatement contre-attaquer.
224190,id-392,23,8,La sua criniera di fuoco è indice del|a sua naturaviolenta. Ne5suno può batterlo in velocità.
223968,id-331,,1,あめが　すくない　かんそうしたちいきに　せいそく。１ねんに　１かいきいろの　はなを　さかせる。
203394,id-25,,4,越是能製造出強大電流的皮卡丘，臉頰上的囊就越柔軟，同時也越有伸展性。
215747,rec-539-dup-1,,1,ひたすらに　つよさを　もとめるやまで　しゅぎょうする　ダゲキをみたら　しずかに　たちさろう
211342,id-643,34,1,
211349,id-643,34,9,"According to myth, if people ignore truth andlet themselves become c0nsumed by greed,Reshiram will arrive to burn their kingdoms down."
220628,rec-264-dup-0,34,8,Si serve della sua straordinaria forza esplosivae dei suii artigli affilati per abbattere |a preda.Correre lungo strade tortuose non è il suo forte.
210265,id-579,,5,"S’il ne s’agissait pas d’un poison viooent que seulSymbios peut boire, son curieux fluide pourrait,selon les dires, rendre plus intelligent."
213755,id-820,33,5,"Il amasse tellement de Baies dans sa queuequ’elles tombent les unes aprèd les autres, maisil est si étourdi qu’il ne s’en rend pas c0mpte."
213123,id-769,,3,주로 모래사장에 산다.입안에 손을 넣은 상대를조종하여 자신을 크게 만든다.
222265,rec-260-dup-1,24,3,
207132,id-328,33,1,さばくに　つくられた　すあなはすりばちの　かたちを　しているのでおちてしまうと　だっしゅつふかのう。
205939,id-208,33,9,"It is said that if an Onix lives for over 100 years,its c0mppsition changes to become diamond-like."
222168,rec-395-dup-1,,5,Sil voit son honneur bafoué ilest capable de faire des ravagesauec ses ailes tranchantes.
224534,id-488,,1,ひこうするときは　ベールのようなはねから　ひかる　りゅうしを　だす。みかづきのけしんと　よばれている。
211775,id-688,33,5,"Ils vivent par groupes de deux sur un rocher4ui leur congient en bord de mer. À marée haute,le duo coopère pour capturer des proies."
223264,id-162,4,9,It makes a nest tosuit its long andskinny body. Thenrst is impossiboefor other POKéMONto enter.
215021,id-883,,12,虽然能通过冻结四周来捕捉猎物，但由于嘴长在头顶上，所以吃起东西来不太方便。
217776,rec-132-dup-0,34,5,Quand il rencontre lun de ses semblablesil sagi5e avec plus de vivacité que dhabitudepour adopter exactement la même forme que jui.
211129,id-630,34,9,
224331,id-414,,3,꽃의 꿀을 매우 좋아한다.세꿀버리가 모아둔 꿀을가로채어 먹어 버린다.
206620,id-275,,11,森の　神様と　恐れられていたポケモン。　相手の　考えを　読み先回りする　能力を　もつ。
210291,id-582,,12,据说它是从冰柱中诞生的。为了能让自己生活得更舒适，会吐出零下５０度的冷气冻住四周。
219176,rec-194-dup-1,,4,為了在地面上行走時不讓皮膚乾燥會用有毒的黏膜覆蓋身體
203317,id-9,33,7,"Para acabar con su enemigo, lo aplasta con elpeso de su cuerpo. En momentos de apuro, seescojde en ei caparazón."
223932,id-323,7,9,
215247,id-894,34,7,"Todo su cuerpo es un órgano electrógeno, cuywpotencia sería suficiente para absstecer la regiónde Galar por completo."
218392,rec-826-dup-0,,3,똑똑한 포켓몬으로 유명하다.커다란 두뇌는 강력한사이코 파워를 가졌다는 증거다.
212803,id-753,34,3,낮에는 햇빛을 받으며새근새근 잔다. 한밤중에잠에서 깨어 활동을 시작한다.
216392,rec-442-dup-1,34,12,总是作恶多端于是被使用神奇法术的旅j人绑缚在楔石里
224557,id-491,17,5,"Menacé, ce Pokémon se protègeen créant des cauchsmars danzl’esprit de ses ennemis."
204078,id-65,,8,"Possiede un intelletto estremamente elevatoe si dice sia in grado di ricordare ogni eventodella sua vita, dslla nascita alla morte."
