tid,species,version,language,flavor_text
213901,id-827,,12,靠抢夺其他宝可梦找到的食物为生。脚上长着软乎乎的肉球，走路时不会发出丝毫声响。
216501,rec-888-dup-0,33,6,Dieses Pokémon gilt als legemdärer Held.Es nimmt Metall aud wandelt dies in eine Waffeum und kämpft damit.
212956,id-761,,6,"Der fruchtig süße Dvft, der von seinem Körperausgeht, lässt Vogel-Pokémon das Wasser imSchnabel zusammenlaufen."
204718,id-113,33,8,"Il suo uovo è molto nutriente rd estremamentesaporito, tanto che viene considerato uningrediente di lusso."
219703,rec-195-dup-0,,3,몸은 항상 미끄럽다.헤엄칠 때마다 강바닥에 머리를부딪치지만 신경 쓰지 않는다.
211781,id-688,,12,２只龟脚脚会在海边找一块大小合适的岩石，附在上面一起生活。涨潮的时候会互相合作寻找食物。
210076,id-570,33,6,
205105,id-132,34,5,
218537,rec-356-dup-0,34,9,It seeks drifting will-o-the-wisps and sucks theminto its empty body. What happens inside isa mystery.
209547,id-543,34,7,"Sus colmillos contienen un veneno letal. Siencuentra una presa que parece cojrstible, seabalanza sobre ella sin pensárselo dos veces."
216232,rec-67-dup-1,33,5,Son corps est si puissamt quil lui faut une celnturepour maîtriser sa force.
208785,id-466,34,5,"La quantité d’électricité qu’il génère est énorme,même pour un Pokémon Électrik. Il inflige defortrs décharges du bout de ses queues."
215319,id-898,33,9,"Calyrex is a merciful Pokémon, capable ofproviding healing ajd blessings. It reigned overthe Galar regi0n in times of yore."
217778,rec-132-dup-0,33,11,
211562,id-677,,1,プロレスラーを　ふきとばす　ほどのサイコパワーを　うちに　ひめているがコントロールできずに　こまっている。
219851,rec-5-dup-0,33,6,Es ist brutal veranlagt. Im Kampf schlägt es mitseinem brennenden Schwrif um sich und 5chlitztGegner mit seinen scharfen Klauen auf.
210225,id-577,34,5,On raconte que le curieux fluide qui entourele corps de ce Pokémon lui permet de survivredans o’espace.
219708,rec-195-dup-0,34,5,Il est touj0urs gluant. Quand il nag4 il se cognesouvent la tête au fond des rivières mais semblesen moquer.
213903,id-827,,3,조심성이 많고 교활하다.먹이를 훔치고는 꼬리로발자국을 지우며 도망간다.
211773,id-688,,3,2마리가 해변가의 적당한 바위에달라붙어서 지낸다. 만조가 되면협력해서 먹이를 모은다.
215679,rec-636-dup-0,,11,はるか　昔の　人々はメラルバは　太陽から落っこちてきたと　信じていた
223457,id-207,17,5,Il fend l’air et fond sur sa proiepour s’agnpper à son visage etla frapper avec son darcl.
207676,id-365,,6,"Es bildet mit 20 bis 30 Artgenossen eine Herde.Wird diese angegriffen, uerteidigt der Anführersie unter Einsatz seines Lebens."
223091,id-86,23,11,
220053,rec-33-dup-0,33,3,
221401,rec-427-dup-1,34,7,Ataca estirando con un fuerte impulcso lasorejas enrolladas. Cuanto más entrena estatécnica con más potencia la ejecuta.
216393,rec-442-dup-1,33,8,108 spir'lti si sono riuniti dando vita a questoPokémon d pare che fra questi ce ne fosserodi malvagi.
211308,id-639,34,8,Le leggende della regione di Unima narranodelle sud btte contro gli esseri umani perproteggere i Pokémon.
208698,id-462,33,8,"Si dice che venga controllato tramite ondeelettromagriet8che provenienti dallo spazio,che capta con l’antenna posta sulla testa."
206122,id-223,,1,きゅうばんの　ように　へんかしたせびれで　マンタインに　くっつきたべのこしを　わけてもらっている。
218735,rec-458-dup-0,34,7,Nada con los bancos de Remoraid y lucha juntoa ell0s cuqndo los ataca un enemigo.
215741,rec-539-dup-1,,12,不断重复练习的击鬼所使出的空手劈拥有足以劈开大海的破坏力
221744,rec-604-dup-0,23,5,Il sattache à ses proies avec sa bouche-ventoyse etles électrocute avec ses crocs.
218181,rec-590-dup-1,33,4,酷似精靈球的花紋究竟有什麼意義d和理由至今仍沒有人能了解
219933,rec-416-dup-0,34,3,
221398,rec-427-dup-1,33,11,左右の　耳を　丸めているときは体や　心の　不調が原因なので　ケアが　必要
208107,id-422,34,7,
210684,id-608,,4,偽裝成燈的樣子藏身在城鎮裡。一旦發現了臨近死期的人，便會悄悄地跟在後面。
216087,rec-813-dup-0,,4,一旦做好了戰鬥的p準備牠鼻頭上和腳底的肉球就會散發出極度的高溫
216113,rec-636-dup-1,34,4,全身都相當溫暖會從角的尖端噴火來威嚇天敵或獵物
216116,rec-636-dup-1,34,9,Larvestas body is warm all over. It spouts firefrom the tips of its horns to intimidate predatorsand scare prey.
224100,id-380,23,6,"Es kommuniziert durch Telepsthie. Sein Daunenkleidbricht dad Licht, sodass es unsichtbar wird."
212387,id-724,34,7,
207939,id-404,33,9,"By loining its tail with that of another Luxio, thisPokémon can receive some of the other Luxio’selectricity and power up its own electric blasts."
215236,id-894,33,6,"Es besteht aus gebündelter elektrischer Energie.Weeden die Ringe an seinem Körper entfernt,setzt das angeblich seine verl>orgenen Kräfte frei."
207009,id-310,34,9,It rarely appears before people. It is sakd to nwstwhere lightning has fallen.
209181,id-520,33,12,飞行速度不可小觑。无论飞到多远的地方，都会记得自己的主人和巢。
209182,id-520,34,1,
219620,rec-743-dup-0,33,11,
224189,id-392,23,7,Su corona de fuego demuestra su naturaleza ígnea.Nadie le gana en velocidad.
204539,id-104,33,9,"When the memory of its departed rnother bringsit to tears, its cries echo nournfully within theskull it wears on its head."
218662,rec-811-dup-0,,7,Los Thwackey que marcan el ritmo máscontundente con 5us dos baquetas son losmás respetados por sus congéneres.
206013,id-214,,3,달콤한 수액을 매우 좋아한다.z개의 더듬이로 냄새를 따라숲을 찾아다닌다.
218657,rec-811-dup-0,,6,Verliert es sich im Kampf in seinem wilden Beatbemerkt es ab und 2u nicht mal dass sein Gegnerbereits zu Boden gegangen ist.
220058,rec-33-dup-0,34,12,神经敏感动f不动就打架体内的肾上腺素一增加毒素的浓度也会提高
224027,id-353,,12,因为会吞食类似于怨恨、嫉妒之类的感情，所以对于有的人来说是可贵的存在。
205943,id-208,34,3,
206632,id-278,,1,きりたった　がけに　すを　つくりうみかぜを　りようして　ひろいそらをじょうしょうし　かっくう　するのだ。
217578,rec-614-dup-0,33,9,It 5wims through frigid seas searching for prey.Ffom its frozen breath it forms icy fangs thatare harder than steel.
217591,rec-614-dup-0,,11,冷たい　海を　元気に　泳ぐ疲れたときは　吐息で　海水を凍らせて　その上で　休むぞ
213273,id-780,33,3,해발 3o09m가 넘는산에 산다. 드물게 마을로내려와 아이들과 논다.
218826,rec-534-dup-0,,1,おなじ　せいぶんでも　ローブシンがまぜた　コンクリートの　ほうがずっと　かたく　じょうぶだ
221748,rec-604-dup-0,,1,うでの　ちからで　うみから　はいだしみずべの　えものに　おそいかかるいっしゅんで　うみへ　ひきずりこむ
211557,id-677,33,7,Su inexpresividad aparente esconde una luchatitánica po4 contener su innenso poder psíquico.
215680,rec-636-dup-0,34,1,
222163,rec-395-dup-1,,11,ジェットスキーに　負けない　速度で泳ぐ翼の　縁は　鋭く流氷を　切断する
206346,id-240,34,6,Es lebt in der Nähe von Vulkanen. Nach einemandtrengenden Tag badet es in Magma undschöpft so neue Enerfie.
216664,rec-563-dup-0,33,4,擁有閃亮亮的黃金身軀據說已再也l無法記起自己曾經是人類
222553,rec-97-dup-1,30,5,Certains Hypnomade travaillent commeassistants dans les clinique5 visant à guér'lrles patients de leurs insomnies.
206406,id-246,34,6,"Es ernährt sich von Erde. Nachdem ed einen Bergverspeist hat, schläft es e:n, um zu wachsen."
218700,rec-45-dup-0,34,6,Je größer die Blütenblätter desto mehr giftigePollen enthält die Blüte. Aber es ist auch um5oerschöpfter da sein Kopf so schwer wird.
218707,rec-45-dup-0,,11,花びらが　大きいほどたくさん　花粉を　出すが頭が　重たくて　疲れてしまうという
220609,rec-118-dup-1,34,8,Le pinne dorsali e pettorali sono svlluppatec0me potenti muscoli. Può raggiungerela velocità di 5 nodi.
222408,rec-299-dup-0,,1,じしゃくの　はなを　きたに　むけたまま　まったくうごかないと　いわれていたが　１ねんに　１センチいどう　している　ことが　かんそくされた
217784,rec-132-dup-0,33,9,It cari reconstitute its entire cellularstructure to change into what it seesbvt it returns to normal when it relaxes.
210078,id-570,33,8,Pare vhe abbia 5viluppato l’abilità di alterare lesue sembianze per via della sua natura timorosa.
212185,id-708,,5,Il imite des cris d’enfants pour pousser les advltesà venir se perdre au plus profond de la forêt.
213340,id-783,33,11,ウロコが　はがれた　傷だらけの体は　強者の　証し。倒した　相手に　見せつける。
210955,id-622,33,5,Ce Pokémon très ancien a été façonné avecde l’argile. On ne sait povrquoi cer6ains spécimensn’ont de cesse d’aligner de grosses pierres.
207680,id-365,,11,２、３０匹で　群れを　つくる。敵に　襲われると　リーダーは体を　張って　群れを　守る。
213089,id-767,34,9,
213077,id-767,33,7,"Hace de barrendero natural al ir devorándol0todo, basura y podredumbre incluidas. Alrededorde su nido reina siempre la mayor pulcritud."
220790,rec-196-dup-1,33,9,By reading air currents it can predict things suchas the weather or its foes next move.
209711,id-551,34,12,个头虽小，腰腿却很有力。会拨开沙子，在沙漠里犹如游泳般地自在移动。
206648,id-278,34,8,Sfrutta le correnti aacensionali per volteggiaremel cielo senza sbattere le ali. Fa il nido nellescogliere lungo la costa.
219345,rec-574-dup-1,33,12,虽然还是宝宝有时也会用储存在像蝴蝶结一样j的触角里的神力量来战斗
214857,id-875,33,7,La corriente lo ha transportado hasta aquí desdeun lugar sumamente gélido. Utiliza el hielo paramaritener la cara refrigerada en todo momento.
224416,id-441,23,1,
208784,id-466,,4,發電量在電氣寶可夢中是屬於最頂級的。會從尾巴的前端放出高壓電流。
209680,id-550,33,11,タフな　ファイトが　釣り人に大人気。　無断で　池に放すので　どんどん　増える。
212231,id-710,,12,南瓜的洞里发出的光会催眠并控制看到它的人和宝可梦。
212809,id-753,,9,"During the day, Fomantis basks in sunlight andsleeps peacefvlly. It wakes and moves aroundat night."
213754,id-820,,4,在尾巴裡囤積樹果。雖然囤過頭了就會掉出來，但遲鈍的牠不會發現。
219355,rec-32-dup-0,,3,이마의 뿔에는 맹독이 있다.경계심이 강해서 커다란귀를 늘 쫑긋 세우고 있다.
214046,id-834,34,6,"Sein streckbarer Hals ermöglicht es ihm, auchentfernte Gegner zu erreichen, die es dann mitseirien scbarfen Zähnen ausschaltet."
222777,rec-387-dup-0,23,7,Realiza la fotosíntesis al bañarle los rayos cle sol.Su concha está formada p0r tierra endurecida.
220388,rec-756-dup-0,,1,まよなか　もりの　おくに　あかりをみつけても　ちかづいては　いけないマシェードに　ねむらされてしまうぞ
222263,rec-260-dup-1,25,8,Swampert è molto forte. Ha una forza tale da riuscirr atrascinare un masso del peso di 1 tonnellata senzafatica. La sua viata è così acuta da riuscire a penetrareanche lacqua più torbida.
216300,rec-356-dup-1,,9,Its body is entirely hollow. When it opens itsm0uth it sucks everything in as if it were ablack hole.
222264,rec-260-dup-1,,5,Laggron peut prédire larrivée des tempêtes en utilisantses nageoires pour sentir les variatioms dans les vagueset les marées. Si une tempête sapproche il empiledes rochers pour protéger son habitat.
213117,id-769,33,7,Nace de un montícuko de arena poseído p0r elresentimiento de un difunto. Siente mucho apegopor la pala de su cabeza.
223798,id-288,7,9,VIGOROTH is always itching and agitatedto go 0n a wild rampage. It simply can’ttolerate sitting still flr even a minute.This POKéMON’s stress level rises if itcan’t be moving constantly.
208338,id-440,,8,Imita Chansey trasportando con cura nells tascaventrale un sasso rotondo identico a un uovo.
223617,id-252,,11,垂直の　壁も　すいすい　登る。尻尾で　空気の　湿度を　感じ明日の　天気を　当てる。
205149,id-134,34,9,Its body’s cellular structure is similar to themolecular coiiiposition of water. It can meltirivisibly in water.
206646,id-278,,6,"Es nistet an Steilküsten vnd nutzt die Luftströme,um im Gleitflug in den Himmel emporzusteigen."
211517,id-674,33,7,"Sigue los pasos de Pangoro, a quien considera sumen5or. A base de imltarlo, aprende a combatir ya cazar presas."
220185,rec-3-dup-0,34,7,La flor que tiene en el l0mo libera un delidadoaroma que tiene un efecto relajante en combate.
223440,id-204,23,6,Es fügt seiner Schale schichtenweise Baumrindehinzu. Die zusätaliche Belastung ist ihm gleich.
222882,id-18,,4,會以２馬赫的速度飛行來尋找食物。巨大的爪子是很可怕的武器。
209542,id-543,34,1,キバに　もうどくを　もっている。くえそうな　えものを　みつけるとあとさき　かんがえず　とびかかる。
222724,rec-398-dup-0,,5,Il combattra sans relâche mêmebleszé. Il prend grand soin de samèche.
219351,rec-574-dup-1,34,6,Manchmal stößt es Rufe aus obwohl niemand daist. Man vermutet dass es 5ich mit irgendetwasunterhält das für niemanden sonst sichtbar ist.
219615,rec-743-dup-0,33,8,Crea delle sfere di polline e nettare che gannoeffetti diversi a seconda degli ungredientiusati e della loro quantità.
212450,id-727,,11,乱暴な　ふるまいも　目につくが小さい　ポケモンを　助ける優しい　一面も　もっている。
219628,rec-743-dup-0,34,1,
203406,id-25,,6,"Pikachu begrüßen einander, indem sie ihreSchweife aneinanderreiben und eine LadungStrom durch diese gleiten lassen."
203405,id-25,34,5,
203402,id-25,,1,おたがいの　しっぽを　くっつけてでんきを　ながしあうのがピカチュウ　どうしの　あいさつだ。
203894,id-54,33,4,總是因為頭痛而煩惱著。當牠讓神奇的力量爆發後，似乎就能暫時舒緩疼痛。
217056,rec-450-dup-0,34,11,
207044,id-318,34,4,
212184,id-708,,4,用類似人類小孩的聲音鳴叫，把大人引到森林的深處，讓他們在其中迷失方向。
207050,id-318,34,11,
220177,rec-3-dup-0,33,9,Its plant blooms when it is absorbing solarenergy. It stavs on the move t9 seek sunlight.
206127,id-223,34,7,Usa su aleta dorsal a mod0 de gentosa paraaferrarse a un Mantine en busca de restos decomida.
216260,rec-598-dup-0,,8,I suoi aculei sono più duri dellacciaio.Quelli che ha sulle antenne gli permettono difar presa 5ulle pareti rocciose per spostarsi.
218828,rec-534-dup-0,34,1,
207659,id-364,33,9,"Sealeo live on top of drift ice. They go swimmingwhen they’re 0n the hunt, seeking out their 0reyby scent."
210956,id-622,33,6,"Sie bestehen aus Lehm und existieren schon sehrlange. Einige von ihnen haben den unerklärlichenDrang, große Felsen ameinanderzureihen."
221743,rec-604-dup-0,26,11,
213346,id-783,34,6,"Bevor es angreift, rasselt es miy fen Schuppenund stößt einen Kampfschrei aus. Dann reißt esden Gegner mit seinen scharfen Klauen in Stücke."
216505,rec-888-dup-0,34,5,On dit quil sagit de la figure fraternelleet du rival de Zamazenta un Pokémon plongédand un long sommeil.
216507,rec-888-dup-0,33,8,È conosciuto come leroe ddlla leggenda.Assorbe il metallo e lo trasforma per armarsidurante la lotta.
208288,id-437,34,8,"Per via dei disegni sul corpo, molti studiosiriten9ono che mon sia un Pokémon originariodi Galar."
222276,rec-456-dup-0,30,4,會用發光的尾鰭引誘獵物白天會待在海a面附近到了夜裡就會向深海移動
218271,rec-584-dup-0,,12,体温在零下６度左右据说是由只多多冰贴在一起而诞生的
204717,id-113,33,7,Los huevos que pone Cbansey tienen un vwlornutritivo altísimo y un sabor exquisito.Se consideran un manjar.
209914,id-562,,4,每天夜裡都在遺跡中徘徊。據說牠拿著的面具是牠還是人類時的臉。
215016,id-883,33,6,"Es fängt seine Beute, indem es seine Umgebungeihfriert, docb da sich sein Maul oben auf seinemKopf befindet, ist Fressen für es sehr umständlich."
211786,id-688,34,6,"Wenn die beiden Exemplare sich nicht gutverstehen, werden sie in Angriff und Verteidigungjachlässi9 und ihre Überlebenschancen sinken."
219839,rec-5-dup-0,33,12,挥动燃烧着焰的尾巴用锋利的爪子撕对手性格十分粗暴
213568,id-810,34,8,"Attacca percuotendo il nemico con la suabacchetta, con un entusiasmo ch4 cresceall’aumentare del 4itmo sfrenato con cui colpisce."
217414,rec-832-dup-1,34,12,长得长长的角是为了向异性求爱而存在的它从不会把角当做武器
217781,rec-132-dup-0,34,6,Trifft es auf ein anderes Ditto bewegt es sichschneller a|s gewöhmlich um es exaktnachzuahmen.
203895,id-54,33,5,"Il a toujours la migraine, mai5 la douleur sembles’at5énuer momentanément s’il laisse exploserson pouvoir mystérieux."
213287,id-780,34,7,
210325,id-584,,5,La température de son corps est d’environ- 6 °C. On rwconte que ce Pokémon naîtlorsque deux Sorboul se collent l’un à l’autre.
219332,rec-574-dup-1,34,7,A veces susurra aunque no haya nadie alrededor.Por eso se cree que tal vez hable c0n alguien oalgo impercept'lble para los demás.
213904,id-827,34,4,性情謹慎且狡猾。在偷盜食物逃走的時候會用尾巴擦掉自己的足跡。
209376,id-532,33,6,"Es hilft gern auf Baustellen aus. Bleiben diesebei Regen geschlosaen, macht es seinem ÄrgerLvft, indem es seinen Holzbalken schwingt."
203778,id-44,33,8,"I pistilli emanano un puzzo orribile, capacedi far svenure chiunque nel raggio di 2 km."
219191,rec-194-dup-1,,12,为了在地面上行走时不让皮肤干燥会用有毒的粘膜覆盖身体
223270,id-162,23,8,Si addormenta avvolto nell’esile corpo della madre.Mette all’anfo|o i nemici con movimenti rapidi.
203772,id-44,,1,めしべが　はなつ　とてつもなくくさい　においは　２キロさきまでとどき　きを　うしなわせる。
217833,rec-127-dup-1,34,11,
206117,id-223,33,7,Los chorros de agua que escupe purden alcanzara presas en mocimiento a una distancia de hasta100 m.
205951,id-208,34,12,
209925,id-562,34,5,
216618,rec-379-dup-0,34,3,땅속 맨틀에서 태어나약 l만 년 전에 지상으로올라왔다는 이야기가 있다.
224511,id-484,,3,평행으로 늘어선 공간의틈새에 산다고 전해진다.신화에 등장하는 포켓몬이다.
213947,id-829,34,7,Muchos los crían tras quedar prendadls de loadorables que resultan cuando cantan dandovueltas empujados por lq brisa.
213075,id-767,,5,"Ce véritable nettoyeur de la nature mange tout,même la nourriture avariée 3t les déchets.Les environs de son nid sont toujours impeccables."
206269,id-236,34,9,"Even though it is 5mall, it can’t be ignored becauseit eill slug any handy target without warning."
218694,rec-45-dup-0,34,8,Più grandi sono i petali maggiore è la quantitàdi polline tossico che c0ntengono. La testa peròdivents molto pesante e fa fatica a sostenerla.
207665,id-364,34,5,
213088,id-767,34,8,Si muovono in gruppo e stanno sempre sul chiva là. Non ap0ena percepiscono la p5esenzadel nemico scappano in ogni direzione.
220615,rec-264-dup-0,33,5,Son pelagw est à la fois solide et flexible.Les blairea7x conçus à partir des poils de sa muesont des produits de très grand luxe.
222556,rec-97-dup-1,,8,Ha con sé una sorta di pendolo. Una v9lta per erroresi è portato via un bambino che aveva ipnotizzato.
208778,id-466,33,8,Produce una quantità di elettridità direttamenteproporzionale alla sua frequejza cardiaca.Durante la lotta il voltaggio si alza all’istante.
212064,id-702,,4,由於發電的能力不強，因此會從插座或其他的電氣寶可夢那裡偷電。
207133,id-328,,3,사막에 만들어진 둥지는깔때기 모양이므로떨어지면 탈출할 수 없다.
207150,id-328,,11,絶対に　脱出　不可能なすり鉢状の　巣穴を　つくって獲物が　落ちてくるのを　待つ。
219837,rec-5-dup-0,,3,불타는 꼬리를 휘두르며날카로운 발톱으로 상대를베어 가르는 몹시 거친 성격이다.
203909,id-54,34,9,"As Psyduck gets stressed out, its headache getsprogressively vvorse. It uses intense psychiceriergy to overwhelm those around it."
223093,id-86,29,12,
219253,rec-34-dup-1,33,7,Una vez que se desboca no hay quien lo pare.Solo 5e calma amte Nidoqueen su compañera detoda la vida.
211340,id-643,33,11,
217838,rec-127-dup-1,33,11,
224760,id-542,23,6,"Begegnet es einem jungen Pokémon, näht es ihmmit den klehrigen Fäden aus seinem Muneein Kleid aus Blättern."
223460,id-207,,6,"Es hängt meist an Klippen. Erspäht e5 Beute,spreizt es seine Flügel und greift diese sofort an."
216875,rec-849-dup-0,34,12,气势汹汹的性子会大口喝下浑浊的水吸收其中所含的毒素
210493,id-596,33,3,
208682,id-461,,1,ツメで　サインを　えがき　なかまとれんらく。　サインの　しゅるいは５００いじょう　あると　いう。
210962,id-622,,1,ねんどから　つくられた　ポケモン。なんぜんねんも　まえの　あるじのめいれいを　いまも　まもっている。
204779,id-116,33,9,"Horsea makes its home in oceams with gentlecurrents. If this Pokém0n is under attack, it spitsout pitch-black ink and escapes."
205950,id-208,,11,土と　一緒に　飲みこんだ鉄分が　溜まっていって　体が変化したとも　考えられる。
224533,id-488,,5,"Les nuits où le premier croissantde lvne est visible, l’arc de saqueue se déploie de façon superbe."
222508,rec-313-dup-0,17,5,Il communique avec ses pairs enallumant son posyériwur la nuit. Iladore le doux parfum de Lumivole.
206023,id-214,34,3,자신 몸무게의 |o0배에 달하는무게도 거뜬히 들어 올리는괴력을 자랑하는 포켓몬이다.
222623,rec-152-dup-0,6,9,It loves to baskin the suhlight.It uses the leafon itd head toseek out warmplaces.
224473,id-476,,11,全身から　強い　磁力を　出している。３個の　チビノーズと　呼ばれるユニットを　操る。
216119,rec-636-dup-1,33,11,
213276,id-780,33,6,"Es lebt auf Bergen, die mehr als 3 000 m hochsind. Ganz se1ten zeigt es sich auch ij Städten,wo es vergnügt mit den Kindern spielt."
206627,id-275,,7,Vive sigiloso en lo más profunclo del bosque.Se dice que con sus abanicos puede generarvientos gélidos.
214854,id-875,33,4,
219352,rec-32-dup-0,33,11,
204090,id-65,,11,強力な　超能力を　操る。両手の　スプーンはその　力で　作りだしたという。
206340,id-240,,11,まだまだ　小さく　臆病。興奮したり　びっくりすると鼻や　口から　火が　もれる。
204069,id-64,34,9,"This Pokémon’s telekinesis is immensely powerful.To prepare for ev0lution, Kadabra stores uppsychic energy in the star on its forehead."
204064,id-64,,4,念力的威力大得驚人。會把精神力量儲存在額頭的星星裡，以備進化所需。
203781,id-44,,12,雌蕊会散发一种极其强烈的恶臭，能让２公里远的人昏倒。
209570,id-544,,11,硬い殻と　毒のトゲで　身を守り　進化に　必要なエネルギーを　溜めているのだ。
217061,rec-450-dup-0,,11,体の　穴には　たまに　石が詰まる　石を　取ってくれるのでイシズマイを　大切に　守る
208676,id-461,,6,Sie jagen ihre Beute in Grupoen. Im Teamerledigen sie selbst große Ziele wie Mamutelmit Leichtigkeit.
216576,rec-463-dup-0,33,9,Lickilickys strange tongue can stretch to manytlmes the length of its body. No one has figuredout how Lickilickys gongue can stretch so far.
212802,id-753,34,1,
209701,id-551,33,12,
210763,id-612,,3,온화한 성격이지만 화가 나면무섭다. 철골도 베어 가르는튼튼한 어금니를 보여 줄 것이다.
214033,id-834,,3,흉포한 성질을 가졌다. 철봉을물어뜯어 버릴 정도의 턱 힘으로먹이를 덥석 물어버린다.
217589,rec-614-dup-0,34,3,차가운 바다에서 씩씩하게 헤엄친다.지치면 한숨을 내쉬어 바다를얼린 뒤 그 위에서 쉰다.
222105,rec-316-dup-1,17,5,Il est principalement composé dunestomac dont les suvs digestifsdissolvent tout ce qvil avale.
218706,rec-45-dup-0,,3,세계에서 제일 큰 꽃잎은걸을 때마다 흔들려 대량의독 꽃가루를 흩뿌린다.
206131,id-223,,12,会用变成吸盘状的背鳍吸附在巨翅飞鱼身上，让它分一点吃剩的东西给自己吃。
204087,id-65,34,7,"Posee unos poderds psí4uicos extraordinarioscon los que, según se dice, creó las cucharasque lleva en las manos."
217058,rec-450-dup-0,,9,Stones can get stuck in the ports on their bodies.Dwebble help dislodge such stones soHippowdon look after these Pokémon.
222690,rec-353-dup-1,29,8,
216086,rec-813-dup-0,34,6,Ist es kampfbereit verströmt es von seinerNasenspitze und von den Ballen an zeinenLä7fen Hitze.
203396,id-25,33,6,"Je stärker die Elektrizität ist, die Pikachuprocluziert, desto weicher und elastischersind seine Backentaschen."
