tid,id,title,authors,venue,year
71415,conf/sigmod/Melling94,Enterprise Information Architectures -- They're Finally Changing,W Melling,SIGMOD Conference,1994
71424,conf/vldb/MeoPC96,A New SQL-like Operator for Mining Association Rules,"R Meo, G Psaila, S Ceri",VLDB,1996
71425,conf/sigmod/Carey94,Parallel Database Systems in the 1990's,M Carey,SIGMOD Conference,1994
71426,conf/vldb/FukudaMMT96,Constructing Efficient Decision Trees by Using Optimized Numeric Association Rules,"T Fukuda, Y Morimoto, S Morishita, T Tokuyama",VLDB,1996
71427,conf/sigmod/Cattell94,ODMG-93: A Standard for Object-Oriented DBMSs,R Cattell,SIGMOD Conference,1994
71428,conf/vldb/LabioG96,Efficient Snapshot Differential Algorithms for Data Warehousing,"W Labio, H Garcia-Molina",VLDB,1996
71430,conf/sigmod/Kim94,UniSQL/X Unified Relational and Object-Oriented Database System,W Kim,SIGMOD Conference,1994
71434,conf/vldb/FaloutsosG96,Analysis of n-Dimensional Quadtrees using the Hausdorff Fractal Dimension,"C Faloutsos, V Gaede",VLDB,1996
71439,conf/vldb/StaudtJ96,Incremental Maintenance of Externally Materialized Views,"M Staudt, M Jarke",VLDB,1996
71440,conf/sigmod/HwangLYMMGCSS94,The MYRIAD Federated Database Prototype,"S Hwang, E Lim, H Yang, S Musukula, K Mediratta, M Ganesh, D Clements, J Stenoien, J Srivastava",SIGMOD Conference,1994
71444,journals/sigmod/AilamakiFFSV03,An environmental sensor network to determine drinking water quality and security,"A Ailamaki, C Faloutsos, P Fischbeck, M Small, J VanBriesen",SIGMOD Record,2003
71447,journals/sigmod/Snodgrass03c,Developments at ACM TODS,R Snodgrass,SIGMOD Record,2003
71450,journals/sigmod/Date03,Edgar F. Codd: a tribute and personal memoir,C Date,SIGMOD Record,2003
71453,conf/vldb/Mohan96,DWMS: Data Warehouse Management System,N Mohan,VLDB,1996
71457,conf/sigmod/MissikoffT94,MOSAICO - A System for Conceptual Modeling and Rapid Prototyping of Object-Oriented Database Application,"M Missikoff, M Toiati",SIGMOD Conference,1994
71472,conf/vldb/TriantafillouP97,On-Demand Data Elevation in Hierarchical Multimedia Storage Servers,"P Triantafillou, T Papadakis",VLDB,1997
71477,journals/sigmod/WangD03,Review of Web caching and replication by Michael Rabinovich and Oliver Spatscheck. Addison Wesley 2002,,,2003
71479,conf/vldb/WangYM97,STING: A Statistical Information Grid Approach to Spatial Data Mining,"W Wang, J Yang, R Muntz",VLDB,1997
71486,journals/sigmod/PalpanasPKG03,Distributed deviation detection in sensor networks,"T Palpanas, D Papadopoulos, V Kalogeraki, D Gunopulos",SIGMOD Record,2003
71489,journals/sigmod/Kumar03,Sensor: the atomic computing particle,V Kumar,SIGMOD Record,2003
71490,conf/vldb/LlirbatST97,Using Versions in Update Transactions: Application to Integrity Checking,"F Llirbat, E Simon, D Tombroff",VLDB,1997
71491,conf/vldb/JagadishNSSK97,Incremental Organization for Data Recording and Warehousing,"H Jagadish, P Narayan, S Seshadri, S Sudarshan, R Kanneganti",VLDB,1997
71496,journals/sigmod/ChengP03,Managing uncertainty in sensor database,"R Cheng, S Prabhakar",SIGMOD Record,2003
71500,conf/vldb/KietzRS97,Mining Insurance Data at Swiss Life,"J Kietz, U Reimer, M Staudt",VLDB,1997
71501,conf/vldb/LiCHH97,Facilitating Multimedia Database Exploration through Visual Interfaces and Perpetual Query Reformulations,"W Li, K Candan, K Hirata, Y Hara",VLDB,1997
71503,journals/sigmod/Hammer03,Treasurer's Message,,,2003
71504,conf/vldb/BridgeJKLLM97,The Oracle Universal Server Buffer,"W Bridge, A Joshi, M Keihl, T Lahiri, J Loaiza, N MacNaughton",VLDB,1997
71507,conf/vldb/PoosalaI97,Selectivity Estimation Without the Attribute Value Independence Assumption,"V Poosala, Y Ioannidis",VLDB,1997
71510,journals/sigmod/Chamberlin03,2003 SIGMOD Innovations Award Speech,D Chamberlin,SIGMOD Record,2003
71514,journals/sigmod/Halevy03,Learning about data integration challenges from day one,A Halevy,SIGMOD Record,2003
71517,conf/vldb/PellenkoftLK97,The Complexity of Transformation-Based Join Enumeration,"A Pellenkoft, C Galindo-Legaria, M Kersten",VLDB,1997
71519,conf/vldb/ChakrabartiDAR97,"Using Taxonomy, Discriminants, and Signatures for Navigating in Text Databases","S Chakrabarti, B Dom, R Agrawal, P Raghavan",VLDB,1997
71521,journals/sigmod/MotroA03,Report on FQAS 2002: fifth international conference on flexible query answering systems,,,2003
71529,journals/sigmod/NascimentoSP03,Analysis of SIGMOD's co-authorship graph,"M Nascimento, J Sander, J Pound",SIGMOD Record,2003
71532,journals/sigmod/Liu03a,Editor's Notes,L Liu,SIGMOD Record,2003
71533,conf/vldb/AmsalegFG95,Efficient Incremental Garbage Collection for Client-Server Object Database Systems,"L Amsaleg, M Franklin, O Gruber",VLDB,1995
71537,journals/sigmod/Jonsson03,In Memory of Gísli R. Hjaltason,,,2003
71541,journals/sigmod/Anisimov03,"Review of The data warehouse toolkit: the complete guide to dimensional modeling (2nd edition) by Ralph Kimball, Margy Ross. John Wiley & Sons, Inc. 2002",,,2003
71543,conf/vldb/YanG95,Duplicate Removal in Information System Dissemination,"T Yan, H Garcia-Molina",VLDB,1995
71544,journals/sigmod/Winslett03b,Interview with Rakesh Agrawal,,,2003
71547,journals/sigmod/Ouksel03,In-context peer-to-peer information filtering on the Web,A Ouksel,SIGMOD Record,2003
71551,conf/vldb/Celis96,The Query Optimizer in Tandem's new ServerWare SQL Product,P Celis,VLDB,1996
71553,conf/vldb/Bhashyam96,"TPC-D: The Challenges, Issues and Results",R Bhashyam,VLDB,1996
71555,conf/vldb/Baru96,Performance of Future Database Systems: Bottlenecks and Bonananzas,C Baru,VLDB,1996
71556,journals/sigmod/Hellerstein03,Toward network data independence,J Hellerstein,SIGMOD Record,2003
71558,journals/sigmod/TatarinovIMHSDDKMM03,The Piazza peer data management project,"I Tatarinov, Z Ives, J Madhavan, A Halevy, D Suciu, N Dalvi, X Dong, Y Kadiyska, G Miklau, P Mork",SIGMOD Record,2003
71559,journals/sigmod/BawaCCDGGKMSSVY03,Peer-to-peer research at Stanford,"M Bawa, B Cooper, A Crespo, N Daswani, P Ganesan, H Garcia-Molina, S Kamvar, S Marti, M Schlosser, Q Sun, P Vinograd, B Yang",SIGMOD Record,2003
71560,conf/vldb/Sacks-Davis96,The Structured Information Manager: A Database System for SGML Documents,R Sacks-Davis,VLDB,1996
71561,conf/vldb/Raghavan96,Loading the Data Warehouse Across Various Parallel Architectures,V Raghavan,VLDB,1996
71562,journals/sigmod/AbererCDDHPS03,P-Grid: a self-organizing structured P2P system,"K Aberer, P Cudré-Mauroux, A Datta, Z Despotovic, M Hauswirth, M Punceva, R Schmidt",SIGMOD Record,2003
71565,conf/vldb/HanF95,Discovery of Multiple-Level Association Rules from Large Databases,"J Han, Y Fu",VLDB,1995
71566,journals/sigmod/RossNO03,Reminiscences on Influential Papers,,,2003
71567,journals/sigmod/ChongFTSYKDJJ03,A mapping mechanism to support bitmap index and other auxiliary structures on tables stored as primary B+-trees,"E Chong, J Srinivasan, S Das, C Freiwald, A Yalamanchi, M Jagannath, A Tran, R Krishnan, R Jiang",SIGMOD Record,2003
71573,journals/sigmod/Nascimento03,Peer-to-peer: harnessing the power of disruptive technologies,M Nascimento,SIGMOD Record,2003
71580,conf/vldb/HasanM95,Coloring Away Communication in Parallel Query Optimization,"W Hasan, R Motwani",VLDB,1995
71581,conf/vldb/SteinbrunnPMK95,Bypassing Joins in Disjunctive Queries,"M Steinbrunn, K Peithner, G Moerkotte, A Kemper",VLDB,1995
71583,journals/sigmod/GottlobKP03a,XPath processing in a nutshell,,,2003
71585,conf/vldb/BunemanDHOW95,A Data Transformation System for Biological Data Sources,"P Buneman, S Davidson, K Hart, G Overton, L Wong",VLDB,1995
71587,journals/sigmod/Ozsu03,Chair's Message,,,2003
71589,journals/sigmod/Vianu03,A Web odyssey: from codd to XML,V Vianu,SIGMOD Record,2003
71590,conf/vldb/YanL95,Eager Aggregation and Lazy Aggregation,"W Yan, P Larson",VLDB,1995
71591,journals/sigmod/Aberer03b,Book review column,K Aberer,SIGMOD Record,2003
71601,conf/vldb/DarFJST96,Semantic Data Caching and Replacement,"S Dar, M Franklin, B Jónsson, D Srivastava, M Tan",VLDB,1996
71603,journals/sigmod/BertinoEH03,A Database Approach to Quality of Service Specification in Video Databases,"E Bertino, A Elmagarmid, M Hacid",SIGMOD Record,2003
71605,journals/sigmod/David03,ANSI SQL Hierarchical Processing Can Fully Integrate Native XML,M David,SIGMOD Record,2003
71609,journals/sigmod/ChakravarthyAEFO03,Database Research at UT Arlington,"S Chakravarthy, Y Aslandogan, R Elmasri, L Fegaras, J Oh",SIGMOD Record,2003
71611,conf/vldb/LinLYZ03,Multiscale Histograms: Summarizing Topological Relations in Large Spatial Datasets,"X Lin, Q Liu, Y Yuan, X Zhou",VLDB,2003
71612,conf/vldb/PapadiasZMT03,Query Processing in Spatial Network Databases,"D Papadias, J Zhang, N Mamoulis, Y Tao",VLDB,2003
71621,conf/vldb/VieiraM03,A Dependability Benchmark for OLTP Application Environments,"M Vieira, H Madeira",VLDB,2003
71622,conf/vldb/ChaudhuriGN03,Primitives for Workload Summarization and Implications for SQL,"S Chaudhuri, P Ganesan, V Narasayya",VLDB,2003
71624,conf/vldb/HelmerNM03,Estimating the Output Cardinality of Partial Preaggregation with a Measure of Clusteredness,"S Helmer, T Neumann, G Moerkotte",VLDB,2003
71625,conf/vldb/AnciauxBP03,Memory Requirements for Query Execution in Highly Constrained Devices,"N Anciaux, L Bouganim, P Pucheral",VLDB,2003
71629,conf/vldb/MurthyB03,XML Schemas in Oracle XML DB,"R Murthy, S Banerjee",VLDB,2003
71631,conf/vldb/AnKR03,Improving Performance with Bulk-Inserts in Oracle R-Trees,"N An, K Kanth, S Ravada",VLDB,2003
71632,conf/vldb/Galindo-LegariaJWW03,Statistics on Views,"C Galindo-Legaria, M Joshi, F Waas, M Wu",VLDB,2003
71638,conf/vldb/PossP03,Data Compression in Oracle,"M Pöss, D Potapov",VLDB,2003
71642,conf/vldb/Jermaine03,Robust Estimation With Sampling and Approximate Pre-Aggregation,C Jermaine,VLDB,2003
71643,conf/vldb/TorloneA03,Chameleon: an Extensible and Customizable Tool for Web Data Translation,"R Torlone, P Atzeni",VLDB,2003
71647,conf/vldb/BalminHKPSW03,A System for Keyword Proximity Search on XML Databases,"A Balmin, V Hristidis, N Koudas, Y Papakonstantinou, D Srivastava, T Wang",VLDB,2003
71650,conf/vldb/MengLLA03,OrientStore: A Schema Based Native XML Storage System,"X Meng, D Luo, M Lee, J An",VLDB,2003
71652,conf/vldb/Brodie03,Illuminating the Dark Side of Web Services,M Brodie,VLDB,2003
71653,conf/vldb/Cluet03,Who needs XML Databases?,S Cluet,VLDB,2003
71654,conf/vldb/KerstenWFKBC03,A Database Striptease or How to Manage Your Personal Databases,"M Kersten, G Weikum, M Franklin, D Keim, A Buchmann, S Chaudhuri",VLDB,2003
71655,conf/vldb/Kuhn03,The Zero-Delay Data Warehouse: Mobilizing Heterogeneous Databases,e Kühn,VLDB,2003
71656,conf/vldb/Schoning03,Commercial Use of Database Technology,H Schöning,VLDB,2003
71665,conf/vldb/WangSG03,An Interpolated Volume Data Model,"T Wang, S Santini, A Gupta",VLDB,2003
71670,conf/vldb/LiPHCAAT03,CachePortal II: Acceleration of Very Large Scale Data Center-Hosted Database-driven Web Applications,"W Li, O Po, W Hsiung, K Candan, D Agrawal, Y Akca, K Taniguchi",VLDB,2003
71671,conf/vldb/NieKH03,BibFinder/StatMiner: Effectively Mining and Using Coverage and Overlap Statistics in Data Integration,"Z Nie, S Kambhampati, T Hernandez",VLDB,2003
71673,conf/vldb/NicklasGS03,"NexusScout: An Advanced Location-Based Application on a Distributed, Open Mediation Platform","D Nicklas, M Großmann, T Schwarz",VLDB,2003
71675,conf/vldb/Mattos03,Integrating Information for On Demand Computing,N Mattos,VLDB,2003
71683,conf/vldb/Amer-YahiaFSX03,Phrase Matching in XML,"S Amer-Yahia, M Fernandez, D Srivastava, Y Xu",VLDB,2003
71684,conf/vldb/ChenDZ03,RRXF: Redundancy reducing XML storage in relations,"Y Chen, S Davidson, C Hara, Y Zheng",VLDB,2003
71685,conf/vldb/DeutschT03,MARS: A System for Publishing XML from Mixed and Redundant Storage,"A Deutsch, V Tannen",VLDB,2003
71687,conf/vldb/HalversonBKKRTVWND03,Mixed Mode XML Query Processing,"A Halverson, J Burger, L Galanis, A Kini, R Krishnamurthy, A Rao, F Tian, S Viglas, Y Wang, J Naughton, D DeWitt",VLDB,2003
71690,conf/vldb/DiaoF03,Query Processing for High-Volume XML Message Brokering,"Y Diao, M Franklin",VLDB,2003
71692,conf/vldb/TengCY03,A Regression-Based Temporal Pattern Mining Scheme for Data Streams,"W Teng, M Chen, P Yu",VLDB,2003
71694,conf/vldb/YuPM03,Distributed Top-N Query Processing with Possibly Uncooperative Local Systems,"C Yu, G Philip, W Meng",VLDB,2003
71695,conf/vldb/LongS03,Optimized Query Execution in Large Search Engines with Global Page Ordering,"X Long, T Suel",VLDB,2003
71698,conf/vldb/Ramanan03,Covering Indexes for XML Queries: Bisimulation - Simulation = Negation,P Ramanan,VLDB,2003
71700,conf/vldb/LabrinidisR03,Balancing Performance and Data Freshness in Web Database Servers,"A Labrinidis, N Roussopoulos",VLDB,2003
71701,conf/vldb/ChenL03,VIPAS: Virtual Link Powered Authority Search in the Web,"C Lin, M Chen",VLDB,2003
71704,conf/vldb/ShiSZ03,A Shrinking-Based Approach for Multi-Dimensional Data Analysis,"Y Shi, Y Song, A Zhang",VLDB,2003
71711,conf/vldb/HeMYW03,WISE-Integrator: An Automatic Integrator of Web Search Interfaces for E-Commerce,"H He, W Meng, C Yu, Z Wu",VLDB,2003
71714,conf/vldb/HuebschHLLSS03,Querying the Internet with PIER,"R Huebsch, J Hellerstein, N Lanham, B Loo, S Shenker, I Stoica",VLDB,2003
71716,conf/vldb/LuoNEW03,Locking Protocols for Materialized Aggregate Join Views,"G Luo, J Naughton, C Ellmann, M Watzke",VLDB,2003
71718,conf/vldb/MadhavanH03,Composing Mappings Among Data Sources,"J Madhavan, A Halevy",VLDB,2003
71719,conf/vldb/GaoS03,Temporal Slicing in the Evaluation of XML Queries,"D Gao, R Snodgrass",VLDB,2003
71723,conf/vldb/KraftSRM03,Coarse-Grained Optimization: Techniques for Rewriting SQL Statement Sequences,"T Kraft, H Schwarz, R Rantzau, B Mitschang",VLDB,2003
71724,conf/vldb/GolabO03,Processing Sliding Window Multi-Joins in Continuous Queries over Data Streams,"L Golab, M Özsu",VLDB,2003
71725,conf/vldb/CormodeKMS03,Finding Hierarchical Heavy Hitters in Data Streams,"G Cormode, F Korn, S Muthukrishnan, D Srivastava",VLDB,2003
71726,conf/vldb/XinHLW03,Star-Cubing: Computing Iceberg Cubes by Top-Down and Bottom-Up Integration,"D Xin, J Han, X Li, B Wah",VLDB,2003
71729,conf/vldb/IwerksSS03,Continuous K-Nearest Neighbor Queries for Continuously Moving Points with Updates,"G Iwerks, H Samet, K Smith",VLDB,2003
71731,conf/vldb/BlottK02,An Almost-Serial Protocol for Transaction Execution in Main-Memory Database Systems,"S Blott, H Korth",VLDB,2002
71734,conf/vldb/KangC02,Exploiting Versions for On-line Data Warehouse Maintenance in MOLAP Servers,"H Kang, C Chung",VLDB,2002
71737,conf/vldb/RizviH02,Maintaining Data Privacy in Association Rule Mining,"S Rizvi, J Haritsa",VLDB,2002
71738,conf/vldb/SenkulKT02,A Logical Framework for Scheduling Workflows under Resource Allocation Constraints,"P Senkul, M Kifer, I Toroslu",VLDB,2002
71739,conf/vldb/PalpanasSCP02,Incremental Maintenance for Non-Distributive Aggregate Functions,"T Palpanas, R Sidle, R Cochrane, H Pirahesh",VLDB,2002
71744,conf/vldb/LakshmananNWZJ02,The Generalized MDL Approach for Summarization,"L Lakshmanan, R Ng, C Wang, X Zhou, T Johnson",VLDB,2002
71747,conf/vldb/ZellerK02,Experience Report: Exploiting Advanced Database Optimization Features for Large-Scale SAP R/3 Installations,"B Zeller, A Kemper",VLDB,2002
71748,conf/vldb/Vingralek02,"GnatDb: A Small-Footprint, Secure Database System",R Vingralek,VLDB,2002
71751,conf/vldb/Fox02,Toward Recovery-Oriented Computing,A Fox,VLDB,2002
71752,conf/vldb/SeifertS02,A Multi-version Cache Replacement and Prefetching Policy for Hybrid Data Delivery Environments,"A Seifert, M Scholl",VLDB,2002
71754,conf/vldb/LohmanL02,SMART: Making DB2 (More) Autonomic,"G Lohman, S Lightstone",VLDB,2002
71755,conf/vldb/SchmidtWKCMB02,XMark: A Benchmark for XML Data Management,"A Schmidt, F Waas, M Kersten, M Carey, I Manolescu, R Busse",VLDB,2002
71759,conf/vldb/LaudBCSR02,"The gRNA: A Highly Programmable Infrastructure for Prototyping, Developing and Deploying Genomics-Centric Applications","A Laud, S Bhowmick, P Cruz, D Singh, G Rajesh",VLDB,2002
71763,conf/vldb/KeidlSSK02,ServiceGlobe: Distributing E-Services Across the Internet,"M Keidl, S Seltzsam, K Stocker, A Kemper",VLDB,2002
71767,conf/vldb/OhuraTPK02,Experiments on Query Expansion for Internet Yellow Page Services Using Web Log Mining,"Y Ohura, K Takahashi, I Pramudiono, M Kitsuregawa",VLDB,2002
71768,conf/vldb/LiHKSPAC02,Issues and Evaluations of Caching Solutions for Web Application Acceleration,"W Li, W Hsiung, D Kalashnikov, R Sion, O Po, D Agrawal, K Candan",VLDB,2002
71769,conf/vldb/King02,The Rubicon of Smart Data,R King,VLDB,2002
71771,conf/vldb/MahnkeMS02,Extending an ORDBMS: The StateMachine Module,"W Mahnke, C Mathis, H Steiert",VLDB,2002
71780,conf/vldb/GarofalakisG01,Approximate Query Processing: Taming the TeraBytes,"M Garofalakis, P Gibbons",VLDB,2001
71781,conf/vldb/LiuJ02,A-TOPSS - A Publish/Subscribe System Supporting Approximate Matching,"H Liu, H Jacobsen",VLDB,2002
71785,conf/vldb/BohannonFHRRS02,LegoDB: Customizing Relational Storage for XML Documents,"P Bohannon, J Freire, J Haritsa, M Ramanath, P Roy, J Siméon",VLDB,2002
71788,conf/vldb/StanoiRAA01,Discovery of Influence Sets in Frequently Updated Databases,"I Stanoi, M Riedewald, D Agrawal, A Abbadi",VLDB,2001
71789,conf/vldb/AmirKN01,Analyzing Quantitative Databases: Image is Everything,"A Amir, R Kashi, N Netanyahu",VLDB,2001
71793,conf/vldb/DayalHL01,"Business Process Coordination: State of the Art, Trends, and Open Issues","U Dayal, M Hsu, R Ladin",VLDB,2001
71794,conf/vldb/CherniackFZ01,Data Management for Pervasive Computing,"M Cherniack, M Franklin, S Zdonik",VLDB,2001
71797,conf/vldb/CeriM03,"Constructing and integrating data-centric Web Applications: Methods, Tools, and Techniques",,,2003
71803,conf/vldb/Nori02,eBusiness Standards and Architectures,,,2002
71804,conf/vldb/GarofalakisG02,Querying and Mining Data Streams: You Only Get One Look,,,2002
71810,conf/vldb/WeikumMHZ02,Self-tuning Database Technology and Information Services: from Wishful Thinking to Viable Engineering,"G Weikum, A Mönkeberg, C Hasse, P Zabback",VLDB,2002
71815,conf/vldb/Moerkotte02,Incorporating XSL Processing into Database Engines,G Moerkotte,VLDB,2002
71816,conf/vldb/ParkMC02,Structural Function Inlining Technique for Structurally Recursive XML Queries,"C Park, J Min, C Chung",VLDB,2002
71819,conf/vldb/AgrawalK02,Watermarking Relational Databases,"R Agrawal, J Kiernan",VLDB,2002
71820,conf/vldb/AgrawalKSX02,Hippocratic Databases,"R Agrawal, J Kiernan, R Srikant, Y Xu",VLDB,2002
71825,conf/vldb/LudascherMP02,A Transducer-Based XML Query Processor,"B Ludäscher, P Mukhopadhyay, Y Papakonstantinou",VLDB,2002
71827,conf/vldb/ChanGR02,RE-Tree: An Efficient Index Structure for Regular Expressions,"C Chan, M Garofalakis, R Rastogi",VLDB,2002
71832,conf/vldb/ChenHWW02,Multi-Dimensional Regression Analysis of Time-Series Data Streams,"Y Chen, G Dong, J Han, B Wah, J Wang",VLDB,2002
71835,conf/vldb/LempelM02,Optimizing Result Prefetching in Web Search Engines with Segmented Indices,"R Lempel, S Moran",VLDB,2002
71837,conf/vldb/MankuM02,Approximate Frequency Counts over Data Streams,"G Manku, R Motwani",VLDB,2002
71841,conf/vldb/IpeirotisG02,Distributed Search over the Hidden Web: Hierarchical Database Sampling and Selection,"P Ipeirotis, L Gravano",VLDB,2002
71842,conf/vldb/Keogh02,Exact Indexing of Dynamic Time Warping,E Keogh,VLDB,2002
71845,conf/vldb/PolyzotisG02,Structure and Value Synopses for XML Data Graphs,"N Polyzotis, M Garofalakis",VLDB,2002
71847,conf/vldb/Uhl02,A Bandwidth Model for Internet Search,A Uhl,VLDB,2002
71848,conf/vldb/ShahRS02,Maintaining Coherency of Dynamic Data in Cooperating Repositories,"S Shah, K Ramamritham, P Shenoy",VLDB,2002
71855,conf/vldb/HammelP02,Searching on the Secondary Structure of Protein Sequences,"L Hammel, J Patel",VLDB,2002
71856,conf/vldb/StolteA02,Efficient Exploration of Large Scientific Databases,"E Stolte, G Alonso",VLDB,2002
71858,conf/vldb/PopaVMHF02,Translating Web Data,"L Popa, Y Velegrakis, R Miller, M Hernández, R Fagin",VLDB,2002
71860,journals/tods/Chen95,Declarative Updates of Relational Databases,W Chen,ACM Trans. Database Syst.,1995
71873,journals/tods/ChenHM95,An Execution Model for Limited Ambiguity Rules and Its Application to Derived Data Update,"I Chen, R Hull, D McLeod",ACM Trans. Database Syst.,1995
71877,journals/tods/BunemanO96,Polymorphism and Type Inference in Database Programming,"P Buneman, A Ohori",ACM Trans. Database Syst.,1996
71887,journals/tods/Galindo-LegariaR97,Outerjoin Simplification and Reordering for Query Optimization,"C Galindo-Legaria, A Rosenthal",ACM Trans. Database Syst.,1997
71890,journals/tods/PetersO97,An Axiomatic Model of Dynamic Schema Evolution in Objectbase Systems,"R Peters, M Özsu",ACM Trans. Database Syst.,1997
71897,journals/vldb/HelmerM03,A performance study of four index structures for set-valued attributes of low cardinality,"S Helmer, G Moerkotte",VLDB J.,2003
71906,journals/vldb/AtluriJY03,Guest editorial,,,2003
71908,journals/tods/SalemGS94,Altruistic Locking,"K Salem, H Garcia-Molina, J Shands",ACM Trans. Database Syst.,1994
71909,journals/tods/CliffordC94,On Completeness of Historical Relational Query Languages,"J Clifford, A Croker, A Tuzhilin",ACM Trans. Database Syst.,1994
71911,journals/tods/OliverS94,A Taxonomy for Secure Object-Oriented Databases,"M Olivier, S Solms",ACM Trans. Database Syst.,1994
71916,journals/tods/RosenthalR94,Tools and Transformations - Rigorous and Otherwise - for Practical Database Design,"A Rosenthal, D Reiner",ACM Trans. Database Syst.,1994
71918,journals/tods/ChrysanthisR94,Synthesis of Extended Transaction Models Using ACTA,"P Chrysanthis, K Ramamritham",ACM Trans. Database Syst.,1994
71919,journals/tods/PolyzoisG94,Evaluation of Remote Backup Algorithms for Transaction-Processing Systems,"C Polyzois, H Garcia-Molina",ACM Trans. Database Syst.,1994
71923,journals/tods/CuiWW00,Tracing the lineage of view data in a warehousing environment,"Y Cui, J Widom, J Wiener",ACM Trans. Database Syst.,2000
71924,journals/tods/ParsonsW00,Emancipating instances from the tyranny of classes in information modeling,"J Parsons, Y Wand",ACM Trans. Database Syst.,2000
71925,journals/tods/Bohm00,A cost model for query processing in high dimensional data spaces,C Böhm,ACM Trans. Database Syst.,2000
71926,journals/tods/KossmannS00,Iterative dynamic programming: a new class of query optimization algorithms,"D Kossmann, K Stocker",ACM Trans. Database Syst.,2000
71927,journals/tods/Lerner00,A model for compound type changes encountered in schema evolution,B Lerner,ACM Trans. Database Syst.,2000
71931,journals/tods/DekhtyarRS01,"Probabilistic temporal databases, I: algebra","A Dekhtyar, R Ross, V Subrahmanian",ACM Trans. Database Syst.,2001
71932,journals/tods/HsuSY01,I/O reference behavior of production database workloads and the TPC benchmarks - an analysis at the logical level,"W Hsu, A Smith, H Young",ACM Trans. Database Syst.,2001
71933,journals/tods/BohlenJS00,Temporal statement modifiers,"M Böhlen, C Jensen, R Snodgrass",ACM Trans. Database Syst.,2000
71941,journals/tods/Snodgrass01,Editorial,,,2001
71944,journals/tods/ChomickiTB01,Querying ATSQL databases with temporal logic,"J Chomicki, D Toman, M Böhlen",ACM Trans. Database Syst.,2001
71946,journals/tods/JajodiaSSS01,Flexible support for multiple access control policies,"S Jajodia, P Samarati, M Sapino, V Subrahmanian",ACM Trans. Database Syst.,2001
71950,journals/tods/SchuldtABS02,Atomicity and isolation for transactional processes,"H Schuldt, G Alonso, C Beeri, H Schek",ACM Trans. Database Syst.,2002
71954,journals/tods/LakshmananSS01,SchemaSQL: An extension to SQL for multidatabase interoperability,"L Lakshmanan, F Sadri, S Subramanian",ACM Trans. Database Syst.,2001
71957,journals/tods/TariSS97,Object Normal Forms and Dependency Constraints for Object-Oriented Schemata,"Z Tari, J Stokes, S Spaccapietra",ACM Trans. Database Syst.,1997
71958,journals/tods/ZaharioudakisCF97,"Adaptive, Fine-Grained Sharing in a Client-Server OODBMS: A Callback-Based Approach","M Zaharioudakis, M Carey, M Franklin",ACM Trans. Database Syst.,1997
71962,journals/tods/WangBBJ97,Logical Design for Temporal Databases with Multiple Granularities,"X Wang, C Bettini, A Brodsky, S Jajodia",ACM Trans. Database Syst.,1997
71963,journals/tods/LiuHD98,Multiview Access Protocols for Large-Scale Replication,"X Liu, A Helal, W Du",ACM Trans. Database Syst.,1998
71964,journals/tods/MehrotraRKS98,Ensuring Consistency in Multidatabases by Preserving Two-Level Serializability,"S Mehrotra, R Rastogi, H Korth, A Silberschatz",ACM Trans. Database Syst.,1998
71971,journals/tods/KonopnickiS98,Information Gathering in the World-Wide Web: The W3QL Query Language and the W3QS System,"D Konopnicki, O Shmueli",ACM Trans. Database Syst.,1998
71972,journals/tods/LeveneL99,Database Design for Incomplete Relations,"M Levene, G Loizou",ACM Trans. Database Syst.,1999
71973,journals/tods/Wijsen99,Temporal FDs on Complex Objects,J Wijsen,ACM Trans. Database Syst.,1999
71975,journals/tods/CastanoAFP98,Conceptual Schema Analysis: Techniques and Applications,"S Castano, V Antonellis, M Fugini, B Pernici",ACM Trans. Database Syst.,1998
71977,journals/tods/ZobelMR98,Inverted Files Versus Signature Files for Text Indexing,"J Zobel, A Moffat, K Ramamohanarao",ACM Trans. Database Syst.,1998
71978,journals/tods/SistlaWYS98,Towards a Theory of Cost Management for Digital Libraries and Electronic Commerce,"A Sistla, O Wolfson, Y Yesha, R Sloan",ACM Trans. Database Syst.,1998
71979,journals/tods/BozkayaO99,Indexing Large Metric Spaces for Similarity Search Queries,"T Bozkaya, Z Özsoyoglu",ACM Trans. Database Syst.,1999
