tid,id,title,authors,venue,year
70847,conf/sigmod/ZhaoDN97,An Array-Based Algorithm for Simultaneous Multidimensional Aggregates,"Y Zhao, P Deshpande, J Naughton",SIGMOD Conference,1997
70848,conf/vldb/SindoniTABFGMPPT01,SIT-IN: a Real-Life Spatio-Temporal Information System,"G Sindoni, L Tininini, A Ambrosetti, C Bedeschi, S Francisci, O Gargano, R Molinaro, M Paolucci, P Patteri, P Ticca",VLDB,2001
70851,conf/sigmod/KornackerMH97,Concurrency and Recovery in Generalized Search Trees,"M Kornacker, C Mohan, J Hellerstein",SIGMOD Conference,1997
70859,conf/vldb/PapadiasT01,MV3R-Tree: A Spatio-Temporal Access Method for Timestamp and Interval Queries,"Y Tao, D Papadias",VLDB,2001
70862,conf/sigmod/Eaton98,Managing Large Systems with DB2 UDB,C Eaton,SIGMOD Conference,1998
70866,conf/sigmod/BlakeleyP98,Microsoft Universal Data Access Platform,"J Blakeley, M Pizzo",SIGMOD Conference,1998
70876,conf/vldb/Duranti01,The Long-Term Preservation of Authentic Electronic Records,L Duranti,VLDB,2001
70878,conf/sigmod/Kennamer98,Microsoft.com: A High-Scale Data Management and Transaction Processing Solution,S Kennamer,SIGMOD Conference,1998
70879,conf/vldb/MarronL01,On Processing XML in LDAP,"P Marrón, G Lausen",VLDB,2001
70886,conf/vldb/Huyn01,Scientific OLAP for the Biotech Domain,N Huyn,VLDB,2001
70888,conf/vldb/BouguettayaEMO01,Ontology-based Support for Digital Government,"A Bouguettaya, A Elmagarmid, B Medjahed, M Ouzzani",VLDB,2001
70890,conf/sigmod/RamakrishnanD98,The PointCast Network,"S Ramakrishnan, V Dayal",SIGMOD Conference,1998
70893,conf/vldb/NetzCBF00,Integration of Data Mining with Database Technology,"A Netz, S Chaudhuri, J Bernhardt, U Fayyad",VLDB,2000
70895,conf/sigmod/CareyK97,"\On Saying \""\""Enough Already!\""\"" in SQL\""""","M Carey, D Kossmann",SIGMOD Conference,1997
70896,conf/vldb/KemperKW99,Generalised Hash Teams for Join and Group-by,"A Kemper, D Kossmann, C Wiesner",VLDB,1999
70897,conf/vldb/Carey00,"Toto, We're Not in Kansas Anymore: On Transitioning from Research to the Real (Invited Industrial Talk)",M Carey,VLDB,2000
70898,conf/sigmod/GravanoCGP97,STARTS: Stanford Proposal for Internet Meta-Searching (Experience Paper),"L Gravano, K Chang, H Garcia-Molina, A Paepcke",SIGMOD Conference,1997
70900,conf/vldb/Blecken00,Media360 Workflow-Implementing a Workflow Engine Inside a Database,C Blecken,VLDB,2000
70902,conf/vldb/CasatiS00,Process Automation as the Foundation for E-Business,"F Casati, M Shan",VLDB,2000
70904,conf/sigmod/KoudasS97,Size Separation Spatial Join,"N Koudas, K Sevcik",SIGMOD Conference,1997
70908,conf/vldb/Ladin00,The Zero Latency Enterprise,D Liles,VLDB,2000
70911,conf/vldb/Deshpande00,Linking Business to Deliver Value: A Data Management Challenge,A Deshpande,VLDB,2000
70914,conf/vldb/Team00,"High-Performance and Scalability through Application Tier,In-Memory Data Management",,VLDB,2000
70920,conf/vldb/Schek00,"Panel: Future Directions of Database Research - The VLDB Broadening Strategy, Part 1",H Schek,VLDB,2000
70922,conf/sigmod/CareyDNAGS97,The BUCKY Object-Relational Benchmark (Experience Paper),"M Carey, D DeWitt, J Naughton, M Asgarian, P Brown, J Gehrke, D Shah",SIGMOD Conference,1997
70924,conf/sigmod/YangM97,Association Rules over Interval Data,"R Miller, Y Yang",SIGMOD Conference,1997
70927,conf/vldb/LudasaherGM00,Model-Based Information Integration in a Neuroscience Mediator System,"B Ludäscher, A Gupta, M Martone",VLDB,2000
70928,conf/sigmod/Kramer97,Databases on the Web: Technologies for Federation Architectures and Case Studies (Tutorial),R Kramer,SIGMOD Conference,1997
70934,conf/sigmod/HanKS97,GeoMiner: A System Prototype for Spatial Data Mining,"J Han, K Koperski, N Stefanovic",SIGMOD Conference,1997
70935,conf/sigmod/RafieiM97,Similarity-Based Queries for Time Series Data,"D Rafiei, A Mendelzon",SIGMOD Conference,1997
70937,conf/sigmod/ChawatheG97,Meaningful Change Detection in Structured Data,"S Chawathe, H Garcia-Molina",SIGMOD Conference,1997
70938,conf/vldb/HelalL00,Rainbow: Distributed Database System for Classroom Education and Experimental Research,"A Helal, H Li",VLDB,2000
70947,conf/sigmod/GebhardtJJ97,A Toolkit for Negotiation Support Interfaces to Multi-Dimensional Data,"M Gebhardt, M Jarke, S Jacobs",SIGMOD Conference,1997
70951,conf/vldb/HinneburgAK00,What Is the Nearest Neighbor in High Dimensional Spaces?,"A Hinneburg, C Aggarwal, D Keim",VLDB,2000
70955,conf/vldb/JiangSLB00,The BT-tree: A Branched and Temporal Access Method,"L Jiang, B Salzberg, D Lomet, M García",VLDB,2000
70956,conf/sigmod/IoannidisLANT97,ZOO: A Desktop Emperiment Management Environment,"Y Ioannidis, M Livny, A Ailamaki, A Narayanan, A Therber",SIGMOD Conference,1997
70959,conf/vldb/GuntzerBK00,Optimizing Multi-Feature Queries for Image Databases,"U Güntzer, W Balke, W Kießling",VLDB,2000
70960,conf/sigmod/Chakravarthy97,SENTINEL: An Object-Oriented DBMS With Event-Based Rules,S Chakravarthy,SIGMOD Conference,1997
70961,conf/vldb/KriegelPS00,Managing Intervals Efficiently in Object-Relational Databases,"H Kriegel, M Pötke, T Seidl",VLDB,2000
70962,conf/sigmod/SeshadriP97,PREDATOR: An OR-DBMS with Enhanced Data Types,"P Seshadri, M Paskin",SIGMOD Conference,1997
70964,conf/vldb/PfoserJT00,Novel Approaches in Query Processing for Moving Object Trajectories,"D Pfoser, C Jensen, Y Theodoridis",VLDB,2000
70968,conf/vldb/RamasamyPNK00,"Set Containment Joins: The Good, The Bad and The Ugly","K Ramasamy, J Patel, J Naughton, R Kaushik",VLDB,2000
70970,conf/vldb/ManegoldBK00,What Happens During a Join? Dissecting CPU and Memory Optimization Effects,"S Manegold, P Boncz, M Kersten",VLDB,2000
70974,conf/sigmod/BohrerBBCFHKKMNRRSUUW97a,The InfoSleuth Project,"R Jr., W Bohrer, R Brice, A Cichocki, J Fowler, A Helal, V Kashyap, T Ksiezyk, G Martin, M Nodine, M Rashid, M Rusinkiewicz, R Shea, C Unnikrishnan, A Unruh, D Woelk",SIGMOD Conference,1997
70975,conf/vldb/Sarawagi00,User-Adaptive Exploration of Multidimensional Data,S Sarawagi,VLDB,2000
70976,conf/sigmod/GeneserethKD97,Infomaster: An Information Integration System,"M Genesereth, A Keller, O Duschka",SIGMOD Conference,1997
70977,conf/vldb/SrinivasanDFCJYKTDB00,Oracle8i Index-Organized Table and Its Application to New Domains,"J Srinivasan, S Das, C Freiwald, E Chong, M Jagannath, A Yalamanchi, R Krishnan, A Tran, S DeFazio, J Banerjee",VLDB,2000
70981,conf/sigmod/WangSCRZP97,Structural Matching and Discovery in Document Databases,"J Wang, D Shasha, G Chang, L Relihan, K Zhang, G Patel",SIGMOD Conference,1997
70985,conf/vldb/MendelzonV00,Temporal Queries in OLAP,"A Mendelzon, A Vaisman",VLDB,2000
70988,conf/sigmod/Chaudhuri97,Query Optimization at the Crossroads (Panel),S Chaudhuri,SIGMOD Conference,1997
70995,conf/vldb/OlstonW00,Offering a Precision-Performance Tradeoff for Aggregation Queries over Replicated Data,"C Olston, J Widom",VLDB,2000
70996,conf/sigmod/AtzeniT97,MDM: a Multiple-Data-Model Tool for the Management of Heterogeneous Database Schemes,"P Atzeni, R Torlone",SIGMOD Conference,1997
70998,conf/vldb/GrumbachRS00,Manipulating Interpolated Data is Easier than You Thought,"S Grumbach, P Rigaux, L Segoufin",VLDB,2000
71001,conf/sigmod/BressanGFJHKLMPQSS97,The COntext INterchange Mediator Prototype,"S Bressan, C Goh, K Fynn, M Jakobisiak, K Hussein, H Kon, T Lee, S Madnick, T Pena, J Qu, A Shum, M Siegel",SIGMOD Conference,1997
71002,conf/vldb/ChakrabartiM00,Local Dimensionality Reduction: A New Approach to Indexing High Dimensional Spaces,"K Chakrabarti, S Mehrotra",VLDB,2000
71005,conf/vldb/WangHH00,Mining Frequent Itemsets Using Support Constraints,"K Wang, Y He, J Han",VLDB,2000
71006,conf/sigmod/ColbyKLMR97,Supporting Multiple View Maintenance Policies,"L Colby, A Kawaguchi, D Lieuwen, I Mumick, K Ross",SIGMOD Conference,1997
71011,conf/vldb/Taylor00,Concurrency in the Data Warehouse,R Taylor,VLDB,2000
71015,conf/sigmod/MotakisZ97,Temporal Aggregation in Active Database Rules,"I Motakis, C Zaniolo",SIGMOD Conference,1997
71016,conf/vldb/SchaeferBBJ00,Controlling Data Warehouses with Knowledge Networks,"E Schaefer, J Becker, A Boehmer, M Jarke",VLDB,2000
71021,conf/sigmod/FranklinJK96,Performance Tradeoffs for Client-Server Query Processing,"M Franklin, B Jónsson, D Kossmann",SIGMOD Conference,1996
71030,conf/sigmod/ZhangRL96,BIRCH: An Efficient Data Clustering Method for Very Large Databases,"T Zhang, R Ramakrishnan, M Livny",SIGMOD Conference,1996
71032,conf/sigmod/AdaliCPS96,Query Caching and Optimization in Distributed Mediator Systems,"S Adali, K Candan, Y Papakonstantinou, V Subrahmanian",SIGMOD Conference,1996
71039,conf/sigmod/ChaudhuriG96,Optimizing Queries over Multimedia Repositories,"S Chaudhuri, L Gravano",SIGMOD Conference,1996
71040,conf/vldb/HaasKU99,Loading a Cache with Query Results,"L Haas, D Kossmann, I Ursu",VLDB,1999
71041,conf/vldb/McHughW99,Query Optimization for XML,"J McHugh, J Widom",VLDB,1999
71042,conf/sigmod/GoelI96,SQL Query Optimization: Reordering for a General Class of Queries,"P Goel, B Iyer",SIGMOD Conference,1996
71044,conf/sigmod/BilirisFOP96,BeSS: Storage Support for Interactive Visualization Systems,"A Biliris, T Funkhouser, W O'Connell, E Panagos",SIGMOD Conference,1996
71046,conf/sigmod/HungYK96,CapBasED-AMS: A Capability-based and Event-driven Activity Management System,"P Hung, H Yeung, K Karlapalem",SIGMOD Conference,1996
71047,conf/vldb/NaumannLF99,Quality-driven Integration of Heterogenous Information Systems,"F Naumann, U Leser, J Freytag",VLDB,1999
71048,conf/sigmod/FukudaMMT96,"Data Mining Using Two-Dimensional Optimized Accociation Rules: Scheme, Algorithms, and Visualization","T Fukuda, Y Morimoto, S Morishita, T Tokuyama",SIGMOD Conference,1996
71049,conf/sigmod/SrikantA96,Mining Quantitative Association Rules in Large Relational Tables,"R Srikant, R Agrawal",SIGMOD Conference,1996
71050,conf/vldb/JosifovskiR99,Integrating Heterogenous Overlapping Databases through Object-Oriented Transformations,"V Josifovski, T Risch",VLDB,1999
71055,conf/sigmod/LeflerSW96,DBSim: A Simulation Tool for Predicting Database Performance,"M Lefler, M Stokrp, C Wong",SIGMOD Conference,1996
71062,conf/vldb/Campbell99,"The New Locking, Logging, and Recovery Architecture of Microsoft SQL Server 7.0",D Campbell,VLDB,1999
71065,conf/vldb/DarmontS99,VOODB: A Generic Discrete-Event Random Simulation Model To Evaluate the Performances of OODBs,"J Darmont, M Schneider",VLDB,1999
71067,conf/sigmod/BrownCL96,Goal-Oriented Buffer Management Revisited,"K Brown, M Carey, M Livny",SIGMOD Conference,1996
71070,conf/sigmod/ChristophidesCM96,Evaluating Queries with Generalized Path Expressions,"V Christophides, S Cluet, G Moerkotte",SIGMOD Conference,1996
71074,conf/sigmod/ColbyGLMT96,Algorithms for Deferred View Maintenance,"L Colby, T Griffin, L Libkin, I Mumick, H Trickey",SIGMOD Conference,1996
71075,conf/vldb/Norvag99,The Persistent Cache: Improving OID Indexing in Temporal Object-Oriented Database Systems,K Nřrvĺg,VLDB,1999
71076,conf/sigmod/LibkinMW96,"A Query Language for Multidimensional Arrays: Design, Implementation, and Optimization Techniques","L Libkin, R Machlin, L Wong",SIGMOD Conference,1996
71078,conf/sigmod/Agarwal96,A Super Scalar Sort Algorithm for RISC Processors,R Agarwal,SIGMOD Conference,1996
71086,conf/sigmod/Freeston95,A General Solution of the n-dimensional B-tree Problem,M Freeston,SIGMOD Conference,1995
71090,conf/sigmod/BerensonBGMOO95,A Critique of ANSI SQL Isolation Levels,"H Berenson, P Bernstein, J Gray, J Melton, E O'Neil, P O'Neil",SIGMOD Conference,1995
71091,conf/sigmod/RothAHCCFSTW96,The Garlic Project,"M Roth, M Arya, L Haas, M Carey, W Cody, R Fagin, P Schwarz, J II, E Wimmers",SIGMOD Conference,1996
71092,conf/vldb/DattaRT99,Curio: A Novel Solution for Efficient Storage and Indexing in Data Warehouses,"A Datta, K Ramamritham, H Thomas",VLDB,1999
71094,conf/sigmod/RundensteinerKRCJM96,The MultiView Project: Object-Oriented View Technology and Applications,"E Rundensteiner, H Kuno, Y Ra, V Crestana-Taube, M Jones, P Marrón",SIGMOD Conference,1996
71095,conf/sigmod/FukudaMMT96a,SONAR: System for Optimized Numeric AssociationRules,"T Fukuda, Y Morimoto, S Morishita, T Tokuyama",SIGMOD Conference,1996
71098,conf/vldb/ChanI99,Hierarchical Prefix Cubes for Range-Sum Queries,"C Chan, Y Ioannidis",VLDB,1999
71099,conf/sigmod/ChooOLCGBPS96,Prospector: A Content-Based Multimedia Server for Massively Parallel Architectures,"S Choo, W O'Connell, G Linderman, H Chen, K Ganapathi, A Biliris, E Panagos, D Schrader",SIGMOD Conference,1996
71103,conf/sigmod/BohmA96,HyperStorM - Administering Structured Documents Using Object-Oriented Database Technology,"K Böhm, K Aberer",SIGMOD Conference,1996
71110,conf/vldb/RothOH99,Cost Models DO Matter: Providing Cost Information for Diverse Data Sources in a Federated System,"M Roth, F Ozcan, L Haas",VLDB,1999
71119,conf/sigmod/CherniackZ96,Rule Languages and Internal Algebras for Rule-Based Optimizers,"M Cherniack, S Zdonik",SIGMOD Conference,1996
71121,conf/vldb/BamfordAP99,A Scalable and Highly Available Networked Database Architecture,"R Bamford, R Ahad, A Pruscino",VLDB,1999
71124,conf/vldb/BernsteinPS99,Context-Based Prefetch for Implementing Objects on Relations,"P Bernstein, S Pal, D Shutt",VLDB,1999
71125,conf/sigmod/McAuliffeCS96,Towards Effective and Efficient Free Space Management,"M McAuliffe, M Carey, M Solomon",SIGMOD Conference,1996
71129,conf/vldb/DyresonBJ99,Capturing and Querying Multiple Aspects of Semistructured Data,"C Dyreson, M Böhlen, C Jensen",VLDB,1999
71130,conf/sigmod/GarofalakisI96,Multi-dimensional Resource Scheduling for Parallel Queries,"M Garofalakis, Y Ioannidis",SIGMOD Conference,1996
71133,conf/vldb/Chawathe99,Comparing Hierarchical Data in External Memory,S Chawathe,VLDB,1999
71136,conf/vldb/Sarawagi99,Explaining Differences in Multidimensional Aggregates,S Sarawagi,VLDB,1999
71141,conf/sigmod/PatelD96,Partition Based Spatial-Merge Join,"J Patel, D DeWitt",SIGMOD Conference,1996
71152,conf/sigmod/ParkCY95,An Effective Hash Based Algorithm for Mining Association Rules,"J Park, M Chen, P Yu",SIGMOD Conference,1995
71155,conf/sigmod/DavisonG95,Dynamic Resource Brokering for Multi-User Query Execution,"D Davison, G Graefe",SIGMOD Conference,1995
71156,conf/vldb/BamfordBKM98,Architecture of Oracle Parallel Server,"R Bamford, D Butler, B Klots, N MacNaughton",VLDB,1998
71160,conf/vldb/Vieille98,From Data Independence to Knowledge Independence: An on-going Story,L Vieille,VLDB,1998
71170,conf/sigmod/LuMSS95,Efficient Maintenance of Materialized Mediated Views,"J Lu, G Moerkotte, J Schü, V Subrahmanian",SIGMOD Conference,1995
71173,conf/vldb/RiedelGF98,Active Storage for Large-Scale Data Mining and Multimedia,"E Riedel, G Gibson, C Faloutsos",VLDB,1998
71174,conf/sigmod/Ivinskis95,High Availability of Commercial Applications,K Ivinskis,SIGMOD Conference,1995
71175,conf/sigmod/Hope95,Enterprise Transaction Processing on Windows NT,G Hope,SIGMOD Conference,1995
71177,conf/vldb/George98,DMS: A Parallel Data Mining Server,F George,VLDB,1998
71178,conf/sigmod/Gettys95,DIRECTV and Oracle Rdb: The Challenges of VLDB Transaction Processing,W Gettys,SIGMOD Conference,1995
71181,conf/sigmod/BaruFGHJPW95,An Overview of DB2 Parallel Edition,"C Baru, G Fecteau, A Goyal, H Hsiao, A Jhingran, S Padmanabhan, W Wilson",SIGMOD Conference,1995
71182,conf/vldb/WeberSB98,A Quantitative Analysis and Performance Study for Similarity-Search Methods in High-Dimensional Spaces,"R Weber, H Schek, S Blott",VLDB,1998
71183,conf/sigmod/Squire95,Data Extraction and Transformation for the Data Warehouse,C Squire,SIGMOD Conference,1995
71184,conf/vldb/CareyK98,Reducing the Braking Distance of an SQL Query Engine,"M Carey, D Kossmann",VLDB,1998
71185,conf/sigmod/Olson95,Cover Your Assets,M Olson,SIGMOD Conference,1995
71188,conf/vldb/GingrasL98,nD-SQL: A Multi-Dimensional Language for Interoperability and OLAP,"F Gingras, L Lakshmanan",VLDB,1998
71190,conf/vldb/RezendeH98,The Heterogeneity Problem and Middleware Technology: Experiences with and Performance of Database Gateways,"F Rezende, K Hergula",VLDB,1998
71191,conf/vldb/BraumandlCK98,Evaluating Functional Joins Along Nested Reference Sets in Object-Relational and Object-Oriented Databases,"R Braumandl, J Claußen, A Kemper",VLDB,1998
71192,conf/sigmod/ImielinskiV95,DataMine - Interactive Rule Discovery System,"T Imielinski, A Virmani",SIGMOD Conference,1995
71205,conf/sigmod/ArefBV95,The Handwritten Trie: Indexing Electronic Ink,"W Aref, D Barbará, P Vallabhaneni",SIGMOD Conference,1995
71211,conf/sigmod/BettiniWBJ95,Semantic Assumptions and Query Evaluation in Temporal Databases,"C Bettini, X Wang, E Bertino, S Jajodia",SIGMOD Conference,1995
71218,conf/sigmod/SistlaW95,Temporal Conditions and Integrity Constraints in Active Database Systems,"A Sistla, O Wolfson",SIGMOD Conference,1995
71222,conf/sigmod/BhargavaGI95,Hypergraph Based Reorderings of Outer Join Queries with Complex Predicates,"G Bhargava, P Goel, B Iyer",SIGMOD Conference,1995
71223,conf/sigmod/FreedmanD95,The SPIFFI Scalable Video-on-Demand System,"C Freedman, D DeWitt",SIGMOD Conference,1995
71225,conf/vldb/FlorescuLSY99,Optimization of Run-time Management of Data Intensive Web-sites,"D Florescu, A Levy, D Suciu, K Yagoub",VLDB,1999
71226,conf/sigmod/GriffinL95,Incremental Maintenance of Views with Duplicates,"T Griffin, L Libkin",SIGMOD Conference,1995
71230,conf/vldb/Tygar98,Atomicity versus Anonymity: Distributed Transactions for Electronic Commerce,J Tygar,VLDB,1998
71231,conf/vldb/HelmerWM98,Diag-Join: An Opportunistic Join Algorithm for 1:N Relationships,"S Helmer, T Westmann, G Moerkotte",VLDB,1998
71232,conf/sigmod/Team95c,Upsizing from File Server to Clent Server Architectures,T Team,SIGMOD Conference,1995
71235,conf/sigmod/BunemanM95,The Data That You Won't Find in Databases: Tutorial panel on data exchange formats,"P Buneman, D Maier",SIGMOD Conference,1995
71238,conf/sigmod/Moore95,The Lotus Notes Storage System,K Moore,SIGMOD Conference,1995
71240,conf/sigmod/Ellison95,Keynote Address,,,1995
71245,conf/sigmod/Golding95,Things Every Update Replication Customer Should Know,R Golding,SIGMOD Conference,1995
71246,conf/vldb/OoiGT98,Fast High-Dimensional Data Search in Incomplete Databases,"B Ooi, C Goh, K Tan",VLDB,1998
71249,conf/sigmod/Edelstein95,Research and Products: Are They Relevant To Each Other? (Panel),H Edelstein,SIGMOD Conference,1995
71251,conf/sigmod/Bampahl95,Real World Requirements for Decision Support - Implications for RDBMS,S Bansal,SIGMOD Conference,1995
71261,conf/sigmod/Levine95,Order-of-Magnitude Advantage of TPC-C Though Massive Parallelism,C Levine,SIGMOD Conference,1995
71262,conf/vldb/PapadiasMD98,Algorithms for Querying by Spatial Structure,"D Papadias, N Mamoulis, V Delis",VLDB,1998
71269,conf/sigmod/Sheth95,"Workflow Automation: Applications, Technology, and Research (Tutorial)",,,1995
71271,conf/sigmod/Norrie95,Integration Approaches for CIM,,,1995
71274,conf/vldb/ZhangL98,Buffering and Read-Ahead Strategies for External Mergesort,"W Zhang, P Larson",VLDB,1998
71275,conf/vldb/ChaudhuriN97,An Efficient Cost-Driven Index Selection Tool for Microsoft SQL Server,"S Chaudhuri, V Narasayya",VLDB,1997
71276,conf/sigmod/GatziuGD95,The SAMOS Active DBMS Prototype,"S Gatziu, A Geppert, K Dittrich",SIGMOD Conference,1995
71277,conf/sigmod/ThomasDM95,Design and Implementation of Advanced Knowledge Processing in the KDMS KRISYS (Demonstration Description),"J Thomas, S Deßloch, N Mattos",SIGMOD Conference,1995
71278,conf/vldb/YangKL97,Algorithms for Materialized View Design in Data Warehousing Environment,"J Yang, K Karlapalem, Q Li",VLDB,1997
71281,conf/vldb/RossS97,Fast Computation of Sparse Datacubes,"K Ross, D Srivastava",VLDB,1997
71282,conf/sigmod/MassariPSC95,QBI: Query By Icons,"A Massari, S Pavani, L Saladini, P Chrysanthis",SIGMOD Conference,1995
71283,conf/vldb/HumborstadSHT97,1-Safe Algorithms for Symmetric Site Configurations,"R Humborstad, M Sabaratnam, S Hvasshovd, Ř Torbjřrnsen",VLDB,1997
71284,conf/sigmod/BuchmannDZH95,The REACH Active OODBMS,"A Buchmann, A Deutsch, J Zimmermann, M Higa",SIGMOD Conference,1995
71286,conf/sigmod/AshleyFHLNP95,The Query By Image Content (QBIC) System,"J Ashley, M Flickner, J Hafner, D Lee, W Niblack, D Petkovic",SIGMOD Conference,1995
71288,conf/vldb/VassalosP97,Describing and Using Query Capabilities of Heterogeneous Sources,"V Vassalos, Y Papakonstantinou",VLDB,1997
71291,conf/sigmod/DreyerDS95,Using the CALANDA Time Series Management System,"W Dreyer, A Dittrich, D Schmidt",SIGMOD Conference,1995
71298,conf/sigmod/Team95b,SHORE: Combining the Best Features of OODBMS and File Systems,S Team,SIGMOD Conference,1995
71302,conf/sigmod/LiC95,Semint: A System Prototype for Semantic Integration in Heterogeneous Databases,"W Li, C Clifton",SIGMOD Conference,1995
71303,conf/vldb/ZhangL97,Dynamic Memory Adjustment for External Mergesort,"W Zhang, P Larson",VLDB,1997
71305,conf/vldb/AshwinRSSS97,Garbage Collection in Object Oriented Databases Using Transactional Cyclic Reference Counting,"S Ashwin, P Roy, S Seshadri, A Silberschatz, S Sudarshan",VLDB,1997
71308,conf/vldb/GibbonsMP97,Fast Incremental Maintenance of Approximate Histograms,"P Gibbons, Y Matias, V Poosala",VLDB,1997
71311,conf/vldb/LeeLWS97,A Region Splitting Strategy for Physical Database Design of Multidimensional File Organizations,"J Lee, Y Lee, K Whang, I Song",VLDB,1997
71312,conf/sigmod/MohanN94,ARIES/CSA: A Method for Database Recovery in Client-Server Architectures,"C Mohan, I Narang",SIGMOD Conference,1994
71325,conf/sigmod/FaloutsosRM94,Fast Subsequence Matching in Time-Series Databases,"C Faloutsos, M Ranganathan, Y Manolopoulos",SIGMOD Conference,1994
71327,conf/sigmod/KrollW94,Distributing a Search Tree Among a Growing Number of Processors,"B Kröll, P Widmayer",SIGMOD Conference,1994
71329,conf/vldb/AlonsoHST97,Distributed Processing over Stand-alone Systems and Applications,"G Alonso, C Hagen, H Schek, M Tresch",VLDB,1997
71330,conf/sigmod/ChristophidesACS94,From Structured Documents to Novel Query Facilities,"V Christophides, S Abiteboul, S Cluet, M Scholl",SIGMOD Conference,1994
71334,conf/vldb/SellisRF97,Multidimensional Access Methods: Trees Have Grown Everywhere,"T Sellis, N Roussopoulos, C Faloutsos",VLDB,1997
71336,conf/vldb/WildfogelY97,Efficient Testing of High Performance Transaction Processing Systems,"D Wildfogel, R Yerneni",VLDB,1997
71337,conf/vldb/Jacobs97,Innovation in Database Management: Computer Science vs. Engineering,K Jacobs,VLDB,1997
71345,conf/sigmod/Mohan94,A Survey and Critique of Advanced Transaction Models,C Mohan,SIGMOD Conference,1994
71347,conf/sigmod/Dietterich94,DEC Data Distributor: for Data Replication and Data Warehousing,D Dietterich,SIGMOD Conference,1994
71348,conf/vldb/Moerkotte98,Small Materialized Aggregates: A Light Weight Index Structure for Data Warehousing,G Moerkotte,VLDB,1998
71355,conf/sigmod/GravanoGT94,The Effectiveness of GlOSS for the Text Database Discovery Problem,"L Gravano, H Garcia-Molina, A Tomasic",SIGMOD Conference,1994
71360,conf/sigmod/ColeG94,Optimization of Dynamic Query Evaluation Plans,"R Cole, G Graefe",SIGMOD Conference,1994
71363,conf/sigmod/BarbaraI94,Sleepers and Workaholics: Caching Strategies in Mobile Environments,"D Barbará, T Imielinski",SIGMOD Conference,1994
71364,conf/vldb/LakshmiZ98,Selectivity Estimation in Extensible Databases - A Neural Network Approach,"M Lakshmi, S Zhou",VLDB,1998
71368,conf/sigmod/BersonGMJ94,Staggered Striping in Multimedia Information Systems,"S Berson, S Ghandeharizadeh, R Muntz, X Ju",SIGMOD Conference,1994
71369,conf/sigmod/Ahn94,Database Issues in Telecommunications Network Management,I Ahn,SIGMOD Conference,1994
71370,conf/vldb/BonczRK98,The Drill Down Benchmark,"P Boncz, T Rühl, F Kwakkel",VLDB,1998
71372,conf/sigmod/GraySEBW94,Quickly Generating Billion-Record Synthetic Databases,"J Gray, P Sundaresan, S Englert, K Baclawski, P Weinberger",SIGMOD Conference,1994
71374,conf/sigmod/DewanSHH94,Predictive Dynamic Load Balancing of Parallel and Distributed Rule and Query Processing,"H Dewan, S Stolfo, M Hernández, J Hwang",SIGMOD Conference,1994
71378,conf/sigmod/ConsensM94,Optimizing Queries on Files,"M Consens, T Milo",SIGMOD Conference,1994
71380,conf/vldb/Schoning98,The ADABAS Buffer Pool Manager,H Schöning,VLDB,1998
71381,conf/sigmod/BrinkhoffKSS94,Multi-Step Processing of Spatial Joins,"T Brinkhoff, H Kriegel, R Schneider, B Seeger",SIGMOD Conference,1994
71382,conf/vldb/CarinoO98,Plan-Per-Tuple Optimization Solution - Parallel Execution of Expensive User-Defined Functions,"F Carińo, W O'Connell",VLDB,1998
71385,conf/sigmod/PangCL94,Managing Memory for Real-Time Queries,"H Pang, M Carey, M Livny",SIGMOD Conference,1994
71389,conf/vldb/RoussopoulosK98,The Cubetree Storage Organization,"N Roussopoulos, Y Kotidis",VLDB,1998
71390,conf/sigmod/WhiteD94,QuickStore: A High Performance Mapped Object Store,"S White, D DeWitt",SIGMOD Conference,1994
71393,conf/sigmod/SeshadriLR94,Sequence Query Processing,"P Seshadri, M Livny, R Ramakrishnan",SIGMOD Conference,1994
71394,conf/vldb/Mina98,MapInfo SpatialWare: A Spatial Information Server for RDBMS,C Mina,VLDB,1998
71398,conf/vldb/Pogue98,Oracle Industrial Exhibit,A Pogue,VLDB,1998
71400,conf/sigmod/Galindo-Legaria94,Outerjoins as Disjunctions,C Galindo-Legaria,SIGMOD Conference,1994
71408,conf/sigmod/Ubell94,The Montage Extensible DataBlade Achitecture,M Ubell,SIGMOD Conference,1994
71409,conf/sigmod/Pirahesh94,Object-Oriented Features of DB2 Client/Server,H Pirahesh,SIGMOD Conference,1994
71414,conf/sigmod/BryanMCLG94,The MEDUSA Project: Autonomous Data Management in a Shared-Nothing Parallel Database Machine,"G Bryan, W Moore, B Curry, K Lodge, J Geyer",SIGMOD Conference,1994
