tid,id,title,authors,venue,year
69611,conf/vldb/RusinkiewiczKTWM95,Towards a Cooperative Transaction Model - The Cooperative Activity Model,"M Rusinkiewicz, W Klas, T Tesch, J Wäsch, P Muth",VLDB,1995
69617,conf/vldb/SubietaKL95,Procedures in Object-Oriented Query Languages,"K Subieta, Y Kambayashi, J Leszczylowski",VLDB,1995
69619,journals/sigmod/Ouksel02,Mining the World Wide Web: An Information Search Approach - Book Review,,,2002
69623,journals/sigmod/Kosch02,MPEG-7 and Multimedia Database Systems,H Kosch,SIGMOD Record,2002
69625,journals/sigmod/RossFS02,Reminiscences on Influential Papers,,,2002
69626,conf/vldb/TreschPL95,Type Classification of Semi-Structured Documents,"M Tresch, N Palmer, A Luniewski",VLDB,1995
69628,conf/vldb/MehtaD95,Managing Intra-operator Parallelism in Parallel Database Systems,"M Mehta, D DeWitt",VLDB,1995
69629,journals/sigmod/CaplinskasEV02,Advances in Databases and Information Systems (ADBIS),"A Caplinskas, J Eder, O Vasilecas",SIGMOD Record,2002
69634,journals/sigmod/Kemper02,Databases and Transaction Processing: An Application-Oriented Approach - Book Review,A Kemper,SIGMOD Record,2002
69635,conf/vldb/HvasshovdTBH95,"The ClustRa Telecom Database: High Availability, High Throughput, and Real-Time Response","S Hvasshovd, Ř Torbjřrnsen, S Bratsberg, P Holager",VLDB,1995
69637,conf/vldb/LuSL95,NeuroRule: A Connectionist Approach to Data Mining,"H Lu, R Setiono, H Liu",VLDB,1995
69638,journals/sigmod/ErdurD02,A Multi-Agent System Infrastructure for Software Component Market-Place: An Ontological Perspective,"R Erdur, O Dikenelli",SIGMOD Record,2002
69640,journals/sigmod/CiliaB02,An Active Functionality Service for E-Business Applications,"M Cilia, A Buchmann",SIGMOD Record,2002
69644,journals/sigmod/Winslett02a,David DeWitt Speaks Out,M Winslett,ecord,2002
69647,conf/vldb/DidriksenGD95,Database De-Centralization - A Practical Approach,"T Didriksen, C Galindo-Legaria, E Dahle",VLDB,1995
69660,conf/vldb/KonopnickiS95,W3QS: A Query System for the World-Wide Web,"D Konopnicki, O Shmueli",VLDB,1995
69662,conf/vldb/WienerN95,OODB Bulk Loading Revisited: The Partitioned-List Approach,"J Wiener, J Naughton",VLDB,1995
69664,conf/vldb/Korth95,The Double Life of the Transaction Abstraction: Fundamental Principle and Evolving System Concept,H Korth,VLDB,1995
69669,conf/vldb/BestavrosB95,Value-cognizant Speculative Concurrency Control,"A Bestavros, S Braoudakis",VLDB,1995
69670,journals/sigmod/Goethals02,Data Warehousing and Business Intelligence for E-Commerce - Book Review,F Goethals,SIGMOD Record,2002
69675,journals/sigmod/Snodgrass02a,TODS Perceptions and Misconceptions,R Snodgrass,SIGMOD Record,2002
69677,journals/sigmod/YaoG02,The Cougar Approach to In-Network Query Processing in Sensor Networks,"Y Yao, J Gehrke",SIGMOD Record,2002
69680,conf/vldb/Galindo-LegariaPK94,"Fast, Randomized Join-Order Selection - Why Use Transformations?","C Galindo-Legaria, A Pellenkoft, M Kersten",VLDB,1994
69689,journals/sigmod/Hammer02a,Treasurer's Message,,,2002
69696,conf/vldb/GutierrezPST94,Database Graph Views: A Practical Model to Manage Persistent Graphs,"A Gutiérrez, P Pucheral, H Steffen, J Thévenin",VLDB,1994
69697,conf/vldb/KemperK94,Dual-Buffering Strategies in Object Bases,"A Kemper, D Kossmann",VLDB,1994
69698,journals/sigmod/MeltonMJKS02,SQL/MED - A Status Report,"J Melton, J Michels, V Josifovski, K Kulkarni, P Schwarz",SIGMOD Record,2002
69699,journals/sigmod/Winslett02b,Hector Garcia-Molina Speaks Out,M Winslett,,2002
69703,journals/sigmod/RossAJS02,Reminiscences on Influential Papers,,,2002
69706,conf/vldb/AgrawalS94,Fast Algorithms for Mining Association Rules in Large Databases,"R Agrawal, R Srikant",VLDB,1994
69707,journals/sigmod/Badia02,Ontologies: A Silver Bullet for Knowledge Management and Electronic Commerce - Book Review,,,2002
69714,conf/vldb/KalusD95,Flexible Relations - Operational Support of Variant Relational Structures,"C Kalus, P Dadam",VLDB,1995
69715,conf/vldb/Sarawagi95,Query Processing in Tertiary Memory Databases,S Sarawagi,VLDB,1995
69719,conf/vldb/RamakrishnanGRSWZ95,Scientific Journals: Extinction or Explosion? (Panel),"R Ramakrishnan, H Garcia-Molina, G Rossbach, A Silberschatz, G Wiederhold, J Zijlstra",VLDB,1995
69722,conf/vldb/SistlaYLL95,Similarity based Retrieval of Pictures Using Indices on Spatial Relationships,"A Sistla, C Yu, C Liu, K Liu",VLDB,1995
69723,journals/sigmod/HalkidiBV02a,Clustering Validity Checking Methods: Part II,"M Halkidi, Y Batistakis, M Vazirgiannis",SIGMOD Record,2002
69724,conf/vldb/Meier95,Providing Database Migration Tools - A Practicioner's Approach,A Meier,VLDB,1995
69725,journals/sigmod/Liu02b,Editor's Notes,L Liu,SIGMOD Record,2002
69728,journals/sigmod/Aberer02b,Book Review Column,K Aberer,SIGMOD Record,2002
69729,journals/sigmod/HuangKL02,A Study on the Management of Semantic Transaction for Efficient Data Retrieval,"S Huang, I Kwan, C Li",SIGMOD Record,2002
69731,conf/vldb/CatozziR95,OS Support for VLDBs: Unix Enhancements for the Teradata Data Base,"J Catozzi, S Rabinovici",VLDB,1995
69732,journals/sigmod/RossAA02,Reminiscences on Influential Papers,,,2002
69737,conf/vldb/Spintzik95,Informix-Online XPS: A Dynamically Scalable RDBMS for Open Parallel Platforms,H Spintzik,VLDB,1995
69739,conf/vldb/AmielBDS94,Supporting Exceptions to Schema Consistency to Ease Schema Evolution in OODBMS,"E Amiel, M Bellosta, E Dujardin, E Simon",VLDB,1994
69742,conf/vldb/ColletCS94,NAOS - Efficient and Modular Reactive Capabilities in an Object-Oriented Database System,"C Collet, T Coupaye, T Svensen",VLDB,1994
69748,conf/vldb/HasanM94,Optimization Algorithms for Exploiting the Parallelism-Communication Tradeoff in Pipelined Parallelism,"W Hasan, R Motwani",VLDB,1994
69751,conf/vldb/LiC94,Semantic Integration in Heterogeneous Databases Using Neural Networks,"W Li, C Clifton",VLDB,1994
69752,journals/sigmod/ChienTZ01,XML Document Versioning,"S Chien, V Tsotras, C Zaniolo",SIGMOD Record,2001
69758,journals/sigmod/RossHKRRSS01,Reminiscences on Influential Papers,,,2001
69760,conf/vldb/SetzerZ94,New Concurrency Control Algorithms for Accessing and Compacting B-Trees,"V Setzer, A Zisman",VLDB,1994
69762,journals/sigmod/Bernstein01,Report on the 2001 SIGMOD and PODS Awards,,,2001
69763,journals/sigmod/BunemanFSW01,Constraints for Semi-structured Data and XML,"P Buneman, W Fan, J Siméon, S Weinstein",SIGMOD Record,2001
69767,conf/vldb/HoelS94,Performance of Data-Parallel Spatial Operations,"E Hoel, H Samet",VLDB,1994
69768,journals/sigmod/EisenbergM01,SQL/XML and the SQLX Informal Group of Companies,"A Eisenberg, J Melton",SIGMOD Record,2001
69771,journals/sigmod/ShahMFH01,Java Support for Data-Intensive Systems: Experiences Building the Telegraph Dataflow System,"M Shah, S Madden, M Franklin, J Hellerstein",SIGMOD Record,2001
69774,conf/vldb/SteenhagenABB94,From Nested-Loop to Join Queries in OODB,"H Steenhagen, P Apers, H Blanken, R By",VLDB,1994
69776,conf/vldb/ChakravarthyKAK94,"Composite Events for Active Databases: Semantics, Contexts and Detection","S Chakravarthy, V Krishnaprasad, E Anwar, S Kim",VLDB,1994
69788,journals/sigmod/BabuW01,Continuous Queries over Data Streams,"S Babu, J Widom",SIGMOD Record,2001
69793,conf/vldb/BernsteinD94,An Overview of Repository Technology,"P Bernstein, U Dayal",VLDB,1994
69794,journals/sigmod/Aberer01,Advanced XML Data Processing - Guest Editor's Introduction,K Aberer,SIGMOD Record,2001
69796,journals/sigmod/Snodgrass01a,Accessibility of the Database Literature,R Snodgrass,SIGMOD Record,2001
69798,conf/vldb/AnandBH94,An Empirical Performance Study of the Ingres Search Accelerator for a Large Property Management Database System,"S Anand, D Bell, J Hughes",VLDB,1994
69799,journals/sigmod/Ozsu01,Chair's Message,,,2001
69800,conf/vldb/RosenthalS94,Data Integration in the Large: The Challenge of Reuse,"A Rosenthal, L Seligman",VLDB,1994
69803,conf/vldb/Bernstein94,PC Database Systems - Present and Future,P Bernstein,VLDB,1994
69804,journals/sigmod/Liu01b,Editor's Notes,L Liu,SIGMOD Record,2001
69805,journals/sigmod/StolfoLCFE01,Data Mining-based Intrusion Detectors: An Overview of the Columbia IDS Project,"S Stolfo, W Lee, P Chan, W Fan, E Eskin",SIGMOD Record,2001
69806,conf/sigmod/BabcockO03,Distributed Top-K Monitoring,"B Babcock, C Olston",SIGMOD Conference,2003
69807,conf/sigmod/DasGR03,Approximate Join Processing Over Data Streams,"A Das, J Gehrke, M Riedewald",SIGMOD Conference,2003
69809,journals/sigmod/CabreraLM01,Detection and Classification of Intrusions and Faults using Sequences of System Calls,"J Cabrera, L Lewis, R Mehra",SIGMOD Record,2001
69811,conf/vldb/MartinC94,Relating Distributed Objects,"B Martin, R Cattell",VLDB,1994
69814,journals/sigmod/Cardelli01,Describing Semistructured Data,L Cardelli,SIGMOD Record,2001
69816,conf/vldb/Spaccapietra94,"\User Interfaces; Who Cares?\""""",S Spaccapietra,VLDB,1994
69817,journals/sigmod/Barbara01,Special Issue on Data Mining for Intrusion Detection and Threat Analysis - Guest Editor's Introduction,,,2001
69823,conf/sigmod/ChaudhuriGS03,Factorizing Complex Predicates in Queries to Exploit Indexes,"S Chaudhuri, P Ganesan, S Sarawagi",SIGMOD Conference,2003
69824,journals/sigmod/VelACM01,Mining Email Content for Author Identification Forensics,"O Vel, A Anderson, M Corney, G Mohay",SIGMOD Record,2001
69827,conf/sigmod/DeligiannakisR03,Extended Wavelets for Multiple Measures,"A Deligiannakis, N Roussopoulos",SIGMOD Conference,2003
69833,journals/sigmod/RossHLW01,Reminiscences on Influential Papers,,,2001
69835,conf/vldb/TsatalosSI94,The GMAP: A Versatile Tool for Physical Data Independence,"O Tsatalos, M Solomon, Y Ioannidis",VLDB,1994
69837,journals/sigmod/Dogac02,Guest Editor's Introduction,,,2002
69841,journals/sigmod/Cingil02,Supporting Global User Profiles Through Trusted Authorities,I Cingil,SIGMOD Record,2002
69847,conf/vldb/LitwinNS94,RP*: A Family of Order Preserving Scalable Distributed Data Structures,"W Litwin, M Neimat, D Schneider",VLDB,1994
69848,journals/sigmod/Bussler02,The Role of B2B Engines in B2B Integration Architectures,C Bussler,SIGMOD Record,2002
69850,conf/vldb/ChawatheCY94,On Index Selection Schemes for Nested Object Hierarchies,"S Chawathe, M Chen, P Yu",VLDB,1994
69851,journals/sigmod/Winslett02,Interview with Avi Silberschatz,,,2002
69853,journals/sigmod/Grefen02,What Will Be - Book Review,,,2002
69854,conf/vldb/LuOT94,On Spatially Partitioned Temporal Join,"H Lu, B Ooi, K Tan",VLDB,1994
69855,conf/vldb/HjelsvoldM94,Modelling and Querying Video Data,"R Hjelsvold, R Midtstraum",VLDB,1994
69863,conf/vldb/XieH94,Join Index Hierarchies for Supporting Efficient Navigations in Object-Oriented Databases,"Z Xie, J Han",VLDB,1994
69865,conf/vldb/KamelF94,Hilbert R-tree: An Improved R-tree using Fractals,"I Kamel, C Faloutsos",VLDB,1994
69868,conf/sigmod/LakshmananPZ03,QC-Trees: An Efficient Summary Structure for Semantic OLAP,"L Lakshmanan, J Pei, Y Zhao",SIGMOD Conference,2003
69869,journals/sigmod/JacobS99,FinTime - A Financial Time Series Benchmark,"K Jacob, D Shasha",SIGMOD Record,1999
69872,journals/sigmod/KempsterST99,Diluting ACID,"T Kempster, C Stirling, P Thanisch",SIGMOD Record,1999
69874,journals/sigmod/GatziuJSV99,Design and Management of Data Warehouses: Report on the DMDW'99 Workshop,"S Gatziu, M Jeusfeld, M Staudt, Y Vassiliou",SIGMOD Record,1999
69876,journals/sigmod/Franklin99b,Editor's Notes,M Franklin,SIGMOD Record,1999
69878,journals/sigmod/EisenbergM00,SQL Standardization: The Next Steps,"A Eisenberg, J Melton",SIGMOD Record,2000
69884,journals/sigmod/Jagadish00,ACM-SIGMOD Digital Review,H Jagadish,SIGMOD Record,2000
69885,journals/sigmod/CeriKKLOSV00,SIGMOD Sister Societies,"S Ceri, L Kalinichenko, M Kitsuregawa, H Lu, Z Özsoyoglu, R Snodgrass, V Vianu",SIGMOD Record,2000
69887,conf/sigmod/AgrawalK03,A System for Watermarking Relational Databases,"R Agrawal, P Haas, J Kiernan",SIGMOD Conference,2003
69896,conf/sigmod/Mamoulis03,Efficient Processing of Joins on Set-valued Attributes,N Mamoulis,SIGMOD Conference,2003
69898,conf/sigmod/JagatheesanR03,Data Grid Management Systems,"A Jagatheesan, A Rajasekar",SIGMOD Conference,2003
69899,conf/sigmod/ChengKP03,Evaluating Probabilistic Queries over Imprecise Data,"R Cheng, D Kalashnikov, S Prabhakar",SIGMOD Conference,2003
69901,conf/sigmod/OlstonJW03,Adaptive Filters for Continuous Queries over Distributed Data Streams,"C Olston, J Jiang, J Widom",SIGMOD Conference,2003
69903,journals/sigmod/Palpanas00,Knowledge Discovery in Data Warehouses,T Palpanas,SIGMOD Record,2000
69908,journals/sigmod/WestmannKHM00,The Implementation and Performance of Compressed Databases,"T Westmann, D Kossmann, S Helmer, G Moerkotte",SIGMOD Record,2000
69910,journals/sigmod/VetterliVS00,Metadata Standards for Data Warehousing: Open Information Model vs. Common Warehouse Metamodel,"T Vetterli, A Vaduva, M Staudt",SIGMOD Record,2000
69918,conf/sigmod/SunAA03,Hardware Acceleration for Spatial Selections and Joins,"C Sun, D Agrawal, A Abbadi",SIGMOD Conference,2003
69919,conf/sigmod/ReissK03,A Characterization of the Sensitivity of Query Optimization to Storage Access Cost Parameters,"F Reiss, T Kanungo",SIGMOD Conference,2003
69920,journals/sigmod/KantM00,"Workshop on Performance and Architecture of Web Servers (PAWS-2000, held in conjection with SIGMETRICS-2000)",,,2000
69921,conf/sigmod/LometT03,A Theory of Redo Recovery,"D Lomet, M Tuttle",SIGMOD Conference,2003
69923,journals/sigmod/Cruz00,SIGMOD Digital Symposium Collection (DiSC) Editor's Message,,,2000
69930,conf/sigmod/CuiOTS03,Contorting High Dimensional Data for Efficient Main Memory Processing,"B Cui, B Ooi, J Su, K Tan",SIGMOD Conference,2003
69931,journals/sigmod/Snodgrass00a,Chair's Message,,,2000
69940,journals/sigmod/Franklin00a,Editor's Notes,M Franklin,SIGMOD Record,2000
69941,conf/sigmod/Colliat03,Data Management Challenges in CRM,G Colliat,SIGMOD Conference,2003
69942,journals/sigmod/PoessF00,New TPC Benchmarks for Decision Support and Web Commerce,"M Pöss, C Floyd",SIGMOD Record,2000
69943,conf/sigmod/GotoK03,Integration of Electronic Tickets and Personal Guide System for Public Transport using Mobile Terminals,"K Goto, Y Kambayashi",SIGMOD Conference,2003
69948,conf/sigmod/KriegelBKPS03,Using Sets of Feature Vectors for Similarity Search on Voxelized CAD Objects,"H Kriegel, S Brecheisen, P Kröger, M Pfeifle, M Schubert",SIGMOD Conference,2003
69950,conf/sigmod/Aggarwal03,A Framework for Change Diagnosis of Data Streams,C Aggarwal,SIGMOD Conference,2003
69951,conf/sigmod/ChaudhuriKN03,On Relational Support for XML Publishing: Beyond Sorting and Tagging,"S Chaudhuri, R Kaushik, J Naughton",SIGMOD Conference,2003
69953,journals/sigmod/RossIJP00,Reminiscences on Influential Papers,,,2000
69956,journals/sigmod/CasatiDS00,VLDB Workshop on Technologies in E-Services (TES),,,2000
69958,conf/sigmod/Pruscino03,Oracle RAC: Architecture and Performance,A Pruscino,SIGMOD Conference,2003
69960,journals/sigmod/PossasMCR00,Using Quantitative Information for Efficient Association Rule Generation,"B Pôssas, W Jr., M Carvalho, R Resende",SIGMOD Record,2000
69961,conf/sigmod/Cabrera03,The Future of Web services - II,F Cabrera,SIGMOD Conference,2003
69962,journals/sigmod/HasselbringHHKRRS00,"Research and Practice in Federated Information Systems, Report of the EFIS '2000 International Workshop",,,2000
69968,journals/sigmod/BernsteinHP00,A Vision of Management of Complex Models,"P Bernstein, A Halevy, R Pottinger",SIGMOD Record,2000
69969,conf/sigmod/StoltePAG03,Scientific Data Repositories: Designing for a Moving Target,"E Stolte, C Praun, G Alonso, T Gross",SIGMOD Conference,2003
69975,conf/sigmod/ZhangZPTL03,Location-based Spatial Queries,"J Zhang, M Zhu, D Papadias, Y Tao, D Lee",SIGMOD Conference,2003
69978,conf/sigmod/MaddenFHH03,The Design of an Acquisitional Query Processor For Sensor Networks,"S Madden, M Franklin, J Hellerstein, W Hong",SIGMOD Conference,2003
69979,conf/sigmod/MinPC03,XPRESS: A Queriable Compression for XML Data,"J Min, M Park, C Chung",SIGMOD Conference,2003
69988,conf/sigmod/MelnikRB03,Rondo: A Programming Platform for Generic Model Management,"S Melnik, E Rahm, P Bernstein",SIGMOD Conference,2003
69992,journals/sigmod/LawderK01,Querying Multi-dimensional Data Indexed Using the Hilbert Space-filling Curve,"J Lawder, P King",SIGMOD Record,2001
69993,conf/sigmod/CohenM03,Spectral Bloom Filters,"S Cohen, Y Matias",SIGMOD Conference,2003
69996,conf/sigmod/LuoEHN02,A scalable hash ripple join algorithm,"G Luo, C Ellmann, P Haas, J Naughton",SIGMOD Conference,2002
69998,journals/sigmod/ChristoffelPSL98,Electronic Market: The Roadmap for University Libraries and Members to Survive in the Information Jungle,"M Christoffel, S Pulkowski, B Schmitt, P Lockemann",SIGMOD Record,1998
70000,journals/sigmod/MeltzerC98,XML and Electronic Commerce: Enabling the Network Economy,"B Meltzer, R Glushko",SIGMOD Record,1998
70007,journals/sigmod/Ritter98,The Middleware Muddle,D Ritter,SIGMOD Record,1998
70008,conf/sigmod/OlstonW02,Best-effort cache synchronization with source cooperation,"C Olston, J Widom",SIGMOD Conference,2002
70012,journals/sigmod/BollKB98,Design and Implementation of RMP - A Virtual Electronic Market Place,"S Boll, W Klas, B Battaglin",SIGMOD Record,1998
70013,journals/sigmod/ReichB98,A Componentized Architecture for Dynamic Electronic Markets,"B Reich, I Ben-Shaul",SIGMOD Record,1998
70014,conf/sigmod/RiedewaldAA02,Efficient integration and aggregation of historical information,"M Riedewald, D Agrawal, A Abbadi",SIGMOD Conference,2002
70015,conf/sigmod/BunemanKTT02,Archiving scientific data,"P Buneman, S Khanna, K Tajima, W Tan",SIGMOD Conference,2002
70016,journals/sigmod/JenningsNF98,ADEPT: An Agent-Based Approach to Business Process Management,"N Jennings, T Norman, P Faratin",SIGMOD Record,1998
70018,journals/sigmod/DogacDATKCD98,A Workflow-based Electronic Marketplace on the Web,"A Dogac, I Durusoy, S Arpinar, N Tatbul, P Koksal, I Cingil, N Dimililer",SIGMOD Record,1998
70023,conf/sigmod/KornMZ03,IPSOFACTO: A Visual Correlation Tool for Aggregate Network Traffic Data,"F Korn, S Muthukrishnan, Y Zhu",SIGMOD Conference,2003
70025,journals/sigmod/BuchnerM98,Discovering Internet Marketing Intelligence through Online Analytical Web Usage Mining,"A Büchner, M Mulvenna",SIGMOD Record,1998
70031,conf/sigmod/ZhangDWEMPMDR03,Rainbow: Multi-XQuery Optimization Using Materialized XML Views,"X Zhang, K Dimitrova, L Wang, M El-Sayed, B Murphy, B Pielech, M Mulchandani, L Ding, E Rundensteiner",SIGMOD Conference,2003
70037,journals/sigmod/Danish98,Building Database-driven Electronic Catalogs,S Danish,SIGMOD Record,1998
70042,conf/sigmod/ChandrasekaranCDFHHKMRS03,TelegraphCQ: Continuous Dataflow Processing,"S Chandrasekaran, O Cooper, A Deshpande, M Franklin, J Hellerstein, W Hong, S Krishnamurthy, S Madden, F Reiss, M Shah",SIGMOD Conference,2003
70044,conf/sigmod/Amer-YahiaFSX03,PIX: Exact and Approximate Phrase Matching in XML,"S Amer-Yahia, M Fernandez, D Srivastava, Y Xu",SIGMOD Conference,2003
70047,journals/sigmod/Hanson99,Statement from the Treasurer,E Hanson,SIGMOD Record,1999
70049,journals/sigmod/OukselS99,Semantic Interoperability in Global Information Systems: A Brief Introduction to the Research Area and the Special Section,"A Ouksel, A Sheth",SIGMOD Record,1999
70050,conf/sigmod/AgichteinG03,QXtract: A Building Block for Efficient Information Extraction from Plain-Text Databases,"E Agichtein, L Gravano",SIGMOD Conference,2003
70060,journals/sigmod/SycaraKWL99,Dynamic Service Matchmaking Among Agents in Open Information Environments,"K Sycara, M Klusch, S Widoff, J Lu",SIGMOD Record,1999
70065,conf/sigmod/2002,"Proceedings of the 2002 ACM SIGMOD International Conference on Management of Data, Madison, Wisconsin, June 3-6, 2002",,,2002
70068,conf/sigmod/HinneburgKW02,HD-Eye: visual clustering of high dimensional data,"A Hinneburg, D Keim, M Wawryniuk",SIGMOD Conference,2002
70073,journals/sigmod/Kim99,"Message from Editor-in-Chief, ACM Transactions on Database Systems",W Kim,,1999
70078,conf/sigmod/MaddenH02,Distributing queries over low-power wireless sensor networks,"S Madden, J Hellerstein",SIGMOD Conference,2002
70080,journals/sigmod/Snodgrass99a,Chair's Message,,,1999
70083,conf/sigmod/KarbhariRXD02,ACDN: a content delivery network for applications,"P Karbhari, M Rabinovich, Z Xiao, F Douglis",SIGMOD Conference,2002
70086,journals/sigmod/BernsteinDK99,"Towards Adaptive Workflow Systems, CSCW-98 Workshop Report",,,1999
70087,conf/sigmod/FungSG02,COUGAR: the network is the database,"W Fung, D Sun, J Gehrke",SIGMOD Conference,2002
70090,journals/sigmod/Snodgrass99b,Reminiscences on Influential Papers,,,1999
70092,journals/sigmod/CfP99,"The Active Database Central, ER2000, VLDB 2000, WISE 2000, Books, ACM DL",,SIGMOD Record,1999
70093,conf/sigmod/BumbulisB02,A compact B-tree,"P Bumbulis, I Bowman",SIGMOD Conference,2002
70105,journals/sigmod/PapianiWDN99,"A Distributed Scientific Data Archive Using the Web, XML and SQL/MED","M Papiani, J Wason, A Dunlop, D Nicole",SIGMOD Record,1999
70106,conf/sigmod/BhattacharyaMBNHS02,Coordinating backup/recovery and data consistency between database and file systems,"S Bhattacharya, C Mohan, K Brannon, I Narang, H Hsiao, M Subramanian",SIGMOD Conference,2002
70108,conf/sigmod/MoonWH02,General match: a subsequence matching method in time-series databases based on generalized windows,"Y Moon, K Whang, W Han",SIGMOD Conference,2002
70112,conf/sigmod/ProcopiucJAM02,A Monte Carlo algorithm for fast projective clustering,"C Procopiuc, M Jones, P Agarwal, T Murali",SIGMOD Conference,2002
70114,journals/sigmod/Libkin99a,Database Principles Column - Introduction,L Libkin,SIGMOD Record,1999
70115,conf/sigmod/BrunoC02,Exploiting statistics on query expressions for optimization,"N Bruno, S Chaudhuri",SIGMOD Conference,2002
70119,conf/sigmod/VriesMNK02,Efficient k-NN search on vertically decomposed data,"A Vries, N Mamoulis, N Nes, M Kersten",SIGMOD Conference,2002
70122,journals/sigmod/EisenbergM99a,SQLJ-Part 1: SQL Routines Using the Java Programming Language,"A Eisenberg, J Melton",SIGMOD Record,1999
70131,journals/sigmod/Snodgrass97a,Chair's Message,,,1997
70132,conf/sigmod/FreireHRRS02,StatiX: making XML count,"J Freire, J Haritsa, M Ramanath, P Roy, J Siméon",SIGMOD Conference,2002
70133,journals/sigmod/NadoH97,Extracting Entity Profiles from Semistructured Information Spaces,"R Nado, S Huffman",SIGMOD Record,1997
70134,conf/sigmod/LiGS02,Skew handling techniques in sort-merge join,"W Li, D Gao, R Snodgrass",SIGMOD Conference,2002
70135,journals/sigmod/AshishK97,Wrapper Generation for Semi-structured Internet Sources,"N Ashish, C Knoblock",SIGMOD Record,1997
70136,conf/sigmod/TatarinovVBSSZ02,Storing and querying ordered XML using a relational database system,"I Tatarinov, S Viglas, K Beyer, J Shanmugasundaram, E Shekita, C Zhang",SIGMOD Conference,2002
70137,conf/sigmod/PapakonstantinouPV02,QURSED: querying and reporting semistructured data,"Y Papakonstantinou, M Petropoulos, V Vassalos",SIGMOD Conference,2002
70138,journals/sigmod/Suciu97,Foreword: Management of Semistructured Data,,,1997
70144,journals/sigmod/Franklin97a,Editor's Notes,M Franklin,SIGMOD Record,1997
70155,journals/sigmod/Snodgrass97,Chair's Message,,,1997
70161,conf/sigmod/JosifovskiSHL02,Garlic: a new flavor of federated query processing for DB2,"V Josifovski, P Schwarz, L Haas, E Lin",SIGMOD Conference,2002
70162,journals/sigmod/RamamrithamS97,Report on DART '96: Databases: Active and Real-Time (Concepts meet Practice),,,1997
70164,journals/sigmod/FernandezFLS97,A Query Language for a Web-Site Management System,"M Fernandez, D Florescu, A Levy, D Suciu",SIGMOD Record,1997
70166,conf/sigmod/SzalayGTKMRSv02,The SDSS skyserver: public access to the sloan digital sky server data,"A Szalay, J Gray, A Thakar, P Kunszt, T Malik, J Raddick, C Stoughton, J vandenBerg",SIGMOD Conference,2002
70169,journals/sigmod/SilberschatzZ97,Database Systems - Breaking Out of the Box,"A Silberschatz, S Zdonik",SIGMOD Record,1997
70172,journals/sigmod/Fong97,Converting Relational to Object-Oriented Databases,J Fong,SIGMOD Record,1997
70173,journals/sigmod/RamanathanH97,Extraction of Object-Oriented Structures from Existing Relational Databases,"S Ramanathan, J Hodges",SIGMOD Record,1997
70174,conf/sigmod/LuoKMPWLN02,Middle-tier database caching for e-business,"Q Luo, S Krishnamurthy, C Mohan, H Pirahesh, H Woo, B Lindsay, J Naughton",SIGMOD Conference,2002
70176,journals/sigmod/ChaudhuriD97,An Overview of Data Warehousing and OLAP Technology,"S Chaudhuri, U Dayal",SIGMOD Record,1997
70181,journals/sigmod/Konig-RiesL97,"Research in Databases and Data-Intensive Applications - Computer Science Department and FZI, University of Karlsruhe","B König-Ries, P Lockemann",SIGMOD Record,1997
70182,conf/sigmod/BarbosaMKL02,ToXgene: a template-based data generator for XML,"D Barbosa, A Mendelzon, J Keenleyside, K Lyons",SIGMOD Conference,2002
70192,conf/sigmod/FlorescuGKR02,XL: a platform for web services,"D Florescu, A Grünhagen, D Kossmann, S Rost",SIGMOD Conference,2002
70193,conf/sigmod/CrescenziMM02,RoadRunner: automatic data extraction from data-intensive web sites,"V Crescenzi, G Mecca, P Merialdo",SIGMOD Conference,2002
70200,conf/sigmod/GarofalakisGR02,Querying and mining data streams: you only get one look a tutorial,,,2002
70202,conf/sigmod/Cotton02,Implementing XQuery,P Cotton,SIGMOD Conference,2002
70203,conf/sigmod/BreunigKKS01,Data Bubbles: Quality Preserving Performance Boosting for Hierarchical Clustering,"M Breunig, H Kriegel, P Kröger, J Sander",SIGMOD Conference,2001
70205,journals/sigmod/BurtonM98,Applications of the JAVA Programming Language to Database Management,"B Burton, V Marek",SIGMOD Record,1998
