tid,id,title,authors,venue,year
70212,conf/sigmod/BohmBKK01,Epsilon Grid Order: An Algorithm for the Similarity Join on Massive High-Dimensional Data,"C Böhm, B Braunmüller, F Krebs, H Kriegel",SIGMOD Conference,2001
70213,conf/sigmod/ChenZCKR01,DyDa: Data Warehouse Maintenance in Fully Concurrent Environments,"J Chen, X Zhang, S Chen, A Koeller, E Rundensteiner",SIGMOD Conference,2001
70215,conf/sigmod/NazeriBO01,Experiences in Mining Aviation Safety Data,"Z Nazeri, E Bloedorn, P Ostwald",SIGMOD Conference,2001
70216,journals/sigmod/SnodgrassGIMSU98,Reminiscences on Influential Papers,,,1998
70220,conf/sigmod/LeeWMS01,Dynamic Buffer Allocation in Video-on-Demand Systems,"S Lee, K Whang, Y Moon, I Song",SIGMOD Conference,2001
70222,journals/sigmod/KuokFW98,Mining Fuzzy Association Rules in Databases,"C Kuok, A Fu, M Wong",SIGMOD Record,1998
70231,conf/sigmod/KiesslingHFE01,"COSIMA - Your Smart, Speaking E-Salesperson","W Kießling, S Holland, S 0003, T Ehm",SIGMOD Conference,2001
70232,journals/sigmod/Snodgrass98,Chair's Message,,,1998
70238,journals/sigmod/Franklin97b,Editor's Notes,M Franklin,SIGMOD Record,1997
70239,journals/sigmod/Rosenthal98,Where Will Object Techonology Drive Data Administration?,A Rosenthal,SIGMOD Record,1998
70242,journals/sigmod/Bernstein98,Repositories and Object Oriented Databases,P Bernstein,SIGMOD Record,1998
70243,journals/sigmod/KoksalAD98,Workflow History Management,"P Koksal, S Arpinar, A Dogac",SIGMOD Record,1998
70245,journals/sigmod/Manola98,Towards a Richer Web Object Model,F Manola,SIGMOD Record,1998
70257,conf/sigmod/LangS01,Modeling High-Dimensional Index Structures using Sampling,"C Lang, A Singh",SIGMOD Conference,2001
70263,conf/sigmod/StonebrakerH01,Content Integration for E-Business,"M Stonebraker, J Hellerstein",SIGMOD Conference,2001
70267,journals/sigmod/DAndreaJ96,UniSQL's Next-Generation Object-Relational Database Management System,"A D'Andrea, P Janus",SIGMOD Record,1996
70272,conf/sigmod/Bussler01,Semantic B2B Integration,,,2001
70275,journals/sigmod/UlusoyB96,Exploiting Main Memory DBMS Features to Improve Real-Time Concurrency Control Protocols,"Ö Ulusoy, A Buchmann",SIGMOD Record,1996
70281,journals/sigmod/LinP96,Enhancing External Consistency in Real-Time Transactions,"K Lin, S Peng",SIGMOD Record,1996
70282,conf/sigmod/GionisGK01,Efficient and Tunable Similar Set Retrieval,"A Gionis, D Gunopulos, N Koudas",SIGMOD Conference,2001
70286,journals/sigmod/PhatakSSS96,"Database Research at the Indian Institute of Technology, Bombay","D Phatak, N Sarda, S Seshadri, S Sudarshan",SIGMOD Record,1996
70287,journals/sigmod/RamamrithamSSTX96,"Integrating Temporal, Real-Time, and Active Databases","K Ramamritham, R Sivasankaran, J Stankovic, D Towsley, M Xiong",SIGMOD Record,1996
70288,conf/sigmod/ClaypoolRZSK01,"Gangam - A Solution to Support Multiple Data Models, their Mappings and Maintenance","K Claypool, E Rundensteiner, X Zhang, H Su, H Kuno, W Lee, G Mitchell",SIGMOD Conference,2001
70289,conf/sigmod/BertinoCF01,Securing XML Documents: the Author-X Project Demonstration,"E Bertino, S Castano, E Ferrari",SIGMOD Conference,2001
70293,journals/sigmod/SonDT96,Improving Timeliness in Real-Time Secure Database Systems,"S Son, R David, B Thuraisingham",SIGMOD Record,1996
70295,journals/sigmod/AdelbergKG96,Overview of the STanford Real-time Information Processor (STRIP),"B Adelberg, B Kao, H Garcia-Molina",SIGMOD Record,1996
70303,journals/sigmod/FreemanG96,Lifestreams: A Storage Model for Personal Data,"E Freeman, D Gelernter",SIGMOD Record,1996
70308,conf/sigmod/Mohan01,Application Servers: Born-Again TP Monitors for the Web? (Panel Abstract),C Mohan,SIGMOD Conference,2001
70317,journals/sigmod/TomasicS97,Improving Access to Environmental Data Using Context Information,"A Tomasic, E Simon",SIGMOD Record,1997
70319,journals/sigmod/AbelTK97,Integrating Modelling Systems for Environmental Management Information Systems,"D Abel, K Taylor, D Kuo",SIGMOD Record,1997
70320,conf/sigmod/AggarwalY01,Outlier Detection for High Dimensional Data,"C Aggarwal, P Yu",SIGMOD Conference,2001
70322,journals/sigmod/Gunther97,Environment Information Systems - Guest Editor's Foreword,,,1997
70324,conf/sigmod/ZhangNDLL01,On Supporting Containment Queries in Relational Database Management Systems,"C Zhang, J Naughton, D DeWitt, Q Luo, G Lohman",SIGMOD Conference,2001
70328,journals/sigmod/Gardels97,Open GIS and On-Line Environmental Libraries,K Gardels,SIGMOD Record,1997
70334,conf/sigmod/HristidisKP01,PREFER: A System for the Efficient Execution of Multi-parametric Ranked Queries,"V Hristidis, N Koudas, Y Papakonstantinou",SIGMOD Conference,2001
70344,journals/sigmod/HasanMV96,Applying database Visualization to the World Wide Web,"M Hasan, A Mendelzon, D Vista",SIGMOD Record,1996
70345,journals/sigmod/KennedyMB96,A Framework for Information Visualisation,"J Kennedy, K Mitchell, P Barclay",SIGMOD Record,1996
70348,journals/sigmod/RafanelliBT96,The Aggregate Data Problem: A System for their Definition and Management,"M Rafanelli, A Bezenchek, L Tininini",SIGMOD Record,1996
70350,journals/sigmod/CatarciC96,"Information Visualization, Guest Editors' Foreword",,,1996
70352,journals/sigmod/Widom96b,Editor's Notes,Jennifer Widom,SIGMOD Record,1996
70353,journals/sigmod/Darwen96,"In Reply to Domains, relations and Religious Wars",H Darwen,SIGMOD Record,1996
70357,conf/sigmod/Amer-YahiaCLS01,Minimization of Tree Pattern Queries,"S Amer-Yahia, S Cho, L Lakshmanan, D Srivastava",SIGMOD Conference,2001
70358,journals/sigmod/SantucciT96,To Table or Not to Table: a Hypertabular Answer,"G Santucci, L Tarantino",SIGMOD Record,1996
70363,journals/sigmod/Eisenberg96,New Standard for Stored Procedures in SQL,A Eisenberg,SIGMOD Record,1996
70364,conf/sigmod/AggarwalY00,Finding Generalized Projected Clusters In High Dimensional Spaces,"C Aggarwal, P Yu",SIGMOD Conference,2000
70370,conf/sigmod/LabioWGG00,Efficient Resumption of Interrupted Warehouse Loads,"W Labio, J Wiener, H Garcia-Molina, V Gorelik",SIGMOD Conference,2000
70373,journals/sigmod/ZobelMR96,Guidelines for Presentation and Comparison of Indexing Techniques,"J Zobel, A Moffat, K Ramamohanarao",SIGMOD Record,1996
70374,conf/sigmod/ChangC01,PBIR - Perception-Based Image Retrieval,"E Chang, T Cheng, L Chang",SIGMOD Conference,2001
70377,conf/sigmod/NguyenACP01,Monitoring XML Data on the Web,"B Nguyen, S Abiteboul, G Cobena, M Preda",SIGMOD Conference,2001
70380,journals/sigmod/MedskerCS95,A Comparison of Three User Interfaces to Relational Microcomputer Data Bases,"C Medsker, M Christensen, I Song",SIGMOD Record,1995
70384,journals/sigmod/DogacAOD95,Implementation Aspects of an Object-Oriented DBMS,"A Dogac, M Altinel, C Ozkan, I Durusoy",SIGMOD Record,1995
70386,conf/sigmod/SzalayGKT00,Designing and Mining Multi-Terabyte Astronomy Archives: The Sloan Digital Sky Survey,"A Szalay, P Kunszt, A Thakar, J Gray, D Slutz",SIGMOD Conference,2000
70399,conf/sigmod/RoySSB00,Efficient and Extensible Algorithms for Multi Query Optimization,"P Roy, S Seshadri, S Sudarshan, S Bhobe",SIGMOD Conference,2000
70404,conf/sigmod/PopaDST00,A Chase Too Far?,"L Popa, A Deutsch, A Sahuguet, V Tannen",SIGMOD Conference,2000
70405,journals/sigmod/KokkotosIPS95,On the Issue of Valid Time(s) in Temporal Databases,"S Kokkotos, E Ioannidis, T Panayiotopoulos, C Spyropoulos",SIGMOD Record,1995
70412,journals/sigmod/KlasS94,Metadata for Digital Media: Introduction to the Special Issue,"W Klas, A Sheth",SIGMOD Record,1994
70413,journals/sigmod/Wedekind94,"\Are the Terms \""\""Version\""\"" and \""\""Variant\""\"" Orthogonal to One Another? A Critical Assessment of the STEP Standardization\""""",H Wedekind,SIGMOD Record,1994
70421,conf/sigmod/HanPY00,Mining Frequent Patterns without Candidate Generation,"J Han, J Pei, Y Yin",SIGMOD Conference,2000
70425,conf/sigmod/ShenoyHSBBS00,Turbo-charging Vertical Mining of Large Databases,"P Shenoy, J Haritsa, S Sudarshan, G Bhalotia, M Bawa, D Shah",SIGMOD Conference,2000
70426,journals/sigmod/KiyokiKH94,A Metadatabase System for Semantic Image Search by a Mathematical Model of Meaning,"Y Kiyoki, T Kitagawa, T Hayama",SIGMOD Record,1994
70429,journals/sigmod/SchlageterBHMSW95,The Database Group at University of Hagen (FernUniversitaet),"G Schlageter, T Berkel, E Heuel, S Mittrach, A Scherer, W Wilkes",SIGMOD Record,1995
70431,conf/sigmod/Jhingran00,Anatomy of a Real E-Commerce System,A Jhingran,SIGMOD Conference,2000
70432,journals/sigmod/X95,Calls for Papers and Announcements,,SIGMOD Record,1995
70433,conf/sigmod/Weininger00,Handling Very Large Databases with Informix Extended Parallel Server,A Weininger,SIGMOD Conference,2000
70435,conf/sigmod/ChenDLT00,Fact: A Learning Based Web Query Processing System,"S Chen, Y Diao, H Lu, Z Tian",SIGMOD Conference,2000
70438,conf/sigmod/WangSSZZW00,An Approximate Search Engine for Structural Databases,"J Wang, X Wang, D Shasha, B Shapiro, K Zhang, X Zheng, Q Ma, Z Weinberg",SIGMOD Conference,2000
70452,conf/sigmod/LabrinidisR00,WebView Materialization,"A Labrinidis, N Roussopoulos",SIGMOD Conference,2000
70453,journals/sigmod/Bohlen95,Temporal Database System Implementations,M Böhlen,SIGMOD Record,1995
70454,conf/sigmod/ChenJDTW00,NiagaraCQ: A Scalable Continuous Query System for Internet Databases,"J Chen, D DeWitt, F Tian, Y Wang",SIGMOD Conference,2000
70456,conf/sigmod/BarclaySG00,TerraServer: A Spatial Data Warehouse,"T Barclay, D Slutz, J Gray",SIGMOD Conference,2000
70460,journals/sigmod/DunhamH95a,Mobile Computing and Databases: Anything New?,"M Dunham, A Helal",SIGMOD Record,1995
70461,journals/sigmod/ElmagarmidJF95,Wireless Client/Server Computing for Personal Information Services and Applications,"A Elmagarmid, J Jing, T Furukawa",SIGMOD Record,1995
70468,conf/sigmod/FaloutsosSTT00,Spatial Join Selectivity Using Power Laws,"C Faloutsos, B Seeger, A Traina, C Jr.",SIGMOD Conference,2000
70469,conf/sigmod/KornM00,Influence Sets Based on Reverse Nearest Neighbor Queries,"F Korn, S Muthukrishnan",SIGMOD Conference,2000
70472,journals/sigmod/Widom95a,Editor's Notes,J Widom,SIGMOD Record,1995
70473,journals/sigmod/NobleS95,A Research Status Report on Adaptation for Mobile Data Access,"B Noble, M Satyanarayanan",SIGMOD Record,1995
70474,conf/sigmod/GarofalakisGRSS00,XTRACT: A System for Extracting Document Type Descriptors from XML Documents,"M Garofalakis, A Gionis, R Rastogi, S Seshadri, K Shim",SIGMOD Conference,2000
70482,conf/sigmod/OrdonezC00,SQLEM: Fast Clustering in SQL using the EM Algorithm,"C Ordonez, P Cereghini",SIGMOD Conference,2000
70487,conf/sigmod/BratsbergT00,Tutorial: Designing an Ultra Highly Available DBMS,,,2000
70491,conf/sigmod/RaoR00,Making B+-Trees Cache Conscious in Main Memory,"J Rao, K Ross",SIGMOD Conference,2000
70493,journals/sigmod/LeeCL95,An Aspect of Query Optimization in Multidatabase Systems (Extended Abstract),"C Lee, C Chen, H Lu",SIGMOD Record,1995
70494,conf/sigmod/AgrawalS00,Privacy-Preserving Data Mining,"R Agrawal, R Srikant",SIGMOD Conference,2000
70496,conf/sigmod/JagadishKS00,On Effective Multi-Dimensional Indexing for Strings,"H Jagadish, N Koudas, D Srivastava",SIGMOD Conference,2000
70500,journals/sigmod/X95a,Calls for Papers and Announcements,,SIGMOD Record,1995
70512,journals/tods/TaoSP03,Analysis of predictive spatio-temporal queries,"Y Tao, J Sun, D Papadias",ACM Trans. Database Syst.,2003
70518,conf/sigmod/Rodriguez-Martinez00,MOCHA: A Database Middleware System Featuring Automatic Deployment of Application-Specific Functionality,"M Rodriguez-Martinez, N Roussopoulos, J McGann, S Kelley, V Katz, Z Song, J JáJá",SIGMOD Conference,2000
70524,journals/sigmod/DreyerDS94,Research Perspectives for Time Series Management Systems,"W Dreyer, A Dittrich, D Schmidt",SIGMOD Record,1994
70527,journals/sigmod/Snodgrass94,Overview of the Special Section on Temporal Database Infrastructure,R Snodgrass,SIGMOD Record,1994
70529,conf/sigmod/PeiMHZ00,Towards Data Mining Benchmarking: A Testbed for Performance Study of Frequent Pattern Mining,"J Pei, R Mao, K Hu, H Zhu",SIGMOD Conference,2000
70531,conf/sigmod/ShuklaD00,Tutorial: LDAP Directory Services - Just Another Database Application?,,,2000
70532,journals/sigmod/SnodgrassAABCDEGJKKKLLRSSS94,TSQL2 Language Specification,"R Snodgrass, I Ahn, G Ariav, D Batory, J Clifford, C Dyreson, R Elmasri, F Grandi, C Jensen, W Käfer, N Kline, K Kulkarni, T Leung, N Lorentzos, J Roddick, A Segev, M Soo, S Sripada",SIGMOD Record,1994
70533,journals/sigmod/Loeffen94,Text Databases: A Survey of Text Models and Systems,A Loeffen,SIGMOD Record,1994
70537,journals/sigmod/Gallagher94,Influencing Database Language Standards,L Gallagher,SIGMOD Record,1994
70538,conf/sigmod/RundensteinerCCSO00,SERFing the Web: Web Site Management Made Easy,"E Rundensteiner, K Claypool, L Chen, H Su, K Oenoki",SIGMOD Conference,2000
70544,journals/tods/FernandezKSMT02,SilkRoute: A framework for publishing relational data in XML,"M Fernandez, Y Kadiyska, D Suciu, A Morishima, W Tan",ACM Trans. Database Syst.,2002
70546,conf/sigmod/CallanCD99,Automatic Discovery of Language Models for Text Databases,"J Callan, M Connell, A Du",SIGMOD Conference,1999
70550,journals/tods/CaldersNW02,Searching for dependencies at multiple abstraction levels,"T Calders, R Ng, J Wijsen",ACM Trans. Database Syst.,2002
70552,journals/tods/ChakrabartiKMP02,Locally adaptive dimensionality reduction for indexing large time series databases,"K Chakrabarti, E Keogh, S Mehrotra, M Pazzani",ACM Trans. Database Syst.,2002
70556,journals/tods/JacoxS03,Iterative spatial join,"E Jacox, H Samet",ACM Trans. Database Syst.,2003
70558,journals/tods/WijesekeraJPH03,Removing permissions in the flexible authorization framework,"D Wijesekera, S Jajodia, F Parisi-Presicce, Ĺ Hagström",ACM Trans. Database Syst.,2003
70562,journals/tods/Jimenez-PerisPAK03,Are quorums an alternative for data replication?,"R Jiménez-Peris, M Patińo-Martínez, G Alonso, B Kemme",ACM Trans. Database Syst.,2003
70564,journals/tods/LechtenborgerV03,On the computation of relational view complements,"J Lechtenbörger, G Vossen",ACM Trans. Database Syst.,2003
70565,journals/tods/GunopulosKMSTS03,Discovering all most specific sentences,"D Gunopulos, R Khardon, H Mannila, S Saluja, H Toivonen, R Sharm",ACM Trans. Database Syst.,2003
70566,conf/sigmod/ShanmugasundaramNSR99,Efficient Concurrency Control for Broadcast Environments,"J Shanmugasundaram, A Nithrakashyap, R Sivasankaran, K Ramamritham",SIGMOD Conference,1999
70581,conf/sigmod/BraumandlKK99,Database Patchwork on the Internet,"R Braumandl, A Kemper, D Kossmann",SIGMOD Conference,1999
70588,journals/sigmod/GlavitschSW94,Metadata for Integrating Speech Documents in a Text Retrieval System,"U Glavitsch, P Schäuble, M Wechsler",SIGMOD Record,1994
70589,journals/sigmod/ChenHKPW94,Metadata for Mixed-Media Access,"F Chen, M Hearst, J Kupiec, J Pedersen, L Wilcox",SIGMOD Record,1994
70591,journals/sigmod/AndersonS94,SEQUOIA 2000 Metadata Schema for Satellite Images,"J Anderson, M Stonebraker",SIGMOD Record,1994
70597,conf/sigmod/KrishnamurthyBN99,Bringing Object-Relational Technology to Mainstream,"V Krishnamurthy, S Banerjee, A Nori",SIGMOD Conference,1999
70601,conf/sigmod/Mohan99,A Database Perspective on Lotus Domino/Notes,C Mohan,SIGMOD Conference,1999
70602,journals/sigmod/MattosD94,Recent Design Trade-offs in SQL3,"N Mattos, L DeMichiel",SIGMOD Record,1994
70606,journals/sigmod/GeppertD94,Constructing the Next 100 Database Management Systems,"A Geppert, K Dittrich",SIGMOD Record,1994
70607,conf/sigmod/AcharyaGPR99a,Join Synopses for Approximate Query Answering,"S Acharya, P Gibbons, V Poosala, S Ramaswamy",SIGMOD Conference,1999
70611,conf/sigmod/MankuRL99,Random Sampling Techniques for Space Efficient Online Computation of Order Statistics of Large Datasets,"G Manku, S Rajagopalan, B Lindsay",SIGMOD Conference,1999
70615,conf/sigmod/LeeKC99,Multi-dimensional Selectivity Estimation Using Compressed Histogram Information,"J Lee, D Kim, C Chung",SIGMOD Conference,1999
70620,conf/sigmod/LakshmananNHP99,Optimization of Constrained Frequent Set Queries with 2-variable Constraints,"L Lakshmanan, R Ng, J Han, A Pang",SIGMOD Conference,1999
70626,conf/sigmod/BreitbartKRSS99,Update Propagation Protocols For Replicated Databases,"Y Breitbart, R Komondoor, R Rastogi, S Seshadri, A Silberschatz",SIGMOD Conference,1999
70630,conf/sigmod/AnkerstBKS99,OPTICS: Ordering Points To Identify the Clustering Structure,"M Ankerst, M Breunig, H Kriegel, J Sander",SIGMOD Conference,1999
70631,journals/sigmod/Alonso94a,Trade Press News,,,1994
70632,conf/sigmod/JagadishLS99,Snakes and Sandwiches: Optimal Clustering Strategies for a Data Warehouse,"H Jagadish, L Lakshmanan, D Srivastava",SIGMOD Conference,1999
70637,conf/vldb/CasatiDGS01,"Improving Business Process Quality through Exception Understanding, Prediction, and Prevention","D Grigori, F Casati, U Dayal, M Shan",VLDB,2001
70640,conf/vldb/AilamakiDHS01,Weaving Relations for Cache Performance,"A Ailamaki, D DeWitt, M Hill, M Skounakis",VLDB,2001
70641,conf/sigmod/BergstraesserBPS99,Versions and Workspaces in Microsoft Repository,"T Bergstraesser, P Bernstein, S Pal, D Shutt",SIGMOD Conference,1999
70644,conf/sigmod/DoRD99,The Need for Distributed Asynchronous Transactions,"L Do, P Ram, P Drew",SIGMOD Conference,1999
70650,conf/sigmod/BargaL99,Phoenix: Making Applications Robust,"R Barga, D Lomet",SIGMOD Conference,1999
70653,conf/vldb/DongHLPW01,Mining Multi-Dimensional Constrained Gradients in Data Cubes,"G Dong, J Han, J Lam, J Pei, K Wang",VLDB,2001
70654,conf/sigmod/RundensteinerCLCZNJLW99,SERF: ODMG-Based Generic Re-structuring Facility,"E Rundensteiner, K Claypool, M Li, L Chen, X Zhang, C Natarajan, J Jin, S Lima, S Weiner",SIGMOD Conference,1999
70658,conf/sigmod/AcharyaGPR99,The Aqua Approximate Query Answering System,"S Acharya, P Gibbons, V Poosala, S Ramaswamy",SIGMOD Conference,1999
70660,conf/vldb/FegarasE01,Query Engines for Web-Accessible XML Data,"L Fegaras, R Elmasri",VLDB,2001
70663,conf/vldb/VeltriCV01,Views in a Large Scale XML Repository,"S Cluet, P Veltri, D Vodislav",VLDB,2001
70664,conf/sigmod/RoussopoulosKS99,The Active MultiSync Controller of the Cubetree Storage Organization,"N Roussopoulos, Y Kotidis, Y Sismanis",SIGMOD Conference,1999
70669,conf/vldb/LiCHPALHAY01,Cache Portal: Technology for Accelerating Database-driven e-commerce Web Sites,"W Li, K Candan, W Hsiung, O Po, D Agrawal, Q Luo, W Huang, Y Akca, C Yilmaz",VLDB,2001
70670,conf/sigmod/MaratheS99,Query Processing Techniques for Arrays,"A Marathe, K Salem",SIGMOD Conference,1999
70671,conf/sigmod/NatsevRS99,WALRUS: A Similarity Retrieval Algorithm for Image Databases,"A Natsev, R Rastogi, K Shim",SIGMOD Conference,1999
70673,conf/vldb/NishioSTTL01,Functional Properties of Information Filtering,"R Sawai, M Tsukamoto, Y Loh, T Terada, S Nishio",VLDB,2001
70675,conf/sigmod/PapakonstantinouV99,Query Rewriting for Semistructured Data,"Y Papakonstantinou, V Vassalos",SIGMOD Conference,1999
70677,conf/vldb/Adler01,DB2 Spatial Extender - Spatial data within the RDBMS,D Adler,VLDB,2001
70678,conf/sigmod/DeutschFS99,Storing Semistructured Data with STORED,"A Deutsch, M Fernandez, D Suciu",SIGMOD Conference,1999
70679,conf/vldb/ZengBNN01,AgFlow: Agent-based Cross-Enterprise Workflow Management System,"L Zeng, B Benatallah, P Nguyen, A Ngu",VLDB,2001
70688,conf/vldb/SeegerBBKSDS01,XXL - A Library Approach to Supporting Efficient Implementations of Advanced Database Queries,"J Bercken, B Blohsfeld, J Dittrich, J Krämer, T Schäfer, M Schneider, B Seeger",VLDB,2001
70695,conf/sigmod/Hammond99,Merge Replication in Microsoft's SQL Server 7.0,B Hammond,SIGMOD Conference,1999
70696,conf/vldb/Sol01,"Ambient Intelligence with the Ubiquitous Network, the Embedded Computer Devices and the Hidden Databases (abstract)",E Sol,VLDB,2001
70697,conf/sigmod/KanthRSB99,Indexing Medium-dimensionality Data in Oracle,"K Kanth, S Ravada, J Sharma, J Banerjee",SIGMOD Conference,1999
70711,conf/sigmod/RajagopalanML98,Approximate Medians and other Quantiles in One Pass and with Limited Memory,"G Manku, S Rajagopalan, B Lindsay",SIGMOD Conference,1998
70712,conf/vldb/GravanoIJKMS01,Approximate String Joins in a Database (Almost) for Free,"L Gravano, P Ipeirotis, H Jagadish, N Koudas, S Muthukrishnan, D Srivastava",VLDB,2001
70715,conf/vldb/BunkerCCMMW01,Aggregate Maintenance for Data Warehousing in Informix Red Brick Vista,"C Bunker, L Colby, R Cole, W McKenna, G Mulagund, D Wilhite",VLDB,2001
70722,conf/sigmod/WhiteCF98,Enterprise Java Platform Data Access,"S White, R Cattell, S Finkelstein",SIGMOD Conference,1998
70724,conf/vldb/Novaretti01,French government activity in the conservation of data and electronic documents,S Novaretti,VLDB,2001
70726,conf/sigmod/NaumanS98,"Developing a High Traffic, Read-Only Web Site","J Nauman, R Suorsa",SIGMOD Conference,1998
70732,conf/vldb/ChienTZ01,Efficient Management of Multiversion Documents by Object Referencing,"S Chien, V Tsotras, C Zaniolo",VLDB,2001
70736,conf/vldb/OzsuLON01,An Extendible Hash for Multi-Precision Similarity Querying of Image Databases,"S Lin, M Özsu, V Oria, R Ng",VLDB,2001
70742,conf/sigmod/Bayardo98,Efficiently Mining Long Patterns from Databases,R Jr.,SIGMOD Conference,1998
70746,conf/sigmod/CherniackZ98,Changing the Rules: Transformations for Rule-Based Optimizers,"M Cherniack, S Zdonik",SIGMOD Conference,1998
70750,conf/vldb/BerckenS01,An Evaluation of Generic Bulk Loading Techniques,"J Bercken, B Seeger",VLDB,2001
70754,conf/sigmod/KabraD98,Efficient Mid-Query Re-Optimization of Sub-Optimal Query Execution Plans,"N Kabra, D DeWitt",SIGMOD Conference,1998
70755,conf/sigmod/SubramanianV98,Cost-Based Optimization of Decision Support Queries Using Transient Views,"S Subramanian, S Venkataraman",SIGMOD Conference,1998
70756,conf/vldb/KahveciS01,Efficient Index Structures for String Databases,"T Kahveci, A Singh",VLDB,2001
70761,conf/sigmod/DeshpandeRSN98,Caching Multidimensional Queries Using Chunks,"P Deshpande, K Ramasamy, A Shukla, J Naughton",SIGMOD Conference,1998
70762,conf/vldb/TanEO01,Efficient Progressive Skyline Computation,"K Tan, P Eng, B Ooi",VLDB,2001
70763,conf/vldb/AgrawalCN00,Automated Selection of Materialized Views and Indexes in SQL Databases,"S Agrawal, S Chaudhuri, V Narasayya",VLDB,2000
70766,conf/vldb/Bar-YossefBCFW00,Approximating Aggregate Queries about Web Pages via Random Walks,"Z Bar-Yossef, A Berg, S Chien, J Fakcharoenphol, D Weitz",VLDB,2000
70771,conf/sigmod/SeidlK98,Optimal Multi-Step k-Nearest Neighbor Search,"T Seidl, H Kriegel",SIGMOD Conference,1998
70778,conf/sigmod/Cohen98,Integration of Heterogeneous Databases Without Common Domains Using Queries Based on Textual Similarity,W Cohen,SIGMOD Conference,1998
70779,conf/sigmod/GodfreySE98,Secure and Portable Database Extensibility,"M Godfrey, T Mayr, P Seshadri, T Eicken",SIGMOD Conference,1998
70785,conf/vldb/Nori00,Asera: Extranet Architecture for B2B Solutions,A Nori,VLDB,2000
70788,conf/vldb/MohanBWSZ00,Evolution of Groupware for Business Applications: A Database Perspective on Lotus Domino/Notes,"C Mohan, R Barber, S Watts, A Somani, M Zaharioudakis",VLDB,2000
70795,conf/sigmod/AvnurHLORRRW98,CONTROL: Continuous Output and Navigation Technology with Refinement On-Line,"R Avnur, J Hellerstein, B Lo, C Olston, B Raman, V Raman, T Roth, K Wylie",SIGMOD Conference,1998
70796,conf/vldb/ChoenniV00,Design and Implementation of a Genetic-Based Algorithm for Data Mining,S Choenni,VLDB,2000
70797,conf/vldb/X00a,Author Index,,VLDB,2000
70808,conf/vldb/KemmeA00,"Don't Be Lazy, Be Consistent: Postgres-R, A New Way to Implement Database Replication","B Kemme, G Alonso",VLDB,2000
70810,conf/vldb/YuV00,Efficient Numerical Error Bounding for Replicated Network Services,"H Yu, A Vahdat",VLDB,2000
70811,conf/sigmod/Fegaras98,Query Unnesting in Object-Oriented Databases,L Fegaras,SIGMOD Conference,1998
70813,conf/sigmod/RaoR98,Reusing Invariants: A New Strategy for Correlated Queries,"J Rao, K Ross",SIGMOD Conference,1998
70816,conf/sigmod/BerchtoldBK98,The Pyramid-Technique: Towards Breaking the Curse of Dimensionality,"S Berchtold, C Böhm, H Kriegel",SIGMOD Conference,1998
70817,conf/sigmod/JonssonFS98,Interaction of Query Evaluation and Buffer Management for Information Retrieval,"B Jónsson, M Franklin, D Srivastava",SIGMOD Conference,1998
70818,conf/vldb/LingLL00,Hierarchical Compact Cube for Range-Max Queries,"S Lee, T Ling, H Li",VLDB,2000
70819,conf/vldb/YiF00,Fast Time Sequence Indexing for Arbitrary Lp Norms,"B Yi, C Faloutsos",VLDB,2000
70822,conf/vldb/LuL00,Decision Tables: Scalable Classification Exploring RDBMS Capabilities,"H Lu, H Liu",VLDB,2000
70824,conf/sigmod/ShintaniK98,Parallel Mining Algorithms for Generalized Association Rules with Classification Hierarchy,"T Shintani, M Kitsuregawa",SIGMOD Conference,1998
70825,conf/sigmod/TsurUACMNR98,Query Flocks: A Generalization of Association-Rule Mining,"S Tsur, J Ullman, S Abiteboul, C Clifton, R Motwani, S Nestorov, A Rosenthal",SIGMOD Conference,1998
70828,conf/sigmod/ZaianeHLCC98,MultiMediaMiner: A System Prototype for Multimedia Data Mining,"O Zaďane, J Han, Z Li, S Chee, J Chiang",SIGMOD Conference,1998
70833,conf/vldb/DattaDTVRF01,A Comparative Study of Alternative Middle Tier Caching Solutions to Support Dynamic Web Content Acceleration,"A Datta, K Dutta, H Thomas, D VanderMeer, K Ramamritham, D Fishman",VLDB,2001
70838,conf/sigmod/LacroixSC98,User-oriented smart-cache for the Web: What You Seek is What You Get!,"Z Lacroix, A Sahuguet, R Chandrasekar",SIGMOD Conference,1998
70842,conf/vldb/MorishimaKKT01,Enabling End-users to Construct Data-intensive Web-sites from XML Repositories: An Example-based Approach,"A Morishima, S Koizumi, H Kitagawa, S Takano",VLDB,2001
