tid,id,title,authors,venue,year
70084,journals/sigmod/YauLMS99,On Multi-Resolution Document Transmission in Mobile Web,"S Yau, H Leong, D McLeod, A Si",SIGMOD Record,1999
70085,conf/sigmod/AltinelLKMPLWB02,DBCache: database caching for web application servers,"M Altinel, Q Luo, S Krishnamurthy, C Mohan, H Pirahesh, B Lindsay, H Woo, L Brown",SIGMOD Conference,2002
70087,conf/sigmod/FungSG02,COUGAR: the network is the database,"W Fung, D Sun, J Gehrke",SIGMOD Conference,2002
70088,journals/sigmod/Franklin99,Editor's Notes,M Franklin,SIGMOD Record,1999
70090,journals/sigmod/Snodgrass99b,Reminiscences on Influential Papers,,,1999
70091,conf/sigmod/DogacTPPLKTK02,An ebXML infrastructure implementation through UDDI registries and RosettaNet PIPs,"A Dogac, Y Tambag, P Pembecioglu, S Pektas, G Laleci, G Kurt, S Toprak, Y Kabak",SIGMOD Conference,2002
70092,journals/sigmod/CfP99,"The Active Database Central, ER2000, VLDB 2000, WISE 2000, Books, ACM DL",,SIGMOD Record,1999
70093,conf/sigmod/BumbulisB02,A compact B-tree,"P Bumbulis, I Bowman",SIGMOD Conference,2002
70094,journals/sigmod/Franklin99a,Editor's Notes,M Franklin,SIGMOD Record,1999
70096,journals/sigmod/ConradHHKRSS99,Engineering Federated Information Systems: Report of EFIS '99 Workshop,"S Conrad, W Hasselbring, U Hohenstein, R Kutsche, M Roantree, G Saake, F Saltor",SIGMOD Record,1999
70097,journals/sigmod/FrankGGJKLMNPSSSTW99,Chorochronos: A Research Network for Spatiotemporal Database Systems,"A Frank, S Grumbach, R Güting, C Jensen, M Koubarakis, N Lorentzos, Y Manolopoulos, E Nardelli, B Pernici, H Schek, M Scholl, T Sellis, B Theodoulidis, P Widmayer",SIGMOD Record,1999
70098,conf/sigmod/RaoZML02,Automating physical database design in a parallel database,"J Rao, C Zhang, N Megiddo, G Lohman",SIGMOD Conference,2002
70099,journals/sigmod/BoulosO99,Cost Estimation of User-Defined Methods in Object-Relational Database Systems,"J Boulos, K Ono",SIGMOD Record,1999
70100,conf/sigmod/Aggarwal02,"Hierarchical subspace sampling: a unified framework for high dimensional data reduction, selectivity estimation and nearest neighbor search",C Aggarwal,SIGMOD Conference,2002
70102,conf/sigmod/SismanisDRK02,Dwarf: shrinking the PetaCube,"Y Sismanis, A Deligiannakis, N Roussopoulos, Y Kotidis",SIGMOD Conference,2002
70103,journals/sigmod/RamDD99,Distributed Transactions in Practice,"P Ram, L Do, P Drew",SIGMOD Record,1999
70104,conf/sigmod/ChaudhuriGN02,Compressing SQL workloads,"S Chaudhuri, A Gupta, V Narasayya",SIGMOD Conference,2002
70105,journals/sigmod/PapianiWDN99,"A Distributed Scientific Data Archive Using the Web, XML and SQL/MED","M Papiani, J Wason, A Dunlop, D Nicole",SIGMOD Record,1999
70106,conf/sigmod/BhattacharyaMBNHS02,Coordinating backup/recovery and data consistency between database and file systems,"S Bhattacharya, C Mohan, K Brannon, I Narang, H Hsiao, M Subramanian",SIGMOD Conference,2002
70107,journals/sigmod/Etzion99,Report on NGITS'99: The 4th International Workshop on Next Generation Information Technologies and Systems,,,1999
70108,conf/sigmod/MoonWH02,General match: a subsequence matching method in time-series databases based on generalized windows,"Y Moon, K Whang, W Han",SIGMOD Conference,2002
70109,conf/sigmod/WangWYY02,Clustering by pattern similarity in large data sets,"H Wang, W Wang, J Yang, P Yu",SIGMOD Conference,2002
70110,journals/sigmod/HansonN99,Timer-Driven Database Triggers and Alerters: Semantics and a Challenge,"E Hanson, L Noronha",SIGMOD Record,1999
70111,journals/sigmod/Libkin99,"Some Remarks on Variable Independence, Closure, and Orthographic Dimension in Constraint Databases",L Libkin,SIGMOD Record,1999
70112,conf/sigmod/ProcopiucJAM02,A Monte Carlo algorithm for fast projective clustering,"C Procopiuc, M Jones, P Agarwal, T Murali",SIGMOD Conference,2002
70113,conf/sigmod/ThaperGIK02,Dynamic multidimensional histograms,"N Thaper, S Guha, P Indyk, N Koudas",SIGMOD Conference,2002
70116,journals/sigmod/Abiteboul99,On Views and XML,S Abiteboul,SIGMOD Record,1999
70117,conf/sigmod/Ramanan02,Efficient algorithms for minimizing tree pattern queries,P Ramanan,SIGMOD Conference,2002
70118,journals/sigmod/RossCGJBV99,Reminiscences on Influential Papers,,,1999
70119,conf/sigmod/VriesMNK02,Efficient k-NN search on vertically decomposed data,"A Vries, N Mamoulis, N Nes, M Kersten",SIGMOD Conference,2002
70120,journals/sigmod/MusickC99,Practical Lessons in Supporting Large-Scale Computational Science,"R Musick, T Critchlow",SIGMOD Record,1999
70121,conf/sigmod/GaoW02,Continually evaluating similarity-based pattern queries on a streaming time series,"L Gao, X Wang",SIGMOD Conference,2002
70122,journals/sigmod/EisenbergM99a,SQLJ-Part 1: SQL Routines Using the Java Programming Language,"A Eisenberg, J Melton",SIGMOD Record,1999
70123,conf/sigmod/DattaDTVSR02,Proxy-based acceleration of dynamically generated content on the world wide web: an approach and implementation,"A Datta, K Dutta, H Thomas, D VanderMeer, S Suresha, K Ramamritham",SIGMOD Conference,2002
70124,journals/sigmod/McHughW97,Integrating Dynamically-Fetched External Information into a DBMS for Semistructured Data,"J McHugh, J Widom",SIGMOD Record,1997
70125,journals/sigmod/AtzeniMM97,Semistructured und Structured Data in the Web: Going Back and Forth,"P Atzeni, G Mecca, P Merialdo",SIGMOD Record,1997
70127,conf/sigmod/ChenGMV02,Fractal prefetching B±Trees: optimizing both cache and disk performance,"S Chen, P Gibbons, T Mowry, G Valentin",SIGMOD Conference,2002
70128,journals/sigmod/BaaderJN97,Intelligent Access to Heterogeneous Information Sources: Report on the 4th Workshop on Knowledge Representation Meets Databases,,,1997
70129,conf/sigmod/ZhouR02,Implementing database operations using SIMD instructions,"J Zhou, K Ross",SIGMOD Conference,2002
70130,journals/sigmod/NestorovAM97,Infering Structure in Semistructured Data,"S Nestorov, S Abiteboul, R Motwani",SIGMOD Record,1997
70132,conf/sigmod/FreireHRRS02,StatiX: making XML count,"J Freire, J Haritsa, M Ramanath, P Roy, J Siméon",SIGMOD Conference,2002
70134,conf/sigmod/LiGS02,Skew handling techniques in sort-merge join,"W Li, D Gao, R Snodgrass",SIGMOD Conference,2002
70135,journals/sigmod/AshishK97,Wrapper Generation for Semi-structured Internet Sources,"N Ashish, C Knoblock",SIGMOD Record,1997
70136,conf/sigmod/TatarinovVBSSZ02,Storing and querying ordered XML using a relational database system,"I Tatarinov, S Viglas, K Beyer, J Shanmugasundaram, E Shekita, C Zhang",SIGMOD Conference,2002
70137,conf/sigmod/PapakonstantinouPV02,QURSED: querying and reporting semistructured data,"Y Papakonstantinou, M Petropoulos, V Vassalos",SIGMOD Conference,2002
70138,journals/sigmod/Suciu97,Foreword: Management of Semistructured Data,,,1997
70139,journals/sigmod/JajodiaBBKMSW97,Information Systems Research at George Mason University,"S Jajodia, D Barbará, A Brodsky, L Kerschberg, A Motro, E Sibley, X Wang",SIGMOD Record,1997
70140,conf/sigmod/DasuJMS02,"\Mining database structure; or, how to build a data quality browser\""""","T Dasu, T Johnson, S Muthukrishnan, V Shkapenyuk",SIGMOD Conference,2002
70141,journals/sigmod/GrayG97,"The Five-Minute Rule Ten Years Later, and Other Computer Storage Rules of Thumb","J Gray, G Graefe",SIGMOD Record,1997
70144,journals/sigmod/Franklin97a,Editor's Notes,M Franklin,SIGMOD Record,1997
70145,journals/sigmod/DadamK97,The Database and Information System Research Group at the University of Ulm,"P Dadam, W Klas",SIGMOD Record,1997
70146,conf/sigmod/RamanH02,Partial results for online query processing,"V Raman, J Hellerstein",SIGMOD Conference,2002
70147,conf/sigmod/TaoP02,Time-parameterized queries in spatio-temporal databases,"Y Tao, D Papadias",SIGMOD Conference,2002
70148,journals/sigmod/ConradEHRSSSV97,Research Issues in Federated Database Systems: Report of EFDBS '97 Workshop,,,1997
70149,conf/sigmod/BrunoKS02,Holistic twig joins: optimal XML pattern matching,"N Bruno, N Koudas, D Srivastava",SIGMOD Conference,2002
70150,journals/sigmod/McClatcheyV97,Workshop on Workflow Management in Scientific and Engineering Applications - Report,,,1997
70151,conf/sigmod/PolyzotisG02,Statistical synopses for graph-structured XML databases,"N Polyzotis, M Garofalakis",SIGMOD Conference,2002
70153,journals/sigmod/GuptaHR97,Virtual Database technology,"A Gupta, V Harinarayan, A Rajaraman",SIGMOD Record,1997
70154,conf/sigmod/ChangH02,Minimal probing: supporting expensive predicates for top-k queries,"K Chang, S Hwang",SIGMOD Conference,2002
70156,conf/sigmod/YangWYH02,Mining long sequential patterns in a noisy environment,"J Yang, W Wang, P Yu, J Han",SIGMOD Conference,2002
70157,journals/sigmod/BarbaraS97,Quasi-Cubes: Exploiting Approximations in Multidimensional Databases,"D Barbará, M Sullivan",SIGMOD Record,1997
70158,conf/sigmod/ChoiC02,Selectivity estimation for spatio-temporal queries to moving objects,"Y Choi, C Chung",SIGMOD Conference,2002
70159,journals/sigmod/ClementLGMK97,OGDI: Toward Interoperability among Geospatial Databases,"G Clement, C Larouche, D Gouin, P Morin, H Kucera",SIGMOD Record,1997
70160,conf/sigmod/GarofalakisG02,Wavelet synopses with error guarantees,"M Garofalakis, P Gibbons",SIGMOD Conference,2002
70161,conf/sigmod/JosifovskiSHL02,Garlic: a new flavor of federated query processing for DB2,"V Josifovski, P Schwarz, L Haas, E Lin",SIGMOD Conference,2002
70163,conf/sigmod/KanthRA02,Quadtree and R-tree indexes in oracle spatial: a comparison using GIS data,"K Kanth, S Ravada, D Abugov",SIGMOD Conference,2002
70164,journals/sigmod/FernandezFLS97,A Query Language for a Web-Site Management System,"M Fernandez, D Florescu, A Levy, D Suciu",SIGMOD Record,1997
70166,conf/sigmod/SzalayGTKMRSv02,The SDSS skyserver: public access to the sloan digital sky server data,"A Szalay, J Gray, A Thakar, P Kunszt, T Malik, J Raddick, C Stoughton, J vandenBerg",SIGMOD Conference,2002
70168,journals/sigmod/JukicV97,Asserting Beliefs in MLS Relational Models,"N Jukic, S Vrbsky",SIGMOD Record,1997
70169,journals/sigmod/SilberschatzZ97,Database Systems - Breaking Out of the Box,"A Silberschatz, S Zdonik",SIGMOD Record,1997
70171,conf/sigmod/AntonJLPZZ02,Web caching for database applications with Oracle Web Cache,"J Anton, L Jacobs, X Liu, J Parker, Z Zeng, T Zhong",SIGMOD Conference,2002
70172,journals/sigmod/Fong97,Converting Relational to Object-Oriented Databases,J Fong,SIGMOD Record,1997
70173,journals/sigmod/RamanathanH97,Extraction of Object-Oriented Structures from Existing Relational Databases,"S Ramanathan, J Hodges",SIGMOD Record,1997
70174,conf/sigmod/LuoKMPWLN02,Middle-tier database caching for e-business,"Q Luo, S Krishnamurthy, C Mohan, H Pirahesh, H Woo, B Lindsay, J Naughton",SIGMOD Conference,2002
70175,conf/sigmod/MarklL02,Learning table access cardinalities with LEO,"V Markl, G Lohman",SIGMOD Conference,2002
70176,journals/sigmod/ChaudhuriD97,An Overview of Data Warehousing and OLAP Technology,"S Chaudhuri, U Dayal",SIGMOD Record,1997
70177,conf/sigmod/ZhangMCMR02,Rainbow: mapping-driven XQuery processing system,"X Zhang, M Mulchandani, S Christ, B Murphy, E Rundensteiner",SIGMOD Conference,2002
70178,journals/sigmod/Franklin97,Editor's Notes,,,1997
70179,conf/sigmod/TheobaldW02,The XXL search engine: ranked retrieval of XML data using indexes and ontologies,"A Theobald, G Weikum",SIGMOD Conference,2002
70181,journals/sigmod/Konig-RiesL97,"Research in Databases and Data-Intensive Applications - Computer Science Department and FZI, University of Karlsruhe","B König-Ries, P Lockemann",SIGMOD Record,1997
70182,conf/sigmod/BarbosaMKL02,ToXgene: a template-based data generator for XML,"D Barbosa, A Mendelzon, J Keenleyside, K Lyons",SIGMOD Conference,2002
70183,conf/sigmod/AbadiC02,Visual COKO: a debugger for query optimizer development,"D Abadi, M Cherniack",SIGMOD Conference,2002
70185,conf/sigmod/ChenRW02,XCache: a semantic caching system for XML queries,"L Chen, E Rundensteiner, S Wang",SIGMOD Conference,2002
70187,conf/sigmod/RundensteinerWYD02,XmdvTool: visual interactive data exploration and trend discovery of high-dimensional data sets,"E Rundensteiner, M Ward, J Yang, P Doshi",SIGMOD Conference,2002
70189,conf/sigmod/LuWYBLY02,XBase: making your gigabyte disk queriable,"H Lu, G Wang, G Yu, Y Bao, J Lv, Y Yu",SIGMOD Conference,2002
70190,journals/sigmod/Snodgrass98b,Chair's Message,,,1998
70191,journals/sigmod/ChangGKRS98,Database Research at Columbia University,"S Chang, L Gravano, G Kaiser, K Ross, S Stolfo",SIGMOD Record,1998
70192,conf/sigmod/FlorescuGKR02,XL: a platform for web services,"D Florescu, A Grünhagen, D Kossmann, S Rost",SIGMOD Conference,2002
70193,conf/sigmod/CrescenziMM02,RoadRunner: automatic data extraction from data-intensive web sites,"V Crescenzi, G Mecca, P Merialdo",SIGMOD Conference,2002
70194,journals/sigmod/FlorescuLM98,Database Techniques for the World-Wide Web: A Survey,"D Florescu, A Levy, A Mendelzon",SIGMOD Record,1998
70196,conf/sigmod/Bussler02,Software as a service: ASP and ASP aggregation,,,2002
70197,conf/sigmod/Mohan02,Tutorial: application servers and associated technologies,,,2002
70198,journals/sigmod/Lomet98,B-tree Page Size When Caching is Considered,D Lomet,SIGMOD Record,1998
70201,journals/sigmod/CheungF98,Enhanced Nearest Neighbour Search on the R-tree,"K Cheung, A Fu",SIGMOD Record,1998
70202,conf/sigmod/Cotton02,Implementing XQuery,P Cotton,SIGMOD Conference,2002
70203,conf/sigmod/BreunigKKS01,Data Bubbles: Quality Preserving Performance Boosting for Hierarchical Clustering,"M Breunig, H Kriegel, P Kröger, J Sander",SIGMOD Conference,2001
70204,journals/sigmod/TsotrasJS98,An Extensible Notation for Spatiotemporal Index Queries,"V Tsotras, C Jensen, R Snodgrass",SIGMOD Record,1998
70205,journals/sigmod/BurtonM98,Applications of the JAVA Programming Language to Database Management,"B Burton, V Marek",SIGMOD Record,1998
70206,conf/sigmod/RinfretOO01,Bit-Sliced Index Arithmetic,"D Rinfret, P O'Neil, E O'Neil",SIGMOD Conference,2001
70207,conf/sigmod/ChaudhuriDN01,"A Robust, Optimization-Based Approach for Approximate Answering of Aggregate Queries","S Chaudhuri, G Das, V Narasayya",SIGMOD Conference,2001
70208,journals/sigmod/Franklin98,Editor's Notes,M Franklin,SIGMOD Record,1998
70209,conf/sigmod/SlivinskasJS01,Adaptable Query Optimization and Evaluation in Temporal Middleware,"G Slivinskas, C Jensen, R Snodgrass",SIGMOD Conference,2001
70211,journals/sigmod/EisenbergM98,Standards in Practice,"A Eisenberg, J Melton",SIGMOD Record,1998
70213,conf/sigmod/ChenZCKR01,DyDa: Data Warehouse Maintenance in Fully Concurrent Environments,"J Chen, X Zhang, S Chen, A Koeller, E Rundensteiner",SIGMOD Conference,2001
70215,conf/sigmod/NazeriBO01,Experiences in Mining Aviation Safety Data,"Z Nazeri, E Bloedorn, P Ostwald",SIGMOD Conference,2001
70216,journals/sigmod/SnodgrassGIMSU98,Reminiscences on Influential Papers,,,1998
70217,journals/sigmod/BorgidaCS98,KRDB '98: The 5th International Workshop on Knowledge Representation Meets Databases,,,1998
70218,conf/sigmod/JagadishJOT01,Global Optimization of Histograms,"H Jagadish, H Jin, B Ooi, K Tan",SIGMOD Conference,2001
70219,journals/sigmod/GatziuKBF98,Unbundling Active Functionality,"S Gatziu, A Koschel, G Bültzingsloewen, H Fritschi",SIGMOD Record,1998
70220,conf/sigmod/LeeWMS01,Dynamic Buffer Allocation in Video-on-Demand Systems,"S Lee, K Whang, Y Moon, I Song",SIGMOD Conference,2001
70221,conf/sigmod/HanPLJ01,DNA-Miner: A System Prototype for Mining DNA Sequences,"J Han, H Jamil, Y Lu, L Chen, Y Liao, J Pei",SIGMOD Conference,2001
70222,journals/sigmod/KuokFW98,Mining Fuzzy Association Rules in Databases,"C Kuok, A Fu, M Wong",SIGMOD Record,1998
70225,journals/sigmod/Roussopoulos98,Materialized Views and Data Warehouses,N Roussopoulos,SIGMOD Record,1998
70226,conf/sigmod/HernandezMHYHT01,Clio: A Semi-Automatic Tool For Schema Mapping,"M Hernández, R Miller, L Haas",SIGMOD Conference,2001
70227,journals/sigmod/Chaudhri98,Workshop Report on Experiences Using Object Data Management in the Real-World,,,1998
70228,conf/sigmod/FernandezMS01,Efficient Evaluation of XML Middle-ware Queries,"M Fernandez, A Morishima, D Suciu",SIGMOD Conference,2001
70229,conf/sigmod/CandanLLHA01,Enabling Dynamic Content Caching for Database-Driven Web Sites,"K Candan, W Li, Q Luo, W Hsiung, D Agrawal",SIGMOD Conference,2001
70231,conf/sigmod/KiesslingHFE01,"COSIMA - Your Smart, Speaking E-Salesperson","W Kießling, S Holland, S 0003, T Ehm",SIGMOD Conference,2001
70232,journals/sigmod/Snodgrass98,Chair's Message,,,1998
70233,journals/sigmod/Mendelzon98,Information Director's Message,,,1998
70234,conf/sigmod/YanMHF01,Data-Driven Understanding and Refinement of Schema Mappings,"L Yan, R Miller, L Haas, R Fagin",SIGMOD Conference,2001
70235,journals/sigmod/Han98,Towards On-Line Analytical Mining in Large Databases,J Han,SIGMOD Record,1998
70237,conf/sigmod/Maguire01,Catalog Management in Websphere Commerce Suite,T Maguire,SIGMOD Conference,2001
70239,journals/sigmod/Rosenthal98,Where Will Object Techonology Drive Data Administration?,A Rosenthal,SIGMOD Record,1998
70240,conf/sigmod/BorkarDS01,Automatic Segmentation of Text into Structured Records,"V Borkar, K Deshmukh, S Sarawagi",SIGMOD Conference,2001
70241,conf/sigmod/SchusterW01,Communication Efficient Distributed Mining of Association Rules,"A Schuster, R Wolff",SIGMOD Conference,2001
70242,journals/sigmod/Bernstein98,Repositories and Object Oriented Databases,P Bernstein,SIGMOD Record,1998
70243,journals/sigmod/KoksalAD98,Workflow History Management,"P Koksal, S Arpinar, A Dogac",SIGMOD Record,1998
70245,journals/sigmod/Manola98,Towards a Richer Web Object Model,F Manola,SIGMOD Record,1998
70246,conf/sigmod/LahiriG01,Fast-Start: Quick Fault Recovery in Oracle,"T Lahiri, A Ganesh, R Weiss, A Joshi",SIGMOD Conference,2001
70248,conf/sigmod/GodfreyGXZ01,Exploiting Constraint-Like Data Characterizations in Query Optimization,"P Godfrey, J Gryz, C Zuzarte",SIGMOD Conference,2001
70249,conf/sigmod/FabretJLPRS01,Filtering Algorithms and Implementation for Very Fast Publish/Subscribe,"F Fabret, H Jacobsen, F Llirbat, J Pereira, K Ross, D Shasha",SIGMOD Conference,2001
70250,journals/sigmod/ChangASS98,T2: A Customizable Parallel Database for Multi-Dimensional Data,"C Chang, A Acharya, A Sussman, J Saltz",SIGMOD Record,1998
70252,journals/sigmod/ACT-NET96,ACT-NET - The Active Database Management System Manifesto: A Rulebase of ADBMS Features,,SIGMOD Record,1996
70253,journals/sigmod/BrunieK96,Control Strategies for Complex Relational Query Processing in Shared Nothing Systems,"L Brunie, H Kosch",SIGMOD Record,1996
70255,conf/sigmod/Smith01,MPEG-7 Standard for Multimedia Databases,,,2001
70256,journals/sigmod/GerlhofKM96,On the Cost of Monitoring and Reorganization of Object Bases for Clustering,"C Gerlhof, A Kemper, G Moerkotte",SIGMOD Record,1996
70257,conf/sigmod/LangS01,Modeling High-Dimensional Index Structures using Sampling,"C Lang, A Singh",SIGMOD Conference,2001
70258,journals/sigmod/NormanZT96,Much Ado About Shared-Nothing,"M Norman, T Zurek, P Thanisch",SIGMOD Record,1996
70259,journals/sigmod/BestavrosLS96,Report on First International Workshop on Real-Time Database Systems,,,1996
70260,conf/sigmod/Meseck01,"Data Management: Lasting Impact of the Wild, Wild, Web",R Meseck,SIGMOD Conference,2001
70262,journals/sigmod/HasanFV96,Open Issues in Parallel Query Optimization,"W Hasan, D Florescu, P Valduriez",SIGMOD Record,1996
70263,conf/sigmod/StonebrakerH01,Content Integration for E-Business,"M Stonebraker, J Hellerstein",SIGMOD Conference,2001
70264,journals/sigmod/Dogac96,Middle East Technical University Software Research and Development Center,A Dogac,SIGMOD Record,1996
70265,conf/sigmod/ShahC01,"Fault-tolerant, Load-balancing Queries in Telegraph","M Shah, S Chandrasekaran",SIGMOD Conference,2001
70266,journals/sigmod/BilirisP96,The BeSS Object Storage Manager: Architecture Overview,"A Biliris, E Panagos",SIGMOD Record,1996
70267,journals/sigmod/DAndreaJ96,UniSQL's Next-Generation Object-Relational Database Management System,"A D'Andrea, P Janus",SIGMOD Record,1996
70268,conf/sigmod/HaasH01,Online Query Processing,,,2001
70270,conf/sigmod/Larson01,XML Data Management Go Native or Spruce up Relational Systems? (Panel Abstract),P Larson,SIGMOD Conference,2001
70271,journals/sigmod/Widom96,Editor's Notes,J Widom,SIGMOD Record,1996
70272,conf/sigmod/Bussler01,Semantic B2B Integration,,,2001
70274,conf/sigmod/GoldsteinL01,"Optimizing Queries Using Materialized Views: A practical, scalable solution","J Goldstein, P Larson",SIGMOD Conference,2001
70275,journals/sigmod/UlusoyB96,Exploiting Main Memory DBMS Features to Improve Real-Time Concurrency Control Protocols,"Ö Ulusoy, A Buchmann",SIGMOD Record,1996
70276,conf/sigmod/ShouCTRH01,REVIEW: A Real Time Virtual Walkthrough System,"L Shou, J Chionh, K Tan, Y Ruan, Z Huang",SIGMOD Conference,2001
70277,journals/sigmod/Bestavros96,Advances in Real-Time Database Systems Research,A Bestavros,SIGMOD Record,1996
70278,conf/sigmod/TatarinovIHW01,Updating XML,"I Tatarinov, Z Ives, A Halevy, D Weld",SIGMOD Conference,2001
70279,conf/sigmod/MistryRSR01,Materialized View Selection and Maintenance Using Multi-Query Optimization,"H Mistry, P Roy, S Sudarshan, K Ramamritham",SIGMOD Conference,2001
70280,journals/sigmod/AndlerHEMBE96,DeeDS Towards a Distributed and Active Real-Time Database System,"S Andler, J Hansson, J Eriksson, J Mellin, M Berndtsson, B Eftring",SIGMOD Record,1996
70281,journals/sigmod/LinP96,Enhancing External Consistency in Real-Time Transactions,"K Lin, S Peng",SIGMOD Record,1996
70282,conf/sigmod/GionisGK01,Efficient and Tunable Similar Set Retrieval,"A Gionis, D Gunopulos, N Koudas",SIGMOD Conference,2001
70283,conf/sigmod/AgichteinGV01,Snowball: A Prototype System for Extracting Relations from Large Text Collections,"E Agichtein, L Gravano, J Pavel, V Sokolova, A Voskoboynik",SIGMOD Conference,2001
70284,journals/sigmod/SilberschatzSU96,Database Research: Achievements and Opportunities Into the 21st Century,"A Silberschatz, M Stonebraker, J Ullman",SIGMOD Record,1996
70285,conf/sigmod/KimCK01,Optimizing Multidimensional Index Trees for Main Memory Access,"K Kim, S Cha, K Kwon",SIGMOD Conference,2001
70286,journals/sigmod/PhatakSSS96,"Database Research at the Indian Institute of Technology, Bombay","D Phatak, N Sarda, S Seshadri, S Sudarshan",SIGMOD Record,1996
70287,journals/sigmod/RamamrithamSSTX96,"Integrating Temporal, Real-Time, and Active Databases","K Ramamritham, R Sivasankaran, J Stankovic, D Towsley, M Xiong",SIGMOD Record,1996
70289,conf/sigmod/BertinoCF01,Securing XML Documents: the Author-X Project Demonstration,"E Bertino, S Castano, E Ferrari",SIGMOD Conference,2001
70290,journals/sigmod/HaritsaS96,Real-Time Index Concurrency Control,"J Haritsa, S Seshadri",SIGMOD Record,1996
70291,journals/sigmod/KuoM96,Real-Time Database - Similarity Semantics and Resource Scheduling,"T Kuo, A Mok",SIGMOD Record,1996
70292,conf/sigmod/BabuGR01,SPARTAN: A Model-Based Semantic Compression System for Massive Data Tables,"S Babu, M Garofalakis, R Rastogi",SIGMOD Conference,2001
70293,journals/sigmod/SonDT96,Improving Timeliness in Real-Time Secure Database Systems,"S Son, R David, B Thuraisingham",SIGMOD Record,1996
70294,conf/sigmod/LamCKNH01,RETINA: A REal-time TraffIc NAvigation System,"K Lam, E Chan, T Kuo, S Ng, D Hung",SIGMOD Conference,2001
70295,journals/sigmod/AdelbergKG96,Overview of the STanford Real-time Information Processor (STRIP),"B Adelberg, B Kao, H Garcia-Molina",SIGMOD Record,1996
70296,conf/sigmod/GreenwaldK01,Space-Efficient Online Computation of Quantile Summaries,"M Greenwald, S Khanna",SIGMOD Conference,2001
70297,conf/sigmod/DraperHW01,The Nimble Integration Engine,"D Draper, A Halevy, D Weld",SIGMOD Conference,2001
70298,journals/sigmod/TsotrasK96,Temporal Database Bibliography Update,"V Tsotras, A Kumar",SIGMOD Record,1996
70299,conf/sigmod/Galindo-LegariaJ01,Orthogonal Optimization of Subqueries and Aggregation,"C Galindo-Legaria, M Joshi",SIGMOD Conference,2001
70300,journals/sigmod/BerndtssonH96,Workshop Report: The First International Workshop on Active and Real-Time Database Systems (ARTDB-95),,,1996
70301,conf/sigmod/DeshpandeGR01,Independence is Good: Dependency-Based Histogram Synopses for High-Dimensional Data,"A Deshpande, M Garofalakis, R Rastogi",SIGMOD Conference,2001
70302,journals/sigmod/Baeza-YatesN96,Integrating Contents and Structure in Text Retrieval,"R Baeza-Yates, G Navarro",SIGMOD Record,1996
70303,journals/sigmod/FreemanG96,Lifestreams: A Storage Model for Personal Data,"E Freeman, D Gelernter",SIGMOD Record,1996
70304,conf/sigmod/LazaridisM01,Progressive Approximate Aggregate Queries with a Multi-Resolution Tree Structure,"I Lazaridis, S Mehrotra",SIGMOD Conference,2001
70305,journals/sigmod/Wade96,Object Query Standards,A Wade,SIGMOD Record,1996
70306,conf/sigmod/BrunoCG01,STHoles: A Multidimensional Workload-Aware Histogram,"N Bruno, S Chaudhuri, L Gravano",SIGMOD Conference,2001
70307,journals/sigmod/UrbanDG96,Database Research at Arizona State University,"S Urban, S Dietrich, F Golshani",SIGMOD Record,1996
70308,conf/sigmod/Mohan01,Application Servers: Born-Again TP Monitors for the Web? (Panel Abstract),C Mohan,SIGMOD Conference,2001
70309,journals/sigmod/Gaffney96,Illustra's Web DataBlade Module,J Gaffney,SIGMOD Record,1996
70310,conf/sigmod/KalnisP01,Proxy-Server Architectures for OLAP,"P Kalnis, D Papadias",SIGMOD Conference,2001
70311,journals/sigmod/Anonymous96,MQSeries and CICS Link for Lotus Notes,,SIGMOD Record,1996
70312,conf/sigmod/YuMWL01,Efficient and Effective Metasearch for Text Databases Incorporating Linkages among Documents,"C Yu, W Meng, W Wu, K Liu",SIGMOD Conference,2001
