tid,id,title,authors,venue,year
69611,conf/vldb/RusinkiewiczKTWM95,Towards a Cooperative Transaction Model - The Cooperative Activity Model,"M Rusinkiewicz, W Klas, T Tesch, J Wäsch, P Muth",VLDB,1995
69612,journals/sigmod/EisenbergM02,SQL/XML is Making Good Progress,"A Eisenberg, J Melton",SIGMOD Record,2002
69613,conf/vldb/AmmannJR95,Using Formal Methods to Reason about Semantics-Based Decompositions of Transactions,"P Ammann, S Jajodia, I Ray",VLDB,1995
69614,journals/sigmod/Liu02,Editor's Notes,L Liu,SIGMOD Record,2002
69615,journals/sigmod/Hammer02,Report on the ACM Fourth International Workshop on Data Warehousing and OLAP (DOLAP 2001),,,2002
69616,conf/vldb/FerrandinaMZFM95,Schema and Database Evolution in the O2 Object Database System,"F Ferrandina, T Meyer, R Zicari, G Ferran, J Madec",VLDB,1995
69617,conf/vldb/SubietaKL95,Procedures in Object-Oriented Query Languages,"K Subieta, Y Kambayashi, J Leszczylowski",VLDB,1995
69618,journals/sigmod/BargaL02,Phoenix Project: Fault-Tolerant Applications,"R Barga, D Lomet",SIGMOD Record,2002
69619,journals/sigmod/Ouksel02,Mining the World Wide Web: An Information Search Approach - Book Review,,,2002
69620,conf/vldb/MoserKK95,L/MRP: A Buffer Management Strategy for Interactive Continuous Data Flows in a Multimedia DBMS,"F Moser, A Kraiss, W Klas",VLDB,1995
69621,journals/sigmod/Konig-RiesMMPPRSVW02,Report on the NSF Workshop on Building an Infrastructure for Mobile and Wireless Systems,,,2002
69622,conf/vldb/ChaudhuriGS95,Retrieval of Composite Multimedia Objects,"S Chaudhuri, S Ghandeharizadeh, C Shahabi",VLDB,1995
69623,journals/sigmod/Kosch02,MPEG-7 and Multimedia Database Systems,H Kosch,SIGMOD Record,2002
69624,conf/vldb/LuTD95,The Fittest Survives: An Adaptive Approach to Query Optimization,"H Lu, K Tan, S Dao",VLDB,1995
69625,journals/sigmod/RossFS02,Reminiscences on Influential Papers,,,2002
69626,conf/vldb/TreschPL95,Type Classification of Semi-Structured Documents,"M Tresch, N Palmer, A Luniewski",VLDB,1995
69627,journals/sigmod/Geller02,Data Mining: Practical Machine Learning Tools and Techniques - Book Review,J Geller,SIGMOD Record,2002
69628,conf/vldb/MehtaD95,Managing Intra-operator Parallelism in Parallel Database Systems,"M Mehta, D DeWitt",VLDB,1995
69629,journals/sigmod/CaplinskasEV02,Advances in Databases and Information Systems (ADBIS),"A Caplinskas, J Eder, O Vasilecas",SIGMOD Record,2002
69630,conf/vldb/SrikantA95,Mining Generalized Association Rules,"R Srikant, R Agrawal",VLDB,1995
69631,conf/vldb/HaasNSS95,Sampling-Based Estimation of the Number of Distinct Values of an Attribute,"P Haas, J Naughton, S Seshadri, L Stokes",VLDB,1995
69633,conf/vldb/FlodinR95,Processing Object-Oriented Queries with Invertible Late Bound Functions,"S Flodin, T Risch",VLDB,1995
69634,journals/sigmod/Kemper02,Databases and Transaction Processing: An Application-Oriented Approach - Book Review,A Kemper,SIGMOD Record,2002
69635,conf/vldb/HvasshovdTBH95,"The ClustRa Telecom Database: High Availability, High Throughput, and Real-Time Response","S Hvasshovd, Ř Torbjřrnsen, S Bratsberg, P Holager",VLDB,1995
69636,journals/sigmod/Kim02,Conceptual Modeling and Specification Generation for B2B Business Process based on ebXML,H Kim,SIGMOD Record,2002
69637,conf/vldb/LuSL95,NeuroRule: A Connectionist Approach to Data Mining,"H Lu, R Setiono, H Liu",VLDB,1995
69638,journals/sigmod/ErdurD02,A Multi-Agent System Infrastructure for Software Component Market-Place: An Ontological Perspective,"R Erdur, O Dikenelli",SIGMOD Record,2002
69639,conf/vldb/GallersdorferN95,Improving Performance in Replicated Databases through Relaxed Coherency,"R Gallersdörfer, M Nicola",VLDB,1995
69641,journals/sigmod/HummerLW02,Contracting in the Days of eBusiness,"W Hümmer, W Lehner, H Wedekind",SIGMOD Record,2002
69642,conf/vldb/LometT95,Redo Recovery after System Crashes,"D Lomet, M Tuttle",VLDB,1995
69643,conf/vldb/Wang95,DB2 Query Parallelism: Staging and Implementation,Y Wang,VLDB,1995
69644,journals/sigmod/Winslett02a,David DeWitt Speaks Out,M Winslett,ecord,2002
69645,conf/vldb/SumiyaYTSI95,A Product Specification Database for Visual Prototyping,"K Sumiya, K Yasutake, H Tanaka, N Sanada, Y Imai",VLDB,1995
69646,journals/sigmod/Camps02,From Ternary Relationship to Relational Tables: A Case Against Common Beliefs,R Camps,SIGMOD Record,2002
69647,conf/vldb/DidriksenGD95,Database De-Centralization - A Practical Approach,"T Didriksen, C Galindo-Legaria, E Dahle",VLDB,1995
69648,journals/sigmod/HalkidiBV02,Cluster Validity Methods: Part I,"M Halkidi, Y Batistakis, M Vazirgiannis",SIGMOD Record,2002
69651,journals/sigmod/SlivinskasJS02,Bringing Order to Query Optimization,"G Slivinskas, C Jensen, R Snodgrass",SIGMOD Record,2002
69652,conf/vldb/BrownS95,BigSur: A System For the Management of Earth Science Data,"P Brown, M Stonebraker",VLDB,1995
69653,journals/sigmod/Liu02a,Editor's Notes,L Liu,SIGMOD Record,2002
69654,conf/vldb/LeslieJBY95,Efficient Search of Multi-Dimensional B-Trees,"H Leslie, R Jain, D Birdsall, H Yaghmai",VLDB,1995
69655,journals/sigmod/CruzKLSWY02,Research Activities in Database Management and Information Retrieval at the University of Illinois at Chicago,"I Cruz, A Khokhar, B Liu, A Sistla, O Wolfson, C Yu",SIGMOD Record,2002
69656,conf/vldb/OrensteinK95,Accessing a Relational Database through an Object-Oriented Database Interface,"J Orenstein, D Kamber",VLDB,1995
69657,journals/sigmod/LuoI02,Interviewing During a Tight Job Market,,,2002
69658,conf/vldb/Lindsay95,"DB2 Common Server: Technology, Progress, & Directions",B Lindsay,VLDB,1995
69659,journals/sigmod/Wiegand02,Investigating XQuery for Querying Across Database Object Types,N Wiegand,SIGMOD Record,2002
69660,conf/vldb/KonopnickiS95,W3QS: A Query System for the World-Wide Web,"D Konopnicki, O Shmueli",VLDB,1995
69661,journals/sigmod/OrlandicLS02,The Design of a Retrieval Technique for High-Dimensional Data on Tertiary Storage,"R Orlandic, J Lukaszuk, C Swietlik",SIGMOD Record,2002
69662,conf/vldb/WienerN95,OODB Bulk Loading Revisited: The Partitioned-List Approach,"J Wiener, J Naughton",VLDB,1995
69663,journals/sigmod/Ozsu02,Chair's Message,,,2002
69665,journals/sigmod/Fagin02,Combining Fuzzy Information: an Overview,R Fagin,SIGMOD Record,2002
69666,conf/vldb/ReuterCGSW95,Databases and Workflow Management: What is it All About? (Panel),"A Reuter, S Ceri, J Gray, B Salzberg, G Weikum",VLDB,1995
69667,conf/vldb/GoyalHSS95,Index Concurrency Control in Firm Real-Time Database Systems,"B Goyal, J Haritsa, S Seshadri, V Srinivasan",VLDB,1995
69669,conf/vldb/BestavrosB95,Value-cognizant Speculative Concurrency Control,"A Bestavros, S Braoudakis",VLDB,1995
69670,journals/sigmod/Goethals02,Data Warehousing and Business Intelligence for E-Commerce - Book Review,F Goethals,SIGMOD Record,2002
69671,journals/sigmod/BerzalM02,Data Mining: Concepts and Techniques - Book Review,"F Galiano, N Marín",SIGMOD Record,2002
69672,conf/vldb/WuYCT95,A Performance Study of Workfile Disk Management for Concurrent Mergesorts in a Multiprocessor Database System,"K Wu, P Yu, J Chung, J Teng",VLDB,1995
69673,conf/vldb/MogiK95,Hot Block Clustering for Disk Arrays with Dynamic Striping,"K Mogi, M Kitsuregawa",VLDB,1995
69674,journals/sigmod/Aberer02a,Book Review Column,K Aberer,SIGMOD Record,2002
69676,conf/vldb/JonscherD94,An Approach for Building Secure Database Federations,"D Jonscher, K Dittrich",VLDB,1994
69677,journals/sigmod/YaoG02,The Cougar Approach to In-Network Query Processing in Sensor Networks,"Y Yao, J Gehrke",SIGMOD Record,2002
69678,conf/vldb/JagadishLRSS94,Dalí: A High Performance Main Memory Storage Manager,"H Jagadish, D Lieuwen, R Rastogi, A Silberschatz, S Sudarshan",VLDB,1994
69680,conf/vldb/Galindo-LegariaPK94,"Fast, Randomized Join-Order Selection - Why Use Transformations?","C Galindo-Legaria, A Pellenkoft, M Kersten",VLDB,1994
69681,journals/sigmod/Weikum02,Foundations of Statistical Natural Language Processing - Book Review,,,2002
69682,conf/vldb/WienerN94,Bulk Loading into an OODB: A Performance Study,"J Wiener, J Naughton",VLDB,1994
69683,conf/vldb/NgH94,Efficient and Effective Clustering Methods for Spatial Data Mining,"R Ng, J Han",VLDB,1994
69684,journals/sigmod/Neven02,Automata Theory for XML Researchers,F Neven,SIGMOD Record,2002
69685,journals/sigmod/WinslettCDHZZ02,Database Research at the University of Illinois at Urbana-Champaign,"M Winslett, K Chang, A Doan, J Han, C Zhai, Y Zhou",SIGMOD Record,2002
69686,conf/vldb/BrownCC94,Fast Incremental Indexing for Full-Text Information Retrieval,"E Brown, J Callan, W Croft",VLDB,1994
69688,conf/vldb/FuC94,A Transaction Replication Scheme for a Replicated Database with Node Autonomy,"A Fu, D Cheung",VLDB,1994
69690,conf/vldb/OuzzaniAB94,A Top-Down Approach for Two Level Serializability,"M Ouzzani, M Atroun, N Belkhodja",VLDB,1994
69691,conf/vldb/FrohnLU94,Access to Objects by Path Expressions and Rules,"J Frohn, G Lausen, H Uphoff",VLDB,1994
69692,journals/sigmod/SofferMC02,Report on the Mobile Search Workshop at WWW 2002,,,2002
69693,conf/vldb/Guting94,GraphDB: Modeling and Querying Graphs in Databases,R Güting,VLDB,1994
69694,journals/sigmod/LeveneP02,Report on the Web Dynamics Workshop at WWW 2002,,,2002
69695,journals/sigmod/CrestaniG02,Report on the 24th European Colloquium on Information Retrieval Research,,,2002
69697,conf/vldb/KemperK94,Dual-Buffering Strategies in Object Bases,"A Kemper, D Kossmann",VLDB,1994
69698,journals/sigmod/MeltonMJKS02,SQL/MED - A Status Report,"J Melton, J Michels, V Josifovski, K Kulkarni, P Schwarz",SIGMOD Record,2002
69699,journals/sigmod/Winslett02b,Hector Garcia-Molina Speaks Out,M Winslett,,2002
69700,conf/vldb/JohnsonS94,2Q: A Low Overhead High Performance Buffer Management Replacement Algorithm,"T Johnson, D Shasha",VLDB,1994
69701,conf/vldb/BarjaPFWD94,An Effective Deductive Object-Oriented Database Through Language Integration,"M Barja, N Paton, A Fernandes, M Williams, A Dinn",VLDB,1994
69702,journals/sigmod/LightstoneLZ02,Toward Autonomic Computing with DB2 Universal Database,"S Lightstone, G Lohman, D Zilio",SIGMOD Record,2002
69703,journals/sigmod/RossAJS02,Reminiscences on Influential Papers,,,2002
69705,journals/sigmod/FrankNS02,Report on the Semantic Web Workshop at WWW 2002,,,2002
69706,conf/vldb/AgrawalS94,Fast Algorithms for Mining Association Rules in Large Databases,"R Agrawal, R Srikant",VLDB,1994
69707,journals/sigmod/Badia02,Ontologies: A Silver Bullet for Knowledge Management and Electronic Commerce - Book Review,,,2002
69708,conf/vldb/HaberIL95,OPOSSUM: Desk-Top Schema Management through Customizable Visualization,"E Haber, Y Ioannidis, M Livny",VLDB,1995
69709,journals/sigmod/GobleR02a,The Grid: An Application of the Semantic Web,"C Goble, D Roure",SIGMOD Record,2002
69710,conf/vldb/AgrawalPWZ95,Querying Shapes of Histories,"R Agrawal, G Psaila, E Wimmers, M Zaďt",VLDB,1995
69711,journals/sigmod/Winslett02c,Interview with David Maier,,,2002
69712,conf/vldb/EvangelidisLS95,"The hBP-tree: A Modified hB-tree Supporting Concurrency, Recovery and Node Consolidation","G Evangelidis, D Lomet, B Salzberg",VLDB,1995
69713,journals/sigmod/Wu02,Small Worlds: the Dynamics of Networks between Order and Randomness - Book Review,,,2002
69714,conf/vldb/KalusD95,Flexible Relations - Operational Support of Variant Relational Structures,"C Kalus, P Dadam",VLDB,1995
69715,conf/vldb/Sarawagi95,Query Processing in Tertiary Memory Databases,S Sarawagi,VLDB,1995
69716,journals/sigmod/FininJ02,"Agents, Turst, and Information Access on the Semantic Web","T Finin, A Joshi",SIGMOD Record,2002
69717,journals/sigmod/SureSS02,Methodology for Development and Employment of Ontology Based Knowledge Management Applications,"Y Sure, S Staab, R Studer",SIGMOD Record,2002
69718,conf/vldb/Brin95,Near Neighbor Search in Large Metric Spaces,S Brin,VLDB,1995
69719,conf/vldb/RamakrishnanGRSWZ95,Scientific Journals: Extinction or Explosion? (Panel),"R Ramakrishnan, H Garcia-Molina, G Rossbach, A Silberschatz, G Wiederhold, J Zijlstra",VLDB,1995
69720,journals/sigmod/ButtlerCCFHLPRX02,Querying Multiple Bioinformatics Data Sources: Can Semantic Web Research Help?,"D Buttler, M Coleman, T Critchlow, R Fileto, W Han, L Liu, C Pu, D Rocco, L Xiong",SIGMOD Record,2002
69721,journals/sigmod/AnyanwuS02,The p Operator: Discovering and Ranking Associations on the Semantic Web,"K Anyanwu, A Sheth",SIGMOD Record,2002
69722,conf/vldb/SistlaYLL95,Similarity based Retrieval of Pictures Using Indices on Spatial Relationships,"A Sistla, C Yu, C Liu, K Liu",VLDB,1995
69723,journals/sigmod/HalkidiBV02a,Clustering Validity Checking Methods: Part II,"M Halkidi, Y Batistakis, M Vazirgiannis",SIGMOD Record,2002
69724,conf/vldb/Meier95,Providing Database Migration Tools - A Practicioner's Approach,A Meier,VLDB,1995
69726,conf/vldb/SeligmanBNSW95,Metrics for Accessing Heterogeneous Data: Is There Any Hope? (Panel),"L Seligman, N Belkin, E Neuhold, M Stonebraker, G Wiederhold",VLDB,1995
69727,conf/vldb/Vaskevitch95,"Very Large Databases: How Large, How Different?",D Vaskevitch,VLDB,1995
69728,journals/sigmod/Aberer02b,Book Review Column,K Aberer,SIGMOD Record,2002
69729,journals/sigmod/HuangKL02,A Study on the Management of Semantic Transaction for Efficient Data Retrieval,"S Huang, I Kwan, C Li",SIGMOD Record,2002
69730,conf/vldb/SimonD95,Promises and Realities of Active Database Systems,"E Simon, A Dittrich",VLDB,1995
69731,conf/vldb/CatozziR95,OS Support for VLDBs: Unix Enhancements for the Teradata Data Base,"J Catozzi, S Rabinovici",VLDB,1995
69733,journals/sigmod/Grohe02,Parameterized Complexity for the Database Theorist,M Grohe,SIGMOD Record,2002
69734,conf/vldb/Fecteau95,Managing a DB2 Parallel Edition Database,G Fecteau,VLDB,1995
69735,journals/sigmod/RoantreeS02,Research in Information Managment at Dublin City University,"M Roantree, A Smeaton",SIGMOD Record,2002
69736,conf/vldb/Hallmark95,The Oracle Warehouse,G Hallmark,VLDB,1995
69737,conf/vldb/Spintzik95,Informix-Online XPS: A Dynamically Scalable RDBMS for Open Parallel Platforms,H Spintzik,VLDB,1995
69738,journals/sigmod/BoucelmaCGJLL02,Report on the EDBT'02 Panel on Scientific Data Integration,,,2002
69741,journals/sigmod/Suciu01,On Database Theory and XML,D Suciu,SIGMOD Record,2001
69742,conf/vldb/ColletCS94,NAOS - Efficient and Modular Reactive Capabilities in an Object-Oriented Database System,"C Collet, T Coupaye, T Svensen",VLDB,1994
69743,journals/sigmod/Fankhauser01,XQuery Formal Semantics: State and Challenges,P Fankhauser,SIGMOD Record,2001
69744,conf/vldb/BrownMCL94,Towards Automated Performance Tuning for Complex Workloads,"K Brown, M Mehta, M Carey, M Livny",VLDB,1994
69745,journals/sigmod/SchmidtWKFCMB01,Why And How To Benchmark XML Databases,"A Schmidt, F Waas, M Kersten, D Florescu, M Carey, I Manolescu, R Busse",SIGMOD Record,2001
69747,journals/sigmod/Lomet01,The Evolution of Effective B-tree: Page Organization and Techniques: A Personal Account,D Lomet,SIGMOD Record,2001
69748,conf/vldb/HasanM94,Optimization Algorithms for Exploiting the Parallelism-Communication Tradeoff in Pipelined Parallelism,"W Hasan, R Motwani",VLDB,1994
69749,journals/sigmod/TanakaV01,The Ecobase Project: Database and Web Technologies for Environmental Information Systems,"A Tanaka, P Valduriez",SIGMOD Record,2001
69750,conf/vldb/MohaniaS94,Some Issues in Design of Distributed Deductive Databases,"M Mohania, N Sarda",VLDB,1994
69751,conf/vldb/LiC94,Semantic Integration in Heterogeneous Databases Using Neural Networks,"W Li, C Clifton",VLDB,1994
69754,journals/sigmod/LudascherMM01,"Preservation of Digital Data with Self-Validating, Self-Instantiating Knowledge-Based Archives","B Ludäscher, R Marciano, R Moore",SIGMOD Record,2001
69755,journals/sigmod/ConstantopoulosCP01,"Semantic Web Workshop: Models, Architectures and Management",,,2001
69756,conf/vldb/FerrandinaMZ94,Implementing Lazy Database Updates for an Object Database System,"F Ferrandina, T Meyer, R Zicari",VLDB,1994
69757,conf/vldb/TeisseirePC94,Towards Event-Driven Modelling for Database Design,"M Teisseire, P Poncelet, R Cicchetti",VLDB,1994
69758,journals/sigmod/RossHKRRSS01,Reminiscences on Influential Papers,,,2001
69759,journals/sigmod/Winslett01,"Jeffrey D. Ullman Speaks Out on the Future of Higher Education, Startups, Database Theory, and More",,,2001
69760,conf/vldb/SetzerZ94,New Concurrency Control Algorithms for Accessing and Compacting B-Trees,"V Setzer, A Zisman",VLDB,1994
69761,conf/vldb/GehaniJR94,OdeFS: A File System Interface to an Object-Oriented Database,"N Gehani, H Jagadish, W Roome",VLDB,1994
69762,journals/sigmod/Bernstein01,Report on the 2001 SIGMOD and PODS Awards,,,2001
69764,conf/vldb/KilgerM94,Indexing Multiple Sets,"C Kilger, G Moerkotte",VLDB,1994
69765,journals/sigmod/Liu01,Editor's Notes,,,2001
69768,journals/sigmod/EisenbergM01,SQL/XML and the SQLX Informal Group of Companies,"A Eisenberg, J Melton",SIGMOD Record,2001
69769,journals/sigmod/BiancheriPP01,EIHA?!?: Deploying Web and WAP services using XML Technology,"C Biancheri, J Pazzaglia, G Paddeu",SIGMOD Record,2001
69770,conf/vldb/BrinkhoffK94,The Impact of Global Clustering on Spatial Database Systems,"T Brinkhoff, H Kriegel",VLDB,1994
69771,journals/sigmod/ShahMFH01,Java Support for Data-Intensive Systems: Experiences Building the Telegraph Dataflow System,"M Shah, S Madden, M Franklin, J Hellerstein",SIGMOD Record,2001
69773,journals/sigmod/MeltonE01,SQL Multimedia and Application Packages (SQL/MM),"J Melton, A Eisenberg",SIGMOD Record,2001
69774,conf/vldb/SteenhagenABB94,From Nested-Loop to Join Queries in OODB,"H Steenhagen, P Apers, H Blanken, R By",VLDB,1994
69775,journals/sigmod/GunopulosK01,DIMACS Summer School Tutorial on New Frontiers in Data Mining,"D Gunopulos, N Koudas",SIGMOD Record,2001
69776,conf/vldb/ChakravarthyKAK94,"Composite Events for Active Databases: Semantics, Contexts and Detection","S Chakravarthy, V Krishnaprasad, E Anwar, S Kim",VLDB,1994
69777,journals/sigmod/LenzeriniNNS01,Report on the 8th International Workshop on Knowledge Representation Meets Databases (KRDB),,,2001
69779,journals/sigmod/Liu01a,Editor's Notes,L Liu,SIGMOD Record,2001
69780,conf/vldb/Chiueh94,Content-Based Image Indexing,T Chiueh,VLDB,1994
69781,conf/vldb/DeWittKLPY94,Client-Server Paradise,"D DeWitt, N Kabra, J Luo, J Patel, J Yu",VLDB,1994
69782,journals/sigmod/ShethMKA01,Research in Multi-Organizational Processes and Semantic Information Brokering at the LSDIS Lab,"A Sheth, J Miller, K Kochut, I Arpinar",SIGMOD Record,2001
69784,conf/vldb/SripadaW94,Cumulative Updates,"S Sripada, B Wüthrich",VLDB,1994
69786,journals/sigmod/Labrinidis01,Introduction to the Career Forum Column,A Labrinidis,SIGMOD Record,2001
69787,conf/vldb/LevySSZ94,Challenges for Global Information Systems,"A Levy, A Silberschatz, D Srivastava, M Zemankova",VLDB,1994
69788,journals/sigmod/BabuW01,Continuous Queries over Data Streams,"S Babu, J Widom",SIGMOD Record,2001
69789,journals/sigmod/Huyn01,Data Analysis and Mining in the Life Sciences,N Huyn,SIGMOD Record,2001
69790,conf/vldb/GoodmanRS94,Building a Laboratory Information System Around a C++-Based Object-Oriented DBMS,"N Goodman, S Rozen, L Stein",VLDB,1994
69792,journals/sigmod/ShanmugasundaramSKKVNT01,A General Techniques for Querying XML Documents using a Relational Database System,"J Shanmugasundaram, E Shekita, J Kiernan, R Krishnamurthy, S Viglas, J Naughton, I Tatarinov",SIGMOD Record,2001
69793,conf/vldb/BernsteinD94,An Overview of Repository Technology,"P Bernstein, U Dayal",VLDB,1994
69794,journals/sigmod/Aberer01,Advanced XML Data Processing - Guest Editor's Introduction,K Aberer,SIGMOD Record,2001
69796,journals/sigmod/Snodgrass01a,Accessibility of the Database Literature,R Snodgrass,SIGMOD Record,2001
69797,journals/sigmod/Hammer01,Treasurer's Message,,,2001
69800,conf/vldb/RosenthalS94,Data Integration in the Large: The Challenge of Reuse,"A Rosenthal, L Seligman",VLDB,1994
69801,journals/sigmod/LabrinidisM01,Career-Enhancing Services at SIGMOD Online,"A Labrinidis, A Mendelzon",SIGMOD Record,2001
69802,conf/vldb/Lesk94,Experiments on Access to Digital Libraries: How can Images and Text be Used Together,M Lesk,VLDB,1994
69804,journals/sigmod/Liu01b,Editor's Notes,L Liu,SIGMOD Record,2001
69805,journals/sigmod/StolfoLCFE01,Data Mining-based Intrusion Detectors: An Overview of the Columbia IDS Project,"S Stolfo, W Lee, P Chan, W Fan, E Eskin",SIGMOD Record,2001
69807,conf/sigmod/DasGR03,Approximate Join Processing Over Data Streams,"A Das, J Gehrke, M Riedewald",SIGMOD Conference,2003
69808,journals/sigmod/BarbaraCJW01,ADAM: A Testbed for Exploring the Use of Data Mining in Intrusion Detection,"D Barbará, J Couto, S Jajodia, N Wu",SIGMOD Record,2001
69809,journals/sigmod/CabreraLM01,Detection and Classification of Intrusions and Faults using Sequences of System Calls,"J Cabrera, L Lewis, R Mehra",SIGMOD Record,2001
69811,conf/vldb/MartinC94,Relating Distributed Objects,"B Martin, R Cattell",VLDB,1994
69812,journals/sigmod/Aberer01a,Book Review Column,K Aberer,SIGMOD Record,2001
69813,conf/vldb/YanA94,Integrating a Structured-Text Retrieval System with an Object-Oriented Database System,"T Yan, J Annevelink",VLDB,1994
69816,conf/vldb/Spaccapietra94,"\User Interfaces; Who Cares?\""""",S Spaccapietra,VLDB,1994
69817,journals/sigmod/Barbara01,Special Issue on Data Mining for Intrusion Detection and Threat Analysis - Guest Editor's Introduction,,,2001
69818,conf/vldb/ZemankovaI94,Scientific Databases - State of the Art and Future Directions,"M Zemankova, Y Ioannidis",VLDB,1994
69819,journals/sigmod/LeeF01,Mining System Audit Data: Opportunities and Challenges,"W Lee, W Fan",SIGMOD Record,2001
69820,conf/sigmod/FaginKS03,Efficient similarity search and classification via rank aggregation,"R Fagin, R Kumar, D Sivakumar",SIGMOD Conference,2003
69821,journals/sigmod/SayginVC01,Using Unknowns to Prevent Discovery of Association Rules,"Y Saygin, V Verykios, C Clifton",SIGMOD Record,2001
69822,conf/sigmod/ArasuG03,Extracting Structured Data from Web Pages,"A Arasu, H Garcia-Molina",SIGMOD Conference,2003
69823,conf/sigmod/ChaudhuriGS03,Factorizing Complex Predicates in Queries to Exploit Indexes,"S Chaudhuri, P Ganesan, S Sarawagi",SIGMOD Conference,2003
69824,journals/sigmod/VelACM01,Mining Email Content for Author Identification Forensics,"O Vel, A Anderson, M Corney, G Mohay",SIGMOD Record,2001
69825,journals/sigmod/Scholl01,Transactional Information Systems - Book Review,,,2001
69826,conf/sigmod/IlyasRLGL03,Estimating Compilation Time of a Query Optimizer,"I Ilyas, J Rao, G Lohman, D Gao, E Lin",SIGMOD Conference,2003
69827,conf/sigmod/DeligiannakisR03,Extended Wavelets for Multiple Measures,"A Deligiannakis, N Roussopoulos",SIGMOD Conference,2003
69828,journals/sigmod/Jagadish01,Information Warfare and Security - Book Review,,,2001
69830,conf/sigmod/BabcockBDM03,Chain : Operator Scheduling for Memory Minimization in Data Stream Systems,"B Babcock, S Babu, M Datar, R Motwani",SIGMOD Conference,2003
69831,journals/sigmod/LohmanGFS01,SIGMOD 2001 Industry Sessions,"G Lohman, C Galindo-Legaria, M Franklin, L Seligman",SIGMOD Record,2001
69832,conf/sigmod/BenediktCFFR03,Capturing both Types and Constraints in Data Integration,"M Benedikt, C Chan, W Fan, J Freire, R Rastogi",SIGMOD Conference,2003
69834,conf/sigmod/MiloAABN03,Exchanging Intensional XML Data,"T Milo, S Abiteboul, B Amann, O Benjelloun, F Ngoc",SIGMOD Conference,2003
69836,journals/sigmod/TianDCZ02,The Design and Performance Evaluation of Alternative XML Storage Strategies,"F Tian, D DeWitt, J Chen, C Zhang",SIGMOD Record,2002
69838,conf/vldb/ChaudhuriS94,Including Group-By in Query Optimization,"S Chaudhuri, K Shim",VLDB,1994
69839,conf/vldb/MatthesS94,Persistent Threads,"F Matthes, J Schmidt",VLDB,1994
69840,journals/sigmod/SommerGB02,The n-Tier Hub Technology,"R Sommer, T Gulledge, D Bailey",SIGMOD Record,2002
69841,journals/sigmod/Cingil02,Supporting Global User Profiles Through Trusted Authorities,I Cingil,SIGMOD Record,2002
69842,conf/vldb/DavisonG94,Memory-Contention Responsive Hash Joins,"D Davison, G Graefe",VLDB,1994
69843,journals/sigmod/QuixSJ02,Business Data Management for B2B Electronic Commerce,"C Quix, M Schoop, M Jeusfeld",SIGMOD Record,2002
69844,conf/vldb/MedianoCD94,V-Trees - A Storage Method for Long Vector Data,"M Mediano, M Casanova, M Dreux",VLDB,1994
69845,conf/vldb/GaasterlandL94,Qualified Answers That Reflect User Needs and Preferences,"T Gaasterland, J Lobo",VLDB,1994
69847,conf/vldb/LitwinNS94,RP*: A Family of Order Preserving Scalable Distributed Data Structures,"W Litwin, M Neimat, D Schneider",VLDB,1994
69848,journals/sigmod/Bussler02,The Role of B2B Engines in B2B Integration Architectures,C Bussler,SIGMOD Record,2002
69849,journals/sigmod/BallMRZ02,Supply Chain Infrastructures: System Integration and Information Sharing,"M Ball, M Ma, L Raschid, Z Zhao",SIGMOD Record,2002
69851,journals/sigmod/Winslett02,Interview with Avi Silberschatz,,,2002
69852,conf/vldb/SistlaYH94,Reasoning About Spatial Relationships in Picture Retrieval Systems,"A Sistla, C Yu, R Haddad",VLDB,1994
69853,journals/sigmod/Grefen02,What Will Be - Book Review,,,2002
69856,journals/sigmod/Stonebraker02,Too Much Middleware,M Stonebraker,SIGMOD Record,2002
69857,conf/vldb/PirotteZMY94,Materialization: A Powerful and Ubiquitous Abstraction Pattern,"A Pirotte, E Zimányi, D Massart, T Yakusheva",VLDB,1994
69858,journals/sigmod/Suciu02,The XML Typechecking Problem,D Suciu,SIGMOD Record,2002
69859,journals/sigmod/GobleR02,Report on the 18th British National Conference on Databases (BNCOD),,,2002
69861,journals/sigmod/RossKMV02,Reminiscences on Influential Papers,,,2002
