tid,id,title,authors,venue,year
70794,conf/vldb/Tsur00,Data Mining in the Bioinformatics Domain,S Tsur,VLDB,2000
70795,conf/sigmod/AvnurHLORRRW98,CONTROL: Continuous Output and Navigation Technology with Refinement On-Line,"R Avnur, J Hellerstein, B Lo, C Olston, B Raman, V Raman, T Roth, K Wylie",SIGMOD Conference,1998
70797,conf/vldb/X00a,Author Index,,VLDB,2000
70798,conf/sigmod/AmbiteABKMMMPT98,ARIADNE: A System for Constructing Mediators for Internet Sources,"J Ambite, N Ashish, G Barish, C Knoblock, S Minton, P Modi, I Muslea, A Philpot, S Tejada",SIGMOD Conference,1998
70799,conf/vldb/ShanmugasundaramSBCLPR00,Efficiently Publishing Relational Data as XML Documents,"J Shanmugasundaram, E Shekita, R Barr, M Carey, B Lindsay, H Pirahesh, B Reinwald",VLDB,2000
70800,conf/sigmod/DarEGP98,DTL's DataSpot: Database Exploration as Easy as Browsing the Web,"S Dar, G Entin, S Geva, E Palmon",SIGMOD Conference,1998
70801,conf/vldb/AltinelF00,Efficient Filtering of XML Documents for Selective Dissemination of Information,"M Altinel, M Franklin",VLDB,2000
70802,conf/sigmod/KornackerSH98,amdb: An Access Method Debugging Tool,"M Kornacker, M Shah, J Hellerstein",SIGMOD Conference,1998
70805,conf/vldb/MatiasVW00,Dynamic Maintenance of Wavelet-Based Histograms,"Y Matias, J Vitter, M Wang",VLDB,2000
70806,conf/sigmod/Brewer98,Delivering High Availability for Inktomi Search Engines,E Brewer,SIGMOD Conference,1998
70807,conf/sigmod/OlstonWACELSS98,DataSplash,"C Olston, A Woodruff, A Aiken, M Chu, V Ercegovac, M Lin, M Spalding, M Stonebraker",SIGMOD Conference,1998
70808,conf/vldb/KemmeA00,"Don't Be Lazy, Be Consistent: Postgres-R, A New Way to Implement Database Replication","B Kemme, G Alonso",VLDB,2000
70809,conf/sigmod/LiuPTBBZBHY98,CQ: A Personalized Update Monitoring Toolkit,"L Liu, C Pu, W Tang, D Buttler, J Biggs, T Zhou, P Benninghoff, W Han, F Yu",SIGMOD Conference,1998
70810,conf/vldb/YuV00,Efficient Numerical Error Bounding for Replicated Network Services,"H Yu, A Vahdat",VLDB,2000
70811,conf/sigmod/Fegaras98,Query Unnesting in Object-Oriented Databases,L Fegaras,SIGMOD Conference,1998
70812,conf/vldb/PardonA00,CheeTah: a Lightweight Transaction Server for Plug-and-Play Internet Data Management,"G Pardon, G Alonso",VLDB,2000
70813,conf/sigmod/RaoR98,Reusing Invariants: A New Strategy for Correlated Queries,"J Rao, K Ross",SIGMOD Conference,1998
70814,conf/vldb/YagoubFIV00,Caching Strategies for Data-Intensive Web Sites,"K Yagoub, D Florescu, V Issarny, P Valduriez",VLDB,2000
70815,conf/vldb/WuFSP00,FALCON: Feedback Adaptive Loop for Content-Based Retrieval,"L Wu, C Faloutsos, K Sycara, T Payne",VLDB,2000
70816,conf/sigmod/BerchtoldBK98,The Pyramid-Technique: Towards Breaking the Curse of Dimensionality,"S Berchtold, C Böhm, H Kriegel",SIGMOD Conference,1998
70817,conf/sigmod/JonssonFS98,Interaction of Query Evaluation and Buffer Management for Information Retrieval,"B Jónsson, M Franklin, D Srivastava",SIGMOD Conference,1998
70819,conf/vldb/YiF00,Fast Time Sequence Indexing for Arbitrary Lp Norms,"B Yi, C Faloutsos",VLDB,2000
70820,conf/sigmod/LiYVGPUV98,Capability Based Mediation in TSIMMIS,"C Li, R Yerneni, V Vassalos, H Garcia-Molina, Y Papakonstantinou, J Ullman, M Valiveti",SIGMOD Conference,1998
70821,conf/sigmod/ChenWZ98,A Protein Patent Query System Powered By Kleisli,"J Chen, L Wong, L Zhang",SIGMOD Conference,1998
70823,conf/vldb/PottingerL00,A Scalable Algorithm for Answering Queries Using Views,"R Pottinger, A Levy",VLDB,2000
70825,conf/sigmod/TsurUACMNR98,Query Flocks: A Generalization of Association-Rule Mining,"S Tsur, J Ullman, S Abiteboul, C Clifton, R Motwani, S Nestorov, A Rosenthal",SIGMOD Conference,1998
70827,conf/vldb/CareyKRLABFLOPQRSSUVWY01,The Propel Distributed Services Platform,"M Carey, S Kirsch, M Roth, B Linden, N Adiba, M Blow, D Florescu, D Li, I Oprencak, R Panwar, R Qi, D Rieber, J Shafer, B Sterling, T Urhan, B Vickery, D Wineman, K Yee",VLDB,2001
70828,conf/sigmod/ZaianeHLCC98,MultiMediaMiner: A System Prototype for Multimedia Data Mining,"O Zaďane, J Han, Z Li, S Chee, J Chiang",SIGMOD Conference,1998
70830,conf/vldb/NarayananS01,Tavant System Architecture for Sell-side Channel Management,"S Narayanan, S Subramanian",VLDB,2001
70831,conf/vldb/AbrolLMMMRTWZ01,Navigating large-scale semi-structured data in business portals,"M Abrol, N Latarche, U Mahadevan, J Mao, R Mukherjee, P Raghavan, M Tourn, J Wang, G Zhang",VLDB,2001
70832,conf/sigmod/BaumannDFRW98,The Multidimensional Database System RasDaMan,"P Baumann, A Dehmel, P Furtado, R Ritsch, N Widmann",SIGMOD Conference,1998
70833,conf/vldb/DattaDTVRF01,A Comparative Study of Alternative Middle Tier Caching Solutions to Support Dynamic Web Content Acceleration,"A Datta, K Dutta, H Thomas, D VanderMeer, K Ramamritham, D Fishman",VLDB,2001
70834,conf/sigmod/ParkKKLPC98,Xmas: An Extensible Main-Memory Storage System for High-Performance Applications,"J Park, Y Kwon, K Kim, S Lee, B Park, S Cha",SIGMOD Conference,1998
70835,conf/vldb/May01,LoPiX: A System for XML Data Integration and Manipulation,W May,VLDB,2001
70836,conf/sigmod/Cohen98a,Providing Database-like Access to the Web Using Queries Based on Textual Similarity,W Cohen,SIGMOD Conference,1998
70838,conf/sigmod/LacroixSC98,User-oriented smart-cache for the Web: What You Seek is What You Get!,"Z Lacroix, A Sahuguet, R Chandrasekar",SIGMOD Conference,1998
70839,conf/vldb/CatozziR01,Operating System Extensions for the Teradata Parallel VLDB,"J Catozzi, S Rabinovici",VLDB,2001
70840,conf/sigmod/ChaudhuriN98a,Microsoft Index Tuning Wizard for SQL Server 7.0,"S Chaudhuri, V Narasayya",SIGMOD Conference,1998
70841,conf/sigmod/KiepuszewskiMO98,FlowBack: Providing Backward Recovery for Workflow Systems,"B Kiepuszewski, R Mühlberger, M Orlowska",SIGMOD Conference,1998
70842,conf/vldb/MorishimaKKT01,Enabling End-users to Construct Data-intensive Web-sites from XML Repositories: An Example-based Approach,"A Morishima, S Koizumi, H Kitagawa, S Takano",VLDB,2001
70843,conf/vldb/BaumgartnerFG01a,Supervised Wrapper Generation with Lixto,"R Baumgartner, S Flesca, G Gottlob",VLDB,2001
70844,conf/sigmod/GriffinH97,A Framework for Implementing Hypothetical Queries,"T Griffin, R Hull",SIGMOD Conference,1997
70846,conf/sigmod/BrinMUT97,Dynamic Itemset Counting and Implication Rules for Market Basket Data,"S Brin, R Motwani, J Ullman, S Tsur",SIGMOD Conference,1997
70847,conf/sigmod/ZhaoDN97,An Array-Based Algorithm for Simultaneous Multidimensional Aggregates,"Y Zhao, P Deshpande, J Naughton",SIGMOD Conference,1997
70849,conf/sigmod/AcharyaFZ97,Balancing Push and Pull for Data Broadcast,"S Acharya, M Franklin, S Zdonik",SIGMOD Conference,1997
70852,conf/vldb/PereiraFJLS01,WebFilter: A High-throughput XML-based Publish and Subscribe System,"J Pereira, F Fabret, H Jacobsen, F Llirbat, D Shasha",VLDB,2001
70854,conf/sigmod/RoussopoulosKR97,Cubetree: Organization of and Bulk Updates on the Data Cube,"N Roussopoulos, Y Kotidis, M Roussopoulos",SIGMOD Conference,1997
70855,conf/vldb/ZhouLZLZJT01,VXMLR: A Visual XML-Relational Database System,"A Zhou, H Lu, S Zheng, Y Liang, L Zhang, W Ji, Z Tian",VLDB,2001
70856,conf/sigmod/CeriFP98,The IDEA Web Lab,"S Ceri, P Fraternali, S Paraboschi",SIGMOD Conference,1998
70857,conf/vldb/StohrR01,WARLOCK: A Data Allocation Tool for Parallel Warehouses,"T Stöhr, E Rahm",VLDB,2001
70858,conf/sigmod/BerchtoldBBKK97,Fast Parallel Similarity Search in Multimedia Databases,"S Berchtold, C Böhm, B Braunmüller, D Keim, H Kriegel",SIGMOD Conference,1997
70859,conf/vldb/PapadiasT01,MV3R-Tree: A Spatio-Temporal Access Method for Timestamp and Interval Queries,"Y Tao, D Papadias",VLDB,2001
70860,conf/sigmod/Spiro98,"Ubiquitous, Self-tuning, Scalable Servers",P Spiro,SIGMOD Conference,1998
70861,conf/vldb/OoiYTJ01,Indexing the Distance: An Efficient Method to KNN Processing,"C Yu, B Ooi, K Tan, H Jagadish",VLDB,2001
70862,conf/sigmod/Eaton98,Managing Large Systems with DB2 UDB,C Eaton,SIGMOD Conference,1998
70863,conf/vldb/TanSHCR01,Walking Through a Very Large Virtual Environment in Real-time,"L Shou, J Chionh, Z Huang, Y Ruan, K Tan",VLDB,2001
70864,conf/sigmod/ReinwaldP98,SQL Open Heterogeneous Data Access,"B Reinwald, H Pirahesh",SIGMOD Conference,1998
70866,conf/sigmod/BlakeleyP98,Microsoft Universal Data Access Platform,"J Blakeley, M Pizzo",SIGMOD Conference,1998
70867,conf/sigmod/ClossmanSHKPB98,Java and Relational Databases: SQLJ (Tutorial),,,1998
70868,conf/vldb/SatheS01,Intelligent Rollups in Multidimensional OLAP Data,"G Sathe, S Sarawagi",VLDB,2001
70869,conf/sigmod/KemperKM98,SAP R/3: A Database Application System (Tutorial),,,1998
70870,conf/vldb/CuiW01,Lineage Tracing for General Data Warehouse Transformations,"Y Cui, J Widom",VLDB,2001
70872,conf/sigmod/Mylopoulos98,Panel on Next Generation Database Systems Won't Work Without Semantics!,J Mylopoulos,SIGMOD Conference,1998
70873,conf/sigmod/AndersonBKW98,"Replication, Consistency, and Practicality: Are These Mutually Exclusive?","T Anderson, Y Breitbart, H Korth, A Wool",SIGMOD Conference,1998
70874,conf/vldb/JensenL01,Transaction Timestamping in (Temporal) Databases,"C Jensen, D Lomet",VLDB,2001
70875,conf/sigmod/MeccaAMMS98,The Araneus Web-Base Management System,"G Mecca, P Atzeni, A Masci, P Merialdo, G Sindoni",SIGMOD Conference,1998
70876,conf/vldb/Duranti01,The Long-Term Preservation of Authentic Electronic Records,L Duranti,VLDB,2001
70877,conf/vldb/OzdenGHNSDGGW01,Storage Service Providers: a Solution for Storage Management? (Panel),"B Özden, E Gabber, B Hillyer, W Ng, E Shriver, D DeWitt, B Gordon, J Gray, J Wilkes",VLDB,2001
70878,conf/sigmod/Kennamer98,Microsoft.com: A High-Scale Data Management and Transaction Processing Solution,S Kennamer,SIGMOD Conference,1998
70879,conf/vldb/MarronL01,On Processing XML in LDAP,"P Marrón, G Lausen",VLDB,2001
70880,conf/sigmod/Lassettre98,Olympic Records for Data at the 1998 Nagano Games,E Lassettre,SIGMOD Conference,1998
70881,conf/vldb/WiesnerK01,Hyperqueries: Dynamic Distributed Query Processing on the Internet,"A Kemper, C Wiesner",VLDB,2001
70882,conf/sigmod/Chong98,Real Business Processing Meets the Web,J Chong,SIGMOD Conference,1998
70883,conf/vldb/BonifatiCDS01,Warehousing Workflow Data: Challenges and Opportunities,"A Bonifati, F Casati, U Dayal, M Shan",VLDB,2001
70885,conf/sigmod/NgLK98,A Data Mining Application: Customes Retention at the Port of Singapore Authority (PSA),"K Ng, H Liu, H Kwah",SIGMOD Conference,1998
70886,conf/vldb/Huyn01,Scientific OLAP for the Biotech Domain,N Huyn,VLDB,2001
70887,conf/sigmod/Chan98,Transactional Publish / Subscribe: The Proactive Multicast of Database Changes,A Chan,SIGMOD Conference,1998
70888,conf/vldb/BouguettayaEMO01,Ontology-based Support for Digital Government,"A Bouguettaya, A Elmagarmid, B Medjahed, M Ouzzani",VLDB,2001
70889,conf/vldb/Gentili01,Italian Electronic Identity Card - principle and architecture,M Gentili,VLDB,2001
70890,conf/sigmod/RamakrishnanD98,The PointCast Network,"S Ramakrishnan, V Dayal",SIGMOD Conference,1998
70891,conf/vldb/LaneEN00,"Biodiversity Informatics: The Challenge of Rapid Development, Large Databases, and Complex Data (Keynote)",,,2000
70893,conf/vldb/NetzCBF00,Integration of Data Mining with Database Technology,"A Netz, S Chaudhuri, J Bernhardt, U Fayyad",VLDB,2000
70894,conf/sigmod/HellersteinHW97,Online Aggregation,"J Hellerstein, P Haas, H Wang",SIGMOD Conference,1997
70895,conf/sigmod/CareyK97,"\On Saying \""\""Enough Already!\""\"" in SQL\""""","M Carey, D Kossmann",SIGMOD Conference,1997
70897,conf/vldb/Carey00,"Toto, We're Not in Kansas Anymore: On Transitioning from Research to the Real (Invited Industrial Talk)",M Carey,VLDB,2000
70898,conf/sigmod/GravanoCGP97,STARTS: Stanford Proposal for Internet Meta-Searching (Experience Paper),"L Gravano, K Chang, H Garcia-Molina, A Paepcke",SIGMOD Conference,1997
70899,conf/sigmod/HanKK97,Scalable Parallel Data Mining for Association Rules,"E Han, G Karypis, V Kumar",SIGMOD Conference,1997
70900,conf/vldb/Blecken00,Media360 Workflow-Implementing a Workflow Engine Inside a Database,C Blecken,VLDB,2000
70901,conf/sigmod/Arpaci-DusseauACHP97,High-Performance Sorting on Networks of Workstations,"A Arpaci-Dusseau, R Arpaci-Dusseau, D Culler, J Hellerstein, D Patterson",SIGMOD Conference,1997
70903,conf/vldb/Schnase00,Research Directions in Biodiversity Informatics,J Schnase,VLDB,2000
70904,conf/sigmod/KoudasS97,Size Separation Spatial Join,"N Koudas, K Sevcik",SIGMOD Conference,1997
70905,conf/sigmod/MaheshwariL97,Partitioned Garbage Collection of Large Object Store,"U Maheshwari, B Liskov",SIGMOD Conference,1997
70906,conf/vldb/Bowker00,Work and Information Practices in the Sciences of Biodiversity,G Bowker,VLDB,2000
70907,conf/sigmod/ZaharioudakisC97,Highly Concurrent Cache Consistency for Indices in Client-Server Database Systems,"M Zaharioudakis, M Carey",SIGMOD Conference,1997
70908,conf/vldb/Ladin00,The Zero Latency Enterprise,D Liles,VLDB,2000
70909,conf/sigmod/ONeilQ97,Improved Query Performance with Variant Indexes,"P O'Neil, D Quass",SIGMOD Conference,1997
70910,conf/vldb/Brodie00,"Panel: Future Directions of Database Research - The VLDB Broadening Strategy, Part 2",M Brodie,VLDB,2000
70911,conf/vldb/Deshpande00,Linking Business to Deliver Value: A Data Management Challenge,A Deshpande,VLDB,2000
70912,conf/sigmod/MumickQM97,Maintenance of Data Cubes and Summary Tables in a Warehouse,"I Mumick, D Quass, B Mumick",SIGMOD Conference,1997
70913,conf/sigmod/HoAMS97,Range Queries in OLAP Data Cubes,"C Ho, R Agrawal, N Megiddo, R Srikant",SIGMOD Conference,1997
70915,conf/vldb/RamamrithamABEGP00,"Social, Educational, and Governmental Change Enabled through Information Technology","K Ramamritham, Y Atfi, C Batini, M Eitan, V Gregg, D Phatak",VLDB,2000
70916,conf/sigmod/DoppelhammerHKK97,Database Performance in the Real World - TPC-D and SAP R/3 (Experience Paper),"J Doppelhammer, T Höppler, A Kemper, D Kossmann",SIGMOD Conference,1997
70917,conf/sigmod/TsueiPK97,Database Buffer Size Investigation for OLTP Workloads (Experience Paper),"T Tsuei, A Packer, K Ko",SIGMOD Conference,1997
70918,conf/vldb/CareyKSSS00,XPERANTO: Middleware for Publishing Object-Relational Data as XML Documents,"M Carey, J Kiernan, J Shanmugasundaram, E Shekita, S Subramanian",VLDB,2000
70919,conf/sigmod/AdelbergGW97,The STRIP Rule System For Efficiently Maintaining Derived Data,"B Adelberg, H Garcia-Molina, J Widom",SIGMOD Conference,1997
70920,conf/vldb/Schek00,"Panel: Future Directions of Database Research - The VLDB Broadening Strategy, Part 1",H Schek,VLDB,2000
70921,conf/vldb/BernsteinHJRW00,Panel: Is Generic Metadata Management Feasible?,"P Bernstein, L Haas, M Jarke, E Rahm, G Wiederhold",VLDB,2000
70922,conf/sigmod/CareyDNAGS97,The BUCKY Object-Relational Benchmark (Experience Paper),"M Carey, D DeWitt, J Naughton, M Asgarian, P Brown, J Gehrke, D Shah",SIGMOD Conference,1997
70923,conf/vldb/PereiraFLS00,Publish/Subscribe on the Web at Extreme Speed,"J Pereira, F Fabret, F Llirbat, R Preotiuc-Pietro, K Ross, D Shasha",VLDB,2000
70924,conf/sigmod/YangM97,Association Rules over Interval Data,"R Miller, Y Yang",SIGMOD Conference,1997
70925,conf/sigmod/JajodiaSSB97,A Unified Framework for Enforcing Multiple Access Control Policies,"S Jajodia, P Samarati, V Subrahmanian, E Bertino",SIGMOD Conference,1997
70926,conf/vldb/ShahabiFKF00,INSITE: A Tool for Interpreting Users? Interaction with a Web Space,"C Shahabi, A Faisal, F Kashani, J Faruque",VLDB,2000
70928,conf/sigmod/Kramer97,Databases on the Web: Technologies for Federation Architectures and Case Studies (Tutorial),R Kramer,SIGMOD Conference,1997
70929,conf/vldb/AdiBEY00,Push Technology Personalization through Event Correlation,"A Adi, D Botzer, O Etzion, T Yatzkar-Haham",VLDB,2000
70930,conf/sigmod/CruzALRZ97,Delaunay: A Database Visualization System,"I Cruz, M Averbuch, W Lucas, M Radzyminski, K Zhang",SIGMOD Conference,1997
70931,conf/vldb/ChakrabartiSST00,Memex: A Browsing Assistant for Collaborative Archiving and Mining of Surf Trails,"S Chakrabarti, S Srivastava, M Subramanyam, M Tiwari",VLDB,2000
70933,conf/vldb/BeneventanoBCCGMMV00,Information Integration: The MOMIS Project Demonstration,"D Beneventano, S Bergamaschi, S Castano, A Corni, R Guidetti, G Malvezzi, M Melchiori, M Vincini",VLDB,2000
70934,conf/sigmod/HanKS97,GeoMiner: A System Prototype for Spatial Data Mining,"J Han, K Koperski, N Stefanovic",SIGMOD Conference,1997
70935,conf/sigmod/RafieiM97,Similarity-Based Queries for Time Series Data,"D Rafiei, A Mendelzon",SIGMOD Conference,1997
70937,conf/sigmod/ChawatheG97,Meaningful Change Detection in Structured Data,"S Chawathe, H Garcia-Molina",SIGMOD Conference,1997
70939,conf/vldb/DiligentiCLGG00,Focused Crawling Using Context Graphs,"M Diligenti, F Coetzee, S Lawrence, C Giles, M Gori",VLDB,2000
70940,conf/sigmod/BrinMS97,Beyond Market Baskets: Generalizing Association Rules to Correlations,"S Brin, R Motwani, C Silverstein",SIGMOD Conference,1997
70941,conf/vldb/RisheYACLMVSV00,Semantic Access: Semantic Interface for Querying Databases,"N Rishe, J Yuan, R Athauda, S Chen, X Lu, X Ma, A Vaschillo, A Shaposhnikov, D Vasilevsky",VLDB,2000
70942,conf/sigmod/KornJF97,Efficiently Supporting Ad Hoc Queries in Large Datasets of Time Sequences,"F Korn, H Jagadish, C Faloutsos",SIGMOD Conference,1997
70943,conf/sigmod/LivnyRBCDLMW97,DEVise: Integrated Querying and Visualization of Large Datasets,"M Livny, R Ramakrishnan, K Beyer, G Chen, D Donjerkovic, S Lawande, J Myllymaki, R Wenger",SIGMOD Conference,1997
70944,conf/vldb/PedersenJD00,The TreeScape System: Reuse of Pre-Computed Aggregates over Irregular OLAP Hierarchies,"T Pedersen, C Jensen, C Dyreson",VLDB,2000
70945,conf/vldb/GuPS00,OLAP++: Powerful and Easy-to-Use Federations of OLAP and Object Databases,"J Gu, T Pedersen, A Shoshani",VLDB,2000
70946,conf/sigmod/PatelYKTNBHRLEKGDN97,"Building a Scaleable Geo-Spatial DBMS: Technology, Implementation, and Evaluation","J Patel, J Yu, N Kabra, K Tufte, B Nag, J Burger, N Hall, K Ramasamy, R Lueder, C Ellmann, J Kupsch, S Guo, D DeWitt, J Naughton",SIGMOD Conference,1997
70947,conf/sigmod/GebhardtJJ97,A Toolkit for Negotiation Support Interfaces to Multi-Dimensional Data,"M Gebhardt, M Jarke, S Jacobs",SIGMOD Conference,1997
70948,conf/vldb/LabioYCGW00,Performance Issues in Incremental Warehouse Maintenance,"W Labio, J Yang, Y Cui, H Garcia-Molina, J Widom",VLDB,2000
70950,conf/sigmod/BozkayaO97,Distance-Based Indexing for High-Dimensional Metric Spaces,"T Bozkaya, Z Özsoyoglu",SIGMOD Conference,1997
70951,conf/vldb/HinneburgAK00,What Is the Nearest Neighbor in High Dimensional Spaces?,"A Hinneburg, C Aggarwal, D Keim",VLDB,2000
70952,conf/sigmod/AgrawalASY97,Efficient View Maintenance at Data Warehouses,"D Agrawal, A Abbadi, A Singh, T Yurek",SIGMOD Conference,1997
70953,conf/vldb/SakuraiYUK00,The A-tree: An Index Structure for High-Dimensional Spaces Using Relative Approximation,"Y Sakurai, M Yoshikawa, S Uemura, H Kojima",VLDB,2000
70954,conf/sigmod/LlirbatFS97,Eliminating Costly Redundant Computations from SQL Trigger Executions,"F Llirbat, F Fabret, E Simon",SIGMOD Conference,1997
70956,conf/sigmod/IoannidisLANT97,ZOO: A Desktop Emperiment Management Environment,"Y Ioannidis, M Livny, A Ailamaki, A Narayanan, A Therber",SIGMOD Conference,1997
70957,conf/vldb/CowleyP00,Temporal Integrity Constraints with Indeterminacy,"W Cowley, D Plexousakis",VLDB,2000
70958,conf/sigmod/WodtkeWWDM97,The MENTOR Workbench for Enterprise-wide Workflow Management,"D Wodtke, J Weißenfels, G Weikum, A Dittrich, P Muth",SIGMOD Conference,1997
70960,conf/sigmod/Chakravarthy97,SENTINEL: An Object-Oriented DBMS With Event-Based Rules,S Chakravarthy,SIGMOD Conference,1997
70961,conf/vldb/KriegelPS00,Managing Intervals Efficiently in Object-Relational Databases,"H Kriegel, M Pötke, T Seidl",VLDB,2000
70962,conf/sigmod/SeshadriP97,PREDATOR: An OR-DBMS with Enhanced Data Types,"P Seshadri, M Paskin",SIGMOD Conference,1997
70963,conf/sigmod/Blakeley96,Data Access for the Masses through OLE DB,J Blakeley,SIGMOD Conference,1996
70964,conf/vldb/PfoserJT00,Novel Approaches in Query Processing for Moving Object Trajectories,"D Pfoser, C Jensen, Y Theodoridis",VLDB,2000
70966,conf/vldb/KoudasIM00,Identifying Representative Trends in Massive Time Series Data Sets Using Sketches,"P Indyk, N Koudas, S Muthukrishnan",VLDB,2000
70967,conf/sigmod/OConnellISWABCCLPWW96,A Content-Based Multimedia Server for Massively Parallel Architectures,"W O'Connell, I Ieong, D Schrader, C Watson, G Au, A Biliris, S Choo, P Colin, G Linderman, E Panagos, J Wang, T Walters",SIGMOD Conference,1996
70968,conf/vldb/RamasamyPNK00,"Set Containment Joins: The Good, The Bad and The Ugly","K Ramasamy, J Patel, J Naughton, R Kaushik",VLDB,2000
70970,conf/vldb/ManegoldBK00,What Happens During a Join? Dissecting CPU and Memory Optimization Effects,"S Manegold, P Boncz, M Kersten",VLDB,2000
70971,conf/sigmod/TomasicABKNR97,The Distributed Information Search Component (Disco) and the World Wide Web,"A Tomasic, R Amouroux, P Bonnet, O Kapitskaia, H Naacke, L Raschid",SIGMOD Conference,1997
70972,conf/vldb/JohnsonA00,Optimizing Queries on Compressed Bitmaps,"S Amer-Yahia, T Johnson",VLDB,2000
70974,conf/sigmod/BohrerBBCFHKKMNRRSUUW97a,The InfoSleuth Project,"R Jr., W Bohrer, R Brice, A Cichocki, J Fowler, A Helal, V Kashyap, T Ksiezyk, G Martin, M Nodine, M Rashid, M Rusinkiewicz, R Shea, C Unnikrishnan, A Unruh, D Woelk",SIGMOD Conference,1997
70975,conf/vldb/Sarawagi00,User-Adaptive Exploration of Multidimensional Data,S Sarawagi,VLDB,2000
70976,conf/sigmod/GeneserethKD97,Infomaster: An Information Integration System,"M Genesereth, A Keller, O Duschka",SIGMOD Conference,1997
70977,conf/vldb/SrinivasanDFCJYKTDB00,Oracle8i Index-Organized Table and Its Application to New Domains,"J Srinivasan, S Das, C Freiwald, E Chong, M Jagannath, A Yalamanchi, R Krishnan, A Tran, S DeFazio, J Banerjee",VLDB,2000
70978,conf/sigmod/GingrasLSPS97,Languages for Multi-database Interoperability,"F Gingras, L Lakshmanan, I Subramanian, D Papoulis, N Shiri",SIGMOD Conference,1997
70980,conf/vldb/StohrMR00,Multi-Dimensional Database Allocation for Parallel Data Warehouses,"T Stöhr, H Märtens, E Rahm",VLDB,2000
70983,conf/vldb/CeriCW00,Practical Applications of Triggers and Constraints: Success and Lingering Issues (10-Year Award),"S Ceri, R Cochrane, J Widom",VLDB,2000
70984,conf/sigmod/LabioZWGGW97,The WHIPS Prototype for Data Warehouse Creation and Maintenance,"W Labio, Y Zhuge, J Wiener, H Gupta, H Garcia-Molina, J Widom",SIGMOD Conference,1997
70986,conf/sigmod/FernandezFKLS97,STRUDEL: A Web-site Management System,"M Fernandez, D Florescu, J Kang, A Levy, D Suciu",SIGMOD Conference,1997
70987,conf/vldb/ChoG00,The Evolution of the Web and Implications for an Incremental Crawler,"J Cho, H Garcia-Molina",VLDB,2000
70988,conf/sigmod/Chaudhuri97,Query Optimization at the Crossroads (Panel),S Chaudhuri,SIGMOD Conference,1997
70989,conf/vldb/BalminPP00,Hypothetical Queries in an OLAP Environment,"A Balmin, T Papadimitriou, Y Papakonstantinou",VLDB,2000
70991,conf/sigmod/CareyMN97,"Object-Relational Database Systems: Principles, Products, and Challenges (Tutorial)",,,1997
70992,conf/vldb/WangZ00,Using SQL to Build New Aggregates and Extenders for Object- Relational Systems,"H Wang, C Zaniolo",VLDB,2000
70993,conf/sigmod/ChaudhuriD97,Data Warehousing and OLAP for Decision Support (Tutorial),,,1997
70994,conf/vldb/GantiLR00,ICICLES: Self-Tuning Samples for Approximate Query Answering,"V Ganti, M Lee, R Ramakrishnan",VLDB,2000
70997,conf/sigmod/HammerGNYBV97,Template-Based Wrappers in the TSIMMIS System,"J Hammer, H Garcia-Molina, S Nestorov, R Yerneni, M Breunig, V Vassalos",SIGMOD Conference,1997
70998,conf/vldb/GrumbachRS00,Manipulating Interpolated Data is Easier than You Thought,"S Grumbach, P Rigaux, L Segoufin",VLDB,2000
71000,conf/sigmod/LiCHH97,SEMCOG: An Object-based Image Retrieval System and Its Visual Query Interface,"W Li, K Candan, K Hirata, Y Hara",SIGMOD Conference,1997
71001,conf/sigmod/BressanGFJHKLMPQSS97,The COntext INterchange Mediator Prototype,"S Bressan, C Goh, K Fynn, M Jakobisiak, K Hussein, H Kon, T Lee, S Madnick, T Pena, J Qu, A Shum, M Siegel",SIGMOD Conference,1997
71003,conf/sigmod/QuassW97,On-Line Warehouse View Maintenance,"D Quass, J Widom",SIGMOD Conference,1997
71004,conf/vldb/LakshmananJN00,The 3W Model and Algebra for Unified Data Mining,"T Johnson, L Lakshmanan, R Ng",VLDB,2000
71005,conf/vldb/WangHH00,Mining Frequent Itemsets Using Support Constraints,"K Wang, Y He, J Han",VLDB,2000
71006,conf/sigmod/ColbyKLMR97,Supporting Multiple View Maintenance Policies,"L Colby, A Kawaguchi, D Lieuwen, I Mumick, K Ross",SIGMOD Conference,1997
71007,conf/vldb/ChaudhuriW00,Rethinking Database System Architecture: Towards a Self-Tuning RISC-Style Database System,"S Chaudhuri, G Weikum",VLDB,2000
71009,conf/sigmod/ShivakumarG97,Wave-Indices: Indexing Evolving Databases,"N Shivakumar, H Garcia-Molina",SIGMOD Conference,1997
71010,conf/vldb/ChristopheBPV00,PicoDMBS: Scaling Down Database Techniques for the Smartcard,"C Bobineau, L Bouganim, P Pucheral, P Valduriez",VLDB,2000
71011,conf/vldb/Taylor00,Concurrency in the Data Warehouse,R Taylor,VLDB,2000
71012,conf/sigmod/GuptaHR97,Revisiting Commit Processing in Distributed Database Systems,"R Gupta, J Haritsa, K Ramamritham",SIGMOD Conference,1997
71014,conf/sigmod/Shasha97,"Lessons from Wall Street: Case Studies in Configuration, Tuning, and Distribution (Tutorial)",,,1997
71015,conf/sigmod/MotakisZ97,Temporal Aggregation in Active Database Rules,"I Motakis, C Zaniolo",SIGMOD Conference,1997
