tid,id,title,authors,venue,year
71494,conf/vldb/Huyn97,Multiple-View Self-Maintenance in Data Warehousing Environments,N Huyn,VLDB,1997
71495,conf/vldb/FaloutsosJS97,Recovering Information from Summary Data,"C Faloutsos, H Jagadish, N Sidiropoulos",VLDB,1997
71497,conf/vldb/Jamil97,Implementing Abstract Objects with Inheritance in Datalogneg,H Jamil,VLDB,1997
71498,journals/sigmod/DemersGRTY03,The Cougar Project: a work-in-progress report,"A Demers, J Gehrke, R Rajaraman, A Trigoni, Y Yao",SIGMOD Record,2003
71501,conf/vldb/LiCHH97,Facilitating Multimedia Database Exploration through Visual Interfaces and Perpetual Query Reformulations,"W Li, K Candan, K Hirata, Y Hara",VLDB,1997
71502,journals/sigmod/NejdlSS03,Design issues and challenges for RDF- and schema-based peer-to-peer systems,"W Nejdl, W Siberski, M Sintek",SIGMOD Record,2003
71503,journals/sigmod/Hammer03,Treasurer's Message,,,2003
71504,conf/vldb/BridgeJKLLM97,The Oracle Universal Server Buffer,"W Bridge, A Joshi, M Keihl, T Lahiri, J Loaiza, N MacNaughton",VLDB,1997
71506,conf/vldb/LockemannKKKN97,"The Network as a Global Database: Challenges of Interoperability, Proactivity, Interactiveness, Legacy","P Lockemann, U Kölsch, A Koschel, R Kramer, R Nikolai, M Wallrath, H Walter",VLDB,1997
71507,conf/vldb/PoosalaI97,Selectivity Estimation Without the Attribute Value Independence Assumption,"V Poosala, Y Ioannidis",VLDB,1997
71510,journals/sigmod/Chamberlin03,2003 SIGMOD Innovations Award Speech,D Chamberlin,SIGMOD Record,2003
71512,conf/vldb/DesslochM97,Integrating SQL Databases with Content-Specific Search Engines,"S Deßloch, N Mattos",VLDB,1997
71514,journals/sigmod/Halevy03,Learning about data integration challenges from day one,A Halevy,SIGMOD Record,2003
71515,conf/vldb/HuangJR97,Spatial Joins Using R-trees: Breadth-First Traversal with Global Optimizations,"Y Huang, N Jing, E Rundensteiner",VLDB,1997
71516,journals/sigmod/Giorgini03,Agent-Oriented software engineering report on the 4th AOSE workshop (AOSE 2003),,,2003
71517,conf/vldb/PellenkoftLK97,The Complexity of Transformation-Based Join Enumeration,"A Pellenkoft, C Galindo-Legaria, M Kersten",VLDB,1997
71518,journals/sigmod/LenzVJS03,Report on the 5th international workshop on the design and management of data warehouses (DMDW'03),,,2003
71519,conf/vldb/ChakrabartiDAR97,"Using Taxonomy, Discriminants, and Signatures for Navigating in Text Databases","S Chakrabarti, B Dom, R Agrawal, P Raghavan",VLDB,1997
71522,conf/vldb/CiacciaPZ97,M-tree: An Efficient Access Method for Similarity Search in Metric Spaces,"P Ciaccia, M Patella, P Zezula",VLDB,1997
71523,conf/vldb/HaasKWY97,Optimizing Queries Across Diverse Data Sources,"L Haas, D Kossmann, E Wimmers, J Yang",VLDB,1997
71524,journals/sigmod/Liu03b,Editor's Notes,L Liu,SIGMOD Record,2003
71526,journals/sigmod/Hainaut03,Research in database engineering at the University of Namur,J Hainaut,SIGMOD Record,2003
71528,conf/vldb/GarofalakisI97,Parallel Query Scheduling and Optimization with Time- and Space-Shared Resources,"M Garofalakis, Y Ioannidis",VLDB,1997
71530,conf/vldb/ClaussenKMP97,Optimizing Queries with Universal Quantification in Object-Oriented and Object-Relational Databases,"J Claußen, A Kemper, G Moerkotte, K Peithner",VLDB,1997
71531,conf/vldb/EicklerGK95,A Performance Evaluation of OID Mapping Techniques,"A Eickler, C Gerlhof, D Kossmann",VLDB,1995
71532,journals/sigmod/Liu03a,Editor's Notes,L Liu,SIGMOD Record,2003
71533,conf/vldb/AmsalegFG95,Efficient Incremental Garbage Collection for Client-Server Object Database Systems,"L Amsaleg, M Franklin, O Gruber",VLDB,1995
71535,journals/sigmod/ChrysanthisSZ03,Report on the 4th International Conference on Mobile Data Management,,,2003
71537,journals/sigmod/Jonsson03,In Memory of Gísli R. Hjaltason,,,2003
71539,conf/vldb/ChenRS95,Declustering Databases on Heterogeneous Disk Systems,"L Chen, D Rotem, S Seshadri",VLDB,1995
71540,journals/sigmod/MalaikaEM03,Standards for databases on the grid,"S Malaika, A Eisenberg, J Melton",SIGMOD Record,2003
71541,journals/sigmod/Anisimov03,"Review of The data warehouse toolkit: the complete guide to dimensional modeling (2nd edition) by Ralph Kimball, Margy Ross. John Wiley & Sons, Inc. 2002",,,2003
71542,conf/vldb/KornackerB95,High-Concurrency Locking in R-Trees,"M Kornacker, D Banks",VLDB,1995
71543,conf/vldb/YanG95,Duplicate Removal in Information System Dissemination,"T Yan, H Garcia-Molina",VLDB,1995
71544,journals/sigmod/Winslett03b,Interview with Rakesh Agrawal,,,2003
71545,journals/sigmod/CherniakV03,Reminiscences on Influential Papers,,,2003
71546,conf/vldb/GravanoG95,Generalizing GlOSS to Vector-Space Databases and Broker Hierarchies,"L Gravano, H Garcia-Molina",VLDB,1995
71547,journals/sigmod/Ouksel03,In-context peer-to-peer information filtering on the Web,A Ouksel,SIGMOD Record,2003
71549,journals/sigmod/KoubarakisTID03,Selective information dissemination in P2P networks: problems and solutions,"M Koubarakis, C Tryfonopoulos, S Idreos, Y Drougas",SIGMOD Record,2003
71550,conf/vldb/MiningGroup96,MineSet(tm): A System for High-End Data Mining and Visualization,,VLDB,1996
71551,conf/vldb/Celis96,The Query Optimizer in Tandem's new ServerWare SQL Product,P Celis,VLDB,1996
71552,journals/sigmod/ArenasKKKMM03,The hyperion project: from data integration to data coordination,"M Arenas, V Kantere, A Kementsietsidis, I Kiringa, R Miller, J Mylopoulos",SIGMOD Record,2003
71553,conf/vldb/Bhashyam96,"TPC-D: The Challenges, Issues and Results",R Bhashyam,VLDB,1996
71555,conf/vldb/Baru96,Performance of Future Database Systems: Bottlenecks and Bonananzas,C Baru,VLDB,1996
71557,conf/vldb/GuptaM96,What is the Data Warehousing Problem? (Are Materialized Views the Answer?),"A Gupta, I Mumick",VLDB,1996
71558,journals/sigmod/TatarinovIMHSDDKMM03,The Piazza peer data management project,"I Tatarinov, Z Ives, J Madhavan, A Halevy, D Suciu, N Dalvi, X Dong, Y Kadiyska, G Miklau, P Mork",SIGMOD Record,2003
71559,journals/sigmod/BawaCCDGGKMSSVY03,Peer-to-peer research at Stanford,"M Bawa, B Cooper, A Crespo, N Daswani, P Ganesan, H Garcia-Molina, S Kamvar, S Marti, M Schlosser, Q Sun, P Vinograd, B Yang",SIGMOD Record,2003
71560,conf/vldb/Sacks-Davis96,The Structured Information Manager: A Database System for SGML Documents,R Sacks-Davis,VLDB,1996
71563,journals/sigmod/WeikumSR03,"Report on the 10th Conference on Database Systems for Business, Technology, and the Web (BTW 2003)",,,2003
71564,conf/vldb/SavasereON95,An Efficient Algorithm for Mining Association Rules in Large Databases,"A Savasere, E Omiecinski, S Navathe",VLDB,1995
71565,conf/vldb/HanF95,Discovery of Multiple-Level Association Rules from Large Databases,"J Han, Y Fu",VLDB,1995
71566,journals/sigmod/RossNO03,Reminiscences on Influential Papers,,,2003
71567,journals/sigmod/ChongFTSYKDJJ03,A mapping mechanism to support bitmap index and other auxiliary structures on tables stored as primary B+-trees,"E Chong, J Srinivasan, S Das, C Freiwald, A Yalamanchi, M Jagannath, A Tran, R Krishnan, R Jiang",SIGMOD Record,2003
71568,conf/vldb/RahmM95,Dynamic Multi-Resource Load Balancing in Parallel Database Systems,"E Rahm, R Marek",VLDB,1995
71569,journals/sigmod/Winslett03a,Interview with Michael Stonebraker,,,2003
71572,conf/vldb/CabreraRH95,Applying Database Technology in the ADSM Mass Storage System,"L Cabrera, R Rees, W Hineman",VLDB,1995
71573,journals/sigmod/Nascimento03,Peer-to-peer: harnessing the power of disruptive technologies,M Nascimento,SIGMOD Record,2003
71574,conf/vldb/HellersteinNP95,Generalized Search Trees for Database Systems,"J Hellerstein, J Naughton, A Pfeffer",VLDB,1995
71575,journals/sigmod/Hoffner03,Fundamentals of data warehouses: 2nd revised and extended edition,V Hoffner,SIGMOD Record,2003
71576,conf/vldb/MillinerBP95,A Scalable Architecture for Autonomous Heterogeneous Database Interactions,"S Milliner, A Bouguettaya, M Papazoglou",VLDB,1995
71578,journals/sigmod/CaleroPR03,Towards a database body of knowledge: a study from Spain,"C Calero, M Piattini, F Ruiz",SIGMOD Record,2003
71579,journals/sigmod/FifeG03,Research issues for data communication in mobile ad-hoc network database systems,"L Fife, L Gruenwald",SIGMOD Record,2003
71580,conf/vldb/HasanM95,Coloring Away Communication in Parallel Query Optimization,"W Hasan, R Motwani",VLDB,1995
71581,conf/vldb/SteinbrunnPMK95,Bypassing Joins in Disjunctive Queries,"M Steinbrunn, K Peithner, G Moerkotte, A Kemper",VLDB,1995
71583,journals/sigmod/GottlobKP03a,XPath processing in a nutshell,,,2003
71584,conf/vldb/BargaP95,A Practical and Modular Implementation of Extended Transaction Models,"R Barga, C Pu",VLDB,1995
71585,conf/vldb/BunemanDHOW95,A Data Transformation System for Biological Data Sources,"P Buneman, S Davidson, K Hart, G Overton, L Wong",VLDB,1995
71586,journals/sigmod/GolabO03,Issues in data stream management,"L Golab, M Özsu",SIGMOD Record,2003
71590,conf/vldb/YanL95,Eager Aggregation and Lazy Aggregation,"W Yan, P Larson",VLDB,1995
71591,journals/sigmod/Aberer03b,Book review column,K Aberer,SIGMOD Record,2003
71592,conf/vldb/GardarinGT95,A Cost Model for Clustered Object-Oriented Databases,"G Gardarin, J Gruser, Z Tang",VLDB,1995
71593,conf/vldb/BelussiF95,Estimating the Selectivity of Spatial Queries Using the `Correlation' Fractal Dimension,"A Belussi, C Faloutsos",VLDB,1995
71594,journals/sigmod/MukhopadhyayGS03,An approach to confidence based page ranking for user oriented Web search,"D Mukhopadhyay, D Giri, S Singh",SIGMOD Record,2003
71595,journals/sigmod/Snodgrass03,ACM TODS in this Internet Age,R Snodgrass,SIGMOD Record,2003
71596,conf/vldb/IoannidisLGP96,ZOO : A Desktop Experiment Management Environment,"Y Ioannidis, M Livny, S Gupta, N Ponnekanti",VLDB,1996
71598,journals/sigmod/OConnellW03,Performing Jobs without Decompression in a Compressed Database System,"S O'Connell, N Winterbottom",SIGMOD Record,2003
71599,conf/vldb/FaloutsosMS96,Modeling Skewed Distribution Using Multifractals and the `80-20' Law,"C Faloutsos, Y Matias, A Silberschatz",VLDB,1996
71600,journals/sigmod/GottlobKP03,XPath Processing in a Nutshell,"G Gottlob, C Koch, R Pichler",SIGMOD Record,2003
71603,journals/sigmod/BertinoEH03,A Database Approach to Quality of Service Specification in Video Databases,"E Bertino, A Elmagarmid, M Hacid",SIGMOD Record,2003
71605,journals/sigmod/David03,ANSI SQL Hierarchical Processing Can Fully Integrate Native XML,M David,SIGMOD Record,2003
71606,conf/vldb/Levy96,Obtaining Complete Answers from Incomplete Databases,A Levy,VLDB,1996
71608,journals/sigmod/MarchiLPT03,Analysis of existing databases at the logical level: the DBA companion project,"F Marchi, S Lopes, J Petit, F Toumani",SIGMOD Record,2003
71609,journals/sigmod/ChakravarthyAEFO03,Database Research at UT Arlington,"S Chakravarthy, Y Aslandogan, R Elmasri, L Fegaras, J Oh",SIGMOD Record,2003
71613,conf/vldb/PottingerB03,Merging Models Based on Given Correspondences,"R Pottinger, P Bernstein",VLDB,2003
71614,conf/vldb/WangC03,Avoiding Ordering and Grouping In Query Processing,"X Wang, M Cherniack",VLDB,2003
71615,conf/vldb/HulgeriS03,AniPQO: Almost Non-intrusive Parametric Query Optimization for Nonlinear Cost Functions,"A Hulgeri, S Sudarshan",VLDB,2003
71617,conf/vldb/PapadiasTS03,The TPR*-Tree: An Optimized Spatio-Temporal Access Method for Predictive Queries,"Y Tao, D Papadias, J Sun",VLDB,2003
71618,conf/vldb/KoudasGGSV03,Efficient Approximation Of Optimization Queries Under Parametric Aggregation Constraints,"S Guha, D Gunopulos, N Koudas, D Srivastava, M Vlachos",VLDB,2003
71619,conf/vldb/AltinelBKMPR03,Cache Tables: Paving the Way for an Adaptive Database Cache,"M Altinel, C Bornhövd, S Krishnamurthy, C Mohan, H Pirahesh, B Reinwald",VLDB,2003
71620,conf/vldb/SchindlerAG03,Lachesis: Robust Database Storage Management Based on Device-specific Performance Characteristics,"J Schindler, A Ailamaki, G Ganger",VLDB,2003
71621,conf/vldb/VieiraM03,A Dependability Benchmark for OLTP Application Environments,"M Vieira, H Madeira",VLDB,2003
71622,conf/vldb/ChaudhuriGN03,Primitives for Workload Summarization and Implications for SQL,"S Chaudhuri, P Ganesan, V Narasayya",VLDB,2003
71623,conf/vldb/HaasB03,BHUNT: Automatic Discovery of Fuzzy Algebraic Constraints in Relational Data,"P Brown, P Haas",VLDB,2003
71624,conf/vldb/HelmerNM03,Estimating the Output Cardinality of Partial Preaggregation with a Measure of Clusteredness,"S Helmer, T Neumann, G Moerkotte",VLDB,2003
71625,conf/vldb/AnciauxBP03,Memory Requirements for Query Execution in Highly Constrained Devices,"N Anciaux, L Bouganim, P Pucheral",VLDB,2003
71626,conf/vldb/YuAA03,Tabular Placement of Relational Data on MEMS-based Storage Devices,"H Yu, D Agrawal, A Abbadi",VLDB,2003
71627,conf/vldb/LiuLBHTS03,Capturing Global Transactions from Multiple Recovery Log Files in a Partitioned Database System,"C Liu, B Lindsay, S Bourbonnais, E Hamel, T Truong, J Stankiewitz",VLDB,2003
71628,conf/vldb/FlorescuHKLRWCSA03,The BEA/XQRL Streaming XQuery Processor,"D Florescu, C Hillery, D Kossmann, P Lucas, F Riccardi, T Westmann, M Carey, A Sundararajan, G Agrawal",VLDB,2003
71630,conf/vldb/HageJPST03,Integrated Data Management for Mobile Services in the Real World,"C Hage, C Jensen, T Pedersen, L Speicys, I Timko",VLDB,2003
71631,conf/vldb/AnKR03,Improving Performance with Bulk-Inserts in Oracle R-Trees,"N An, K Kanth, S Ravada",VLDB,2003
71632,conf/vldb/Galindo-LegariaJWW03,Statistics on Views,"C Galindo-Legaria, M Joshi, F Waas, M Wu",VLDB,2003
71633,conf/vldb/BhattacharjeePMLCH03,Efficient Query Processing for Multi-Dimensionally Clustered Tables in DB2,"B Bhattacharjee, S Padmanabhan, T Malkemus, T Lai, L Cranston, M Huras",VLDB,2003
71637,conf/vldb/BawaBA03,Privacy-Preserving Indexing of Documents on the Network,"M Bawa, R Jr., R Agrawal",VLDB,2003
71639,conf/vldb/CarneyCZRCS03,Operator Scheduling in a Data Stream Manager,"D Carney, U Çetintemel, A Rasin, S Zdonik, M Cherniack, M Stonebraker",VLDB,2003
71640,conf/vldb/HristidisGP03,Efficient IR-Style Keyword Search over Relational Databases,"V Hristidis, L Gravano, Y Papakonstantinou",VLDB,2003
71641,conf/vldb/GalanisWJD03,Locating Data Sources in Large Distributed Systems,"L Galanis, Y Wang, S Jeffery, D DeWitt",VLDB,2003
71642,conf/vldb/Jermaine03,Robust Estimation With Sampling and Approximate Pre-Aggregation,C Jermaine,VLDB,2003
71643,conf/vldb/TorloneA03,Chameleon: an Extensible and Customizable Tool for Web Data Translation,"R Torlone, P Atzeni",VLDB,2003
71644,conf/vldb/WeberSNSS03,WebService Composition with O'GRAPE and OSIRIS,"R Weber, C Schuler, P Neukomm, H Schuldt, H Schek",VLDB,2003
71645,conf/vldb/FernandezSCMS03,Implementing Xquery 1.0: The Galax Experience,"M Fernandez, J Siméon, B Choi, A Marian, G Sur",VLDB,2003
71646,conf/vldb/HardingLM03,XISS/R: XML Indexing and Storage System using RDBMS,"P Harding, Q Li, B Moon",VLDB,2003
71648,conf/vldb/ArionBCDMP03,Xquec: Pushing Queries to Compressed XML Data,"A Arion, A Bonifati, G Costa, S D'Aguanno, I Manolescu, A Pugliese",VLDB,2003
71649,conf/vldb/AbiteboulBBCCDMMP03,Managing Distributed Workspaces with Active XML,"S Abiteboul, J Baumgarten, A Bonifati, G Cobena, C Cremarenco, F Dragan, I Manolescu, T Milo, N Preda",VLDB,2003
71651,conf/vldb/BergerBSW03,Xcerpt and visXcerpt: From Pattern-Based to Visual Querying of XML and Semistructured Data,"S Berger, F Bry, S Schaffert, C Wieser",VLDB,2003
71652,conf/vldb/Brodie03,Illuminating the Dark Side of Web Services,M Brodie,VLDB,2003
71653,conf/vldb/Cluet03,Who needs XML Databases?,S Cluet,VLDB,2003
71654,conf/vldb/KerstenWFKBC03,A Database Striptease or How to Manage Your Personal Databases,"M Kersten, G Weikum, M Franklin, D Keim, A Buchmann, S Chaudhuri",VLDB,2003
71655,conf/vldb/Kuhn03,The Zero-Delay Data Warehouse: Mobilizing Heterogeneous Databases,e Kühn,VLDB,2003
71656,conf/vldb/Schoning03,Commercial Use of Database Technology,H Schöning,VLDB,2003
71657,conf/vldb/Leymann03,Grid and Applications (Industrial Session),F Leymann,VLDB,2003
71661,conf/vldb/NathDKGKS03,IrisNet: An Architecture for Internet-scale Sensing Services,"S Nath, A Deshpande, Y Ke, P Gibbons, B Karp, S Seshan",VLDB,2003
71662,conf/vldb/Baumann03,"Large-Scale, Standards-Based Earth Observation Imagery and Web Mapping Services",P Baumann,VLDB,2003
71663,conf/vldb/SattlerGS03,QUIET: Continuous Query-driven Index Tuning,"K Sattler, I Geist, E Schallehn",VLDB,2003
71664,conf/vldb/BouganimNPW03,Chip-Secured Data Access: Reconciling Access Rights with Data Encryption,"L Bouganim, F Ngoc, P Pucheral, L Wu",VLDB,2003
71665,conf/vldb/WangSG03,An Interpolated Volume Data Model,"T Wang, S Santini, A Gupta",VLDB,2003
71666,conf/vldb/LakshmananPZ03,Efficacious Data Cube Exploration by Semantic Summarization and Compression,"L Lakshmanan, J Pei, Y Zhao",VLDB,2003
71667,conf/vldb/WangZL03,ATLAS: A Small but Complete SQL Extension for Data Mining and Data Streams,"H Wang, C Zaniolo, C Luo",VLDB,2003
71668,conf/vldb/WitkowskiBBFGSS03,Business Modelling Using SQL Spreadsheets,"A Witkowski, S Bellamkonda, T Bozkaya, N Folkert, A Gupta, L Sheng, S Subramanian",VLDB,2003
71669,conf/vldb/SizovGT03,From Focused Crawling to Expert Information: an Application Framework for Web Exploration and Portal Generation,"S Sizov, J Graupmann, M Theobald",VLDB,2003
71670,conf/vldb/LiPHCAAT03,CachePortal II: Acceleration of Very Large Scale Data Center-Hosted Database-driven Web Applications,"W Li, O Po, W Hsiung, K Candan, D Agrawal, Y Akca, K Taniguchi",VLDB,2003
71671,conf/vldb/NieKH03,BibFinder/StatMiner: Effectively Mining and Using Coverage and Overlap Statistics in Data Integration,"Z Nie, S Kambhampati, T Hernandez",VLDB,2003
71676,conf/vldb/EleftheriouBCDHLPPABDDDGJHLRSVW03,A Nanotechnology-based Approach to Data Storage,"E Eleftheriou, P Bächtold, G Cherubini, A Dholakia, C Hagleitner, T Loeliger, A Pantazi, H Pozidis, T Albrecht, G Binnig, M Despont, U Drechsler, U Dürig, B Gotsmann, D Jubin, W Häberle, M Lantz, H Rothuizen, R Stutz, P Vettiger, D Wiesmann",VLDB,2003
71677,conf/vldb/Ioannidis03,The History of Histograms (abridged),Y Ioannidis,VLDB,2003
71678,conf/vldb/Shenker03,The Data-Centric Revolution in Networking,S Shenker,VLDB,2003
71679,conf/vldb/CohenMKS03,XSEarch: A Semantic Search Engine for XML,"S Cohen, J Mamou, Y Kanza, Y Sagiv",VLDB,2003
71680,conf/vldb/RaghavanG03,Complex Queries over Web Repositories,"S Raghavan, H Garcia-Molina",VLDB,2003
71681,conf/vldb/YangLH03,Efficient Mining of XML Query Patterns for Caching,"L Yang, M Lee, W Hsu",VLDB,2003
71682,conf/vldb/ShahDR03,An Efficient and Resilient Approach to Filtering and Disseminating Streaming Data,"S Shah, S Dharmarajan, K Ramamritham",VLDB,2003
71683,conf/vldb/Amer-YahiaFSX03,Phrase Matching in XML,"S Amer-Yahia, M Fernandez, D Srivastava, Y Xu",VLDB,2003
71684,conf/vldb/ChenDZ03,RRXF: Redundancy reducing XML storage in relations,"Y Chen, S Davidson, C Hara, Y Zheng",VLDB,2003
71686,conf/vldb/MarianS03,Projecting XML Documents,"A Marian, J Siméon",VLDB,2003
71688,conf/vldb/ChenJLP03,From Tree Patterns to Generalized Tree Patterns: On Efficient Evaluation of XQuery,"Z Chen, H Jagadish, L Lakshmanan, S Paparizos",VLDB,2003
71689,conf/vldb/Koch03,Efficient Processing of Expressive Node-Selecting Queries on XML Data in Secondary Storage: A Tree Automata-based Approach,C Koch,VLDB,2003
71690,conf/vldb/DiaoF03,Query Processing for High-Volume XML Message Brokering,"Y Diao, M Franklin",VLDB,2003
71691,conf/vldb/AggarwalHWY03,A Framework for Clustering Evolving Data Streams,"C Aggarwal, J Han, J Wang, P Yu",VLDB,2003
71692,conf/vldb/TengCY03,A Regression-Based Temporal Pattern Mining Scheme for Data Streams,"W Teng, M Chen, P Yu",VLDB,2003
71693,conf/vldb/KumaranH03,On the Costs of Multilingualism in Database Systems,"A Kumaran, J Haritsa",VLDB,2003
71694,conf/vldb/YuPM03,Distributed Top-N Query Processing with Possibly Uncooperative Local Systems,"C Yu, G Philip, W Meng",VLDB,2003
71695,conf/vldb/LongS03,Optimized Query Execution in Large Search Engines with Global Page Ordering,"X Long, T Suel",VLDB,2003
71696,conf/vldb/KochBG03,Path Queries on Compressed XML,"P Buneman, M Grohe, C Koch",VLDB,2003
71697,conf/vldb/FlescaFM03,On the minimization of Xpath queries,"S Flesca, F Furfaro, E Masciari",VLDB,2003
71698,conf/vldb/Ramanan03,Covering Indexes for XML Queries: Bisimulation - Simulation = Negation,P Ramanan,VLDB,2003
71699,conf/vldb/ZhouR03,Buffering Accesses to Memory-Resident Index Structures,"J Zhou, K Ross",VLDB,2003
71702,conf/vldb/LimWV03,SASH: A Self-Adaptive Histogram Set for Dynamically Changing Workloads,"L Lim, M Wang, J Vitter",VLDB,2003
71703,conf/vldb/ZhouS03,Data Bubbles for Non-Vector Data: Speeding-up Hierarchical Clustering in Arbitrary Metric Spaces,"J Zhou, J Sander",VLDB,2003
71704,conf/vldb/ShiSZ03,A Shrinking-Based Approach for Multi-Dimensional Data Analysis,"Y Shi, Y Song, A Zhang",VLDB,2003
71705,conf/vldb/HinneburgLH03,COMBI-Operator: Database Support for Data Mining Applications,"A Hinneburg, W Lehner, D Habich",VLDB,2003
71706,conf/vldb/HankinsP03,"Data Morphing: An Adaptive, Cache-Conscious Storage Technique","R Hankins, J Patel",VLDB,2003
71707,conf/vldb/TatbulCZCS03,Load Shedding in a Data Stream Manager,"N Tatbul, U Çetintemel, S Zdonik, M Cherniack, M Stonebraker",VLDB,2003
71708,conf/vldb/HammadFAE03,Scheduling for shared window joins over data streams,"M Hammad, M Franklin, W Aref, A Elmagarmid",VLDB,2003
71709,conf/vldb/ViglasNB03,Maximizing the Output Rate of Multi-Way Join Queries over Streaming Information Sources,"S Viglas, J Naughton, J Burger",VLDB,2003
71710,conf/vldb/JiangWL03,Holistic Twig Joins on Indexed XML Documents,"H Jiang, W Wang, H Lu, J Yu",VLDB,2003
71711,conf/vldb/HeMYW03,WISE-Integrator: An Automatic Integrator of Web Search Interfaces for E-Commerce,"H He, W Meng, C Yu, Z Wu",VLDB,2003
71712,conf/vldb/LernerS03,"AQuery: Query Language for Ordered Data, Optimization Techniques, and Experiments","A Lerner, D Shasha",VLDB,2003
71713,conf/vldb/TianD03,Tuple Routing Strategies for Distributed Eddies,"F Tian, D DeWitt",VLDB,2003
71714,conf/vldb/HuebschHLLSS03,Querying the Internet with PIER,"R Huebsch, J Hellerstein, N Lanham, B Loo, S Shenker, I Stoica",VLDB,2003
71715,conf/vldb/VelegrakisMP03,Mapping Adaptation under Evolving Schemas,"Y Velegrakis, R Miller, L Popa",VLDB,2003
71716,conf/vldb/LuoNEW03,Locking Protocols for Materialized Aggregate Join Views,"G Luo, J Naughton, C Ellmann, M Watzke",VLDB,2003
71718,conf/vldb/MadhavanH03,Composing Mappings Among Data Sources,"J Madhavan, A Halevy",VLDB,2003
71719,conf/vldb/GaoS03,Temporal Slicing in the Evaluation of XML Queries,"D Gao, R Snodgrass",VLDB,2003
71721,conf/vldb/LeeHJT03,Supporting Frequent Updates in R-Trees: A Bottom-Up Approach,"M Lee, W Hsu, C Jensen, B Cui, K Teo",VLDB,2003
71723,conf/vldb/KraftSRM03,Coarse-Grained Optimization: Techniques for Rewriting SQL Statement Sequences,"T Kraft, H Schwarz, R Rantzau, B Mitschang",VLDB,2003
71725,conf/vldb/CormodeKMS03,Finding Hierarchical Heavy Hitters in Data Streams,"G Cormode, F Korn, S Muthukrishnan, D Srivastava",VLDB,2003
71726,conf/vldb/XinHLW03,Star-Cubing: Computing Iceberg Cubes by Top-Down and Bottom-Up Integration,"D Xin, J Han, X Li, B Wah",VLDB,2003
71727,conf/vldb/KornMZ03,Checks and Balances: Monitoring Data Quality Problems in Network Traffic Databases,"F Korn, S Muthukrishnan, Y Zhu",VLDB,2003
71729,conf/vldb/IwerksSS03,Continuous K-Nearest Neighbor Queries for Continuously Moving Points with Updates,"G Iwerks, H Samet, K Smith",VLDB,2003
71730,conf/vldb/GrustKT03,Staircase Join: Teach a Relational DBMS to Watch its (Axis) Steps,"T Grust, M Keulen, J Teubner",VLDB,2003
71731,conf/vldb/BlottK02,An Almost-Serial Protocol for Transaction Execution in Main-Memory Database Systems,"S Blott, H Korth",VLDB,2002
71732,conf/vldb/DaynesC02,Lightweight Flexible Isolation for Language-based Extensible Systems,"L Daynčs, G Czajkowski",VLDB,2002
71733,conf/vldb/KarayannidisTSPMRFEB02,Processing Star Queries on Hierarchically-Clustered Fact Tables,"N Karayannidis, A Tsois, T Sellis, R Pieringer, V Markl, F Ramsak, R Fenk, K Elhardt, R Bayer",VLDB,2002
71735,conf/vldb/NiermanJ02,ProTDB: Probabilistic Data in XML,"A Nierman, H Jagadish",VLDB,2002
71736,conf/vldb/HristidisP02,DISCOVER: Keyword Search in Relational Databases,"V Hristidis, Y Papakonstantinou",VLDB,2002
71737,conf/vldb/RizviH02,Maintaining Data Privacy in Association Rule Mining,"S Rizvi, J Haritsa",VLDB,2002
71739,conf/vldb/PalpanasSCP02,Incremental Maintenance for Non-Distributive Aggregate Functions,"T Palpanas, R Sidle, R Cochrane, H Pirahesh",VLDB,2002
71740,conf/vldb/KornMS02,Reverse Nearest Neighbor Aggregates Over Data Streams,"F Korn, S Muthukrishnan, D Srivastava",VLDB,2002
71742,conf/vldb/BenediktCFRZZ02,DTD-Directed Publishing with Attribute Translation Grammars,"M Benedikt, C Chan, W Fan, R Rastogi, S Zheng, A Zhou",VLDB,2002
71743,conf/vldb/RohmBSS02,FAS - A Freshness-Sensitive Coordination Middleware for a Cluster of OLAP Components,"U Röhm, K Böhm, H Schek, H Schuldt",VLDB,2002
71744,conf/vldb/LakshmananNWZJ02,The Generalized MDL Approach for Summarization,"L Lakshmanan, R Ng, C Wang, X Zhou, T Johnson",VLDB,2002
71745,conf/vldb/LakshmananPH02,Quotient Cube: How to Summarize the Semantics of a Data Cube,"L Lakshmanan, J Pei, J Han",VLDB,2002
71746,conf/vldb/LeeWMS02,A One-Pass Aggregation Algorithm with the Optimal Buffer Size in Multidimensional OLAP,"Y Lee, K Whang, Y Moon, I Song",VLDB,2002
71747,conf/vldb/ZellerK02,Experience Report: Exploiting Advanced Database Optimization Features for Large-Scale SAP R/3 Installations,"B Zeller, A Kemper",VLDB,2002
71748,conf/vldb/Vingralek02,"GnatDb: A Small-Footprint, Secure Database System",R Vingralek,VLDB,2002
